[],False,downadarkallie,,[],,text,t2_1ko12hnn,False,False,[],False,False,1610751070,i.redd.it,https://www.reddit.com/r/Portland/comments/ky5zvq/i_love_that_this_is_home/,{},ky5zvq,True,False,False,True,True,False,False,,photo,[],Photo,dark,text,False,False,False,65,0,False,all_ads,/r/Portland/comments/ky5zvq/i_love_that_this_is_home/,False,image,"{'enabled': True, 'images': [{'id': '55SelUBUsfaQ_mfcGPhDwhW7P6RcL1t9roeuJSPv5K0', 'resolutions': [{'height': 81, 'url': 'https://preview.redd.it/fnjdihaeskb61.jpg?width=108&amp;crop=smart&amp;auto=webp&amp;s=791797d66580f94111020ef1b4f4f992660cdaf2', 'width': 108}, {'height': 162, 'url': 'https://preview.redd.it/fnjdihaeskb61.jpg?width=216&amp;crop=smart&amp;auto=webp&amp;s=a3921f00f6b97d6f0db2b0bc10d573ab39484cf3', 'width': 216}, {'height': 240, 'url': 'https://preview.redd.it/fnjdihaeskb61.jpg?width=320&amp;crop=smart&amp;auto=webp&amp;s=6677ef223c8b2b38a4ccc26b58622da1137ffcb8', 'width': 320}, {'height': 480, 'url': 'https://preview.redd.it/fnjdihaeskb61.jpg?width=640&amp;crop=smart&amp;auto=webp&amp;s=5f198a2a37e0cd635b40a375475c5913a4346c4c', 'width': 640}, {'height': 720, 'url': 'https://preview.redd.it/fnjdihaeskb61.jpg?width=960&amp;crop=smart&amp;auto=webp&amp;s=75d90261f19eba06ad3326f44f1338179d49f754', 'width': 960}, {'height': 810, 'url': 'https://preview.redd.it/fnjdihaeskb61.jpg?width=1080&amp;crop=smart&amp;auto=webp&amp;s=eb1a822f7d2a8ea8bbdf7f33ac2e3e671fe6dc95', 'width': 1080}], 'source': {'height': 3024, 'url': 'https://preview.redd.it/fnjdihaeskb61.jpg?auto=webp&amp;s=c58292398b740405b621e34dbeaeb980d17d8ec6', 'width': 4032}, 'variants': {}}]}",6,1610751837,3,,True,False,False,Portland,t5_2qi2i,188490,public,confidence,https://b.thumbs.redditmedia.com/SAD8tvLtV7czzpxCaxRY2BAyorng5lskR6inydoT28Y.jpg,105.0,140.0,I love that this is home.,0,[],0.71,https://i.redd.it/fnjdihaeskb61.jpg,https://i.redd.it/fnjdihaeskb61.jpg,all_ads,6,,,,,,,,,,,,,,
[],False,OregonSchmuck,,[],,text,t2_1h0ncuzi,False,False,[],False,False,1610750563,self.Portland,https://www.reddit.com/r/Portland/comments/ky5u0y/comcast_activity/,{},ky5u0y,True,False,False,False,True,True,False,,,[],,dark,text,False,False,True,12,0,False,all_ads,/r/Portland/comments/ky5u0y/comcast_activity/,False,,,6,1610751314,0,"Does anyone know what’s up with Comcast’s activity? They just shut off my internet for 10 minutes then turned it back on, but it looks like they installed something on the line to my house.",True,False,False,Portland,t5_2qi2i,188489,public,confidence,self,,,Comcast Activity,0,[],0.5,https://www.reddit.com/r/Portland/comments/ky5u0y/comcast_activity/,,all_ads,6,,,,,,,,,,,,,,
[],False,lirrianna,,[],,text,t2_b5qla,False,False,[],False,False,1610749955,self.Portland,https://www.reddit.com/r/Portland/comments/ky5mxq/hostage_situation_downtown/,{},ky5mxq,True,False,False,False,True,True,False,,,[],,dark,text,False,False,False,107,0,False,all_ads,/r/Portland/comments/ky5mxq/hostage_situation_downtown/,False,,,6,1610750734,5,"A coworker downtown at our office building by the Scientology building says that he can't get out of the building because there's tape everywhere and a ton of cops. 

Anyone have any info?",True,False,False,Portland,t5_2qi2i,188486,public,confidence,self,,,Hostage Situation Downtown?,0,[],0.86,https://www.reddit.com/r/Portland/comments/ky5mxq/hostage_situation_downtown/,,all_ads,6,,,,,,,,,,,,,,
[],False,ranoutofbacon,,[],Grant Park,text,t2_eo4hs,False,False,[],False,False,1610749656,self.Portland,https://www.reddit.com/r/Portland/comments/ky5jem/anyone_got_the_lowdown_on_whats_happening_with/,{},ky5jem,True,False,False,False,True,True,False,,,[],,dark,text,False,False,False,4,0,False,all_ads,/r/Portland/comments/ky5jem/anyone_got_the_lowdown_on_whats_happening_with/,False,,,6,1610750449,2,"I was headed down 4th and there were at least 10 cop cars blocking the street and several more around the corner.

Edit: It appears a mental health crisis results in PPB doing the opposite of what is needed.",False,False,False,Portland,t5_2qi2i,188484,public,confidence,self,,,Anyone got the lowdown on what's happening with all the cops blocking several blocks in SW 4th between Harvey Milk and Oak?,0,[],0.67,https://www.reddit.com/r/Portland/comments/ky5jem/anyone_got_the_lowdown_on_whats_happening_with/,,all_ads,6,,dark,,,,,,,,,,,1610749929.0,
[],False,P1neTr33,,[],,text,t2_17btph,False,False,[],False,False,1610749152,self.Portland,https://www.reddit.com/r/Portland/comments/ky5di0/with_a_significant_of_younger_millennials_moving/,{},ky5di0,True,False,False,False,True,True,False,,,[],,dark,text,False,False,False,70,0,False,all_ads,/r/Portland/comments/ky5di0/with_a_significant_of_younger_millennials_moving/,False,self,"{'enabled': False, 'images': [{'id': '1BF9oKlVbYa-_y-b5tIB7F0An9XPe3lf7BpoibZvlSo', 'resolutions': [{'height': 60, 'url': 'https://external-preview.redd.it/kzSrIW3RQE2XCrRvsB0tIf_PGepiaF3oc_YHkF8udxU.jpg?width=108&amp;crop=smart&amp;auto=webp&amp;s=4c2fa1248535a2439c491bdecab3ece804b2ed66', 'width': 108}, {'height': 121, 'url': 'https://external-preview.redd.it/kzSrIW3RQE2XCrRvsB0tIf_PGepiaF3oc_YHkF8udxU.jpg?width=216&amp;crop=smart&amp;auto=webp&amp;s=a673c75266e3f209ae12bb475137a7ba87eb408f', 'width': 216}, {'height': 180, 'url': 'https://external-preview.redd.it/kzSrIW3RQE2XCrRvsB0tIf_PGepiaF3oc_YHkF8udxU.jpg?width=320&amp;crop=smart&amp;auto=webp&amp;s=6f98b918a20746fd80c3ed11cdb21f83ac4273be', 'width': 320}, {'height': 360, 'url': 'https://external-preview.redd.it/kzSrIW3RQE2XCrRvsB0tIf_PGepiaF3oc_YHkF8udxU.jpg?width=640&amp;crop=smart&amp;auto=webp&amp;s=f00ae0fbaab0f9551b57edfd67eb26edf288fc1a', 'width': 640}, {'height': 540, 'url': 'https://external-preview.redd.it/kzSrIW3RQE2XCrRvsB0tIf_PGepiaF3oc_YHkF8udxU.jpg?width=960&amp;crop=smart&amp;auto=webp&amp;s=7c6e61599daa0db3aeb0c638b93e814cc7712eda', 'width': 960}], 'source': {'height': 576, 'url': 'https://external-preview.redd.it/kzSrIW3RQE2XCrRvsB0tIf_PGepiaF3oc_YHkF8udxU.jpg?auto=webp&amp;s=03181afe47d371aeb6b9020d0f7995946774bd62', 'width': 1024}, 'variants': {}}]}",6,1610749932,2,"I've seen a few news sources reporting that a large % of younger people (39%) are saying they've either moved back home or are planning to. Here are some links, one from [PBS](https://www.pbs.org/newshour/show/why-the-pandemic-is-forcing-millennials-to-move-back-home-with-their-parents) and one from [CNBC](https://www.cnbc.com/2020/08/05/39-percent-of-younger-millennials-say-covid-19-has-them-moving-back-home.html).

My building has more vacancies than it did when I signed my lease early last year, and the prices they are offering new residents are *lower* than what I signed up for. A report on ApartmentList also shows that average rents in Portland are down ~5% year over year.

So this has me wondering if Portland is becoming more of a renters market now? ...at least more than it has been over the last few years? Are people using this to their advantage as they look for apartments, resign their leases, etc?",True,False,False,Portland,t5_2qi2i,188484,public,confidence,self,,,With a significant # of younger millennials moving back home with their parents -- is Portland becoming more of a renters market? ...I know my building has more vacancies now than it did a year ago.,0,[],0.75,https://www.reddit.com/r/Portland/comments/ky5di0/with_a_significant_of_younger_millennials_moving/,,all_ads,6,,,,,,,,,,,,,,
[],False,beastofwordin,,[],🍦,text,t2_10kq5t,False,False,[],False,False,1610746973,self.Portland,https://www.reddit.com/r/Portland/comments/ky4mre/renaming_wilson_high_ida_b_wellsbarnett/,{},ky4mre,True,False,False,False,True,True,False,,,[],,dark,text,False,False,True,61,0,False,all_ads,/r/Portland/comments/ky4mre/renaming_wilson_high_ida_b_wellsbarnett/,False,,,6,1610747648,1,"
A message from Portland Public Schools
 
English | Español | Soomaali

Dear Wilson Community,

We, the Wilson High School Renaming Committee, are writing to share some exciting news. Over the last few months, our Committee engaged in numerous community outreach efforts, we gathered nearly 2,000 community comments, and we spent many hours in careful consideration of the most appropriate new name for our school. Earlier this week, we sent a formal request to Superintendent Guerrero that our school be renamed “Ida B. Wells-Barnett High School.”

Ida B. Wells-Barnett (1862-1931), a singular American journalist, activist, educator, and researcher, was born into enslavement during the Civil War in the state of Mississippi. As an investigative journalist, she used the power of truth to shed light on the unjust and violent conditions under which African-Americans lived throughout the South. She was a firm believer that an education was important, and that spreading and sharing knowledge was the key to a more tolerant and just society. Long recognized for her leadership in anti-lynching activism, Wells-Barnett marched on Washington in the name of women’s suffrage on the day of Woodrow Wilson’s inauguration, and she later wrote and spoke to President Wilson in protest of segregation and of his discriminatory hiring practices. Wells-Barnett helped found the National Association of Colored Women, the National Association for the Advancement of Colored People, and the first Black women's suffrage association, the Alpha Suffrage Club. Remembered as one of the most lauded civil rights advocates of the 19th and 20th centuries, Wells-Barnett is an American hero. Ida B. Wells-Barnett will foster a lasting message of determination, valor, and tolerance among all students and staff.

Today we received Superintendent Guerrero’s approval to present our recommendation to the PPS School Board on January 26th. We are looking forward to sharing information on how our renaming process aligned with district guidelines, how we solicited and processed community input, and why we ultimately decided that Ida B. Wells-Barnett is the most appropriate person to name our school after.

We want to thank all of you who participated in and helped guide this historic process. Please that see some of the community comments we received in appreciation of our new eponym, Ida B. Wells-Barnett.

Sincerely,

The Undersigned Wilson High School Renaming Committee:
Ayesha Coning, Vice Principal
Filip Hristić, Principal
Hui Hui Hutchinson, Junior 
Liliana McClain, Junior
Noreena McCleave, Alumni
Jonel Mondero, Junior
Aslan Newson, Junior 
Martin Osborne, Community Representative
Nura Salah, Junior
Senya Scott, Junior
Mia Sedory, Senior 
Katisyn Sweeney, Junior
Deborah Walsh, Parent Representative
Ellen Whatmore, Teacher Representative
Zachariah Winterspring, Teacher Representative",True,False,False,Portland,t5_2qi2i,188480,public,confidence,self,,,Renaming Wilson High: Ida B. Wells-Barnett,0,[],0.6,https://www.reddit.com/r/Portland/comments/ky4mre/renaming_wilson_high_ida_b_wellsbarnett/,,all_ads,6,3e9a307e-be3d-11e9-b757-0e479afbd176,dark,,,,,,,,,,,,
[],False,CheefJeef,,[],,text,t2_eqorz,False,False,[],False,False,1610746210,self.Portland,https://www.reddit.com/r/Portland/comments/ky4d93/2nd_catalytic_converter_theft_in_2_months/,{},ky4d93,True,False,False,False,True,True,False,,,[],,dark,text,False,False,True,25,0,False,all_ads,/r/Portland/comments/ky4d93/2nd_catalytic_converter_theft_in_2_months/,False,,,6,1610746847,1,Just woke up to take my dogs to the sellwood docks just to find out my catalytic converter is gone again. Anyone know of any exhaust shops that can install a protective cage around the cat for a Honda Element? Thanks,True,False,False,Portland,t5_2qi2i,188479,public,confidence,self,,,2nd catalytic converter theft in 2 months.,0,[],1.0,https://www.reddit.com/r/Portland/comments/ky4d93/2nd_catalytic_converter_theft_in_2_months/,,all_ads,6,,,,,,,,,,,,,,
[],False,My_Lucid_Dreams,,[],NE,text,t2_22alownk,False,False,[],False,False,1610745988,opb.org,https://www.reddit.com/r/Portland/comments/ky4ajt/oregon_governor_there_is_no_federal_reserve_of/,{},ky4ajt,True,False,False,False,True,False,False,,local-news,[],Local News,dark,text,False,False,False,14,0,False,all_ads,/r/Portland/comments/ky4ajt/oregon_governor_there_is_no_federal_reserve_of/,False,link,"{'enabled': False, 'images': [{'id': 'JLbC-3_B5vuVzEQztlf4MwxU0r-YvVr4TsSS8iMZRKc', 'resolutions': [{'height': 60, 'url': 'https://external-preview.redd.it/f0JRd6FqNJ5oNosF_cy1sjQb1K_6swXBu9gzM-_F_TU.jpg?width=108&amp;crop=smart&amp;auto=webp&amp;s=aeb7c1faac9dbdc35ce15675d842df3bf35c31a5', 'width': 108}, {'height': 121, 'url': 'https://external-preview.redd.it/f0JRd6FqNJ5oNosF_cy1sjQb1K_6swXBu9gzM-_F_TU.jpg?width=216&amp;crop=smart&amp;auto=webp&amp;s=f3749f09c2f52637fa68243cca68abe4fbae0266', 'width': 216}, {'height': 180, 'url': 'https://external-preview.redd.it/f0JRd6FqNJ5oNosF_cy1sjQb1K_6swXBu9gzM-_F_TU.jpg?width=320&amp;crop=smart&amp;auto=webp&amp;s=d16549996b7385d91e31fda245a9cb88e1d258cd', 'width': 320}, {'height': 360, 'url': 'https://external-preview.redd.it/f0JRd6FqNJ5oNosF_cy1sjQb1K_6swXBu9gzM-_F_TU.jpg?width=640&amp;crop=smart&amp;auto=webp&amp;s=2ac4c2df39eb6d534a4c51aa1980ad9d4a701c31', 'width': 640}, {'height': 540, 'url': 'https://external-preview.redd.it/f0JRd6FqNJ5oNosF_cy1sjQb1K_6swXBu9gzM-_F_TU.jpg?width=960&amp;crop=smart&amp;auto=webp&amp;s=129da6e8a9ceff284bd562ab68d9ffeab603e724', 'width': 960}, {'height': 607, 'url': 'https://external-preview.redd.it/f0JRd6FqNJ5oNosF_cy1sjQb1K_6swXBu9gzM-_F_TU.jpg?width=1080&amp;crop=smart&amp;auto=webp&amp;s=6aa9e3dcbb0c0e6cfcb33c884386905c46ea0535', 'width': 1080}], 'source': {'height': 675, 'url': 'https://external-preview.redd.it/f0JRd6FqNJ5oNosF_cy1sjQb1K_6swXBu9gzM-_F_TU.jpg?auto=webp&amp;s=ee810127b470dfe4c3bfa9d3343b45c2174acf73', 'width': 1200}, 'variants': {}}]}",6,1610746622,3,,False,False,False,Portland,t5_2qi2i,188479,public,confidence,https://b.thumbs.redditmedia.com/9GRhvMTDcBEOhB8elnPsEt1aKH0E7IFQ9txILGgvSVA.jpg,78.0,140.0,"Oregon governor: ‘There is no federal reserve of doses,’ accuses Trump administration of deception (OPB non-paywall link)",0,[],1.0,https://www.opb.org/article/2021/01/15/oregon-covid-19-vaccine-governor-brown-trump-administration/,https://www.opb.org/article/2021/01/15/oregon-covid-19-vaccine-governor-brown-trump-administration/,all_ads,6,02698216-4254-11e1-a562-12313b08a511,dark,,,,,,,,,,,,
[],False,34_tubs_of_guts,,[],"Portland, ME",text,t2_8h7z20e3,False,True,[],False,False,1610744083,koin.com,https://www.reddit.com/r/Portland/comments/ky3m92/vancouver_girl_launches_vegan_lip_gloss_line/,{},ky3m92,True,False,False,False,True,False,False,,local-news,[],Local News,dark,text,False,False,False,5,0,False,all_ads,/r/Portland/comments/ky3m92/vancouver_girl_launches_vegan_lip_gloss_line/,False,link,"{'enabled': False, 'images': [{'id': 'tAIqhsv1US8WLMUSdtmAgfYE5G0W-LoWfVSvcjjH7xc', 'resolutions': [{'height': 70, 'url': 'https://external-preview.redd.it/v31bap7L-4_2BCRGJqrHHSYPia2NlmIsyNB1Henx9Nc.jpg?width=108&amp;crop=smart&amp;auto=webp&amp;s=f9b1e9aae512bc3f2d99c22b881538a8059f75a2', 'width': 108}, {'height': 140, 'url': 'https://external-preview.redd.it/v31bap7L-4_2BCRGJqrHHSYPia2NlmIsyNB1Henx9Nc.jpg?width=216&amp;crop=smart&amp;auto=webp&amp;s=bf283104922e0b29c0a1bb397ea6a50cdee3df20', 'width': 216}, {'height': 208, 'url': 'https://external-preview.redd.it/v31bap7L-4_2BCRGJqrHHSYPia2NlmIsyNB1Henx9Nc.jpg?width=320&amp;crop=smart&amp;auto=webp&amp;s=72f9384745f94c9f3b3b680dd9460665bbd34923', 'width': 320}, {'height': 417, 'url': 'https://external-preview.redd.it/v31bap7L-4_2BCRGJqrHHSYPia2NlmIsyNB1Henx9Nc.jpg?width=640&amp;crop=smart&amp;auto=webp&amp;s=b892050ae13d32d82bb5245af5c4e89be705844c', 'width': 640}, {'height': 626, 'url': 'https://external-preview.redd.it/v31bap7L-4_2BCRGJqrHHSYPia2NlmIsyNB1Henx9Nc.jpg?width=960&amp;crop=smart&amp;auto=webp&amp;s=9f7ac08e6e57f38983dbdcc3abe72daaa178dc9a', 'width': 960}, {'height': 704, 'url': 'https://external-preview.redd.it/v31bap7L-4_2BCRGJqrHHSYPia2NlmIsyNB1Henx9Nc.jpg?width=1080&amp;crop=smart&amp;auto=webp&amp;s=77532467de884211935b3aa69b56d257acd712d4', 'width': 1080}], 'source': {'height': 835, 'url': 'https://external-preview.redd.it/v31bap7L-4_2BCRGJqrHHSYPia2NlmIsyNB1Henx9Nc.jpg?auto=webp&amp;s=811cd486d21e67b961fae6e5016ba24e441d8348', 'width': 1280}, 'variants': {}}]}",6,1610744859,2,,False,False,False,Portland,t5_2qi2i,188478,public,confidence,https://b.thumbs.redditmedia.com/QlonppsNap3Ns2JwnuX7SoWQigxMBLzmLFKB5O1M09Y.jpg,91.0,140.0,Vancouver girl launches vegan lip gloss line,0,[],1.0,https://www.koin.com/am-extra/vancouver-girl-launches-vegan-lip-gloss-line/,https://www.koin.com/am-extra/vancouver-girl-launches-vegan-lip-gloss-line/,all_ads,6,6def5a0a-a78b-11e6-979b-0e6444f32ba4,dark,,,,,,,,,,,,
[],False,bikemaul,,[],🥘,text,t2_3beb3,False,False,[],False,False,1610744070,self.Portland,https://www.reddit.com/r/Portland/comments/ky3m3e/were_indoor_yoga_studios_legally_open_yesterday/,{},ky3m3e,True,False,False,False,True,True,False,,,[],,dark,text,False,False,True,5,0,False,all_ads,/r/Portland/comments/ky3m3e/were_indoor_yoga_studios_legally_open_yesterday/,False,,,6,1610744850,0,I'm having a hard time finding the actual business regulation timeline and their duty to enforce mask wearing. This was in Sellwood.,True,False,False,Portland,t5_2qi2i,188478,public,confidence,self,,,Were indoor yoga studios legally open yesterday?,0,[],0.2,https://www.reddit.com/r/Portland/comments/ky3m3e/were_indoor_yoga_studios_legally_open_yesterday/,,all_ads,6,ff7517fe-ed2c-11ea-8598-0e1abbcd77cf,dark,,,,,,,,,,,,
[],False,wonderskirt,,[],,text,t2_11ojxp,False,False,[],False,False,1610743849,self.Portland,https://www.reddit.com/r/Portland/comments/ky3jd8/looking_for_pomelos/,{},ky3jd8,True,False,False,False,True,True,False,,,[],,dark,text,False,False,True,22,0,False,all_ads,/r/Portland/comments/ky3jd8/looking_for_pomelos/,False,,,6,1610744621,1,"Has anyone seem pomelos for sale around town? 

They are my favorite winter citrus but I can’t find any.",True,False,False,Portland,t5_2qi2i,188478,public,confidence,self,,,Looking for pomelos,0,[],1.0,https://www.reddit.com/r/Portland/comments/ky3jd8/looking_for_pomelos/,,all_ads,6,,,,,,,,,,,,,,
[],False,guanaco55,,[],Regional Gallowboob,text,t2_hyfa9,False,True,[],False,False,1610743377,oregonlive.com,https://www.reddit.com/r/Portland/comments/ky3deu/oregon_zoo_offers_halfprice_admission_for/,{},ky3deu,True,False,False,False,True,False,False,,local-news,[],Local News,dark,text,False,False,True,10,0,False,all_ads,/r/Portland/comments/ky3deu/oregon_zoo_offers_halfprice_admission_for/,False,link,"{'enabled': False, 'images': [{'id': '9EksOTNwEuSXzGOqnEdlj1mA87_zMyDqr2ksopKPonU', 'resolutions': [{'height': 88, 'url': 'https://external-preview.redd.it/SlEO-XyygoimVUTeGj3V5t0c6DZGIL_8YCuIcbYqlHI.jpg?width=108&amp;crop=smart&amp;auto=webp&amp;s=0e8c22547fddab4542a925b522e46fda0ed17b3a', 'width': 108}, {'height': 176, 'url': 'https://external-preview.redd.it/SlEO-XyygoimVUTeGj3V5t0c6DZGIL_8YCuIcbYqlHI.jpg?width=216&amp;crop=smart&amp;auto=webp&amp;s=82aaf794e6eb357b5d29b8c680338b91ecd3f37e', 'width': 216}, {'height': 261, 'url': 'https://external-preview.redd.it/SlEO-XyygoimVUTeGj3V5t0c6DZGIL_8YCuIcbYqlHI.jpg?width=320&amp;crop=smart&amp;auto=webp&amp;s=26bb0252eec86b433fb1ca2c3109127e0919eec7', 'width': 320}, {'height': 522, 'url': 'https://external-preview.redd.it/SlEO-XyygoimVUTeGj3V5t0c6DZGIL_8YCuIcbYqlHI.jpg?width=640&amp;crop=smart&amp;auto=webp&amp;s=cf4630334f84dfb4b60ddbe21dfbcf62c094ce5b', 'width': 640}, {'height': 783, 'url': 'https://external-preview.redd.it/SlEO-XyygoimVUTeGj3V5t0c6DZGIL_8YCuIcbYqlHI.jpg?width=960&amp;crop=smart&amp;auto=webp&amp;s=b487b10e30fc2fda444d5508032b37e229a53153', 'width': 960}, {'height': 881, 'url': 'https://external-preview.redd.it/SlEO-XyygoimVUTeGj3V5t0c6DZGIL_8YCuIcbYqlHI.jpg?width=1080&amp;crop=smart&amp;auto=webp&amp;s=a507e269c72bbfa1491a577d1621576dc149efca', 'width': 1080}], 'source': {'height': 1045, 'url': 'https://external-preview.redd.it/SlEO-XyygoimVUTeGj3V5t0c6DZGIL_8YCuIcbYqlHI.jpg?auto=webp&amp;s=f2f384d9ee8d1b1a7aad93f265c1935a555a3c8f', 'width': 1280}, 'variants': {}}]}",6,1610744190,1,,True,False,False,Portland,t5_2qi2i,188478,public,confidence,https://b.thumbs.redditmedia.com/rzb9TVZwBDi35Uk3vudpTOKCernMbqjC3lQ8fVyKk9U.jpg,114.0,140.0,Oregon Zoo offers half-price admission for qualifying guests,0,[],1.0,https://www.oregonlive.com/events/2021/01/oregon-zoo-offers-half-price-admission-for-qualifying-guests.html,https://www.oregonlive.com/events/2021/01/oregon-zoo-offers-half-price-admission-for-qualifying-guests.html,all_ads,6,,dark,,,,,,,,,,,,
[],False,NumberTurg,,[],,text,t2_hx4yk5z,False,False,[],False,False,1610742411,self.Portland,https://www.reddit.com/r/Portland/comments/ky31ie/does_anyone_else_really_feel_comforted_by_the/,{},ky31ie,False,False,False,False,False,True,False,,,[],,dark,text,False,False,True,9,0,False,all_ads,/r/Portland/comments/ky31ie/does_anyone_else_really_feel_comforted_by_the/,False,,,6,1610743195,0,[removed],True,False,False,Portland,t5_2qi2i,188474,public,confidence,self,,,Does anyone else really feel comforted by the fact that antifa has a regular presence in Portland?,0,[],0.29,https://www.reddit.com/r/Portland/comments/ky31ie/does_anyone_else_really_feel_comforted_by_the/,,all_ads,6,,,moderator,,,,,,,,,,,
[],False,Your_New_Overlord,,[],,text,t2_js5x4,False,False,[],False,False,1610740813,self.Portland,https://www.reddit.com/r/Portland/comments/ky2hm1/mlk_day_charitable_opportunities/,{},ky2hm1,True,False,False,False,True,True,False,,,[],,dark,text,False,False,False,4,0,False,all_ads,/r/Portland/comments/ky2hm1/mlk_day_charitable_opportunities/,False,,,6,1610741599,3,"My gf and I both have the holiday off, and in the spirit of the day would like to spend some time/money giving back. Anyone know some good local causes (we're in NE) that are in need of some help help or donations?",True,False,False,Portland,t5_2qi2i,188470,public,confidence,self,,,MLK Day charitable opportunities?,0,[],1.0,https://www.reddit.com/r/Portland/comments/ky2hm1/mlk_day_charitable_opportunities/,,all_ads,6,,,,,,,,,,,,,,
[],False,34_tubs_of_guts,,[],"Portland, ME",text,t2_8h7z20e3,False,True,[],False,False,1610740359,oregonlive.com,https://www.reddit.com/r/Portland/comments/ky2bvv/despite_reported_apologies_to_mom_louis_vuitton/,{},ky2bvv,True,False,False,False,True,False,False,,local-news,[],Local News,dark,text,False,False,True,30,0,False,all_ads,/r/Portland/comments/ky2bvv/despite_reported_apologies_to_mom_louis_vuitton/,False,link,"{'enabled': False, 'images': [{'id': 'SwZY-fnrLB4g3PO7AKRcgm9PZbG-KGT9sb_oWZT90Hw', 'resolutions': [{'height': 71, 'url': 'https://external-preview.redd.it/lybwR3lg4o0GeKMkxczB1Z5E314Vac6g-trgj720GPo.jpg?width=108&amp;crop=smart&amp;auto=webp&amp;s=0c03b06bf2db69f0a9742c1406bf79746472a878', 'width': 108}, {'height': 143, 'url': 'https://external-preview.redd.it/lybwR3lg4o0GeKMkxczB1Z5E314Vac6g-trgj720GPo.jpg?width=216&amp;crop=smart&amp;auto=webp&amp;s=78238b834853a6691515157c18d0c2d38473314b', 'width': 216}, {'height': 213, 'url': 'https://external-preview.redd.it/lybwR3lg4o0GeKMkxczB1Z5E314Vac6g-trgj720GPo.jpg?width=320&amp;crop=smart&amp;auto=webp&amp;s=195116823fa03b315c5a220dd2554a9f0e29e422', 'width': 320}, {'height': 426, 'url': 'https://external-preview.redd.it/lybwR3lg4o0GeKMkxczB1Z5E314Vac6g-trgj720GPo.jpg?width=640&amp;crop=smart&amp;auto=webp&amp;s=b9e6c6b5269070dc8f5f522875db2a0cb785032a', 'width': 640}, {'height': 639, 'url': 'https://external-preview.redd.it/lybwR3lg4o0GeKMkxczB1Z5E314Vac6g-trgj720GPo.jpg?width=960&amp;crop=smart&amp;auto=webp&amp;s=80cff5476641ca12eb4c5be142b4d03d6c43a22e', 'width': 960}, {'height': 719, 'url': 'https://external-preview.redd.it/lybwR3lg4o0GeKMkxczB1Z5E314Vac6g-trgj720GPo.jpg?width=1080&amp;crop=smart&amp;auto=webp&amp;s=c73adffa7272c591c27182657fb63f6c0ab8355b', 'width': 1080}], 'source': {'height': 853, 'url': 'https://external-preview.redd.it/lybwR3lg4o0GeKMkxczB1Z5E314Vac6g-trgj720GPo.jpg?auto=webp&amp;s=a37220c80081644b1b4251ceec26c324727c3628', 'width': 1280}, 'variants': {}}]}",6,1610741165,1,,False,False,False,Portland,t5_2qi2i,188469,public,confidence,https://b.thumbs.redditmedia.com/GuPR9WeHVdb8AmcDicIYaQRRp0fTS6o6aRh0djjMwnw.jpg,93.0,140.0,"Despite reported apologies to mom, Louis Vuitton and police, 22-year-old accused in Portland riots pleads not guilty",0,[],0.6,https://www.oregonlive.com/portland/2021/01/despite-reported-apologies-to-mom-louis-vuitton-and-police-22-year-old-accused-in-portland-riots-pleads-not-guilty.html,https://www.oregonlive.com/portland/2021/01/despite-reported-apologies-to-mom-louis-vuitton-and-police-22-year-old-accused-in-portland-riots-pleads-not-guilty.html,all_ads,6,6def5a0a-a78b-11e6-979b-0e6444f32ba4,dark,,,,,,,,,,,,
[],False,bettie420,,[],Ashcreek,text,t2_xlkxw,False,False,[],False,False,1610740008,self.Portland,https://www.reddit.com/r/Portland/comments/ky27j4/therapists_that_accept_ohp/,{},ky27j4,True,False,False,False,True,True,False,,,[],,dark,text,False,False,False,17,0,False,all_ads,/r/Portland/comments/ky27j4/therapists_that_accept_ohp/,False,,,6,1610740831,1,I’m looking for someone who’s accepting new clients (obviously) and experienced with ADHD and borderline personality disorder. Preferably female.,True,False,False,Portland,t5_2qi2i,188468,public,confidence,self,,,Therapists that accept OHP?,0,[],1.0,https://www.reddit.com/r/Portland/comments/ky27j4/therapists_that_accept_ohp/,,all_ads,6,3f2f9a0a-42f9-11e1-a63f-12313d18ad57,dark,,,,,,,,,,,,
