author,author_created_utc,author_flair_css_class,author_flair_text,author_fullname,created_utc,domain,full_link,gilded,id,is_self,media_embed,num_comments,over_18,permalink,retrieved_on,score,secure_media_embed,selftext,stickied,subreddit,subreddit_id,thumbnail,title,url,edited,post_hint,preview,media,secure_media
alauraborealis,1184883679.0,,,t2_27uz7,1436325782,self.Portland,https://www.reddit.com/r/Portland/comments/3cic6e/looking_for_portland_workers_to_interview/,0,3cic6e,True,{},5,False,/r/Portland/comments/3cic6e/looking_for_portland_workers_to_interview/,1440624905,11,{},"Hi there. I am an artist working on an oral history project about workers and income inequality here in Portland called Wage/Working. In partnership with local community organization Know Your City, we are creating a jukebox full of stories and interviews about the working lives of Portland residents. These stories will be edited to a length which corresponds with the amount of time it takes these workers to earn $1 (resulting in longer stories by those who earn the least) before being placed inside of a jukebox. The jukebox will be hosted in at least three different public spaces (venues to be confirmed) across Portland starting in late July 2015 and be used to start conversations around income inequality in our community. You can read more about my project at www.wageworking.com.


I am looking for all types of workers (especially folks who do not spend their entire day behind a computer) to be interview about their relationship to their work. Subjects must be willing to share how much money they make per hour (which will not be explicitly stated in the interview) and be able to be recorded on the job. If you're interested in being interviewed, please send me a message or comment! Thanks so much.",False,Portland,t5_2qi2i,self,Looking for Portland Workers to Interview!,http://www.reddit.com/r/Portland/comments/3cic6e/looking_for_portland_workers_to_interview/,,,,,
rbevans,1309264166.0,,,t2_5fsyr,1436325479,self.Portland,https://www.reddit.com/r/Portland/comments/3cibkf/portland_you_have_an_amazing_city/,0,3cibkf,True,{},27,False,/r/Portland/comments/3cibkf/portland_you_have_an_amazing_city/,1440624913,14,{},"My wife and I had 24 hours in Portland before we flew back to Charlotte and it was amazing. You guys and girls have an amazing cultured city. We started at Jake's Crawfish for dinner and ended up at Powell's.  So many books and I could get lost in there. 

The next morning we hit up Voodoos for amazing doughnuts. That place is legit. We headed over to the Japanese garden, which I enjoyed way more than I thought, spent some time at the Rose garden, and then ended in that area at the Mansion (can't remember the name). We went back to Powell's for a while, checked out Billy Crystal's, and my wife and her mom did some window shopping in the area.  My wife loved the Sangria in the can. Not sure where she picked it up at. 

Before heading back to the airport we stopped by Breakside for dinner and great beer. That place was an on point brewery. Great service, beer, and food. I'm a huge IPA fan, hoppier the better, so I was happy. 

I wish we had more time here and I hope to be back! ",False,Portland,t5_2qi2i,self,Portland you have an amazing city,http://www.reddit.com/r/Portland/comments/3cibkf/portland_you_have_an_amazing_city/,1436326998.0,,,,
[deleted],,,,,1436324110,self.Portland,https://www.reddit.com/r/Portland/comments/3ci8yj/synagogue_recommendations/,0,3ci8yj,True,{},4,False,/r/Portland/comments/3ci8yj/synagogue_recommendations/,1440624947,6,{},"Can you please give me a run down on the synagogues in Portland? 

Any you attend or have heard about good (or bad) things about?

My SO and I are looking for a progressive, preferably reform, temple to check out but would love to hear any and all experiences you've had. 

Thank you!

",False,Portland,t5_2qi2i,default,Synagogue recommendations?,http://www.reddit.com/r/Portland/comments/3ci8yj/synagogue_recommendations/,,,,,
InkNerd,1336660896.0,,,t2_7opuv,1436322146,imgur.com,https://www.reddit.com/r/Portland/comments/3ci524/portland_sailing_enthusiast_i_found_your_notebook/,0,3ci524,False,{},5,False,/r/Portland/comments/3ci524/portland_sailing_enthusiast_i_found_your_notebook/,1440624998,32,{},,False,Portland,t5_2qi2i,http://b.thumbs.redditmedia.com/P2uxqFBCWOeXuobPyylRGXCE7FoSkWcaQTP-jkugudo.jpg,Portland sailing enthusiast- I found your notebook! Verify interior for return,http://imgur.com/Xzif64V,,link,"{'images': [{'id': 'a2tazeNgphtKXLI5QfgKJObS0QXmXamwDY8gbCS2TaQ', 'resolutions': [{'height': 144, 'url': 'https://i.redditmedia.com/YJcPq9yQWSQyR55i4JaYeraMN9vK_Ou90bP5YuVM_s0.jpg?fit=crop&amp;crop=faces%2Centropy&amp;arh=2&amp;w=108&amp;s=bdbec4d343c6f79211ec9a4590a43a2d', 'width': 108}, {'height': 288, 'url': 'https://i.redditmedia.com/YJcPq9yQWSQyR55i4JaYeraMN9vK_Ou90bP5YuVM_s0.jpg?fit=crop&amp;crop=faces%2Centropy&amp;arh=2&amp;w=216&amp;s=8259db61265eb07d60fcfc785f13bc6d', 'width': 216}, {'height': 426, 'url': 'https://i.redditmedia.com/YJcPq9yQWSQyR55i4JaYeraMN9vK_Ou90bP5YuVM_s0.jpg?fit=crop&amp;crop=faces%2Centropy&amp;arh=2&amp;w=320&amp;s=3b6ec2c3e577b69a4ee34021e9e3f776', 'width': 320}, {'height': 853, 'url': 'https://i.redditmedia.com/YJcPq9yQWSQyR55i4JaYeraMN9vK_Ou90bP5YuVM_s0.jpg?fit=crop&amp;crop=faces%2Centropy&amp;arh=2&amp;w=640&amp;s=9af2b5c110e5ce0daae56825debb0d01', 'width': 640}], 'source': {'height': 1200, 'url': 'https://i.redditmedia.com/YJcPq9yQWSQyR55i4JaYeraMN9vK_Ou90bP5YuVM_s0.jpg?s=52501f28383ac42194d69cdbc9698fcc', 'width': 900}, 'variants': {}}]}",,
juitar,1303687915.0,,,t2_553g9,1436320425,self.Portland,https://www.reddit.com/r/Portland/comments/3ci1m2/moving_to_portland_probably/,0,3ci1m2,True,{},1,False,/r/Portland/comments/3ci1m2/moving_to_portland_probably/,1440625042,1,{},,False,Portland,t5_2qi2i,default,Moving to Portland (Probably),http://www.reddit.com/r/Portland/comments/3ci1m2/moving_to_portland_probably/,,,,,
cockeyeoctopi,1320569802.0,,,t2_66v26,1436319590,self.Portland,https://www.reddit.com/r/Portland/comments/3chzyd/two_friends_visited_from_michigan_and_these_are/,0,3chzyd,True,{},2,False,/r/Portland/comments/3chzyd/two_friends_visited_from_michigan_and_these_are/,1440625064,0,{},"They both created two separate videos to the same song so you can watch them at the same time! These make me realize all over again how beautiful Portland and Oregon are. Enjoy.

https://vimeo.com/132476431
https://vimeo.com/132261690",False,Portland,t5_2qi2i,self,Two friends visited from Michigan and these are their perspectives. Check it out!,http://www.reddit.com/r/Portland/comments/3chzyd/two_friends_visited_from_michigan_and_these_are/,,,,,
GoDucks2002,1372610647.0,,,t2_c7rqw,1436317985,self.Portland,https://www.reddit.com/r/Portland/comments/3chwqz/dispensaries_giving_away_samples_seeds_or_clones/,0,3chwqz,True,{},13,False,/r/Portland/comments/3chwqz/dispensaries_giving_away_samples_seeds_or_clones/,1440625105,6,{},Was wondering if anyone knew of any cannabis related events going on this month. I was out of town during Weed The People and wanting to know if anyone's heard of anything.,False,Portland,t5_2qi2i,self,"Dispensaries giving away samples, seeds, or clones?",http://www.reddit.com/r/Portland/comments/3chwqz/dispensaries_giving_away_samples_seeds_or_clones/,,,,,
sdmpdx,1395793597.0,,,t2_furji,1436317798,vimeo.com,https://www.reddit.com/r/Portland/comments/3chwdc/teaser_sadodamascus_records_summer_copulation/,0,3chwdc,False,"{'content': '&lt;iframe class=""embedly-embed"" src=""//cdn.embedly.com/widgets/media.html?src=https%3A%2F%2Fplayer.vimeo.com%2Fvideo%2F132802852&amp;url=https%3A%2F%2Fvimeo.com%2F132802852&amp;image=http%3A%2F%2Fi.vimeocdn.com%2Fvideo%2F525620019_1280.jpg&amp;key=2aa3c4d5f3de4f5b9120b660ad850dc9&amp;type=text%2Fhtml&amp;schema=vimeo"" width=""600"" height=""338"" scrolling=""no"" frameborder=""0"" allowfullscreen&gt;&lt;/iframe&gt;', 'height': 338, 'scrolling': False, 'width': 600}",0,False,/r/Portland/comments/3chwdc/teaser_sadodamascus_records_summer_copulation/,1440625110,0,"{'content': '&lt;iframe class=""embedly-embed"" src=""https://cdn.embedly.com/widgets/media.html?src=https%3A%2F%2Fplayer.vimeo.com%2Fvideo%2F132802852&amp;url=https%3A%2F%2Fvimeo.com%2F132802852&amp;image=http%3A%2F%2Fi.vimeocdn.com%2Fvideo%2F525620019_1280.jpg&amp;key=2aa3c4d5f3de4f5b9120b660ad850dc9&amp;type=text%2Fhtml&amp;schema=vimeo"" width=""600"" height=""338"" scrolling=""no"" frameborder=""0"" allowfullscreen&gt;&lt;/iframe&gt;', 'height': 338, 'scrolling': False, 'width': 600}",,False,Portland,t5_2qi2i,default,teaser - SadoDaMascus Records: Summer Copulation 2015 (SDM-022),https://vimeo.com/132802852,,,,"{'oembed': {'author_name': 'SDMPDX', 'author_url': 'http://vimeo.com/sdmpdx', 'description': 'SadoDaMascus Records: Summer Copulation 2015 (SDM-022) Available July 8, 2015. featuring: 1000TrashCans, Ras Mix, The Translucent Siders, James Curry IV, Volcanic Pinnacles, Gnar Gnar, ABSV, Terror Apart, Play Human, Gooo, PANTING, Hairy Food, Two Crows Fighting, Mita Lupa, Alien Parkinsons Project, Yah-Eef-Ay, Eaton Flowers, Consumer Music: 1000xLife (ft.', 'height': 338, 'html': '&lt;iframe class=""embedly-embed"" src=""//cdn.embedly.com/widgets/media.html?src=https%3A%2F%2Fplayer.vimeo.com%2Fvideo%2F132802852&amp;url=https%3A%2F%2Fvimeo.com%2F132802852&amp;image=http%3A%2F%2Fi.vimeocdn.com%2Fvideo%2F525620019_1280.jpg&amp;key=2aa3c4d5f3de4f5b9120b660ad850dc9&amp;type=text%2Fhtml&amp;schema=vimeo"" width=""600"" height=""338"" scrolling=""no"" frameborder=""0"" allowfullscreen&gt;&lt;/iframe&gt;', 'provider_name': 'Vimeo', 'provider_url': 'https://vimeo.com/', 'thumbnail_height': 720, 'thumbnail_url': 'http://i.vimeocdn.com/video/525620019_1280.jpg', 'thumbnail_width': 1280, 'title': 'SadoDaMascus Records: Summer Copulation 2015 (SDM-022)', 'type': 'video', 'version': '1.0', 'width': 600}, 'type': 'vimeo.com'}","{'oembed': {'author_name': 'SDMPDX', 'author_url': 'http://vimeo.com/sdmpdx', 'description': 'SadoDaMascus Records: Summer Copulation 2015 (SDM-022) Available July 8, 2015. featuring: 1000TrashCans, Ras Mix, The Translucent Siders, James Curry IV, Volcanic Pinnacles, Gnar Gnar, ABSV, Terror Apart, Play Human, Gooo, PANTING, Hairy Food, Two Crows Fighting, Mita Lupa, Alien Parkinsons Project, Yah-Eef-Ay, Eaton Flowers, Consumer Music: 1000xLife (ft.', 'height': 338, 'html': '&lt;iframe class=""embedly-embed"" src=""https://cdn.embedly.com/widgets/media.html?src=https%3A%2F%2Fplayer.vimeo.com%2Fvideo%2F132802852&amp;url=https%3A%2F%2Fvimeo.com%2F132802852&amp;image=http%3A%2F%2Fi.vimeocdn.com%2Fvideo%2F525620019_1280.jpg&amp;key=2aa3c4d5f3de4f5b9120b660ad850dc9&amp;type=text%2Fhtml&amp;schema=vimeo"" width=""600"" height=""338"" scrolling=""no"" frameborder=""0"" allowfullscreen&gt;&lt;/iframe&gt;', 'provider_name': 'Vimeo', 'provider_url': 'https://vimeo.com/', 'thumbnail_height': 720, 'thumbnail_url': 'https://i.embed.ly/1/image?url=http%3A%2F%2Fi.vimeocdn.com%2Fvideo%2F525620019_1280.jpg&amp;key=b1e305db91cf4aa5a86b732cc9fffceb', 'thumbnail_width': 1280, 'title': 'SadoDaMascus Records: Summer Copulation 2015 (SDM-022)', 'type': 'video', 'version': '1.0', 'width': 600}, 'type': 'vimeo.com'}"
IRunLikeADuck,1371441999.0,,,t2_c2a33,1436317714,self.Portland,https://www.reddit.com/r/Portland/comments/3chw77/crazy_traffic_in_downtown_portland/,0,3chw77,True,{},7,False,/r/Portland/comments/3chw77/crazy_traffic_in_downtown_portland/,1440625112,0,{},Stop and go traffic in downtown is just killer right now. Anyone else stuck? Any reasons why?,False,Portland,t5_2qi2i,self,Crazy traffic in downtown Portland?,http://www.reddit.com/r/Portland/comments/3chw77/crazy_traffic_in_downtown_portland/,,,,,
RegJIN,,,Lake Oswego,,1436316985,imgur.com,https://www.reddit.com/r/Portland/comments/3churn/i_didnt_see_any_options_for_this_on_the_pdx/,0,3churn,False,{},23,False,/r/Portland/comments/3churn/i_didnt_see_any_options_for_this_on_the_pdx/,1440625131,33,{},,False,Portland,t5_2qi2i,http://b.thumbs.redditmedia.com/dtlRNyZILSwGepvj8FoH54DMQChUdQRFf3NSUP3051M.jpg,I didn't see any options for this on the PDX Reporter App,http://imgur.com/xAQCsn3,,link,"{'images': [{'id': 'mBHgDq7v9b51k1FKEagx1ON2WgDI1m1LHMcbU3Y_pSU', 'resolutions': [{'height': 144, 'url': 'https://i.redditmedia.com/pGRGDCGshm8eqmijC6SoxgfMyJ8IU6OB6jrEGnUmI6M.jpg?fit=crop&amp;crop=faces%2Centropy&amp;arh=2&amp;w=108&amp;s=d376f6445a98c6f2319f537a549bbb25', 'width': 108}, {'height': 288, 'url': 'https://i.redditmedia.com/pGRGDCGshm8eqmijC6SoxgfMyJ8IU6OB6jrEGnUmI6M.jpg?fit=crop&amp;crop=faces%2Centropy&amp;arh=2&amp;w=216&amp;s=0df90af8f578a56da3c3d27a19ca1a9e', 'width': 216}, {'height': 426, 'url': 'https://i.redditmedia.com/pGRGDCGshm8eqmijC6SoxgfMyJ8IU6OB6jrEGnUmI6M.jpg?fit=crop&amp;crop=faces%2Centropy&amp;arh=2&amp;w=320&amp;s=c83a4662561c6e1bc2836bf9ef7901f7', 'width': 320}, {'height': 853, 'url': 'https://i.redditmedia.com/pGRGDCGshm8eqmijC6SoxgfMyJ8IU6OB6jrEGnUmI6M.jpg?fit=crop&amp;crop=faces%2Centropy&amp;arh=2&amp;w=640&amp;s=6fd14d10fc003d5690b9b8512809a2ee', 'width': 640}], 'source': {'height': 1200, 'url': 'https://i.redditmedia.com/pGRGDCGshm8eqmijC6SoxgfMyJ8IU6OB6jrEGnUmI6M.jpg?s=14fe98bff7773624ad602671087caf75', 'width': 900}, 'variants': {}}]}",,
bkerensa,1210833773.0,,NE,t2_35ak6,1436316515,kickstarter.com,https://www.reddit.com/r/Portland/comments/3chttj/amazingly_great_hot_sauces_from_portland_or_back/,0,3chttj,False,{},13,False,/r/Portland/comments/3chttj/amazingly_great_hot_sauces_from_portland_or_back/,1440625143,0,{},,False,Portland,t5_2qi2i,default,"Amazingly great HOT sauces from Portland, OR » Back this project",https://www.kickstarter.com/projects/1297064351/amazingly-great-hot-sauces-that-are-actually-hot,,,,,
diabloblanco,1277146173.0,,Creston-Kenilworth,t2_44tfz,1436315446,tinyhouselistings.com,https://www.reddit.com/r/Portland/comments/3chrpx/did_luke_and_jess_move_from_burnside_26_into_this/,0,3chrpx,False,{},32,False,/r/Portland/comments/3chrpx/did_luke_and_jess_move_from_burnside_26_into_this/,1440625170,6,{},,False,Portland,t5_2qi2i,http://a.thumbs.redditmedia.com/hqUn7i4w94NBVuwEMscrPJbpoZW4RmMl1HDMgQqqgL0.jpg,Did Luke and Jess move from Burnside 26 into this tiny house?,http://tinyhouselistings.com/2014-heirloom-tiny-house-financing-available/,,link,"{'images': [{'id': '5rvYGAODBdfR_8RaSbGa8AC-RZJEGDd-7cunQwsjTp4', 'resolutions': [{'height': 81, 'url': 'https://i.redditmedia.com/MJxaEF23fGEzH9kXq8ntteIU5x0cf3TCSTpPwOftzd8.jpg?fit=crop&amp;crop=faces%2Centropy&amp;arh=2&amp;w=108&amp;s=a1a7537a5dec32142d6460bea892b86c', 'width': 108}, {'height': 162, 'url': 'https://i.redditmedia.com/MJxaEF23fGEzH9kXq8ntteIU5x0cf3TCSTpPwOftzd8.jpg?fit=crop&amp;crop=faces%2Centropy&amp;arh=2&amp;w=216&amp;s=34eb89b565c13762b38cb1bf08938106', 'width': 216}, {'height': 240, 'url': 'https://i.redditmedia.com/MJxaEF23fGEzH9kXq8ntteIU5x0cf3TCSTpPwOftzd8.jpg?fit=crop&amp;crop=faces%2Centropy&amp;arh=2&amp;w=320&amp;s=277b5a1c72a504026e0bf1f64e83fc84', 'width': 320}, {'height': 480, 'url': 'https://i.redditmedia.com/MJxaEF23fGEzH9kXq8ntteIU5x0cf3TCSTpPwOftzd8.jpg?fit=crop&amp;crop=faces%2Centropy&amp;arh=2&amp;w=640&amp;s=7634c6a4ddff1be7c7891d3d3919ad35', 'width': 640}], 'source': {'height': 480, 'url': 'https://i.redditmedia.com/MJxaEF23fGEzH9kXq8ntteIU5x0cf3TCSTpPwOftzd8.jpg?s=6ec3ca6cdc7a899bc6f205f5aef6ae1a', 'width': 640}, 'variants': {}}]}",,
el_seano,1231668397.0,,,t2_3cenm,1436314740,portlandoregon.gov,https://www.reddit.com/r/Portland/comments/3chq8h/ysk_about_the_pdx_reporter_app_made_to_simplify/,0,3chq8h,False,{},9,False,/r/Portland/comments/3chq8h/ysk_about_the_pdx_reporter_app_made_to_simplify/,1440625190,36,{},,False,Portland,t5_2qi2i,http://b.thumbs.redditmedia.com/keUxk6zCPV37hj840Zu2gpbu7SAF4vibT6LhJFi-5mk.jpg,"YSK about the PDX Reporter app; made to simplify reporting things like graffiti, maintenance issues, or hazards to the appropriate city bureau!",http://www.portlandoregon.gov/article/419527,,link,"{'images': [{'id': '1HiZC9EpFADFal0pfu3LcE2BrsK3_jBaq-jTvfVtOnw', 'resolutions': [{'height': 179, 'url': 'https://i.redditmedia.com/rqh8Q-cuLbl5OgJv2maGf_BEqbxqpkIrNkMHelrKPUA.jpg?fit=crop&amp;crop=faces%2Centropy&amp;arh=2&amp;w=108&amp;s=114b042254dff9b801dbafa21efdfb37', 'width': 108}, {'height': 359, 'url': 'https://i.redditmedia.com/rqh8Q-cuLbl5OgJv2maGf_BEqbxqpkIrNkMHelrKPUA.jpg?fit=crop&amp;crop=faces%2Centropy&amp;arh=2&amp;w=216&amp;s=b7d724e596c7f207788c64a6528caa0e', 'width': 216}, {'height': 533, 'url': 'https://i.redditmedia.com/rqh8Q-cuLbl5OgJv2maGf_BEqbxqpkIrNkMHelrKPUA.jpg?fit=crop&amp;crop=faces%2Centropy&amp;arh=2&amp;w=320&amp;s=4b825d471e06bb64104c1a713cf043ba', 'width': 320}], 'source': {'height': 533, 'url': 'https://i.redditmedia.com/rqh8Q-cuLbl5OgJv2maGf_BEqbxqpkIrNkMHelrKPUA.jpg?s=f4b6dc2f08de6a9cc80f7691976595d0', 'width': 320}, 'variants': {}}]}",,
[deleted],,,,,1436313644,imgur.com,https://www.reddit.com/r/Portland/comments/3chnxh/have_you_seen_this_guy_missing_since_the_4th_near/,0,3chnxh,False,{},1,False,/r/Portland/comments/3chnxh/have_you_seen_this_guy_missing_since_the_4th_near/,1440625220,1,{},,False,Portland,t5_2qi2i,default,Have you seen this guy? Missing since the 4th near Gabriel Park.,http://imgur.com/muHJKuO,,,,,
multocotaxthrowaway,1436313115.0,,,t2_om0gg,1436313497,self.Portland,https://www.reddit.com/r/Portland/comments/3chnld/multnomah_county_property_appraisal_after/,0,3chnld,True,{},17,False,/r/Portland/comments/3chnld/multnomah_county_property_appraisal_after/,1440625224,15,{},"Thought this might be a good place to post this, and throwaway because taxman.

Had a visit from a Multnomah County Property Assessor this week, which I am guessing was prompted by permitted work we had done to our house last year.

The assessor asked to come inside the premises, and I asked if I had to allow him inside.  He said no, and asked me a couple of questions about the house and the work done.

The reason I denied him entry was because a couple years back we had a similar visit, again due to permitted work, and I allowed the assessor in the house.  Our property taxes ended up going up after that visit due to his assessment.

So, those in the know...did I do myself a favor by not letting him inside, or did I hurt myself...or neither?  Multnomah County assessor's office website does not have any details on this question.

I figured this might be a helpful thread for other homeowners going through the same situation.",False,Portland,t5_2qi2i,self,Multnomah County Property Appraisal After Permitted Work,http://www.reddit.com/r/Portland/comments/3chnld/multnomah_county_property_appraisal_after/,,,,,
olyfrijole,1286513647.0,,NE,t2_4euh3,1436313496,i.imgur.com,https://www.reddit.com/r/Portland/comments/3chnla/i_hope_the_city_is_getting_these_for_free_as_part/,0,3chnla,False,{},39,False,/r/Portland/comments/3chnla/i_hope_the_city_is_getting_these_for_free_as_part/,1440625224,42,{},,False,Portland,t5_2qi2i,http://b.thumbs.redditmedia.com/mPgXWqGWn-O2m-_XjEer0sPrCTXqz4nNJGS746YCEcg.jpg,I hope the city is getting these for free as part of an experiment because neither they nor their cementitious predecessors seem to last more than a few months before coming apart,http://i.imgur.com/FoRMdC9.jpg,,image,"{'images': [{'id': 'PFNbisTRkQm8pXQl7Ehz3ZZNsexpCFyIKyST955MHIU', 'resolutions': [{'height': 81, 'url': 'https://i.redditmedia.com/DmnH3S8b_LKAL5SHUOPD-dv2cEiCqj14OS6tr7vzYN0.jpg?fit=crop&amp;crop=faces%2Centropy&amp;arh=2&amp;w=108&amp;s=a2a29332dc5426e54e90129203cd342b', 'width': 108}, {'height': 162, 'url': 'https://i.redditmedia.com/DmnH3S8b_LKAL5SHUOPD-dv2cEiCqj14OS6tr7vzYN0.jpg?fit=crop&amp;crop=faces%2Centropy&amp;arh=2&amp;w=216&amp;s=33d96646d8c4b66d257dd59a5b19faf4', 'width': 216}, {'height': 240, 'url': 'https://i.redditmedia.com/DmnH3S8b_LKAL5SHUOPD-dv2cEiCqj14OS6tr7vzYN0.jpg?fit=crop&amp;crop=faces%2Centropy&amp;arh=2&amp;w=320&amp;s=26e94106b5060caf40fbaa63f73e4f17', 'width': 320}, {'height': 480, 'url': 'https://i.redditmedia.com/DmnH3S8b_LKAL5SHUOPD-dv2cEiCqj14OS6tr7vzYN0.jpg?fit=crop&amp;crop=faces%2Centropy&amp;arh=2&amp;w=640&amp;s=d7910dc2d0565d79f182aa0e3a976cc2', 'width': 640}, {'height': 720, 'url': 'https://i.redditmedia.com/DmnH3S8b_LKAL5SHUOPD-dv2cEiCqj14OS6tr7vzYN0.jpg?fit=crop&amp;crop=faces%2Centropy&amp;arh=2&amp;w=960&amp;s=630693b0e032513160aad46422541c57', 'width': 960}, {'height': 810, 'url': 'https://i.redditmedia.com/DmnH3S8b_LKAL5SHUOPD-dv2cEiCqj14OS6tr7vzYN0.jpg?fit=crop&amp;crop=faces%2Centropy&amp;arh=2&amp;w=1080&amp;s=24ecbe938fa461e1fd2cc2ae4c92d801', 'width': 1080}], 'source': {'height': 1714, 'url': 'https://i.redditmedia.com/DmnH3S8b_LKAL5SHUOPD-dv2cEiCqj14OS6tr7vzYN0.jpg?s=9adce2ddf7ef03a9af91ed93f8fac84e', 'width': 2285}, 'variants': {}}]}",,
BackOff_ImAScientist,1338761989.0,,Tigard,t2_7w0h9,1436312233,wweek.com,https://www.reddit.com/r/Portland/comments/3chl42/oregon_will_become_second_state_to_offer_free/,0,3chl42,False,{},96,False,/r/Portland/comments/3chl42/oregon_will_become_second_state_to_offer_free/,1440625256,334,{},,False,Portland,t5_2qi2i,http://b.thumbs.redditmedia.com/tiUZKWjTez1i_wTZP3uBgvov3GhO8Fzpss3AYi5jWdw.jpg,Oregon Will Become Second State to Offer Free Community College,http://www.wweek.com/portland/blog-33425-oregon_will_become_second_state_to_offer_free_community_college.html,,link,"{'images': [{'id': '-kf76atJ-RrpnD6SrAlSM72EgS3WgThpBISvp4zKDSI', 'resolutions': [{'height': 71, 'url': 'https://i.redditmedia.com/1INwu5Iiuay-GO4thJ3ZEZyKf3P4g1VFdxoUOVYtI54.jpg?fit=crop&amp;crop=faces%2Centropy&amp;arh=2&amp;w=108&amp;s=0e7eac41daa74735b771161875e08b2f', 'width': 108}, {'height': 143, 'url': 'https://i.redditmedia.com/1INwu5Iiuay-GO4thJ3ZEZyKf3P4g1VFdxoUOVYtI54.jpg?fit=crop&amp;crop=faces%2Centropy&amp;arh=2&amp;w=216&amp;s=9db2f95374ac26520fa41dab2dadc1d5', 'width': 216}, {'height': 212, 'url': 'https://i.redditmedia.com/1INwu5Iiuay-GO4thJ3ZEZyKf3P4g1VFdxoUOVYtI54.jpg?fit=crop&amp;crop=faces%2Centropy&amp;arh=2&amp;w=320&amp;s=42944c07db32404a8bed2c78f247a25d', 'width': 320}], 'source': {'height': 413, 'url': 'https://i.redditmedia.com/1INwu5Iiuay-GO4thJ3ZEZyKf3P4g1VFdxoUOVYtI54.jpg?s=9b623a0fe594a455ea2cb417ad7f1e91', 'width': 622}, 'variants': {}}]}",,
[deleted],,,,,1436310350,self.Portland,https://www.reddit.com/r/Portland/comments/3chh10/have_ever_pleaded_not_guilty_to_a_dangerous_left/,0,3chh10,True,{},0,False,/r/Portland/comments/3chh10/have_ever_pleaded_not_guilty_to_a_dangerous_left/,1440625309,1,{},"i am going into court tomorrow to plead not guilty.
my turn was safe, there was a guy who was speeding - driving straight, who swerved and crashed into two parked cars and a pedestrian. 
any tips?",False,Portland,t5_2qi2i,default,"have ever pleaded ""not guilty"" to a dangerous left hand turn?",http://www.reddit.com/r/Portland/comments/3chh10/have_ever_pleaded_not_guilty_to_a_dangerous_left/,,,,,
[deleted],,,,,1436310342,portland.craigslist.org,https://www.reddit.com/r/Portland/comments/3chh0d/no_buyers_yet_giant_rideable_trex_art_bike/,0,3chh0d,False,{},1,False,/r/Portland/comments/3chh0d/no_buyers_yet_giant_rideable_trex_art_bike/,1440625309,1,{},,False,Portland,t5_2qi2i,default,No buyers yet? Giant Rideable T-Rex Art Bike.,http://portland.craigslist.org/clc/bik/5072609529.html,,,,,
ReallyHender,1330562130.0,,Buckman,t2_71zlh,1436309265,oregonlive.com,https://www.reddit.com/r/Portland/comments/3chepq/dead_body_found_floating_in_laurelhurst_park_pond/,0,3chepq,False,{},45,False,/r/Portland/comments/3chepq/dead_body_found_floating_in_laurelhurst_park_pond/,1440625339,56,{},,False,Portland,t5_2qi2i,http://b.thumbs.redditmedia.com/mx3BtYtTaOEy3Fi0gZ8-FgA4QGxzSWl2MiL3B4ZZQrA.jpg,Dead body found floating in Laurelhurst Park pond,http://www.oregonlive.com/portland/index.ssf/2015/07/dead_body_found_floating_in_la.html,,link,"{'images': [{'id': 'I3k2cBOQ7jhPiEu5RJ0G716-ooWBsnmpyR7RASEUTWA', 'resolutions': [{'height': 60, 'url': 'https://i.redditmedia.com/0k73L4nALJeYv7dqhp5wP295WDE7AgjCWVzW2gguZsM.jpg?fit=crop&amp;crop=faces%2Centropy&amp;arh=2&amp;w=108&amp;s=aa46fec57f08122fe4ab47f6e44b97a5', 'width': 108}, {'height': 121, 'url': 'https://i.redditmedia.com/0k73L4nALJeYv7dqhp5wP295WDE7AgjCWVzW2gguZsM.jpg?fit=crop&amp;crop=faces%2Centropy&amp;arh=2&amp;w=216&amp;s=014cdd6a2e0c0db7bb476f0ba5000d5e', 'width': 216}, {'height': 179, 'url': 'https://i.redditmedia.com/0k73L4nALJeYv7dqhp5wP295WDE7AgjCWVzW2gguZsM.jpg?fit=crop&amp;crop=faces%2Centropy&amp;arh=2&amp;w=320&amp;s=f4d6b3ff8fa5e71fe3f71f7699af65f3', 'width': 320}], 'source': {'height': 348, 'url': 'https://i.redditmedia.com/0k73L4nALJeYv7dqhp5wP295WDE7AgjCWVzW2gguZsM.jpg?s=38e446be898a2245e2e925c6b2542b74', 'width': 620}, 'variants': {}}]}",,
