all_awardings,author,author_flair_css_class,author_flair_richtext,author_flair_text,author_flair_type,author_fullname,author_patreon_flair,can_mod_post,contest_mode,created_utc,domain,full_link,gildings,id,is_crosspostable,is_meta,is_original_content,is_reddit_media_domain,is_robot_indexable,is_self,is_video,link_flair_background_color,link_flair_richtext,link_flair_text_color,link_flair_type,locked,media_only,no_follow,num_comments,num_crossposts,over_18,parent_whitelist_status,permalink,pinned,pwls,retrieved_on,score,selftext,send_replies,spoiler,stickied,subreddit,subreddit_id,subreddit_subscribers,subreddit_type,thumbnail,title,total_awards_received,updated_utc,url,whitelist_status,wls,link_flair_css_class,link_flair_text,author_flair_background_color,author_flair_template_id,author_flair_text_color,post_hint,preview,thumbnail_height,thumbnail_width,media,media_embed,secure_media,secure_media_embed,suggested_sort
[],JanineRSP,,[],,text,t2_3i78vwrm,False,False,False,1556931914,self.Portland,https://www.reddit.com/r/Portland/comments/bkftv7/cable_series_looking_for_bigfoot_stories/,{},bkftv7,True,False,False,False,True,True,False,,[],dark,text,False,False,True,13,0,False,all_ads,/r/Portland/comments/bkftv7/cable_series_looking_for_bigfoot_stories/,False,6,1556931916,0,"Hi!

(I think this is the right place because I don't think it would belong in the classified or events thread)

&amp;#x200B;

My name is Janine and I'm a producer for a new cable series where we're looking for real Bigfoot stories.

I'd love to hear about your sightings, encounters, etc. The show we're making is a very serious and professional investigation series and it is in no way a joke or parody. I'd be happy to talk to anyone personally in a DM if you'd rather not post it on the thread. I'd also chat with you folks on the phone to maybe see if your encounter could be a great fit for the series! Because of the journalistic and documentarian nature we're taking with the show, we technically can't offer any monetary compensation in case it affects the integrity of the story. That being said, though, we will cover any travel or expenses that may happen if we'd like to have you telling your story in the show. I just want great stories and can work out all other details so everybody is happy/feels safe sharing!

Let me know any questions you have. Thanks in advance.

Janine",True,False,False,Portland,t5_2qi2i,124940,public,self,Cable Series Looking for Bigfoot Stories,0,1557516658,https://www.reddit.com/r/Portland/comments/bkftv7/cable_series_looking_for_bigfoot_stories/,all_ads,6,,,,,,,,,,,,,,
[],brandonm519,,[],,text,t2_306y877j,False,False,False,1556931747,self.Portland,https://www.reddit.com/r/Portland/comments/bkft03/used_golf_stores_around_pdx/,{},bkft03,True,False,False,False,True,True,False,,[],dark,text,False,False,True,5,0,False,all_ads,/r/Portland/comments/bkft03/used_golf_stores_around_pdx/,False,6,1556931748,0,What are some shops around Portland that sell used golf clubs? Looking for iron sets in particular. It could also be North of town as I am heading to Seattle after.,True,False,False,Portland,t5_2qi2i,124940,public,self,Used golf stores around PDX,0,1557516646,https://www.reddit.com/r/Portland/comments/bkft03/used_golf_stores_around_pdx/,all_ads,6,,,,,,,,,,,,,,
[],foodieloveyum,,[],,text,t2_9c98h6s,False,False,False,1556929508,i.redd.it,https://www.reddit.com/r/Portland/comments/bkfhae/beyond_meat_giving_away_free_burgers_tacos/,{},bkfhae,True,False,False,True,True,False,False,,[],dark,text,False,False,True,13,0,False,all_ads,/r/Portland/comments/bkfhae/beyond_meat_giving_away_free_burgers_tacos/,False,6,1556929509,28,,True,False,False,Portland,t5_2qi2i,124935,public,default,"Beyond Meat giving away FREE Burgers, Tacos, Coupons *today only* to celebrate it's stock going public",0,1557516189,https://i.redd.it/ln1wipyl73w21.png,all_ads,6,,,,,,,,,,,,,,
[],anythreewords,,[],,text,t2_1vwi2gho,False,False,False,1556929025,i.redd.it,https://www.reddit.com/r/Portland/comments/bkfeq7/there_are_so_many_bars_in_downtown_portland/,{},bkfeq7,True,False,False,True,True,False,False,,[],dark,text,False,False,True,28,0,False,all_ads,/r/Portland/comments/bkfeq7/there_are_so_many_bars_in_downtown_portland/,False,6,1556929027,127,,True,False,False,Portland,t5_2qi2i,124935,public,default,There are so many bars in downtown Portland!,0,1557516154,https://i.redd.it/fl3f7ufr73w21.jpg,all_ads,6,photo,Photo,,,,,,,,,,,,
[],MichaelTen,,[],,text,t2_884o7,False,False,False,1556928185,oregonlive.com,https://www.reddit.com/r/Portland/comments/bkf9yn/should_psu_release_investigations_of_its_president/,{},bkf9yn,True,False,False,False,True,False,False,,[],dark,text,False,False,True,6,0,False,all_ads,/r/Portland/comments/bkf9yn/should_psu_release_investigations_of_its_president/,False,6,1556928186,58,,False,False,False,Portland,t5_2qi2i,124933,public,default,Should PSU release investigations of its president?,0,1557516087,https://www.oregonlive.com/politics/2019/05/should-psu-release-investigations-of-its-president.html?utm_medium=social&amp;utm_campaign=oregonian_sf&amp;utm_source=twitter,all_ads,6,local-news,Local News,,,,,,,,,,,,
[],6_tubs_of_guts,,[],,text,t2_2vh12mex,False,False,False,1556924793,kgw.com,https://www.reddit.com/r/Portland/comments/bkeqkw/abrupt_closure_of_beaverton_spa_leaves_customers/,{},bkeqkw,True,False,False,False,True,False,False,,[],dark,text,False,False,True,2,0,False,all_ads,/r/Portland/comments/bkeqkw/abrupt_closure_of_beaverton_spa_leaves_customers/,False,6,1556924794,10,,False,False,False,Portland,t5_2qi2i,124932,public,default,Abrupt closure of Beaverton spa leaves customers out hundreds of dollars,0,1557515519,https://www.kgw.com/mobile/article/money/business/abrupt-closure-of-beaverton-spa-leaves-customers-out-hundreds-of-dollars/283-f23293ec-232d-47aa-a2d3-a3405284fcaa,all_ads,6,local-news,Local News,,,,,,,,,,,,
[],6_tubs_of_guts,,[],,text,t2_2vh12mex,False,False,False,1556924188,koin.com,https://www.reddit.com/r/Portland/comments/bkemxs/5_hillsboro_high_students_under_the_influence/,{},bkemxs,True,False,False,False,True,False,False,,[],dark,text,False,False,True,11,0,False,all_ads,/r/Portland/comments/bkemxs/5_hillsboro_high_students_under_the_influence/,False,6,1556924190,0,,False,False,False,Portland,t5_2qi2i,124932,public,default,5 Hillsboro High students 'under the influence',0,1557515468,https://www.koin.com/news/education/5-hillsboro-high-students-under-the-influence-of-intoxicants-may-2-2019/1974684880,all_ads,6,local-news,Local News,,,,,,,,,,,,
[],itstoolatefororanges,,[],Downtown,text,t2_28two8dm,False,False,False,1556923852,oswegocountytoday.com,https://www.reddit.com/r/Portland/comments/bkekx8/sandra_scott_travels_explore_some_of_portlands/,{},bkekx8,True,False,False,False,True,False,False,,[],dark,text,False,False,True,0,0,False,all_ads,/r/Portland/comments/bkekx8/sandra_scott_travels_explore_some_of_portlands/,False,6,1556923853,6,,True,False,False,Portland,t5_2qi2i,124932,public,default,Sandra Scott Travels: Explore Some Of Portland’s Notorious Past,0,1557515440,https://oswegocountytoday.com/sandra-scott-travels-explore-some-of-portlands-notorious-past/entertainment/sandra-scott-travels/,all_ads,6,,,,eabbbf0e-42ca-11e1-a863-12313b08a511,dark,,,,,,,,,
[],jcallip,,[],Kenton,text,t2_jyh9a,False,False,False,1556923035,kgw.com,https://www.reddit.com/r/Portland/comments/bkefzv/lifelong_blazers_fan_from_nyc_arrives_in_portland/,{},bkefzv,True,False,False,False,True,False,False,,[],dark,text,False,False,True,8,0,False,all_ads,/r/Portland/comments/bkefzv/lifelong_blazers_fan_from_nyc_arrives_in_portland/,False,6,1556923037,24,,False,False,False,Portland,t5_2qi2i,124930,public,default,Lifelong Blazers fan from NYC arrives in Portland for Game 3,0,1557515079,https://www.kgw.com/article/sports/nba/blazers/lifelong-blazers-fan-from-nyc-arrives-in-portland-for-game-3/283-fcae8b3a-1b85-428d-8bc2-b1622ceabdb7,all_ads,6,local-news,Local News,,,dark,,,,,,,,,
[],PDX_Stan,,[],,text,t2_ejfyx,False,False,False,1556922806,i.redd.it,https://www.reddit.com/r/Portland/comments/bkeeio/i_thought_it_would_be_nice_to_say_at_least_one/,{},bkeeio,True,False,False,True,True,False,False,,[],dark,text,False,False,True,2,0,False,all_ads,/r/Portland/comments/bkeeio/i_thought_it_would_be_nice_to_say_at_least_one/,False,6,1556922807,1,,True,False,False,Portland,t5_2qi2i,124930,public,default,I thought it would be nice to say at least one nice thing about the place,0,1557515058,https://i.redd.it/osp002d4p2w21.jpg,all_ads,6,photo,Photo,,,,,,,,,,,,
[],ArchaeoFriend,,[],,text,t2_14eukq,False,False,False,1556922203,self.Portland,https://www.reddit.com/r/Portland/comments/bkeasx/archaeology_in_your_backyard_8_philosophizing/,{},bkeasx,True,False,False,False,True,True,False,,[],dark,text,False,False,True,2,0,False,all_ads,/r/Portland/comments/bkeasx/archaeology_in_your_backyard_8_philosophizing/,False,6,1556922203,1,"  

Sit back, relax, and light your thinking pipe because it’s that time of year again. The trees are singing, the rivers are dropping, and I’ve come to talk about archaeology with the good people of r/Portland. 

Allow me a moment to paint a mental picture. 

Somewhere deep in the wilds of Sauvie Island (I can’t say where, but it doesn’t really matter), there’s a 75 foot long stretch of bare earth peaking out from tufts of grass and the roots of gnarled old *Fraxinus*. You might not notice it at first, sure, but you will see it if you look long enough – here, a diffuse blob of reddened earth. There, a small broken chunk of igneous rock with pitted faces and unnaturally sharp right angles and blackened color. And there, a tiny flake of faded grayish white quartzite, that once, many centuries or perhaps even millennia ago, was part of a larger quartzite cobble picked from the banks of the Columbia River a half mile away. All telltale signs that, probably sometime well before any [Broughtons](https://en.wikipedia.org/wiki/William_Robert_Broughton) or Lewises or Clarks nervously scooted by in big strange boats, a group of Chinookan people camped here and had fires and processed some local food materials.

You look around. In some ways, the surrounding landscape seems like a time machine; no houses are visible, you can hear sucker fish splash and bufflehead ducks and bald eagles and even sometimes [white pelicans](https://www.youtube.com/watch?v=zmZRNgZNG5Q)  flying overhead. The breeze rustles the leaves of dozens of “native” trees and shrubs – a short distance away stands one of the best remaining examples of oak savannah left in the Portland metro area. 

At the same time, where you are standing would probably be under water this time of a year if a giant levy had not been constructed decades ago around much of the island. A couple hundred feet away, the landscape forms strangely uniform lines and ditches, obviously impacted by heavy machinery during some project or the other, not very long ago. 

Through it all lies our little archaeological site, and, as its discoverer (as far as I know) I might just be the only person who knows about it. What does it mean, then? There’s a story there, but only one small fragment of it has been told, and that to possibly only me. Well me and the pelicans anyway. What does the story mean to us, the living, if it is not told? Can we ever tell it well, even if we try? How does this little story fit into the bigger story of the land in which it rests, virtually hidden?

Not very far from there is a stretch of beach on a large river where, if the tide and time of year are right, a similar variety of artifacts – but in much greater quantity – are exposed for all who pass by to see. Now like our other site, this site is also not officially discovered or listed in any Oregon state database. But I do know that there are quite a few people who know about this site, some of whom come here to look for artifacts to collect. Their way of engaging with that story is (well, [illegal in Oregon](https://www.oregonlaws.org/ors/358.920), but also) to take a piece of it into their hand and then into their home. Probably, a lot of other people walk by and say, huh, that’s weird, without knowing what they are seeing. Either way, there is more of a story being told here, see? But is that for the best?

And then lastly, we go across the island, to a very much officially known, well documented, and heavily dug site – made the news and everything. Almost a century of digging has taken place here, from local collectors to professional archaeologists. This place means a whole lot to a whole lot of people. Case in point: a couple years ago, I was doing a brief site visit there with some other professional archaeologists, and two locals in a boat pulled up and started yelling at us to get the heck out of there. We threw our hands up and said hey we’re archaeologists! They grimaced like pirates and drifted slowly away, muttering dark things. 

I think we all felt a bit awkward then, shaken up, perhaps wondering silently what special claim or right we have to be there tromping around this site. What’s my point here? I guess it’s that it’s difficult to pin down what all that history lying out there means until someone discovers it and tries to understand its story. And then when that happens, whose story is it to tell? How does the story change when trained archaeologists come to study it? How many stories can dwell within the bigger story, and how wondrous or painful or enlightening or useless will each story be to any one human?

Or maybe the point is that archaeology is a never ending question, and that’s the beauty of it.

If you'd like to philosophize some more, or just learn about local archaeology, come check out a really neat, annual free public outreach and educational/hands on/fun event. It's on June 1st in downtown Portland (see links below). This year's theme is the Archaeology of Daily Life.

**Footnote**

*Archaeology is a sub-discipline of anthropology. Archaeologists study the traces people leave behind – namely artifacts, features, structures, and impacts on the landscape. As in the rest of the United States, professional archaeological work occurs frequently in NW Oregon, and is carried out by universities, private companies, government agencies, and tribes. Archaeology is everywhere – in city, suburb, and wilderness alike.*

*While archaeological work is largely funded by your public tax dollars, chances are you don’t realize that archaeology is being done regularly in your area. You are also likely unaware of the kinds of things archaeologists discover, explore, and analyze – despite the fact that these findings could have significant meaning and impact for you and many others. The difference a little solid knowledge of the past can make is amazing.*

*This series of posts from professional archaeologists is meant to foster discussion about regional archaeological projects, topics, or issues, with the ultimate goal being a more informed and engaged public. If these posts and discussions interest you, join us at the* [8th annual Archaeology Roadshow in Portland on June 1st 201](https://www.pdx.edu/anthropology/archaeology-roadshow)9 *and come ready to learn, share, and continue the conversation! This FREE event is Oregon’s largest ongoing archaeology/history outreach event, and includes educational exhibits and activities (for adults &amp; kids alike) from dozens of local companies, agencies, and tribes, as well as a panel of experts to tell you more about any old objects you might have found.*

**Check out past Archaeology in Your Backyard series posts:**

1) [Native Fishes](https://www.reddit.com/r/Portland/comments/5ocbqi/archaeology_in_your_backyard_a_reddit_discussion/)

2) [Poop](https://www.reddit.com/r/Portland/comments/5r2xai/archaeology_in_your_backyard_a_reddit_discussion/)

3)[Archaeology Under the Streets](https://www.reddit.com/r/Portland/comments/613s24/archaeology_in_your_backyard_a_reddit_discussion/)

4) [Who What Where When…Why?](https://www.reddit.com/r/Portland/comments/6aebdt/archaeology_in_your_backyard_a_reddit_discussion/)

5) [Storytime](https://www.reddit.com/r/Portland/comments/6bqoov/archaeology_in_your_backyard_a_reddit_discussion/)

6) [Trash](https://www.reddit.com/r/Portland/comments/84f784/archaeology_in_your_backyard_a_reddit_discussion/)

7) [What Would You Do?](https://www.reddit.com/r/Portland/comments/8m53o9/archaeology_in_your_backyard_a_reddit_discussion/)",True,False,False,Portland,t5_2qi2i,124930,public,self,Archaeology in Your Backyard #8: Philosophizing about Archaeology,0,1557515006,https://www.reddit.com/r/Portland/comments/bkeasx/archaeology_in_your_backyard_8_philosophizing/,all_ads,6,,,,,,,,,,,,,,
[],florgblorgle,,[],,text,t2_ho3br,False,False,False,1556921915,self.Portland,https://www.reddit.com/r/Portland/comments/bke93d/psu_warns_of_11_percent_tuition_hike_10_million/,{},bke93d,True,False,False,False,True,True,False,,[],dark,text,False,False,True,80,0,False,all_ads,/r/Portland/comments/bke93d/psu_warns_of_11_percent_tuition_hike_10_million/,False,6,1556921917,95,"https://www.bizjournals.com/portland/news/2019/05/03/psu-warns-of-11-percent-tuition-hike-10-million.html

""Portland State University students could absorb an 11 percent tuition increase next year unless lawmakers budget more money for higher education, the university announced Friday.

Oregon's second-largest university would also need to make $10 million in budget cuts campuswide as it faces $18.6 million in cost increases, according to a PSU news release.

The Legislature's budget committees have allocated $40.5 million in new money for the state's seven public universities for next biennium, according to PSU's announcement. That statement attributed the university's rising costs to increases in retirement costs, benefits and salaries.

“We need a commitment of additional revenue support from the state to cover significant cost increases, particularly those that arise as a result of the underfunded Public Employee Retirement System,” Vice President of Finance and Administration Kevin Reynolds said.""

Hard to spin this one in a positive way for PSU students.  ""We need you to pay more so we can pay retirees that you'll never meet.  In the meantime, we're cutting services, and here are your new adjuncts getting paid less than minimum wage to teach your classes this term...""",True,False,False,Portland,t5_2qi2i,124930,public,self,"PSU warns of 11 percent tuition hike, $10 million in cuts",0,1557514982,https://www.reddit.com/r/Portland/comments/bke93d/psu_warns_of_11_percent_tuition_hike_10_million/,all_ads,6,,,,,,,,,,,,,,
[],Old-Willapa,,[],,text,t2_4iu2ps6,False,False,False,1556919783,i.redd.it,https://www.reddit.com/r/Portland/comments/bkdvq3/sold_out_or_not/,{},bkdvq3,True,False,False,True,True,False,False,,[],dark,text,False,False,True,18,0,False,all_ads,/r/Portland/comments/bkdvq3/sold_out_or_not/,False,6,1556919785,685,,True,False,False,Portland,t5_2qi2i,124928,public,https://a.thumbs.redditmedia.com/0UkKbFp3ASIUx7JyoIG3uGWcZcq-h4Y5tsUNBjYRF28.jpg,Sold out? or not...,0,1557514515,https://i.redd.it/y5et4jbcg2w21.jpg,all_ads,6,photo,Photo,,,,image,"{'enabled': True, 'images': [{'id': '_SJE08Qgb4NPkT_XG54FWFL0pVH833Cea9nVGcC_wog', 'resolutions': [{'height': 140, 'url': 'https://preview.redd.it/y5et4jbcg2w21.jpg?width=108&amp;crop=smart&amp;auto=webp&amp;s=ce625d7ddc508e438b3c6d9a641dc4f078674f69', 'width': 108}, {'height': 280, 'url': 'https://preview.redd.it/y5et4jbcg2w21.jpg?width=216&amp;crop=smart&amp;auto=webp&amp;s=20d0f9d80e26f4c5c1742b4d19b124e831fd3082', 'width': 216}, {'height': 416, 'url': 'https://preview.redd.it/y5et4jbcg2w21.jpg?width=320&amp;crop=smart&amp;auto=webp&amp;s=e87ebf6c1ce6f0c7f2663a0d06ee315bebcef150', 'width': 320}, {'height': 832, 'url': 'https://preview.redd.it/y5et4jbcg2w21.jpg?width=640&amp;crop=smart&amp;auto=webp&amp;s=726349602ea3ef1aca4dc9c25a32d78fc6fa2a4d', 'width': 640}], 'source': {'height': 960, 'url': 'https://preview.redd.it/y5et4jbcg2w21.jpg?auto=webp&amp;s=ea27d271adaf045a7d38441bbe51cbb054dd5d33', 'width': 738}, 'variants': {}}]}",140.0,140.0,,,,,
[],itstoolatefororanges,,[],Downtown,text,t2_28two8dm,False,False,False,1556919642,oregonlive.com,https://www.reddit.com/r/Portland/comments/bkdutm/proposed_portland_baseball_stadium_site_faces/,{},bkdutm,True,False,False,False,True,False,False,,[],dark,text,False,False,True,45,0,False,all_ads,/r/Portland/comments/bkdutm/proposed_portland_baseball_stadium_site_faces/,False,6,1556919643,21,,True,False,False,Portland,t5_2qi2i,124928,public,default,Proposed Portland baseball stadium site faces deadline: Pay up or move on,0,1557514501,https://www.oregonlive.com/portland/2019/05/portland-diamond-project-nears-deadline-for-proposed-stadium-site.html,all_ads,6,,,,eabbbf0e-42ca-11e1-a863-12313b08a511,dark,,,,,,,,,
[],sungorth,,[],,text,t2_esmqr,False,False,False,1556917393,change.org,https://www.reddit.com/r/Portland/comments/bkdgn3/petition_to_remove_kevin_mchale_from_future/,{},bkdgn3,True,False,False,False,True,False,False,,[],dark,text,False,False,True,1,0,False,all_ads,/r/Portland/comments/bkdgn3/petition_to_remove_kevin_mchale_from_future/,False,6,1556917394,1,,True,False,False,Portland,t5_2qi2i,124926,public,default,Petition to remove Kevin Mchale from future blazers broadcasts,0,1557514290,https://www.change.org/p/warnermedia-entertainment-tnt-remove-kevin-mchale-from-future-blazers-broadcasts,all_ads,6,,,,,,,,,,,,,,
[],theresevoir,,[],,text,t2_2c8k0w05,False,False,False,1556917060,wired.com,https://www.reddit.com/r/Portland/comments/bkdeg2/portland_is_again_blazing_trails_for_open/,{},bkdeg2,True,False,False,False,True,False,False,,[],dark,text,False,False,True,1,0,False,all_ads,/r/Portland/comments/bkdeg2/portland_is_again_blazing_trails_for_open/,False,6,1556917061,1,,True,False,False,Portland,t5_2qi2i,124926,public,https://b.thumbs.redditmedia.com/7go4xQRS5ieRtWg7rS9WUNIC7R-in7VJtZHIdVWKIbQ.jpg,Portland Is Again Blazing Trails for Open Internet Access,0,1557514258,https://www.wired.com/story/portland-again-blazing-trails-open-internet-access/,all_ads,6,,,,,,link,"{'enabled': False, 'images': [{'id': '8VRS2S3nSKOq4nals4Om9IEDJoRlyaZh8-Y1YiQwLW4', 'resolutions': [{'height': 56, 'url': 'https://external-preview.redd.it/IvpfSUf8nZN5j4qGPksIOkJWM52dlJajwMLl3UtRJuw.jpg?width=108&amp;crop=smart&amp;auto=webp&amp;s=62133790cb4dcb56caef727c1e6eb9466815a2fc', 'width': 108}, {'height': 113, 'url': 'https://external-preview.redd.it/IvpfSUf8nZN5j4qGPksIOkJWM52dlJajwMLl3UtRJuw.jpg?width=216&amp;crop=smart&amp;auto=webp&amp;s=660fa642f911d6c13158d54284122763b73bdd4f', 'width': 216}, {'height': 167, 'url': 'https://external-preview.redd.it/IvpfSUf8nZN5j4qGPksIOkJWM52dlJajwMLl3UtRJuw.jpg?width=320&amp;crop=smart&amp;auto=webp&amp;s=73a2e5cfc8c8780990df162ec327789539f91e84', 'width': 320}, {'height': 334, 'url': 'https://external-preview.redd.it/IvpfSUf8nZN5j4qGPksIOkJWM52dlJajwMLl3UtRJuw.jpg?width=640&amp;crop=smart&amp;auto=webp&amp;s=4125951e7d84aab695d21b7c46e40a4cfc40ebb0', 'width': 640}, {'height': 502, 'url': 'https://external-preview.redd.it/IvpfSUf8nZN5j4qGPksIOkJWM52dlJajwMLl3UtRJuw.jpg?width=960&amp;crop=smart&amp;auto=webp&amp;s=96c4e9ac1f23484f7384488fb976ce47062b8e79', 'width': 960}, {'height': 565, 'url': 'https://external-preview.redd.it/IvpfSUf8nZN5j4qGPksIOkJWM52dlJajwMLl3UtRJuw.jpg?width=1080&amp;crop=smart&amp;auto=webp&amp;s=ce772a90021730bb7a92356acce91fa2593d6059', 'width': 1080}], 'source': {'height': 785, 'url': 'https://external-preview.redd.it/IvpfSUf8nZN5j4qGPksIOkJWM52dlJajwMLl3UtRJuw.jpg?auto=webp&amp;s=bb87c5b5171a0e95164923d4637dfe1d7165b6ad', 'width': 1500}, 'variants': {}}]}",73.0,140.0,,,,,
[],Nsurgnie,,[],Downtown,text,t2_4sz43,False,False,False,1556916914,self.Portland,https://www.reddit.com/r/Portland/comments/bkddia/bought_a_bike_serial_number_flagged_stolen_in_2012/,{},bkddia,True,False,False,False,True,True,False,,[],dark,text,False,False,True,73,0,False,all_ads,/r/Portland/comments/bkddia/bought_a_bike_serial_number_flagged_stolen_in_2012/,False,6,1556916915,34,"Not sure what to do. Bought a bike off Craiglist, looked up the serial number, and it's on a registry as stolen back in 2012 out off Lake O.

I feel like I'm going to be out the cash if I contact Lake Oswego police. 

Advice?",True,False,False,Portland,t5_2qi2i,124926,public,self,Bought a bike. Serial number flagged stolen in 2012.,0,1557514242,https://www.reddit.com/r/Portland/comments/bkddia/bought_a_bike_serial_number_flagged_stolen_in_2012/,all_ads,6,,,,,dark,,,,,,,,,
[],julianchad,,[],S Tabor,text,t2_q2rb3,False,False,False,1556915575,change.org,https://www.reddit.com/r/Portland/comments/bkd4wa/remove_kevin_mchale_from_blazers_broadcasts/,{},bkd4wa,True,False,False,False,True,False,False,,[],dark,text,False,False,True,30,0,False,all_ads,/r/Portland/comments/bkd4wa/remove_kevin_mchale_from_blazers_broadcasts/,False,6,1556915576,68,,True,False,False,Portland,t5_2qi2i,124924,public,default,Remove Kevin McHale From Blazers Broadcasts,0,1557514120,https://www.change.org/p/warnermedia-entertainment-tnt-remove-kevin-mchale-from-future-blazers-broadcasts?recruiter=956586927&amp;recruited_by_id=b156a920-6d62-11e9-b1f0-47dea67391cd&amp;utm_source=share_petition&amp;utm_medium=copylink&amp;utm_campaign=psf_combo_share_initial&amp;utm_term=psf_combo_share_abi&amp;share_bandit_exp=initial-15290892-en-US&amp;share_bandit_var=v1,all_ads,6,,,,,dark,,,,,,,,,
