author,author_created_utc,author_flair_css_class,author_flair_text,author_fullname,created_utc,domain,full_link,gilded,id,is_self,media_embed,num_comments,over_18,permalink,retrieved_on,score,secure_media_embed,selftext,stickied,subreddit,subreddit_id,thumbnail,title,url,edited,post_hint,preview,media,secure_media
[deleted],,,,,1436308914,self.Portland,https://www.reddit.com/r/Portland/comments/3chdyj/aspiring_writer_moving_up_to_portland_to_center/,0,3chdyj,True,{},24,False,/r/Portland/comments/3chdyj/aspiring_writer_moving_up_to_portland_to_center/,1440625349,0,{},"Hey guys, I was kinda hesitant on doing one of these as I'm sure you get them pretty often as Portland is such a hot place for young people to move out to right now and by now you're probably sick of us. But, I've been told it's a healthy choice to get a feel for a city through its community before heading out there and I figured r/Portland would be a good place to open up some discussions about the city.

There's nothing set in stone in ways of dates right now, but it looks like I'll be shipping out there somewhere around mid-August, but I'd like to make the move as quickly as I can. I took a visit to the city last July, and fell head over heels in love with the place for a ton of reasons; the incredible amount of green, the capacity for rain, the almost European atmosphere, the social energy, Bagdad Theater, fucking Powell's, but it was seeing this darling couple on a bus sitting side-by-side with their heads together each reading their own book that wrenched a piece of my heart out and told me I needed to live at least some portion of my life out in Portland. Over the past year I've been taking extra hours at work to save up a strong heap of funds to make my first move out on my own and am now just waiting on finishing up with some routine doctor appointments/check-ups before I head on out.

Currently, and for the last 20 years of my life, I've lived in a medium-sized, Tatooine-like desert town with scorching summers and winters flooded by retirees who can afford to live out here part time congesting our roads. Been writing for well over half-a-decade now, and I'm probably about six productive months away from finally finishing my first novel. I'm absolutely RCTID, and firmly believe that Clint Dempsey is an ill menace plaguing not only MLS but American society in general(If you'd like, we can talk about how much I screamed when Jewsbury put Valeri's free kick in against San Jose Sunday night). For work I'll likely just find another restaurant job as a server.

But anyway, more to the point, which is I guess I'm just looking for advice and things to know about living in your city. I want to find a writing workshop upon moving out there, and if anyone knows any bars or pubs to watch Timbers games, I'd kill for that intel as well. I've been pretty set on living inside of the city, and have found a number of places I want to look into to rent(studios and 1-bedrooms), but I'm also curious to how much of a pain living in a neighboring area like Beaverton would be. 

But, I guess that's it. Like, end of weird post that felt more like a dating profile page than anything else. Looking forward to making the move out to your city and happy to hear any and all advice you have for me. Thanks.

TL;DR: 24-year-old dude who writes and is a Timbers supporter is looking for writing groups/workshops, bars/pubs to watch soccer in, and general advice about living in a city.",False,Portland,t5_2qi2i,default,Aspiring writer moving up to Portland to center in on finishing my novel and meet new people.,http://www.reddit.com/r/Portland/comments/3chdyj/aspiring_writer_moving_up_to_portland_to_center/,,,,,
schallplatte,1413477246.0,,S Tabor,t2_iw0ue,1436308408,reuters.com,https://www.reddit.com/r/Portland/comments/3chcua/oregon_is_now_the_easiest_place_in_the_nation_for/,0,3chcua,False,{},79,False,/r/Portland/comments/3chcua/oregon_is_now_the_easiest_place_in_the_nation_for/,1440625363,532,{},,False,Portland,t5_2qi2i,http://b.thumbs.redditmedia.com/Xb0ZAC4BLFThV7e-3-_-aeYVsrgWBjRMGxzY3xZ3FFI.jpg,"""Oregon is now the easiest place in the nation for women to access birth control""",http://www.reuters.com/article/2015/07/07/us-usa-oregon-birthcontrol-idUSKCN0PH2EA20150707,,link,"{'images': [{'id': 'jeTA7Y-vbLbYG6yChTNRW3rNxN4vG1GO-wfS4sBnl5s', 'resolutions': [{'height': 75, 'url': 'https://i.redditmedia.com/sDGzrzhuE6wtoh3gueyky6dy_WnPbTZkLAlUIA68ddI.jpg?fit=crop&amp;crop=faces%2Centropy&amp;arh=2&amp;w=108&amp;s=7c4f22852eb78cefc7e159940e008280', 'width': 108}, {'height': 150, 'url': 'https://i.redditmedia.com/sDGzrzhuE6wtoh3gueyky6dy_WnPbTZkLAlUIA68ddI.jpg?fit=crop&amp;crop=faces%2Centropy&amp;arh=2&amp;w=216&amp;s=2d1bf9228a06c38456f82e3c016be066', 'width': 216}, {'height': 223, 'url': 'https://i.redditmedia.com/sDGzrzhuE6wtoh3gueyky6dy_WnPbTZkLAlUIA68ddI.jpg?fit=crop&amp;crop=faces%2Centropy&amp;arh=2&amp;w=320&amp;s=e6aff980d21b8b5fd034a7f2a07b97cc', 'width': 320}, {'height': 446, 'url': 'https://i.redditmedia.com/sDGzrzhuE6wtoh3gueyky6dy_WnPbTZkLAlUIA68ddI.jpg?fit=crop&amp;crop=faces%2Centropy&amp;arh=2&amp;w=640&amp;s=2311899712d34c6ceba894d834521547', 'width': 640}], 'source': {'height': 545, 'url': 'https://i.redditmedia.com/sDGzrzhuE6wtoh3gueyky6dy_WnPbTZkLAlUIA68ddI.jpg?s=38a75ce8dc54af2f77ce4827ea3c7330', 'width': 782}, 'variants': {}}]}",,
KDRX2,1340740014.0,,Brooklyn,t2_84vpb,1436307429,imgur.com,https://www.reddit.com/r/Portland/comments/3chahm/pnw/,0,3chahm,False,{},19,False,/r/Portland/comments/3chahm/pnw/,1440625394,31,{},,False,Portland,t5_2qi2i,http://b.thumbs.redditmedia.com/pSmA8hAqeZh49f8n9R6BRSXn1qRCryk4DtkAWEky3YI.jpg,PNW,http://imgur.com/lrY3CtG,,link,"{'images': [{'id': 'QnrxUlzdYIEA7qsgeOYKGaI3S2bTeSE_qOpS0sQoJzM', 'resolutions': [{'height': 144, 'url': 'https://i.redditmedia.com/5wT-_MIrrGRHocc-CA3NXYy7Dkvhlx7XhH_UOs3Lg_k.jpg?fit=crop&amp;crop=faces%2Centropy&amp;arh=2&amp;w=108&amp;s=04d3b502673da0111a607e7eee423677', 'width': 108}, {'height': 288, 'url': 'https://i.redditmedia.com/5wT-_MIrrGRHocc-CA3NXYy7Dkvhlx7XhH_UOs3Lg_k.jpg?fit=crop&amp;crop=faces%2Centropy&amp;arh=2&amp;w=216&amp;s=812e02b0da3217ff1f879a9f352267b7', 'width': 216}, {'height': 426, 'url': 'https://i.redditmedia.com/5wT-_MIrrGRHocc-CA3NXYy7Dkvhlx7XhH_UOs3Lg_k.jpg?fit=crop&amp;crop=faces%2Centropy&amp;arh=2&amp;w=320&amp;s=791e96eafa51ea35e268299f7cda1291', 'width': 320}, {'height': 853, 'url': 'https://i.redditmedia.com/5wT-_MIrrGRHocc-CA3NXYy7Dkvhlx7XhH_UOs3Lg_k.jpg?fit=crop&amp;crop=faces%2Centropy&amp;arh=2&amp;w=640&amp;s=0698e962964e97fa6e6aa76b8b800f90', 'width': 640}], 'source': {'height': 1200, 'url': 'https://i.redditmedia.com/5wT-_MIrrGRHocc-CA3NXYy7Dkvhlx7XhH_UOs3Lg_k.jpg?s=0606fc040c88e5fad1567fe8a41b4b97', 'width': 900}, 'variants': {}}]}",,
tubergibbosum,1330440074.0,,Mt Tabor,t2_71gk3,1436306370,self.Portland,https://www.reddit.com/r/Portland/comments/3ch83y/casual_magic_the_gathering_in_pdx/,0,3ch83y,True,{},6,False,/r/Portland/comments/3ch83y/casual_magic_the_gathering_in_pdx/,1440625425,3,{},"I just dug out some of my old cards, and want to get back into the game.  Anybody know of a place/club that regularly holds get-togethers  for casual, friendly play?",False,Portland,t5_2qi2i,self,Casual Magic the Gathering in PDX?,http://www.reddit.com/r/Portland/comments/3ch83y/casual_magic_the_gathering_in_pdx/,,,,,
Blurbobot,1279685376.0,,,t2_474th,1436305776,self.Portland,https://www.reddit.com/r/Portland/comments/3ch6qw/visiting_portland_next_week_can_i_legally_drive/,0,3ch6qw,True,{},2,False,/r/Portland/comments/3ch6qw/visiting_portland_next_week_can_i_legally_drive/,1440625442,1,{},,False,Portland,t5_2qi2i,default,Visiting Portland next week. Can I legally drive to WA and buy pot and bring it into OR?,http://www.reddit.com/r/Portland/comments/3ch6qw/visiting_portland_next_week_can_i_legally_drive/,,,,,
[deleted],,,,,1436305489,self.Portland,https://www.reddit.com/r/Portland/comments/3ch62u/i_have_1_extra_shellac_ticket_for_the_revolution/,0,3ch62u,True,{},1,False,/r/Portland/comments/3ch62u/i_have_1_extra_shellac_ticket_for_the_revolution/,1440625451,0,{},,False,Portland,t5_2qi2i,default,I have 1 extra Shellac ticket for the Revolution Hall show on Thursday the 9th of July.,http://www.reddit.com/r/Portland/comments/3ch62u/i_have_1_extra_shellac_ticket_for_the_revolution/,,,,,
Trivirti,1374129333.0,,,t2_cf7co,1436304875,opb.org,https://www.reddit.com/r/Portland/comments/3ch4o5/oregon_public_broadcasting_has_an_excellent_local/,0,3ch4o5,False,{},13,False,/r/Portland/comments/3ch4o5/oregon_public_broadcasting_has_an_excellent_local/,1440625469,1,{},,False,Portland,t5_2qi2i,http://b.thumbs.redditmedia.com/vTAIanLWi4VwVeVAJZYx6H5hOaUovDl03YRkNmCC4Lk.jpg,Oregon Public Broadcasting has an excellent local issues podcast!,http://www.opb.org/radio/programs/thinkoutloud/,,link,"{'images': [{'id': 'FvGGBV-Am_KsMHrZhPF_kyKK8U7q-_P_flKD7CCtqZc', 'resolutions': [{'height': 64, 'url': 'https://i.redditmedia.com/U1zljcVxaFCe7f3NgXQlIrVUG3agRgcUsT8WTepm8qU.jpg?fit=crop&amp;crop=faces%2Centropy&amp;arh=2&amp;w=108&amp;s=5fe74403cbbd65648584fcd4ce9d15bd', 'width': 108}, {'height': 129, 'url': 'https://i.redditmedia.com/U1zljcVxaFCe7f3NgXQlIrVUG3agRgcUsT8WTepm8qU.jpg?fit=crop&amp;crop=faces%2Centropy&amp;arh=2&amp;w=216&amp;s=96c4bcf1e3512e694fe0a2d60951ae5e', 'width': 216}, {'height': 192, 'url': 'https://i.redditmedia.com/U1zljcVxaFCe7f3NgXQlIrVUG3agRgcUsT8WTepm8qU.jpg?fit=crop&amp;crop=faces%2Centropy&amp;arh=2&amp;w=320&amp;s=eff38dc41925d054c2e5211c40f80e6c', 'width': 320}], 'source': {'height': 300, 'url': 'https://i.redditmedia.com/U1zljcVxaFCe7f3NgXQlIrVUG3agRgcUsT8WTepm8qU.jpg?s=9f7266600958a3f06d7a9525e938da9b', 'width': 500}, 'variants': {}}]}",,
farvista,1404682171.0,,,t2_ha2cr,1436304858,imgur.com,https://www.reddit.com/r/Portland/comments/3ch4mt/sunrise_over_mount_hood/,0,3ch4mt,False,{},5,False,/r/Portland/comments/3ch4mt/sunrise_over_mount_hood/,1440625470,190,{},,False,Portland,t5_2qi2i,http://a.thumbs.redditmedia.com/3Qh-k5G_Xrc7btAtNSprHYDT4UFYZN8sAZCTfJBW3C4.jpg,Sunrise over Mount Hood,http://imgur.com/xh04yjT,,link,"{'images': [{'id': '1wGbWdVR6FtZXeI9EHN14uCemGnpzodoSdlJcfg8Sos', 'resolutions': [{'height': 72, 'url': 'https://i.redditmedia.com/c1UgPblPMOLRbeKaEnk3nZ0PKzrMmuNcSBWTqa8d_NM.jpg?fit=crop&amp;crop=faces%2Centropy&amp;arh=2&amp;w=108&amp;s=ed3e33d3cb18450b567b34883f586edc', 'width': 108}, {'height': 144, 'url': 'https://i.redditmedia.com/c1UgPblPMOLRbeKaEnk3nZ0PKzrMmuNcSBWTqa8d_NM.jpg?fit=crop&amp;crop=faces%2Centropy&amp;arh=2&amp;w=216&amp;s=22c116dea019471fddc957e57e9f8be8', 'width': 216}, {'height': 213, 'url': 'https://i.redditmedia.com/c1UgPblPMOLRbeKaEnk3nZ0PKzrMmuNcSBWTqa8d_NM.jpg?fit=crop&amp;crop=faces%2Centropy&amp;arh=2&amp;w=320&amp;s=a27bddcef08dae696a0f9bea9ace6d3b', 'width': 320}, {'height': 426, 'url': 'https://i.redditmedia.com/c1UgPblPMOLRbeKaEnk3nZ0PKzrMmuNcSBWTqa8d_NM.jpg?fit=crop&amp;crop=faces%2Centropy&amp;arh=2&amp;w=640&amp;s=74840c15fe1a55081e71da440dcd140d', 'width': 640}, {'height': 640, 'url': 'https://i.redditmedia.com/c1UgPblPMOLRbeKaEnk3nZ0PKzrMmuNcSBWTqa8d_NM.jpg?fit=crop&amp;crop=faces%2Centropy&amp;arh=2&amp;w=960&amp;s=21938144a59b75852570a0f3f3d34ba7', 'width': 960}, {'height': 720, 'url': 'https://i.redditmedia.com/c1UgPblPMOLRbeKaEnk3nZ0PKzrMmuNcSBWTqa8d_NM.jpg?fit=crop&amp;crop=faces%2Centropy&amp;arh=2&amp;w=1080&amp;s=be1833b12853be91bfdcfa4176c6b5ee', 'width': 1080}], 'source': {'height': 1800, 'url': 'https://i.redditmedia.com/c1UgPblPMOLRbeKaEnk3nZ0PKzrMmuNcSBWTqa8d_NM.jpg?s=3bdc66cfc61245a6a373f7722e4eb9f2', 'width': 2700}, 'variants': {}}]}",,
Neechevo,,,,,1436303913,self.Portland,https://www.reddit.com/r/Portland/comments/3ch2gx/infinite_jest_group_tonight_at_7_hawthorne_lucky/,0,3ch2gx,True,{},19,False,/r/Portland/comments/3ch2gx/infinite_jest_group_tonight_at_7_hawthorne_lucky/,1440625498,13,{},,False,Portland,t5_2qi2i,self,Infinite Jest group tonight at 7! Hawthorne Lucky Lab. Anyone else still game?,http://www.reddit.com/r/Portland/comments/3ch2gx/infinite_jest_group_tonight_at_7_hawthorne_lucky/,,,,,
[deleted],,,,,1436301251,self.Portland,https://www.reddit.com/r/Portland/comments/3cgw3i/andrey_i_found_your_drivers_license_at_the_max/,0,3cgw3i,True,{},2,False,/r/Portland/comments/3cgw3i/andrey_i_found_your_drivers_license_at_the_max/,1440625580,4,{},,False,Portland,t5_2qi2i,default,"Andrey, I found your driver's license at the MAX station.",http://www.reddit.com/r/Portland/comments/3cgw3i/andrey_i_found_your_drivers_license_at_the_max/,,,,,
OpenMicNightCardGame,1436261859.0,,,t2_olfic,1436298779,imgur.com,https://www.reddit.com/r/Portland/comments/3cgq43/we_made_a_collecting_card_game_based_off_the/,0,3cgq43,False,"{'content': '&lt;iframe class=""embedly-embed"" src=""//cdn.embedly.com/widgets/media.html?src=%2F%2Fimgur.com%2Fa%2Fw2Sa8%2Fembed&amp;url=http%3A%2F%2Fimgur.com%2Fa%2Fw2Sa8&amp;image=http%3A%2F%2Fi.imgur.com%2F4Eh8Hzx.jpg&amp;key=2aa3c4d5f3de4f5b9120b660ad850dc9&amp;type=text%2Fhtml&amp;schema=imgur"" width=""550"" height=""550"" scrolling=""no"" frameborder=""0"" allowfullscreen&gt;&lt;/iframe&gt;', 'height': 550, 'scrolling': False, 'width': 550}",9,False,/r/Portland/comments/3cgq43/we_made_a_collecting_card_game_based_off_the/,1440625658,51,"{'content': '&lt;iframe class=""embedly-embed"" src=""https://cdn.embedly.com/widgets/media.html?src=%2F%2Fimgur.com%2Fa%2Fw2Sa8%2Fembed&amp;url=http%3A%2F%2Fimgur.com%2Fa%2Fw2Sa8&amp;image=http%3A%2F%2Fi.imgur.com%2F4Eh8Hzx.jpg&amp;key=2aa3c4d5f3de4f5b9120b660ad850dc9&amp;type=text%2Fhtml&amp;schema=imgur"" width=""550"" height=""550"" scrolling=""no"" frameborder=""0"" allowfullscreen&gt;&lt;/iframe&gt;', 'height': 550, 'scrolling': False, 'width': 550}",,False,Portland,t5_2qi2i,http://b.thumbs.redditmedia.com/3f4DvAckm9Or0QhziKUR8USOizTf_DU0O3TCgFjxxKw.jpg,We made a collecting card game based off the comedy scene here in Portland! Go to different comedy venues around town and collect them all!,http://imgur.com/a/w2Sa8,,link,"{'images': [{'id': 'ajg4YjRj4UtTN7tPgjS9Jyk5pJiBoCn4mk57Tpj0nDI', 'resolutions': [{'height': 60, 'url': 'https://i.redditmedia.com/KcczAPJ8ht6MLs7PjVK1t8KZv98jzjMKfdHpojLI7dI.jpg?fit=crop&amp;crop=faces%2Centropy&amp;arh=2&amp;w=108&amp;s=c5a013135388efda76b0591bd16a133b', 'width': 108}, {'height': 121, 'url': 'https://i.redditmedia.com/KcczAPJ8ht6MLs7PjVK1t8KZv98jzjMKfdHpojLI7dI.jpg?fit=crop&amp;crop=faces%2Centropy&amp;arh=2&amp;w=216&amp;s=529c84d768ff02d5140344166271f215', 'width': 216}, {'height': 180, 'url': 'https://i.redditmedia.com/KcczAPJ8ht6MLs7PjVK1t8KZv98jzjMKfdHpojLI7dI.jpg?fit=crop&amp;crop=faces%2Centropy&amp;arh=2&amp;w=320&amp;s=c75d08fd9bec7fda4bf48a2721407d67', 'width': 320}, {'height': 360, 'url': 'https://i.redditmedia.com/KcczAPJ8ht6MLs7PjVK1t8KZv98jzjMKfdHpojLI7dI.jpg?fit=crop&amp;crop=faces%2Centropy&amp;arh=2&amp;w=640&amp;s=d32f6e68bf30d32879f9f8f95eb5eaba', 'width': 640}, {'height': 540, 'url': 'https://i.redditmedia.com/KcczAPJ8ht6MLs7PjVK1t8KZv98jzjMKfdHpojLI7dI.jpg?fit=crop&amp;crop=faces%2Centropy&amp;arh=2&amp;w=960&amp;s=0d1ceb0ecbe8ac1a0646175dcd4647c8', 'width': 960}, {'height': 607, 'url': 'https://i.redditmedia.com/KcczAPJ8ht6MLs7PjVK1t8KZv98jzjMKfdHpojLI7dI.jpg?fit=crop&amp;crop=faces%2Centropy&amp;arh=2&amp;w=1080&amp;s=9e1749ce56c4db202da3ab7dc6afce00', 'width': 1080}], 'source': {'height': 972, 'url': 'https://i.redditmedia.com/KcczAPJ8ht6MLs7PjVK1t8KZv98jzjMKfdHpojLI7dI.jpg?s=157dfcefeb5b552199d5158d1ad45534', 'width': 1727}, 'variants': {}}]}","{'oembed': {'description': 'A swath of the different comedian cards, and a stack of the foil packs being distributed at comedy venues around town.', 'height': 550, 'html': '&lt;iframe class=""embedly-embed"" src=""//cdn.embedly.com/widgets/media.html?src=%2F%2Fimgur.com%2Fa%2Fw2Sa8%2Fembed&amp;url=http%3A%2F%2Fimgur.com%2Fa%2Fw2Sa8&amp;image=http%3A%2F%2Fi.imgur.com%2F4Eh8Hzx.jpg&amp;key=2aa3c4d5f3de4f5b9120b660ad850dc9&amp;type=text%2Fhtml&amp;schema=imgur"" width=""550"" height=""550"" scrolling=""no"" frameborder=""0"" allowfullscreen&gt;&lt;/iframe&gt;', 'provider_name': 'Imgur', 'provider_url': 'http://imgur.com', 'thumbnail_height': 972, 'thumbnail_url': 'http://i.imgur.com/4Eh8Hzx.jpg', 'thumbnail_width': 1727, 'title': 'Open Mic Night Card Game', 'type': 'rich', 'version': '1.0', 'width': 550}, 'type': 'imgur.com'}","{'oembed': {'description': 'A swath of the different comedian cards, and a stack of the foil packs being distributed at comedy venues around town.', 'height': 550, 'html': '&lt;iframe class=""embedly-embed"" src=""https://cdn.embedly.com/widgets/media.html?src=%2F%2Fimgur.com%2Fa%2Fw2Sa8%2Fembed&amp;url=http%3A%2F%2Fimgur.com%2Fa%2Fw2Sa8&amp;image=http%3A%2F%2Fi.imgur.com%2F4Eh8Hzx.jpg&amp;key=2aa3c4d5f3de4f5b9120b660ad850dc9&amp;type=text%2Fhtml&amp;schema=imgur"" width=""550"" height=""550"" scrolling=""no"" frameborder=""0"" allowfullscreen&gt;&lt;/iframe&gt;', 'provider_name': 'Imgur', 'provider_url': 'http://imgur.com', 'thumbnail_height': 972, 'thumbnail_url': 'https://i.embed.ly/1/image?url=http%3A%2F%2Fi.imgur.com%2F4Eh8Hzx.jpg&amp;key=b1e305db91cf4aa5a86b732cc9fffceb', 'thumbnail_width': 1727, 'title': 'Open Mic Night Card Game', 'type': 'rich', 'version': '1.0', 'width': 550}, 'type': 'imgur.com'}"
[deleted],,,,,1436297100,self.Portland,https://www.reddit.com/r/Portland/comments/3cgm6f/portland_income_tax_if_working_in_washington/,0,3cgm6f,True,{},1,False,/r/Portland/comments/3cgm6f/portland_income_tax_if_working_in_washington/,1440625709,1,{},"I currently live and work in Tanasbourne, but I'm interested in moving to Portland proper and commuting. Do people who work outside of Multnomah county still pay its income tax? I read it was like 9%. 

Thanks",False,Portland,t5_2qi2i,default,Portland income tax if working in Washington county.,http://www.reddit.com/r/Portland/comments/3cgm6f/portland_income_tax_if_working_in_washington/,,,,,
reprehenderitinvol,1394948009.0,,,t2_fpti2,1436295860,self.Portland,https://www.reddit.com/r/Portland/comments/3cgj7d/place_to_buy_milk_crates/,0,3cgj7d,True,{},4,False,/r/Portland/comments/3cgj7d/place_to_buy_milk_crates/,1440625747,2,{},"Looking to buy ~30 milk crates. Trued Alpenrose, they no longer sell them. Anyone know where I could get these? I can't use the cheap flimsy store bought ones for this project, I need real ones. Thanks!",False,Portland,t5_2qi2i,self,Place to buy milk crates?,http://www.reddit.com/r/Portland/comments/3cgj7d/place_to_buy_milk_crates/,,,,,
[deleted],,,,,1436294767,self.Portland,https://www.reddit.com/r/Portland/comments/3cggid/does_anyone_have_ratatat_tickets/,0,3cggid,True,{},0,False,/r/Portland/comments/3cggid/does_anyone_have_ratatat_tickets/,1440625782,0,{},,False,Portland,t5_2qi2i,default,Does anyone have Ratatat tickets?,http://www.reddit.com/r/Portland/comments/3cggid/does_anyone_have_ratatat_tickets/,,,,,
Fittyakaferrari,1307233557.0,,NW,t2_5byfe,1436294587,change.org,https://www.reddit.com/r/Portland/comments/3cgg33/petition_to_limit_development_in_multnomah/,0,3cgg33,False,{},110,False,/r/Portland/comments/3cgg33/petition_to_limit_development_in_multnomah/,1440625788,12,{},,False,Portland,t5_2qi2i,http://a.thumbs.redditmedia.com/BhNE3Tnm4QjkcQAf6l2x3pAnL_9sNsNHG_lOJC90_N4.jpg,"Petition to Limit development in Multnomah Village to 2 or 3 stories, and mandate 1 parking space per rental unit",https://www.change.org/p/city-council-of-portland-oregon-limit-development-in-multnomah-village-to-2-or-3-stories-and-mandate-1-parking-space-per-rental-unit-20ef1d0a-aa58-4d94-8a48-feb317960d7d?recruiter=312226801&amp;utm_source=share_petition&amp;utm_medium=facebook&amp;utm_campaign=share_facebook_responsive&amp;utm_term=des-lg-no_src-custom_msg&amp;fb_ref=Default,,link,"{'images': [{'id': 'lxyNmE96jKpiljaQ0CQZI3L79D_VR6F_GqQbtIp2I3Y', 'resolutions': [{'height': 60, 'url': 'https://i.redditmedia.com/Xr98U6M-_bz-6J89k75iLrM9pKnksmwwl_HmJQY8ZGQ.jpg?fit=crop&amp;crop=faces%2Centropy&amp;arh=2&amp;w=108&amp;s=d07f5421fb8e42d88d817f7ca72d4e83', 'width': 108}, {'height': 121, 'url': 'https://i.redditmedia.com/Xr98U6M-_bz-6J89k75iLrM9pKnksmwwl_HmJQY8ZGQ.jpg?fit=crop&amp;crop=faces%2Centropy&amp;arh=2&amp;w=216&amp;s=ae48d8db59f6745bddb66fb4bef509f5', 'width': 216}, {'height': 180, 'url': 'https://i.redditmedia.com/Xr98U6M-_bz-6J89k75iLrM9pKnksmwwl_HmJQY8ZGQ.jpg?fit=crop&amp;crop=faces%2Centropy&amp;arh=2&amp;w=320&amp;s=c8348b52169ff45d5cb1716e20c4d1f5', 'width': 320}, {'height': 360, 'url': 'https://i.redditmedia.com/Xr98U6M-_bz-6J89k75iLrM9pKnksmwwl_HmJQY8ZGQ.jpg?fit=crop&amp;crop=faces%2Centropy&amp;arh=2&amp;w=640&amp;s=f8ab286a5abe5296415d62dff7ab171c', 'width': 640}, {'height': 540, 'url': 'https://i.redditmedia.com/Xr98U6M-_bz-6J89k75iLrM9pKnksmwwl_HmJQY8ZGQ.jpg?fit=crop&amp;crop=faces%2Centropy&amp;arh=2&amp;w=960&amp;s=6938a4c5b65999568990cb4a869775ff', 'width': 960}, {'height': 607, 'url': 'https://i.redditmedia.com/Xr98U6M-_bz-6J89k75iLrM9pKnksmwwl_HmJQY8ZGQ.jpg?fit=crop&amp;crop=faces%2Centropy&amp;arh=2&amp;w=1080&amp;s=ec95a0ef3678d5093cb403b90d773625', 'width': 1080}], 'source': {'height': 900, 'url': 'https://i.redditmedia.com/Xr98U6M-_bz-6J89k75iLrM9pKnksmwwl_HmJQY8ZGQ.jpg?s=8adabeb0dc0409ffea9eec371ceb3bdf', 'width': 1600}, 'variants': {}}]}",,
TygErbLoOd,1326258542.0,,,t2_6mwcl,1436294392,self.Portland,https://www.reddit.com/r/Portland/comments/3cgflc/can_anyone_suggest_to_me_a_good_used_car_lot_in/,0,3cgflc,True,{},26,False,/r/Portland/comments/3cgflc/can_anyone_suggest_to_me_a_good_used_car_lot_in/,1440625794,7,{},"i'm trying to spend between $1500-$5000, and i want to avoid a car that's been wrecked or abandoned on side of the road, they never work!

thanks for your help!",False,Portland,t5_2qi2i,self,Can anyone suggest to me a good used car lot in town? thanks!,http://www.reddit.com/r/Portland/comments/3cgflc/can_anyone_suggest_to_me_a_good_used_car_lot_in/,,,,,
throwawayshirt,1287457397.0,,,t2_4fwl5,1436290719,self.Portland,https://www.reddit.com/r/Portland/comments/3cg6nr/about_that_homemade_sign_on_se35thclinton_urging/,0,3cg6nr,True,{},27,False,/r/Portland/comments/3cg6nr/about_that_homemade_sign_on_se35thclinton_urging/,1440625910,0,{},"The sign cites ORS 814.430(2)(c): 
""When reasonably necessary to avoid hazardous conditions including, but not limited to, fixed or moving objects, parked or moving vehicles, bicycles, pedestrians, animals, surface hazards or other conditions that make continued operation along the right curb or edge unsafe or to avoid unsafe operation in a lane on the roadway that is too narrow for a bicycle and vehicle to travel safely side by side. Nothing in this paragraph excuses the operator of a bicycle from the requirements under [ORS 811.425](http://www.oregonlaws.org/ors/811.425) (Failure of slower driver to yield to overtaking vehicle) or from the penalties for failure to comply with those requirements.""

Please bear in mind, the general rule under [814.430(1) Improper use of lane](http://www.oregonlaws.org/ors/814.430) is that a cyclist traveling on a roadway at less than the normal speed of traffic must travel as close as is practicable to the right curb or edge of roadway.  Subsection (2)(c) is a fairly narrow exception to the general rule.  

Cyclists who take the lane on Clinton to slow cars down, to discourage cars from using Clinton, or to make it more difficult for cars to pass, are risking a ticket for Improper use of lane and/or Failure of a slower driver to yield to overtaking vehicle.  



",False,Portland,t5_2qi2i,self,About that homemade sign on SE35th/Clinton urging cyclists to take the whole lane,http://www.reddit.com/r/Portland/comments/3cg6nr/about_that_homemade_sign_on_se35thclinton_urging/,,,,,
remindsmeof,1299554370.0,,,t2_4xnf4,1436289491,self.Portland,https://www.reddit.com/r/Portland/comments/3cg3p9/temporary_living_assistance_for_a_woman_in_trauma/,0,3cg3p9,True,{},25,False,/r/Portland/comments/3cg3p9/temporary_living_assistance_for_a_woman_in_trauma/,1440625948,20,{},"Hey PDX. I'm reaching out here. My partner and I occasionally host friends of friends who are having difficulty getting on their feet for whatever reason. A few weeks ago we agreed to host a 20yo woman who had nowhere to go (she was living in her car for a bit) and since that time we have helped her find work, get public assistance, etc. but we are now at a point where we think it is important for her to transition into something a bit more semi-permanent. She has little money, no drug problems (besides past alcohol issues), has a car of here own, and DOES have the drive to make things better for herself. She's in survival mode and has been taken advantage of in the past. There is trauma. We have had zero problems with her besides the brief and occasional flail. I've reached out to several other groups but thought someone here might have ideas we haven't thought of. I'm concerned that at this point we are potentially enabling her, regardless of how many conversations I have about getting her shit straight and moving forward. Looking for positive solutions here as this is stressful enough as it is. Peace.
*Update - No luck anywhere (shelters full/end of fiscal year = no money!) so it's back to the crisis hotline. Thanks and love to everyone who offered advice and options.
**Got an appointment with Naya tomorrow. Things are looking up. Thanks again to all of you.",False,Portland,t5_2qi2i,self,Temporary living assistance for a woman in trauma?,http://www.reddit.com/r/Portland/comments/3cg3p9/temporary_living_assistance_for_a_woman_in_trauma/,1436311958.0,,,,
