[],False,MIZZKATHY74,,[],YOU SEEN MY FUCKEN CONES,text,t2_52d2ntpx,False,False,[],False,False,1610782168,self.Portland,https://www.reddit.com/r/Portland/comments/kyeix2/protest_forms_around_officers_helping_person_in/,{},kyeix2,True,False,False,False,True,True,False,,,[],,dark,text,False,False,True,0,0,False,all_ads,/r/Portland/comments/kyeix2/protest_forms_around_officers_helping_person_in/,False,,,6,1610782179,1,"

Protest Forms Around Officers Helping Person in Crisis

Portland Police Bureau

Friday, January 15th, 2021 • 10:30 PM

A protest that formed around a crisis call involving a man holding a knife downtown prompted a call for help citywide.

On Friday, January 15, 2021 at about 1:00p.m., Central Precinct officers responded to a welfare check call outside an apartment building in the 300 block of Southwest 4th Avenue. The call indicated that a man had jumped from a second story window of the building, pulled out a knife, and began waving it around at people and cars going by.

The 30-year-old man showed arriving officers his knife, held it to his neck, and said he would kill himself if they came any closer. An Enhanced Crisis Intervention Team (ECIT) officer began a dialogue with the man in crisis, while other officers attempted to clear the area hoping to reduce the stress of the situation. The officers learned that the man was schizophrenic and extremely paranoid. He not only threatened to kill himself, he said he would hurt others as well. Rather than rush in, exacerbating a dangerous situation, officers slowed down, kept their distance, and exercised patience and de-escalation.

The negotiation lasted for about 90 minutes before two separate crowds of protesters began showing up to the north and south. Some in the crowd began chanting, and one even started using a bullhorn. The extra noise and distraction made it impossible for the specially trained officers to speak to the man. Officers implored the crowd to stop interfering, but their energy only increased. Even when the suicidal man's mother arrived and begged the crowd to stop, most in the crowd continued. Some in the crowd began threatening the officers. A supervisor requested resources citywide, and all available officers responded from North and East Precincts. This caused a major resource drain citywide and all but the highest priority calls had to wait. The officers had to don helmets and face shields to protect themselves as they stood in front of the hostile crowd.

The officers consulted with the Crisis Negotiation Team, whose members were able to find a mental health professional familiar with the man. They learned that the man could be a threat to himself and violent toward others. After over 3 hours of negotiation, the incident commander set into motion a plan to take the man into custody. A K9 unit was used to divert his attention by barking so officers could safely approach him. A Conducted Electrical Weapon (CEW, or Taser) was used to prevent him from using the knife, and he was taken into custody and transported by ambulance to a hospital. Besides the punctures from the CEW probes, he was uninjured. Officers placed him on a Police Officer Hold so that he could be evaluated by medical professionals.

The only force used against the protesters was some pushing to keep them back and out of the street.

As primary responders to crisis calls, all Portland Police Bureau officers receive basic Crisis Intervention Training as well as annual CIT refresher training. In addition, the Bureau has volunteer officers from a variety of patrol assignments on the Enhanced Crisis Intervention Team (ECIT). These officers will be the first responders dispatched by 9-1-1 to crisis calls that are determined to be related to an individual with mental illness. ECIT officers receive additional training in order to identify risks during a behavioral crisis, utilize crisis communication techniques to help deescalate a person in crisis, and have knowledge of available community resources.

Help is available for community members struggling from a mental health crisis and/or suicidal thoughts. Suicide is preventable.

The Multnomah County Mental Health Call Center is available 24 hours a day at 503-988-4888.
If you or someone you know is in mental health crisis please visit Cascadia Behavioral Healthcare's Urgent Walk-In Clinic. The clinic is located at 4212 Southeast Division Street and is open from 7am to 10:30pm, 7 days a week. Services are free and available to individuals of all ages.

Lines for Life is also available 24 hours a day at 1-800-273-TALK (8255).
Information about the Portland Police Bureau's Behavioral Health Unit (BHU) and additional resources can be found by visiting portlandoregon.gov/police/bhu



###PPB###",True,False,False,Portland,t5_2qi2i,188572,public,confidence,self,,,Protest Forms Around Officers Helping Person in Crisis,0,[],1.0,https://www.reddit.com/r/Portland/comments/kyeix2/protest_forms_around_officers_helping_person_in/,,all_ads,6,5786c622-bd77-11e9-a551-0ed7cadd2dec,dark,,,,,,,,,,,,
[],False,natalfoam,,[],,text,t2_82wcu1zk,False,False,[],False,False,1610781746,koin.com,https://www.reddit.com/r/Portland/comments/kyefjg/protesters_use_bullhorn_as_police_try_to_help_man/,{},kyefjg,True,False,False,False,True,False,False,,local-news,[],Local News,dark,text,False,False,False,118,0,False,all_ads,/r/Portland/comments/kyefjg/protesters_use_bullhorn_as_police_try_to_help_man/,False,link,"{'enabled': False, 'images': [{'id': '8qa6YeVcYhzYe8lbBjtqBTb_oVNaIRBhP-30vYsgFHg', 'resolutions': [{'height': 60, 'url': 'https://external-preview.redd.it/sfsSsGU88d4tmcUui46oc36ukteQtGx_oJkzSZosO3U.jpg?width=108&amp;crop=smart&amp;auto=webp&amp;s=c9bb780af2ce6d9a1df5bbd63416430f5d9eab67', 'width': 108}, {'height': 121, 'url': 'https://external-preview.redd.it/sfsSsGU88d4tmcUui46oc36ukteQtGx_oJkzSZosO3U.jpg?width=216&amp;crop=smart&amp;auto=webp&amp;s=b85035693dbcee30e906e8fb68ba4983f37b3f5c', 'width': 216}, {'height': 180, 'url': 'https://external-preview.redd.it/sfsSsGU88d4tmcUui46oc36ukteQtGx_oJkzSZosO3U.jpg?width=320&amp;crop=smart&amp;auto=webp&amp;s=600cb2b2ed9efd22da12ee14004870155c57ed3a', 'width': 320}, {'height': 360, 'url': 'https://external-preview.redd.it/sfsSsGU88d4tmcUui46oc36ukteQtGx_oJkzSZosO3U.jpg?width=640&amp;crop=smart&amp;auto=webp&amp;s=41e95b131bb10150b92cf4ec4526735c936bfbf6', 'width': 640}], 'source': {'height': 360, 'url': 'https://external-preview.redd.it/sfsSsGU88d4tmcUui46oc36ukteQtGx_oJkzSZosO3U.jpg?auto=webp&amp;s=e4f96ca0d7b6602bec5c7ececa26e066ef3dd42f', 'width': 640}, 'variants': {}}]}",6,1610781757,1,,True,False,False,Portland,t5_2qi2i,188570,public,confidence,https://b.thumbs.redditmedia.com/7-OluPahk31oAyQq4-S473O30IhuMWbRv8QSmWledrE.jpg,78.0,140.0,Protesters use bullhorn as police try to help man in crisis,0,[],1.0,https://www.koin.com/local/multnomah-county/protesters-interfere-with-ppb-cops-helping-man-in-crisis/,https://www.koin.com/local/multnomah-county/protesters-interfere-with-ppb-cops-helping-man-in-crisis/,all_ads,6,,,,,,,,,,,,,,
[],False,BulletBear126,,[],,text,t2_9kdvfljc,False,False,[],False,False,1610780047,self.Portland,https://www.reddit.com/r/Portland/comments/kye291/damn_ive_missed_portland/,{},kye291,True,False,False,False,True,True,False,,,[],,dark,text,False,False,True,12,0,False,all_ads,/r/Portland/comments/kye291/damn_ive_missed_portland/,False,,,6,1610780058,1,"I’m proud to be a part of this beautiful city. I got back from being away for 4 months, and I had no idea how much I’ve missed this city. Man oh man is it awesome to live in Portland. I don’t think there’s anywhere else I’d be. Our air, climate, holy crap RAIN! I missed our rain so much. Man it’s good to be back.",True,False,False,Portland,t5_2qi2i,188567,public,confidence,self,,,Damn I’ve missed Portland.,0,[],1.0,https://www.reddit.com/r/Portland/comments/kye291/damn_ive_missed_portland/,,all_ads,6,,,,,,,,,,,,,,
[],False,tucktuckgoose,,[],Cully,text,t2_42gdz,False,False,[],False,False,1610779944,oregonlive.com,https://www.reddit.com/r/Portland/comments/kye1ed/oregon_reports_first_case_of_contagious/,{},kye1ed,True,False,False,False,True,False,False,,local-news,[],Local News,dark,text,False,False,True,3,0,False,all_ads,/r/Portland/comments/kye1ed/oregon_reports_first_case_of_contagious/,False,link,"{'enabled': False, 'images': [{'id': 'ODQx2njB1-RDZGb8BjJAmLCT0cZgicV5G8VY8gkk-Ik', 'resolutions': [{'height': 71, 'url': 'https://external-preview.redd.it/Gbvl5xnb51cPWidV0KpoO-G-AZtTM6L4Nd4g4trSz_4.jpg?width=108&amp;crop=smart&amp;auto=webp&amp;s=401efe3e2f40c0ab9cdecf7e61537a3ab8a1a471', 'width': 108}, {'height': 143, 'url': 'https://external-preview.redd.it/Gbvl5xnb51cPWidV0KpoO-G-AZtTM6L4Nd4g4trSz_4.jpg?width=216&amp;crop=smart&amp;auto=webp&amp;s=1d99ec5cecf870e33c55a1567642ade7d054ec08', 'width': 216}, {'height': 212, 'url': 'https://external-preview.redd.it/Gbvl5xnb51cPWidV0KpoO-G-AZtTM6L4Nd4g4trSz_4.jpg?width=320&amp;crop=smart&amp;auto=webp&amp;s=4483b7dd643c5a8390af24b1dce6711ccdc5e5a5', 'width': 320}, {'height': 424, 'url': 'https://external-preview.redd.it/Gbvl5xnb51cPWidV0KpoO-G-AZtTM6L4Nd4g4trSz_4.jpg?width=640&amp;crop=smart&amp;auto=webp&amp;s=a7a2ccbda06482ff1d17dd8a4baced5586d7c2ab', 'width': 640}, {'height': 636, 'url': 'https://external-preview.redd.it/Gbvl5xnb51cPWidV0KpoO-G-AZtTM6L4Nd4g4trSz_4.jpg?width=960&amp;crop=smart&amp;auto=webp&amp;s=545f854e5e258d5525d4665b272a9e07a034b0a6', 'width': 960}, {'height': 715, 'url': 'https://external-preview.redd.it/Gbvl5xnb51cPWidV0KpoO-G-AZtTM6L4Nd4g4trSz_4.jpg?width=1080&amp;crop=smart&amp;auto=webp&amp;s=b1bb24bb2794ccc351cb998935697a678af34d13', 'width': 1080}], 'source': {'height': 848, 'url': 'https://external-preview.redd.it/Gbvl5xnb51cPWidV0KpoO-G-AZtTM6L4Nd4g4trSz_4.jpg?auto=webp&amp;s=812bd4ee64fc5c9df121b6f78ac30da695992b02', 'width': 1280}, 'variants': {}}]}",6,1610779954,1,,True,False,False,Portland,t5_2qi2i,188567,public,confidence,https://b.thumbs.redditmedia.com/YYcZBRHula33yPGZVg6HWnobMAiOlntjlK6tz3P2b3E.jpg,92.0,140.0,"Oregon reports first case of contagious coronavirus strain from U.K., worrying health officials",0,[],1.0,https://www.oregonlive.com/coronavirus/2021/01/oregon-reports-first-case-of-contagious-coronavirus-strain-from-uk-worrying-health-officials.html,https://www.oregonlive.com/coronavirus/2021/01/oregon-reports-first-case-of-contagious-coronavirus-strain-from-uk-worrying-health-officials.html,all_ads,6,,dark,,,,,,,,,,,,
[],False,tucktuckgoose,,[],Cully,text,t2_42gdz,False,False,[],False,False,1610779792,oregonlive.com,https://www.reddit.com/r/Portland/comments/kye097/oregon_reports_first_case_of_more_contagious/,{},kye097,True,False,False,False,True,False,False,,local-news,[],Local News,dark,text,False,False,True,0,0,False,all_ads,/r/Portland/comments/kye097/oregon_reports_first_case_of_more_contagious/,False,link,"{'enabled': False, 'images': [{'id': 'ODQx2njB1-RDZGb8BjJAmLCT0cZgicV5G8VY8gkk-Ik', 'resolutions': [{'height': 71, 'url': 'https://external-preview.redd.it/Gbvl5xnb51cPWidV0KpoO-G-AZtTM6L4Nd4g4trSz_4.jpg?width=108&amp;crop=smart&amp;auto=webp&amp;s=401efe3e2f40c0ab9cdecf7e61537a3ab8a1a471', 'width': 108}, {'height': 143, 'url': 'https://external-preview.redd.it/Gbvl5xnb51cPWidV0KpoO-G-AZtTM6L4Nd4g4trSz_4.jpg?width=216&amp;crop=smart&amp;auto=webp&amp;s=1d99ec5cecf870e33c55a1567642ade7d054ec08', 'width': 216}, {'height': 212, 'url': 'https://external-preview.redd.it/Gbvl5xnb51cPWidV0KpoO-G-AZtTM6L4Nd4g4trSz_4.jpg?width=320&amp;crop=smart&amp;auto=webp&amp;s=4483b7dd643c5a8390af24b1dce6711ccdc5e5a5', 'width': 320}, {'height': 424, 'url': 'https://external-preview.redd.it/Gbvl5xnb51cPWidV0KpoO-G-AZtTM6L4Nd4g4trSz_4.jpg?width=640&amp;crop=smart&amp;auto=webp&amp;s=a7a2ccbda06482ff1d17dd8a4baced5586d7c2ab', 'width': 640}, {'height': 636, 'url': 'https://external-preview.redd.it/Gbvl5xnb51cPWidV0KpoO-G-AZtTM6L4Nd4g4trSz_4.jpg?width=960&amp;crop=smart&amp;auto=webp&amp;s=545f854e5e258d5525d4665b272a9e07a034b0a6', 'width': 960}, {'height': 715, 'url': 'https://external-preview.redd.it/Gbvl5xnb51cPWidV0KpoO-G-AZtTM6L4Nd4g4trSz_4.jpg?width=1080&amp;crop=smart&amp;auto=webp&amp;s=b1bb24bb2794ccc351cb998935697a678af34d13', 'width': 1080}], 'source': {'height': 848, 'url': 'https://external-preview.redd.it/Gbvl5xnb51cPWidV0KpoO-G-AZtTM6L4Nd4g4trSz_4.jpg?auto=webp&amp;s=812bd4ee64fc5c9df121b6f78ac30da695992b02', 'width': 1280}, 'variants': {}}]}",6,1610779803,1,,True,False,False,Portland,t5_2qi2i,188567,public,confidence,https://b.thumbs.redditmedia.com/YYcZBRHula33yPGZVg6HWnobMAiOlntjlK6tz3P2b3E.jpg,92.0,140.0,Oregon reports first case of more contagious coronavirus strain from U.K. (found in Multnomah County),0,[],1.0,https://www.oregonlive.com/coronavirus/2021/01/oregon-reports-first-case-of-contagious-coronavirus-strain-from-uk-worrying-health-officials.html,https://www.oregonlive.com/coronavirus/2021/01/oregon-reports-first-case-of-contagious-coronavirus-strain-from-uk-worrying-health-officials.html,all_ads,6,,dark,,,,,,,,,,,,
[],False,1ToeIn,,[],,text,t2_63xccjv2,False,False,[],False,False,1610777879,i.redd.it,https://www.reddit.com/r/Portland/comments/kydknb/graffiti_wisdom_birite_parking_lot/,{},kydknb,True,False,False,True,True,False,False,,photo,[],Photo,dark,text,False,False,True,15,0,False,all_ads,/r/Portland/comments/kydknb/graffiti_wisdom_birite_parking_lot/,False,image,"{'enabled': True, 'images': [{'id': 'ly9djmgPKt7V8JDyixeeR5at8zQ0i_7BvTBJVVvfrzc', 'resolutions': [{'height': 144, 'url': 'https://preview.redd.it/0kgzv7n30nb61.jpg?width=108&amp;crop=smart&amp;auto=webp&amp;s=86b7fb560066ca41320d511f6fd3c3bcd98e40d0', 'width': 108}, {'height': 288, 'url': 'https://preview.redd.it/0kgzv7n30nb61.jpg?width=216&amp;crop=smart&amp;auto=webp&amp;s=5043c5078e909e24a7d14dc1cb300d1b61879b23', 'width': 216}, {'height': 426, 'url': 'https://preview.redd.it/0kgzv7n30nb61.jpg?width=320&amp;crop=smart&amp;auto=webp&amp;s=25103fa15ea204d1b552c5644131a527cff9fade', 'width': 320}, {'height': 853, 'url': 'https://preview.redd.it/0kgzv7n30nb61.jpg?width=640&amp;crop=smart&amp;auto=webp&amp;s=a231e3b72624beb7921578bcb04ce9685250949e', 'width': 640}, {'height': 1280, 'url': 'https://preview.redd.it/0kgzv7n30nb61.jpg?width=960&amp;crop=smart&amp;auto=webp&amp;s=08f4ab0a91e50cbc15cdd0c9959347a7790dbe3c', 'width': 960}, {'height': 1440, 'url': 'https://preview.redd.it/0kgzv7n30nb61.jpg?width=1080&amp;crop=smart&amp;auto=webp&amp;s=0d23d97318127890b97bc505f1e10580e61b0969', 'width': 1080}], 'source': {'height': 4032, 'url': 'https://preview.redd.it/0kgzv7n30nb61.jpg?auto=webp&amp;s=7016d9f3d7d728184acd2fa372edc716aec227fe', 'width': 3024}, 'variants': {}}]}",6,1610777890,1,,True,False,False,Portland,t5_2qi2i,188562,public,confidence,https://a.thumbs.redditmedia.com/WwChOdt_YpUk9v0aCvb9haEwiKngBUXMyvoXvmoL-88.jpg,140.0,140.0,Graffiti wisdom: Bi-Rite parking lot,0,[],1.0,https://i.redd.it/0kgzv7n30nb61.jpg,https://i.redd.it/0kgzv7n30nb61.jpg,all_ads,6,,,,,,,,,,,,,,
[],False,isaiah5417,,[],,text,t2_aa2tigl,False,False,[],False,False,1610777555,i.redd.it,https://www.reddit.com/r/Portland/comments/kydhy5/pick_up_the_latesr_copy_of_street_roots_if_you/,{},kydhy5,True,False,False,True,True,False,False,,photo,[],Photo,dark,text,False,False,True,0,0,False,all_ads,/r/Portland/comments/kydhy5/pick_up_the_latesr_copy_of_street_roots_if_you/,False,image,"{'enabled': True, 'images': [{'id': 'YRe6xPw4e_ApfW3-NcFSteXrXgSEdCVsVCFOTYxHeOM', 'resolutions': [{'height': 107, 'url': 'https://preview.redd.it/dwcd8n85zmb61.png?width=108&amp;crop=smart&amp;auto=webp&amp;s=1a3cdf355a288be455ddc82f83d8efc12bb0452b', 'width': 108}, {'height': 214, 'url': 'https://preview.redd.it/dwcd8n85zmb61.png?width=216&amp;crop=smart&amp;auto=webp&amp;s=da12822184b751be1005c59b97b82eb6b98bb545', 'width': 216}, {'height': 318, 'url': 'https://preview.redd.it/dwcd8n85zmb61.png?width=320&amp;crop=smart&amp;auto=webp&amp;s=5314026cf6a5f4c3d2a4cae213e01edd73c2f8ad', 'width': 320}, {'height': 636, 'url': 'https://preview.redd.it/dwcd8n85zmb61.png?width=640&amp;crop=smart&amp;auto=webp&amp;s=472ff2fd7b6dbd9f7806096554ff66b4450b9d75', 'width': 640}], 'source': {'height': 698, 'url': 'https://preview.redd.it/dwcd8n85zmb61.png?auto=webp&amp;s=44e66a6b5718e842fa2597bcb77ae24c7cf6c535', 'width': 702}, 'variants': {}}]}",6,1610777566,1,,True,False,False,Portland,t5_2qi2i,188561,public,confidence,https://b.thumbs.redditmedia.com/-YlQ6K9QIvbdfHyPAnXyyOPK2XtHx3nEabVUhIIrPAw.jpg,139.0,140.0,Pick up the latesr copy of Street Roots if you can! Someone near and dear to my heart is on the cover!,0,[],1.0,https://i.redd.it/dwcd8n85zmb61.png,https://i.redd.it/dwcd8n85zmb61.png,all_ads,6,,,,,,,,,,,,,,
[],False,PeePee51DooDoo,,[],,text,t2_1954zb51,False,False,[],False,False,1610775209,i.redd.it,https://www.reddit.com/r/Portland/comments/kycxff/tesla_seen_your_fucken_cones/,{},kycxff,True,False,False,True,True,False,False,,photo,[],Photo,dark,text,False,False,True,0,0,False,all_ads,/r/Portland/comments/kycxff/tesla_seen_your_fucken_cones/,False,image,"{'enabled': True, 'images': [{'id': 'lSP4jdmSHhCm04rSnR2djZ2grR47pPid39EjssnywVU', 'resolutions': [{'height': 144, 'url': 'https://preview.redd.it/s38jmub6smb61.jpg?width=108&amp;crop=smart&amp;auto=webp&amp;s=b6da87edab9796298cf00baaef6c4d63c4f1e172', 'width': 108}, {'height': 288, 'url': 'https://preview.redd.it/s38jmub6smb61.jpg?width=216&amp;crop=smart&amp;auto=webp&amp;s=f029b11df856a61d64b15f0c4dd1653550c71fdd', 'width': 216}, {'height': 426, 'url': 'https://preview.redd.it/s38jmub6smb61.jpg?width=320&amp;crop=smart&amp;auto=webp&amp;s=3868590ed07f5d2758df1ddec3efe6317171165c', 'width': 320}, {'height': 853, 'url': 'https://preview.redd.it/s38jmub6smb61.jpg?width=640&amp;crop=smart&amp;auto=webp&amp;s=d5e5f6f0965ac5cd516318ba64ddfe15b46c1ebc', 'width': 640}, {'height': 1280, 'url': 'https://preview.redd.it/s38jmub6smb61.jpg?width=960&amp;crop=smart&amp;auto=webp&amp;s=dcc0d0d10ac3f30e8a7099842c5701e899a6a478', 'width': 960}, {'height': 1440, 'url': 'https://preview.redd.it/s38jmub6smb61.jpg?width=1080&amp;crop=smart&amp;auto=webp&amp;s=5106e1d9c599d7a0385b520ea0facc343242470f', 'width': 1080}], 'source': {'height': 1600, 'url': 'https://preview.redd.it/s38jmub6smb61.jpg?auto=webp&amp;s=74facf04f8526444627696c920ec120a697cbba7', 'width': 1200}, 'variants': {}}]}",6,1610775224,1,,True,False,False,Portland,t5_2qi2i,188559,public,confidence,https://b.thumbs.redditmedia.com/P_q5yKxGS7gXor7tB_rWYZk_5Ep0y2b3n7We5QV0SNY.jpg,140.0,140.0,TESLA SEEN YOUR FUCKEN CONES,0,[],1.0,https://i.redd.it/s38jmub6smb61.jpg,https://i.redd.it/s38jmub6smb61.jpg,all_ads,6,,,,,,,,,,,,,,
[],False,anassakata,,[],SW,text,t2_4nifz,False,True,[],False,False,1610771591,self.Portland,https://www.reddit.com/r/Portland/comments/kyc018/daily_mental_health_checkin_thread/,{},kyc018,True,False,False,False,True,True,False,,,[],,dark,text,False,False,True,45,0,False,all_ads,/r/Portland/comments/kyc018/daily_mental_health_checkin_thread/,False,self,"{'enabled': True, 'images': [{'id': '50mExhN7Hf0-mWJHhVXenk9gIXIO6astdfvVMDPwKJo', 'resolutions': [{'height': 70, 'url': 'https://external-preview.redd.it/eKiEvXJqkf0UUoIPvm5iHwL_BhQ3sNFLhXqFz9NopT4.gif?width=108&amp;crop=smart&amp;format=png8&amp;s=b1b8d260287033d5c4df593699dc15cca8c7b244', 'width': 108}, {'height': 140, 'url': 'https://external-preview.redd.it/eKiEvXJqkf0UUoIPvm5iHwL_BhQ3sNFLhXqFz9NopT4.gif?width=216&amp;crop=smart&amp;format=png8&amp;s=7eb08fa57ed3a68162e699d5bc4b6a50fe4fb9c1', 'width': 216}, {'height': 208, 'url': 'https://external-preview.redd.it/eKiEvXJqkf0UUoIPvm5iHwL_BhQ3sNFLhXqFz9NopT4.gif?width=320&amp;crop=smart&amp;format=png8&amp;s=e21519096033de3a325a34c492efe28dc25a5d6c', 'width': 320}], 'source': {'height': 325, 'url': 'https://external-preview.redd.it/eKiEvXJqkf0UUoIPvm5iHwL_BhQ3sNFLhXqFz9NopT4.gif?format=png8&amp;s=f628aa9fe6c2297be9c29a409b149b5c477bf706', 'width': 500}, 'variants': {'gif': {'resolutions': [{'height': 70, 'url': 'https://external-preview.redd.it/eKiEvXJqkf0UUoIPvm5iHwL_BhQ3sNFLhXqFz9NopT4.gif?width=108&amp;crop=smart&amp;s=d794c63f89298be8a2b1bddc9cb89ea2eff46899', 'width': 108}, {'height': 140, 'url': 'https://external-preview.redd.it/eKiEvXJqkf0UUoIPvm5iHwL_BhQ3sNFLhXqFz9NopT4.gif?width=216&amp;crop=smart&amp;s=3b8181662968e0d7146a83eda8ce1b121329501b', 'width': 216}, {'height': 208, 'url': 'https://external-preview.redd.it/eKiEvXJqkf0UUoIPvm5iHwL_BhQ3sNFLhXqFz9NopT4.gif?width=320&amp;crop=smart&amp;s=7c76f231cbd8c53cc21baa5f78bcf31b19d4dc56', 'width': 320}], 'source': {'height': 325, 'url': 'https://external-preview.redd.it/eKiEvXJqkf0UUoIPvm5iHwL_BhQ3sNFLhXqFz9NopT4.gif?s=928bf3b97b37acb643f3361b1637224e8f2b9545', 'width': 500}}, 'mp4': {'resolutions': [{'height': 70, 'url': 'https://external-preview.redd.it/eKiEvXJqkf0UUoIPvm5iHwL_BhQ3sNFLhXqFz9NopT4.gif?width=108&amp;format=mp4&amp;s=c7237d0d7826d0a60298f75ca4581634d9d67062', 'width': 108}, {'height': 140, 'url': 'https://external-preview.redd.it/eKiEvXJqkf0UUoIPvm5iHwL_BhQ3sNFLhXqFz9NopT4.gif?width=216&amp;format=mp4&amp;s=c7eafc33467cebfa99aa146ea8174dda07ed7e29', 'width': 216}, {'height': 208, 'url': 'https://external-preview.redd.it/eKiEvXJqkf0UUoIPvm5iHwL_BhQ3sNFLhXqFz9NopT4.gif?width=320&amp;format=mp4&amp;s=5a1e15585eed350f9161e2f19eef667fead9ffba', 'width': 320}], 'source': {'height': 325, 'url': 'https://external-preview.redd.it/eKiEvXJqkf0UUoIPvm5iHwL_BhQ3sNFLhXqFz9NopT4.gif?format=mp4&amp;s=e665aee5382f7acb0a5c7bef9160d3ae840a836e', 'width': 500}}}}]}",6,1610771601,1,"Good evening! This thread is for expressing how you feel - stuff that's making life particularly hard right at this incredibly inconvenient moment. It's okay if you're furious, it's okay if you're sad, and it's even okay if you're just okay! If you have done anything lately that's helped your mood, please share that as well.

**To any users who have the emotional bandwidth to do so, please consider leaving a validating comment on another comment, especially one that hasn't gotten interaction, and [""that's rough, buddy""](https://i.imgur.com/X5tD7M5.gif) counts!**

This is a place for ""I"" statements, this is a place for things to be about you if you've been worried for other people, this is a place where you can get validation for the feelings you may be shoving down because 'other people have it worse.' This is a place for you.

I am hoping that rather than all of us shouting into the void, sharing it with some real Portlanders, or maybe bots, will help the commiserating feel better. This is an experiment, and it's ""daily"" so long as people find it helpful (the ~~beatings~~ mental health threads will continue until morale improves!).

*Note: thanks to all who have given reddit gold and other awards - if you're using actual money to buy those, please consider donating those funds to your local food bank or mutual aid food distribution project instead!*",True,False,False,Portland,t5_2qi2i,188546,public,confidence,self,,,Daily Mental Health Check-In Thread,0,[],1.0,https://www.reddit.com/r/Portland/comments/kyc018/daily_mental_health_checkin_thread/,,all_ads,6,,dark,,,,,,,,,,,,
[],False,vr_dream,,[],,text,t2_3smfpcb6,False,False,[],False,False,1610771014,self.Portland,https://www.reddit.com/r/Portland/comments/kybuno/soo_what_happened_to_the_red_house_situation/,{},kybuno,True,False,False,False,True,True,False,,,[],,dark,text,False,False,True,87,0,False,all_ads,/r/Portland/comments/kybuno/soo_what_happened_to_the_red_house_situation/,False,,,6,1610771025,1,,True,False,False,Portland,t5_2qi2i,188544,public,confidence,self,,,Soo... What happened to the Red House situation?,0,[],1.0,https://www.reddit.com/r/Portland/comments/kybuno/soo_what_happened_to_the_red_house_situation/,,all_ads,6,,,,,,,,,,,,,,
[],False,hashymeow13,,[],,text,t2_50ofvbj3,False,False,[],False,False,1610770947,self.Portland,https://www.reddit.com/r/Portland/comments/kybtyk/i_need_help/,{},kybtyk,True,False,False,False,True,True,False,,,[],,dark,text,False,False,False,54,0,False,all_ads,/r/Portland/comments/kybtyk/i_need_help/,False,,,6,1610770959,1,"Hi! 

My name is Amanda! 
I just got a job as a Vet Receptionist and I am super excited as it is another step towards my career!

I, unfortunately, have not been working because its been hard to find a job, I was denied unemployment, and now am out of money!

I was curious if anyone has any xs/s scrubs or “business casual” clothes I could pick up!
I only have jeans or leggings because I’ve always been a dog handler! I cannot wear these to work!
I was not prepared for this! Lol

I also need a pair of work shoes! I have an old old pair of running shoes that should work for a bit but they are SO gross and I’m trying to look TOO unprepared!

Has anyone had a delay in getting their stimulus? I checked online and it said it was sent but I have yet to receive mine!

Thanks for your help! 

Much love,

Amanda",True,False,False,Portland,t5_2qi2i,188544,public,confidence,self,,,I need help!,0,[],1.0,https://www.reddit.com/r/Portland/comments/kybtyk/i_need_help/,,all_ads,6,,,,,,,,,,,,,,
