author,author_created_utc,author_flair_css_class,author_flair_text,author_fullname,contest_mode,created_utc,domain,edited,full_link,gilded,id,is_self,locked,media_embed,num_comments,over_18,permalink,retrieved_on,score,secure_media_embed,selftext,spoiler,stickied,subreddit,subreddit_id,thumbnail,title,url,distinguished,link_flair_css_class,link_flair_text,post_hint,preview,banned_by,media,secure_media
hallie_grace,1435338621.0,,,t2_ocxdv,False,1477925755,self.Portland,1477928918.0,https://www.reddit.com/r/Portland/comments/5acoaq/4_hours_to_spend_in_downtown_portland/,0,5acoaq,True,False,{},12,False,/r/Portland/comments/5acoaq/4_hours_to_spend_in_downtown_portland/,1480292904,0,{},"Including lunch. Happening today. Any ideas?

Vegetarian food gets bonus points!

Edit - forgot to mention that my friend's toddler daughter will be in tow...",False,False,Portland,t5_2qi2i,self,4 hours to spend in downtown Portland,https://www.reddit.com/r/Portland/comments/5acoaq/4_hours_to_spend_in_downtown_portland/,,,,,,,,
AutoModerator,1325741068.0,,24 Hour Church of Elvis,t2_6l4z3,False,1477922743,self.Portland,,https://www.reddit.com/r/Portland/comments/5acebq/dear_portland_october_31_2016_weekly_rant_thread/,0,5acebq,True,False,{},183,False,/r/Portland/comments/5acebq/dear_portland_october_31_2016_weekly_rant_thread/,1480292737,28,{},"SNARK SNARK SNARK. What bee is under your bonnet today?

Caps on, inhibitions off, but if you break our rules so help me I'll delete my account.  And yours.
",False,False,Portland,t5_2qi2i,self,"DEAR PORTLAND: October 31, 2016 WEEKLY RANT THREAD",https://www.reddit.com/r/Portland/comments/5acebq/dear_portland_october_31_2016_weekly_rant_thread/,moderator,custom,Weekly Rant,,,,,
[deleted],,,,,False,1477922678,m.imgur.com,,https://www.reddit.com/r/Portland/comments/5ace3t/70_chance_of_snow_today/,0,5ace3t,False,False,{},37,False,/r/Portland/comments/5ace3t/70_chance_of_snow_today/,1480292734,57,{},[deleted],False,False,Portland,t5_2qi2i,default,70% chance of snow today?,http://m.imgur.com/QmzUfqA,,photo,Photo,,,,,
blackbookrecords,1356107571.0,,,t2_9yodz,False,1477920821,self.Portland,,https://www.reddit.com/r/Portland/comments/5ac8gt/benjamin_franklin_freeman_mid_2000s_band/,0,5ac8gt,True,False,{},7,False,/r/Portland/comments/5ac8gt/benjamin_franklin_freeman_mid_2000s_band/,1480292639,0,{},"Anyone remember / used to go see / a former part of this band?  Found out about them through a former bandmate of my own out here in Buffalo, NY way back in 2005 or so, as he found them on CDBaby.  I find myself going back to their full length, killyourselfishness, quite often still, but it was always hard to find info on the band back then, as they maintained a very low and mysterious online presence.  At this point, time is fading that history away even more, so i'm hoping someone here has some knowledge they can share.  Killyourselfishness is a VERY competent rock / glam record, and the song ""goldmine"" is appropriately titled, as it's absolutely brilliant.  (https://www.youtube.com/watch?v=-ud888PtD08).  It's the kind of song you put on repeat for a while.

Any info on post-BFF projects, or other life endeavors, would be greatly appreciated.  Thanks.",False,False,Portland,t5_2qi2i,self,Benjamin Franklin Freeman - mid 2000s band,https://www.reddit.com/r/Portland/comments/5ac8gt/benjamin_franklin_freeman_mid_2000s_band/,,,,self,"{'images': [{'id': '4y46Zr2waNmb3E36fyMD86o_s3yOonNu4k0mp1G15bQ', 'resolutions': [{'height': 81, 'url': 'https://i.redditmedia.com/sxwXTeqdLPx-HVfNy56c2FZ0pEGPfrdgG9hRRSeQquM.jpg?fit=crop&amp;crop=faces%2Centropy&amp;arh=2&amp;w=108&amp;s=9cca2e7ca241c66411c57d4fc459643a', 'width': 108}, {'height': 162, 'url': 'https://i.redditmedia.com/sxwXTeqdLPx-HVfNy56c2FZ0pEGPfrdgG9hRRSeQquM.jpg?fit=crop&amp;crop=faces%2Centropy&amp;arh=2&amp;w=216&amp;s=280b7e5d20582e24de3baf1a5d5653b0', 'width': 216}, {'height': 240, 'url': 'https://i.redditmedia.com/sxwXTeqdLPx-HVfNy56c2FZ0pEGPfrdgG9hRRSeQquM.jpg?fit=crop&amp;crop=faces%2Centropy&amp;arh=2&amp;w=320&amp;s=cfba01fc6225dd3f9b496f526de31893', 'width': 320}], 'source': {'height': 360, 'url': 'https://i.redditmedia.com/sxwXTeqdLPx-HVfNy56c2FZ0pEGPfrdgG9hRRSeQquM.jpg?s=0b3f556c07e53a1bcbd0a0d1620bc711', 'width': 480}, 'variants': {}}]}",,,
bikepdx,1455905718.0,,,t2_vaf6t,False,1477918519,self.Portland,,https://www.reddit.com/r/Portland/comments/5ac1we/bought_a_car_in_wa_need_to_register_in_or/,0,5ac1we,True,False,{},10,False,/r/Portland/comments/5ac1we/bought_a_car_in_wa_need_to_register_in_or/,1480292531,0,{},"Hi all,
I bought a car in WA, financed it through the dealership, then drove it back to OR. I did not pay any DMV fees with the dealer since they are out-of-state. I am now reading that I have to send the dealership in WA the title &amp; registration paperwork along with a check for all the title, registration, and plate fees and then I have to get them to mail the paperwork, my check, AND the title to the OR DMV. Does this seem right? I would think that they would hang on to the title until I pay it off and not mail it in. Am I misunderstanding the rules? Here's what I am reading:

""If a security interest holder (bank, finance company, etc.) is holding the vehicle title, send them all the completed documents and fees with the “To Security Interest Holder” letter (Form 735-6603L). The letter asks the security interest holder to send the outstanding title, completed documents and fees to Oregon DMV, 1905 Lana Avenue NE, Salem OR 97314. All documents and fees must be returned TOGETHER. If you mail your application to DMV without the title, it will be returned to you unprocessed.""",False,False,Portland,t5_2qi2i,self,"Bought a car in WA, need to register in OR",https://www.reddit.com/r/Portland/comments/5ac1we/bought_a_car_in_wa_need_to_register_in_or/,,,,,,,,
[deleted],,,,,False,1477915843,msn.com,,https://www.reddit.com/r/Portland/comments/5abutt/best_cupcakes_in_oregon_cupcake_jones_portland/,0,5abutt,False,False,{},4,False,/r/Portland/comments/5abutt/best_cupcakes_in_oregon_cupcake_jones_portland/,1480292414,0,{},[deleted],False,False,Portland,t5_2qi2i,default,"Best Cupcakes in Oregon? Cupcake Jones, Portland.",http://www.msn.com/en-us/foodanddrink/restaurantsandnews/the-best-cupcakes-in-every-state/ss-AAiUTXR?ocid=spartanntp#image=37,,,,,,,,
Qabt_motorbike_lic,1477902992.0,,,t2_12huid,False,1477903172,self.Portland,1477970659.0,https://www.reddit.com/r/Portland/comments/5ab7bd/in_portland_just_for_a_week_or_two_around/,0,5ab7bd,True,False,{},16,False,/r/Portland/comments/5ab7bd/in_portland_just_for_a_week_or_two_around/,1480292018,0,{},"Went through the Team Oregon website and the DMV website and I am struggling to see whether it is a hard requirement to get a ""motorcycle endorsement"" from the Team Oregon beginner's course or not. I have 6 years experience driving various size motorcycles in many countries. Team Oregon course says it is for those just starting out.

Will it be possible just to undertake the test at the DMV without doing Team Oregon's beginner course? How long until I can receive the license after undertaking the course?

Thanks for responses!

EDIT: Many thanks to all for your responses! Very helpful and now I know what to do. All the best.",False,False,Portland,t5_2qi2i,self,In Portland just for a week or two around Christmas - need to get international motorcycle license (US citizen),https://www.reddit.com/r/Portland/comments/5ab7bd/in_portland_just_for_a_week_or_two_around/,,,,,,,,
JarekBloodDragon,1329801766.0,,,t2_6z7th,False,1477896663,self.Portland,1477948729.0,https://www.reddit.com/r/Portland/comments/5aawsw/any_one_know_whats_going_on_in_se/,0,5aawsw,True,False,{},13,False,/r/Portland/comments/5aawsw/any_one_know_whats_going_on_in_se/,1480291844,0,{},"10 or so cops have gone past my house in the last 15 mins and now cops have locked off my street. Around the 82nd foster area.

Edit: Holy shit there are some idiotic people. 82nd's not the ghetto. No, it's not usual to have 10-20 police cars drive by in a group around 82nd. It's even rarer to have them block off streets. The worst problem you usually get are bums. You're at no risk walking around 82nd. You have no fucking clue what a real ghetto is.",False,False,Portland,t5_2qi2i,self,Any one know what's going on in SE?,https://www.reddit.com/r/Portland/comments/5aawsw/any_one_know_whats_going_on_in_se/,,,,,,,,
[deleted],,,,,False,1477896610,self.Portland,,https://www.reddit.com/r/Portland/comments/5aawpx/any_parties/,0,5aawpx,True,False,{},4,False,/r/Portland/comments/5aawpx/any_parties/,1480291843,0,{},[deleted],False,False,Portland,t5_2qi2i,default,Any parties?,https://www.reddit.com/r/Portland/comments/5aawpx/any_parties/,,,,,,,,
[deleted],,,,,False,1477893387,self.Portland,,https://www.reddit.com/r/Portland/comments/5aaqmp/we_found_the_person_who_owns_the_passport/,0,5aaqmp,True,False,{},0,False,/r/Portland/comments/5aaqmp/we_found_the_person_who_owns_the_passport/,1480291742,1,{},[deleted],False,False,Portland,t5_2qi2i,default,We found the person who owns the passport,https://www.reddit.com/r/Portland/comments/5aaqmp/we_found_the_person_who_owns_the_passport/,,,,,,,,
[deleted],,,,,False,1477891929,self.Portland,,https://www.reddit.com/r/Portland/comments/5aanvx/visiting_portland_4_days_tips/,0,5aanvx,True,False,{},1,False,/r/Portland/comments/5aanvx/visiting_portland_4_days_tips/,1480291696,1,{},[removed],False,False,Portland,t5_2qi2i,default,Visiting Portland 4 days - tips?,https://www.reddit.com/r/Portland/comments/5aanvx/visiting_portland_4_days_tips/,,,,,,moderators,,
octopus_pi,1409268960.0,,Parkrose Heights,t2_i3jlt,False,1477889679,self.Portland,,https://www.reddit.com/r/Portland/comments/5aaj27/i_just_got_a_no_on_97_ad_while_trying_to_watch/,0,5aaj27,True,False,{},13,False,/r/Portland/comments/5aaj27/i_just_got_a_no_on_97_ad_while_trying_to_watch/,1480291619,0,{},WTF? That alone is reason enough to vote Yes. Invading my stoney Halloween couch sanctum with political shit. Desperate much?,False,False,Portland,t5_2qi2i,self,"I just got a ""No on 97"" ad while trying to watch Hellraiser II on Crackle",https://www.reddit.com/r/Portland/comments/5aaj27/i_just_got_a_no_on_97_ad_while_trying_to_watch/,,,,,,,,
drewlb,1188970993.0,,,t2_2lw6e,False,1477889073,portlandmercury.com,,https://www.reddit.com/r/Portland/comments/5aahpb/headdressrocking_good_samaritan_was_just_trying/,0,5aahpb,False,False,{},3,False,/r/Portland/comments/5aahpb/headdressrocking_good_samaritan_was_just_trying/,1480291596,16,{},,False,False,Portland,t5_2qi2i,http://b.thumbs.redditmedia.com/woXM8yXBbdM8X3i5Ne853aIFkO8wbz9svQLfqFe3V8Q.jpg,Headdress-Rocking Good Samaritan Was Just Trying to Get Some Weed When He Disarmed Gunman,http://www.portlandmercury.com/blogtown/2016/10/26/18656694/headdress-rocking-good-samaritan-was-just-trying-to-get-some-weed-when-he-disarmed-gunman,,local-news,Local News,link,"{'images': [{'id': 'BnxKJjD7TiGSM3HEaBKel4tPL4N9TMNNSDnXreIsKF8', 'resolutions': [{'height': 59, 'url': 'https://i.redditmedia.com/fbBfPu3YFXMGHgTrqI84jSJ7Nx0hKbMHotX2_Fx0QgE.jpg?fit=crop&amp;crop=faces%2Centropy&amp;arh=2&amp;w=108&amp;s=6dcf04b1dfe452e247a03f81f4c05d02', 'width': 108}, {'height': 119, 'url': 'https://i.redditmedia.com/fbBfPu3YFXMGHgTrqI84jSJ7Nx0hKbMHotX2_Fx0QgE.jpg?fit=crop&amp;crop=faces%2Centropy&amp;arh=2&amp;w=216&amp;s=840c00a2facf7503bc502839787f76b4', 'width': 216}, {'height': 177, 'url': 'https://i.redditmedia.com/fbBfPu3YFXMGHgTrqI84jSJ7Nx0hKbMHotX2_Fx0QgE.jpg?fit=crop&amp;crop=faces%2Centropy&amp;arh=2&amp;w=320&amp;s=f48348427f1a73f6d677ad915a44cfc9', 'width': 320}], 'source': {'height': 207, 'url': 'https://i.redditmedia.com/fbBfPu3YFXMGHgTrqI84jSJ7Nx0hKbMHotX2_Fx0QgE.jpg?s=d77d09443c68ae5b82a92b1b949acd3b', 'width': 374}, 'variants': {}}]}",,,
Daphins,,,,,False,1477876530,self.Portland,,https://www.reddit.com/r/Portland/comments/5a9kr1/bernie_sanders_for_east_soil_water_director_zone_1/,0,5a9kr1,True,False,{},8,False,/r/Portland/comments/5a9kr1/bernie_sanders_for_east_soil_water_director_zone_1/,1480291059,0,{},"Let's make this happen. Oregon needs more Bernie.

#WriteInBernieEastSoil&amp;Water",False,False,Portland,t5_2qi2i,self,"Bernie Sanders for East Soil &amp; Water director, zone 1",https://www.reddit.com/r/Portland/comments/5a9kr1/bernie_sanders_for_east_soil_water_director_zone_1/,,,,,,,,
pushkill,1256971590.0,,,t2_3p9ib,False,1477874140,wikileaks.org,,https://www.reddit.com/r/Portland/comments/5a9dvz/earl_blumenauer_pops_up_as_a_topic_of/,0,5a9dvz,False,False,{},19,False,/r/Portland/comments/5a9dvz/earl_blumenauer_pops_up_as_a_topic_of/,1480290948,23,{},,False,False,Portland,t5_2qi2i,http://a.thumbs.redditmedia.com/64HWA_gAxC0Fz_Dhotv-SWpFpDIXL0aoF91MKO5YuV4.jpg,Earl Blumenauer pops up as a topic of conversation in the Podesta WikiLeaks leak,https://wikileaks.org/podesta-emails/emailid/36427,,,,link,"{'images': [{'id': 'ZSvKPc5W_YT5RcZFLoCdwwhfS1-d-3QttZV5rjQTHXc', 'resolutions': [{'height': 64, 'url': 'https://i.redditmedia.com/06zPgVabQf2UqcORH0xQ9ko923BXN5AS2T5jsbmwKu8.jpg?fit=crop&amp;crop=faces%2Centropy&amp;arh=2&amp;w=108&amp;s=85d0dfbc7f90c2c608d304bea3f50930', 'width': 108}, {'height': 129, 'url': 'https://i.redditmedia.com/06zPgVabQf2UqcORH0xQ9ko923BXN5AS2T5jsbmwKu8.jpg?fit=crop&amp;crop=faces%2Centropy&amp;arh=2&amp;w=216&amp;s=20aaf935381cce1da264e087b7a9d7e9', 'width': 216}], 'source': {'height': 180, 'url': 'https://i.redditmedia.com/06zPgVabQf2UqcORH0xQ9ko923BXN5AS2T5jsbmwKu8.jpg?s=7bb1021b7ed97cf5c667687b0a0ab99a', 'width': 300}, 'variants': {}}]}",,,
Swisst,1283402126.0,,,t2_4b12c,False,1477870362,self.Portland,1477873262.0,https://www.reddit.com/r/Portland/comments/5a92da/whats_to_be_done_about_comcast/,0,5a92da,True,False,{},2,False,/r/Portland/comments/5a92da/whats_to_be_done_about_comcast/,1480290754,2,{},[removed],False,False,Portland,t5_2qi2i,default,What's to be done about Comcast?,https://www.reddit.com/r/Portland/comments/5a92da/whats_to_be_done_about_comcast/,,,,,,,,
egeeirl,1439568741.0,,,t2_pjylj,False,1477867588,imgur.com,,https://www.reddit.com/r/Portland/comments/5a8tu3/if_youve_ever_considered_moving_to_or_visiting/,0,5a8tu3,False,False,"{'content': '&lt;iframe class=""embedly-embed"" src=""//cdn.embedly.com/widgets/media.html?src=%2F%2Fimgur.com%2Fa%2FDXUf6%2Fembed&amp;url=http%3A%2F%2Fimgur.com%2Fa%2FDXUf6&amp;image=http%3A%2F%2Fi.imgur.com%2FV2HIN9v.jpg%3Ffb&amp;key=2aa3c4d5f3de4f5b9120b660ad850dc9&amp;type=text%2Fhtml&amp;schema=imgur"" width=""550"" height=""550"" scrolling=""no"" frameborder=""0"" allowfullscreen&gt;&lt;/iframe&gt;', 'height': 550, 'scrolling': False, 'width': 550}",33,False,/r/Portland/comments/5a8tu3/if_youve_ever_considered_moving_to_or_visiting/,1480290613,1,"{'content': '&lt;iframe class=""embedly-embed"" src=""https://cdn.embedly.com/widgets/media.html?src=%2F%2Fimgur.com%2Fa%2FDXUf6%2Fembed&amp;url=http%3A%2F%2Fimgur.com%2Fa%2FDXUf6&amp;image=http%3A%2F%2Fi.imgur.com%2FV2HIN9v.jpg%3Ffb&amp;key=2aa3c4d5f3de4f5b9120b660ad850dc9&amp;type=text%2Fhtml&amp;schema=imgur"" width=""550"" height=""550"" scrolling=""no"" frameborder=""0"" allowfullscreen&gt;&lt;/iframe&gt;', 'height': 550, 'scrolling': False, 'width': 550}",,False,False,Portland,t5_2qi2i,http://b.thumbs.redditmedia.com/gA-NlZwpXEsHWLKEJLIsN3DnOfYIQZmMtFgDcAGfIWI.jpg,If you've ever considered moving to or visiting Sandy..,http://imgur.com/a/DXUf6,,photo,Photo,link,"{'images': [{'id': 'WeaB-l5fHcK1FEIqTgbWty3fqt5BwW42zOjIhpKrGpA', 'resolutions': [{'height': 89, 'url': 'https://i.redditmedia.com/OprgpULqpsvaHxn9GkPOYyEAaKnlLQ_xZsaTuq9MNCc.jpg?fit=crop&amp;crop=faces%2Centropy&amp;arh=2&amp;w=108&amp;s=59648b2018e1852406e4849f990e2c13', 'width': 108}, {'height': 179, 'url': 'https://i.redditmedia.com/OprgpULqpsvaHxn9GkPOYyEAaKnlLQ_xZsaTuq9MNCc.jpg?fit=crop&amp;crop=faces%2Centropy&amp;arh=2&amp;w=216&amp;s=25733488e00a38d2ca51fe9a20772b51', 'width': 216}, {'height': 265, 'url': 'https://i.redditmedia.com/OprgpULqpsvaHxn9GkPOYyEAaKnlLQ_xZsaTuq9MNCc.jpg?fit=crop&amp;crop=faces%2Centropy&amp;arh=2&amp;w=320&amp;s=954f0cde83cd3ddaaee4cc006e0ca61a', 'width': 320}, {'height': 531, 'url': 'https://i.redditmedia.com/OprgpULqpsvaHxn9GkPOYyEAaKnlLQ_xZsaTuq9MNCc.jpg?fit=crop&amp;crop=faces%2Centropy&amp;arh=2&amp;w=640&amp;s=0304b6b6280728c830415bfbe536ae18', 'width': 640}], 'source': {'height': 614, 'url': 'https://i.redditmedia.com/OprgpULqpsvaHxn9GkPOYyEAaKnlLQ_xZsaTuq9MNCc.jpg?s=053f9b0996ad5f8b59a458c9ba91b9a8', 'width': 739}, 'variants': {}}]}",,"{'oembed': {'description': 'Imgur: The most awesome images on the Internet.', 'height': 550, 'html': '&lt;iframe class=""embedly-embed"" src=""//cdn.embedly.com/widgets/media.html?src=%2F%2Fimgur.com%2Fa%2FDXUf6%2Fembed&amp;url=http%3A%2F%2Fimgur.com%2Fa%2FDXUf6&amp;image=http%3A%2F%2Fi.imgur.com%2FV2HIN9v.jpg%3Ffb&amp;key=2aa3c4d5f3de4f5b9120b660ad850dc9&amp;type=text%2Fhtml&amp;schema=imgur"" width=""550"" height=""550"" scrolling=""no"" frameborder=""0"" allowfullscreen&gt;&lt;/iframe&gt;', 'provider_name': 'Imgur', 'provider_url': 'http://imgur.com', 'thumbnail_height': 315, 'thumbnail_url': 'http://i.imgur.com/V2HIN9v.jpg?fb', 'thumbnail_width': 600, 'title': 'Imgur: The most awesome images on the Internet', 'type': 'rich', 'version': '1.0', 'width': 550}, 'type': 'imgur.com'}","{'oembed': {'description': 'Imgur: The most awesome images on the Internet.', 'height': 550, 'html': '&lt;iframe class=""embedly-embed"" src=""https://cdn.embedly.com/widgets/media.html?src=%2F%2Fimgur.com%2Fa%2FDXUf6%2Fembed&amp;url=http%3A%2F%2Fimgur.com%2Fa%2FDXUf6&amp;image=http%3A%2F%2Fi.imgur.com%2FV2HIN9v.jpg%3Ffb&amp;key=2aa3c4d5f3de4f5b9120b660ad850dc9&amp;type=text%2Fhtml&amp;schema=imgur"" width=""550"" height=""550"" scrolling=""no"" frameborder=""0"" allowfullscreen&gt;&lt;/iframe&gt;', 'provider_name': 'Imgur', 'provider_url': 'http://imgur.com', 'thumbnail_height': 315, 'thumbnail_url': 'https://i.embed.ly/1/image?url=http%3A%2F%2Fi.imgur.com%2FV2HIN9v.jpg%3Ffb&amp;key=b1e305db91cf4aa5a86b732cc9fffceb', 'thumbnail_width': 600, 'title': 'Imgur: The most awesome images on the Internet', 'type': 'rich', 'version': '1.0', 'width': 550}, 'type': 'imgur.com'}"
gbcw,1455755612.0,,,t2_v7wgw,False,1477866413,priceonomics.com,,https://www.reddit.com/r/Portland/comments/5a8q40/why_so_many_subies_around_in_the_90s_subaru_found/,0,5a8q40,False,False,{},79,False,/r/Portland/comments/5a8q40/why_so_many_subies_around_in_the_90s_subaru_found/,1480290552,86,{},,False,False,Portland,t5_2qi2i,http://a.thumbs.redditmedia.com/93KNzkZc_AE7SyAiU7MKMU2ArApYBc8LUkiFJKNsXh8.jpg,"Why so many Subies around? In the 90's Subaru found a 5th demographic and Portland was a relevant 'pocket' studied. 1. educators, 2. healthcare professionals, 3. IT professionals, 4. outdoorsy types,and 5. lesbians. Here's ""How an Ad Campaign Made Lesbians Fall in Love with Subaru.""",https://priceonomics.com/how-an-ad-campaign-made-lesbians-fall-in-love-with/,,,,link,"{'images': [{'id': 'hfnmsn5if0nrUL97bFQSzRu_qchfsgaOYxRngCTgI3g', 'resolutions': [{'height': 73, 'url': 'https://i.redditmedia.com/gLbei0bajE_mHViZ-6XN7kW1XhH-jF6xrFo8Frwes-Q.jpg?fit=crop&amp;crop=faces%2Centropy&amp;arh=2&amp;w=108&amp;s=9de6b96f973714c643f8338f4e51c1ee', 'width': 108}, {'height': 147, 'url': 'https://i.redditmedia.com/gLbei0bajE_mHViZ-6XN7kW1XhH-jF6xrFo8Frwes-Q.jpg?fit=crop&amp;crop=faces%2Centropy&amp;arh=2&amp;w=216&amp;s=71f1c05261d9039c868a475412140812', 'width': 216}, {'height': 218, 'url': 'https://i.redditmedia.com/gLbei0bajE_mHViZ-6XN7kW1XhH-jF6xrFo8Frwes-Q.jpg?fit=crop&amp;crop=faces%2Centropy&amp;arh=2&amp;w=320&amp;s=987b0bbe7cbea043057e89d7af07b0fc', 'width': 320}, {'height': 436, 'url': 'https://i.redditmedia.com/gLbei0bajE_mHViZ-6XN7kW1XhH-jF6xrFo8Frwes-Q.jpg?fit=crop&amp;crop=faces%2Centropy&amp;arh=2&amp;w=640&amp;s=a9bc8225c449348d58c74792cd4b4465', 'width': 640}, {'height': 654, 'url': 'https://i.redditmedia.com/gLbei0bajE_mHViZ-6XN7kW1XhH-jF6xrFo8Frwes-Q.jpg?fit=crop&amp;crop=faces%2Centropy&amp;arh=2&amp;w=960&amp;s=3009f7ec98eb00eb02eceae02ea37c45', 'width': 960}], 'source': {'height': 669, 'url': 'https://i.redditmedia.com/gLbei0bajE_mHViZ-6XN7kW1XhH-jF6xrFo8Frwes-Q.jpg?s=d9f9d75fe2d7cd68fa23dd912d4d9996', 'width': 981}, 'variants': {}}]}",,,
[deleted],,,,,False,1477862727,imgur.com,,https://www.reddit.com/r/Portland/comments/5a8eae/the_plaid_on_50th_and_division_inst_taking_any/,0,5a8eae,False,False,"{'content': '&lt;iframe class=""embedly-embed"" src=""//cdn.embedly.com/widgets/media.html?src=%2F%2Fimgur.com%2Fa%2FfF582%2Fembed&amp;url=http%3A%2F%2Fimgur.com%2Fa%2FfF582&amp;image=http%3A%2F%2Fi.imgur.com%2FoSyaXyR.jpg%3Ffb&amp;key=2aa3c4d5f3de4f5b9120b660ad850dc9&amp;type=text%2Fhtml&amp;schema=imgur"" width=""550"" height=""550"" scrolling=""no"" frameborder=""0"" allowfullscreen&gt;&lt;/iframe&gt;', 'height': 550, 'scrolling': False, 'width': 550}",6,False,/r/Portland/comments/5a8eae/the_plaid_on_50th_and_division_inst_taking_any/,1480290355,7,"{'content': '&lt;iframe class=""embedly-embed"" src=""https://cdn.embedly.com/widgets/media.html?src=%2F%2Fimgur.com%2Fa%2FfF582%2Fembed&amp;url=http%3A%2F%2Fimgur.com%2Fa%2FfF582&amp;image=http%3A%2F%2Fi.imgur.com%2FoSyaXyR.jpg%3Ffb&amp;key=2aa3c4d5f3de4f5b9120b660ad850dc9&amp;type=text%2Fhtml&amp;schema=imgur"" width=""550"" height=""550"" scrolling=""no"" frameborder=""0"" allowfullscreen&gt;&lt;/iframe&gt;', 'height': 550, 'scrolling': False, 'width': 550}",[deleted],False,False,Portland,t5_2qi2i,default,The Plaid on 50th and Division ins't taking any chances this Halloween,http://imgur.com/a/fF582,,photo,Photo,,,,"{'oembed': {'description': 'Imgur: The most awesome images on the Internet.', 'height': 550, 'html': '&lt;iframe class=""embedly-embed"" src=""//cdn.embedly.com/widgets/media.html?src=%2F%2Fimgur.com%2Fa%2FfF582%2Fembed&amp;url=http%3A%2F%2Fimgur.com%2Fa%2FfF582&amp;image=http%3A%2F%2Fi.imgur.com%2FoSyaXyR.jpg%3Ffb&amp;key=2aa3c4d5f3de4f5b9120b660ad850dc9&amp;type=text%2Fhtml&amp;schema=imgur"" width=""550"" height=""550"" scrolling=""no"" frameborder=""0"" allowfullscreen&gt;&lt;/iframe&gt;', 'provider_name': 'Imgur', 'provider_url': 'http://imgur.com', 'thumbnail_height': 315, 'thumbnail_url': 'http://i.imgur.com/oSyaXyR.jpg?fb', 'thumbnail_width': 600, 'title': 'Imgur: The most awesome images on the Internet', 'type': 'rich', 'version': '1.0', 'width': 550}, 'type': 'imgur.com'}","{'oembed': {'description': 'Imgur: The most awesome images on the Internet.', 'height': 550, 'html': '&lt;iframe class=""embedly-embed"" src=""https://cdn.embedly.com/widgets/media.html?src=%2F%2Fimgur.com%2Fa%2FfF582%2Fembed&amp;url=http%3A%2F%2Fimgur.com%2Fa%2FfF582&amp;image=http%3A%2F%2Fi.imgur.com%2FoSyaXyR.jpg%3Ffb&amp;key=2aa3c4d5f3de4f5b9120b660ad850dc9&amp;type=text%2Fhtml&amp;schema=imgur"" width=""550"" height=""550"" scrolling=""no"" frameborder=""0"" allowfullscreen&gt;&lt;/iframe&gt;', 'provider_name': 'Imgur', 'provider_url': 'http://imgur.com', 'thumbnail_height': 315, 'thumbnail_url': 'https://i.embed.ly/1/image?url=http%3A%2F%2Fi.imgur.com%2FoSyaXyR.jpg%3Ffb&amp;key=b1e305db91cf4aa5a86b732cc9fffceb', 'thumbnail_width': 600, 'title': 'Imgur: The most awesome images on the Internet', 'type': 'rich', 'version': '1.0', 'width': 550}, 'type': 'imgur.com'}"
evilkenevil,1343748808.0,,,t2_8iho2,False,1477858021,self.Portland,,https://www.reddit.com/r/Portland/comments/5a7z6d/neighbor_has_14_cars_in_his_front_and_back_yards/,0,5a7z6d,True,False,{},42,False,/r/Portland/comments/5a7z6d/neighbor_has_14_cars_in_his_front_and_back_yards/,1480290106,21,{},"This is in Multnomah county, 14 cars in his front and back yard and growing. Can't tell if they run or not but it's getting ugly on this residential street. Starting to resemble a wrecking/bone yard. Can the city do something? ",False,False,Portland,t5_2qi2i,self,Neighbor has 14 cars in his front and back yards,https://www.reddit.com/r/Portland/comments/5a7z6d/neighbor_has_14_cars_in_his_front_and_back_yards/,,,,,,,,
BartKing,1262189291.0,,,t2_3srtx,False,1477856883,i.redd.it,,https://www.reddit.com/r/Portland/comments/5a7vgp/halloween_portlandstyle/,0,5a7vgp,False,False,{},21,False,/r/Portland/comments/5a7vgp/halloween_portlandstyle/,1480290048,342,{},,False,False,Portland,t5_2qi2i,http://b.thumbs.redditmedia.com/h_qdTkQOioatJV7wcKS7faiC1BeAZkHQTRWtw8B68Fc.jpg,"Halloween, Portland-style.",https://i.redd.it/mp4m3p2p1oux.jpg,,photo,Photo,image,"{'images': [{'id': 'BkFwg00q-AYR3WBQLQ4dS61x8NG4xqTx6D7gpw0-unw', 'resolutions': [{'height': 81, 'url': 'https://i.redditmedia.com/hNtNJhMptEjZqX4aJBeyrcunxJXrBEDWpyc_IOK5ayc.jpg?fit=crop&amp;crop=faces%2Centropy&amp;arh=2&amp;w=108&amp;s=704d713e495c72f9b2e21647f619da4c', 'width': 108}, {'height': 162, 'url': 'https://i.redditmedia.com/hNtNJhMptEjZqX4aJBeyrcunxJXrBEDWpyc_IOK5ayc.jpg?fit=crop&amp;crop=faces%2Centropy&amp;arh=2&amp;w=216&amp;s=291e97ef5f6d5be7d22c9199af6e1cc6', 'width': 216}, {'height': 240, 'url': 'https://i.redditmedia.com/hNtNJhMptEjZqX4aJBeyrcunxJXrBEDWpyc_IOK5ayc.jpg?fit=crop&amp;crop=faces%2Centropy&amp;arh=2&amp;w=320&amp;s=ecfdfb68dd24ff7be77ca26e2507fdce', 'width': 320}, {'height': 480, 'url': 'https://i.redditmedia.com/hNtNJhMptEjZqX4aJBeyrcunxJXrBEDWpyc_IOK5ayc.jpg?fit=crop&amp;crop=faces%2Centropy&amp;arh=2&amp;w=640&amp;s=8beb8171db6d4942d7df8366bf16f198', 'width': 640}, {'height': 720, 'url': 'https://i.redditmedia.com/hNtNJhMptEjZqX4aJBeyrcunxJXrBEDWpyc_IOK5ayc.jpg?fit=crop&amp;crop=faces%2Centropy&amp;arh=2&amp;w=960&amp;s=a284c465c3ef4637daae5f049b2893c2', 'width': 960}], 'source': {'height': 720, 'url': 'https://i.redditmedia.com/hNtNJhMptEjZqX4aJBeyrcunxJXrBEDWpyc_IOK5ayc.jpg?s=3106d0be0d74bc093c4f27beba9580f7', 'width': 960}, 'variants': {}}]}",,,
