author,author_flair_css_class,author_flair_richtext,author_flair_text,author_flair_type,can_mod_post,contest_mode,created_utc,domain,full_link,gilded,id,is_crosspostable,is_original_content,is_reddit_media_domain,is_self,is_video,link_flair_background_color,link_flair_css_class,link_flair_richtext,link_flair_text,link_flair_text_color,link_flair_type,locked,no_follow,num_comments,num_crossposts,over_18,parent_whitelist_status,permalink,pinned,post_hint,preview,pwls,retrieved_on,rte_mode,score,selftext,send_replies,spoiler,stickied,subreddit,subreddit_id,subreddit_subscribers,subreddit_type,thumbnail,thumbnail_height,thumbnail_width,title,url,whitelist_status,wls,crosspost_parent,crosspost_parent_list
flowercup,,[],,text,False,False,1526447346,i.redd.it,https://www.reddit.com/r/Portland/comments/8jsear/lost_cat_post_sorry_has_anyone_seen_salami_near/,0.0,8jsear,True,False,True,False,False,,photo,"[{'e': 'text', 't': 'Photo'}]",Photo,dark,richtext,False,True,2,0,False,all_ads,/r/Portland/comments/8jsear/lost_cat_post_sorry_has_anyone_seen_salami_near/,False,image,"{'enabled': True, 'images': [{'id': 'KXjEU4-wQ4RZqf6gc30jGrbJ0GSatwqf_OTnnnBdfcY', 'resolutions': [{'height': 192, 'url': 'https://i.redditmedia.com/F3ymp0bMNmn1JooEP3to5SQ22xzn21tu6OQJjiVqTDQ.jpg?fit=crop&amp;crop=faces%2Centropy&amp;arh=2&amp;w=108&amp;s=e4d39a6365eb0fe4123868b469a0834f', 'width': 108}, {'height': 384, 'url': 'https://i.redditmedia.com/F3ymp0bMNmn1JooEP3to5SQ22xzn21tu6OQJjiVqTDQ.jpg?fit=crop&amp;crop=faces%2Centropy&amp;arh=2&amp;w=216&amp;s=d5d7f5455f0625c882b28a0bd0e9b1e0', 'width': 216}, {'height': 569, 'url': 'https://i.redditmedia.com/F3ymp0bMNmn1JooEP3to5SQ22xzn21tu6OQJjiVqTDQ.jpg?fit=crop&amp;crop=faces%2Centropy&amp;arh=2&amp;w=320&amp;s=115f3783f12d7aa1421394d48bda2078', 'width': 320}, {'height': 1138, 'url': 'https://i.redditmedia.com/F3ymp0bMNmn1JooEP3to5SQ22xzn21tu6OQJjiVqTDQ.jpg?fit=crop&amp;crop=faces%2Centropy&amp;arh=2&amp;w=640&amp;s=18898354a3ba4c778d5fb215ecc678d8', 'width': 640}], 'source': {'height': 1334, 'url': 'https://i.redditmedia.com/F3ymp0bMNmn1JooEP3to5SQ22xzn21tu6OQJjiVqTDQ.jpg?s=d4af24ad625c2b29c58b169149866a91', 'width': 750}, 'variants': {}}]}",6,1526447347,markdown,9,,True,False,False,Portland,t5_2qi2i,94527,public,https://b.thumbs.redditmedia.com/MCNTh3BIpFtGnT8bC36UJcoOsBnMWD8ZcEkYybBnRic.jpg,140.0,140.0,"Lost cat post, sorry! Has anyone seen Salami? Near 122 and division or powell",https://i.redd.it/akxodhg5i5y01.jpg,all_ads,6,,
Aractor,,[],,text,False,False,1526444271,self.Portland,https://www.reddit.com/r/Portland/comments/8js4kt/hair_beard_stylist_referral/,0.0,8js4kt,True,False,False,True,False,,,[],,dark,text,False,True,15,0,False,all_ads,/r/Portland/comments/8js4kt/hair_beard_stylist_referral/,False,,,6,1526444272,markdown,0,"I just moved back into Portland after spending the last 6 years living just outside the city, and I'm looking to connect with a new stylist instead of just going to a Supercuts or Sport Clips.

Can anyone recommend a good hair &amp; beard stylist? Around SE preferred, but not required.",True,False,False,Portland,t5_2qi2i,94524,public,self,,,Hair &amp; beard stylist referral?,https://www.reddit.com/r/Portland/comments/8js4kt/hair_beard_stylist_referral/,all_ads,6,,
norsteinbeckler,,[],,text,False,False,1526444071,instagram.com,https://www.reddit.com/r/Portland/comments/8js3y1/i_see_you_portland_instagram_shows_portlands_true/,0.0,8js3y1,True,False,False,False,False,,,[],,dark,text,False,True,2,0,False,all_ads,/r/Portland/comments/8js3y1/i_see_you_portland_instagram_shows_portlands_true/,False,,,6,1526444071,markdown,0,,True,False,False,Portland,t5_2qi2i,94524,public,default,,,I See You Portland Instagram Shows Portland's True Face,https://www.instagram.com/iseeyouportland/,all_ads,6,,
QueenThrowaway970,,[],,text,False,False,1526442294,self.Portland,https://www.reddit.com/r/Portland/comments/8jrxpl/culture_shock/,0.0,8jrxpl,True,False,False,True,False,,,[],,dark,text,False,True,6,0,False,all_ads,/r/Portland/comments/8jrxpl/culture_shock/,False,,,6,1526442295,markdown,0,"My Fiance got a job out here a few weeks ago and we made the trip here from rural Illinois. We don't have to worry much about money or a job for myself, but I had some questions.

 Most things have been great. Except the guy who told us to go back home, are new people hated here? 

Is Portland divided into districts like Chicago, and if so is there a map? To add to that are there areas to be avoided? 

I was thinking of getting a small Cafe racer to get around town, are those a viable option or should I just get another regular vehicle?

We are into the more artistic scene, music and film, is there an area for that?

What advice do you have for us?",True,False,False,Portland,t5_2qi2i,94523,public,self,,,Culture Shock,https://www.reddit.com/r/Portland/comments/8jrxpl/culture_shock/,all_ads,6,,
sitesurfer253,,[],,text,False,False,1526442206,imgur.com,https://www.reddit.com/r/Portland/comments/8jrxeh/worst_part_of_the_power_outage/,0.0,8jrxeh,True,False,False,False,False,,photo,"[{'e': 'text', 't': 'Photo'}]",Photo,dark,richtext,False,True,7,0,False,all_ads,/r/Portland/comments/8jrxeh/worst_part_of_the_power_outage/,False,,,6,1526442207,markdown,91,,True,False,False,Portland,t5_2qi2i,94523,public,default,,,Worst part of the power outage,https://imgur.com/zrh9fQC,all_ads,6,,
dumbledogg89,,[],,text,False,False,1526441398,i.redd.it,https://www.reddit.com/r/Portland/comments/8jruir/the_door_was_open_intentionally/,0.0,8jruir,True,False,True,False,False,,photo,"[{'e': 'text', 't': 'Photo'}]",Photo,dark,richtext,False,True,27,0,False,all_ads,/r/Portland/comments/8jruir/the_door_was_open_intentionally/,False,,,6,1526441399,markdown,128,,False,False,False,Portland,t5_2qi2i,94521,public,default,,,The door was open intentionally...,https://i.redd.it/nbv5vgrf05y01.jpg,all_ads,6,,
gorilladust,,[],,text,False,False,1526441049,oregonlive.com,https://www.reddit.com/r/Portland/comments/8jrtc0/hardesty_smith_in_runoff_for_portland_city/,0.0,8jrtc0,True,False,False,False,False,,local-news,"[{'e': 'text', 't': 'Local News'}]",Local News,dark,richtext,False,True,50,0,False,all_ads,/r/Portland/comments/8jrtc0/hardesty_smith_in_runoff_for_portland_city/,False,,,6,1526441050,markdown,40,,True,False,False,Portland,t5_2qi2i,94519,public,default,,,"Hardesty, Smith in runoff for Portland City Council seat",http://www.oregonlive.com/portland/index.ssf/2018/05/portland_city_council_race.html,all_ads,6,,
MrFireAlarms,,[],,text,False,False,1526440855,self.Portland,https://www.reddit.com/r/Portland/comments/8jrsny/til_of_a_new_apple_variety/,0.0,8jrsny,True,False,False,True,False,,,[],,dark,text,False,True,2,0,False,all_ads,/r/Portland/comments/8jrsny/til_of_a_new_apple_variety/,False,,,6,1526440856,markdown,0,It’s called the cosmic crisp and is a cross between honeycrisp and enterprise apples. Thoughts?,True,False,False,Portland,t5_2qi2i,94518,public,self,,,TIL of a new Apple variety,https://www.reddit.com/r/Portland/comments/8jrsny/til_of_a_new_apple_variety/,all_ads,6,,
Justachillday,,[],,text,False,False,1526440582,self.Portland,https://www.reddit.com/r/Portland/comments/8jrrpk/stupid_question_but_will_star_theater_maybe_let/,0.0,8jrrpk,True,False,False,True,False,,,[],,dark,text,False,True,5,0,False,all_ads,/r/Portland/comments/8jrrpk/stupid_question_but_will_star_theater_maybe_let/,False,,,6,1526440583,markdown,5,"i thought there were still some tickets left for mount kimbie, was just wondering if maybe i could tip a doorman or they still sell some tickets at the gate ",True,False,False,Portland,t5_2qi2i,94518,public,self,,,stupid question but will star theater maybe let me buy a ticket at the door if the tickets are sold out?,https://www.reddit.com/r/Portland/comments/8jrrpk/stupid_question_but_will_star_theater_maybe_let/,all_ads,6,,
effingeffit,,[],,text,False,False,1526439930,self.Portland,https://www.reddit.com/r/Portland/comments/8jrpbm/if_you_are_in_se_portland_now_is_the_time_to_see/,0.0,8jrpbm,True,False,False,True,False,,,[],,dark,text,False,True,70,0,False,all_ads,/r/Portland/comments/8jrpbm/if_you_are_in_se_portland_now_is_the_time_to_see/,False,,,6,1526439931,markdown,52,,False,False,False,Portland,t5_2qi2i,94515,public,self,,,"If you are in SE Portland, now is the time to see how prepared you are for the big one.",https://www.reddit.com/r/Portland/comments/8jrpbm/if_you_are_in_se_portland_now_is_the_time_to_see/,all_ads,6,,
JDnotsalinger,,[],,text,False,False,1526439594,self.Portland,https://www.reddit.com/r/Portland/comments/8jro13/anyone_know_anything_about_the_power_outage_in/,0.0,8jro13,True,False,False,True,False,,,[],,dark,text,False,True,6,0,False,all_ads,/r/Portland/comments/8jro13/anyone_know_anything_about_the_power_outage_in/,False,,,6,1526439596,markdown,0,,True,False,False,Portland,t5_2qi2i,94514,public,self,,,Anyone know anything about the power outage in sellwood right now?,https://www.reddit.com/r/Portland/comments/8jro13/anyone_know_anything_about_the_power_outage_in/,all_ads,6,,
shimshamshazzle,,[],,text,False,False,1526438261,self.Portland,https://www.reddit.com/r/Portland/comments/8jrinr/power_out_in_se_around_30th_gladstone/,0.0,8jrinr,True,False,False,True,False,,,[],,dark,text,False,True,14,0,False,all_ads,/r/Portland/comments/8jrinr/power_out_in_se_around_30th_gladstone/,False,,,6,1526438262,markdown,13,"Seems like a large issue. Everyone on my street is out, and looks like PGE is down. ",True,False,False,Portland,t5_2qi2i,94511,public,self,,,Power out in SE around 30th &amp; Gladstone,https://www.reddit.com/r/Portland/comments/8jrinr/power_out_in_se_around_30th_gladstone/,all_ads,6,,
bringing_not_back,,[],,text,False,False,1526437883,self.Portland,https://www.reddit.com/r/Portland/comments/8jrh4t/power_out_in_se/,0.0,8jrh4t,True,False,False,True,False,,,[],,dark,text,False,True,79,0,False,all_ads,/r/Portland/comments/8jrh4t/power_out_in_se/,False,,,6,1526437884,markdown,120,Out in Sellwood around 7:28,True,False,False,Portland,t5_2qi2i,94508,public,self,,,Power out in SE?,https://www.reddit.com/r/Portland/comments/8jrh4t/power_out_in_se/,all_ads,6,,
pdxbilly,,[],,text,False,False,1526437822,self.Portland,https://www.reddit.com/r/Portland/comments/8jrgvu/power_out_s_tabor/,0.0,8jrgvu,True,False,False,True,False,,,[],,dark,text,False,True,52,0,False,all_ads,/r/Portland/comments/8jrgvu/power_out_s_tabor/,False,,,6,1526437823,markdown,53,Lucky we just finished cooking dinner! ,True,False,False,Portland,t5_2qi2i,94508,public,self,,,Power out S Tabor,https://www.reddit.com/r/Portland/comments/8jrgvu/power_out_s_tabor/,all_ads,6,,
AnalDentist,,[],,text,False,False,1526437773,i.redd.it,https://www.reddit.com/r/Portland/comments/8jrgpc/when_the_stoplights_stop_lighting/,0.0,8jrgpc,True,False,True,False,False,,photo,"[{'e': 'text', 't': 'Photo'}]",Photo,dark,richtext,False,True,12,0,False,all_ads,/r/Portland/comments/8jrgpc/when_the_stoplights_stop_lighting/,False,,,6,1526437774,markdown,3,,True,False,False,Portland,t5_2qi2i,94508,public,default,,,When the stoplights stop lighting.,https://i.redd.it/qy86qd1op4y01.jpg,all_ads,6,,
Gjallarhorn_Lost,,[],,text,False,False,1526437502,self.Portland,https://www.reddit.com/r/Portland/comments/8jrfmu/red_light_at_bicycle_crossing/,0.0,8jrfmu,True,False,False,True,False,,,[],,dark,text,False,True,14,0,False,all_ads,/r/Portland/comments/8jrfmu/red_light_at_bicycle_crossing/,False,,,6,1526437503,markdown,9,"When driving, are you allowed to proceed when the red solid light starts blinking? Or do you wait until the flashing stops? An example being the Fanno Creek Trail crossing Hall Blvd near the Washington Square Mall.",True,False,False,Portland,t5_2qi2i,94508,public,self,,,Red Light at Bicycle Crossing,https://www.reddit.com/r/Portland/comments/8jrfmu/red_light_at_bicycle_crossing/,all_ads,6,,
AllWeNeedIsLiberty,,[],,text,False,False,1526436935,self.Portland,https://www.reddit.com/r/Portland/comments/8jrdb0/looking_for_a_keychain_souvenir/,0.0,8jrdb0,True,False,False,True,False,,,[],,dark,text,False,True,6,0,False,all_ads,/r/Portland/comments/8jrdb0/looking_for_a_keychain_souvenir/,False,,,6,1526436937,markdown,7,"A friend I’m visiting really likes keychains and I’m soliciting the help of reddit to help me gift her the coolest one. Looking for something Oregon or Portland related.

Any ideas? Appreciate the help! ",True,False,False,Portland,t5_2qi2i,94508,public,self,,,Looking for a keychain souvenir,https://www.reddit.com/r/Portland/comments/8jrdb0/looking_for_a_keychain_souvenir/,all_ads,6,,
sufferingforever,,[],,text,False,False,1526436519,self.Portland,https://www.reddit.com/r/Portland/comments/8jrbn1/where_can_i_buy_sushi_grade_raw_shrimp_and_squid/,0.0,8jrbn1,True,False,False,True,False,,,[],,dark,text,False,True,19,0,False,all_ads,/r/Portland/comments/8jrbn1/where_can_i_buy_sushi_grade_raw_shrimp_and_squid/,False,,,6,1526436520,markdown,8,"Mostly looking for amaebi, aka sweet shrimp/spot shrimp, since I couldn't even find that at Uwaji.
I'm also looking for sushi grade raw squid as well though, thanks!

I live in deep NE so going to Beaverton all the time just really isn't feasible or pleasent. If there are alternatives I'd love to know, but Google isn't helping.",True,False,False,Portland,t5_2qi2i,94508,public,self,,,Where can I buy sushi grade raw shrimp and squid in Portland (Besides Uwajimaya...),https://www.reddit.com/r/Portland/comments/8jrbn1/where_can_i_buy_sushi_grade_raw_shrimp_and_squid/,all_ads,6,,
DivinelyFlawed,,[],,text,False,False,1526436292,katu.com,https://www.reddit.com/r/Portland/comments/8jraob/significant_gas_leak_closes_foster_road_in_se/,0.0,8jraob,True,False,False,False,False,,local-news,"[{'e': 'text', 't': 'Local News'}]",Local News,dark,richtext,False,True,11,0,False,all_ads,/r/Portland/comments/8jraob/significant_gas_leak_closes_foster_road_in_se/,False,,,6,1526436294,markdown,91,,True,False,False,Portland,t5_2qi2i,94508,public,default,,,'Significant' gas leak closes Foster Road in SE Portland,http://katu.com/news/local/gas-leak-closes-foster-road-in-se-portland-101st-102nd-104th,all_ads,6,,
bananapanquakez,,[],,text,False,False,1526434449,i.imgur.com,https://www.reddit.com/r/Portland/comments/8jr2xr/found_dog_buckman_hosfordabernathy/,0.0,8jr2xr,True,False,False,False,False,,photo,"[{'e': 'text', 't': 'Photo'}]",Photo,dark,richtext,False,True,1,0,False,all_ads,/r/Portland/comments/8jr2xr/found_dog_buckman_hosfordabernathy/,False,,,6,1526434451,markdown,32,,True,False,False,Portland,t5_2qi2i,94508,public,default,,,Found Dog - Buckman / Hosford-Abernathy,https://i.imgur.com/OIANCR6.jpg,all_ads,6,,
Old-Willapa,,[],,text,False,False,1526431435,self.Portland,https://www.reddit.com/r/Portland/comments/8jqqd5/exclusive_how_rightwing_groups_wield_secret/,0.0,8jqqd5,True,False,False,True,False,,,[],,dark,text,False,True,14,0,False,all_ads,/r/Portland/comments/8jqqd5/exclusive_how_rightwing_groups_wield_secret/,False,,,6,1526431436,markdown,0,"Exclusive: how rightwing groups wield secret 'toolkit' to plot against US unions

https://www.theguardian.com/us-news/2018/may/15/rightwing-thinktanks-secret-plot-against-unions?CMP=Share_AndroidApp_Post_on_Reddit",True,False,False,Portland,t5_2qi2i,94509,public,self,,,Exclusive: how rightwing groups wield secret 'toolkit' to plot against US unions,https://www.reddit.com/r/Portland/comments/8jqqd5/exclusive_how_rightwing_groups_wield_secret/,all_ads,6,,
tit_curtain,,[],,text,False,False,1526427196,bikeportland.org,https://www.reddit.com/r/Portland/comments/8jq8um/city_puts_northwest_street_projects_in_motion/,0.0,8jq8um,True,False,False,False,False,,local-news,"[{'e': 'text', 't': 'Local News'}]",Local News,dark,richtext,False,True,1,0,False,all_ads,/r/Portland/comments/8jq8um/city_puts_northwest_street_projects_in_motion/,False,,,6,1526427197,markdown,14,,True,False,False,Portland,t5_2qi2i,94503,public,default,,,"City puts Northwest street projects ""in motion""",https://bikeportland.org/2018/05/15/city-puts-northwest-street-projects-in-motion-281362,all_ads,6,,
notcanoe,,[],,text,False,False,1526420277,self.Portland,https://www.reddit.com/r/Portland/comments/8jpf8o/credit_union_recommendation_where_you_make_your/,0.0,8jpf8o,True,False,False,True,False,,,[],,dark,text,False,True,16,0,False,all_ads,/r/Portland/comments/8jpf8o/credit_union_recommendation_where_you_make_your/,False,,,6,1526420279,markdown,4,"It's truly not that big of a deal, but it matters enough to me. I've read a lot of threads about credit unions in the area. A lot of them that I've compared, there's no real difference since I'm just needing a basic checking and savings account.


One thing that I would like to do is be able to set my own username versus one be provided to me. What credit union will allow me to do that?

Looking specifically at if Onpoint, Advantis, or Oregon Community lets you make your own username. Please add others that will.",True,False,False,Portland,t5_2qi2i,94496,public,self,,,Credit Union Recommendation where you make your own username.,https://www.reddit.com/r/Portland/comments/8jpf8o/credit_union_recommendation_where_you_make_your/,all_ads,6,,
SaganWasMisterX,,[],,text,False,False,1526418755,weednews.co,https://www.reddit.com/r/Portland/comments/8jp85x/oregonians_elect_candidates_sensible_on_cannabis/,0.0,8jp85x,True,False,False,False,False,,,[],,dark,text,False,True,0,0,False,all_ads,/r/Portland/comments/8jp85x/oregonians_elect_candidates_sensible_on_cannabis/,False,,,6,1526418756,markdown,3,,False,False,False,Portland,t5_2qi2i,94494,public,default,,,"Oregonians, Elect Candidates Sensible on Cannabis Policy",https://www.weednews.co/oregonians-elect-candidates-sensible-on-cannabis-policy/,all_ads,6,,
hasterthepastor,,[],,text,False,False,1526418338,self.Portland,https://www.reddit.com/r/Portland/comments/8jp67o/best_social_media_presence_for_local_adoptable/,0.0,8jp67o,False,False,False,True,False,,,[],,dark,text,False,True,9,0,False,all_ads,/r/Portland/comments/8jp67o/best_social_media_presence_for_local_adoptable/,False,,,6,1526418339,markdown,3,[removed],True,False,False,Portland,t5_2qi2i,94493,public,self,,,Best social media presence for local adoptable doggos?,https://www.reddit.com/r/Portland/comments/8jp67o/best_social_media_presence_for_local_adoptable/,all_ads,6,,
bchevy,,[],,text,False,False,1526417481,rosener.com,https://www.reddit.com/r/Portland/comments/8jp22m/sherwood_city_councilor_teases_idea_of_municipal/,0.0,8jp22m,True,False,False,False,False,,,[],,dark,text,False,True,4,0,False,all_ads,/r/Portland/comments/8jp22m/sherwood_city_councilor_teases_idea_of_municipal/,False,,,6,1526417483,markdown,103,,True,False,False,Portland,t5_2qi2i,94490,public,default,,,Sherwood city councilor teases idea of municipal broadband,https://www.rosener.com/therosenercorner/2018/5/9/take-the-poll-city-of-sherwood-internet-broadband-service,all_ads,6,,
Loaficious,,[],,text,False,False,1526416161,koin.com,https://www.reddit.com/r/Portland/comments/8jovqv/keep_portland_drunk/,0.0,8jovqv,True,False,False,False,False,,local-news,"[{'e': 'text', 't': 'Local News'}]",Local News,dark,richtext,False,True,14,0,False,all_ads,/r/Portland/comments/8jovqv/keep_portland_drunk/,False,,,6,1526416162,markdown,10,,False,False,False,Portland,t5_2qi2i,94491,public,default,,,Keep Portland drunk.,http://www.koin.com/news/oregon/unlike-most-of-the-country-pnw-drinking-more-beer/1180130221,all_ads,6,,
rockbottam,,[],,text,False,False,1526415898,v.redd.it,https://www.reddit.com/r/Portland/comments/8joulu/a_typical_day_in_portland/,0.0,8joulu,True,False,True,False,False,,,[],,dark,text,False,True,4,0,False,all_ads,/r/Portland/comments/8joulu/a_typical_day_in_portland/,False,link,"{'enabled': False, 'images': [{'id': 'I9r_EeRna6vIZtEWJY2LYlX0IkJqhkXWvbaW-TEoToE', 'resolutions': [{'height': 108, 'url': 'https://i.redditmedia.com/kd1o9W5jkEtVciWlrw0uscLrba5Rf_v-o7BKlIIlOJw.png?fit=crop&amp;crop=faces%2Centropy&amp;arh=2&amp;w=108&amp;s=74a9a442a705b9fa731473afd78b9531', 'width': 108}, {'height': 216, 'url': 'https://i.redditmedia.com/kd1o9W5jkEtVciWlrw0uscLrba5Rf_v-o7BKlIIlOJw.png?fit=crop&amp;crop=faces%2Centropy&amp;arh=2&amp;w=216&amp;s=37c9b15f4001f63b5a1575ada09d9c39', 'width': 216}, {'height': 320, 'url': 'https://i.redditmedia.com/kd1o9W5jkEtVciWlrw0uscLrba5Rf_v-o7BKlIIlOJw.png?fit=crop&amp;crop=faces%2Centropy&amp;arh=2&amp;w=320&amp;s=5f6b33943012037b50b816df19a9f310', 'width': 320}, {'height': 640, 'url': 'https://i.redditmedia.com/kd1o9W5jkEtVciWlrw0uscLrba5Rf_v-o7BKlIIlOJw.png?fit=crop&amp;crop=faces%2Centropy&amp;arh=2&amp;w=640&amp;s=385c1ae8c12da6d6db0cc0465b6f28d1', 'width': 640}], 'source': {'height': 640, 'url': 'https://i.redditmedia.com/kd1o9W5jkEtVciWlrw0uscLrba5Rf_v-o7BKlIIlOJw.png?s=e6d3b05244ae07b46c0a043f004ca3b0', 'width': 640}, 'variants': {}}]}",6,1526415899,markdown,0,,True,False,False,Portland,t5_2qi2i,94491,public,https://b.thumbs.redditmedia.com/_gJI4T9cSai1THDRH69mTPqhyajmp1COpAH96g7V1iM.jpg,140.0,140.0,A typical day in Portland,https://v.redd.it/wemgkbgfjpx01,all_ads,6,t3_8j7vw9,"[{'approved_at_utc': None, 'approved_by': None, 'archived': False, 'author': 'Nothin2Say', 'author_flair_background_color': None, 'author_flair_css_class': None, 'author_flair_richtext': [], 'author_flair_template_id': None, 'author_flair_text': None, 'author_flair_text_color': None, 'author_flair_type': 'text', 'banned_at_utc': None, 'banned_by': None, 'can_gild': True, 'can_mod_post': False, 'category': None, 'clicked': False, 'contest_mode': False, 'created': 1526282900.0, 'created_utc': 1526254100.0, 'distinguished': None, 'domain': 'v.redd.it', 'downs': 0, 'edited': False, 'gilded': 0, 'hidden': False, 'hide_score': False, 'id': '8j7vw9', 'is_crosspostable': True, 'is_original_content': False, 'is_reddit_media_domain': True, 'is_self': False, 'is_video': True, 'likes': None, 'link_flair_css_class': None, 'link_flair_richtext': [], 'link_flair_text': None, 'link_flair_text_color': 'dark', 'link_flair_type': 'text', 'locked': False, 'media': {'reddit_video': {'dash_url': 'https://v.redd.it/wemgkbgfjpx01/DASHPlaylist.mpd', 'duration': 8, 'fallback_url': 'https://v.redd.it/wemgkbgfjpx01/DASH_2_4_M', 'height': 480, 'hls_url': 'https://v.redd.it/wemgkbgfjpx01/HLSPlaylist.m3u8', 'is_gif': True, 'scrubber_media_url': 'https://v.redd.it/wemgkbgfjpx01/DASH_600_K', 'transcoding_status': 'completed', 'width': 480}}, 'media_embed': {}, 'mod_note': None, 'mod_reason_by': None, 'mod_reason_title': None, 'mod_reports': [], 'name': 't3_8j7vw9', 'no_follow': False, 'num_comments': 48, 'num_crossposts': 1, 'num_reports': None, 'over_18': False, 'parent_whitelist_status': 'all_ads', 'permalink': '/r/nonononoyes/comments/8j7vw9/real_life_frogger/', 'pinned': False, 'post_categories': None, 'post_hint': 'hosted:video', 'preview': {'enabled': False, 'images': [{'id': 'I9r_EeRna6vIZtEWJY2LYlX0IkJqhkXWvbaW-TEoToE', 'resolutions': [{'height': 108, 'url': 'https://i.redditmedia.com/kd1o9W5jkEtVciWlrw0uscLrba5Rf_v-o7BKlIIlOJw.png?fit=crop&amp;crop=faces%2Centropy&amp;arh=2&amp;w=108&amp;s=74a9a442a705b9fa731473afd78b9531', 'width': 108}, {'height': 216, 'url': 'https://i.redditmedia.com/kd1o9W5jkEtVciWlrw0uscLrba5Rf_v-o7BKlIIlOJw.png?fit=crop&amp;crop=faces%2Centropy&amp;arh=2&amp;w=216&amp;s=37c9b15f4001f63b5a1575ada09d9c39', 'width': 216}, {'height': 320, 'url': 'https://i.redditmedia.com/kd1o9W5jkEtVciWlrw0uscLrba5Rf_v-o7BKlIIlOJw.png?fit=crop&amp;crop=faces%2Centropy&amp;arh=2&amp;w=320&amp;s=5f6b33943012037b50b816df19a9f310', 'width': 320}, {'height': 640, 'url': 'https://i.redditmedia.com/kd1o9W5jkEtVciWlrw0uscLrba5Rf_v-o7BKlIIlOJw.png?fit=crop&amp;crop=faces%2Centropy&amp;arh=2&amp;w=640&amp;s=385c1ae8c12da6d6db0cc0465b6f28d1', 'width': 640}], 'source': {'height': 640, 'url': 'https://i.redditmedia.com/kd1o9W5jkEtVciWlrw0uscLrba5Rf_v-o7BKlIIlOJw.png?s=e6d3b05244ae07b46c0a043f004ca3b0', 'width': 640}, 'variants': {}}]}, 'pwls': 6, 'quarantine': False, 'removal_reason': None, 'report_reasons': None, 'rte_mode': 'markdown', 'saved': False, 'score': 700, 'secure_media': {'reddit_video': {'dash_url': 'https://v.redd.it/wemgkbgfjpx01/DASHPlaylist.mpd', 'duration': 8, 'fallback_url': 'https://v.redd.it/wemgkbgfjpx01/DASH_2_4_M', 'height': 480, 'hls_url': 'https://v.redd.it/wemgkbgfjpx01/HLSPlaylist.m3u8', 'is_gif': True, 'scrubber_media_url': 'https://v.redd.it/wemgkbgfjpx01/DASH_600_K', 'transcoding_status': 'completed', 'width': 480}}, 'secure_media_embed': {}, 'selftext': '', 'selftext_html': None, 'send_replies': True, 'spoiler': False, 'stickied': False, 'subreddit': 'nonononoyes', 'subreddit_id': 't5_2xp2p', 'subreddit_name_prefixed': 'r/nonononoyes', 'subreddit_subscribers': 824764, 'subreddit_type': 'public', 'suggested_sort': None, 'thumbnail': 'https://b.thumbs.redditmedia.com/_gJI4T9cSai1THDRH69mTPqhyajmp1COpAH96g7V1iM.jpg', 'thumbnail_height': 140, 'thumbnail_width': 140, 'title': 'Real life Frogger!', 'ups': 700, 'url': 'https://v.redd.it/wemgkbgfjpx01', 'user_reports': [], 'view_count': None, 'visited': False, 'whitelist_status': 'all_ads', 'wls': 6}]"
