author,author_created_utc,author_flair_css_class,author_flair_text,author_fullname,created_utc,domain,edited,full_link,gilded,id,is_self,link_flair_css_class,link_flair_text,locked,media_embed,num_comments,over_18,permalink,retrieved_on,score,secure_media_embed,selftext,stickied,subreddit,subreddit_id,thumbnail,title,url,post_hint,preview,media,secure_media,distinguished
flippantantant,1463635876.0,,,t2_y1k8y,1466610243,self.Portland,1466648494.0,https://www.reddit.com/r/Portland/comments/4pbb2q/i_need_some_feedback_regarding_an_idea_i_have/,0,4pbb2q,True,help-me,Help Me,False,{},18,False,/r/Portland/comments/4pbb2q/i_need_some_feedback_regarding_an_idea_i_have/,1472800971,13,{},"Recently, I started working on a website for people who are disabled. It's meant to be a place where they can get information about different places. For example, good accessible camping spots, or if a restaurant is a good place for someone in a wheelchair, that sort of thing.

Anyway, while working on the site, I started thinking to myself, I'm doing this because I'm in a situation where thinking about these things has become a part of my life, but what other things could I do after this? This got me to thinking, maybe I should start a non-profit organization and recruit other programmer volunteers to help out in creating things for the community. Set up a site where community members can give suggestions of things they'd like to see (web apps, etc), and then set up hackathons where programmers get together (which is always fun anyway) and build them.

Any thoughts on this are appreciated. I'm just gauging what other people think before I go spend the time and money putting together a non-profit.

Edit: in response to all the great replies, I'm going to hit up some of these organizations when I get back in town and see what I can do to either help out, or get something going, possibly under their umbrella. Thanks to everyone for all the feedback, it has been very helpful.",False,Portland,t5_2qi2i,self,"I need some feedback regarding an idea I have. Just want to see if it's realistic, or even worthwhile.",https://www.reddit.com/r/Portland/comments/4pbb2q/i_need_some_feedback_regarding_an_idea_i_have/,,,,,
Flab-a-doo,1447105660.0,,,t2_rvxmq,1466609389,self.Portland,1466615262.0,https://www.reddit.com/r/Portland/comments/4pb8e8/psa_dont_hop_in_front_of_other_cyclists_at_stop/,0,4pb8e8,True,,,False,{},58,False,/r/Portland/comments/4pb8e8/psa_dont_hop_in_front_of_other_cyclists_at_stop/,1472800934,0,{},"To the three different people who came up behind me stopped at a light and decided you should just pull right in front of me.  You were all wrong.  You were all slow.

If you are going to jump to the front of the line (because that's what it is) make damn fucking sure you are going to ride faster than those people you just cut off.

Edit:  Removed mention of weight.  Sorry.  Was in reference to ability to their speed, but the two things aren't dependent.",False,Portland,t5_2qi2i,self,PSA: Don't hop in front of other cyclists at stop lights.,https://www.reddit.com/r/Portland/comments/4pb8e8/psa_dont_hop_in_front_of_other_cyclists_at_stop/,,,,,
JoeBethersonton,1342813168.0,,,t2_8ea0k,1466607381,content.govdelivery.com,,https://www.reddit.com/r/Portland/comments/4pb25b/interstate_bridge_lifts_this_week_for_maintenance/,0,4pb25b,False,local-news,Local News,False,{},1,False,/r/Portland/comments/4pb25b/interstate_bridge_lifts_this_week_for_maintenance/,1472800846,7,{},,False,Portland,t5_2qi2i,http://b.thumbs.redditmedia.com/j3OhgmXy7AM3ZlI3hYdC965zN47FtNylMDScvEDjSrM.jpg,Interstate Bridge lifts this week for maintenance work,https://content.govdelivery.com/accounts/ORDOT/bulletins/1507e87,link,"{'images': [{'id': 'iPFNiXeEfjyHtYEkkwEBhhuAlA_f717z5C9j_vmzyyI', 'resolutions': [], 'source': {'height': 50, 'url': 'https://i.redditmedia.com/1kHxzKdd5aN7zS8jX8D0gDs8a4xs958-r-GoG4HoZWw.jpg?s=060e16a0c98c9b1e7b7389c84d21dab2', 'width': 50}, 'variants': {}}]}",,,
thunderford,1396684005.0,,,t2_fzua0,1466602085,self.Portland,,https://www.reddit.com/r/Portland/comments/4pamu6/fuck_summer_at_least_now_the_days_will_start/,0,4pamu6,True,,,False,{},13,False,/r/Portland/comments/4pamu6/fuck_summer_at_least_now_the_days_will_start/,1472800630,0,{},:D,False,Portland,t5_2qi2i,self,"Fuck summer. At least now, the days will start getting shorter",https://www.reddit.com/r/Portland/comments/4pamu6/fuck_summer_at_least_now_the_days_will_start/,,,,,
jr98664,1304474855.0,,Humboldt,t2_56rfr,1466600057,oregonlive.com,,https://www.reddit.com/r/Portland/comments/4pahny/portland_firm_asks_verity_baptist_church_to_leave/,0,4pahny,False,local-news,Local News,False,{},154,False,/r/Portland/comments/4pahny/portland_firm_asks_verity_baptist_church_to_leave/,1472800557,348,{},,False,Portland,t5_2qi2i,http://b.thumbs.redditmedia.com/s3xKEC7w92aPqiZN-9EzQ5U5xOiD4zWhOjjXptpC3Kc.jpg,Portland firm asks Verity Baptist Church to leave property after anti-LGBT comments following Orlando shooting.,http://www.oregonlive.com/business/index.ssf/2016/06/orlando_shooting_portland_firm.html,link,"{'images': [{'id': 'gFTLyQwXFQDLL7qKvDYLrzsIntQ8Ucyi4OrvM2p6INg', 'resolutions': [{'height': 69, 'url': 'https://i.redditmedia.com/PHndibRpmf5X6v2mkNk_rlzClcs-Rwx_HD5qgg7x3k4.jpg?fit=crop&amp;crop=faces%2Centropy&amp;arh=2&amp;w=108&amp;s=d49f9837972818bcdad32d41eeaad109', 'width': 108}, {'height': 138, 'url': 'https://i.redditmedia.com/PHndibRpmf5X6v2mkNk_rlzClcs-Rwx_HD5qgg7x3k4.jpg?fit=crop&amp;crop=faces%2Centropy&amp;arh=2&amp;w=216&amp;s=de569bd96a3719448f453ae614283a5e', 'width': 216}, {'height': 205, 'url': 'https://i.redditmedia.com/PHndibRpmf5X6v2mkNk_rlzClcs-Rwx_HD5qgg7x3k4.jpg?fit=crop&amp;crop=faces%2Centropy&amp;arh=2&amp;w=320&amp;s=3ef467666ddf3a55341cd749e4956660', 'width': 320}], 'source': {'height': 398, 'url': 'https://i.redditmedia.com/PHndibRpmf5X6v2mkNk_rlzClcs-Rwx_HD5qgg7x3k4.jpg?s=fbedc8c9397a5813248c1528710b23a3', 'width': 620}, 'variants': {}}]}",,,
whats_a_portlandian,1436634478.0,,,t2_op8pa,1466588036,self.Portland,1466710034.0,https://www.reddit.com/r/Portland/comments/4p9tuu/seeking_witnesses_to_accident_at_33rd_and/,0,4p9tuu,True,local-news,Local News,False,{},16,False,/r/Portland/comments/4p9tuu/seeking_witnesses_to_accident_at_33rd_and/,1472800225,25,{},"Here is the Flash Alert:
http://pdxfanews.blogspot.com/2016/06/major-crash-team-investigating-serious_21.html

The report is incorrect in that the driver of the Corolla is not female.  He is my partner and has zero recollection of the accident.  Can anyone here help fill in the blanks?

Wear you seat belts. &lt;3


Update: I can't completely put into words how grateful I am towards everybody involved in this. For the people who pulled him out, who kept an eye on the other driver, paramedics who handled him while he was in shock, everybody who replied on here to fill us in, and for the care he has received every step of the way at the hospital.  Thank you!",False,Portland,t5_2qi2i,self,Seeking Witnesses to Accident at 33rd and Killingsworth June 21st 7:53pm,https://www.reddit.com/r/Portland/comments/4p9tuu/seeking_witnesses_to_accident_at_33rd_and/,,,,,
Strangebrewer,1377035405.0,,S Burlingame,t2_ctz4t,1466583025,kgw.com,,https://www.reddit.com/r/Portland/comments/4p9lc8/wiedenkennedy_touts_powerful_hypocrites_for_mass/,0,4p9lc8,False,local-news,Local News,False,{},22,False,/r/Portland/comments/4p9lc8/wiedenkennedy_touts_powerful_hypocrites_for_mass/,1472800106,15,{},,False,Portland,t5_2qi2i,http://b.thumbs.redditmedia.com/mTaHlrLXMkUys0mK_-niQjbEW5Rf0K4C-xi1FIogMLM.jpg,Wieden+Kennedy touts 'powerful hypocrites' for mass shooting inaction,http://www.kgw.com/news/local/wiedenkennedy-calls-out-powerful-hypocrites-for-mass-shooting-inaction/251532888,link,"{'images': [{'id': 'cJbKsitdaHNW0co488RSeeHEXdTvTcJHl1gi6sDCSb8', 'resolutions': [{'height': 60, 'url': 'https://i.redditmedia.com/kNyC4-vD7cLYByrlmwFa4rVkZGAKjhQ2obKN6vIK8uQ.jpg?fit=crop&amp;crop=faces%2Centropy&amp;arh=2&amp;w=108&amp;s=75c308dbbacf0023e3dbd0607018a645', 'width': 108}, {'height': 121, 'url': 'https://i.redditmedia.com/kNyC4-vD7cLYByrlmwFa4rVkZGAKjhQ2obKN6vIK8uQ.jpg?fit=crop&amp;crop=faces%2Centropy&amp;arh=2&amp;w=216&amp;s=e6a6da5a6385835a6846f2a53b529262', 'width': 216}, {'height': 180, 'url': 'https://i.redditmedia.com/kNyC4-vD7cLYByrlmwFa4rVkZGAKjhQ2obKN6vIK8uQ.jpg?fit=crop&amp;crop=faces%2Centropy&amp;arh=2&amp;w=320&amp;s=f7bf5c23a9cad2486b719b53aa5597a5', 'width': 320}, {'height': 360, 'url': 'https://i.redditmedia.com/kNyC4-vD7cLYByrlmwFa4rVkZGAKjhQ2obKN6vIK8uQ.jpg?fit=crop&amp;crop=faces%2Centropy&amp;arh=2&amp;w=640&amp;s=4a6cc2a940968fd83e820a0c64efea01', 'width': 640}], 'source': {'height': 360, 'url': 'https://i.redditmedia.com/kNyC4-vD7cLYByrlmwFa4rVkZGAKjhQ2obKN6vIK8uQ.jpg?s=e38d794ac06300eb4799c20104391fa0', 'width': 640}, 'variants': {}}]}",,,
gordo1893,1328481771.0,,,t2_6uj0y,1466574743,statesmanjournal.com,,https://www.reddit.com/r/Portland/comments/4p9645/oregon_dmv_says_it_cant_issue_drivers_license_to/,0,4p9645,False,local-news,Local News,False,{},192,False,/r/Portland/comments/4p9645/oregon_dmv_says_it_cant_issue_drivers_license_to/,1472799894,36,{},,False,Portland,t5_2qi2i,http://b.thumbs.redditmedia.com/c7Jcx4TA-xsYfNor6AOE8BreR98w50A6mUCCtcWgh_s.jpg,Oregon DMV says it can't issue driver's license to Portland person given nonbinary gender status,http://www.statesmanjournal.com/story/news/politics/2016/06/21/ore-dmv-says-cant-issue-license-nonbinary-person/86183112/,link,"{'images': [{'id': 'gRcZvzeIotTcBEuv_flEvfHLPBWdT313rZ3066gorXc', 'resolutions': [{'height': 56, 'url': 'https://i.redditmedia.com/mgyWwgfonvOiNhRuTSoy57fh6OtvEgb1Qnc7C7MfGxo.jpg?fit=crop&amp;crop=faces%2Centropy&amp;arh=2&amp;w=108&amp;s=b852d6888369dfc8758f4858362f4a62', 'width': 108}, {'height': 113, 'url': 'https://i.redditmedia.com/mgyWwgfonvOiNhRuTSoy57fh6OtvEgb1Qnc7C7MfGxo.jpg?fit=crop&amp;crop=faces%2Centropy&amp;arh=2&amp;w=216&amp;s=25d75a19527558594476bca149cf64d6', 'width': 216}, {'height': 168, 'url': 'https://i.redditmedia.com/mgyWwgfonvOiNhRuTSoy57fh6OtvEgb1Qnc7C7MfGxo.jpg?fit=crop&amp;crop=faces%2Centropy&amp;arh=2&amp;w=320&amp;s=ade5d214f3b05c02645c032b7d3854ec', 'width': 320}, {'height': 336, 'url': 'https://i.redditmedia.com/mgyWwgfonvOiNhRuTSoy57fh6OtvEgb1Qnc7C7MfGxo.jpg?fit=crop&amp;crop=faces%2Centropy&amp;arh=2&amp;w=640&amp;s=b71e17280f8a8edf709a37e19bdfb683', 'width': 640}, {'height': 504, 'url': 'https://i.redditmedia.com/mgyWwgfonvOiNhRuTSoy57fh6OtvEgb1Qnc7C7MfGxo.jpg?fit=crop&amp;crop=faces%2Centropy&amp;arh=2&amp;w=960&amp;s=cb70771166a735a8f677a21e86becd95', 'width': 960}, {'height': 567, 'url': 'https://i.redditmedia.com/mgyWwgfonvOiNhRuTSoy57fh6OtvEgb1Qnc7C7MfGxo.jpg?fit=crop&amp;crop=faces%2Centropy&amp;arh=2&amp;w=1080&amp;s=f803d491dea7ad76471c11d9da1ff087', 'width': 1080}], 'source': {'height': 1680, 'url': 'https://i.redditmedia.com/mgyWwgfonvOiNhRuTSoy57fh6OtvEgb1Qnc7C7MfGxo.jpg?s=6697fcea5094bb95269d26663048ca62', 'width': 3200}, 'variants': {}}]}",,,
[deleted],,,,,1466574075,i.redd.it,,https://www.reddit.com/r/Portland/comments/4p94sl/taken_from_the_eastbank_esplanade_a_few_days_ago/,0,4p94sl,False,,,False,{},1,False,/r/Portland/comments/4p94sl/taken_from_the_eastbank_esplanade_a_few_days_ago/,1472799874,3,{},[deleted],False,Portland,t5_2qi2i,default,Taken from the Eastbank Esplanade a few days ago. [OC],https://i.redd.it/8s2dxwz04s4x.jpg,,,,,
Cigar_Lounger,1462145713.0,,,t2_xm6oc,1466572215,imgur.com,,https://www.reddit.com/r/Portland/comments/4p90vq/lola_and_i_duke_visited_the_rose_city_classic_car/,0,4p90vq,False,photo,Photo,False,"{'content': '&lt;iframe class=""embedly-embed"" src=""//cdn.embedly.com/widgets/media.html?src=%2F%2Fimgur.com%2Fa%2F56p8b%2Fembed&amp;url=http%3A%2F%2Fimgur.com%2Fa%2F56p8b&amp;image=http%3A%2F%2Fi.imgur.com%2FSJouqIY.jpg%3Ffb&amp;key=2aa3c4d5f3de4f5b9120b660ad850dc9&amp;type=text%2Fhtml&amp;schema=imgur"" width=""550"" height=""550"" scrolling=""no"" frameborder=""0"" allowfullscreen&gt;&lt;/iframe&gt;', 'height': 550, 'scrolling': False, 'width': 550}",3,False,/r/Portland/comments/4p90vq/lola_and_i_duke_visited_the_rose_city_classic_car/,1472799820,13,"{'content': '&lt;iframe class=""embedly-embed"" src=""https://cdn.embedly.com/widgets/media.html?src=%2F%2Fimgur.com%2Fa%2F56p8b%2Fembed&amp;url=http%3A%2F%2Fimgur.com%2Fa%2F56p8b&amp;image=http%3A%2F%2Fi.imgur.com%2FSJouqIY.jpg%3Ffb&amp;key=2aa3c4d5f3de4f5b9120b660ad850dc9&amp;type=text%2Fhtml&amp;schema=imgur"" width=""550"" height=""550"" scrolling=""no"" frameborder=""0"" allowfullscreen&gt;&lt;/iframe&gt;', 'height': 550, 'scrolling': False, 'width': 550}",,False,Portland,t5_2qi2i,http://a.thumbs.redditmedia.com/41GkBMSeMCG6dB5SuR0jCHYrG4i174TTaS7M7IZaqe0.jpg,Lola and I (Duke) Visited the Rose City Classic Car Round Up on Saturday. Here are a few of the over 100 pictures we took. Video to come. Had a great time.,http://imgur.com/a/56p8b,link,"{'images': [{'id': 'b4gVU6PWrrchMOE94KJmX96mHbiIGhIUC8I62N8HNiY', 'resolutions': [{'height': 105, 'url': 'https://i.redditmedia.com/kqr3JuKOYG1BErD9CuAVU_tFMLSd8xc_Hnqa5b3_aUw.jpg?fit=crop&amp;crop=faces%2Centropy&amp;arh=2&amp;w=108&amp;s=577882fb12c645571260607e1f9ff30c', 'width': 108}, {'height': 210, 'url': 'https://i.redditmedia.com/kqr3JuKOYG1BErD9CuAVU_tFMLSd8xc_Hnqa5b3_aUw.jpg?fit=crop&amp;crop=faces%2Centropy&amp;arh=2&amp;w=216&amp;s=6cf688c51b32678d7150d76b323d1b93', 'width': 216}, {'height': 312, 'url': 'https://i.redditmedia.com/kqr3JuKOYG1BErD9CuAVU_tFMLSd8xc_Hnqa5b3_aUw.jpg?fit=crop&amp;crop=faces%2Centropy&amp;arh=2&amp;w=320&amp;s=fc5c69c4aab252cbbd1e2ac36bb2bd86', 'width': 320}, {'height': 624, 'url': 'https://i.redditmedia.com/kqr3JuKOYG1BErD9CuAVU_tFMLSd8xc_Hnqa5b3_aUw.jpg?fit=crop&amp;crop=faces%2Centropy&amp;arh=2&amp;w=640&amp;s=7f7a9695d176b52b3a72702a1541db7a', 'width': 640}, {'height': 936, 'url': 'https://i.redditmedia.com/kqr3JuKOYG1BErD9CuAVU_tFMLSd8xc_Hnqa5b3_aUw.jpg?fit=crop&amp;crop=faces%2Centropy&amp;arh=2&amp;w=960&amp;s=e89c5de68b5057f4d079b599e0d1dce2', 'width': 960}, {'height': 1053, 'url': 'https://i.redditmedia.com/kqr3JuKOYG1BErD9CuAVU_tFMLSd8xc_Hnqa5b3_aUw.jpg?fit=crop&amp;crop=faces%2Centropy&amp;arh=2&amp;w=1080&amp;s=24f608aa50d4912220b56b72b8f3dcff', 'width': 1080}], 'source': {'height': 1280, 'url': 'https://i.redditmedia.com/kqr3JuKOYG1BErD9CuAVU_tFMLSd8xc_Hnqa5b3_aUw.jpg?s=d1b2a63be96e75ff7a10a2bea4679b6a', 'width': 1312}, 'variants': {}}]}","{'oembed': {'description': 'Album . Rose City Round Up 2016 Taken By: Cigar Lounger', 'height': 550, 'html': '&lt;iframe class=""embedly-embed"" src=""//cdn.embedly.com/widgets/media.html?src=%2F%2Fimgur.com%2Fa%2F56p8b%2Fembed&amp;url=http%3A%2F%2Fimgur.com%2Fa%2F56p8b&amp;image=http%3A%2F%2Fi.imgur.com%2FSJouqIY.jpg%3Ffb&amp;key=2aa3c4d5f3de4f5b9120b660ad850dc9&amp;type=text%2Fhtml&amp;schema=imgur"" width=""550"" height=""550"" scrolling=""no"" frameborder=""0"" allowfullscreen&gt;&lt;/iframe&gt;', 'provider_name': 'Imgur', 'provider_url': 'http://imgur.com', 'thumbnail_height': 315, 'thumbnail_url': 'http://i.imgur.com/SJouqIY.jpg?fb', 'thumbnail_width': 600, 'title': 'Rose City Round Up 2016 Taken By: Cigar Lounger', 'type': 'rich', 'version': '1.0', 'width': 550}, 'type': 'imgur.com'}","{'oembed': {'description': 'Album . Rose City Round Up 2016 Taken By: Cigar Lounger', 'height': 550, 'html': '&lt;iframe class=""embedly-embed"" src=""https://cdn.embedly.com/widgets/media.html?src=%2F%2Fimgur.com%2Fa%2F56p8b%2Fembed&amp;url=http%3A%2F%2Fimgur.com%2Fa%2F56p8b&amp;image=http%3A%2F%2Fi.imgur.com%2FSJouqIY.jpg%3Ffb&amp;key=2aa3c4d5f3de4f5b9120b660ad850dc9&amp;type=text%2Fhtml&amp;schema=imgur"" width=""550"" height=""550"" scrolling=""no"" frameborder=""0"" allowfullscreen&gt;&lt;/iframe&gt;', 'provider_name': 'Imgur', 'provider_url': 'http://imgur.com', 'thumbnail_height': 315, 'thumbnail_url': 'https://i.embed.ly/1/image?url=http%3A%2F%2Fi.imgur.com%2FSJouqIY.jpg%3Ffb&amp;key=b1e305db91cf4aa5a86b732cc9fffceb', 'thumbnail_width': 600, 'title': 'Rose City Round Up 2016 Taken By: Cigar Lounger', 'type': 'rich', 'version': '1.0', 'width': 550}, 'type': 'imgur.com'}",
WhippyFlagellum,1333742417.0,,,t2_7djxt,1466569308,self.Portland,1466574607.0,https://www.reddit.com/r/Portland/comments/4p8ull/cpa_recommendations/,0,4p8ull,True,,,False,{},8,False,/r/Portland/comments/4p8ull/cpa_recommendations/,1472799731,0,{},"Hey there. I'm a newer college grad, married, looking to buy a house, and just seeking professional advice on taxes, saving, and the like. Would love to hear if anyone has a CPA that they've worked with that they can recommend?

Edit: as I mentioned below, I'm looking for an Oregon specific tax professional, and not a referral to a random subreddit or website. My wife has a new small business which allows for tax write offs, buying a house allows write offs, and the career industry I'm in has occasional tax incentives as well. ",False,Portland,t5_2qi2i,self,CPA recommendations?,https://www.reddit.com/r/Portland/comments/4p8ull/cpa_recommendations/,,,,,
pdxbadlifechoices,1466568621.0,,,t2_yxcvo,1466568739,self.Portland,,https://www.reddit.com/r/Portland/comments/4p8tbe/eli5_how_do_buildersdevelopers_get_the_jump_on/,0,4p8tbe,True,,,False,{},15,False,/r/Portland/comments/4p8tbe/eli5_how_do_buildersdevelopers_get_the_jump_on/,1472799713,1,{},"I see a lot of older/falling-aparter homes that are torn down lickity split without being listed for sale - the next thing you know, some opportunist builder is laying down a bunch of hideous square feet for the next breeder coming to the neighborhood. How do they find their lots/homes? I can't find anything I like/afford on the market and am wondering if I might be able to build something for myself.

Throwaway because I'm embarrassed that I don't know how this stuff works.",False,Portland,t5_2qi2i,self,ELI5: How do builders/developers get the jump on lots and teardown houses to build their own?,https://www.reddit.com/r/Portland/comments/4p8tbe/eli5_how_do_buildersdevelopers_get_the_jump_on/,,,,,
csteene,,,,,1466566803,imgur.com,,https://www.reddit.com/r/Portland/comments/4p8oz3/come_out_and_dance_at_the_lovecraft_tonight/,0,4p8oz3,False,photo,Photo,False,{},3,False,/r/Portland/comments/4p8oz3/come_out_and_dance_at_the_lovecraft_tonight/,1472799653,4,{},,False,Portland,t5_2qi2i,http://a.thumbs.redditmedia.com/RlKrp427oRM5C6GQUjd8c6AHD7VMcOQST3thZgsCzh4.jpg,Come out and dance at the Lovecraft tonight,http://imgur.com/KeLBNxK,link,"{'images': [{'id': 'gP4IdxQ4lpBvGxufr3HL345K-Ah4TggNRvSGbA2coys', 'resolutions': [{'height': 108, 'url': 'https://i.redditmedia.com/PcU0a8Jp0medZ05JAhTo2hKvc0rn2mJYev5iPjDmZ30.jpg?fit=crop&amp;crop=faces%2Centropy&amp;arh=2&amp;w=108&amp;s=1aae96fc9533f251ea4e8f5298cd1296', 'width': 108}, {'height': 216, 'url': 'https://i.redditmedia.com/PcU0a8Jp0medZ05JAhTo2hKvc0rn2mJYev5iPjDmZ30.jpg?fit=crop&amp;crop=faces%2Centropy&amp;arh=2&amp;w=216&amp;s=3c5ca3e7058442ee0b8cec42894bac6b', 'width': 216}, {'height': 320, 'url': 'https://i.redditmedia.com/PcU0a8Jp0medZ05JAhTo2hKvc0rn2mJYev5iPjDmZ30.jpg?fit=crop&amp;crop=faces%2Centropy&amp;arh=2&amp;w=320&amp;s=2389ce8cc902238f06e234b058feca39', 'width': 320}, {'height': 640, 'url': 'https://i.redditmedia.com/PcU0a8Jp0medZ05JAhTo2hKvc0rn2mJYev5iPjDmZ30.jpg?fit=crop&amp;crop=faces%2Centropy&amp;arh=2&amp;w=640&amp;s=dac6f1f615c343a39d11559c22b94959', 'width': 640}, {'height': 960, 'url': 'https://i.redditmedia.com/PcU0a8Jp0medZ05JAhTo2hKvc0rn2mJYev5iPjDmZ30.jpg?fit=crop&amp;crop=faces%2Centropy&amp;arh=2&amp;w=960&amp;s=e35a1cc7375922276ccdb72edbb2920b', 'width': 960}], 'source': {'height': 960, 'url': 'https://i.redditmedia.com/PcU0a8Jp0medZ05JAhTo2hKvc0rn2mJYev5iPjDmZ30.jpg?s=10e7ce2fe8e30290eb66f7375b345507', 'width': 960}, 'variants': {}}]}",,,
[deleted],,,,,1466562779,oregonlive.com,,https://www.reddit.com/r/Portland/comments/4p8fm8/ticketmasters_free_concert_tickets_no_good_in/,0,4p8fm8,False,local-news,Local News,False,{},26,False,/r/Portland/comments/4p8fm8/ticketmasters_free_concert_tickets_no_good_in/,1472799521,46,{},[deleted],False,Portland,t5_2qi2i,default,Ticketmaster's free concert tickets no good in Oregonâ€”for now,http://www.oregonlive.com/music/index.ssf/2016/06/no_ticketmaster_free_concerts_oregon.html,,,,,
ororgtfo,1437074942.0,,,t2_ouhtd,1466561746,siliconbeat.com,,https://www.reddit.com/r/Portland/comments/4p8d8h/biz_break_intel_tries_to_get_out_of_12_billion_eu/,0,4p8d8h,False,,,False,{},0,False,/r/Portland/comments/4p8d8h/biz_break_intel_tries_to_get_out_of_12_billion_eu/,1472799488,5,{},,False,Portland,t5_2qi2i,http://b.thumbs.redditmedia.com/ppPMKb5_HYkm65MtjVkSBn2H_NYqeNGSTbDlquBydRE.jpg,Biz Break: Intel tries to get out of $1.2 billion EU fine,http://www.siliconbeat.com/2016/06/21/biz-break-intel-tries-get-1-2-billion-eu-fine/,link,"{'images': [{'id': 'gWc63HR6wx74NutPDnShdbkAH8VR_Ljjm2djD3sMnVM', 'resolutions': [{'height': 50, 'url': 'https://i.redditmedia.com/iI8VNB3yik4ZHYV3IK-ZplXkjH6dLERLY6gi28WxTZY.jpg?fit=crop&amp;crop=faces%2Centropy&amp;arh=2&amp;w=108&amp;s=22f11f84d8db405adf149266d12bef26', 'width': 108}, {'height': 101, 'url': 'https://i.redditmedia.com/iI8VNB3yik4ZHYV3IK-ZplXkjH6dLERLY6gi28WxTZY.jpg?fit=crop&amp;crop=faces%2Centropy&amp;arh=2&amp;w=216&amp;s=24beaf776827efa3de9ccb75cb1ecf00', 'width': 216}, {'height': 150, 'url': 'https://i.redditmedia.com/iI8VNB3yik4ZHYV3IK-ZplXkjH6dLERLY6gi28WxTZY.jpg?fit=crop&amp;crop=faces%2Centropy&amp;arh=2&amp;w=320&amp;s=200dc36994d0e72bc7143387288f004c', 'width': 320}, {'height': 300, 'url': 'https://i.redditmedia.com/iI8VNB3yik4ZHYV3IK-ZplXkjH6dLERLY6gi28WxTZY.jpg?fit=crop&amp;crop=faces%2Centropy&amp;arh=2&amp;w=640&amp;s=41365478cb4e13af174acbc6f1361eca', 'width': 640}], 'source': {'height': 300, 'url': 'https://i.redditmedia.com/iI8VNB3yik4ZHYV3IK-ZplXkjH6dLERLY6gi28WxTZY.jpg?s=9db56e4bd82b88c6d11c53537f029600', 'width': 640}, 'variants': {}}]}",,,
Tjerino,1238637335.0,,Richmond,t2_3flcz,1466557496,self.Portland,,https://www.reddit.com/r/Portland/comments/4p82sz/stolen_camera_family_heirloom_500_reward/,0,4p82sz,True,,,False,{},4,False,/r/Portland/comments/4p82sz/stolen_camera_family_heirloom_500_reward/,1472799342,1,{},"&gt; Hey Portland, I need a little help. My camera was stolen this weekend. It is a Hasselblad 500c. Someone broke the window of my van and grabbed my camera bag. This camera means the world to me and any help would be greatly appreciated.
&gt; $500 REWARD. No questions asked.
&gt; There are some unique handwritten numbers on the focus of the lens: 5, 10, 15.
&gt; Thank you and please spread this information to anyone that you think could help.

I'm posting for a friend.  This camera was passed down from his grandfather to his father to him, so has some real sentimental value.  If you have any info please send a PM, many thanks!  [Here's an image of the camera](http://imgur.com/33tsZg5).",False,Portland,t5_2qi2i,self,Stolen Camera - Family Heirloom - $500 Reward,https://www.reddit.com/r/Portland/comments/4p82sz/stolen_camera_family_heirloom_500_reward/,self,"{'images': [{'id': 'OOoP6D28WkjpzvVGoa0YrDq2aetXbjRb0Ow36urm8EA', 'resolutions': [{'height': 108, 'url': 'https://i.redditmedia.com/3zRbRHWtIz_J9OVR3IGiPlJmHyr16f8cuied6GNiVq4.jpg?fit=crop&amp;crop=faces%2Centropy&amp;arh=2&amp;w=108&amp;s=0513ab5aecac7a76eece76a0700b8041', 'width': 108}, {'height': 216, 'url': 'https://i.redditmedia.com/3zRbRHWtIz_J9OVR3IGiPlJmHyr16f8cuied6GNiVq4.jpg?fit=crop&amp;crop=faces%2Centropy&amp;arh=2&amp;w=216&amp;s=50a77733ef0f67c8c1feaf4d4640fc3d', 'width': 216}, {'height': 320, 'url': 'https://i.redditmedia.com/3zRbRHWtIz_J9OVR3IGiPlJmHyr16f8cuied6GNiVq4.jpg?fit=crop&amp;crop=faces%2Centropy&amp;arh=2&amp;w=320&amp;s=a82707b7032b7f9e6c2ae94e02425eda', 'width': 320}, {'height': 640, 'url': 'https://i.redditmedia.com/3zRbRHWtIz_J9OVR3IGiPlJmHyr16f8cuied6GNiVq4.jpg?fit=crop&amp;crop=faces%2Centropy&amp;arh=2&amp;w=640&amp;s=912084e73df7b5f15fd9e6ec9dfe344d', 'width': 640}, {'height': 960, 'url': 'https://i.redditmedia.com/3zRbRHWtIz_J9OVR3IGiPlJmHyr16f8cuied6GNiVq4.jpg?fit=crop&amp;crop=faces%2Centropy&amp;arh=2&amp;w=960&amp;s=f51be23bd0c4ee4ea86a50562a0d3b16', 'width': 960}], 'source': {'height': 960, 'url': 'https://i.redditmedia.com/3zRbRHWtIz_J9OVR3IGiPlJmHyr16f8cuied6GNiVq4.jpg?s=a8e9712406c6b6bd9b50a9561b084fe8', 'width': 960}, 'variants': {}}]}",,,
Soulja_Boy_Yellen,1457543963.0,,Portlandia Statue,t2_wabby,1466556889,self.Portland,,https://www.reddit.com/r/Portland/comments/4p819n/are_there_any_bars_showing_the_uk_eu_referendum/,0,4p819n,True,help-me,Help Me,False,{},10,False,/r/Portland/comments/4p819n/are_there_any_bars_showing_the_uk_eu_referendum/,1472799321,9,{},I believe the results will come in in the evening and I'd love to watch it. ,False,Portland,t5_2qi2i,self,Are there any bars showing the UK EU referendum?,https://www.reddit.com/r/Portland/comments/4p819n/are_there_any_bars_showing_the_uk_eu_referendum/,,,,,
[deleted],,,,,1466555806,oregonlive.com,,https://www.reddit.com/r/Portland/comments/4p7yhp/man_tries_to_rob_woman_at_knifepoint_in_se/,0,4p7yhp,False,local-news,Local News,False,{},17,False,/r/Portland/comments/4p7yhp/man_tries_to_rob_woman_at_knifepoint_in_se/,1472799283,37,{},[deleted],False,Portland,t5_2qi2i,default,"Man tries to rob woman at knifepoint in SE Portland park, police say",http://www.oregonlive.com/portland/index.ssf/2016/06/man_tries_to_rob_woman_at_knif.html,,,,,
