all_awardings,allow_live_comments,author,author_flair_css_class,author_flair_richtext,author_flair_text,author_flair_type,author_fullname,author_patreon_flair,author_premium,awarders,can_mod_post,contest_mode,created_utc,domain,full_link,gildings,id,is_crosspostable,is_meta,is_original_content,is_reddit_media_domain,is_robot_indexable,is_self,is_video,link_flair_background_color,link_flair_richtext,link_flair_text_color,link_flair_type,locked,media_only,no_follow,num_comments,num_crossposts,over_18,parent_whitelist_status,permalink,pinned,pwls,retrieved_on,score,selftext,send_replies,spoiler,steward_reports,stickied,subreddit,subreddit_id,subreddit_subscribers,subreddit_type,thumbnail,title,total_awards_received,url,whitelist_status,wls,author_flair_background_color,author_flair_text_color,link_flair_css_class,link_flair_text,post_hint,preview,thumbnail_height,thumbnail_width,removed_by_category,author_flair_template_id
[],False,letthefunin,,[],,text,t2_4zsvui0j,False,True,[],False,False,1577230664,self.Portland,https://www.reddit.com/r/Portland/comments/ef8wll/stupid_idiot_question_about_weededibles/,{},ef8wll,True,False,False,False,True,True,False,,[],dark,text,False,False,True,42,0,False,all_ads,/r/Portland/comments/ef8wll/stupid_idiot_question_about_weededibles/,False,6,1577230666,1,"Attack me, it's fine. I'm an idiot. But I have a very close friend, one to whom I may have once been married in fact, who wanted, because of her work situation being federal, me to get her edibles for her stress/anxiety. Ok. I very much still care about her and the holidays can be stressful. Cool.


Weed has never been my thing. She wanted something that would make her relaxed, deal with her anxiety, but not get her high. And keep her high functioning.


My thought was a high CBD, low THC edible. So going on that description that's what I bought.


But then when I sent her a pic, she immediately asked me if it was sativa. I didn't know, it didn't say. I'd spaced that she requested that, among the other requirements.


Long story short, I went back and bought a ""sativa enhanced"" edible, which I noticed has no CBD. It's all THC.


I'm so confused. Which is the best for anxiety while not getting her high and staying high functioning? Or is it one or the other?",True,False,[],False,Portland,t5_2qi2i,142661,public,self,Stupid idiot question about weed/edibles,0,https://www.reddit.com/r/Portland/comments/ef8wll/stupid_idiot_question_about_weededibles/,all_ads,6,,,,,,,,,,
[],False,spacebotanyx,,[],,text,t2_57n18lml,False,False,[],False,False,1577228901,self.Portland,https://www.reddit.com/r/Portland/comments/ef8kaj/found_keys_by_the_goodwill_on_powell_and_100thish/,{},ef8kaj,True,False,False,False,True,True,False,,[],dark,text,False,False,True,0,0,False,all_ads,/r/Portland/comments/ef8kaj/found_keys_by_the_goodwill_on_powell_and_100thish/,False,6,1577228903,1,are they yours? the store had just closed so i couldn't turn them in anywhere.,True,False,[],False,Portland,t5_2qi2i,142660,public,self,found keys by the goodwill on Powell and 100thish,0,https://www.reddit.com/r/Portland/comments/ef8kaj/found_keys_by_the_goodwill_on_powell_and_100thish/,all_ads,6,,,,,,,,,,
[],False,aafeiger,,[],,text,t2_c3bdp,False,False,[],False,False,1577227894,i.redd.it,https://www.reddit.com/r/Portland/comments/ef8d3p/pomegranate_doug_fir_hard_cider/,{},ef8d3p,True,False,False,True,True,False,False,,[],dark,text,False,False,True,3,0,False,all_ads,/r/Portland/comments/ef8d3p/pomegranate_doug_fir_hard_cider/,False,6,1577227895,1,,True,False,[],False,Portland,t5_2qi2i,142657,public,default,Pomegranate &amp; Doug Fir Hard Cider,0,https://i.redd.it/gywak39sun641.jpg,all_ads,6,,,photo,Photo,,,,,,
[],False,honestchips,,[],,text,t2_9vjsb,False,True,[],False,False,1577227574,katu.com,https://www.reddit.com/r/Portland/comments/ef8avg/so_youre_saying_theres_a_chance/,{},ef8avg,True,False,False,False,True,False,False,,[],dark,text,False,False,True,17,0,False,all_ads,/r/Portland/comments/ef8avg/so_youre_saying_theres_a_chance/,False,6,1577227575,1,,True,False,[],False,Portland,t5_2qi2i,142656,public,default,So you're saying there's a chance..,0,https://katu.com/news/local/less-than-1-chance-of-a-white-christmas-for-portland-metro,all_ads,6,,,,,,,,,,
[],False,remotectrl,,[],🌅,text,t2_571j8,False,True,[],False,False,1577223914,oregonhumane.org,https://www.reddit.com/r/Portland/comments/ef7kou/pippin_144lb_9_years_2_months/,{},ef7kou,True,False,False,False,True,False,False,,[],dark,text,False,False,True,7,0,False,all_ads,/r/Portland/comments/ef7kou/pippin_144lb_9_years_2_months/,False,6,1577223915,1,,False,False,[],False,Portland,t5_2qi2i,142653,public,default,"Pippin - 14.4lb, 9 years 2 months",0,https://www.oregonhumane.org/adopt/details/101377/,all_ads,6,,dark,,,,,,,,
[],False,remotectrl,,[],🌅,text,t2_571j8,False,True,[],False,False,1577223834,self.Portland,https://www.reddit.com/r/Portland/comments/ef7k3y/pippin_a_bit_of_a_chonker_at_ohs/,{},ef7k3y,True,False,False,False,True,True,False,,[],dark,text,False,False,True,0,0,False,all_ads,/r/Portland/comments/ef7k3y/pippin_a_bit_of_a_chonker_at_ohs/,False,6,1577223835,1,,True,False,[],False,Portland,t5_2qi2i,142653,public,self,"Pippin, a bit of a chonker, at OHS",0,https://www.reddit.com/r/Portland/comments/ef7k3y/pippin_a_bit_of_a_chonker_at_ohs/,all_ads,6,,dark,,,,,,,,
[],False,PoorlyPlacedWindow,,[],,text,t2_33jez5bq,False,False,[],False,False,1577216367,self.Portland,https://www.reddit.com/r/Portland/comments/ef60vz/lost_spurs_hat/,{},ef60vz,True,False,False,False,True,True,False,,[],dark,text,False,False,True,2,0,False,all_ads,/r/Portland/comments/ef60vz/lost_spurs_hat/,False,6,1577216370,1,"I lost my retro Spurs hat at the Eastport Plaza movie theater. It’s Michel and Ness and means lots to me. To anyone who has it, I would like it back obviously but if not treat it with care and love &lt;3",True,False,[],False,Portland,t5_2qi2i,142649,public,self,Lost Spurs Hat??,0,https://www.reddit.com/r/Portland/comments/ef60vz/lost_spurs_hat/,all_ads,6,,,,,,,,,,
[],False,tacos4eva,,[],,text,t2_h5z6y,False,False,[],False,False,1577215757,self.Portland,https://www.reddit.com/r/Portland/comments/ef5w83/33_yo_new_to_skating_looking_for_another_beginner/,{},ef5w83,True,False,False,False,True,True,False,,[],dark,text,False,False,True,16,0,False,all_ads,/r/Portland/comments/ef5w83/33_yo_new_to_skating_looking_for_another_beginner/,False,6,1577215760,1,"Hi y'all, after spending stupid amounts of time watching skateboarding videos on the web I decided to get a board and see what its like to eat shit IRL. Currently working on manuals with a goal to ride off a curb before 2020. Any other beginners wanna wobble around under covered elementary school bball courts?",True,False,[],False,Portland,t5_2qi2i,142649,public,self,33 y/o new to skating looking for another beginner to sprain wrists with,0,https://www.reddit.com/r/Portland/comments/ef5w83/33_yo_new_to_skating_looking_for_another_beginner/,all_ads,6,,,,,,,,,,
[],False,octohan,,[],,text,t2_135k2e,False,False,[],False,False,1577214946,self.Portland,https://www.reddit.com/r/Portland/comments/ef5q1k/is_there_a_way_to_check_if_a_homeless_person_that/,{},ef5q1k,True,False,False,False,True,True,False,,[],dark,text,False,False,True,30,0,False,all_ads,/r/Portland/comments/ef5q1k/is_there_a_way_to_check_if_a_homeless_person_that/,False,6,1577214948,1,"I don’t know if this is the right sub, let me know if there’s a better sub for this, but I have a homeless friend and I haven’t heard from him in a couple weeks. He hasn’t been on messenger at all in like two weeks and my messages aren’t even delivering, which is very unlike him since it’s the only way he has to communicate with people because nobody has service and can only talk to people on wifi and messenger is the easiest way to do that. 

I’ve already checked multnomah, clackamas, and Washington co jails, and also checked to see if he could have made another Facebook account but any name he would have used didn’t come up. I’m trying not to think of the worst case scenario, but I want to check just to make sure and possibly ease my mind a little bit. He’s had friends that have died by being shot or stabbed, so I’m always worrying about him and checking on him. He goes MIA sometimes, but not like this. When he’s just avoiding people he’s still on messenger or at least on wifi so his messages deliver.

If by any chance you’re homeless or active in the homeless community in downtown, please send me a message. He knows like everybody lol so it’s possible you know him or have mutuals.",True,False,[],False,Portland,t5_2qi2i,142648,public,self,Is there a way to check if a homeless person that doesn’t carry ID died in Portland?,0,https://www.reddit.com/r/Portland/comments/ef5q1k/is_there_a_way_to_check_if_a_homeless_person_that/,all_ads,6,,,homeless,Homeless,,,,,,
[],False,BeatTheBass,,[],,text,t2_83631,False,False,[],False,False,1577213184,self.Portland,https://www.reddit.com/r/Portland/comments/ef5c94/dog_friendly_place_to_watch_a_game_for_lunch_on/,{},ef5c94,True,False,False,False,True,True,False,,[],dark,text,False,False,True,7,0,False,all_ads,/r/Portland/comments/ef5c94/dog_friendly_place_to_watch_a_game_for_lunch_on/,False,6,1577213186,1,Not from the area and trying to watch Liverpool Leicester...,True,False,[],False,Portland,t5_2qi2i,142646,public,self,Dog friendly place to watch a game for lunch on the 26th?,0,https://www.reddit.com/r/Portland/comments/ef5c94/dog_friendly_place_to_watch_a_game_for_lunch_on/,all_ads,6,,,,,,,,,,
[],False,ThePortlandStrangler,,[],,text,t2_4v00kge2,False,False,[],False,False,1577211746,i.redd.it,https://www.reddit.com/r/Portland/comments/ef5124/lets_all_bitch_in_everybody/,{},ef5124,True,False,False,True,True,False,False,,[],dark,text,False,False,True,3,0,False,all_ads,/r/Portland/comments/ef5124/lets_all_bitch_in_everybody/,False,6,1577211751,1,,True,False,[],False,Portland,t5_2qi2i,142645,public,https://b.thumbs.redditmedia.com/XqUnEFzsI2Dn0PuJi9mTFzicDSLXf5qmIx9Sckf0H3s.jpg,Let’s all Bitch In everybody!,0,https://i.redd.it/qzls10urim641.jpg,all_ads,6,,,photo,Photo,image,"{'enabled': True, 'images': [{'id': '82GhFQmPJzKD9nUeLIFYZdAIt47yizNuSWAvIqoO8Uc', 'resolutions': [{'height': 135, 'url': 'https://preview.redd.it/qzls10urim641.jpg?width=108&amp;crop=smart&amp;auto=webp&amp;s=c2331340765274650fc8f3734dcbdf06442fd54f', 'width': 108}, {'height': 270, 'url': 'https://preview.redd.it/qzls10urim641.jpg?width=216&amp;crop=smart&amp;auto=webp&amp;s=6679406e02df69f9822deea262c1730957cd3f48', 'width': 216}, {'height': 400, 'url': 'https://preview.redd.it/qzls10urim641.jpg?width=320&amp;crop=smart&amp;auto=webp&amp;s=6bee0955cfec2cbc19ec6b0c791930bd0ab48610', 'width': 320}, {'height': 800, 'url': 'https://preview.redd.it/qzls10urim641.jpg?width=640&amp;crop=smart&amp;auto=webp&amp;s=462161e641fe767f1f5d77a5fd526cd26ba9c4c8', 'width': 640}, {'height': 1200, 'url': 'https://preview.redd.it/qzls10urim641.jpg?width=960&amp;crop=smart&amp;auto=webp&amp;s=95e0c15ec430fe692b5b7699e5742a5a97875e59', 'width': 960}, {'height': 1350, 'url': 'https://preview.redd.it/qzls10urim641.jpg?width=1080&amp;crop=smart&amp;auto=webp&amp;s=79a44e3c84b5b167d3022a2c6dfabc720af65fd2', 'width': 1080}], 'source': {'height': 1350, 'url': 'https://preview.redd.it/qzls10urim641.jpg?auto=webp&amp;s=d2d6b3f9168bcb05e87ca567e66a8102e649e72d', 'width': 1080}, 'variants': {}}]}",140.0,140.0,,
[],False,GonnaWinSomeday,,[],,text,t2_15w22e7i,False,False,[],False,False,1577210696,self.Portland,https://www.reddit.com/r/Portland/comments/ef4sjm/stay_sober_this_holiday_cuz_hooper_detox_just/,{},ef4sjm,True,False,False,False,True,True,False,,[],dark,text,False,False,True,41,0,False,all_ads,/r/Portland/comments/ef4sjm/stay_sober_this_holiday_cuz_hooper_detox_just/,False,6,1577210698,1,"Not quite sure how to deliver juicy breaking news to the community, but my coworker whose husband works at Hooper told me that all staff got emails last night announcing that Hooper Detox Stabilization Center and CHIERS are both  ceasing operations immediately. All staff are laid off (with 30 days severance pay for union members, at least) and now passed out drunks and junkies will just be dropped off at the ER. Happy Holidays, everybody!",True,False,[],False,Portland,t5_2qi2i,142643,public,self,"Stay sober this holiday, cuz Hooper Detox just shut down",0,https://www.reddit.com/r/Portland/comments/ef4sjm/stay_sober_this_holiday_cuz_hooper_detox_just/,all_ads,6,,,,,,,,,,
[],False,portlandninja,,[],,text,t2_274vv0y6,False,True,[],False,False,1577209938,self.Portland,https://www.reddit.com/r/Portland/comments/ef4mlu/big_shout_out_to_uromuo/,{},ef4mlu,True,False,False,False,True,True,False,,[],dark,text,False,False,True,3,0,False,all_ads,/r/Portland/comments/ef4mlu/big_shout_out_to_uromuo/,False,6,1577209939,1,"thank you thank you thank you, u/romuo, for stepping up for your fellow man and helping me make someone's holiday less gnarly. i was so happy to meet you and find a kindred spirit who was worrying over someone else at this time of year. so we pulled it off and i couldn't have done it without you. YOU. ROCK!",True,False,[],False,Portland,t5_2qi2i,142643,public,self,BIG SHOUT OUT TO u/romuo,0,https://www.reddit.com/r/Portland/comments/ef4mlu/big_shout_out_to_uromuo/,all_ads,6,,,,,,,,,,
[],False,speer360,,[],,text,t2_hmf3a,False,False,[],False,False,1577208388,opb.org,https://www.reddit.com/r/Portland/comments/ef4ae3/study_finds_not_logging_some_northwest_forests/,{},ef4ae3,True,False,False,False,True,False,False,,[],dark,text,False,False,True,55,0,False,all_ads,/r/Portland/comments/ef4ae3/study_finds_not_logging_some_northwest_forests/,False,6,1577208392,1,,True,False,[],False,Portland,t5_2qi2i,142643,public,https://b.thumbs.redditmedia.com/g8NmOEm0ccUtTbhQd8hrA2VKsX0bEfsufTsnIzuV-GY.jpg,Study Finds Not Logging Some Northwest Forests Could Offset Climate Change,0,https://www.opb.org/news/article/climate-change-study-carbon-offset-logging-northwest-forests/,all_ads,6,,,local-news,Local News,link,"{'enabled': False, 'images': [{'id': 'GOE9mA6oPsK8i8BfAICmI2EEHCj5f-ZGUj4CywpC-Oo', 'resolutions': [{'height': 81, 'url': 'https://external-preview.redd.it/g0dos_N9dkXx4r0UQWCl7s9rv61RiEfMGGsvcAYeWp0.jpg?width=108&amp;crop=smart&amp;auto=webp&amp;s=0e22d60922e51a5658cf84aa0f25734700576576', 'width': 108}, {'height': 162, 'url': 'https://external-preview.redd.it/g0dos_N9dkXx4r0UQWCl7s9rv61RiEfMGGsvcAYeWp0.jpg?width=216&amp;crop=smart&amp;auto=webp&amp;s=5b96e4405fe95f7b0fa9d1f3b0ee9123b0c51396', 'width': 216}, {'height': 240, 'url': 'https://external-preview.redd.it/g0dos_N9dkXx4r0UQWCl7s9rv61RiEfMGGsvcAYeWp0.jpg?width=320&amp;crop=smart&amp;auto=webp&amp;s=8c39714ff39d4e000736e76029a80f53f2996ef2', 'width': 320}], 'source': {'height': 300, 'url': 'https://external-preview.redd.it/g0dos_N9dkXx4r0UQWCl7s9rv61RiEfMGGsvcAYeWp0.jpg?auto=webp&amp;s=d9706209c859ce4387e1af91a0492e943ec308d4', 'width': 400}, 'variants': {}}]}",105.0,140.0,,
[],False,guanaco55,,[],Regional Gallowboob,text,t2_hyfa9,False,False,[],False,False,1577207835,oregonlive.com,https://www.reddit.com/r/Portland/comments/ef45xv/on_christmas_a_heart_surgeon_and_his_family_offer/,{},ef45xv,True,False,False,False,True,False,False,,[],dark,text,False,False,True,0,0,False,all_ads,/r/Portland/comments/ef45xv/on_christmas_a_heart_surgeon_and_his_family_offer/,False,6,1577207837,1,,True,False,[],False,Portland,t5_2qi2i,142642,public,default,"On Christmas, a heart surgeon and his family offer a different kind of healing at Providence St. Vincent Medical Center",0,https://www.oregonlive.com/living/2019/12/on-christmas-a-heart-surgeon-and-his-family-offer-a-different-kind-of-healing-at-providence-st-vincent-medical-center.html,all_ads,6,,dark,local-news,Local News,,,,,,
[],False,thorax7,,[],,text,t2_3yawu,False,False,[],False,False,1577207161,kptv.com,https://www.reddit.com/r/Portland/comments/ef40gz/da_woman_indicted_for_telling_portland_food_cart/,{},ef40gz,True,False,False,False,True,False,False,,[],dark,text,False,False,True,119,0,False,all_ads,/r/Portland/comments/ef40gz/da_woman_indicted_for_telling_portland_food_cart/,False,6,1577207163,1,,False,False,[],False,Portland,t5_2qi2i,142642,public,default,"DA: Woman indicted for telling Portland food cart operator to ‘go back to Mexico’, spitting on her chicken",0,https://www.kptv.com/news/da-woman-indicted-for-telling-portland-food-cart-operator-to/article_38b8485c-25fe-11ea-8634-2fca4feb5bed.html,all_ads,6,,,local-news,Local News,,,,,,
[],False,KuckenFones,,[],,text,t2_4x2qhtxr,False,False,[],False,False,1577207006,i.redd.it,https://www.reddit.com/r/Portland/comments/ef3z7e/more_from_portlands_most_important_news_source/,{},ef3z7e,True,False,False,True,True,False,False,,[],dark,text,False,False,True,46,0,False,all_ads,/r/Portland/comments/ef3z7e/more_from_portlands_most_important_news_source/,False,6,1577207010,1,,True,False,[],False,Portland,t5_2qi2i,142643,public,https://b.thumbs.redditmedia.com/GqBzcNoswuX30O143nHhpWusT_LlbdLrQN-xvm2pZYE.jpg,More from Portland’s Most Important News Source,0,https://i.redd.it/x6arggon4m641.jpg,all_ads,6,,,photo,Photo,image,"{'enabled': True, 'images': [{'id': 'Hsmg-D6CafPoBkDiRdjRGoHuu-jRirsIPYgXNmgvjs4', 'resolutions': [{'height': 103, 'url': 'https://preview.redd.it/x6arggon4m641.jpg?width=108&amp;crop=smart&amp;auto=webp&amp;s=811e9ca03496e727f47f52cbaad4b1b3beeba5ff', 'width': 108}, {'height': 206, 'url': 'https://preview.redd.it/x6arggon4m641.jpg?width=216&amp;crop=smart&amp;auto=webp&amp;s=2a72386650b1512da4d045862a404abd14de4771', 'width': 216}, {'height': 305, 'url': 'https://preview.redd.it/x6arggon4m641.jpg?width=320&amp;crop=smart&amp;auto=webp&amp;s=b3be2251f242c8542307eefd3fbab20a09b863eb', 'width': 320}, {'height': 611, 'url': 'https://preview.redd.it/x6arggon4m641.jpg?width=640&amp;crop=smart&amp;auto=webp&amp;s=46f9034994dd24ce08405d4da66f7dd6d0101fb8', 'width': 640}, {'height': 917, 'url': 'https://preview.redd.it/x6arggon4m641.jpg?width=960&amp;crop=smart&amp;auto=webp&amp;s=65fcb35eb9990899ea5c7b391d60be9f3cef2847', 'width': 960}, {'height': 1032, 'url': 'https://preview.redd.it/x6arggon4m641.jpg?width=1080&amp;crop=smart&amp;auto=webp&amp;s=f297c06a978d196e43825ce8fb8d5e4a33f36652', 'width': 1080}], 'source': {'height': 1075, 'url': 'https://preview.redd.it/x6arggon4m641.jpg?auto=webp&amp;s=afd5c4fd92eaffb38a98d5ddab6d7d539096bf68', 'width': 1125}, 'variants': {}}]}",133.0,140.0,,
[],False,natureismychurch,,[],NW,text,t2_wlxnu,False,False,[],False,False,1577206103,kgw.com,https://www.reddit.com/r/Portland/comments/ef3rxs/washington_county_woman_missing_after_hike/,{},ef3rxs,True,False,False,False,True,False,False,,[],dark,text,False,False,True,19,0,False,all_ads,/r/Portland/comments/ef3rxs/washington_county_woman_missing_after_hike/,False,6,1577206104,1,,True,False,[],False,Portland,t5_2qi2i,142643,public,default,Washington County woman missing after hike,0,https://www.kgw.com/article/news/local/missing/washington-county-searching/283-527c45a3-41cb-46dc-974a-4dfb90de12e0,all_ads,6,,dark,local-news,Local News,,,,,,0e3c0f78-4254-11e1-a17b-12313d2c1af1
[],False,natureismychurch,,[],NW,text,t2_wlxnu,False,False,[],False,False,1577206042,self.Portland,https://www.reddit.com/r/Portland/comments/ef3rhk/washington_county_woman_missing_after_hike/,{},ef3rhk,True,False,False,False,True,True,False,,[],dark,text,False,False,True,0,0,False,all_ads,/r/Portland/comments/ef3rhk/washington_county_woman_missing_after_hike/,False,6,1577206043,1,,True,False,[],False,Portland,t5_2qi2i,142643,public,self,Washington County woman missing after hike,0,https://www.reddit.com/r/Portland/comments/ef3rhk/washington_county_woman_missing_after_hike/,all_ads,6,,dark,,,,,,,,0e3c0f78-4254-11e1-a17b-12313d2c1af1
[],False,postymac,,[],,text,t2_5aki3s6j,False,False,[],False,False,1577204852,i.redd.it,https://www.reddit.com/r/Portland/comments/ef3i2b/okay_reddit_do_your_magic_found_at_hotlips_psu/,{},ef3i2b,False,False,False,True,False,False,False,,[],dark,text,False,False,True,5,0,False,all_ads,/r/Portland/comments/ef3i2b/okay_reddit_do_your_magic_found_at_hotlips_psu/,False,6,1577204855,1,,True,False,[],False,Portland,t5_2qi2i,142643,public,https://b.thumbs.redditmedia.com/srEn1wp7hxa0THV97JD0ICtv_d9iR8zMepGgWNbnkdI.jpg,Okay reddit do your Magic. Found at Hotlips psu yesterday or the day before. Seems like it’s got some sentimental value,0,https://i.redd.it/vhgeq4q9yl641.jpg,all_ads,6,,,,,image,"{'enabled': True, 'images': [{'id': '8vaKPd6NJv_YxS4EBZY-BHJ8_FFf6O-nikMUVT-eulQ', 'resolutions': [{'height': 108, 'url': 'https://preview.redd.it/vhgeq4q9yl641.jpg?width=108&amp;crop=smart&amp;auto=webp&amp;s=f897b73ec10e37bc6a2c6894353958d11e5e8ac2', 'width': 108}, {'height': 216, 'url': 'https://preview.redd.it/vhgeq4q9yl641.jpg?width=216&amp;crop=smart&amp;auto=webp&amp;s=8030c114bd680358a23c4e0ef7d977d1e47caed4', 'width': 216}, {'height': 320, 'url': 'https://preview.redd.it/vhgeq4q9yl641.jpg?width=320&amp;crop=smart&amp;auto=webp&amp;s=fa552fa7fa4b86e89447caf2b366b22f97bef020', 'width': 320}, {'height': 640, 'url': 'https://preview.redd.it/vhgeq4q9yl641.jpg?width=640&amp;crop=smart&amp;auto=webp&amp;s=e4eeab11ae27c8696dce60ee535b301c752f660b', 'width': 640}, {'height': 960, 'url': 'https://preview.redd.it/vhgeq4q9yl641.jpg?width=960&amp;crop=smart&amp;auto=webp&amp;s=eb354b22e34a44c1a5767995c04f15b1d9c9f45c', 'width': 960}, {'height': 1080, 'url': 'https://preview.redd.it/vhgeq4q9yl641.jpg?width=1080&amp;crop=smart&amp;auto=webp&amp;s=cd5b7131d8368de894901e755b5b1456da08849a', 'width': 1080}], 'source': {'height': 3024, 'url': 'https://preview.redd.it/vhgeq4q9yl641.jpg?auto=webp&amp;s=7cca96f7b97ef89456e2119d27d06b6ab14d6fe4', 'width': 3024}, 'variants': {}}]}",140.0,140.0,automod_filtered,
[],False,speer360,,[],,text,t2_hmf3a,False,False,[],False,False,1577203798,ijpr.org,https://www.reddit.com/r/Portland/comments/ef39ui/oregon_coastal_towns_confront_a_fate_tied_to/,{},ef39ui,True,False,False,False,True,False,False,,[],dark,text,False,False,True,3,0,False,all_ads,/r/Portland/comments/ef39ui/oregon_coastal_towns_confront_a_fate_tied_to/,False,6,1577203799,1,,True,False,[],False,Portland,t5_2qi2i,142644,public,default,Oregon Coastal Towns Confront A Fate Tied To Antarctica's Melting Glaciers,0,https://www.ijpr.org/post/oregon-coastal-towns-confront-fate-tied-antarcticas-melting-glaciers,all_ads,6,,,,,,,,,,
[],False,TwistedJake503,,[],,text,t2_221af3rj,False,False,[],False,False,1577203093,i.redd.it,https://www.reddit.com/r/Portland/comments/ef34gu/has_anyone_else_made_a_tradition_of_visiting_the/,{},ef34gu,True,False,False,True,True,False,False,,[],dark,text,False,False,True,13,0,False,all_ads,/r/Portland/comments/ef34gu/has_anyone_else_made_a_tradition_of_visiting_the/,False,6,1577203094,1,,True,False,[],False,Portland,t5_2qi2i,142644,public,default,Has anyone else made a tradition of visiting the Santa Clones every year?,0,https://i.redd.it/yojj5qe1tl641.jpg,all_ads,6,,,,,,,,,,
[],False,Zeenakun,,[],,text,t2_1xlpuddk,False,False,[],False,False,1577203087,i.redd.it,https://www.reddit.com/r/Portland/comments/ef34fj/anyone_missing_a_switch_think_i_found_it/,{},ef34fj,True,False,False,True,True,False,False,,[],dark,text,False,False,True,31,0,False,all_ads,/r/Portland/comments/ef34fj/anyone_missing_a_switch_think_i_found_it/,False,6,1577203089,1,,True,False,[],False,Portland,t5_2qi2i,142644,public,default,Anyone missing a switch? Think I found it.,0,https://i.redd.it/zgy9slv0tl641.jpg,all_ads,6,,,photo,Photo,,,,,,
[],False,zas21193,,[],,text,t2_4t5h15eu,False,False,[],False,False,1577202353,self.Portland,https://www.reddit.com/r/Portland/comments/ef2yxj/im_new_to_state_f27_also_my_out_of_state_friend/,{},ef2yxj,True,False,False,False,True,True,False,,[],dark,text,False,False,True,2,0,False,all_ads,/r/Portland/comments/ef2yxj/im_new_to_state_f27_also_my_out_of_state_friend/,False,6,1577202355,1,"Me and my equally out of state friend just decided since we’re both without fam, dealing with a lot of life changes and personal issues, and this new change of scenery to Portland-which is lovely-mainly west side but can travel whenever with max (hopefully-shit keep forgetting it’s almost Christmas!!!) 
We want to go all out, see the festivities, sit on Santa’s lap, see the tree in pioneer, but what else is there? Is there any bars with Christmas parties or any fellows with corporate or fam parties that wouldn’t mind two rather good looking platonic friends in mid-late twenties? Can totally bring a dish or dessert if so! Or just tell me the fun festive bars, lit up neighborhoods, hell even bowling allies!
But seriously any parties Dm me, we will look sharp, and bring a dish and be social butterflies, tell us what’s up (and not closed early) tonight Portlandia!
Sorry for the grammar, mobile. 
Lights, trees, festive areas, festive bars?!
Thanks in advance to dealing with my procrastination and you lovely Portlandians being so kind always. 
DM me anything fun!",True,False,[],False,Portland,t5_2qi2i,142644,public,self,"Im new to state F27, &amp; also my out of state friend M32 haven’t been in Xmas spirit, yet just realized we must take in all festivities before Christmas Eve is over! Help!",0,https://www.reddit.com/r/Portland/comments/ef2yxj/im_new_to_state_f27_also_my_out_of_state_friend/,all_ads,6,,,,,,,,,,
