author,author_created_utc,author_flair_css_class,author_flair_text,author_fullname,contest_mode,created_utc,domain,edited,full_link,gilded,id,is_self,locked,media_embed,num_comments,over_18,permalink,retrieved_on,score,secure_media_embed,selftext,spoiler,stickied,subreddit,subreddit_id,thumbnail,title,url,distinguished,link_flair_css_class,link_flair_text,post_hint,preview,banned_by,media,secure_media
[deleted],,,,,False,1477810716,i.imgur.com,,https://www.reddit.com/r/Portland/comments/5a4yo9/maybe_youll_like_this_flag_instead/,0,5a4yo9,False,False,{},3,False,/r/Portland/comments/5a4yo9/maybe_youll_like_this_flag_instead/,1480288282,0,{},[deleted],False,False,Portland,t5_2qi2i,default,Maybe you'll like this flag instead,http://i.imgur.com/5QORkrU.jpg,,photo,Photo,,,,,
resaka,1316375721.0,,,t2_5vs3f,False,1477809202,self.Portland,,https://www.reddit.com/r/Portland/comments/5a4wat/looking_for_henry_rollins_tickets/,0,5a4wat,True,False,{},7,False,/r/Portland/comments/5a4wat/looking_for_henry_rollins_tickets/,1480288240,0,{},"I didn't realize his New Year's Day show would sell out so soon and missed the boat. Anyone looking to sell one, possibly two tickets to this show?",False,False,Portland,t5_2qi2i,self,Looking for Henry Rollins Ticket(s),https://www.reddit.com/r/Portland/comments/5a4wat/looking_for_henry_rollins_tickets/,,,,,,,,
4aredhead,1377728970.0,,,t2_cxh8t,False,1477804471,self.Portland,,https://www.reddit.com/r/Portland/comments/5a4nuh/please_tell_me_where_to_go_trick_or_treating_ive/,0,5a4nuh,True,False,{},7,False,/r/Portland/comments/5a4nuh/please_tell_me_where_to_go_trick_or_treating_ive/,1480288096,0,{},"I'm obligated to take some foreign exchange students out for the full trick or treating experience, please tell me where to go.

 I fondly remember as a child going up to the mountains and being amazed by the rich folks houses and giving out whole candy bars and busy sidewalks, but it has been over a decade for me.",False,False,Portland,t5_2qi2i,self,"Please tell me where to go trick or treating, I've been out of the loop for YEARS.",https://www.reddit.com/r/Portland/comments/5a4nuh/please_tell_me_where_to_go_trick_or_treating_ive/,,,,,,,,
oahut,1456088428.0,,SW,t2_vd9lw,False,1477802784,twitter.com,,https://www.reddit.com/r/Portland/comments/5a4kkh/mmollenkopf_on_twitter_cant_ride_bikes_on/,0,5a4kkh,False,False,{},6,False,/r/Portland/comments/5a4kkh/mmollenkopf_on_twitter_cant_ride_bikes_on/,1480288040,0,{},,False,False,Portland,t5_2qi2i,http://a.thumbs.redditmedia.com/ZaDtbqVUf0794nEchLZ7yRRSq0lzphBLiHq64Dx5Ca4.jpg,"MMollenkopf on Twitter: ""Can't ride bikes on sidewalks, but @PortlandPolice it's their personal parking spot. #doublestandard #lawsapplytoyou2 https://t.co/il86A8fT1f""",https://twitter.com/mollenkopfmark/status/792090184749752320,,,,link,"{'images': [{'id': '-0LQ8SpMUq44MQN8zUU8q5iWfq_6-6jgL2JnoKWc-_8', 'resolutions': [{'height': 81, 'url': 'https://i.redditmedia.com/qOI0MXY-sU0x6myroaOzVRRC1mIp3xTUevcjApetfIU.jpg?fit=crop&amp;crop=faces%2Centropy&amp;arh=2&amp;w=108&amp;s=88a3c31c037757c975cfb439985887db', 'width': 108}, {'height': 162, 'url': 'https://i.redditmedia.com/qOI0MXY-sU0x6myroaOzVRRC1mIp3xTUevcjApetfIU.jpg?fit=crop&amp;crop=faces%2Centropy&amp;arh=2&amp;w=216&amp;s=f7beb8663d5f4960bee0b348de0a62c6', 'width': 216}, {'height': 240, 'url': 'https://i.redditmedia.com/qOI0MXY-sU0x6myroaOzVRRC1mIp3xTUevcjApetfIU.jpg?fit=crop&amp;crop=faces%2Centropy&amp;arh=2&amp;w=320&amp;s=266c8284e7cc4686761ca09f28145219', 'width': 320}, {'height': 480, 'url': 'https://i.redditmedia.com/qOI0MXY-sU0x6myroaOzVRRC1mIp3xTUevcjApetfIU.jpg?fit=crop&amp;crop=faces%2Centropy&amp;arh=2&amp;w=640&amp;s=715fcb7198fcf5d2027e8cea4e4f4ae1', 'width': 640}, {'height': 720, 'url': 'https://i.redditmedia.com/qOI0MXY-sU0x6myroaOzVRRC1mIp3xTUevcjApetfIU.jpg?fit=crop&amp;crop=faces%2Centropy&amp;arh=2&amp;w=960&amp;s=6bc55513cfafd389f4cf4cad21851736', 'width': 960}, {'height': 810, 'url': 'https://i.redditmedia.com/qOI0MXY-sU0x6myroaOzVRRC1mIp3xTUevcjApetfIU.jpg?fit=crop&amp;crop=faces%2Centropy&amp;arh=2&amp;w=1080&amp;s=9046bf27cd06938afd05210903e095f0', 'width': 1080}], 'source': {'height': 1536, 'url': 'https://i.redditmedia.com/qOI0MXY-sU0x6myroaOzVRRC1mIp3xTUevcjApetfIU.jpg?s=119be2fedfeb2012e0c8a477f3ba11a9', 'width': 2048}, 'variants': {}}]}",,,
MakeMeAnIrishCoffee,1382193277.0,,SE,t2_dkkrb,False,1477797441,imgur.com,,https://www.reddit.com/r/Portland/comments/5a48yw/another_sorry_night_in_portland_why_else_would_i/,0,5a48yw,False,False,{},10,False,/r/Portland/comments/5a48yw/another_sorry_night_in_portland_why_else_would_i/,1480287831,2,{},,False,False,Portland,t5_2qi2i,http://a.thumbs.redditmedia.com/Mz2vTyZ73d_sod-Gi-Tq1Bs2FWf_q7kCWW9SHrK2N98.jpg,Another Sorry! night. In Portland. Why else would I post this here?,http://imgur.com/BYVYw3V,,photo,Photo,link,"{'images': [{'id': '6O-TSZ2rnHIMLw1u91QFQM7XmEFwrAH_r7nKrb73JXo', 'resolutions': [{'height': 81, 'url': 'https://i.redditmedia.com/vWVlAtgsvOZiZhEZEqoMcF8c5dHHHwmQkcMigwD1ThQ.jpg?fit=crop&amp;crop=faces%2Centropy&amp;arh=2&amp;w=108&amp;s=29b3334235923a89074a2e1510632608', 'width': 108}, {'height': 162, 'url': 'https://i.redditmedia.com/vWVlAtgsvOZiZhEZEqoMcF8c5dHHHwmQkcMigwD1ThQ.jpg?fit=crop&amp;crop=faces%2Centropy&amp;arh=2&amp;w=216&amp;s=ae8122a0d90f860c2955a2992cce0db7', 'width': 216}, {'height': 240, 'url': 'https://i.redditmedia.com/vWVlAtgsvOZiZhEZEqoMcF8c5dHHHwmQkcMigwD1ThQ.jpg?fit=crop&amp;crop=faces%2Centropy&amp;arh=2&amp;w=320&amp;s=4593c1772eeca0513eac576cc71f8979', 'width': 320}, {'height': 480, 'url': 'https://i.redditmedia.com/vWVlAtgsvOZiZhEZEqoMcF8c5dHHHwmQkcMigwD1ThQ.jpg?fit=crop&amp;crop=faces%2Centropy&amp;arh=2&amp;w=640&amp;s=27f728d9af6c05bf8faee8279e22ed43', 'width': 640}, {'height': 720, 'url': 'https://i.redditmedia.com/vWVlAtgsvOZiZhEZEqoMcF8c5dHHHwmQkcMigwD1ThQ.jpg?fit=crop&amp;crop=faces%2Centropy&amp;arh=2&amp;w=960&amp;s=3ece0f7ad5457e820db8ba2979eed27f', 'width': 960}, {'height': 810, 'url': 'https://i.redditmedia.com/vWVlAtgsvOZiZhEZEqoMcF8c5dHHHwmQkcMigwD1ThQ.jpg?fit=crop&amp;crop=faces%2Centropy&amp;arh=2&amp;w=1080&amp;s=89937e18b35173a6e0ed46a59111f13c', 'width': 1080}], 'source': {'height': 2448, 'url': 'https://i.redditmedia.com/vWVlAtgsvOZiZhEZEqoMcF8c5dHHHwmQkcMigwD1ThQ.jpg?s=09381318fc0cd69a42d157b9d2153303', 'width': 3264}, 'variants': {}}]}",,,
[deleted],,,,,False,1477796510,self.Portland,1477796780.0,https://www.reddit.com/r/Portland/comments/5a46ut/a_quick_question_about_the_trimet_app/,0,5a46ut,True,False,{},9,False,/r/Portland/comments/5a46ut/a_quick_question_about_the_trimet_app/,1480287791,1,{},[deleted],False,False,Portland,t5_2qi2i,default,A quick question about the Trimet App,https://www.reddit.com/r/Portland/comments/5a46ut/a_quick_question_about_the_trimet_app/,,,,,,,,
[deleted],,,,,False,1477794870,self.Portland,,https://www.reddit.com/r/Portland/comments/5a42z3/crowdfund_me_to_move_to_california/,0,5a42z3,True,False,{},20,False,/r/Portland/comments/5a42z3/crowdfund_me_to_move_to_california/,1480287725,0,{},[deleted],False,False,Portland,t5_2qi2i,default,Crowdfund me to move to California,https://www.reddit.com/r/Portland/comments/5a42z3/crowdfund_me_to_move_to_california/,,,,,,,,
Doyouevenpedal,1467330039.0,,Creston-Kenilworth,t2_z5h64,False,1477794147,koin.com,,https://www.reddit.com/r/Portland/comments/5a41ah/update_to_cyclist_killed_on_st_johns_bridge/,0,5a41ah,False,False,{},107,False,/r/Portland/comments/5a41ah/update_to_cyclist_killed_on_st_johns_bridge/,1480287699,114,{},,False,False,Portland,t5_2qi2i,http://b.thumbs.redditmedia.com/kKpdAttfseMfEUz5Ybjz-3YONubuls9lcRn8TjO0eic.jpg,Update to cyclist killed on St Johns bridge. Driver arrested.,http://koin.com/2016/10/29/st-johns-bridge-closed-after-cyclist-dies-in-crash/,,local-news,Local News,link,"{'images': [{'id': 'p5uI7rlGlPV3leLHmbUt4tCjAt993fzD9HgYp-KfhFA', 'resolutions': [{'height': 81, 'url': 'https://i.redditmedia.com/voJ897Rv6ZkcaMokkGW0yEZWVSW_Jz_R5d6AYDpSrRQ.jpg?fit=crop&amp;crop=faces%2Centropy&amp;arh=2&amp;w=108&amp;s=ca53ac9d774e6d842cae7db4aa16affd', 'width': 108}, {'height': 162, 'url': 'https://i.redditmedia.com/voJ897Rv6ZkcaMokkGW0yEZWVSW_Jz_R5d6AYDpSrRQ.jpg?fit=crop&amp;crop=faces%2Centropy&amp;arh=2&amp;w=216&amp;s=97f04214852437f64571f8a6156530f1', 'width': 216}, {'height': 240, 'url': 'https://i.redditmedia.com/voJ897Rv6ZkcaMokkGW0yEZWVSW_Jz_R5d6AYDpSrRQ.jpg?fit=crop&amp;crop=faces%2Centropy&amp;arh=2&amp;w=320&amp;s=f7f1602ca3fdaa4a5101e75b13fcd52e', 'width': 320}, {'height': 480, 'url': 'https://i.redditmedia.com/voJ897Rv6ZkcaMokkGW0yEZWVSW_Jz_R5d6AYDpSrRQ.jpg?fit=crop&amp;crop=faces%2Centropy&amp;arh=2&amp;w=640&amp;s=8fe83cd862d4a7dc6252d85d610fd5f9', 'width': 640}], 'source': {'height': 480, 'url': 'https://i.redditmedia.com/voJ897Rv6ZkcaMokkGW0yEZWVSW_Jz_R5d6AYDpSrRQ.jpg?s=a548bc4ae58a39a8673ea63632f6e822', 'width': 640}, 'variants': {}}]}",,,
moonjumper13,1403988704.0,,,t2_h6bu5,False,1477793554,self.Portland,,https://www.reddit.com/r/Portland/comments/5a3zvp/do_you_like_bugs_science_art_then_youll_love_one/,0,5a3zvp,True,False,{},48,False,/r/Portland/comments/5a3zvp/do_you_like_bugs_science_art_then_youll_love_one/,1480287675,25,{},"**Bugs are everywhere.** Regardless of place, age, status, etc., everyone knows a bug! Because of their ubiquitousness bugs are often overlooked or ignored in our everyday lives, and many may not know that a miraculous micro world of insects and arachnids exists right under our noses, just waiting to be explored!
    
**Portland Insectarium**: We are an all-women team of biologists, artists, and entrepreneurs with a love of bugs and the desire to bring fantastic science knowledge and experiences to everyone.

**Our Impact**: We believe in promoting diversity within the sciences. Because we are mobile, Portland Insectarium’s BugMobile will allow us to bring educational museum experiences directly to the community, including to those who would otherwise have little access to such activities. 

To realize our vision of a unique mobile museum, we are remodeling a donated 20 ft RV, converting the interior and exterior into exhibit and display space. This involves removing several large appliances from the RV, adding additional counter space, building displays, signage and more. (Thanks to the ADX Portland fabrication team for their awesome assistance in making the BugMobile come to life!)

We believe in the power of hands-on and inquisitive learning. To develop engaging and memorable exhibit experiences we are also in need of equipment for interactive exhibits, such as magnifying glasses, microscopes, signage and visual media. 

**PLEASE DONATE!** Your contribution supports these first stages of Portland's only natural history museum!

https://www.indiegogo.com/projects/portland-insectarium#/

Share your support and follow Portland Insectarium and the BugMobile's transformation:

www.pdxinsectarium.org

www.instagram.com/pdxinsectarium

www.twitter.com/pdxinsectarium

www.facebook.com/portlandinsectarium",False,False,Portland,t5_2qi2i,self,Do you like bugs? Science? Art? Then you'll love one of Portland's newest non-profits – run entirely by women!,https://www.reddit.com/r/Portland/comments/5a3zvp/do_you_like_bugs_science_art_then_youll_love_one/,,,,,,,,
Lostinwanderland13,1477789697.0,,,t2_12gv6s,False,1477790512,self.Portland,,https://www.reddit.com/r/Portland/comments/5a3sdr/standing_rock_carpool/,0,5a3sdr,True,False,{},4,False,/r/Portland/comments/5a3sdr/standing_rock_carpool/,1480287555,1,{},"Portland! I am, as I'm sure you are too, appalled with the current situation in North Dakota. Tensions are rising, it is getting colder, and the need for water protectors and peaceful protesters is greater than ever. 

Sacred Stone Camp, (http://sacredstonecamp.org/faq/) is providing space for protectors who wish to camp on the land. There is much work to do building structures to create a livable space through the winter. There is also much ceremony and prayer to be a part of. 

I am hoping to connect with one or more portlanders with a reliable car to carpool the 19hr drive to Standing Rock. Ideally we would leave the night of November 8 (tuesday) and return on the 13 or 14, but these dates are flexible. 

I can pitch gas money, food, water, tunes.. I will also be bringing as many blankets and supplies I can to leave at standing rock.

I am looking for a respectful, nonviolent person who has felt called to serve as an ally for the Native American tribes at Standing Rock. 

Whos with me? 
",False,False,Portland,t5_2qi2i,self,Standing Rock Carpool,https://www.reddit.com/r/Portland/comments/5a3sdr/standing_rock_carpool/,,,,self,"{'images': [{'id': '7NHRbMMHVyBp80aQ5aDW7waiM7qPGWyGdh03xesJ5YQ', 'resolutions': [{'height': 69, 'url': 'https://i.redditmedia.com/bWf8NTIhal-nVB1DGoaR2mzzM03UcjYwDhnpMLyqz9g.jpg?fit=crop&amp;crop=faces%2Centropy&amp;arh=2&amp;w=108&amp;s=7471c3ae5e25b24faffc11fb2905e71c', 'width': 108}, {'height': 139, 'url': 'https://i.redditmedia.com/bWf8NTIhal-nVB1DGoaR2mzzM03UcjYwDhnpMLyqz9g.jpg?fit=crop&amp;crop=faces%2Centropy&amp;arh=2&amp;w=216&amp;s=54641e52eab2b3c7e64ca1805e0b75ad', 'width': 216}, {'height': 207, 'url': 'https://i.redditmedia.com/bWf8NTIhal-nVB1DGoaR2mzzM03UcjYwDhnpMLyqz9g.jpg?fit=crop&amp;crop=faces%2Centropy&amp;arh=2&amp;w=320&amp;s=4937affe558649cc5323f5ec8d3f5993', 'width': 320}, {'height': 414, 'url': 'https://i.redditmedia.com/bWf8NTIhal-nVB1DGoaR2mzzM03UcjYwDhnpMLyqz9g.jpg?fit=crop&amp;crop=faces%2Centropy&amp;arh=2&amp;w=640&amp;s=38be2626faa60623cff4269d11de5bae', 'width': 640}, {'height': 621, 'url': 'https://i.redditmedia.com/bWf8NTIhal-nVB1DGoaR2mzzM03UcjYwDhnpMLyqz9g.jpg?fit=crop&amp;crop=faces%2Centropy&amp;arh=2&amp;w=960&amp;s=8e7492771b9f024b83891a422a91f272', 'width': 960}], 'source': {'height': 647, 'url': 'https://i.redditmedia.com/bWf8NTIhal-nVB1DGoaR2mzzM03UcjYwDhnpMLyqz9g.jpg?s=1a5a2d592e5310881ea28467546ed7e1', 'width': 1000}, 'variants': {}}]}",,,
BlackberryPierette,1476926229.0,,,t2_1290bb,False,1477790436,self.Portland,,https://www.reddit.com/r/Portland/comments/5a3s6p/halloweening_on_actual_halloween/,0,5a3s6p,True,False,{},14,False,/r/Portland/comments/5a3s6p/halloweening_on_actual_halloween/,1480287551,10,{},"My husband works on Sundays, so we can't go out tonight - but I'm having a hell of a time finding options for Monday night. I'm fine just wearing our costumes out wherever, but I'm hoping someone knows of a venue that's doing something the day of! I know goodfoot &amp; Dante's have events. Anywhere else? ",False,False,Portland,t5_2qi2i,self,Halloween-ing on actual Halloween?,https://www.reddit.com/r/Portland/comments/5a3s6p/halloweening_on_actual_halloween/,,,,,,,,
[deleted],,,,,False,1477787453,i.reddituploads.com,,https://www.reddit.com/r/Portland/comments/5a3kkl/what_is_that_tiny_green_orb_towards_the_bottom/,0,5a3kkl,False,False,{},3,False,/r/Portland/comments/5a3kkl/what_is_that_tiny_green_orb_towards_the_bottom/,1480287430,0,{},[deleted],False,False,Portland,t5_2qi2i,default,What is that tiny green orb towards the bottom left?,https://i.reddituploads.com/18c04c8292c44f7ca5de8214c2ad347b?fit=max&amp;h=1536&amp;w=1536&amp;s=b139b1afac38e953ad55be8c02fbe5f2,,photo,Photo,,,,,
annarchy8,1302217998.0,,,t2_52nmb,False,1477786676,imgur.com,,https://www.reddit.com/r/Portland/comments/5a3ieh/ran_into_unipiper_downton_friday_he_scared_the/,0,5a3ieh,False,False,{},13,False,/r/Portland/comments/5a3ieh/ran_into_unipiper_downton_friday_he_scared_the/,1480287395,65,{},,False,False,Portland,t5_2qi2i,http://b.thumbs.redditmedia.com/L2f8p2aLQ0r6jpsvH7t-orOWupVWYKNbdJNpDj_8XZE.jpg,Ran into Unipiper downton Friday. He scared the shit out of me.,http://imgur.com/52aMqmy,,photo,Photo,link,"{'images': [{'id': 'yuJ8AGeJBwb9gBa1DTqoKigLQZojWs-8GFQJBZ_c-kQ', 'resolutions': [{'height': 108, 'url': 'https://i.redditmedia.com/Cku7Fem-XBu_j81NwzmghyCojRdQWElvDyDItIZHotY.jpg?fit=crop&amp;crop=faces%2Centropy&amp;arh=2&amp;w=108&amp;s=029bd9e5575593ffde59db71780fa7fc', 'width': 108}, {'height': 216, 'url': 'https://i.redditmedia.com/Cku7Fem-XBu_j81NwzmghyCojRdQWElvDyDItIZHotY.jpg?fit=crop&amp;crop=faces%2Centropy&amp;arh=2&amp;w=216&amp;s=fe3c9e437e425474ce5266621acf74ba', 'width': 216}, {'height': 320, 'url': 'https://i.redditmedia.com/Cku7Fem-XBu_j81NwzmghyCojRdQWElvDyDItIZHotY.jpg?fit=crop&amp;crop=faces%2Centropy&amp;arh=2&amp;w=320&amp;s=0e8e89e683e4024517f8eb79b0c86896', 'width': 320}, {'height': 640, 'url': 'https://i.redditmedia.com/Cku7Fem-XBu_j81NwzmghyCojRdQWElvDyDItIZHotY.jpg?fit=crop&amp;crop=faces%2Centropy&amp;arh=2&amp;w=640&amp;s=78211cf3335c6c95694167380cb34f3e', 'width': 640}, {'height': 960, 'url': 'https://i.redditmedia.com/Cku7Fem-XBu_j81NwzmghyCojRdQWElvDyDItIZHotY.jpg?fit=crop&amp;crop=faces%2Centropy&amp;arh=2&amp;w=960&amp;s=8a23da5abb68b130cec3969c1d74a139', 'width': 960}, {'height': 1080, 'url': 'https://i.redditmedia.com/Cku7Fem-XBu_j81NwzmghyCojRdQWElvDyDItIZHotY.jpg?fit=crop&amp;crop=faces%2Centropy&amp;arh=2&amp;w=1080&amp;s=981922a7a4a79af18235c97d3f351b8e', 'width': 1080}], 'source': {'height': 3120, 'url': 'https://i.redditmedia.com/Cku7Fem-XBu_j81NwzmghyCojRdQWElvDyDItIZHotY.jpg?s=3a8a0cde7b20f163610bb210cb7a2226', 'width': 3120}, 'variants': {}}]}",,,
solaceinsleep,1400387623.0,,,t2_gm1xg,False,1477785554,kgw.com,,https://www.reddit.com/r/Portland/comments/5a3fgu/we_asked_86_burglars_how_they_broke_into_homes/,0,5a3fgu,False,False,{},48,False,/r/Portland/comments/5a3fgu/we_asked_86_burglars_how_they_broke_into_homes/,1480287345,99,{},,False,False,Portland,t5_2qi2i,http://a.thumbs.redditmedia.com/G72WhFWakTjqy30bEpvmlDMXVM3mAmNzNTff1WigXR4.jpg,We asked 86 burglars how they broke into homes,http://www.kgw.com/news/investigations/we-asked-86-burglars-how-they-broke-into-homes/344213396,,local-news,Local News,link,"{'images': [{'id': 'kIutuK1UX3aKEpa0HTeePmzhIAAtCd0X8g31SSan23A', 'resolutions': [{'height': 60, 'url': 'https://i.redditmedia.com/iM-7rymk3K5rY1arpqIFsaCUI9GbQZa2xMRxy2ZUCVQ.jpg?fit=crop&amp;crop=faces%2Centropy&amp;arh=2&amp;w=108&amp;s=96cf2d654652f52af101edfb9b9fa3e4', 'width': 108}, {'height': 121, 'url': 'https://i.redditmedia.com/iM-7rymk3K5rY1arpqIFsaCUI9GbQZa2xMRxy2ZUCVQ.jpg?fit=crop&amp;crop=faces%2Centropy&amp;arh=2&amp;w=216&amp;s=3702d06ec8d41821cce438722a0b6fbf', 'width': 216}, {'height': 180, 'url': 'https://i.redditmedia.com/iM-7rymk3K5rY1arpqIFsaCUI9GbQZa2xMRxy2ZUCVQ.jpg?fit=crop&amp;crop=faces%2Centropy&amp;arh=2&amp;w=320&amp;s=c80d8774be3fa9134ca0f78f8683c1f2', 'width': 320}, {'height': 360, 'url': 'https://i.redditmedia.com/iM-7rymk3K5rY1arpqIFsaCUI9GbQZa2xMRxy2ZUCVQ.jpg?fit=crop&amp;crop=faces%2Centropy&amp;arh=2&amp;w=640&amp;s=3f8c801f1b1a2691dbd18a7c4ddb79fa', 'width': 640}], 'source': {'height': 360, 'url': 'https://i.redditmedia.com/iM-7rymk3K5rY1arpqIFsaCUI9GbQZa2xMRxy2ZUCVQ.jpg?s=1c02feda935119525d0b8640837e89b8', 'width': 640}, 'variants': {}}]}",,,
WPPGreg,1456094643.0,,,t2_vdcwv,False,1477784451,soundcloud.com,,https://www.reddit.com/r/Portland/comments/5a3ckv/interview_with_stephanie_kralevich_of_more_good/,0,5a3ckv,False,False,"{'content': '&lt;iframe class=""embedly-embed"" src=""//cdn.embedly.com/widgets/media.html?src=https%3A%2F%2Fw.soundcloud.com%2Fplayer%2F%3Fvisual%3Dtrue%26url%3Dhttp%253A%252F%252Fapi.soundcloud.com%252Ftracks%252F290586844%26show_artwork%3Dtrue&amp;url=https%3A%2F%2Fsoundcloud.com%2Fgregday%2Fstephanie-kralevich-of-kptv&amp;image=http%3A%2F%2Fi1.sndcdn.com%2Fartworks-000191245376-vbiapu-t500x500.jpg&amp;key=2aa3c4d5f3de4f5b9120b660ad850dc9&amp;type=text%2Fhtml&amp;schema=soundcloud"" width=""500"" height=""500"" scrolling=""no"" frameborder=""0"" allowfullscreen&gt;&lt;/iframe&gt;', 'height': 500, 'scrolling': False, 'width': 500}",3,False,/r/Portland/comments/5a3ckv/interview_with_stephanie_kralevich_of_more_good/,1480287298,0,"{'content': '&lt;iframe class=""embedly-embed"" src=""https://cdn.embedly.com/widgets/media.html?src=https%3A%2F%2Fw.soundcloud.com%2Fplayer%2F%3Fvisual%3Dtrue%26url%3Dhttp%253A%252F%252Fapi.soundcloud.com%252Ftracks%252F290586844%26show_artwork%3Dtrue&amp;url=https%3A%2F%2Fsoundcloud.com%2Fgregday%2Fstephanie-kralevich-of-kptv&amp;image=http%3A%2F%2Fi1.sndcdn.com%2Fartworks-000191245376-vbiapu-t500x500.jpg&amp;key=2aa3c4d5f3de4f5b9120b660ad850dc9&amp;type=text%2Fhtml&amp;schema=soundcloud"" width=""500"" height=""500"" scrolling=""no"" frameborder=""0"" allowfullscreen&gt;&lt;/iframe&gt;', 'height': 500, 'scrolling': False, 'width': 500}",,False,False,Portland,t5_2qi2i,http://b.thumbs.redditmedia.com/6FETsqgFwp4__jd-CogEuLZ8D10MXCcJzIk5eCT-AOg.jpg,Interview with Stephanie Kralevich of More Good Day Oregon,https://soundcloud.com/gregday/stephanie-kralevich-of-kptv,,,,link,"{'images': [{'id': '4wgR3j5MDeFt9W7Th5xZ-asKyAoykfp3vSj3_-AbnVQ', 'resolutions': [{'height': 108, 'url': 'https://i.redditmedia.com/-R2JN184RWr-mHXdYrOTpsN_2QTvwWjB5BseGTg2Fr4.jpg?fit=crop&amp;crop=faces%2Centropy&amp;arh=2&amp;w=108&amp;s=59254a5bc0e7a409ae4916518f4ec791', 'width': 108}, {'height': 216, 'url': 'https://i.redditmedia.com/-R2JN184RWr-mHXdYrOTpsN_2QTvwWjB5BseGTg2Fr4.jpg?fit=crop&amp;crop=faces%2Centropy&amp;arh=2&amp;w=216&amp;s=b092d7f85dc5ca3f84db2db3ec5e189b', 'width': 216}, {'height': 320, 'url': 'https://i.redditmedia.com/-R2JN184RWr-mHXdYrOTpsN_2QTvwWjB5BseGTg2Fr4.jpg?fit=crop&amp;crop=faces%2Centropy&amp;arh=2&amp;w=320&amp;s=1510a5ac013d3f1261852073a00a9f87', 'width': 320}], 'source': {'height': 500, 'url': 'https://i.redditmedia.com/-R2JN184RWr-mHXdYrOTpsN_2QTvwWjB5BseGTg2Fr4.jpg?s=80b53693135a89508618cac7533b684c', 'width': 500}, 'variants': {}}]}",,"{'oembed': {'author_name': 'The Weekly Portland Podcast', 'author_url': 'http://soundcloud.com/gregday', 'description': 'Stephanie Kralevich, host of More Good Day Oregon, on pdxpodcast.com', 'height': 500, 'html': '&lt;iframe class=""embedly-embed"" src=""//cdn.embedly.com/widgets/media.html?src=https%3A%2F%2Fw.soundcloud.com%2Fplayer%2F%3Fvisual%3Dtrue%26url%3Dhttp%253A%252F%252Fapi.soundcloud.com%252Ftracks%252F290586844%26show_artwork%3Dtrue&amp;url=https%3A%2F%2Fsoundcloud.com%2Fgregday%2Fstephanie-kralevich-of-kptv&amp;image=http%3A%2F%2Fi1.sndcdn.com%2Fartworks-000191245376-vbiapu-t500x500.jpg&amp;key=2aa3c4d5f3de4f5b9120b660ad850dc9&amp;type=text%2Fhtml&amp;schema=soundcloud"" width=""500"" height=""500"" scrolling=""no"" frameborder=""0"" allowfullscreen&gt;&lt;/iframe&gt;', 'provider_name': 'SoundCloud', 'provider_url': 'http://soundcloud.com', 'thumbnail_height': 500, 'thumbnail_url': 'http://i1.sndcdn.com/artworks-000191245376-vbiapu-t500x500.jpg', 'thumbnail_width': 500, 'title': 'Stephanie Kralevich of KPTV by The Weekly Portland Podcast', 'type': 'rich', 'version': '1.0', 'width': 500}, 'type': 'soundcloud.com'}","{'oembed': {'author_name': 'The Weekly Portland Podcast', 'author_url': 'http://soundcloud.com/gregday', 'description': 'Stephanie Kralevich, host of More Good Day Oregon, on pdxpodcast.com', 'height': 500, 'html': '&lt;iframe class=""embedly-embed"" src=""https://cdn.embedly.com/widgets/media.html?src=https%3A%2F%2Fw.soundcloud.com%2Fplayer%2F%3Fvisual%3Dtrue%26url%3Dhttp%253A%252F%252Fapi.soundcloud.com%252Ftracks%252F290586844%26show_artwork%3Dtrue&amp;url=https%3A%2F%2Fsoundcloud.com%2Fgregday%2Fstephanie-kralevich-of-kptv&amp;image=http%3A%2F%2Fi1.sndcdn.com%2Fartworks-000191245376-vbiapu-t500x500.jpg&amp;key=2aa3c4d5f3de4f5b9120b660ad850dc9&amp;type=text%2Fhtml&amp;schema=soundcloud"" width=""500"" height=""500"" scrolling=""no"" frameborder=""0"" allowfullscreen&gt;&lt;/iframe&gt;', 'provider_name': 'SoundCloud', 'provider_url': 'http://soundcloud.com', 'thumbnail_height': 500, 'thumbnail_url': 'https://i.embed.ly/1/image?url=http%3A%2F%2Fi1.sndcdn.com%2Fartworks-000191245376-vbiapu-t500x500.jpg&amp;key=b1e305db91cf4aa5a86b732cc9fffceb', 'thumbnail_width': 500, 'title': 'Stephanie Kralevich of KPTV by The Weekly Portland Podcast', 'type': 'rich', 'version': '1.0', 'width': 500}, 'type': 'soundcloud.com'}"
TeeFLYNN,1437153946.0,,,t2_ov9f0,False,1477781273,self.Portland,,https://www.reddit.com/r/Portland/comments/5a345o/looking_for_an_awesome_new_haunted_house/,0,5a345o,True,False,{},0,False,/r/Portland/comments/5a345o/looking_for_an_awesome_new_haunted_house/,1480287162,0,{},"Come see our Fearlandia Hospital and Clown Chaos tonight and every night through Halloween 16255 SW Upper Boones Ferry Rd, Tigard, OR 97224!  You can purchase tickets for this hot new haunted house online at fearlandia.com or at the door for shorter lines and a frightfully good time!  The scariest place in Oregon this weekend by far!  See our reviews at http://www.oregonhauntedhouses.com/halloween/fearlandia-or.html",False,False,Portland,t5_2qi2i,self,Looking for an awesome new haunted house?,https://www.reddit.com/r/Portland/comments/5a345o/looking_for_an_awesome_new_haunted_house/,,,,self,"{'images': [{'id': '73em5GBimPgAjG96BfleNoDjp3mg_5kwxA-uZpYBbPM', 'resolutions': [{'height': 56, 'url': 'https://i.redditmedia.com/f1KZoUWhaotZgk63s7bMAGEYXJJGOy2xJ31sjN8x2hY.jpg?fit=crop&amp;crop=faces%2Centropy&amp;arh=2&amp;w=108&amp;s=236ae14867bbdb8304ce3193b338d84b', 'width': 108}, {'height': 113, 'url': 'https://i.redditmedia.com/f1KZoUWhaotZgk63s7bMAGEYXJJGOy2xJ31sjN8x2hY.jpg?fit=crop&amp;crop=faces%2Centropy&amp;arh=2&amp;w=216&amp;s=064981237002b65cf3e06c9a719cfc21', 'width': 216}, {'height': 168, 'url': 'https://i.redditmedia.com/f1KZoUWhaotZgk63s7bMAGEYXJJGOy2xJ31sjN8x2hY.jpg?fit=crop&amp;crop=faces%2Centropy&amp;arh=2&amp;w=320&amp;s=348cb9ebc836a98aeb80caba77326196', 'width': 320}], 'source': {'height': 315, 'url': 'https://i.redditmedia.com/f1KZoUWhaotZgk63s7bMAGEYXJJGOy2xJ31sjN8x2hY.jpg?s=e12e58a2b73ccbb28c7b92a7b5c2b51d', 'width': 600}, 'variants': {}}]}",,,
