all_awardings,allow_live_comments,author,author_flair_css_class,author_flair_richtext,author_flair_text,author_flair_type,author_fullname,author_patreon_flair,author_premium,awarders,can_mod_post,contest_mode,created_utc,domain,full_link,gildings,id,is_crosspostable,is_meta,is_original_content,is_reddit_media_domain,is_robot_indexable,is_self,is_video,link_flair_background_color,link_flair_richtext,link_flair_text_color,link_flair_type,locked,media_only,no_follow,num_comments,num_crossposts,over_18,parent_whitelist_status,permalink,pinned,pwls,retrieved_on,score,selftext,send_replies,spoiler,stickied,subreddit,subreddit_id,subreddit_subscribers,subreddit_type,thumbnail,title,total_awards_received,url,whitelist_status,wls,post_hint,preview,thumbnail_height,thumbnail_width,link_flair_css_class,link_flair_text,author_flair_template_id,author_flair_text_color,author_flair_background_color,removed_by_category,author_cakeday,media,media_embed,secure_media,secure_media_embed
[],False,this_is_Winston,,[],,text,t2_17bcfs,False,False,[],False,False,1584849105,self.Portland,https://www.reddit.com/r/Portland/comments/fmtgbd/anyone_knowledgeable_on_the_laws_about_kicking_a/,{},fmtgbd,True,False,False,False,True,True,False,,[],dark,text,False,False,True,27,0,False,all_ads,/r/Portland/comments/fmtgbd/anyone_knowledgeable_on_the_laws_about_kicking_a/,False,6,1584849106,1,"A let a friend move in at the end of January. They're not paying me any rent, we just had a verbal agreement they'd help with utilities. Was supposed to be just for one month. They did have their address changed to my address with the post office if that matters. I'm wondering if they're protected by the law and I'd have to go through an eviction process or if I'm legally allowed to tell them they have to leave.",True,False,False,Portland,t5_2qi2i,149101,public,self,Anyone knowledgeable on the laws about kicking a guest out of your house?,0,https://www.reddit.com/r/Portland/comments/fmtgbd/anyone_knowledgeable_on_the_laws_about_kicking_a/,all_ads,6,,,,,,,,,,,,,,,
[],False,stankyjuice,,[],,text,t2_fslup,False,False,[],False,False,1584848443,i.redd.it,https://www.reddit.com/r/Portland/comments/fmta98/we_made_another_flower_mandalathanks_for_then/,{},fmta98,True,False,False,True,True,False,False,,[],dark,text,False,False,True,22,0,False,all_ads,/r/Portland/comments/fmta98/we_made_another_flower_mandalathanks_for_then/,False,6,1584848445,1,,True,False,False,Portland,t5_2qi2i,149098,public,default,We made another flower mandala...thanks for then inspiration reddit 🥰,0,https://i.redd.it/j0z70g0ka5o41.jpg,all_ads,6,,,,,photo,Photo,,,,,True,,,,
[],False,thresher97024,,[],,text,t2_2ksq22w1,False,False,[],False,False,1584847875,self.Portland,https://www.reddit.com/r/Portland/comments/fmt59n/social_distancing/,{},fmt59n,True,False,False,False,True,True,False,,[],dark,text,False,False,True,0,0,False,all_ads,/r/Portland/comments/fmt59n/social_distancing/,False,6,1584847876,1,"Wanted to feed the ducks at the lake today but too many people. So, I went to the living room to feed the cats!

#socialdistancing


[](https://i.imgur.com/4QFlhWs.jpg)",True,False,False,Portland,t5_2qi2i,149098,public,self,Social Distancing,0,https://www.reddit.com/r/Portland/comments/fmt59n/social_distancing/,all_ads,6,,,,,,,,,,,,,,,
[],False,chofstone,,[],,text,t2_4ata5,False,False,[],False,False,1584846596,self.Portland,https://www.reddit.com/r/Portland/comments/fmsu8q/it_is_not_often_that_the_ineffectiveness_of_a/,{},fmsu8q,True,False,False,False,True,True,False,,[],dark,text,False,False,True,16,0,False,all_ads,/r/Portland/comments/fmsu8q/it_is_not_often_that_the_ineffectiveness_of_a/,False,6,1584846597,1,"Ms. Brown, how will history judge the effectiveness of your government? 

The choices you make will have a lasting impact and be a case study for years to come.",True,False,False,Portland,t5_2qi2i,149097,public,self,It is not often that the ineffectiveness of a government can be measured by a death count,0,https://www.reddit.com/r/Portland/comments/fmsu8q/it_is_not_often_that_the_ineffectiveness_of_a/,all_ads,6,,,,,,,,,,,,,,,
[],False,rpunx,,[],,text,t2_hwlvr,False,False,[],False,False,1584846397,youtube.com,https://www.reddit.com/r/Portland/comments/fmsscc/she_was_adamant_that_having_a_working_phone_was/,{},fmsscc,True,False,False,False,True,False,False,,[],dark,text,False,False,True,6,0,False,all_ads,/r/Portland/comments/fmsscc/she_was_adamant_that_having_a_working_phone_was/,False,6,1584846398,1,,True,False,False,Portland,t5_2qi2i,149097,public,default,She was adamant that having a working phone was an essential service!,0,https://www.youtube.com/watch?v=bYCG0vwC0aM&amp;feature=youtu.be,all_ads,6,,,,,,,,,,,,,,,
[],False,niewinski,,[],Goose Hollow,text,t2_4vyyz,False,True,[],False,False,1584845407,i.redd.it,https://www.reddit.com/r/Portland/comments/fmsjhq/rent_strike_dont_pay_april_rent_we_have_power_if/,{},fmsjhq,True,False,False,True,True,False,False,,[],dark,text,False,False,True,39,0,False,all_ads,/r/Portland/comments/fmsjhq/rent_strike_dont_pay_april_rent_we_have_power_if/,False,6,1584845409,1,,True,False,False,Portland,t5_2qi2i,149095,public,default,Rent strike! Don’t pay April rent. We have power if we stand together,0,https://i.redd.it/3enofp5j15o41.jpg,all_ads,6,,,,,photo,Photo,5580b8e0-42ca-11e1-9514-12313d18ad57,dark,,,,,,,
[],False,LittleElevator6,,[],,text,t2_5zwmm099,False,False,[],False,False,1584845283,self.Portland,https://www.reddit.com/r/Portland/comments/fmsic6/liquor_delivery/,{},fmsic6,False,False,False,False,False,True,False,,[],dark,text,False,False,True,10,0,False,all_ads,/r/Portland/comments/fmsic6/liquor_delivery/,False,6,1584845285,1,[removed],True,False,False,Portland,t5_2qi2i,149095,public,self,Liquor delivery?,0,https://www.reddit.com/r/Portland/comments/fmsic6/liquor_delivery/,all_ads,6,,,,,,,,,,automod_filtered,,,,,
[],False,arnuga,,[],,text,t2_4a9vo,False,False,[],False,False,1584844978,self.Portland,https://www.reddit.com/r/Portland/comments/fmsfqx/is_the_food_supply_chain_really_intact/,{},fmsfqx,True,False,False,False,True,True,False,,[],dark,text,False,False,True,22,0,False,all_ads,/r/Portland/comments/fmsfqx/is_the_food_supply_chain_really_intact/,False,6,1584844980,1,"My first trip in a week to my local freddies. Last time I watched the paper towels, toilet paper, etc all being bought up by hoarders. Many frozen items such as veggies, burritos, chicken items of various kinds were clear targets and in low supply. Here 


Here we are a week later and guess what, all those items are still out, beer was refreshed (thank the maker!), milk was good, fresh fruit and veg was all good. So what's up with paper products, frozen foods and meats? Is the supply chain really still working? Honestly I'd expected the opposite, fresh items to to low and frozen crap to be in great supply. What am I missing?",True,False,False,Portland,t5_2qi2i,149095,public,self,Is the food supply chain really intact?,0,https://www.reddit.com/r/Portland/comments/fmsfqx/is_the_food_supply_chain_really_intact/,all_ads,6,,,,,,,,,,,,,,,
[],False,Theresbeerinthefridg,,[],,text,t2_jj95r,False,False,[],False,False,1584844853,self.Portland,https://www.reddit.com/r/Portland/comments/fmselv/what_tomato_varieties_do_yall_grow/,{},fmselv,True,False,False,False,True,True,False,,[],dark,text,False,False,True,20,0,False,all_ads,/r/Portland/comments/fmselv/what_tomato_varieties_do_yall_grow/,False,6,1584844854,1,"I've had pretty terrible luck with tomatoes in my garden the last few years. Last year was devastating - the plants grew well bur the fruit all rotted at the bottom (I believe that's some sort of deficiency I can address). The couple of years prior to that were better but I still got a lot of split fruit and other issues. 

This year I'm determined to have my best tomato year ever, and I want to start with the perfect varieties. What varieties do you swear by? Any other advice will also be greatly appreciated!",True,False,False,Portland,t5_2qi2i,149096,public,self,What tomato varieties do y'all grow?,0,https://www.reddit.com/r/Portland/comments/fmselv/what_tomato_varieties_do_yall_grow/,all_ads,6,,,,,,,,,,,,,,,
[],False,BoxoRocks188,,[],,text,t2_4en1n8f5,False,False,[],False,False,1584844638,dailyastorian.com,https://www.reddit.com/r/Portland/comments/fmsct0/stop_coming_to_the_coast_stay_home_just_making/,{},fmsct0,True,False,False,False,True,False,False,,[],dark,text,False,False,True,27,0,False,all_ads,/r/Portland/comments/fmsct0/stop_coming_to_the_coast_stay_home_just_making/,False,6,1584844641,1,,True,False,False,Portland,t5_2qi2i,149095,public,https://b.thumbs.redditmedia.com/rtbQs8e5evCV2m4_Ug390QulHSf3IOJhfpXDZ5OJF8g.jpg,Stop coming to the coast. Stay home just making things worse.,0,https://www.dailyastorian.com/coronavirus/north-coast-leaders-appeal-to-tourists-to-stay-away-over/article_76c6e312-6bde-11ea-8a87-93dd6daf3466.html,all_ads,6,link,"{'enabled': False, 'images': [{'id': 'IMTUYGBZIL7FD2jJVZnFY_pr2YyuyR8D3vnkqAZco9o', 'resolutions': [{'height': 101, 'url': 'https://external-preview.redd.it/L5_MOEKNud_1d-juBUWaZI1wvZLnSsV76MZ6IL9lrl8.jpg?width=108&amp;crop=smart&amp;auto=webp&amp;s=0962f0621fd0699794cf98d5a4d31bf1b9d4f8b5', 'width': 108}, {'height': 203, 'url': 'https://external-preview.redd.it/L5_MOEKNud_1d-juBUWaZI1wvZLnSsV76MZ6IL9lrl8.jpg?width=216&amp;crop=smart&amp;auto=webp&amp;s=eb7811c4a0b12b0263aff4585b6230ecc747f650', 'width': 216}, {'height': 301, 'url': 'https://external-preview.redd.it/L5_MOEKNud_1d-juBUWaZI1wvZLnSsV76MZ6IL9lrl8.jpg?width=320&amp;crop=smart&amp;auto=webp&amp;s=2ab1bdca946ddf8b05e5bdcdbd44035613af5216', 'width': 320}, {'height': 602, 'url': 'https://external-preview.redd.it/L5_MOEKNud_1d-juBUWaZI1wvZLnSsV76MZ6IL9lrl8.jpg?width=640&amp;crop=smart&amp;auto=webp&amp;s=d14b37ee73bee7c519c3ac5226cf5755b74dfde7', 'width': 640}], 'source': {'height': 630, 'url': 'https://external-preview.redd.it/L5_MOEKNud_1d-juBUWaZI1wvZLnSsV76MZ6IL9lrl8.jpg?auto=webp&amp;s=f6042433db549efea3a1599eae7c0ed014fb3fe5', 'width': 669}, 'variants': {}}]}",131.0,140.0,,,,,,,,,,,
[],False,Doyouevenpedal,,[],,text,t2_z5h64,False,False,[],False,False,1584844595,self.Portland,https://www.reddit.com/r/Portland/comments/fmscfq/what_new_recipes_are_you_making_during_your/,{},fmscfq,True,False,False,False,True,True,False,,[],dark,text,False,False,True,53,0,False,all_ads,/r/Portland/comments/fmscfq/what_new_recipes_are_you_making_during_your/,False,6,1584844597,1,"Since we are all at home and cooking (and definitely not going to the beach.) What new recipes have you tried or plan on making? Tonight I am making Mapu tofu with ground pork, and stir fried baby bok choy with spinach. I've attempted this recipe once before but didn't have all the ingredients that I needed. I don't cook as much as I should so this has been a good opportunity to make foods that I wouldn't do otherwise.",True,False,False,Portland,t5_2qi2i,149095,public,self,What new recipes are you making during your quarantine?,0,https://www.reddit.com/r/Portland/comments/fmscfq/what_new_recipes_are_you_making_during_your/,all_ads,6,,,,,,,,,,,,,,,
[],False,mxzebrax,,[],,text,t2_iodes,False,False,[],False,False,1584844086,self.Portland,https://www.reddit.com/r/Portland/comments/fms7yj/warrenton_gives_tourist_24_hours_to_vacate/,{},fms7yj,True,False,False,False,True,True,False,,[],dark,text,False,False,True,81,0,False,all_ads,/r/Portland/comments/fms7yj/warrenton_gives_tourist_24_hours_to_vacate/,False,6,1584844088,1,"(Small town, all on Facebook for now, so no link. Here’s the story). 


WARRENTON GIVES TOURISTS 24 HOURS TO GET OUT OF TOWN

By Cindy Yingst
The Columbia Press
Tourists have 24 hours to get out of town or face arrest.
Warrenton city commissioners took the stance after thousands of people from elsewhere arrived in town Friday and Saturday, clogging highways 30, 26 and 101.
Warrenton called an emergency meeting at 5 p.m. Saturday, first issuing a state of emergency because of the COVID-19 outbreak and then taking further action to prevent those from other areas coming here on vacations and spring break or for simple recreation and endangering residents.
“This is a serious event and it’s also a major event,” Mayor Henry Balensifer said earlier in the day during a livestream broadcast. “Our top priority is doing what we need to do for the best interest of our citizens.”
Resolution 2565, “To ensure the public health and safety of the citizens of Warrenton and to avoid unnecessary risks to hospital surge in Clatsop County,” makes the following orders:
All camping is closed at Warrenton and Hammond marinas.
All camping is closed at KOA, Fort Stevens State Park, Kampers West and Hammond Marina RV Park. An exception is made for permanent residents, camp hosts, employees and anyone living as a long-term resident of the facilities who were residents with contracts before March 11 – when the virus was declared a pandemic.
All stays in short-term rentals, home-stay lodging and B&amp;Bs are prohibited.
All hotels within city limits are closed except for current users registered for longer than 30 days and as authorized by the county, state or federal health authorities. So long-term contractors already staying in the city’s hotels may remain.
All camping on private property, except by order of the police chief or state, is prohibited.
The resolution takes effect immediately and those affected have 24 hours to vacate.
The vote was unanimous with Balensifer, Tom Dyer, Rick Newton and Mark Baldwin at City Hall – separated by 6 feet – and Pam Ackley via telephone.
The resolution will be enforced by Warrenton Police and four officers were at City Hall for the Saturday meeting, including Chief Matt Workman. 
“We’re prepared for that,” Workman told commissioners. “I’ve spoken with Sheriff Phillips and he will provide us with any additional resources as needed.”
The offense – remaining in town after the 24 hours – is a class C misdemeanor “and that is an arrestable offense,” he said.
“I would hope that the majority of the folks that are affected by this order … will cooperatively work with the city so as not to tax the limited resources we have,” City Manager Linda Engbretson said.
Officers will contact managers of the campgrounds and hotels and they’re expected to take action to clear out their facilities.
Balensifer said he’d spoken with county officials, County Commissioner Mark Kujala and state Senator Betsy Johnson and all are aware of the city’s action and support it.
“We’re not making this decision in a vacuum.”",True,False,False,Portland,t5_2qi2i,149093,public,self,Warrenton gives tourist 24 hours to vacate.,0,https://www.reddit.com/r/Portland/comments/fms7yj/warrenton_gives_tourist_24_hours_to_vacate/,all_ads,6,,,,,,,,,,,,,,,
[],False,TexasWithADollarsign,,[],Shari's Cafe & Pies,text,t2_4a7gx,False,False,[],False,False,1584843759,wweek.com,https://www.reddit.com/r/Portland/comments/fms50o/anxious_oregonians_head_for_the_woods_creating_a/,{},fms50o,True,False,False,False,True,False,False,,[],dark,text,False,False,True,37,0,False,all_ads,/r/Portland/comments/fms50o/anxious_oregonians_head_for_the_woods_creating_a/,False,6,1584843760,1,,True,False,False,Portland,t5_2qi2i,149091,public,default,"Anxious Oregonians Head for the Woods, Creating a Traffic Jam in the Columbia River Gorge",0,https://www.wweek.com/outdoors/2020/03/20/anxious-oregonians-head-for-the-woods-creating-a-traffic-jam-in-the-columbia-river-gorge/,all_ads,6,,,,,,,9913fd3a-c71f-11e7-813c-0e6c07f3cce2,dark,,,,,,,
[],False,salmonmangochipotle,,[],,text,t2_5scl8fcz,False,False,[],False,False,1584843472,wweek.com,https://www.reddit.com/r/Portland/comments/fms2hd/people_are_packing_the_oregon_coast_despite/,{},fms2hd,False,False,False,False,False,False,False,,[],dark,text,False,False,True,1,0,False,all_ads,/r/Portland/comments/fms2hd/people_are_packing_the_oregon_coast_despite/,False,6,1584843473,1,,True,False,False,Portland,t5_2qi2i,149091,public,https://b.thumbs.redditmedia.com/0W_xYbqqVZQpj2QelanGEi2v5PjseuPV3YYCtrkhGso.jpg,People Are Packing the Oregon Coast Despite Warnings to Stay Home,0,https://www.wweek.com/news/2020/03/21/people-are-packing-the-oregon-coast-despite-warnings-to-stay-home/,all_ads,6,link,"{'enabled': False, 'images': [{'id': 'DMYa9otkBbzG-xZoAKeow5-Vu1we0EdBHnYfyr4LJYE', 'resolutions': [{'height': 60, 'url': 'https://external-preview.redd.it/mmI_T7xtUiblmoxJJW27PpBjtDuXQWOXDY3CxiDIVKw.jpg?width=108&amp;crop=smart&amp;auto=webp&amp;s=93391d10044c79d90f332c538098285b831351c1', 'width': 108}, {'height': 121, 'url': 'https://external-preview.redd.it/mmI_T7xtUiblmoxJJW27PpBjtDuXQWOXDY3CxiDIVKw.jpg?width=216&amp;crop=smart&amp;auto=webp&amp;s=019e5986976fd11ce576379681f18668abaa88f8', 'width': 216}, {'height': 180, 'url': 'https://external-preview.redd.it/mmI_T7xtUiblmoxJJW27PpBjtDuXQWOXDY3CxiDIVKw.jpg?width=320&amp;crop=smart&amp;auto=webp&amp;s=b9b5ba060f4d25c93c45724a675cdda36e4f4f85', 'width': 320}, {'height': 360, 'url': 'https://external-preview.redd.it/mmI_T7xtUiblmoxJJW27PpBjtDuXQWOXDY3CxiDIVKw.jpg?width=640&amp;crop=smart&amp;auto=webp&amp;s=bced6f23027bb7dca3c22bbb988a7096f0395315', 'width': 640}, {'height': 540, 'url': 'https://external-preview.redd.it/mmI_T7xtUiblmoxJJW27PpBjtDuXQWOXDY3CxiDIVKw.jpg?width=960&amp;crop=smart&amp;auto=webp&amp;s=f05810638c8e2421615eba20dc0b214e9c9bc3c6', 'width': 960}, {'height': 607, 'url': 'https://external-preview.redd.it/mmI_T7xtUiblmoxJJW27PpBjtDuXQWOXDY3CxiDIVKw.jpg?width=1080&amp;crop=smart&amp;auto=webp&amp;s=4383e8805133a97e36fc3c905c08caffc1d0571e', 'width': 1080}], 'source': {'height': 675, 'url': 'https://external-preview.redd.it/mmI_T7xtUiblmoxJJW27PpBjtDuXQWOXDY3CxiDIVKw.jpg?auto=webp&amp;s=593cd6aa2311b31c464a25dc01ebe27a70cd79bd', 'width': 1200}, 'variants': {}}]}",78.0,140.0,,,,,,moderator,,,,,
[],False,drewskie_drewskie,,[],SE,text,t2_djvyu,False,False,[],False,False,1584843015,self.Portland,https://www.reddit.com/r/Portland/comments/fmryev/sushi_anyone/,{},fmryev,True,False,False,False,True,True,False,,[],dark,text,False,False,True,4,0,False,all_ads,/r/Portland/comments/fmryev/sushi_anyone/,False,6,1584843016,1,"The owner of Uchu sushi went in yesterday to buy sushi for his family and tipped his employees $40.  He's doing everything he can to keep the lights on and support his employees who can't get unemployment.  I don't know how long he can stay in business.  In light of bunch stories of bosses doing the wrong things, I promise this guy is doing everything he can to support his employees. 

(503) 281-8248",True,False,False,Portland,t5_2qi2i,149089,public,self,Sushi anyone?,0,https://www.reddit.com/r/Portland/comments/fmryev/sushi_anyone/,all_ads,6,,,,,,,,dark,,,,,,,
[],False,vatra23,,[],,text,t2_285ophi2,False,False,[],False,False,1584842912,i.redd.it,https://www.reddit.com/r/Portland/comments/fmrxi4/socks_it_is/,{},fmrxi4,True,False,False,True,True,False,False,,[],dark,text,False,False,True,5,0,False,all_ads,/r/Portland/comments/fmrxi4/socks_it_is/,False,6,1584842914,1,,True,False,False,Portland,t5_2qi2i,149088,public,https://b.thumbs.redditmedia.com/IewKfWr52N7X8FU02BbOvw1BXtRnLrIgw26TtavtLdc.jpg,Socks it is!,0,https://i.redd.it/xzbfxh35u4o41.jpg,all_ads,6,image,"{'enabled': True, 'images': [{'id': 'MHB_j0SfW0tGLrBZpXjUdaNFFk11BdENWF5AULD5mCQ', 'resolutions': [{'height': 192, 'url': 'https://preview.redd.it/xzbfxh35u4o41.jpg?width=108&amp;crop=smart&amp;auto=webp&amp;s=1d289e685be49441e3d3c39b5eb63e60bf4e3e82', 'width': 108}, {'height': 384, 'url': 'https://preview.redd.it/xzbfxh35u4o41.jpg?width=216&amp;crop=smart&amp;auto=webp&amp;s=18833b6a444fe729f2a5ac49f3ba9353dfeaa839', 'width': 216}, {'height': 569, 'url': 'https://preview.redd.it/xzbfxh35u4o41.jpg?width=320&amp;crop=smart&amp;auto=webp&amp;s=f6592c048121c58cabd8a4d3d5b6518b59a94752', 'width': 320}, {'height': 1138, 'url': 'https://preview.redd.it/xzbfxh35u4o41.jpg?width=640&amp;crop=smart&amp;auto=webp&amp;s=4cc97f71e4879f9bbf9ea850f247bab99647f64f', 'width': 640}], 'source': {'height': 1334, 'url': 'https://preview.redd.it/xzbfxh35u4o41.jpg?auto=webp&amp;s=ee1c6f57e790a751d9fd06aa2124d96d1c7c0ae6', 'width': 750}, 'variants': {}}]}",140.0,140.0,photo,Photo,,,,,,,,,
[],False,Yeh_Old_Rums,,[],,text,t2_5y5j6smg,False,False,[],False,False,1584841262,self.Portland,https://www.reddit.com/r/Portland/comments/fmrir5/i_played_golf_today_i_was_relatively_34_feet_from/,{},fmrir5,True,False,False,False,True,True,False,,[],dark,text,False,False,True,8,0,False,all_ads,/r/Portland/comments/fmrir5/i_played_golf_today_i_was_relatively_34_feet_from/,False,6,1584841263,1,,False,False,False,Portland,t5_2qi2i,149086,public,self,I played golf today. I was relatively (3-4 feet) from 2-3 people for short periods of time and a few feet from an employee twice. I also swiped my Debit card and entered my pin. Should I be ashamed and afraid or perfectly fine with maximum distance and get little contact?,0,https://www.reddit.com/r/Portland/comments/fmrir5/i_played_golf_today_i_was_relatively_34_feet_from/,all_ads,6,,,,,,,,,,,,,,,
[],False,chiefbrody62,,[],,text,t2_l1ev1,False,False,[],False,False,1584841130,self.Portland,https://www.reddit.com/r/Portland/comments/fmrhn7/having_a_date_over_tonight_is_that_a_bad_idea_she/,{},fmrhn7,True,False,False,False,True,True,False,,[],dark,text,False,False,True,25,0,False,all_ads,/r/Portland/comments/fmrhn7/having_a_date_over_tonight_is_that_a_bad_idea_she/,False,6,1584841132,1,Or is that being risky?,True,False,False,Portland,t5_2qi2i,149086,public,self,"Having a date over tonight, is that a bad idea? She was here about a week ago and hasn't really left her house much since then.",0,https://www.reddit.com/r/Portland/comments/fmrhn7/having_a_date_over_tonight_is_that_a_bad_idea_she/,all_ads,6,,,,,,,,,,,,,,,
[],False,mmmmmmtoast,,[],,text,t2_dv1oq,False,False,[],False,False,1584841103,self.Portland,https://www.reddit.com/r/Portland/comments/fmrhf7/let_it_rain/,{},fmrhf7,True,False,False,False,True,True,False,,[],dark,text,False,False,True,37,0,False,all_ads,/r/Portland/comments/fmrhf7/let_it_rain/,False,6,1584841105,1,"Excited for the rain next week. It’ll really keep people inside, like my roommate who won’t stop going to the fucking skatepark and smoking weed with random people he meets there because it’s packed. He’s a 28 yo man but won’t take this seriously. It’ll be natures way of saying please shelter in place :)",True,False,False,Portland,t5_2qi2i,149086,public,self,LET IT RAIN!,0,https://www.reddit.com/r/Portland/comments/fmrhf7/let_it_rain/,all_ads,6,,,,,,,,,,,,,,,
[],False,sarcasticDNA,,[],,text,t2_3mf49wtw,False,False,[],False,False,1584839523,self.Portland,https://www.reddit.com/r/Portland/comments/fmr32f/tv_reporters_on_scene/,{},fmr32f,True,False,False,False,True,True,False,,[],dark,text,False,False,True,15,0,False,all_ads,/r/Portland/comments/fmr32f/tv_reporters_on_scene/,False,6,1584839524,1,"Does anyone else find this wrong-headed? WHY does a reporter need to be in front of a closed restaurant, in front of a hospital, or standing in Waterfront Park, or (worst) interviewing people about what they are doing out and about? Standing there to report that people are two inches rather than six feet apart? Interviewing respiratory therapists in person when they could be talking to them via phone or video? These reporters aren't practicing physical distancing, nor is it ""essential"" activity. No reporter needs to be on that crowded beach talking to the revelers/violators? I just shake my head that local and national news organizations are sending people even onto the streets of Italy to report on what is and isn't happening there.",True,False,False,Portland,t5_2qi2i,149085,public,self,TV reporters on scene,0,https://www.reddit.com/r/Portland/comments/fmr32f/tv_reporters_on_scene/,all_ads,6,,,,,,,,,,,,,,,
[],False,kristabrewer,,[],,text,t2_17jl4mt6,False,False,[],False,False,1584839407,self.Portland,https://www.reddit.com/r/Portland/comments/fmr238/anybody_been_to_costco_today/,{},fmr238,True,False,False,False,True,True,False,,[],dark,text,False,False,True,16,0,False,all_ads,/r/Portland/comments/fmr238/anybody_been_to_costco_today/,False,6,1584839409,1,Just wondering if it's super crazy just need regular groceries!,True,False,False,Portland,t5_2qi2i,149085,public,self,Anybody been to costco today?,0,https://www.reddit.com/r/Portland/comments/fmr238/anybody_been_to_costco_today/,all_ads,6,,,,,,,,,,,,,,,
[],False,peppymyers,,[],,text,t2_4dfvzrfc,False,False,[],False,False,1584838831,i.redd.it,https://www.reddit.com/r/Portland/comments/fmqwwy/pandemic_not_at_the_home_depot/,{},fmqwwy,True,False,False,True,True,False,False,,[],dark,text,False,False,True,27,0,False,all_ads,/r/Portland/comments/fmqwwy/pandemic_not_at_the_home_depot/,False,6,1584838832,1,,True,False,False,Portland,t5_2qi2i,149085,public,default,Pandemic? Not at the Home Depot!,0,https://i.redd.it/etc4cod0i4o41.jpg,all_ads,6,,,,,,,,,,,,,,,
