author,author_created_utc,author_flair_css_class,author_flair_text,author_fullname,created_utc,domain,full_link,gilded,id,is_self,media_embed,num_comments,over_18,permalink,retrieved_on,score,secure_media_embed,selftext,stickied,subreddit,subreddit_id,thumbnail,title,url,edited,media,secure_media
Hugetuboguts,1423485687.0,,,t2_l97lf,1423636829,oregonlive.com,https://www.reddit.com/r/Portland/comments/2vigep/guns_drugs_cash_seized_during_police_raid_of_se/,0,2vigep,False,{},8,False,/r/Portland/comments/2vigep/guns_drugs_cash_seized_during_police_raid_of_se/,1440914138,5,{},,False,Portland,t5_2qi2i,default,"Guns, drugs, cash seized during police raid of SE Portland home; 5 people arrested",http://www.oregonlive.com/portland/index.ssf/2015/02/guns_drugs_cash_seized_during.html,,,
maxoregonian,1397022581.0,,,t2_g1p96,1423634395,s.oregonlive.com,https://www.reddit.com/r/Portland/comments/2vicuc/citizen_journalist_sues_police_trimet_for/,0,2vicuc,False,{},0,False,/r/Portland/comments/2vicuc/citizen_journalist_sues_police_trimet_for/,1440914185,1,{},,False,Portland,t5_2qi2i,default,"Citizen journalist sues police, TriMet for grabbing phone while she filmed officers making arrest",http://s.oregonlive.com/SJg4I4X,,,
hlhlhlhl,,,,,1423633903,self.Portland,https://www.reddit.com/r/Portland/comments/2vic3e/european_import_shop_looking_for_some_uk_and/,0,2vic3e,True,{},9,False,/r/Portland/comments/2vic3e/european_import_shop_looking_for_some_uk_and/,1440914195,3,{},"Before I make my trip to Cost Plus World Market to try my luck, is there anywhere in Portland where I can pick up Parma Violets or salmiak? ",False,Portland,t5_2qi2i,self,European import shop? Looking for some UK and Scandinavian candy,http://www.reddit.com/r/Portland/comments/2vic3e/european_import_shop_looking_for_some_uk_and/,,,
[deleted],,,,,1423630158,facebook.com,https://www.reddit.com/r/Portland/comments/2vi5sd/best_in_town/,0,2vi5sd,False,{},0,False,/r/Portland/comments/2vi5sd/best_in_town/,1440914276,1,{},,False,Portland,t5_2qi2i,default,Best in town,https://www.facebook.com/photo.php?fbid=10204756945155168&amp;set=a.1046415852327.8885.1583589666&amp;type=1&amp;theater,,,
vaderj,1387046398.0,,Milwaukie,t2_ecqup,1423629290,self.Portland,https://www.reddit.com/r/Portland/comments/2vi46k/jon_stewarts_last_night_on_the_daily_show/,0,2vi46k,True,{},3,False,/r/Portland/comments/2vi46k/jon_stewarts_last_night_on_the_daily_show/,1440914298,0,{},"So it has not yet aired on the west coast, but Jon Stewart is done with the daily show. It's a good thing I can type this and not have to talk because this blows - so lets throw a party! 
His last broadcast, as far as I have read, has not yet been announced, but what better place is there than Portland, to host like a block party / street dance (Midwest style) to celebrate Jon's last broadcast of the legendary Daily Show.   So if anyones down, lets discuss the details.  First, I can only assume that we would need a permit to do this - so we need a location and a place to start for the permit application.   My vote for location is Sellwood - say, around Nehalem St - theres a couple pubs around, its nice area and right next to the bike paths and bus routes.",False,Portland,t5_2qi2i,self,Jon Stewarts last night on the Daily Show,http://www.reddit.com/r/Portland/comments/2vi46k/jon_stewarts_last_night_on_the_daily_show/,,,
shatstack,1299758101.0,,,t2_4y0h6,1423627890,self.Portland,https://www.reddit.com/r/Portland/comments/2vi1ku/lost_keys_in_kenton_park/,0,2vi1ku,True,{},2,False,/r/Portland/comments/2vi1ku/lost_keys_in_kenton_park/,1440914330,1,{},Just a shot in the dark. Lost my keys in Kenton park while playing with my dogs yesterday afternoon. Bummer. ,False,Portland,t5_2qi2i,self,lost keys in Kenton park,http://www.reddit.com/r/Portland/comments/2vi1ku/lost_keys_in_kenton_park/,,,
donpdonp,1182267913.0,,,t2_1zlsy,1423627401,self.Portland,https://www.reddit.com/r/Portland/comments/2vi0pe/willamette_pirate_ship_cargo_barge_abandoned/,0,2vi0pe,True,{},16,False,/r/Portland/comments/2vi0pe/willamette_pirate_ship_cargo_barge_abandoned/,1440914343,15,{},"While biking along the eastside esplinade this afternoon, the 'cargo barge' that has been connected to the pirate ship for many months, was anchored in the middle of the river, alone.

http://i.imgur.com/1bvgf08.jpg

The pirate ship is further down, anchored. It looked possibly abandoned.

http://i.imgur.com/lNbHLC8.jpg

Anyone have more news on this?
",False,Portland,t5_2qi2i,self,Willamette Pirate Ship &amp; cargo barge abandoned?,http://www.reddit.com/r/Portland/comments/2vi0pe/willamette_pirate_ship_cargo_barge_abandoned/,,,
[deleted],,,,,1423626828,self.Portland,https://www.reddit.com/r/Portland/comments/2vhzhn/we_always_see_posts_about_how_gutter_punks_are/,0,2vhzhn,True,{},11,False,/r/Portland/comments/2vhzhn/we_always_see_posts_about_how_gutter_punks_are/,1440914357,0,{},"Meaning, the real culprits of the majority of thefts are probably well-off criminals, not the homeless.",False,Portland,t5_2qi2i,default,"We always see posts about how gutter punks are stealing bikes, but don't these people make a killing selling them?",http://www.reddit.com/r/Portland/comments/2vhzhn/we_always_see_posts_about_how_gutter_punks_are/,,,
[deleted],,,,,1423625824,m.bendsource.com,https://www.reddit.com/r/Portland/comments/2vhxhn/how_to_protect_portland_a_psa/,0,2vhxhn,False,{},1,False,/r/Portland/comments/2vhxhn/how_to_protect_portland_a_psa/,1440914383,0,{},,False,Portland,t5_2qi2i,default,How to protect Portland; A PSA,http://m.bendsource.com/Bent/archives/2015/01/29/tired-of-newcomers-portlanders-make-anti-tourism-video,,,
[deleted],,,,,1423625763,self.Portland,https://www.reddit.com/r/Portland/comments/2vhxdp/who_are_you/,0,2vhxdp,True,{},9,False,/r/Portland/comments/2vhxdp/who_are_you/,1440914385,0,{},"bar on Saturday night in SE division. Wearing a red plaid shirt, if my drunk self remembers correctly...",False,Portland,t5_2qi2i,default,Who are you?,http://www.reddit.com/r/Portland/comments/2vhxdp/who_are_you/,,,
[deleted],,,,,1423624457,facebook.com,https://www.reddit.com/r/Portland/comments/2vhutj/friends_motorcycle_was_stolen_in_vancouver_keep/,0,2vhutj,False,{},0,False,/r/Portland/comments/2vhutj/friends_motorcycle_was_stolen_in_vancouver_keep/,1440914418,0,{},,False,Portland,t5_2qi2i,default,"Friends motorcycle was stolen in Vancouver, keep an eye out!",https://www.facebook.com/ClarkCountySheriffsOffice/posts/719463371503081,,,
TeddyDaBear,1345142980.0,,Cedar Mill,t2_8owhw,1423623940,self.Portland,https://www.reddit.com/r/Portland/comments/2vhtq6/i_almost_killed_you/,0,2vhtq6,True,{},35,False,/r/Portland/comments/2vhtq6/i_almost_killed_you/,1440914433,16,{},"To the white Subaru wagon, I almost killed you tonight. Well, maybe not you, but your passenger had a brush with death at about 5:15 because of you.

You were turning off of Skyline onto Burnside just west of the tunnel. You made your turn into the (too short of a) merge/acceleration lane then immediately tried to cut into the main travel lane. I was doing 40mph - I would be surprised if you were doing 10. I almost put my front right bumper into your car just behind your rear passenger door. You are lucky to have not killed your passenger for 2 reasons:    
1) My truck is barely a year old and my brakes are fucking AWESOME. But even with 4 wheel ABS I locked every tire and heard the tires chirp on the pavement. Good thing the brakes of the cars behind me were pretty good too because no one went under my rear bumper as I had to panic break to avoid your stupid ass.   
2) I drive a pickup truck which allows me to easily mount curbs. Thanks to you, there are now tire tracks in the grass at the edge of Skyline Cemetery.

Why did this almost happen? BECAUSE YOU WEREN'T PAYING ANY FUCKING ATTENTION TO WHAT YOU WERE DOING! You made a turn into an acceleration lane but didn't accelerate even though there was a long line of cars right behind me. You immediately swerved out of that acceleration lane and directly in front of me with MAYBE 15 or 20 feet of space. [At 40mph, it would take me 80 feet to stop](http://www.arachnoid.com/lutusp/auto.html) and that is only after I react to the situation.

If I had hit you, might left front bumper would have impacted just behind your rear passenger door. Your car would have been immediately spun sideways and crushed the front passenger against the strongest part of my car: the very front center. The passenger would have been crushed and if not killed, at least VERY badly injured. And what would have happened to my truck? Very little. My bumper would be finished, my radiator MIGHT have cracked. My airbags would have gone off to be sure, but most likely I would have gotten nothing more than a bump.

But you know what is even worse? I was LAYING on my horn while this happened and you barely twitched. Don't think I could see you? I could see you QUITE clearly. You looked all around as if wondering what the hell was going on! It wasn't until I was directly behind you again and flashed my high beams that you seemed to have ANY clue as to what had happened - and I am willing to lay money that as soon as you started to pull away you were immediately saying to yourself ""What is that asshole's problem?!"". Well if wanting to get home safely makes me an asshole, then that is what I am. But my problem is you and people just like you - you need to pay attention to what you are fucking doing!

But even with all that, I do have one thing to thank you for: I am bought a dashcam tonight and will be putting it in as soon as it arrives. Next time I encounter you or another reckless driver such as yourself, I am going to have video evidence of your inability to drive safely.

/Rant",False,Portland,t5_2qi2i,self,I Almost Killed You,http://www.reddit.com/r/Portland/comments/2vhtq6/i_almost_killed_you/,,,
rc07,1333812544.0,,,t2_7dt16,1423623430,vox.com,https://www.reddit.com/r/Portland/comments/2vhso8/giving_housing_to_the_homeless_is_three_times/,0,2vhso8,False,{},105,False,/r/Portland/comments/2vhso8/giving_housing_to_the_homeless_is_three_times/,1440914446,113,{},,False,Portland,t5_2qi2i,default,Giving housing to the homeless is three times cheaper than leaving them on the streets,http://www.vox.com/2014/5/30/5764096/its-three-times-cheaper-to-give-housing-to-the-homeless-than-to-keep,,,
ZiFiStriClub,1405975432.0,,,t2_hic73,1423621506,stripclubjournals.com,https://www.reddit.com/r/Portland/comments/2vhoq4/avn_expo_2015_strip_club_journals_unbound_part_1/,0,2vhoq4,False,{},0,False,/r/Portland/comments/2vhoq4/avn_expo_2015_strip_club_journals_unbound_part_1/,1440914498,1,{},,False,Portland,t5_2qi2i,default,AVN Expo 2015: Strip Club Journals Unbound (Part 1),http://www.stripclubjournals.com/avn-expo-2015-strip-club-journals-unbound-part-1/,,,
xoom999,1344305356.0,,,t2_8l1e7,1423620120,self.Portland,https://www.reddit.com/r/Portland/comments/2vhlu6/stolen_suzuki_vstorm_650_vancouver_wa/,0,2vhlu6,True,{},0,False,/r/Portland/comments/2vhlu6/stolen_suzuki_vstorm_650_vancouver_wa/,1440914534,2,{},"Not my bike, but a good friend of mine had an Orange and Black Vstorm Stolen from Vancouver, WA garage. The bike has WA Plate 9B2106

Clark County Sheriff Case#  S15-1539
CCSO FB Post:
https://www.facebook.com/ClarkCountySheriffsOffice/posts/719464074836344

Surveillance Videos of theft:
https://www.youtube.com/watch?v=QLt8MD21aeQ
https://www.youtube.com/watch?v=RSHv1V1Bwuc",False,Portland,t5_2qi2i,self,"Stolen Suzuki Vstorm 650 -- Vancouver, WA",http://www.reddit.com/r/Portland/comments/2vhlu6/stolen_suzuki_vstorm_650_vancouver_wa/,,,
paul_olenik,1420584745.0,,,t2_kjz7v,1423616960,self.Portland,https://www.reddit.com/r/Portland/comments/2vhezj/reddit_night_at_winterhawks_game_36_7pm_moda/,0,2vhezj,True,{},21,False,/r/Portland/comments/2vhezj/reddit_night_at_winterhawks_game_36_7pm_moda/,1440914623,36,{},"Hey Guys,

I just got things approved on my end to run this! Based on the interest from: 

http://www.reddit.com/r/Portland/comments/2rt1i1/portland_reddit_meetupevent_idea/

and the responses from: 

http://www.reddit.com/r/Portland/comments/2t321p/portland_redditors_winterhawks_meetup_v2/

I set this up for: **Friday, March 6, 2015 @ Moda Center. It’s Portland vs. Seattle at 7PM**

This is our biggest rival. When Portland plays in Seattle, the fans love to chant, “Portland Sucks.” And we always love to give them a hard time when they come here. Plus it’s going to be a really important game for playoff seeding. Each team also has a projected first rounder in the NHL Draft this spring.

*Pre-game anyone?* I couldn’t land you any beer deals, so if you would like to get a little saucy before the game, and **if we can get 25+ tickets purchased to the game, I’ll host a pre-game party at Stingray Café at 5:45PM.** Stingray is two blocks from the Moda Center at the Left Bank Annex. I can hand out hats, and I’ll do some games/trivia for some extra Winterhawks wearables.  This way by coming early you can snag some free street parking nearby, and get a good price on some micro-brews.

**Cost:** $20.50 per ticket for Center Ice Club Level seats together and it will come with a free Winterhawks trucker style hat. The Club level was renovated this summer, it's really nice. So you’ll be able to grab a drink at the bar, and hang out in some of the lounge seating between periods. 

We'll say what's up to the redditors on the big screen during 2nd intermission, that will happen. If we get tons of interest I'll do what I can to blow this thing up even more. Give me 50+ and I'll get something really cool going.

To purchase your tickets just go to the Ticketmaster website I have set up just for /r Portland: 

https://oss.ticketmaster.com/aps/winterhawks/EN/link/promotion/home/be528a23a061920699560fb4d3dc0139e2438a26   
and enter the promo code: **CHUGGERS**

Please feel free to spread the link around. The more the merrier. Friends and family are more than welcome!  

Here’s the meetup page: http://www.meetup.com/rPORTLAND/events/220444722/

Questions, concerns, rants? PM me or email paulo at winterhawks.com

Let's do this!",False,Portland,t5_2qi2i,self,Reddit Night at Winterhawks Game - 3/6 @ 7PM - Moda Center,http://www.reddit.com/r/Portland/comments/2vhezj/reddit_night_at_winterhawks_game_36_7pm_moda/,1423617145.0,,
Howlinghound,1253655098.0,,,t2_3n5iw,1423616882,self.Portland,https://www.reddit.com/r/Portland/comments/2vheta/if_you_were_from_texas_and_you_were_to_spend_four/,0,2vheta,True,{},3,False,/r/Portland/comments/2vheta/if_you_were_from_texas_and_you_were_to_spend_four/,1440914625,0,{},,False,Portland,t5_2qi2i,default,"If you were from Texas and you were to spend four days in Oregon with no budget, what would you do, where would you go, and what would you eat?",http://www.reddit.com/r/Portland/comments/2vheta/if_you_were_from_texas_and_you_were_to_spend_four/,,,
blacktara,1337055863.0,,Hillsboro,t2_7q192,1423615711,self.Portland,https://www.reddit.com/r/Portland/comments/2vhcby/oops_cant_make_it_to_otep_want_to_go/,0,2vhcby,True,{},0,False,/r/Portland/comments/2vhcby/oops_cant_make_it_to_otep_want_to_go/,1440914657,3,{},,False,Portland,t5_2qi2i,default,"Oops, can't make it to Otep. Want to go?",http://www.reddit.com/r/Portland/comments/2vhcby/oops_cant_make_it_to_otep_want_to_go/,,,
desperatebreakfasts,1407047223.0,,,t2_hp7vr,1423611887,kickstarter.com,https://www.reddit.com/r/Portland/comments/2vh4bo/my_film_cotton_mouth_was_just_made_a_kickstarter/,0,2vh4bo,False,{},2,False,/r/Portland/comments/2vh4bo/my_film_cotton_mouth_was_just_made_a_kickstarter/,1440914761,0,{},,False,Portland,t5_2qi2i,default,My film Cotton Mouth was just made a Kickstarter Staff Pick! The main character is a Redditor:) Check it out!,https://www.kickstarter.com/projects/1646735822/cotton-mouth,,,
[deleted],,,,,1423610166,governing.com,https://www.reddit.com/r/Portland/comments/2vh0mm/were_number_1_the_2015_gentrification_in_america/,0,2vh0mm,False,{},66,False,/r/Portland/comments/2vh0mm/were_number_1_the_2015_gentrification_in_america/,1440914809,41,{},,False,Portland,t5_2qi2i,http://b.thumbs.redditmedia.com/3owlTVBFl1fYINiz2-_iWtCfAISb6ofip63VMp_jmTc.jpg,We're number 1! The 2015 Gentrification in America Report from GOVERNING Magazine,http://www.governing.com/gov-data/census/gentrification-in-cities-governing-report.html,,,
Newsnow2020,1423483246.0,,,t2_l972o,1423607404,oregonlive.com,https://www.reddit.com/r/Portland/comments/2vguj3/portland_burglar_rents_out_homes_that_arent_hers/,0,2vguj3,False,{},13,False,/r/Portland/comments/2vguj3/portland_burglar_rents_out_homes_that_arent_hers/,1440914888,69,{},,False,Portland,t5_2qi2i,http://b.thumbs.redditmedia.com/AOjcPUcyv8Tq6zBMuq881wJ-_A0RtqPnHyJMgYum3TM.jpg,"Portland burglar rents out homes that aren't hers, gets 4 years in prison",http://www.oregonlive.com/portland/index.ssf/2015/02/portland_burglar_rents_out_hom.html,,,
downvotedtohellNback,1423605973.0,,,t2_la9g0,1423606365,self.Portland,https://www.reddit.com/r/Portland/comments/2vgs78/hello_please_simple_question_where_can_a_plus/,0,2vgs78,True,{},58,False,/r/Portland/comments/2vgs78/hello_please_simple_question_where_can_a_plus/,1440914919,17,{},"I'm ten days away from being homeless after a renting scam I got involved in. I'm crushed, depressed, no family in town, no family anywhere, it's all up to me - I need to be able to make quick money before I go homeless - the weather isn't exactly being nice lately. So yeah basically I'm blonde hair, blue eyes, 32dd breast, but I have bit of a stomach - 5'1 - 150 pounds. Thanks. It doesn't even have to be downtown, just anywhere off the max. Thank you. Or does anyone know any no experience needed jobs that have tips? ",False,Portland,t5_2qi2i,self,hello! please simple question - where can a plus size girl find work in a strip joint/jack shack around here?,http://www.reddit.com/r/Portland/comments/2vgs78/hello_please_simple_question_where_can_a_plus/,,,
EveryManALion,1401672887.0,,,t2_gt5h2,1423605670,self.Portland,https://www.reddit.com/r/Portland/comments/2vgql3/no_rain_today_anyone_want_to_play_basketball_at/,0,2vgql3,True,{},0,False,/r/Portland/comments/2vgql3/no_rain_today_anyone_want_to_play_basketball_at/,1440914940,10,{},Feel free to come!,False,Portland,t5_2qi2i,self,NO RAIN TODAY! Anyone want to play basketball at Alberta park at 5 tonight?,http://www.reddit.com/r/Portland/comments/2vgql3/no_rain_today_anyone_want_to_play_basketball_at/,,,
OrderOrder,1332878202.0,,,t2_7a7mw,1423605502,imgur.com,https://www.reddit.com/r/Portland/comments/2vgq6j/no_way_vday_at_rose_thistle/,0,2vgq6j,False,{},1,False,/r/Portland/comments/2vgq6j/no_way_vday_at_rose_thistle/,1440914945,0,{},,False,Portland,t5_2qi2i,http://b.thumbs.redditmedia.com/kCohDXhjI20JkFdAR6KaVWkADOsbr5rFoy5oTt2YRCc.jpg,No Way V-Day At Rose &amp; Thistle,http://imgur.com/00sQEKv,,,
baconbananapancakes,1366329590.0,,,t2_bdcys,1423605061,katu.com,https://www.reddit.com/r/Portland/comments/2vgp4b/keurig_fire_destroys_gresham_apartment_company/,0,2vgp4b,False,{},74,False,/r/Portland/comments/2vgp4b/keurig_fire_destroys_gresham_apartment_company/,1440914958,217,{},,False,Portland,t5_2qi2i,http://a.thumbs.redditmedia.com/hIrZfIB5qXNmfmNipDWqPd-41lylNjLfILc2PMbMJu8.jpg,"Keurig fire destroys Gresham apartment, company offers new coffee maker",http://www.katu.com/news/problemsolver/Keurig-sparks-fire-gresham-coffee-maker-291324921.html,,,
buckyball60,1323499450.0,,,t2_6erwb,1423604836,oregonlive.com,https://www.reddit.com/r/Portland/comments/2vgol8/port_of_portlands_biggest_customer_hanjin/,0,2vgol8,False,{},30,False,/r/Portland/comments/2vgol8/port_of_portlands_biggest_customer_hanjin/,1440914965,45,{},,False,Portland,t5_2qi2i,http://b.thumbs.redditmedia.com/aW-eUjHouzV2o_UXObQEFtytmDcYDL_XfWZfrZ6AXLA.jpg,"Port of Portland's biggest customer, Hanjin, notifies shippers it might drop Terminal 6",http://www.oregonlive.com/business/index.ssf/2015/02/port_of_portlands_biggest_cust.html,,,
corneliusrex72,1422312646.0,,,t2_kypjr,1423604565,golocalpdx.com,https://www.reddit.com/r/Portland/comments/2vgnxy/cylvia_hayes_plagiarized_portions_of_her/,0,2vgnxy,False,{},38,False,/r/Portland/comments/2vgnxy/cylvia_hayes_plagiarized_portions_of_her/,1440914975,57,{},,False,Portland,t5_2qi2i,http://a.thumbs.redditmedia.com/cu0wDYDnH0nArrdMbOoFKgTIcGUBBUklEd_cZQrrvv4.jpg,Cylvia Hayes Plagiarized Portions of Her Consulting Report,http://www.golocalpdx.com/news/investigation-cylvia-hayes-plagiarized-portions-of-her-consulting-report,,,
larry_darrell_,1375408215.0,,S Portland,t2_clj3r,1423602102,self.Portland,https://www.reddit.com/r/Portland/comments/2vgi3k/lloyd_center_nordstrom_selling_all_its_fixtures/,0,2vgi3k,True,{},31,False,/r/Portland/comments/2vgi3k/lloyd_center_nordstrom_selling_all_its_fixtures/,1440915049,36,{},"Feels almost like a piece of history coming down. It's pretty cool in there with the place half gutted and literally everything they have for sale. If you want a deal on random fixtures,  pro kitchen equipment, or more importantly your very own mannequin I'd head over",False,Portland,t5_2qi2i,self,Lloyd Center Nordstrom selling all its fixtures today;lots of cool stuff in there,http://www.reddit.com/r/Portland/comments/2vgi3k/lloyd_center_nordstrom_selling_all_its_fixtures/,1423602366.0,,
Newsnow2020,1423483246.0,,,t2_l972o,1423601535,kptv.com,https://www.reddit.com/r/Portland/comments/2vggs9/shooter_outside_lloyd_center_tossed_gun_in_bush/,0,2vggs9,False,{},7,False,/r/Portland/comments/2vggs9/shooter_outside_lloyd_center_tossed_gun_in_bush/,1440915066,2,{},,False,Portland,t5_2qi2i,http://b.thumbs.redditmedia.com/s28Ca0aFNHhKHXq3qWLVzwlDFpS8gc2MQw0Uxt-2-ow.jpg,Shooter outside Lloyd Center tossed gun in bush; reward offered,http://www.kptv.com/story/28073683/shooter-outside-lloyd-center-tossed-gun-in-bush-reward-offered,,,
[deleted],,,,,1423599569,self.Portland,https://www.reddit.com/r/Portland/comments/2vgc1y/well_looks_like_we_are_about_to_hit_60_f_this/,0,2vgc1y,True,{},77,False,/r/Portland/comments/2vgc1y/well_looks_like_we_are_about_to_hit_60_f_this/,1440915128,79,{},"Oops, mean to post a link. 

http://forecast.weather.gov/MapClick.php?CityName=Portland&amp;state=OR&amp;site=PQR&amp;textField1=45.5236&amp;textField2=-122.675&amp;e=1",False,Portland,t5_2qi2i,self,"Well, looks like we are about to hit 60° F this week. There will be no Spring tease this year, just plain ol' Spring.",http://www.reddit.com/r/Portland/comments/2vgc1y/well_looks_like_we_are_about_to_hit_60_f_this/,,,
[deleted],,,,,1423598882,self.Portland,https://www.reddit.com/r/Portland/comments/2vgad5/free_platinum_blonde_application_needed_for/,0,2vgad5,True,{},5,False,/r/Portland/comments/2vgad5/free_platinum_blonde_application_needed_for/,1440915150,2,{},"Hello all,
My name is Richard and I'm currently seeking a model for a platinum blonde bleach and tone. This service will also include a free haircut, which is normally $60. I work at an upscale boutique salon in SE Portland, and need a model in within the next two weeks. My current price for a bleach and tone is $200+, and I need to provide a new model before my next price increase, showing that the the integrity of the hair is kept.

Like I said, everything will be free, and you will be given direction on how to maintain the tones in your hair, products you should be using, and overall knowledge of being a blonde, as education is a must.

There are a few requirements I'd like to ask: 
-Age 18+ -Hair type: Not heavily damaged or extremely long 
-Hair Color: No previous at home/box color, No natural color below a medium brown, no perm or relaxers. Virgin hair (natural color) would be the absolute best, but I understand that it's hard to find.

If you meet these specifics, or have any questions regarding the session, feel free to shoot me a message and we can speak further about moving this process along. If you are interested in the salon, and my background education, check out our website WINDOWWALLsalon.com.

I hope to get some responses, as I love a good platinum in the winter!

Thank you!",False,Portland,t5_2qi2i,default,FREE PLATINUM BLONDE APPLICATION needed for upscale salon in Portland.,http://www.reddit.com/r/Portland/comments/2vgad5/free_platinum_blonde_application_needed_for/,,,
vagjayjayhooray,1382410828.0,,,t2_dlq41,1423597858,self.Portland,https://www.reddit.com/r/Portland/comments/2vg83m/free_entry_to_zoo_on_valentines_day/,0,2vg83m,True,{},17,False,/r/Portland/comments/2vg83m/free_entry_to_zoo_on_valentines_day/,1440915179,57,{},"http://www.oregonzoo.org/events/community-free-day

The weather probably won't behave, but at least you'll see some elephants.",False,Portland,t5_2qi2i,self,Free entry to Zoo on Valentine's Day!,http://www.reddit.com/r/Portland/comments/2vg83m/free_entry_to_zoo_on_valentines_day/,,,
jordanpattern,1420430722.0,,Sumner,t2_kil7g,1423597709,self.Portland,https://www.reddit.com/r/Portland/comments/2vg7t9/powellhurstgilbertmil_parklents/,0,2vg7t9,True,{},3,False,/r/Portland/comments/2vg7t9/powellhurstgilbertmil_parklents/,1440915183,0,{},"My partner and I are trying to buy a house. We're blue collar folks and have a pretty small budget. We're not averse to ugly homes/cosmetic fixers, but don't want to deal with a full-scale rehab. We also need a large garage/shop, which limits us a fair bit. We're seeing some good looking stuff in our price range in Powellhurst-Gibert, Mill Park, and Lents. We're not averse to living a bit further out and currently are renting in Sumner, around 91 and Sandy, but we'd be interested to hear from anyone who lives in any of these areas about how they like it.

Any thoughts anyone has would be appreciated. Thank you! :)",False,Portland,t5_2qi2i,self,Powellhurst-Gilbert/Mil Park/Lents,http://www.reddit.com/r/Portland/comments/2vg7t9/powellhurstgilbertmil_parklents/,,,
