author,author_created_utc,author_flair_css_class,author_flair_text,author_fullname,created_utc,domain,full_link,gilded,id,is_self,media_embed,num_comments,over_18,permalink,retrieved_on,score,secure_media_embed,selftext,stickied,subreddit,subreddit_id,thumbnail,title,url,edited,media,secure_media
EmtoorsGF,1346281325.0,,Downtown,t2_8tyuh,1423597639,self.Portland,https://www.reddit.com/r/Portland/comments/2vg7ns/bottomless_mimosas_in_pdx/,0,2vg7ns,True,{},33,False,/r/Portland/comments/2vg7ns/bottomless_mimosas_in_pdx/,1440915186,15,{},I know of Club 21 and Rae's Lakeview Lounge does it. Are there any other brunch locations? I need those mimosas - ya feel me? Any help is mucho appreciated. ,False,Portland,t5_2qi2i,self,Bottomless Mimosas In PDX?,http://www.reddit.com/r/Portland/comments/2vg7ns/bottomless_mimosas_in_pdx/,,,
nothingphancy,1418584214.0,,,t2_k0mqe,1423594505,self.Portland,https://www.reddit.com/r/Portland/comments/2vg15y/portland_parks/,0,2vg15y,True,{},5,False,/r/Portland/comments/2vg15y/portland_parks/,1440915269,0,{},what parks have the biggest or the most puddles in the area? I am looking to do some awesome puddle jumping with a girl I watch!,False,Portland,t5_2qi2i,self,Portland Parks,http://www.reddit.com/r/Portland/comments/2vg15y/portland_parks/,,,
[deleted],,,,,1423593833,cascade.org,https://www.reddit.com/r/Portland/comments/2vfzn0/open_registration_started_this_morning_at_10_for/,0,2vfzn0,False,{},14,False,/r/Portland/comments/2vfzn0/open_registration_started_this_morning_at_10_for/,1440915289,13,{},,False,Portland,t5_2qi2i,default,"Open registration started this morning at 10 for the SeattleToPortland, in case you were planning to go and forgot.",http://cascade.org,,,
starrats,1263797407.0,,,t2_3tyws,1423592895,registerguard.com,https://www.reddit.com/r/Portland/comments/2vfxjv/west_linn_mayor_does_not_give_reasons_for/,0,2vfxjv,False,{},6,False,/r/Portland/comments/2vfxjv/west_linn_mayor_does_not_give_reasons_for/,1440915316,0,{},,False,Portland,t5_2qi2i,http://b.thumbs.redditmedia.com/y0KHB2e-gzVoSdWylIut50aM0qbW9VufgNtNNcPkTrQ.jpg,West Linn Mayor does not give reasons for quitting job.,http://registerguard.com/rg/news/32758930-76/west-linn-mayor-john-kovash-resigns-unexpectedly.html.csp,,,
[deleted],,,,,1423592069,self.Portland,https://www.reddit.com/r/Portland/comments/2vfvku/looking_for_a_model_who_wants_to_achieve_a/,0,2vfvku,True,{},2,False,/r/Portland/comments/2vfvku/looking_for_a_model_who_wants_to_achieve_a/,1440915341,0,{},"Hello all,

My name is Richard and I'm currently seeking a model for a platinum blonde bleach and tone. This service will also include a free haircut, which is normally $60. I work at an upscale boutique salon in SE Portland, and need a model in within the next two week. My current price for a bleach and tone is $200+, and I need to provide a new model before my next price increase, showing that the the integrity of the hair is kept.

Like I said, everything will be free, and you will be given direction on how to maintain the tones in your hair, products you should be using, and overall knowledge of being a blonde, as education is a must. 

There are a few requirements I'd like to ask:
-Age 18+
-Hair type: Not heavily damaged or extremely long
-Hair Color: No previous at home/box color, No natural color below a medium brown, no perm or relaxers. Virgin hair (natural color) would be the absolute best, but I understand that it's hard to find.

If you meet these specifics, or have any questions regarding the session, feel free to shoot me a message and we can speak further about moving this process along. If you are interested in the salon, and my background education, check out out website WINDOWWALLsalon.com.

I hope to get some responses, as I love a good platinum in the winter!

Thank you!
",False,Portland,t5_2qi2i,default,Looking for a model who wants to achieve a healthy PLAINUM BLONDE FOR FREE in an upscale salon in Portland!,http://www.reddit.com/r/Portland/comments/2vfvku/looking_for_a_model_who_wants_to_achieve_a/,,,
[deleted],,,,,1423590054,m.imgur.com,https://www.reddit.com/r/Portland/comments/2vfqx3/sighted_a_hoboat_today/,0,2vfqx3,False,{},26,False,/r/Portland/comments/2vfqx3/sighted_a_hoboat_today/,1440915402,22,{},,False,Portland,t5_2qi2i,default,Sighted a Hoboat today...,http://m.imgur.com/OalN4Zr,,,
Danegler,1358028750.0,,,t2_a79tg,1423589581,self.Portland,https://www.reddit.com/r/Portland/comments/2vfptm/when_should_i_start_my_job_search/,0,2vfptm,True,{},10,False,/r/Portland/comments/2vfptm/when_should_i_start_my_job_search/,1440915416,0,{},"I am graduating in June with my masters in applied mathematics. When should I start applying for jobs, with an expected starting date in July? Any insight or ideas will help. Thank you. ",False,Portland,t5_2qi2i,self,When should I start my job search?,http://www.reddit.com/r/Portland/comments/2vfptm/when_should_i_start_my_job_search/,,,
ZiFiStriClub,1405975432.0,,,t2_hic73,1423589382,stripclubjournals.com,https://www.reddit.com/r/Portland/comments/2vfpe8/from_adult_industry_writer_to_real_lifevegas_to/,0,2vfpe8,False,{},0,False,/r/Portland/comments/2vfpe8/from_adult_industry_writer_to_real_lifevegas_to/,1440915421,1,{},,False,Portland,t5_2qi2i,default,From Adult Industry Writer to Real Life-Vegas to Pdx,http://www.stripclubjournals.com/from-adult-industry-writer-to-real-life/,,,
Hugetuboguts,1423485687.0,,,t2_l97lf,1423588946,oregonlive.com,https://www.reddit.com/r/Portland/comments/2vfofz/man_accused_of_stealing_fire_pit_from_nw_portland/,0,2vfofz,False,{},47,False,/r/Portland/comments/2vfofz/man_accused_of_stealing_fire_pit_from_nw_portland/,1440915434,51,{},,False,Portland,t5_2qi2i,default,Man accused of stealing fire pit from NW Portland apartment to use beneath Broadway Bridge,http://www.oregonlive.com/portland/index.ssf/2015/02/man_accused_of_stealing_fire_p.html,,,
caseymparks,1392069589.0,,,t2_f7prl,1423587945,oregonlive.com,https://www.reddit.com/r/Portland/comments/2vfm7k/portland_parks_recreation_wants_to_know_whats/,0,2vfm7k,False,{},32,False,/r/Portland/comments/2vfm7k/portland_parks_recreation_wants_to_know_whats/,1440915464,22,{},,False,Portland,t5_2qi2i,http://b.thumbs.redditmedia.com/DRkX6T9laYQuCwxbEtjN2BC9oMPuqEuw7syc7yJj0sE.jpg,Portland Parks &amp; Recreation wants to know: What's your race and ethnicity?,http://www.oregonlive.com/portland/index.ssf/2015/02/portland_parks_race_ethnicity.html,,,
[deleted],,,,,1423586487,self.Portland,https://www.reddit.com/r/Portland/comments/2vfiy8/paying_couch_surfer/,0,2vfiy8,True,{},4,False,/r/Portland/comments/2vfiy8/paying_couch_surfer/,1440915505,0,{},,False,Portland,t5_2qi2i,default,Paying couch surfer.,http://www.reddit.com/r/Portland/comments/2vfiy8/paying_couch_surfer/,,,
maxoregonian,1397022581.0,,,t2_g1p96,1423582838,s.oregonlive.com,https://www.reddit.com/r/Portland/comments/2vfbbg/federal_justice_attorney_calls_portlands/,0,2vfbbg,False,{},0,False,/r/Portland/comments/2vfbbg/federal_justice_attorney_calls_portlands/,1440915604,1,{},,False,Portland,t5_2qi2i,default,Federal justice attorney calls Portland's community-monitored police reform agreement 'innovative',http://s.oregonlive.com/iROz2tU,,,
Hugetuboguts,1423485687.0,,,t2_l97lf,1423582160,katu.com,https://www.reddit.com/r/Portland/comments/2vfa0y/police_looking_for_suspect_in_southwest_portland/,0,2vfa0y,False,{},6,False,/r/Portland/comments/2vfa0y/police_looking_for_suspect_in_southwest_portland/,1440915620,12,{},,False,Portland,t5_2qi2i,default,Police looking for suspect in Southwest Portland bank robbery,http://www.katu.com/news/local/Police-looking-for-suspect-in-Southwest-Portland-bank-robbery-291299311.html,,,
Firry,1378582596.0,,,t2_d1t8a,1423581707,self.Portland,https://www.reddit.com/r/Portland/comments/2vf92x/ppb_helicopter/,0,2vf92x,True,{},17,False,/r/Portland/comments/2vf92x/ppb_helicopter/,1440915633,5,{},"A comment in another post indicated that the PoPo have no choppers. For a city this size that seems kind of crazy. Are all the choppers we see in NE really just the TV ""news"" chasing ambulances? ",False,Portland,t5_2qi2i,self,PPB Helicopter,http://www.reddit.com/r/Portland/comments/2vf92x/ppb_helicopter/,,,
aafeiger,1371661854.0,,,t2_c3bdp,1423579865,self.Portland,https://www.reddit.com/r/Portland/comments/2vf5la/helicopters_above_ne_portland/,0,2vf5la,True,{},17,False,/r/Portland/comments/2vf5la/helicopters_above_ne_portland/,1440915678,9,{},Anyone know why helicopters are flying above Woodlawn? I'm really hoping it's not related another shooting. This is getting ridiculous.,False,Portland,t5_2qi2i,self,Helicopters above NE Portland,http://www.reddit.com/r/Portland/comments/2vf5la/helicopters_above_ne_portland/,,,
toastmanv2,1343827568.0,,,t2_8ivbp,1423561791,self.Portland,https://www.reddit.com/r/Portland/comments/2vej97/any_okay_camping_around_this_time_of_year/,0,2vej97,True,{},13,False,/r/Portland/comments/2vej97/any_okay_camping_around_this_time_of_year/,1440915967,5,{},"Hi there, I'm trying to do a quick camping trip this coming weekend for Valentine's Day with my girlfriend. She is currently living in Bend, and we had an idea to meet halfway somewhere on Friday. Of course I know this isn't the best time of year to do it, but I was hoping I could at least get some suggestions of places to check out, I'm at a total loss.

-We wiill be car camping. (most likely)

-It definitely doesn't need to be exactly between us, just any place in between would be awesome

-We will have 2 dogs with us. 

Thanks in advance for any advice!

",False,Portland,t5_2qi2i,self,Any okay camping around this time of year?,http://www.reddit.com/r/Portland/comments/2vej97/any_okay_camping_around_this_time_of_year/,,,
Contemporarydisease,1423559079.0,,,t2_l9vgk,1423559848,self.Portland,https://www.reddit.com/r/Portland/comments/2vehct/can_anyone_recommend_a_local_home_audiovideo/,0,2vehct,True,{},17,False,/r/Portland/comments/2vehct/can_anyone_recommend_a_local_home_audiovideo/,1440915992,4,{},"So my Onkyo R606 decided to stop recognizing any HDMI signals, thus rendering my receiver basically useless. I was wondering if anyone here has had experience with the same issue and/or can recommend a local shop/repairman who will work on Onkyo receivers. Or perhaps anyone who has some know-how and can do some soldering. Any input would be much appreciated, thanks!

",False,Portland,t5_2qi2i,self,Can anyone recommend a local home audio/video repair shop that can repair Onkyo receiver HDMI board?,http://www.reddit.com/r/Portland/comments/2vehct/can_anyone_recommend_a_local_home_audiovideo/,1423560666.0,,
[deleted],,,,,1423555757,yosemite.epa.gov,https://www.reddit.com/r/Portland/comments/2ved7y/heres_a_map_of_the_portland_harbor_superfund_site/,0,2ved7y,False,{},26,False,/r/Portland/comments/2ved7y/heres_a_map_of_the_portland_harbor_superfund_site/,1440916046,98,{},,False,Portland,t5_2qi2i,http://b.thumbs.redditmedia.com/0pif7B-8OQLL46LAJhogCS-C5ecK5tdgD7374VD3tDA.jpg,Here's a map of the Portland Harbor Superfund Site,http://yosemite.epa.gov/r10/CLEANUP.NSF/0/6312f7ef17518912882573990068d67d/$FILE/Portlandharbormaplg.jpg,,,
[deleted],,,,,1423548173,self.Portland,https://www.reddit.com/r/Portland/comments/2ve3i3/fine_for_a_fine/,0,2ve3i3,True,{},12,False,/r/Portland/comments/2ve3i3/fine_for_a_fine/,1440916173,2,{},"In December my husband ran a red light on Burnside. He got a ticket for $260 which we promptly paid. He submitted a letter at the courthouse with the check taking responsibility. They cashed and endorsed the check with the case # on it. So today we get a letter in the post saying a balance is past due and he now owes $130. We're very confused. We paid the ticket and haven't heard anything until today. Has this happened to anyone else?

Edit: We checked it out and.... they owe us $130. I guess the judge reduced the fine and somehow they decided to send a bill. ",False,Portland,t5_2qi2i,self,Fine for a fine?!,http://www.reddit.com/r/Portland/comments/2ve3i3/fine_for_a_fine/,1423591496.0,,
IndigoVixx,1361197087.0,,,t2_an5z8,1423546645,i.imgur.com,https://www.reddit.com/r/Portland/comments/2ve16v/welcome_to_every_single_thing_in_portland/,0,2ve16v,False,{},11,False,/r/Portland/comments/2ve16v/welcome_to_every_single_thing_in_portland/,1440916203,0,{},,False,Portland,t5_2qi2i,http://b.thumbs.redditmedia.com/NEiwKiUZjQdmG5dYj_AVfkQJ2cVlpZh3FMpgkftr6FM.jpg,Welcome to every single thing in Portland...,http://i.imgur.com/2AGgSVv.jpg,,,
extraeme,1324670494.0,,,t2_6i16v,1423544911,self.Portland,https://www.reddit.com/r/Portland/comments/2vdy7c/anyone_know_what_sheetz_gas_is/,0,2vdy7c,True,{},4,False,/r/Portland/comments/2vdy7c/anyone_know_what_sheetz_gas_is/,1440916241,0,{},"If you do, you probably came from the East coast like me. If you are a fan of them like me, you should contact them to request  them to build a location here.

Contact them here: 
https://www.sheetz.com/contact/contact_form.jsp

Edit: Apparently I don't know East vs. West 


",False,Portland,t5_2qi2i,self,Anyone know what Sheetz gas is?,http://www.reddit.com/r/Portland/comments/2vdy7c/anyone_know_what_sheetz_gas_is/,1423549240.0,,
[deleted],,,,,1423543495,self.Portland,https://www.reddit.com/r/Portland/comments/2vdvnq/john_kitzhaber_is_a_crook/,0,2vdvnq,True,{},0,False,/r/Portland/comments/2vdvnq/john_kitzhaber_is_a_crook/,1440916273,0,{},,False,Portland,t5_2qi2i,default,JOHN KITZHABER IS A CROOK,http://www.reddit.com/r/Portland/comments/2vdvnq/john_kitzhaber_is_a_crook/,,,
ebmfreak,1234060375.0,,Richmond,t2_3dg74,1423543442,self.Portland,https://www.reddit.com/r/Portland/comments/2vdvkg/local_source_farm_to_buy_rainier_cherries_this/,0,2vdvkg,True,{},5,False,/r/Portland/comments/2vdvkg/local_source_farm_to_buy_rainier_cherries_this/,1440916274,8,{},"So - I have a little family recipe for some barrel-aged Mead that uses bing cherries, but I want to localize it using the awesome Rainier Cherry.

Thing is, I need a good local farm to source them from. Preferably one that wouldn't mind providing them as a Cherry Mash without pits...

While spendy - I think it'll be worth it.  I have the barrel, I heave the yeast cultures bread from a long line of german yeast strains that go back to the age of the saxons and were used to make the drinks of the gods! (ok I made that last part up). 

Anyhow... does anyone know of / work for a local farm that does bulk sales?",False,Portland,t5_2qi2i,self,Local source / farm to buy Rainier Cherries this summer??,http://www.reddit.com/r/Portland/comments/2vdvkg/local_source_farm_to_buy_rainier_cherries_this/,1423544184.0,,
47REO,1362208994.0,,,t2_asc3p,1423542928,self.Portland,https://www.reddit.com/r/Portland/comments/2vdulk/looking_for_the_type_of_gallery_or_art_space_that/,0,2vdulk,True,{},5,False,/r/Portland/comments/2vdulk/looking_for_the_type_of_gallery_or_art_space_that/,1440916287,0,{},My friend /u/armed2theteeth makes these awesome post-apocalyptic [sculptures](http://andrewnewell.org/portfolio/assemblage/) and hoards them all to himself.  I am wondering what kind of gallery/art-spaces would be good to show these kind of pieces. I know lots of people want to see crazy sci-fi art and the intricate details on these things have to be seen to be believed. ,False,Portland,t5_2qi2i,self,Looking for the type of gallery or art space that would show creepy cool sci-fi sculptures. Any suggestions?,http://www.reddit.com/r/Portland/comments/2vdulk/looking_for_the_type_of_gallery_or_art_space_that/,,,
onihcuk,1286218870.0,,Hollywood,t2_4eh4v,1423542005,self.Portland,https://www.reddit.com/r/Portland/comments/2vdsyb/so_just_a_psa_had_my_package_stolen_today_in/,0,2vdsyb,True,{},7,False,/r/Portland/comments/2vdsyb/so_just_a_psa_had_my_package_stolen_today_in/,1440916308,5,{},my neighbor across from me also had his package taken same day..  Anyone in Hollywood district best to do signature or pick up from the post off on your own from now on.,False,Portland,t5_2qi2i,self,So just a PSA had my package stolen today in Hollywood district,http://www.reddit.com/r/Portland/comments/2vdsyb/so_just_a_psa_had_my_package_stolen_today_in/,,,
3orangespaces,1422335475.0,,,t2_kyxnx,1423540321,self.Portland,https://www.reddit.com/r/Portland/comments/2vdpu1/half_price_dodge_ball_anyone_interested/,0,2vdpu1,True,{},10,False,/r/Portland/comments/2vdpu1/half_price_dodge_ball_anyone_interested/,1440916350,1,{},i play dodge ball with recess time sports and I saw in the portland dodge ball group on facebook they're offering half off discounts for the tuesday night league cause it already started.. just figured i would pass it along and see if anyone on here was interested. it usually cost like $80 so you could play for like $40 bucks and i think you only missed 2-3 games. ,False,Portland,t5_2qi2i,self,"half price dodge ball, anyone interested?",http://www.reddit.com/r/Portland/comments/2vdpu1/half_price_dodge_ball_anyone_interested/,,,
pdxthrowawayyy,1423538638.0,,,t2_l9q3x,1423539605,self.Portland,https://www.reddit.com/r/Portland/comments/2vdogv/tubalessure_under_30_in_portland/,0,2vdogv,True,{},12,False,/r/Portland/comments/2vdogv/tubalessure_under_30_in_portland/,1440916366,10,{},"I'm 27 and looking for a doctor who will perform tubal ligation or Essure in Portland on someone under 30 who doesn't have any children (thank god!) I've been looking around Childfree subreddits and forums and the closest I've found are doctors in Washington, but I'd like someone closer, if it's possible. I have United Healthcare if that helps, I thought it'd be more helpful to ask here before calling and dealing with them.
I'm not interested in an IUD because I'm really sensitive to side effects. I've wanted this procedure for a long time, but didn't have health insurance until recently. I've never liked kids, and even if I somehow did, I believe strongly in adoption, so I'm not going to ""regret"" it. I don't mind if the doctor asks a few (honest) questions or asks for a psych eval, I just don't want to be jerked around or end up denied for some ridiculous reason.
Did you, or someone you know deal with a compassion practitioner in Portland or the nearby area? I really appreciate it! If you are wary of posting that information here, please please PM me.",False,Portland,t5_2qi2i,self,Tubal/Essure under 30 in Portland?,http://www.reddit.com/r/Portland/comments/2vdogv/tubalessure_under_30_in_portland/,,,
ScienceisMagic,1350967769.0,,,t2_9dtw0,1423536519,nytimes.com,https://www.reddit.com/r/Portland/comments/2vdiif/nyt_where_young_college_graduates_are_choosing_to/,0,2vdiif,False,{},3,False,/r/Portland/comments/2vdiif/nyt_where_young_college_graduates_are_choosing_to/,1440916444,0,{},,False,Portland,t5_2qi2i,default,NYT: Where Young College Graduates Are Choosing to Live,http://www.nytimes.com/2014/10/20/upshot/where-young-college-graduates-are-choosing-to-live.html?WT.mc_id=2015-Q1-KEYWEE-AUD_DEV-0101-0331&amp;WT.mc_ev=click&amp;bicmp=AD&amp;bicmlukp=WT.mc_id&amp;bicmst=1420088400&amp;bicmet=1451624400&amp;ad-keywords=FEBAUDDEV&amp;kwp_0=8781&amp;kwp_4=64872&amp;kwp_1=122099&amp;_r=0&amp;abt=0002&amp;abg=1,,,
siscily,1413498337.0,,,t2_iw8a2,1423532634,self.Portland,https://www.reddit.com/r/Portland/comments/2vdav5/electric_wizard/,0,2vdav5,True,{},5,False,/r/Portland/comments/2vdav5/electric_wizard/,1440916543,4,{},"Anybody know of someone selling tickets to Electric Wizard? Or if you are? Please let me know if so, thanks! ",False,Portland,t5_2qi2i,self,Electric Wizard,http://www.reddit.com/r/Portland/comments/2vdav5/electric_wizard/,,,
Propyl_People_Ether,1350118334.0,,SE,t2_9afd4,1423531949,self.Portland,https://www.reddit.com/r/Portland/comments/2vd9cj/high_speed_internet_who_sucks_least_pls_halp/,0,2vd9cj,True,{},12,False,/r/Portland/comments/2vd9cj/high_speed_internet_who_sucks_least_pls_halp/,1440916562,0,{},"We currently have service with a dinosaur ISP because they don't particularly notice piracy and my partner keeps their email address. However, I've had it up to here with bullshit connection speeds. I'm typing this on my cell phone because my computer is basically a typewriter with this crap wifi. 

Trouble is, all the high-speed providers seem to score under two stars on Yelp. 

Someone help me out here, I'm going nuts. Do you have Internet service in Portland that you're non-miserable with? If so, who's your carrier? It doesn't even need to be that fast - we're not MMO gamers or anything. Just... Save me from this basic DSL and its regular outages. Please. 

I'm in inner SE, if that's helpful. ",False,Portland,t5_2qi2i,self,High speed Internet: who sucks least? PLS HALP.,http://www.reddit.com/r/Portland/comments/2vd9cj/high_speed_internet_who_sucks_least_pls_halp/,,,
[deleted],,,,,1423529128,self.Portland,https://www.reddit.com/r/Portland/comments/2vd3i5/anybody_work_now_or_has_worked_at_pite_duncan/,0,2vd3i5,True,{},1,False,/r/Portland/comments/2vd3i5/anybody_work_now_or_has_worked_at_pite_duncan/,1440916638,2,{},"I've got a job interview there next week and can't find much about their Portland office on Glassdoor.  They're offering almost three bucks more an hour doing the same thing I do at the law firm where I currently work, so it's VERY tempting.  I would love to hear from any current/former employees!!",False,Portland,t5_2qi2i,default,Anybody work now or has worked at Pite Duncan?,http://www.reddit.com/r/Portland/comments/2vd3i5/anybody_work_now_or_has_worked_at_pite_duncan/,,,
RandyWe2,1415857957.0,,,t2_jc4fa,1423527745,self.Portland,https://www.reddit.com/r/Portland/comments/2vd0p8/portland_to_san_diego_ride_offered/,0,2vd0p8,True,{},3,False,/r/Portland/comments/2vd0p8/portland_to_san_diego_ride_offered/,1440916674,13,{},I am going from Portland to San Diego tomorrow in a Uhaul. I have room for a person and/or things. What rideshare do Portlanders use?,False,Portland,t5_2qi2i,self,Portland to San Diego ride offered,http://www.reddit.com/r/Portland/comments/2vd0p8/portland_to_san_diego_ride_offered/,,,
liveplur,1379096789.0,,,t2_d5239,1423527719,kptv.com,https://www.reddit.com/r/Portland/comments/2vd0ne/rapper_e40_to_visit_two_portland_fred_meyer/,0,2vd0ne,False,{},36,False,/r/Portland/comments/2vd0ne/rapper_e40_to_visit_two_portland_fred_meyer/,1440916676,60,{},,False,Portland,t5_2qi2i,http://b.thumbs.redditmedia.com/VpgYtrJH6umnDgJnTnHAjxUDyJwd_S6s__7Xfw0x5DE.jpg,Rapper E-40 to visit two Portland Fred Meyer stores and autograph his new line of wines,http://www.kptv.com/story/28061189/rapper-e-40-to-visit-two-portland-fred-meyer-stores?autostart=true,,,
feynmanwithtwosticks,1334788075.0,,,t2_7hrom,1423521697,self.Portland,https://www.reddit.com/r/Portland/comments/2vcnln/help_finding_an_apartment/,0,2vcnln,True,{},29,False,/r/Portland/comments/2vcnln/help_finding_an_apartment/,1440916844,0,{},"Alright folks, I am hoping people here can give me a few good leads on where to look for good apartments. There are so many buildings downtown that don't really advertise their listings on the major sites, and Craigslist blows for searching. 

Anyway, I just recently moved back to Portland from Oklahoma City and I'm currently staying with my Folks until I can save up a security deposit, which will be around mid-march. I'm looking to live downtown/pearl/NW, but anywhere close-in and on a MAX line would work great. 

Does anyone know of a great place to search for apartments that may be a bbit more inclusive than the normal rent.com or apartmentfinder type sites? Any leads would be awesome. ",False,Portland,t5_2qi2i,self,Help finding an apartment,http://www.reddit.com/r/Portland/comments/2vcnln/help_finding_an_apartment/,,,
[deleted],,,,,1423521462,self.Portland,https://www.reddit.com/r/Portland/comments/2vcn2y/why_would_you_steal_that_thieves_steal_a_potted/,0,2vcn2y,True,{},31,False,/r/Portland/comments/2vcn2y/why_would_you_steal_that_thieves_steal_a_potted/,1440916851,21,{},"I just watched a hilarious video of a couple trying to shove our concrete planter with tree inside their van at 11:24PM Saturday evening. And had the gall to try to nab the other one!

Their van and license plate has been reported. We're tracking them down now, but if anyone happens to see [one of these]
(http://imgur.com/LQW6XIY), please message me. It's about 35 pounds and 30"" tall.

Case # 15-1053
Beaverton Police Dept

EDIT: [KATU Video](http://www.katu.com/news/local/Social-crime-solvers-The-internet-is-your-best-friend-right-now-291423831.html)

EDIT: Original surveillance video [here](https://www.youtube.com/watch?v=d0UaHvHdZ1Q) (sorry for potato quality)",False,Portland,t5_2qi2i,default,Why would you steal that? Thieves steal a potted plant from my business in Beaverton. Can you keep an eye out for it?,http://www.reddit.com/r/Portland/comments/2vcn2y/why_would_you_steal_that_thieves_steal_a_potted/,1423613935.0,,
mightymangotits,1421045642.0,,,t2_knvz0,1423519003,self.Portland,https://www.reddit.com/r/Portland/comments/2vch9q/where_can_i_find_collage_materials/,0,2vch9q,True,{},6,False,/r/Portland/comments/2vch9q/where_can_i_find_collage_materials/,1440916926,0,{},I am working on a collage project with cut magazines. Is there a place I can go to pick up a bunch of old ones for free? Thanks portland!,False,Portland,t5_2qi2i,self,Where can I find collage materials?,http://www.reddit.com/r/Portland/comments/2vch9q/where_can_i_find_collage_materials/,,,
