author,author_created_utc,author_flair_css_class,author_flair_text,author_fullname,created_utc,domain,edited,full_link,gilded,id,is_self,link_flair_css_class,link_flair_text,locked,media_embed,num_comments,over_18,permalink,retrieved_on,score,secure_media_embed,selftext,stickied,subreddit,subreddit_id,thumbnail,title,url,post_hint,preview,media,secure_media,distinguished
imyxle,1259028004.0,,Trumptown,t2_3qkrw,1466466260,youtube.com,,https://www.reddit.com/r/Portland/comments/4p1pd8/how_this_sub_feels_since_last_week/,0,4p1pd8,False,local-news,Local News,False,"{'content': '&lt;iframe width=""459"" height=""344"" src=""https://www.youtube.com/embed/kkX-BnW9loU?feature=oembed"" frameborder=""0"" allowfullscreen&gt;&lt;/iframe&gt;', 'height': 344, 'scrolling': False, 'width': 459}",83,False,/r/Portland/comments/4p1pd8/how_this_sub_feels_since_last_week/,1472796088,28,"{'content': '&lt;iframe width=""459"" height=""344"" src=""https://www.youtube.com/embed/kkX-BnW9loU?feature=oembed"" frameborder=""0"" allowfullscreen&gt;&lt;/iframe&gt;', 'height': 344, 'scrolling': False, 'width': 459}",,False,Portland,t5_2qi2i,http://a.thumbs.redditmedia.com/AT4Eei3FCShFJiSGJHKQyaN8Up6l4bB0zFuTNgdHln0.jpg,How this sub feels since last week,https://www.youtube.com/watch?v=kkX-BnW9loU,rich:video,"{'images': [{'id': 'EqgvYN17MplRO6gas2WJ05AX60PYvsj9XrFDi2OcNhw', 'resolutions': [{'height': 81, 'url': 'https://i.redditmedia.com/3yDXxpTV9Z4N1U9__E6EFbJZJ80TyXSP8XASUBhT-Bk.jpg?fit=crop&amp;crop=faces%2Centropy&amp;arh=2&amp;w=108&amp;s=e3280b66b88c5cda9508ee4348b420c0', 'width': 108}, {'height': 162, 'url': 'https://i.redditmedia.com/3yDXxpTV9Z4N1U9__E6EFbJZJ80TyXSP8XASUBhT-Bk.jpg?fit=crop&amp;crop=faces%2Centropy&amp;arh=2&amp;w=216&amp;s=6c6e803c71aa3ce4cec0d779ed71172b', 'width': 216}, {'height': 240, 'url': 'https://i.redditmedia.com/3yDXxpTV9Z4N1U9__E6EFbJZJ80TyXSP8XASUBhT-Bk.jpg?fit=crop&amp;crop=faces%2Centropy&amp;arh=2&amp;w=320&amp;s=91ff00f2fa2207cb92b1970b0a4a3df2', 'width': 320}], 'source': {'height': 360, 'url': 'https://i.redditmedia.com/3yDXxpTV9Z4N1U9__E6EFbJZJ80TyXSP8XASUBhT-Bk.jpg?s=25eeedb79fd7ad4ce6504092bff576dd', 'width': 480}, 'variants': {}}]}","{'oembed': {'author_name': 'Michael Lewis', 'author_url': 'https://www.youtube.com/user/MrElCrotcho', 'height': 344, 'html': '&lt;iframe width=""459"" height=""344"" src=""https://www.youtube.com/embed/kkX-BnW9loU?feature=oembed"" frameborder=""0"" allowfullscreen&gt;&lt;/iframe&gt;', 'provider_name': 'YouTube', 'provider_url': 'https://www.youtube.com/', 'thumbnail_height': 360, 'thumbnail_url': 'https://i.ytimg.com/vi/kkX-BnW9loU/hqdefault.jpg', 'thumbnail_width': 480, 'title': 'Goodbye Moderation', 'type': 'video', 'version': '1.0', 'width': 459}, 'type': 'youtube.com'}","{'oembed': {'author_name': 'Michael Lewis', 'author_url': 'https://www.youtube.com/user/MrElCrotcho', 'height': 344, 'html': '&lt;iframe width=""459"" height=""344"" src=""https://www.youtube.com/embed/kkX-BnW9loU?feature=oembed"" frameborder=""0"" allowfullscreen&gt;&lt;/iframe&gt;', 'provider_name': 'YouTube', 'provider_url': 'https://www.youtube.com/', 'thumbnail_height': 360, 'thumbnail_url': 'https://i.ytimg.com/vi/kkX-BnW9loU/hqdefault.jpg', 'thumbnail_width': 480, 'title': 'Goodbye Moderation', 'type': 'video', 'version': '1.0', 'width': 459}, 'type': 'youtube.com'}",
CallMeValiant,,,,,1466465796,self.Portland,,https://www.reddit.com/r/Portland/comments/4p1o6g/those_who_bought_a_house_in_portland_in_the_last/,0,4p1o6g,True,help-me,Help Me,False,{},69,False,/r/Portland/comments/4p1o6g/those_who_bought_a_house_in_portland_in_the_last/,1472796070,16,{},"Native Portlandian here. With the crazy home prices and trends toward prices only going higher, I have to ask: How did you do it? Was it all loans? Was it mostly saving up forever?

I just look at my friends and I living in the Portland Metro area and feel like none of us will ever be able to buy a house. The honey trap of renting, wheeee.",False,Portland,t5_2qi2i,self,Those who bought a house in Portland in the last 5 years: HOW?,https://www.reddit.com/r/Portland/comments/4p1o6g/those_who_bought_a_house_in_portland_in_the_last/,,,,,
anarchitecture,1372727216.0,,SW,t2_c8c7s,1466463241,self.Portland,,https://www.reddit.com/r/Portland/comments/4p1hkf/designer_of_the_yard_defends_design/,0,4p1hkf,True,local-news,Local News,False,{},60,False,/r/Portland/comments/4p1hkf/designer_of_the_yard_defends_design/,1472795975,27,{},"**This is behind a paywall on the Daily Journal of Commerce website, thought I'd share. Written by Garrett Andrews for DJC Oregon 6/2/16**

In six weeks, market-rate apartment tenants will move into the Yard tower â€“ the jutting, angular embodiment of a new Central Eastside.
The 21-story mixed-use tower at the Burnside bridgehead has lived its share of controversy getting out of the ground. A large design change missed by plan examiners has led to questions about the cityâ€™s permitting process and the use of photo-realism in design renderings. Itâ€™s been assailed as cold and foreboding by critics.
The views from inside, though, are unassailably striking. Located near the geographic center of the city, Yard is currently the only high-rise across from downtown along the Willamette River.
â€œItâ€™s a pretty important site in Portland,â€ Skylab Architecture principal Jeff Kovel said on a tour this month. â€œYou can see, itâ€™s really the best position in the city.â€
Perhaps the biggest issue with the tower has been its glazing. The change missed by the city was involved a reduced number of vision glass panels â€“ resulting in a darker facade. The city and developer Key Development of Hood River have agreed the city will provide the project an additional 67 panels of glass, though itâ€™s not yet known whether theyâ€™ll be vision glass or spandrel glass.
Developing the site long known as Block 67 has been a long time coming. For more than a century, the Central Eastside served as the manufacturing and industrial counterpoint to downtown. The recession put an end to a plan to build a shorter project on Block 67, with a Loweâ€™s store as an anchor tenant.
The building replaces a parking lot that for years served the Burnside Skatepark, a handmade landmark and a worldwide tourist draw.
Kovel said in ways large and small the project is meant to honor the Eastsideâ€™s â€œmakerâ€ spirit, which he said today has more creative offerings than the area across the Willamette.
It chafes Kovel that people have overlooked the good things about his project â€“ the inclusion of affordable workforce units, the fact that it isnâ€™t a cookie cutter with a cramped fitness center and a terrace tossed on top. But he acknowledges it is striking to see a structure so big on that site.
â€œItâ€™s the kind of thing you get used to over time,â€ he said. â€œIt gets to be part of the fabric.â€",False,Portland,t5_2qi2i,self,Designer of The Yard defends design,https://www.reddit.com/r/Portland/comments/4p1hkf/designer_of_the_yard_defends_design/,,,,,
[deleted],,,,,1466462491,i.reddituploads.com,,https://www.reddit.com/r/Portland/comments/4p1fh5/tripp_would_like_to_wish_you_a_happy_first_day_of/,0,4p1fh5,False,,,False,{},0,False,/r/Portland/comments/4p1fh5/tripp_would_like_to_wish_you_a_happy_first_day_of/,1472795946,1,{},[deleted],False,Portland,t5_2qi2i,default,Tripp would like to wish you a happy first day of summer! She was super excited to see Mount Hood and all the big volcanoes in clear view!,https://i.reddituploads.com/8f147f102ed940d3ae7a35a898b82242?fit=max&amp;h=1536&amp;w=1536&amp;s=ed919ca4d8d60062a7be9c5668d5a760,,,,,
[deleted],,,,,1466462368,self.Portland,1466462651.0,https://www.reddit.com/r/Portland/comments/4p1f5k/anybody_ride_line_33mcloughlinking_rd_or_line/,0,4p1f5k,True,,,False,{},6,False,/r/Portland/comments/4p1f5k/anybody_ride_line_33mcloughlinking_rd_or_line/,1472795942,0,{},[deleted],False,Portland,t5_2qi2i,default,Anybody ride Line 33-McLoughlin/King Rd or Line 85-Swan Island?,https://www.reddit.com/r/Portland/comments/4p1f5k/anybody_ride_line_33mcloughlinking_rd_or_line/,,,,,
ReadyTown,1462301623.0,,,t2_xnsry,1466461166,self.Portland,,https://www.reddit.com/r/Portland/comments/4p1btd/take_this_earthquake_preparedness_survey/,0,4p1btd,True,off-topic,Other,False,{},0,False,/r/Portland/comments/4p1btd/take_this_earthquake_preparedness_survey/,1472795894,0,{},"I have put together a brief survey to better understand how people are thinking about and preparing for an earthquake. Are we ready?

If you have 10 minutes, please fill it out. https://www.surveymonkey.com/r/earthquakeready

Also, if you'd like, feel free to share it via twitter, facebook, email, etc. to others who might contribute. Thanks!",False,Portland,t5_2qi2i,self,Take This Earthquake Preparedness Survey,https://www.reddit.com/r/Portland/comments/4p1btd/take_this_earthquake_preparedness_survey/,self,"{'images': [{'id': '9RET61CjA_8kI3TkRg89NZvhQteYUdvr0jl62v7Uxeg', 'resolutions': [{'height': 91, 'url': 'https://i.redditmedia.com/swgYpEyfOugzrdVtDYEoc3l0Sf8Yn7v4081eikGRx_0.jpg?fit=crop&amp;crop=faces%2Centropy&amp;arh=2&amp;w=108&amp;s=e158b6cd741af34815de259dee858195', 'width': 108}], 'source': {'height': 110, 'url': 'https://i.redditmedia.com/swgYpEyfOugzrdVtDYEoc3l0Sf8Yn7v4081eikGRx_0.jpg?s=4b5da12522cba2dc4b402f0d0ce9dfcb', 'width': 130}, 'variants': {}}]}",,,
QuantumRealims,1461337631.0,,,t2_xdeil,1466460683,wweek.com,,https://www.reddit.com/r/Portland/comments/4p1agf/a_jury_trial_for_an_eviction_would_have_been_very/,0,4p1agf,False,local-news,Local News,False,{},17,False,/r/Portland/comments/4p1agf/a_jury_trial_for_an_eviction_would_have_been_very/,1472795875,17,{},,False,Portland,t5_2qi2i,http://b.thumbs.redditmedia.com/GWdkUhAOW77OPAF4RwzI358mjvq72Wec89XMDmicqEU.jpg,"â€œA jury trial for an eviction would have been very unusual,â€ a Multnomah County Circuit judge says.",http://www.wweek.com/news/2016/06/19/a-jury-trial-for-an-eviction-jessie-sponberg-almost-made-it-happen/,link,"{'images': [{'id': 'W8r_oXqd07Hxa-mvyxrUzvRIDVVJF9l2iKTGjy9mApg', 'resolutions': [{'height': 81, 'url': 'https://i.redditmedia.com/wRbg-eIpZTVvc99izzJQwSxxNSl-qg8rYdOe1qAaWZE.jpg?fit=crop&amp;crop=faces%2Centropy&amp;arh=2&amp;w=108&amp;s=1aaad0dab7c70f28f3068e0467d2763c', 'width': 108}, {'height': 162, 'url': 'https://i.redditmedia.com/wRbg-eIpZTVvc99izzJQwSxxNSl-qg8rYdOe1qAaWZE.jpg?fit=crop&amp;crop=faces%2Centropy&amp;arh=2&amp;w=216&amp;s=2414a04041f01a38cf30d96fadad4dfc', 'width': 216}, {'height': 240, 'url': 'https://i.redditmedia.com/wRbg-eIpZTVvc99izzJQwSxxNSl-qg8rYdOe1qAaWZE.jpg?fit=crop&amp;crop=faces%2Centropy&amp;arh=2&amp;w=320&amp;s=edb672afc53e560540918e0abfe545a9', 'width': 320}, {'height': 480, 'url': 'https://i.redditmedia.com/wRbg-eIpZTVvc99izzJQwSxxNSl-qg8rYdOe1qAaWZE.jpg?fit=crop&amp;crop=faces%2Centropy&amp;arh=2&amp;w=640&amp;s=feb02f1dec07075ace714a0f25c4151c', 'width': 640}], 'source': {'height': 615, 'url': 'https://i.redditmedia.com/wRbg-eIpZTVvc99izzJQwSxxNSl-qg8rYdOe1qAaWZE.jpg?s=ac3d3e08191a848610188e2043efeea4', 'width': 820}, 'variants': {}}]}",,,
epicrepairetime,1448858794.0,,,t2_sjkhv,1466460522,portlandtribune.com,,https://www.reddit.com/r/Portland/comments/4p1a08/amazoncom_to_open_bookstore_at_washington_square/,0,4p1a08,False,local-news,Local News,False,{},12,False,/r/Portland/comments/4p1a08/amazoncom_to_open_bookstore_at_washington_square/,1472795869,0,{},,False,Portland,t5_2qi2i,default,Amazon.com to open bookstore at Washington Square mall,http://portlandtribune.com/pt/9-news/311781-190268-amazoncom-to-open-bookstore-at-washington-square-mall,,,,,
[deleted],,,,,1466459942,self.Portland,1470251410.0,https://www.reddit.com/r/Portland/comments/4p18f6/calling_all_sketchup_masters_would_you_be_willing/,0,4p18f6,True,classifieds,Classifieds,False,{},6,False,/r/Portland/comments/4p18f6/calling_all_sketchup_masters_would_you_be_willing/,1472795847,3,{},[deleted],False,Portland,t5_2qi2i,default,Calling all sketch-up masters: would you be willing to teach me the basics in exchange for some beer?,https://www.reddit.com/r/Portland/comments/4p18f6/calling_all_sketchup_masters_would_you_be_willing/,,,,,
ZeroXing,1464455183.0,,,t2_y9zc7,1466458715,docs.google.com,,https://www.reddit.com/r/Portland/comments/4p1545/ukulele_flash_mob_tomorrow_for_make_music_day/,0,4p1545,False,event,Events,False,{},3,False,/r/Portland/comments/4p1545/ukulele_flash_mob_tomorrow_for_make_music_day/,1472795799,0,{},,False,Portland,t5_2qi2i,http://b.thumbs.redditmedia.com/ldKhZmt1Ys4Hz_WRbvlBUE-YBgIQL1hiIAxrFWK9Ovw.jpg,"Ukulele flash mob tomorrow for ""Make Music Day""",https://docs.google.com/forms/d/1sMXcXwLhWpFihMXuTYel7JeSV9fLTrQ0nN_p8pCW7CU/viewform?c=0&amp;w=1,link,"{'images': [{'id': '7A2bMAAkw7nczkE3iS0PGiQXXKwn6uI0VyDU6_HeY3Q', 'resolutions': [{'height': 56, 'url': 'https://i.redditmedia.com/QpSe7GQNAQTahrwOVRiKpKedY-TaSVPyCBoTvcnBGnA.jpg?fit=crop&amp;crop=faces%2Centropy&amp;arh=2&amp;w=108&amp;s=efa321718100217a97311bb0f68c3fc7', 'width': 108}, {'height': 113, 'url': 'https://i.redditmedia.com/QpSe7GQNAQTahrwOVRiKpKedY-TaSVPyCBoTvcnBGnA.jpg?fit=crop&amp;crop=faces%2Centropy&amp;arh=2&amp;w=216&amp;s=05219fa947d1a421b32d4f245042f2a9', 'width': 216}, {'height': 168, 'url': 'https://i.redditmedia.com/QpSe7GQNAQTahrwOVRiKpKedY-TaSVPyCBoTvcnBGnA.jpg?fit=crop&amp;crop=faces%2Centropy&amp;arh=2&amp;w=320&amp;s=b3522d84e710c42a21f1e708f3ebbc78', 'width': 320}, {'height': 336, 'url': 'https://i.redditmedia.com/QpSe7GQNAQTahrwOVRiKpKedY-TaSVPyCBoTvcnBGnA.jpg?fit=crop&amp;crop=faces%2Centropy&amp;arh=2&amp;w=640&amp;s=524d945271aa9734c1275edd0698e10f', 'width': 640}, {'height': 504, 'url': 'https://i.redditmedia.com/QpSe7GQNAQTahrwOVRiKpKedY-TaSVPyCBoTvcnBGnA.jpg?fit=crop&amp;crop=faces%2Centropy&amp;arh=2&amp;w=960&amp;s=21e0e9732a0fa247254db8401083ce67', 'width': 960}, {'height': 567, 'url': 'https://i.redditmedia.com/QpSe7GQNAQTahrwOVRiKpKedY-TaSVPyCBoTvcnBGnA.jpg?fit=crop&amp;crop=faces%2Centropy&amp;arh=2&amp;w=1080&amp;s=26b603065fcb9bb8ec4fc05b0df35644', 'width': 1080}], 'source': {'height': 630, 'url': 'https://i.redditmedia.com/QpSe7GQNAQTahrwOVRiKpKedY-TaSVPyCBoTvcnBGnA.jpg?s=bcdb719424748c89dd0cdaff0081ac80', 'width': 1200}, 'variants': {}}]}",,,
arr_gee_jay,1464193103.0,,Creston-Kenilworth,t2_y7dsi,1466455606,oregonhumane.org,,https://www.reddit.com/r/Portland/comments/4p0wga/good_news_you_can_welcome_satan_into_your_home/,0,4p0wga,False,local-news,Local News,False,{},38,False,/r/Portland/comments/4p0wga/good_news_you_can_welcome_satan_into_your_home/,1472795676,279,{},,False,Portland,t5_2qi2i,http://b.thumbs.redditmedia.com/ue7F-_WcfmsrepL0Z0fujjjwnqIC_xCsexDqyWeIW5g.jpg,"Good news! You can welcome Satan into your home for only $2.50. Thank you, Oregon Humane Society.",http://www.oregonhumane.org/adopt/details/189167/,link,"{'images': [{'id': 'MFM4gaAJL0MVat_3mONl4DJmMYa2U9MzgqhEaJOmX2g', 'resolutions': [{'height': 81, 'url': 'https://i.redditmedia.com/o1PX_Dg88_DHxOormDSOOquQNn_Wm0M-KnekbtGryC4.jpg?fit=crop&amp;crop=faces%2Centropy&amp;arh=2&amp;w=108&amp;s=410c0b79e497f0e3dc2480162a2fbc0c', 'width': 108}, {'height': 162, 'url': 'https://i.redditmedia.com/o1PX_Dg88_DHxOormDSOOquQNn_Wm0M-KnekbtGryC4.jpg?fit=crop&amp;crop=faces%2Centropy&amp;arh=2&amp;w=216&amp;s=6845bf8886f02e69845698fcc6b9f5c2', 'width': 216}, {'height': 240, 'url': 'https://i.redditmedia.com/o1PX_Dg88_DHxOormDSOOquQNn_Wm0M-KnekbtGryC4.jpg?fit=crop&amp;crop=faces%2Centropy&amp;arh=2&amp;w=320&amp;s=467628608f3164cf828e7b11ffaa3eaa', 'width': 320}], 'source': {'height': 375, 'url': 'https://i.redditmedia.com/o1PX_Dg88_DHxOormDSOOquQNn_Wm0M-KnekbtGryC4.jpg?s=d6c876b0e61e38de9dcb42766bf94110', 'width': 500}, 'variants': {}}]}",,,
[deleted],,,,,1466453870,portlandtribune.com,,https://www.reddit.com/r/Portland/comments/4p0r9z/oregon_dmv_rules_make_state_ripe_for_fraud_auto/,0,4p0r9z,False,local-news,Local News,False,{},14,False,/r/Portland/comments/4p0r9z/oregon_dmv_rules_make_state_ripe_for_fraud_auto/,1472795602,90,{},[deleted],False,Portland,t5_2qi2i,default,"Oregon DMV rules make state ripe for fraud, auto theft",http://portlandtribune.com/pt/9-news/311232-183364-oregon-dmv-rules-make-state-ripe-for-fraud-auto-theft,,,,,
rawesome400,1432879731.0,,,t2_ns2o4,1466451628,wweek.com,,https://www.reddit.com/r/Portland/comments/4p0kjt/smokin_the_bible_with_pride/,0,4p0kjt,False,local-news,Local News,False,{},73,False,/r/Portland/comments/4p0kjt/smokin_the_bible_with_pride/,1472795505,12,{},,False,Portland,t5_2qi2i,http://b.thumbs.redditmedia.com/nQF6VYQxIyw-xxf5Elq1UyxtbdRSStUKdkRODZ7UEPc.jpg,Smokin' the Bible with Pride,http://www.wweek.com/arts/2016/06/20/joints-rolled-in-the-bible-got-smoked-at-pride/,link,"{'images': [{'id': 'jw6rcPKEqY3QJWPb9b6npHG9ImVMu5shdfTQM_0MNoA', 'resolutions': [{'height': 144, 'url': 'https://i.redditmedia.com/tWnwDam0uUmDnchRBkmKvOcQrR7AxJOygPEbFt-uC7M.jpg?fit=crop&amp;crop=faces%2Centropy&amp;arh=2&amp;w=108&amp;s=cdc447c3cb93bf4258eb90099bb52b8a', 'width': 108}, {'height': 288, 'url': 'https://i.redditmedia.com/tWnwDam0uUmDnchRBkmKvOcQrR7AxJOygPEbFt-uC7M.jpg?fit=crop&amp;crop=faces%2Centropy&amp;arh=2&amp;w=216&amp;s=21ea4ea9ec4e034f575f6e22ffc8a166', 'width': 216}, {'height': 426, 'url': 'https://i.redditmedia.com/tWnwDam0uUmDnchRBkmKvOcQrR7AxJOygPEbFt-uC7M.jpg?fit=crop&amp;crop=faces%2Centropy&amp;arh=2&amp;w=320&amp;s=f2219b079880656ca1be5704a3edc822', 'width': 320}, {'height': 853, 'url': 'https://i.redditmedia.com/tWnwDam0uUmDnchRBkmKvOcQrR7AxJOygPEbFt-uC7M.jpg?fit=crop&amp;crop=faces%2Centropy&amp;arh=2&amp;w=640&amp;s=0d21c20a8053a6dfac20134c54a948a7', 'width': 640}], 'source': {'height': 960, 'url': 'https://i.redditmedia.com/tWnwDam0uUmDnchRBkmKvOcQrR7AxJOygPEbFt-uC7M.jpg?s=3e51657ef1e22a81602ecca943596645', 'width': 720}, 'variants': {}}]}",,,
_R3BRTH_,1386272320.0,,,t2_e7vq6,1466449905,self.Portland,,https://www.reddit.com/r/Portland/comments/4p0fb2/looking_to_get_a_kitten_any_local_shelters_or/,0,4p0fb2,True,help-me,Help Me,False,{},25,False,/r/Portland/comments/4p0fb2/looking_to_get_a_kitten_any_local_shelters_or/,1472795430,12,{},"The title says it all. We would like to sponsor a cage free, free range, cruelty free kitten.",False,Portland,t5_2qi2i,self,Looking to get a kitten. Any local shelters or kitten dealers you can vouch for?,https://www.reddit.com/r/Portland/comments/4p0fb2/looking_to_get_a_kitten_any_local_shelters_or/,,,,,
[deleted],,,,,1466449280,self.Portland,,https://www.reddit.com/r/Portland/comments/4p0de3/i_am_going_to_do_a_day_trip_up_to_timothy_lake/,0,4p0de3,True,help-me,Help Me,False,{},9,False,/r/Portland/comments/4p0de3/i_am_going_to_do_a_day_trip_up_to_timothy_lake/,1472795403,0,{},[deleted],False,Portland,t5_2qi2i,default,I am going to do a day trip up to Timothy lake Tuesday and I am wondering what the quietest sites are,https://www.reddit.com/r/Portland/comments/4p0de3/i_am_going_to_do_a_day_trip_up_to_timothy_lake/,,,,,
[deleted],,,,,1466449022,tdhurst.com,,https://www.reddit.com/r/Portland/comments/4p0cjh/had_i_died_today_tdhurst_leaves_burnside_26/,0,4p0cjh,False,local-news,Local News,False,{},25,False,/r/Portland/comments/4p0cjh/had_i_died_today_tdhurst_leaves_burnside_26/,1472795391,0,{},[deleted],False,Portland,t5_2qi2i,default,Had I Died Today (tdhurst leaves Burnside 26),http://tdhurst.com/died-today/,,,,,
mayoms,1179732666.0,,Cully,t2_1sa30,1466448750,wweek.com,,https://www.reddit.com/r/Portland/comments/4p0bpf/life_in_the_numbers/,0,4p0bpf,False,local-news,Local News,False,{},9,False,/r/Portland/comments/4p0bpf/life_in_the_numbers/,1472795379,5,{},,False,Portland,t5_2qi2i,http://b.thumbs.redditmedia.com/fmzYsaFx9bZYgwnURONDvIa2Adqpxk9LTqWUYKRAIRs.jpg,Life In the Numbers:,http://www.wweek.com/culture/2016/06/15/life-in-the-numbers/,link,"{'images': [{'id': 'pv2BK-tc-0xbdZ0fZptDnJ6HrKaWUCt_YyPI1Rc9pD8', 'resolutions': [{'height': 73, 'url': 'https://i.redditmedia.com/9TQY7SvAHlPzD6lKszzC8NrlACGmENIp9JK6xp5j1Cs.jpg?fit=crop&amp;crop=faces%2Centropy&amp;arh=2&amp;w=108&amp;s=7b0f14b47e9d923b3611a5d4d586a3b1', 'width': 108}, {'height': 147, 'url': 'https://i.redditmedia.com/9TQY7SvAHlPzD6lKszzC8NrlACGmENIp9JK6xp5j1Cs.jpg?fit=crop&amp;crop=faces%2Centropy&amp;arh=2&amp;w=216&amp;s=a1766c43a1d0ade0fefdb973a096c7ae', 'width': 216}, {'height': 218, 'url': 'https://i.redditmedia.com/9TQY7SvAHlPzD6lKszzC8NrlACGmENIp9JK6xp5j1Cs.jpg?fit=crop&amp;crop=faces%2Centropy&amp;arh=2&amp;w=320&amp;s=c09d368c6d6bab21835b7735a0351e69', 'width': 320}, {'height': 437, 'url': 'https://i.redditmedia.com/9TQY7SvAHlPzD6lKszzC8NrlACGmENIp9JK6xp5j1Cs.jpg?fit=crop&amp;crop=faces%2Centropy&amp;arh=2&amp;w=640&amp;s=f9a032158e684fffe80c8c7bbd5d7a68', 'width': 640}, {'height': 656, 'url': 'https://i.redditmedia.com/9TQY7SvAHlPzD6lKszzC8NrlACGmENIp9JK6xp5j1Cs.jpg?fit=crop&amp;crop=faces%2Centropy&amp;arh=2&amp;w=960&amp;s=39f32285c686689780ce351d295a7cf3', 'width': 960}, {'height': 738, 'url': 'https://i.redditmedia.com/9TQY7SvAHlPzD6lKszzC8NrlACGmENIp9JK6xp5j1Cs.jpg?fit=crop&amp;crop=faces%2Centropy&amp;arh=2&amp;w=1080&amp;s=4e959970af21e22f87b435b096211b7b', 'width': 1080}], 'source': {'height': 2191, 'url': 'https://i.redditmedia.com/9TQY7SvAHlPzD6lKszzC8NrlACGmENIp9JK6xp5j1Cs.jpg?s=7ea15dbba4ce73e5ca362359948f3333', 'width': 3205}, 'variants': {}}]}",,,
MySobriquet,1432403285.0,,,t2_nn5jp,1466448591,self.Portland,,https://www.reddit.com/r/Portland/comments/4p0b81/refinishing_hardwood_floors/,0,4p0b81,True,help-me,Help Me,False,{},10,False,/r/Portland/comments/4p0b81/refinishing_hardwood_floors/,1472795373,0,{},"I have a house that I need to re-Finish the hardwoods. I've asked friends and tried the Google search for recommendations, only to have no call backs, no shows on appointments and failure to deliver estimates. I coming here for some help! Has anyone had good experiences? Thank you.",False,Portland,t5_2qi2i,self,Refinishing hardwood floors.,https://www.reddit.com/r/Portland/comments/4p0b81/refinishing_hardwood_floors/,,,,,
Someguypoiuyt,,,Ex-Port,,1466448150,bus75.org,,https://www.reddit.com/r/Portland/comments/4p09vn/riding_against_the_grain_line_75/,0,4p09vn,False,local-news,Local News,False,{},5,False,/r/Portland/comments/4p09vn/riding_against_the_grain_line_75/,1472795353,10,{},,False,Portland,t5_2qi2i,http://b.thumbs.redditmedia.com/k2bHRxVFihRVeo56Kw_BKxoGp8NAgUeXv1DYppTNoxI.jpg,Riding against the Grain: Line 75,https://bus75.org/2016/06/20/riding-against-the-grain-line-75/,link,"{'images': [{'id': 'XEy1WwTNCVuFp7WdFAg4s0sDf_TnpKEN9p8iOrkdfKw', 'resolutions': [{'height': 81, 'url': 'https://i.redditmedia.com/J2YyLB5nGYmguP2xDo0rRwP0fKzvAb6TM8juw_cm_Rs.jpg?fit=crop&amp;crop=faces%2Centropy&amp;arh=2&amp;w=108&amp;s=a8859fe51163d873011b83bb0aed1f51', 'width': 108}, {'height': 162, 'url': 'https://i.redditmedia.com/J2YyLB5nGYmguP2xDo0rRwP0fKzvAb6TM8juw_cm_Rs.jpg?fit=crop&amp;crop=faces%2Centropy&amp;arh=2&amp;w=216&amp;s=c383c3ac5753b21689f70ed17d60768f', 'width': 216}, {'height': 240, 'url': 'https://i.redditmedia.com/J2YyLB5nGYmguP2xDo0rRwP0fKzvAb6TM8juw_cm_Rs.jpg?fit=crop&amp;crop=faces%2Centropy&amp;arh=2&amp;w=320&amp;s=6222c28965bf2930dc08bf35589b3f04', 'width': 320}, {'height': 480, 'url': 'https://i.redditmedia.com/J2YyLB5nGYmguP2xDo0rRwP0fKzvAb6TM8juw_cm_Rs.jpg?fit=crop&amp;crop=faces%2Centropy&amp;arh=2&amp;w=640&amp;s=f5e23a0370f379238919c19d44db2a6e', 'width': 640}, {'height': 720, 'url': 'https://i.redditmedia.com/J2YyLB5nGYmguP2xDo0rRwP0fKzvAb6TM8juw_cm_Rs.jpg?fit=crop&amp;crop=faces%2Centropy&amp;arh=2&amp;w=960&amp;s=693ed8da0e1f72ec98c0d35adc41f85f', 'width': 960}, {'height': 810, 'url': 'https://i.redditmedia.com/J2YyLB5nGYmguP2xDo0rRwP0fKzvAb6TM8juw_cm_Rs.jpg?fit=crop&amp;crop=faces%2Centropy&amp;arh=2&amp;w=1080&amp;s=d4f2eb59759f69edf0f6f6f701d16344', 'width': 1080}], 'source': {'height': 900, 'url': 'https://i.redditmedia.com/J2YyLB5nGYmguP2xDo0rRwP0fKzvAb6TM8juw_cm_Rs.jpg?s=153b15eaed51ee8d56ecf700efb2a7fd', 'width': 1200}, 'variants': {}}]}",,,
seethinksay,1432828227.0,,,t2_nrmji,1466445618,oregonlive.com,,https://www.reddit.com/r/Portland/comments/4p0221/parent_editorial_dreams_or_basics_for_portland/,0,4p0221,False,local-news,Local News,False,{},2,False,/r/Portland/comments/4p0221/parent_editorial_dreams_or_basics_for_portland/,1472795241,4,{},,False,Portland,t5_2qi2i,http://b.thumbs.redditmedia.com/4bjLi2xxf56FGgPFf3YGg3ocRBlqbaLh7XaCq4Ms35U.jpg,Parent Editorial: Dreams or Basics for Portland Public Schools?,http://www.oregonlive.com/opinion/index.ssf/2016/06/portland_school_leaders_must_t.html#incart_river_index,link,"{'images': [{'id': 'L7UAHqyNNd_bVCGKeom2AklwdnGx3vADp8qSIg1mpEw', 'resolutions': [{'height': 70, 'url': 'https://i.redditmedia.com/_Lt4HJPIexq-kBHHrEO-m4X0Do6_Zh8Ak6bhQmA9znM.jpg?fit=crop&amp;crop=faces%2Centropy&amp;arh=2&amp;w=108&amp;s=1243526d69d5e1136512671ba0cd5318', 'width': 108}, {'height': 140, 'url': 'https://i.redditmedia.com/_Lt4HJPIexq-kBHHrEO-m4X0Do6_Zh8Ak6bhQmA9znM.jpg?fit=crop&amp;crop=faces%2Centropy&amp;arh=2&amp;w=216&amp;s=c6ca0732f0b87377f2a8ee0c6a61970a', 'width': 216}, {'height': 208, 'url': 'https://i.redditmedia.com/_Lt4HJPIexq-kBHHrEO-m4X0Do6_Zh8Ak6bhQmA9znM.jpg?fit=crop&amp;crop=faces%2Centropy&amp;arh=2&amp;w=320&amp;s=b21d2511609eaa65bf487ff1b8435427', 'width': 320}], 'source': {'height': 247, 'url': 'https://i.redditmedia.com/_Lt4HJPIexq-kBHHrEO-m4X0Do6_Zh8Ak6bhQmA9znM.jpg?s=373a2e2be57d0e34e903899d02c7d03d', 'width': 380}, 'variants': {}}]}",,,
