author,author_flair_css_class,author_flair_richtext,author_flair_text,author_flair_type,author_id,can_mod_post,contest_mode,created_utc,domain,full_link,gilded,id,is_crosspostable,is_original_content,is_reddit_media_domain,is_self,is_video,link_flair_richtext,link_flair_text_color,link_flair_type,locked,media_only,no_follow,num_comments,num_crossposts,over_18,parent_whitelist_status,permalink,pinned,pwls,retrieved_on,rte_mode,score,selftext,send_replies,spoiler,stickied,subreddit,subreddit_id,subreddit_subscribers,subreddit_type,thumbnail,title,url,whitelist_status,wls,link_flair_background_color,link_flair_css_class,link_flair_text,post_hint,preview,thumbnail_height,thumbnail_width,author_flair_background_color,author_flair_template_id,author_flair_text_color
Lutran,,"[{'e': 'text', 't': 'Hosford-Abernethy'}]",Hosford-Abernethy,richtext,t2_mqbge,False,False,1531785269,self.Portland,https://www.reddit.com/r/Portland/comments/8zg6wp/honey_bee_swarm/,0,8zg6wp,True,False,False,True,False,[],dark,text,False,False,True,15,0,False,all_ads,/r/Portland/comments/8zg6wp/honey_bee_swarm/,False,6,1531785270,markdown,13,"There's a little swarm having a rest (or making a nest?) in a tree right off of SE Larch and SE Spruce in Ladd's Addition best to the white house.

https://m.imgur.com/gallery/eykhCMn",True,False,False,Portland,t5_2qi2i,99883,public,self,Honey Bee Swarm?,https://www.reddit.com/r/Portland/comments/8zg6wp/honey_bee_swarm/,all_ads,6,,,,,,,,,,
guanaco55,,[],,text,t2_hyfa9,False,False,1531783784,oregonlive.com,https://www.reddit.com/r/Portland/comments/8zg0dn/this_cinderella_storys_modern_wit_will_appeal_to/,0,8zg0dn,True,False,False,False,False,"[{'e': 'text', 't': 'Local News'}]",dark,richtext,False,False,True,1,0,False,all_ads,/r/Portland/comments/8zg0dn/this_cinderella_storys_modern_wit_will_appeal_to/,False,6,1531783787,markdown,1,,True,False,False,Portland,t5_2qi2i,99882,public,https://b.thumbs.redditmedia.com/Pc42RB64ZczFE968Vtz9ggDt68fwKxm74CWSIQoDPss.jpg,This Cinderella story's modern wit will appeal to new and longtime opera fans alike,https://www.oregonlive.com/expo/life-and-culture/erry-2018/07/dbc43cf14b111/this-cinderella-storys-modern.html,all_ads,6,,local-news,Local News,link,"{'enabled': False, 'images': [{'id': 'rNM-yXO1dz4_EpXy3DPaRlnva_J0FDDtHMGHq3e89R0', 'resolutions': [{'height': 74, 'url': 'https://i.redditmedia.com/kCVyfaagKp73JBrJX9wdw3y--XfxFT__TXInxM_IPCw.jpg?fit=crop&amp;crop=faces%2Centropy&amp;arh=2&amp;w=108&amp;s=96d94fe4f3e5b992994765ce9723c5f6', 'width': 108}, {'height': 148, 'url': 'https://i.redditmedia.com/kCVyfaagKp73JBrJX9wdw3y--XfxFT__TXInxM_IPCw.jpg?fit=crop&amp;crop=faces%2Centropy&amp;arh=2&amp;w=216&amp;s=8592682b1bc1de54fdffce3947c48d1c', 'width': 216}, {'height': 219, 'url': 'https://i.redditmedia.com/kCVyfaagKp73JBrJX9wdw3y--XfxFT__TXInxM_IPCw.jpg?fit=crop&amp;crop=faces%2Centropy&amp;arh=2&amp;w=320&amp;s=2e3d5128c52dcd162ec1c06d05ea400d', 'width': 320}, {'height': 439, 'url': 'https://i.redditmedia.com/kCVyfaagKp73JBrJX9wdw3y--XfxFT__TXInxM_IPCw.jpg?fit=crop&amp;crop=faces%2Centropy&amp;arh=2&amp;w=640&amp;s=f77e0bc1b69375be691af8e3bbd2f860', 'width': 640}, {'height': 659, 'url': 'https://i.redditmedia.com/kCVyfaagKp73JBrJX9wdw3y--XfxFT__TXInxM_IPCw.jpg?fit=crop&amp;crop=faces%2Centropy&amp;arh=2&amp;w=960&amp;s=7a1d32d2ef882978fe39c199ded3da43', 'width': 960}], 'source': {'height': 659, 'url': 'https://i.redditmedia.com/kCVyfaagKp73JBrJX9wdw3y--XfxFT__TXInxM_IPCw.jpg?s=727630de08ee5a784882b318ed9d6dc9', 'width': 960}, 'variants': {}}]}",96.0,140.0,,,
guanaco55,,[],,text,t2_hyfa9,False,False,1531783663,oregonlive.com,https://www.reddit.com/r/Portland/comments/8zfzu5/sunday_parkways_will_hit_portlands_central_city/,0,8zfzu5,True,False,False,False,False,"[{'e': 'text', 't': 'Local News'}]",dark,richtext,False,False,True,1,0,False,all_ads,/r/Portland/comments/8zfzu5/sunday_parkways_will_hit_portlands_central_city/,False,6,1531783664,markdown,2,,True,False,False,Portland,t5_2qi2i,99882,public,https://a.thumbs.redditmedia.com/3jE2ORz4TUvAOFHyyxZ1utxKJZjByfV3e-rHQWgRCf8.jpg,"Sunday Parkways will hit Portland's Central City, 'Green Loop' this weekend",https://www.oregonlive.com/roadreport/index.ssf/2018/07/sunday_parkways_will_hit_portl.html#incart_m-rpt-2,all_ads,6,,local-news,Local News,link,"{'enabled': False, 'images': [{'id': 'aFD0uq1EUKY_w2jLsETGqCjz2FBixhdDdSEBBBYYggY', 'resolutions': [{'height': 71, 'url': 'https://i.redditmedia.com/QMWf2D_NvqJ70U4CwE6tU06TWs0ba891Y6uxXGOB6aU.jpg?fit=crop&amp;crop=faces%2Centropy&amp;arh=2&amp;w=108&amp;s=c52058b80369080b7d5a2bdaaf925dfa', 'width': 108}, {'height': 143, 'url': 'https://i.redditmedia.com/QMWf2D_NvqJ70U4CwE6tU06TWs0ba891Y6uxXGOB6aU.jpg?fit=crop&amp;crop=faces%2Centropy&amp;arh=2&amp;w=216&amp;s=62a2c1dab720b495d165105f347c3c06', 'width': 216}, {'height': 212, 'url': 'https://i.redditmedia.com/QMWf2D_NvqJ70U4CwE6tU06TWs0ba891Y6uxXGOB6aU.jpg?fit=crop&amp;crop=faces%2Centropy&amp;arh=2&amp;w=320&amp;s=9e9497b027efc80647dcc701542f6f84', 'width': 320}], 'source': {'height': 411, 'url': 'https://i.redditmedia.com/QMWf2D_NvqJ70U4CwE6tU06TWs0ba891Y6uxXGOB6aU.jpg?s=32c18f553fbd774934c9c4ecf9db210f', 'width': 620}, 'variants': {}}]}",92.0,140.0,,,
guanaco55,,[],,text,t2_hyfa9,False,False,1531783567,oregonlive.com,https://www.reddit.com/r/Portland/comments/8zfzf1/shes_a_fighter_sheriff_says_of_portland_woman_who/,0,8zfzf1,True,False,False,False,False,[],dark,text,False,False,True,4,1,False,all_ads,/r/Portland/comments/8zfzf1/shes_a_fighter_sheriff_says_of_portland_woman_who/,False,6,1531783568,markdown,6,,True,False,False,Portland,t5_2qi2i,99882,public,default,"'She's a fighter,' sheriff says of Portland woman who survived 250-foot plunge over Big Sur cliffs",https://www.oregonlive.com/portland/index.ssf/2018/07/shes_a_fighter_sheriff_says_of.html#incart_target2box_default_#incart_target2box_targeted_,all_ads,6,,,,,,,,,,
MLKhimself,,[],,text,t2_1p2x5sw7,False,False,1531780929,imgur.com,https://www.reddit.com/r/Portland/comments/8zfn7d/as_long_as_the_mods_agree_with_your_speech_in/,0,8zfn7d,True,False,False,False,False,"[{'e': 'text', 't': 'Photo'}]",dark,richtext,False,False,True,26,0,False,all_ads,/r/Portland/comments/8zfn7d/as_long_as_the_mods_agree_with_your_speech_in/,False,6,1531780930,markdown,0,,True,False,False,Portland,t5_2qi2i,99881,public,default,As long as the mods agree with your speech in this sub you can hurl gay slurs at people. Nice to know.,https://imgur.com/ykTnr2W,all_ads,6,,photo,Photo,,,,,,,
lc969810,,[],,text,t2_1sgkyg8h,False,False,1531780681,self.Portland,https://www.reddit.com/r/Portland/comments/8zfm33/portland_fantasy_football_league/,0,8zfm33,True,False,False,True,False,[],dark,text,False,False,True,16,0,False,all_ads,/r/Portland/comments/8zfm33/portland_fantasy_football_league/,False,6,1531780681,richtext,4,"Just moved out to Portland from Ohio, looking for a group to start or join a fantasy football league with. Drink some beers and watch the games on Sundays. Any interest??",True,False,False,Portland,t5_2qi2i,99881,public,self,Portland Fantasy Football League,https://www.reddit.com/r/Portland/comments/8zfm33/portland_fantasy_football_league/,all_ads,6,,,,,,,,,,
starknolonger,,[],,text,t2_j8iyi,False,False,1531779876,imgur.com,https://www.reddit.com/r/Portland/comments/8zfigz/this_is_fine/,0,8zfigz,True,False,False,False,False,"[{'e': 'text', 't': 'Photo'}]",dark,richtext,False,False,True,21,0,False,all_ads,/r/Portland/comments/8zfigz/this_is_fine/,False,6,1531779877,markdown,35,,True,False,False,Portland,t5_2qi2i,99881,public,default,this is fine,https://imgur.com/a/Ww58CbN,all_ads,6,,photo,Photo,,,,,,,
fidelitypdx,,[],,text,t2_8xtor,False,False,1531779335,self.Portland,https://www.reddit.com/r/Portland/comments/8zffsf/big_fire_in_se_portland_black_smoke_visible_from/,0,8zffsf,True,False,False,True,False,[],dark,text,False,False,True,0,0,False,all_ads,/r/Portland/comments/8zffsf/big_fire_in_se_portland_black_smoke_visible_from/,False,6,1531779336,markdown,25,https://twitter.com/pdxalerts has the info,True,False,False,Portland,t5_2qi2i,99880,public,self,"Big fire in SE Portland, black smoke visible from downtown - apparently mobile home park @ 12323 SE Holgate.",https://www.reddit.com/r/Portland/comments/8zffsf/big_fire_in_se_portland_black_smoke_visible_from/,all_ads,6,,,,,,,,,,
RushLocates,,[],,text,t2_z6xb1,False,False,1531779100,rushlocates.com,https://www.reddit.com/r/Portland/comments/8zfen4/a_short_history_about_how_homes_have_been_heated/,0,8zfen4,True,False,False,False,False,[],dark,text,False,False,True,7,0,False,all_ads,/r/Portland/comments/8zfen4/a_short_history_about_how_homes_have_been_heated/,False,6,1531779100,markdown,0,,True,False,False,Portland,t5_2qi2i,99880,public,default,A short history about how homes have been heated in the Portland area over time,https://www.rushlocates.com/history-diesel-oil-heating-homes/,all_ads,6,,,,,,,,,,
Peralta89,,[],,text,t2_ia9cbyx,False,False,1531776221,i.redd.it,https://www.reddit.com/r/Portland/comments/8zf0fy/the_grotto_on_a_much_cooler_day_amazing_that_this/,0,8zf0fy,True,False,True,False,False,"[{'e': 'text', 't': 'Photo'}]",dark,richtext,False,False,True,12,0,False,all_ads,/r/Portland/comments/8zf0fy/the_grotto_on_a_much_cooler_day_amazing_that_this/,False,6,1531776222,markdown,234,,True,False,False,Portland,t5_2qi2i,99881,public,default,The Grotto on a much cooler day. Amazing that this is right in town. (OC),https://i.redd.it/k084cewfnda11.jpg,all_ads,6,,photo,Photo,,,,,,,
KarasianSky,,[],,text,t2_5mtg9cw,False,False,1531775605,i.redd.it,https://www.reddit.com/r/Portland/comments/8zewuh/portland_fire_responding_to_a_report_of_a_large/,0,8zewuh,True,False,True,False,False,"[{'e': 'text', 't': 'Photo'}]",dark,richtext,False,False,True,3,0,False,all_ads,/r/Portland/comments/8zewuh/portland_fire_responding_to_a_report_of_a_large/,False,6,1531775609,markdown,1,,True,False,False,Portland,t5_2qi2i,99879,public,https://b.thumbs.redditmedia.com/RG0X9FYz2-0HIk1NCSwzqdXVBjGH4qnn5h8zi5z1ZXw.jpg,"Portland: fire responding to a report of a large commercial fire, caller reporting “half the block is on fire”, area SE MLK/Pine, expect streets blocked and delays in the area.",https://i.redd.it/twf8r4orlda11.jpg,all_ads,6,,photo,Photo,image,"{'enabled': True, 'images': [{'id': 'PGz_19HqMxgWud2o8h_hkkg64XubReh5i_pxc_7WWwo', 'resolutions': [{'height': 114, 'url': 'https://i.redditmedia.com/8FJC_vrPYAElOTR_tN4FDRojHDhX__BPWlJnXjr-fwU.jpg?fit=crop&amp;crop=faces%2Centropy&amp;arh=2&amp;w=108&amp;s=98d2f0303bc139d8ba44930251cebe96', 'width': 108}, {'height': 228, 'url': 'https://i.redditmedia.com/8FJC_vrPYAElOTR_tN4FDRojHDhX__BPWlJnXjr-fwU.jpg?fit=crop&amp;crop=faces%2Centropy&amp;arh=2&amp;w=216&amp;s=3e9e53b07c18c70f0ebbb0dfe1069b30', 'width': 216}, {'height': 338, 'url': 'https://i.redditmedia.com/8FJC_vrPYAElOTR_tN4FDRojHDhX__BPWlJnXjr-fwU.jpg?fit=crop&amp;crop=faces%2Centropy&amp;arh=2&amp;w=320&amp;s=96674bdee4e7ffdae74e4d655cabd4a7', 'width': 320}, {'height': 676, 'url': 'https://i.redditmedia.com/8FJC_vrPYAElOTR_tN4FDRojHDhX__BPWlJnXjr-fwU.jpg?fit=crop&amp;crop=faces%2Centropy&amp;arh=2&amp;w=640&amp;s=dc4b31120068f8e5dc79945d27fed156', 'width': 640}, {'height': 1014, 'url': 'https://i.redditmedia.com/8FJC_vrPYAElOTR_tN4FDRojHDhX__BPWlJnXjr-fwU.jpg?fit=crop&amp;crop=faces%2Centropy&amp;arh=2&amp;w=960&amp;s=dba53150d0af76e93583c9adf7607976', 'width': 960}, {'height': 1141, 'url': 'https://i.redditmedia.com/8FJC_vrPYAElOTR_tN4FDRojHDhX__BPWlJnXjr-fwU.jpg?fit=crop&amp;crop=faces%2Centropy&amp;arh=2&amp;w=1080&amp;s=2f7bdf871988549fa1cf13d054a548e5', 'width': 1080}], 'source': {'height': 1228, 'url': 'https://i.redditmedia.com/8FJC_vrPYAElOTR_tN4FDRojHDhX__BPWlJnXjr-fwU.jpg?s=83fe99faf3ee148baacad942ca62e8d5', 'width': 1162}, 'variants': {}}]}",140.0,140.0,,,
KarasianSky,,[],,text,t2_5mtg9cw,False,False,1531775568,self.Portland,https://www.reddit.com/r/Portland/comments/8zewl1/portland_fire_responding_to_a_report_of_a_large/,0,8zewl1,True,False,False,True,False,[],dark,text,False,False,True,1,0,False,all_ads,/r/Portland/comments/8zewl1/portland_fire_responding_to_a_report_of_a_large/,False,6,1531775570,richtext,1,Anyone know what's up with this?,True,False,False,Portland,t5_2qi2i,99879,public,self,"Portland: fire responding to a report of a large commercial fire, caller reporting “half the block is on fire”, area SE MLK/Pine, expect streets blocked and delays in the area.",https://www.reddit.com/r/Portland/comments/8zewl1/portland_fire_responding_to_a_report_of_a_large/,all_ads,6,,,,,,,,,,
francehopper,,"[{'e': 'text', 't': 'S Waterfront'}]",S Waterfront,richtext,t2_5k6vy,False,False,1531775207,self.Portland,https://www.reddit.com/r/Portland/comments/8zeuju/psa_hawthorne_freddys_has_no_ac/,0,8zeuju,True,False,False,True,False,[],dark,text,False,False,True,36,0,False,all_ads,/r/Portland/comments/8zeuju/psa_hawthorne_freddys_has_no_ac/,False,6,1531775211,richtext,68,Store is getting new AC as part of the remodel. They will be without AC for several days.,True,False,False,Portland,t5_2qi2i,99879,public,self,PSA: Hawthorne Freddy's Has No AC,https://www.reddit.com/r/Portland/comments/8zeuju/psa_hawthorne_freddys_has_no_ac/,all_ads,6,,,,,,,,,,
babbage_ct,,"[{'e': 'text', 't': 'N'}]",N,richtext,t2_9ur8c,False,False,1531775021,wweek.com,https://www.reddit.com/r/Portland/comments/8zetmp/portland_police_union_calls_city_a_cesspool_and/,0,8zetmp,True,False,False,False,False,[],dark,text,False,False,True,568,0,False,all_ads,/r/Portland/comments/8zetmp/portland_police_union_calls_city_a_cesspool_and/,False,6,1531775022,markdown,619,,False,False,False,Portland,t5_2qi2i,99879,public,default,Portland Police Union Calls City A “Cesspool” And Lambastes Mayor For Questioning Arrests of Homeless People,http://www.wweek.com/news/courts/2018/07/16/portland-police-union-calls-city-a-cesspool-and-criticizes-mayor-for-questioning-arrests-of-homeless-people/,all_ads,6,,,,,,,,,,
ReadySetN0,,"[{'e': 'text', 't': 'NW'}]",NW,richtext,t2_iutdh,False,False,1531772082,oregonlive.com,https://www.reddit.com/r/Portland/comments/8zedvx/really_none_of_the_1500_kids_in_my_school_leans/,0,8zedvx,True,False,False,False,False,[],dark,text,False,False,True,39,0,False,all_ads,/r/Portland/comments/8zedvx/really_none_of_the_1500_kids_in_my_school_leans/,False,6,1531772083,markdown,20,,True,False,False,Portland,t5_2qi2i,99874,public,default,"Really? None of the 1,500 kids in my school leans conservative?: Guest opinion | OregonLive.com",http://www.oregonlive.com/opinion/index.ssf/2018/07/really_none_of_the_1500_kids_i.html,all_ads,6,,,,,,,,,0e3c0f78-4254-11e1-a17b-12313d2c1af1,dark
draymondsdickkickers,,[],,text,t2_11x9bx,False,False,1531769739,self.Portland,https://www.reddit.com/r/Portland/comments/8ze0z8/things_to_dosee_on_drive_to_sf/,0,8ze0z8,True,False,False,True,False,[],dark,text,False,False,True,32,0,False,all_ads,/r/Portland/comments/8ze0z8/things_to_dosee_on_drive_to_sf/,False,6,1531769740,markdown,0,"I’m going to take a couple of days to drive down from Portland to San Fran and was looking for things to look at on the way. I’m intentionally going to space it out over 3 or 4 days so I can fit more in. So far I’m thinking checking out the redwood in eureka, camping a night in crater lake and driving through sacaramento. Also curious on people’s thoughts on the 101 vs the 5",True,False,False,Portland,t5_2qi2i,99872,public,self,Things to do/see on drive to SF,https://www.reddit.com/r/Portland/comments/8ze0z8/things_to_dosee_on_drive_to_sf/,all_ads,6,,,,,,,,,,
Brentwood_Bro,,"[{'e': 'text', 't': 'pre-volcano transplant'}]",pre-volcano transplant,richtext,t2_dmkxl07,False,False,1531768905,self.Portland,https://www.reddit.com/r/Portland/comments/8zdwh4/spontaneous_rainbow_art_party/,0,8zdwh4,True,False,False,True,False,[],dark,text,False,False,True,16,0,False,all_ads,/r/Portland/comments/8zdwh4/spontaneous_rainbow_art_party/,False,6,1531768906,markdown,97,"Hi there preddit! We had a very ugly homophobic incident occurr last night at the corner of SE 63rd/Duke. A young man tried to hit a lesbian couple with his car (they were driving drunk) and when confronted about his actions he went on a 5 minute anti-gay tirade captured on video (link in comments) insulting these young women. The PPB was called and instead of managing the situation they ended up gaslighting and victim blaming as usual. 

Here in Brentwood-Darlington we are all about unity. We are uniting together this afternoon/evening to fight hate with creativity and love. We would love to see broad support from folks willing to come down around 2pm today until we run out of flags and paint and chalk. We are going to reclaim that intersection for civilized people who respect their neighbors. 

BRING YOUR RAINBOW GEAR/PAINT/BANNERS. Have some fun in the flats.",True,False,False,Portland,t5_2qi2i,99872,public,self,Spontaneous Rainbow Art Party!,https://www.reddit.com/r/Portland/comments/8zdwh4/spontaneous_rainbow_art_party/,all_ads,6,,,,,,,,,,dark
Drewbacca,,"[{'e': 'text', 't': 'Richmond'}]",Richmond,richtext,t2_4b1za,False,False,1531765694,self.Portland,https://www.reddit.com/r/Portland/comments/8zdexi/4_to_1_productions_is_a_garbage_company_asking/,0,8zdexi,True,False,False,True,False,[],dark,text,False,False,True,38,0,False,all_ads,/r/Portland/comments/8zdexi/4_to_1_productions_is_a_garbage_company_asking/,False,6,1531765695,richtext,133,"I don't know where else to post this since I'm not on Facebook anymore, but there is a ""production company"" here in town called [4 to 1 productions](http://www.4to1productions.com/services-provided). They put calls out all the time for skilled workers ([cinematographers](https://web.archive.org/web/20180716182255/https://portland.craigslist.org/mlt/cwg/d/videographer-needed-on-august/6643897515.html), [PAs](https://web.archive.org/web/20180716182444/https://portland.craigslist.org/mlt/cwg/d/production-assistant-needed/6643967866.html), audio guys, basically all crew), offering a $50 ""mileage reimbursement"" for **FOUR FULL DAY'S WORK**. If they're shooting a typical 10 hour day, that comes to **$1.25 per hour.** 

This company is a sham, I have told them they are a sham, and they need to go away.

/rant",True,False,False,Portland,t5_2qi2i,99870,public,self,4 to 1 Productions is a garbage company asking for highly skilled workers for free and I'm tired of it,https://www.reddit.com/r/Portland/comments/8zdexi/4_to_1_productions_is_a_garbage_company_asking/,all_ads,6,,,,,,,,,,
susibirb,,[],,text,t2_7jvxatd,False,False,1531762694,self.Portland,https://www.reddit.com/r/Portland/comments/8zcykq/climate_change_at_work_in_pdx/,0,8zcykq,True,False,False,True,False,[],dark,text,False,False,True,10,0,False,all_ads,/r/Portland/comments/8zcykq/climate_change_at_work_in_pdx/,False,6,1531762696,markdown,1,"https://imgur.com/a/iFpHvLy
https://imgur.com/a/NxdQj0V

Wallace park in NW. Third Elm to faulter in a month’s time. PDX is hitting record temps. According to the Ranger (I’m no scientist) (and I’m paraphrasing here) the elms are not used to the extreme heat. They dry out during the day, and soak up more water than normal in order to counter drying out, resulting in collapse under it’s own weight. The picture does not do it justice, this sucker was old, and HUGE. So were the last two. Over the last month our doggie park has gone from shaded cool oasis, to sunny dusty fart. Sad!",True,False,False,Portland,t5_2qi2i,99870,public,self,Climate change at work in PDX?,https://www.reddit.com/r/Portland/comments/8zcykq/climate_change_at_work_in_pdx/,all_ads,6,,,,,,,,,,
meowgaritaville,,[],,text,t2_144hof,False,False,1531759725,self.Portland,https://www.reddit.com/r/Portland/comments/8zcihz/my_faith_in_humanity_has_been_restored/,0,8zcihz,True,False,False,True,False,[],dark,text,False,False,True,30,0,False,all_ads,/r/Portland/comments/8zcihz/my_faith_in_humanity_has_been_restored/,False,6,1531759726,markdown,134,"I just moved here, and I have been temporarily living at a hotel until I figure out where I want to live. I decided to go to a brewery a few miles down the road to Lake Oswego, and enjoy my Sunday with my pup. I was having such a lovely day and there was live music. I've been falling in love with everything about oregon so far. 

It was getting later in the afternoon and I wanted to go home and rest before a big day filled with appointments. I mosey my way back to my car and make my way back home so I can prepare for tomorrow. Having a lovely drive home. My dog is smiling, i'm smiling, life is good.

I got back to the hotel and realized I couldn't find my wallet. Full blown panic has set in because my D.L. and my dog's service animal I.D. was in the, too. I need both of those things for everything! How could I be so clumsy!? Where did I lose it?? Whhhyyyyy. I don't have a permanent address yet for me to get a new I.D. and I didn't have any other identifying info like my number or emergency contact info.

After driving around back and forth through the parking garage and through the city, I've accepted my clumsy fate and decided to just go back to the hotel. I got a new hotel key card and went to mope around in my room and still get ready for tomorrow. 

At 1130 pm, my hotel phone rings, and I immediately think about scary movies and this is how bad things happen, first the wallet, then the phone rings and I die. I wearily answer the phone and it's the lady at the lobby and says my wallet has been found and she was going to come up to my room to give me the number of the woman who found my wallet. 

I'm sitting on my bed in shock. I thought it was gone forever! So, she comes up and gives me the lady's number and tells me she's expecting a phone call from me. I immediately call her, and thank her for finding me and getting it back and how much it means to me. I asked her how she found me, she said: ""I saw there was a hotel key card with a pizza logo, so I called around lots of different hotels asking if you were there. I kept trying and finally found you! I'm just so glad I was able to get your stuff back to you! I am having my son go and drop it off for you right now.""

I'm sitting on the floor crying. I didn't know strangers could be that nice. She was so dedicated to helping me, and so sweet, she spent her night trying to make sure my stuff was given back to me. How many hotels did she have to call??! There's millions of them just in the LO area! I would like to think I would have done the same thing, but I didn't expect it at all. I asked her if there was anything at all I could do to repay her, and she said absolutely not. 

Her son was over in minutes and dropped my wallet off. I thanked him profusely and he said he found the wallet originally, and they both thought it seemed important to get it back to me. I asked him if there was anything that I could do to repay him for it, and he said just to enjoy the rest of my night.

I have so much faith restored for good people out there. What caring people who want nothing but to do good things. I was so caught up in my own problems I forgot about how nice other people could be. Especially in such a big town like portland!Nothing was taken out of my wallet, of course. 

**Also, I know this is a very long shot, but if the son is reading this, I'd really like to buy you a beer or something. I wish I asked for your number when you were here, I was just still in shock.",True,False,False,Portland,t5_2qi2i,99860,public,self,My faith in humanity has been restored,https://www.reddit.com/r/Portland/comments/8zcihz/my_faith_in_humanity_has_been_restored/,all_ads,6,,,,,,,,,,
jjdubbs,,[],,text,t2_528bk,False,False,1531759585,self.Portland,https://www.reddit.com/r/Portland/comments/8zchr6/anybody_willing_to_share_jumpingrope_swing_spots/,0,8zchr6,True,False,False,True,False,[],dark,text,False,False,True,6,0,False,all_ads,/r/Portland/comments/8zchr6/anybody_willing_to_share_jumpingrope_swing_spots/,False,6,1531759586,markdown,7,"Hi all, just wondering (hoping) someone would share their ""secret"" jump/rope swing spots on a river or lake.  The places I've been are getting super crowded and a bit sketchy at times, so I'm trying to find a new spot.

I understand the need for discretion with these things, so feel free to PM me.  I also offer snacks and sundry delicious beverages if we meet there!  I hope it goes without saying that I and the few people I would share the spot with would keep it quiet and pack out everything we bring in.

Thanks for helping beat the heat!",True,False,False,Portland,t5_2qi2i,99860,public,self,Anybody willing to share jumping/rope swing spots?,https://www.reddit.com/r/Portland/comments/8zchr6/anybody_willing_to_share_jumpingrope_swing_spots/,all_ads,6,,,,,,,,,,
guanaco55,,[],,text,t2_hyfa9,False,False,1531759493,wweek.com,https://www.reddit.com/r/Portland/comments/8zch9f/as_portland_gentrifies_vancouver_school_district/,0,8zch9f,True,False,False,False,False,[],dark,text,False,False,True,10,1,False,all_ads,/r/Portland/comments/8zch9f/as_portland_gentrifies_vancouver_school_district/,False,6,1531759494,markdown,12,,True,False,False,Portland,t5_2qi2i,99860,public,default,"As Portland Gentrifies, Vancouver School District Deals With Higher Poverty",http://www.wweek.com/news/2018/07/15/as-portland-gentrifies-vancouver-school-district-deals-with-higher-poverty/,all_ads,6,,,,,,,,,,
