[],False,MrLaughter,,[],,text,t2_3zgb8,False,False,[],False,False,1589479625,docs.google.com,https://www.reddit.com/r/Portland/comments/gjrlb3/havent_mailed_in_your_primary_ballots_heres_the/,{},gjrlb3,True,False,False,False,True,False,False,,[],dark,text,False,False,True,3,0,False,all_ads,/r/Portland/comments/gjrlb3/havent_mailed_in_your_primary_ballots_heres_the/,False,6,1589481676,0,,True,False,False,Portland,t5_2qi2i,154030,public,https://b.thumbs.redditmedia.com/4hMW_ewwI_7yV-r61a3OoHcJjRdoa9cJvqxZ14fy2xE.jpg,Haven't mailed in your primary ballots? Here's the progressives endorsed by Our Revolution!,0,[],0.5,https://docs.google.com/document/d/1UPrLcqdW1-sC1ALPVf7PhFuUWYfxERakyUfi1Ynod_Q/edit,all_ads,6,,,,,,link,"{'enabled': False, 'images': [{'id': 'hQPaik_MI6P2Cn4q-2Xk5wi-0Jr4dcaM8uQgqKXm2Zc', 'resolutions': [{'height': 56, 'url': 'https://external-preview.redd.it/LFOgQvPoIL-NVllh8n4NAZKODLJKLonKTRA9yqIPX6g.jpg?width=108&amp;crop=smart&amp;auto=webp&amp;s=6268e6ff65ce21cc1cdeb42be97798199514cc2e', 'width': 108}, {'height': 113, 'url': 'https://external-preview.redd.it/LFOgQvPoIL-NVllh8n4NAZKODLJKLonKTRA9yqIPX6g.jpg?width=216&amp;crop=smart&amp;auto=webp&amp;s=c3c44936bfdedd6f2b62f05a57256610543839c6', 'width': 216}, {'height': 168, 'url': 'https://external-preview.redd.it/LFOgQvPoIL-NVllh8n4NAZKODLJKLonKTRA9yqIPX6g.jpg?width=320&amp;crop=smart&amp;auto=webp&amp;s=1d41b18402311d14c70321bc1b20f3a72efad6d7', 'width': 320}, {'height': 336, 'url': 'https://external-preview.redd.it/LFOgQvPoIL-NVllh8n4NAZKODLJKLonKTRA9yqIPX6g.jpg?width=640&amp;crop=smart&amp;auto=webp&amp;s=12cd183d764b8df9bd68e871414e33429bcee461', 'width': 640}, {'height': 504, 'url': 'https://external-preview.redd.it/LFOgQvPoIL-NVllh8n4NAZKODLJKLonKTRA9yqIPX6g.jpg?width=960&amp;crop=smart&amp;auto=webp&amp;s=b2668b668440d98ba2c11fc99d9d630088fa2335', 'width': 960}, {'height': 567, 'url': 'https://external-preview.redd.it/LFOgQvPoIL-NVllh8n4NAZKODLJKLonKTRA9yqIPX6g.jpg?width=1080&amp;crop=smart&amp;auto=webp&amp;s=e2a3af545797c7d6c48be533950fe5463ad91327', 'width': 1080}], 'source': {'height': 630, 'url': 'https://external-preview.redd.it/LFOgQvPoIL-NVllh8n4NAZKODLJKLonKTRA9yqIPX6g.jpg?auto=webp&amp;s=29daf83e2912ab7cc0bb48a69919ca9c1c3c0f0c', 'width': 1200}, 'variants': {}}]}",73.0,140.0,,,,,,,,
[],False,gdbeav,,[],,text,t2_18eovcbr,False,False,[],False,False,1589479297,self.Portland,https://www.reddit.com/r/Portland/comments/gjrhb6/unipiper_sighting/,{},gjrhb6,True,False,False,False,True,True,False,,[],dark,text,False,False,False,14,0,False,all_ads,/r/Portland/comments/gjrhb6/unipiper_sighting/,False,6,1589481370,6,"Heard some bagpipes in the distance around 7pm last night. Thought someone was honoring essential workers or something. 2 minutes later I see the freakin Unipiper ride by my house. Random sight in deep SW,  near Markham Elementary. Highlight of my day.",True,False,False,Portland,t5_2qi2i,154029,public,self,Unipiper sighting,0,[],0.71,https://www.reddit.com/r/Portland/comments/gjrhb6/unipiper_sighting/,all_ads,6,,,,,,,,,,,,,,,,,
[],False,oregonvoter,,[],,text,t2_6fthzmrw,False,False,[],False,False,1589478601,self.Portland,https://www.reddit.com/r/Portland/comments/gjr964/if_you_still_havent_received_your_unemployment/,{},gjr964,False,False,False,False,False,True,False,,[],dark,text,False,False,True,31,0,False,all_ads,/r/Portland/comments/gjr964/if_you_still_havent_received_your_unemployment/,False,6,1589480720,1,[removed],False,False,False,Portland,t5_2qi2i,154027,public,https://b.thumbs.redditmedia.com/f0ri3tO5LCwVt6quon0N-YK5rD8NHO-J9UQk5dewuLQ.jpg,If you still haven't received your unemployment benefits...,0,[],1.0,https://www.reddit.com/r/Portland/comments/gjr964/if_you_still_havent_received_your_unemployment/,all_ads,6,automod_filtered,,,,,,,64.0,140.0,,,,,,,,
[],False,pbjars,,[],,text,t2_awtm42m,False,False,[],False,False,1589478329,powells.com,https://www.reddit.com/r/Portland/comments/gjr60z/dont_forget_to_support_powells_books_one_of_the/,{},gjr60z,True,False,False,False,True,False,False,,[],dark,text,False,False,False,126,0,False,all_ads,/r/Portland/comments/gjr60z/dont_forget_to_support_powells_books_one_of_the/,False,6,1589480470,9,,True,False,False,Portland,t5_2qi2i,154027,public,https://b.thumbs.redditmedia.com/rj4Vn9rAUFHi4CNY9wV7tX6lO8Ujl9__yga1R2_PxlQ.jpg,Don't forget to support Powell's Books. One of the last independent booksellers and arguably the City's most recognizable business needs your support.,0,[],0.85,https://www.powells.com/used,all_ads,6,,,,,,link,"{'enabled': False, 'images': [{'id': '9mqE_bDvT-rO87vj-aMNKYbCqWz3Yca6giRwYvewfFU', 'resolutions': [{'height': 77, 'url': 'https://external-preview.redd.it/0-HTpG5wNPvDBqkXD1RYzTOnhlsJlBKM3Z5sNSlgWBY.jpg?width=108&amp;crop=smart&amp;auto=webp&amp;s=b1e3ee55a9fa749980a1a96c53acfec0c761c8fc', 'width': 108}], 'source': {'height': 107, 'url': 'https://external-preview.redd.it/0-HTpG5wNPvDBqkXD1RYzTOnhlsJlBKM3Z5sNSlgWBY.jpg?auto=webp&amp;s=269870571cacc437f1e911036b0133e423b4d1b5', 'width': 150}, 'variants': {}}]}",99.0,140.0,,,,,,,,
[],False,HeroHas,,[],,text,t2_5509c,False,False,[],False,False,1589478293,self.Portland,https://www.reddit.com/r/Portland/comments/gjr5ls/exhausted_unemployment_and_cares_extension/,{},gjr5ls,True,False,False,False,True,True,False,,[],dark,text,False,False,True,18,0,False,all_ads,/r/Portland/comments/gjr5ls/exhausted_unemployment_and_cares_extension/,False,6,1589480434,2,"Long story short I exhausted my unemployment this year right before the pandemic due to an Non-compete agreement. I got a new job but 3 weeks in I was ""furloughed"".

Everything I have read stated there is an extension for atleast the $600 a month and I qualify. Surely I'd like the full employment amount but I'll take anything at this point.

I have made my claim every week and the system/mail is still telling me it's exhausted. I am calling over 1000 times a day. I have tried getting my request expedited through st. Helen's with James, but nothing. My previous job is not fighting the claim. 

Is anyone else in an exhausted Unemployment situation prior to the pandemic? Has anyone even received their CARES extra benefits? Am I eligible for more than the $600? Do I fill out the application or is that just for gig/self employed? 

I don't know what to do anymore.",True,False,False,Portland,t5_2qi2i,154027,public,self,Exhausted Unemployment and CARES extension,0,[],0.75,https://www.reddit.com/r/Portland/comments/gjr5ls/exhausted_unemployment_and_cares_extension/,all_ads,6,,,,,,,,,,,,,,,,,
[],False,snakeladders,,[],S Tabor,text,t2_3d6juw8t,False,False,[],False,False,1589477955,self.Portland,https://www.reddit.com/r/Portland/comments/gjr1gm/lime_scooters_trying_to_reopen_in_our_city/,{},gjr1gm,True,False,False,False,True,True,False,,[],dark,text,False,False,True,19,0,False,all_ads,/r/Portland/comments/gjr1gm/lime_scooters_trying_to_reopen_in_our_city/,False,6,1589480117,0,"Just wanted to let others know and maybe more people will speak up/protest this. Those scooters are a cesspool of germs. The company uses independent contractors to pick up the scooters to charge overnight, but pays them only about $3 per scooter. They do not provide PPE for their contractors, they don't provide any way to sanitize the scooters, and they are trying to force their juicers back to work - risking their lives for scraps. Please don't support this company as they put corporate profit over the safety of Portlanders. They know they can't be proven to be directly responsible for someone contracting the virus, so they are just gonna roll out their scooters as if they aren't transmission vectors.",True,False,False,Portland,t5_2qi2i,154027,public,self,Lime Scooters trying to reopen in our city,0,[],0.5,https://www.reddit.com/r/Portland/comments/gjr1gm/lime_scooters_trying_to_reopen_in_our_city/,all_ads,6,,,dark,,,,,,,,ec34db12-4276-11e1-ad56-12313b08a511,,,,,,
[],False,SwackHD,,[],,text,t2_12n3xx,False,False,[],False,False,1589476914,self.Portland,https://www.reddit.com/r/Portland/comments/gjqpa5/please_dont_come_to_the_gorge/,{},gjqpa5,True,False,False,False,True,True,False,,[],dark,text,False,False,False,115,0,False,all_ads,/r/Portland/comments/gjqpa5/please_dont_come_to_the_gorge/,False,6,1589479105,20,"Hello from the gorge!

I know you guys over in Portland are going a little crazy and want to get out, but PLEASE don’t come to the gorge just because we entered Phase 1. 
We completely understand that you need to get out and that the Gorge is perfect this time of year. We get it! But we want to keep the cases low in the gorge. We one, don’t have the hospital capacity to take in tourists and two, want to enter phase 3 quicker so we can confidently start letting you guys visit the area.

We know it’s hard, but we don’t want the cases to rise in our counties and set us back more then we would have otherwise.

We hope you understand...",True,False,False,Portland,t5_2qi2i,154026,public,self,Please don’t come to the gorge...,0,[],0.76,https://www.reddit.com/r/Portland/comments/gjqpa5/please_dont_come_to_the_gorge/,all_ads,6,,,,,,,,,,,,,,,,,
[],False,TheR1Kid,,[],,text,t2_d6dw6,False,False,[],False,False,1589476726,self.Portland,https://www.reddit.com/r/Portland/comments/gjqn5d/places_to_buy_baklava/,{},gjqn5d,True,False,False,False,True,True,False,,[],dark,text,False,False,True,47,0,False,all_ads,/r/Portland/comments/gjqn5d/places_to_buy_baklava/,False,6,1589478926,4,"I've goggled and searched with no luck. 
Does anyone know of a market where I can buy some good baklava? Not a piece like at a restaurant but a tin or a box of it like a bakery or store would sell

 Possibly the best treat ever and I cant find any other than occasionally a slice in a restaurant.",True,False,False,Portland,t5_2qi2i,154026,public,self,Places to buy Baklava??,0,[],0.83,https://www.reddit.com/r/Portland/comments/gjqn5d/places_to_buy_baklava/,all_ads,6,,,,,,,,,,,,,,,,,
[],False,postart777,,[],,text,t2_2ww35qw7,False,False,[],False,False,1589476671,self.Portland,https://www.reddit.com/r/Portland/comments/gjqmjx/dear_portland_the_science_is_clear_and/,{},gjqmjx,True,False,False,False,True,True,False,,[],dark,text,False,False,False,307,0,False,all_ads,/r/Portland/comments/gjqmjx/dear_portland_the_science_is_clear_and/,False,6,1589478876,4,[https://www.cdc.gov/coronavirus/2019-ncov/prevent-getting-sick/cloth-face-cover.html](https://www.cdc.gov/coronavirus/2019-ncov/prevent-getting-sick/cloth-face-cover.html),True,False,False,Portland,t5_2qi2i,154026,public,self,"Dear Portland, the science is clear and unambiguous: wear face covering in public to prevent spread of coronavirus.",0,[],0.58,https://www.reddit.com/r/Portland/comments/gjqmjx/dear_portland_the_science_is_clear_and/,all_ads,6,,,,,,self,"{'enabled': False, 'images': [{'id': 'MdUgFAk00e89VL0TtW_5yJZQySZFP92OqMqu9_lILwY', 'resolutions': [{'height': 54, 'url': 'https://external-preview.redd.it/RNkvMYKVUveckC3ouEn6OOiGoYBneeUQoDYKwbVy7xU.jpg?width=108&amp;crop=smart&amp;auto=webp&amp;s=6eead9f866df88e67d24504f83af7bcbd2906d65', 'width': 108}, {'height': 108, 'url': 'https://external-preview.redd.it/RNkvMYKVUveckC3ouEn6OOiGoYBneeUQoDYKwbVy7xU.jpg?width=216&amp;crop=smart&amp;auto=webp&amp;s=617322e89502aad70d989edf781a9139de18dffc', 'width': 216}, {'height': 160, 'url': 'https://external-preview.redd.it/RNkvMYKVUveckC3ouEn6OOiGoYBneeUQoDYKwbVy7xU.jpg?width=320&amp;crop=smart&amp;auto=webp&amp;s=a76f17789911d131c3deb1af45d2bebc5c9a7b24', 'width': 320}, {'height': 320, 'url': 'https://external-preview.redd.it/RNkvMYKVUveckC3ouEn6OOiGoYBneeUQoDYKwbVy7xU.jpg?width=640&amp;crop=smart&amp;auto=webp&amp;s=c1adcfd99fa537e301a9c4ec03c4093937ec3cd3', 'width': 640}, {'height': 480, 'url': 'https://external-preview.redd.it/RNkvMYKVUveckC3ouEn6OOiGoYBneeUQoDYKwbVy7xU.jpg?width=960&amp;crop=smart&amp;auto=webp&amp;s=2af4a6259ace3068592a865fda7669ebd175ca87', 'width': 960}, {'height': 540, 'url': 'https://external-preview.redd.it/RNkvMYKVUveckC3ouEn6OOiGoYBneeUQoDYKwbVy7xU.jpg?width=1080&amp;crop=smart&amp;auto=webp&amp;s=9c5bb35cdcbcf3ad1984f9e148addd05287cd5b5', 'width': 1080}], 'source': {'height': 600, 'url': 'https://external-preview.redd.it/RNkvMYKVUveckC3ouEn6OOiGoYBneeUQoDYKwbVy7xU.jpg?auto=webp&amp;s=dbac89c09d443295de4ba5fd2415a6914794e43e', 'width': 1200}, 'variants': {}}]}",,,,,,,,,,
[],False,[deleted],,,,,,,,[],False,False,1589475170,self.Portland,https://www.reddit.com/r/Portland/comments/gjq4i5/just_spotted_a_nazi_in_my_city_lets_fucking_swarm/,{},gjq4i5,False,False,False,False,False,True,False,,[],dark,text,False,False,True,0,0,False,all_ads,/r/Portland/comments/gjq4i5/just_spotted_a_nazi_in_my_city_lets_fucking_swarm/,False,6,1589477470,1,,True,False,False,Portland,t5_2qi2i,154024,public,default,Just spotted a Nazi in MY CITY. LETS FUCKING SWARM,0,[],1.0,https://www.reddit.com/r/Portland/comments/gjq4i5/just_spotted_a_nazi_in_my_city_lets_fucking_swarm/,all_ads,6,deleted,,dark,,,,,,,,,,,,,,moderators
[],False,foryourhealthdangus,,[],,text,t2_1knavd0e,False,False,[],False,False,1589474824,self.Portland,https://www.reddit.com/r/Portland/comments/gjq0if/anyone_downtown_open_for_bike_tune_ups/,{},gjq0if,True,False,False,False,True,True,False,,[],dark,text,False,False,True,7,0,False,all_ads,/r/Portland/comments/gjq0if/anyone_downtown_open_for_bike_tune_ups/,False,6,1589477152,0,"I’m willing to socially distance and follow all health safety protocols, just really need a tune up and everyone is listed as closed. Thanks!",True,False,False,Portland,t5_2qi2i,154024,public,self,Anyone downtown open for bike tune ups?,0,[],0.5,https://www.reddit.com/r/Portland/comments/gjq0if/anyone_downtown_open_for_bike_tune_ups/,all_ads,6,,,,,,,,,,,,,,,,,
[],True,xyzpdq77,,[],Roseway,text,t2_31w9zpxt,False,False,[],False,False,1589474683,self.Portland,https://www.reddit.com/r/Portland/comments/gjpyz4/what_bike_stores_are_open/,{},gjpyz4,True,False,False,False,True,True,False,,[],dark,text,False,False,True,20,0,False,all_ads,/r/Portland/comments/gjpyz4/what_bike_stores_are_open/,False,6,1589477023,1,Would like to get a bike for my teen but I have no idea what size bike he should be riding now. Also I don’t want to spend $1000. Thanks!,True,False,False,Portland,t5_2qi2i,154024,public,self,What bike stores are open?,0,[],0.57,https://www.reddit.com/r/Portland/comments/gjpyz4/what_bike_stores_are_open/,all_ads,6,,,dark,,,,,,,,3d5d06c8-42d0-11e1-8a63-12313b08a511,,,,,,
[],False,MIZZKATHY74,,[],,text,t2_52d2ntpx,False,False,[],False,False,1589474589,oregonlive.com,https://www.reddit.com/r/Portland/comments/gjpxut/ringside_beef_sale_reservations_this_time/,{},gjpxut,True,False,False,False,True,False,False,,[],dark,text,False,False,True,9,0,False,all_ads,/r/Portland/comments/gjpxut/ringside_beef_sale_reservations_this_time/,False,6,1589476937,1,,True,False,False,Portland,t5_2qi2i,154024,public,https://b.thumbs.redditmedia.com/M-ijmX_IsXj0G1UGAVL7d5hVTjQx73p49uuzwrgalnA.jpg,Ringside beef sale. Reservations this time!,0,[],0.67,https://www.oregonlive.com/dining/2020/05/ringsides-traffic-plagued-steak-sale-returns-this-time-with-reservations.html,all_ads,6,,,,local-news,Local News,link,"{'enabled': False, 'images': [{'id': 'afHaXDF_ptDo5CJsEKeF2wQ3Emyqj8FmNZUf6G0Jn34', 'resolutions': [{'height': 71, 'url': 'https://external-preview.redd.it/ny9TKSzhxILkON4u9POytSBjHyh7nvCajJoo66npuJI.jpg?width=108&amp;crop=smart&amp;auto=webp&amp;s=46b610b0471beff26a17673d41485bba5b8adc62', 'width': 108}, {'height': 143, 'url': 'https://external-preview.redd.it/ny9TKSzhxILkON4u9POytSBjHyh7nvCajJoo66npuJI.jpg?width=216&amp;crop=smart&amp;auto=webp&amp;s=bcbf0ffb3748aac61e10873a5aac2d3593c3d819', 'width': 216}, {'height': 213, 'url': 'https://external-preview.redd.it/ny9TKSzhxILkON4u9POytSBjHyh7nvCajJoo66npuJI.jpg?width=320&amp;crop=smart&amp;auto=webp&amp;s=a3332f2a407e1b16508a4111402e921fe9a46f32', 'width': 320}, {'height': 426, 'url': 'https://external-preview.redd.it/ny9TKSzhxILkON4u9POytSBjHyh7nvCajJoo66npuJI.jpg?width=640&amp;crop=smart&amp;auto=webp&amp;s=7452ef8b5bd7ed0346ea597adc1e6bc754c7b254', 'width': 640}, {'height': 639, 'url': 'https://external-preview.redd.it/ny9TKSzhxILkON4u9POytSBjHyh7nvCajJoo66npuJI.jpg?width=960&amp;crop=smart&amp;auto=webp&amp;s=2ca6e60c043f9f11b86d7286e50634a8b81a3d0d', 'width': 960}, {'height': 719, 'url': 'https://external-preview.redd.it/ny9TKSzhxILkON4u9POytSBjHyh7nvCajJoo66npuJI.jpg?width=1080&amp;crop=smart&amp;auto=webp&amp;s=d124b2dfffa24ff6c8c3a901933bdc7df8c77a13', 'width': 1080}], 'source': {'height': 853, 'url': 'https://external-preview.redd.it/ny9TKSzhxILkON4u9POytSBjHyh7nvCajJoo66npuJI.jpg?auto=webp&amp;s=06109af94cda0a4af1065f902b5311cb0f547933', 'width': 1280}, 'variants': {}}]}",93.0,140.0,,,,,,,,
[],False,Haxormacks,,[],,text,t2_6h4nnqgl,False,False,[],False,False,1589472978,oregonlive.com,https://www.reddit.com/r/Portland/comments/gjpf73/qa_on_oregons_unemployment_benefits_fiasco_where/,{},gjpf73,True,False,False,False,True,False,False,,[],dark,text,False,False,False,32,0,False,all_ads,/r/Portland/comments/gjpf73/qa_on_oregons_unemployment_benefits_fiasco_where/,False,6,1589475438,5,,True,False,False,Portland,t5_2qi2i,154022,public,https://b.thumbs.redditmedia.com/cgY81HPXWdlWu_jhZyXWri6p0DhKWPv1hFMRQSMYWdA.jpg,"Q&amp;A on Oregon’s unemployment benefits fiasco: where things went wrong, and where they’re headed",0,[],0.78,https://www.oregonlive.com/business/2020/05/qa-on-oregons-unemployment-benefits-fiasco-where-things-went-wrong-and-where-theyre-headed.html,all_ads,6,,,,,,link,"{'enabled': False, 'images': [{'id': 'JL2cd_-bvAlhZ7qkybg1bjjbsqPkaKUfOF1fedqb4Ns', 'resolutions': [{'height': 71, 'url': 'https://external-preview.redd.it/wWEWQhWWNnRbaybkGcdB46k41uSsKcBBCohiDOV6hfo.jpg?width=108&amp;crop=smart&amp;auto=webp&amp;s=2740ba186153d91dc5e02fd4f3783a725e68ebef', 'width': 108}, {'height': 143, 'url': 'https://external-preview.redd.it/wWEWQhWWNnRbaybkGcdB46k41uSsKcBBCohiDOV6hfo.jpg?width=216&amp;crop=smart&amp;auto=webp&amp;s=82caaf668be17be29dd8ba5b44c7b99651c97cfd', 'width': 216}, {'height': 213, 'url': 'https://external-preview.redd.it/wWEWQhWWNnRbaybkGcdB46k41uSsKcBBCohiDOV6hfo.jpg?width=320&amp;crop=smart&amp;auto=webp&amp;s=e97964f94c693f7acd97d8ecc21e511bade72b3b', 'width': 320}, {'height': 426, 'url': 'https://external-preview.redd.it/wWEWQhWWNnRbaybkGcdB46k41uSsKcBBCohiDOV6hfo.jpg?width=640&amp;crop=smart&amp;auto=webp&amp;s=049513ec8e187f3ec4c39abe6e3116cbc9d274da', 'width': 640}, {'height': 639, 'url': 'https://external-preview.redd.it/wWEWQhWWNnRbaybkGcdB46k41uSsKcBBCohiDOV6hfo.jpg?width=960&amp;crop=smart&amp;auto=webp&amp;s=88802cf32628e0a1472f56bb5888d3492e5d74ac', 'width': 960}, {'height': 719, 'url': 'https://external-preview.redd.it/wWEWQhWWNnRbaybkGcdB46k41uSsKcBBCohiDOV6hfo.jpg?width=1080&amp;crop=smart&amp;auto=webp&amp;s=c1dd211111de1519cbff16ad3688fd4aba81f6ee', 'width': 1080}], 'source': {'height': 853, 'url': 'https://external-preview.redd.it/wWEWQhWWNnRbaybkGcdB46k41uSsKcBBCohiDOV6hfo.jpg?auto=webp&amp;s=1d321f33f2f9a8f019d23334b5c205b86f19baa5', 'width': 1280}, 'variants': {}}]}",93.0,140.0,,,,,,,,
[],True,MS_Erin_69,,[],,text,t2_160wvd7n,False,False,[],False,False,1589472744,self.Portland,https://www.reddit.com/r/Portland/comments/gjpcpj/people_taking_dogs/,{},gjpcpj,True,False,False,False,True,True,False,,[],dark,text,False,False,True,26,0,False,all_ads,/r/Portland/comments/gjpcpj/people_taking_dogs/,False,6,1589475217,3,"Hello my Portland Peeps! 
Short explanation: my partner and I are looking to adopt a dog. We have been looking all the “normal” ways, Human Society, applying at MANY PACNW rescues, etc... but I’m antsy so for the last two months I’ve also been watching Craigslist. 
I keep seeing posts of stolen dogs, mostly pit mixes. It seems to be concentrated in deeper NE (rockwood/edge of Gresham and PDX) and a few in N PDX.  
Is this a thing? 
What the heck? 
I feel like a fairly street smart and well versed in all things Portland since I’ve grown up here. But it’s 2020, and I have a toddler so now I realize I’m in Momland and thus out of touch! 
Is there dog fighting? Food? Are they fake post? I hope so! 
Please explain this to my dumbass! 
Thank you!!",True,False,False,Portland,t5_2qi2i,154022,public,self,People Taking Dogs?,0,[],0.8,https://www.reddit.com/r/Portland/comments/gjpcpj/people_taking_dogs/,all_ads,6,,,,,,,,,,,,,,,,,
[],False,Haxormacks,,[],,text,t2_6h4nnqgl,False,False,[],False,False,1589472033,oregonlive.com,https://www.reddit.com/r/Portland/comments/gjp4iy/giant_balloon_creatures_bring_joy_to_oregon_icu/,{},gjp4iy,True,False,False,False,True,False,False,,[],dark,text,False,False,False,1,0,False,all_ads,/r/Portland/comments/gjp4iy/giant_balloon_creatures_bring_joy_to_oregon_icu/,False,6,1589474536,2,,False,False,False,Portland,t5_2qi2i,154022,public,https://a.thumbs.redditmedia.com/_munROfAwzK5WM2b3xrCMCBs6dvx9dzzBWilIPp-_i8.jpg,Giant balloon creatures bring joy to Oregon ICU nurse and neighbors during coronavirus,0,[],0.67,https://www.oregonlive.com/coronavirus/2020/05/giant-balloon-creatures-bring-joy-to-oregon-icu-nurse-and-neighbors-during-coronavirus.html,all_ads,6,,,,,,link,"{'enabled': False, 'images': [{'id': 'XZSfTzgV8_fK54ncbgT_WfwOrqbT5Fl4bGK8nlGzSmo', 'resolutions': [{'height': 60, 'url': 'https://external-preview.redd.it/mR-aRXObQbzxFu2n0Q9BKnwkBIdWiX3glDXH5zn3TTk.jpg?width=108&amp;crop=smart&amp;auto=webp&amp;s=2d13f2980394175a4cdeaf6da27761318c94b814', 'width': 108}, {'height': 121, 'url': 'https://external-preview.redd.it/mR-aRXObQbzxFu2n0Q9BKnwkBIdWiX3glDXH5zn3TTk.jpg?width=216&amp;crop=smart&amp;auto=webp&amp;s=ae274f661c0e42807e4463cab92ea7e42318712d', 'width': 216}, {'height': 180, 'url': 'https://external-preview.redd.it/mR-aRXObQbzxFu2n0Q9BKnwkBIdWiX3glDXH5zn3TTk.jpg?width=320&amp;crop=smart&amp;auto=webp&amp;s=5f022abe29facabe1243c50b2da4ab7fba8e2dd3', 'width': 320}, {'height': 360, 'url': 'https://external-preview.redd.it/mR-aRXObQbzxFu2n0Q9BKnwkBIdWiX3glDXH5zn3TTk.jpg?width=640&amp;crop=smart&amp;auto=webp&amp;s=19dd07c630f9fa52a8cb24f331d0f71dc6d40a82', 'width': 640}, {'height': 540, 'url': 'https://external-preview.redd.it/mR-aRXObQbzxFu2n0Q9BKnwkBIdWiX3glDXH5zn3TTk.jpg?width=960&amp;crop=smart&amp;auto=webp&amp;s=92dcbe2160de56a96a749e780e0c8fcb7fcad2e1', 'width': 960}, {'height': 607, 'url': 'https://external-preview.redd.it/mR-aRXObQbzxFu2n0Q9BKnwkBIdWiX3glDXH5zn3TTk.jpg?width=1080&amp;crop=smart&amp;auto=webp&amp;s=0f27a5a9cec6cfe3c6e56029f317ccf22dc5fd0f', 'width': 1080}], 'source': {'height': 720, 'url': 'https://external-preview.redd.it/mR-aRXObQbzxFu2n0Q9BKnwkBIdWiX3glDXH5zn3TTk.jpg?auto=webp&amp;s=d22264526a7d72fe793fb53167eecf913830a2e9', 'width': 1280}, 'variants': {}}]}",78.0,140.0,,,,,,,,
[],False,[deleted],,,,,,,,[],False,False,1589470849,self.Portland,https://www.reddit.com/r/Portland/comments/gjor2r/i_moved_to_co_from_or_in_january_2020_i_filed_in/,{},gjor2r,False,False,False,False,False,True,False,,[],dark,text,False,False,True,0,0,False,all_ads,/r/Portland/comments/gjor2r/i_moved_to_co_from_or_in_january_2020_i_filed_in/,False,6,1589473434,1,[deleted],True,False,False,Portland,t5_2qi2i,154020,public,default,I moved to CO from OR in January 2020. I filed in Oregon nearly 5 weeks ago and I haven’t heard anything. Do I file in Colorado?,0,[],1.0,https://www.reddit.com/r/Portland/comments/gjor2r/i_moved_to_co_from_or_in_january_2020_i_filed_in/,all_ads,6,deleted,,dark,,,,,,,,,,,,,,
[],False,73233,,[],,text,t2_4bkd147o,False,False,[],False,False,1589470489,wweek.com,https://www.reddit.com/r/Portland/comments/gjomyd/the_portland_city_council_already_agreed_to_give/,{},gjomyd,True,False,False,False,True,False,False,,[],dark,text,False,False,False,15,0,False,all_ads,/r/Portland/comments/gjomyd/the_portland_city_council_already_agreed_to_give/,False,6,1589473100,4,,False,False,False,Portland,t5_2qi2i,154020,public,https://b.thumbs.redditmedia.com/n4ZHAx6p2ilH8g2m9fQNfy4r4Rk7bJqozFr-GdeKAgc.jpg,The Portland City Council Already Agreed to Give Police and Firefighters a Raise. Now It Needs Them to Take Pay Cuts.,0,[],0.83,https://www.wweek.com/news/2020/05/13/the-portland-city-council-already-agreed-to-give-police-and-firefighters-a-raise-now-it-needs-them-to-take-pay-cuts/,all_ads,6,,,,local-news,Local News,link,"{'enabled': False, 'images': [{'id': '8q1t3PxrT4iGpXCP1BRbxwMOTgMNsOY0EhJP6R2OmvA', 'resolutions': [{'height': 72, 'url': 'https://external-preview.redd.it/8kRkMSqhrtAls3zkJfOkmXkOGV3TtNxk9EgaJshouBo.jpg?width=108&amp;crop=smart&amp;auto=webp&amp;s=6595ee60f348828637cb43e9e8f225db90e80c0f', 'width': 108}, {'height': 144, 'url': 'https://external-preview.redd.it/8kRkMSqhrtAls3zkJfOkmXkOGV3TtNxk9EgaJshouBo.jpg?width=216&amp;crop=smart&amp;auto=webp&amp;s=5b0c05311ba235e1869991b397eefba54c2343f4', 'width': 216}, {'height': 213, 'url': 'https://external-preview.redd.it/8kRkMSqhrtAls3zkJfOkmXkOGV3TtNxk9EgaJshouBo.jpg?width=320&amp;crop=smart&amp;auto=webp&amp;s=bf5bb832f8eda964920d74dae57a67079f2397e9', 'width': 320}, {'height': 426, 'url': 'https://external-preview.redd.it/8kRkMSqhrtAls3zkJfOkmXkOGV3TtNxk9EgaJshouBo.jpg?width=640&amp;crop=smart&amp;auto=webp&amp;s=354c300a44efa96886d8bb19d1998bea7c328ac7', 'width': 640}, {'height': 640, 'url': 'https://external-preview.redd.it/8kRkMSqhrtAls3zkJfOkmXkOGV3TtNxk9EgaJshouBo.jpg?width=960&amp;crop=smart&amp;auto=webp&amp;s=64c952f9fa88c3f2ac2fe040233f771e2dac0048', 'width': 960}, {'height': 720, 'url': 'https://external-preview.redd.it/8kRkMSqhrtAls3zkJfOkmXkOGV3TtNxk9EgaJshouBo.jpg?width=1080&amp;crop=smart&amp;auto=webp&amp;s=a427737b3d9c6cf96b792878c1dde9da2b620a23', 'width': 1080}], 'source': {'height': 800, 'url': 'https://external-preview.redd.it/8kRkMSqhrtAls3zkJfOkmXkOGV3TtNxk9EgaJshouBo.jpg?auto=webp&amp;s=3adb407f101ac5f1eb4e1ad95d2581569684c303', 'width': 1200}, 'variants': {}}]}",93.0,140.0,,,,,,,,
