author,author_flair_css_class,author_flair_richtext,author_flair_text,author_flair_type,author_fullname,can_mod_post,contest_mode,created_utc,domain,full_link,gilded,id,is_crosspostable,is_meta,is_original_content,is_reddit_media_domain,is_self,is_video,link_flair_background_color,link_flair_richtext,link_flair_text_color,link_flair_type,locked,media_only,no_follow,num_comments,num_crossposts,over_18,parent_whitelist_status,permalink,pinned,pwls,retrieved_on,score,selftext,send_replies,spoiler,stickied,subreddit,subreddit_id,subreddit_subscribers,subreddit_type,thumbnail,title,url,whitelist_status,wls,author_flair_background_color,author_flair_text_color,link_flair_css_class,link_flair_text,post_hint,preview,thumbnail_height,thumbnail_width,author_flair_template_id,media,media_embed,secure_media,secure_media_embed
cucksmash,,[],,text,t2_xe22s,False,False,1535630350,self.Portland,https://www.reddit.com/r/Portland/comments/9bizhe/im_back_and_i_was_right_about_california_and_how/,0,9bizhe,True,False,False,False,True,False,,[],dark,text,False,False,True,1,0,False,all_ads,/r/Portland/comments/9bizhe/im_back_and_i_was_right_about_california_and_how/,False,6,1535630350,0,"Not much of a victory, but I told you fuckers that everyone flooding in at once was going to turn this city into a bum shit infested garbage hole. Now look around. The Portland I and everyone used to know is dead. It's just another big city now, complete with all the amenities. Trash, bum shit everywhere, bums EVERYWHERE, coldness to your fellow man, shitty stores that are only there to sell to tourists who still think it's hip to be here. You were all wrong about everything. And now that the population has begun stabilizing, maybe this city will start to go back to the way it was before it became a Hot Topic for ear gauged  losers, and shallow Californians. California raped their state dry, and now they come here like they own the place. I hope you all enjoy the seasonal depression. Homewrecking piles of garbage.",True,False,False,Portland,t5_2qi2i,103473,public,self,I'm back! And I was right about California and how it effected Portland!,https://www.reddit.com/r/Portland/comments/9bizhe/im_back_and_i_was_right_about_california_and_how/,all_ads,6,,,,,,,,,,,,,
RaginBetch,,[],Buckman,text,t2_gdi6x,False,False,1535611498,self.Portland,https://www.reddit.com/r/Portland/comments/9bhb0k/what_happened_on_the_train_tracks_tonight/,0,9bhb0k,True,False,False,False,True,False,,[],dark,text,False,False,True,4,0,False,all_ads,/r/Portland/comments/9bhb0k/what_happened_on_the_train_tracks_tonight/,False,6,1535611499,1,There were police cars and flares along Water st. and the train cars were stopped for a while.,True,False,False,Portland,t5_2qi2i,103470,public,self,What happened on the train tracks tonight?,https://www.reddit.com/r/Portland/comments/9bhb0k/what_happened_on_the_train_tracks_tonight/,all_ads,6,,dark,,,,,,,,,,,
Newbasaurusrex,,[],,text,t2_ptuvq,False,False,1535607343,i.redd.it,https://www.reddit.com/r/Portland/comments/9bgxnc/looks_like_this_scooter_went_for_a_swim/,0,9bgxnc,True,False,False,True,False,False,,[],dark,text,False,False,True,19,0,False,all_ads,/r/Portland/comments/9bgxnc/looks_like_this_scooter_went_for_a_swim/,False,6,1535607344,45,,True,False,False,Portland,t5_2qi2i,103468,public,https://b.thumbs.redditmedia.com/pXQE4IjUc-IaQmuJh_LRmqQXhUpgYd2b1XwmlxBI8vU.jpg,Looks like this scooter went for a swim,https://i.redd.it/167g1qsi36j11.jpg,all_ads,6,,,photo,Photo,image,"{'enabled': True, 'images': [{'id': 'rde1ikEFnWYBAfJSJJAXE3wNDjfmNaSzEYF3PLbvIIY', 'resolutions': [{'height': 192, 'url': 'https://i.redditmedia.com/xNLvRfi2Nd4BWlb8vrB1WjAv4s-H9-aLfRpuwp4LIpE.jpg?fit=crop&amp;crop=faces%2Centropy&amp;arh=2&amp;w=108&amp;s=8ca0c6af11701fb57b83a19223d7a81a', 'width': 108}, {'height': 384, 'url': 'https://i.redditmedia.com/xNLvRfi2Nd4BWlb8vrB1WjAv4s-H9-aLfRpuwp4LIpE.jpg?fit=crop&amp;crop=faces%2Centropy&amp;arh=2&amp;w=216&amp;s=f228863873f9164142bf768f324fef3f', 'width': 216}, {'height': 568, 'url': 'https://i.redditmedia.com/xNLvRfi2Nd4BWlb8vrB1WjAv4s-H9-aLfRpuwp4LIpE.jpg?fit=crop&amp;crop=faces%2Centropy&amp;arh=2&amp;w=320&amp;s=cfa20d6a191b2d58bb9e39f02aa66e1f', 'width': 320}, {'height': 1137, 'url': 'https://i.redditmedia.com/xNLvRfi2Nd4BWlb8vrB1WjAv4s-H9-aLfRpuwp4LIpE.jpg?fit=crop&amp;crop=faces%2Centropy&amp;arh=2&amp;w=640&amp;s=1fd87f4bdf8bfac7c00e587ae05c7276', 'width': 640}, {'height': 1706, 'url': 'https://i.redditmedia.com/xNLvRfi2Nd4BWlb8vrB1WjAv4s-H9-aLfRpuwp4LIpE.jpg?fit=crop&amp;crop=faces%2Centropy&amp;arh=2&amp;w=960&amp;s=8d3e726c06c70d8bdf0e1ea5155a865d', 'width': 960}, {'height': 1920, 'url': 'https://i.redditmedia.com/xNLvRfi2Nd4BWlb8vrB1WjAv4s-H9-aLfRpuwp4LIpE.jpg?fit=crop&amp;crop=faces%2Centropy&amp;arh=2&amp;w=1080&amp;s=e76fea470f82b62bf81862090db24568', 'width': 1080}], 'source': {'height': 2208, 'url': 'https://i.redditmedia.com/xNLvRfi2Nd4BWlb8vrB1WjAv4s-H9-aLfRpuwp4LIpE.jpg?s=244b818a90f2788becd5f472ec01601f', 'width': 1242}, 'variants': {}}]}",140.0,140.0,,,,,
conorthearchitect,,[],Buckman,text,t2_gfjcgss,False,False,1535604505,self.Portland,https://www.reddit.com/r/Portland/comments/9bgnep/to_whoever_just_drove_by_my_place_blasting_a/,0,9bgnep,True,False,False,False,True,False,,[],dark,text,False,False,True,5,0,False,all_ads,/r/Portland/comments/9bgnep/to_whoever_just_drove_by_my_place_blasting_a/,False,6,1535604506,9,,True,False,False,Portland,t5_2qi2i,103468,public,self,"To whoever just drove by my place blasting A Tribe Called Red, I see you :)",https://www.reddit.com/r/Portland/comments/9bgnep/to_whoever_just_drove_by_my_place_blasting_a/,all_ads,6,,dark,,,,,,,62071770-4276-11e1-946d-12313b08a511,,,,
HawkinsJamesHook,,[],,text,t2_vscx1k0,False,False,1535603864,self.Portland,https://www.reddit.com/r/Portland/comments/9bgl36/car_accessible_open_field_snow_skiing_right_now/,0,9bgl36,True,False,False,False,True,False,,[],dark,text,False,False,True,4,0,False,all_ads,/r/Portland/comments/9bgl36/car_accessible_open_field_snow_skiing_right_now/,False,6,1535603865,0,"I realize it's a long shot but I am hoping to take my lady and two dogs up for a quick hike and ski this week/weekend.

&amp;#x200B;

Does anyone know if there's somewhat below off of Helens, Hood, or Adams that can be mostly accessible by vehicle?  FUSFS trails, logging trails with altitidude? We'd usually be down for the full on mountaineering trip but one of our pups are on his last days. All he wants to do is see the snow and feel the sun while sliding down with us one last time. 

&amp;#x200B;

Any and all recommendations would be greatly appreciated. Thanks, guys!",True,False,False,Portland,t5_2qi2i,103465,public,self,"Car accessible, open field, snow skiing right now?",https://www.reddit.com/r/Portland/comments/9bgl36/car_accessible_open_field_snow_skiing_right_now/,all_ads,6,,,,,,,,,,,,,
funbuddle,,[],dickbutt,text,t2_962bef3,False,False,1535602265,self.Portland,https://www.reddit.com/r/Portland/comments/9bgeyk/i_have_a_spare_jacksepticeye_tour_ticket/,0,9bgeyk,True,False,False,False,True,False,,[],dark,text,False,False,True,3,0,False,all_ads,/r/Portland/comments/9bgeyk/i_have_a_spare_jacksepticeye_tour_ticket/,False,6,1535602266,0,"I'm not sure how to do this but this seems like the best place to do it (r/jacksepticeye is dead).

I have a spare Jacksepticeye tour ticket because me friend is flaking in me. Show is on Thursday August 30th (tomorrow) at 8pm (doors open at 7pm) at the Revolution Hall (1300 SE Stark Street) for a balcony seat (BB 34). Currently sold out.

Cost me $40 and rather not scalp them (will if I have to but not for profit) so here's what I'm offering:

Option 1: Buy it off me. Simple, $30 ($10 off, negotiable) and that's it. Find me outside the place and make the exchange and we see the show, I'll be next to you because that's my seat.

Option 2: Fun date 😏! If some lovely Jacksepticeye fangirl sees fit to accompany me to this, that'd be fun! No cost to you so there's a bonus. It'd be fun and we could talk some. Me stats: 27/5'10""/140lb; I like to think at least a 7/10; likes video games, bike riding, and Netflix snuggles 😊. PM me stats like what I just did with selfie doing Spock handsign so there are no bamboozles (if bamboozle, will resort to scalping at door so don't try it).

Option 3: Beg me. Disgraceful begging because you're the biggest Jacksepticeye fan to ever live but the spending money of a part-time ferret vajazzler. Only costs you your dignity and self-respect.

PM me on which option you're going for and just comment that you PM'd me.

To mods: Should this be the wrong place for this, guide me with your mod wisdom to the right place. Thanks!",True,False,False,Portland,t5_2qi2i,103465,public,self,I have a spare Jacksepticeye tour ticket,https://www.reddit.com/r/Portland/comments/9bgeyk/i_have_a_spare_jacksepticeye_tour_ticket/,all_ads,6,,dark,,,,,,,b3283754-e038-11e7-a873-0e0bf97c88d8,,,,
GaymoSexual,,[],Beaumont-Wilshire,text,t2_fyr2t,False,False,1535602210,imgflip.com,https://www.reddit.com/r/Portland/comments/9bgeqq/keep_it_up_rose_city/,0,9bgeqq,True,False,False,False,False,False,,[],dark,text,False,False,True,4,0,False,all_ads,/r/Portland/comments/9bgeqq/keep_it_up_rose_city/,False,6,1535602211,0,,True,False,False,Portland,t5_2qi2i,103465,public,default,Keep it up Rose City!,https://imgflip.com/gif/2gus4s,all_ads,6,,dark,,,,,,,,,,,
30ustice4,,[],,text,t2_ofc8p,False,False,1535601931,twitter.com,https://www.reddit.com/r/Portland/comments/9bgdon/a_racist_woman_interrogates_a_usborn_student/,0,9bgdon,False,False,False,False,False,False,,[],dark,text,False,False,True,0,0,False,all_ads,/r/Portland/comments/9bgdon/a_racist_woman_interrogates_a_usborn_student/,False,6,1535601932,1,,True,False,False,Portland,t5_2qi2i,103465,public,default,A racist woman interrogates a U.S.-born student about his citizenship after he said that she hit his car: “You were not born here!”,https://twitter.com/IndivisibleNet/status/1034980249107218432,all_ads,6,,,,,,,,,,,,,
arnold_owner,,[],,text,t2_21j80hat,False,False,1535601743,i.redd.it,https://www.reddit.com/r/Portland/comments/9bgcys/hello_it_is_me_arnolds_ownerthe_parakeet_race/,0,9bgcys,False,False,False,True,False,False,,[],dark,text,False,False,True,0,0,False,all_ads,/r/Portland/comments/9bgcys/hello_it_is_me_arnolds_ownerthe_parakeet_race/,False,6,1535601743,1,,True,False,False,Portland,t5_2qi2i,103466,public,https://b.thumbs.redditmedia.com/4xTpw2sahfsoHtB2286J3u972qkglr4G9xybyzgH94g.jpg,"Hello! It is me arnold’s owner(the parakeet race coordinator). To make this years event extra special, we decided to design tee shirts! We will not make a dime off these they are solely to make you guys happy😄😄 hope I did alright with the design. https://www.customink.com/g/pqh0-00bh-rstg",https://i.redd.it/dhesdkfvm5j11.jpg,all_ads,6,,,,,image,"{'enabled': True, 'images': [{'id': 'EiewbqOevH4Anyx9a_q4iDK9KJQXXkqMqLW6rRZQQtY', 'resolutions': [{'height': 46, 'url': 'https://i.redditmedia.com/hy3R5NYPrilWgrjcSirarD0UrQSvU3vOxNcJyD1L_g4.jpg?fit=crop&amp;crop=faces%2Centropy&amp;arh=2&amp;w=108&amp;s=610977d25985d80ddf6c9d473f7d101d', 'width': 108}, {'height': 93, 'url': 'https://i.redditmedia.com/hy3R5NYPrilWgrjcSirarD0UrQSvU3vOxNcJyD1L_g4.jpg?fit=crop&amp;crop=faces%2Centropy&amp;arh=2&amp;w=216&amp;s=946ae61b8e4295302d07d256fc496604', 'width': 216}, {'height': 138, 'url': 'https://i.redditmedia.com/hy3R5NYPrilWgrjcSirarD0UrQSvU3vOxNcJyD1L_g4.jpg?fit=crop&amp;crop=faces%2Centropy&amp;arh=2&amp;w=320&amp;s=c1e7f18f5f1fd5c0a6578895b48b7025', 'width': 320}], 'source': {'height': 260, 'url': 'https://i.redditmedia.com/hy3R5NYPrilWgrjcSirarD0UrQSvU3vOxNcJyD1L_g4.jpg?s=8c53f33c8b102cd88be7cc368e00c275', 'width': 599}, 'variants': {}}]}",60.0,140.0,,,,,
PDX666,,[],,text,t2_wn0j6,False,False,1535595540,katu.com,https://www.reddit.com/r/Portland/comments/9bfnkc/measles_case_confirmed_in_portland_about_500/,0,9bfnkc,True,False,False,False,False,False,,[],dark,text,False,False,True,4,0,False,all_ads,/r/Portland/comments/9bfnkc/measles_case_confirmed_in_portland_about_500/,False,6,1535595540,0,,True,False,False,Portland,t5_2qi2i,103462,public,default,"Measles case confirmed in Portland, about 500 people possibly exposed",https://katu.com/news/local/measles-case-confirmed-in-portland-about-500-people-exposed,all_ads,6,,,local-news,Local News,,,,,,,,,
ab2g,,[],Milwaukie,text,t2_4kgw6,False,False,1535594559,i.imgur.com,https://www.reddit.com/r/Portland/comments/9bfj8g/has_this_been_posted_here_before/,0,9bfj8g,True,False,False,False,False,False,,[],dark,text,False,False,True,2,0,False,all_ads,/r/Portland/comments/9bfj8g/has_this_been_posted_here_before/,False,6,1535594560,11,,True,False,False,Portland,t5_2qi2i,103462,public,default,Has this been posted here before?,https://i.imgur.com/nH9gUu0.jpg,all_ads,6,,dark,photo,Photo,,,,,,,,,
korbysore,,[],,text,t2_xuhvl,False,False,1535593207,i.redd.it,https://www.reddit.com/r/Portland/comments/9bfdex/first_lime_scooter_catches_on_fire/,0,9bfdex,True,False,False,True,False,False,,[],dark,text,False,False,True,33,0,False,all_ads,/r/Portland/comments/9bfdex/first_lime_scooter_catches_on_fire/,False,6,1535593208,73,,True,False,False,Portland,t5_2qi2i,103461,public,default,First Lime Scooter catches on fire.,https://i.redd.it/7aqk7lghx4j11.jpg,all_ads,6,,,,,,,,,,,,,
Projectrage,,[],,text,t2_8m08z,False,False,1535592360,self.Portland,https://www.reddit.com/r/Portland/comments/9bf9qn/some_damn_kids_keep_leaving_their_scooters_on_the/,0,9bf9qn,True,False,False,False,True,False,,[],dark,text,False,False,True,4,0,False,all_ads,/r/Portland/comments/9bf9qn/some_damn_kids_keep_leaving_their_scooters_on_the/,False,6,1535592361,0,"Damn kids and their rock n roll, keep leaving their lil scooters around. Put your toys away!!",True,False,False,Portland,t5_2qi2i,103460,public,self,Some damn kids keep leaving their scooters on the sidewalks. What is up with that?,https://www.reddit.com/r/Portland/comments/9bf9qn/some_damn_kids_keep_leaving_their_scooters_on_the/,all_ads,6,,,,,,,,,,,,,
WhereverUGoThereUR,,[],,text,t2_7z04y,False,False,1535590136,ktvz.com,https://www.reddit.com/r/Portland/comments/9bf014/free_fishing_this_saturday_and_sunday_in_oregon/,0,9bf014,True,False,False,False,False,False,,[],dark,text,False,False,True,3,0,False,all_ads,/r/Portland/comments/9bf014/free_fishing_this_saturday_and_sunday_in_oregon/,False,6,1535590136,25,,True,False,False,Portland,t5_2qi2i,103457,public,default,Free fishing this Saturday and Sunday in Oregon - KTVZ,https://www.ktvz.com/news/free-fishing-this-saturday-and-sunday-in-oregon/787573582,all_ads,6,,,,,,,,,,,,,
Cinquain0,,[],,text,t2_z0pbu,False,False,1535589654,cityxcape.com,https://www.reddit.com/r/Portland/comments/9bexz7/how_to_find_abandoned_places/,0,9bexz7,True,False,False,False,False,False,,[],dark,text,False,False,True,1,0,False,all_ads,/r/Portland/comments/9bexz7/how_to_find_abandoned_places/,False,6,1535589654,0,,True,False,False,Portland,t5_2qi2i,103453,public,default,How to Find Abandoned Places,https://www.cityxcape.com/secret-spots/how-to-find-abandon-places,all_ads,6,,,,,,,,,,,,,
Jmclark92,,[],,text,t2_6j8z1z8,False,False,1535588905,/r/Portland/comments/9beuox/met_this_little_guy_on_mt_st_helens_yesterday/,https://www.reddit.com/r/Portland/comments/9beuox/met_this_little_guy_on_mt_st_helens_yesterday/,0,9beuox,True,False,False,False,False,True,,[],dark,text,False,False,True,17,0,False,all_ads,/r/Portland/comments/9beuox/met_this_little_guy_on_mt_st_helens_yesterday/,False,6,1535588906,204,,True,False,False,Portland,t5_2qi2i,103453,public,default,Met this little guy on Mt. St Helens yesterday.,https://v.redd.it/7eujt3wgk4j11,all_ads,6,,,,,,,,,,,,,
ThatLeftHand,,[],,text,t2_rp5czoi,False,False,1535586134,self.Portland,https://www.reddit.com/r/Portland/comments/9bei9a/asian_population_in_portland/,0,9bei9a,True,False,False,False,True,False,,[],dark,text,False,False,True,37,0,False,all_ads,/r/Portland/comments/9bei9a/asian_population_in_portland/,False,6,1535586135,0," According to the census  


Vietnamese - 30.4k  
Chinese - 28.4k  
Indian - 14.7k  
Filipino - 13.7k  
Korean - 13.6k  
Japanese - 9.9k  
Other - 5.9k  
 

Is this correct? Specifically the Japanese population. Where do I find Japanese people.

Also do the Japanese students at PSU from Japan and Hawaii stay in Portland or do they all go back?",True,False,False,Portland,t5_2qi2i,103452,public,self,Asian population in Portland,https://www.reddit.com/r/Portland/comments/9bei9a/asian_population_in_portland/,all_ads,6,,,,,,,,,,,,,
drpoopchute,,[],,text,t2_20gs68yk,False,False,1535584340,self.Portland,https://www.reddit.com/r/Portland/comments/9beaae/visitor_seeking_tour_guide_for_this_evening/,0,9beaae,True,False,False,False,True,False,,[],dark,text,False,False,True,12,0,False,all_ads,/r/Portland/comments/9beaae/visitor_seeking_tour_guide_for_this_evening/,False,6,1535584341,0,"I am in Portland for a work event tomorrow night. I arrived one day early due to logistics and have a free evening.

&amp;#x200B;

Would anyone like to be my tour guide after I finish an early, mandatory dinner?

&amp;#x200B;

Me:  40, Male, Straight, employed, clean shaven, with gash on forehead from mountain biking accident this past weekend

&amp;#x200B;

You:  M or F, outgoing, local, fun 

&amp;#x200B;

Not looking for a hookup. Drinks are on me.",True,False,False,Portland,t5_2qi2i,103447,public,self,Visitor Seeking Tour Guide for This Evening,https://www.reddit.com/r/Portland/comments/9beaae/visitor_seeking_tour_guide_for_this_evening/,all_ads,6,,,,,,,,,,,,,
MattyPDNfingers,,[],,text,t2_1it6afvx,False,False,1535584146,self.Portland,https://www.reddit.com/r/Portland/comments/9be9bu/whats_wrong_with_people_at_the_sunset_tc/,0,9be9bu,True,False,False,False,True,False,,[],dark,text,False,False,True,5,0,False,all_ads,/r/Portland/comments/9be9bu/whats_wrong_with_people_at_the_sunset_tc/,False,6,1535584147,0,"As soon as they get off the bus and onto the stairs its like they feel the need to stroll and look around. This is happening to me everyday and today I finally said something and it was like rudest thing that's ever happened to these people. I got off the 48 bus with a lot of other people and as soon as we made it to the top of the stairs, the max pulled in and every person in front of me started walking slower like they didn't want to get on that max, they wanted the next one. So I said ""excuse me"" and they look at like I spit on someone, they were in total shock. Is it me or is this normal at sunset? ",True,False,False,Portland,t5_2qi2i,103446,public,self,What's wrong with people at the sunset TC?,https://www.reddit.com/r/Portland/comments/9be9bu/whats_wrong_with_people_at_the_sunset_tc/,all_ads,6,,,,,,,,,,,,,
DyelTurden,,[],,text,t2_1kgeoxmm,False,False,1535580495,oregonlive.com,https://www.reddit.com/r/Portland/comments/9bdskh/street_racing_suspected_in_death_of_ne_portland/,0,9bdskh,True,False,False,False,False,False,,[],dark,text,False,False,True,28,0,False,all_ads,/r/Portland/comments/9bdskh/street_racing_suspected_in_death_of_ne_portland/,False,6,1535580497,57,,True,False,False,Portland,t5_2qi2i,103445,public,https://b.thumbs.redditmedia.com/RPe-Tw5MxRg2PDYgV2OYgfzW-_SS42gao7JVF3xbYrU.jpg,"Street racing suspected in death of NE Portland pedestrian, police say",https://www.oregonlive.com/portland/index.ssf/2018/08/street_racing_suspected_in_dea.html#incart_target2box_default_#incart_target2box_targeted_,all_ads,6,,,local-news,Local News,link,"{'enabled': False, 'images': [{'id': 'eKF7wNAgSAIFxYznvB1i8K0qqGh2hoLkAKx1-X2uBow', 'resolutions': [{'height': 69, 'url': 'https://i.redditmedia.com/_bPA3FpyBa71I_1KqxX-3e84Y894TCZFEv_A2SkrIdM.jpg?fit=crop&amp;crop=faces%2Centropy&amp;arh=2&amp;w=108&amp;s=d13245531a176b43eb98ca77e3715649', 'width': 108}, {'height': 138, 'url': 'https://i.redditmedia.com/_bPA3FpyBa71I_1KqxX-3e84Y894TCZFEv_A2SkrIdM.jpg?fit=crop&amp;crop=faces%2Centropy&amp;arh=2&amp;w=216&amp;s=119a62003ecf71ffc0cb661dfda69f62', 'width': 216}, {'height': 205, 'url': 'https://i.redditmedia.com/_bPA3FpyBa71I_1KqxX-3e84Y894TCZFEv_A2SkrIdM.jpg?fit=crop&amp;crop=faces%2Centropy&amp;arh=2&amp;w=320&amp;s=99e215f15193d760531da9a36b98d28b', 'width': 320}, {'height': 410, 'url': 'https://i.redditmedia.com/_bPA3FpyBa71I_1KqxX-3e84Y894TCZFEv_A2SkrIdM.jpg?fit=crop&amp;crop=faces%2Centropy&amp;arh=2&amp;w=640&amp;s=de77fc699203c4e17f49ae354d97f877', 'width': 640}, {'height': 615, 'url': 'https://i.redditmedia.com/_bPA3FpyBa71I_1KqxX-3e84Y894TCZFEv_A2SkrIdM.jpg?fit=crop&amp;crop=faces%2Centropy&amp;arh=2&amp;w=960&amp;s=10cde433b8dc3c3a5b17a6cf4e06ab1b', 'width': 960}], 'source': {'height': 615, 'url': 'https://i.redditmedia.com/_bPA3FpyBa71I_1KqxX-3e84Y894TCZFEv_A2SkrIdM.jpg?s=0c76c7541061eec71c0155677342e80d', 'width': 960}, 'variants': {}}]}",89.0,140.0,,,,,
DyelTurden,,[],,text,t2_1kgeoxmm,False,False,1535580461,oregonlive.com,https://www.reddit.com/r/Portland/comments/9bdsfn/oregon_humane_society_under_investigation_amid/,0,9bdsfn,True,False,False,False,False,False,,[],dark,text,False,False,True,5,0,False,all_ads,/r/Portland/comments/9bdsfn/oregon_humane_society_under_investigation_amid/,False,6,1535580462,32,,True,False,False,Portland,t5_2qi2i,103445,public,default,Oregon Humane Society under investigation amid accusations of mishandled evidence,https://www.oregonlive.com/portland/index.ssf/2018/08/police_investigate_oregon_huma.html#incart_std,all_ads,6,,,local-news,Local News,,,,,,,,,
GeorgeTaylorG,,[],Hillsboro,text,t2_5jz8l,False,False,1535580045,twitter.com,https://www.reddit.com/r/Portland/comments/9bdqcv/construction_in_pdx/,0,9bdqcv,True,False,False,False,False,False,,[],dark,text,False,False,True,39,0,False,all_ads,/r/Portland/comments/9bdqcv/construction_in_pdx/,False,6,1535580047,26,,True,False,False,Portland,t5_2qi2i,103445,public,default,Construction in PDX,https://twitter.com/GeorgeTaylorG/status/1034923619233591296,all_ads,6,,dark,,,,,,,,,,,
2_Tubs_of_Guts,,[],Old Town Chinatown,text,t2_1obh5hbo,False,False,1535579696,imgur.com,https://www.reddit.com/r/Portland/comments/9bdoml/dont_they_just_publish_this_same_issue_every/,0,9bdoml,True,False,False,False,False,False,,[],dark,text,False,False,True,16,0,False,all_ads,/r/Portland/comments/9bdoml/dont_they_just_publish_this_same_issue_every/,False,6,1535579697,34,,False,False,False,Portland,t5_2qi2i,103443,public,default,Don't they just publish this same issue every couple months?,https://imgur.com/a/mopJ75b,all_ads,6,,dark,photo,Photo,,,,,b752c054-42ca-11e1-b05a-12313d2c1af1,,,,
jessepdx,,[],,text,t2_6x83266,False,False,1535579261,/r/Portland/comments/9bdmh5/lady_on_scooter_almost_into_traffic/,https://www.reddit.com/r/Portland/comments/9bdmh5/lady_on_scooter_almost_into_traffic/,0,9bdmh5,True,False,False,False,False,True,,[],dark,text,False,False,True,18,0,False,all_ads,/r/Portland/comments/9bdmh5/lady_on_scooter_almost_into_traffic/,False,6,1535579263,0,,True,False,False,Portland,t5_2qi2i,103443,public,https://b.thumbs.redditmedia.com/NSyyimud7IGIsxipTDulUKeSszo6GaSAKCYZrC-Ytcw.jpg,Lady on Scooter almost into traffic,https://v.redd.it/5f3rwv5xr3j11,all_ads,6,,,,,hosted:video,"{'enabled': False, 'images': [{'id': 'CzlxXqjjMsLmJRe5VWUnSc4X-MOWSCYkbkAme2FU3oE', 'resolutions': [{'height': 76, 'url': 'https://i.redditmedia.com/vHfnne4962d24jbEleIXzSV627gJf59RK1ZFpEiI86U.png?fit=crop&amp;crop=faces%2Centropy&amp;arh=2&amp;w=108&amp;s=c2535c902df39f25fcdc1d62a13712c3', 'width': 108}, {'height': 152, 'url': 'https://i.redditmedia.com/vHfnne4962d24jbEleIXzSV627gJf59RK1ZFpEiI86U.png?fit=crop&amp;crop=faces%2Centropy&amp;arh=2&amp;w=216&amp;s=fd6a21126eb0fd54f9ac135b706725de', 'width': 216}, {'height': 226, 'url': 'https://i.redditmedia.com/vHfnne4962d24jbEleIXzSV627gJf59RK1ZFpEiI86U.png?fit=crop&amp;crop=faces%2Centropy&amp;arh=2&amp;w=320&amp;s=1a0eae4fbb21d49915b89ba211498a48', 'width': 320}, {'height': 452, 'url': 'https://i.redditmedia.com/vHfnne4962d24jbEleIXzSV627gJf59RK1ZFpEiI86U.png?fit=crop&amp;crop=faces%2Centropy&amp;arh=2&amp;w=640&amp;s=2055309b5ede82b4f7953a3d0ee48327', 'width': 640}], 'source': {'height': 580, 'url': 'https://i.redditmedia.com/vHfnne4962d24jbEleIXzSV627gJf59RK1ZFpEiI86U.png?s=b79b12f1f4c8d68f33adb930d1ed7603', 'width': 820}, 'variants': {}}]}",99.0,140.0,,,,,
jessepdx,,[],,text,t2_6x83266,False,False,1535579165,self.Portland,https://www.reddit.com/r/Portland/comments/9bdly5/lady_on_scooter_almost_into_traffic_cropped/,0,9bdly5,True,False,False,False,True,False,,[],dark,text,False,False,True,1,0,False,all_ads,/r/Portland/comments/9bdly5/lady_on_scooter_almost_into_traffic_cropped/,False,6,1535579166,1,I cropped it for easier viewing,True,False,False,Portland,t5_2qi2i,103443,public,self,Lady on Scooter almost into traffic CROPPED,https://www.reddit.com/r/Portland/comments/9bdly5/lady_on_scooter_almost_into_traffic_cropped/,all_ads,6,,,,,,,,,,,,,
jessepdx,,[],,text,t2_6x83266,False,False,1535578217,/r/Portland/comments/9bdh5b/lady_on_scooter_almost_into_traffic/,https://www.reddit.com/r/Portland/comments/9bdh5b/lady_on_scooter_almost_into_traffic/,0,9bdh5b,True,False,False,False,False,True,,[],dark,text,False,False,True,4,0,False,all_ads,/r/Portland/comments/9bdh5b/lady_on_scooter_almost_into_traffic/,False,6,1535578219,0,,True,False,False,Portland,t5_2qi2i,103441,public,default,Lady on scooter almost into traffic,https://v.redd.it/j1z6sppuo3j11,all_ads,6,,,,,,,,,,,,,
