author,author_flair_background_color,author_flair_css_class,author_flair_richtext,author_flair_template_id,author_flair_text,author_flair_text_color,author_flair_type,author_fullname,author_patreon_flair,can_mod_post,contest_mode,created_utc,domain,full_link,gildings,id,is_crosspostable,is_meta,is_original_content,is_reddit_media_domain,is_robot_indexable,is_self,is_video,link_flair_background_color,link_flair_richtext,link_flair_text_color,link_flair_type,locked,media_only,no_follow,num_comments,num_crossposts,over_18,parent_whitelist_status,permalink,pinned,pwls,retrieved_on,score,selftext,send_replies,spoiler,stickied,subreddit,subreddit_id,subreddit_subscribers,subreddit_type,thumbnail,title,updated_utc,url,whitelist_status,wls,post_hint,preview,link_flair_css_class,link_flair_text,thumbnail_height,thumbnail_width
anthropicprincipal,,,[],de833834-42fc-11e1-9d02-12313d2c1af1,Hawthorne,dark,text,t2_jcu70nq,False,False,False,1555724682,columbian.com,https://www.reddit.com/r/Portland/comments/bf73c9/scanner_suspect_hijacks_ctran_bus_demands_ride_to/,"{'gid_1': 0, 'gid_2': 0, 'gid_3': 0}",bf73c9,True,False,False,False,True,False,False,,[],dark,text,False,False,True,16,0,False,all_ads,/r/Portland/comments/bf73c9/scanner_suspect_hijacks_ctran_bus_demands_ride_to/,False,6,1555724683,68,,True,False,False,Portland,t5_2qi2i,123893,public,default,"Scanner: Suspect hijacks C-Tran bus, demands ride to Portland",1555811057,https://www.columbian.com/news/2019/apr/19/scanner-suspect-hijacks-c-tran-bus-demands-ride-to-portland/,all_ads,6,,,,,,
GannonLara4,,,[],,,,text,t2_3mm8wvv8,False,False,False,1555724381,self.Portland,https://www.reddit.com/r/Portland/comments/bf71n1/lost_dog_in_oregon_city_link_in_description/,"{'gid_1': 0, 'gid_2': 0, 'gid_3': 0}",bf71n1,False,False,False,False,False,True,False,,[],dark,text,False,False,True,0,0,False,all_ads,/r/Portland/comments/bf71n1/lost_dog_in_oregon_city_link_in_description/,False,6,1555724382,27,[removed],True,False,False,Portland,t5_2qi2i,123893,public,self,Lost dog in Oregon city. link in description,1555810817,https://www.reddit.com/r/Portland/comments/bf71n1/lost_dog_in_oregon_city_link_in_description/,all_ads,6,self,"{'enabled': False, 'images': [{'id': 'zPFqvcqSauiW8KbHuR-WT_YDNQ0I8CYkJr2KmAbZh4Q', 'resolutions': [{'height': 144, 'url': 'https://external-preview.redd.it/ZIMwlEL0hnF4uyJAOhhygPUC3l92AnZxCGEwLiABmDE.jpg?width=108&amp;crop=smart&amp;auto=webp&amp;s=ffce5e071061295002d232100ce6246fc1e62484', 'width': 108}, {'height': 288, 'url': 'https://external-preview.redd.it/ZIMwlEL0hnF4uyJAOhhygPUC3l92AnZxCGEwLiABmDE.jpg?width=216&amp;crop=smart&amp;auto=webp&amp;s=e097489009a8e683aad007e5a607fc54446df49d', 'width': 216}, {'height': 426, 'url': 'https://external-preview.redd.it/ZIMwlEL0hnF4uyJAOhhygPUC3l92AnZxCGEwLiABmDE.jpg?width=320&amp;crop=smart&amp;auto=webp&amp;s=478673bed8d091022ff3dcba47f5648166a6aee9', 'width': 320}, {'height': 853, 'url': 'https://external-preview.redd.it/ZIMwlEL0hnF4uyJAOhhygPUC3l92AnZxCGEwLiABmDE.jpg?width=640&amp;crop=smart&amp;auto=webp&amp;s=bbc6a9dbcb2bef1518629a44af4d14f6e11e5ace', 'width': 640}], 'source': {'height': 960, 'url': 'https://external-preview.redd.it/ZIMwlEL0hnF4uyJAOhhygPUC3l92AnZxCGEwLiABmDE.jpg?auto=webp&amp;s=8f7c2ccf96d738988e19b718fc5e3c48f47768d7', 'width': 720}, 'variants': {}}]}",,,,
t_gong,,,[],,,,text,t2_3mor9dzy,False,False,False,1555724331,i.redd.it,https://www.reddit.com/r/Portland/comments/bf71d5/if_you_need_help_moving_heres_a_promo_code/,"{'gid_1': 0, 'gid_2': 0, 'gid_3': 0}",bf71d5,True,False,False,True,True,False,False,,[],dark,text,False,False,True,0,0,False,all_ads,/r/Portland/comments/bf71d5/if_you_need_help_moving_heres_a_promo_code/,False,6,1555724332,1,,True,False,False,Portland,t5_2qi2i,123893,public,default,"If you need help moving, here’s a Promo Code",1555810715,https://i.redd.it/fuqmobbnpbt21.jpg,all_ads,6,,,,,,
cwg913,,,[],24a31cee-42fd-11e1-af09-12313b08a511,Hillsboro,dark,text,t2_qfgddgz,False,False,False,1555724314,i.redd.it,https://www.reddit.com/r/Portland/comments/bf719p/help_needed_in_which_part_of_hillsboro_can_i_find/,"{'gid_1': 0, 'gid_2': 0, 'gid_3': 0}",bf719p,True,False,False,True,True,False,False,,[],dark,text,False,False,True,48,0,False,all_ads,/r/Portland/comments/bf719p/help_needed_in_which_part_of_hillsboro_can_i_find/,False,6,1555724315,271,,True,False,False,Portland,t5_2qi2i,123893,public,https://b.thumbs.redditmedia.com/iAHTCVSjLk6n69zFF2X4rRj6WbKzCW9cXCFE_2I7JxQ.jpg,Help needed: In which part of Hillsboro can I find this geological formation?,1555810701,https://i.redd.it/j785a1eiobt21.jpg,all_ads,6,image,"{'enabled': True, 'images': [{'id': 'vxqpe2Kr60GLcFwVccBesICc2auUbGSMKDDXtMvalZQ', 'resolutions': [{'height': 208, 'url': 'https://preview.redd.it/j785a1eiobt21.jpg?width=108&amp;crop=smart&amp;auto=webp&amp;s=d8c9c59c95677ea825957bbe8d9417561ce62645', 'width': 108}, {'height': 417, 'url': 'https://preview.redd.it/j785a1eiobt21.jpg?width=216&amp;crop=smart&amp;auto=webp&amp;s=fdd8baebfee90a9edcb0b0af59d59be7f925fb1f', 'width': 216}, {'height': 618, 'url': 'https://preview.redd.it/j785a1eiobt21.jpg?width=320&amp;crop=smart&amp;auto=webp&amp;s=aaba4cf47d106ea3f0944a4ace049985d00ef28b', 'width': 320}], 'source': {'height': 779, 'url': 'https://preview.redd.it/j785a1eiobt21.jpg?auto=webp&amp;s=f949e7bc477c4f8e8d08c977b973c46ee1e1cce0', 'width': 403}, 'variants': {}}]}",photo,Photo,140.0,140.0
LoveTruth1,,,[],,,,text,t2_24wm0z5e,False,False,False,1555723256,self.Portland,https://www.reddit.com/r/Portland/comments/bf6vka/visiting_portland/,"{'gid_1': 0, 'gid_2': 0, 'gid_3': 0}",bf6vka,False,False,False,False,False,True,False,,[],dark,text,False,False,True,2,0,False,all_ads,/r/Portland/comments/bf6vka/visiting_portland/,False,6,1555723258,1,[removed],True,False,False,Portland,t5_2qi2i,123892,public,self,Visiting Portland,1555809644,https://www.reddit.com/r/Portland/comments/bf6vka/visiting_portland/,all_ads,6,,,,,,
t_gong,,,[],,,,text,t2_3mor9dzy,False,False,False,1555722725,i.redd.it,https://www.reddit.com/r/Portland/comments/bf6sp3/40_off_bellhops_moving_promo_code/,"{'gid_1': 0, 'gid_2': 0, 'gid_3': 0}",bf6sp3,False,False,False,True,False,False,False,,[],dark,text,False,False,True,0,0,False,all_ads,/r/Portland/comments/bf6sp3/40_off_bellhops_moving_promo_code/,False,6,1555722727,1,,True,False,False,Portland,t5_2qi2i,123889,public,default,$40 Off Bellhops Moving Promo Code,1555809100,https://i.redd.it/r4aush7vkbt21.jpg,all_ads,6,,,,,,
elle-mnop,,,[],,,,text,t2_x4rq3,False,False,False,1555720249,self.Portland,https://www.reddit.com/r/Portland/comments/bf6f4f/anyone_been_to_ohsu_als_and_neuromuscular_disease/,"{'gid_1': 0, 'gid_2': 0, 'gid_3': 0}",bf6f4f,True,False,False,False,True,True,False,,[],dark,text,False,False,True,2,0,False,all_ads,/r/Portland/comments/bf6f4f/anyone_been_to_ohsu_als_and_neuromuscular_disease/,False,6,1555720251,6,"Just wondering if anyone has any experience with this clinic.

I have a neuromuscular disease - I've been seeing a string of neurologists but none of them are specialists in this area. The disease I have is super rare, so even specialists probably haven't seen it before... Wondering if it's worthwhile to ask for a referral. 

(direct messages are welcome if you don't want to comment publicly on this topic)",True,False,False,Portland,t5_2qi2i,123884,public,self,Anyone been to OHSU ALS and Neuromuscular Disease Center,1555806628,https://www.reddit.com/r/Portland/comments/bf6f4f/anyone_been_to_ohsu_als_and_neuromuscular_disease/,all_ads,6,,,,,,
The_Mojito,,,[],,,,text,t2_15o4z3,False,False,False,1555720221,self.Portland,https://www.reddit.com/r/Portland/comments/bf6ey0/for_hire_software_engineer_cannabis_company_full/,"{'gid_1': 0, 'gid_2': 0, 'gid_3': 0}",bf6ey0,True,False,False,False,True,True,False,,[],dark,text,False,False,True,1,0,False,all_ads,/r/Portland/comments/bf6ey0/for_hire_software_engineer_cannabis_company_full/,False,6,1555720221,0,"We are looking to bring on a Full Stack engineer with solid React experience on front and be open to learning / using Elixir on the back.

With over 300 licensed partners, we have processed over $100M in sales for 2018 and are scaling to meet demand.

You will be building the platform infrastructure that includes implementing modules, adding features and essentially wiring-things-up for delivery tracking, fleet management, seed to sale compliance, inventory management, warehouse management and CRM integration. This is an opportunity to kick ass, knock out code, and take ownership of each project.

This is a full time remote role but would require occasional trips to Oakland, CA every quarter

Comp - 100 - 120k + equity &amp; benefits

Please DM if interested",True,False,False,Portland,t5_2qi2i,123884,public,self,[For Hire] Software Engineer - Cannabis Company (Full Time - Remote),1555806620,https://www.reddit.com/r/Portland/comments/bf6ey0/for_hire_software_engineer_cannabis_company_full/,all_ads,6,,,,,,
flowercup,,,[],0e3c0f78-4254-11e1-a17b-12313d2c1af1,NW,dark,text,t2_57lgj,False,False,False,1555716815,self.Portland,https://www.reddit.com/r/Portland/comments/bf5vge/where_can_i_watch_the_blazers_game_tonight_near/,"{'gid_1': 0, 'gid_2': 0, 'gid_3': 0}",bf5vge,True,False,False,False,True,True,False,,[],dark,text,False,False,True,17,0,False,all_ads,/r/Portland/comments/bf5vge/where_can_i_watch_the_blazers_game_tonight_near/,False,6,1555716817,0,"Looking for somewhere other than marathon or silver dollar

Thank you!",True,False,False,Portland,t5_2qi2i,123883,public,self,Where can I watch the blazers game tonight near 23rd and burnside?,1555803193,https://www.reddit.com/r/Portland/comments/bf5vge/where_can_i_watch_the_blazers_game_tonight_near/,all_ads,6,,,,,,
itstoolatefororanges,,,[],eabbbf0e-42ca-11e1-a863-12313b08a511,Downtown,dark,text,t2_28two8dm,False,False,False,1555716389,oregonlive.com,https://www.reddit.com/r/Portland/comments/bf5syv/environmentalists_urge_city_hall_to_halt_crude/,"{'gid_1': 0, 'gid_2': 0, 'gid_3': 0}",bf5syv,True,False,False,False,True,False,False,,[],dark,text,False,False,True,44,0,False,all_ads,/r/Portland/comments/bf5syv/environmentalists_urge_city_hall_to_halt_crude/,False,6,1555716391,78,,True,False,False,Portland,t5_2qi2i,123883,public,default,Environmentalists urge City Hall to halt crude oil exports through Portland,1555802769,https://www.oregonlive.com/portland/2019/04/environmentalists-urge-city-hall-to-halt-crude-oil-exports-through-portland.html,all_ads,6,,,local-news,Local News,,
UnfairSprinkles,,,[],,,,text,t2_2h7f6ikk,False,False,False,1555716241,kgw.com,https://www.reddit.com/r/Portland/comments/bf5s2u/person_struck_and_killed_grand_and_broadway_by_a/,"{'gid_1': 0, 'gid_2': 0, 'gid_3': 0}",bf5s2u,True,False,False,False,True,False,False,,[],dark,text,False,False,True,34,0,False,all_ads,/r/Portland/comments/bf5s2u/person_struck_and_killed_grand_and_broadway_by_a/,False,6,1555716242,81,,True,False,False,Portland,t5_2qi2i,123883,public,default,Person struck and killed @ Grand and Broadway by a beer truck (site altered headline),1555802626,https://www.kgw.com/mobile/article/news/local/pedestrian-struck-killed-in-ne-portland/283-34dcbca0-27d8-4a7b-9794-e6b5759bd1e8,all_ads,6,,,local-news,Local News,,
moltovhighball,,,[],,,,text,t2_zgqq7hi,False,False,False,1555715479,self.Portland,https://www.reddit.com/r/Portland/comments/bf5nm0/what_the_hell_is_going_on_at_mlk_and_broadway/,"{'gid_1': 0, 'gid_2': 0, 'gid_3': 0}",bf5nm0,True,False,False,False,True,True,False,,[],dark,text,False,False,True,28,0,False,all_ads,/r/Portland/comments/bf5nm0/what_the_hell_is_going_on_at_mlk_and_broadway/,False,6,1555715480,28,,True,False,False,Portland,t5_2qi2i,123882,public,self,What the hell is going on at MLK and Broadway. Cops got the road blocked.,1555801865,https://www.reddit.com/r/Portland/comments/bf5nm0/what_the_hell_is_going_on_at_mlk_and_broadway/,all_ads,6,,,,,,
epicreparetime,,,[],,,,text,t2_10vsqv,False,False,False,1555712958,self.Portland,https://www.reddit.com/r/Portland/comments/bf57vy/should_portland_have_a_kibbutz/,"{'gid_1': 0, 'gid_2': 0, 'gid_3': 0}",bf57vy,True,False,False,False,True,True,False,,[],dark,text,False,False,True,5,0,False,all_ads,/r/Portland/comments/bf57vy/should_portland_have_a_kibbutz/,False,6,1555712959,0,Just asking.,True,False,False,Portland,t5_2qi2i,123877,public,self,Should Portland have a kibbutz?,1555799412,https://www.reddit.com/r/Portland/comments/bf57vy/should_portland_have_a_kibbutz/,all_ads,6,,,,,,
itstoolatefororanges,,,[],eabbbf0e-42ca-11e1-a863-12313b08a511,Downtown,dark,text,t2_28two8dm,False,False,False,1555710980,self.Portland,https://www.reddit.com/r/Portland/comments/bf4v2v/folks_who_drive_down_to_portland_in_the_summer_so/,"{'gid_1': 0, 'gid_2': 0, 'gid_3': 0}",bf4v2v,True,False,False,False,True,True,False,,[],dark,text,False,False,True,29,0,False,all_ads,/r/Portland/comments/bf4v2v/folks_who_drive_down_to_portland_in_the_summer_so/,False,6,1555710981,0,"Summer is approaching and that means parents bringing their kids to places like Keller Fountain Park or Lovejoy Fountain Park so they can frolic in the water. If you're one of those parents, I have to ask why? Most of the fountains recycle water and I've seen multiple occasions of folks pissing in the fountains at night, meaning your child is playing around and at times consuming nasty piss water. 

&amp;#x200B;

Wouldn't it be better to just go to a river like the Sandy river or the Clackamas river for your kids to play in? Never understood the mentality of parents who put their kids in our fountains.",True,False,False,Portland,t5_2qi2i,123879,public,self,"Folks who drive down to Portland in the summer so their kids can play in the public fountains, why?",1555797362,https://www.reddit.com/r/Portland/comments/bf4v2v/folks_who_drive_down_to_portland_in_the_summer_so/,all_ads,6,,,,,,
boldarcher,,,[],,,,text,t2_ctb8p,False,False,False,1555710250,self.Portland,https://www.reddit.com/r/Portland/comments/bf4qee/longdistance_help/,"{'gid_1': 0, 'gid_2': 0, 'gid_3': 0}",bf4qee,True,False,False,False,True,True,False,,[],dark,text,False,False,True,11,0,False,all_ads,/r/Portland/comments/bf4qee/longdistance_help/,False,6,1555710252,0,"Hey, my friend just bought his first home in Portland and I want to send him a house-warming gift. I've never been there - can anyone recommend places that would ship gift cards? I was thinking package store/brewery and hardware store. Thank you!!!",True,False,False,Portland,t5_2qi2i,123879,public,self,Long-distance help!,1555796629,https://www.reddit.com/r/Portland/comments/bf4qee/longdistance_help/,all_ads,6,,,,,,
Redditcule,,,[],,,,text,t2_sfujsbf,False,False,False,1555709530,/r/Portland/comments/bf4lsk/real_portland_treasures/,https://www.reddit.com/r/Portland/comments/bf4lsk/real_portland_treasures/,"{'gid_1': 0, 'gid_2': 0, 'gid_3': 0}",bf4lsk,True,False,False,False,True,False,True,,[],dark,text,False,False,True,4,0,False,all_ads,/r/Portland/comments/bf4lsk/real_portland_treasures/,False,6,1555709532,0,,True,False,False,Portland,t5_2qi2i,123878,public,default,Real Portland Treasures,1555795919,https://v.redd.it/5wx9i2vjhat21,all_ads,6,,,,,,
westernbittercrass,,,[],,,,text,t2_sbu81jg,False,False,False,1555709302,wweek.com,https://www.reddit.com/r/Portland/comments/bf4kc8/portland_agencies_might_build_a_funicular_up_the/,"{'gid_1': 0, 'gid_2': 0, 'gid_3': 0}",bf4kc8,True,False,False,False,True,False,False,,[],dark,text,False,False,True,30,0,False,all_ads,/r/Portland/comments/bf4kc8/portland_agencies_might_build_a_funicular_up_the/,False,6,1555709304,27,,True,False,False,Portland,t5_2qi2i,123878,public,default,Portland Agencies Might Build a Funicular Up the Side of Marquam Hill,1555795688,https://www.wweek.com/news/2019/04/18/portland-agencies-might-build-a-funicular-up-the-side-of-marquam-hill/,all_ads,6,,,local-news,Local News,,
workmeow,,,[],,,,text,t2_skcf2,False,False,False,1555708296,self.Portland,https://www.reddit.com/r/Portland/comments/bf4dy9/adidas_employee_store/,"{'gid_1': 0, 'gid_2': 0, 'gid_3': 0}",bf4dy9,False,False,False,False,False,True,False,,[],dark,text,False,False,True,1,0,False,all_ads,/r/Portland/comments/bf4dy9/adidas_employee_store/,False,6,1555708297,1,[removed],True,False,False,Portland,t5_2qi2i,123878,public,self,Adidas Employee Store,1555794680,https://www.reddit.com/r/Portland/comments/bf4dy9/adidas_employee_store/,all_ads,6,,,,,,
zombiearclight,,,[],,NW District,dark,text,t2_9o6eh,False,False,False,1555707998,self.Portland,https://www.reddit.com/r/Portland/comments/bf4c08/anyone_know_about_our_local_bat_species/,"{'gid_1': 0, 'gid_2': 0, 'gid_3': 0}",bf4c08,True,False,False,False,True,True,False,,[],dark,text,False,False,True,18,0,False,all_ads,/r/Portland/comments/bf4c08/anyone_know_about_our_local_bat_species/,False,6,1555708000,4,"I live near water and love watching the bats come out in the evening. There are two species I've encountered. 

The first is small, flies fast, and zooms around just a few feet above the water's surface. I believe this is Yuma myotis, as the description matches it perfectly.

The other is larger, flies slower and never seems to descend much below 100 feet. It doesn't seem to match the description of any of the 14 species we have here. 

Anyone know enough about bats to hazard a guess?",True,False,False,Portland,t5_2qi2i,123878,public,self,Anyone know about our local bat species?,1555794386,https://www.reddit.com/r/Portland/comments/bf4c08/anyone_know_about_our_local_bat_species/,all_ads,6,,,,,,
skyvipgrady,,,[],,,,text,t2_6l0je,False,False,False,1555707799,i.redd.it,https://www.reddit.com/r/Portland/comments/bf4aou/space_8_the_uv_element_with_kno_why_at_paris/,"{'gid_1': 0, 'gid_2': 0, 'gid_3': 0}",bf4aou,False,False,False,True,False,False,False,,[],dark,text,False,False,True,1,0,False,all_ads,/r/Portland/comments/bf4aou/space_8_the_uv_element_with_kno_why_at_paris/,False,6,1555707800,1,,True,False,False,Portland,t5_2qi2i,123878,public,default,Space 8: The UV Element with KNO / WHY at Paris Theatre,1555794188,https://i.redd.it/k5de2fmhcat21.jpg,all_ads,6,,,photo,Photo,,
cjsmed,,,[],,,,text,t2_2oala80u,False,False,False,1555707523,self.Portland,https://www.reddit.com/r/Portland/comments/bf48ul/morning_hike/,"{'gid_1': 0, 'gid_2': 0, 'gid_3': 0}",bf48ul,True,False,False,False,True,True,False,,[],dark,text,False,False,True,3,0,False,all_ads,/r/Portland/comments/bf48ul/morning_hike/,False,6,1555707526,0,"Any recommendations on a good early morning hike to watch the sunrise? Not a difficult hike, maybe 1/2 hour or less?",True,False,False,Portland,t5_2qi2i,123879,public,self,Morning hike,1555793910,https://www.reddit.com/r/Portland/comments/bf48ul/morning_hike/,all_ads,6,,,,,,
sarcasticDNA,,,[],,,,text,t2_3mf49wtw,False,False,False,1555707078,self.Portland,https://www.reddit.com/r/Portland/comments/bf45vu/recycling_costs/,"{'gid_1': 0, 'gid_2': 0, 'gid_3': 0}",bf45vu,True,False,False,False,True,True,False,,[],dark,text,False,False,True,5,0,False,all_ads,/r/Portland/comments/bf45vu/recycling_costs/,False,6,1555707079,0,"Curbside recycling has become pretty expensive; I'm thinking of canceling and just hauling paper/metal to Far West every couple of months (we don't generate that much); the issue is the trash -- we generate a bag maybe every six weeks or so and can store it for a long time but -- is there an option other than driving to landfill/dump periodically (used to lease an office and could use community dumpster -- nada mas, alas)? No, I won't sneak onto some apartment or commercial site to hurl a bag or two in ;-0. Would never ...",True,False,False,Portland,t5_2qi2i,123880,public,self,Recycling costs,1555793459,https://www.reddit.com/r/Portland/comments/bf45vu/recycling_costs/,all_ads,6,,,,,,
jordanlund,,,[],659aa628-2750-11e5-babb-0ecbbd00e599,Tualatin,dark,text,t2_2etc2,False,False,False,1555706994,imgur.com,https://www.reddit.com/r/Portland/comments/bf45bd/justice_league_fatal_five_set_partially_in/,"{'gid_1': 0, 'gid_2': 0, 'gid_3': 0}",bf45bd,True,False,False,False,True,False,False,,[],dark,text,False,False,True,9,0,False,all_ads,/r/Portland/comments/bf45bd/justice_league_fatal_five_set_partially_in/,False,6,1555706995,2,,True,False,False,Portland,t5_2qi2i,123880,public,default,Justice League: Fatal Five set partially in Portland. Compared with the parking garage SW 1st and Clay:,1555793420,https://imgur.com/gallery/fRklGSu,all_ads,6,,,photo,Photo,,
itstoolatefororanges,,,[],eabbbf0e-42ca-11e1-a863-12313b08a511,Downtown,dark,text,t2_28two8dm,False,False,False,1555706925,oregonlive.com,https://www.reddit.com/r/Portland/comments/bf44tr/new_coffee_shop_takes_over_ristretto_roasters/,"{'gid_1': 0, 'gid_2': 0, 'gid_3': 0}",bf44tr,True,False,False,False,True,False,False,,[],dark,text,False,False,True,13,0,False,all_ads,/r/Portland/comments/bf44tr/new_coffee_shop_takes_over_ristretto_roasters/,False,6,1555706928,76,,True,False,False,Portland,t5_2qi2i,123880,public,https://b.thumbs.redditmedia.com/qiFqsz8XDSxKeuppLEyvPjf2YwlaBq7zbC_82l3aTVQ.jpg,New coffee shop takes over Ristretto Roasters location in Northwest Portland,1555793315,https://www.oregonlive.com/dining/2019/04/new-coffee-shop-takes-over-ristretto-roasters-location-in-northwest-portland.html,all_ads,6,link,"{'enabled': False, 'images': [{'id': 'SPLJeAnr0idN2rUlJ0SmMz2SFuExWlQnjC61Cg_sXAQ', 'resolutions': [{'height': 72, 'url': 'https://external-preview.redd.it/O3KfsLCsnTqTFqIatO2FL-zpju5hMvoKSzvFmY5SfGc.jpg?width=108&amp;crop=smart&amp;auto=webp&amp;s=07126bac2bd7f2bd8f9e16c0ca70f58435458979', 'width': 108}, {'height': 144, 'url': 'https://external-preview.redd.it/O3KfsLCsnTqTFqIatO2FL-zpju5hMvoKSzvFmY5SfGc.jpg?width=216&amp;crop=smart&amp;auto=webp&amp;s=3d4a8f2a0b2ce04dc3b057db7a63cf5e72cdcd34', 'width': 216}, {'height': 213, 'url': 'https://external-preview.redd.it/O3KfsLCsnTqTFqIatO2FL-zpju5hMvoKSzvFmY5SfGc.jpg?width=320&amp;crop=smart&amp;auto=webp&amp;s=47ffc3001047b484d6976e316c1bf30219b58804', 'width': 320}, {'height': 426, 'url': 'https://external-preview.redd.it/O3KfsLCsnTqTFqIatO2FL-zpju5hMvoKSzvFmY5SfGc.jpg?width=640&amp;crop=smart&amp;auto=webp&amp;s=b5952d39896ea51b2b9c4608b4716afe38caa357', 'width': 640}, {'height': 640, 'url': 'https://external-preview.redd.it/O3KfsLCsnTqTFqIatO2FL-zpju5hMvoKSzvFmY5SfGc.jpg?width=960&amp;crop=smart&amp;auto=webp&amp;s=87f83e20a9d35a4ce905101764aa31bedb09e501', 'width': 960}, {'height': 720, 'url': 'https://external-preview.redd.it/O3KfsLCsnTqTFqIatO2FL-zpju5hMvoKSzvFmY5SfGc.jpg?width=1080&amp;crop=smart&amp;auto=webp&amp;s=40a5bf0b6cf007ccafa7ff010d2c2149203d36ab', 'width': 1080}], 'source': {'height': 800, 'url': 'https://external-preview.redd.it/O3KfsLCsnTqTFqIatO2FL-zpju5hMvoKSzvFmY5SfGc.jpg?auto=webp&amp;s=67eb5a3c2503a8a5a59d8ac8bbc880543d39a44f', 'width': 1200}, 'variants': {}}]}",local-news,Local News,93.0,140.0
cjbaty,,,[],,,,text,t2_2666ar7o,False,False,False,1555706868,i.redd.it,https://www.reddit.com/r/Portland/comments/bf44gq/can_you_name_this_location/,"{'gid_1': 0, 'gid_2': 0, 'gid_3': 0}",bf44gq,True,False,False,True,True,False,False,,[],dark,text,False,False,True,17,0,False,all_ads,/r/Portland/comments/bf44gq/can_you_name_this_location/,False,6,1555706869,2,,True,False,False,Portland,t5_2qi2i,123880,public,default,Can you name this location?,1555793254,https://i.redd.it/069zma0q9at21.jpg,all_ads,6,,,photo,Photo,,
MegaMaga2020,,,[],,,,text,t2_2y0xs9k4,False,False,False,1555704361,self.Portland,https://www.reddit.com/r/Portland/comments/bf3nlg/any_cool_easter_services_happening_in_town/,"{'gid_1': 0, 'gid_2': 0, 'gid_3': 0}",bf3nlg,False,False,False,False,False,True,False,,[],dark,text,False,False,True,4,0,False,all_ads,/r/Portland/comments/bf3nlg/any_cool_easter_services_happening_in_town/,False,6,1555704362,0,[removed],True,False,False,Portland,t5_2qi2i,123874,public,self,Any cool Easter services happening in town?,1555790744,https://www.reddit.com/r/Portland/comments/bf3nlg/any_cool_easter_services_happening_in_town/,all_ads,6,,,,,,
squally_,,,[],,,,text,t2_3k0rvr7q,False,False,False,1555701798,self.Portland,https://www.reddit.com/r/Portland/comments/bf3608/keep_you_in_the_dark_you_know_they_all_pretend/,"{'gid_1': 0, 'gid_2': 0, 'gid_3': 0}",bf3608,True,False,False,False,True,True,False,,[],dark,text,False,False,True,7,0,False,all_ads,/r/Portland/comments/bf3608/keep_you_in_the_dark_you_know_they_all_pretend/,False,6,1555701800,0,"
 Keep you in the dark and so it all begins ❤️”",True,False,False,Portland,t5_2qi2i,123872,public,self,"“Keep you in the dark, you know they all pretend :)",1555788180,https://www.reddit.com/r/Portland/comments/bf3608/keep_you_in_the_dark_you_know_they_all_pretend/,all_ads,6,,,,,,
Juhnelle,,,[],,,,text,t2_102vj9,False,False,False,1555701622,oregonlive.com,https://www.reddit.com/r/Portland/comments/bf34tx/my_name_is_arat_montoya_i_get_the_doggies/,"{'gid_1': 0, 'gid_2': 0, 'gid_3': 0}",bf34tx,True,False,False,False,True,False,False,,[],dark,text,False,False,True,10,0,False,all_ads,/r/Portland/comments/bf34tx/my_name_is_arat_montoya_i_get_the_doggies/,False,6,1555701623,53,,True,False,False,Portland,t5_2qi2i,123872,public,default,My name is Arat Montoya. I get the doggies.,1555788020,https://www.oregonlive.com/living/2019/04/oregons-doggie-school-bus-takes-pups-out-for-a-day-of-play-video.html?utm_source=facebook&amp;utm_medium=social&amp;utm_campaign=theoregonian_sf&amp;fbclid=IwAR1YT7T1k68GHL1L3XcR7iC9K3j67fz4HkIrLPG6r_zka5tk3qrmu5sv5JY&amp;fbclid=IwAR0Mqstwo6zZmCfmCKWDb2ZEhvVjutYMVrvd_MliSsZ8E_0kDhvAtr9DFrY,all_ads,6,,,,,,
