author,author_flair_background_color,author_flair_css_class,author_flair_richtext,author_flair_template_id,author_flair_text,author_flair_text_color,author_flair_type,author_fullname,author_patreon_flair,can_mod_post,contest_mode,created_utc,domain,full_link,gildings,id,is_crosspostable,is_meta,is_original_content,is_reddit_media_domain,is_robot_indexable,is_self,is_video,link_flair_background_color,link_flair_css_class,link_flair_richtext,link_flair_text,link_flair_text_color,link_flair_type,locked,media_only,no_follow,num_comments,num_crossposts,over_18,parent_whitelist_status,permalink,pinned,pwls,retrieved_on,score,selftext,send_replies,spoiler,stickied,subreddit,subreddit_id,subreddit_subscribers,subreddit_type,thumbnail,title,updated_utc,url,whitelist_status,wls,media,media_embed,post_hint,preview,secure_media,secure_media_embed,thumbnail_height,thumbnail_width,media_metadata,gilded
abelovesfun,,,[],,,,text,t2_4lmp3,False,False,False,1554320137,self.Portland,https://www.reddit.com/r/Portland/comments/b92kpt/pdx_tomato_growing_advice/,"{'gid_1': 0, 'gid_2': 0, 'gid_3': 0}",b92kpt,True,False,False,False,True,True,False,,,[],,dark,text,False,False,True,13,0,False,all_ads,/r/Portland/comments/b92kpt/pdx_tomato_growing_advice/,False,6,1554320298,12,"Hello - this is my first post to PDX Reddit. I've lived here since 01 but became a 1st time homeowner last year in June. At the time I planted some late season tomato starts and had some lovely tomatoes.

This year I started several seeds inside, and those are on the windowsill and will be ready for 4"" pots later this week, with the intention of going in the ground when they outgrow those.

That plan was made slightly questionable today. I was looking at the raised bed, and realized that at the tomato plant sites from last year, I have several tomato seedlings popping up without me having done anything. I assume those are from tomatoes that fell before I could pick them, I would sometimes just bury them instead of throwing them in the compost.

What would you do? Disregard the bed seedlings and go with my stronger starts that I started inside? Or be happy with my zombie tomato plants regrowing in the beds? I worry that it is too early in the year for those bed tomatoes, but have no experience growing tomatoes except for last year.",True,False,False,Portland,t5_2qi2i,122591,public,self,PDX Tomato Growing Advice,1554518417,https://www.reddit.com/r/Portland/comments/b92kpt/pdx_tomato_growing_advice/,all_ads,6,,,,,,,,,,
GregorMacdonald,,,[],,,,text,t2_fl3xo,False,False,False,1554319378,self.Portland,https://www.reddit.com/r/Portland/comments/b92etg/could_a_highway_widening_fight_lead_to_congestion/,"{'gid_1': 0, 'gid_2': 0, 'gid_3': 0}",b92etg,True,False,False,False,True,True,False,,,[],,dark,text,False,False,True,8,0,False,all_ads,/r/Portland/comments/b92etg/could_a_highway_widening_fight_lead_to_congestion/,False,6,1554319572,0,"Putting a congestion pricing program in place faces a number of hurdles, from local opposition to federal approval for interstate highways. But in Portland, the current battle over a proposed I-5 widening, may have started to open the door.",True,False,False,Portland,t5_2qi2i,122591,public,self,Could a Highway Widening Fight Lead to Congestion Pricing in Portland?,1554518109,https://www.reddit.com/r/Portland/comments/b92etg/could_a_highway_widening_fight_lead_to_congestion/,all_ads,6,,,,,,,,,,
Polly_woggles,,,[],,,,text,t2_35xdform,False,False,False,1554318760,self.Portland,https://www.reddit.com/r/Portland/comments/b929tf/couch_removal/,"{'gid_1': 0, 'gid_2': 0, 'gid_3': 0}",b929tf,True,False,False,False,True,True,False,,,[],,dark,text,False,False,True,48,0,False,all_ads,/r/Portland/comments/b929tf/couch_removal/,False,6,1554318978,9,"I had no idea getting rid of this couch would be so difficult! Community Warehouse only takes 8 feet and under, and this couch is nearly 10feet on one side. The people delivering the new one want literally hundreds to remove the old one, and I am having trouble getting comfortable posting on something like Craiglist because then total strangers will be coming to my house (maybe I watch too much true crime :P ) Is there a magical option I am unaware of? ",True,False,False,Portland,t5_2qi2i,122590,public,self,Couch removal?,1554518036,https://www.reddit.com/r/Portland/comments/b929tf/couch_removal/,all_ads,6,,,,,,,,,,
anarchojet,,,[],,,,text,t2_3hbw8jou,False,False,False,1554318682,self.Portland,https://www.reddit.com/r/Portland/comments/b92960/thoughts_on_free_at_point_of_use_trimet/,"{'gid_1': 0, 'gid_2': 0, 'gid_3': 0}",b92960,True,False,False,False,True,True,False,,,[],,dark,text,False,False,True,76,0,False,all_ads,/r/Portland/comments/b92960/thoughts_on_free_at_point_of_use_trimet/,False,6,1554318888,0,"Hi!

I posed this question on a number of other platforms and it's had some interesting feedback so I'd like to try it here.

In my years of riding mass transit in major cities around the country, the biggest stumbling block has always been fare collection, fare enforcement and fare processing. I'm from Pittsburgh and fare collection and tap cards almost bankrupted our agency, and I'm seeing a pattern here in Portland as well.

Last month, King County made the observation publicly, that removing fare collection as a process and simply asking the state for the money otherwise collected from cash fare and passholders would do several things. First, the amount of money needed to collect the revenue, to maintain the fare boxes and count the cash, would drop to $0. Workers in these positions could be folded into the network elsewhere and retrained for other positions sorely lacking. Drivers would be free to just drive, and passengers wouldn't be left in the rain waiting while other passengers struggle with currency or malfunctioning tap cards.

It's time Trimet went free at point of use, I believe. Pittsburgh for example offers parts of the light rail network free of use at all times for everyone, and as I understand it Portland was similar before my time to a point. G4S would be made redundant in a massive way and would be freed up to stop legit crime at stations, or the contract could be dropped altogether and it could return to Portland Police Transit Police as the agency exists for a reason already, even if I don't particularly care for the white shirts or bus cops myself.

Your take? Please keep in mind before posting:

The mentally disabled, or those with clearly presenting behaviors you may not understand or do not have yourself still need transit and space

The houseless and still need transit and need warmth

The above groups and all passengers need to respect the rules of the transit vehicles and shelters so all of Portland can continue to enjoy/tolerate them for years to come - Trimet could facilitate some of this by working to add restrooms closer to stations: the first thing I saw as a brand new Portlander was the Portland Loo next to the Greyhound station after a 67 hour trip to my new home. Those things are a savior. If you don't want people defecating on MAX, put a toilet somewhere. All people need to poop. Make it solar powered and self composting for all I care.",True,False,False,Portland,t5_2qi2i,122590,public,self,Thoughts on Free at Point of use Trimet,1554517970,https://www.reddit.com/r/Portland/comments/b92960/thoughts_on_free_at_point_of_use_trimet/,all_ads,6,,,,,,,,,,
Mozzzi3,,,[],,,,text,t2_g6thxru,False,False,False,1554317830,self.Portland,https://www.reddit.com/r/Portland/comments/b922lg/help_moving_to_portland/,"{'gid_1': 0, 'gid_2': 0, 'gid_3': 0}",b922lg,False,False,False,False,False,True,False,,,[],,dark,text,False,False,True,1,0,False,all_ads,/r/Portland/comments/b922lg/help_moving_to_portland/,False,6,1554318105,1,[removed],True,False,False,Portland,t5_2qi2i,122590,public,self,Help! Moving to Portland,1554517863,https://www.reddit.com/r/Portland/comments/b922lg/help_moving_to_portland/,all_ads,6,,,,,,,,,,
f8f84f30eecd621a2804,,,[],,,,text,t2_76lne,False,False,False,1554316558,i.imgur.com,https://www.reddit.com/r/Portland/comments/b91su8/this_guy_has_been_sleeping_outside_my_office/,"{'gid_1': 0, 'gid_2': 0, 'gid_3': 0}",b91su8,True,False,False,False,True,False,False,,photo,[],Photo,dark,text,False,False,True,6,0,False,all_ads,/r/Portland/comments/b91su8/this_guy_has_been_sleeping_outside_my_office/,False,6,1554316624,5,,False,False,False,Portland,t5_2qi2i,122586,public,https://b.thumbs.redditmedia.com/yGLcfJl02yfZVki-gdCe2hSQont-oX3vLMphrwP4C9E.jpg,This guy has been sleeping outside my office window all morning,1554517475,https://i.imgur.com/Wb7GoMs.jpg,all_ads,6,,,image,"{'enabled': True, 'images': [{'id': 'iAnT5dzgaxhj5-hy3UccmkvLGZQEL7Pr_a_VxH3mfsE', 'resolutions': [{'height': 60, 'url': 'https://external-preview.redd.it/pSN_Jk5nrS587WiRBm4kAIyM84dm4zxv3FrUDtwX0XU.jpg?width=108&amp;crop=smart&amp;auto=webp&amp;s=0eb42e6abf85380820d35ab5fa4b566a9864229d', 'width': 108}, {'height': 121, 'url': 'https://external-preview.redd.it/pSN_Jk5nrS587WiRBm4kAIyM84dm4zxv3FrUDtwX0XU.jpg?width=216&amp;crop=smart&amp;auto=webp&amp;s=f2c42a26d14901aab894d5be02f1c7f2c4e81378', 'width': 216}, {'height': 180, 'url': 'https://external-preview.redd.it/pSN_Jk5nrS587WiRBm4kAIyM84dm4zxv3FrUDtwX0XU.jpg?width=320&amp;crop=smart&amp;auto=webp&amp;s=7aa06f20af07b6a66a535b05c991b3f8ee52cd25', 'width': 320}, {'height': 360, 'url': 'https://external-preview.redd.it/pSN_Jk5nrS587WiRBm4kAIyM84dm4zxv3FrUDtwX0XU.jpg?width=640&amp;crop=smart&amp;auto=webp&amp;s=4119266f676e40903d1de41ddf4b7d30c51f72aa', 'width': 640}, {'height': 540, 'url': 'https://external-preview.redd.it/pSN_Jk5nrS587WiRBm4kAIyM84dm4zxv3FrUDtwX0XU.jpg?width=960&amp;crop=smart&amp;auto=webp&amp;s=c8ceb4aff6d5699a3299ef5008075228232c572f', 'width': 960}, {'height': 607, 'url': 'https://external-preview.redd.it/pSN_Jk5nrS587WiRBm4kAIyM84dm4zxv3FrUDtwX0XU.jpg?width=1080&amp;crop=smart&amp;auto=webp&amp;s=202f57db094b26c6e0d7a4e670be2c8a861195ac', 'width': 1080}], 'source': {'height': 1728, 'url': 'https://external-preview.redd.it/pSN_Jk5nrS587WiRBm4kAIyM84dm4zxv3FrUDtwX0XU.jpg?auto=webp&amp;s=8ecf30e5a45949e368f93fbbdaca28dcc544519f', 'width': 3072}, 'variants': {}}]}",,,78.0,140.0,,
epicrepairetime,,,[],,,,text,t2_sjkhv,False,False,False,1554310235,curbed.com,https://www.reddit.com/r/Portland/comments/b90ggs/oneofakind_geometric_house_for_sale/,"{'gid_1': 0, 'gid_2': 0, 'gid_3': 0}",b90ggs,True,False,False,False,True,False,False,,,[],,dark,text,False,False,True,9,0,False,all_ads,/r/Portland/comments/b90ggs/oneofakind_geometric_house_for_sale/,False,6,1554310237,0,,True,False,False,Portland,t5_2qi2i,122579,public,https://b.thumbs.redditmedia.com/x-JERQWNPH6I8wmaeuZSEeUfbZeZFnMl5I8e3gd_knI.jpg,One-of-a-kind geometric house for sale.,1554516394,https://www.curbed.com/2019/4/3/18293249/portland-house-for-sale-architecture-robert-harvey-oshatz,all_ads,6,,,link,"{'enabled': False, 'images': [{'id': 'Jusv2xkk3l22jNMjYtXSCq1fxpvNCvcGm9V8u0uaKPc', 'resolutions': [{'height': 56, 'url': 'https://external-preview.redd.it/49KqJhYBUtcpKMmZ4xSBmj1L_wcpNVTCTEvw-3LnzGQ.jpg?width=108&amp;crop=smart&amp;auto=webp&amp;s=92ea5dcf5a17afce1ba7640a3dd926035c19e417', 'width': 108}, {'height': 113, 'url': 'https://external-preview.redd.it/49KqJhYBUtcpKMmZ4xSBmj1L_wcpNVTCTEvw-3LnzGQ.jpg?width=216&amp;crop=smart&amp;auto=webp&amp;s=fad6a401c2fd13b3ee6d33577fd712d343075863', 'width': 216}, {'height': 167, 'url': 'https://external-preview.redd.it/49KqJhYBUtcpKMmZ4xSBmj1L_wcpNVTCTEvw-3LnzGQ.jpg?width=320&amp;crop=smart&amp;auto=webp&amp;s=0a8057a2a22962b95d58da633f7bc3c8414a0197', 'width': 320}, {'height': 334, 'url': 'https://external-preview.redd.it/49KqJhYBUtcpKMmZ4xSBmj1L_wcpNVTCTEvw-3LnzGQ.jpg?width=640&amp;crop=smart&amp;auto=webp&amp;s=6354f4efcf61fa3f646d6038cda839884cc5339f', 'width': 640}, {'height': 502, 'url': 'https://external-preview.redd.it/49KqJhYBUtcpKMmZ4xSBmj1L_wcpNVTCTEvw-3LnzGQ.jpg?width=960&amp;crop=smart&amp;auto=webp&amp;s=92c30ebd84a56361fa80111609147591dfb8e3ae', 'width': 960}, {'height': 565, 'url': 'https://external-preview.redd.it/49KqJhYBUtcpKMmZ4xSBmj1L_wcpNVTCTEvw-3LnzGQ.jpg?width=1080&amp;crop=smart&amp;auto=webp&amp;s=2917fda1665835e65943054cc95b0d8e69316884', 'width': 1080}], 'source': {'height': 628, 'url': 'https://external-preview.redd.it/49KqJhYBUtcpKMmZ4xSBmj1L_wcpNVTCTEvw-3LnzGQ.jpg?auto=webp&amp;s=30835b27c6ddf6fb25e48d7f470cda4c70dac4c8', 'width': 1200}, 'variants': {}}]}",,,73.0,140.0,,
slingshotrobot,,,[],,,,text,t2_behpvgp,False,False,False,1554310060,oregonlive.com,https://www.reddit.com/r/Portland/comments/b90f34/the_fbi_has_rebuffed_a_formal_request_from/,"{'gid_1': 0, 'gid_2': 0, 'gid_3': 0}",b90f34,True,False,False,False,True,False,False,,local-news,[],Local News,dark,text,False,False,True,179,0,False,all_ads,/r/Portland/comments/b90f34/the_fbi_has_rebuffed_a_formal_request_from/,False,6,1554310061,729,,False,False,False,Portland,t5_2qi2i,122580,public,default,The FBI has rebuffed a formal request from Oregon’s senior U.S. senator and won’t turn over information it might have about cases where students from Saudi Arabia vanished while facing criminal charges around the country.,1554516374,https://www.oregonlive.com/news/2019/04/what-does-the-fbi-know-about-saudi-students-escaping-us-justice-it-wont-say.html?utm_medium=social&amp;utm_campaign=oregonian_sf&amp;utm_source=twitter,all_ads,6,,,,,,,,,,
WhereverUGoThereUR,,,[],a83c2e8e-42ca-11e1-a86c-12313d096aae,NW Heights,dark,text,t2_7z04y,False,False,False,1554309489,imgur.com,https://www.reddit.com/r/Portland/comments/b90at2/still_here_one_less_bottle_then_shown/,"{'gid_1': 0, 'gid_2': 0, 'gid_3': 0}",b90at2,True,False,False,False,True,False,False,,photo,[],Photo,dark,text,False,False,True,23,0,False,all_ads,/r/Portland/comments/b90at2/still_here_one_less_bottle_then_shown/,False,6,1554309490,26,,False,False,False,Portland,t5_2qi2i,122579,public,default,Still here (one less bottle then shown),1554516312,https://imgur.com/nT2okj1.jpg,all_ads,6,,,,,,,,,,
greazysteak,,,[],,,,text,t2_733gn,False,False,False,1554308304,self.Portland,https://www.reddit.com/r/Portland/comments/b901jl/favorite_brewerybrewpub_in_portland/,"{'gid_1': 0, 'gid_2': 0, 'gid_3': 0}",b901jl,True,False,False,False,True,True,False,,,[],,dark,text,False,False,True,80,0,False,all_ads,/r/Portland/comments/b901jl/favorite_brewerybrewpub_in_portland/,False,6,1554308307,14,"I don't remember seeing this addressed before and I am just curious of what everyone's favorite is. I dont need the beer snobs in r/portlandbeer to chime in (that's not actually true) but this is about more than just the beer. It's about food, location, staff, clients etc.

&amp;#x200B;

&amp;#x200B;

&amp;#x200B;

&amp;#x200B;",True,False,False,Portland,t5_2qi2i,122579,public,self,Favorite brewery/brewpub in Portland?,1554516179,https://www.reddit.com/r/Portland/comments/b901jl/favorite_brewerybrewpub_in_portland/,all_ads,6,,,,,,,,,,
gogogodzilla86,,,[],,,,text,t2_fx1ts,False,False,False,1554306876,self.Portland,https://www.reddit.com/r/Portland/comments/b8zqio/i_want_you_all_to_know_this_is_wrong_but_its_on/,"{'gid_1': 0, 'gid_2': 0, 'gid_3': 0}",b8zqio,True,False,False,False,True,True,False,,,[],,dark,text,False,False,True,32,0,False,all_ads,/r/Portland/comments/b8zqio/i_want_you_all_to_know_this_is_wrong_but_its_on/,False,6,1554306877,7,"Taking the practice exam test, the question, “if your vehicle starts to skid, you should turn the steering wheel___” and according to the test, you should turn the steering wheel to the direction you want to go. This is false. Take your foot off the gas don’t brake and turn into the skid to regain control of your car. Sorry for the rant, but this is fu**ing stupid.",True,False,False,Portland,t5_2qi2i,122579,public,self,"I want you all to know this is wrong, but it’s on the drivers license test- you steer Into it when your vehicle skids.",1554515917,https://www.reddit.com/r/Portland/comments/b8zqio/i_want_you_all_to_know_this_is_wrong_but_its_on/,all_ads,6,,,,,,,,,,
nyxo1,,,[],,,,text,t2_a7mj7,False,False,False,1554306578,self.Portland,https://www.reddit.com/r/Portland/comments/b8zoao/best_chicken_fried_steak/,"{'gid_1': 0, 'gid_2': 0, 'gid_3': 0}",b8zoao,True,False,False,False,True,True,False,,,[],,dark,text,False,False,True,26,0,False,all_ads,/r/Portland/comments/b8zoao/best_chicken_fried_steak/,False,6,1554306579,0,"Having lived in Texas for years, I was spoiled by having good chicken fried steak everywhere. I haven't seen many places in Portland that have it on the menu and probably even fewer make a decent one.

Anyone got any suggestions?",True,False,False,Portland,t5_2qi2i,122579,public,self,Best chicken fried steak?,1554515885,https://www.reddit.com/r/Portland/comments/b8zoao/best_chicken_fried_steak/,all_ads,6,,,,,,,,,,
guanaco55,,,[],,Regional Gallowboob,dark,text,t2_hyfa9,False,False,False,1554306320,wweek.com,https://www.reddit.com/r/Portland/comments/b8zmav/sarah_jeong_is_watching_the_web_from_portland_she/,"{'gid_1': 0, 'gid_2': 0, 'gid_3': 0}",b8zmav,True,False,False,False,True,False,False,,local-news,[],Local News,dark,text,False,False,True,28,0,False,all_ads,/r/Portland/comments/b8zmav/sarah_jeong_is_watching_the_web_from_portland_she/,False,6,1554306322,0,,True,False,False,Portland,t5_2qi2i,122579,public,default,Sarah Jeong Is Watching the Web From Portland. She Sees a Pile of Garbage.,1554515854,https://www.wweek.com/news/2019/04/03/sarah-jeong-is-watching-the-web-from-portland-she-sees-a-pile-of-garbage/,all_ads,6,,,,,,,,,,
guanaco55,,,[],,Regional Gallowboob,dark,text,t2_hyfa9,False,False,False,1554306190,oregonlive.com,https://www.reddit.com/r/Portland/comments/b8zlbg/sale_of_portland_meadows_could_send_oregon_horse/,"{'gid_1': 0, 'gid_2': 0, 'gid_3': 0}",b8zlbg,True,False,False,False,True,False,False,,local-news,[],Local News,dark,text,False,False,True,28,0,False,all_ads,/r/Portland/comments/b8zlbg/sale_of_portland_meadows_could_send_oregon_horse/,False,6,1554306191,34,,True,False,False,Portland,t5_2qi2i,122579,public,https://b.thumbs.redditmedia.com/fH2DZ3M_n2ZfPzGRs_9JSbFl89ChsZWxEB8DccWklKs.jpg,Sale of Portland Meadows could send Oregon horse racing to Grants Pass,1554515840,https://www.oregonlive.com/business/2019/04/sale-of-portland-meadows-could-send-oregon-horse-racing-to-grants-pass.html,all_ads,6,,,link,"{'enabled': False, 'images': [{'id': 'AWmQ03pIaCAFSe-PtQNNyaPaughJRelsWY_q2O_aT3M', 'resolutions': [{'height': 54, 'url': 'https://external-preview.redd.it/4eOsSzCH0xI6SoyBW3WXbJZrWB6GjCWRTuBfdaMdwWE.jpg?width=108&amp;crop=smart&amp;auto=webp&amp;s=79425c5330fb1bc4f03f962e346e102e62c4ddb5', 'width': 108}, {'height': 109, 'url': 'https://external-preview.redd.it/4eOsSzCH0xI6SoyBW3WXbJZrWB6GjCWRTuBfdaMdwWE.jpg?width=216&amp;crop=smart&amp;auto=webp&amp;s=380ebfd9f2bc5b2a796e29cc9759ff555a39f2b9', 'width': 216}, {'height': 161, 'url': 'https://external-preview.redd.it/4eOsSzCH0xI6SoyBW3WXbJZrWB6GjCWRTuBfdaMdwWE.jpg?width=320&amp;crop=smart&amp;auto=webp&amp;s=6b416765670b277749e393007330be5c88d493e2', 'width': 320}, {'height': 323, 'url': 'https://external-preview.redd.it/4eOsSzCH0xI6SoyBW3WXbJZrWB6GjCWRTuBfdaMdwWE.jpg?width=640&amp;crop=smart&amp;auto=webp&amp;s=9000cfe5269348c48c9d73316e54392a30ce77c9', 'width': 640}, {'height': 484, 'url': 'https://external-preview.redd.it/4eOsSzCH0xI6SoyBW3WXbJZrWB6GjCWRTuBfdaMdwWE.jpg?width=960&amp;crop=smart&amp;auto=webp&amp;s=8f233766b8a45d3176f1b6dd3d653625735d2911', 'width': 960}, {'height': 545, 'url': 'https://external-preview.redd.it/4eOsSzCH0xI6SoyBW3WXbJZrWB6GjCWRTuBfdaMdwWE.jpg?width=1080&amp;crop=smart&amp;auto=webp&amp;s=7837a0ecc429758a2e8af1a6a2f31155b9255fda', 'width': 1080}], 'source': {'height': 606, 'url': 'https://external-preview.redd.it/4eOsSzCH0xI6SoyBW3WXbJZrWB6GjCWRTuBfdaMdwWE.jpg?auto=webp&amp;s=7f0efd51855ce7a471c693d514a77ca6cfb09224', 'width': 1200}, 'variants': {}}]}",,,70.0,140.0,,
Hillarybest1,,,[],,,,text,t2_36hmcnpj,False,False,False,1554305783,laist.com,https://www.reddit.com/r/Portland/comments/b8zi9l/need_to_sleep_a_basic_human_right/,"{'gid_1': 0, 'gid_2': 0, 'gid_3': 0}",b8zi9l,True,False,False,False,True,False,False,,,[],,dark,text,False,False,True,19,0,False,all_ads,/r/Portland/comments/b8zi9l/need_to_sleep_a_basic_human_right/,False,6,1554305785,0,,True,False,False,Portland,t5_2qi2i,122579,public,default,Need to sleep a basic human right,1554515738,https://laist.com/2019/04/03/homeless_martin_boise_constitutional_rights.php,all_ads,6,,,,,,,,,,
toesterstruudel,,,[],,,,text,t2_2xn8qkyz,False,False,False,1554304897,i.redd.it,https://www.reddit.com/r/Portland/comments/b8zbli/beautiful_view_down_heather_canyon_on_moumt_hopd/,"{'gid_1': 0, 'gid_2': 0, 'gid_3': 0}",b8zbli,True,False,False,True,True,False,False,,photo,[],Photo,dark,text,False,False,True,0,0,False,all_ads,/r/Portland/comments/b8zbli/beautiful_view_down_heather_canyon_on_moumt_hopd/,False,6,1554304900,8,,True,False,False,Portland,t5_2qi2i,122578,public,https://b.thumbs.redditmedia.com/FYavoWK_ZnirTBthirIt5HWuAx93Ef3sdTj2f_i2kIY.jpg,Beautiful view down Heather Canyon on Moumt Hopd,1554515643,https://i.redd.it/o70icmovg2q21.jpg,all_ads,6,,,image,"{'enabled': True, 'images': [{'id': 'nOMJQp5iYDh0ihSyA5GCf8t35AftBdAzlrrqZgu0Jbs', 'resolutions': [{'height': 94, 'url': 'https://preview.redd.it/o70icmovg2q21.jpg?width=108&amp;crop=smart&amp;auto=webp&amp;s=e5767364384d5ac324ee921f1e99572e119e27f8', 'width': 108}, {'height': 189, 'url': 'https://preview.redd.it/o70icmovg2q21.jpg?width=216&amp;crop=smart&amp;auto=webp&amp;s=655dac22b4f7a9eb449a755e3be0456be5f31bc9', 'width': 216}, {'height': 280, 'url': 'https://preview.redd.it/o70icmovg2q21.jpg?width=320&amp;crop=smart&amp;auto=webp&amp;s=f1580ac05cb1db0d78f61c571103b72472a7b303', 'width': 320}, {'height': 561, 'url': 'https://preview.redd.it/o70icmovg2q21.jpg?width=640&amp;crop=smart&amp;auto=webp&amp;s=e3a3b56235c103d113ec9dea99e6b697047558df', 'width': 640}, {'height': 842, 'url': 'https://preview.redd.it/o70icmovg2q21.jpg?width=960&amp;crop=smart&amp;auto=webp&amp;s=fb5595715f748e5c9e246e318689083bbc92631f', 'width': 960}, {'height': 947, 'url': 'https://preview.redd.it/o70icmovg2q21.jpg?width=1080&amp;crop=smart&amp;auto=webp&amp;s=059fbb57051bb88274af745edc050bb65c9a3eaf', 'width': 1080}], 'source': {'height': 2736, 'url': 'https://preview.redd.it/o70icmovg2q21.jpg?auto=webp&amp;s=03654ccfefb8de77dfbe4412f8f9162691d5a7c1', 'width': 3117}, 'variants': {}}]}",,,122.0,140.0,,
JanetEastman,,,[],,,,text,t2_foahe,False,False,False,1554304843,oregonlive.com,https://www.reddit.com/r/Portland/comments/b8zb5t/get_inside_new_modern_homes_rentable_accessory/,"{'gid_1': 0, 'gid_2': 0, 'gid_3': 0}",b8zb5t,False,False,False,False,False,False,False,,,[],,dark,text,False,False,True,0,0,False,all_ads,/r/Portland/comments/b8zb5t/get_inside_new_modern_homes_rentable_accessory/,False,6,1554304846,1,,False,False,False,Portland,t5_2qi2i,122578,public,https://a.thumbs.redditmedia.com/TOSNvCKZB7e6xL2wyUCBlkzDjYiZAHHSYVhBZefnY28.jpg,"Get inside new modern homes, rentable accessory dwelling units: AIA tour during Design Week Portland (photos) | OregonLive.com",1554515637,https://www.oregonlive.com/expo/life-and-culture/g66l-2019/04/a58831c9d68390/get-inside-new-modern-homes-rentable-accessory-dwelling-units-aia-tour-during-design-week-portland-photos-.html,all_ads,6,,,link,"{'enabled': False, 'images': [{'id': 'cfKZNwYEh1SeBhOdNV0fEv7XUMl14PhiBWLAeTJ_Tp4', 'resolutions': [{'height': 65, 'url': 'https://external-preview.redd.it/iuQbfsaJhhsACrpfUnOi3-haNARnyRQqd9yWpfZvtew.jpg?width=108&amp;crop=smart&amp;auto=webp&amp;s=b983c399435ec661507a828acb38b818915c7aa4', 'width': 108}, {'height': 131, 'url': 'https://external-preview.redd.it/iuQbfsaJhhsACrpfUnOi3-haNARnyRQqd9yWpfZvtew.jpg?width=216&amp;crop=smart&amp;auto=webp&amp;s=50089b6f191799e77486d65ff831927eedda44a5', 'width': 216}, {'height': 194, 'url': 'https://external-preview.redd.it/iuQbfsaJhhsACrpfUnOi3-haNARnyRQqd9yWpfZvtew.jpg?width=320&amp;crop=smart&amp;auto=webp&amp;s=1cc0bac47536e1c21442650b6b1b60fedf0aa324', 'width': 320}, {'height': 389, 'url': 'https://external-preview.redd.it/iuQbfsaJhhsACrpfUnOi3-haNARnyRQqd9yWpfZvtew.jpg?width=640&amp;crop=smart&amp;auto=webp&amp;s=981a78741a11b0add46b1c6e9aa418a074c58dc9', 'width': 640}, {'height': 584, 'url': 'https://external-preview.redd.it/iuQbfsaJhhsACrpfUnOi3-haNARnyRQqd9yWpfZvtew.jpg?width=960&amp;crop=smart&amp;auto=webp&amp;s=61a9a6d9633a718d417083962761415b578a104e', 'width': 960}], 'source': {'height': 584, 'url': 'https://external-preview.redd.it/iuQbfsaJhhsACrpfUnOi3-haNARnyRQqd9yWpfZvtew.jpg?auto=webp&amp;s=08bfe8ab6e9351d3d98b311057d2f65c79b331ad', 'width': 960}, 'variants': {}}]}",,,85.0,140.0,,
1600vam,,,[],,,,text,t2_b0r0j,False,False,False,1554302898,facebook.com,https://www.reddit.com/r/Portland/comments/b8ywms/rally_to_release_the_mueller_report_north/,"{'gid_1': 0, 'gid_2': 0, 'gid_3': 0}",b8ywms,True,False,False,False,True,False,False,,,[],,dark,text,False,False,True,314,0,False,all_ads,/r/Portland/comments/b8ywms/rally_to_release_the_mueller_report_north/,False,6,1554302900,294,,False,False,False,Portland,t5_2qi2i,122580,public,default,Rally to Release the Mueller Report | North Waterfront Park | Thursday 5PM,1554515375,https://www.facebook.com/events/594650097679115/?active_tab=about,all_ads,6,,,,,,,,,,
