author,author_created_utc,author_flair_css_class,author_flair_text,author_fullname,created_utc,domain,full_link,gilded,id,is_self,media_embed,num_comments,over_18,permalink,retrieved_on,score,secure_media_embed,selftext,stickied,subreddit,subreddit_id,thumbnail,title,url,edited,media,secure_media
[deleted],,,,,1423451373,self.Portland,https://www.reddit.com/r/Portland/comments/2v9ef2/blue_lights_over_portland/,0,2v9ef2,True,{},13,False,/r/Portland/comments/2v9ef2/blue_lights_over_portland/,1440918423,0,{},Looks like lightning but not! How,False,Portland,t5_2qi2i,default,Blue lights over portland?,http://www.reddit.com/r/Portland/comments/2v9ef2/blue_lights_over_portland/,,,
Potlandia,1416219338.0,,,t2_jef3e,1423448800,kgw.com,https://www.reddit.com/r/Portland/comments/2v99jo/portland_police_city_doj_reach_settlement/,0,2v99jo,False,{},1,False,/r/Portland/comments/2v99jo/portland_police_city_doj_reach_settlement/,1440918486,0,{},,False,Portland,t5_2qi2i,default,"Portland police, city, DOJ reach settlement",http://www.kgw.com/story/news/2014/07/26/12580510/,,,
dogweather,1286331609.0,,Alphabet District,t2_4emgi,1423447442,self.Portland,https://www.reddit.com/r/Portland/comments/2v96z4/new_longboarding_subreddit_and_meetup_needs/,0,2v96z4,True,{},5,False,/r/Portland/comments/2v96z4/new_longboarding_subreddit_and_meetup_needs/,1440918519,0,{},"* http://www.reddit.com/r/pdxlongboarding
* http://www.meetup.com/Longboarding-PDX/

Help moderate and customize! Just give a shout. The [Longboarding NYC Meetup](http://www.meetup.com/LongboardingNYC/members/10307748/) group is an inspiration. [Seattle's](http://www.meetup.com/Lake-Union-Longboarders/) ain't bad either. 

As far as subreddits, [r/longboarding](http://reddit.com/r/longboarding) is kick-ass, and sets a really high bar. I'd just like to see a subreddit for talking about local longboarding stuff. ",False,Portland,t5_2qi2i,self,New longboarding subreddit and meetup needs moderators,http://www.reddit.com/r/Portland/comments/2v96z4/new_longboarding_subreddit_and_meetup_needs/,,,
