author,author_created_utc,author_flair_css_class,author_flair_text,author_fullname,created_utc,domain,full_link,gilded,id,is_self,media_embed,num_comments,over_18,permalink,retrieved_on,score,secure_media_embed,selftext,stickied,subreddit,subreddit_id,thumbnail,title,url,edited,media,secure_media
2error,1393105388.0,,Sullivan's Gulch,t2_fefwq,1425505037,orangesplot.net,https://www.reddit.com/r/Portland/comments/2xy9rc/a_progressive_portland_developers_plan_for_an/,0,2xy9rc,False,{},21,False,/r/Portland/comments/2xy9rc/a_progressive_portland_developers_plan_for_an/,1440872665,20,{},,False,Portland,t5_2qi2i,http://a.thumbs.redditmedia.com/Ad1IKoQnNM61A5wdHetBqpBPhE8LvPpiHxiEvLYCd10.jpg,A progressive Portland developer’s plan for an affordable infill policy,http://www.orangesplot.net/2015/02/14/plank-of-progressive-planning-ideas-for-portland-that-wont-piss-off-the-neighbors/,,,
CupsBlade,1337501336.0,,,t2_7rgwt,1425504662,self.Portland,https://www.reddit.com/r/Portland/comments/2xy8xk/question_about_the_weather_on_i5_on_my_way_to_pdx/,0,2xy8xk,True,{},6,False,/r/Portland/comments/2xy8xk/question_about_the_weather_on_i5_on_my_way_to_pdx/,1440872675,0,{},"If I'm driving up to Portland from Sonoma County, CA next Sunday the 15th, will I need chains of any kind over the pass or through Shasta? Was curious for this time of the year.",False,Portland,t5_2qi2i,self,Question about the weather on i5 on my way to PDX,http://www.reddit.com/r/Portland/comments/2xy8xk/question_about_the_weather_on_i5_on_my_way_to_pdx/,,,
Tjerino,1238637335.0,,Richmond,t2_3flcz,1425504320,self.Portland,https://www.reddit.com/r/Portland/comments/2xy86n/anyone_recommend_a_local_ebay_resellerconsignment/,0,2xy86n,True,{},13,False,/r/Portland/comments/2xy86n/anyone_recommend_a_local_ebay_resellerconsignment/,1440872685,0,{},"I tried searching Google for a local ebay reseller/consignment type business and didn't have much luck.  I found one for clothing, but most of the other listings seemed pretty shady or unprofessional.  Anybody have any recommendations?  

I have a bunch of electronics type equipment from work we'd like to get rid of that's still in good condition and worth decent money.",False,Portland,t5_2qi2i,self,Anyone recommend a local Ebay reseller/consignment type business?,http://www.reddit.com/r/Portland/comments/2xy86n/anyone_recommend_a_local_ebay_resellerconsignment/,,,
Ocean_Blues,1294811110.0,,,t2_4ptx4,1425503714,self.Portland,https://www.reddit.com/r/Portland/comments/2xy6su/22_male_visiting_for_grad_school_interview/,0,2xy6su,True,{},4,False,/r/Portland/comments/2xy6su/22_male_visiting_for_grad_school_interview/,1440872702,0,{},,False,Portland,t5_2qi2i,default,"22 Male Visiting for Grad school interview, question on where to stay",http://www.reddit.com/r/Portland/comments/2xy6su/22_male_visiting_for_grad_school_interview/,,,
midnight_waffles,1416096624.0,,Sellwood-Moreland,t2_jdn3r,1425503082,katu.com,https://www.reddit.com/r/Portland/comments/2xy5cx/goat_thief_suspect_caught_with_stolen_bikes/,0,2xy5cx,False,{},47,False,/r/Portland/comments/2xy5cx/goat_thief_suspect_caught_with_stolen_bikes/,1440872722,104,{},,False,Portland,t5_2qi2i,http://b.thumbs.redditmedia.com/Vb2Weypd-hOGP6bu0970U9V6syo4PLilooqiYbh6lmc.jpg,Goat thief suspect caught with stolen bikes,http://www.katu.com/news/local/Police-Goat-theft-suspect-caught-with-stolen-bikes-295041311.html,,,
kstebbs,1288626992.0,,Kerns,t2_4hcmh,1425501853,self.Portland,https://www.reddit.com/r/Portland/comments/2xy2pa/luckys_tavern_ne_28thglisan_has_been_closed_and/,0,2xy2pa,True,{},13,False,/r/Portland/comments/2xy2pa/luckys_tavern_ne_28thglisan_has_been_closed_and/,1440872755,15,{},"It is a prime location, and I've seen nothing being done after the demolition of the building. Is the property for sale? I miss the old place...",False,Portland,t5_2qi2i,self,"Lucky's Tavern (NE 28th/Glisan) has been closed and demolished for well over a year, and the lot is still empty. What is going on?",http://www.reddit.com/r/Portland/comments/2xy2pa/luckys_tavern_ne_28thglisan_has_been_closed_and/,,,
[deleted],,,,,1425501812,self.Portland,https://www.reddit.com/r/Portland/comments/2xy2lv/luckys_tavern_ne_28thglisan_has_been_closed_and/,0,2xy2lv,True,{},0,False,/r/Portland/comments/2xy2lv/luckys_tavern_ne_28thglisan_has_been_closed_and/,1440872757,1,{},"It is a prime location, and I've seen nothing being done after the demolition of the building. Is the property for sale? I miss the old place...",False,Portland,t5_2qi2i,default,"Lucky's Tavern (NE 28th/Glisan) has been closed and demolitioned for well over a year, and the lot is still empty. What is going on?",http://www.reddit.com/r/Portland/comments/2xy2lv/luckys_tavern_ne_28thglisan_has_been_closed_and/,,,
brownprideswag,1425004848.0,,,t2_lp0lu,1425501452,oregonlive.com,https://www.reddit.com/r/Portland/comments/2xy1uu/tigard_stands_up_against_the_disgusting_trend_of/,0,2xy1uu,False,{},3,False,/r/Portland/comments/2xy1uu/tigard_stands_up_against_the_disgusting_trend_of/,1440872767,0,{},,False,Portland,t5_2qi2i,default,Tigard stands up against the disgusting trend of gentrification,http://www.oregonlive.com/tigard/index.ssf/2015/03/tigard_city_council_rejects_pl.html,,,
theoldtaste,1422915404.0,,,t2_l44dr,1425500441,self.Portland,https://www.reddit.com/r/Portland/comments/2xxznj/would_you_gentlemen_use_a_personal_shopper/,0,2xxznj,True,{},17,False,/r/Portland/comments/2xxznj/would_you_gentlemen_use_a_personal_shopper/,1440872796,0,{},,False,Portland,t5_2qi2i,default,would you gentlemen use a personal shopper?,http://www.reddit.com/r/Portland/comments/2xxznj/would_you_gentlemen_use_a_personal_shopper/,1425501005.0,,
dadonster,1415751109.0,,,t2_jbdjv,1425500422,flickr.com,https://www.reddit.com/r/Portland/comments/2xxzm2/ive_been_taking_pictures_of_my_friends_paintings/,0,2xxzm2,False,{},1,False,/r/Portland/comments/2xxzm2/ive_been_taking_pictures_of_my_friends_paintings/,1440872796,0,{},,False,Portland,t5_2qi2i,http://b.thumbs.redditmedia.com/iPnSZYrzCNjwcSmBgJSF-FEv6mU6Mg5moIOvI6rTlNw.jpg,I've been taking pictures of my friend's paintings around Portland...check 'em out!,https://www.flickr.com/photos/125938988@N03/sets/72157650740694855/,,,
lunarobverse00,1332002914.0,,Sellwood-Moreland,t2_771an,1425496928,ting.com,https://www.reddit.com/r/Portland/comments/2xxrpn/ting_gsm_beta_in_portland/,0,2xxrpn,False,{},8,False,/r/Portland/comments/2xxrpn/ting_gsm_beta_in_portland/,1440872898,0,{},,False,Portland,t5_2qi2i,http://b.thumbs.redditmedia.com/P8ysLSR6LghL9iTmKONK70tv54XllcMZsFC45VrssUk.jpg,Ting GSM beta in Portland?,https://ting.com/blog/ting-on-a-gsm-network-open-beta-is-well-open/,,,
[deleted],,,,,1425496449,i.imgur.com,https://www.reddit.com/r/Portland/comments/2xxqmi/dead_fish_littering_sandy_river_deltasmelt_or/,0,2xxqmi,False,{},0,False,/r/Portland/comments/2xxqmi/dead_fish_littering_sandy_river_deltasmelt_or/,1440872913,0,{},,False,Portland,t5_2qi2i,default,Dead Fish littering Sandy River Delta--smelt or..?,http://i.imgur.com/lhfAU1r.jpg,,,
slysesh,1346335935.0,,,t2_8uais,1425494422,self.Portland,https://www.reddit.com/r/Portland/comments/2xxm0m/musicians_and_music_lovers_of_reddit_portland_we/,0,2xxm0m,True,{},1,False,/r/Portland/comments/2xxm0m/musicians_and_music_lovers_of_reddit_portland_we/,1440872973,0,{},,False,Portland,t5_2qi2i,default,Musicians and Music Lovers of Reddit Portland- We need help Seeking a Solid Bass Player,http://www.reddit.com/r/Portland/comments/2xxm0m/musicians_and_music_lovers_of_reddit_portland_we/,,,
coldcoffee18,1425492685.0,,,t2_lvtmj,1425492900,self.Portland,https://www.reddit.com/r/Portland/comments/2xximy/found_ergo_baby_carrier_in_grant_park/,0,2xximy,True,{},2,False,/r/Portland/comments/2xximy/found_ergo_baby_carrier_in_grant_park/,1440873016,0,{},"I found an Ergo baby carrier in Grant Park yesterday afternoon (3/3).  Looks like it could have fallen off a stroller or something.  If it's yours, reply to my craigslist post and I'll get it back to you:

http://portland.craigslist.org/mlt/laf/4916077784.html",False,Portland,t5_2qi2i,self,found: Ergo baby carrier in grant park,http://www.reddit.com/r/Portland/comments/2xximy/found_ergo_baby_carrier_in_grant_park/,,,
[deleted],,,,,1425492746,self.Portland,https://www.reddit.com/r/Portland/comments/2xxiae/favorite_tattoo_parlors_and_artists_go/,0,2xxiae,True,{},6,False,/r/Portland/comments/2xxiae/favorite_tattoo_parlors_and_artists_go/,1440873021,0,{},"My inked Oregonians. Hoping to get my first tattoo, need some help finding the right fit. Where have you gone, and what has your experience been?",False,Portland,t5_2qi2i,default,Favorite tattoo parlors and artists. Go.,http://www.reddit.com/r/Portland/comments/2xxiae/favorite_tattoo_parlors_and_artists_go/,,,
tbonenowison,1386305223.0,,SE,t2_e84nc,1425492264,self.Portland,https://www.reddit.com/r/Portland/comments/2xxh8b/anyone_walk_the_4t_trail_recently_from_the_zoo_to/,0,2xxh8b,True,{},12,False,/r/Portland/comments/2xxh8b/anyone_walk_the_4t_trail_recently_from_the_zoo_to/,1440873035,13,{},"It was my first time so I went early this morning by myself thinking the trail would be fairly easy to hike through. Once I started into the woods, there was no real clear signs of a trail except white ribbons tied on trees every now and then. I eventually got lost and was even walking really close to homeless camps. I only had a rusty pocket knife in my backpack just in case but it felt sketchy nonetheless.

Anyone done this trail recently or have advice next time I (possibly) try it?",False,Portland,t5_2qi2i,self,Anyone walk the 4T Trail recently from the Zoo to Council Crest?,http://www.reddit.com/r/Portland/comments/2xxh8b/anyone_walk_the_4t_trail_recently_from_the_zoo_to/,,,
[deleted],,,,,1425486766,oregonlive.com,https://www.reddit.com/r/Portland/comments/2xx58s/this_lady_is_suing_a_restaurant_for_100k_because/,0,2xx58s,False,{},208,False,/r/Portland/comments/2xx58s/this_lady_is_suing_a_restaurant_for_100k_because/,1440873190,157,{},,False,Portland,t5_2qi2i,default,This lady is suing a restaurant for $100k because they were rude to her,http://www.oregonlive.com/dining/index.ssf/2015/03/woman_seeks_100000_from_portla.html#incart_m-rpt-1,,,
[deleted],,,,,1425482416,self.Portland,https://www.reddit.com/r/Portland/comments/2xww5c/pet_custody_issues/,0,2xww5c,True,{},1,False,/r/Portland/comments/2xww5c/pet_custody_issues/,1440873308,0,{},"From the research I've done, (like [this](http://www.oregonlive.com/pets/index.ssf/2012/09/pet_talk_pet_custody_battles_i.html) article for instance), custody matters in Oregon hinge on ownership, as the pet is considered property. But what if one party can prove purchase of the animal, the other holds the license and microchip, and each did various vet visits? 

Is there a local mediation service that can help in non-divorce situations like these for shared custody or visitation rights?",False,Portland,t5_2qi2i,default,Pet Custody Issues,http://www.reddit.com/r/Portland/comments/2xww5c/pet_custody_issues/,,,
[deleted],,,,,1425482326,self.Portland,https://www.reddit.com/r/Portland/comments/2xwvz7/zone_m_parking_in_nw/,0,2xwvz7,True,{},11,False,/r/Portland/comments/2xwvz7/zone_m_parking_in_nw/,1440873310,10,{},Like good citizens we went out and bought our parking permits by March 1st but looking around it seems most of our neighbors didn't. I also haven't seen any signs or meters. Does anyone know what's happening here? Have you seen any signs go up?,False,Portland,t5_2qi2i,self,Zone M Parking in NW?,http://www.reddit.com/r/Portland/comments/2xwvz7/zone_m_parking_in_nw/,,,
[deleted],,,,,1425468884,self.Portland,https://www.reddit.com/r/Portland/comments/2xwc0n/meta_thoughts_on_banning_or_restricting_requests/,0,2xwc0n,True,{},57,False,/r/Portland/comments/2xwc0n/meta_thoughts_on_banning_or_restricting_requests/,1440873569,58,{},"I'd like to see how people feel about restricting or disallowing this sort of post, possibly via (at a minimum) requiring verification of the claimed situation to mods before it can be posted.

I hate to see people getting scammed; having been a part of some particularly ugly communities (EVE Online, Bitcoin, etc) I've seen it happen over and over and over. Really, it's depressing.

When just words words words and no proof leads to donations of money, you have a recipe for disaster. It doesn't even matter whether a specific instance is a scam, allowing this in general creates an environment where scammers will simply mimic the real ones until so many people get burned that it stops working - leading to a worse situation both for people who really need help and for those who want to help them. 

~~~So, I'm going to throw down the gauntlet. If this is allowed to continue unchecked, I may or may not make a post like the ones that are starting to crop up. You won't know it's me - it'll be another of my dozen accounts, probably one with a couple k karma to look legit. But I'd take the money and run.~~~

edit: I admit it, I'm not enough of an asshole to do that, or I wouldn't have made this post in the first place. Other people are. I made this post hoping to call attention to that fact and to accomplish more than a way to say 'told you so' after people get burned badly enough that something is done.",False,Portland,t5_2qi2i,default,[META] Thoughts on banning or restricting requests for assistance?,http://www.reddit.com/r/Portland/comments/2xwc0n/meta_thoughts_on_banning_or_restricting_requests/,1425489312.0,,
[deleted],,,,,1425465284,whatwouldjackdo.net,https://www.reddit.com/r/Portland/comments/2xw8dy/another_reason_to_love_portland_our_airport_is/,0,2xw8dy,False,{},0,False,/r/Portland/comments/2xw8dy/another_reason_to_love_portland_our_airport_is/,1440873616,1,{},,False,Portland,t5_2qi2i,default,Another reason to love Portland: Our airport is cooler than yours,http://whatwouldjackdo.net/2015/03/another-reason-to-love-portland-our-airport-is-cooler-than-yours.html,,,
lambers,1359874807.0,,,t2_agi9a,1425455328,self.Portland,https://www.reddit.com/r/Portland/comments/2xvy7k/found_very_sweet_cat/,0,2xvy7k,True,{},3,False,/r/Portland/comments/2xvy7k/found_very_sweet_cat/,1440873747,6,{},"Extremely sweet and sociable cat found near SE Powell and 136th. Smallish with white and calico markings. We adore her and will give her a warm, loving, forever home but only if she doesn't already have one. Please send pics if she's yours and we will happily reunite you!",False,Portland,t5_2qi2i,self,Found very sweet cat,http://www.reddit.com/r/Portland/comments/2xvy7k/found_very_sweet_cat/,,,
hmmokwowthanks,1383896427.0,,,t2_dtp06,1425448970,imgur.com,https://www.reddit.com/r/Portland/comments/2xvpja/freebox_shit/,0,2xvpja,False,{},3,False,/r/Portland/comments/2xvpja/freebox_shit/,1440873880,0,{},,False,Portland,t5_2qi2i,http://b.thumbs.redditmedia.com/4kqIYz4oc5E0l3YikhyGIFlJXTSvjwwdOxeVts1qyIg.jpg,Freebox shit!,http://imgur.com/yXM3YQf,,,
[deleted],,,,,1425448801,imgur.com,https://www.reddit.com/r/Portland/comments/2xvp91/freebox_shit/,0,2xvp91,False,{},0,False,/r/Portland/comments/2xvp91/freebox_shit/,1440873884,1,{},,False,Portland,t5_2qi2i,default,Freebox shit!,http://imgur.com/ipplm0If,,,
malaclypz,1368669418.0,,,t2_boz97,1425447218,self.Portland,https://www.reddit.com/r/Portland/comments/2xvmqp/latenight_music_venues/,0,2xvmqp,True,{},9,False,/r/Portland/comments/2xvmqp/latenight_music_venues/,1440873916,0,{},"Looking for music venues that can go until 4 or 5 am without any chance of noise complaints, and can handle 150-250 people. Any suggestions would be much appreciated. Thanks!",False,Portland,t5_2qi2i,self,Late-night Music Venues?,http://www.reddit.com/r/Portland/comments/2xvmqp/latenight_music_venues/,,,
NeilioForRealio,1358999780.0,,,t2_acep3,1425443150,scontent-sea.xx.fbcdn.net,https://www.reddit.com/r/Portland/comments/2xvfej/massive_cruise_ship_norwegian_star_floats_in/,0,2xvfej,False,{},35,False,/r/Portland/comments/2xvfej/massive_cruise_ship_norwegian_star_floats_in/,1440874011,141,{},,False,Portland,t5_2qi2i,http://b.thumbs.redditmedia.com/vOXoP1lVUYN4m9ETiBdR_-XALdy691w6VMpSYbJD8yI.jpg,Massive cruise ship Norwegian Star floats in under the St. Johns Bridge for maintenance and repairs,https://scontent-sea.xx.fbcdn.net/hphotos-xfa1/t31.0-8/11043435_10205310317373430_5966230297853706903_o.jpg,,,
atrain714,1303790298.0,,,t2_55bz8,1425442171,self.Portland,https://www.reddit.com/r/Portland/comments/2xvdm7/the_gypsy_has_been_closed_for_over_a_year_what/,0,2xvdm7,True,{},29,False,/r/Portland/comments/2xvdm7/the_gypsy_has_been_closed_for_over_a_year_what/,1440874035,3,{},My vote is for a brewery,False,Portland,t5_2qi2i,self,"The Gypsy has been closed for over a year, what should replace it?",http://www.reddit.com/r/Portland/comments/2xvdm7/the_gypsy_has_been_closed_for_over_a_year_what/,,,
OldeSaultie,1423769053.0,,,t2_lbkl0,1425440669,self.Portland,https://www.reddit.com/r/Portland/comments/2xvaoo/the_librarians_locations_map/,0,2xvaoo,True,{},3,False,/r/Portland/comments/2xvaoo/the_librarians_locations_map/,1440874073,8,{},"thought I'd share my ""The Librarians"" [filming locations map](https://www.google.com/maps/d/edit?mid=zvv9Zgrd9E4Q.ktzOvP-OYKWE)",False,Portland,t5_2qi2i,self,THE LIBRARIANS - locations map,http://www.reddit.com/r/Portland/comments/2xvaoo/the_librarians_locations_map/,,,
[deleted],,,,,1425438046,self.Portland,https://www.reddit.com/r/Portland/comments/2xv5h0/with_all_the_development_occuring_along_the_i5/,0,2xv5h0,True,{},1,False,/r/Portland/comments/2xv5h0/with_all_the_development_occuring_along_the_i5/,1440874140,1,{},,False,Portland,t5_2qi2i,default,"With all the development occuring along the I-5 corridor near the Columbia river, could we be seeing a long term trend toward a OR/WA downtown along the Columbia?",http://www.reddit.com/r/Portland/comments/2xv5h0/with_all_the_development_occuring_along_the_i5/,,,
123hayhay,1396925275.0,,,t2_g155h,1425436363,self.Portland,https://www.reddit.com/r/Portland/comments/2xv21o/good_dive_bars_in_ne_or_se_for_a_friends_21st/,0,2xv21o,True,{},12,False,/r/Portland/comments/2xv21o/good_dive_bars_in_ne_or_se_for_a_friends_21st/,1440874184,0,{},"My friend's 21st birthday is tomorrow and he wants to stick mainly on the east side. Places like Roadside Attraction or BOG would be great, but honestly, as long as we can get drunk and enjoy some decent bar food, anything goes. Thanks!",False,Portland,t5_2qi2i,self,Good dive bars in NE or SE for a friend's 21st tomorrow?,http://www.reddit.com/r/Portland/comments/2xv21o/good_dive_bars_in_ne_or_se_for_a_friends_21st/,,,
maxoregonian,1397022581.0,,,t2_g1p96,1425435520,s.oregonlive.com,https://www.reddit.com/r/Portland/comments/2xv0cl/north_portland_high_school_student_i_live_north/,0,2xv0cl,False,{},0,False,/r/Portland/comments/2xv0cl/north_portland_high_school_student_i_live_north/,1440874206,1,{},,False,Portland,t5_2qi2i,default,North Portland high school student: 'I live north of Portlandia...the one you know nothing about',http://s.oregonlive.com/QqtA86i,,,
ThePrimCrow,1409893594.0,,,t2_i90fk,1425435079,self.Portland,https://www.reddit.com/r/Portland/comments/2xuze0/awesome_sunset_alert/,0,2xuze0,True,{},5,False,/r/Portland/comments/2xuze0/awesome_sunset_alert/,1440874219,0,{},Get off Reddit for a second and go look at it.,False,Portland,t5_2qi2i,self,Awesome sunset alert,http://www.reddit.com/r/Portland/comments/2xuze0/awesome_sunset_alert/,,,
portland_driver,1425428913.0,,,t2_luux7,1425434286,self.Portland,https://www.reddit.com/r/Portland/comments/2xuxqy/an_open_letter_to_the_driver_who_laid_of_their/,0,2xuxqy,True,{},0,False,/r/Portland/comments/2xuxqy/an_open_letter_to_the_driver_who_laid_of_their/,1440874240,1,{},,False,Portland,t5_2qi2i,default,An open letter to the driver who laid of their horn and tried to ram my vehicle at the intersection of T.V. Highway and Brookwood Parkway in Hillsboro.,http://www.reddit.com/r/Portland/comments/2xuxqy/an_open_letter_to_the_driver_who_laid_of_their/,,,
[deleted],,,,,1425432294,kgw.com,https://www.reddit.com/r/Portland/comments/2xutoc/police_thief_arrested_after_stealing_package_off/,0,2xutoc,False,{},0,False,/r/Portland/comments/2xutoc/police_thief_arrested_after_stealing_package_off/,1440874293,1,{},,False,Portland,t5_2qi2i,default,Police: Thief arrested after stealing package off porch,http://www.kgw.com/story/news/crime/2015/02/04/thief-caught-on-video/22895351/,,,
onionsman,1331769626.0,,,t2_769bm,1425431957,oregonzoo.org,https://www.reddit.com/r/Portland/comments/2xuszb/gus_the_sea_lion_passes_away_at_27_you_will/,0,2xuszb,False,{},30,False,/r/Portland/comments/2xuszb/gus_the_sea_lion_passes_away_at_27_you_will/,1440874302,378,{},,False,Portland,t5_2qi2i,http://a.thumbs.redditmedia.com/oyaI-VygjAoL43HxUaebbroQHuNOKwWvoFi87s1dDO0.jpg,Gus the Sea Lion passes away at 27. You will likely remember this photo of him with Lily the baby elephant. :(,http://www.oregonzoo.org/sites/default/files/styles/content/public/gallery/images/H_orig_elephant_glass_window_water_stellar_sea_lion_gal.jpg?itok=_QW3bIxb,,,
[deleted],,,,,1425430276,kgw.com,https://www.reddit.com/r/Portland/comments/2xupjj/east_portland_group_files_to_secede_from_city/,0,2xupjj,False,{},1,False,/r/Portland/comments/2xupjj/east_portland_group_files_to_secede_from_city/,1440874348,2,{},,False,Portland,t5_2qi2i,default,East Portland group files to secede from city,http://www.kgw.com/story/news/local/gresham/2015/03/03/portland-initiative-petition-secede-epno/24325867/,,,
jkpritchard,1307057756.0,,,t2_5bni2,1425430200,self.Portland,https://www.reddit.com/r/Portland/comments/2xupds/i_have_a_single_portland_timbers_season_ticket/,0,2xupds,True,{},0,False,/r/Portland/comments/2xupds/i_have_a_single_portland_timbers_season_ticket/,1440874349,1,{},,False,Portland,t5_2qi2i,default,I have a single Portland Timbers season ticket available for sale. Front row and field level.,http://www.reddit.com/r/Portland/comments/2xupds/i_have_a_single_portland_timbers_season_ticket/,,,
[deleted],,,,,1425430139,i.imgur.com,https://www.reddit.com/r/Portland/comments/2xup96/my_girlfriend_has_a_problem_with_people_smoking/,0,2xup96,False,{},24,False,/r/Portland/comments/2xup96/my_girlfriend_has_a_problem_with_people_smoking/,1440874350,0,{},,False,Portland,t5_2qi2i,default,My girlfriend has a problem with people smoking outside of her business. Where can she get one of these signs?,http://i.imgur.com/DMKZLkj.jpg,,,
Datalore45,,,,,1425427239,self.Portland,https://www.reddit.com/r/Portland/comments/2xujd9/quieres_hablar_conmigo/,0,2xujd9,True,{},15,False,/r/Portland/comments/2xujd9/quieres_hablar_conmigo/,1440874427,4,{},just looking for a companero/a para conversaciones I'm currently a Spanish student and would really love the opportunity to hang out with and learn from a native speaker please feel free to post with leads or pm me! nos vemos proximo!?,False,Portland,t5_2qi2i,self,Quieres Hablar Conmigo?,http://www.reddit.com/r/Portland/comments/2xujd9/quieres_hablar_conmigo/,,,
daidiru,1365568387.0,,,t2_b9g8p,1425426882,i.imgur.com,https://www.reddit.com/r/Portland/comments/2xuil1/found_dog_sw_terwilliger_area/,0,2xuil1,False,{},11,False,/r/Portland/comments/2xuil1/found_dog_sw_terwilliger_area/,1440874438,22,{},,False,Portland,t5_2qi2i,http://b.thumbs.redditmedia.com/sPfQXkpDX-8SHXzSxN0Qy_fYkNEn6lVWX1JGXNd-QzE.jpg,"Found dog, SW Terwilliger area.",http://i.imgur.com/8GQyfTt.jpg,,,
tbonenowison,1386305223.0,,SE,t2_e84nc,1425424497,thrillist.com,https://www.reddit.com/r/Portland/comments/2xuddm/16_reasons_why_portland_is_americas_best_beer_town/,0,2xuddm,False,{},0,False,/r/Portland/comments/2xuddm/16_reasons_why_portland_is_americas_best_beer_town/,1440874504,1,{},,False,Portland,t5_2qi2i,default,16 Reasons why Portland is America's best beer town,http://www.thrillist.com/drink/portland/portland-best-beer-city-in-america-thrillist-portland,,,
Puppyl0ve,,,,,1425424219,i.imgur.com,https://www.reddit.com/r/Portland/comments/2xucqm/dog_found_at_gabriel_park/,0,2xucqm,False,{},6,False,/r/Portland/comments/2xucqm/dog_found_at_gabriel_park/,1440874512,29,{},,False,Portland,t5_2qi2i,http://b.thumbs.redditmedia.com/OWCT_JY1YvYV9dVRXwhet97kgwnhYjFi4xyc-tX-CZc.jpg,Dog found at Gabriel Park,http://i.imgur.com/sCqTNR9.jpg,,,
