all_awardings,allow_live_comments,author,author_flair_css_class,author_flair_richtext,author_flair_text,author_flair_type,author_fullname,author_patreon_flair,author_premium,awarders,can_mod_post,contest_mode,created_utc,domain,full_link,gildings,id,is_crosspostable,is_meta,is_original_content,is_reddit_media_domain,is_robot_indexable,is_self,is_video,link_flair_background_color,link_flair_richtext,link_flair_text_color,link_flair_type,locked,media_only,no_follow,num_comments,num_crossposts,over_18,parent_whitelist_status,permalink,pinned,pwls,retrieved_on,score,selftext,send_replies,spoiler,steward_reports,stickied,subreddit,subreddit_id,subreddit_subscribers,subreddit_type,thumbnail,title,total_awards_received,url,whitelist_status,wls,author_flair_background_color,author_flair_text_color,link_flair_css_class,link_flair_text,post_hint,preview,thumbnail_height,thumbnail_width,removed_by_category,author_flair_template_id
[],False,El_Cartografo,,[],,text,t2_d7v7v,False,False,[],False,False,1577386146,opb.org,https://www.reddit.com/r/Portland/comments/efz7na/a_really_cool_episode_about_a_commonly_maligned/,{},efz7na,True,False,False,False,True,False,False,,[],dark,text,False,False,True,16,0,False,all_ads,/r/Portland/comments/efz7na/a_really_cool_episode_about_a_commonly_maligned/,False,6,1577386147,1,,True,False,[],False,Portland,t5_2qi2i,142739,public,default,A really cool episode about a commonly maligned section of the city: Sandy Boulevard. Think Out Loud OPB,0,https://www.opb.org/radio/programs/thinkoutloud/segment/rebroadcast-sandy-boulevard-on-the-road/,all_ads,6,,,,,,,,,,
[],False,guanaco55,,[],Regional Gallowboob,text,t2_hyfa9,False,False,[],False,False,1577383861,opb.org,https://www.reddit.com/r/Portland/comments/efyq61/oregon_conservation_group_collects_christmas/,{},efyq61,True,False,False,False,True,False,False,,[],dark,text,False,False,True,57,0,False,all_ads,/r/Portland/comments/efyq61/oregon_conservation_group_collects_christmas/,False,6,1577383862,1,,True,False,[],False,Portland,t5_2qi2i,142739,public,default,Oregon Conservation Group Collects Christmas Trees For Salmon Habitat,0,https://www.opb.org/news/article/oregon-salmon-habitat-christmas-trees-collection-trout-unlimited-clackamas-tualatin/,all_ads,6,,dark,,,,,,,,
[],False,drewbiedoo1296,,[],,text,t2_2ucd740g,False,False,[],False,False,1577383318,self.Portland,https://www.reddit.com/r/Portland/comments/efylv5/im_looking_for_a_tattoo_artist/,{},efylv5,True,False,False,False,True,True,False,,[],dark,text,False,False,True,12,0,False,all_ads,/r/Portland/comments/efylv5/im_looking_for_a_tattoo_artist/,False,6,1577383320,1,I'm hoping for any suggestions for an artist in or near portland that is skilled in art replication! Looking to do a peice combining a hyper real painting with a surreal one!and suggestions of artists or shops would be awesome.,True,False,[],False,Portland,t5_2qi2i,142739,public,self,I'm looking for a tattoo artist!,0,https://www.reddit.com/r/Portland/comments/efylv5/im_looking_for_a_tattoo_artist/,all_ads,6,,,,,,,,,,
[],False,Hooverville128,,[],,text,t2_4vly3q2x,False,False,[],False,False,1577382706,self.Portland,https://www.reddit.com/r/Portland/comments/efyh5t/are_there_any_doctors_in_the_west_portland_metro/,{},efyh5t,True,False,False,False,True,True,False,,[],dark,text,False,False,True,8,0,False,all_ads,/r/Portland/comments/efyh5t/are_there_any_doctors_in_the_west_portland_metro/,False,6,1577382709,1,"I do not know if these types of posts are allowed, so if they are not I am sorry. 

I can meet anywhere and anytime, and if you are open to me shadowing you once I turn 18 in two months I more than look forward to observing then. I am looking for a longer term relationship, but I will take anything. Please pm me, I have a CV if wanted to look over and we can talk over the phone before anything as well!",True,False,[],False,Portland,t5_2qi2i,142739,public,self,Are there any doctors in the west portland metro area willing to let me (17M) shadow them?,0,https://www.reddit.com/r/Portland/comments/efyh5t/are_there_any_doctors_in_the_west_portland_metro/,all_ads,6,,,,,,,,,,
[],False,GrimeMachine,,[],,text,t2_6vesj,False,False,[],False,False,1577381260,self.Portland,https://www.reddit.com/r/Portland/comments/efy61b/why_are_cars_so_expensive_out_here/,{},efy61b,True,False,False,False,True,True,False,,[],dark,text,False,False,True,54,0,False,all_ads,/r/Portland/comments/efy61b/why_are_cars_so_expensive_out_here/,False,6,1577381261,1,"I've been in Portland for about a month and a half. I left my car for my mother when I moved out here from the East Coast - her car pooed itself unexpectedly, so I wanted her to have reliable transportation. 

I've been looking to buy a replacement for myself, but I've found it to be a little ridiculous. Every 3rd car is a salvage/rebuilt title, and clean titled examples of cars I'm looking at are easily $3000+ more than in other markets. For example, a 2010 Lexus with ~150k miles sells for about $4000 more in the Portland area than even 200 miles away. 

When I do end up finding a car that's a good price, I end up being extremely weary of getting scammed. Does everyone here just make the concession and pay far more than cars are worth out here?

And just to clarify, I'm looking at both dealers and private sellers. I'm looking at used cars around $8-$15k; I was initially considering buying new/CPO (in the $15k-$25k range), but again cars seem to be more expensive here all-around.",True,False,[],False,Portland,t5_2qi2i,142737,public,self,Why are cars so expensive out here?,0,https://www.reddit.com/r/Portland/comments/efy61b/why_are_cars_so_expensive_out_here/,all_ads,6,,,,,,,,,,
[],False,73233,,[],,text,t2_4bkd147o,False,False,[],False,False,1577378547,wweek.com,https://www.reddit.com/r/Portland/comments/efxldd/new_polling_suggests_anticamping_laws_are_not_a/,{},efxldd,True,False,False,False,True,False,False,,[],dark,text,False,False,True,60,0,False,all_ads,/r/Portland/comments/efxldd/new_polling_suggests_anticamping_laws_are_not_a/,False,6,1577378550,1,,False,False,[],False,Portland,t5_2qi2i,142735,public,https://b.thumbs.redditmedia.com/Ttqy-ZAnVSZ-qCGzdwCfdav1Qv96eYmmbAcosCdQoDE.jpg,New Polling Suggests Anti-Camping Laws Are Not a Popular Way to Address Homelessness in Portland,0,https://www.wweek.com/news/city/2019/12/25/new-polling-suggests-anti-camping-laws-are-not-a-popular-way-to-address-homelessness-in-portland/,all_ads,6,,,local-news,Local News,link,"{'enabled': False, 'images': [{'id': 'bqIsewXfuwDiU6CFA76vpOUD7lP4h6Pe-0zhHV7VgJU', 'resolutions': [{'height': 72, 'url': 'https://external-preview.redd.it/GG_WtVzcCMcWRjxspGjGFP2PHArWFD060XxE7J4zAfQ.jpg?width=108&amp;crop=smart&amp;auto=webp&amp;s=9aed76a16d61aff14894cb99982f524c31d773da', 'width': 108}, {'height': 144, 'url': 'https://external-preview.redd.it/GG_WtVzcCMcWRjxspGjGFP2PHArWFD060XxE7J4zAfQ.jpg?width=216&amp;crop=smart&amp;auto=webp&amp;s=37798f185329ccfebe00b6ad511c5657dae78ac5', 'width': 216}, {'height': 213, 'url': 'https://external-preview.redd.it/GG_WtVzcCMcWRjxspGjGFP2PHArWFD060XxE7J4zAfQ.jpg?width=320&amp;crop=smart&amp;auto=webp&amp;s=bddfec9f5cd3cf0635ed8ce9f140e4cc6b253d89', 'width': 320}, {'height': 426, 'url': 'https://external-preview.redd.it/GG_WtVzcCMcWRjxspGjGFP2PHArWFD060XxE7J4zAfQ.jpg?width=640&amp;crop=smart&amp;auto=webp&amp;s=e67224b35bf3e9a7aa571513aa5558852cbcdd81', 'width': 640}, {'height': 640, 'url': 'https://external-preview.redd.it/GG_WtVzcCMcWRjxspGjGFP2PHArWFD060XxE7J4zAfQ.jpg?width=960&amp;crop=smart&amp;auto=webp&amp;s=c6b923d3b31eb5043be388a80501111f1af5c333', 'width': 960}, {'height': 720, 'url': 'https://external-preview.redd.it/GG_WtVzcCMcWRjxspGjGFP2PHArWFD060XxE7J4zAfQ.jpg?width=1080&amp;crop=smart&amp;auto=webp&amp;s=7a812e500cbd3efdf09de432ad3905bfd01795d8', 'width': 1080}], 'source': {'height': 800, 'url': 'https://external-preview.redd.it/GG_WtVzcCMcWRjxspGjGFP2PHArWFD060XxE7J4zAfQ.jpg?auto=webp&amp;s=bd5b9da7cf30c5e94301f635e7773eb3008d132b', 'width': 1200}, 'variants': {}}]}",93.0,140.0,,
[],False,GreasyBender,,[],,text,t2_52deolog,False,False,[],False,False,1577373891,oregonlive.com,https://www.reddit.com/r/Portland/comments/efwn42/death_on_a_portland_beach_what_led_to_an_attack/,{},efwn42,True,False,False,False,True,False,False,,[],dark,text,False,False,True,78,0,False,all_ads,/r/Portland/comments/efwn42/death_on_a_portland_beach_what_led_to_an_attack/,False,6,1577373892,1,,True,False,[],False,Portland,t5_2qi2i,142730,public,default,"Death on a Portland beach: What led to an attack on a young father, what losses followed",0,https://www.oregonlive.com/news/2019/12/death-on-a-portland-beach-what-led-to-an-attack-on-a-young-father-what-losses-followed.html,all_ads,6,,,,,,,,,,
[],False,Chespy007,,[],,text,t2_wqnij,False,False,[],False,False,1577349463,self.Portland,https://www.reddit.com/r/Portland/comments/eft326/visiting_portland_for_the_first_time_on_my_own/,{},eft326,False,False,False,False,False,True,False,,[],dark,text,False,False,True,1,0,False,all_ads,/r/Portland/comments/eft326/visiting_portland_for_the_first_time_on_my_own/,False,6,1577349464,1,[removed],True,False,[],False,Portland,t5_2qi2i,142725,public,self,Visiting Portland for the first time on my own with no acquiescence in the city. Any tips on what to do?,0,https://www.reddit.com/r/Portland/comments/eft326/visiting_portland_for_the_first_time_on_my_own/,all_ads,6,,,,,,,,,moderator,
[],False,MichaelTen,,[],,text,t2_884o7,False,False,[],False,False,1577346388,oregonlive.com,https://www.reddit.com/r/Portland/comments/efsnsf/portland_police_look_for_new_agency_to_provide/,{},efsnsf,True,False,False,False,True,False,False,,[],dark,text,False,False,True,35,0,False,all_ads,/r/Portland/comments/efsnsf/portland_police_look_for_new_agency_to_provide/,False,6,1577346389,1,,False,False,[],False,Portland,t5_2qi2i,142722,public,default,"Portland police look for new agency to provide roving van, sobering center for people intoxicated or on drugs",0,https://www.oregonlive.com/crime/2019/12/portland-police-look-for-new-agency-to-provide-roving-van-sobering-center-for-people-intoxicated-or-on-drugs.html,all_ads,6,,,,,,,,,,
[],False,ohhhhhhyesssss,,[],,text,t2_2xlvi41l,False,False,[],False,False,1577342493,self.Portland,https://www.reddit.com/r/Portland/comments/efs2pn/what_to_do_in_town_as_16_year_old/,{},efs2pn,True,False,False,False,True,True,False,,[],dark,text,False,False,True,5,0,False,all_ads,/r/Portland/comments/efs2pn/what_to_do_in_town_as_16_year_old/,False,6,1577342495,1,"So I’m visiting my brother in Hillsboro tomorrow thru Saturday. He lives right along a max line and have Friday open to explore Portland (MAX is the transportation I have). I’m 16, like nature, weather, but am open to anything. What should I do for the day that is decently cheap/free? Thanks guys!",True,False,[],False,Portland,t5_2qi2i,142719,public,self,What to do in town as 16 year old.....,0,https://www.reddit.com/r/Portland/comments/efs2pn/what_to_do_in_town_as_16_year_old/,all_ads,6,,,,,,,,,,
[],False,Aturom,,[],,text,t2_pm58y,False,True,[],False,False,1577339405,self.Portland,https://www.reddit.com/r/Portland/comments/efrls8/what_are_your_plans_for_new_years_eve/,{},efrls8,True,False,False,False,True,True,False,,[],dark,text,False,False,True,24,0,False,all_ads,/r/Portland/comments/efrls8/what_are_your_plans_for_new_years_eve/,False,6,1577339407,1,,True,False,[],False,Portland,t5_2qi2i,142714,public,self,What are your plans for New Year's Eve?,0,https://www.reddit.com/r/Portland/comments/efrls8/what_are_your_plans_for_new_years_eve/,all_ads,6,,,,,,,,,,
[],False,ThatModestHouseplant,,[],,text,t2_fv8mq,False,False,[],False,False,1577333839,self.Portland,https://www.reddit.com/r/Portland/comments/efqnsv/does_anyone_want_to_start_card_game_group_for/,{},efqnsv,True,False,False,False,True,True,False,,[],dark,text,False,False,True,0,0,False,all_ads,/r/Portland/comments/efqnsv/does_anyone_want_to_start_card_game_group_for/,False,6,1577333840,1,"I know that's a is a Longshot but if anyone is familiar or wants to learn the card game French tarot (aka jeu de tarot) I would love to start a tarot group. Just to be clear this is NOT the fortune telling activity. I find that almost nobody is familiar with the game in the US. 

Here is the best English tutorial that I could find. 
https://youtu.be/zo9pLf5Mai4",True,False,[],False,Portland,t5_2qi2i,142704,public,self,Does anyone want to start card game group for French tarot (jeu de tarot),0,https://www.reddit.com/r/Portland/comments/efqnsv/does_anyone_want_to_start_card_game_group_for/,all_ads,6,,,,,,,,,,
[],False,Superfree007,,[],,text,t2_9d7v0,False,False,[],False,False,1577324053,self.Portland,https://www.reddit.com/r/Portland/comments/efowjg/competitive_basketball_runs_in_portlandbeaverton/,{},efowjg,True,False,False,False,True,True,False,,[],dark,text,False,False,True,2,0,False,all_ads,/r/Portland/comments/efowjg/competitive_basketball_runs_in_portlandbeaverton/,False,6,1577324054,1,I'm looking for some places to play basketball in the Portland/Beaverton area that are reliably active and competitive.,True,False,[],False,Portland,t5_2qi2i,142692,public,self,Competitive basketball runs in Portland/Beaverton?,0,https://www.reddit.com/r/Portland/comments/efowjg/competitive_basketball_runs_in_portlandbeaverton/,all_ads,6,,,,,,,,,,
[],False,woofers02,,[],Foster-Powell,text,t2_4az8l,False,True,[],False,False,1577323723,i.redd.it,https://www.reddit.com/r/Portland/comments/efouaf/tabor_with_a_last_minute_christmas_gift/,{},efouaf,True,False,False,True,True,False,False,,[],dark,text,False,False,True,5,0,False,all_ads,/r/Portland/comments/efouaf/tabor_with_a_last_minute_christmas_gift/,False,6,1577323724,1,,True,False,[],False,Portland,t5_2qi2i,142692,public,default,Tabor with a last minute Christmas gift.,0,https://i.redd.it/m3wggtfqrv641.jpg,all_ads,6,,dark,photo,Photo,,,,,,81647324-4276-11e1-946d-12313b08a511
[],False,jonathanjrouse,,[],,text,t2_3yrz4,False,False,[],False,False,1577323253,self.Portland,https://www.reddit.com/r/Portland/comments/efor74/sledding/,{},efor74,True,False,False,False,True,True,False,,[],dark,text,False,False,True,6,0,False,all_ads,/r/Portland/comments/efor74/sledding/,False,6,1577323255,1,"So, it's not snowing in the city, but outside the city at higher elevations it is. I'm wondering if anyone knows of any simple hillsides (not, say, the Ski Bowl @ Mt Hood or Cooper Spur) in snowy areas that I could just drive to, pull over &amp; slide down w/my kids. Is such a thing too good to be true?",True,False,[],False,Portland,t5_2qi2i,142693,public,self,Sledding,0,https://www.reddit.com/r/Portland/comments/efor74/sledding/,all_ads,6,,,,,,,,,,
[],False,Noahboi1234,,[],,text,t2_3kc4qym0,False,False,[],False,False,1577323234,self.Portland,https://www.reddit.com/r/Portland/comments/efor2r/upvote_this_plz/,{},efor2r,True,False,False,False,True,True,False,,[],dark,text,False,False,True,2,0,False,all_ads,/r/Portland/comments/efor2r/upvote_this_plz/,False,6,1577323235,1,8======D,True,False,[],False,Portland,t5_2qi2i,142693,public,self,Upvote this plz,0,https://www.reddit.com/r/Portland/comments/efor2r/upvote_this_plz/,all_ads,6,,,,,,,,,,
[],False,pdx_throwitaway,,[],,text,t2_4cs99luf,False,False,[],False,False,1577322992,i.redd.it,https://www.reddit.com/r/Portland/comments/efopgt/l_y_f_t/,{},efopgt,True,False,False,True,True,False,False,,[],dark,text,False,False,True,9,0,False,all_ads,/r/Portland/comments/efopgt/l_y_f_t/,False,6,1577322993,1,,True,False,[],False,Portland,t5_2qi2i,142693,public,https://a.thumbs.redditmedia.com/sPQJqZVvV9l9Mndud0TxBUo886VLNyjEPFcFNYwGKK4.jpg,L Y F T !,0,https://i.redd.it/g5uyomsjpv641.jpg,all_ads,6,,,,,image,"{'enabled': True, 'images': [{'id': '5WEN1-mO-v5YWetIVns1AXjR6s0M4PfpO6YSz7TlLm4', 'resolutions': [{'height': 81, 'url': 'https://preview.redd.it/g5uyomsjpv641.jpg?width=108&amp;crop=smart&amp;auto=webp&amp;s=c06ca8c1acf56d2d97b9efa845a94b76356216ba', 'width': 108}, {'height': 162, 'url': 'https://preview.redd.it/g5uyomsjpv641.jpg?width=216&amp;crop=smart&amp;auto=webp&amp;s=125e6e6c45e0db36f87086f6e073b8a58fa9ee37', 'width': 216}, {'height': 240, 'url': 'https://preview.redd.it/g5uyomsjpv641.jpg?width=320&amp;crop=smart&amp;auto=webp&amp;s=805939fb077c0a14f7b21e108e70a3b5c23cb198', 'width': 320}, {'height': 480, 'url': 'https://preview.redd.it/g5uyomsjpv641.jpg?width=640&amp;crop=smart&amp;auto=webp&amp;s=25b4b59a6a7c64fbcd6d77dc309d3c0f2590c873', 'width': 640}], 'source': {'height': 600, 'url': 'https://preview.redd.it/g5uyomsjpv641.jpg?auto=webp&amp;s=2e6e043ead9a50d66c383a0c7900710a6b127454', 'width': 800}, 'variants': {}}]}",105.0,140.0,,
[],False,herodotuslovescats,,[],,text,t2_5a5ksv09,False,False,[],False,False,1577319792,/r/Portland/comments/efo3xf/25_sec_of_christmas_murder_willamette_park/,https://www.reddit.com/r/Portland/comments/efo3xf/25_sec_of_christmas_murder_willamette_park/,{},efo3xf,True,False,False,False,True,False,True,,[],dark,text,False,False,True,0,0,False,all_ads,/r/Portland/comments/efo3xf/25_sec_of_christmas_murder_willamette_park/,False,6,1577319794,1,,True,False,[],False,Portland,t5_2qi2i,142693,public,default,25 sec of Christmas Murder (willamette park),0,https://v.redd.it/x62qulvrfv641,all_ads,6,,,,,,,,,,
[],False,doclsd,,[],SE,text,t2_2ye4ro1d,False,True,[],False,False,1577319769,i.redd.it,https://www.reddit.com/r/Portland/comments/efo3rs/all_justin_all_the_time/,{},efo3rs,True,False,False,True,True,False,False,,[],dark,text,False,False,True,8,0,False,all_ads,/r/Portland/comments/efo3rs/all_justin_all_the_time/,False,6,1577319770,1,,True,False,[],False,Portland,t5_2qi2i,142693,public,default,"All Justin, all the time",0,https://i.redd.it/awmjm63zfv641.jpg,all_ads,6,,dark,,,,,,,,065fa756-4254-11e1-92dd-12313d096aae
[],False,KiyoLTE,,[],,text,t2_u0yok,False,False,[],False,False,1577318434,self.Portland,https://www.reddit.com/r/Portland/comments/efnuy3/church_with_weekday_service_in_the_area/,{},efnuy3,True,False,False,False,True,True,False,,[],dark,text,False,False,True,3,0,False,all_ads,/r/Portland/comments/efnuy3/church_with_weekday_service_in_the_area/,False,6,1577318437,1,"I moved to Portland recently and work on the weekends. I was wondering if anyone knew of any churches with weekday services. I tried looking for one online and could only find one which seemed very  traditional and old school (not my type). I know Portland isn’t the most religious city, but if anyone has any recommendations I’d really appreciate it. Thanks in advance.",True,False,[],False,Portland,t5_2qi2i,142693,public,self,Church with weekday service in the area?,0,https://www.reddit.com/r/Portland/comments/efnuy3/church_with_weekday_service_in_the_area/,all_ads,6,,,,,,,,,,
[],False,3fjn3t,,[],Ardenwald,text,t2_ddlrb,False,True,[],False,False,1577317813,self.Portland,https://www.reddit.com/r/Portland/comments/efnqrf/christmas_gold_giveaway/,{},efnqrf,True,False,False,False,True,True,False,,[],dark,text,False,False,True,24,0,False,all_ads,/r/Portland/comments/efnqrf/christmas_gold_giveaway/,False,6,1577317814,1,Merry Christmas!!,True,False,[],False,Portland,t5_2qi2i,142693,public,self,Christmas Gold Giveaway,0,https://www.reddit.com/r/Portland/comments/efnqrf/christmas_gold_giveaway/,all_ads,6,,dark,,,,,,,,
[],False,pdx_throwitaway,,[],,text,t2_4cs99luf,False,False,[],False,False,1577317343,imgur.com,https://www.reddit.com/r/Portland/comments/efnnhi/sick_tent_and_rv_camp_spot_street_by_664_n/,{},efnnhi,True,False,False,False,True,False,False,,[],dark,text,False,False,True,2,0,False,all_ads,/r/Portland/comments/efnnhi/sick_tent_and_rv_camp_spot_street_by_664_n/,False,6,1577317347,1,,True,False,[],False,Portland,t5_2qi2i,142693,public,https://b.thumbs.redditmedia.com/sY7VyOclP-IOQ0cUejkpre8lD1WJE4tBMGkMru_BX_o.jpg,Sick tent and RV camp spot: street by 664 N Tillamook St. Fast Internet and it only bugs City of Portland workers.,0,https://imgur.com/a/npIdWm4,all_ads,6,,,photo,Photo,link,"{'enabled': False, 'images': [{'id': 'tVC2xiY9vhLklgX7JLSVMyp2kxsFEBlgU5LAVzUoh_k', 'resolutions': [{'height': 81, 'url': 'https://external-preview.redd.it/MwzEhhwnKBZxaS8no9UdXv4jiAYPVZrPEASZnb4sxP4.jpg?width=108&amp;crop=smart&amp;auto=webp&amp;s=6f3ed05e4a1dfb1e76098eefb14061c9795cb576', 'width': 108}, {'height': 162, 'url': 'https://external-preview.redd.it/MwzEhhwnKBZxaS8no9UdXv4jiAYPVZrPEASZnb4sxP4.jpg?width=216&amp;crop=smart&amp;auto=webp&amp;s=a2a0bd53182a96b901cf5e4a9670db324f76d44e', 'width': 216}, {'height': 240, 'url': 'https://external-preview.redd.it/MwzEhhwnKBZxaS8no9UdXv4jiAYPVZrPEASZnb4sxP4.jpg?width=320&amp;crop=smart&amp;auto=webp&amp;s=acb0ea6f6aaf778ce7b1a0c9019b819c1e163a59', 'width': 320}, {'height': 480, 'url': 'https://external-preview.redd.it/MwzEhhwnKBZxaS8no9UdXv4jiAYPVZrPEASZnb4sxP4.jpg?width=640&amp;crop=smart&amp;auto=webp&amp;s=7352d43559b5a19e7d20b6a611efd3871f36dc22', 'width': 640}], 'source': {'height': 600, 'url': 'https://external-preview.redd.it/MwzEhhwnKBZxaS8no9UdXv4jiAYPVZrPEASZnb4sxP4.jpg?auto=webp&amp;s=feaaee8894cb09a4a1623820558e15e4815ff855', 'width': 800}, 'variants': {}}]}",105.0,140.0,,
[],False,DrCMcMeth,,[],,text,t2_iw1h64x,False,False,[],False,False,1577313642,imgur.com,https://www.reddit.com/r/Portland/comments/efmxi2/because_it_belongs_in_a_museum/,{},efmxi2,True,False,False,False,True,False,False,,[],dark,text,False,False,True,6,0,False,all_ads,/r/Portland/comments/efmxi2/because_it_belongs_in_a_museum/,False,6,1577313643,1,,False,False,[],False,Portland,t5_2qi2i,142688,public,default,Because it belongs in a Museum.,0,https://imgur.com/a/ZH8E4vg,all_ads,6,,,,,,,,,,
[],False,BigOleBobbie,,[],,text,t2_332gx20r,False,False,[],False,False,1577311543,self.Portland,https://www.reddit.com/r/Portland/comments/efmizh/driving_with_foglights_on/,{},efmizh,True,False,False,False,True,True,False,,[],dark,text,False,False,True,28,0,False,all_ads,/r/Portland/comments/efmizh/driving_with_foglights_on/,False,6,1577311545,1,"When it's not foggy?

WHY?

It just blinds oncoming traffic, and is irritating as fuck when you are behind me or coming up beside me!",True,False,[],False,Portland,t5_2qi2i,142685,public,self,Driving with FOGLIGHTS ON?,0,https://www.reddit.com/r/Portland/comments/efmizh/driving_with_foglights_on/,all_ads,6,,,,,,,,,,
[],False,sings-to-cats,,[],,text,t2_3yvapvs0,False,False,[],False,False,1577308662,i.redd.it,https://www.reddit.com/r/Portland/comments/eflyf2/missing_cat_missing_since_feb_her_dads_been/,{},eflyf2,True,False,False,True,True,False,False,,[],dark,text,False,False,True,35,0,False,all_ads,/r/Portland/comments/eflyf2/missing_cat_missing_since_feb_her_dads_been/,False,6,1577308664,1,,True,False,[],False,Portland,t5_2qi2i,142685,public,default,"Missing Cat: missing since Feb., her dad's been searching for her, please contact me!",0,https://i.redd.it/qr1maudyiu641.jpg,all_ads,6,,,,,,,,,,
[],False,lootgoblin69,,[],,text,t2_qmdyz,False,False,[],False,False,1577307949,self.Portland,https://www.reddit.com/r/Portland/comments/eflt7h/dispensarys_open_on_christmas/,{},eflt7h,True,False,False,False,True,True,False,,[],dark,text,False,False,True,6,0,False,all_ads,/r/Portland/comments/eflt7h/dispensarys_open_on_christmas/,False,6,1577307950,1,Does anyone know of any dispensary’s that are open today in Portland city?,True,False,[],False,Portland,t5_2qi2i,142685,public,self,Dispensary’s open on Christmas?,0,https://www.reddit.com/r/Portland/comments/eflt7h/dispensarys_open_on_christmas/,all_ads,6,,,,,,,,,,
[],False,PHIA47,,[],,text,t2_2m0085gu,False,False,[],False,False,1577305882,imgur.com,https://www.reddit.com/r/Portland/comments/efle83/doggo_found_on_sunnyside/,{},efle83,True,False,False,False,True,False,False,,[],dark,text,False,False,True,6,0,False,all_ads,/r/Portland/comments/efle83/doggo_found_on_sunnyside/,False,6,1577305883,1,,True,False,[],False,Portland,t5_2qi2i,142682,public,default,Doggo found on sunnyside,0,https://imgur.com/5oi7yYU,all_ads,6,,,photo,Photo,,,,,,
[],False,Wormwood666,,[],,text,t2_angnvqt,False,False,[],False,False,1577305072,i.redd.it,https://www.reddit.com/r/Portland/comments/efl8ax/santa_portlandor_2005/,{},efl8ax,True,False,False,True,True,False,False,,[],dark,text,False,False,True,4,0,False,all_ads,/r/Portland/comments/efl8ax/santa_portlandor_2005/,False,6,1577305073,1,,True,False,[],False,Portland,t5_2qi2i,142680,public,default,"Santa~ Portland,OR 2005",0,https://i.redd.it/cy2w6dw58u641.jpg,all_ads,6,,,,,,,,,,
[],False,megomarko,,[],,text,t2_l1dji,False,False,[],False,False,1577304958,imgur.com,https://www.reddit.com/r/Portland/comments/efl7h2/dog_found_152_and_sunnyside/,{},efl7h2,True,False,False,False,True,False,False,,[],dark,text,False,False,True,8,0,False,all_ads,/r/Portland/comments/efl7h2/dog_found_152_and_sunnyside/,False,6,1577304959,1,,True,False,[],False,Portland,t5_2qi2i,142680,public,default,Dog found 152 and sunnyside,0,https://imgur.com/s07o5wK,all_ads,6,,,,,,,,,,
[],False,Reasonnottreason,,[],,text,t2_399aufcg,False,False,[],False,False,1577304091,self.Portland,https://www.reddit.com/r/Portland/comments/efl108/any_west_side_grocery_stores_open_today/,{},efl108,True,False,False,False,True,True,False,,[],dark,text,False,False,True,2,0,False,all_ads,/r/Portland/comments/efl108/any_west_side_grocery_stores_open_today/,False,6,1577304092,1,,True,False,[],False,Portland,t5_2qi2i,142680,public,self,Any west side grocery stores open today?,0,https://www.reddit.com/r/Portland/comments/efl108/any_west_side_grocery_stores_open_today/,all_ads,6,,,,,,,,,,
