all_awardings,allow_live_comments,author,author_flair_css_class,author_flair_richtext,author_flair_text,author_flair_type,author_fullname,author_patreon_flair,author_premium,awarders,can_mod_post,contest_mode,created_utc,domain,full_link,gildings,id,is_crosspostable,is_meta,is_original_content,is_reddit_media_domain,is_robot_indexable,is_self,is_video,link_flair_background_color,link_flair_richtext,link_flair_text_color,link_flair_type,locked,media_only,no_follow,num_comments,num_crossposts,over_18,parent_whitelist_status,permalink,pinned,post_hint,preview,pwls,retrieved_on,score,selftext,send_replies,spoiler,stickied,subreddit,subreddit_id,subreddit_subscribers,subreddit_type,suggested_sort,thumbnail,title,total_awards_received,treatment_tags,upvote_ratio,url,whitelist_status,wls,author_flair_background_color,author_flair_text_color,distinguished,link_flair_css_class,link_flair_text,thumbnail_height,thumbnail_width,url_overridden_by_dest,author_flair_template_id,gallery_data,is_gallery,media_metadata,media,media_embed,secure_media,secure_media_embed,author_cakeday,removed_by_category
[],False,PNWfarmboy,,[],,text,t2_2nn9jwsg,False,False,[],False,False,1601916661,self.Portland,https://www.reddit.com/r/Portland/comments/j5n0nv/update_on_the_irving_park_attempted_arrest_on/,{},j5n0nv,True,False,False,False,True,True,False,,[],dark,text,False,False,True,61,0,False,all_ads,/r/Portland/comments/j5n0nv/update_on_the_irving_park_attempted_arrest_on/,False,self,"{'enabled': False, 'images': [{'id': 's7rVk_77WH1z06NJ2pARa2wKl6QHPDif9Rxoi7k1e_I', 'resolutions': [{'height': 108, 'url': 'https://external-preview.redd.it/q8_O_mCz3AGqEMDuMc5lzlD2ODOjt5D6N9k_xNJONJ0.jpg?width=108&amp;crop=smart&amp;auto=webp&amp;s=dceabde5e07a82a409877c9f92d4de3b0525cf46', 'width': 108}], 'source': {'height': 140, 'url': 'https://external-preview.redd.it/q8_O_mCz3AGqEMDuMc5lzlD2ODOjt5D6N9k_xNJONJ0.jpg?auto=webp&amp;s=a398767502b01425d3190b4da2dee9af9f9551bc', 'width': 140}, 'variants': {}}]}",6,1601916672,1,"So two people attempted to arrest a protesters at an art therapy event in Irving park. During the incident people blocked and chased off the 2 men attempting the arrest. They called an ""uber"" which had a driver and a passenger with a walkie talkie pick them up. At no point did the ""officers"" identified themselves or show badges. 

On Sunday 10/3 the protester was actually arrested on unknown charges but booked under a Marshals' hold. Due to the unorthodox nature of the attempted arrest people have been speculating that it was ""Proud Boy"" vigilantes. 

It is very concerning that the Marshals are acting like secret police.

[Source ](https://twitter.com/alex_zee/status/1313117554362048514) with most of the info",True,False,False,Portland,t5_2qi2i,177695,public,confidence,self,Update on the Irving Park attempted arrest on Saturday 10/2,0,[],1.0,https://www.reddit.com/r/Portland/comments/j5n0nv/update_on_the_irving_park_attempted_arrest_on/,all_ads,6,,,,,,,,,,,,,,,,,,
[],False,Accomplished-Sleep84,,[],,text,t2_76pl6qz1,False,False,[],False,False,1601915270,self.Portland,https://www.reddit.com/r/Portland/comments/j5mkm6/are_schools_reopening/,{},j5mkm6,True,False,False,False,True,True,False,,[],dark,text,False,False,True,11,0,False,all_ads,/r/Portland/comments/j5mkm6/are_schools_reopening/,False,,,6,1601915281,1,I vaguely remember that PPS was going to announce on October 5 (today) about what kind of changes we can expect after November 5th.  Can anybody confirm?,True,False,False,Portland,t5_2qi2i,177693,public,confidence,self,Are schools reopening?,0,[],1.0,https://www.reddit.com/r/Portland/comments/j5mkm6/are_schools_reopening/,all_ads,6,,,,,,,,,,,,,,,,,,
[],False,sexual_cheeto,,[],,text,t2_i7zd30l,False,False,[],False,False,1601911895,self.Portland,https://www.reddit.com/r/Portland/comments/j5li0r/corbett_fish_house_closed/,{},j5li0r,True,False,False,False,True,True,False,,[],dark,text,False,False,True,31,0,False,all_ads,/r/Portland/comments/j5li0r/corbett_fish_house_closed/,False,,,6,1601911906,1,"I was thinking of stopping by today for takeout but saw it was reported “permanently closed” on Yelp? Is this true?? If it is, does anyone know copycat recipes for their fried fish and the crab pepper cheese soup so I can have a memorial dinner for the restaurant? 😅",True,False,False,Portland,t5_2qi2i,177688,public,confidence,self,Corbett Fish House closed??,0,[],1.0,https://www.reddit.com/r/Portland/comments/j5li0r/corbett_fish_house_closed/,all_ads,6,,,,,,,,,,,,,,,,,,
[],False,AutoModerator,,[],🌅,text,t2_6l4z3,False,True,[],False,False,1601906881,self.Portland,https://www.reddit.com/r/Portland/comments/j5k12l/dear_portland_october_05_2020_weekly_rant_thread/,{},j5k12l,True,False,False,False,True,True,False,,[],dark,text,False,False,True,129,0,False,all_ads,/r/Portland/comments/j5k12l/dear_portland_october_05_2020_weekly_rant_thread/,False,,,6,1601906891,1,"GREETINGS MEATBAGS. PLEASE TELL ME YOUR MISFORTUNES SO I CAN LAUGH AT THEM. 

Caps on, inhibitions off, but if you break our rules so help me I'll delete my account. And yours.",False,False,True,Portland,t5_2qi2i,177688,public,confidence,self,"DEAR PORTLAND: October 05, 2020 WEEKLY RANT THREAD",0,[],1.0,https://www.reddit.com/r/Portland/comments/j5k12l/dear_portland_october_05_2020_weekly_rant_thread/,all_ads,6,,dark,moderator,custom,Weekly Rant,,,,,,,,,,,,,
[],False,guanaco55,,[],Regional Gallowboob,text,t2_hyfa9,False,True,[],False,False,1601893652,wweek.com,https://www.reddit.com/r/Portland/comments/j5gz3x/one_of_the_regions_largest_employers_seeks/,{},j5gz3x,True,False,False,False,True,False,False,,[],dark,text,False,False,True,33,0,False,all_ads,/r/Portland/comments/j5gz3x/one_of_the_regions_largest_employers_seeks/,False,link,"{'enabled': False, 'images': [{'id': 'v44G4o2FqfbtPrmSiKZWZIvB_gQxq3N1ghQSHHJsqWg', 'resolutions': [{'height': 72, 'url': 'https://external-preview.redd.it/QQ75o_IVgkrZmMTAOx74O8gK5dSq-HczSBB3dpqDPeQ.jpg?width=108&amp;crop=smart&amp;auto=webp&amp;s=630ff4cbc29195422d73ef580762701ea3af1b9f', 'width': 108}, {'height': 144, 'url': 'https://external-preview.redd.it/QQ75o_IVgkrZmMTAOx74O8gK5dSq-HczSBB3dpqDPeQ.jpg?width=216&amp;crop=smart&amp;auto=webp&amp;s=f6d847dc284d26e7cfb20231fd8bf9df3b9b30aa', 'width': 216}, {'height': 213, 'url': 'https://external-preview.redd.it/QQ75o_IVgkrZmMTAOx74O8gK5dSq-HczSBB3dpqDPeQ.jpg?width=320&amp;crop=smart&amp;auto=webp&amp;s=c872c1e0bba92e015bd0b465f02691cafe956d7a', 'width': 320}, {'height': 426, 'url': 'https://external-preview.redd.it/QQ75o_IVgkrZmMTAOx74O8gK5dSq-HczSBB3dpqDPeQ.jpg?width=640&amp;crop=smart&amp;auto=webp&amp;s=9c528ce376b51fde00d2d053e15fc97dfa8603f7', 'width': 640}, {'height': 640, 'url': 'https://external-preview.redd.it/QQ75o_IVgkrZmMTAOx74O8gK5dSq-HczSBB3dpqDPeQ.jpg?width=960&amp;crop=smart&amp;auto=webp&amp;s=46b92ed56aaf5d602788a4f9711171fa1bdabd5d', 'width': 960}, {'height': 720, 'url': 'https://external-preview.redd.it/QQ75o_IVgkrZmMTAOx74O8gK5dSq-HczSBB3dpqDPeQ.jpg?width=1080&amp;crop=smart&amp;auto=webp&amp;s=579b4b02e64895487f2fd1f52c103bac5e4f852d', 'width': 1080}], 'source': {'height': 800, 'url': 'https://external-preview.redd.it/QQ75o_IVgkrZmMTAOx74O8gK5dSq-HczSBB3dpqDPeQ.jpg?auto=webp&amp;s=ce3fc34e31037b5a539cb46f5dff8054e49db491', 'width': 1200}, 'variants': {}}]}",6,1601893662,1,,True,False,False,Portland,t5_2qi2i,177688,public,confidence,https://b.thumbs.redditmedia.com/HlPyKmFUABpsv8aTsBMHUC_TlnmqV6wo_PasEjjK7vU.jpg,"One of the Region’s Largest Employers Seeks Exemption From Metro’s Transportation Tax -- Oregon Health &amp; Science University, a public corporation, gets almost no money from taxpayers but, for purposes of this tax, says it’s a government agency.",0,[],1.0,https://www.wweek.com/news/2020/10/04/one-of-regions-largest-employers-seeks-exemption-from-metros-transportation-tax/,all_ads,6,,dark,,local-news,Local News,93.0,140.0,https://www.wweek.com/news/2020/10/04/one-of-regions-largest-employers-seeks-exemption-from-metros-transportation-tax/,,,,,,,,,,
[],False,tallant85,,[],,text,t2_3bts4,False,False,[],False,False,1601877125,self.Portland,https://www.reddit.com/r/Portland/comments/j5e54t/strip_clubs_in_age_of_covid/,{},j5e54t,True,False,False,False,True,True,False,,[],dark,text,False,False,True,11,0,False,all_ads,/r/Portland/comments/j5e54t/strip_clubs_in_age_of_covid/,False,,,6,1601877135,1,"How are they right now? I see they're all open. Are they following guidelines, or are they extremely risky?",True,False,False,Portland,t5_2qi2i,177681,public,confidence,self,Strip clubs in age of covid?,0,[],1.0,https://www.reddit.com/r/Portland/comments/j5e54t/strip_clubs_in_age_of_covid/,all_ads,6,,,,,,,,,,,,,,,,,,
[],False,apollo30,,[],,text,t2_p8et7,False,False,[],False,False,1601876626,self.Portland,https://www.reddit.com/r/Portland/comments/j5e1uz/i_live_near_the_courthouse_and_sleep_is_a_myth/,{},j5e1uz,True,False,False,False,True,True,False,,[],dark,text,False,False,True,1,0,False,all_ads,/r/Portland/comments/j5e1uz/i_live_near_the_courthouse_and_sleep_is_a_myth/,False,,,6,1601876637,1,"While I highly sympathize with the cause that the protestors are aligned with it has gotten so so grating how often I can't go to sleep at a reasonable hour anymore. As I'm typing this some people are playing loud, I think it's edm music? It's a Sunday night and I don't want to be up super late, but I have no choice because I have to wait until people go home or are forced out by ppb in some brutal fashion. I don't know what's expected to happen at this point and I'm sure some will think I'm bootlickers for even saying this much, but man, I just want to sleep without having to worry about random megaphones at 1am, random music or the lrads by the cops telling them to knock it off. 

Again, I highly sympathize with the cause and sure some will think I'm a bootlicker just for expressing any discontent but I can't wait for my lease to be over so I can move somewhere where I can fucking sleep at a reasonable hour.

Just venting some frustration.",True,False,False,Portland,t5_2qi2i,177682,public,confidence,self,I live near the courthouse and sleep is a myth,0,[],1.0,https://www.reddit.com/r/Portland/comments/j5e1uz/i_live_near_the_courthouse_and_sleep_is_a_myth/,all_ads,6,,,,,,,,,,,,,,,,,,
[],False,vsans,,[],,text,t2_ez2v0,False,False,[],False,False,1601873666,govdeals.com,https://www.reddit.com/r/Portland/comments/j5dgko/pbot_auctioning_ne_39th_ave_cesar_e_chavez_blvd/,{},j5dgko,True,False,False,False,True,False,False,,[],dark,text,False,False,True,21,0,False,all_ads,/r/Portland/comments/j5dgko/pbot_auctioning_ne_39th_ave_cesar_e_chavez_blvd/,False,link,"{'enabled': False, 'images': [{'id': '4dCnHVEHYFbpkqKtJGYppwHfw3Z-zojq0hw6igD7aXY', 'resolutions': [{'height': 81, 'url': 'https://external-preview.redd.it/itSjP8ND-tmi45uG8AoPoFVlcaHZLOAiWmTzfCNoDCE.jpg?width=108&amp;crop=smart&amp;auto=webp&amp;s=ce45e793308481ef48820e58ea1620d1c29370af', 'width': 108}, {'height': 162, 'url': 'https://external-preview.redd.it/itSjP8ND-tmi45uG8AoPoFVlcaHZLOAiWmTzfCNoDCE.jpg?width=216&amp;crop=smart&amp;auto=webp&amp;s=dc91a75021541b95f7de9082acfe2a1602cf7a41', 'width': 216}, {'height': 240, 'url': 'https://external-preview.redd.it/itSjP8ND-tmi45uG8AoPoFVlcaHZLOAiWmTzfCNoDCE.jpg?width=320&amp;crop=smart&amp;auto=webp&amp;s=fae186bd10f130d237290ab9fb4d3d20603c4299', 'width': 320}, {'height': 480, 'url': 'https://external-preview.redd.it/itSjP8ND-tmi45uG8AoPoFVlcaHZLOAiWmTzfCNoDCE.jpg?width=640&amp;crop=smart&amp;auto=webp&amp;s=d326a2a3545deace5c89661179794737bda129d1', 'width': 640}], 'source': {'height': 600, 'url': 'https://external-preview.redd.it/itSjP8ND-tmi45uG8AoPoFVlcaHZLOAiWmTzfCNoDCE.jpg?auto=webp&amp;s=ae3728d12d8157e77065c6da2e9c0d839381394c', 'width': 800}, 'variants': {}}]}",6,1601873676,1,,True,False,False,Portland,t5_2qi2i,177679,public,confidence,https://b.thumbs.redditmedia.com/uCZWxGPx7MfNK6URF8R5O-K5kha_wwfH6Bnt1P6xRao.jpg,PBOT auctioning “NE 39th Ave” (Cesar E Chavez Blvd) street name signs,0,[],1.0,https://www.govdeals.com/index.cfm?fa=Main.Item&amp;itemid=1406&amp;acctid=7073,all_ads,6,,,,,,105.0,140.0,https://www.govdeals.com/index.cfm?fa=Main.Item&amp;itemid=1406&amp;acctid=7073,,,,,,,,,,
[],False,MIZZKATHY74,,[],YOU SEEN MY FUCKEN CONES,text,t2_52d2ntpx,False,False,[],False,False,1601873522,katu.com,https://www.reddit.com/r/Portland/comments/j5dfjf/report_police_say_man_pushed_womans_wheelchair/,{},j5dfjf,True,False,False,False,True,False,False,,[],dark,text,False,False,True,2,0,False,all_ads,/r/Portland/comments/j5dfjf/report_police_say_man_pushed_womans_wheelchair/,False,link,"{'enabled': False, 'images': [{'id': '2pEAMZA7umRcr_Ol-UPiOYA5lTK7GRzN1DKILfJ6qDs', 'resolutions': [{'height': 60, 'url': 'https://external-preview.redd.it/atAfu5UgoZYM6Iw_33_FfCVWSvesbmIWPYrlG5CPWnA.jpg?width=108&amp;crop=smart&amp;auto=webp&amp;s=f96cb5cecc81178044911714ebeb4f8f92023ac5', 'width': 108}, {'height': 121, 'url': 'https://external-preview.redd.it/atAfu5UgoZYM6Iw_33_FfCVWSvesbmIWPYrlG5CPWnA.jpg?width=216&amp;crop=smart&amp;auto=webp&amp;s=ed7aeb761530f32813f977343cb2fbdde79ea4fa', 'width': 216}, {'height': 179, 'url': 'https://external-preview.redd.it/atAfu5UgoZYM6Iw_33_FfCVWSvesbmIWPYrlG5CPWnA.jpg?width=320&amp;crop=smart&amp;auto=webp&amp;s=996f8d11c888009473e1055419374ae30e46f014', 'width': 320}, {'height': 359, 'url': 'https://external-preview.redd.it/atAfu5UgoZYM6Iw_33_FfCVWSvesbmIWPYrlG5CPWnA.jpg?width=640&amp;crop=smart&amp;auto=webp&amp;s=fae6f4cb034ccf2761982b30b2d14e7efe9c7b0d', 'width': 640}, {'height': 539, 'url': 'https://external-preview.redd.it/atAfu5UgoZYM6Iw_33_FfCVWSvesbmIWPYrlG5CPWnA.jpg?width=960&amp;crop=smart&amp;auto=webp&amp;s=8e303def2d57c819d2e86a7640f80e8fa46be1fd', 'width': 960}], 'source': {'height': 554, 'url': 'https://external-preview.redd.it/atAfu5UgoZYM6Iw_33_FfCVWSvesbmIWPYrlG5CPWnA.jpg?auto=webp&amp;s=89f8696fc48a1ee242a429a4e1080b3c74be3de4', 'width': 986}, 'variants': {}}]}",6,1601873533,1,,True,False,False,Portland,t5_2qi2i,177678,public,confidence,https://b.thumbs.redditmedia.com/MSF5ZuKEfni-lbVtrb4XfTAob5yM8dFFWy7EpRb1MVE.jpg,"Report: Police say man pushed woman's wheelchair over, sending her to the hospital",0,[],1.0,https://katu.com/news/local/police-say-man-pushed-womans-wheelchair-over-sending-her-to-the-hospital,all_ads,6,,dark,,local-news,Local News,78.0,140.0,https://katu.com/news/local/police-say-man-pushed-womans-wheelchair-over-sending-her-to-the-hospital,5786c622-bd77-11e9-a551-0ed7cadd2dec,,,,,,,,,
[],False,jcksns,,[],,text,t2_yvjpx,False,False,[],False,False,1601871906,self.Portland,https://www.reddit.com/r/Portland/comments/j5d3ff/when_are_we_supposed_to_get_our_ballots/,{},j5d3ff,True,False,False,False,True,True,False,,[],dark,text,False,False,True,16,0,False,all_ads,/r/Portland/comments/j5d3ff/when_are_we_supposed_to_get_our_ballots/,False,,,6,1601871917,1,I feel like I should've got mine by now. Anyone know?,True,False,False,Portland,t5_2qi2i,177678,public,confidence,self,When are we supposed to get our ballots?,0,[],1.0,https://www.reddit.com/r/Portland/comments/j5d3ff/when_are_we_supposed_to_get_our_ballots/,all_ads,6,,,,,,,,,,,,,,,,,,
[],False,tylerPA007,,[],,text,t2_bflyy,False,False,[],False,False,1601871704,reddit.com,https://www.reddit.com/r/Portland/comments/j5d1yf/lost_cat_in_ne_kerns_near_glisan_sandy_his_name/,{},j5d1yf,True,False,False,False,True,False,False,,[],dark,text,False,False,True,1,0,False,all_ads,/r/Portland/comments/j5d1yf/lost_cat_in_ne_kerns_near_glisan_sandy_his_name/,False,,,6,1601871714,1,,True,False,False,Portland,t5_2qi2i,177678,public,confidence,default,"Lost Cat in NE Kerns - Near Glisan &amp; Sandy. His name is Samwise, ~6 months old, w/!varying shades of gray in his coat. He does not have a collar or a chip. The first picture is the most recent. Please DM with any questions or information. Thank you!",0,[],1.0,https://www.reddit.com/gallery/j5d1yf,all_ads,6,,,,,,,,https://www.reddit.com/gallery/j5d1yf,,"{'items': [{'id': 7527721, 'media_id': '3v0h6ksfd7r51'}, {'id': 7527722, 'media_id': 'syojjjsfd7r51'}, {'id': 7527723, 'media_id': 'afzyjosfd7r51'}, {'id': 7527724, 'media_id': 'nv6h4lsfd7r51'}]}",True,"{'3v0h6ksfd7r51': {'e': 'Image', 'id': '3v0h6ksfd7r51', 'm': 'image/jpg', 'p': [{'u': 'https://preview.redd.it/3v0h6ksfd7r51.jpg?width=108&amp;crop=smart&amp;auto=webp&amp;s=b6cdade3cdfa04f46dc5a5c32eb7a2e8daa04468', 'x': 108, 'y': 144}, {'u': 'https://preview.redd.it/3v0h6ksfd7r51.jpg?width=216&amp;crop=smart&amp;auto=webp&amp;s=51e57c7e670308eefa763c2d2e5438eca37039b2', 'x': 216, 'y': 288}, {'u': 'https://preview.redd.it/3v0h6ksfd7r51.jpg?width=320&amp;crop=smart&amp;auto=webp&amp;s=13d5cfe0db133b7179e80a0733af4767f91fcb4d', 'x': 320, 'y': 426}, {'u': 'https://preview.redd.it/3v0h6ksfd7r51.jpg?width=640&amp;crop=smart&amp;auto=webp&amp;s=e50c2252e1224b9befc2c2069ba388e97c89f13d', 'x': 640, 'y': 853}, {'u': 'https://preview.redd.it/3v0h6ksfd7r51.jpg?width=960&amp;crop=smart&amp;auto=webp&amp;s=813648ac118f802c913d843e19238fb80b25fa6f', 'x': 960, 'y': 1280}, {'u': 'https://preview.redd.it/3v0h6ksfd7r51.jpg?width=1080&amp;crop=smart&amp;auto=webp&amp;s=036157838e4cdb21dbe04072e331c27a7e27f2e5', 'x': 1080, 'y': 1440}], 's': {'u': 'https://preview.redd.it/3v0h6ksfd7r51.jpg?width=3024&amp;format=pjpg&amp;auto=webp&amp;s=4de92786b120663a1df5c0bf9437b55f86b3dc0d', 'x': 3024, 'y': 4032}, 'status': 'valid'}, 'afzyjosfd7r51': {'e': 'Image', 'id': 'afzyjosfd7r51', 'm': 'image/jpg', 'p': [{'u': 'https://preview.redd.it/afzyjosfd7r51.jpg?width=108&amp;crop=smart&amp;auto=webp&amp;s=81e6807dc9ffd01f6fc82f121a98dfc30b11d25e', 'x': 108, 'y': 144}, {'u': 'https://preview.redd.it/afzyjosfd7r51.jpg?width=216&amp;crop=smart&amp;auto=webp&amp;s=7e873dfd7e3be1cdaa7d59a231123da1e9bf8022', 'x': 216, 'y': 288}, {'u': 'https://preview.redd.it/afzyjosfd7r51.jpg?width=320&amp;crop=smart&amp;auto=webp&amp;s=bd3f179b2edc696eb466a41fe28fe97d59f2e57d', 'x': 320, 'y': 426}, {'u': 'https://preview.redd.it/afzyjosfd7r51.jpg?width=640&amp;crop=smart&amp;auto=webp&amp;s=a941e11082ff8dd6b0e3fc25a3d1dd32fbfce244', 'x': 640, 'y': 853}, {'u': 'https://preview.redd.it/afzyjosfd7r51.jpg?width=960&amp;crop=smart&amp;auto=webp&amp;s=c084260f8a2b061a5b6b9c34063b22dde4497375', 'x': 960, 'y': 1280}, {'u': 'https://preview.redd.it/afzyjosfd7r51.jpg?width=1080&amp;crop=smart&amp;auto=webp&amp;s=fd4e8917ed5d411d4773b981d6b6d95d01306cce', 'x': 1080, 'y': 1440}], 's': {'u': 'https://preview.redd.it/afzyjosfd7r51.jpg?width=3024&amp;format=pjpg&amp;auto=webp&amp;s=ca26175288d8e01177a339b39e5d342439d9e98e', 'x': 3024, 'y': 4032}, 'status': 'valid'}, 'nv6h4lsfd7r51': {'e': 'Image', 'id': 'nv6h4lsfd7r51', 'm': 'image/jpg', 'p': [{'u': 'https://preview.redd.it/nv6h4lsfd7r51.jpg?width=108&amp;crop=smart&amp;auto=webp&amp;s=c296a7e66964dc1978cc72449745cd0ead695377', 'x': 108, 'y': 144}, {'u': 'https://preview.redd.it/nv6h4lsfd7r51.jpg?width=216&amp;crop=smart&amp;auto=webp&amp;s=1aef01719cd425bc1682372c9a8adc4c5f76313f', 'x': 216, 'y': 288}, {'u': 'https://preview.redd.it/nv6h4lsfd7r51.jpg?width=320&amp;crop=smart&amp;auto=webp&amp;s=f4c207f4363f159c5328457a644af41ccfb02965', 'x': 320, 'y': 426}, {'u': 'https://preview.redd.it/nv6h4lsfd7r51.jpg?width=640&amp;crop=smart&amp;auto=webp&amp;s=8d7e28dcaadf98652d90b60cb9867fb153bd0d9e', 'x': 640, 'y': 853}, {'u': 'https://preview.redd.it/nv6h4lsfd7r51.jpg?width=960&amp;crop=smart&amp;auto=webp&amp;s=c838e45bad9ba064b6c6a7f096fe02869f26de71', 'x': 960, 'y': 1280}, {'u': 'https://preview.redd.it/nv6h4lsfd7r51.jpg?width=1080&amp;crop=smart&amp;auto=webp&amp;s=40b79a94f4b5544699bea43fe3392907e32d6181', 'x': 1080, 'y': 1440}], 's': {'u': 'https://preview.redd.it/nv6h4lsfd7r51.jpg?width=3024&amp;format=pjpg&amp;auto=webp&amp;s=86f043db38ff0bb01b0248ed7e11bb75dc857749', 'x': 3024, 'y': 4032}, 'status': 'valid'}, 'syojjjsfd7r51': {'e': 'Image', 'id': 'syojjjsfd7r51', 'm': 'image/jpg', 'p': [{'u': 'https://preview.redd.it/syojjjsfd7r51.jpg?width=108&amp;crop=smart&amp;auto=webp&amp;s=be1b5051f093870f5981d43e2578ec73954911e3', 'x': 108, 'y': 81}, {'u': 'https://preview.redd.it/syojjjsfd7r51.jpg?width=216&amp;crop=smart&amp;auto=webp&amp;s=ea6b71e02631c492fcb5fe3b8fc8664cbfac833b', 'x': 216, 'y': 162}, {'u': 'https://preview.redd.it/syojjjsfd7r51.jpg?width=320&amp;crop=smart&amp;auto=webp&amp;s=385ce72c1fc7774292f56c1b73e2037c063167f5', 'x': 320, 'y': 240}, {'u': 'https://preview.redd.it/syojjjsfd7r51.jpg?width=640&amp;crop=smart&amp;auto=webp&amp;s=b7572c7cba09a6346942a0cd3ccf8499f7240f7f', 'x': 640, 'y': 480}, {'u': 'https://preview.redd.it/syojjjsfd7r51.jpg?width=960&amp;crop=smart&amp;auto=webp&amp;s=111e6cab7ded9a61931a52460177ba47c59a9605', 'x': 960, 'y': 720}, {'u': 'https://preview.redd.it/syojjjsfd7r51.jpg?width=1080&amp;crop=smart&amp;auto=webp&amp;s=681ddc4fac29c23438bf1df3eb051e10d27a8b46', 'x': 1080, 'y': 810}], 's': {'u': 'https://preview.redd.it/syojjjsfd7r51.jpg?width=4032&amp;format=pjpg&amp;auto=webp&amp;s=4ad66697bdcbe049ea4ff2129b6ac023e4aca35b', 'x': 4032, 'y': 3024}, 'status': 'valid'}}",,,,,,
