author,author_flair_css_class,author_flair_richtext,author_flair_text,author_flair_type,can_mod_post,contest_mode,created_utc,domain,full_link,gilded,id,is_crosspostable,is_original_content,is_reddit_media_domain,is_self,is_video,link_flair_richtext,link_flair_text_color,link_flair_type,locked,media_only,no_follow,num_comments,num_crossposts,over_18,parent_whitelist_status,permalink,pinned,pwls,retrieved_on,rte_mode,score,selftext,send_replies,spoiler,stickied,subreddit,subreddit_id,subreddit_subscribers,subreddit_type,thumbnail,title,url,whitelist_status,wls,media,media_embed,post_hint,preview,secure_media,secure_media_embed,thumbnail_height,thumbnail_width,link_flair_background_color,link_flair_css_class,link_flair_text
drewbit54,,[],,text,False,False,1530107008,self.Portland,https://www.reddit.com/r/Portland/comments/8u9ppb/i5_and_i84_construction/,0,8u9ppb,True,False,False,True,False,[],dark,text,False,False,True,3,0,False,all_ads,/r/Portland/comments/8u9ppb/i5_and_i84_construction/,False,6,1530107010,markdown,0,"I'm a little confused on what exactly is happening. I've read multiple things that make it sound like all of the work is going to be downtown, but I've also seen a lot of other articles saying that the I5 bridge is going to be closed - I live in Vancouver, for context. Can someone help clear this up for me?",True,False,False,Portland,t5_2qi2i,98331,public,self,I5 and I84 construction,https://www.reddit.com/r/Portland/comments/8u9ppb/i5_and_i84_construction/,all_ads,6,,,,,,,,,,,
aldaeepoundston,,[],,text,False,False,1530077731,youtu.be,https://www.reddit.com/r/Portland/comments/8u7233/youtube/,0,8u7233,False,False,False,False,False,[],dark,text,False,False,True,0,0,False,all_ads,/r/Portland/comments/8u7233/youtube/,False,6,1530077732,markdown,0,,False,False,False,Portland,t5_2qi2i,98302,public,https://b.thumbs.redditmedia.com/a4VPPRhEzCFi_n1XUjmZSbt-ffvg2aq5lqQ5myaF8AI.jpg,YouTube,https://youtu.be/vSnToUacwVA,all_ads,6,"{'oembed': {'author_name': 'Mark Rashad', 'author_url': 'https://www.youtube.com/channel/UCBNnAJBnm2ZBDkhi8QsgDuQ', 'height': 338, 'html': '&lt;iframe width=""600"" height=""338"" src=""https://www.youtube.com/embed/vSnToUacwVA?feature=oembed&amp;enablejsapi=1"" frameborder=""0"" allow=""autoplay; encrypted-media"" allowfullscreen&gt;&lt;/iframe&gt;', 'provider_name': 'YouTube', 'provider_url': 'https://www.youtube.com/', 'thumbnail_height': 360, 'thumbnail_url': 'https://i.ytimg.com/vi/vSnToUacwVA/hqdefault.jpg', 'thumbnail_width': 480, 'title': ""Mark Rashad I MCA MOTOR CLUB OF AMERICA 2017 I YOU'RE NOT REGISTERED"", 'type': 'video', 'version': '1.0', 'width': 600}, 'type': 'youtube.com'}","{'content': '&lt;iframe width=""600"" height=""338"" src=""https://www.youtube.com/embed/vSnToUacwVA?feature=oembed&amp;enablejsapi=1"" frameborder=""0"" allow=""autoplay; encrypted-media"" allowfullscreen&gt;&lt;/iframe&gt;', 'height': 338, 'scrolling': False, 'width': 600}",rich:video,"{'enabled': False, 'images': [{'id': 'nZuTImB3pBmqtNypJd-o4l9IcevuzCSozVAcuI44o7U', 'resolutions': [{'height': 81, 'url': 'https://i.redditmedia.com/sdPm8S73Wn31WtNwQbQUhOpIbQvwQMKbf81NhAYbzag.jpg?fit=crop&amp;crop=faces%2Centropy&amp;arh=2&amp;w=108&amp;s=443ccd61e805873791354d6148647357', 'width': 108}, {'height': 162, 'url': 'https://i.redditmedia.com/sdPm8S73Wn31WtNwQbQUhOpIbQvwQMKbf81NhAYbzag.jpg?fit=crop&amp;crop=faces%2Centropy&amp;arh=2&amp;w=216&amp;s=0146f9cf2d698ed4a7e91c675d42340d', 'width': 216}, {'height': 240, 'url': 'https://i.redditmedia.com/sdPm8S73Wn31WtNwQbQUhOpIbQvwQMKbf81NhAYbzag.jpg?fit=crop&amp;crop=faces%2Centropy&amp;arh=2&amp;w=320&amp;s=8ea6e7a98730c558b22e2ebdf638fddf', 'width': 320}], 'source': {'height': 360, 'url': 'https://i.redditmedia.com/sdPm8S73Wn31WtNwQbQUhOpIbQvwQMKbf81NhAYbzag.jpg?s=8010603e016fafd58b8dde1a3a52b395', 'width': 480}, 'variants': {}}]}","{'oembed': {'author_name': 'Mark Rashad', 'author_url': 'https://www.youtube.com/channel/UCBNnAJBnm2ZBDkhi8QsgDuQ', 'height': 338, 'html': '&lt;iframe width=""600"" height=""338"" src=""https://www.youtube.com/embed/vSnToUacwVA?feature=oembed&amp;enablejsapi=1"" frameborder=""0"" allow=""autoplay; encrypted-media"" allowfullscreen&gt;&lt;/iframe&gt;', 'provider_name': 'YouTube', 'provider_url': 'https://www.youtube.com/', 'thumbnail_height': 360, 'thumbnail_url': 'https://i.ytimg.com/vi/vSnToUacwVA/hqdefault.jpg', 'thumbnail_width': 480, 'title': ""Mark Rashad I MCA MOTOR CLUB OF AMERICA 2017 I YOU'RE NOT REGISTERED"", 'type': 'video', 'version': '1.0', 'width': 600}, 'type': 'youtube.com'}","{'content': '&lt;iframe width=""600"" height=""338"" src=""https://www.youtube.com/embed/vSnToUacwVA?feature=oembed&amp;enablejsapi=1"" frameborder=""0"" allow=""autoplay; encrypted-media"" allowfullscreen&gt;&lt;/iframe&gt;', 'height': 338, 'media_domain_url': 'https://www.redditmedia.com/mediaembed/8u7233', 'scrolling': False, 'width': 600}",105.0,140.0,,,
lolerblades,,[],,text,False,False,1530076673,self.Portland,https://www.reddit.com/r/Portland/comments/8u6yre/anyone_want_a_super_sweet_cali_king_mattress/,0,8u6yre,True,False,False,True,False,[],dark,text,False,False,True,1,0,False,all_ads,/r/Portland/comments/8u6yre/anyone_want_a_super_sweet_cali_king_mattress/,False,6,1530076673,markdown,0,"I am moving out of my apartment and need to get rid of this thing by Thursday.  This thing is such a great bed. It's so comfy, and huge..so much room for activities! I'd be hanging onto it but I'm moving into a camper van and it definitely won't fit in there. I'm in inner SE, you must pick up. Make me an offer and I'll probably you up on it!",True,False,False,Portland,t5_2qi2i,98302,public,self,Anyone want a super sweet Cali King Mattress?,https://www.reddit.com/r/Portland/comments/8u6yre/anyone_want_a_super_sweet_cali_king_mattress/,all_ads,6,,,,,,,,,,,
annasantarina,,[],,text,False,False,1530075964,self.Portland,https://www.reddit.com/r/Portland/comments/8u6wbd/stolen_suburu_outback/,0,8u6wbd,True,False,False,True,False,[],dark,text,False,False,True,10,0,False,all_ads,/r/Portland/comments/8u6wbd/stolen_suburu_outback/,False,6,1530075965,markdown,12,"My **white '97 suburu outback** was stolen last night (6/26) from SE 48th and Gladstone. It has a colorfully painted rocket box on the roof and several bumper stickers including ""World Naked Bike Ride"" and 
""I &lt;3 ME""

*License plate # XKC 896. 
*case # 18 214381

Please call non-emergency to report it if you see it abandoned, and of course if you see suspect characters near or in it call 911.

Thanks all for looking!
",True,False,False,Portland,t5_2qi2i,98301,public,self,Stolen Suburu Outback,https://www.reddit.com/r/Portland/comments/8u6wbd/stolen_suburu_outback/,all_ads,6,,,,,,,,,,,
Waffles_Remix,,[],,text,False,False,1530074713,i.redd.it,https://www.reddit.com/r/Portland/comments/8u6s1x/an_amazing_portland_bar/,0,8u6s1x,True,False,True,False,False,[],dark,text,False,False,True,443,0,False,all_ads,/r/Portland/comments/8u6s1x/an_amazing_portland_bar/,False,6,1530074714,markdown,1829,,True,False,False,Portland,t5_2qi2i,98299,public,default,An amazing Portland bar,https://i.redd.it/k7ewis064h611.jpg,all_ads,6,,,,,,,,,,,
throwawaitingtruth,,[],,text,False,False,1530071705,self.Portland,https://www.reddit.com/r/Portland/comments/8u6hdz/healthcare_recommendations/,0,8u6hdz,True,False,False,True,False,[],dark,text,False,False,True,16,0,False,all_ads,/r/Portland/comments/8u6hdz/healthcare_recommendations/,False,6,1530071706,richtext,0,"Hi Portlanders!

I'm purchasing healthcare through the local Oregon plan and would love recommendations on which provider you prefer. Just quality of doctors, speed of getting appointments, quality of communication and care.

Much appreciated!",True,False,False,Portland,t5_2qi2i,98297,public,self,Healthcare Recommendations?,https://www.reddit.com/r/Portland/comments/8u6hdz/healthcare_recommendations/,all_ads,6,,,,,,,,,,,
salamander37,,[],,text,False,False,1530068741,self.Portland,https://www.reddit.com/r/Portland/comments/8u6667/hair_stylist_recommendations/,0,8u6667,True,False,False,True,False,[],dark,text,False,False,True,4,0,False,all_ads,/r/Portland/comments/8u6667/hair_stylist_recommendations/,False,6,1530068743,markdown,0,"I’m from out of town but I’d like to get my hair cut and colored while I’m here. I have long, thick brown hair and I’m looking to trim it, add layers, and subtle balayage. Anyone have any good hair stylist recommendations? ",True,False,False,Portland,t5_2qi2i,98292,public,self,Hair stylist recommendations?,https://www.reddit.com/r/Portland/comments/8u6667/hair_stylist_recommendations/,all_ads,6,,,,,,,,,,,
pequodarrivingtolz,,[],,text,False,False,1530065429,i.redd.it,https://www.reddit.com/r/Portland/comments/8u5tx6/pink_da_ba_dee/,0,8u5tx6,True,False,True,False,False,"[{'e': 'text', 't': 'Photo'}]",dark,richtext,False,False,True,3,1,False,all_ads,/r/Portland/comments/8u5tx6/pink_da_ba_dee/,False,6,1530065431,markdown,11,,True,False,False,Portland,t5_2qi2i,98286,public,https://b.thumbs.redditmedia.com/mM-jw-nPZBphry56tpgcysjrjdBbOE35Wp33O5p7Q4w.jpg,Pink da ba dee,https://i.redd.it/yogrg5kcbg611.jpg,all_ads,6,,,image,"{'enabled': True, 'images': [{'id': '7DKsdmTww_vLK5KT-9nDuLDrgwkhVLQ8Y5PIN1n8Egc', 'resolutions': [{'height': 60, 'url': 'https://i.redditmedia.com/XXEeTdyIvhFRalJjqe18Cy6dzi8C3p3NC5y5Ml9IYQE.jpg?fit=crop&amp;crop=faces%2Centropy&amp;arh=2&amp;w=108&amp;s=e4293ead24e3141259346a6303cba48e', 'width': 108}, {'height': 121, 'url': 'https://i.redditmedia.com/XXEeTdyIvhFRalJjqe18Cy6dzi8C3p3NC5y5Ml9IYQE.jpg?fit=crop&amp;crop=faces%2Centropy&amp;arh=2&amp;w=216&amp;s=a2041de0f1e4fdd19f310388805774e4', 'width': 216}, {'height': 179, 'url': 'https://i.redditmedia.com/XXEeTdyIvhFRalJjqe18Cy6dzi8C3p3NC5y5Ml9IYQE.jpg?fit=crop&amp;crop=faces%2Centropy&amp;arh=2&amp;w=320&amp;s=defa36d2ab62c03ee3e2b22b3b5050a6', 'width': 320}, {'height': 359, 'url': 'https://i.redditmedia.com/XXEeTdyIvhFRalJjqe18Cy6dzi8C3p3NC5y5Ml9IYQE.jpg?fit=crop&amp;crop=faces%2Centropy&amp;arh=2&amp;w=640&amp;s=a54f8f8c595bf347dd72838205032868', 'width': 640}, {'height': 539, 'url': 'https://i.redditmedia.com/XXEeTdyIvhFRalJjqe18Cy6dzi8C3p3NC5y5Ml9IYQE.jpg?fit=crop&amp;crop=faces%2Centropy&amp;arh=2&amp;w=960&amp;s=f4f17f05ee4e9ea607b93dc21300d5f8', 'width': 960}, {'height': 606, 'url': 'https://i.redditmedia.com/XXEeTdyIvhFRalJjqe18Cy6dzi8C3p3NC5y5Ml9IYQE.jpg?fit=crop&amp;crop=faces%2Centropy&amp;arh=2&amp;w=1080&amp;s=398058306ab97ade79b2adaf61529949', 'width': 1080}], 'source': {'height': 2242, 'url': 'https://i.redditmedia.com/XXEeTdyIvhFRalJjqe18Cy6dzi8C3p3NC5y5Ml9IYQE.jpg?s=04f08a62b3b6c25d838132ae6f198463', 'width': 3992}, 'variants': {}}]}",,,78.0,140.0,,photo,Photo
LesserLastLife,,[],,text,False,False,1530064626,i.redd.it,https://www.reddit.com/r/Portland/comments/8u5qnz/old_woman_in_black_jetta_driving_down_oncoming/,0,8u5qnz,False,False,True,False,False,[],dark,text,False,False,True,1,0,False,all_ads,/r/Portland/comments/8u5qnz/old_woman_in_black_jetta_driving_down_oncoming/,False,6,1530064627,markdown,1,,True,False,False,Portland,t5_2qi2i,98285,public,default,Old woman in black Jetta driving down oncoming lane of traffic on Sellwood Bridge after sitting on phone prior to merge blocking cars. 50 mins from LO to Sellwood. Yikes!,https://i.redd.it/wvmc5d10ag611.jpg,all_ads,6,,,,,,,,,,,
pequodarrivingtolz,,[],,text,False,False,1530062994,opb.org,https://www.reddit.com/r/Portland/comments/8u5kb0/with_court_ruling_expected_gun_ban_advocates_will/,0,8u5kb0,True,False,False,False,False,"[{'e': 'text', 't': 'Local News'}]",dark,richtext,False,False,True,54,0,False,all_ads,/r/Portland/comments/8u5kb0/with_court_ruling_expected_gun_ban_advocates_will/,False,6,1530062995,markdown,3,,True,False,False,Portland,t5_2qi2i,98283,public,default,"With Court Ruling Expected, Gun Ban Advocates Will Try To Make History",https://www.opb.org/news/article/oregon-gun-control-initiative-petition-43-assault-weapons/,all_ads,6,,,,,,,,,,local-news,Local News
SirHuffDaddy,,[],,text,False,False,1530062494,self.Portland,https://www.reddit.com/r/Portland/comments/8u5ic2/whatre_good_places_for_asian_hair_stylists/,0,8u5ic2,True,False,False,True,False,[],dark,text,False,False,True,12,0,False,all_ads,/r/Portland/comments/8u5ic2/whatre_good_places_for_asian_hair_stylists/,False,6,1530062496,markdown,3,"I just moved up to Portland, and I am looking for a place to get my hair cut (male), prefer stylists who know Asian hair ",True,False,False,Portland,t5_2qi2i,98282,public,self,What’re good places for Asian hair stylists ???,https://www.reddit.com/r/Portland/comments/8u5ic2/whatre_good_places_for_asian_hair_stylists/,all_ads,6,,,,,,,,,,,
LumpyBatter,,[],,text,False,False,1530059995,i.redd.it,https://www.reddit.com/r/Portland/comments/8u58lj/freshly_picked_raspberries_one_of_the_reasons_im/,0,8u58lj,True,False,True,False,False,"[{'e': 'text', 't': 'Photo'}]",dark,richtext,False,False,True,44,0,False,all_ads,/r/Portland/comments/8u58lj/freshly_picked_raspberries_one_of_the_reasons_im/,False,6,1530059996,markdown,6,,True,False,False,Portland,t5_2qi2i,98280,public,default,Freshly picked raspberries - One of the reasons I'm looking forward to moving to Portland,https://i.redd.it/ghhfxqbewf611.jpg,all_ads,6,,,,,,,,,,photo,Photo
Candararar,,[],,text,False,False,1530059730,self.Portland,https://www.reddit.com/r/Portland/comments/8u57ky/places_to_buy_satchels_in_portland/,0,8u57ky,True,False,False,True,False,[],dark,text,False,False,True,19,0,False,all_ads,/r/Portland/comments/8u57ky/places_to_buy_satchels_in_portland/,False,6,1530059734,markdown,0,"Hi friends,

I recently became a student at psu and I'm having a problem I could use reddit's help with. I started at psu recently and the campus smells like bird poop. Everywhere. I cant get away from it lmao! The smell is getting stuck in my senses and following me home.

So my request is this: where can I buy a satchel that is small, with a long enough drawstring to wear around my neck? My goal is to fill the satchel with herbs and spices. +bonus if its a spiritual shop and not a big box store, but i will take anything at this point.

Cheers, and thank you for your help!",True,False,False,Portland,t5_2qi2i,98280,public,self,Places to buy satchels in Portland?,https://www.reddit.com/r/Portland/comments/8u57ky/places_to_buy_satchels_in_portland/,all_ads,6,,,,,,,,,,,
skullsnstuff,,[],,text,False,False,1530059678,instagram.com,https://www.reddit.com/r/Portland/comments/8u57e8/come_join_our_open_gym_deadlifting_party_in_se_at/,0,8u57e8,True,False,False,False,False,[],dark,text,False,False,True,1,0,False,all_ads,/r/Portland/comments/8u57e8/come_join_our_open_gym_deadlifting_party_in_se_at/,False,6,1530059679,markdown,5,,True,False,False,Portland,t5_2qi2i,98280,public,default,Come join our open gym deadlifting party in SE at Strength Union. Raffling off prizes for a great cause!,https://www.instagram.com/p/BkORO9ChsOm/?utm_source=ig_share_sheet&amp;igshid=1ii86rk9q9des,all_ads,6,,,,,,,,,,,
trstnw,,[],,text,False,False,1530059589,i.imgur.com,https://www.reddit.com/r/Portland/comments/8u570u/stjohns_bridge_traffic_is_getting_ridiculous/,0,8u570u,True,False,False,False,False,[],dark,text,False,False,True,121,0,False,all_ads,/r/Portland/comments/8u570u/stjohns_bridge_traffic_is_getting_ridiculous/,False,6,1530059589,markdown,45,,True,False,False,Portland,t5_2qi2i,98280,public,default,St.Johns Bridge traffic is getting ridiculous lately. Backed up from every direction.,https://i.imgur.com/XljlCrp.jpg,all_ads,6,,,,,,,,,,,
TwoUnicycles,,[],,text,False,False,1530056905,self.Portland,https://www.reddit.com/r/Portland/comments/8u4waq/were_you_in_laurelhurst_about_an_hour_ago/,0,8u4waq,True,False,False,True,False,[],dark,text,False,False,True,19,0,False,all_ads,/r/Portland/comments/8u4waq/were_you_in_laurelhurst_about_an_hour_ago/,False,6,1530056905,markdown,76,"If you were, and you happened to catch my amazing fall off my bike and roll halfway down the dog hill, stagger to my feet, fall over and roll the rest of the way down the dog hill - if you happened to catch that on camera, please share.

Cause man, that shit must have been hilarious to watch.

(I'm fine, though my back is probably not going to work tomorrow. Just super amused at what that probably looked like. And very grateful that nobody stole my bike at the top of the hill while I was rolling around and moaning at the bottom of the hill.)",True,False,False,Portland,t5_2qi2i,98278,public,self,Were you in Laurelhurst about an hour ago?,https://www.reddit.com/r/Portland/comments/8u4waq/were_you_in_laurelhurst_about_an_hour_ago/,all_ads,6,,,,,,,,,,,
ShirtOffEric,,[],,text,False,False,1530056250,self.Portland,https://www.reddit.com/r/Portland/comments/8u4tls/milkshakes_wo_plastic_straws/,0,8u4tls,True,False,False,True,False,[],dark,text,False,False,True,34,0,False,all_ads,/r/Portland/comments/8u4tls/milkshakes_wo_plastic_straws/,False,6,1530056251,markdown,0,"Im sitting at burgerville enjoying a mocha perk shake, contimplating the optuons once the up for consideration plastic straw ban takes effect. Will i be a metal straw packing person? For such an occasional indulgence? Did milkshakes even exist before the invention of the plastic straw? ",True,False,False,Portland,t5_2qi2i,98275,public,self,Milkshakes w/o plastic straws?,https://www.reddit.com/r/Portland/comments/8u4tls/milkshakes_wo_plastic_straws/,all_ads,6,,,,,,,,,,,
thisisnotmyusernameI,,[],,text,False,False,1530052989,i.imgur.com,https://www.reddit.com/r/Portland/comments/8u4fv1/map_of_amsterdams_public_transport_great_piece_of/,0,8u4fv1,True,False,False,False,False,"[{'e': 'text', 't': 'Photo'}]",dark,richtext,False,False,True,20,0,False,all_ads,/r/Portland/comments/8u4fv1/map_of_amsterdams_public_transport_great_piece_of/,False,6,1530052990,markdown,53,,True,False,False,Portland,t5_2qi2i,98273,public,https://b.thumbs.redditmedia.com/gzD0D-Ho7VBEtQALQ-gj67vYeFRcnGkYfebSW1eIc1s.jpg,Map of Amsterdam's public transport: Great piece of inspiration for Portland.,https://i.imgur.com/Jd0hgAc.png,all_ads,6,,,image,"{'enabled': True, 'images': [{'id': 'CebOT9eakMK8lOtugMsi9pV7zP-mIbEjuFOdT6ytrBY', 'resolutions': [{'height': 108, 'url': 'https://i.redditmedia.com/bozF3dwwZ36kroydPtUjhRnCrvEG1aCF0HfA_gNk1t0.png?fit=crop&amp;crop=faces%2Centropy&amp;arh=2&amp;w=108&amp;s=1c846a6ae1067dd09123798de0aebf7b', 'width': 108}, {'height': 216, 'url': 'https://i.redditmedia.com/bozF3dwwZ36kroydPtUjhRnCrvEG1aCF0HfA_gNk1t0.png?fit=crop&amp;crop=faces%2Centropy&amp;arh=2&amp;w=216&amp;s=90b30e703d6a4e537f1447ad84ed4622', 'width': 216}, {'height': 320, 'url': 'https://i.redditmedia.com/bozF3dwwZ36kroydPtUjhRnCrvEG1aCF0HfA_gNk1t0.png?fit=crop&amp;crop=faces%2Centropy&amp;arh=2&amp;w=320&amp;s=d0e6d4b8b86bd994c7502459646faacb', 'width': 320}, {'height': 640, 'url': 'https://i.redditmedia.com/bozF3dwwZ36kroydPtUjhRnCrvEG1aCF0HfA_gNk1t0.png?fit=crop&amp;crop=faces%2Centropy&amp;arh=2&amp;w=640&amp;s=554055513bac04826a51ade4ed9dbbf5', 'width': 640}, {'height': 960, 'url': 'https://i.redditmedia.com/bozF3dwwZ36kroydPtUjhRnCrvEG1aCF0HfA_gNk1t0.png?fit=crop&amp;crop=faces%2Centropy&amp;arh=2&amp;w=960&amp;s=da468d798bf4c6b8c461a10c9531ace7', 'width': 960}, {'height': 1080, 'url': 'https://i.redditmedia.com/bozF3dwwZ36kroydPtUjhRnCrvEG1aCF0HfA_gNk1t0.png?fit=crop&amp;crop=faces%2Centropy&amp;arh=2&amp;w=1080&amp;s=d013e8093ae91d3fccd0eed01df9227d', 'width': 1080}], 'source': {'height': 1400, 'url': 'https://i.redditmedia.com/bozF3dwwZ36kroydPtUjhRnCrvEG1aCF0HfA_gNk1t0.png?s=a7b9a1e739805488f02ac5a300db5c2d', 'width': 1400}, 'variants': {}}]}",,,140.0,140.0,,photo,Photo
themukilteoshadow,,[],,text,False,False,1530044207,i.imgur.com,https://www.reddit.com/r/Portland/comments/8u3b2z/view_of_downtown_during_commercial_lighting_ban/,0,8u3b2z,True,False,False,False,False,[],dark,text,False,False,True,19,0,False,all_ads,/r/Portland/comments/8u3b2z/view_of_downtown_during_commercial_lighting_ban/,False,6,1530044208,markdown,536,,True,False,False,Portland,t5_2qi2i,98256,public,https://a.thumbs.redditmedia.com/rjMO433L9Drua8WwI7o6jFjZS7ITrOgxUtf1y9scNM8.jpg,"View of downtown during commercial lighting ban of the Energy Crisis, October 1973",https://i.imgur.com/wKjiud3.jpg,all_ads,6,,,image,"{'enabled': True, 'images': [{'id': 'j6M_qjS2UteUU0NNZMx95PsXWgf5xy7wsy7oQY93Qv8', 'resolutions': [{'height': 72, 'url': 'https://i.redditmedia.com/gStjvsUyAMZTKYRyTVaxKovt_DsgkgX5dsGIbkozx2s.jpg?fit=crop&amp;crop=faces%2Centropy&amp;arh=2&amp;w=108&amp;s=562a71247ca19a0cf1ae52c98377a224', 'width': 108}, {'height': 145, 'url': 'https://i.redditmedia.com/gStjvsUyAMZTKYRyTVaxKovt_DsgkgX5dsGIbkozx2s.jpg?fit=crop&amp;crop=faces%2Centropy&amp;arh=2&amp;w=216&amp;s=45e55a81e461b722e83357b068c45cbb', 'width': 216}, {'height': 215, 'url': 'https://i.redditmedia.com/gStjvsUyAMZTKYRyTVaxKovt_DsgkgX5dsGIbkozx2s.jpg?fit=crop&amp;crop=faces%2Centropy&amp;arh=2&amp;w=320&amp;s=111f728ca8e86f05b605ef86fef6ae79', 'width': 320}, {'height': 430, 'url': 'https://i.redditmedia.com/gStjvsUyAMZTKYRyTVaxKovt_DsgkgX5dsGIbkozx2s.jpg?fit=crop&amp;crop=faces%2Centropy&amp;arh=2&amp;w=640&amp;s=9a79c87abaf5378914fc6f0342f17bcc', 'width': 640}], 'source': {'height': 538, 'url': 'https://i.redditmedia.com/gStjvsUyAMZTKYRyTVaxKovt_DsgkgX5dsGIbkozx2s.jpg?s=cb3a9ddd92ade72c0d2afaadbe59b8d1', 'width': 800}, 'variants': {}}]}",,,94.0,140.0,,,
El--Borto,,[],,text,False,False,1530043894,self.Portland,https://www.reddit.com/r/Portland/comments/8u39hn/lost_keys_on_mt_tabor/,0,8u39hn,False,False,False,True,False,[],dark,text,False,False,True,3,0,False,all_ads,/r/Portland/comments/8u39hn/lost_keys_on_mt_tabor/,False,6,1530043895,markdown,0,[removed],True,False,False,Portland,t5_2qi2i,98256,public,self,Lost Keys on Mt. Tabor,https://www.reddit.com/r/Portland/comments/8u39hn/lost_keys_on_mt_tabor/,all_ads,6,,,,,,,,,,,
ICEFuckOFF,,[],,text,False,False,1530043887,oregonlive.com,https://www.reddit.com/r/Portland/comments/8u39gh/portland_ice_protesters_remain_defiant_day_after/,0,8u39gh,False,False,False,False,False,[],dark,text,False,False,True,1,0,False,all_ads,/r/Portland/comments/8u39gh/portland_ice_protesters_remain_defiant_day_after/,False,6,1530043889,markdown,1,,True,False,False,Portland,t5_2qi2i,98256,public,https://b.thumbs.redditmedia.com/ucYoPOWr9mB5IzX449Rd_3D2v8_6W48LjZ-aOSE_lFI.jpg,Portland ICE protesters remain defiant day after feds issue arrest warning,https://www.oregonlive.com/portland/index.ssf/2018/06/portland_ice_protesters_remain.html,all_ads,6,,,link,"{'enabled': False, 'images': [{'id': '58K_tZOCafmwadhxydVVnCzoZJC3PseOui196KwJxr4', 'resolutions': [{'height': 72, 'url': 'https://i.redditmedia.com/mPAKeuT9Lv9oL3iSvpg2ZE9RLwbwztTTUpHsrQFClig.jpg?fit=crop&amp;crop=faces%2Centropy&amp;arh=2&amp;w=108&amp;s=e8e72316e3674f318f1a80c73aa2517e', 'width': 108}, {'height': 144, 'url': 'https://i.redditmedia.com/mPAKeuT9Lv9oL3iSvpg2ZE9RLwbwztTTUpHsrQFClig.jpg?fit=crop&amp;crop=faces%2Centropy&amp;arh=2&amp;w=216&amp;s=564a1db576316c3499d772d4311a1216', 'width': 216}, {'height': 213, 'url': 'https://i.redditmedia.com/mPAKeuT9Lv9oL3iSvpg2ZE9RLwbwztTTUpHsrQFClig.jpg?fit=crop&amp;crop=faces%2Centropy&amp;arh=2&amp;w=320&amp;s=62676de1e400de7b5bcb3b35fc1a6c00', 'width': 320}, {'height': 426, 'url': 'https://i.redditmedia.com/mPAKeuT9Lv9oL3iSvpg2ZE9RLwbwztTTUpHsrQFClig.jpg?fit=crop&amp;crop=faces%2Centropy&amp;arh=2&amp;w=640&amp;s=51081da22df2354e0610383efcd72d74', 'width': 640}, {'height': 640, 'url': 'https://i.redditmedia.com/mPAKeuT9Lv9oL3iSvpg2ZE9RLwbwztTTUpHsrQFClig.jpg?fit=crop&amp;crop=faces%2Centropy&amp;arh=2&amp;w=960&amp;s=1db561656af5a3436a133f6e58999248', 'width': 960}], 'source': {'height': 640, 'url': 'https://i.redditmedia.com/mPAKeuT9Lv9oL3iSvpg2ZE9RLwbwztTTUpHsrQFClig.jpg?s=7d52a07e6bb084f95250798b53a960a3', 'width': 960}, 'variants': {}}]}",,,93.0,140.0,,,
femmishrobot,,[],,text,False,False,1530042607,self.Portland,https://www.reddit.com/r/Portland/comments/8u32r5/seeking_recommendations_guttersrainbarrel_repair/,0,8u32r5,True,False,False,True,False,[],dark,text,False,False,True,6,0,False,all_ads,/r/Portland/comments/8u32r5/seeking_recommendations_guttersrainbarrel_repair/,False,6,1530042608,markdown,6,"I have shitty old wood water barrels that my gutters drain into, which aren't level anymore. Also the gutter covers on one whole side of my roof have come off. Do you have a recommendation or warning about a gutter/rain barrel specialist who worked on your house? NE",True,False,False,Portland,t5_2qi2i,98256,public,self,Seeking recommendations! Gutters/rainbarrel repair,https://www.reddit.com/r/Portland/comments/8u32r5/seeking_recommendations_guttersrainbarrel_repair/,all_ads,6,,,,,,,,,,,
n0thingburger,,[],,text,False,False,1530042170,independent.co.uk,https://www.reddit.com/r/Portland/comments/8u30mz/astoria_is_the_hipster_haven_for_people_priced/,0,8u30mz,True,False,False,False,False,[],dark,text,False,False,True,0,0,False,all_ads,/r/Portland/comments/8u30mz/astoria_is_the_hipster_haven_for_people_priced/,False,6,1530042171,markdown,1,,True,False,False,Portland,t5_2qi2i,98256,public,default,Astoria is the hipster haven for people priced out of Portland,https://www.independent.co.uk/travel/americas/astoria-oregan-portland-hipster-travel-columbia-river-best-restaurants-bars-a8415401.html,all_ads,6,,,,,,,,,,,
