author,author_created_utc,author_flair_css_class,author_flair_text,author_fullname,created_utc,domain,full_link,gilded,id,is_self,media_embed,num_comments,over_18,permalink,retrieved_on,score,secure_media_embed,selftext,stickied,subreddit,subreddit_id,thumbnail,title,url,edited,media,secure_media
inopdx,1300158040.0,,,t2_4yprd,1425356732,self.Portland,https://www.reddit.com/r/Portland/comments/2xr42p/swm_seeking_compost_and_fill_dirt_for_awesome_new/,0,2xr42p,True,{},10,False,/r/Portland/comments/2xr42p/swm_seeking_compost_and_fill_dirt_for_awesome_new/,1440876024,0,{},Where is an affordable place to get compost and top soil. Woodlawn/Piedmont N Portland.Thanks,False,Portland,t5_2qi2i,self,SWM seeking compost and fill dirt for awesome new raised beds!,http://www.reddit.com/r/Portland/comments/2xr42p/swm_seeking_compost_and_fill_dirt_for_awesome_new/,1425412926.0,,
dadus14,1425353719.0,,,t2_ltq93,1425354338,postimg.org,https://www.reddit.com/r/Portland/comments/2xqz99/pps_countdown_just_found_this_out/,0,2xqz99,False,{},1,False,/r/Portland/comments/2xqz99/pps_countdown_just_found_this_out/,1440876087,1,{},,False,Portland,t5_2qi2i,default,PPS countdown - just found this out,http://postimg.org/image/50bredu9r/,,,
maxoregonian,1397022581.0,,,t2_g1p96,1425353387,s.oregonlive.com,https://www.reddit.com/r/Portland/comments/2xqxdv/family_members_gather_at_scene_of_north_portland/,0,2xqxdv,False,{},0,False,/r/Portland/comments/2xqxdv/family_members_gather_at_scene_of_north_portland/,1440876111,1,{},,False,Portland,t5_2qi2i,default,Family members gather at scene of North Portland shooting that left a 29-year-old man dead,http://s.oregonlive.com/UEHpXvj,,,
ottilie,1215014549.0,,,t2_36ohc,1425352956,komonews.com,https://www.reddit.com/r/Portland/comments/2xqwkk/minispike_of_heroin_overdoses_in_seattle_north_of/,0,2xqwkk,False,{},5,False,/r/Portland/comments/2xqwkk/minispike_of_heroin_overdoses_in_seattle_north_of/,1440876122,0,{},,False,Portland,t5_2qi2i,http://b.thumbs.redditmedia.com/-jsJqSLS1FRnvXmMg6EK2jYLcp9lvpIv6sLe-izjqdo.jpg,"Mini-spike of heroin overdoses in Seattle, north of here",http://www.komonews.com/news/local/Spike-in-heroin-overdoses-prompts-police-message-294761291.html,,,
[deleted],,,,,1425350529,trippy.com,https://www.reddit.com/r/Portland/comments/2xqrtu/if_youre_looking_to_visit_pdx_or_like_answering/,0,2xqrtu,False,{},11,False,/r/Portland/comments/2xqrtu/if_youre_looking_to_visit_pdx_or_like_answering/,1440876183,0,{},,False,Portland,t5_2qi2i,default,If you're looking to visit PDX (or like answering their questions)... try Trippy instead of Reddit. :),http://www.trippy.com,,,
[deleted],,,,,1425348808,self.Portland,https://www.reddit.com/r/Portland/comments/2xqobp/tilits_illegal_to_pass_a_trimet_bus/,0,2xqobp,True,{},9,False,/r/Portland/comments/2xqobp/tilits_illegal_to_pass_a_trimet_bus/,1440876229,0,{},What if you are in a different lane ? Somebody please explain what I just heard on KATU.,False,Portland,t5_2qi2i,default,TIL...Its illegal to pass a TriMet bus.,http://www.reddit.com/r/Portland/comments/2xqobp/tilits_illegal_to_pass_a_trimet_bus/,,,
[deleted],,,,,1425347253,i.imgur.com,https://www.reddit.com/r/Portland/comments/2xqla2/looking_a_bit_too_colorful_for_this_time_of_year/,0,2xqla2,False,{},0,False,/r/Portland/comments/2xqla2/looking_a_bit_too_colorful_for_this_time_of_year/,1440876268,1,{},,False,Portland,t5_2qi2i,default,Looking a bit too colorful for this time of year...,http://i.imgur.com/0xbA1X1.jpg,,,
[deleted],,,,,1425346892,self.Portland,https://www.reddit.com/r/Portland/comments/2xqkk3/music_looking_for_reason_8_user_in_portland_for/,0,2xqkk3,True,{},2,False,/r/Portland/comments/2xqkk3/music_looking_for_reason_8_user_in_portland_for/,1440876277,0,{},"i have a project file made in 8.1, i need to open for material retrieval and i don't own reason. pm me for details please if you can help me. ",False,Portland,t5_2qi2i,default,music: looking for reason 8 user in portland for small favor,http://www.reddit.com/r/Portland/comments/2xqkk3/music_looking_for_reason_8_user_in_portland_for/,,,
Signaldisrupt,1369953153.0,,,t2_bv96x,1425345587,self.Portland,https://www.reddit.com/r/Portland/comments/2xqhtl/lets_start_shooting_white_people/,0,2xqhtl,True,{},4,False,/r/Portland/comments/2xqhtl/lets_start_shooting_white_people/,1440876313,0,{},,False,Portland,t5_2qi2i,default,Let's start shooting white people! =),http://www.reddit.com/r/Portland/comments/2xqhtl/lets_start_shooting_white_people/,,,
bnblazer,1324822725.0,,NW,t2_6ie30,1425344218,opb.org,https://www.reddit.com/r/Portland/comments/2xqf0q/turn_those_dead_smelt_into_a_candle/,0,2xqf0q,False,{},2,False,/r/Portland/comments/2xqf0q/turn_those_dead_smelt_into_a_candle/,1440876350,1,{},,False,Portland,t5_2qi2i,http://b.thumbs.redditmedia.com/LT9o8ZHnGKWr18_BYMCNEWkdO4VVsB37fOWEx2UjkuI.jpg,Turn those dead smelt into a candle!,http://www.opb.org/news/blog/newsblog/dead-fish-on-sauvie-island-are-a-good-sign/?google_editors_picks=true,,,
cratermoon,1314835579.0,,,t2_5rlaq,1425343046,opb.org,https://www.reddit.com/r/Portland/comments/2xqcle/dead_fish_on_sauvie_island_are_a_good_sign/,0,2xqcle,False,{},8,False,/r/Portland/comments/2xqcle/dead_fish_on_sauvie_island_are_a_good_sign/,1440876381,55,{},,False,Portland,t5_2qi2i,http://b.thumbs.redditmedia.com/LT9o8ZHnGKWr18_BYMCNEWkdO4VVsB37fOWEx2UjkuI.jpg,Dead Fish On Sauvie Island Are A Good Sign,http://www.opb.org/news/blog/newsblog/dead-fish-on-sauvie-island-are-a-good-sign/,,,
Rockriverhairsupply,1425341161.0,,,t2_ltl65,1425341455,self.Portland,https://www.reddit.com/r/Portland/comments/2xq9an/saturday_market_booth/,0,2xq9an,True,{},0,False,/r/Portland/comments/2xq9an/saturday_market_booth/,1440876423,1,{},,False,Portland,t5_2qi2i,default,Saturday Market booth?,http://www.reddit.com/r/Portland/comments/2xq9an/saturday_market_booth/,,,
TheMasterCthulhu,1394583259.0,,,t2_fnp1z,1425341227,self.Portland,https://www.reddit.com/r/Portland/comments/2xq8th/printing_companies/,0,2xq8th,True,{},3,False,/r/Portland/comments/2xq8th/printing_companies/,1440876430,0,{},"Hi, I'm looking for some printing companies in Portland. Does anyone have any knowledge of that or recommendations?",False,Portland,t5_2qi2i,self,Printing companies?,http://www.reddit.com/r/Portland/comments/2xq8th/printing_companies/,,,
neil_before_scrodd,,,,,1425340787,wweek.com,https://www.reddit.com/r/Portland/comments/2xq7ub/the_sandy_hut_has_closed/,0,2xq7ub,False,{},62,False,/r/Portland/comments/2xq7ub/the_sandy_hut_has_closed/,1440876442,51,{},,False,Portland,t5_2qi2i,http://b.thumbs.redditmedia.com/mtGjBqFu2bcSS0nqHiiSFb-QqXq3Iy7rPiJQLgvuwgU.jpg,The Sandy Hut has closed.,http://www.wweek.com/portland/blog-32894-club_21_owners_in_process_of_buying_the_sandy_hut.html,,,
welfarecuban,1324960267.0,,,t2_6iqlg,1425339813,katu.com,https://www.reddit.com/r/Portland/comments/2xq5t8/one_person_shot_and_killed_in_north_portland/,0,2xq5t8,False,{},31,False,/r/Portland/comments/2xq5t8/one_person_shot_and_killed_in_north_portland/,1440876468,10,{},,False,Portland,t5_2qi2i,http://b.thumbs.redditmedia.com/fsQHoQzAz9tswQ8x_84zAWyOp3ZogSYLL5UJTNL-jTs.jpg,One person shot and killed in North Portland (North Commercial St. and N. Blandena right in the middle of the day; no arrests),http://www.katu.com/news/local/One-person-shot-and-killed-in-North-Portland-294737141.html,,,
littleoysterchell,1415424342.0,,,t2_j99v9,1425338074,localfarmersdelivery.deliverybizpro.com,https://www.reddit.com/r/Portland/comments/2xq228/i_found_free_delivery_milk_bread_butter_eggs_etc/,0,2xq228,False,{},44,False,/r/Portland/comments/2xq228/i_found_free_delivery_milk_bread_butter_eggs_etc/,1440876517,81,{},,False,Portland,t5_2qi2i,http://b.thumbs.redditmedia.com/Sm49GOW85YEQHso9S4U3mbxE4hP6HWHM-NNEuDiX-_k.jpg,"I found FREE DELIVERY! Milk, bread, butter, eggs, etc. ENJOY!!",http://localfarmersdelivery.deliverybizpro.com/home.php?xid=f9fd0be8a510e3d326beb89b454e360f,,,
Lydiagnostic,1403141597.0,,Milwaukie,t2_h1dpy,1425337939,self.Portland,https://www.reddit.com/r/Portland/comments/2xq1s1/fiddlehead_ferns/,0,2xq1s1,True,{},13,False,/r/Portland/comments/2xq1s1/fiddlehead_ferns/,1440876521,8,{},"Anyone know of a place that sells fiddlehead greens? My SO and I love these things on pizza. The last time we had them, they came from Trader Joe's in California. I've been checking TJ's ever since, to no avail. ",False,Portland,t5_2qi2i,self,Fiddlehead Ferns,http://www.reddit.com/r/Portland/comments/2xq1s1/fiddlehead_ferns/,,,
hobohuffer,1238793798.0,,,t2_3fo4f,1425337746,self.Portland,https://www.reddit.com/r/Portland/comments/2xq1d3/anyone_know_if_the_urban_iditarod_is_happening/,0,2xq1d3,True,{},10,False,/r/Portland/comments/2xq1d3/anyone_know_if_the_urban_iditarod_is_happening/,1440876526,9,{},"I can only find evidence of it happening everywhere else. The organizer last year dropped the ball, not sure what happened the year before that.",False,Portland,t5_2qi2i,self,Anyone know if the urban iditarod is happening this year in Portland?,http://www.reddit.com/r/Portland/comments/2xq1d3/anyone_know_if_the_urban_iditarod_is_happening/,,,
maryannpdx,1383527802.0,,NW District,t2_drhvb,1425335286,self.Portland,https://www.reddit.com/r/Portland/comments/2xpw01/led_zeppelin_cover/,0,2xpw01,True,{},0,False,/r/Portland/comments/2xpw01/led_zeppelin_cover/,1440876596,0,{},,False,Portland,t5_2qi2i,default,Led Zeppelin Cover,http://www.reddit.com/r/Portland/comments/2xpw01/led_zeppelin_cover/,,,
tbonenowison,1386305223.0,,SE,t2_e84nc,1425335090,self.Portland,https://www.reddit.com/r/Portland/comments/2xpvkm/are_there_any_lit_up_trails_in_forest_park/,0,2xpvkm,True,{},7,False,/r/Portland/comments/2xpvkm/are_there_any_lit_up_trails_in_forest_park/,1440876601,0,{},"I was thinking of walking from Lower Macleay to the Zoo via Wildwood around 6 or 7pm. Anyone have experience walking around there at night?

Any other recommended night routes in the area?",False,Portland,t5_2qi2i,self,Are there any lit up trails in Forest Park?,http://www.reddit.com/r/Portland/comments/2xpvkm/are_there_any_lit_up_trails_in_forest_park/,1425335550.0,,
eside,1419789180.0,,,t2_kd5ut,1425330397,self.Portland,https://www.reddit.com/r/Portland/comments/2xpkp9/anyone_know_of_a_coolcheap_space_to_rent_for_1/,0,2xpkp9,True,{},4,False,/r/Portland/comments/2xpkp9/anyone_know_of_a_coolcheap_space_to_rent_for_1/,1440876742,0,{},Preferably a crappy-ish old building or low key spot in SE that can hold at least 50 people and a couple of kegs. Flat walls for projecting on would also be sweet. Maybe Foster-Powell? ,False,Portland,t5_2qi2i,self,Anyone know of a cool(cheap) space to rent for 1 night digital art show in May?,http://www.reddit.com/r/Portland/comments/2xpkp9/anyone_know_of_a_coolcheap_space_to_rent_for_1/,,,
weddingvows,1418483788.0,,Alphabet District,t2_jztb6,1425329947,self.Portland,https://www.reddit.com/r/Portland/comments/2xpjmh/can_you_recommend_a_smallbusiness_accountant/,0,2xpjmh,True,{},4,False,/r/Portland/comments/2xpjmh/can_you_recommend_a_smallbusiness_accountant/,1440876756,0,{},"I'm starting a small business and need some advice from an accountant about what kind of legal entity to form, and some other questions. Do you have an accountant you'd recommend?",False,Portland,t5_2qi2i,self,Can you recommend a small-business accountant?,http://www.reddit.com/r/Portland/comments/2xpjmh/can_you_recommend_a_smallbusiness_accountant/,,,
sonatia,1317752819.0,,,t2_5zb04,1425329563,self.Portland,https://www.reddit.com/r/Portland/comments/2xpipt/where_can_i_find_green_pigeon_peas_gandules/,0,2xpipt,True,{},4,False,/r/Portland/comments/2xpipt/where_can_i_find_green_pigeon_peas_gandules/,1440876768,1,{},I've already checked winco and safeway with no luck.,False,Portland,t5_2qi2i,self,Where can I find green pigeon peas (gandules verdes) in Portland?,http://www.reddit.com/r/Portland/comments/2xpipt/where_can_i_find_green_pigeon_peas_gandules/,,,
armrha,1311357189.0,,Laurelhurst,t2_5jwxy,1425329273,i.imgur.com,https://www.reddit.com/r/Portland/comments/2xpi15/what_are_these_comics_and_who_makes_them_seen_em/,0,2xpi15,False,{},16,False,/r/Portland/comments/2xpi15/what_are_these_comics_and_who_makes_them_seen_em/,1440876777,126,{},,False,Portland,t5_2qi2i,http://a.thumbs.redditmedia.com/zC35bw-jWgGQ7Neqw5nGKRswUzkD_5CcDJ4aaxAI3f4.jpg,What are these comics and who makes them? Seen 'em around over the last few years.,http://i.imgur.com/Sy50y3f.jpg,,,
lexuh,1332806091.0,,,t2_79xvq,1425329068,self.Portland,https://www.reddit.com/r/Portland/comments/2xphjx/piece_of_cake_bakery_in_sellwood_is_amazing/,0,2xphjx,True,{},26,False,/r/Portland/comments/2xphjx/piece_of_cake_bakery_in_sellwood_is_amazing/,1440876783,15,{},"This is the third year in a row I've had them make a crazy custom cake for my friend's birthday, and they went above and beyond: http://imgur.com/bH231Rn

Yes, that's Marcel the Shell. Made in edible modeling chocolate, on top of a red velvet cake with cream cheese frosting.

If you need a special cake, I cannot recommend them highly enough. Not only is the cake delicious, but they put up with my shenanigans year after year. ",False,Portland,t5_2qi2i,self,Piece of Cake Bakery in Sellwood is AMAZING.,http://www.reddit.com/r/Portland/comments/2xphjx/piece_of_cake_bakery_in_sellwood_is_amazing/,,,
slice_of_pi,1345080796.0,,,t2_8omdz,1425328160,kptv.com,https://www.reddit.com/r/Portland/comments/2xpfhi/filmmaker_vets_bike_stolen_jeopardizing_his/,0,2xpfhi,False,{},1,False,/r/Portland/comments/2xpfhi/filmmaker_vets_bike_stolen_jeopardizing_his/,1440876810,1,{},,False,Portland,t5_2qi2i,http://b.thumbs.redditmedia.com/DG68UNwLBGtCHwi_MiTW3fxv3WbBE2pkoHmrgn8fkoU.jpg,"Filmmaker vet's bike stolen, jeopardizing his current project (x-post /r/harley &amp; /r/motorcycles)",http://www.kptv.com/story/28239220/oregon-veterans-film-project-in-jeopardy-after-motorcycle-stolen,,,
tedder42,1246569231.0,,NW,t2_3j8d1,1425327664,imgur.com,https://www.reddit.com/r/Portland/comments/2xpecm/look_at_all_these_car2go_cars_pushing_their_noses/,0,2xpecm,False,"{'content': '&lt;iframe class=""embedly-embed"" src=""//cdn.embedly.com/widgets/media.html?src=http%3A%2F%2Fimgur.com%2Fa%2FSwPAm%2Fembed&amp;url=http%3A%2F%2Fimgur.com%2Fa%2FSwPAm&amp;image=http%3A%2F%2Fi.imgur.com%2Fu479Jpg.jpg&amp;key=2aa3c4d5f3de4f5b9120b660ad850dc9&amp;type=text%2Fhtml&amp;schema=imgur"" width=""550"" height=""550"" scrolling=""no"" frameborder=""0"" allowfullscreen&gt;&lt;/iframe&gt;', 'height': 550, 'scrolling': False, 'width': 550}",46,False,/r/Portland/comments/2xpecm/look_at_all_these_car2go_cars_pushing_their_noses/,1440876825,117,{},,False,Portland,t5_2qi2i,http://b.thumbs.redditmedia.com/maqZ7iWSNn7TSfIKKwAhDuiS_pPHzmGk_KPnXT1cy9Q.jpg,"look at all these car2go cars, pushing their noses against the fence, trying to get out of their cage",http://imgur.com/a/SwPAm,,"{'oembed': {'height': 550, 'html': '&lt;iframe class=""embedly-embed"" src=""//cdn.embedly.com/widgets/media.html?src=http%3A%2F%2Fimgur.com%2Fa%2FSwPAm%2Fembed&amp;url=http%3A%2F%2Fimgur.com%2Fa%2FSwPAm&amp;image=http%3A%2F%2Fi.imgur.com%2Fu479Jpg.jpg&amp;key=2aa3c4d5f3de4f5b9120b660ad850dc9&amp;type=text%2Fhtml&amp;schema=imgur"" width=""550"" height=""550"" scrolling=""no"" frameborder=""0"" allowfullscreen&gt;&lt;/iframe&gt;', 'provider_name': 'Imgur', 'provider_url': 'http://imgur.com', 'thumbnail_height': 1920, 'thumbnail_url': 'http://i.imgur.com/u479Jpg.jpg', 'thumbnail_width': 1080, 'title': 'car2go against boundary 20150302', 'type': 'rich', 'version': '1.0', 'width': 550}, 'type': 'imgur.com'}",
BacteriaEP,1255386167.0,,,t2_3o916,1425325310,self.Portland,https://www.reddit.com/r/Portland/comments/2xp8uo/interested_in_joining_a_mens_d5_futsal_team/,0,2xp8uo,True,{},7,False,/r/Portland/comments/2xp8uo/interested_in_joining_a_mens_d5_futsal_team/,1440876896,0,{},"I'm putting together a team for Rose City Futsal's new Sunday D5 league and we need a few more! If you've ever been interested in joining a team sport or playing futsal this would be a great chance to do it! Lots of fun and a great workout.

Here are the details:

* Games will be on Sundays starting March 15th. We don't know if it's afternoon or night games.
* Rose City Futsal is a great location. Well lit and it comes with a bar.
* 8 games over 8 weeks.
* It'll cost somewhere around $50-$60 for the entire session. Exact amount is based on how many players we have (8-9).

D5 is the lowest level so even if you're new to the sport, you won't be entirely outclassed. We're also pretty supportive. We like to win, but we also like to have fun so if you screw up (which I have multiple times) nobody is going to beat up on you.

There are no tryouts, but if you're a keeper (or a part time keeper) you get preference! Otherwise we're looking for 2-3 guys.

PM or comment here if you're interested or have more questions.

(Might also have a spot opening up for my Thursday evening D5 team)

**UPDATE** All full up guys. Sorry.",False,Portland,t5_2qi2i,self,Interested in joining a men's D5 Futsal team? (Sundays),http://www.reddit.com/r/Portland/comments/2xp8uo/interested_in_joining_a_mens_d5_futsal_team/,1425400415.0,,
coastiefish,1283104192.0,,N Tabor,t2_4agoa,1425324184,oregonlive.com,https://www.reddit.com/r/Portland/comments/2xp684/psa_reminder_zipping_around_a_stopped_trimet_bus/,0,2xp684,False,{},100,False,/r/Portland/comments/2xp684/psa_reminder_zipping_around_a_stopped_trimet_bus/,1440876931,99,{},,False,Portland,t5_2qi2i,http://b.thumbs.redditmedia.com/R62hWyjqwNYfJmMOf0HDVtknqAeCyQQrZqMl_7hujWw.jpg,PSA reminder: Zipping around a stopped TriMet bus is illegal,http://www.oregonlive.com/commuting/index.ssf/2015/03/trimet_portland_bus_driver_sav.html,,,
hotbreadz,1306280286.0,,,t2_5a602,1425323825,i.imgur.com,https://www.reddit.com/r/Portland/comments/2xp5fq/the_mighty_columbia_river_mt_st_helens_from/,0,2xp5fq,False,{},13,False,/r/Portland/comments/2xp5fq/the_mighty_columbia_river_mt_st_helens_from/,1440876940,218,{},,False,Portland,t5_2qi2i,http://b.thumbs.redditmedia.com/rQwWqnePe-ZYmGwJMklpKhOOjL7oQH6KI6_lZBfjkUY.jpg,"The Mighty Columbia River &amp; Mt. St. Helens - From Sauvie Island, OC",http://i.imgur.com/QtxcDc1.jpg,,,
