author,author_flair_css_class,author_flair_richtext,author_flair_text,author_flair_type,can_mod_post,contest_mode,created_utc,domain,full_link,gilded,id,is_crosspostable,is_original_content,is_reddit_media_domain,is_self,is_video,link_flair_richtext,link_flair_text_color,link_flair_type,locked,media_only,no_follow,num_comments,num_crossposts,over_18,parent_whitelist_status,permalink,pinned,pwls,retrieved_on,rte_mode,score,selftext,send_replies,spoiler,stickied,subreddit,subreddit_id,subreddit_subscribers,subreddit_type,thumbnail,title,url,whitelist_status,wls,media,media_embed,post_hint,preview,secure_media,secure_media_embed,thumbnail_height,thumbnail_width,link_flair_background_color,link_flair_css_class,link_flair_text
sencinitas,,[],,text,False,False,1530041647,self.Portland,https://www.reddit.com/r/Portland/comments/8u2y5k/mexican_food_restaurant_that_have_carne_asada/,0,8u2y5k,True,False,False,True,False,[],dark,text,False,False,True,26,0,False,all_ads,/r/Portland/comments/8u2y5k/mexican_food_restaurant_that_have_carne_asada/,False,6,1530041648,markdown,0,"If I go to regular Mexican restaurants and ask for this, the burritos are tiny. I'm looking to get a carne asada burrito like you would get in Rossarito, San Diego or new Mexico. Just carne!

Bonus points if it's in the SE near Hawthorne.",True,False,False,Portland,t5_2qi2i,98255,public,self,Mexican Food restaurant that have carne asada burritos that are just carne asada and guac?,https://www.reddit.com/r/Portland/comments/8u2y5k/mexican_food_restaurant_that_have_carne_asada/,all_ads,6,,,,,,,,,,,
differt,,[],,text,False,False,1530041518,i.redd.it,https://www.reddit.com/r/Portland/comments/8u2xib/i_recently_moved_here_from_savannah_georgia_where/,0,8u2xib,True,False,True,False,False,[],dark,text,False,False,True,38,0,False,all_ads,/r/Portland/comments/8u2xib/i_recently_moved_here_from_savannah_georgia_where/,False,6,1530041519,markdown,0,,True,False,False,Portland,t5_2qi2i,98255,public,default,"I recently moved here from Savannah, Georgia. Where I was doing historic preservation and assisting people with house flipping. I was hoping to do the same here but I’m unsure about historical preservation here in Portland. Any pointers?",https://i.redd.it/t2oe24qgde611.jpg,all_ads,6,,,,,,,,,,,
n0tfunthrowaway,,[],,text,False,False,1530039801,self.Portland,https://www.reddit.com/r/Portland/comments/8u2pb8/unacceptable_behavior_in_sw_be_on_the_lookout_for/,0,8u2pb8,True,False,False,True,False,[],dark,text,False,False,True,0,0,False,all_ads,/r/Portland/comments/8u2pb8/unacceptable_behavior_in_sw_be_on_the_lookout_for/,False,6,1530039801,richtext,1,"Long story short a man that goes by FunHarvey, (on Instagram as @funharvey) has been harassing a group of my friends outside their work in SW. \[He can be seen here\]([https://www.instagram.com/p/BhYZ347nzwO/?taken-by=funharvey](https://www.instagram.com/p/BhYZ347nzwO/?taken-by=funharvey)) deploying the tactics he uses on a daily basis to target single women under the guise of a ""prank"" or ""joke"". Hoping into a strangers car and refusing to leave until they are forced to rate your appearance is not funny, it's borderline rapey. In the video above you can clearly hear the woman stating he is invading her personal space, her safe space, and that he is making her feel uncomfortable. Multiple times. I wanted to make this public here so that if anyone else encounters this ass-hat they can call him out on his bullshit. 

""It's just a prank bro..."" isn't an acceptable excuse for any of this.",True,False,False,Portland,t5_2qi2i,98253,public,self,"Unacceptable behavior in SW, be on the lookout for this man...",https://www.reddit.com/r/Portland/comments/8u2pb8/unacceptable_behavior_in_sw_be_on_the_lookout_for/,all_ads,6,,,,,,,,,,,
acoen01,,[],,text,False,False,1530039339,self.Portland,https://www.reddit.com/r/Portland/comments/8u2mz8/does_portland_receive_less_rain_and_sunshine_than/,0,8u2mz8,True,False,False,True,False,[],dark,text,False,False,True,13,0,False,all_ads,/r/Portland/comments/8u2mz8/does_portland_receive_less_rain_and_sunshine_than/,False,6,1530039340,markdown,0,I’m thinking about Portland as an option to move to and am checking in to see if Portland or Seattle is rainier and which one of the two receives less sunshine. ,True,False,False,Portland,t5_2qi2i,98252,public,self,Does Portland receive less rain and sunshine than Seattle or is equal?,https://www.reddit.com/r/Portland/comments/8u2mz8/does_portland_receive_less_rain_and_sunshine_than/,all_ads,6,,,,,,,,,,,
swiggajuice,,[],,text,False,False,1530036774,self.Portland,https://www.reddit.com/r/Portland/comments/8u2ano/anyone_know_any_mechanic_or_shop_who_can_work_on/,0,8u2ano,True,False,False,True,False,[],dark,text,False,False,True,17,0,False,all_ads,/r/Portland/comments/8u2ano/anyone_know_any_mechanic_or_shop_who_can_work_on/,False,6,1530036776,markdown,15,My daughter owns a short bus that was converted to propane. It broke down (at our house)... She's been calling around all day to find a mechanic or shop who can service that setup... coming up empty. Anyone know of anyone / anyplace?,True,False,False,Portland,t5_2qi2i,98248,public,self,Anyone know any mechanic or shop who can work on a propane-powered short bus?,https://www.reddit.com/r/Portland/comments/8u2ano/anyone_know_any_mechanic_or_shop_who_can_work_on/,all_ads,6,,,,,,,,,,,
Kadamel,,[],,text,False,False,1530036010,self.Portland,https://www.reddit.com/r/Portland/comments/8u26sp/suggestions_on_things_to_do_in_portland/,0,8u26sp,True,False,False,True,False,[],dark,text,False,False,True,5,0,False,all_ads,/r/Portland/comments/8u26sp/suggestions_on_things_to_do_in_portland/,False,6,1530036011,markdown,1,"My partner and I are in Portland for a few months. Still haven’t found a job (sigh), so I’m looking for suggestions on things to do! I am on my own most of the time as he works 10am - 9pm Monday through Saturday. I have already done some exploring, mostly of the coast. So any suggestions on things closer to Portland. I’ve seen multnomah falls and as much as I could along the gorge, with it being closed and all. Ive done the zoo (where I’m doing some volunteering), Hoyt Arboretum, and the Japanese gardens. I love Oregon so far. Any suggestions appreciated!! Outdoorsy to museums to urban areas/neighborhoods. 

Thanks!",True,False,False,Portland,t5_2qi2i,98245,public,self,Suggestions on things to do in Portland!,https://www.reddit.com/r/Portland/comments/8u26sp/suggestions_on_things_to_do_in_portland/,all_ads,6,,,,,,,,,,,
popopintheattic,,[],,text,False,False,1530035729,self.Portland,https://www.reddit.com/r/Portland/comments/8u25ew/garbage_plate_in_portland/,0,8u25ew,True,False,False,True,False,[],dark,text,False,False,True,20,0,False,all_ads,/r/Portland/comments/8u25ew/garbage_plate_in_portland/,False,6,1530035730,markdown,3,"When I visited Rochester, NY some years back, I had a garbage plate and fell in love with it! I have a huge craving for one now, but don't know where to find a place that serves them. 

Anyone know of a restaurant/bar that serves Garbage Plates in the Portland area?",True,False,False,Portland,t5_2qi2i,98245,public,self,Garbage Plate in Portland?,https://www.reddit.com/r/Portland/comments/8u25ew/garbage_plate_in_portland/,all_ads,6,,,,,,,,,,,
ckern82,,[],,text,False,False,1530033866,i.redd.it,https://www.reddit.com/r/Portland/comments/8u1vtk/update_he_is_hanging_a_bit_lower_this_morning/,0,8u1vtk,True,False,True,False,False,"[{'e': 'text', 't': 'Photo'}]",dark,richtext,False,False,True,52,0,False,all_ads,/r/Portland/comments/8u1vtk/update_he_is_hanging_a_bit_lower_this_morning/,False,6,1530033868,markdown,385,,True,False,False,Portland,t5_2qi2i,98239,public,https://a.thumbs.redditmedia.com/mh-HBXOaABfGP3OORJVqzcZYDMaXMyaFPxh7_stF174.jpg,Update: he is hanging a bit lower this morning,https://i.redd.it/z1ofbahpqd611.jpg,all_ads,6,,,image,"{'enabled': True, 'images': [{'id': 'Cokz0EDiwUT8hQ7v2fpdA5jysvbu7Ewpnslgxj-4gT8', 'resolutions': [{'height': 123, 'url': 'https://i.redditmedia.com/H3lwx3tHppexO4WmgVe96NgVDVC3_GteeEza0p-qJdw.jpg?fit=crop&amp;crop=faces%2Centropy&amp;arh=2&amp;w=108&amp;s=bbd1ae369ea2a97032fea8304b66a4ed', 'width': 108}, {'height': 246, 'url': 'https://i.redditmedia.com/H3lwx3tHppexO4WmgVe96NgVDVC3_GteeEza0p-qJdw.jpg?fit=crop&amp;crop=faces%2Centropy&amp;arh=2&amp;w=216&amp;s=338687a238d16a87cd7ff79475eea368', 'width': 216}, {'height': 364, 'url': 'https://i.redditmedia.com/H3lwx3tHppexO4WmgVe96NgVDVC3_GteeEza0p-qJdw.jpg?fit=crop&amp;crop=faces%2Centropy&amp;arh=2&amp;w=320&amp;s=c5776cef6dcdf04e1873db1ab9f7aa26', 'width': 320}, {'height': 729, 'url': 'https://i.redditmedia.com/H3lwx3tHppexO4WmgVe96NgVDVC3_GteeEza0p-qJdw.jpg?fit=crop&amp;crop=faces%2Centropy&amp;arh=2&amp;w=640&amp;s=e3b582c3623c2758fe4639cb38db5c54', 'width': 640}, {'height': 1093, 'url': 'https://i.redditmedia.com/H3lwx3tHppexO4WmgVe96NgVDVC3_GteeEza0p-qJdw.jpg?fit=crop&amp;crop=faces%2Centropy&amp;arh=2&amp;w=960&amp;s=045ebb698450b23ec535401a1437d168', 'width': 960}, {'height': 1230, 'url': 'https://i.redditmedia.com/H3lwx3tHppexO4WmgVe96NgVDVC3_GteeEza0p-qJdw.jpg?fit=crop&amp;crop=faces%2Centropy&amp;arh=2&amp;w=1080&amp;s=ff48e801ab6eb0d405ed254ad22f6f85', 'width': 1080}], 'source': {'height': 2558, 'url': 'https://i.redditmedia.com/H3lwx3tHppexO4WmgVe96NgVDVC3_GteeEza0p-qJdw.jpg?s=d721d0bdd2e333dd53019bea0f4bcbbd', 'width': 2245}, 'variants': {}}]}",,,140.0,140.0,,photo,Photo
ME_2017,,[],,text,False,False,1530033300,self.Portland,https://www.reddit.com/r/Portland/comments/8u1swu/can_someone_recommend_a_tattoo_artist_with_a/,0,8u1swu,True,False,False,True,False,[],dark,text,False,False,True,6,0,False,all_ads,/r/Portland/comments/8u1swu/can_someone_recommend_a_tattoo_artist_with_a/,False,6,1530033301,markdown,0,"Title says all. Looking to get a pretty detailed realistic piece of my chest. This is gonna be my first decent sized, detailed, and noticeable tattoo and I'm fairly new to the Portland area, so I want to make sure I can connect with a good artist.

Thanks!",True,False,False,Portland,t5_2qi2i,98239,public,self,Can someone recommend a tattoo artist with a decent portfolio of realistic tattoo work?,https://www.reddit.com/r/Portland/comments/8u1swu/can_someone_recommend_a_tattoo_artist_with_a/,all_ads,6,,,,,,,,,,,
CyclingIsLove,,[],,text,False,False,1530032142,cityobservatory.org,https://www.reddit.com/r/Portland/comments/8u1n3u/portland_votes_to_increase_housing_supply/,0,8u1n3u,True,False,False,False,False,[],dark,text,False,False,True,89,0,False,all_ads,/r/Portland/comments/8u1n3u/portland_votes_to_increase_housing_supply/,False,6,1530032142,markdown,50,,False,False,False,Portland,t5_2qi2i,98236,public,default,Portland votes to increase housing supply,http://cityobservatory.org/portland-votes-to-increase-housing-supply/,all_ads,6,,,,,,,,,,,
shwiftyget,,[],,text,False,False,1530030912,i.redd.it,https://www.reddit.com/r/Portland/comments/8u1gvi/1337/,0,8u1gvi,True,False,True,False,False,[],dark,text,False,False,True,5,0,False,all_ads,/r/Portland/comments/8u1gvi/1337/,False,6,1530030913,markdown,0,,True,False,False,Portland,t5_2qi2i,98234,public,https://b.thumbs.redditmedia.com/1miUohGxr1VyArMsQxCui_IbH9j745PeImi6Eu46lbo.jpg,1337,https://i.redd.it/ryzd2u7vhd611.jpg,all_ads,6,,,image,"{'enabled': True, 'images': [{'id': 'xi29kdVXj3RY57Su87EkitJBR-1Qe7i4R6uF-5jaBI8', 'resolutions': [{'height': 141, 'url': 'https://i.redditmedia.com/Q5a5D11pl4vJjrCFs8Da6TqXzHOt26DmPkddSA0d-GQ.jpg?fit=crop&amp;crop=faces%2Centropy&amp;arh=2&amp;w=108&amp;s=5e80048cd953f1bceeac11a37af2f888', 'width': 108}, {'height': 283, 'url': 'https://i.redditmedia.com/Q5a5D11pl4vJjrCFs8Da6TqXzHOt26DmPkddSA0d-GQ.jpg?fit=crop&amp;crop=faces%2Centropy&amp;arh=2&amp;w=216&amp;s=74e680d26923986429109e365a5901b2', 'width': 216}], 'source': {'height': 367, 'url': 'https://i.redditmedia.com/Q5a5D11pl4vJjrCFs8Da6TqXzHOt26DmPkddSA0d-GQ.jpg?s=3ee6da5f0878a675dace119443c1695b', 'width': 280}, 'variants': {}}]}",,,140.0,140.0,,,
Alice_B_Tokeless,,[],,text,False,False,1530030242,oregonlive.com,https://www.reddit.com/r/Portland/comments/8u1dgc/trans_woman_who_set_herself_on_fire_in_portland/,0,8u1dgc,True,False,False,False,False,"[{'e': 'text', 't': 'Local News'}]",dark,richtext,False,False,True,23,0,False,all_ads,/r/Portland/comments/8u1dgc/trans_woman_who_set_herself_on_fire_in_portland/,False,6,1530030244,markdown,0,,False,False,False,Portland,t5_2qi2i,98233,public,default,"Trans woman, who set herself on fire in Portland park, remembered as 'brilliant and tortured' artist",https://www.oregonlive.com/portland/index.ssf/2018/06/woman_who_set_self_on_fire_in.html,all_ads,6,,,,,,,,,,local-news,Local News
DefinitelyNotMartinC,,[],,text,False,False,1530027780,kgw.com,https://www.reddit.com/r/Portland/comments/8u117m/chicken_activist_arrested_after_standoff_with/,0,8u117m,True,False,False,False,False,"[{'e': 'text', 't': 'Local News'}]",dark,richtext,False,False,True,39,0,False,all_ads,/r/Portland/comments/8u117m/chicken_activist_arrested_after_standoff_with/,False,6,1530027782,markdown,43,,False,False,False,Portland,t5_2qi2i,98228,public,default,Chicken activist arrested after standoff with police at scene of truck collision.,https://www.kgw.com/article/news/local/vancouver/standoff-with-activists-at-scene-of-chicken-truck-trash-ends-with-1-in-custody/283-567402612,all_ads,6,,,,,,,,,,local-news,Local News
lauraisunder,,[],,text,False,False,1530023360,self.Portland,https://www.reddit.com/r/Portland/comments/8u0gb0/looking_for_an_offleash_area_for_my_dog_to_go/,0,8u0gb0,True,False,False,True,False,[],dark,text,False,False,True,21,0,False,all_ads,/r/Portland/comments/8u0gb0/looking_for_an_offleash_area_for_my_dog_to_go/,False,6,1530023362,markdown,13,"Other than the coast, what are some good places to take a dog to? My dog has bad legs, and can’t swim too well (but he loves it!) so he needs a life jacket, and I don’t really want to take him to 1000 acre dog park due to how busy it can get. What lakes and slow rivers are good for your pups?? Something with easy lake access or a view would be nice. We are new to the area so we don’t know of much. ",True,False,False,Portland,t5_2qi2i,98227,public,self,Looking for an off-leash area for my dog to go swimming at,https://www.reddit.com/r/Portland/comments/8u0gb0/looking_for_an_offleash_area_for_my_dog_to_go/,all_ads,6,,,,,,,,,,,
wattadaga,,[],,text,False,False,1530022677,self.Portland,https://www.reddit.com/r/Portland/comments/8u0d8c/whats_it_like_to_live_in_portland/,0,8u0d8c,True,False,False,True,False,[],dark,text,False,False,True,14,0,False,all_ads,/r/Portland/comments/8u0d8c/whats_it_like_to_live_in_portland/,False,6,1530022678,richtext,0,"Im from the boroughs of NYC. I was wondering if any of you guys could leave a comment, big or small, about what it's like living in Portland, the pros and cons, and the things that make you never want to leave. Thanks to any help I can get!",True,False,False,Portland,t5_2qi2i,98227,public,self,What's it like to live in Portland?,https://www.reddit.com/r/Portland/comments/8u0d8c/whats_it_like_to_live_in_portland/,all_ads,6,,,,,,,,,,,
tit_curtain,,[],,text,False,False,1530020509,wweek.com,https://www.reddit.com/r/Portland/comments/8u03nn/state_advisory_group_votes_for_tolls_on_portions/,0,8u03nn,True,False,False,False,False,"[{'e': 'text', 't': 'Local News'}]",dark,richtext,False,False,True,357,0,False,all_ads,/r/Portland/comments/8u03nn/state_advisory_group_votes_for_tolls_on_portions/,False,6,1530020510,markdown,232,,True,False,False,Portland,t5_2qi2i,98225,public,https://a.thumbs.redditmedia.com/VaA1QW8HRQK9cZhXBc0PrHlFVeoT6gHTYrGaG9wwDs4.jpg,State Advisory Group Votes for Tolls on Portions of I-5 and I-205 in Portland,http://www.wweek.com/news/city/2018/06/25/state-advisory-group-votes-for-tolls-on-portions-of-i-5-and-i-205-in-portland/,all_ads,6,,,link,"{'enabled': False, 'images': [{'id': 'LFDJZn2NXHN9-IQJyIgkEIAhXii5qv0YTMq0TvHJJDU', 'resolutions': [{'height': 64, 'url': 'https://i.redditmedia.com/Ad2-acjjF0RJ6Uzvyh47LaUA0exfC7gP-euuuUA9bmc.jpg?fit=crop&amp;crop=faces%2Centropy&amp;arh=2&amp;w=108&amp;s=a32ceb202becf8518cbfa8971f14c12d', 'width': 108}, {'height': 129, 'url': 'https://i.redditmedia.com/Ad2-acjjF0RJ6Uzvyh47LaUA0exfC7gP-euuuUA9bmc.jpg?fit=crop&amp;crop=faces%2Centropy&amp;arh=2&amp;w=216&amp;s=751615dff085c4e9219d8ac2dbc1fc6d', 'width': 216}, {'height': 192, 'url': 'https://i.redditmedia.com/Ad2-acjjF0RJ6Uzvyh47LaUA0exfC7gP-euuuUA9bmc.jpg?fit=crop&amp;crop=faces%2Centropy&amp;arh=2&amp;w=320&amp;s=5456c9e891814475eb4d7db6386f3a78', 'width': 320}, {'height': 384, 'url': 'https://i.redditmedia.com/Ad2-acjjF0RJ6Uzvyh47LaUA0exfC7gP-euuuUA9bmc.jpg?fit=crop&amp;crop=faces%2Centropy&amp;arh=2&amp;w=640&amp;s=53feeefc8bdf3aa0ae29f8dc49e70e3b', 'width': 640}, {'height': 576, 'url': 'https://i.redditmedia.com/Ad2-acjjF0RJ6Uzvyh47LaUA0exfC7gP-euuuUA9bmc.jpg?fit=crop&amp;crop=faces%2Centropy&amp;arh=2&amp;w=960&amp;s=aa14e4caeb5be5fcff78040b3550213d', 'width': 960}, {'height': 648, 'url': 'https://i.redditmedia.com/Ad2-acjjF0RJ6Uzvyh47LaUA0exfC7gP-euuuUA9bmc.jpg?fit=crop&amp;crop=faces%2Centropy&amp;arh=2&amp;w=1080&amp;s=4c9b3ac7c97e835c05287d7514445b87', 'width': 1080}], 'source': {'height': 720, 'url': 'https://i.redditmedia.com/Ad2-acjjF0RJ6Uzvyh47LaUA0exfC7gP-euuuUA9bmc.jpg?s=74919e19b529533431cf21fa90b39ffc', 'width': 1200}, 'variants': {}}]}",,,84.0,140.0,,local-news,Local News
Nonredditar,,[],,text,False,False,1530009323,self.Portland,https://www.reddit.com/r/Portland/comments/8tyyvt/my_car_got_broken_into_tonight_literally_the_only/,0,8tyyvt,True,False,False,True,False,[],dark,text,False,False,True,0,0,False,all_ads,/r/Portland/comments/8tyyvt/my_car_got_broken_into_tonight_literally_the_only/,False,6,1530009324,markdown,1,,True,False,False,Portland,t5_2qi2i,98222,public,self,My car got broken into tonight... literally the only thing out in the open was an iPhone charger cord... nothing is safe in plain sight FYI..,https://www.reddit.com/r/Portland/comments/8tyyvt/my_car_got_broken_into_tonight_literally_the_only/,all_ads,6,,,,,,,,,,,
cratermoon,,[],,text,False,False,1529994782,kgw.com,https://www.reddit.com/r/Portland/comments/8txswz/brush_fire_off_of_i84_near_rufus_oregon_here_we/,0,8txswz,True,False,False,False,False,"[{'e': 'text', 't': 'Local News'}]",dark,richtext,False,False,True,27,0,False,all_ads,/r/Portland/comments/8txswz/brush_fire_off_of_i84_near_rufus_oregon_here_we/,False,6,1529994783,markdown,10,,True,False,False,Portland,t5_2qi2i,98217,public,default,"Brush fire off of I-84 near Rufus, Oregon [Here we go again..]",https://www.kgw.com/gallery/news/brush-fire-off-of-i-84-near-rufus-oregon/283-312607744,all_ads,6,,,,,,,,,,local-news,Local News
iateburritojesus,,[],,text,False,False,1529990123,/r/Portland/comments/8txe41/it_got_boring_after_the_first_100/,https://www.reddit.com/r/Portland/comments/8txe41/it_got_boring_after_the_first_100/,0,8txe41,True,False,False,False,True,[],dark,text,False,False,True,53,0,False,all_ads,/r/Portland/comments/8txe41/it_got_boring_after_the_first_100/,False,6,1529990125,markdown,115,,True,False,False,Portland,t5_2qi2i,98205,public,https://b.thumbs.redditmedia.com/9KMp3oFNFDuBUHMhqhmZDbDWMRAgdyLpm_h1JK1xuLo.jpg,It got boring after the first 100.,https://v.redd.it/x0gsohhi4a611,all_ads,6,,,hosted:video,"{'enabled': False, 'images': [{'id': 'GhuL-JL3kObwxfPFRRW4lAMqAIxwUX60hvabxjQ0izg', 'resolutions': [{'height': 60, 'url': 'https://i.redditmedia.com/PqvzmQaPtxM3n__k2Cw9W11wTu-SqO5qJeT9ZVr-tn8.png?fit=crop&amp;crop=faces%2Centropy&amp;arh=2&amp;w=108&amp;s=21668d296e8dbece6c4ff305310d801d', 'width': 108}, {'height': 121, 'url': 'https://i.redditmedia.com/PqvzmQaPtxM3n__k2Cw9W11wTu-SqO5qJeT9ZVr-tn8.png?fit=crop&amp;crop=faces%2Centropy&amp;arh=2&amp;w=216&amp;s=406430b2f020a1e8042b85c91f84899c', 'width': 216}, {'height': 180, 'url': 'https://i.redditmedia.com/PqvzmQaPtxM3n__k2Cw9W11wTu-SqO5qJeT9ZVr-tn8.png?fit=crop&amp;crop=faces%2Centropy&amp;arh=2&amp;w=320&amp;s=0b6de8d3c3cc4474868941ed962dd21a', 'width': 320}, {'height': 360, 'url': 'https://i.redditmedia.com/PqvzmQaPtxM3n__k2Cw9W11wTu-SqO5qJeT9ZVr-tn8.png?fit=crop&amp;crop=faces%2Centropy&amp;arh=2&amp;w=640&amp;s=0c162cc19f6875cc316647022997006c', 'width': 640}], 'source': {'height': 406, 'url': 'https://i.redditmedia.com/PqvzmQaPtxM3n__k2Cw9W11wTu-SqO5qJeT9ZVr-tn8.png?s=e1cd580ed2808051f9c985f202ef0ba4', 'width': 720}, 'variants': {}}]}",,,78.0,140.0,,,
comebackkitcat,,[],,text,False,False,1529987624,imgur.com,https://www.reddit.com/r/Portland/comments/8tx5my/lost_cat_in_scappoose_near_the_shoe_factory/,0,8tx5my,False,False,False,False,False,[],dark,text,False,False,True,17,0,False,all_ads,/r/Portland/comments/8tx5my/lost_cat_in_scappoose_near_the_shoe_factory/,False,6,1529987625,markdown,156,,True,False,False,Portland,t5_2qi2i,98199,public,default,Lost cat in Scappoose near the shoe factory neighborhood. Please message me if you've seen her. She is microchipped but has no collar.,https://imgur.com/ilQp7QZ,all_ads,6,,,,,,,,,,,
InsideOutRound,,[],,text,False,False,1529987224,self.Portland,https://www.reddit.com/r/Portland/comments/8tx47s/solo_48_hours_in_portland/,0,8tx47s,True,False,False,True,False,[],dark,text,False,False,True,6,0,False,all_ads,/r/Portland/comments/8tx47s/solo_48_hours_in_portland/,False,6,1529987225,richtext,2,"Hey y'all! Single female in her late 20s here. I'm going to Portland soon for a 2 day trip by myself. I basically want to eat and see the gorge. Any good spots to check out? Maybe a place that's hard to get into but might have a seat at the bar?

Thanks so much!",True,False,False,Portland,t5_2qi2i,98197,public,self,Solo 48 hours in Portland?,https://www.reddit.com/r/Portland/comments/8tx47s/solo_48_hours_in_portland/,all_ads,6,,,,,,,,,,,
Glorious_Bustard,,[],,text,False,False,1529986774,imgur.com,https://www.reddit.com/r/Portland/comments/8tx2my/orange_van/,0,8tx2my,True,False,False,False,False,"[{'e': 'text', 't': 'Photo'}]",dark,richtext,False,False,True,2,0,False,all_ads,/r/Portland/comments/8tx2my/orange_van/,False,6,1529986776,markdown,9,,True,False,False,Portland,t5_2qi2i,98195,public,default,Orange Van,https://imgur.com/LZA3MAe,all_ads,6,,,,,,,,,,photo,Photo
ICantGoForThat5,,[],,text,False,False,1529986695,mobile.nytimes.com,https://www.reddit.com/r/Portland/comments/8tx2bw/the_not_so_distant_future_of_portland_restaurants/,0,8tx2bw,True,False,False,False,False,[],dark,text,False,False,True,9,0,False,all_ads,/r/Portland/comments/8tx2bw/the_not_so_distant_future_of_portland_restaurants/,False,6,1529986695,markdown,0,,True,False,False,Portland,t5_2qi2i,98195,public,default,The not so distant future of Portland restaurants,https://mobile.nytimes.com/2018/06/25/dining/san-francisco-restaurants-service.html?smid=fb-nytimes&amp;smtyp=cur,all_ads,6,,,,,,,,,,,
seethinksay,,[],,text,False,False,1529985944,oregonlive.com,https://www.reddit.com/r/Portland/comments/8twzl5/portland_city_bureau_assignment_discussion/,0,8twzl5,True,False,False,False,False,[],dark,text,False,False,True,23,0,False,all_ads,/r/Portland/comments/8twzl5/portland_city_bureau_assignment_discussion/,False,6,1529985945,markdown,7,,False,False,False,Portland,t5_2qi2i,98194,public,default,Portland city bureau assignment discussion,https://www.oregonlive.com/portland/index.ssf/2018/06/mayor_wheeler_may_shake_up_por.html,all_ads,6,,,,,,,,,,,
TheeOperator,,[],,text,False,False,1529984001,self.Portland,https://www.reddit.com/r/Portland/comments/8twsdg/vacation_sept_1522/,0,8twsdg,False,False,False,True,False,[],dark,text,False,False,True,1,0,False,all_ads,/r/Portland/comments/8twsdg/vacation_sept_1522/,False,6,1529984003,markdown,1,[removed],True,False,False,Portland,t5_2qi2i,98192,public,self,Vacation; Sept. 15-22,https://www.reddit.com/r/Portland/comments/8twsdg/vacation_sept_1522/,all_ads,6,,,,,,,,,,,
wmlaws3,,[],,text,False,False,1529982725,self.Portland,https://www.reddit.com/r/Portland/comments/8twnlc/3_guys_from_portland_on_the_high_river_trail/,0,8twnlc,True,False,False,True,False,[],dark,text,False,False,True,1,0,False,all_ads,/r/Portland/comments/8twnlc/3_guys_from_portland_on_the_high_river_trail/,False,6,1529982726,markdown,0,"Thanks for the food recommendations and the conversation.  Already had the burger at Higgins and loved it. To our trail buddies: we're starting at Prasad for breakfast, I'm buying if your hungry.
",True,False,False,Portland,t5_2qi2i,98191,public,self,3 guys from Portland on the High River Trail,https://www.reddit.com/r/Portland/comments/8twnlc/3_guys_from_portland_on_the_high_river_trail/,all_ads,6,,,,,,,,,,,
bowlieandboo,,[],,text,False,False,1529978485,i.redd.it,https://www.reddit.com/r/Portland/comments/8tw78j/just_because_you_have_an_opinion_doesnt_mean_its/,0,8tw78j,True,False,True,False,False,"[{'e': 'text', 't': 'Photo'}]",dark,richtext,False,False,True,11,0,False,all_ads,/r/Portland/comments/8tw78j/just_because_you_have_an_opinion_doesnt_mean_its/,False,6,1529978487,markdown,0,,True,False,False,Portland,t5_2qi2i,98185,public,default,Just because you have an opinion doesn’t mean it’s right.,https://i.redd.it/vcafo59069611.jpg,all_ads,6,,,,,,,,,,photo,Photo
spyro503thedragon,,[],,text,False,False,1529978269,self.Portland,https://www.reddit.com/r/Portland/comments/8tw6dl/looking_for_addy_adderall_around_portland/,0,8tw6dl,False,False,False,True,False,[],dark,text,False,False,True,0,0,False,all_ads,/r/Portland/comments/8tw6dl/looking_for_addy_adderall_around_portland/,False,6,1529978270,richtext,1,[removed],True,False,False,Portland,t5_2qi2i,98185,public,self,Looking for Addy Adderall around portland,https://www.reddit.com/r/Portland/comments/8tw6dl/looking_for_addy_adderall_around_portland/,all_ads,6,,,,,,,,,,,
