all_awardings,allow_live_comments,author,author_flair_css_class,author_flair_richtext,author_flair_text,author_flair_type,author_fullname,author_patreon_flair,author_premium,awarders,can_mod_post,contest_mode,created_utc,domain,full_link,gildings,id,is_crosspostable,is_meta,is_original_content,is_reddit_media_domain,is_robot_indexable,is_self,is_video,link_flair_background_color,link_flair_css_class,link_flair_richtext,link_flair_text,link_flair_text_color,link_flair_type,locked,media_only,no_follow,num_comments,num_crossposts,over_18,parent_whitelist_status,permalink,pinned,post_hint,preview,pwls,retrieved_on,score,selftext,send_replies,spoiler,stickied,subreddit,subreddit_id,subreddit_subscribers,subreddit_type,suggested_sort,thumbnail,thumbnail_height,thumbnail_width,title,total_awards_received,treatment_tags,upvote_ratio,url,url_overridden_by_dest,whitelist_status,wls,author_flair_template_id,author_flair_text_color,removed_by_category,author_flair_background_color,gallery_data,is_gallery,media_metadata,media,media_embed,secure_media,secure_media_embed,banned_by,edited,link_flair_template_id
[],False,VengeanceRose,,[],,text,t2_1j9e95ye,False,False,[],False,False,1610823603,i.redd.it,https://www.reddit.com/r/Portland/comments/kyoxpk/friends_car_stolen_in_kenton/,{},kyoxpk,True,False,False,True,True,False,False,,photo,[],Photo,dark,text,False,False,True,5,0,False,all_ads,/r/Portland/comments/kyoxpk/friends_car_stolen_in_kenton/,False,image,"{'enabled': True, 'images': [{'id': 'ICBscfEPvpzjvLscB8XkZ_DwalSgOtlgE5HQeWKBSzI', 'resolutions': [{'height': 188, 'url': 'https://preview.redd.it/goonjqr2sqb61.jpg?width=108&amp;crop=smart&amp;auto=webp&amp;s=1175a066f0162e7177233fcdcc993e90d14f0e4d', 'width': 108}, {'height': 376, 'url': 'https://preview.redd.it/goonjqr2sqb61.jpg?width=216&amp;crop=smart&amp;auto=webp&amp;s=30761980f65d99ce45bcc89b7ffc0ea81c365c3f', 'width': 216}, {'height': 557, 'url': 'https://preview.redd.it/goonjqr2sqb61.jpg?width=320&amp;crop=smart&amp;auto=webp&amp;s=73a26804abd5bcd5ef5f4f77bd53d6dc3871c55e', 'width': 320}, {'height': 1114, 'url': 'https://preview.redd.it/goonjqr2sqb61.jpg?width=640&amp;crop=smart&amp;auto=webp&amp;s=0c57f19821c51f0f2599a0668590dd4eac7ef7b4', 'width': 640}], 'source': {'height': 1442, 'url': 'https://preview.redd.it/goonjqr2sqb61.jpg?auto=webp&amp;s=4306c9620df9931936634a08bf338197d4f36070', 'width': 828}, 'variants': {}}]}",6,1610824052,0,,True,False,False,Portland,t5_2qi2i,188626,public,confidence,https://b.thumbs.redditmedia.com/UR4-xXbOzD6Dk58PGvjbmvVoVCz_ojCeHcMMhGxug7M.jpg,140.0,140.0,Friend's Car stolen in Kenton,0,[],0.5,https://i.redd.it/goonjqr2sqb61.jpg,https://i.redd.it/goonjqr2sqb61.jpg,all_ads,6,,,,,,,,,,,,,,
[],False,My_Lucid_Dreams,,[],NE,text,t2_22alownk,False,False,[],False,False,1610823141,salemhealth.org,https://www.reddit.com/r/Portland/comments/kyoseu/parents_of_developmentally_disabled_autistic/,{},kyoseu,False,False,False,False,False,False,False,,,[],,dark,text,False,False,True,32,0,False,all_ads,/r/Portland/comments/kyoseu/parents_of_developmentally_disabled_autistic/,False,link,"{'enabled': False, 'images': [{'id': 'j3ZVqTMK_cXXaPp9gyg4ePmFmb_bn7hRYrGc7eAEMsc', 'resolutions': [{'height': 145, 'url': 'https://external-preview.redd.it/cSoWv7l671ghMXIkyqd6tpXQbderq2HmiM3ofH-yEsM.jpg?width=108&amp;crop=smart&amp;auto=webp&amp;s=47583068287c5cbdae221018b8221977c4229908', 'width': 108}, {'height': 290, 'url': 'https://external-preview.redd.it/cSoWv7l671ghMXIkyqd6tpXQbderq2HmiM3ofH-yEsM.jpg?width=216&amp;crop=smart&amp;auto=webp&amp;s=f56e52788bb8f280a0d5a845f25714b0d8a74af8', 'width': 216}, {'height': 430, 'url': 'https://external-preview.redd.it/cSoWv7l671ghMXIkyqd6tpXQbderq2HmiM3ofH-yEsM.jpg?width=320&amp;crop=smart&amp;auto=webp&amp;s=952a01c67bfcbb5fc237cd2a0ee42484181962d6', 'width': 320}, {'height': 861, 'url': 'https://external-preview.redd.it/cSoWv7l671ghMXIkyqd6tpXQbderq2HmiM3ofH-yEsM.jpg?width=640&amp;crop=smart&amp;auto=webp&amp;s=5238e02b55aabf30d99635e147360503e420b8fa', 'width': 640}, {'height': 1292, 'url': 'https://external-preview.redd.it/cSoWv7l671ghMXIkyqd6tpXQbderq2HmiM3ofH-yEsM.jpg?width=960&amp;crop=smart&amp;auto=webp&amp;s=0a6d18e64347d678424add3765e3be4216b03489', 'width': 960}, {'height': 1454, 'url': 'https://external-preview.redd.it/cSoWv7l671ghMXIkyqd6tpXQbderq2HmiM3ofH-yEsM.jpg?width=1080&amp;crop=smart&amp;auto=webp&amp;s=82f083f54143f4a525b39dd3ea7cfae5612fcd09', 'width': 1080}], 'source': {'height': 2059, 'url': 'https://external-preview.redd.it/cSoWv7l671ghMXIkyqd6tpXQbderq2HmiM3ofH-yEsM.jpg?auto=webp&amp;s=7766d5dab186dcdf2c01d5b960971be52a585c54', 'width': 1529}, 'variants': {}}]}",6,1610823596,1,,False,False,False,Portland,t5_2qi2i,188624,public,confidence,https://b.thumbs.redditmedia.com/yAMwZ7pP9z5zCrOHifQxshnax7T9Wx16vcrymu3dTqw.jpg,140.0,140.0,Parents of developmentally disabled / autistic children are eligible for COVID vaccine now as part of Phase 1A Group 3,0,[],1.0,https://www.salemhealth.org/covid-19/covid-vaccine,https://www.salemhealth.org/covid-19/covid-vaccine,all_ads,6,02698216-4254-11e1-a562-12313b08a511,dark,automod_filtered,,,,,,,,,,,
[],False,RiseCascadia,,[],,text,t2_ehnft,False,False,[],False,False,1610823101,theguardian.com,https://www.reddit.com/r/Portland/comments/kyoryu/us_capitol_riot_police_have_long_history_of/,{},kyoryu,False,False,False,False,False,False,False,,,[],,dark,text,False,False,True,0,0,False,all_ads,/r/Portland/comments/kyoryu/us_capitol_riot_police_have_long_history_of/,False,link,"{'enabled': False, 'images': [{'id': '-sH0edWTzi-unh-zLWpe8VFMdqvLa4qptN2zeTxbBBM', 'resolutions': [{'height': 56, 'url': 'https://external-preview.redd.it/jDXaZUdLtDQ0nEklwQ2ypf6PDMI6rzqTKQdVwWJ0EEk.jpg?width=108&amp;crop=smart&amp;auto=webp&amp;s=6efbd1769291603819486c63bab436f199ae45d6', 'width': 108}, {'height': 113, 'url': 'https://external-preview.redd.it/jDXaZUdLtDQ0nEklwQ2ypf6PDMI6rzqTKQdVwWJ0EEk.jpg?width=216&amp;crop=smart&amp;auto=webp&amp;s=41aa38200cfecb97f812fc8763b6b4fb742369bc', 'width': 216}, {'height': 168, 'url': 'https://external-preview.redd.it/jDXaZUdLtDQ0nEklwQ2ypf6PDMI6rzqTKQdVwWJ0EEk.jpg?width=320&amp;crop=smart&amp;auto=webp&amp;s=990de17a04316536f0e109d187814d6298a8fc78', 'width': 320}, {'height': 336, 'url': 'https://external-preview.redd.it/jDXaZUdLtDQ0nEklwQ2ypf6PDMI6rzqTKQdVwWJ0EEk.jpg?width=640&amp;crop=smart&amp;auto=webp&amp;s=3a989c05361d3d94bf93687f691b8728bc040852', 'width': 640}, {'height': 504, 'url': 'https://external-preview.redd.it/jDXaZUdLtDQ0nEklwQ2ypf6PDMI6rzqTKQdVwWJ0EEk.jpg?width=960&amp;crop=smart&amp;auto=webp&amp;s=6b85e2e14d96fa753ef0149e0e0c67444740a398', 'width': 960}, {'height': 567, 'url': 'https://external-preview.redd.it/jDXaZUdLtDQ0nEklwQ2ypf6PDMI6rzqTKQdVwWJ0EEk.jpg?width=1080&amp;crop=smart&amp;auto=webp&amp;s=36057ebe1301ce21f8d00f5d3e312ff1189d2e5b', 'width': 1080}], 'source': {'height': 630, 'url': 'https://external-preview.redd.it/jDXaZUdLtDQ0nEklwQ2ypf6PDMI6rzqTKQdVwWJ0EEk.jpg?auto=webp&amp;s=75705969b53016185902ae846c5b79f42163e6a8', 'width': 1200}, 'variants': {}}]}",6,1610823556,1,,True,False,False,Portland,t5_2qi2i,188624,public,confidence,https://b.thumbs.redditmedia.com/VnliLI8p5YHfZGHux3UrOPON7ADVRhE8ztmaatkwOVs.jpg,73.0,140.0,US Capitol riot: police have long history of aiding neo-Nazis and extremists,0,[],1.0,https://www.theguardian.com/us-news/2021/jan/16/us-capitol-riot-police-neo-nazis-far-right,https://www.theguardian.com/us-news/2021/jan/16/us-capitol-riot-police-neo-nazis-far-right,all_ads,6,,,automod_filtered,,,,,,,,,,,
[],False,knowwhatimean_vern,,[],,text,t2_w3kwoyo,False,False,[],False,False,1610822813,i.redd.it,https://www.reddit.com/r/Portland/comments/kyooij/go_outside_take_in_the_sunshine_and/,{},kyooij,True,False,False,True,True,False,False,,photo,[],Photo,dark,text,False,False,False,12,0,False,all_ads,/r/Portland/comments/kyooij/go_outside_take_in_the_sunshine_and/,False,image,"{'enabled': True, 'images': [{'id': 'aM2GAzlOjwnECYyDi08QS5F7iiYXQ6ZALFmwdr03hDQ', 'resolutions': [{'height': 55, 'url': 'https://preview.redd.it/qisk555qpqb61.jpg?width=108&amp;crop=smart&amp;auto=webp&amp;s=ce002df56be0f15cf2a9bb849a6c835aac2aeb01', 'width': 108}, {'height': 110, 'url': 'https://preview.redd.it/qisk555qpqb61.jpg?width=216&amp;crop=smart&amp;auto=webp&amp;s=f009da427228c98cdd7d70c24ada310934b735ed', 'width': 216}, {'height': 164, 'url': 'https://preview.redd.it/qisk555qpqb61.jpg?width=320&amp;crop=smart&amp;auto=webp&amp;s=5e27db81fcebbb7b05f79ef3802057fac68b27cd', 'width': 320}, {'height': 328, 'url': 'https://preview.redd.it/qisk555qpqb61.jpg?width=640&amp;crop=smart&amp;auto=webp&amp;s=685b646cb61c5fe5d6318f329a8396e342ca2e65', 'width': 640}, {'height': 492, 'url': 'https://preview.redd.it/qisk555qpqb61.jpg?width=960&amp;crop=smart&amp;auto=webp&amp;s=3513aa421cd9d20fefd348bd4983bae06cd7490d', 'width': 960}, {'height': 553, 'url': 'https://preview.redd.it/qisk555qpqb61.jpg?width=1080&amp;crop=smart&amp;auto=webp&amp;s=e476ad34344e94211ebbe80439e16fd37fcef5e2', 'width': 1080}], 'source': {'height': 1848, 'url': 'https://preview.redd.it/qisk555qpqb61.jpg?auto=webp&amp;s=7293733cd1acdb8e8254d31b005850acb4183a46', 'width': 3605}, 'variants': {}}]}",6,1610823245,5,,True,False,False,Portland,t5_2qi2i,188623,public,confidence,https://b.thumbs.redditmedia.com/2m0-OlNMVQOuzUqRvY-srlBQ_MN-Z8CeQqaop3MCqOs.jpg,71.0,140.0,"Go outside, take in the sunshine and...",0,[],0.86,https://i.redd.it/qisk555qpqb61.jpg,https://i.redd.it/qisk555qpqb61.jpg,all_ads,6,,,,,,,,,,,,,,
[],False,steelissurreal,,[],,text,t2_hv92xi0,False,False,[],False,False,1610822354,self.Portland,https://www.reddit.com/r/Portland/comments/kyoj2j/thrifted_red_wings/,{},kyoj2j,True,False,False,False,True,True,False,,,[],,dark,text,False,False,True,23,0,False,all_ads,/r/Portland/comments/kyoj2j/thrifted_red_wings/,False,,,6,1610822804,0,where’s the best thrift shop to possibly find red wings? i’ve seen a few here and there but i’m wondering if there is anywhere that consistently has them. thanks!,True,False,False,Portland,t5_2qi2i,188622,public,confidence,self,,,thrifted red wings,0,[],0.5,https://www.reddit.com/r/Portland/comments/kyoj2j/thrifted_red_wings/,,all_ads,6,,,,,,,,,,,,,,
[],False,HeatherLeeAnn,,[],,text,t2_10lari,False,False,[],False,False,1610821825,self.Portland,https://www.reddit.com/r/Portland/comments/kyocyi/covid_vaccine_dose_2_final_update/,{},kyocyi,True,False,False,False,True,True,False,,,[],,dark,text,False,False,False,33,0,False,all_ads,/r/Portland/comments/kyocyi/covid_vaccine_dose_2_final_update/,False,,,6,1610822225,4,"[Original Post](https://www.reddit.com/r/Portland/comments/khl9rb/vaccine_part_one_down/)

[Update #1](https://www.reddit.com/r/Portland/comments/kjk1fy/covid_part_one_vaccine_update/)

As requested I am posting an update post second dose. 

Disclaimer: I am not a doctor and do not pretend to be one so please do not ask for medical advice. Contact your primary care physician with questions.

I received my second dose on Monday (1/11/21) afternoon this is a basic breakdown of the days following.

Monday evening: 

Headache and sore arm started almost immediately, which I expected, so I took some ibuprofen which helped.

Tuesday: 

5:30 AM - Woke up with my arm still sore but no more headache so I went to work.

8:30 AM - Arm super super sore. I was unable to raise it above shoulder height. Starting to feel kinda blah but not too bad.

9:30 AM - Fatigue starting to set in. Just wanted to curl up and take a nap. 

10:00 AM - Headache, fatigue, chills, and mild chest tightness. I decide it's time to go home.

11:30 AM - Take ibuprofen and went to sleep

1:00 PM - Woke up, ate some soup, watched some tv, back to sleep

4:00 - 8:00 PM - Woke up, ate some soup, watched some tv, back to sleep

Wednesday:

5:30 AM - Woke up feeling much better. No longer feeling ""sick"" but the fatigue hung on so I didn't go into work.

3:00ish PM - Feeling completely back to normal

All normal stuff! I have had the flu before and this was not even close to being as bad. 

A couple of tidbits of advice: Do not get the shot in your dominant arm since it may hurt for a day or two. If you have the ability to take the day off after your second dose do it.

10/10 would take again!

Hopefully once Biden gets into office the vaccinations will start in earnest. Go forth and get vaccinated!",True,False,False,Portland,t5_2qi2i,188621,public,confidence,self,,,COVID Vaccine dose #2 - Final Update,0,[],1.0,https://www.reddit.com/r/Portland/comments/kyocyi/covid_vaccine_dose_2_final_update/,,all_ads,6,,,,,,,,,,,,,,
[],False,Ki11atr0n,,[],,text,t2_11bbni,False,False,[],False,False,1610821516,self.Portland,https://www.reddit.com/r/Portland/comments/kyo9aw/need_help_getting_my_mother_over_65_a_covid/,{},kyo9aw,True,False,False,False,True,True,False,,,[],,dark,text,False,False,True,10,0,False,all_ads,/r/Portland/comments/kyo9aw/need_help_getting_my_mother_over_65_a_covid/,False,,,6,1610821908,1,Does anyone have any tips or info on how to get my mother (over 65) a Covid vaccine? I've heard people have had success hunting down vaccines from various sources but I'm not sure where to begin.,True,False,False,Portland,t5_2qi2i,188620,public,confidence,self,,,Need help getting my mother (over 65) a Covid vaccine.,0,[],1.0,https://www.reddit.com/r/Portland/comments/kyo9aw/need_help_getting_my_mother_over_65_a_covid/,,all_ads,6,,,,,,,,,,,,,,
[],False,ORSoxFan2004,,[],,text,t2_oi3ldmo,False,False,[],False,False,1610820738,self.Portland,https://www.reddit.com/r/Portland/comments/kynzws/oregon_dmv_existing_vehicle_registration_renewal/,{},kynzws,True,False,False,False,True,True,False,,,[],,dark,text,False,False,False,12,0,False,all_ads,/r/Portland/comments/kynzws/oregon_dmv_existing_vehicle_registration_renewal/,False,,,6,1610821138,2,"I have had the same car and it has been registered in Oregon since I bought it in February 2003.

Since 2004, every even-numbered year in December I have received the renewal paperwork in the mail and I have gone to the DEQ, paid my fees and received the new stickers to put on my licence plate.

As of now, I have not received the registration paperwork that I should have received last month in the mail from the DMV. I went to the DMV2U site and tried to renew there, but it says I need to go to the DEQ and get the certificate from them before I can renew my registration.

However, I don't want to show up at the DEQ without having any paperwork from the DMV.

Is there anybody else in this situation?  Is the DMV behind on mailing simple registration renewal paperwork or maybe mine got lost in the mail?

If I need to go to the DEQ, I am assuming I need to bring them something from the DMV.

Any help or advice would be appreciated.

Thank you.",False,False,False,Portland,t5_2qi2i,188621,public,confidence,self,,,Oregon DMV Existing Vehicle Registration Renewal Question,0,[],0.75,https://www.reddit.com/r/Portland/comments/kynzws/oregon_dmv_existing_vehicle_registration_renewal/,,all_ads,6,,,,,,,,,,,,,,
[],False,kimj0ng-illin,,[],,text,t2_hqobg,False,False,[],False,False,1610819987,self.Portland,https://www.reddit.com/r/Portland/comments/kynqmu/with_what_we_just_found_out_about_the_vaccine/,{},kynqmu,True,False,False,False,True,True,False,,,[],,dark,text,False,False,True,13,0,False,all_ads,/r/Portland/comments/kynqmu/with_what_we_just_found_out_about_the_vaccine/,False,,,6,1610820367,1,"Will those of us who got the first shot, be able to get a second one? Or will they have run out of doses?",True,False,False,Portland,t5_2qi2i,188620,public,confidence,self,,,With what we just found out about the vaccine stockpile being fake,0,[],0.67,https://www.reddit.com/r/Portland/comments/kynqmu/with_what_we_just_found_out_about_the_vaccine/,,all_ads,6,,,,,,,,,,,,,,
[],False,tinglingtriangle,,[],,text,t2_tswiitd,False,False,[],False,False,1610819421,self.Portland,https://www.reddit.com/r/Portland/comments/kynk51/the_frontier_a_fallout_new_vegas_mod_set_in/,{},kynk51,True,False,False,False,True,True,False,,,[],,dark,text,False,False,False,9,0,False,all_ads,/r/Portland/comments/kynk51/the_frontier_a_fallout_new_vegas_mod_set_in/,False,self,"{'enabled': False, 'images': [{'id': 'Fox6ZtUKFzVhDZNqyH3uZro-AsUywA-Mvj59L5n_Zv8', 'resolutions': [{'height': 81, 'url': 'https://external-preview.redd.it/E6U5AykI-W55eenYGt7W5FE3kiACVEhYIuYDmIjXiXA.jpg?width=108&amp;crop=smart&amp;auto=webp&amp;s=36d789e4e2202da81dcd2fa7f1be306d3190b914', 'width': 108}, {'height': 162, 'url': 'https://external-preview.redd.it/E6U5AykI-W55eenYGt7W5FE3kiACVEhYIuYDmIjXiXA.jpg?width=216&amp;crop=smart&amp;auto=webp&amp;s=d612bb45dc75766c46b6b242199f2adac9d5d044', 'width': 216}, {'height': 240, 'url': 'https://external-preview.redd.it/E6U5AykI-W55eenYGt7W5FE3kiACVEhYIuYDmIjXiXA.jpg?width=320&amp;crop=smart&amp;auto=webp&amp;s=bcbe259dbc5150f3bb7105076cf5ba05886eeae9', 'width': 320}], 'source': {'height': 360, 'url': 'https://external-preview.redd.it/E6U5AykI-W55eenYGt7W5FE3kiACVEhYIuYDmIjXiXA.jpg?auto=webp&amp;s=99241f51590394e61aa3cc109f12cebe723121cd', 'width': 480}, 'variants': {}}]}",6,1610819794,0,"[Fallout: The Frontier - Release Trailer - YouTube](https://www.youtube.com/watch?v=im31_CFinr0)

This post-apocalyptic game set in Portland was released yesterday. I haven't tried it, but judging by the trailer it does make some effort to recreate downtown Portland, albeit with quite a lot of snow. Perhaps in a week or two it'll look even more realistic...

If you've played it, how ""Portlandy"" is it? I recognized Portlandia in the trailer and perhaps Ground Kontrol, but I'm curious about how it feels. Download link:  [Fallout - The Frontier at Fallout New Vegas - mods and community (nexusmods.com)](https://www.nexusmods.com/newvegas/mods/68009/)",True,False,False,Portland,t5_2qi2i,188620,public,confidence,self,,,"""The Frontier"", a Fallout New Vegas mod set in Portland - does it feel like Portland?",0,[],0.5,https://www.reddit.com/r/Portland/comments/kynk51/the_frontier_a_fallout_new_vegas_mod_set_in/,,all_ads,6,,,,,,,,,,,,,,
[],False,AlexiLaihoTheHuman,,[],,text,t2_4ksf4fy3,False,False,[],False,False,1610817970,i.redd.it,https://www.reddit.com/r/Portland/comments/kyn330/i_love_this_city/,{},kyn330,True,False,False,True,True,False,False,,photo,[],Photo,dark,text,False,False,False,74,0,False,all_ads,/r/Portland/comments/kyn330/i_love_this_city/,False,image,"{'enabled': True, 'images': [{'id': 'UVcEFvBmtWr6-rz56mopT26Ofgs6WZK89QmWWCE2uDU', 'resolutions': [{'height': 144, 'url': 'https://preview.redd.it/0pe16pkbbqb61.jpg?width=108&amp;crop=smart&amp;auto=webp&amp;s=365c76c1cbfe13d44fe63587629be0c48fa713a2', 'width': 108}, {'height': 288, 'url': 'https://preview.redd.it/0pe16pkbbqb61.jpg?width=216&amp;crop=smart&amp;auto=webp&amp;s=14f1ec893366d80e5a7159b8365a635b98bbe9b9', 'width': 216}, {'height': 426, 'url': 'https://preview.redd.it/0pe16pkbbqb61.jpg?width=320&amp;crop=smart&amp;auto=webp&amp;s=697dee95f0d4b920c5c4c26566b94a0690d61e01', 'width': 320}, {'height': 853, 'url': 'https://preview.redd.it/0pe16pkbbqb61.jpg?width=640&amp;crop=smart&amp;auto=webp&amp;s=aeede45854ec1468a4281f0ab9af578bb1de57bb', 'width': 640}, {'height': 1280, 'url': 'https://preview.redd.it/0pe16pkbbqb61.jpg?width=960&amp;crop=smart&amp;auto=webp&amp;s=4bd3ad2e89c89c17d701676903c5c82a21e0af28', 'width': 960}, {'height': 1440, 'url': 'https://preview.redd.it/0pe16pkbbqb61.jpg?width=1080&amp;crop=smart&amp;auto=webp&amp;s=ec68023d231b24c8c09cc82d87c250bf6bb604dd', 'width': 1080}], 'source': {'height': 4000, 'url': 'https://preview.redd.it/0pe16pkbbqb61.jpg?auto=webp&amp;s=9528843f5be9487059d6772363f9c7a0e65ca55b', 'width': 3000}, 'variants': {}}]}",6,1610818269,4,,True,False,False,Portland,t5_2qi2i,188616,public,confidence,https://b.thumbs.redditmedia.com/PiJiYjvx2O_uHXhvEsI30yEBx-YfI0d4jYvyGVmlnFA.jpg,140.0,140.0,I love this city,0,[],1.0,https://i.redd.it/0pe16pkbbqb61.jpg,https://i.redd.it/0pe16pkbbqb61.jpg,all_ads,6,,,,,,,,,,,,,,
[],False,madoublet87,,[],,text,t2_5yj3eidw,False,False,[],False,False,1610817791,opb.org,https://www.reddit.com/r/Portland/comments/kyn0vl/portland_mayor_calls_for_faster_rollout_of/,{},kyn0vl,True,False,False,False,True,False,False,,local-news,[],Local News,dark,text,False,False,False,46,0,False,all_ads,/r/Portland/comments/kyn0vl/portland_mayor_calls_for_faster_rollout_of/,False,link,"{'enabled': False, 'images': [{'id': 'MnxXQ2SjGhTZfbKs0Btr5M0qVPkyXQBHd5ovOCFsjow', 'resolutions': [{'height': 108, 'url': 'https://external-preview.redd.it/4WfIekkZLDfjiGUThcjR0BL8fjDHm-Pu-GEJP348RBk.jpg?width=108&amp;crop=smart&amp;auto=webp&amp;s=ce3c05faf74cf217b76aa9be24805a9bc8542c72', 'width': 108}, {'height': 216, 'url': 'https://external-preview.redd.it/4WfIekkZLDfjiGUThcjR0BL8fjDHm-Pu-GEJP348RBk.jpg?width=216&amp;crop=smart&amp;auto=webp&amp;s=8a7b428146aa12ba6c7a256f4f21daa0e4d50142', 'width': 216}, {'height': 320, 'url': 'https://external-preview.redd.it/4WfIekkZLDfjiGUThcjR0BL8fjDHm-Pu-GEJP348RBk.jpg?width=320&amp;crop=smart&amp;auto=webp&amp;s=87644f24c46e6f1221065eb5411eca1f2b97bacc', 'width': 320}, {'height': 640, 'url': 'https://external-preview.redd.it/4WfIekkZLDfjiGUThcjR0BL8fjDHm-Pu-GEJP348RBk.jpg?width=640&amp;crop=smart&amp;auto=webp&amp;s=451ba4d43d9e7f9433915c7da71ae9515bf09931', 'width': 640}, {'height': 960, 'url': 'https://external-preview.redd.it/4WfIekkZLDfjiGUThcjR0BL8fjDHm-Pu-GEJP348RBk.jpg?width=960&amp;crop=smart&amp;auto=webp&amp;s=ae9833fc5439347cd519288d6983ea4da7f512bd', 'width': 960}, {'height': 1080, 'url': 'https://external-preview.redd.it/4WfIekkZLDfjiGUThcjR0BL8fjDHm-Pu-GEJP348RBk.jpg?width=1080&amp;crop=smart&amp;auto=webp&amp;s=ceae24e025fdf67882c3c17619414749cb27aa50', 'width': 1080}], 'source': {'height': 4096, 'url': 'https://external-preview.redd.it/4WfIekkZLDfjiGUThcjR0BL8fjDHm-Pu-GEJP348RBk.jpg?auto=webp&amp;s=c52499e2f704edb86a875c6f77c8ff1f07888ec5', 'width': 4096}, 'variants': {}}]}",6,1610818088,2,,False,False,False,Portland,t5_2qi2i,188616,public,confidence,https://b.thumbs.redditmedia.com/99Ht74m6HuTheh2DnjF5DeREKfA87HEFPprN3Pruadw.jpg,140.0,140.0,Portland mayor calls for faster roll-out of policing alternative,0,[],1.0,https://www.opb.org/article/2021/01/16/portland-street-response-911-police-alternative/,https://www.opb.org/article/2021/01/16/portland-street-response-911-police-alternative/,all_ads,6,,,,,,,,,,,,,,
[],False,j3rkf4ce,,[],🐝,text,t2_8dfwt,False,False,[],False,False,1610816318,falloutthefrontier.com,https://www.reddit.com/r/Portland/comments/kymjar/falloutnew_vegas_mod_with_portland_as_the_setting/,{},kymjar,True,False,False,False,True,False,False,,,[],,dark,text,False,False,True,25,0,False,all_ads,/r/Portland/comments/kymjar/falloutnew_vegas_mod_with_portland_as_the_setting/,False,,,6,1610816649,0,,True,False,False,Portland,t5_2qi2i,188613,public,confidence,default,,,Fallout:New Vegas Mod with Portland as the setting.,0,[],0.5,https://www.falloutthefrontier.com/,https://www.falloutthefrontier.com/,all_ads,6,ac48aad6-d2bb-11ea-a3bf-0e5103940751,dark,,,,,,,,,,,,
[],False,c0viD00M,,[],,text,t2_8oaja9dm,False,False,[],False,False,1610815688,king5.com,https://www.reddit.com/r/Portland/comments/kymc44/no_federal_reserve_of_covid19_vaccine_doses/,{},kymc44,True,False,False,False,True,False,False,,,[],,dark,text,False,False,True,1,0,False,all_ads,/r/Portland/comments/kymc44/no_federal_reserve_of_covid19_vaccine_doses/,False,link,"{'enabled': False, 'images': [{'id': 'tntIzIB7bINO0-tCLqSGISOobBgKu9uxEw_fSJUNJAg', 'resolutions': [{'height': 60, 'url': 'https://external-preview.redd.it/u1jw_quEbRPs9xj5vGGGE-j7EVm7ljDF5YBaVbciZvo.jpg?width=108&amp;crop=smart&amp;auto=webp&amp;s=444bce6b3cca5cc71d6ca30a62be71919e4fed02', 'width': 108}, {'height': 121, 'url': 'https://external-preview.redd.it/u1jw_quEbRPs9xj5vGGGE-j7EVm7ljDF5YBaVbciZvo.jpg?width=216&amp;crop=smart&amp;auto=webp&amp;s=9a6a4edf1989673ec2585f1b00b7c5ebc545d016', 'width': 216}, {'height': 179, 'url': 'https://external-preview.redd.it/u1jw_quEbRPs9xj5vGGGE-j7EVm7ljDF5YBaVbciZvo.jpg?width=320&amp;crop=smart&amp;auto=webp&amp;s=953dd4582989bc95a7be74c3633cdc8d1b49feda', 'width': 320}, {'height': 359, 'url': 'https://external-preview.redd.it/u1jw_quEbRPs9xj5vGGGE-j7EVm7ljDF5YBaVbciZvo.jpg?width=640&amp;crop=smart&amp;auto=webp&amp;s=7789cbbaedfcdda63ff5fc36297daf89f7517594', 'width': 640}, {'height': 539, 'url': 'https://external-preview.redd.it/u1jw_quEbRPs9xj5vGGGE-j7EVm7ljDF5YBaVbciZvo.jpg?width=960&amp;crop=smart&amp;auto=webp&amp;s=a33ebd31fd6c58d4c6d53a10458e60beade30158', 'width': 960}, {'height': 607, 'url': 'https://external-preview.redd.it/u1jw_quEbRPs9xj5vGGGE-j7EVm7ljDF5YBaVbciZvo.jpg?width=1080&amp;crop=smart&amp;auto=webp&amp;s=58ed5e4e4effd112fe4a8516c29fe34f54c58061', 'width': 1080}], 'source': {'height': 641, 'url': 'https://external-preview.redd.it/u1jw_quEbRPs9xj5vGGGE-j7EVm7ljDF5YBaVbciZvo.jpg?auto=webp&amp;s=ab433fcb9ea0077a9907f236ce2cb2d31222ac42', 'width': 1140}, 'variants': {}}]}",6,1610816027,1,,True,False,False,Portland,t5_2qi2i,188610,public,confidence,https://b.thumbs.redditmedia.com/ST2pxDUobsIW5498AEQ5xWu3A0OsR247b5SQjATjMho.jpg,78.0,140.0,"'No federal reserve' of COVID-19 vaccine doses exists, Oregon governor says",0,[],0.67,https://www.king5.com/article/news/health/coronavirus/vaccine/no-federal-reserve-covid-19-vaccine/281-090beb09-3fa0-465b-a668-1aed22fee3f2,https://www.king5.com/article/news/health/coronavirus/vaccine/no-federal-reserve-covid-19-vaccine/281-090beb09-3fa0-465b-a668-1aed22fee3f2,all_ads,6,,,,,,,,,,,,,,
