author,author_created_utc,author_flair_css_class,author_flair_text,author_fullname,created_utc,domain,full_link,gilded,id,is_self,locked,media,media_embed,num_comments,over_18,permalink,retrieved_on,score,secure_media,secure_media_embed,selftext,stickied,subreddit,subreddit_id,thumbnail,title,url,link_flair_css_class,link_flair_text,post_hint,preview,edited,banned_by,distinguished
satansanus,1372174802.0,,,t2_c5qec,1470187376,imgur.com,https://www.reddit.com/r/Portland/comments/4vw0p7/a_mighty_faggot/,0,4vw0p7,False,False,"{'oembed': {'description': 'Imgur: The most awesome images on the Internet.', 'height': 550, 'html': '&lt;iframe class=""embedly-embed"" src=""//cdn.embedly.com/widgets/media.html?src=%2F%2Fimgur.com%2Fa%2F56LEo%2Fembed&amp;url=http%3A%2F%2Fimgur.com%2Fa%2F56LEo&amp;image=http%3A%2F%2Fi.imgur.com%2Fvw1P3Zm.jpg%3Ffb&amp;key=2aa3c4d5f3de4f5b9120b660ad850dc9&amp;type=text%2Fhtml&amp;schema=imgur"" width=""550"" height=""550"" scrolling=""no"" frameborder=""0"" allowfullscreen&gt;&lt;/iframe&gt;', 'provider_name': 'Imgur', 'provider_url': 'http://imgur.com', 'thumbnail_height': 315, 'thumbnail_url': 'http://i.imgur.com/vw1P3Zm.jpg?fb', 'thumbnail_width': 600, 'title': 'A Mighty Faggot!', 'type': 'rich', 'version': '1.0', 'width': 550}, 'type': 'imgur.com'}","{'content': '&lt;iframe class=""embedly-embed"" src=""//cdn.embedly.com/widgets/media.html?src=%2F%2Fimgur.com%2Fa%2F56LEo%2Fembed&amp;url=http%3A%2F%2Fimgur.com%2Fa%2F56LEo&amp;image=http%3A%2F%2Fi.imgur.com%2Fvw1P3Zm.jpg%3Ffb&amp;key=2aa3c4d5f3de4f5b9120b660ad850dc9&amp;type=text%2Fhtml&amp;schema=imgur"" width=""550"" height=""550"" scrolling=""no"" frameborder=""0"" allowfullscreen&gt;&lt;/iframe&gt;', 'height': 550, 'scrolling': False, 'width': 550}",0,False,/r/Portland/comments/4vw0p7/a_mighty_faggot/,1473012165,1,"{'oembed': {'description': 'Imgur: The most awesome images on the Internet.', 'height': 550, 'html': '&lt;iframe class=""embedly-embed"" src=""https://cdn.embedly.com/widgets/media.html?src=%2F%2Fimgur.com%2Fa%2F56LEo%2Fembed&amp;url=http%3A%2F%2Fimgur.com%2Fa%2F56LEo&amp;image=http%3A%2F%2Fi.imgur.com%2Fvw1P3Zm.jpg%3Ffb&amp;key=2aa3c4d5f3de4f5b9120b660ad850dc9&amp;type=text%2Fhtml&amp;schema=imgur"" width=""550"" height=""550"" scrolling=""no"" frameborder=""0"" allowfullscreen&gt;&lt;/iframe&gt;', 'provider_name': 'Imgur', 'provider_url': 'http://imgur.com', 'thumbnail_height': 315, 'thumbnail_url': 'https://i.embed.ly/1/image?url=http%3A%2F%2Fi.imgur.com%2Fvw1P3Zm.jpg%3Ffb&amp;key=b1e305db91cf4aa5a86b732cc9fffceb', 'thumbnail_width': 600, 'title': 'A Mighty Faggot!', 'type': 'rich', 'version': '1.0', 'width': 550}, 'type': 'imgur.com'}","{'content': '&lt;iframe class=""embedly-embed"" src=""https://cdn.embedly.com/widgets/media.html?src=%2F%2Fimgur.com%2Fa%2F56LEo%2Fembed&amp;url=http%3A%2F%2Fimgur.com%2Fa%2F56LEo&amp;image=http%3A%2F%2Fi.imgur.com%2Fvw1P3Zm.jpg%3Ffb&amp;key=2aa3c4d5f3de4f5b9120b660ad850dc9&amp;type=text%2Fhtml&amp;schema=imgur"" width=""550"" height=""550"" scrolling=""no"" frameborder=""0"" allowfullscreen&gt;&lt;/iframe&gt;', 'height': 550, 'scrolling': False, 'width': 550}",,False,Portland,t5_2qi2i,default,A Mighty Faggot!,http://imgur.com/a/56LEo,,,,,,,
[deleted],,,,,1470186349,news.vice.com,https://www.reddit.com/r/Portland/comments/4vvxz9/vice_hiding_the_homeless/,0,4vvxz9,False,False,,{},5,False,/r/Portland/comments/4vvxz9/vice_hiding_the_homeless/,1473012126,10,,{},[deleted],False,Portland,t5_2qi2i,default,Vice: Hiding the Homeless,https://news.vice.com/video/hiding-the-homeless-full-length,homeless,Homeless,,,,,
BuckmanTarheel,1455880597.0,,,t2_v9wqt,1470185149,self.Portland,https://www.reddit.com/r/Portland/comments/4vvuyf/vintage_stereo_repair/,0,4vvuyf,True,False,,{},15,False,/r/Portland/comments/4vvuyf/vintage_stereo_repair/,1473012084,9,,{},"I have an old Marantz receiver that I've had for years and it could use a tune up.  Nothing major, the buttons are just starting to stick and some of the little lamps are burnt out.  Has anyone used any of the vintage stereo repair places in town?  How much should I expect to pay for a tune up?",False,Portland,t5_2qi2i,self,Vintage stereo repair?,https://www.reddit.com/r/Portland/comments/4vvuyf/vintage_stereo_repair/,help-me,Help Me,,,,,
PDXTony,1391709791.0,,,t2_f5hyt,1470181265,self.Portland,https://www.reddit.com/r/Portland/comments/4vvkhs/bike_police_in_se/,0,4vvkhs,True,False,,{},14,False,/r/Portland/comments/4vvkhs/bike_police_in_se/,1473011933,32,,{},"I just saw two bike Police cruising down Powell (around 112th).

Just a quick thank you to the Police and supervisors who set this up. I know the job is thankless but thank you!",False,Portland,t5_2qi2i,self,Bike Police in SE,https://www.reddit.com/r/Portland/comments/4vvkhs/bike_police_in_se/,off-topic,Other,,,,,
dbtng,1399852365.0,,Hillsboro,t2_giwsu,1470177400,bankssunsetpark.com,https://www.reddit.com/r/Portland/comments/4vv9z2/combine_harvester_demolition_derby_tractor_pulls/,0,4vv9z2,False,False,,{},11,False,/r/Portland/comments/4vv9z2/combine_harvester_demolition_derby_tractor_pulls/,1473011782,16,,{},,False,Portland,t5_2qi2i,http://b.thumbs.redditmedia.com/151YnWF9Or3np104d88jL10loRd7y6LPFVIpELcGR0s.jpg,"Combine Harvester Demolition Derby, tractor pulls, etc. - All out redneck festival in Banks!",http://bankssunsetpark.com/bbq/,event,Events,link,"{'images': [{'id': 'IaATiW9JAXbdLbyLLkEtbedXKOOiZT9WcRvsa3Ybx2w', 'resolutions': [{'height': 166, 'url': 'https://i.redditmedia.com/Ms7bUDYYAYHNyf9UzKAw43_UumBUsdL-OPzApz_t9HI.jpg?fit=crop&amp;crop=faces%2Centropy&amp;arh=2&amp;w=108&amp;s=553b22ef4bc07b927a89071a1df87a1a', 'width': 108}, {'height': 333, 'url': 'https://i.redditmedia.com/Ms7bUDYYAYHNyf9UzKAw43_UumBUsdL-OPzApz_t9HI.jpg?fit=crop&amp;crop=faces%2Centropy&amp;arh=2&amp;w=216&amp;s=89b1edca9cec69e3d66a3d9428c067f4', 'width': 216}, {'height': 494, 'url': 'https://i.redditmedia.com/Ms7bUDYYAYHNyf9UzKAw43_UumBUsdL-OPzApz_t9HI.jpg?fit=crop&amp;crop=faces%2Centropy&amp;arh=2&amp;w=320&amp;s=506275eb07c24fcc7f887d25261bfb78', 'width': 320}], 'source': {'height': 612, 'url': 'https://i.redditmedia.com/Ms7bUDYYAYHNyf9UzKAw43_UumBUsdL-OPzApz_t9HI.jpg?s=7abc8c0d3e8c63b0be1f3fc79d724989', 'width': 396}, 'variants': {}}]}",,,
epicrepairetime,1448858794.0,,,t2_sjkhv,1470176222,i.imgur.com,https://www.reddit.com/r/Portland/comments/4vv6ro/list_oregon_ballot_measures_that_will_appear_on/,0,4vv6ro,False,False,,{},75,False,/r/Portland/comments/4vv6ro/list_oregon_ballot_measures_that_will_appear_on/,1473011737,44,,{},,False,Portland,t5_2qi2i,http://b.thumbs.redditmedia.com/Qg8OvQKrW_d-t_j2gxH--genwQvUhx2-iAWXtczAMNg.jpg,List - Oregon Ballot Measures that will appear on the 11/08/16 ballot so far.,http://i.imgur.com/fgcKeho.jpg,photo,Photo,image,"{'images': [{'id': 'KqENTabjCiPe-WlsKXr-TiQwW-K1Y4VHMG17uL9GP-8', 'resolutions': [{'height': 51, 'url': 'https://i.redditmedia.com/ZC8z_1LllQJYVu71qSSK6Kuf1iWK3QYTEu_Bn_c85Vw.jpg?fit=crop&amp;crop=faces%2Centropy&amp;arh=2&amp;w=108&amp;s=ebb1905a4d4f2092ea0f06742ae5391e', 'width': 108}, {'height': 102, 'url': 'https://i.redditmedia.com/ZC8z_1LllQJYVu71qSSK6Kuf1iWK3QYTEu_Bn_c85Vw.jpg?fit=crop&amp;crop=faces%2Centropy&amp;arh=2&amp;w=216&amp;s=3a15719b40b1d5d0e018760eadd9be7e', 'width': 216}, {'height': 151, 'url': 'https://i.redditmedia.com/ZC8z_1LllQJYVu71qSSK6Kuf1iWK3QYTEu_Bn_c85Vw.jpg?fit=crop&amp;crop=faces%2Centropy&amp;arh=2&amp;w=320&amp;s=9580dbe793090fc3a4416a223f7869ff', 'width': 320}, {'height': 302, 'url': 'https://i.redditmedia.com/ZC8z_1LllQJYVu71qSSK6Kuf1iWK3QYTEu_Bn_c85Vw.jpg?fit=crop&amp;crop=faces%2Centropy&amp;arh=2&amp;w=640&amp;s=cda751f370642a91ff95d2413c5de442', 'width': 640}], 'source': {'height': 368, 'url': 'https://i.redditmedia.com/ZC8z_1LllQJYVu71qSSK6Kuf1iWK3QYTEu_Bn_c85Vw.jpg?s=4a92e7da70b8612782e86d5c4e9421f3', 'width': 778}, 'variants': {}}]}",,,
LobsterFarts,1425173309.0,,,t2_lqa8x,1470175951,self.Portland,https://www.reddit.com/r/Portland/comments/4vv5yc/nenw_parks/,0,4vv5yc,True,False,,{},10,False,/r/Portland/comments/4vv5yc/nenw_parks/,1473011725,0,,{},"Hey everyone, I have family staying with me for the next TEN DAYS in my STUDIO apartment I JUST moved into, so in order to save my sanity I'm going to need to go for a few long drives/walks. Can anyone recommend any parks where I can just go and sit/read/relax for an hour? Anything with an overlook/view is a huge plus - good for staring out into nothing and wondering, ""Why??"" lol",False,Portland,t5_2qi2i,self,NE/NW Parks,https://www.reddit.com/r/Portland/comments/4vv5yc/nenw_parks/,help-me,Help Me,,,,,
[deleted],,,,,1470175691,self.Portland,https://www.reddit.com/r/Portland/comments/4vv57l/the_bill_and_ted_rule_is_vague_the_mods_are_heavy/,0,4vv57l,True,False,,{},128,False,/r/Portland/comments/4vv57l/the_bill_and_ted_rule_is_vague_the_mods_are_heavy/,1473011715,0,,{},[deleted],False,Portland,t5_2qi2i,default,The Bill and Ted rule is vague. The mods are heavy handed.,https://www.reddit.com/r/Portland/comments/4vv57l/the_bill_and_ted_rule_is_vague_the_mods_are_heavy/,custom,Drama,,,,,
oregone1,1288115687.0,,Hosford-Abernethy,t2_4gq1v,1470175656,self.Portland,https://www.reddit.com/r/Portland/comments/4vv549/i_dont_think_allowing_hobos_in_your_backyard_is_a/,0,4vv549,True,False,,{},143,False,/r/Portland/comments/4vv549/i_dont_think_allowing_hobos_in_your_backyard_is_a/,1473011713,194,,{},"One of my neighbors has recently decided to allow a small group of hobos set up camp in her backyard.  [Here](http://imgur.com/a/wkqBi) is a pic of her backyard.  

Although it started out as just one person in a tent at the beginning of July, it has expanded greatly.  

* As you can see, there is a small structure on the left side of the picture.  This is made of some bifold doors and a storage tub.  They use that as their bathroom.  It is smelly.  

* To the right of their tent, they have set up a dinette set and have run an extension cord from the house to power a microwave.  I'm not sure how microwaves do in the rain, but I imagine the answer is not well.  I am not an electrician or a code compliance officer, but I can't imagine that 100 foot extension cords powering outdoor microwave ovens are safe.    

* I don't mind the clothesline.  I like clotheslines.  More people should use them, where possible.   

* On the right side of the picture you can see that trash is starting to pile up.  With trash comes rats, raccoons, and the occasional caracal.   

* Since this is outdoors (duh), everyone in the neighborhood can hear when the hobos fight, and the police have been called at least twice in the 3 days I've been back from vacation.  

I'm posting this because I have heard the argument that homeowners should be allowed to let hobos camp in their yards.  Maybe this can happen with some strict guidelines or heavy regulation, maybe not.  However, giving hobos a bucket and an extension cord and giving them free reign over your yard is clearly unsafe and unsanitary.    ",False,Portland,t5_2qi2i,self,I don't think allowing hobos in your backyard is a good idea.,https://www.reddit.com/r/Portland/comments/4vv549/i_dont_think_allowing_hobos_in_your_backyard_is_a/,homeless,Homeless,self,"{'images': [{'id': 'A7VpkRWV8bbVoAzwIa8Xk26cP5ckLOF9zc2u1Yhbo10', 'resolutions': [{'height': 80, 'url': 'https://i.redditmedia.com/-g-WXSO1HBv0C5oK68vfI3hNCBY0Iq5mqXryf8EZpRQ.jpg?fit=crop&amp;crop=faces%2Centropy&amp;arh=2&amp;w=108&amp;s=7c8e6d81dd55b8775f97f03916ab2f96', 'width': 108}, {'height': 161, 'url': 'https://i.redditmedia.com/-g-WXSO1HBv0C5oK68vfI3hNCBY0Iq5mqXryf8EZpRQ.jpg?fit=crop&amp;crop=faces%2Centropy&amp;arh=2&amp;w=216&amp;s=dfd8280f729fd8c70ba241c1e97562a2', 'width': 216}, {'height': 239, 'url': 'https://i.redditmedia.com/-g-WXSO1HBv0C5oK68vfI3hNCBY0Iq5mqXryf8EZpRQ.jpg?fit=crop&amp;crop=faces%2Centropy&amp;arh=2&amp;w=320&amp;s=15e75495187be823f55dd20af0341147', 'width': 320}, {'height': 479, 'url': 'https://i.redditmedia.com/-g-WXSO1HBv0C5oK68vfI3hNCBY0Iq5mqXryf8EZpRQ.jpg?fit=crop&amp;crop=faces%2Centropy&amp;arh=2&amp;w=640&amp;s=b673922395e4d0b0a735c622ed8d3588', 'width': 640}, {'height': 719, 'url': 'https://i.redditmedia.com/-g-WXSO1HBv0C5oK68vfI3hNCBY0Iq5mqXryf8EZpRQ.jpg?fit=crop&amp;crop=faces%2Centropy&amp;arh=2&amp;w=960&amp;s=cfc4f235e736a862850dcc50f3d5250d', 'width': 960}, {'height': 809, 'url': 'https://i.redditmedia.com/-g-WXSO1HBv0C5oK68vfI3hNCBY0Iq5mqXryf8EZpRQ.jpg?fit=crop&amp;crop=faces%2Centropy&amp;arh=2&amp;w=1080&amp;s=c5c4eed5ab0ec4d14f41812dd1c7f20d', 'width': 1080}], 'source': {'height': 1958, 'url': 'https://i.redditmedia.com/-g-WXSO1HBv0C5oK68vfI3hNCBY0Iq5mqXryf8EZpRQ.jpg?s=60c81d3067ade271a28816a54c394d5f', 'width': 2611}, 'variants': {}}]}",,,
pox109,1353478465.0,,,t2_9o18q,1470173432,self.Portland,https://www.reddit.com/r/Portland/comments/4vuypj/are_there_joinable_hiking_groups_in_portland/,0,4vuypj,True,False,,{},8,False,/r/Portland/comments/4vuypj/are_there_joinable_hiking_groups_in_portland/,1473011623,10,,{},"I would like to meet people whom enjoy hiking and the outdoors as much a I do, and am curious about what kind of communities already exist in Portland.",False,Portland,t5_2qi2i,self,Are there joinable hiking groups in Portland?,https://www.reddit.com/r/Portland/comments/4vuypj/are_there_joinable_hiking_groups_in_portland/,help-me,Help Me,,,,,
mc88788,1423947385.0,,,t2_lcxkm,1470173054,portlandtribune.com,https://www.reddit.com/r/Portland/comments/4vuxi8/lents_leader_councilbydistrict_wouldnt_help_east/,0,4vuxi8,False,False,,{},4,False,/r/Portland/comments/4vuxi8/lents_leader_councilbydistrict_wouldnt_help_east/,1473011605,17,,{},,False,Portland,t5_2qi2i,http://b.thumbs.redditmedia.com/ZSotcIQrt7ydpFIFT5_zdNYqCp-flEWjVyS_uryEoXw.jpg,Lents leader: Council-by-district wouldn't help East Portland,http://portlandtribune.com/pt/10-opinion/317086-195852-my-view-dont-short-shrift-east-portland,local-news,Local News,link,"{'images': [{'id': 'v118IIQs8nz-z8sv4vGxe9VcmSl16rFGSEQUYYxC5t4', 'resolutions': [{'height': 110, 'url': 'https://i.redditmedia.com/TgSD8RLmcdXup97kzN2qWFrIQXQ5mFh0KaPLF06IFH8.jpg?fit=crop&amp;crop=faces%2Centropy&amp;arh=2&amp;w=108&amp;s=39b2e68c0afcc84973ae9df746f82054', 'width': 108}, {'height': 220, 'url': 'https://i.redditmedia.com/TgSD8RLmcdXup97kzN2qWFrIQXQ5mFh0KaPLF06IFH8.jpg?fit=crop&amp;crop=faces%2Centropy&amp;arh=2&amp;w=216&amp;s=0b4e3b7824591939d8afcecb1ebcab76', 'width': 216}], 'source': {'height': 301, 'url': 'https://i.redditmedia.com/TgSD8RLmcdXup97kzN2qWFrIQXQ5mFh0KaPLF06IFH8.jpg?s=663a85aa5312fe29b3927ce16b6cfd4d', 'width': 295}, 'variants': {}}]}",,,
[deleted],,,,,1470172362,portlandtribune.com,https://www.reddit.com/r/Portland/comments/4vuvf1/east_portlander_councilbydistrict_would_screw/,0,4vuvf1,False,False,,{},0,False,/r/Portland/comments/4vuvf1/east_portlander_councilbydistrict_would_screw/,1473011575,1,,{},[deleted],False,Portland,t5_2qi2i,default,East Portlander: Council-by-district would screw East Portland,http://portlandtribune.com/pt/10-opinion/317086-195852-my-view-dont-short-shrift-east-portland,local-news,Local News,,,,,
Purplelimeade,1424407329.0,,,t2_lh697,1470171907,self.Portland,https://www.reddit.com/r/Portland/comments/4vutxl/pharmacist_prescribed_birth_control_fee/,0,4vutxl,True,False,,{},16,False,/r/Portland/comments/4vutxl/pharmacist_prescribed_birth_control_fee/,1473011554,9,,{},"I went into to Safeway's pharmacy today to try to get a new birth control prescription written and was told there would be a $45 fee if I got it written through the pharmacy rather than my primary care doctor. I was under the impression that any Oregon health insurance provider (I have Moda) was required to cover birth control completely. Furthermore, I can't actually find any information on the fee I was going to be charged when looking through the law that allows pharmacists to prescribe birth control.

I'm just wondering if anyone here has experience with getting birth control written through a pharmacist and if the fee is a legitimate thing or not.

This isn't a huge deal as I can just call my doctor's office to get my birth control refilled instead, but I'm just curious if anyone has more information on this.

",False,Portland,t5_2qi2i,self,Pharmacist Prescribed Birth Control Fee?,https://www.reddit.com/r/Portland/comments/4vutxl/pharmacist_prescribed_birth_control_fee/,help-me,Help Me,,,,,
elationisfacile,1360355004.0,,Sunnyside,t2_aiyug,1470171612,portlandoregon.gov,https://www.reddit.com/r/Portland/comments/4vut0n/tonight_is_national_night_out_go_find_a_party_and/,0,4vut0n,False,False,,{},15,False,/r/Portland/comments/4vut0n/tonight_is_national_night_out_go_find_a_party_and/,1473011541,21,,{},,False,Portland,t5_2qi2i,default,Tonight is National Night Out - go find a party and meet your neighbors!,https://www.portlandoregon.gov/oni/55346,local-news,Local News,,,,,
oregone1,1288115687.0,,Hosford-Abernethy,t2_4gq1v,1470171438,imgur.com,https://www.reddit.com/r/Portland/comments/4vusgx/the_simple_solution/,0,4vusgx,False,False,"{'oembed': {'description': 'Imgur: The most awesome images on the Internet.', 'height': 550, 'html': '&lt;iframe class=""embedly-embed"" src=""//cdn.embedly.com/widgets/media.html?src=%2F%2Fimgur.com%2Fa%2FMKVdJ%2Fembed&amp;url=http%3A%2F%2Fimgur.com%2Fa%2FMKVdJ&amp;image=http%3A%2F%2Fi.imgur.com%2Fh2utZ01.jpg%3Ffb&amp;key=2aa3c4d5f3de4f5b9120b660ad850dc9&amp;type=text%2Fhtml&amp;schema=imgur"" width=""550"" height=""550"" scrolling=""no"" frameborder=""0"" allowfullscreen&gt;&lt;/iframe&gt;', 'provider_name': 'Imgur', 'provider_url': 'http://imgur.com', 'thumbnail_height': 315, 'thumbnail_url': 'http://i.imgur.com/h2utZ01.jpg?fb', 'thumbnail_width': 600, 'title': 'Imgur: The most awesome images on the Internet', 'type': 'rich', 'version': '1.0', 'width': 550}, 'type': 'imgur.com'}","{'content': '&lt;iframe class=""embedly-embed"" src=""//cdn.embedly.com/widgets/media.html?src=%2F%2Fimgur.com%2Fa%2FMKVdJ%2Fembed&amp;url=http%3A%2F%2Fimgur.com%2Fa%2FMKVdJ&amp;image=http%3A%2F%2Fi.imgur.com%2Fh2utZ01.jpg%3Ffb&amp;key=2aa3c4d5f3de4f5b9120b660ad850dc9&amp;type=text%2Fhtml&amp;schema=imgur"" width=""550"" height=""550"" scrolling=""no"" frameborder=""0"" allowfullscreen&gt;&lt;/iframe&gt;', 'height': 550, 'scrolling': False, 'width': 550}",9,False,/r/Portland/comments/4vusgx/the_simple_solution/,1473011534,17,"{'oembed': {'description': 'Imgur: The most awesome images on the Internet.', 'height': 550, 'html': '&lt;iframe class=""embedly-embed"" src=""https://cdn.embedly.com/widgets/media.html?src=%2F%2Fimgur.com%2Fa%2FMKVdJ%2Fembed&amp;url=http%3A%2F%2Fimgur.com%2Fa%2FMKVdJ&amp;image=http%3A%2F%2Fi.imgur.com%2Fh2utZ01.jpg%3Ffb&amp;key=2aa3c4d5f3de4f5b9120b660ad850dc9&amp;type=text%2Fhtml&amp;schema=imgur"" width=""550"" height=""550"" scrolling=""no"" frameborder=""0"" allowfullscreen&gt;&lt;/iframe&gt;', 'provider_name': 'Imgur', 'provider_url': 'http://imgur.com', 'thumbnail_height': 315, 'thumbnail_url': 'https://i.embed.ly/1/image?url=http%3A%2F%2Fi.imgur.com%2Fh2utZ01.jpg%3Ffb&amp;key=b1e305db91cf4aa5a86b732cc9fffceb', 'thumbnail_width': 600, 'title': 'Imgur: The most awesome images on the Internet', 'type': 'rich', 'version': '1.0', 'width': 550}, 'type': 'imgur.com'}","{'content': '&lt;iframe class=""embedly-embed"" src=""https://cdn.embedly.com/widgets/media.html?src=%2F%2Fimgur.com%2Fa%2FMKVdJ%2Fembed&amp;url=http%3A%2F%2Fimgur.com%2Fa%2FMKVdJ&amp;image=http%3A%2F%2Fi.imgur.com%2Fh2utZ01.jpg%3Ffb&amp;key=2aa3c4d5f3de4f5b9120b660ad850dc9&amp;type=text%2Fhtml&amp;schema=imgur"" width=""550"" height=""550"" scrolling=""no"" frameborder=""0"" allowfullscreen&gt;&lt;/iframe&gt;', 'height': 550, 'scrolling': False, 'width': 550}",,False,Portland,t5_2qi2i,http://a.thumbs.redditmedia.com/atErJaUixwfvaNmLu7t-3EZWiivyWauzL68MPAdXHC0.jpg,The simple solution.,http://imgur.com/a/MKVdJ,photo,Photo,link,"{'images': [{'id': '3Pq4NV8c2uhUrZENWyh6i719sFCAgnZa_N6X1snlcw8', 'resolutions': [{'height': 144, 'url': 'https://i.redditmedia.com/5duNUsZaAtxpbOqHxSUm5deMcvngC7jWs6xevDnh8Qo.jpg?fit=crop&amp;crop=faces%2Centropy&amp;arh=2&amp;w=108&amp;s=0e6fbb67bf3b1279d494ad6f8075a578', 'width': 108}, {'height': 288, 'url': 'https://i.redditmedia.com/5duNUsZaAtxpbOqHxSUm5deMcvngC7jWs6xevDnh8Qo.jpg?fit=crop&amp;crop=faces%2Centropy&amp;arh=2&amp;w=216&amp;s=21bba9609b9c14e793896615a89afa48', 'width': 216}, {'height': 426, 'url': 'https://i.redditmedia.com/5duNUsZaAtxpbOqHxSUm5deMcvngC7jWs6xevDnh8Qo.jpg?fit=crop&amp;crop=faces%2Centropy&amp;arh=2&amp;w=320&amp;s=c8e3be732865c82f38bcebce72f152aa', 'width': 320}, {'height': 853, 'url': 'https://i.redditmedia.com/5duNUsZaAtxpbOqHxSUm5deMcvngC7jWs6xevDnh8Qo.jpg?fit=crop&amp;crop=faces%2Centropy&amp;arh=2&amp;w=640&amp;s=52ba0d1f52bee2ac1c318bfd2d5ea2ec', 'width': 640}, {'height': 1280, 'url': 'https://i.redditmedia.com/5duNUsZaAtxpbOqHxSUm5deMcvngC7jWs6xevDnh8Qo.jpg?fit=crop&amp;crop=faces%2Centropy&amp;arh=2&amp;w=960&amp;s=ff74d83effc5dfca582d55b05264c96b', 'width': 960}, {'height': 1440, 'url': 'https://i.redditmedia.com/5duNUsZaAtxpbOqHxSUm5deMcvngC7jWs6xevDnh8Qo.jpg?fit=crop&amp;crop=faces%2Centropy&amp;arh=2&amp;w=1080&amp;s=e4962178ffdb2ca504bf53ad96d5ee76', 'width': 1080}], 'source': {'height': 3264, 'url': 'https://i.redditmedia.com/5duNUsZaAtxpbOqHxSUm5deMcvngC7jWs6xevDnh8Qo.jpg?s=7b917fa1ebc8bc7d460c010bc259448e', 'width': 2448}, 'variants': {}}]}",,,
