author,author_created_utc,author_flair_css_class,author_flair_text,author_fullname,created_utc,domain,full_link,gilded,id,is_self,media_embed,num_comments,over_18,permalink,retrieved_on,score,secure_media_embed,selftext,stickied,subreddit,subreddit_id,thumbnail,title,url,edited,media,secure_media
Farfel_TheDog,1376770459.0,,,t2_csmbt,1425676495,self.Portland,https://www.reddit.com/r/Portland/comments/2y6chm/today_is_my_birthday_and_want_to_know_where_i_can/,0,2y6chm,True,{},10,False,/r/Portland/comments/2y6chm/today_is_my_birthday_and_want_to_know_where_i_can/,1440868837,0,{},I already went to Denny's and getting buck time is of the essence ,False,Portland,t5_2qi2i,self,Today is my birthday and want to know where I can get free stuff,http://www.reddit.com/r/Portland/comments/2y6chm/today_is_my_birthday_and_want_to_know_where_i_can/,,,
93TILL503,1211522480.0,,NW District,t2_35h9o,1425675598,i.imgur.com,https://www.reddit.com/r/Portland/comments/2y6aju/any_idea_whats_going_on_in_hillsboro/,0,2y6aju,False,{},10,False,/r/Portland/comments/2y6aju/any_idea_whats_going_on_in_hillsboro/,1440868862,0,{},,False,Portland,t5_2qi2i,http://b.thumbs.redditmedia.com/96MaUyvKuFiz8TqpkQGnspUD0QLS3497lOiyEfJ-4Wg.jpg,Any idea what's going on in Hillsboro?,http://i.imgur.com/L1PnBFa.png,,,
[deleted],,,,,1425675524,self.Portland,https://www.reddit.com/r/Portland/comments/2y6aee/huge_ploom_of_black_smoke_going_into_the_sky/,0,2y6aee,True,{},0,False,/r/Portland/comments/2y6aee/huge_ploom_of_black_smoke_going_into_the_sky/,1440868864,1,{},Looking out my window I'm seeing a lot of black smoke going pretty high up. It just started within the last hour. anyone know whats on fire? ,False,Portland,t5_2qi2i,default,Huge ploom of black smoke going into the sky?,http://www.reddit.com/r/Portland/comments/2y6aee/huge_ploom_of_black_smoke_going_into_the_sky/,,,
ajlm,1322250666.0,,Far Southwest,t2_6b916,1425675382,i.imgur.com,https://www.reddit.com/r/Portland/comments/2y6a37/huge_smoke_plume_in_hillsboro_anybody_know_what/,0,2y6a37,False,{},121,False,/r/Portland/comments/2y6a37/huge_smoke_plume_in_hillsboro_anybody_know_what/,1440868868,183,{},,False,Portland,t5_2qi2i,http://b.thumbs.redditmedia.com/G2K6TNK6Xpk1DiB_MGN2rRTWOVp22UiQhJdiQq1SQac.jpg,"Huge smoke plume in Hillsboro, anybody know what happened?",http://i.imgur.com/boa5Fa0.jpg,,,
investandr,1418254534.0,,,t2_jxsih,1425675360,i.imgur.com,https://www.reddit.com/r/Portland/comments/2y6a1l/whats_burning_in_hillsboro/,0,2y6a1l,False,{},8,False,/r/Portland/comments/2y6a1l/whats_burning_in_hillsboro/,1440868869,12,{},,False,Portland,t5_2qi2i,http://b.thumbs.redditmedia.com/vei8GfgwhMVgiNlpapRObGutw4Gyit6WPQKQ6rTagsc.jpg,What's burning in hillsboro?,http://i.imgur.com/mDj3WOL.jpg,,,
testing_testes,1385315454.0,,,t2_e1yn0,1425674252,self.Portland,https://www.reddit.com/r/Portland/comments/2y67pf/free_headshotspics_this_weekend/,0,2y67pf,True,{},10,False,/r/Portland/comments/2y67pf/free_headshotspics_this_weekend/,1440868899,10,{},"I rented a great portrait lens for a gig tonight and I'm going to end up having until Monday morning. Since I've got it for the weekend, I want to use it. If you're looking for some head shots or even just a new Facebook profile pic or whatever, hit me up. 

I'm thinking we could just meet up someplace downtown and walk around. I've got a couple spots in mind: around the art museum and the river front specifically but if you have any ideas, let me know. We'll keep it in public so there's no threat of one of us murdering the other. I may end up adding these to my portfolio or just on to my Facebook if they're good enough. Either way you'll be able to pick out ones you like and get images after I'm done processing them. I listed this on craigslist and it has some samples of mine:

[http://portland.craigslist.org/mlt/ats/4920244111.html](http://portland.craigslist.org/mlt/ats/4920244111.html)",False,Portland,t5_2qi2i,self,Free Headshots/Pics this weekend,http://www.reddit.com/r/Portland/comments/2y67pf/free_headshotspics_this_weekend/,,,
[deleted],,,,,1425674060,self.Portland,https://www.reddit.com/r/Portland/comments/2y679t/power_out_in_se_portland_for_anyone_else/,0,2y679t,True,{},6,False,/r/Portland/comments/2y679t/power_out_in_se_portland_for_anyone_else/,1440868905,11,{},"PGE says 2 outages affecting 1500 customers

https://www.portlandgeneral.com/safety_outages/outages/outage_updates/outage_map.aspx",False,Portland,t5_2qi2i,self,Power out in SE Portland for anyone else?,http://www.reddit.com/r/Portland/comments/2y679t/power_out_in_se_portland_for_anyone_else/,,,
Dirigibleduck,1266620634.0,,Hawthorne,t2_3wa3y,1425673010,oregonlive.com,https://www.reddit.com/r/Portland/comments/2y64xq/thirty_years_on_activists_say_its_time_to_undo/,0,2y64xq,False,{},90,False,/r/Portland/comments/2y64xq/thirty_years_on_activists_say_its_time_to_undo/,1440868935,83,{},,False,Portland,t5_2qi2i,http://b.thumbs.redditmedia.com/aPPKYIRsqZ5_gFN0LHSE8tQLiIbG2eSO0J5PpEV2C2o.jpg,"Thirty years on, activists say it's time to undo Oregon's prohibition of rent control",http://www.oregonlive.com/front-porch/index.ssf/2015/03/thirty_years_on_activists_say.html,,,
[deleted],,,,,1425672635,roguevalleymessenger.com,https://www.reddit.com/r/Portland/comments/2y643t/dont_smoke_the_messenger_history_repeats_itself/,0,2y643t,False,{},1,False,/r/Portland/comments/2y643t/dont_smoke_the_messenger_history_repeats_itself/,1440868946,2,{},,False,Portland,t5_2qi2i,default,DON'T SMOKE THE MESSENGER: History Repeats Itself,http://roguevalleymessenger.com/news/dont-smoke-messenger-history-repeats-itself#.VPoG1PnF-kx,,,
[deleted],,,,,1425671965,self.Portland,https://www.reddit.com/r/Portland/comments/2y62o9/trimet_is_checking_fares_at_the_westbound/,0,2y62o9,True,{},1,False,/r/Portland/comments/2y62o9/trimet_is_checking_fares_at_the_westbound/,1440868964,0,{},,False,Portland,t5_2qi2i,default,trimet is checking fares at the westbound providence park max stop.,http://www.reddit.com/r/Portland/comments/2y62o9/trimet_is_checking_fares_at_the_westbound/,,,
tsatsawassa,1298811409.0,,,t2_4wc5v,1425671651,self.Portland,https://www.reddit.com/r/Portland/comments/2y620f/bills_ending_daylight_savings_time_to_receive/,0,2y620f,True,{},35,False,/r/Portland/comments/2y620f/bills_ending_daylight_savings_time_to_receive/,1440868973,143,{},"This is a follow-up to a post last month about Bills in the Oregon Legislature to abolish DST in Oregon.  

The bills will receive a public hearing.  If you want to attend, [here](https://olis.leg.state.or.us/liz/2015R1/Committees/SRULES/2015-03-10-15-00/SB99/Details) are the details.  

I also received this in an email: ""If anyone would like to submit testimony on the bill, they can send it to the committee administrator, Erin Seiler, by email (erin.seiler@state.or.us).

The timing is great, because we're all about to lose an hour of sleep this weekend.  

Someone is welcome to re-post this on Monday when it might have a bigger impact.  ",False,Portland,t5_2qi2i,self,Bills Ending Daylight Savings Time to Receive Public Hearing. Follow-up to post from last month.,http://www.reddit.com/r/Portland/comments/2y620f/bills_ending_daylight_savings_time_to_receive/,,,
atrain714,1303790298.0,,,t2_55bz8,1425670820,pdx.eater.com,https://www.reddit.com/r/Portland/comments/2y60bg/postmates_launches_in_portland_on_thursday/,0,2y60bg,False,{},2,False,/r/Portland/comments/2y60bg/postmates_launches_in_portland_on_thursday/,1440868995,2,{},,False,Portland,t5_2qi2i,default,"Postmates launches in Portland on Thursday, delivering food from Lardo, Blue Star Donuts, and others",http://pdx.eater.com/2015/3/5/8151147/postmates-launches-portland-delivery-service-free-voodoo-doughnuts,,,
[deleted],,,,,1425670659,urbanforestprofessionals.com,https://www.reddit.com/r/Portland/comments/2y5zz7/as_someone_recently_surprised_by_a_large_canopy/,0,2y5zz7,False,{},0,False,/r/Portland/comments/2y5zz7/as_someone_recently_surprised_by_a_large_canopy/,1440868999,1,{},,False,Portland,t5_2qi2i,default,"As someone recently surprised by a large canopy tree removed by a neighbor with no warning, here are new rules about Title 11 trees and our urban canopy",http://www.urbanforestprofessionals.com/portland-tree-permit-series-title-11-trees,,,
Poops_your_bed,1355479655.0,,,t2_9w3eb,1425670540,self.Portland,https://www.reddit.com/r/Portland/comments/2y5zr4/bachelor_party_ideas_in_portland/,0,2y5zr4,True,{},14,False,/r/Portland/comments/2y5zr4/bachelor_party_ideas_in_portland/,1440869002,0,{},Looking for bachelor party suggestions for a group of Canadian fellas to partake in near the end of May. Nothing is taboo or too depraved. ,False,Portland,t5_2qi2i,self,Bachelor party ideas in Portland?,http://www.reddit.com/r/Portland/comments/2y5zr4/bachelor_party_ideas_in_portland/,,,
xmclark,1341194196.0,,,t2_8729f,1425670484,self.Portland,https://www.reddit.com/r/Portland/comments/2y5zmo/what_is_dress_code_at_schnitz/,0,2y5zmo,True,{},51,False,/r/Portland/comments/2y5zmo/what_is_dress_code_at_schnitz/,1440869004,14,{},"I'm seeing the video games symphony tonight...can I wear jeans and dress shoes? I'm not sure of the dress code, if there even is one. First world problems...

EDIT: The responses are awesome. Thanks everyone!!

EDIT: I have decided to wear day clothes, because reasons. ",False,Portland,t5_2qi2i,self,What is dress code at Schnitz?,http://www.reddit.com/r/Portland/comments/2y5zmo/what_is_dress_code_at_schnitz/,1425678980.0,,
lexuh,1332806091.0,,,t2_79xvq,1425668730,oregonlive.com,https://www.reddit.com/r/Portland/comments/2y5vz0/city_council_approves_taller_buildings_in/,0,2y5vz0,False,{},92,False,/r/Portland/comments/2y5vz0/city_council_approves_taller_buildings_in/,1440869051,94,{},,False,Portland,t5_2qi2i,http://b.thumbs.redditmedia.com/abeOlQhvgE5v_A8fgxzXU6-LwJ7s23mAI21fhTZ3vBY.jpg,"City Council approves taller buildings in downtown, Fritz ""disgusted""",http://www.oregonlive.com/portland/index.ssf/2015/03/city_council_approves_downtown.html#incart_river,,,
jaketrudell,1425665526.0,,,t2_ly0p8,1425666370,bnj.com,https://www.reddit.com/r/Portland/comments/2y5r64/the_ugly_2015_timbers_jersey_may_be_just_what_we/,0,2y5r64,False,{},3,False,/r/Portland/comments/2y5r64/the_ugly_2015_timbers_jersey_may_be_just_what_we/,1440869113,1,{},,False,Portland,t5_2qi2i,default,"The ""ugly"" 2015 Timbers' jersey may be just what we need. What do you think?",https://www.bnj.com/blog/the-2015-timbers-jersey-a-designers-defense/,,,
pdxreddits,1425663548.0,,,t2_lxzrw,1425663618,self.Portland,https://www.reddit.com/r/Portland/comments/2y5ld2/portland_softball_leagues_looking_for_a_team_to/,0,2y5ld2,True,{},17,False,/r/Portland/comments/2y5ld2/portland_softball_leagues_looking_for_a_team_to/,1440869189,0,{},"Hi there.

Mid-20s former baseball player looking for a softball team to play on. I am on a team but the only way I can get them out is to scrimmage. Sure that is great but they aren't getting better and don't seem to want to. I need a higher competition level. 

Edit: I play 3rd base/SS or wherever needed

PM me if you know of something that would work for me please!

Thanks!",False,Portland,t5_2qi2i,self,Portland Softball Leagues: looking for a team to join. Mid-to-high skill level,http://www.reddit.com/r/Portland/comments/2y5ld2/portland_softball_leagues_looking_for_a_team_to/,1425663801.0,,
green_and_yellow,1339437684.0,,Hillsdale,t2_7ypoy,1425663507,self.Portland,https://www.reddit.com/r/Portland/comments/2y5l3m/what_are_your_favorite_wineries_to_visit_are_you/,0,2y5l3m,True,{},36,False,/r/Portland/comments/2y5l3m/what_are_your_favorite_wineries_to_visit_are_you/,1440869192,22,{},"Edit: I'm seeing lots of downvotes. Should this be in /r/askportland instead?

Edit 2: Disregard Edit 1",False,Portland,t5_2qi2i,self,"What are your favorite wineries to visit? Are you a member of any winery's ""wine club""?",http://www.reddit.com/r/Portland/comments/2y5l3m/what_are_your_favorite_wineries_to_visit_are_you/,1425675594.0,,
CopWithAComplaint,1425655749.0,,,t2_lxw9m,1425658776,self.Portland,https://www.reddit.com/r/Portland/comments/2y5awr/local_police_officer_here_with_a_complaint_about/,0,2y5awr,True,{},1,False,/r/Portland/comments/2y5awr/local_police_officer_here_with_a_complaint_about/,1440869324,0,{},,False,Portland,t5_2qi2i,default,Local police officer here with a complaint about Portland Police.,http://www.reddit.com/r/Portland/comments/2y5awr/local_police_officer_here_with_a_complaint_about/,,,
my_lucid_nightmare,1347554003.0,,,t2_8zz0z,1425653133,self.Portland,https://www.reddit.com/r/Portland/comments/2y5033/who_can_tell_me_about_this_guy/,0,2y5033,True,{},13,False,/r/Portland/comments/2y5033/who_can_tell_me_about_this_guy/,1440869464,7,{},"Recently, a Portland expat moved to Seattle and is running in a local city council race.  Has anyone had experience with him that they'd like to share?

http://westseattleblog.com/2015/03/2015-election-1th-candidate-for-district-1-city-council-pavel-goberman/",False,Portland,t5_2qi2i,self,Who can tell me about this guy,http://www.reddit.com/r/Portland/comments/2y5033/who_can_tell_me_about_this_guy/,,,
MBoffin,1275461412.0,,,t2_43f0n,1425630122,self.Portland,https://www.reddit.com/r/Portland/comments/2y4azd/want_to_watch_a_film_about_indie_game_developers/,0,2y4azd,True,{},8,False,/r/Portland/comments/2y4azd/want_to_watch_a_film_about_indie_game_developers/,1440869790,21,{},"There's a great new film out about independent game developers. The film is called [Gameloading: Rise of the Indies](http://www.gameloading.tv/). It just had its premiere tonight at the Game Developers Conference in San Francisco and was very well received. Here's a trailer:

https://www.youtube.com/watch?v=nw7pt6hC23w

A number of members from the [Portland Indie Game Squad](http://pigsquad.com) (a local community of indie game devs) are going to a screening of this film on April 6th at the Clinton Street Theater. Two members of PIGSquad can actually be seen in the film!

If you'd like to watch it with us, reserve your tickets now. It's one of those things where we need to secure a certain number of reservations in order to make it happen. So if you plan to go, please, reserve a ticket now! It's $11 per ticket. Here's where you can reserve tickets:

https://gathr.us/screening/11016

We hope to see you there! :)",False,Portland,t5_2qi2i,self,Want to watch a film about indie game developers *with* a bunch of Portland indie game developers?,http://www.reddit.com/r/Portland/comments/2y4azd/want_to_watch_a_film_about_indie_game_developers/,,,
dressmenice,,,,,1425616697,gofundme.com,https://www.reddit.com/r/Portland/comments/2y3tgt/help_sean_start_kids_for_recycling/,0,2y3tgt,False,{},1,False,/r/Portland/comments/2y3tgt/help_sean_start_kids_for_recycling/,1440870017,1,{},,False,Portland,t5_2qi2i,default,Help Sean start Kids for Recycling,http://www.gofundme.com/nw2auw,,,
Littlebigman57,1367963614.0,,Happy Valley,t2_blg8r,1425615639,self.Portland,https://www.reddit.com/r/Portland/comments/2y3rrm/where_is_there_a_philippine_restaurant_to_buy/,0,2y3rrm,True,{},14,False,/r/Portland/comments/2y3rrm/where_is_there_a_philippine_restaurant_to_buy/,1440870039,2,{},,False,Portland,t5_2qi2i,self,Where is there a Philippine restaurant to buy Lumpia and Pancet ?,http://www.reddit.com/r/Portland/comments/2y3rrm/where_is_there_a_philippine_restaurant_to_buy/,,,
[deleted],,,,,1425614942,self.Portland,https://www.reddit.com/r/Portland/comments/2y3qke/to_the_dude_running_down_the_middle_of_going_st/,0,2y3qke,True,{},2,False,/r/Portland/comments/2y3qke/to_the_dude_running_down_the_middle_of_going_st/,1440870054,0,{},"Kudos for having your dog on a leash, but your positioning made it difficult to ride around you without being sure I wouldn't wreck into your dog. Your headphones ensured you didn't hear my friendly ""on your left!"" Having to go wide at the last second I almost crashed into a really cute girl on a bicycle, and as nice as it would have been to have a conversation with her it would probably ruin her morning to have it on the way to the ER. Try to be a little more considerate, stranger who will never read this.  

Respectfully,

A dude who hates crashing his bicycle into dogs/girls",False,Portland,t5_2qi2i,default,To the dude running down the middle of Going St with his dog,http://www.reddit.com/r/Portland/comments/2y3qke/to_the_dude_running_down_the_middle_of_going_st/,,,
magpiepdx,1402339525.0,,,t2_gwvw4,1425614836,portland.craigslist.org,https://www.reddit.com/r/Portland/comments/2y3qe1/oh_geez_now_this_a_finders_fee_yeah_right/,0,2y3qe1,False,{},37,False,/r/Portland/comments/2y3qe1/oh_geez_now_this_a_finders_fee_yeah_right/,1440870056,15,{},,False,Portland,t5_2qi2i,default,"Oh geez, now this? A finder's fee?? Yeah right.",http://portland.craigslist.org/mlt/apa/4918822522.html,,,
RevBendo,1298011008.0,,Brentwood-Darlington,t2_4uxar,1425612728,wweek.com,https://www.reddit.com/r/Portland/comments/2y3mje/east_portland_residents_file_ballot_petition_to/,0,2y3mje,False,{},2,False,/r/Portland/comments/2y3mje/east_portland_residents_file_ballot_petition_to/,1440870106,0,{},,False,Portland,t5_2qi2i,http://b.thumbs.redditmedia.com/Rjrq9lLPibFqLCa35t8P3Mk2MvgKWjxpUCHBphI_X5U.jpg,East Portland Residents File Ballot Petition to Secede from Portland,http://www.wweek.com/portland/mobile/blogs/blogView/id:32905,,,
Stephjj35,1425609998.0,,,t2_lxiox,1425612716,self.Portland,https://www.reddit.com/r/Portland/comments/2y3mio/almost_assaulted_at_colonel_summers_park_please/,0,2y3mio,True,{},0,False,/r/Portland/comments/2y3mio/almost_assaulted_at_colonel_summers_park_please/,1440870107,1,{},,False,Portland,t5_2qi2i,default,"Almost assaulted at Colonel Summers Park, Please be watchful. Here is my story.",http://www.reddit.com/r/Portland/comments/2y3mio/almost_assaulted_at_colonel_summers_park_please/,,,
REO_SpeedDealer,1417176889.0,,,t2_jni24,1425609229,self.Portland,https://www.reddit.com/r/Portland/comments/2y3fw5/anyone_know_of_any_bars_that_have_a_piano_that/,0,2y3fw5,True,{},16,False,/r/Portland/comments/2y3fw5/anyone_know_of_any_bars_that_have_a_piano_that/,1440870193,8,{},,False,Portland,t5_2qi2i,self,Anyone know of any bars that have a piano that customers are allowed to play?,http://www.reddit.com/r/Portland/comments/2y3fw5/anyone_know_of_any_bars_that_have_a_piano_that/,,,
TryHardDieHard,1322845042.0,,,t2_6cx56,1425608676,self.Portland,https://www.reddit.com/r/Portland/comments/2y3eum/portland_vs_austin_anyone_lived_in_both_places_i/,0,2y3eum,True,{},40,False,/r/Portland/comments/2y3eum/portland_vs_austin_anyone_lived_in_both_places_i/,1440870206,2,{},"How do they compare? Is rent out of control like it is here? Are the low income people pushed out of the city? 

The /r/austin post:

http://www.reddit.com/r/Austin/comments/2y1c13/portland_vs_austin_anyone_lived_in_both_places/

EDIT: Wow, I can't believe how much of a controversial issue this is. So many downvotes. ",False,Portland,t5_2qi2i,self,Portland vs Austin. Anyone lived in both places? I copied this post from /r/austin so we can get your perspective.,http://www.reddit.com/r/Portland/comments/2y3eum/portland_vs_austin_anyone_lived_in_both_places_i/,1425622880.0,,
[deleted],,,,,1425606886,i.imgur.com,https://www.reddit.com/r/Portland/comments/2y3boc/pdx_pollution_makes_the_sun_look_cool/,0,2y3boc,False,{},3,False,/r/Portland/comments/2y3boc/pdx_pollution_makes_the_sun_look_cool/,1440870247,0,{},,False,Portland,t5_2qi2i,default,PDX pollution makes the sun look cool =\,http://i.imgur.com/pHtaQPo.jpg,,,
PeculiarParable,1390265064.0,,,t2_ewgj0,1425606609,self.Portland,https://www.reddit.com/r/Portland/comments/2y3b6g/how_do_i_evict_a_roommate_not_on_my_lease/,0,2y3b6g,True,{},24,False,/r/Portland/comments/2y3b6g/how_do_i_evict_a_roommate_not_on_my_lease/,1440870254,11,{},"I've never had to do this before, but I am living with a roommate and it is a nightmare and I want him gone. Here are the facts:

* He owes me a this month's worth of bills (he owed me 2 months worth, but has paid 1 month's worth). 

* He pays his half of the rent to my landlord and not to me.

* His name is NOT on the lease.

* Talked to my landlord and he says it is up to me to evict him if I want him gone.

He says he cannot afford 2 month's worth of bills in one month (I had to tell his GF because she apparently speaks for him now since she is helping him pay bills). I don't see this as my problem.

I will be giving him a month to catch up on bills, but if he does not pay me within that time, I really want to evict him. How do I go about doing this?

Also, can I legally disallow his GF to be over here? She is super bossy and when I tried to speak to my roommate about the rent/bills situation, she wouldn't even let him talk. She had to be the one to discuss his bills/rent with me and I find this unacceptable.",False,Portland,t5_2qi2i,self,How do I evict a roommate not on my lease?,http://www.reddit.com/r/Portland/comments/2y3b6g/how_do_i_evict_a_roommate_not_on_my_lease/,,,
youhatemeandihateyou,1325466319.0,,SE,t2_6k787,1425605005,self.Portland,https://www.reddit.com/r/Portland/comments/2y384w/whats_the_deal_with_ospirg_petition_signature/,0,2y384w,True,{},26,False,/r/Portland/comments/2y384w/whats_the_deal_with_ospirg_petition_signature/,1440870293,5,{},"Someone just came to my door to collect signatures for HB2598 (info here:  http://gov.oregonlive.com/bill/2015/HB2598/).  She gave a rehearsed spiel and was not carrying the text of the bill that she was collecting signatures for.  WTF.

She said that she was with ""a non-profit group"" OSPIRG.  I found their website, but it's filled with slimy doublespeak.

I sent her away so that I could read the bill and find out more about it, and she hit me up for monthly donations to her employer.  I'll say it again:  WTF?  

The bill seems righteous, but the whole experience was really offputting.  Do any of you know more about this group?  

Edit:  typo",False,Portland,t5_2qi2i,self,What's the deal with OSPIRG (petition signature canvassers)?,http://www.reddit.com/r/Portland/comments/2y384w/whats_the_deal_with_ospirg_petition_signature/,1425606489.0,,
[deleted],,,,,1425604824,i.imgur.com,https://www.reddit.com/r/Portland/comments/2y37rf/whose_goddamn_car_is_this_its_been_parked/,0,2y37rf,False,{},4,False,/r/Portland/comments/2y37rf/whose_goddamn_car_is_this_its_been_parked/,1440870298,0,{},,False,Portland,t5_2qi2i,default,Whose Goddamn car is this? It's been parked illegally since Sunday. SW 18th and Taylor,http://i.imgur.com/IfZ28br.jpg,,,
findthegoat,1425604469.0,,,t2_lxgpl,1425604665,patfarnach.com,https://www.reddit.com/r/Portland/comments/2y37gs/in_honor_of_the_pygmy_goat_thief_being_brought_to/,0,2y37gs,False,{},14,False,/r/Portland/comments/2y37gs/in_honor_of_the_pygmy_goat_thief_being_brought_to/,1440870302,30,{},,False,Portland,t5_2qi2i,http://b.thumbs.redditmedia.com/j7yqwkarj3mdBCIv0bB5wC18-bw-CsogzKCm9KQuCEY.jpg,"In honor of the pygmy goat thief being brought to justice, I made this little browser game",http://patfarnach.com/goat/,,,
[deleted],,,,,1425604060,i.imgur.com,https://www.reddit.com/r/Portland/comments/2y36b3/xpost_rkeyboard_my_optometrist_knows_whats_up/,0,2y36b3,False,{},1,False,/r/Portland/comments/2y36b3/xpost_rkeyboard_my_optometrist_knows_whats_up/,1440870317,0,{},,False,Portland,t5_2qi2i,default,[xpost /r/keyboard] My optometrist knows what's up,http://i.imgur.com/z9XkWD7.png,,,
[deleted],,,,,1425599051,self.Portland,https://www.reddit.com/r/Portland/comments/2y2w4u/does_anyone_have_a_glassglasses_from_cider_summit/,0,2y2w4u,True,{},1,False,/r/Portland/comments/2y2w4u/does_anyone_have_a_glassglasses_from_cider_summit/,1440870449,0,{},"I had two glasses from Cider Summit PDX 2013 (held in Caruthers Park), and of course I broke both of them. It has the dates on the back and shows the aerial tram on the stem of the apple (as opposed to the ones from 2014, which show the bridge and do not have the dates). Does anyone have an extra glass they'd be willing to sell/send to me? (I live in CA now). I'd be super super super super appreciative!!",False,Portland,t5_2qi2i,default,Does anyone have a glass/glasses from Cider Summit PDX 2013 they'd be willing to sell?,http://www.reddit.com/r/Portland/comments/2y2w4u/does_anyone_have_a_glassglasses_from_cider_summit/,,,
tbshawk4,1360014268.0,,NE,t2_ah462,1425598665,kgw.com,https://www.reddit.com/r/Portland/comments/2y2vcf/oregon_senate_passes_bill_making_voter/,0,2y2vcf,False,{},101,False,/r/Portland/comments/2y2vcf/oregon_senate_passes_bill_making_voter/,1440870459,269,{},,False,Portland,t5_2qi2i,http://b.thumbs.redditmedia.com/KOfYzZJ4LGED0sbhQrD4sz5r5CN62XsHWXY8TpdEDdc.jpg,Oregon Senate passes bill making voter registration automatic from driver license records,http://www.kgw.com/story/news/politics/2015/03/05/senate-passes-bill-voter-registration-automatic/24459563/,,,
garyploski,1301059248.0,,,t2_50e2x,1425598369,multco.us,https://www.reddit.com/r/Portland/comments/2y2uqo/board_bans_ecig_sales_to_minors_vaping_indoors/,0,2y2uqo,False,{},84,False,/r/Portland/comments/2y2uqo/board_bans_ecig_sales_to_minors_vaping_indoors/,1440870467,71,{},,False,Portland,t5_2qi2i,http://b.thumbs.redditmedia.com/-WLegHnbt2YqUzeTwpNhbldwIdLSkhCdyD0ZdaRAExw.jpg,"Board bans e-cig sales to minors, vaping indoors",https://multco.us/multnomah-county/news/board-bans-e-cig-sales-minors-vaping-indoors,,,
