all_awardings,allow_live_comments,author,author_flair_css_class,author_flair_richtext,author_flair_text,author_flair_type,author_fullname,author_patreon_flair,author_premium,awarders,can_mod_post,contest_mode,created_utc,domain,full_link,gildings,id,is_crosspostable,is_meta,is_original_content,is_reddit_media_domain,is_robot_indexable,is_self,is_video,link_flair_background_color,link_flair_richtext,link_flair_text_color,link_flair_type,locked,media_only,no_follow,num_comments,num_crossposts,over_18,parent_whitelist_status,permalink,pinned,pwls,retrieved_on,score,selftext,send_replies,spoiler,steward_reports,stickied,subreddit,subreddit_id,subreddit_subscribers,subreddit_type,thumbnail,title,total_awards_received,url,whitelist_status,wls,author_flair_background_color,author_flair_text_color,link_flair_css_class,link_flair_text,post_hint,preview,thumbnail_height,thumbnail_width,removed_by_category,author_flair_template_id
[],False,harv405,,[],,text,t2_4bv2mdnq,False,False,[],False,False,1577199563,self.Portland,https://www.reddit.com/r/Portland/comments/ef2duv/home_buying_greater_portland_area/,{},ef2duv,True,False,False,False,True,True,False,,[],dark,text,False,False,True,1,0,False,all_ads,/r/Portland/comments/ef2duv/home_buying_greater_portland_area/,False,6,1577199564,1,"Hello Mainer Redditors! 

I thought that I should reach out here about buying a home in the area. My wife and I are finally ready to seriously start looking at buying our first home in the Greater Portland area. We are currently renting in Cape Elizabeth and absolutely love it! I spent most of my summers here as a kid so it figures that I would enjoy it as an adult and want our child to grow up here. Having said that, we also understand that Cape is not a cheap area to buy a home and are looking at a few options. 

&amp;#x200B;

1. Buy a home that needs some work in Cape. Does anyone know a reputable home-reno specialist or some contractors that I could add to my list of contacts if this happens? 
2. Should we avoid buying a home that needs some renovation as it is a hassle and save more for a ""turn-key"" home? 
3. What are some other areas that we should be looking? We need good schools, reasonable commute into downtown Portland, and a sense of community. We already have Gorham, SoPo, and Brunswick on the list. Yarmouth, Falmouth, and Freeport do not interest us that much as they are around the same cost as Cape. 
4.  Which areas do you expect to see the most growth? I am thinking Windham (worried about the traffic to Portland), Westbrook (though I think it will be awhile before the schools get decent), and Topsham. 

Really any insight into buying within the Greater Portland area would be much appreciated. 

Please let me know! 

&amp;#x200B;

Thanks!",True,False,[],False,Portland,t5_2qi2i,142643,public,self,Home Buying - Greater Portland Area,0,https://www.reddit.com/r/Portland/comments/ef2duv/home_buying_greater_portland_area/,all_ads,6,,,,,,,,,,
[],False,acrossthewholething,,[],,text,t2_2los9kvs,False,False,[],False,False,1577198340,i.redd.it,https://www.reddit.com/r/Portland/comments/ef24zu/summer_sunset/,{},ef24zu,True,False,False,True,True,False,False,,[],dark,text,False,False,True,0,0,False,all_ads,/r/Portland/comments/ef24zu/summer_sunset/,False,6,1577198341,1,,True,False,[],False,Portland,t5_2qi2i,142642,public,default,Summer Sunset,0,https://i.redd.it/veboq21wel641.jpg,all_ads,6,,,photo,Photo,,,,,,
[],False,AutoModerator,,[],🌅,text,t2_6l4z3,False,True,[],False,False,1577196421,self.Portland,https://www.reddit.com/r/Portland/comments/ef1rqm/dear_portland_december_24_2019_weekly_pet_photo/,{},ef1rqm,True,False,False,False,True,True,False,,[],dark,text,False,False,True,4,0,False,all_ads,/r/Portland/comments/ef1rqm/dear_portland_december_24_2019_weekly_pet_photo/,False,6,1577196422,1,"Hello, humans. 

[Here is a photo of my beloved dog #0000ff](http://i.imgur.com/d4oWeSi.jpg)! Post pictures of your house creatures.",False,False,[],False,Portland,t5_2qi2i,142642,public,self,"DEAR PORTLAND: December 24, 2019 WEEKLY PET PHOTO THREAD",0,https://www.reddit.com/r/Portland/comments/ef1rqm/dear_portland_december_24_2019_weekly_pet_photo/,all_ads,6,,dark,,,,,,,,
[],False,chatton_rose,,[],,text,t2_a2hjy40,False,False,[],False,False,1577186359,self.Portland,https://www.reddit.com/r/Portland/comments/ef058b/cool_place_to_stay_while_in_portland_for_solo/,{},ef058b,True,False,False,False,True,True,False,,[],dark,text,False,False,True,8,0,False,all_ads,/r/Portland/comments/ef058b/cool_place_to_stay_while_in_portland_for_solo/,False,6,1577186361,1,"Hello Portland!! I am planning on visiting for the first time and am looking at airbnbs and such but do not know the area so thought I’d so some scooping, which area/accommodation type would you recommend keeping in mind the following: 

- 420 friendly
- drinker
- don’t love clubs 
- don’t love huge crowds but like meeting people
- nice breweries, coffee shops and bookstores/cute shops type of neighbourhood 
- do not drive 

Any tips/advices/spots to check/whatever is appreciated :) thanks!!",True,False,[],False,Portland,t5_2qi2i,142646,public,self,Cool place to stay while in Portland for solo girl over Christmas,0,https://www.reddit.com/r/Portland/comments/ef058b/cool_place_to_stay_while_in_portland_for_solo/,all_ads,6,,,,,,,,,,
[],False,cawk_rawker,,[],,text,t2_10ghg6,False,False,[],False,False,1577176155,i.redd.it,https://www.reddit.com/r/Portland/comments/eeymlu/my_friend_lost_his_pup_last_night_last_seen_202nd/,{},eeymlu,True,False,False,True,True,False,False,,[],dark,text,False,False,True,7,0,False,all_ads,/r/Portland/comments/eeymlu/my_friend_lost_his_pup_last_night_last_seen_202nd/,False,6,1577176155,1,,True,False,[],False,Portland,t5_2qi2i,142637,public,default,"My friend lost his pup last night. Last seen 202nd &amp; Stark. His name is Walker and he’s probably terrified, fingers crossed someone’s seen him.",0,https://i.redd.it/afd6c9txkj641.jpg,all_ads,6,,,,,,,,,,
[],False,gloomynymph,,[],,text,t2_2w5ki7xj,False,False,[],False,False,1577175661,self.Portland,https://www.reddit.com/r/Portland/comments/eeyk33/anyone_in_the_area_expecting_puppies_or_have/,{},eeyk33,True,False,False,False,True,True,False,,[],dark,text,False,False,True,4,0,False,all_ads,/r/Portland/comments/eeyk33/anyone_in_the_area_expecting_puppies_or_have/,False,6,1577175663,1,I’ve been combing the shelters but I’m curious if anyone is expecting puppies soon in the Portland area or has any,True,False,[],False,Portland,t5_2qi2i,142637,public,self,Anyone in the area expecting puppies or have puppies?,0,https://www.reddit.com/r/Portland/comments/eeyk33/anyone_in_the_area_expecting_puppies_or_have/,all_ads,6,,,,,,,,,,
[],False,12_tubs_of_gutz,,[],"Portland, ME",text,t2_4anlcf87,False,True,[],False,False,1577168748,opb.org,https://www.reddit.com/r/Portland/comments/eexheg/laboratory_cats_and_dogs_in_oregon_have_to_be_put/,{},eexheg,True,False,False,False,True,False,False,,[],dark,text,False,False,True,8,0,False,all_ads,/r/Portland/comments/eexheg/laboratory_cats_and_dogs_in_oregon_have_to_be_put/,False,6,1577168749,1,,False,False,[],False,Portland,t5_2qi2i,142634,public,default,Laboratory Cats And Dogs In Oregon Have To Be Put Up For Adoption,0,https://www.opb.org/news/article/laboratory-dogs-and-cats-put-up-for-adoption/,all_ads,6,,dark,local-news,Local News,,,,,,6def5a0a-a78b-11e6-979b-0e6444f32ba4
[],False,12_tubs_of_gutz,,[],"Portland, ME",text,t2_4anlcf87,False,True,[],False,False,1577168644,oregonlive.com,https://www.reddit.com/r/Portland/comments/eexgqn/woman_charged_with_bias_crime_after_harassing/,{},eexgqn,True,False,False,False,True,False,False,,[],dark,text,False,False,True,21,0,False,all_ads,/r/Portland/comments/eexgqn/woman_charged_with_bias_crime_after_harassing/,False,6,1577168645,1,,False,False,[],False,Portland,t5_2qi2i,142634,public,https://b.thumbs.redditmedia.com/yfSWslFhl8v0XTF-1r7Ojt-66lWBCVzdAqqBRHKI--c.jpg,"Woman charged with bias crime after harassing food cart operator, police say",0,https://www.oregonlive.com/crime/2019/12/woman-charged-with-bias-crime-after-harassing-food-cart-operator-police-say.html,all_ads,6,,dark,,,link,"{'enabled': False, 'images': [{'id': 'PwKrb6lK7jYtVYGPYiOwX1bub6c9GEbjhqgHOM54iXU', 'resolutions': [{'height': 60, 'url': 'https://external-preview.redd.it/DjkciBdN2MLJdPOxbghIMXP_FGu60go6xk_ixxV6xlY.jpg?width=108&amp;crop=smart&amp;auto=webp&amp;s=599e2723c0a21b184a7be030a72429281adb958f', 'width': 108}, {'height': 121, 'url': 'https://external-preview.redd.it/DjkciBdN2MLJdPOxbghIMXP_FGu60go6xk_ixxV6xlY.jpg?width=216&amp;crop=smart&amp;auto=webp&amp;s=c156cb5ace4be5eace0acd1638f15524c85b7528', 'width': 216}, {'height': 180, 'url': 'https://external-preview.redd.it/DjkciBdN2MLJdPOxbghIMXP_FGu60go6xk_ixxV6xlY.jpg?width=320&amp;crop=smart&amp;auto=webp&amp;s=7d77741d4b7360a7885bd00cd9c373be969f94c8', 'width': 320}, {'height': 360, 'url': 'https://external-preview.redd.it/DjkciBdN2MLJdPOxbghIMXP_FGu60go6xk_ixxV6xlY.jpg?width=640&amp;crop=smart&amp;auto=webp&amp;s=7ec836f65c9ba84e6bc5d8d5a45c11ccf59c0e49', 'width': 640}, {'height': 540, 'url': 'https://external-preview.redd.it/DjkciBdN2MLJdPOxbghIMXP_FGu60go6xk_ixxV6xlY.jpg?width=960&amp;crop=smart&amp;auto=webp&amp;s=151d096e79b80e9c41985453bd7186ae979da06e', 'width': 960}, {'height': 607, 'url': 'https://external-preview.redd.it/DjkciBdN2MLJdPOxbghIMXP_FGu60go6xk_ixxV6xlY.jpg?width=1080&amp;crop=smart&amp;auto=webp&amp;s=01a85bf7abf8ad9224bf73fef5df4a23faf9918a', 'width': 1080}], 'source': {'height': 720, 'url': 'https://external-preview.redd.it/DjkciBdN2MLJdPOxbghIMXP_FGu60go6xk_ixxV6xlY.jpg?auto=webp&amp;s=c2488fd99ff8df0965fa54c66d99823faf945277', 'width': 1280}, 'variants': {}}]}",78.0,140.0,,6def5a0a-a78b-11e6-979b-0e6444f32ba4
[],False,hittheblock,,[],,text,t2_3k873tqx,False,False,[],False,False,1577167047,i.redd.it,https://www.reddit.com/r/Portland/comments/eex6nn/romanian_panhandle_with_babies_is_a_nation_wide/,{},eex6nn,False,False,False,True,False,False,False,,[],dark,text,False,False,True,0,0,False,all_ads,/r/Portland/comments/eex6nn/romanian_panhandle_with_babies_is_a_nation_wide/,False,6,1577167047,1,,True,False,[],False,Portland,t5_2qi2i,142633,public,default,Romanian panhandle with babies is a nation wide scam,0,https://i.redd.it/mo8ebg8uti641.jpg,all_ads,6,,,,,,,,,moderator,
[],False,speleophile,,[],,text,t2_2xz1qmkn,False,False,[],False,False,1577163461,i.redd.it,https://www.reddit.com/r/Portland/comments/eewit6/fire_under_the_mlk_overpass/,{},eewit6,True,False,False,True,True,False,False,,[],dark,text,False,False,True,112,0,False,all_ads,/r/Portland/comments/eewit6/fire_under_the_mlk_overpass/,False,6,1577163461,1,,True,False,[],False,Portland,t5_2qi2i,142630,public,default,Fire under the MLK overpass.,0,https://i.redd.it/tjyqgtt6ji641.jpg,all_ads,6,,,,,,,,,,
[],False,Recent-Force,,[],,text,t2_57vlqwyz,False,False,[],False,False,1577162874,oregonlive.com,https://www.reddit.com/r/Portland/comments/eeweq4/sworn_to_protect_and_serve_a_city_that_doesnt/,{},eeweq4,True,False,False,False,True,False,False,,[],dark,text,False,False,True,24,0,False,all_ads,/r/Portland/comments/eeweq4/sworn_to_protect_and_serve_a_city_that_doesnt/,False,6,1577162876,1,,False,False,[],False,Portland,t5_2qi2i,142630,public,default,Sworn to protect and serve a city that doesn’t welcome it (by a PPB officer),0,https://www.oregonlive.com/opinion/2019/12/opinion-sworn-to-protect-and-serve-a-city-that-doesnt-welcome-it.html,all_ads,6,,,local-news,Local News,,,,,,
[],False,holmquistc,,[],,text,t2_d45u6,False,False,[],False,False,1577162244,self.Portland,https://www.reddit.com/r/Portland/comments/eewa5b/tourists/,{},eewa5b,True,False,False,False,True,True,False,,[],dark,text,False,False,True,19,0,False,all_ads,/r/Portland/comments/eewa5b/tourists/,False,6,1577162245,1,So occasionally after work (I work on the outskirts of Downtown Portland) I'll do Uber and Lyft driving.  Most of the tourists I meet have said they've spent their entire trip downtown.  I'm born and raised in Portland (weird huh?) so I have to be told this oddly but why are tourists from around the world so anxious to see Portland and waste time downtown?  They don't have these stores where they come from?,True,False,[],False,Portland,t5_2qi2i,142630,public,self,Tourists,0,https://www.reddit.com/r/Portland/comments/eewa5b/tourists/,all_ads,6,,,,,,,,,,
[],False,SirPhantomIII,,[],,text,t2_d0zo3,False,False,[],False,False,1577162013,self.Portland,https://www.reddit.com/r/Portland/comments/eew8k2/porch_theft_in_ne_portland/,{},eew8k2,True,False,False,False,True,True,False,,[],dark,text,False,False,True,9,0,False,all_ads,/r/Portland/comments/eew8k2/porch_theft_in_ne_portland/,False,6,1577162013,1,"Hey all,

As the title says, we got stolen from. At first it was believed only my package was stolen (a 12 pack of madrinas coffee) but after getting home, my girlfriend realised her package had also gotten stolen. Now, I was upset about my package, but it was just some coffee that was less than 30 dollars. I was mad, but not much harm done. However, my girlfriends package was not so simple.

She really likes figures. Anime, animal, pokemon, you name it. If she likes it, she buys it. The figure that was stolen was a limited edition variant of [this](https://www.myplasticheart.com/the-phantom-fox-wild-by-genkosha/) fox. I believe it was a rainbow version for the same price. Anyways, I'm just posting both to vent and to also ask if anyone else has experienced this. I live near the crossroads church, if that reduces the area. I've already filed a theft report with USPS and will probably file a police report tomorrow, but chances are nothing will come of it, since we dont have video proof or anything.

Also, a note to the thief. If you see this, please return the fox. I dont care about the coffee, you can have it. But please give the fox back. My girlfriend has been distraught ever since we found out it was taken too. She was very excited for it. If this reaches you at all, please return it.",True,False,[],False,Portland,t5_2qi2i,142629,public,self,Porch theft in NE Portland,0,https://www.reddit.com/r/Portland/comments/eew8k2/porch_theft_in_ne_portland/,all_ads,6,,,,,,,,,,
[],False,CatDamage,,[],,text,t2_17dxq5bh,False,False,[],False,False,1577159571,i.redd.it,https://www.reddit.com/r/Portland/comments/eevqsk/pretty_cool_hanukkah_section_fred_meyer/,{},eevqsk,True,False,False,True,True,False,False,,[],dark,text,False,False,True,9,0,False,all_ads,/r/Portland/comments/eevqsk/pretty_cool_hanukkah_section_fred_meyer/,False,6,1577159572,1,,True,False,[],False,Portland,t5_2qi2i,142627,public,default,"Pretty cool Hanukkah section, Fred Meyer.",0,https://i.redd.it/egaouo8m7i641.jpg,all_ads,6,,,,,,,,,,
[],False,SportsBrahh,,[],,text,t2_av4sr,False,False,[],False,False,1577157488,self.Portland,https://www.reddit.com/r/Portland/comments/eevbmr/to_the_guy_at_liquor_store_who_suggested_i_add/,{},eevbmr,True,False,False,False,True,True,False,,[],dark,text,False,False,True,9,0,False,all_ads,/r/Portland/comments/eevbmr/to_the_guy_at_liquor_store_who_suggested_i_add/,False,6,1577157489,1,"Kurt! Odd I even remember that. Thank you for forever changing my hot toddy game. I lost my voice that night we met (yelling at my verbally abusive ex, not-so-funny enough) and have been healing all weekend. It’s been a strange lesson not being able to speak so easily. Anyway, you sparked my interest when you mentioned something in passing and if you remember and wanna chat feel free to dm me and tell me what that was. Or some other identifying factor haha. Is this a good craigslist missed connection?

If this is anyway against the rules sorry I tried to read them but I’m way too stoned watching Bad Santa to get through them all...........",True,False,[],False,Portland,t5_2qi2i,142626,public,self,To the guy at Liquor Store who suggested I add cayenne pepper to my hot toddy,0,https://www.reddit.com/r/Portland/comments/eevbmr/to_the_guy_at_liquor_store_who_suggested_i_add/,all_ads,6,,,,,,,,,,
[],False,Belmont_goatse,,[],,text,t2_1gxdvl93,False,False,[],False,False,1577156809,self.Portland,https://www.reddit.com/r/Portland/comments/eev6s6/19363610_here_is_a_big_problem_with_the_crime_in/,{},eev6s6,True,False,False,False,True,True,False,,[],dark,text,False,False,True,121,0,False,all_ads,/r/Portland/comments/eev6s6/19363610_here_is_a_big_problem_with_the_crime_in/,False,6,1577156809,1,"I am going to share a situation here that occured today in Brentwood-Darlington and Woodstock. A known felon had stolen gas from a business owner and when confronted about the theft pulled a gun on the business owner and fled. This was all caught on camera. The suspect was sighted by the business owner at the 82nd/Flavel 7-11. The suspect got wise and fled. The owner called 911 and followed the suspect (dangerous... I DO NOT RECOMMEND THIS) to make sure he didn't get away entirely. The suspect headed through Brentwood-Darlington and two female companions bailed out of the vehicle. The suspect then attempted to ram the business owner several times before the police made contact. The owner followed him all the way to Woodstock/52nd and the PPB intercepted the suspect and apprehended him at Safeway. This is where things get fucked.

Upon arrest it is discovered that the suspect was just released from jail yesterday. In spite of the business owner having a credible account of events, and actual footage.... this suspect is being released in 4 hours. Why? The county doesn't believe he's a threat. His record is full of violent crime, and evidence of current crimes exist. 

While we rail at the city... the true culprits for our slide into rampant criminality are Deb Kafoury, Rod Underhill, and the entire county commission. Unless you bleed do not expect consequences for any criminal perpetrator. We are fucked. 

P.S.- I have links to his Multnomah County criminal record if you don't believe me... I just didn't want to get in trouble for doxxing since this sub is very sympathetic to criminals.",True,False,[],False,Portland,t5_2qi2i,142626,public,self,19-363610 Here is a BIG problem with the crime in Portland.,0,https://www.reddit.com/r/Portland/comments/eev6s6/19363610_here_is_a_big_problem_with_the_crime_in/,all_ads,6,,,,,,,,,,
