all_awardings,allow_live_comments,author,author_flair_css_class,author_flair_richtext,author_flair_text,author_flair_type,author_fullname,author_patreon_flair,author_premium,awarders,can_mod_post,contest_mode,created_utc,domain,full_link,gildings,id,is_crosspostable,is_meta,is_original_content,is_reddit_media_domain,is_robot_indexable,is_self,is_video,link_flair_background_color,link_flair_richtext,link_flair_text_color,link_flair_type,locked,media_only,no_follow,num_comments,num_crossposts,over_18,parent_whitelist_status,permalink,pinned,pwls,retrieved_on,score,selftext,send_replies,spoiler,steward_reports,stickied,subreddit,subreddit_id,subreddit_subscribers,subreddit_type,thumbnail,title,total_awards_received,url,whitelist_status,wls,author_flair_background_color,author_flair_text_color,link_flair_css_class,link_flair_text,post_hint,preview,thumbnail_height,thumbnail_width,removed_by_category,author_flair_template_id
[],False,CrazyAF863,,[],,text,t2_4o5wk6bk,False,False,[],False,False,1577299823,self.Portland,https://www.reddit.com/r/Portland/comments/efk5fm/how_are_portland_people_celebrating_christmas/,{},efk5fm,True,False,False,False,True,True,False,,[],dark,text,False,False,True,33,0,False,all_ads,/r/Portland/comments/efk5fm/how_are_portland_people_celebrating_christmas/,False,6,1577299825,1,Wish you all Merry Christmas !! I hope santa gave you nice presents . How are you all celebrating with friends and family ?,True,False,[],False,Portland,t5_2qi2i,142678,public,self,How are Portland people celebrating Christmas ?,0,https://www.reddit.com/r/Portland/comments/efk5fm/how_are_portland_people_celebrating_christmas/,all_ads,6,,,,,,,,,,
[],False,kellanium,,[],dickbutt,text,t2_5koaw,False,False,[],False,False,1577298395,self.Portland,https://www.reddit.com/r/Portland/comments/efjuvw/so_we_fucked_up_our_stash_any_dispensaries_open/,{},efjuvw,True,False,False,False,True,True,False,,[],dark,text,False,False,True,11,0,False,all_ads,/r/Portland/comments/efjuvw/so_we_fucked_up_our_stash_any_dispensaries_open/,False,6,1577298396,1,,True,False,[],False,Portland,t5_2qi2i,142677,public,self,So we fucked up our stash. Any dispensaries open on Christmas?,0,https://www.reddit.com/r/Portland/comments/efjuvw/so_we_fucked_up_our_stash_any_dispensaries_open/,all_ads,6,,dark,,,,,,,,b3283754-e038-11e7-a873-0e0bf97c88d8
[],False,saunders096,,[],,text,t2_1430xr,False,False,[],False,False,1577296292,self.Portland,https://www.reddit.com/r/Portland/comments/efjfc9/complete_list_of_establishments_open_of_christmas/,{},efjfc9,True,False,False,False,True,True,False,,[],dark,text,False,False,True,30,0,False,all_ads,/r/Portland/comments/efjfc9/complete_list_of_establishments_open_of_christmas/,False,6,1577296294,1,Oh... I mean... I don’t personally have a complete list... perhaps folks could list places?,True,False,[],False,Portland,t5_2qi2i,142676,public,self,Complete List of Establishments Open of Christmas in Portland,0,https://www.reddit.com/r/Portland/comments/efjfc9/complete_list_of_establishments_open_of_christmas/,all_ads,6,,,,,,,,,,
[],False,coastiefish,,[],,text,t2_4agoa,False,False,[],False,False,1577292896,imgur.com,https://www.reddit.com/r/Portland/comments/efipzv/merry_fucken_xmas_rportland/,{},efipzv,True,False,False,False,True,False,False,,[],dark,text,False,False,True,56,0,False,all_ads,/r/Portland/comments/efipzv/merry_fucken_xmas_rportland/,False,6,1577292898,1,,True,False,[],False,Portland,t5_2qi2i,142675,public,default,Merry Fucken Xmas r/Portland!,0,https://imgur.com/5jyFo9B,all_ads,6,,,photo,Photo,,,,,,
[],False,DumpsterfireDonny,,[],,text,t2_4o85t7gl,False,False,[],False,False,1577288610,self.Portland,https://www.reddit.com/r/Portland/comments/efhvfh/merry_xmas_portland/,{},efhvfh,True,False,False,False,True,True,False,,[],dark,text,False,False,True,2,0,False,all_ads,/r/Portland/comments/efhvfh/merry_xmas_portland/,False,6,1577288616,1,"🎄Wishing all you assholes a Merry Xmas. 🎄

&lt;3 Dumpster &lt;3",True,False,[],False,Portland,t5_2qi2i,142677,public,self,Merry Xmas Portland,0,https://www.reddit.com/r/Portland/comments/efhvfh/merry_xmas_portland/,all_ads,6,,,,,,,,,,
[],False,Things_Make_Me_Sad,,[],Mill Ends Park,text,t2_4v8545z4,False,False,[],False,False,1577288503,self.Portland,https://www.reddit.com/r/Portland/comments/efhuo7/merry_christmas_portland_megathread_resources/,{},efhuo7,True,False,False,False,True,True,False,,[],dark,text,False,False,True,15,0,False,all_ads,/r/Portland/comments/efhuo7/merry_christmas_portland_megathread_resources/,False,6,1577288504,1,"Happy holidays, everybody!  Whether or not you celebrate Christmas traditionally, the day itself has become something of an American custom.  It is a day not unlike Thanksgiving, where we gather with friends, family and loved ones to reflect on the past year, the coming year and our love for one another.

I am very lucky.  I live in a beautiful home, I have all the food I could ever want, I have health insurance, a care network, and live in one of the most beautiful places one could ask to live.  I feel very blessed today.

I know that the traditional meaning of Christmas is a religious one, but as I am not a religious person and the meaning of the holidays has slightly shifted over the years, I am curious as to how my fellow Portland reddit denizens are celebrating today.  

To anyone who feels alone today, you are not.  There are at least three large hot meals going on.

[There is the Community Christmas Dinner at Temple Beth Israel from 12 to 2.](https://www.google.com/search?source=hp&amp;ei=oIEDXvrUE8PA0PEPo_-8qAw&amp;q=free+christmas+dinner+portland&amp;oq=free+christmas+dinner+portland&amp;gs_l=psy-ab.3..0.137.3404..3693...0.0..0.646.4193.13j3j1j1j1j3......0....1..gws-wiz.......0i131j0i3j0i22i30.cHD0utViNwc&amp;uact=5&amp;ibp=htl;events&amp;rciv=evn&amp;sa=X&amp;ved=2ahUKEwiU1sSIkNHmAhWQop4KHXrYBmcQ5bwDMAB6BAgNEAE#fpstate=tldetail&amp;htidocid=EgY4DMOjCyEqeFrCJpA8-A%3D%3D&amp;htivrt=events)

[There is also the Christmas Day Orphan Dinner at Bar Maven at 5 PM.](https://www.google.com/search?source=hp&amp;ei=oIEDXvrUE8PA0PEPo_-8qAw&amp;q=free+christmas+dinner+portland&amp;oq=free+christmas+dinner+portland&amp;gs_l=psy-ab.3..0.137.3404..3693...0.0..0.646.4193.13j3j1j1j1j3......0....1..gws-wiz.......0i131j0i3j0i22i30.cHD0utViNwc&amp;uact=5&amp;ibp=htl;events&amp;rciv=evn&amp;sa=X&amp;ved=2ahUKEwiU1sSIkNHmAhWQop4KHXrYBmcQ5bwDMAF6BAgLEAE#fpstate=tldetail&amp;htidocid=UZOtweNOYxsrL25-JpA8-A%3D%3D&amp;htivrt=events)

[Finally, Potluck In The Park is doing a Christmas Dinner from noon to 3 pm.](https://www.potluckinthepark.org/events/annual-free-christmas-dinner/)

[Here is a list of where to find warming shelters if it gets too cold on Christmas.](https://multco.us/winter-weather/warming-shelters-and-homelessness)

Happy holidays, everyone.  I love this city and I hope you all have a Merry Christmas, whether or not you celebrate the religious aspects of it.  I hope you all feel safe, loved and part of a community today.

I hope if you are hunry",True,False,[],False,Portland,t5_2qi2i,142677,public,self,MERRY CHRISTMAS PORTLAND MEGATHREAD! RESOURCES INSIDE FOR THOSE IN NEED TODAY!,0,https://www.reddit.com/r/Portland/comments/efhuo7/merry_christmas_portland_megathread_resources/,all_ads,6,,dark,,,,,,,,34fe0d36-ddf5-11e6-bd98-0ea5f6761f56
[],False,ThePortlandStrangler,,[],,text,t2_4v00kge2,False,False,[],False,False,1577287141,/r/Portland/comments/efhli5/pretty_accurate/,https://www.reddit.com/r/Portland/comments/efhli5/pretty_accurate/,{},efhli5,True,False,False,False,True,False,True,,[],dark,text,False,False,True,8,0,False,all_ads,/r/Portland/comments/efhli5/pretty_accurate/,False,6,1577287142,1,,True,False,[],False,Portland,t5_2qi2i,142677,public,default,Pretty accurate.,0,https://v.redd.it/s4lnlc4yqs641,all_ads,6,,,,,,,,,,
[],False,AutoModerator,,[],🌅,text,t2_6l4z3,False,True,[],False,False,1577282875,self.Portland,https://www.reddit.com/r/Portland/comments/efguoh/rportland_weekly_casual_conversation_december_25/,{},efguoh,True,False,False,False,True,True,False,,[],dark,text,False,False,True,44,0,False,all_ads,/r/Portland/comments/efguoh/rportland_weekly_casual_conversation_december_25/,False,6,1577282876,1,This is our weekly casual conversation thread where no topic is off-topic. Got something to say and you can't wait until the rant or rave? Got a great picture you want to share? Watch/read/play something good? Let's talk about it here!,False,False,[],False,Portland,t5_2qi2i,142677,public,self,"/r/Portland weekly casual conversation December 25, 2019",0,https://www.reddit.com/r/Portland/comments/efguoh/rportland_weekly_casual_conversation_december_25/,all_ads,6,,dark,,,,,,,,
[],False,speer360,,[],,text,t2_hmf3a,False,False,[],False,False,1577281072,wweek.com,https://www.reddit.com/r/Portland/comments/efgkca/portland_police_have_stopped_transporting/,{},efgkca,True,False,False,False,True,False,False,,[],dark,text,False,False,True,13,0,False,all_ads,/r/Portland/comments/efgkca/portland_police_have_stopped_transporting/,False,6,1577281073,1,,True,False,[],False,Portland,t5_2qi2i,142676,public,default,Portland Police Have Stopped Transporting Intoxicated People to Longtime Sobering Center—Effective Immediately,0,https://www.wweek.com/news/city/2019/12/24/portland-police-have-stopped-transporting-intoxicated-people-to-longtime-sobering-center-effective-immediately/,all_ads,6,,,,,,,,,,
[],False,corpsesandstones,,[],,text,t2_4y1t42jc,False,False,[],False,False,1577261424,i.redd.it,https://www.reddit.com/r/Portland/comments/efdygt/portland/,{},efdygt,True,False,False,True,True,False,False,,[],dark,text,False,False,True,4,0,False,all_ads,/r/Portland/comments/efdygt/portland/,False,6,1577261425,1,,True,False,[],False,Portland,t5_2qi2i,142675,public,default,💕Portland 💕,0,https://i.redd.it/dcnc25phmq641.jpg,all_ads,6,,,,,,,,,,
[],False,ToeJammies,,[],,text,t2_3yi8wt4j,False,False,[],False,False,1577258978,i.redd.it,https://www.reddit.com/r/Portland/comments/efdmla/send_them_all_back_to_kansas/,{},efdmla,True,False,False,True,True,False,False,,[],dark,text,False,False,True,15,0,False,all_ads,/r/Portland/comments/efdmla/send_them_all_back_to_kansas/,False,6,1577258980,1,,True,False,[],False,Portland,t5_2qi2i,142674,public,default,Send them all back to Kansas,0,https://i.redd.it/vynz6lm7fq641.png,all_ads,6,,,photo,Photo,,,,,,
[],False,corylew,,[],,text,t2_68fcm,False,False,[],False,False,1577258379,self.Portland,https://www.reddit.com/r/Portland/comments/efdjog/a_moment_of_silence_to_honor_those_still_stuck_in/,{},efdjog,True,False,False,False,True,True,False,,[],dark,text,False,False,True,46,0,False,all_ads,/r/Portland/comments/efdjog/a_moment_of_silence_to_honor_those_still_stuck_in/,False,6,1577258380,1,"Authorities are still trying to get supplies to those who are standing in line. Sources say somewhere around the Star Wars house was a couple that tried getting a selfie, causing the entire debacle. No word yet on the number of survivors. 

Thoughts and prayers to their loved ones.",False,False,[],False,Portland,t5_2qi2i,142674,public,self,A moment of silence to honor those still stuck in line at Peacock Lane.,0,https://www.reddit.com/r/Portland/comments/efdjog/a_moment_of_silence_to_honor_those_still_stuck_in/,all_ads,6,,,,,,,,,,
[],False,kenistod,,[],Cedar Mill,text,t2_yd3qv,False,False,[],False,False,1577254733,i.redd.it,https://www.reddit.com/r/Portland/comments/efd0ve/hiked_ridge_trail_in_forest_park_this_afternoon/,{},efd0ve,True,False,False,True,True,False,False,,[],dark,text,False,False,True,24,0,False,all_ads,/r/Portland/comments/efd0ve/hiked_ridge_trail_in_forest_park_this_afternoon/,False,6,1577254734,1,,True,False,[],False,Portland,t5_2qi2i,142673,public,default,Hiked Ridge Trail in Forest Park this afternoon and caught this view of the St. Johns Bridge.,0,https://i.redd.it/508fjgug2q641.jpg,all_ads,6,,dark,photo,Photo,,,,,,c057cfb2-b3f1-11e1-a49a-12313b0c247a
[],False,aleceiffel_,,[],,text,t2_7864w2d,False,False,[],False,False,1577253602,self.Portland,https://www.reddit.com/r/Portland/comments/efcui8/recommendations_on_a_good_volvo_mechanic/,{},efcui8,True,False,False,False,True,True,False,,[],dark,text,False,False,True,7,0,False,all_ads,/r/Portland/comments/efcui8/recommendations_on_a_good_volvo_mechanic/,False,6,1577253603,1,"I have a 1982 244 GL Diesel that needs some minor work and was wondering if any of you folks knew of a skilled mechanic in the way of older Volvos.

Any help is appreciated.",True,False,[],False,Portland,t5_2qi2i,142672,public,self,Recommendations on a good Volvo mechanic,0,https://www.reddit.com/r/Portland/comments/efcui8/recommendations_on_a_good_volvo_mechanic/,all_ads,6,,,,,,,,,,
[],False,reprojection,,[],,text,t2_eh4meor,False,False,[],False,False,1577251898,self.Portland,https://www.reddit.com/r/Portland/comments/efcl27/looking_for_a_42_game/,{},efcl27,True,False,False,False,True,True,False,,[],dark,text,False,False,True,4,0,False,all_ads,/r/Portland/comments/efcl27/looking_for_a_42_game/,False,6,1577251899,1,"Moved from Texas 13 years ago, the only thing I miss besides decent tex-mex is the national game of Texas, 42. Looking for a game to join or people who want to play. I'm good with either people who already know how to play or people who want to learn. Anything out there?",True,False,[],False,Portland,t5_2qi2i,142670,public,self,Looking for a 42 game,0,https://www.reddit.com/r/Portland/comments/efcl27/looking_for_a_42_game/,all_ads,6,,,,,,,,,,
[],False,BridgeCityBus,,[],Tilikum Crossing,text,t2_3yx0xraz,False,True,[],False,False,1577251150,self.Portland,https://www.reddit.com/r/Portland/comments/efcgtj/happy_christmas_to_all_yall_wonderful_fucking/,{},efcgtj,True,False,False,False,True,True,False,,[],dark,text,False,False,True,22,0,False,all_ads,/r/Portland/comments/efcgtj/happy_christmas_to_all_yall_wonderful_fucking/,False,6,1577251151,1,"Tonight is the most magical night of all. Santa setting out to deliver gifts to every child all over the world, parents tirelessly working to wrap presents and hoping they don’t run out of scotch tape, and childless folks, like me (and maybe you), drinking themselves silly and making new friends all over town in the few bars that are still open. 

This entire week has been a LOVE FEST on the bus!!  Everyone has been in a fantastic mood. This city is full of beautiful folks, like you and me. We make this city what it is. 

Today marks my one year anniversary of driving on my own after training. The feeling I have behind the wheel is so, so different. My shoulders are relaxed and my smile isn’t faked—not faked like “I don’t like you,” but faked like “I’m trying not to kill all of us while I drive this bus on my own.”  I didn’t see Santa get arrested tonight, so that’s a plus (or maybe a minus?).

Be safe out there, folks!  One bonus of working for TriMet is my free bus pass. So, in a way, TriMet subsidizes my drinking shenanigans on my Fridays, and drops me off almost at my doorstep. How fucking cool is that?  Yay for public transit!


Merry Christmas, y’all!!

P.S. if you’re looking for a “Yamhill Pub” a little to the South and a little to the East, The Coney Island in OC is the place to witness some of the craziest drinkers in the state, just sayin’.",True,False,[],False,Portland,t5_2qi2i,142668,public,self,Happy Christmas to all y’all wonderful fucking people!!,0,https://www.reddit.com/r/Portland/comments/efcgtj/happy_christmas_to_all_yall_wonderful_fucking/,all_ads,6,,dark,,,,,,,,dadf92e8-4942-11e7-9eb1-0e40e3d28306
[],False,speer360,,[],,text,t2_hmf3a,False,False,[],False,False,1577250466,oregonlive.com,https://www.reddit.com/r/Portland/comments/efccqs/trimet_bus_kills_pedestrian_speeding_mercedes/,{},efccqs,True,False,False,False,True,False,False,,[],dark,text,False,False,True,21,0,False,all_ads,/r/Portland/comments/efccqs/trimet_bus_kills_pedestrian_speeding_mercedes/,False,6,1577250468,1,,True,False,[],False,Portland,t5_2qi2i,142668,public,default,"TriMet bus kills pedestrian, speeding Mercedes flips along Gresham thoroughfare, police say",0,https://www.oregonlive.com/news/2019/12/tri-met-bus-kills-pedestrian-speeding-mercedes-flips-along-gresham-thoroughfare-police-say.html,all_ads,6,,,local-news,Local News,,,,,,
[],False,ScoobyDoo27,,[],,text,t2_7v2r3,False,True,[],False,False,1577249586,i.imgur.com,https://www.reddit.com/r/Portland/comments/efc7f0/long_shot_but_im_looking_for_a_piece_to_an/,{},efc7f0,True,False,False,False,True,False,False,,[],dark,text,False,False,True,6,0,False,all_ads,/r/Portland/comments/efc7f0/long_shot_but_im_looking_for_a_piece_to_an/,False,6,1577249587,1,,True,False,[],False,Portland,t5_2qi2i,142668,public,default,Long shot but I’m looking for a piece to an insulin pump,0,https://i.imgur.com/WhZ6UcG.png,all_ads,6,,,,,,,,,,
[],False,HoldingontoPhun,,[],,text,t2_149s22,False,False,[],False,False,1577248190,self.Portland,https://www.reddit.com/r/Portland/comments/efbz3a/best_place_to_buy_usedhomemade_products/,{},efbz3a,True,False,False,False,True,True,False,,[],dark,text,False,False,True,3,0,False,all_ads,/r/Portland/comments/efbz3a/best_place_to_buy_usedhomemade_products/,False,6,1577248191,1,Reason I'm asking in the Portland subreddit is because of local apps like Offer Up or Let Go. Mostly looking at clothes and electronics/games. I haven't used eBay in years and that time I was ripped off. Thanks.,True,False,[],False,Portland,t5_2qi2i,142667,public,self,Best place to buy used/homemade products?,0,https://www.reddit.com/r/Portland/comments/efbz3a/best_place_to_buy_usedhomemade_products/,all_ads,6,,,,,,,,,,
[],False,schwelvis,,[],NE,text,t2_38sma,False,False,[],False,False,1577246323,i.redd.it,https://www.reddit.com/r/Portland/comments/efbnuv/zoo_train/,{},efbnuv,True,False,False,True,True,False,False,,[],dark,text,False,False,True,7,0,False,all_ads,/r/Portland/comments/efbnuv/zoo_train/,False,6,1577246323,1,,True,False,[],False,Portland,t5_2qi2i,142668,public,default,Zoo train,0,https://i.redd.it/ow6tem4jdp641.jpg,all_ads,6,,dark,,,,,,,,
[],False,invokez,,[],,text,t2_5wqu9,False,True,[],False,False,1577244179,self.Portland,https://www.reddit.com/r/Portland/comments/efbakt/liquor_store_still_open/,{},efbakt,True,False,False,False,True,True,False,,[],dark,text,False,False,True,9,0,False,all_ads,/r/Portland/comments/efbakt/liquor_store_still_open/,False,6,1577244180,1,Any liquor stores still open on Christmas Eve? We may have under estimated our liquor needs,True,False,[],False,Portland,t5_2qi2i,142667,public,self,Liquor store still open?,0,https://www.reddit.com/r/Portland/comments/efbakt/liquor_store_still_open/,all_ads,6,,,,,,,,,,
[],False,Things_Make_Me_Sad,,[],Mill Ends Park,text,t2_4v8545z4,False,False,[],False,False,1577242503,portlandlivingonthecheap.com,https://www.reddit.com/r/Portland/comments/efb0ce/all_sizzle_pie_locations_in_portland_are_offering/,{},efb0ce,True,False,False,False,True,False,False,,[],dark,text,False,False,True,30,0,False,all_ads,/r/Portland/comments/efb0ce/all_sizzle_pie_locations_in_portland_are_offering/,False,6,1577242504,1,,True,False,[],False,Portland,t5_2qi2i,142666,public,default,"All Sizzle Pie Locations In Portland Are Offering Buy A Large Pizza, Get One Free On Christmas Day!",0,https://portlandlivingonthecheap.com/sizzle-pie-christmas-day/,all_ads,6,,dark,,,,,,,,34fe0d36-ddf5-11e6-bd98-0ea5f6761f56
[],False,Aestro17,,[],SE,text,t2_atfhy,False,False,[],False,False,1577241667,self.Portland,https://www.reddit.com/r/Portland/comments/efavdr/psa_turn_on_your_nose/,{},efavdr,True,False,False,False,True,True,False,,[],dark,text,False,False,True,30,0,False,all_ads,/r/Portland/comments/efavdr/psa_turn_on_your_nose/,False,6,1577241668,1,OKAY I WAS FLYING THROUGH NOPO WHEN SOME ASSHOLE IN A SLED NEARLY RUNS INTO ME WITH A BUNCH OF DAMNED ELK!  IT'S FUCKING DARK OUT!  TURN ON YOUR NOSE!,False,False,[],False,Portland,t5_2qi2i,142666,public,self,PSA: TURN ON YOUR NOSE,0,https://www.reddit.com/r/Portland/comments/efavdr/psa_turn_on_your_nose/,all_ads,6,,dark,,,,,,,,065fa756-4254-11e1-92dd-12313d096aae
[],False,sharksinthepool,,[],,text,t2_lta1b,False,False,[],False,False,1577241064,self.Portland,https://www.reddit.com/r/Portland/comments/efarr8/ski_lessons_with_transportation_included/,{},efarr8,True,False,False,False,True,True,False,,[],dark,text,False,False,True,10,0,False,all_ads,/r/Portland/comments/efarr8/ski_lessons_with_transportation_included/,False,6,1577241065,1,"Hi! 

I would love to learn to ski this year, but I don’t think my car would do well in snowy weather. I’d like to find some kind of group/organization/company that provides transportation from Portland to a ski location, where I could take lessons for the day, then head back. 

I have researched shuttle companies that could take me to Mt. Hood, where I could rent gear and get a lift ticket, but I wonder if there is something that is more a one-stop shop where I could just pay one fee for everything.

Thanks for any insight!",True,False,[],False,Portland,t5_2qi2i,142668,public,self,Ski lessons with transportation included?,0,https://www.reddit.com/r/Portland/comments/efarr8/ski_lessons_with_transportation_included/,all_ads,6,,,,,,,,,,
[],False,shantired,,[],,text,t2_1ft7hxd8,False,False,[],False,False,1577240783,i.redd.it,https://www.reddit.com/r/Portland/comments/efaq0p/why_did_this_post_on_nextdoor_disappear_does/,{},efaq0p,True,False,False,True,True,False,False,,[],dark,text,False,False,True,6,0,False,all_ads,/r/Portland/comments/efaq0p/why_did_this_post_on_nextdoor_disappear_does/,False,6,1577240783,1,,True,False,[],False,Portland,t5_2qi2i,142668,public,default,Why did this post on Nextdoor disappear? Does anyone have the full OP and subsequent responses?,0,https://i.redd.it/k5ww0n04xo641.jpg,all_ads,6,,,,,,,,,,
[],False,oregoncurtis,,[],,text,t2_fysqr,False,False,[],False,False,1577239346,self.Portland,https://www.reddit.com/r/Portland/comments/efahf7/fibersphere_or_centurylink/,{},efahf7,True,False,False,False,True,True,False,,[],dark,text,False,False,True,16,0,False,all_ads,/r/Portland/comments/efahf7/fibersphere_or_centurylink/,False,6,1577239347,1,"Moving to a new apartment which is already wired for Fibersphere, Centurylink and Comcast. I haven't seen many recent post on Fibersphere so wondering if they are still a good option? I don't need gigabit as I don't game and don't stream 4K. I'm currently on \~20Mbps Comcast and it's OK. I'd like to get up to between 50 and 100 Mbps just to cut out the little bit of lagging I do experience.",True,False,[],False,Portland,t5_2qi2i,142666,public,self,Fibersphere or CenturyLink,0,https://www.reddit.com/r/Portland/comments/efahf7/fibersphere_or_centurylink/,all_ads,6,,,,,,,,,,
[],False,TRWickord96,,[],,text,t2_v7ewn,False,False,[],False,False,1577234416,self.Portland,https://www.reddit.com/r/Portland/comments/ef9lwk/best_neighborhoods_to_look_at_lights/,{},ef9lwk,True,False,False,False,True,True,False,,[],dark,text,False,False,True,4,0,False,all_ads,/r/Portland/comments/ef9lwk/best_neighborhoods_to_look_at_lights/,False,6,1577234418,1,"I’m in town for the holidays, and want to go see lights tonight. What are some great neighborhoods (I’ve done Peacock Lane) that put on a great show?",True,False,[],False,Portland,t5_2qi2i,142661,public,self,Best neighborhoods to look at lights?,0,https://www.reddit.com/r/Portland/comments/ef9lwk/best_neighborhoods_to_look_at_lights/,all_ads,6,,,,,,,,,,
[],False,lantzlayton,,[],Lloyd District,text,t2_8tri7,False,False,[],False,False,1577234279,self.Portland,https://www.reddit.com/r/Portland/comments/ef9l2r/any_fun_stuff_happening_on_christmas_eve/,{},ef9l2r,True,False,False,False,True,True,False,,[],dark,text,False,False,True,0,0,False,all_ads,/r/Portland/comments/ef9l2r/any_fun_stuff_happening_on_christmas_eve/,False,6,1577234280,1,"Gonna get dinner and bop around, anyone know of any bars/breweries doing anything special for the loners far from home this holiday?",True,False,[],False,Portland,t5_2qi2i,142660,public,self,Any fun stuff happening on Christmas Eve?,0,https://www.reddit.com/r/Portland/comments/ef9l2r/any_fun_stuff_happening_on_christmas_eve/,all_ads,6,,dark,,,,,,,,89b16de2-4ae1-11e2-8a0b-12313d28169d
[],False,psychognosis,,[],Glenfair,text,t2_6zsjl,False,False,[],False,False,1577232973,i.imgur.com,https://www.reddit.com/r/Portland/comments/ef9cf0/free_trees_abandoned_lot_on_se_stark_and_146th_ave/,{},ef9cf0,True,False,False,False,True,False,False,,[],dark,text,False,False,True,14,0,False,all_ads,/r/Portland/comments/ef9cf0/free_trees_abandoned_lot_on_se_stark_and_146th_ave/,False,6,1577232974,1,,True,False,[],False,Portland,t5_2qi2i,142661,public,default,Free trees! Abandoned lot on SE Stark and 146th Ave.,0,https://i.imgur.com/zKjqVKA.jpg,all_ads,6,,dark,,,,,,,,
[],False,MusicOfBeeFef,,[],,text,t2_11yr4i,False,False,[],False,False,1577231595,self.Portland,https://www.reddit.com/r/Portland/comments/ef92wx/any_meetup_groups_inaround_beaverton_for/,{},ef92wx,True,False,False,False,True,True,False,,[],dark,text,False,False,True,1,0,False,all_ads,/r/Portland/comments/ef92wx/any_meetup_groups_inaround_beaverton_for/,False,6,1577231596,1,I looked on meetup.com and i didn't find a lot. The ones I did find didn't have any upcoming events that were very soon as far as I noticed,True,False,[],False,Portland,t5_2qi2i,142660,public,self,any meetup groups in/around Beaverton for electronic music production?,0,https://www.reddit.com/r/Portland/comments/ef92wx/any_meetup_groups_inaround_beaverton_for/,all_ads,6,,,meetup,Meetups,,,,,,
