author,author_created_utc,author_flair_css_class,author_flair_text,author_fullname,created_utc,domain,edited,full_link,gilded,id,is_self,link_flair_css_class,link_flair_text,locked,media_embed,num_comments,over_18,permalink,retrieved_on,score,secure_media_embed,selftext,stickied,subreddit,subreddit_id,thumbnail,title,url,post_hint,preview,media,secure_media,distinguished
OLeoLeahy,1301617818.0,,Grant Park,t2_51i07,1466553662,pps.net,,https://www.reddit.com/r/Portland/comments/4p7sry/carole_smith_announces_her_retirement_june_2017/,0,4p7sry,False,local-news,Local News,False,{},1,False,/r/Portland/comments/4p7sry/carole_smith_announces_her_retirement_june_2017/,1472799203,0,{},,False,Portland,t5_2qi2i,default,"Carole Smith announces her retirement, June, 2017",http://www.pps.net/site/default.aspx?PageType=14&amp;DomainID=4&amp;ModuleInstanceID=1692&amp;PageModuleInstanceID=1809&amp;ViewID=f1e6a90c-52e5-4c22-bd75-b7d8541b443f&amp;RenderLoc=0&amp;FlexDataID=32706&amp;PageID=1,,,,,
[deleted],,,,,1466553579,pps.net,,https://www.reddit.com/r/Portland/comments/4p7sjj/carole_smith_announces_her_retirement_june_2017/,0,4p7sjj,False,,,False,{},0,False,/r/Portland/comments/4p7sjj/carole_smith_announces_her_retirement_june_2017/,1472799200,1,{},[deleted],False,Portland,t5_2qi2i,default,"Carole Smith announces her retirement, June, 2017",http://www.pps.net/site/default.aspx?PageType=14&amp;DomainID=4&amp;ModuleInstanceID=1692&amp;PageModuleInstanceID=1809&amp;ViewID=f1e6a90c-52e5-4c22-bd75-b7d8541b443f&amp;RenderLoc=0&amp;FlexDataID=32706&amp;PageID=1,,,,,
PrismSechs,1390497812.0,,,t2_ey0x2,1466553470,self.Portland,,https://www.reddit.com/r/Portland/comments/4p7s9x/pps_carole_smith_resigns_letter_in_post/,0,4p7s9x,True,local-news,Local News,False,{},11,False,/r/Portland/comments/4p7s9x/pps_carole_smith_resigns_letter_in_post/,1472799195,38,{},"With excuses for poisoning children... No surprise. Adios.

LETTER FROM THE SUPERINTENDENT

June 21, 2016

 

Dear Portland students, parents, teachers, administrators, central office staff, Board members, community partners and volunteers, and members of the community:

 

Over my time as superintendent, I am proud to have worked alongside you and with seventeen different board members to make Portland Public Schools the best we can during a period of extreme financial volatility. 

 

By prioritizing, and often times making difficult decisions about budgets, staffing and programs, we not only helped create stability for our students but we paved paths to unprecedented progress in building a district that truly serves every one of our students:

 

Our graduation rate has increased 21 percentage points in the last 7 years.
The Jefferson High School Middle College for Advanced Studies, in partnership with Portland Community College and Self Enhancement Inc., supported students to increase the graduation rate from 55% in 2011, the first year of the program, to 80% in 2015.
We passed a $482M construction bond, have completed seismic, roofing and accessibility upgrades on 45 schools, and are scheduled to complete work on 7 more schools this summer.
Construction on two high school modernization projects is now well underway and master planning for the third has been completed, representing the first phase of district-wide modernization plans for all our schools.
We have launched a unique partnership with Faubion K8 and Concordia University, 3 to PhD, that will house Faubion K8 school and Concordiaâ€™s School of Education, along with an early childhood center and health clinic.
We have re-established the Portland Interscholastic League, to strengthen athletic programming and target investments to ensure we begin restoring middle school athletic programs.
We have worked with numerous partners to renovate and turf our 10 high school tracks and fields, providing quality places for sport and community building.
We are bringing arts programming and access back to our students in partnership with the City and others (including Right Brain Initiative, BRAVO, White Bird, Oregon Symphony) - as well as the voters that passed the Arts Tax.
We are steadily building new Career Technical Education capacity, increasing from 19 to more than 50 programs in the last two years.
More students are earning college credit while in high school through Advanced Placement, International Baccalaureate and Dual Credit programs.
Voters have passed multiple local option levies to help put an additional 600 teachers in our classrooms to support our students and their success.
Most importantly to me, we have placed equity firmly at the center of our work. In partnership with our community, our board passed a Racial Educational Equity Policy that has been held up as a model locally and nationally, and that has served as the foundation to align other important policies, including our enrollment and transfer policy, boundary review process and budgeting process, Affirmative Action Policy, and Equity in Public Purchasing and Contracting Policy. The focus on equity continues to deepen and drive every aspect of our work as we strive to be a school district that truly supports every one of our students in reaching their full potential.
 

These successes were not without tough decisions that the act of prioritizing requires.  And they were not the success of one person or board alone - but those of a collective commitment by individuals, organizations and citizens who want to see only the best outcome and opportunities for our students.

 

These choices, given the last 20 years of state budget constraints for schools, meant some priorities took precedence over others.  At PPS the focus of the community, board and district has been on maintaining teachers in our classrooms and providing a full school year to our students, which not every district has been able to accomplish.

 

Unfortunately, the unintended consequence of these successes for our students has meant a corresponding under-investment in facilities maintenance and business infrastructure.

 

In 2012 we successfully presented the public with a plan to modernize our schools and facilities. The bond has allowed us to methodically work to replace roofs, make seismic upgrades and improve accessibility in buildings across the system, as we embark on the longer-term effort of modernizing every building in the district.

 

Now it is time to turn our attention to and make other infrastructure improvements a priority - and I believe that health and safety investments should be at the top of the list for the next bond.

 

In the short term, we are making water quality a priority:

 

We will contract with a third party service to provide drinking water for the next school year to ensure every school has access to clean water for the    
    2016-17 year.

Water testing is now underway on an accelerated timetable so we know the details          necessary to adequately address the quality of water delivery in all of our buildings.
Tonight the board will vote on a contract with CH2M Hill to do a first phase of an assessment for a plan to address water quality once the water results are available to provide a roadmap on what we need to do to fix, remediate or renovate our water delivery systems.
We are also working to identify an Environmental and Public Health Director to oversee assessment and planning for other issues including radon, lead (water and paint), asbestos, mold and other environmental health hazards. 
 

This will continue to be a focus of our work over the coming year and together it is an opportunity to overcome this challenge, as we have so many others. 

 

In the long-term, however, we must make our infrastructure a priority for the total well-being of our students. We have an opportunity before us to continue to accelerate the rebuilding of education in Oregon. PPS has been growing steadily and continues to do so - and we must plan for that growth and the 5,000 additional students we expect over the next decade.  We do this by looking long-term. By making strategic investments in the areas we know support student success and a critical part of that is the health and environmental safety of our students and staff.

 

When I started this job in October of 2007, the average tenure of an urban superintendent was and still is 2.5 years. I knew that in order to make meaningful change, I set my goal at 10 years so that I could fully commit myself to the long-term needs of the district, students and staff.  I am entering my 10th year as superintendent and today I have affirmed for the Board my intention to retire. 

 

The board has asked me to stay through the end of my contract in June, 2017 to allow them to move forward to conduct a superintendent search at the appropriate time and set the district up for a successful and smooth transition of leadership, as well as continue our work on health and safety.

 

The education and success of our students is an effort that takes all of us - so thank you for your daily commitment and partnership on our studentsâ€™ behalf.

 

I have loved being your superintendent. It is an honor and a pleasure to serve our students, families and staff.

 

Carole Smith

Superintendent

Portland Public Schools


",False,Portland,t5_2qi2i,self,PPS Carole Smith resigns - letter in post,https://www.reddit.com/r/Portland/comments/4p7s9x/pps_carole_smith_resigns_letter_in_post/,,,,,
sellwoodman,1450930390.0,,,t2_t7063,1466553272,opb.org,,https://www.reddit.com/r/Portland/comments/4p7rsi/watch_neko_case_kd_lang_and_laura_veirs_perform/,0,4p7rsi,False,local-news,Local News,False,{},6,False,/r/Portland/comments/4p7rsi/watch_neko_case_kd_lang_and_laura_veirs_perform/,1472799189,34,{},,False,Portland,t5_2qi2i,http://b.thumbs.redditmedia.com/YzopEZO97Ygnr8hB2YRWswJp3p651NrXDbFkBNHrRlc.jpg,"Watch Neko Case, k.d. lang And Laura Veirs Perform Their New Album Live in Portland",http://www.opb.org/opbmusic/series/sessions/caselangveirs-neko-case-kd-lang-and-laura-veirs-perform-their-new-album-live-at-opb/,link,"{'images': [{'id': '_9r5OwrKAoEVVgQmhL7zxZPOup7TSKDpDagi3Pa8mi4', 'resolutions': [{'height': 81, 'url': 'https://i.redditmedia.com/vdeMguUzpmTpO2LMAr0SOqUg269ol8IpqREHilhJ-t8.jpg?fit=crop&amp;crop=faces%2Centropy&amp;arh=2&amp;w=108&amp;s=90ce1565562725ed678478f2867d703e', 'width': 108}, {'height': 162, 'url': 'https://i.redditmedia.com/vdeMguUzpmTpO2LMAr0SOqUg269ol8IpqREHilhJ-t8.jpg?fit=crop&amp;crop=faces%2Centropy&amp;arh=2&amp;w=216&amp;s=8a7a615a9448188aa885e3181acacc16', 'width': 216}, {'height': 240, 'url': 'https://i.redditmedia.com/vdeMguUzpmTpO2LMAr0SOqUg269ol8IpqREHilhJ-t8.jpg?fit=crop&amp;crop=faces%2Centropy&amp;arh=2&amp;w=320&amp;s=0d871740a42ebdef198fc29e1cb4cbaa', 'width': 320}], 'source': {'height': 300, 'url': 'https://i.redditmedia.com/vdeMguUzpmTpO2LMAr0SOqUg269ol8IpqREHilhJ-t8.jpg?s=0b1aa6afb4e51772c525fb5d2f748943', 'width': 400}, 'variants': {}}]}",,,
washcoug,1444169444.0,,,t2_qzkn0,1466552174,oec.nonprofitsoapbox.com,,https://www.reddit.com/r/Portland/comments/4p7ot3/fred_meyer_cans_test_positive_for_bpa_oec_bpa_day/,0,4p7ot3,False,event,Events,False,{},14,False,/r/Portland/comments/4p7ot3/fred_meyer_cans_test_positive_for_bpa_oec_bpa_day/,1472799147,4,{},,False,Portland,t5_2qi2i,http://b.thumbs.redditmedia.com/nj9eCKRgfzgHIAWz9OZU8dBjd95dOwg-obUzGUrm_ms.jpg,Fred Meyer Can's Test Positive for BPA: OEC - BPA Day of Action - June 22 Stadium Fred Meyers,http://oec.nonprofitsoapbox.com/fmbpa,link,"{'images': [{'id': 'spmz37tPLnhdXVnaWfD5wzEfURAHEID7k7pHr_B1CJA', 'resolutions': [{'height': 108, 'url': 'https://i.redditmedia.com/a01dE_lQQsvhEWio2B-naS4FJ6XGopETY2GTFGNYSn0.jpg?fit=crop&amp;crop=faces%2Centropy&amp;arh=2&amp;w=108&amp;s=4452bce908852c5b6529a0810a0f159e', 'width': 108}, {'height': 216, 'url': 'https://i.redditmedia.com/a01dE_lQQsvhEWio2B-naS4FJ6XGopETY2GTFGNYSn0.jpg?fit=crop&amp;crop=faces%2Centropy&amp;arh=2&amp;w=216&amp;s=5009d6a5e8647a2afff1b5936504c3c2', 'width': 216}, {'height': 320, 'url': 'https://i.redditmedia.com/a01dE_lQQsvhEWio2B-naS4FJ6XGopETY2GTFGNYSn0.jpg?fit=crop&amp;crop=faces%2Centropy&amp;arh=2&amp;w=320&amp;s=5d00896b755aace4294dade11a357160', 'width': 320}], 'source': {'height': 564, 'url': 'https://i.redditmedia.com/a01dE_lQQsvhEWio2B-naS4FJ6XGopETY2GTFGNYSn0.jpg?s=1d41cce3f768977be30b146382c1a1d2', 'width': 564}, 'variants': {}}]}",,,
gorilladust,1292458479.0,,Woodstock,t2_4mi1b,1466551409,heraldandnews.com,,https://www.reddit.com/r/Portland/comments/4p7mqv/oregon_bottle_deposit_likely_to_double_in_2017/,0,4p7mqv,False,local-news,Local News,False,{},84,False,/r/Portland/comments/4p7mqv/oregon_bottle_deposit_likely_to_double_in_2017/,1472799118,102,{},,False,Portland,t5_2qi2i,http://a.thumbs.redditmedia.com/nPPIIA51yTPV0pEp0F742oOZCU3HivRrvne3-Wlmhn4.jpg,Oregon bottle deposit likely to double in 2017,http://www.heraldandnews.com/news/local_news/oregon-bottle-deposit-likely-to-double-in/article_d9822208-23bc-562c-b263-62a3caacb166.html,link,"{'images': [{'id': 'vzlJIrKa3mb5wI2gqLSHcMWxqhg0vnu-4jiSnItDmv8', 'resolutions': [{'height': 72, 'url': 'https://i.redditmedia.com/rkI4epTz3Jg8ft7k8J5VBKIKqz-mwRZxWjAuPVKOBLs.jpg?fit=crop&amp;crop=faces%2Centropy&amp;arh=2&amp;w=108&amp;s=1bf18ce2a9bc800bf8644cc3f047e258', 'width': 108}, {'height': 144, 'url': 'https://i.redditmedia.com/rkI4epTz3Jg8ft7k8J5VBKIKqz-mwRZxWjAuPVKOBLs.jpg?fit=crop&amp;crop=faces%2Centropy&amp;arh=2&amp;w=216&amp;s=4071434c119f0a517a07738bf1c23b68', 'width': 216}, {'height': 213, 'url': 'https://i.redditmedia.com/rkI4epTz3Jg8ft7k8J5VBKIKqz-mwRZxWjAuPVKOBLs.jpg?fit=crop&amp;crop=faces%2Centropy&amp;arh=2&amp;w=320&amp;s=4684b37445cb30630c233907faabb06b', 'width': 320}, {'height': 426, 'url': 'https://i.redditmedia.com/rkI4epTz3Jg8ft7k8J5VBKIKqz-mwRZxWjAuPVKOBLs.jpg?fit=crop&amp;crop=faces%2Centropy&amp;arh=2&amp;w=640&amp;s=d91a4feb0f1b8cd7bc8de7aba5cec6ff', 'width': 640}], 'source': {'height': 630, 'url': 'https://i.redditmedia.com/rkI4epTz3Jg8ft7k8J5VBKIKqz-mwRZxWjAuPVKOBLs.jpg?s=80474bff89d675c585d153ee49b3e4d3', 'width': 945}, 'variants': {}}]}",,,
PM_ME_SHIMPAN,1459128885.0,,NE,t2_wp5f1,1466550035,self.Portland,1466550235.0,https://www.reddit.com/r/Portland/comments/4p7iqt/nice_bike_rides_in_portland_area/,0,4p7iqt,True,help-me,Help Me,False,{},17,False,/r/Portland/comments/4p7iqt/nice_bike_rides_in_portland_area/,1472799062,4,{},"Hey all, I need a summer activity and recently got my mom's road bike tuned and fitted for myself. I can handle a decent distance, and am looking for some nice long rides (about 20-40 miles) that I can take without driving taking public transportation.

It's a road bike, so no trails or anything, but I'd appreciate any suggestions!

EDIT: I forgot to mention, but I'd prefer trails that remain mostly out of the way of busy roads/dense intersections.",False,Portland,t5_2qi2i,self,Nice bike rides in Portland Area?,https://www.reddit.com/r/Portland/comments/4p7iqt/nice_bike_rides_in_portland_area/,,,,,
The_Sloth_Lyfe,1426550137.0,,,t2_m9med,1466549748,self.Portland,,https://www.reddit.com/r/Portland/comments/4p7hxk/portland_rant/,0,4p7hxk,True,off-topic,Other,False,{},53,False,/r/Portland/comments/4p7hxk/portland_rant/,1472799051,0,{},I'm here for a conference and bored out of my mind,False,Portland,t5_2qi2i,self,Portland rant,https://www.reddit.com/r/Portland/comments/4p7hxk/portland_rant/,,,,,
water--,1430269653.0,,Milwaukie,t2_n6ngp,1466549232,i.redd.it,,https://www.reddit.com/r/Portland/comments/4p7ggc/snowing_on_the_solstice_skiing_off_rainier_with/,0,4p7ggc,False,photo,Photo,False,{},15,False,/r/Portland/comments/4p7ggc/snowing_on_the_solstice_skiing_off_rainier_with/,1472799030,180,{},,False,Portland,t5_2qi2i,http://b.thumbs.redditmedia.com/xLWWozRz3cH0sQDu5nZAcJUVsJpMBS6JSJLJPbQvZko.jpg,Snowing on the Solstice: Skiing off Rainier with Mt. Hood all sunny in background,https://i.redd.it/lyauz2p62q4x.jpg,image,"{'images': [{'id': 'qqSIW9mkGu1ZNrlfsdQvmqqFvujXOuA17d27vB5aY_8', 'resolutions': [{'height': 71, 'url': 'https://i.redditmedia.com/afItlcI70lkmlBO6DIOv2vRVQwVwydyyym_F63NROrY.jpg?fit=crop&amp;crop=faces%2Centropy&amp;arh=2&amp;w=108&amp;s=03b5a65d8a780e44d9aeb8c5a719fc4f', 'width': 108}, {'height': 143, 'url': 'https://i.redditmedia.com/afItlcI70lkmlBO6DIOv2vRVQwVwydyyym_F63NROrY.jpg?fit=crop&amp;crop=faces%2Centropy&amp;arh=2&amp;w=216&amp;s=c2422140623ff8c217022b7e6bb877e1', 'width': 216}, {'height': 212, 'url': 'https://i.redditmedia.com/afItlcI70lkmlBO6DIOv2vRVQwVwydyyym_F63NROrY.jpg?fit=crop&amp;crop=faces%2Centropy&amp;arh=2&amp;w=320&amp;s=2647becfe7cc12cde263de8a6cdbcddb', 'width': 320}, {'height': 425, 'url': 'https://i.redditmedia.com/afItlcI70lkmlBO6DIOv2vRVQwVwydyyym_F63NROrY.jpg?fit=crop&amp;crop=faces%2Centropy&amp;arh=2&amp;w=640&amp;s=e6ed8dd983ae9c634f7c985c3b32c85d', 'width': 640}, {'height': 637, 'url': 'https://i.redditmedia.com/afItlcI70lkmlBO6DIOv2vRVQwVwydyyym_F63NROrY.jpg?fit=crop&amp;crop=faces%2Centropy&amp;arh=2&amp;w=960&amp;s=e0d6f8c967d2eca5b00cd12b9c3d5a1a', 'width': 960}, {'height': 717, 'url': 'https://i.redditmedia.com/afItlcI70lkmlBO6DIOv2vRVQwVwydyyym_F63NROrY.jpg?fit=crop&amp;crop=faces%2Centropy&amp;arh=2&amp;w=1080&amp;s=0ebe82d5b12f607696d582386ec07936', 'width': 1080}], 'source': {'height': 1993, 'url': 'https://i.redditmedia.com/afItlcI70lkmlBO6DIOv2vRVQwVwydyyym_F63NROrY.jpg?s=4daadeb8807107fc8d6cce6f473bf22d', 'width': 3000}, 'variants': {}}]}",,,
[deleted],,,,,1466548007,c2.staticflickr.com,,https://www.reddit.com/r/Portland/comments/4p7cw1/happy_belated_solstice_and_happy_summer_portland/,0,4p7cw1,False,photo,Photo,False,{},3,False,/r/Portland/comments/4p7cw1/happy_belated_solstice_and_happy_summer_portland/,1472798981,0,{},[deleted],False,Portland,t5_2qi2i,default,"Happy Belated Solstice, and Happy Summer Portland!",https://c2.staticflickr.com/8/7564/27708048822_2e85410f78_k.jpg,,,,,
[deleted],,,,,1466547769,c2.staticflickr.com,,https://www.reddit.com/r/Portland/comments/4p7c87/happy_belated_solstice_and_happy_summer_portland/,0,4p7c87,False,local-news,Local News,False,{},1,False,/r/Portland/comments/4p7c87/happy_belated_solstice_and_happy_summer_portland/,1472798971,0,{},[deleted],False,Portland,t5_2qi2i,default,"Happy Belated Solstice, and Happy Summer Portland!",https://c2.staticflickr.com/8/7564/27708048822_2e85410f78_k.jpg,,,,,
Imnaha2,1459426540.0,,,t2_ws1to,1466545079,oregonlive.com,,https://www.reddit.com/r/Portland/comments/4p74b6/gov_kate_brown_schools_must_share_radon_lead/,0,4p74b6,False,local-news,Local News,False,{},7,False,/r/Portland/comments/4p74b6/gov_kate_brown_schools_must_share_radon_lead/,1472798859,50,{},,False,Portland,t5_2qi2i,http://b.thumbs.redditmedia.com/lbzbltzKJvf0_Q1K7LLGnP9Ja7NdwjgSdi_FeeZjLQY.jpg,"Gov. Kate Brown: Schools must share radon, lead results annually",http://www.oregonlive.com/portland/index.ssf/2016/06/gov_kate_brown_schools_must_sh.html,link,"{'images': [{'id': '_FrZsM3wiR-8feQ-KR8kTCp9YHF-0UsMc7kZBwSNs6k', 'resolutions': [{'height': 79, 'url': 'https://i.redditmedia.com/xGGd3IQ3nFGm6b_EeggkWODA6AKBBEeb-GNYZY-1emg.jpg?fit=crop&amp;crop=faces%2Centropy&amp;arh=2&amp;w=108&amp;s=029b6cdbdc2757dbd017532e79a1a3e7', 'width': 108}, {'height': 158, 'url': 'https://i.redditmedia.com/xGGd3IQ3nFGm6b_EeggkWODA6AKBBEeb-GNYZY-1emg.jpg?fit=crop&amp;crop=faces%2Centropy&amp;arh=2&amp;w=216&amp;s=105b3e65efcf36f411c5a15e386a5334', 'width': 216}, {'height': 234, 'url': 'https://i.redditmedia.com/xGGd3IQ3nFGm6b_EeggkWODA6AKBBEeb-GNYZY-1emg.jpg?fit=crop&amp;crop=faces%2Centropy&amp;arh=2&amp;w=320&amp;s=8b91f0a2b9bba7957011b6ecfc920cc5', 'width': 320}], 'source': {'height': 278, 'url': 'https://i.redditmedia.com/xGGd3IQ3nFGm6b_EeggkWODA6AKBBEeb-GNYZY-1emg.jpg?s=2dd4f3cc5e0ea6a02af7936636e83ad9', 'width': 380}, 'variants': {}}]}",,,
dat_taco_smell,1439924682.0,,Portsmouth,t2_pnnl6,1466543341,residentialinfill.participate.online,,https://www.reddit.com/r/Portland/comments/4p6yw2/residential_infill_project_proposed_changes_to/,0,4p6yw2,False,housing,Housing,False,{},26,False,/r/Portland/comments/4p6yw2/residential_infill_project_proposed_changes_to/,1472798782,17,{},,False,Portland,t5_2qi2i,http://b.thumbs.redditmedia.com/_Pq5NCWqvkVpVW2eX_3n3stYXCvwjnh59QP3EM65A7s.jpg,Residential Infill Project: Proposed changes to zoning rules (incl. height and size restrictions),http://residentialinfill.participate.online/house-size,link,"{'images': [{'id': 'OdV2NQ0k6l2h3E2jmA2TtqEJbwO6T7rHDQY2gGo1jYE', 'resolutions': [{'height': 57, 'url': 'https://i.redditmedia.com/RiyzI1njUVryH-t_5X_fx9QZcSpAiHEMR6xnIxn7W9s.jpg?fit=crop&amp;crop=faces%2Centropy&amp;arh=2&amp;w=108&amp;s=49c9f41097f5a701a1cf78cbc4f1d39e', 'width': 108}, {'height': 114, 'url': 'https://i.redditmedia.com/RiyzI1njUVryH-t_5X_fx9QZcSpAiHEMR6xnIxn7W9s.jpg?fit=crop&amp;crop=faces%2Centropy&amp;arh=2&amp;w=216&amp;s=444a6afaceeb463a8383e3ac92cdbe23', 'width': 216}, {'height': 170, 'url': 'https://i.redditmedia.com/RiyzI1njUVryH-t_5X_fx9QZcSpAiHEMR6xnIxn7W9s.jpg?fit=crop&amp;crop=faces%2Centropy&amp;arh=2&amp;w=320&amp;s=8ffe55163184ef681e219df7259c093a', 'width': 320}, {'height': 340, 'url': 'https://i.redditmedia.com/RiyzI1njUVryH-t_5X_fx9QZcSpAiHEMR6xnIxn7W9s.jpg?fit=crop&amp;crop=faces%2Centropy&amp;arh=2&amp;w=640&amp;s=5b9f7db42a25ea85a815ab54af587df5', 'width': 640}, {'height': 510, 'url': 'https://i.redditmedia.com/RiyzI1njUVryH-t_5X_fx9QZcSpAiHEMR6xnIxn7W9s.jpg?fit=crop&amp;crop=faces%2Centropy&amp;arh=2&amp;w=960&amp;s=a76224b76b03706f953896792eac35dd', 'width': 960}, {'height': 574, 'url': 'https://i.redditmedia.com/RiyzI1njUVryH-t_5X_fx9QZcSpAiHEMR6xnIxn7W9s.jpg?fit=crop&amp;crop=faces%2Centropy&amp;arh=2&amp;w=1080&amp;s=9030edb9b0dfe8c60bfacebabfa48bbe', 'width': 1080}], 'source': {'height': 659, 'url': 'https://i.redditmedia.com/RiyzI1njUVryH-t_5X_fx9QZcSpAiHEMR6xnIxn7W9s.jpg?s=8f21844bc0aede7b7c66c0d4138e243a', 'width': 1239}, 'variants': {}}]}",,,
reverber8,1411689876.0,,S Portland,t2_ikpdq,1466538539,self.Portland,1466538805.0,https://www.reddit.com/r/Portland/comments/4p6k8l/lost_wallet_yesterday_ne_7th_couch/,0,4p6k8l,True,classifieds,Classifieds,False,{},6,False,/r/Portland/comments/4p6k8l/lost_wallet_yesterday_ne_7th_couch/,1472798572,5,{},"If anyone finds it, or has found it, please PM me! 

Also ðŸ˜©

I tried to find a picture of it, but of course I don't have one. It is cloth and has a rather loud pattern on the outside and it's green on the inside. My cash is probably gone which is horrible, but it's a NQA thing when you want something back this badly, and I'll offer $50 for its return.",False,Portland,t5_2qi2i,self,Lost wallet yesterday NE 7th &amp; Couch,https://www.reddit.com/r/Portland/comments/4p6k8l/lost_wallet_yesterday_ne_7th_couch/,,,,,
Osiris32,1295719786.0,,Milwaukie,t2_4r7pz,1466537014,self.Portland,1466549328.0,https://www.reddit.com/r/Portland/comments/4p6fhd/were_in_need_of_some_new_mods/,0,4p6fhd,True,custom,Meta,True,{},333,False,/r/Portland/comments/4p6fhd/were_in_need_of_some_new_mods/,1472798506,37,{},"So the /r/Portland mod team is in need of help.  We're looking for three people willing to help moderate this sub and deal with all the things that need to be dealt with.  What we're looking for:

* At least one year active on reddit
* Regular participation in /r/Portland 
* The willingness and ability to be online at least once a day
* A minimal-to-no history of trolling within this sub

Skills that are preferred:

* CSS/html coding
* Experience with automod and reddit-based bots
* Prior moderating experience

You can nominate yourself or someone else, but only if you talk to that person first and get their permission.  Nominations will be open for the next five days, after which we will have a vote to find the top three candidates.",False,Portland,t5_2qi2i,self,We're in need of some new mods,https://www.reddit.com/r/Portland/comments/4p6fhd/were_in_need_of_some_new_mods/,,,,,moderator
