author,author_flair_background_color,author_flair_css_class,author_flair_richtext,author_flair_text,author_flair_text_color,author_flair_type,author_fullname,author_patreon_flair,can_mod_post,contest_mode,created_utc,domain,full_link,gildings,id,is_crosspostable,is_meta,is_original_content,is_reddit_media_domain,is_robot_indexable,is_self,is_video,link_flair_background_color,link_flair_richtext,link_flair_text_color,link_flair_type,locked,media_only,no_follow,num_comments,num_crossposts,over_18,parent_whitelist_status,permalink,pinned,pwls,retrieved_on,score,selftext,send_replies,spoiler,stickied,subreddit,subreddit_id,subreddit_subscribers,subreddit_type,thumbnail,title,updated_utc,url,whitelist_status,wls,link_flair_css_class,link_flair_text,suggested_sort,author_flair_template_id,media_metadata,media,media_embed,post_hint,preview,secure_media,secure_media_embed,thumbnail_height,thumbnail_width
AutoModerator,,,[],24 Hour Church of Elvis,dark,text,t2_6l4z3,False,False,False,1551449328,self.Portland,https://www.reddit.com/r/Portland/comments/aw5azn/dear_portland_march_01_2019_weekly_rave_thread/,"{'gid_1': 0, 'gid_2': 0, 'gid_3': 0}",aw5azn,True,False,False,False,True,True,False,,[],dark,text,False,False,True,50,0,False,all_ads,/r/Portland/comments/aw5azn/dear_portland_march_01_2019_weekly_rave_thread/,False,6,1551449329,15,"What made you smile this week--tell us about it! what are you looking forward to this weekend? what's making you happy?

Caps lock off, downvotes never, go forth and be happy! 
",False,False,False,Portland,t5_2qi2i,119644,public,self,"dear portland: March 01, 2019 weekly rave thread",1553949708,https://www.reddit.com/r/Portland/comments/aw5azn/dear_portland_march_01_2019_weekly_rave_thread/,all_ads,6,,,,,,,,,,,,,
gryphiti2,,,[],,,text,t2_ub7syay,False,False,False,1551425847,self.Portland,https://www.reddit.com/r/Portland/comments/aw25k8/portland_house_ants_help/,"{'gid_1': 0, 'gid_2': 0, 'gid_3': 0}",aw25k8,True,False,False,False,True,True,False,,[],dark,text,False,False,True,43,0,False,all_ads,/r/Portland/comments/aw25k8/portland_house_ants_help/,False,6,1551425850,10,"I had this experience at my old house where ants would be all over the kitchen and in the bathroom which I expected but they would be coming out of nowhere in my room. All the time. No trails, no nothing. I’d just see a ton of them over time crawling on my floor out of nowhere and in sleep would even feel something on my skin and it would turn out to be an ant or TWO. I used everything I could . 

I moved into a new place recently that is pretty clean and I live in a room north facing in the second floor. I’m all of a sudden now experiencing the ants on the floor again. I’m seeing them just crawl out of nowhere and even found one on my bed. I’ve tried wiping the floor down with peppermint oil and they still keep coming. Help! I’m getting really anxious because of my previous terrible experience with them before to the point I couldn’t sleep in my bed any longer. ",True,False,False,Portland,t5_2qi2i,119632,public,self,"Portland house ants, help!!! 😫😫😫",1553946645,https://www.reddit.com/r/Portland/comments/aw25k8/portland_house_ants_help/,all_ads,6,,,,,,,,,,,,,
AutoModerator,,,[],24 Hour Church of Elvis,dark,text,t2_6l4z3,False,False,False,1551424040,self.Portland,https://www.reddit.com/r/Portland/comments/aw1x4h/monthly_rportland_hire_me_thread_march_01_2019/,"{'gid_1': 0, 'gid_2': 0, 'gid_3': 0}",aw1x4h,True,False,False,False,True,True,False,,[],dark,text,False,False,True,12,0,False,all_ads,/r/Portland/comments/aw1x4h/monthly_rportland_hire_me_thread_march_01_2019/,False,6,1551424041,4,"It's that time again!

JOB SEEKERS, what kinds of work are you looking for, what are your qualifications, and what location interests you?

Write a quick bio of what you're looking for. Please do not post personal information such as a link directly to your own resume; keep that to PM.

**If you are hiring people, use the ""I'M HIRING"" thread.** Link is in the top menu and on sidebar, under ""JOBS"".",False,False,False,Portland,t5_2qi2i,119631,public,self,"MONTHLY /R/PORTLAND ""HIRE ME"" THREAD: March 01, 2019",1553946231,https://www.reddit.com/r/Portland/comments/aw1x4h/monthly_rportland_hire_me_thread_march_01_2019/,all_ads,6,custom,Hire Me,new,,,,,,,,,,
AutoModerator,,,[],24 Hour Church of Elvis,dark,text,t2_6l4z3,False,False,False,1551424031,self.Portland,https://www.reddit.com/r/Portland/comments/aw1x33/monthly_rportland_im_hiring_thread_march_01_2019/,"{'gid_1': 0, 'gid_2': 0, 'gid_3': 0}",aw1x33,True,False,False,False,True,True,False,,[],dark,text,False,False,True,19,0,False,all_ads,/r/Portland/comments/aw1x33/monthly_rportland_im_hiring_thread_march_01_2019/,False,6,1551424033,41,"It's that time again!

EMPLOYERS, what jobs do you have available? EMPLOYEES, what positions are available at your place of business?

Please feel free to post links to job sites and general job search advice here. You may solicit for resumes, but please do not post personal information; keep that to PM. Public company email addresses are okay.

**If you are seeking a job, use the ""HIRE ME"" thread.** Link is in the top menu and on sidebar, under ""JOBS"".
",False,False,False,Portland,t5_2qi2i,119631,public,self,"MONTHLY /R/PORTLAND ""I'M HIRING"" THREAD: March 01, 2019",1553946230,https://www.reddit.com/r/Portland/comments/aw1x33/monthly_rportland_im_hiring_thread_march_01_2019/,all_ads,6,custom,I'm Hiring,new,,,,,,,,,,
JDnotsalinger,,,[],,,text,t2_79dguhd,False,False,False,1551423212,self.Portland,https://www.reddit.com/r/Portland/comments/aw1t6o/any_awesome_radical_artists_want_to_hang_out_and/,"{'gid_1': 0, 'gid_2': 0, 'gid_3': 0}",aw1t6o,True,False,False,False,True,True,False,,[],dark,text,False,False,True,1,0,False,all_ads,/r/Portland/comments/aw1t6o/any_awesome_radical_artists_want_to_hang_out_and/,False,6,1551423212,0,"I (27f) stopped participating in the Portland activist community about two years ago, for the reasons one might expect. (extreme interpersonal drama among everyone, ethical-olympics...just too much toxic stuff)

&amp;#x200B;

But I'm ready to crawl out of my hole and make some new friends. 

I really want to give more respect to the things I'm good at and start doing them again as well.

So if there are any cool people out there, I'm down to paint, write, build stuff, whatever.

Maybe we can swap instagrams to verify each others sanity?

&amp;#x200B;

&amp;#x200B;",True,False,False,Portland,t5_2qi2i,119630,public,self,any awesome radical artists want to hang out and paint or something?,1553946178,https://www.reddit.com/r/Portland/comments/aw1t6o/any_awesome_radical_artists_want_to_hang_out_and/,all_ads,6,,,,,,,,,,,,,
BluPeach,,,[],,,text,t2_brg0n,False,False,False,1551422808,self.Portland,https://www.reddit.com/r/Portland/comments/aw1r98/im_looking_for_a_v_relaxing_romantic_weekend/,"{'gid_1': 0, 'gid_2': 0, 'gid_3': 0}",aw1r98,True,False,False,False,True,True,False,,[],dark,text,False,False,True,8,0,False,all_ads,/r/Portland/comments/aw1r98/im_looking_for_a_v_relaxing_romantic_weekend/,False,6,1551422808,0,We are able to spend about $100/night and would love to be able to spend a few days not having to drive  anywhere for food or drink... a quick drive for activities would be great! Thank you for your consideration!,True,False,False,Portland,t5_2qi2i,119630,public,self,I’m looking for a V relaxing &amp; romantic weekend driving distance from Portland that is affordable. Any suggestions?,1553946151,https://www.reddit.com/r/Portland/comments/aw1r98/im_looking_for_a_v_relaxing_romantic_weekend/,all_ads,6,,,,,,,,,,,,,
Skate503,,,[],,,text,t2_sdzkuos,False,False,False,1551422583,self.Portland,https://www.reddit.com/r/Portland/comments/aw1q7k/found_cell_phone_at_hollywood_tc_today/,"{'gid_1': 0, 'gid_2': 0, 'gid_3': 0}",aw1q7k,True,False,False,False,True,True,False,,[],dark,text,False,False,True,0,0,False,all_ads,/r/Portland/comments/aw1q7k/found_cell_phone_at_hollywood_tc_today/,False,6,1551422584,5,"It's metro PCS, broken screen, and encrypted I found it around 830-9 ish this evening (Thursday)  hit me if it's yours and you can show me that you know how to unlock it",True,False,False,Portland,t5_2qi2i,119630,public,self,Found cell phone at Hollywood TC today,1553946136,https://www.reddit.com/r/Portland/comments/aw1q7k/found_cell_phone_at_hollywood_tc_today/,all_ads,6,,,,,,,,,,,,,
CasketOfCass,,,[],,,text,t2_xy953,False,False,False,1551422372,theguardian.com,https://www.reddit.com/r/Portland/comments/aw1p89/guardian_exclusive_video_shows_portland_officers/,"{'gid_1': 0, 'gid_2': 0, 'gid_3': 0}",aw1p89,True,False,False,False,True,False,False,,[],dark,text,False,False,True,87,0,False,all_ads,/r/Portland/comments/aw1p89/guardian_exclusive_video_shows_portland_officers/,False,6,1551422372,162,,True,False,False,Portland,t5_2qi2i,119627,public,default,Guardian Exclusive: video shows Portland officers made deal with far-right group leader,1553946123,https://www.theguardian.com/us-news/2019/mar/01/exclusive-video-shows-portland-officers-made-deal-with-far-right-group-leader,all_ads,6,,,,,,,,,,,,,
andrewtaylorwilkins,,,[],,,text,t2_7g3oy,False,False,False,1551419083,jcwc.org,https://www.reddit.com/r/Portland/comments/aw18li/volunteer_to_help_restore_johnson_creek_in_one_of/,"{'gid_1': 0, 'gid_2': 0, 'gid_3': 0}",aw18li,True,False,False,False,True,False,False,,[],dark,text,False,False,True,15,0,False,all_ads,/r/Portland/comments/aw18li/volunteer_to_help_restore_johnson_creek_in_one_of/,False,6,1551419083,42,,True,False,False,Portland,t5_2qi2i,119626,public,default,"Volunteer to help restore Johnson Creek in one of ten locations on Saturday, March 2nd",1553945595,http://www.jcwc.org/events/wwe21/,all_ads,6,,,,,,,,,,,,,
hotwings93,,,[],,,text,t2_1ucs16vi,False,False,False,1551418199,self.Portland,https://www.reddit.com/r/Portland/comments/aw13xw/help_me_compile_a_list_of_good_date_spots_or/,"{'gid_1': 0, 'gid_2': 0, 'gid_3': 0}",aw13xw,True,False,False,False,True,True,False,,[],dark,text,False,False,True,11,0,False,all_ads,/r/Portland/comments/aw13xw/help_me_compile_a_list_of_good_date_spots_or/,False,6,1551418200,0," Alright, sooo probably like a bunch of other 20 somethings, I’ve got my list of go-to date spots, bars or weekend activities and places to eat.
I’m getting bored of my personal places. So I wanna ask for help here, and see what your lists of date ideas, activities, restaurants, etc are.

On a side note. Maybe we can turn this into a small book of what to do in P town.

Thanks everyone ❤️",True,False,False,Portland,t5_2qi2i,119625,public,self,Help me compile a list of good date spots or things to do it Portland.,1553945532,https://www.reddit.com/r/Portland/comments/aw13xw/help_me_compile_a_list_of_good_date_spots_or/,all_ads,6,,,,,,,,,,,,,
dino_parrot,,,[],,,text,t2_3777lxdp,False,False,False,1551416815,kptv.com,https://www.reddit.com/r/Portland/comments/aw0wgp/chickfila_gives_people_unwanted_gas/,"{'gid_1': 0, 'gid_2': 0, 'gid_3': 0}",aw0wgp,True,False,False,False,True,False,False,,[],dark,text,False,False,True,5,0,False,all_ads,/r/Portland/comments/aw0wgp/chickfila_gives_people_unwanted_gas/,False,6,1551416816,4,,True,False,False,Portland,t5_2qi2i,119619,public,default,Chick-Fil-A Gives People Unwanted Gas,1553945429,https://www.kptv.com/news/nw-th-avenue-reopened-after-car-hits-gas-line-in/article_36ad6734-3bd7-11e9-ae35-13129f258f6a.html,all_ads,6,local-news,Local News,,,,,,,,,,,
maddyb48,,,[],,,text,t2_3bl5k9hs,False,False,False,1551416210,self.Portland,https://www.reddit.com/r/Portland/comments/aw0t1e/moving_to_oregon_newly_licensed_teacher/,"{'gid_1': 0, 'gid_2': 0, 'gid_3': 0}",aw0t1e,False,False,False,False,False,True,False,,[],dark,text,False,False,True,1,0,False,all_ads,/r/Portland/comments/aw0t1e/moving_to_oregon_newly_licensed_teacher/,False,6,1551416211,1,[removed],True,False,False,Portland,t5_2qi2i,119618,public,self,Moving to Oregon- newly licensed teacher,1553945084,https://www.reddit.com/r/Portland/comments/aw0t1e/moving_to_oregon_newly_licensed_teacher/,all_ads,6,,,,,,,,,,,,,
ShuuyiW,,,[],,,text,t2_y0mui,False,False,False,1551414193,self.Portland,https://www.reddit.com/r/Portland/comments/aw0hxr/when_can_we_expect_cherry_blossoms_to_bloom/,"{'gid_1': 0, 'gid_2': 0, 'gid_3': 0}",aw0hxr,True,False,False,False,True,True,False,,[],dark,text,False,False,True,2,0,False,all_ads,/r/Portland/comments/aw0hxr/when_can_we_expect_cherry_blossoms_to_bloom/,False,6,1551414194,0,I'm a Canadian living in Forest Grove. When should I make the drive out to Portland to see the blossoms?,True,False,False,Portland,t5_2qi2i,119609,public,self,When can we expect cherry blossoms to bloom?,1553944934,https://www.reddit.com/r/Portland/comments/aw0hxr/when_can_we_expect_cherry_blossoms_to_bloom/,all_ads,6,,,,,,,,,,,,,
WhereverUGoThereUR,,,[],NW Heights,dark,text,t2_7z04y,False,False,False,1551409050,imgur.com,https://www.reddit.com/r/Portland/comments/avzo4w/can_we_please_get_a_traffic_signal_at_nw_25th/,"{'gid_1': 0, 'gid_2': 0, 'gid_3': 0}",avzo4w,True,False,False,False,True,False,False,,[],dark,text,False,False,True,47,0,False,all_ads,/r/Portland/comments/avzo4w/can_we_please_get_a_traffic_signal_at_nw_25th/,False,6,1551409051,25,,False,False,False,Portland,t5_2qi2i,119605,public,default,Can we Please get a traffic signal at NW 25th &amp; Lovejoy?,1553944218,https://imgur.com/Z6hj6df.jpg,all_ads,6,,,,a83c2e8e-42ca-11e1-a86c-12313d096aae,,,,,,,,,
powellandpressmurder,,,[],Piedmont,dark,text,t2_5m6kx,False,False,False,1551408284,self.Portland,https://www.reddit.com/r/Portland/comments/avzjqu/how_do_fellow_renters_deal_with_curb_parking/,"{'gid_1': 0, 'gid_2': 0, 'gid_3': 0}",avzjqu,True,False,False,False,True,True,False,,[],dark,text,False,False,True,77,0,False,all_ads,/r/Portland/comments/avzjqu/how_do_fellow_renters_deal_with_curb_parking/,False,6,1551408285,31,"I'll start with that I've lived in Portland for over a decade, just in case it matters to readers. I moved into a rental house with my fiancee and her child last summer because we needed more space. One of our next door neighbors - whom owns their home - is pretty aggressive about curb parking politics. They have (from what I can tell) three cars and a large work van, with a drive way they don't use. We have two cars and no drive way. They've ran the gauntlet on curb parking patrolling, from casually asking us to not park near their house, to intentionally boxing us in if we pass their declared threshold. This is a residential side street in deep SE (past 82nd) with a good amount of cars parked on it, so parking is tight, but not NW 21st tight. It's getting to the point where we have to park a block or so away some times to avoid unwanted tension. I'm wondering if anyone here has successfully deescalated a situation like this without pissing anyone off, and what strategies they've used. We want to be good neighbors, but we feel like we're being railroaded a bit.",True,False,False,Portland,t5_2qi2i,119603,public,self,How do fellow renters deal with curb parking politics with homeowners?,1553943865,https://www.reddit.com/r/Portland/comments/avzjqu/how_do_fellow_renters_deal_with_curb_parking/,all_ads,6,,,,,,,,,,,,,
non_trivial,,,[],,,text,t2_4lvrpd,False,False,False,1551407645,oregonlive.com,https://www.reddit.com/r/Portland/comments/avzg13/portland_place_name_etymology_montavilla_is/,"{'gid_1': 0, 'gid_2': 0, 'gid_3': 0}",avzg13,True,False,False,False,True,False,False,,[],dark,text,False,False,True,16,0,False,all_ads,/r/Portland/comments/avzg13/portland_place_name_etymology_montavilla_is/,False,6,1551407646,0,,True,False,False,Portland,t5_2qi2i,119603,public,default,Portland place name etymology. Montavilla is hilarious,1553943811,https://www.oregonlive.com/trending/2019/02/the-surprising-meanings-behind-portlands-most-unusual-neighborhood-names.html,all_ads,6,local-news,Local News,,,,,,,,,,,
sweet_dee_27,,,[],,,text,t2_vzr7rkk,False,False,False,1551407075,self.Portland,https://www.reddit.com/r/Portland/comments/avzcpi/drivers_avoid_i5_northbound_this_evening_the/,"{'gid_1': 0, 'gid_2': 0, 'gid_3': 0}",avzcpi,True,False,False,False,True,True,False,,[],dark,text,False,False,True,1,0,False,all_ads,/r/Portland/comments/avzcpi/drivers_avoid_i5_northbound_this_evening_the/,False,6,1551407076,32,"Hey all- 

Stuck in stopped traffic during rush hour. Dozens of waze users have reported standstill traffic, a bridge lift, and a broken down semi. Take backroads or the 205 bridge if you’re heading north! Safe travels :)",True,False,False,Portland,t5_2qi2i,119603,public,self,Drivers- avoid I5 Northbound this evening! The bridge is up AND there is a semi broken down in the center lane near Rosa Parks exit.,1553943763,https://www.reddit.com/r/Portland/comments/avzcpi/drivers_avoid_i5_northbound_this_evening_the/,all_ads,6,,,,,,,,,,,,,
henofthewoods,,,[],,,text,t2_4y3sg,False,False,False,1551405934,self.Portland,https://www.reddit.com/r/Portland/comments/avz69n/touchless_car_wash/,"{'gid_1': 0, 'gid_2': 0, 'gid_3': 0}",avz69n,True,False,False,False,True,True,False,,[],dark,text,False,False,True,16,0,False,all_ads,/r/Portland/comments/avz69n/touchless_car_wash/,False,6,1551405935,0,I just bought a new black car (yes a Subaru lol) and am looking for a touchless car wash where I can maintain it through winter. I don't want to get out of the car and spray it myself... I'm just not that dedicated. I used to take my old car to the Washman by next adventure but I don't trust anything that makes contact with my sparkly new paint. Thanks!,True,False,False,Portland,t5_2qi2i,119599,public,self,Touchless car wash?,1553943671,https://www.reddit.com/r/Portland/comments/avz69n/touchless_car_wash/,all_ads,6,,,,,,,,,,,,,
6_tubs_of_guts,,,[],,,text,t2_2vh12mex,False,False,False,1551404432,i.redd.it,https://www.reddit.com/r/Portland/comments/avyxsc/tualatin_today/,"{'gid_1': 0, 'gid_2': 0, 'gid_3': 0}",avyxsc,True,False,False,True,True,False,False,,[],dark,text,False,False,True,11,0,False,all_ads,/r/Portland/comments/avyxsc/tualatin_today/,False,6,1551404433,8,,False,False,False,Portland,t5_2qi2i,119598,public,default,Tualatin today,1553943260,https://i.redd.it/fzcgsdvbwej21.jpg,all_ads,6,,,,,,,,,,,,,
Footballshoes12,,,[],,,text,t2_3bjr13l2,False,False,False,1551404132,self.Portland,https://www.reddit.com/r/Portland/comments/avyw05/meeting_at_the_park/,"{'gid_1': 0, 'gid_2': 0, 'gid_3': 0}",avyw05,False,False,False,False,False,True,False,,[],dark,text,False,False,True,0,0,False,all_ads,/r/Portland/comments/avyw05/meeting_at_the_park/,False,6,1551404133,1,[removed],True,False,False,Portland,t5_2qi2i,119598,public,self,Meeting at the park,1553943234,https://www.reddit.com/r/Portland/comments/avyw05/meeting_at_the_park/,all_ads,6,,,,,,,,,,,,,
DefinitelyNotMartinC,,,[],,,text,t2_9umkvgt,False,False,False,1551404039,i.redd.it,https://www.reddit.com/r/Portland/comments/avyvh9/support_the_arts_and_dont_forget_to_pay_your_2018/,"{'gid_1': 0, 'gid_2': 0, 'gid_3': 0}",avyvh9,True,False,False,True,True,False,False,,[],dark,text,False,False,True,6,0,False,all_ads,/r/Portland/comments/avyvh9/support_the_arts_and_dont_forget_to_pay_your_2018/,False,6,1551404040,18,,True,False,False,Portland,t5_2qi2i,119597,public,default,Support the arts and don't forget to pay your 2018 Arts Tax!,1553943228,https://i.redd.it/49tv711ouej21.jpg,all_ads,6,photo,Photo,,,,,,,,,,,
wellsuremaybeiguess,,,[],,,text,t2_2v3ij2gy,False,False,False,1551403618,self.Portland,https://www.reddit.com/r/Portland/comments/avyt4u/residential_green_roof_contractors/,"{'gid_1': 0, 'gid_2': 0, 'gid_3': 0}",avyt4u,True,False,False,False,True,True,False,,[],dark,text,False,False,True,2,0,False,all_ads,/r/Portland/comments/avyt4u/residential_green_roof_contractors/,False,6,1551403620,0,"I'm due for a new roof and want to explore some green/living roof alternatives. On my little bit of top notch Google searching I really only found green/living roof forms that were targeting commercial installs. Anyone know of people out there who are doing this for residential roofs?

Thanks!",True,False,False,Portland,t5_2qi2i,119598,public,self,Residential green roof contractors?,1553943193,https://www.reddit.com/r/Portland/comments/avyt4u/residential_green_roof_contractors/,all_ads,6,,,,,,,,,,,,,
ReillyGod,,,[],,,text,t2_szz3q,False,False,False,1551401990,i.redd.it,https://www.reddit.com/r/Portland/comments/avyjhs/spotted_while_out_in_shinjuku_tokyo_japan/,"{'gid_1': 0, 'gid_2': 0, 'gid_3': 0}",avyjhs,True,False,False,True,True,False,False,,[],dark,text,False,False,True,106,0,False,all_ads,/r/Portland/comments/avyjhs/spotted_while_out_in_shinjuku_tokyo_japan/,False,6,1551401991,2089,,True,False,False,Portland,t5_2qi2i,119592,public,default,"Spotted while out in Shinjuku. [Tokyo, Japan]",1553943052,https://i.redd.it/ci5c0702pej21.jpg,all_ads,6,photo,Photo,,,,,,,,,,,
WhereverUGoThereUR,,,[],NW Heights,dark,text,t2_7z04y,False,False,False,1551399907,self.Portland,https://www.reddit.com/r/Portland/comments/avy7e0/uh_governor_kate_uh_brown_uh_mandates_uh_rent_uh/,"{'gid_1': 0, 'gid_2': 0, 'gid_3': 0}",avy7e0,True,False,False,False,True,True,False,,[],dark,text,False,False,True,12,0,False,all_ads,/r/Portland/comments/avy7e0/uh_governor_kate_uh_brown_uh_mandates_uh_rent_uh/,False,6,1551399908,0,"Seriously, she's really got to work on public speaking.",True,False,False,Portland,t5_2qi2i,119587,public,self,"""uh"" Governor Kate ""uh"" Brown ""uh"" mandates ""uh"" rent ""uh Control ""uh"" in ""uh"" Oregon",1553942585,https://www.reddit.com/r/Portland/comments/avy7e0/uh_governor_kate_uh_brown_uh_mandates_uh_rent_uh/,all_ads,6,,,,a83c2e8e-42ca-11e1-a86c-12313d096aae,,,,,,,,,
guanaco55,,,[],Regional Gallowboob,dark,text,t2_hyfa9,False,False,False,1551399493,wweek.com,https://www.reddit.com/r/Portland/comments/avy4wr/ahmed_ag_kaedy_was_exiled_from_mali_for_playing/,"{'gid_1': 0, 'gid_2': 0, 'gid_3': 0}",avy4wr,True,False,False,False,True,False,False,,[],dark,text,False,False,True,2,0,False,all_ads,/r/Portland/comments/avy4wr/ahmed_ag_kaedy_was_exiled_from_mali_for_playing/,False,6,1551399494,14,,True,False,False,Portland,t5_2qi2i,119587,public,default,Ahmed Ag Kaedy Was Exiled from Mali for Playing Music. So He Recorded His Album in Portland Instead.,1553942550,https://www.wweek.com/music/2019/02/28/ahmed-ag-kaedy-was-exiled-from-mali-for-playing-music-so-he-recorded-his-album-in-portland-instead/,all_ads,6,,,,,,,,,,,,,
AGlassOfCoolMilk,,,[],,,text,t2_159n5y,False,False,False,1551399269,i.redd.it,https://www.reddit.com/r/Portland/comments/avy3jd/the_most_violently_portland_crime_ive_ever_heard/,"{'gid_1': 0, 'gid_2': 0, 'gid_3': 0}",avy3jd,True,False,False,True,True,False,False,,[],dark,text,False,False,True,11,0,False,all_ads,/r/Portland/comments/avy3jd/the_most_violently_portland_crime_ive_ever_heard/,False,6,1551399271,66,,True,False,False,Portland,t5_2qi2i,119587,public,default,The most violently Portland crime I've ever heard.,1553942531,https://i.redd.it/p4rh0lx0hej21.jpg,all_ads,6,photo,Photo,,,,,,,,,,,
mygeek101,,,[],,,text,t2_r7nf144,False,False,False,1551399219,self.Portland,https://www.reddit.com/r/Portland/comments/avy38y/community_group_meet_ups_feminist_group_prefered/,"{'gid_1': 0, 'gid_2': 0, 'gid_3': 0}",avy38y,True,False,False,False,True,True,False,,[],dark,text,False,False,True,5,0,False,all_ads,/r/Portland/comments/avy38y/community_group_meet_ups_feminist_group_prefered/,False,6,1551399220,0,"Hi all, I'm writing a college paper.  I was wondering if  anybody knows any walk in femisits meetups?  In the Portland or Beaverton area. What days and times? Thank you. ",True,False,False,Portland,t5_2qi2i,119586,public,self,Community Group Meet ups? (Feminist Group prefered),1553942527,https://www.reddit.com/r/Portland/comments/avy38y/community_group_meet_ups_feminist_group_prefered/,all_ads,6,,,,,,,,,,,,,
perpetual_fail,,,[],,,text,t2_7bt5v,False,False,False,1551396475,self.Portland,https://www.reddit.com/r/Portland/comments/avxm4w/hey_where_do_i_find_vegetable_rennet/,"{'gid_1': 0, 'gid_2': 0, 'gid_3': 0}",avxm4w,True,False,False,False,True,True,False,,[],dark,text,False,False,True,5,0,False,all_ads,/r/Portland/comments/avxm4w/hey_where_do_i_find_vegetable_rennet/,False,6,1551396477,0,"I’m trying to make cheese up in here and need vegetable rennet, according to my recipe. Any idea as to where I can find some around town?",True,False,False,Portland,t5_2qi2i,119582,public,self,Hey! Where do I find vegetable rennet?,1553941990,https://www.reddit.com/r/Portland/comments/avxm4w/hey_where_do_i_find_vegetable_rennet/,all_ads,6,,,,,,,,,,,,,
vaninahowan,,,[],,,text,t2_24zeb63w,False,False,False,1551395181,kickstarter.com,https://www.reddit.com/r/Portland/comments/avxe07/my_friend_is_trying_to_open_the_first_zero_waste/,"{'gid_1': 0, 'gid_2': 0, 'gid_3': 0}",avxe07,True,False,False,False,True,False,False,,[],dark,text,False,False,True,0,0,False,all_ads,/r/Portland/comments/avxe07/my_friend_is_trying_to_open_the_first_zero_waste/,False,6,1551395181,1,,True,False,False,Portland,t5_2qi2i,119578,public,default,My friend is trying to open the first zero waste grocery store in Portland. Here's her Kickstarter if this is something you'd like to support.,1553941870,https://www.kickstarter.com/projects/goodlifemarket/good-life-market,all_ads,6,,,,,,,,,,,,,
chrislehr,,,[],,,text,t2_4x430,False,False,False,1551393733,i.redd.it,https://www.reddit.com/r/Portland/comments/avx4so/anyone_lose_an_orange_mtb_recently/,"{'gid_1': 0, 'gid_2': 0, 'gid_3': 0}",avx4so,True,False,False,True,True,False,False,,[],dark,text,False,False,True,2,0,False,all_ads,/r/Portland/comments/avx4so/anyone_lose_an_orange_mtb_recently/,False,6,1551393734,0,,True,False,False,Portland,t5_2qi2i,119577,public,default,Anyone lose an orange mtb recently?,1553941449,https://i.redd.it/5idzwq8k0ej21.jpg,all_ads,6,photo,Photo,,,,,,,,,,,
