author,author_flair_css_class,author_flair_richtext,author_flair_text,author_flair_type,author_fullname,can_mod_post,contest_mode,created_utc,domain,full_link,gildings,id,is_crosspostable,is_meta,is_original_content,is_reddit_media_domain,is_robot_indexable,is_self,is_video,link_flair_background_color,link_flair_richtext,link_flair_text_color,link_flair_type,locked,media_only,no_follow,num_comments,num_crossposts,over_18,parent_whitelist_status,permalink,pinned,pwls,retrieved_on,score,selftext,send_replies,spoiler,stickied,subreddit,subreddit_id,subreddit_subscribers,subreddit_type,thumbnail,title,url,whitelist_status,wls,post_hint,preview,thumbnail_height,thumbnail_width,link_flair_css_class,link_flair_text,author_flair_background_color,author_flair_text_color,author_flair_template_id,media,media_embed,secure_media,secure_media_embed
Kavator3,,[],,text,t2_1lqyh9id,False,False,1539450409,self.Portland,https://www.reddit.com/r/Portland/comments/9nvc22/new_apartment_has_hint_of_weed_smell/,"{'gid_1': 0, 'gid_2': 0, 'gid_3': 0}",9nvc22,True,False,False,False,True,True,False,,[],dark,text,False,False,True,17,0,False,all_ads,/r/Portland/comments/9nvc22/new_apartment_has_hint_of_weed_smell/,False,6,1539450410,1,"Alright I got a tricky one.  I just moved into an apartment, and we are doing our inspection of everything wrong in order to send it to the landlord.  I notice the bathroom has a hint of a smell that could likely be marijuana.  Its always just the bathroom, and its not that strong but it is noticable.  Now, one of us does smoke weed but doe not smoke inside.  one of us had some items in storage in a garage that had weed drying in it.  I know this seems like the obvious answer here, but i am certain that is not the source of the smell.  Its just an issue because if we get an inspection there could be a tiny flake of weed or one of the items in the apartment might smell like it.

It might be that other tenants are smoking inside and its going through the vents.  This doesnt bother either of us, and we dont want to get any of our new neighbors in trouble, but we also dont want to be blamed since we are going to have the landlord inspect other issues with the apartment.

So the question is, do we mention it or not?",True,False,False,Portland,t5_2qi2i,106944,public,self,New apartment has hint of weed smell.,https://www.reddit.com/r/Portland/comments/9nvc22/new_apartment_has_hint_of_weed_smell/,all_ads,6,,,,,,,,,,,,,
bobisgod44,,[],,text,t2_omhmh,False,False,1539449131,self.Portland,https://www.reddit.com/r/Portland/comments/9nv5z3/place_to_get_an_old_hammer_repaired/,"{'gid_1': 0, 'gid_2': 0, 'gid_3': 0}",9nv5z3,True,False,False,False,True,True,False,,[],dark,text,False,False,True,16,0,False,all_ads,/r/Portland/comments/9nv5z3/place_to_get_an_old_hammer_repaired/,False,6,1539449132,1,"So this is odd, but if there were anywhere that had someone that did this, it’d be here I imagine. 

I have a children’s hammer from a tool set my husband had as a child with a broken hammer.  The head broke off the handle. I need someone who can put a new handle in. It’s not a standard size, it might need to be custom turned. I get that this isn’t necessarily a cheap thing and we could easily get a new one, but this one is so cool, and I’d love my kid to learn with the one my husband had growing up. 

Any ideas?",True,False,False,Portland,t5_2qi2i,106943,public,self,Place to get an old hammer repaired?,https://www.reddit.com/r/Portland/comments/9nv5z3/place_to_get_an_old_hammer_repaired/,all_ads,6,,,,,,,,,,,,,
yahoowizard,,[],,text,t2_c0th9,False,False,1539448993,reddit.com,https://www.reddit.com/r/Portland/comments/9nv5aw/from_rall_didnt_see_this_posted_here/,"{'gid_1': 0, 'gid_2': 0, 'gid_3': 0}",9nv5aw,True,False,False,False,True,False,False,,[],dark,text,False,False,True,27,0,False,all_ads,/r/Portland/comments/9nv5aw/from_rall_didnt_see_this_posted_here/,False,6,1539448994,1,,True,False,False,Portland,t5_2qi2i,106943,public,https://b.thumbs.redditmedia.com/nX1gwQT1C84_VSfFw-NwKkpSnLzZsJ34lRo2VHalzPA.jpg,"From r/all, didn't see this posted here",https://www.reddit.com/r/gifs/comments/9nscju/nah_you_dont_wanna_do_that/,all_ads,6,link,"{'enabled': False, 'images': [{'id': 'sn5ZQZ3SwxioMBfrI0jxqlKI7zVjw1NCWAxZK6hGN9o', 'resolutions': [{'height': 60, 'url': 'https://external-preview.redd.it/N292LvHfbRehQLxIUzybtXhDgaGh8csgFgmPi9eGVzo.jpg?width=108&amp;crop=smart&amp;auto=webp&amp;s=8bc410f7c7a25aff7ec5b197f46b9131c6505e0e', 'width': 108}, {'height': 121, 'url': 'https://external-preview.redd.it/N292LvHfbRehQLxIUzybtXhDgaGh8csgFgmPi9eGVzo.jpg?width=216&amp;crop=smart&amp;auto=webp&amp;s=2b7513d3a04364661ed34d86bd00b3c50c9d156d', 'width': 216}, {'height': 180, 'url': 'https://external-preview.redd.it/N292LvHfbRehQLxIUzybtXhDgaGh8csgFgmPi9eGVzo.jpg?width=320&amp;crop=smart&amp;auto=webp&amp;s=27411601e2efa847693765434c7e8131d746f382', 'width': 320}], 'source': {'height': 180, 'url': 'https://external-preview.redd.it/N292LvHfbRehQLxIUzybtXhDgaGh8csgFgmPi9eGVzo.jpg?auto=webp&amp;s=78bf26ebd3ddf1ccc4e002149a21fc8e605a70ed', 'width': 320}, 'variants': {}}]}",78.0,140.0,,,,,,,,,
xusemoi1,,[],,text,t2_193xt4dy,False,False,1539447871,i.redd.it,https://www.reddit.com/r/Portland/comments/9nuztg/a_night/,"{'gid_1': 0, 'gid_2': 0, 'gid_3': 0}",9nuztg,True,False,False,True,True,False,False,,[],dark,text,False,False,True,0,0,False,all_ads,/r/Portland/comments/9nuztg/a_night/,False,6,1539447872,1,,True,False,False,Portland,t5_2qi2i,106943,public,default,A night.,https://i.redd.it/pzraonkdbzr11.jpg,all_ads,6,,,,,photo,Photo,,,,,,,
omygodtom,,[],,text,t2_cuscwcl,False,False,1539443968,i.redd.it,https://www.reddit.com/r/Portland/comments/9nui4f/the_mayor_has_said_we_will_be_the_cleanest_city/,"{'gid_1': 0, 'gid_2': 0, 'gid_3': 0}",9nui4f,True,False,False,True,True,False,False,,[],dark,text,False,False,True,222,0,False,all_ads,/r/Portland/comments/9nui4f/the_mayor_has_said_we_will_be_the_cleanest_city/,False,6,1539443968,1,,True,False,False,Portland,t5_2qi2i,106940,public,default,"The mayor has said we will be the cleanest city in America.Hope the New Trash Can,s come with Locks.",https://i.redd.it/szvahj65zyr11.jpg,all_ads,6,,,,,,,,,,,,,
janeteastmanreporter,,[],"Verified - Janet Eastman, The Oregonian",text,t2_164mbj,False,False,1539443846,oregonlive.com,https://www.reddit.com/r/Portland/comments/9nuhjs/homes_for_firsttime_buyers_can_you_swing_1300_a/,"{'gid_1': 0, 'gid_2': 0, 'gid_3': 0}",9nuhjs,False,False,False,False,False,False,False,,[],dark,text,False,False,True,0,0,False,all_ads,/r/Portland/comments/9nuhjs/homes_for_firsttime_buyers_can_you_swing_1300_a/,False,6,1539443848,1,,False,False,False,Portland,t5_2qi2i,106940,public,https://b.thumbs.redditmedia.com/_-8OQGbzUG78nZZxtjSOt495owgM4hBydYJyEhV0XlI.jpg,"Homes for first-time buyers: Can you swing $1,300 a month? | OregonLive.com",https://www.oregonlive.com/expo/life-and-culture/erry-2018/10/9f0450f6ef9460/homes-for-firsttime-buyers-can.html,all_ads,6,link,"{'enabled': False, 'images': [{'id': 'wgc-fQjbOD0T34eENfsT5xIRN-P9ecMXCPTXdmt7p9A', 'resolutions': [{'height': 71, 'url': 'https://external-preview.redd.it/nImVMXFxh3_8WU9QzH1CAvFZY92_ZHsA6Xgw3j_RWhE.jpg?width=108&amp;crop=smart&amp;auto=webp&amp;s=2461df63655473dc0941f677c8be85eaa063f934', 'width': 108}, {'height': 143, 'url': 'https://external-preview.redd.it/nImVMXFxh3_8WU9QzH1CAvFZY92_ZHsA6Xgw3j_RWhE.jpg?width=216&amp;crop=smart&amp;auto=webp&amp;s=6984f33bec0be8911fa49048cf46d86a1978e9be', 'width': 216}, {'height': 212, 'url': 'https://external-preview.redd.it/nImVMXFxh3_8WU9QzH1CAvFZY92_ZHsA6Xgw3j_RWhE.jpg?width=320&amp;crop=smart&amp;auto=webp&amp;s=80b584ecae623feebea4fd65ddaf93b5cad98e5a', 'width': 320}, {'height': 424, 'url': 'https://external-preview.redd.it/nImVMXFxh3_8WU9QzH1CAvFZY92_ZHsA6Xgw3j_RWhE.jpg?width=640&amp;crop=smart&amp;auto=webp&amp;s=5462d51d432f6ce321cea03bb10f93ab41076336', 'width': 640}], 'source': {'height': 441, 'url': 'https://external-preview.redd.it/nImVMXFxh3_8WU9QzH1CAvFZY92_ZHsA6Xgw3j_RWhE.jpg?auto=webp&amp;s=613de4776cac85ea18b1af3dff0a0061fec5603b', 'width': 665}, 'variants': {}}]}",92.0,140.0,,,,dark,,,,,
vaderj,,[],Milwaukie,text,t2_ecqup,False,False,1539434563,oregonlive.com,https://www.reddit.com/r/Portland/comments/9nth7m/portland_driver_at_center_of_viral_protest_video/,"{'gid_1': 0, 'gid_2': 0, 'gid_3': 0}",9nth7m,True,False,False,False,True,False,False,,[],dark,text,False,False,True,6,0,False,all_ads,/r/Portland/comments/9nth7m/portland_driver_at_center_of_viral_protest_video/,False,6,1539434564,1,,False,False,False,Portland,t5_2qi2i,106935,public,https://b.thumbs.redditmedia.com/Qh2D7nIgv6_soOijT4gS13I3Rih13-HXafRqIoTaMyQ.jpg,Portland driver at center of viral protest video says he just wanted to escape,https://www.oregonlive.com/portland/index.ssf/2018/10/portland_driver_at_center_of_v.html,all_ads,6,link,"{'enabled': False, 'images': [{'id': 'umQw5eI7z7LplAOD08RII4mXny_61ifladIgcIjSyXU', 'resolutions': [{'height': 81, 'url': 'https://external-preview.redd.it/Ve_6hWVXSiNIbO8X0XUR6jdngkyxvoi6S1d1Fb08Ng0.jpg?width=108&amp;crop=smart&amp;auto=webp&amp;s=88746d967a7eaae8ed2eb724e8cc44dfc66f928d', 'width': 108}, {'height': 162, 'url': 'https://external-preview.redd.it/Ve_6hWVXSiNIbO8X0XUR6jdngkyxvoi6S1d1Fb08Ng0.jpg?width=216&amp;crop=smart&amp;auto=webp&amp;s=af0d96d180d631ea39de7e9b402c5772497a0777', 'width': 216}, {'height': 240, 'url': 'https://external-preview.redd.it/Ve_6hWVXSiNIbO8X0XUR6jdngkyxvoi6S1d1Fb08Ng0.jpg?width=320&amp;crop=smart&amp;auto=webp&amp;s=84aa2ab66ce7245d70248bc0f5ddf21e0399376e', 'width': 320}], 'source': {'height': 360, 'url': 'https://external-preview.redd.it/Ve_6hWVXSiNIbO8X0XUR6jdngkyxvoi6S1d1Fb08Ng0.jpg?auto=webp&amp;s=72cac7c98881fd3213af69559d276fa5a02fea68', 'width': 480}, 'variants': {}}]}",105.0,140.0,local-news,Local News,,dark,,,,,
Old-Willapa,,[],,text,t2_4iu2ps6,False,False,1539430840,self.Portland,https://www.reddit.com/r/Portland/comments/9nt5g4/one_more_reason_to_take_a_cab/,"{'gid_1': 0, 'gid_2': 0, 'gid_3': 0}",9nt5g4,False,False,False,False,False,True,False,,[],dark,text,False,False,True,0,0,False,all_ads,/r/Portland/comments/9nt5g4/one_more_reason_to_take_a_cab/,False,6,1539430840,1,[removed],True,False,False,Portland,t5_2qi2i,106934,public,self,One more reason to take a cab,https://www.reddit.com/r/Portland/comments/9nt5g4/one_more_reason_to_take_a_cab/,all_ads,6,,,,,,,,,,,,,
Rhinoplug,,[],,text,t2_ewarmxo,False,False,1539427829,ajaisblog.com,https://www.reddit.com/r/Portland/comments/9nswnc/facebook_shuts_down_spammy_politics_pages/,"{'gid_1': 0, 'gid_2': 0, 'gid_3': 0}",9nswnc,False,False,False,False,False,False,False,,[],dark,text,False,False,True,0,0,False,all_ads,/r/Portland/comments/9nswnc/facebook_shuts_down_spammy_politics_pages/,False,6,1539427829,1,,True,False,False,Portland,t5_2qi2i,106934,public,default,Facebook shuts down 'spammy' politics pages,https://www.ajaisblog.com/facebook-shuts-down-spammy-politics-pages/,all_ads,6,,,,,,,,,,,,,
notablelaggard,,[],,text,t2_3mlco,False,False,1539425986,self.Portland,https://www.reddit.com/r/Portland/comments/9nsrso/trying_to_recall_the_name_of_the_grocery_store/,"{'gid_1': 0, 'gid_2': 0, 'gid_3': 0}",9nsrso,True,False,False,False,True,True,False,,[],dark,text,False,False,True,7,0,False,all_ads,/r/Portland/comments/9nsrso/trying_to_recall_the_name_of_the_grocery_store/,False,6,1539425987,1,"It was there through the 70's and 80's .. one word .. was used in the Burt Reynolds movie 'Breaking in' .. extremely popular grocery store in SE Portland on what is now MLK Blvd.
Thanks!!!",True,False,False,Portland,t5_2qi2i,106934,public,self,Trying to recall the name of the grocery store that used to be tucked down almost under the Morrison Bridge - E. bank.,https://www.reddit.com/r/Portland/comments/9nsrso/trying_to_recall_the_name_of_the_grocery_store/,all_ads,6,,,,,,,,,,,,,
turbinetemp,,[],,text,t2_1auwwxbs,False,False,1539418629,i.redd.it,https://www.reddit.com/r/Portland/comments/9ns8yy/tried_my_hand_at_astrophotography_tonight_hope/,"{'gid_1': 0, 'gid_2': 0, 'gid_3': 0}",9ns8yy,True,False,False,True,True,False,False,,[],dark,text,False,False,True,24,0,False,all_ads,/r/Portland/comments/9ns8yy/tried_my_hand_at_astrophotography_tonight_hope/,False,6,1539418629,1,,True,False,False,Portland,t5_2qi2i,106935,public,default,Tried my hand at astrophotography tonight. Hope you like it.,https://i.redd.it/6hx742zdwwr11.jpg,all_ads,6,,,,,photo,Photo,,,,,,,
qwerty_rocks,,[],,text,t2_1668a0,False,False,1539413520,self.Portland,https://www.reddit.com/r/Portland/comments/9nrupr/whats_the_most_efficient_way_to_get_banned_from/,"{'gid_1': 0, 'gid_2': 0, 'gid_3': 0}",9nrupr,True,False,False,False,True,True,False,,[],dark,text,False,False,True,2,0,False,all_ads,/r/Portland/comments/9nrupr/whats_the_most_efficient_way_to_get_banned_from/,False,6,1539413521,1,,True,False,False,Portland,t5_2qi2i,106925,public,self,What's the most efficient way to get banned from r/Portland ?,https://www.reddit.com/r/Portland/comments/9nrupr/whats_the_most_efficient_way_to_get_banned_from/,all_ads,6,,,,,,,,,,,,,
SayitlikeaBlood,,[],,text,t2_29ci6sow,False,False,1539411864,apnews.com,https://www.reddit.com/r/Portland/comments/9nrpt8/the_other_portland_takes_a_crack_at_air_bnb/,"{'gid_1': 0, 'gid_2': 0, 'gid_3': 0}",9nrpt8,True,False,False,False,True,False,False,,[],dark,text,False,False,True,0,0,False,all_ads,/r/Portland/comments/9nrpt8/the_other_portland_takes_a_crack_at_air_bnb/,False,6,1539411865,1,,True,False,False,Portland,t5_2qi2i,106923,public,default,The other Portland takes a crack at Air BNB limitations,http://www.apnews.com/4fc10162a4ee4a8f8a93407e318232f2,all_ads,6,,,,,,,,,,,,,
x_____________,,[],,text,t2_3x2nb,False,False,1539411390,liveleak.com,https://www.reddit.com/r/Portland/comments/9nroft/what_could_have_happened_to_the_portland/,"{'gid_1': 0, 'gid_2': 0, 'gid_3': 0}",9nroft,True,False,False,False,True,False,False,,[],dark,text,False,False,True,2,0,True,all_ads,/r/Portland/comments/9nroft/what_could_have_happened_to_the_portland/,False,6,1539411391,1,,True,False,False,Portland,t5_2qi2i,106923,public,nsfw,What could have happened to the Portland demonstrator who was shot in head with flash bang round by Portland Police if he was not wearing a helmet [NSFW],https://www.liveleak.com/view?t=uGk0V_1539379707,promo_adult_nsfw,3,,,,,,,,,,,,,
stumpfenheimer,,[],,text,t2_4l6kh,False,False,1539410003,self.Portland,https://www.reddit.com/r/Portland/comments/9nrk9c/swgoose_hollow_someone_stole_our_recycle_bin/,"{'gid_1': 0, 'gid_2': 0, 'gid_3': 0}",9nrk9c,True,False,False,False,True,True,False,,[],dark,text,False,False,True,27,0,False,all_ads,/r/Portland/comments/9nrk9c/swgoose_hollow_someone_stole_our_recycle_bin/,False,6,1539410005,1,"Hello friends, 
In true Portland fashion, a tweaker stole our recycle bin about 45 min ago. We called PPD and they said they’d look around. My husband and I watched him take it, went to follow him at a distance, and he vanished into thin air. If you see a lidless, blue, rolling recycle bin filled with boxes and bottles, please let me know! Thief was a white male, grey/blue polo t-shirt, about 5’10-6’0, brown shaggy hair. Thank you! ",True,False,False,Portland,t5_2qi2i,106921,public,self,SW/Goose Hollow: someone stole our recycle bin?????,https://www.reddit.com/r/Portland/comments/9nrk9c/swgoose_hollow_someone_stole_our_recycle_bin/,all_ads,6,,,,,,,,,,,,,
Jemmy_Time,,[],,text,t2_g3klcrw,False,False,1539409589,self.Portland,https://www.reddit.com/r/Portland/comments/9nriyh/any_affordable_small_towns_15k_youd_recommend_up/,"{'gid_1': 0, 'gid_2': 0, 'gid_3': 0}",9nriyh,True,False,False,False,True,True,False,,[],dark,text,False,False,True,25,0,False,all_ads,/r/Portland/comments/9nriyh/any_affordable_small_towns_15k_youd_recommend_up/,False,6,1539409589,1,"From a small town myself, I’m missing that feel. ",True,False,False,Portland,t5_2qi2i,106920,public,self,"Any affordable, small towns (&lt;15k) you’d recommend up to an hour out of the city?",https://www.reddit.com/r/Portland/comments/9nriyh/any_affordable_small_towns_15k_youd_recommend_up/,all_ads,6,,,,,,,,,,,,,
wzzzzrd,,[],Tigard,text,t2_hg1fm,False,False,1539407304,self.Portland,https://www.reddit.com/r/Portland/comments/9nrbnc/is_there_anywhere_i_can_take_my_girlfriend_to_pet/,"{'gid_1': 0, 'gid_2': 0, 'gid_3': 0}",9nrbnc,True,False,False,False,True,True,False,,[],dark,text,False,False,True,43,0,False,all_ads,/r/Portland/comments/9nrbnc/is_there_anywhere_i_can_take_my_girlfriend_to_pet/,False,6,1539407305,1,"Preferably next month for her birthday, she loves sheep.",True,False,False,Portland,t5_2qi2i,106919,public,self,Is there anywhere I can take my girlfriend to pet sheep?,https://www.reddit.com/r/Portland/comments/9nrbnc/is_there_anywhere_i_can_take_my_girlfriend_to_pet/,all_ads,6,,,,,,,,dark,,,,,
anythreewords,,[],,text,t2_1vwi2gho,False,False,1539407276,i.redd.it,https://www.reddit.com/r/Portland/comments/9nrbjn/heres_portland_looking_pretty_even_though_it_was/,"{'gid_1': 0, 'gid_2': 0, 'gid_3': 0}",9nrbjn,True,False,False,True,True,False,False,,[],dark,text,False,False,True,0,0,False,all_ads,/r/Portland/comments/9nrbjn/heres_portland_looking_pretty_even_though_it_was/,False,6,1539407278,1,,True,False,False,Portland,t5_2qi2i,106919,public,default,Here's Portland looking pretty even though it was a bit grey.,https://i.redd.it/o7sgu22iyvr11.jpg,all_ads,6,,,,,photo,Photo,,,,,,,
candidcio,,[],,text,t2_1g3hf,False,False,1539406099,i.redd.it,https://www.reddit.com/r/Portland/comments/9nr7tk/the_tilikum_crossing_is_my_favorite_portland/,"{'gid_1': 0, 'gid_2': 0, 'gid_3': 0}",9nr7tk,True,False,False,True,True,False,False,,[],dark,text,False,False,True,12,0,False,all_ads,/r/Portland/comments/9nr7tk/the_tilikum_crossing_is_my_favorite_portland/,False,6,1539406101,1,,True,False,False,Portland,t5_2qi2i,106917,public,default,"The Tilikum Crossing is my favorite Portland bridge, especially at night.",https://i.redd.it/aq074m26vvr11.jpg,all_ads,6,,,,,photo,Photo,,,,,,,
tweedleedeedee,,[],Pearl,text,t2_vh1jj,False,False,1539405341,self.Portland,https://www.reddit.com/r/Portland/comments/9nr5dl/bicyclecar_collision_on_naito_today/,"{'gid_1': 0, 'gid_2': 0, 'gid_3': 0}",9nr5dl,True,False,False,False,True,True,False,,[],dark,text,False,False,True,5,0,False,all_ads,/r/Portland/comments/9nr5dl/bicyclecar_collision_on_naito_today/,False,6,1539405343,1,"Just wondering if anyone else witnessed this and knows what ended up happening.  
  
I was driving south on Naito around (I think) 5:30pm today, and right as we were crossing under the Broadway Bridge there was a car coming out of that parking lot under the bridge, turning right/north onto Naito, and the car slammed into a passing cyclist. It happened right as we were going by so by the time we stopped a few seconds later, there were already a couple other cars and cyclists stopping to help. The cyclist was on the ground and stayed down, but they were definitely moving. It looked and sounded so painful though.  
  
We decided to keep going since there were already several people on it, but I'm so curious if that person was ok. Anyone else know anything about this?",True,False,False,Portland,t5_2qi2i,106917,public,self,Bicycle/car collision on Naito today,https://www.reddit.com/r/Portland/comments/9nr5dl/bicyclecar_collision_on_naito_today/,all_ads,6,,,,,,,,dark,,,,,
FlamingBlankets,,[],,text,t2_r0qhs,False,False,1539402598,self.Portland,https://www.reddit.com/r/Portland/comments/9nqw0i/does_anyone_have_an_omsi_membership_whats_all/,"{'gid_1': 0, 'gid_2': 0, 'gid_3': 0}",9nqw0i,True,False,False,False,True,True,False,,[],dark,text,False,False,True,11,0,False,all_ads,/r/Portland/comments/9nqw0i/does_anyone_have_an_omsi_membership_whats_all/,False,6,1539402598,1,"We've been going to OMSI as a family a few times each year and I'm thinking it might be cheaper to just buy a membership but the website doesn't really provide a whole lot of details about what is discounted. It simply says ""discounts from souvenirs to sub tours"" but what's all included in that?  Is it a decent discount or something minuscule? 

And it also has ""290+ national museums"" listed as a perk. What does that mean exactly? I get the impression that it's a discount at 290+ museums but it doesn't say. ",True,False,False,Portland,t5_2qi2i,106916,public,self,Does anyone have an OMSI membership? What's all included exactly?,https://www.reddit.com/r/Portland/comments/9nqw0i/does_anyone_have_an_omsi_membership_whats_all/,all_ads,6,,,,,,,,,,,,,
gettymandylor,,[],,text,t2_153mfctn,False,False,1539401320,self.Portland,https://www.reddit.com/r/Portland/comments/9nqrlz/looking_to_liberal_small_town_in_oregon_any/,"{'gid_1': 0, 'gid_2': 0, 'gid_3': 0}",9nqrlz,True,False,False,False,True,True,False,,[],dark,text,False,False,True,0,0,False,all_ads,/r/Portland/comments/9nqrlz/looking_to_liberal_small_town_in_oregon_any/,False,6,1539401321,1,,True,False,False,Portland,t5_2qi2i,106916,public,self,"looking to liberal small town in Oregon. Any thoughts on Eugene, Hood River, Cannon Beach?",https://www.reddit.com/r/Portland/comments/9nqrlz/looking_to_liberal_small_town_in_oregon_any/,all_ads,6,,,,,,,,,,,,,
Bubbaox97,,[],,text,t2_fyn85,False,False,1539401006,self.Portland,https://www.reddit.com/r/Portland/comments/9nqqj2/where_can_i_buy_some_nigerian_clothing/,"{'gid_1': 0, 'gid_2': 0, 'gid_3': 0}",9nqqj2,True,False,False,False,True,True,False,,[],dark,text,False,False,True,13,0,False,all_ads,/r/Portland/comments/9nqqj2/where_can_i_buy_some_nigerian_clothing/,False,6,1539401007,1,My daughter has a counties of the world festival at school and she has chosen Nigeria. We are having some trouble finding clothes that would work though. Any help would be appreciated.,True,False,False,Portland,t5_2qi2i,106915,public,self,Where can I buy some Nigerian clothing?,https://www.reddit.com/r/Portland/comments/9nqqj2/where_can_i_buy_some_nigerian_clothing/,all_ads,6,,,,,,,,,,,,,
BeGayAndDoCrime,,[],Cedar Mill,text,t2_2bm4qn40,False,False,1539398920,i.imgur.com,https://www.reddit.com/r/Portland/comments/9nqj3l/hoyt_arboretum/,"{'gid_1': 0, 'gid_2': 0, 'gid_3': 0}",9nqj3l,True,False,False,False,True,False,False,,[],dark,text,False,False,True,14,0,False,all_ads,/r/Portland/comments/9nqj3l/hoyt_arboretum/,False,6,1539398921,1,,True,False,False,Portland,t5_2qi2i,106912,public,default,Hoyt Arboretum,https://i.imgur.com/sIW0yhO.jpg,all_ads,6,,,,,photo,Photo,,dark,c057cfb2-b3f1-11e1-a49a-12313b0c247a,,,,
ANONWANTSTENDIES,,[],,text,t2_z08tavf,False,False,1539397308,self.Portland,https://www.reddit.com/r/Portland/comments/9nqdba/proud_boys_are_back_at_it_again/,"{'gid_1': 0, 'gid_2': 0, 'gid_3': 0}",9nqdba,True,False,False,False,True,True,False,,[],dark,text,False,False,True,4,0,False,all_ads,/r/Portland/comments/9nqdba/proud_boys_are_back_at_it_again/,False,6,1539397309,1,"Warning: The Proud Boys have stated that they will be out and about Portland tomorrow, ""cleaning the streets"". They will most likely be targeting the homeless and minorities. Please stay safe.",True,False,False,Portland,t5_2qi2i,106911,public,self,Proud Boys are Back at it Again,https://www.reddit.com/r/Portland/comments/9nqdba/proud_boys_are_back_at_it_again/,all_ads,6,,,,,,,,,,,,,
chillgazer,,[],,text,t2_tswff,False,False,1539397240,i.redd.it,https://www.reddit.com/r/Portland/comments/9nqd2a/portlands_solution_for_urban_camping_put_a/,"{'gid_1': 0, 'gid_2': 0, 'gid_3': 0}",9nqd2a,True,False,False,True,True,False,False,,[],dark,text,False,False,True,350,0,False,all_ads,/r/Portland/comments/9nqd2a/portlands_solution_for_urban_camping_put_a/,False,6,1539397240,1,,True,False,False,Portland,t5_2qi2i,106910,public,default,Portland’s solution for urban camping: Put a boulder on it!,https://i.redd.it/p39hyu5g4vr11.jpg,all_ads,6,,,,,,,,,,,,,
jaco1001,,[],,text,t2_6j079,False,False,1539394687,sos.oregon.gov,https://www.reddit.com/r/Portland/comments/9nq3k1/there_is_only_four_more_days_to_register_to_vote/,"{'gid_1': 0, 'gid_2': 0, 'gid_3': 0}",9nq3k1,True,False,False,False,True,False,False,,[],dark,text,False,False,True,22,0,False,all_ads,/r/Portland/comments/9nq3k1/there_is_only_four_more_days_to_register_to_vote/,False,6,1539394689,1,,True,False,False,Portland,t5_2qi2i,106911,public,default,There is only FOUR MORE days to register to vote in Oregon! You can register and check that your information is up to date here.,https://sos.oregon.gov/voting/Pages/registration.aspx?lang=en,all_ads,6,,,,,,,,,,,,,
mommytravels,,[],,text,t2_e8jix,False,False,1539391417,edensexpeditions.com,https://www.reddit.com/r/Portland/comments/9npqx9/the_portland_brunch_experience_6_must_try_places/,"{'gid_1': 0, 'gid_2': 0, 'gid_3': 0}",9npqx9,False,False,False,False,False,False,False,,[],dark,text,False,False,True,0,0,False,all_ads,/r/Portland/comments/9npqx9/the_portland_brunch_experience_6_must_try_places/,False,6,1539391417,1,,True,False,False,Portland,t5_2qi2i,106907,public,default,The Portland Brunch Experience - 6 must try places,http://edensexpeditions.com/2018/10/12/the-portland-brunch-experience/,all_ads,6,,,,,,,,,,,,,
