author,author_flair_background_color,author_flair_css_class,author_flair_richtext,author_flair_template_id,author_flair_text,author_flair_text_color,author_flair_type,author_fullname,author_patreon_flair,can_mod_post,contest_mode,created_utc,domain,full_link,gildings,id,is_crosspostable,is_meta,is_original_content,is_reddit_media_domain,is_robot_indexable,is_self,is_video,link_flair_background_color,link_flair_richtext,link_flair_text_color,link_flair_type,locked,media_only,no_follow,num_comments,num_crossposts,over_18,parent_whitelist_status,permalink,pinned,pwls,retrieved_on,score,selftext,send_replies,spoiler,stickied,subreddit,subreddit_id,subreddit_subscribers,subreddit_type,thumbnail,title,updated_utc,url,whitelist_status,wls,post_hint,preview,link_flair_css_class,link_flair_text,thumbnail_height,thumbnail_width
agentmantis,,,[],,,,text,t2_i0phs,False,False,False,1555609008,self.Portland,https://www.reddit.com/r/Portland/comments/beodtk/selling_a_vehicle_in_oregon/,"{'gid_1': 0, 'gid_2': 0, 'gid_3': 0}",beodtk,True,False,False,False,True,True,False,,[],dark,text,False,False,True,22,0,False,all_ads,/r/Portland/comments/beodtk/selling_a_vehicle_in_oregon/,False,6,1555609027,26,"PSA - if you're selling a vehicle in Oregon or anywhere really, take the license plates off the vehicle and obtain a legal and correctly filled out bill of sale. Then, turn in the bill of sale to the DMV when you report the vehicle sold. Just calling the DMV and reporting the car sold isn't enough. 

The law in Oregon doesn't do much to protect the seller if the car you sold is towed away and the tow yards come after you. Also, if you don't take the plates, you can be held liable for parking tickets and photo radar tickets. 

A car I sold in 2015 was towed earlier this year. Retriever Towing was the company and they were successful in making me pay for this vehicle to keep me out of collections. This was the advice given to me by an attorney. So just a warning to others and hopefully this message will help someone.",True,False,False,Portland,t5_2qi2i,123804,public,self,Selling a vehicle in Oregon?,1555695394,https://www.reddit.com/r/Portland/comments/beodtk/selling_a_vehicle_in_oregon/,all_ads,6,,,,,,
OccupyJourney,,,[],,,,text,t2_dlypi,False,False,False,1555609003,i.redd.it,https://www.reddit.com/r/Portland/comments/beodsk/wait_what_happened_to/,"{'gid_1': 0, 'gid_2': 0, 'gid_3': 0}",beodsk,False,False,False,True,False,False,False,,[],dark,text,False,False,True,0,0,False,all_ads,/r/Portland/comments/beodsk/wait_what_happened_to/,False,6,1555609024,1,,True,False,False,Portland,t5_2qi2i,123804,public,https://b.thumbs.redditmedia.com/IZ6cpJJ4_9WgeUGN2vDuhtWyo-LqtDt80I9hu5AuSyI.jpg,"Wait, what happened to: https://www.apnews.com/3964861076af417a9734bfc4aa1eefdd My rights are being violated, aren’t they??? Anyone want to help or is Portland homeless advocates going to abandon another person???",1555695394,https://i.redd.it/7ejet58q62t21.jpg,all_ads,6,image,"{'enabled': True, 'images': [{'id': 'fHjWCZdLE9-SQsKQEJgIMS7Bwc6mR0PXnDUb5jozQTE', 'resolutions': [{'height': 81, 'url': 'https://preview.redd.it/7ejet58q62t21.jpg?width=108&amp;crop=smart&amp;auto=webp&amp;s=e2e1d83318714a6b3684ac98319df689ccb1bf3c', 'width': 108}, {'height': 162, 'url': 'https://preview.redd.it/7ejet58q62t21.jpg?width=216&amp;crop=smart&amp;auto=webp&amp;s=42b33ebe1a5b8e77019d979ba5734418ff32044c', 'width': 216}, {'height': 240, 'url': 'https://preview.redd.it/7ejet58q62t21.jpg?width=320&amp;crop=smart&amp;auto=webp&amp;s=469bdbf9897fc91de552cbb48099d78da2668d1d', 'width': 320}, {'height': 480, 'url': 'https://preview.redd.it/7ejet58q62t21.jpg?width=640&amp;crop=smart&amp;auto=webp&amp;s=b76afbd7d536ea76212b129e126e0da7292d6158', 'width': 640}, {'height': 720, 'url': 'https://preview.redd.it/7ejet58q62t21.jpg?width=960&amp;crop=smart&amp;auto=webp&amp;s=34e0b900d523331b2f84a220689a5ea1460103c2', 'width': 960}, {'height': 810, 'url': 'https://preview.redd.it/7ejet58q62t21.jpg?width=1080&amp;crop=smart&amp;auto=webp&amp;s=7d9d3d92813610491045b62b4935841c7df30c6e', 'width': 1080}], 'source': {'height': 1500, 'url': 'https://preview.redd.it/7ejet58q62t21.jpg?auto=webp&amp;s=e0783b7aee53130d891d3ab7a7a9419efdd8c2d2', 'width': 2000}, 'variants': {}}]}",,,105.0,140.0
yummy_elephants,,,[],,,,text,t2_lonyv,False,False,False,1555608730,self.Portland,https://www.reddit.com/r/Portland/comments/beobz6/family_hair_cuts_on_lombard/,"{'gid_1': 0, 'gid_2': 0, 'gid_3': 0}",beobz6,True,False,False,False,True,True,False,,[],dark,text,False,False,True,2,0,False,all_ads,/r/Portland/comments/beobz6/family_hair_cuts_on_lombard/,False,6,1555608732,6,"Has anyone gotten a haircut or seen the Vietnamese lady who works at the hair cut place on Lombard recently? I went last Saturday 15 mins before she opens because I know she gets busy on the weekends. I waited for an hour and she never showed up. Then just this morning, my housemate went to get a haircut but she wasn’t there again. Not sure if she’s just late again or if she’s out of town or something else. Does anyone know if she’s around or seen her since last Saturday?",True,False,False,Portland,t5_2qi2i,123803,public,self,Family Hair Cuts on Lombard,1555695114,https://www.reddit.com/r/Portland/comments/beobz6/family_hair_cuts_on_lombard/,all_ads,6,,,,,,
TearGasForeignPolicy,,,[],,,,text,t2_2ofqdp4i,False,False,False,1555608719,npr.org,https://www.reddit.com/r/Portland/comments/beobwk/oregon_courts_should_follow_new_yorks_lead_no_ice/,"{'gid_1': 0, 'gid_2': 0, 'gid_3': 0}",beobwk,True,False,False,False,True,False,False,,[],dark,text,False,False,True,12,0,False,all_ads,/r/Portland/comments/beobwk/oregon_courts_should_follow_new_yorks_lead_no_ice/,False,6,1555608720,3,,True,False,False,Portland,t5_2qi2i,123803,public,https://b.thumbs.redditmedia.com/dwTNNoeEKTVLe2auv-HcK4PqLAAsooxkUPxKMfSTFrg.jpg,Oregon courts should follow New York's lead: no ICE arrests in courthouses without judicial warrants,1555695103,https://www.npr.org/2019/04/17/714496186/new-york-courts-tell-ice-not-to-arrest-immigrants-in-courthouses-without-warrant,all_ads,6,link,"{'enabled': False, 'images': [{'id': 's1CwPe9pi06xALtJANaPM9PWyIQ76YjmsIJbrq2L6tY', 'resolutions': [{'height': 60, 'url': 'https://external-preview.redd.it/wn2GHDSCzGi0dZBMpXHwS4bD-Om3zITeNHpdzESLjuA.jpg?width=108&amp;crop=smart&amp;auto=webp&amp;s=a0495035c90a1fab5245bda58bef8401adf6d0a5', 'width': 108}, {'height': 121, 'url': 'https://external-preview.redd.it/wn2GHDSCzGi0dZBMpXHwS4bD-Om3zITeNHpdzESLjuA.jpg?width=216&amp;crop=smart&amp;auto=webp&amp;s=8859ba626c056b01d7653251685e48e316a05b11', 'width': 216}, {'height': 179, 'url': 'https://external-preview.redd.it/wn2GHDSCzGi0dZBMpXHwS4bD-Om3zITeNHpdzESLjuA.jpg?width=320&amp;crop=smart&amp;auto=webp&amp;s=37fb840ec5bef85b896d61dfbf21ea216612c389', 'width': 320}, {'height': 359, 'url': 'https://external-preview.redd.it/wn2GHDSCzGi0dZBMpXHwS4bD-Om3zITeNHpdzESLjuA.jpg?width=640&amp;crop=smart&amp;auto=webp&amp;s=18a2f20163dca04a9702c9c0b6ee483741053d04', 'width': 640}, {'height': 539, 'url': 'https://external-preview.redd.it/wn2GHDSCzGi0dZBMpXHwS4bD-Om3zITeNHpdzESLjuA.jpg?width=960&amp;crop=smart&amp;auto=webp&amp;s=f75b22c87a310c87c1d34b4ab4bd3425bf48af9b', 'width': 960}, {'height': 607, 'url': 'https://external-preview.redd.it/wn2GHDSCzGi0dZBMpXHwS4bD-Om3zITeNHpdzESLjuA.jpg?width=1080&amp;crop=smart&amp;auto=webp&amp;s=490f93b146f19668acc4b60a1398e75aebc9113a', 'width': 1080}], 'source': {'height': 787, 'url': 'https://external-preview.redd.it/wn2GHDSCzGi0dZBMpXHwS4bD-Om3zITeNHpdzESLjuA.jpg?auto=webp&amp;s=a06d0399571f39fabb2cb16df6f6eea59b1459fd', 'width': 1400}, 'variants': {}}]}",,,78.0,140.0
portlandpete,,,[],,,,text,t2_f2ige,False,False,False,1555607168,i.redd.it,https://www.reddit.com/r/Portland/comments/beo11j/anyone_missing_a_bike_north_end_south_waterfront/,"{'gid_1': 0, 'gid_2': 0, 'gid_3': 0}",beo11j,True,False,False,True,True,False,False,,[],dark,text,False,False,True,4,0,False,all_ads,/r/Portland/comments/beo11j/anyone_missing_a_bike_north_end_south_waterfront/,False,6,1555607170,0,,True,False,False,Portland,t5_2qi2i,123802,public,default,"Anyone missing a bike? North End, South Waterfront Park.",1555693550,https://i.redd.it/jqwpgz1812t21.jpg,all_ads,6,,,photo,Photo,,
xvrlpz,,,[],,,,text,t2_1thg5atj,False,False,False,1555606926,i.redd.it,https://www.reddit.com/r/Portland/comments/benzah/co_worker_lost_dog_in_northeast_portland_near/,"{'gid_1': 0, 'gid_2': 0, 'gid_3': 0}",benzah,True,False,False,True,True,False,False,,[],dark,text,False,False,True,10,0,False,all_ads,/r/Portland/comments/benzah/co_worker_lost_dog_in_northeast_portland_near/,False,6,1555606928,106,,True,False,False,Portland,t5_2qi2i,123802,public,https://b.thumbs.redditmedia.com/VETa3K_iArC86F6u5seDHbay3EC6Q5Wt37wy1U7zvrk.jpg,"Co worker Lost dog in Northeast Portland (Near killingsworth and 55th). Super friendly, food motivated loves people.",1555693317,https://i.redd.it/nfavyfwj02t21.jpg,all_ads,6,image,"{'enabled': True, 'images': [{'id': '5oWbruKJstuGJjL0X6XM5kZXdoD4gvTmgURYAlKhH1k', 'resolutions': [{'height': 108, 'url': 'https://preview.redd.it/nfavyfwj02t21.jpg?width=108&amp;crop=smart&amp;auto=webp&amp;s=1fcc102e711dc28f0449d8ab83db42f4292f1112', 'width': 108}, {'height': 216, 'url': 'https://preview.redd.it/nfavyfwj02t21.jpg?width=216&amp;crop=smart&amp;auto=webp&amp;s=b20b2f6e3aefcc62f438ef96aaa081bcaedd0265', 'width': 216}, {'height': 320, 'url': 'https://preview.redd.it/nfavyfwj02t21.jpg?width=320&amp;crop=smart&amp;auto=webp&amp;s=e730e2be477787d8e2475d89b9edaf971f02f9a9', 'width': 320}, {'height': 640, 'url': 'https://preview.redd.it/nfavyfwj02t21.jpg?width=640&amp;crop=smart&amp;auto=webp&amp;s=5fca83db67c9b7bfe8ce4ef1b4dd439ec65b2306', 'width': 640}], 'source': {'height': 750, 'url': 'https://preview.redd.it/nfavyfwj02t21.jpg?auto=webp&amp;s=9e707bd11fc702d76d47a5fc8358cf8c58889aff', 'width': 750}, 'variants': {}}]}",photo,Photo,140.0,140.0
ShadowPDX,,,[],,,,text,t2_1148j4,False,False,False,1555605799,self.Portland,https://www.reddit.com/r/Portland/comments/benrdm/why_all_the_contrails_in_the_sky/,"{'gid_1': 0, 'gid_2': 0, 'gid_3': 0}",benrdm,True,False,False,False,True,True,False,,[],dark,text,False,False,True,28,0,False,all_ads,/r/Portland/comments/benrdm/why_all_the_contrails_in_the_sky/,False,6,1555605801,0,Has anyone noticed an uptick in the contrails in the sky going north? Every time I check the planes live app they all seem to be from California to Seattle and Vancouver. Has this always been the norm or is there something I’m missing?,True,False,False,Portland,t5_2qi2i,123802,public,self,Why all the contrails in the sky?,1555692187,https://www.reddit.com/r/Portland/comments/benrdm/why_all_the_contrails_in_the_sky/,all_ads,6,,,,,,
myconoid,,,[],,Montavilla,dark,text,t2_5yrk5,False,False,False,1555605761,twitter.com,https://www.reddit.com/r/Portland/comments/benr4e/portland_pd_is_so_nice_to_motorcycle_thieves/,"{'gid_1': 0, 'gid_2': 0, 'gid_3': 0}",benr4e,True,False,False,False,True,False,False,,[],dark,text,False,False,True,25,0,False,all_ads,/r/Portland/comments/benr4e/portland_pd_is_so_nice_to_motorcycle_thieves/,False,6,1555605763,4,,True,False,False,Portland,t5_2qi2i,123802,public,default,Portland PD is so nice to motorcycle thieves!,1555692152,https://twitter.com/ppbeast/status/1118796958024343552?s=21,all_ads,6,,,,,,
conorthearchitect,,,[],62071770-4276-11e1-946d-12313b08a511,Buckman,dark,text,t2_gfjcgss,False,False,False,1555605603,self.Portland,https://www.reddit.com/r/Portland/comments/benpyl/tattoo_artist_recommendations/,"{'gid_1': 0, 'gid_2': 0, 'gid_3': 0}",benpyl,True,False,False,False,True,True,False,,[],dark,text,False,False,True,8,0,False,all_ads,/r/Portland/comments/benpyl/tattoo_artist_recommendations/,False,6,1555605604,0,"I'm looking for someone with good straight line work, someone that could do something along the lines of an architectural sketch/drawing. 

I'm fully aware Google is a thing, but I'd love to give people a chance to shout out their friends and favorites that might not be listed or featured on the ol' googs.",True,False,False,Portland,t5_2qi2i,123802,public,self,Tattoo artist recommendations?,1555692020,https://www.reddit.com/r/Portland/comments/benpyl/tattoo_artist_recommendations/,all_ads,6,,,,,,
thottybegoney421,,,[],,,,text,t2_2y91dflu,False,False,False,1555604307,self.Portland,https://www.reddit.com/r/Portland/comments/bengzj/cant_believe_what_happened_on_my_california_road/,"{'gid_1': 0, 'gid_2': 0, 'gid_3': 0}",bengzj,True,False,False,False,True,True,False,,[],dark,text,False,False,True,16,0,False,all_ads,/r/Portland/comments/bengzj/cant_believe_what_happened_on_my_california_road/,False,6,1555604309,0,"So we recently drove down to California for a couple weeks, and all I have to say is things sure have changed in the last 5 years. What is it with the whole Oregon vs. California thing? I was told multiple times: to ""Go back to Oregon"", ""California is full"", ""Oregonians need to stay in Oregon"", ""Drive like you are in California idiot"", etc, etc.  This has never happened to me when I've been down there in the past, why all of a sudden are we getting hate? Also, I noticed at my company (I work for a multi-national corporation with an office in Portland), alot of new hires we get that originate from California, they either keep to themselves, or only socialize with other transplants.",True,False,False,Portland,t5_2qi2i,123800,public,self,Can't believe what happened on my California road trip LOL,1555690688,https://www.reddit.com/r/Portland/comments/bengzj/cant_believe_what_happened_on_my_california_road/,all_ads,6,,,,,,
Walker90R,,,[],,,,text,t2_1700cbkd,False,False,False,1555603917,self.Portland,https://www.reddit.com/r/Portland/comments/bene8s/book_on_the_dada_movement_at_gruner/,"{'gid_1': 0, 'gid_2': 0, 'gid_3': 0}",bene8s,True,False,False,False,True,True,False,,[],dark,text,False,False,True,4,0,False,all_ads,/r/Portland/comments/bene8s/book_on_the_dada_movement_at_gruner/,False,6,1555603919,0,"I once passed through Portland and had a meal at a restaurant called Gruner (with an umlaut, of course) and at the time (this was years ago) they delivered the check as a book mark in a small book on the Dada movement. Do the locals here know what this book is titled as? I don't actually know if they used copies of the same book for each table, so it is sort of a long shot. As I understand it, the restaurant closed some time ago so that too might make this a difficult ask. The name escapes me so I thought I might get some help from the community.",True,False,False,Portland,t5_2qi2i,123798,public,self,Book on the dada movement at Gruner,1555690304,https://www.reddit.com/r/Portland/comments/bene8s/book_on_the_dada_movement_at_gruner/,all_ads,6,,,,,,
guaschino94,,,[],,,,text,t2_1ed7k28,False,False,False,1555603549,self.Portland,https://www.reddit.com/r/Portland/comments/benbn8/taking_a_trip_over_to_you_guys_at_the_beginning/,"{'gid_1': 0, 'gid_2': 0, 'gid_3': 0}",benbn8,True,False,False,False,True,True,False,,[],dark,text,False,False,True,5,0,False,all_ads,/r/Portland/comments/benbn8/taking_a_trip_over_to_you_guys_at_the_beginning/,False,6,1555603550,0,,True,False,False,Portland,t5_2qi2i,123797,public,self,Taking a trip over to you guys at the beginning of May. What’s some fun stuff to do over there besides eat and drink?,1555689933,https://www.reddit.com/r/Portland/comments/benbn8/taking_a_trip_over_to_you_guys_at_the_beginning/,all_ads,6,,,,,,
