all_awardings,author,author_flair_css_class,author_flair_richtext,author_flair_text,author_flair_type,author_fullname,author_patreon_flair,can_mod_post,contest_mode,created_utc,domain,full_link,gildings,id,is_crosspostable,is_meta,is_original_content,is_reddit_media_domain,is_robot_indexable,is_self,is_video,link_flair_background_color,link_flair_richtext,link_flair_text_color,link_flair_type,locked,media_only,no_follow,num_comments,num_crossposts,over_18,parent_whitelist_status,permalink,pinned,pwls,retrieved_on,score,selftext,send_replies,spoiler,stickied,subreddit,subreddit_id,subreddit_subscribers,subreddit_type,thumbnail,title,total_awards_received,updated_utc,url,whitelist_status,wls,link_flair_css_class,link_flair_text,author_flair_background_color,author_flair_template_id,author_flair_text_color,post_hint,preview,thumbnail_height,thumbnail_width,media,media_embed,secure_media,secure_media_embed,suggested_sort
[],CyaDudes,,[],,text,t2_171xjr,False,False,False,1556914797,i.redd.it,https://www.reddit.com/r/Portland/comments/bkczq6/about_damascus/,{},bkczq6,True,False,False,True,True,False,False,,[],dark,text,False,False,True,1,0,False,all_ads,/r/Portland/comments/bkczq6/about_damascus/,False,6,1556914798,4,,True,False,False,Portland,t5_2qi2i,124923,public,https://b.thumbs.redditmedia.com/oNtjz7GZZ1GMpR48YaE48cCfylivI4ETzsVchKL6JtY.jpg,About Damascus,0,1557514047,https://i.redd.it/7w8zwrti12w21.jpg,all_ads,6,photo,Photo,,,,image,"{'enabled': True, 'images': [{'id': 'g-xpu19CntLyeWLLWBQ1VYnJIRcigsMwJD-nOU09y7w', 'resolutions': [{'height': 89, 'url': 'https://preview.redd.it/7w8zwrti12w21.jpg?width=108&amp;crop=smart&amp;auto=webp&amp;s=ca6883cc43b0ec6b94636161d2fd4786c7864560', 'width': 108}, {'height': 179, 'url': 'https://preview.redd.it/7w8zwrti12w21.jpg?width=216&amp;crop=smart&amp;auto=webp&amp;s=fc92379bb23a8baa7317c9377ba0a822c9e88ea5', 'width': 216}, {'height': 265, 'url': 'https://preview.redd.it/7w8zwrti12w21.jpg?width=320&amp;crop=smart&amp;auto=webp&amp;s=f40917187721b2f91f867bc24e78bb7bc2b77e1c', 'width': 320}, {'height': 531, 'url': 'https://preview.redd.it/7w8zwrti12w21.jpg?width=640&amp;crop=smart&amp;auto=webp&amp;s=b12cea066f1c4834c7f650fc6d91ca0ce412493c', 'width': 640}, {'height': 797, 'url': 'https://preview.redd.it/7w8zwrti12w21.jpg?width=960&amp;crop=smart&amp;auto=webp&amp;s=1e90e8f3ac86f8392b25a176de930a915c449375', 'width': 960}, {'height': 896, 'url': 'https://preview.redd.it/7w8zwrti12w21.jpg?width=1080&amp;crop=smart&amp;auto=webp&amp;s=f82de14364639b55bee087846c8f43e752693752', 'width': 1080}], 'source': {'height': 1645, 'url': 'https://preview.redd.it/7w8zwrti12w21.jpg?auto=webp&amp;s=33a6951b244ecc05f99e03d404c512710df90ac7', 'width': 1981}, 'variants': {}}]}",116.0,140.0,,,,,
[],surveyquestionaire,,[],,text,t2_3pk13eag,False,False,False,1556914137,self.Portland,https://www.reddit.com/r/Portland/comments/bkcvgk/quick_survey_for_a_student_project/,{},bkcvgk,True,False,False,False,True,True,False,,[],dark,text,False,False,True,0,0,False,all_ads,/r/Portland/comments/bkcvgk/quick_survey_for_a_student_project/,False,6,1556914138,1,"Hey all, I was looking to get some random people from the Portland area to answer this 13 question survey surrounding air pollution/quality to represent why this social issue has importance for research.  
I am looking for a few submissions to show a pool of perspectives and people's thoughts on air pollution/quality and if some people see it as a big issue compared to others!  


[Survey](https://docs.google.com/forms/d/e/1FAIpQLSfpB5ByTubCmDX2fvGQxu6Zi8-xhJcuFHBV2W85LDEGq6X-kA/viewform?usp=sf_link)  


Thanks so much.",True,False,False,Portland,t5_2qi2i,124922,public,self,Quick survey for a student project!,0,1557513986,https://www.reddit.com/r/Portland/comments/bkcvgk/quick_survey_for_a_student_project/,all_ads,6,,,,,,,,,,,,,,
[],CRBedrock,,[],,text,t2_11hcf2,False,False,False,1556912986,self.Portland,https://www.reddit.com/r/Portland/comments/bkcnvv/multnomah_county_animal_services_sent_me_to/,{},bkcnvv,True,False,False,False,True,True,False,,[],dark,text,False,False,True,41,0,False,all_ads,/r/Portland/comments/bkcnvv/multnomah_county_animal_services_sent_me_to/,False,6,1556912987,37,"Hey everyone - 

I lurk pretty hard in this subreddit, and never had reason to post, but this seemed like the kind of thing that might be informative. 

I have two cats. Both registered with Multnomah County. Per the rules, you have to pay 25 dollars every three years and update vaccine info - which is no problem. Registration requires an address, two phone numbers, and an email - and both my wife and I are registered on the account. 

When we moved across town in April of 2017, we changed our address as required on their website - but they don’t send you any kind of confirmation that this has in fact happened. 

Yesterday I received two letters from a collection agency trying to collect $200 in penalties from not having my cats registered in a timely manner.

I called animal services and was told this was no longer their problem as the debt had been sold. I also found out our address had not been updated. The county made no attempt to contact my wife and I at either phone number or email address, and can provide no record of when notifications of the debt/lack of registration was sent to the old address. 

I called the collections company and disputed the charge. 

What is crazy about all of this (other than the sheer ineptitude) is that the county would use a collections agency to collect any debt, much less one of such dubious origin. 

Any constructive suggestions about who to complain to about this? It seems like terrible policy (and poorly executed to boot). Further, I would think Multnomah County would have pretty robust infrastructure for collecting civil penalties, and wouldn’t farm out contracts to a collections agency. 

I would also be interested if anyone else has had a similar experience - thanks!",True,False,False,Portland,t5_2qi2i,124922,public,self,Multnomah County Animal Services sent me to collections,0,1557513295,https://www.reddit.com/r/Portland/comments/bkcnvv/multnomah_county_animal_services_sent_me_to/,all_ads,6,,,,,,,,,,,,,,
[],scoooooooooooooot,,[],,text,t2_3nvw0y57,False,False,False,1556912973,koin.com,https://www.reddit.com/r/Portland/comments/bkcnso/sources_whos_to_blame_for_gentrification/,{},bkcnso,True,False,False,False,True,False,False,,[],dark,text,False,False,True,41,0,False,all_ads,/r/Portland/comments/bkcnso/sources_whos_to_blame_for_gentrification/,False,6,1556912975,0,,True,False,False,Portland,t5_2qi2i,124922,public,default,Sources: Who's to blame for gentrification?,0,1557513294,https://www.koin.com/news/local/multnomah-county/sources-who-s-to-blame-for-gentrification-/1972864764,all_ads,6,local-news,Local News,,,,,,,,,,,,
[],Joshuadbonner,,[],,text,t2_ks7zs,False,False,False,1556909725,self.Portland,https://www.reddit.com/r/Portland/comments/bkc27h/whatre_they_setting_up_for_on_the_waterfront/,{},bkc27h,True,False,False,False,True,True,False,,[],dark,text,False,False,True,7,0,False,all_ads,/r/Portland/comments/bkc27h/whatre_they_setting_up_for_on_the_waterfront/,False,6,1556909726,0,,True,False,False,Portland,t5_2qi2i,124921,public,self,Whatre they setting up for on the waterfront? Looks like a Carnival of sorts?,0,1557512699,https://www.reddit.com/r/Portland/comments/bkc27h/whatre_they_setting_up_for_on_the_waterfront/,all_ads,6,,,,,,,,,,,,,,
[],guanaco55,,[],Regional Gallowboob,text,t2_hyfa9,False,False,False,1556909449,expo.oregonlive.com,https://www.reddit.com/r/Portland/comments/bkc0da/10_iconic_wildflower_hikes_in_the_columbia_river/,{},bkc0da,True,False,False,False,True,False,False,,[],dark,text,False,False,True,6,0,False,all_ads,/r/Portland/comments/bkc0da/10_iconic_wildflower_hikes_in_the_columbia_river/,False,6,1556909450,2,,True,False,False,Portland,t5_2qi2i,124921,public,default,10 iconic wildflower hikes in the Columbia River Gorge,0,1557512672,https://expo.oregonlive.com/life-and-culture/g66l-2019/05/131dc93842329/10-iconic-wildflower-hikes-in-the-columbia-river-gorge.html,all_ads,6,,,,,dark,,,,,,,,,
[],ahnonamis,,[],Tualatin,text,t2_2fnfk,False,False,False,1556909306,self.Portland,https://www.reddit.com/r/Portland/comments/bkbze2/psa_tomorrow_may_4_is_free_comic_book_day/,{},bkbze2,True,False,False,False,True,True,False,,[],dark,text,False,False,True,0,0,False,all_ads,/r/Portland/comments/bkbze2/psa_tomorrow_may_4_is_free_comic_book_day/,False,6,1556909307,41,"It will be nice and sunny out, so why not walk around visiting some of your local comic shops participating in FCBD! 

You can find a list of participating stores at https://www.freecomicbookday.com/StoreLocator 

(And if your closest shop isn't participating, don't take it out on them, because stores DO have to pay for the free comics still, and not every store has the luxury of being able to do that!)",False,False,False,Portland,t5_2qi2i,124921,public,self,PSA: Tomorrow (May 4) is Free Comic Book Day,0,1557512657,https://www.reddit.com/r/Portland/comments/bkbze2/psa_tomorrow_may_4_is_free_comic_book_day/,all_ads,6,,,,,dark,,,,,,,,,
[],slingshotrobot,,[],,text,t2_behpvgp,False,False,False,1556908960,imgur.com,https://www.reddit.com/r/Portland/comments/bkbx2h/rogue_released_a_may_day_beer/,{},bkbx2h,True,False,False,False,True,False,False,,[],dark,text,False,False,True,15,0,False,all_ads,/r/Portland/comments/bkbx2h/rogue_released_a_may_day_beer/,False,6,1556908961,17,,False,False,False,Portland,t5_2qi2i,124921,public,default,Rogue released a May Day Beer,0,1557512624,https://imgur.com/a/XwR43u5,all_ads,6,,,,,,,,,,,,,,
[],OregonTripleBeam,,[],,text,t2_10k39a,False,False,False,1556906789,theskanner.com,https://www.reddit.com/r/Portland/comments/bkbilj/oregon_lawmakers_continue_to_weigh_the_benefits/,{},bkbilj,True,False,False,False,True,False,False,,[],dark,text,False,False,True,9,0,False,all_ads,/r/Portland/comments/bkbilj/oregon_lawmakers_continue_to_weigh_the_benefits/,False,6,1556906791,20,,True,False,False,Portland,t5_2qi2i,124917,public,default,Oregon lawmakers continue to weigh the benefits of shipping the state’s famed cannabis products out of state,0,1557512419,https://www.theskanner.com/news/northwest/28471-oregon-lawmakers-consider-exporting-cannabis-surplus,all_ads,6,,,,,,,,,,,,,,
[],bigblackcloud,,[],Fosterp Owl,text,t2_a0w9t,False,False,False,1556905554,bikeportland.org,https://www.reddit.com/r/Portland/comments/bkbad4/oregons_idaho_stop_bill_faces_headwinds_in_senate/,{},bkbad4,True,False,False,False,True,False,False,,[],dark,text,False,False,True,46,0,False,all_ads,/r/Portland/comments/bkbad4/oregons_idaho_stop_bill_faces_headwinds_in_senate/,False,6,1556905555,23,,True,False,False,Portland,t5_2qi2i,124916,public,default,Oregon’s ‘Idaho Stop’ bill faces headwinds in Senate,0,1557512012,https://bikeportland.org/2019/05/03/oregons-idaho-stop-bill-faces-headwinds-in-senate-299217,all_ads,6,,,,,dark,,,,,,,,,
[],itstoolatefororanges,,[],Downtown,text,t2_28two8dm,False,False,False,1556902883,i.redd.it,https://www.reddit.com/r/Portland/comments/bkas7z/theres_a_place_in_sisters_or_where_you_can_soak/,{},bkas7z,True,False,False,True,True,False,False,,[],dark,text,False,False,True,50,0,False,all_ads,/r/Portland/comments/bkas7z/theres_a_place_in_sisters_or_where_you_can_soak/,False,6,1556902884,77,,True,False,False,Portland,t5_2qi2i,124913,public,default,"There’s a place in Sisters, OR where you can soak in beer while drinking beer. How’s your Friday going so far?",0,1557511465,https://i.redd.it/fcfxbejz11w21.jpg,all_ads,6,photo,Photo,,eabbbf0e-42ca-11e1-a863-12313b08a511,dark,,,,,,,,,
[],silva42,,[],N,text,t2_c402,False,False,False,1556902045,wired.com,https://www.reddit.com/r/Portland/comments/bkamk1/portland_is_again_blazing_trails_for_open/,{},bkamk1,True,False,False,False,True,False,False,,[],dark,text,False,False,True,2,0,False,all_ads,/r/Portland/comments/bkamk1/portland_is_again_blazing_trails_for_open/,False,6,1556902046,23,,True,False,False,Portland,t5_2qi2i,124913,public,https://b.thumbs.redditmedia.com/7go4xQRS5ieRtWg7rS9WUNIC7R-in7VJtZHIdVWKIbQ.jpg,Portland Is Again Blazing Trails for Open Internet Access,0,1557511381,https://www.wired.com/story/portland-again-blazing-trails-open-internet-access/,all_ads,6,,,,16eec5ca-4254-11e1-b8eb-12313b08a511,dark,link,"{'enabled': False, 'images': [{'id': '8VRS2S3nSKOq4nals4Om9IEDJoRlyaZh8-Y1YiQwLW4', 'resolutions': [{'height': 56, 'url': 'https://external-preview.redd.it/IvpfSUf8nZN5j4qGPksIOkJWM52dlJajwMLl3UtRJuw.jpg?width=108&amp;crop=smart&amp;auto=webp&amp;s=62133790cb4dcb56caef727c1e6eb9466815a2fc', 'width': 108}, {'height': 113, 'url': 'https://external-preview.redd.it/IvpfSUf8nZN5j4qGPksIOkJWM52dlJajwMLl3UtRJuw.jpg?width=216&amp;crop=smart&amp;auto=webp&amp;s=660fa642f911d6c13158d54284122763b73bdd4f', 'width': 216}, {'height': 167, 'url': 'https://external-preview.redd.it/IvpfSUf8nZN5j4qGPksIOkJWM52dlJajwMLl3UtRJuw.jpg?width=320&amp;crop=smart&amp;auto=webp&amp;s=73a2e5cfc8c8780990df162ec327789539f91e84', 'width': 320}, {'height': 334, 'url': 'https://external-preview.redd.it/IvpfSUf8nZN5j4qGPksIOkJWM52dlJajwMLl3UtRJuw.jpg?width=640&amp;crop=smart&amp;auto=webp&amp;s=4125951e7d84aab695d21b7c46e40a4cfc40ebb0', 'width': 640}, {'height': 502, 'url': 'https://external-preview.redd.it/IvpfSUf8nZN5j4qGPksIOkJWM52dlJajwMLl3UtRJuw.jpg?width=960&amp;crop=smart&amp;auto=webp&amp;s=96c4e9ac1f23484f7384488fb976ce47062b8e79', 'width': 960}, {'height': 565, 'url': 'https://external-preview.redd.it/IvpfSUf8nZN5j4qGPksIOkJWM52dlJajwMLl3UtRJuw.jpg?width=1080&amp;crop=smart&amp;auto=webp&amp;s=ce772a90021730bb7a92356acce91fa2593d6059', 'width': 1080}], 'source': {'height': 785, 'url': 'https://external-preview.redd.it/IvpfSUf8nZN5j4qGPksIOkJWM52dlJajwMLl3UtRJuw.jpg?auto=webp&amp;s=bb87c5b5171a0e95164923d4637dfe1d7165b6ad', 'width': 1500}, 'variants': {}}]}",73.0,140.0,,,,,
[],toothjones,,[],,text,t2_16uxr4,False,False,False,1556901650,self.Portland,https://www.reddit.com/r/Portland/comments/bkajx2/best_things_is_portland_to_see_for_early_20s/,{},bkajx2,True,False,False,False,True,True,False,,[],dark,text,False,False,True,3,0,False,all_ads,/r/Portland/comments/bkajx2/best_things_is_portland_to_see_for_early_20s/,False,6,1556901652,1,In town for about 3 or 4 nights. Hit me with you best!,True,False,False,Portland,t5_2qi2i,124913,public,self,Best things is portland to see for early 20s Aussie Travellers!,0,1557511344,https://www.reddit.com/r/Portland/comments/bkajx2/best_things_is_portland_to_see_for_early_20s/,all_ads,6,,,,,,,,,,,,,,
[],mfiasco,,[],,text,t2_abk6y,False,False,False,1556901366,self.Portland,https://www.reddit.com/r/Portland/comments/bkai43/to_the_suv_driver_on_cesar_chavez_who_almost_side/,{},bkai43,True,False,False,False,True,True,False,,[],dark,text,False,False,True,74,0,False,all_ads,/r/Portland/comments/bkai43/to_the_suv_driver_on_cesar_chavez_who_almost_side/,False,6,1556901367,238,"THANK YOU for being so cool. I try not to get super mad at people on the road because everyone makes mistakes, and I myself have almost missed seeing someone on a motorcycle before merging. But it is scary as fuck to almost be knocked into oncoming traffic, and my tiny stupid horn does little to convey that terror. I thought for a minute you were gonna be a jerk about it. But then you got to the stop sign and leaned out your window to sincerely apologize. And dude, you made my day. It’s way easier to be rude to someone on the road than to say something kind. I’ve almost been hit dozens of times and not once has anyone said something like that. Thank you for taking responsibility. It made me feel safer knowing that a close call like that might actually make another driver more vigilant in the future. I hope you had a great day.",True,False,False,Portland,t5_2qi2i,124913,public,self,To the SUV driver on Cesar Chavez who almost side swiped me into traffic on my scooter yesterday afternoon:,0,1557511319,https://www.reddit.com/r/Portland/comments/bkai43/to_the_suv_driver_on_cesar_chavez_who_almost_side/,all_ads,6,,,,,,,,,,,,,,
[],slingshotrobot,,[],,text,t2_behpvgp,False,False,False,1556901345,coldwatersafety.org,https://www.reddit.com/r/Portland/comments/bkahz7/psa_it_might_be_warm_but_the_willamette_is_at_54/,{},bkahz7,True,False,False,False,True,False,False,,[],dark,text,False,False,True,0,0,False,all_ads,/r/Portland/comments/bkahz7/psa_it_might_be_warm_but_the_willamette_is_at_54/,False,6,1556901346,1,,False,False,False,Portland,t5_2qi2i,124913,public,default,PSA: It might be warm but the Willamette is at 54 degrees right now. Swimming in water at this temperature is very dangerous and immediately Life-threatening.,0,1557511317,http://www.coldwatersafety.org/WhatIsCold.html,all_ads,6,,,,,,,,,,,,,,
[],robotrichard1,,[],,text,t2_3pidwycg,False,False,False,1556896477,i.redd.it,https://www.reddit.com/r/Portland/comments/bk9ln2/keep_portland_shitty/,{},bk9ln2,False,False,False,True,False,False,False,,[],dark,text,False,False,True,0,0,False,all_ads,/r/Portland/comments/bk9ln2/keep_portland_shitty/,False,6,1556896479,1,,True,False,False,Portland,t5_2qi2i,124904,public,default,Keep Portland Shitty,0,1557510275,https://i.redd.it/nv5pz1k1j0w21.jpg,all_ads,6,,,,,,,,,,,,,,
[],onlydacoolest,,[],,text,t2_hfuny,False,False,False,1556894769,self.Portland,https://www.reddit.com/r/Portland/comments/bk9ahx/pine_state_biscuits_on_nw_23rd_and_savier_opens/,{},bk9ahx,True,False,False,False,True,True,False,,[],dark,text,False,False,True,0,0,False,all_ads,/r/Portland/comments/bk9ahx/pine_state_biscuits_on_nw_23rd_and_savier_opens/,False,6,1556894770,1,I work next door at The Barbers and we’ve been waiting not so patiently for this!,True,False,False,Portland,t5_2qi2i,124905,public,self,Pine State biscuits on NW 23rd and Savier opens today!,0,1557510111,https://www.reddit.com/r/Portland/comments/bk9ahx/pine_state_biscuits_on_nw_23rd_and_savier_opens/,all_ads,6,,,,,,,,,,,,,,
[],guanaco55,,[],Regional Gallowboob,text,t2_hyfa9,False,False,False,1556893468,oregonlive.com,https://www.reddit.com/r/Portland/comments/bk926z/newberg_entrepreneur_and_philanthropist_ken/,{},bk926z,True,False,False,False,True,False,False,,[],dark,text,False,False,True,2,0,False,all_ads,/r/Portland/comments/bk926z/newberg_entrepreneur_and_philanthropist_ken/,False,6,1556893469,5,,True,False,False,Portland,t5_2qi2i,124904,public,default,"Newberg entrepreneur and philanthropist Ken Austin dies -- Innovator and entrepreneur of dental devices, Austin was also open about his struggle with alcoholism and became a beacon for others seeking hope.",0,1557509906,https://www.oregonlive.com/business/2019/05/newberg-entrepreneur-and-philanthropist-ken-austin-dies.html,all_ads,6,local-news,Local News,,,dark,,,,,,,,,
[],AutoModerator,,[],24 Hour Church of Elvis,text,t2_6l4z3,False,False,False,1556892516,self.Portland,https://www.reddit.com/r/Portland/comments/bk8wbq/dear_portland_may_03_2019_weekly_rave_thread/,{},bk8wbq,True,False,False,False,True,True,False,,[],dark,text,False,False,True,51,0,False,all_ads,/r/Portland/comments/bk8wbq/dear_portland_may_03_2019_weekly_rave_thread/,False,6,1556892518,17,"What made you smile this week--tell us about it! what are you looking forward to this weekend? what's making you happy?

Caps lock off, downvotes never, go forth and be happy!",False,False,False,Portland,t5_2qi2i,124905,public,self,"dear portland: May 03, 2019 weekly rave thread",0,1557508673,https://www.reddit.com/r/Portland/comments/bk8wbq/dear_portland_may_03_2019_weekly_rave_thread/,all_ads,6,custom,Weekly Rave,,,dark,,,,,,,,,
[],guanaco55,,[],Regional Gallowboob,text,t2_hyfa9,False,False,False,1556890632,oregonlive.com,https://www.reddit.com/r/Portland/comments/bk8l39/trimet_bus_driver_rescues_dog_taken_by_stranger/,{},bk8l39,True,False,False,False,True,False,False,,[],dark,text,False,False,True,4,0,False,all_ads,/r/Portland/comments/bk8l39/trimet_bus_driver_rescues_dog_taken_by_stranger/,False,6,1556890635,18,,True,False,False,Portland,t5_2qi2i,124905,public,https://b.thumbs.redditmedia.com/89Y6WBu26woBXZNkSmcl_yT0I-hz4NguPxnd5tUBwzk.jpg,TriMet bus driver rescues dog taken by stranger,0,1557506335,https://www.oregonlive.com/news/2019/05/trimet-bus-driver-rescues-dog-taken-by-stranger.html,all_ads,6,local-news,Local News,,,dark,link,"{'enabled': False, 'images': [{'id': 'yw5Lw72R9BoIpEuHVFh7nSxtnCTkT2ytFQBspQeIV4A', 'resolutions': [{'height': 60, 'url': 'https://external-preview.redd.it/KZRZvbKhxiPe0MRccBELcmGzlfncrw_LYSMHqbcPCG8.jpg?width=108&amp;crop=smart&amp;auto=webp&amp;s=ecf6833340b41c5fabce862287b6432954f85963', 'width': 108}, {'height': 121, 'url': 'https://external-preview.redd.it/KZRZvbKhxiPe0MRccBELcmGzlfncrw_LYSMHqbcPCG8.jpg?width=216&amp;crop=smart&amp;auto=webp&amp;s=f4c4b2f3ce4fa4fffd150e143150e9882a6fdb31', 'width': 216}, {'height': 180, 'url': 'https://external-preview.redd.it/KZRZvbKhxiPe0MRccBELcmGzlfncrw_LYSMHqbcPCG8.jpg?width=320&amp;crop=smart&amp;auto=webp&amp;s=4d4cda4b471675807ab703253190073b9c23b983', 'width': 320}, {'height': 360, 'url': 'https://external-preview.redd.it/KZRZvbKhxiPe0MRccBELcmGzlfncrw_LYSMHqbcPCG8.jpg?width=640&amp;crop=smart&amp;auto=webp&amp;s=7fa0126d94f5104920afa59af4997550df36d6a8', 'width': 640}, {'height': 540, 'url': 'https://external-preview.redd.it/KZRZvbKhxiPe0MRccBELcmGzlfncrw_LYSMHqbcPCG8.jpg?width=960&amp;crop=smart&amp;auto=webp&amp;s=26090aca689d0288ef9911321d51dedf522e2022', 'width': 960}, {'height': 607, 'url': 'https://external-preview.redd.it/KZRZvbKhxiPe0MRccBELcmGzlfncrw_LYSMHqbcPCG8.jpg?width=1080&amp;crop=smart&amp;auto=webp&amp;s=3f9473c9c81a044f29577c137389901225c1c870', 'width': 1080}], 'source': {'height': 675, 'url': 'https://external-preview.redd.it/KZRZvbKhxiPe0MRccBELcmGzlfncrw_LYSMHqbcPCG8.jpg?auto=webp&amp;s=17dfbdba67c820747fc08b1cacb0ebfa18add2b4', 'width': 1200}, 'variants': {}}]}",78.0,140.0,,,,,
[],PDX_Stan,,[],,text,t2_ejfyx,False,False,False,1556883650,i.redd.it,https://www.reddit.com/r/Portland/comments/bk7grq/one_last_correction/,{},bk7grq,True,False,False,True,True,False,False,,[],dark,text,False,False,True,12,0,False,all_ads,/r/Portland/comments/bk7grq/one_last_correction/,False,6,1556883651,36,,True,False,False,Portland,t5_2qi2i,124907,public,default,One last correction,0,1557497912,https://i.redd.it/gf0iqt7rgzv21.jpg,all_ads,6,,,,,,,,,,,,,,
[],thismoustacheisonlyt,,[],,text,t2_fh7c1,False,False,False,1556881913,self.Portland,https://www.reddit.com/r/Portland/comments/bk77vk/do_you_or_a_neighbor_have_a_curbside/,{},bk77vk,True,False,False,False,True,True,False,,[],dark,text,False,False,True,7,0,False,all_ads,/r/Portland/comments/bk77vk/do_you_or_a_neighbor_have_a_curbside/,False,6,1556881914,6,"I have no driveway so I have to bring my bins up stairs to store them in my backyard. I’d like to build something curbside that looks nice to hide them away. 

Is this allowed by city code? I googled and found nothing. 

Do you or a neighbor have something like this? Can you post a picture?",True,False,False,Portland,t5_2qi2i,124905,public,self,Do you or a neighbor have a curbside garbage/recycling bin storage hut/cove/shed thing? Is this allowed?,0,1557496070,https://www.reddit.com/r/Portland/comments/bk77vk/do_you_or_a_neighbor_have_a_curbside/,all_ads,6,,,,,,,,,,,,,,
[],akamttsmth,,[],,text,t2_1v0fbaq4,False,False,False,1556873336,self.Portland,https://www.reddit.com/r/Portland/comments/bk66xo/haunted_places/,{},bk66xo,True,False,False,False,True,True,False,,[],dark,text,False,False,True,7,0,False,all_ads,/r/Portland/comments/bk66xo/haunted_places/,False,6,1556873337,0,Me and my friend are staying pretty close to OSHU on a vacation and we were wondering if there are any cool haunted places that most people dont know about oe are just fun to visit?,True,False,False,Portland,t5_2qi2i,124900,public,self,Haunted places?,0,1557488367,https://www.reddit.com/r/Portland/comments/bk66xo/haunted_places/,all_ads,6,,,,,,,,,,,,,,
[],lemonjelllo,,[],,text,t2_y34u3,False,False,False,1556869171,imgur.com,https://www.reddit.com/r/Portland/comments/bk5rip/walked_past_this_scene_today_in_cathedral_park/,{},bk5rip,True,False,False,False,True,False,False,,[],dark,text,False,False,True,1,0,False,all_ads,/r/Portland/comments/bk5rip/walked_past_this_scene_today_in_cathedral_park/,False,6,1556869172,0,,True,False,False,Portland,t5_2qi2i,124900,public,default,Walked past this scene today in Cathedral Park. What the hell is going on here?,0,1557485148,https://imgur.com/a/E2JcnXc,all_ads,6,photo,Photo,,,,,,,,,,,,
[],funbuddle,,[],dickbutt,text,t2_962bef3,False,False,False,1556867298,self.Portland,https://www.reddit.com/r/Portland/comments/bk5jzv/portland_is_overpriced_trash/,{},bk5jzv,True,False,False,False,True,True,False,,[],dark,text,False,False,True,31,0,False,all_ads,/r/Portland/comments/bk5jzv/portland_is_overpriced_trash/,False,6,1556867299,0,"Portland has so many things that is trash yet costs too much. 

* Four pieces of bacon in a cruddy bar with a bathroom that would make a rat gag: $5

One baked potato with Fred Meyer brand sour cream in a 15ftx15ft restaurant that feels the need to use discarded wood as tables: $4

Parking in what is basically a dirt lot now with poorly done asphalt on top: Frankly costs anything depending if you have more money than sense

I find so much to criticize in Portland yet nothing to praise. Portland kinds sucks.",True,False,False,Portland,t5_2qi2i,124901,public,self,Portland is overpriced trash,0,1557483563,https://www.reddit.com/r/Portland/comments/bk5jzv/portland_is_overpriced_trash/,all_ads,6,,,,b3283754-e038-11e7-a873-0e0bf97c88d8,dark,,,,,,,,,
