author,author_created_utc,author_flair_css_class,author_flair_text,author_fullname,created_utc,domain,edited,full_link,gilded,id,is_self,link_flair_css_class,link_flair_text,locked,media_embed,num_comments,over_18,permalink,retrieved_on,score,secure_media_embed,selftext,stickied,subreddit,subreddit_id,thumbnail,title,url,post_hint,preview,media,secure_media,distinguished
ZnaeW,1430457933.0,,,t2_n84wb,1466535803,self.Portland,,https://www.reddit.com/r/Portland/comments/4p6bme/my_experience_in_portland_from_a_south_american/,0,4p6bme,True,local-news,Local News,False,{},125,False,/r/Portland/comments/4p6bme/my_experience_in_portland_from_a_south_american/,1472798452,407,{},"Hello everyone, two weeks ago I left Portland and was a really great experience. I went to Pycon, an event about the computing lenguage Python, and I had many days off to explore the city and the people :). 

I can resume my view of Portland in two short stories:

I was taking the bus to my hostal from Hollywood Center, the 75 one, everything was normal, also when a old lady boarded the bus at the Cesar Chavez avenue. She was walking with a medical walker, with some gifts. Someone noticed she was a trans woman and him asked to she for who are the gifts. ""For my nephews"" she told to him. And he said ""Not are you shamed for your condition have nephews?"". So he started to harass verbally the old lady, until a builder and another lady stopped him. They supported the old lady, and more people on the bus did the same. So the guy had to get off the bus. The builder and the lady started to chat about life, nephews and other topics. When people had to get off the bus, they appreciated the gesture to others and the old lady. Was really sensitive one moment.

Theres so many homeless in Portland and a lot of them are very aggressive. Seriously. I'm from Chile, we have a lot of homeless people too, but they aren't physically aggressive if you don't have money to them. I was in a hostel near to Providence Park and I had to miss one or two because they tried to stole my cap. And no was only with me, also was with the local people. Especially with kids, three or four time I saw homeless trying to steal food from them :/. I really like to take some photos and I had to miss some spots because I didn't feel secure at the night. Was weird, because almost all the people of Portland was really nice, with very good manners. The worst moment I had with homeless were at the Waterfront Park, I were with my friends taking some photos of the bridges and one started to yelling us like 5 minutes. Insulting us about everything, how we were dressed, our faces, everything. He tried to take my camera, was really awkward.

Portland was a really good experience, it's a really great city with awesome people. It haves little problems like every city, but I was amazed mostly for the people. They have so good manners, it's amazing and felt to be one more of them. Maybe, because I'm kinda weird here in Chile. Thank you if read my two stories, sorry If I had really bad grammar or syntax. I hope to comeback soon :).",False,Portland,t5_2qi2i,self,"My experience in Portland, from a south american",https://www.reddit.com/r/Portland/comments/4p6bme/my_experience_in_portland_from_a_south_american/,,,,,
[deleted],,,,,1466535011,m.imgur.com,,https://www.reddit.com/r/Portland/comments/4p68zv/anyone_know_the_story_behind_this_guy_seen/,0,4p68zv,False,photo,Photo,False,{},16,False,/r/Portland/comments/4p68zv/anyone_know_the_story_behind_this_guy_seen/,1472798414,0,{},[deleted],False,Portland,t5_2qi2i,default,Anyone know the story behind this guy seen constantly in SE with safety gear and a small box on a cart.,http://m.imgur.com/j3hu8an,,,,,
[deleted],,,,,1466533629,self.Portland,,https://www.reddit.com/r/Portland/comments/4p64jy/psa_the_mods_are_bypassing_their_own_transparency/,0,4p64jy,True,,,False,{},10,False,/r/Portland/comments/4p64jy/psa_the_mods_are_bypassing_their_own_transparency/,1472798352,0,{},[deleted],False,Portland,t5_2qi2i,default,"PSA: The mods are bypassing their own transparency rules, filtering content without notifying OP or subscribers.",https://www.reddit.com/r/Portland/comments/4p64jy/psa_the_mods_are_bypassing_their_own_transparency/,,,,,
MaNiFeX,1336758465.0,,Multnomah,t2_7p2wy,1466533571,nytimes.com,,https://www.reddit.com/r/Portland/comments/4p64cd/we_should_take_a_cue_from_albuquerque/,0,4p64cd,False,non-local-news,Outside News,False,{},33,False,/r/Portland/comments/4p64cd/we_should_take_a_cue_from_albuquerque/,1472798349,8,{},,False,Portland,t5_2qi2i,http://b.thumbs.redditmedia.com/9RrmyUm-XK9k9pFFj00rc0ikEVZDud9DXjxp2NeN4Ic.jpg,We should take a cue from Albuquerque.,http://www.nytimes.com/2015/12/08/us/albuquerque-revising-approach-toward-the-homeless-offers-them-jobs.html?_r=2,link,"{'images': [{'id': 'gVG5Mvxn3nv6DniltTI2qKCyTeB3BY6a2J4D2-d5bEY', 'resolutions': [{'height': 56, 'url': 'https://i.redditmedia.com/yI-6OaV1IZkepki62V8UubZI5_0Y4e8fM4okZSvJNrA.jpg?fit=crop&amp;crop=faces%2Centropy&amp;arh=2&amp;w=108&amp;s=2d1952dba1408834155c8dfc497202e6', 'width': 108}, {'height': 113, 'url': 'https://i.redditmedia.com/yI-6OaV1IZkepki62V8UubZI5_0Y4e8fM4okZSvJNrA.jpg?fit=crop&amp;crop=faces%2Centropy&amp;arh=2&amp;w=216&amp;s=6d204420d86a1ec74c292d968220f3c6', 'width': 216}, {'height': 167, 'url': 'https://i.redditmedia.com/yI-6OaV1IZkepki62V8UubZI5_0Y4e8fM4okZSvJNrA.jpg?fit=crop&amp;crop=faces%2Centropy&amp;arh=2&amp;w=320&amp;s=2e7ac7dfce816b4b4ffc82b3258b172f', 'width': 320}, {'height': 335, 'url': 'https://i.redditmedia.com/yI-6OaV1IZkepki62V8UubZI5_0Y4e8fM4okZSvJNrA.jpg?fit=crop&amp;crop=faces%2Centropy&amp;arh=2&amp;w=640&amp;s=153d571365caf0353d2b3b3b9b5adabc', 'width': 640}, {'height': 502, 'url': 'https://i.redditmedia.com/yI-6OaV1IZkepki62V8UubZI5_0Y4e8fM4okZSvJNrA.jpg?fit=crop&amp;crop=faces%2Centropy&amp;arh=2&amp;w=960&amp;s=2c63eee314b6d4c4cbb75dcc80294532', 'width': 960}], 'source': {'height': 550, 'url': 'https://i.redditmedia.com/yI-6OaV1IZkepki62V8UubZI5_0Y4e8fM4okZSvJNrA.jpg?s=7929dab2fc98f7b93fd6eaff1f99190b', 'width': 1050}, 'variants': {}}]}",,,
argyleecho,1369430621.0,,SE,t2_bsnq0,1466533011,img.ccrd.clearchannel.com,,https://www.reddit.com/r/Portland/comments/4p62j3/map_of_parking_meters_to_be_installed_beginning/,0,4p62j3,False,local-news,Local News,False,{},9,False,/r/Portland/comments/4p62j3/map_of_parking_meters_to_be_installed_beginning/,1472798323,24,{},,False,Portland,t5_2qi2i,http://b.thumbs.redditmedia.com/M-4lwo0HdAZKBNInfJCwIzINbWIbcBb9PYWNv6nwh2s.jpg,Map of parking meters to be installed beginning today in Central Eastside. According to article they're the same machines that were installed in NW earlier this year.,http://img.ccrd.clearchannel.com/media/mlib/610/2016/06/default/map_for_eastside_parking_meter_0_1466517560.jpg,image,"{'images': [{'id': 'atTL1u57k87S9m8m12DhUcSrTRDPaoLl8yJ-SRpKpOo', 'resolutions': [{'height': 166, 'url': 'https://i.redditmedia.com/QfhFM2_KIYzBo3_WqT4FuNzVORIn7CCul3oCrkXhfaE.jpg?fit=crop&amp;crop=faces%2Centropy&amp;arh=2&amp;w=108&amp;s=f997726de59404e8da57521d506ad8fe', 'width': 108}, {'height': 333, 'url': 'https://i.redditmedia.com/QfhFM2_KIYzBo3_WqT4FuNzVORIn7CCul3oCrkXhfaE.jpg?fit=crop&amp;crop=faces%2Centropy&amp;arh=2&amp;w=216&amp;s=d1e60429bef611b867accf345e8d2612', 'width': 216}, {'height': 494, 'url': 'https://i.redditmedia.com/QfhFM2_KIYzBo3_WqT4FuNzVORIn7CCul3oCrkXhfaE.jpg?fit=crop&amp;crop=faces%2Centropy&amp;arh=2&amp;w=320&amp;s=11792954104da05da1f0f5dd8093300f', 'width': 320}], 'source': {'height': 911, 'url': 'https://i.redditmedia.com/QfhFM2_KIYzBo3_WqT4FuNzVORIn7CCul3oCrkXhfaE.jpg?s=b776eca251b652b6581e43e42baa9483', 'width': 590}, 'variants': {}}]}",,,
theripper17,1409346328.0,,,t2_i41ez,1466532458,self.Portland,,https://www.reddit.com/r/Portland/comments/4p60su/startup_seeking_conference_room/,0,4p60su,True,classifieds,Classifieds,False,{},7,False,/r/Portland/comments/4p60su/startup_seeking_conference_room/,1472798300,0,{},"Hi everyone,

We're a broke startup in search of a free or relatively inexpensive space for all day meetings. Ideally the space would be near the airport but I know I can't be too picky.

Any thoughts? Thanks in advance",False,Portland,t5_2qi2i,self,Startup Seeking Conference Room,https://www.reddit.com/r/Portland/comments/4p60su/startup_seeking_conference_room/,,,,,
[deleted],,,,,1466531841,reddit.com,,https://www.reddit.com/r/Portland/comments/4p5yr7/head_mod_mia_again_rportland_still_a_bunch_of_spam/,0,4p5yr7,False,,,False,{},5,False,/r/Portland/comments/4p5yr7/head_mod_mia_again_rportland_still_a_bunch_of_spam/,1472798271,0,{},,False,Portland,t5_2qi2i,default,"Head mod MIA again, r/Portland still a bunch of spam.",https://www.reddit.com/r/Portland/comments/4of7id/state_of_the_sub/d4cp813,,,,,
Red_Zeppelin,1337096002.0,,,t2_7q5bk,1466528852,imgur.com,,https://www.reddit.com/r/Portland/comments/4p5ov2/were_you_riding_your_motorcycle_on_logie/,0,4p5ov2,False,photo,Photo,False,"{'content': '&lt;iframe class=""embedly-embed"" src=""//cdn.embedly.com/widgets/media.html?src=%2F%2Fimgur.com%2Fa%2Fq90dA%2Fembed&amp;url=http%3A%2F%2Fimgur.com%2Fa%2Fq90dA&amp;image=http%3A%2F%2Fi.imgur.com%2F0vEh9iq.jpg%3Ffb&amp;key=2aa3c4d5f3de4f5b9120b660ad850dc9&amp;type=text%2Fhtml&amp;schema=imgur"" width=""550"" height=""550"" scrolling=""no"" frameborder=""0"" allowfullscreen&gt;&lt;/iframe&gt;', 'height': 550, 'scrolling': False, 'width': 550}",15,False,/r/Portland/comments/4p5ov2/were_you_riding_your_motorcycle_on_logie/,1472798132,39,"{'content': '&lt;iframe class=""embedly-embed"" src=""https://cdn.embedly.com/widgets/media.html?src=%2F%2Fimgur.com%2Fa%2Fq90dA%2Fembed&amp;url=http%3A%2F%2Fimgur.com%2Fa%2Fq90dA&amp;image=http%3A%2F%2Fi.imgur.com%2F0vEh9iq.jpg%3Ffb&amp;key=2aa3c4d5f3de4f5b9120b660ad850dc9&amp;type=text%2Fhtml&amp;schema=imgur"" width=""550"" height=""550"" scrolling=""no"" frameborder=""0"" allowfullscreen&gt;&lt;/iframe&gt;', 'height': 550, 'scrolling': False, 'width': 550}",,False,Portland,t5_2qi2i,http://b.thumbs.redditmedia.com/gsOLjiGUxzf6R6voIRzV-eX-ZK1eaWoM-ctthyReqGg.jpg,Were you riding your motorcycle on Logie Trail/Rocky Point Rd last night? (+extras),http://imgur.com/a/q90dA,link,"{'images': [{'id': 'Xw7Pi69lA5OuhLqlLv9xFF5kHX2QTrZBJ1wUwArr3PU', 'resolutions': [{'height': 60, 'url': 'https://i.redditmedia.com/7z7Nrm-lMfMpNNCc-55jQhYcZbbCWu1ZX0m3PAx2PUk.jpg?fit=crop&amp;crop=faces%2Centropy&amp;arh=2&amp;w=108&amp;s=55ed6daab5d42dddc7ca0f74f63456b3', 'width': 108}, {'height': 121, 'url': 'https://i.redditmedia.com/7z7Nrm-lMfMpNNCc-55jQhYcZbbCWu1ZX0m3PAx2PUk.jpg?fit=crop&amp;crop=faces%2Centropy&amp;arh=2&amp;w=216&amp;s=1c85635befd6925c4843ee548a0a8cd1', 'width': 216}, {'height': 180, 'url': 'https://i.redditmedia.com/7z7Nrm-lMfMpNNCc-55jQhYcZbbCWu1ZX0m3PAx2PUk.jpg?fit=crop&amp;crop=faces%2Centropy&amp;arh=2&amp;w=320&amp;s=c3676713532e2fbe00c93145e659682d', 'width': 320}, {'height': 360, 'url': 'https://i.redditmedia.com/7z7Nrm-lMfMpNNCc-55jQhYcZbbCWu1ZX0m3PAx2PUk.jpg?fit=crop&amp;crop=faces%2Centropy&amp;arh=2&amp;w=640&amp;s=c54e36911383277aaac1e175c0b7ee73', 'width': 640}, {'height': 540, 'url': 'https://i.redditmedia.com/7z7Nrm-lMfMpNNCc-55jQhYcZbbCWu1ZX0m3PAx2PUk.jpg?fit=crop&amp;crop=faces%2Centropy&amp;arh=2&amp;w=960&amp;s=7dfc89f9e8aa128915ad11f08ed583b6', 'width': 960}, {'height': 607, 'url': 'https://i.redditmedia.com/7z7Nrm-lMfMpNNCc-55jQhYcZbbCWu1ZX0m3PAx2PUk.jpg?fit=crop&amp;crop=faces%2Centropy&amp;arh=2&amp;w=1080&amp;s=791403556bf5c4384eaa05af5183cd27', 'width': 1080}], 'source': {'height': 1688, 'url': 'https://i.redditmedia.com/7z7Nrm-lMfMpNNCc-55jQhYcZbbCWu1ZX0m3PAx2PUk.jpg?s=99eb817fc6134c355fca92708049bff9', 'width': 3000}, 'variants': {}}]}","{'oembed': {'description': 'Imgur: The most awesome images on the Internet.', 'height': 550, 'html': '&lt;iframe class=""embedly-embed"" src=""//cdn.embedly.com/widgets/media.html?src=%2F%2Fimgur.com%2Fa%2Fq90dA%2Fembed&amp;url=http%3A%2F%2Fimgur.com%2Fa%2Fq90dA&amp;image=http%3A%2F%2Fi.imgur.com%2F0vEh9iq.jpg%3Ffb&amp;key=2aa3c4d5f3de4f5b9120b660ad850dc9&amp;type=text%2Fhtml&amp;schema=imgur"" width=""550"" height=""550"" scrolling=""no"" frameborder=""0"" allowfullscreen&gt;&lt;/iframe&gt;', 'provider_name': 'Imgur', 'provider_url': 'http://imgur.com', 'thumbnail_height': 315, 'thumbnail_url': 'http://i.imgur.com/0vEh9iq.jpg?fb', 'thumbnail_width': 600, 'title': 'Imgur: The most awesome images on the Internet', 'type': 'rich', 'version': '1.0', 'width': 550}, 'type': 'imgur.com'}","{'oembed': {'description': 'Imgur: The most awesome images on the Internet.', 'height': 550, 'html': '&lt;iframe class=""embedly-embed"" src=""https://cdn.embedly.com/widgets/media.html?src=%2F%2Fimgur.com%2Fa%2Fq90dA%2Fembed&amp;url=http%3A%2F%2Fimgur.com%2Fa%2Fq90dA&amp;image=http%3A%2F%2Fi.imgur.com%2F0vEh9iq.jpg%3Ffb&amp;key=2aa3c4d5f3de4f5b9120b660ad850dc9&amp;type=text%2Fhtml&amp;schema=imgur"" width=""550"" height=""550"" scrolling=""no"" frameborder=""0"" allowfullscreen&gt;&lt;/iframe&gt;', 'provider_name': 'Imgur', 'provider_url': 'http://imgur.com', 'thumbnail_height': 315, 'thumbnail_url': 'https://i.embed.ly/1/image?url=http%3A%2F%2Fi.imgur.com%2F0vEh9iq.jpg%3Ffb&amp;key=b1e305db91cf4aa5a86b732cc9fffceb', 'thumbnail_width': 600, 'title': 'Imgur: The most awesome images on the Internet', 'type': 'rich', 'version': '1.0', 'width': 550}, 'type': 'imgur.com'}",
schallplatte,1413477246.0,,S Tabor,t2_iw0ue,1466528085,timbers.com,,https://www.reddit.com/r/Portland/comments/4p5m8k/deal_alert_timbers_giving_away_50_off_vouchers/,0,4p5m8k,False,event,Events,False,{},9,False,/r/Portland/comments/4p5m8k/deal_alert_timbers_giving_away_50_off_vouchers/,1472798095,29,{},,False,Portland,t5_2qi2i,http://b.thumbs.redditmedia.com/UrmyzfwHf014m3t0zYsIkBSw6R0ncI517mSuiDkWqqg.jpg,Deal Alert: Timbers giving away 50% off vouchers for select Alaska Airline routes again.,http://www.timbers.com/AlaskaHalfOff,link,"{'images': [{'id': 'orjZL61dpFQKElIGc2DYMiuyMwJFibB-i8zdlbcmioo', 'resolutions': [{'height': 59, 'url': 'https://i.redditmedia.com/YpCLrDMcyFsS7XbTD9eXihDMtgRNk48Oi1Bze_cwmUM.jpg?fit=crop&amp;crop=faces%2Centropy&amp;arh=2&amp;w=108&amp;s=a91e153c5b486db257e39b748985ea8a', 'width': 108}, {'height': 118, 'url': 'https://i.redditmedia.com/YpCLrDMcyFsS7XbTD9eXihDMtgRNk48Oi1Bze_cwmUM.jpg?fit=crop&amp;crop=faces%2Centropy&amp;arh=2&amp;w=216&amp;s=20bffd38dd2e64e077f2d8cff9adca5a', 'width': 216}, {'height': 176, 'url': 'https://i.redditmedia.com/YpCLrDMcyFsS7XbTD9eXihDMtgRNk48Oi1Bze_cwmUM.jpg?fit=crop&amp;crop=faces%2Centropy&amp;arh=2&amp;w=320&amp;s=0aaf094ba2f68dbc46e824d1dc67a0ca', 'width': 320}, {'height': 352, 'url': 'https://i.redditmedia.com/YpCLrDMcyFsS7XbTD9eXihDMtgRNk48Oi1Bze_cwmUM.jpg?fit=crop&amp;crop=faces%2Centropy&amp;arh=2&amp;w=640&amp;s=960a825edc56c4e8f696f555336fb349', 'width': 640}], 'source': {'height': 396, 'url': 'https://i.redditmedia.com/YpCLrDMcyFsS7XbTD9eXihDMtgRNk48Oi1Bze_cwmUM.jpg?s=ee9c2168930b519ad6221a0bd522c9b8', 'width': 720}, 'variants': {}}]}",,,
CreepyMaleNurse,1337466795.0,,,t2_7rd9g,1466527467,self.Portland,,https://www.reddit.com/r/Portland/comments/4p5k5x/thinking_about_visiting_portland_in_august_for/,0,4p5k5x,True,,,False,{},1,False,/r/Portland/comments/4p5k5x/thinking_about_visiting_portland_in_august_for/,1472798065,1,{},[removed],False,Portland,t5_2qi2i,default,Thinking about visiting Portland in August for vacation,https://www.reddit.com/r/Portland/comments/4p5k5x/thinking_about_visiting_portland_in_august_for/,,,,,
Gobstopper17,1358330754.0,,,t2_a8y0m,1466525300,self.Portland,,https://www.reddit.com/r/Portland/comments/4p5db6/suggestions_for_boxing_gyms/,0,4p5db6,True,help-me,Help Me,False,{},21,False,/r/Portland/comments/4p5db6/suggestions_for_boxing_gyms/,1472797968,14,{},"As far as my skill level, 24 year old guy not in bad shape but have zero boxing &amp; overall fighting knowledge. Just looking for a place to learn once a week to box cause it looks like a painfully good time",False,Portland,t5_2qi2i,self,Suggestions for boxing gyms?,https://www.reddit.com/r/Portland/comments/4p5db6/suggestions_for_boxing_gyms/,,,,,
SeanTheModerator,1466461612.0,,,t2_ywa5h,1466525296,pamplinmedia.com,,https://www.reddit.com/r/Portland/comments/4p5dan/police_chiefs_top_aides_under_scrutiny/,0,4p5dan,False,local-news,Local News,False,{},0,False,/r/Portland/comments/4p5dan/police_chiefs_top_aides_under_scrutiny/,1472797968,7,{},,False,Portland,t5_2qi2i,http://b.thumbs.redditmedia.com/_nXfHoETgrzSFcLpsfVj6bIVjvCytEtUSbpLYqZS21A.jpg,Police chief's top aides under scrutiny,http://pamplinmedia.com/pt/9-news/311978-190143-police-chiefs-top-aides-under-scrutiny,link,"{'images': [{'id': '92J_SocH5EUYgzFwhvZbjs2kfLVK11-gWvJFnWK_ZVw', 'resolutions': [{'height': 71, 'url': 'https://i.redditmedia.com/AvulZY5VQjcxoX-BwdJBBT-LdSscFOtGXmwYAGS4jFg.jpg?fit=crop&amp;crop=faces%2Centropy&amp;arh=2&amp;w=108&amp;s=73c0820491ada4b148e7bff6701a1737', 'width': 108}, {'height': 143, 'url': 'https://i.redditmedia.com/AvulZY5VQjcxoX-BwdJBBT-LdSscFOtGXmwYAGS4jFg.jpg?fit=crop&amp;crop=faces%2Centropy&amp;arh=2&amp;w=216&amp;s=d9716fa4b7fb7523be3d1cd56513506a', 'width': 216}, {'height': 213, 'url': 'https://i.redditmedia.com/AvulZY5VQjcxoX-BwdJBBT-LdSscFOtGXmwYAGS4jFg.jpg?fit=crop&amp;crop=faces%2Centropy&amp;arh=2&amp;w=320&amp;s=c9e30ac58c60ac4e60434f31bc93ea27', 'width': 320}, {'height': 426, 'url': 'https://i.redditmedia.com/AvulZY5VQjcxoX-BwdJBBT-LdSscFOtGXmwYAGS4jFg.jpg?fit=crop&amp;crop=faces%2Centropy&amp;arh=2&amp;w=640&amp;s=4d14e9dd838cf29a08ed77418f5fa55c', 'width': 640}], 'source': {'height': 533, 'url': 'https://i.redditmedia.com/AvulZY5VQjcxoX-BwdJBBT-LdSscFOtGXmwYAGS4jFg.jpg?s=4a66337cb30284655fdf49a4b40d7f8c', 'width': 800}, 'variants': {}}]}",,,
NotMyArray,1391891209.0,,,t2_f6lc5,1466523989,self.Portland,,https://www.reddit.com/r/Portland/comments/4p5968/found_a_pedal_board/,0,4p5968,True,classifieds,Classifieds,False,{},0,False,/r/Portland/comments/4p5968/found_a_pedal_board/,1472797910,2,{},"Hey all,
I was walking around yesterday and found what appears to be an old guitar pedal board near savier and 16th.

No pedals on it just the board. All wood, clearly hand made.

Not sure how it why it got there, posting in case anyone's pedal board got stolen",False,Portland,t5_2qi2i,self,Found A Pedal Board,https://www.reddit.com/r/Portland/comments/4p5968/found_a_pedal_board/,,,,,
Imnaha2,1459426540.0,,,t2_ws1to,1466523518,oregonlive.com,,https://www.reddit.com/r/Portland/comments/4p57pe/angry_residents_challenge_inconclusive_air/,0,4p57pe,False,local-news,Local News,False,{},3,False,/r/Portland/comments/4p57pe/angry_residents_challenge_inconclusive_air/,1472797889,14,{},,False,Portland,t5_2qi2i,http://b.thumbs.redditmedia.com/Ph9RzXccPt9NibbDagdzBDHT48zfhjbbKuXIb1El-Fo.jpg,Angry residents challenge inconclusive air pollution study in N Portland,http://www.oregonlive.com/environment/index.ssf/2016/06/angry_residents_challenge_inco.html,link,"{'images': [{'id': 'crvt91XmLlsQX9IeQ-vTdEeO-gR7W85SDd3latJlhrM', 'resolutions': [{'height': 80, 'url': 'https://i.redditmedia.com/yKShstloqiXGlpluHo46Fwwrq1qcx0y7EPbGHa6Lemg.jpg?fit=crop&amp;crop=faces%2Centropy&amp;arh=2&amp;w=108&amp;s=dbf7527aaae031f4f208974bc3dc30e6', 'width': 108}, {'height': 161, 'url': 'https://i.redditmedia.com/yKShstloqiXGlpluHo46Fwwrq1qcx0y7EPbGHa6Lemg.jpg?fit=crop&amp;crop=faces%2Centropy&amp;arh=2&amp;w=216&amp;s=47f2a9186e9c8bb001a0cb74fa7aa945', 'width': 216}, {'height': 239, 'url': 'https://i.redditmedia.com/yKShstloqiXGlpluHo46Fwwrq1qcx0y7EPbGHa6Lemg.jpg?fit=crop&amp;crop=faces%2Centropy&amp;arh=2&amp;w=320&amp;s=dcdd6b44e33a81ac8dc4c80fd26f8376', 'width': 320}], 'source': {'height': 464, 'url': 'https://i.redditmedia.com/yKShstloqiXGlpluHo46Fwwrq1qcx0y7EPbGHa6Lemg.jpg?s=a93c19b84bea6eb330ad935fe2ac0b84', 'width': 620}, 'variants': {}}]}",,,
nathwhal,,,,,1466522500,koin.com,,https://www.reddit.com/r/Portland/comments/4p54mc/most_new_portlanders_come_from_oregon/,0,4p54mc,False,local-news,Local News,False,{},61,False,/r/Portland/comments/4p54mc/most_new_portlanders_come_from_oregon/,1472797846,37,{},,False,Portland,t5_2qi2i,http://b.thumbs.redditmedia.com/wmeGxFhl_yuDGs0a6uIV0TIgRJWeew4op7UMl_4FOJk.jpg,Most new Portlanders come from Oregon,http://koin.com/2016/06/21/most-new-portlanders-come-from-oregon/,link,"{'images': [{'id': '3gmVOJv4PNs5JItCvtPWHaQ8-CdRsb5ckkCosifHmiQ', 'resolutions': [{'height': 69, 'url': 'https://i.redditmedia.com/olvrwFsfl8cf0j8xKGh_NZaLjZzopwo0J-Q7W0j-kJc.jpg?fit=crop&amp;crop=faces%2Centropy&amp;arh=2&amp;w=108&amp;s=a18e1f6c8145be982c1732711128ea74', 'width': 108}, {'height': 139, 'url': 'https://i.redditmedia.com/olvrwFsfl8cf0j8xKGh_NZaLjZzopwo0J-Q7W0j-kJc.jpg?fit=crop&amp;crop=faces%2Centropy&amp;arh=2&amp;w=216&amp;s=1c7dc13dc841904493e7e6d222513fd1', 'width': 216}, {'height': 206, 'url': 'https://i.redditmedia.com/olvrwFsfl8cf0j8xKGh_NZaLjZzopwo0J-Q7W0j-kJc.jpg?fit=crop&amp;crop=faces%2Centropy&amp;arh=2&amp;w=320&amp;s=5e0d61358ecf8850da2b145c174cc522', 'width': 320}, {'height': 412, 'url': 'https://i.redditmedia.com/olvrwFsfl8cf0j8xKGh_NZaLjZzopwo0J-Q7W0j-kJc.jpg?fit=crop&amp;crop=faces%2Centropy&amp;arh=2&amp;w=640&amp;s=705c19fed126b75791a03f78a748afb3', 'width': 640}], 'source': {'height': 515, 'url': 'https://i.redditmedia.com/olvrwFsfl8cf0j8xKGh_NZaLjZzopwo0J-Q7W0j-kJc.jpg?s=3da9cd100121f7c6ba1f03c039f031f7', 'width': 800}, 'variants': {}}]}",,,
jr98664,1304474855.0,,Humboldt,t2_56rfr,1466520071,wweek.com,,https://www.reddit.com/r/Portland/comments/4p4xhd/twenty_years_ago_powells_books_rebuffed_a/,0,4p4xhd,False,local-news,Local News,False,{},91,False,/r/Portland/comments/4p4xhd/twenty_years_ago_powells_books_rebuffed_a/,1472797745,570,{},,False,Portland,t5_2qi2i,http://b.thumbs.redditmedia.com/tohTGx6A8JVEsvaqJ7-80S03GoiUBORE6I8GBp8maeQ.jpg,"Twenty years ago, Powell's Books rebuffed a multi-million dollar deal to become part of Amazon.",http://www.wweek.com/portland/article-23433-one-day-in-1996-michael-powell-tells-jeff-bezos-%E2%80%9Cthanks-but-no-thanks%E2%80%A6%E2%80%9D.html,link,"{'images': [{'id': 'J1IiIYX4Jdhmp8jx9jMdApWGcBwTANJdzqYxUuc2ykA', 'resolutions': [{'height': 79, 'url': 'https://i.redditmedia.com/4CDOl81YmRtNhIdertPBwlct3f5WJ38MJLqJkC1sz_U.jpg?fit=crop&amp;crop=faces%2Centropy&amp;arh=2&amp;w=108&amp;s=d92a82d9efc35d58f7d54a4072961211', 'width': 108}, {'height': 158, 'url': 'https://i.redditmedia.com/4CDOl81YmRtNhIdertPBwlct3f5WJ38MJLqJkC1sz_U.jpg?fit=crop&amp;crop=faces%2Centropy&amp;arh=2&amp;w=216&amp;s=72d2207282901b13cbf7afe3942c273c', 'width': 216}, {'height': 234, 'url': 'https://i.redditmedia.com/4CDOl81YmRtNhIdertPBwlct3f5WJ38MJLqJkC1sz_U.jpg?fit=crop&amp;crop=faces%2Centropy&amp;arh=2&amp;w=320&amp;s=1dc0615bf5e6583f691bf121a341ff23', 'width': 320}], 'source': {'height': 455, 'url': 'https://i.redditmedia.com/4CDOl81YmRtNhIdertPBwlct3f5WJ38MJLqJkC1sz_U.jpg?s=67a9c903f4fe2e87eba795cdde93dd58', 'width': 622}, 'variants': {}}]}",,,
throwaway3386643,1464690651.0,,,t2_ycc9f,1466514148,self.Portland,,https://www.reddit.com/r/Portland/comments/4p4h1n/psa_rich_saudi_college_students_youre_in_the_us/,0,4p4h1n,True,off-topic,Other,False,{},167,False,/r/Portland/comments/4p4h1n/psa_rich_saudi_college_students_youre_in_the_us/,1472797512,136,{},,False,Portland,t5_2qi2i,self,PSA: Rich Saudi College Students: You're in the US now. Food service industry workers are not your slaves and tipping is customary. Haggling over prices is not. Adjust.,https://www.reddit.com/r/Portland/comments/4p4h1n/psa_rich_saudi_college_students_youre_in_the_us/,,,,,
Imnaha2,1459426540.0,,,t2_ws1to,1466513521,oregonlive.com,,https://www.reddit.com/r/Portland/comments/4p4fin/school_district_employee_pleads_not_guilty_to/,0,4p4fin,False,local-news,Local News,False,{},8,False,/r/Portland/comments/4p4fin/school_district_employee_pleads_not_guilty_to/,1472797491,18,{},,False,Portland,t5_2qi2i,http://b.thumbs.redditmedia.com/oCgDfWtp10e25udOhvqBGzGnmKYOPUeTAaH0gcVS-8Q.jpg,"School district employee pleads not guilty to trying to take photo, video of woman in Troutdale bar bathroom",http://www.oregonlive.com/portland/index.ssf/2016/06/david_douglas_school_district_7.html,link,"{'images': [{'id': 'xY0L-MIVDhrnK_Fw54My2XwbiGIbfHkq9aq7BT6u7Ts', 'resolutions': [{'height': 124, 'url': 'https://i.redditmedia.com/BNH8Syjl2kNNLaszYuEsa451rVet9Qa-ksBBXaiNkBM.jpg?fit=crop&amp;crop=faces%2Centropy&amp;arh=2&amp;w=108&amp;s=ea0ebbb2783e698ca8fa919049d95f76', 'width': 108}, {'height': 249, 'url': 'https://i.redditmedia.com/BNH8Syjl2kNNLaszYuEsa451rVet9Qa-ksBBXaiNkBM.jpg?fit=crop&amp;crop=faces%2Centropy&amp;arh=2&amp;w=216&amp;s=e4cf62e0bc56b28098f786e4d627290c', 'width': 216}, {'height': 369, 'url': 'https://i.redditmedia.com/BNH8Syjl2kNNLaszYuEsa451rVet9Qa-ksBBXaiNkBM.jpg?fit=crop&amp;crop=faces%2Centropy&amp;arh=2&amp;w=320&amp;s=3beab9f10673931aa8bf0ba10dc64de8', 'width': 320}], 'source': {'height': 553, 'url': 'https://i.redditmedia.com/BNH8Syjl2kNNLaszYuEsa451rVet9Qa-ksBBXaiNkBM.jpg?s=633bb553e9bd82be1684dedc82153aee', 'width': 479}, 'variants': {}}]}",,,
[deleted],,,,,1466510345,self.Portland,,https://www.reddit.com/r/Portland/comments/4p47n2/fuck_you_skylab_and_kovel_and_the_yard_burnside/,0,4p47n2,True,,,False,{},0,False,/r/Portland/comments/4p47n2/fuck_you_skylab_and_kovel_and_the_yard_burnside/,1472797366,1,{},[deleted],False,Portland,t5_2qi2i,default,"FUCK YOU SKYLAB, AND KOVEL, AND THE YARD @BURNSIDE",https://www.reddit.com/r/Portland/comments/4p47n2/fuck_you_skylab_and_kovel_and_the_yard_burnside/,,,,,
