author,author_flair_background_color,author_flair_css_class,author_flair_richtext,author_flair_text,author_flair_text_color,author_flair_type,author_fullname,author_patreon_flair,can_mod_post,contest_mode,created_utc,domain,full_link,gildings,id,is_crosspostable,is_meta,is_original_content,is_reddit_media_domain,is_robot_indexable,is_self,is_video,link_flair_background_color,link_flair_richtext,link_flair_text_color,link_flair_type,locked,media_only,no_follow,num_comments,num_crossposts,over_18,parent_whitelist_status,permalink,pinned,pwls,retrieved_on,score,selftext,send_replies,spoiler,stickied,subreddit,subreddit_id,subreddit_subscribers,subreddit_type,thumbnail,title,updated_utc,url,whitelist_status,wls,link_flair_css_class,link_flair_text,suggested_sort,author_flair_template_id,media_metadata,media,media_embed,post_hint,preview,secure_media,secure_media_embed,thumbnail_height,thumbnail_width
pajamasox,,,[],,,text,t2_12itt2,False,False,False,1551373306,self.Portland,https://www.reddit.com/r/Portland/comments/avtdxv/thank_you_idiots_who_shouldnt_be_driving/,"{'gid_1': 0, 'gid_2': 0, 'gid_3': 0}",avtdxv,True,False,False,False,True,True,False,,[],dark,text,False,False,True,3,0,False,all_ads,/r/Portland/comments/avtdxv/thank_you_idiots_who_shouldnt_be_driving/,False,6,1551373307,0,"A heartfelt thank you goes out to the fucking morons who caused a seven car accident yesterday in Eastmoreland that smashed up my wife's car. She legally parked it while at work, not on a hill, not on a blind corner. Just on a street. 
And some idiots sliding around on the road who don't know how to drive in snow smashed not one, not two, but three different cars into her car as part of some seven vehicle gangbang fuckery that left her legally parked car, minding its own business, all fucked up with pieces laying everywhere. 
Now it's not driveable, had to be towed, might have axle damage. Had about 7,000 miles on it. 
We worked really hard and saved up a long time for that car and now it's all jacked up because some fuckwit in a Toyota Yaris is out here playing bumper cars.
Thanks, Portland!",True,False,False,Portland,t5_2qi2i,119544,public,self,Thank you idiots who shouldn't be driving,1553937745,https://www.reddit.com/r/Portland/comments/avtdxv/thank_you_idiots_who_shouldnt_be_driving/,all_ads,6,,,,,,,,,,,,,
Dangstarmootang2,,,[],,,text,t2_2pt1wo3x,False,False,False,1551373231,twitter.com,https://www.reddit.com/r/Portland/comments/avtdd7/trimet_responds_to_the_llama/,"{'gid_1': 0, 'gid_2': 0, 'gid_3': 0}",avtdd7,True,False,False,False,True,False,False,,[],dark,text,False,False,True,38,0,False,all_ads,/r/Portland/comments/avtdd7/trimet_responds_to_the_llama/,False,6,1551373232,70,,True,False,False,Portland,t5_2qi2i,119543,public,default,TriMet responds to the Llama,1553937737,https://twitter.com/trimet/status/1100476960457646081?s=21,all_ads,6,,,,,,,,,,,,,
ethicsg,,,[],,,text,t2_cfd20,False,False,False,1551372720,self.Portland,https://www.reddit.com/r/Portland/comments/avt9ts/does_anyone_have_a_independent_honda_mechanic/,"{'gid_1': 0, 'gid_2': 0, 'gid_3': 0}",avt9ts,True,False,False,False,True,True,False,,[],dark,text,False,False,True,24,0,False,all_ads,/r/Portland/comments/avt9ts/does_anyone_have_a_independent_honda_mechanic/,False,6,1551372721,0,I'm officially done with the the Stealership. ,True,False,False,Portland,t5_2qi2i,119543,public,self,Does anyone have a independent Honda mechanic they like?,1553937686,https://www.reddit.com/r/Portland/comments/avt9ts/does_anyone_have_a_independent_honda_mechanic/,all_ads,6,,,,,,,,,,,,,
LANewbie123,,,[],,,text,t2_1avntbof,False,False,False,1551372097,self.Portland,https://www.reddit.com/r/Portland/comments/avt5k9/route_6_to_tillamook/,"{'gid_1': 0, 'gid_2': 0, 'gid_3': 0}",avt5k9,True,False,False,False,True,True,False,,[],dark,text,False,False,True,7,0,False,all_ads,/r/Portland/comments/avt5k9/route_6_to_tillamook/,False,6,1551372098,0,Does anyone know how the roads are over the range towards Tillamook? Will be driving there tomorrow afternoon.,True,False,False,Portland,t5_2qi2i,119542,public,self,Route 6 to Tillamook,1553937628,https://www.reddit.com/r/Portland/comments/avt5k9/route_6_to_tillamook/,all_ads,6,,,,,,,,,,,,,
thetileguy,,,[],,,text,t2_5kl0r,False,False,False,1551370419,youtu.be,https://www.reddit.com/r/Portland/comments/avsube/good_morning_portland/,"{'gid_1': 0, 'gid_2': 0, 'gid_3': 0}",avsube,True,False,False,False,True,False,False,,[],dark,text,False,False,True,2,0,False,all_ads,/r/Portland/comments/avsube/good_morning_portland/,False,6,1551370420,0,,True,False,False,Portland,t5_2qi2i,119540,public,https://b.thumbs.redditmedia.com/wVxiLSw0zx-awh4JKqR8lLOR4bf6uylyW1CrHGimezc.jpg,Good Morning Portland,1553937179,https://youtu.be/emjlnM3JxGY,all_ads,6,,,,,,"{'oembed': {'author_name': 'TheTile Guy', 'author_url': 'https://www.youtube.com/channel/UCBORxqnoKaLG71wfiWeb9xg', 'height': 338, 'html': '&lt;iframe width=""600"" height=""338"" src=""https://www.youtube.com/embed/emjlnM3JxGY?feature=oembed&amp;enablejsapi=1"" frameborder=""0"" allow=""accelerometer; autoplay; encrypted-media; gyroscope; picture-in-picture"" allowfullscreen&gt;&lt;/iframe&gt;', 'provider_name': 'YouTube', 'provider_url': 'https://www.youtube.com/', 'thumbnail_height': 360, 'thumbnail_url': 'https://i.ytimg.com/vi/emjlnM3JxGY/hqdefault.jpg', 'thumbnail_width': 480, 'title': 'Good Morning Portland', 'type': 'video', 'version': '1.0', 'width': 600}, 'type': 'youtube.com'}","{'content': '&lt;iframe width=""600"" height=""338"" src=""https://www.youtube.com/embed/emjlnM3JxGY?feature=oembed&amp;enablejsapi=1"" frameborder=""0"" allow=""accelerometer; autoplay; encrypted-media; gyroscope; picture-in-picture"" allowfullscreen&gt;&lt;/iframe&gt;', 'height': 338, 'scrolling': False, 'width': 600}",rich:video,"{'enabled': False, 'images': [{'id': 'COfhsMFK0V7-UvDv5Fu5AuyXktYJaqfCvOwUZWZNdUw', 'resolutions': [{'height': 81, 'url': 'https://external-preview.redd.it/TyjW9d5mg1gD9RMgoYGAu4s-N13kdH5u7bWZZW9f50U.jpg?width=108&amp;crop=smart&amp;auto=webp&amp;s=55c4f91d4036b2b9850bcbe071268001444eb11d', 'width': 108}, {'height': 162, 'url': 'https://external-preview.redd.it/TyjW9d5mg1gD9RMgoYGAu4s-N13kdH5u7bWZZW9f50U.jpg?width=216&amp;crop=smart&amp;auto=webp&amp;s=369b40cf54b32b70c04c2cbc6a35491e9225dc1c', 'width': 216}, {'height': 240, 'url': 'https://external-preview.redd.it/TyjW9d5mg1gD9RMgoYGAu4s-N13kdH5u7bWZZW9f50U.jpg?width=320&amp;crop=smart&amp;auto=webp&amp;s=aa88fcdb4d72764620b065643ce2c2c37bc41553', 'width': 320}], 'source': {'height': 360, 'url': 'https://external-preview.redd.it/TyjW9d5mg1gD9RMgoYGAu4s-N13kdH5u7bWZZW9f50U.jpg?auto=webp&amp;s=8f78eab44a2c1229739d8f54abb0220443e67e9e', 'width': 480}, 'variants': {}}]}","{'oembed': {'author_name': 'TheTile Guy', 'author_url': 'https://www.youtube.com/channel/UCBORxqnoKaLG71wfiWeb9xg', 'height': 338, 'html': '&lt;iframe width=""600"" height=""338"" src=""https://www.youtube.com/embed/emjlnM3JxGY?feature=oembed&amp;enablejsapi=1"" frameborder=""0"" allow=""accelerometer; autoplay; encrypted-media; gyroscope; picture-in-picture"" allowfullscreen&gt;&lt;/iframe&gt;', 'provider_name': 'YouTube', 'provider_url': 'https://www.youtube.com/', 'thumbnail_height': 360, 'thumbnail_url': 'https://i.ytimg.com/vi/emjlnM3JxGY/hqdefault.jpg', 'thumbnail_width': 480, 'title': 'Good Morning Portland', 'type': 'video', 'version': '1.0', 'width': 600}, 'type': 'youtube.com'}","{'content': '&lt;iframe width=""600"" height=""338"" src=""https://www.youtube.com/embed/emjlnM3JxGY?feature=oembed&amp;enablejsapi=1"" frameborder=""0"" allow=""accelerometer; autoplay; encrypted-media; gyroscope; picture-in-picture"" allowfullscreen&gt;&lt;/iframe&gt;', 'height': 338, 'media_domain_url': 'https://www.redditmedia.com/mediaembed/avsube', 'scrolling': False, 'width': 600}",105.0,140.0
DefinitelyNotMartinC,,,[],,,text,t2_9umkvgt,False,False,False,1551368907,oregonlive.com,https://www.reddit.com/r/Portland/comments/avsjsu/drunken_hoodtocoast_runner_gets_jail_for_taking/,"{'gid_1': 0, 'gid_2': 0, 'gid_3': 0}",avsjsu,True,False,False,False,True,False,False,,[],dark,text,False,False,True,26,0,False,all_ads,/r/Portland/comments/avsjsu/drunken_hoodtocoast_runner_gets_jail_for_taking/,False,6,1551368908,74,,True,False,False,Portland,t5_2qi2i,119538,public,default,Drunken Hood-To-Coast runner gets jail for taking Honey Bucket truck on joy ride and driving over another runner,1553937017,https://www.oregonlive.com/news/2019/02/drunken-hood-to-coast-runner-gets-jail-for-taking-honey-bucket-truck-on-joy-ride-and-driving-over-another-runner.html,all_ads,6,local-news,Local News,,,,,,,,,,,
AutoModerator,,,[],24 Hour Church of Elvis,dark,text,t2_6l4z3,False,False,False,1551366397,self.Portland,https://www.reddit.com/r/Portland/comments/avs3ed/weekly_rportland_classifieds_february_28_2019/,"{'gid_1': 0, 'gid_2': 0, 'gid_3': 0}",avs3ed,True,False,False,False,True,True,False,,[],dark,text,False,False,True,11,0,False,all_ads,/r/Portland/comments/avs3ed/weekly_rportland_classifieds_february_28_2019/,False,6,1551366399,7,"Please post your community classifieds in this thread. Examples include:

* Lost and found pets, wallets, etc.
* Stolen cars or bikes
* Looking for a roommate or place to live
* Want to buy tickets, furniture, etc.
* I have stuff to donate

**General rules:** 

If it's the type of thing you would see on Craigslist, it goes in here.

Never post personal information. Do that in PM and remember, safety first.

Per Rule #2, no advertising of items/services you make money from. Looking for tickets is okay, selling them for profit is not.

Employers and job seekers, use the Monthly I'm Hiring/Hire me threads (links are in the top menu and on sidebar, under ""JOBS"").
",False,False,False,Portland,t5_2qi2i,119537,public,self,"WEEKLY /R/PORTLAND CLASSIFIEDS: February 28, 2019",1553290608,https://www.reddit.com/r/Portland/comments/avs3ed/weekly_rportland_classifieds_february_28_2019/,all_ads,6,classifieds,Classifieds,new,,,,,,,,,,
its9am,,,[],,,text,t2_pyr6x7c,False,False,False,1551362222,i.redd.it,https://www.reddit.com/r/Portland/comments/avreg7/og_michael_in_da_parking_lot/,"{'gid_1': 0, 'gid_2': 0, 'gid_3': 0}",avreg7,True,False,False,True,True,False,False,,[],dark,text,False,False,True,29,0,False,all_ads,/r/Portland/comments/avreg7/og_michael_in_da_parking_lot/,False,6,1551362222,358,,True,False,False,Portland,t5_2qi2i,119532,public,default,OG Michael in da parking lot,1553290204,https://i.redd.it/siyrqh5vebj21.jpg,all_ads,6,photo,Photo,,,,,,,,,,,
barondeke,,,[],,,text,t2_2i8gr6mm,False,False,False,1551359155,self.Portland,https://www.reddit.com/r/Portland/comments/avqwz1/upsetting_topics/,"{'gid_1': 0, 'gid_2': 0, 'gid_3': 0}",avqwz1,False,False,False,False,False,True,False,,[],dark,text,False,False,True,13,0,False,all_ads,/r/Portland/comments/avqwz1/upsetting_topics/,False,6,1551359157,0,[removed],True,False,False,Portland,t5_2qi2i,119532,public,self,"""upsetting topics""",1553289935,https://www.reddit.com/r/Portland/comments/avqwz1/upsetting_topics/,all_ads,6,,,,,,,,,,,,,
wickornot,,,[],,,text,t2_of7el,False,False,False,1551355541,self.Portland,https://www.reddit.com/r/Portland/comments/avqd8e/screamingshrieking_psu_near_park_blocks/,"{'gid_1': 0, 'gid_2': 0, 'gid_3': 0}",avqd8e,True,False,False,False,True,True,False,,[],dark,text,False,False,True,5,0,False,all_ads,/r/Portland/comments/avqd8e/screamingshrieking_psu_near_park_blocks/,False,6,1551355542,0,"Anyone else hear this? Sounded like someone shrieking in terror, happened twice maybe 5 mins apart around 4 am. Was loud enough to wake me up.",True,False,False,Portland,t5_2qi2i,119532,public,self,Screaming/shrieking @ psu near park blocks,1553289636,https://www.reddit.com/r/Portland/comments/avqd8e/screamingshrieking_psu_near_park_blocks/,all_ads,6,,,,,,,,,,,,,
pdxboob,,,[],Belmont,dark,text,t2_aymya,False,False,False,1551342664,self.Portland,https://www.reddit.com/r/Portland/comments/avos4u/lets_start_a_list_which_businesses_tack_on/,"{'gid_1': 0, 'gid_2': 0, 'gid_3': 0}",avos4u,True,False,False,False,True,True,False,,[],dark,text,False,False,True,18,0,False,all_ads,/r/Portland/comments/avos4u/lets_start_a_list_which_businesses_tack_on/,False,6,1551342664,0,"I'm feeling pretty salty right now. I have to work in a few hours and can't sleep. Also, I've been craving all kinds of restaurant foods but am trying to save money and/or boycotting. I haven't been to a certain Russian restaurant since I learned they have a 5% fee added to every tab for rising costs for their employees something something. Keep hearing about the bowling alley on Morrison that's owned by a group that also runs Thirsty Lion. 

&amp;#x200B;

I am all for employee benefits and living wages. But there's no way to hold these business accountable with this method. 

&amp;#x200B;

What other places sneak this shit in at the bottom of their menus in small print?",True,False,False,Portland,t5_2qi2i,119530,public,self,"Let's start a list: Which businesses tack on ""employee health benefit"" percentages?",1553288813,https://www.reddit.com/r/Portland/comments/avos4u/lets_start_a_list_which_businesses_tack_on/,all_ads,6,,,,,,,,,,,,,
Svladimir-Jelly,,,[],,,text,t2_19ebgj93,False,False,False,1551341721,self.Portland,https://www.reddit.com/r/Portland/comments/avoo9p/adx_maker_space_alternative_beware_adx/,"{'gid_1': 0, 'gid_2': 0, 'gid_3': 0}",avoo9p,True,False,False,False,True,True,False,,[],dark,text,False,False,True,6,0,False,all_ads,/r/Portland/comments/avoo9p/adx_maker_space_alternative_beware_adx/,False,6,1551341723,0,"Does anyone know of a space other than ADX that has a large router? Something that can handle 5' x 8' or larger? 

I'm getting sudden flak from the owner of ADX about paying to certify myself with safety tests for using the equipment. Testing will cost me hundreds of dollars and tons of my personal time. (When I've been there for about eight years doing the exact same thing, and not lost a single extremity.)  All the while I'm paying for access to ADX itself. This amounts to tons of lost money, for no reason. It isn't a new insurance measure on their end, it's just a arbitrary management decision. People there roll their eyes when I tell them how flabbergasting it is that I can't just go in at a time when the equipment isn't being used *at all* by anyone and work on my project. Employees say the owner does this to everyone, and there's nothing they can do about it. Why she has a bee in her bonnet about this suddenly after all of this time is beyond me. I work at hours when hardly anyone is there, clean up after myself and put everything away meticulously. Anyone have the same experience? Recommend a better maker space with a capable router?",True,False,False,Portland,t5_2qi2i,119530,public,self,ADX maker space alternative? **Beware ADX**,1553288760,https://www.reddit.com/r/Portland/comments/avoo9p/adx_maker_space_alternative_beware_adx/,all_ads,6,,,,,,,,,,,,,
turdfergusonpdx,,,[],,,text,t2_166zcy,False,False,False,1551339224,self.Portland,https://www.reddit.com/r/Portland/comments/avoddn/the_photo_radar_vans_are_out_in_force_watch_out/,"{'gid_1': 0, 'gid_2': 0, 'gid_3': 0}",avoddn,True,False,False,False,True,True,False,,[],dark,text,False,False,True,23,0,False,all_ads,/r/Portland/comments/avoddn/the_photo_radar_vans_are_out_in_force_watch_out/,False,6,1551339226,0,I’ve gotten two $170 tickets in the last month. 11 mph over on SE Hawthorne and SE Morrison near the bridges. ,True,False,False,Portland,t5_2qi2i,119528,public,self,The photo radar vans are out in force. Watch out!,1553288604,https://www.reddit.com/r/Portland/comments/avoddn/the_photo_radar_vans_are_out_in_force_watch_out/,all_ads,6,,,,,,,,,,,,,
cakeshady,,,[],,,text,t2_3bcs8t0x,False,False,False,1551337574,self.Portland,https://www.reddit.com/r/Portland/comments/avo5im/i_have_no_clue/,"{'gid_1': 0, 'gid_2': 0, 'gid_3': 0}",avo5im,False,False,False,False,False,True,False,,[],dark,text,False,False,True,0,0,False,all_ads,/r/Portland/comments/avo5im/i_have_no_clue/,False,6,1551337575,1,[removed],True,False,False,Portland,t5_2qi2i,119527,public,self,I have no clue,1553288492,https://www.reddit.com/r/Portland/comments/avo5im/i_have_no_clue/,all_ads,6,,,,,,,,,,,,,
dennyxmas,,,[],,,text,t2_14rxfpz,False,False,False,1551336365,i.redd.it,https://www.reddit.com/r/Portland/comments/avnzhu/saw_this_person_who_knows_how_to_spend_money/,"{'gid_1': 0, 'gid_2': 0, 'gid_3': 0}",avnzhu,True,False,False,True,True,False,False,,[],dark,text,False,False,True,50,0,False,all_ads,/r/Portland/comments/avnzhu/saw_this_person_who_knows_how_to_spend_money/,False,6,1551336366,933,,True,False,False,Portland,t5_2qi2i,119525,public,https://a.thumbs.redditmedia.com/Nf0T9BlQ1VP_GF8UASqNnJMCrpze4RfLuXUTSIcaAd4.jpg,Saw this person who knows how to spend money,1553288404,https://i.redd.it/b1dbndbz99j21.jpg,all_ads,6,photo,Photo,,,,,,image,"{'enabled': True, 'images': [{'id': 'epeWTyROUAOvBCbRyFnIXpuw4hUQ1i44d5iY19sgWSs', 'resolutions': [{'height': 113, 'url': 'https://preview.redd.it/b1dbndbz99j21.jpg?width=108&amp;crop=smart&amp;auto=webp&amp;s=d7f911d3977a7da5a8640962c9a81d0ac6be8192', 'width': 108}, {'height': 226, 'url': 'https://preview.redd.it/b1dbndbz99j21.jpg?width=216&amp;crop=smart&amp;auto=webp&amp;s=fb1273094feaf019a8554a93f0b2d205af7d6e1a', 'width': 216}, {'height': 334, 'url': 'https://preview.redd.it/b1dbndbz99j21.jpg?width=320&amp;crop=smart&amp;auto=webp&amp;s=64f3a298b0edce9289b408c2be01c5621579d09c', 'width': 320}, {'height': 669, 'url': 'https://preview.redd.it/b1dbndbz99j21.jpg?width=640&amp;crop=smart&amp;auto=webp&amp;s=cbde881f75b3b714bad0ba6fd6481e0d9874720e', 'width': 640}, {'height': 1004, 'url': 'https://preview.redd.it/b1dbndbz99j21.jpg?width=960&amp;crop=smart&amp;auto=webp&amp;s=22d2c115907c82c9e8f54940e2a87bb5e794da14', 'width': 960}, {'height': 1130, 'url': 'https://preview.redd.it/b1dbndbz99j21.jpg?width=1080&amp;crop=smart&amp;auto=webp&amp;s=67ffc98bea5224f2b1ee1a44d47fe79862654d38', 'width': 1080}], 'source': {'height': 2000, 'url': 'https://preview.redd.it/b1dbndbz99j21.jpg?auto=webp&amp;s=5d184a90e9350474b423bb5eec9c05c9820e9be9', 'width': 1911}, 'variants': {}}]}",,,140.0,140.0
animalcures,,,[],,,text,t2_3awu9fzh,False,False,False,1551335520,citylab.com,https://www.reddit.com/r/Portland/comments/avnvg6/why_portlands_public_toilets_succeeded_where/,"{'gid_1': 0, 'gid_2': 0, 'gid_3': 0}",avnvg6,False,False,False,False,False,False,False,,[],dark,text,False,False,True,0,0,False,all_ads,/r/Portland/comments/avnvg6/why_portlands_public_toilets_succeeded_where/,False,6,1551335521,1,,True,False,False,Portland,t5_2qi2i,119523,public,https://b.thumbs.redditmedia.com/r0iqerV-pOrZoZv0c0NlRC2ODF6aGgCEr4d-fGBJ4ws.jpg,Why Portland's Public Toilets Succeeded Where Others Failed,1553288320,https://www.citylab.com/design/2012/01/why-portlands-public-toilets-succeeded-where-others-failed/1020/,all_ads,6,,,,,,,,link,"{'enabled': False, 'images': [{'id': 'a5khy7dUIMH4YdA638sM4I4MACNN43c4azQEIAuMO8A', 'resolutions': [{'height': 67, 'url': 'https://external-preview.redd.it/U94qZo096lpVSyxfgEFKg8OEpB60Y9JjU3uMcEN1S6w.jpg?width=108&amp;crop=smart&amp;auto=webp&amp;s=1e4f91756330e25b44ca62516a048fd70f3d1b3f', 'width': 108}, {'height': 135, 'url': 'https://external-preview.redd.it/U94qZo096lpVSyxfgEFKg8OEpB60Y9JjU3uMcEN1S6w.jpg?width=216&amp;crop=smart&amp;auto=webp&amp;s=1617ded56e38e5ff14c6c9b619af38949df5bd3c', 'width': 216}, {'height': 200, 'url': 'https://external-preview.redd.it/U94qZo096lpVSyxfgEFKg8OEpB60Y9JjU3uMcEN1S6w.jpg?width=320&amp;crop=smart&amp;auto=webp&amp;s=8873c436354e64f78b7467b6600d89887ddfe470', 'width': 320}], 'source': {'height': 388, 'url': 'https://external-preview.redd.it/U94qZo096lpVSyxfgEFKg8OEpB60Y9JjU3uMcEN1S6w.jpg?auto=webp&amp;s=838d2b6e34d88a6632ec415c67b58c512d4d5920', 'width': 620}, 'variants': {}}]}",,,87.0,140.0
JDnotsalinger,,,[],,,text,t2_79dguhd,False,False,False,1551335302,self.Portland,https://www.reddit.com/r/Portland/comments/avnubp/howd_you_guys_learn_to_garden_like_damn/,"{'gid_1': 0, 'gid_2': 0, 'gid_3': 0}",avnubp,True,False,False,False,True,True,False,,[],dark,text,False,False,True,29,0,False,all_ads,/r/Portland/comments/avnubp/howd_you_guys_learn_to_garden_like_damn/,False,6,1551335303,41,I’m just perplexed at how many people have such excellent gardening skills. Are there any community places to learn this stuff? ,True,False,False,Portland,t5_2qi2i,119523,public,self,How’d you guys learn to garden? Like damn,1553288304,https://www.reddit.com/r/Portland/comments/avnubp/howd_you_guys_learn_to_garden_like_damn/,all_ads,6,,,,,,,,,,,,,
pearl_dude,,,[],,,text,t2_3bcbgm3b,False,False,False,1551333489,i.redd.it,https://www.reddit.com/r/Portland/comments/avnlkp/concerned_citizen_of_the_pearl_district/,"{'gid_1': 0, 'gid_2': 0, 'gid_3': 0}",avnlkp,False,False,False,True,False,False,False,,[],dark,text,False,False,True,0,0,False,all_ads,/r/Portland/comments/avnlkp/concerned_citizen_of_the_pearl_district/,False,6,1551333490,2,,True,False,False,Portland,t5_2qi2i,119518,public,default,Concerned citizen of the Pearl District,1553288173,https://i.redd.it/oe61nzk919j21.jpg,all_ads,6,,,,,,,,,,,,,
voodooziggy,,,[],,,text,t2_dzlne,False,False,False,1551330659,self.Portland,https://www.reddit.com/r/Portland/comments/avn7sh/for_the_first_time_in_my_life_i_hope_it_doesnt/,"{'gid_1': 0, 'gid_2': 0, 'gid_3': 0}",avn7sh,True,False,False,False,True,True,False,,[],dark,text,False,False,True,4,0,False,all_ads,/r/Portland/comments/avn7sh/for_the_first_time_in_my_life_i_hope_it_doesnt/,False,6,1551330661,0,Told my boss I can work at 8 am if there's no school tomorrow. I get off at midnight tonight. God I need some sleep. ,True,False,False,Portland,t5_2qi2i,119509,public,self,"For the first time in my life, I hope it doesn't snow tonight",1553287958,https://www.reddit.com/r/Portland/comments/avn7sh/for_the_first_time_in_my_life_i_hope_it_doesnt/,all_ads,6,,,,,,,,,,,,,
hur00003,,,[],,,text,t2_iuamu,False,False,False,1551329924,self.Portland,https://www.reddit.com/r/Portland/comments/avn3yt/rupauls_drag_race_season_11/,"{'gid_1': 0, 'gid_2': 0, 'gid_3': 0}",avn3yt,True,False,False,False,True,True,False,,[],dark,text,False,False,True,7,0,False,all_ads,/r/Portland/comments/avn3yt/rupauls_drag_race_season_11/,False,6,1551329925,0,"Looking for a bar that is playing  Rupaul's Drag Race tomorrow.  Any suggestions? I know that Scandals plays it, but it's always so busy!

Thank you in advance!

",True,False,False,Portland,t5_2qi2i,119507,public,self,Rupaul's Drag Race Season 11 !!!,1553287900,https://www.reddit.com/r/Portland/comments/avn3yt/rupauls_drag_race_season_11/,all_ads,6,,,,,,,,,,,,,
The_succ,,,[],,,text,t2_z3s15,False,False,False,1551328413,imgur.com,https://www.reddit.com/r/Portland/comments/avmwfi/das_it/,"{'gid_1': 0, 'gid_2': 0, 'gid_3': 0}",avmwfi,True,False,False,False,True,False,False,,[],dark,text,False,False,True,7,0,False,all_ads,/r/Portland/comments/avmwfi/das_it/,False,6,1551328414,100,,False,False,False,Portland,t5_2qi2i,119507,public,default,Das it,1553287781,https://imgur.com/oqecCRh,all_ads,6,photo,Photo,,,,,,,,,,,
lindseyhasears,,,[],,,text,t2_xp97pp7,False,False,False,1551326928,self.Portland,https://www.reddit.com/r/Portland/comments/avmop7/selling_books_to_powells/,"{'gid_1': 0, 'gid_2': 0, 'gid_3': 0}",avmop7,True,False,False,False,True,True,False,,[],dark,text,False,False,True,16,0,False,all_ads,/r/Portland/comments/avmop7/selling_books_to_powells/,False,6,1551326928,3,"I am trying to get some extra cash and thinking about bringing some books to Powell’s to sell. Probably a variety of fiction, graphic novels, etc. I’m not expecting to walk out of there rich but I’m curious if people have done it and could give me an idea of what to expect. Is it remotely a way to get some cash? Or do you get pennies? ",True,False,False,Portland,t5_2qi2i,119505,public,self,Selling books to Powell’s,1553287656,https://www.reddit.com/r/Portland/comments/avmop7/selling_books_to_powells/,all_ads,6,,,,,,,,,,,,,
Acatalepsia,,,[],,,text,t2_8vi4u,False,False,False,1551326526,self.Portland,https://www.reddit.com/r/Portland/comments/avmmjw/trying_to_get_out_of_the_city_for_a_day_or_two/,"{'gid_1': 0, 'gid_2': 0, 'gid_3': 0}",avmmjw,True,False,False,False,True,True,False,,[],dark,text,False,False,True,11,0,False,all_ads,/r/Portland/comments/avmmjw/trying_to_get_out_of_the_city_for_a_day_or_two/,False,6,1551326527,0,"Looking for cool or lesser known recommendations for stuff thats within 3 hours. Was thinking of Bagby Hotsprings and Crater Lake, but it seems stupid to go there right now! Perhaps stuff that's west / on the coast? I've just been to Seaside, Astoria, and Pacific City before... but other sights/trails/areas would be rad.",True,False,False,Portland,t5_2qi2i,119505,public,self,Trying to get out of the city for a day or two? ...without chains?,1553287621,https://www.reddit.com/r/Portland/comments/avmmjw/trying_to_get_out_of_the_city_for_a_day_or_two/,all_ads,6,,,,,,,,,,,,,
Bad2bBiled,,,[],,,text,t2_2t4yqojj,False,False,False,1551324697,i.redd.it,https://www.reddit.com/r/Portland/comments/avmc96/this_car_on_99e_tuesday_morning/,"{'gid_1': 0, 'gid_2': 0, 'gid_3': 0}",avmc96,True,False,False,True,True,False,False,,[],dark,text,False,False,True,35,0,False,all_ads,/r/Portland/comments/avmc96/this_car_on_99e_tuesday_morning/,False,6,1551324697,211,,True,False,False,Portland,t5_2qi2i,119500,public,default,This car on 99E Tuesday morning,1553287459,https://i.redd.it/6f6d7x2ab8j21.jpg,all_ads,6,,,,,,,,,,,,,
