all_awardings,allow_live_comments,author,author_flair_css_class,author_flair_richtext,author_flair_text,author_flair_type,author_fullname,author_patreon_flair,can_mod_post,contest_mode,created_utc,domain,full_link,gildings,id,is_crosspostable,is_meta,is_original_content,is_reddit_media_domain,is_robot_indexable,is_self,is_video,link_flair_background_color,link_flair_richtext,link_flair_text_color,link_flair_type,locked,media_only,no_follow,num_comments,num_crossposts,over_18,parent_whitelist_status,permalink,pinned,pwls,retrieved_on,score,selftext,send_replies,spoiler,stickied,subreddit,subreddit_id,subreddit_subscribers,subreddit_type,thumbnail,title,total_awards_received,updated_utc,url,whitelist_status,wls,author_flair_template_id,author_flair_text_color,link_flair_css_class,link_flair_text,post_hint,preview,thumbnail_height,thumbnail_width,author_flair_background_color,author_cakeday,media,media_embed,secure_media,secure_media_embed
[],False,komodokiller,,[],,text,t2_bmw5j,False,False,False,1562885888,self.Portland,https://www.reddit.com/r/Portland/comments/cc2omy/lost_dog_se_portland/,{},cc2omy,True,False,False,False,True,True,False,,[],dark,text,False,False,True,4,0,False,all_ads,/r/Portland/comments/cc2omy/lost_dog_se_portland/,False,6,1562885891,22,A chihuahua is lost in the creston kenilworth neighborhood last seen on Francis and 34th headed towards caesar Chavez. No pictures of it at the moment as it's not my dog.,True,False,False,Portland,t5_2qi2i,131052,public,self,Lost Dog SE Portland,0,1562972270,https://www.reddit.com/r/Portland/comments/cc2omy/lost_dog_se_portland/,all_ads,6,,,,,,,,,,,,,,
[],False,GuiltyGear,,[],,text,t2_56fmj,False,False,False,1562883898,youtu.be,https://www.reddit.com/r/Portland/comments/cc2ash/joe_rogan_experience_1323_andy_ngo_interview_post/,{},cc2ash,False,False,False,False,False,False,False,,[],dark,text,False,False,True,0,0,False,all_ads,/r/Portland/comments/cc2ash/joe_rogan_experience_1323_andy_ngo_interview_post/,False,6,1562883899,1,,True,False,False,Portland,t5_2qi2i,131052,public,https://b.thumbs.redditmedia.com/ISurNqRM08628nGTdssmexZS_WO-cSlQr_VlMjAYPlY.jpg,Joe Rogan Experience #1323 - Andy Ngo Interview Post Assault By Portland's Antifa Wackos,0,1562970283,https://youtu.be/cI2EHMy1lgs,all_ads,6,,,,,rich:video,"{'enabled': False, 'images': [{'id': 'pRp4gxMlv5-KG3C0PENLYY8kZPEkMMW2c6BcmwmfxcI', 'resolutions': [{'height': 81, 'url': 'https://external-preview.redd.it/VQYL1hiN_1GV1UWELA_1AvMAVG4hEC4LPp7W2BFWa2E.jpg?width=108&amp;crop=smart&amp;auto=webp&amp;s=71cbfdd6a38684118fe08c3bcad52e9849bd0d27', 'width': 108}, {'height': 162, 'url': 'https://external-preview.redd.it/VQYL1hiN_1GV1UWELA_1AvMAVG4hEC4LPp7W2BFWa2E.jpg?width=216&amp;crop=smart&amp;auto=webp&amp;s=fe8b9c599d430d16d941021f1aa4013485b7d683', 'width': 216}, {'height': 240, 'url': 'https://external-preview.redd.it/VQYL1hiN_1GV1UWELA_1AvMAVG4hEC4LPp7W2BFWa2E.jpg?width=320&amp;crop=smart&amp;auto=webp&amp;s=08d0a55955957dc58eba2aeb551dcafd75be70dc', 'width': 320}], 'source': {'height': 360, 'url': 'https://external-preview.redd.it/VQYL1hiN_1GV1UWELA_1AvMAVG4hEC4LPp7W2BFWa2E.jpg?auto=webp&amp;s=90eb795aaad1f712af3949a6d529d15893f02aac', 'width': 480}, 'variants': {}}]}",105.0,140.0,,,"{'oembed': {'author_name': 'PowerfulJRE', 'author_url': 'https://www.youtube.com/user/PowerfulJRE', 'height': 338, 'html': '&lt;iframe width=""600"" height=""338"" src=""https://www.youtube.com/embed/cI2EHMy1lgs?feature=oembed&amp;enablejsapi=1"" frameborder=""0"" allow=""accelerometer; autoplay; encrypted-media; gyroscope; picture-in-picture"" allowfullscreen&gt;&lt;/iframe&gt;', 'provider_name': 'YouTube', 'provider_url': 'https://www.youtube.com/', 'thumbnail_height': 360, 'thumbnail_url': 'https://i.ytimg.com/vi/cI2EHMy1lgs/hqdefault.jpg', 'thumbnail_width': 480, 'title': 'Joe Rogan Experience #1323 - Andy Ngo', 'type': 'video', 'version': '1.0', 'width': 600}, 'type': 'youtube.com'}","{'content': '&lt;iframe width=""600"" height=""338"" src=""https://www.youtube.com/embed/cI2EHMy1lgs?feature=oembed&amp;enablejsapi=1"" frameborder=""0"" allow=""accelerometer; autoplay; encrypted-media; gyroscope; picture-in-picture"" allowfullscreen&gt;&lt;/iframe&gt;', 'height': 338, 'scrolling': False, 'width': 600}","{'oembed': {'author_name': 'PowerfulJRE', 'author_url': 'https://www.youtube.com/user/PowerfulJRE', 'height': 338, 'html': '&lt;iframe width=""600"" height=""338"" src=""https://www.youtube.com/embed/cI2EHMy1lgs?feature=oembed&amp;enablejsapi=1"" frameborder=""0"" allow=""accelerometer; autoplay; encrypted-media; gyroscope; picture-in-picture"" allowfullscreen&gt;&lt;/iframe&gt;', 'provider_name': 'YouTube', 'provider_url': 'https://www.youtube.com/', 'thumbnail_height': 360, 'thumbnail_url': 'https://i.ytimg.com/vi/cI2EHMy1lgs/hqdefault.jpg', 'thumbnail_width': 480, 'title': 'Joe Rogan Experience #1323 - Andy Ngo', 'type': 'video', 'version': '1.0', 'width': 600}, 'type': 'youtube.com'}","{'content': '&lt;iframe width=""600"" height=""338"" src=""https://www.youtube.com/embed/cI2EHMy1lgs?feature=oembed&amp;enablejsapi=1"" frameborder=""0"" allow=""accelerometer; autoplay; encrypted-media; gyroscope; picture-in-picture"" allowfullscreen&gt;&lt;/iframe&gt;', 'height': 338, 'media_domain_url': 'https://www.redditmedia.com/mediaembed/cc2ash', 'scrolling': False, 'width': 600}"
[],False,rachelshmee,,[],,text,t2_7g8we,False,False,False,1562882409,i.redd.it,https://www.reddit.com/r/Portland/comments/cc1zug/i_was_raised_in_oregon_and_moved_away_a_little/,{},cc1zug,True,False,False,True,True,False,False,,[],dark,text,False,False,True,6,0,False,all_ads,/r/Portland/comments/cc1zug/i_was_raised_in_oregon_and_moved_away_a_little/,False,6,1562882410,0,,True,False,False,Portland,t5_2qi2i,131053,public,default,"I was raised in Oregon, and moved away a little over a year ago to Western New York. There aren’t too many pine trees out here, so I got one to carry with me💚🌲",0,1562968795,https://i.redd.it/2lec9sjayq931.jpg,all_ads,6,,,photo,Photo,,,,,,,,,,
[],False,encryptonaut,,[],,text,t2_j95npsb,False,False,False,1562881960,i.redd.it,https://www.reddit.com/r/Portland/comments/cc1wn6/help_the_portland_pd/,{},cc1wn6,True,False,False,True,True,False,False,,[],dark,text,False,False,True,6,0,False,all_ads,/r/Portland/comments/cc1wn6/help_the_portland_pd/,False,6,1562881961,0,,True,False,False,Portland,t5_2qi2i,131050,public,default,Help the Portland PD!!!,0,1562968343,https://i.redd.it/rujkbopywq931.jpg,all_ads,6,,,,,,,,,,,,,,
[],False,Sunygrad07,,[],,text,t2_44u6hpko,False,False,False,1562880900,self.Portland,https://www.reddit.com/r/Portland/comments/cc1otu/help_cure_my_mama/,{},cc1otu,False,False,False,False,False,True,False,,[],dark,text,False,False,True,1,0,False,all_ads,/r/Portland/comments/cc1otu/help_cure_my_mama/,False,6,1562880902,1,[removed],True,False,False,Portland,t5_2qi2i,131049,public,self,Help cure my mama,0,1562967283,https://www.reddit.com/r/Portland/comments/cc1otu/help_cure_my_mama/,all_ads,6,,,,,,,,,,,,,,
[],False,tbshawk4,,[],NE,text,t2_ah462,False,False,False,1562878041,self.Portland,https://www.reddit.com/r/Portland/comments/cc13c0/is_it_legal_for_garbage_truck_to_pick_up_trash/,{},cc13c0,True,False,False,False,True,True,False,,[],dark,text,False,False,True,16,0,False,all_ads,/r/Portland/comments/cc13c0/is_it_legal_for_garbage_truck_to_pick_up_trash/,False,6,1562878042,4,Just moved into a new apartment near NE 27th and Weidler and have been woken up at 3:30am to a garbage truck picking up a dumpster from a business twice a week. Is this legal? I thought they weren't able to run until 6am. Is it because it might be considered a commercial zone?,True,False,False,Portland,t5_2qi2i,131047,public,self,Is it legal for garbage truck to pick up trash from dumpster at 3:30am?,0,1562964422,https://www.reddit.com/r/Portland/comments/cc13c0/is_it_legal_for_garbage_truck_to_pick_up_trash/,all_ads,6,,dark,,,,,,,,,,,,
[],False,Not_A_Red_Stapler,,[],,text,t2_o8o60,False,False,False,1562878009,self.Portland,https://www.reddit.com/r/Portland/comments/cc133d/i_need_two_gates_who_can_make_and_install_them/,{},cc133d,True,False,False,False,True,True,False,,[],dark,text,False,False,True,8,0,False,all_ads,/r/Portland/comments/cc133d/i_need_two_gates_who_can_make_and_install_them/,False,6,1562878010,0,"I have fencing around three sides of my yard.  I just need two lockable gates from the house to the fencing.  Any recommendations for who to talk to?   Any idea how much it should cost?

&amp;#x200B;

Thanks",True,False,False,Portland,t5_2qi2i,131047,public,self,I need two gates. Who can make and install them for me?,0,1562964391,https://www.reddit.com/r/Portland/comments/cc133d/i_need_two_gates_who_can_make_and_install_them/,all_ads,6,,,,,,,,,,,,,,
[],False,Glass_Pickle,,[],MAX Green Line,text,t2_1ez0flfg,False,False,False,1562877995,oregonlive.com,https://www.reddit.com/r/Portland/comments/cc12zw/convicted_swindler_ordered_to_learn_to_read_and/,{},cc12zw,True,False,False,False,True,False,False,,[],dark,text,False,False,True,11,0,False,all_ads,/r/Portland/comments/cc12zw/convicted_swindler_ordered_to_learn_to_read_and/,False,6,1562877997,19,,True,False,False,Portland,t5_2qi2i,131047,public,default,Convicted swindler ordered to ‘learn to read and write’ while awaiting trial in alleged $2.5 million scam,0,1562964381,https://www.oregonlive.com/crime/2019/07/convicted-swindler-ordered-to-learn-to-read-and-write-while-awaiting-trial-in-alleged-25-million-scam.html,all_ads,6,a4912c24-305b-11e7-b4cd-0e08561127f8,dark,,,,,,,,,,,,
[],False,Pjseaturtle,,[],SW,text,t2_cnyn95c,False,False,False,1562877228,self.Portland,https://www.reddit.com/r/Portland/comments/cc0x0s/police_sirens_all_over_the_city/,{},cc0x0s,True,False,False,False,True,True,False,,[],dark,text,False,False,True,3,0,False,all_ads,/r/Portland/comments/cc0x0s/police_sirens_all_over_the_city/,False,6,1562877230,0,"What is going on I hear tons of police sirens, does anyone know what’s going on",True,False,False,Portland,t5_2qi2i,131044,public,self,Police sirens all over the city,0,1562963617,https://www.reddit.com/r/Portland/comments/cc0x0s/police_sirens_all_over_the_city/,all_ads,6,13a73d02-4254-11e1-9f6c-12313d2c1af1,dark,,,,,,,,,,,,
[],False,ztic,,[],,text,t2_16c4h0,False,False,False,1562874570,i.redd.it,https://www.reddit.com/r/Portland/comments/cc0cm2/portland_from_mt_tabor_clouds_and_all/,{},cc0cm2,True,False,False,True,True,False,False,,[],dark,text,False,False,True,0,0,False,all_ads,/r/Portland/comments/cc0cm2/portland_from_mt_tabor_clouds_and_all/,False,6,1562874578,0,,True,False,False,Portland,t5_2qi2i,131040,public,https://b.thumbs.redditmedia.com/2AOaXlPR2F2mkerkfRxzo9AmpseTGjfumYhCv5p_qAc.jpg,"Portland from Mt. Tabor, clouds and all.",0,1562960956,https://i.redd.it/41dkhi7saq931.jpg,all_ads,6,,,photo,Photo,image,"{'enabled': True, 'images': [{'id': '6jBaJmx0gccTM1JC2r9OJPLR6XiShRZAuX5eAQNJdUw', 'resolutions': [{'height': 144, 'url': 'https://preview.redd.it/41dkhi7saq931.jpg?width=108&amp;crop=smart&amp;auto=webp&amp;s=a9eb0ae152db26f4464d2f4ff6ecb97900d8c060', 'width': 108}, {'height': 288, 'url': 'https://preview.redd.it/41dkhi7saq931.jpg?width=216&amp;crop=smart&amp;auto=webp&amp;s=c938bbd78221f5d4db4eda78d1765eda86422c01', 'width': 216}, {'height': 426, 'url': 'https://preview.redd.it/41dkhi7saq931.jpg?width=320&amp;crop=smart&amp;auto=webp&amp;s=fb5c85e124a71e0e4a54d292d8fe0266d189d134', 'width': 320}, {'height': 853, 'url': 'https://preview.redd.it/41dkhi7saq931.jpg?width=640&amp;crop=smart&amp;auto=webp&amp;s=c0c260efab2d1013bbaac6bf0fb60114e7c825dc', 'width': 640}, {'height': 1280, 'url': 'https://preview.redd.it/41dkhi7saq931.jpg?width=960&amp;crop=smart&amp;auto=webp&amp;s=cf3db37747cb605476ab46f1defee1bd605ddaea', 'width': 960}, {'height': 1440, 'url': 'https://preview.redd.it/41dkhi7saq931.jpg?width=1080&amp;crop=smart&amp;auto=webp&amp;s=48baf4037b1a13a5e2d41c982ed7795154fedd23', 'width': 1080}], 'source': {'height': 4032, 'url': 'https://preview.redd.it/41dkhi7saq931.jpg?auto=webp&amp;s=fbdfb89b6f7a4ce6f2ff3264cb144b48d773b2b4', 'width': 3024}, 'variants': {}}]}",140.0,140.0,,,,,,
[],False,ColeTrain4EVER,,[],,text,t2_dqnoc,False,False,False,1562874489,thecup.us,https://www.reddit.com/r/Portland/comments/cc0bzo/the_portland_timbers_defeated_los_angeles_fc/,{},cc0bzo,True,False,False,False,True,False,False,,[],dark,text,False,False,True,30,0,False,all_ads,/r/Portland/comments/cc0bzo/the_portland_timbers_defeated_los_angeles_fc/,False,6,1562874491,313,,True,False,False,Portland,t5_2qi2i,131040,public,https://b.thumbs.redditmedia.com/KhJT52zGtwERZlVvVk7l_CTv6zzmtCwO-NJqYHLsiTQ.jpg,"The Portland Timbers defeated Los Angeles FC, which is currently leading Major League Soccer, last night in the U.S. Open Cup tournament to reach the semifinals",0,1562960875,https://thecup.us/2019/07/11/2019-us-open-cup-quarterfinals-portland-timbers-score-late-goal-to-eliminate-mls-front-runners-lafc/,all_ads,6,,,,,link,"{'enabled': False, 'images': [{'id': 'oq5qpmKHMzgPYhoBsEsA99i_GAo00Oaq-DoVx1svnZ0', 'resolutions': [{'height': 67, 'url': 'https://external-preview.redd.it/q656U5NEIUzCZyGG9QwaIGki4Lnng3NXBsQLaNYFFAM.jpg?width=108&amp;crop=smart&amp;auto=webp&amp;s=c7f872d1472ed00e8be1c4567b280842d57aff9d', 'width': 108}, {'height': 135, 'url': 'https://external-preview.redd.it/q656U5NEIUzCZyGG9QwaIGki4Lnng3NXBsQLaNYFFAM.jpg?width=216&amp;crop=smart&amp;auto=webp&amp;s=3ddcc84b7035f2da483518c1824d60b84ec12c38', 'width': 216}, {'height': 200, 'url': 'https://external-preview.redd.it/q656U5NEIUzCZyGG9QwaIGki4Lnng3NXBsQLaNYFFAM.jpg?width=320&amp;crop=smart&amp;auto=webp&amp;s=5fc4d5d5e2a25fa020e4363cc4fbb6f29a971d78', 'width': 320}, {'height': 400, 'url': 'https://external-preview.redd.it/q656U5NEIUzCZyGG9QwaIGki4Lnng3NXBsQLaNYFFAM.jpg?width=640&amp;crop=smart&amp;auto=webp&amp;s=8a8ae2040e8a2caf939751f623da78c3d60ee27d', 'width': 640}], 'source': {'height': 453, 'url': 'https://external-preview.redd.it/q656U5NEIUzCZyGG9QwaIGki4Lnng3NXBsQLaNYFFAM.jpg?auto=webp&amp;s=6a74b9ffcc5f7147b9f2c8d572a3aa9b2095cd26', 'width': 724}, 'variants': {}}]}",87.0,140.0,,,,,,
[],False,AutoModerator,,[],24 Hour Church of Elvis,text,t2_6l4z3,False,False,False,1562871950,self.Portland,https://www.reddit.com/r/Portland/comments/cbzrpu/weekly_rportland_events_july_11_2019/,{},cbzrpu,True,False,False,False,True,True,False,,[],dark,text,False,False,True,5,0,False,all_ads,/r/Portland/comments/cbzrpu/weekly_rportland_events_july_11_2019/,False,6,1562871951,5,"Please post notices about local events in this thread. Examples include upcoming:

* Entertainment like concerts, festivals, movies, etc.
* Natural events like eclipses, aurorae borealis, etc.
* Large-impact events like marathons and presidential visits 

**General rules:** 

If it's an answer to ""What's going on this weekend?"" it goes in here.

Never post personal information. Do that in PM and remember, safety first.

Per Rule #2, no advertising of events you make money from. Discussing a concert is okay, unless you're the ticket seller.

People looking for tickets, try the Weekly Classifieds thread (link is in the top menu and on sidebar, under ""CLASSIFIEDS"").",False,False,False,Portland,t5_2qi2i,131032,public,self,"WEEKLY /R/PORTLAND EVENTS: July 11, 2019",0,1562958333,https://www.reddit.com/r/Portland/comments/cbzrpu/weekly_rportland_events_july_11_2019/,all_ads,6,,dark,,,,,,,,,,,,
[],False,jMyles,,[],Foster-Powell,text,t2_65jml,False,False,False,1562871689,self.Portland,https://www.reddit.com/r/Portland/comments/cbzpk7/posting_photos_of_bicycles_and_alleged_bicycle/,{},cbzpk7,True,False,False,False,True,True,False,,[],dark,text,False,False,True,116,0,False,all_ads,/r/Portland/comments/cbzpk7/posting_photos_of_bicycles_and_alleged_bicycle/,False,6,1562871690,32,"Hey Portland friends.

I apparently violated a rule of this sub - the rules against ""creepshots"" - by going to an area that someone had posted on craigslist (65th and Powell) and taking some photos and posting them here.

I'm very saddened by this.  I thought I was doing a good deed.  

I had a bike stolen three days ago.  I thought I might find it at a place like the one at 65th and Powell.  When it wasn't there, I thought, ""well, these bikes might belong to others, I might as well get some photos.""  So I did.  

A man started yelling at me; I took his photo too.

I just want to have a discussion about this: is this really the kind of content we want to push out of this sub?  I know that if my bike were one of those depicted, I'd love to know its location.

There was nothing even vaguely ""creepy"" about any of these photos - they were taken in full public view on a public sidewalk.

I ask that this rule be amended to clarify that pictures taken in public are permissible.  Looking at the front page of this sub, there are plenty of links to newspaper and other articles which have photos of public spaces with recognizable faces.  Is it different because I happen not to be in the employ of a newspaper?",True,False,False,Portland,t5_2qi2i,131032,public,self,Posting photos of bicycles and alleged bicycle chop shops - not allowed?,0,1562958071,https://www.reddit.com/r/Portland/comments/cbzpk7/posting_photos_of_bicycles_and_alleged_bicycle/,all_ads,6,,dark,,,,,,,,,,,,
[],False,TheDingalingus,,[],SE,text,t2_kuhos,False,False,False,1562871580,self.Portland,https://www.reddit.com/r/Portland/comments/cbzopq/tenant_attorney/,{},cbzopq,True,False,False,False,True,True,False,,[],dark,text,False,False,True,4,0,False,all_ads,/r/Portland/comments/cbzopq/tenant_attorney/,False,6,1562871585,0,"Howdy folks. Posting this both here and /r/askportland in hopes it reaches someone with experience/recommendations. 


I could go into the long story, but I’ll save you the reading - I need legal consult regarding unlawful entry/landlord burglarizing my apartment/constructive eviction, and quick. My budget isn’t astronomical, so a free/low cost consult to see if this is practical to pursue is preferred. 
I’ve left messages with the Community Alliance of Tenants, and called the bar referral line. Google can be daunting with the mass of results and I was hoping someone else out there who has had to deal with a horrifically bas landlord had a recommendation!",True,False,False,Portland,t5_2qi2i,131032,public,self,Tenant attorney?,0,1562957962,https://www.reddit.com/r/Portland/comments/cbzopq/tenant_attorney/,all_ads,6,,dark,,,,,,,,,,,,
[],False,blappiep,,[],,text,t2_3a2vxtre,False,False,False,1562870516,i.redd.it,https://www.reddit.com/r/Portland/comments/cbzghr/peacock_waiting_for_the_bus_615_am/,{},cbzghr,True,False,False,True,True,False,False,,[],dark,text,False,False,True,48,0,False,all_ads,/r/Portland/comments/cbzghr/peacock_waiting_for_the_bus_615_am/,False,6,1562870517,465,,True,False,False,Portland,t5_2qi2i,131031,public,default,"Peacock waiting for the bus, 6:15 am",0,1562956904,https://i.redd.it/voackuotyp931.jpg,all_ads,6,,,,,,,,,,,,,,
[],False,ALutzy,,[],,text,t2_1ex6eo2s,False,False,False,1562869662,self.Portland,https://www.reddit.com/r/Portland/comments/cbz9qr/grand_opening_at_omni_portland_friday_july_19th/,{},cbz9qr,True,False,False,False,True,True,False,,[],dark,text,False,False,True,6,0,False,all_ads,/r/Portland/comments/cbz9qr/grand_opening_at_omni_portland_friday_july_19th/,False,6,1562869664,0,"My company is hosting a free event for our Portland community.  

&amp;#x200B;

Come celebrate the official grand opening of [OMNI PDX](http://omni.co/)! We are Portland's rental hub for mostly anything. Enjoy an evening of great music at an intimate venue with a beautiful community of people. 

Anyone attending will have the opportunity to use a promo code for free rentals.  
100% of donations go directly to the band!

[About Omni:](https://omni.co/s?g_id=&amp;metro=portland)

Omni is a tech startup specializing in rentals. Here at Omni, we believe in experiences over things, access over ownership, and living lighter rather than being weighed down by our possessions. Members use our digital marketplace to shop rentable items in Portland. Renters also use our app to rent things at the push of a button. Out storefront allows users to pick up their rented items within minutes. Omni rents anything from costumes to adventure equipment and even drones! Together, we’re building a community that values experiences over things. Our services are currently available in the San Francisco Bay Area, New York City, Los Angeles, and Portland. 

[About the band: ](http://www.theriversidefolk.com/)

The Riverside is a band of friends from California and Texas, founded by husband and wife duo, Jacob and Lorien Jeanson. Circled around one microphone, the band relies on one another to find balance in their music. This traditional type of performance is one that seems to be drowned out in a world of loud music. With vocal harmony and their folk-rooted stringed instruments, the band paints landscapes and tells their stories.

Through traveling the country together and speaking honestly about many highs and lows, The Riverside strives to be a family that grows together, and a band that helps listeners carry on down this life's winding river.

Even if you can not make it please check out this amazing group of talented musicians.  [https://youtu.be/73d8sHHViq0](https://youtu.be/73d8sHHViq0)

Please Let me know if you'd like to attend!  It'll be a great company of local folks into access over ownership.  Also let me know if you have any questions about our company!! I'd love to spread the word even if you can't attend.  Thanks to the moderators for giving me permission to pass along an invite to our party and let the community know about Omni!",True,False,False,Portland,t5_2qi2i,131029,public,self,"Grand Opening at OMNI - Portland, Friday July 19th at 7PM. Free Event w/Music from The Riverside, foods, refreshments, community, and free rentals!!",0,1562956046,https://www.reddit.com/r/Portland/comments/cbz9qr/grand_opening_at_omni_portland_friday_july_19th/,all_ads,6,,,,,,,,,,,,,,
[],False,Fuck_Yo_Carrots,,[],,text,t2_340jy92o,False,False,False,1562869012,youtu.be,https://www.reddit.com/r/Portland/comments/cbz4r1/joe_rogan_experience_1323_andy_ngo/,{},cbz4r1,False,False,False,False,False,False,False,,[],dark,text,False,False,True,0,0,False,all_ads,/r/Portland/comments/cbz4r1/joe_rogan_experience_1323_andy_ngo/,False,6,1562869013,1,,False,False,False,Portland,t5_2qi2i,131029,public,https://b.thumbs.redditmedia.com/ISurNqRM08628nGTdssmexZS_WO-cSlQr_VlMjAYPlY.jpg,Joe Rogan Experience #1323 - Andy Ngo,0,1562955393,https://youtu.be/cI2EHMy1lgs,all_ads,6,,,,,rich:video,"{'enabled': False, 'images': [{'id': 'pRp4gxMlv5-KG3C0PENLYY8kZPEkMMW2c6BcmwmfxcI', 'resolutions': [{'height': 81, 'url': 'https://external-preview.redd.it/VQYL1hiN_1GV1UWELA_1AvMAVG4hEC4LPp7W2BFWa2E.jpg?width=108&amp;crop=smart&amp;auto=webp&amp;s=71cbfdd6a38684118fe08c3bcad52e9849bd0d27', 'width': 108}, {'height': 162, 'url': 'https://external-preview.redd.it/VQYL1hiN_1GV1UWELA_1AvMAVG4hEC4LPp7W2BFWa2E.jpg?width=216&amp;crop=smart&amp;auto=webp&amp;s=fe8b9c599d430d16d941021f1aa4013485b7d683', 'width': 216}, {'height': 240, 'url': 'https://external-preview.redd.it/VQYL1hiN_1GV1UWELA_1AvMAVG4hEC4LPp7W2BFWa2E.jpg?width=320&amp;crop=smart&amp;auto=webp&amp;s=08d0a55955957dc58eba2aeb551dcafd75be70dc', 'width': 320}], 'source': {'height': 360, 'url': 'https://external-preview.redd.it/VQYL1hiN_1GV1UWELA_1AvMAVG4hEC4LPp7W2BFWa2E.jpg?auto=webp&amp;s=90eb795aaad1f712af3949a6d529d15893f02aac', 'width': 480}, 'variants': {}}]}",105.0,140.0,,,"{'oembed': {'author_name': 'PowerfulJRE', 'author_url': 'https://www.youtube.com/user/PowerfulJRE', 'height': 338, 'html': '&lt;iframe width=""600"" height=""338"" src=""https://www.youtube.com/embed/cI2EHMy1lgs?feature=oembed&amp;enablejsapi=1"" frameborder=""0"" allow=""accelerometer; autoplay; encrypted-media; gyroscope; picture-in-picture"" allowfullscreen&gt;&lt;/iframe&gt;', 'provider_name': 'YouTube', 'provider_url': 'https://www.youtube.com/', 'thumbnail_height': 360, 'thumbnail_url': 'https://i.ytimg.com/vi/cI2EHMy1lgs/hqdefault.jpg', 'thumbnail_width': 480, 'title': 'Joe Rogan Experience #1323 - Andy Ngo', 'type': 'video', 'version': '1.0', 'width': 600}, 'type': 'youtube.com'}","{'content': '&lt;iframe width=""600"" height=""338"" src=""https://www.youtube.com/embed/cI2EHMy1lgs?feature=oembed&amp;enablejsapi=1"" frameborder=""0"" allow=""accelerometer; autoplay; encrypted-media; gyroscope; picture-in-picture"" allowfullscreen&gt;&lt;/iframe&gt;', 'height': 338, 'scrolling': False, 'width': 600}","{'oembed': {'author_name': 'PowerfulJRE', 'author_url': 'https://www.youtube.com/user/PowerfulJRE', 'height': 338, 'html': '&lt;iframe width=""600"" height=""338"" src=""https://www.youtube.com/embed/cI2EHMy1lgs?feature=oembed&amp;enablejsapi=1"" frameborder=""0"" allow=""accelerometer; autoplay; encrypted-media; gyroscope; picture-in-picture"" allowfullscreen&gt;&lt;/iframe&gt;', 'provider_name': 'YouTube', 'provider_url': 'https://www.youtube.com/', 'thumbnail_height': 360, 'thumbnail_url': 'https://i.ytimg.com/vi/cI2EHMy1lgs/hqdefault.jpg', 'thumbnail_width': 480, 'title': 'Joe Rogan Experience #1323 - Andy Ngo', 'type': 'video', 'version': '1.0', 'width': 600}, 'type': 'youtube.com'}","{'content': '&lt;iframe width=""600"" height=""338"" src=""https://www.youtube.com/embed/cI2EHMy1lgs?feature=oembed&amp;enablejsapi=1"" frameborder=""0"" allow=""accelerometer; autoplay; encrypted-media; gyroscope; picture-in-picture"" allowfullscreen&gt;&lt;/iframe&gt;', 'height': 338, 'media_domain_url': 'https://www.redditmedia.com/mediaembed/cbz4r1', 'scrolling': False, 'width': 600}"
