author,author_flair_background_color,author_flair_css_class,author_flair_richtext,author_flair_template_id,author_flair_text,author_flair_text_color,author_flair_type,author_fullname,author_patreon_flair,can_mod_post,contest_mode,created_utc,domain,full_link,gildings,id,is_crosspostable,is_meta,is_original_content,is_reddit_media_domain,is_robot_indexable,is_self,is_video,link_flair_background_color,link_flair_richtext,link_flair_text_color,link_flair_type,locked,media_only,no_follow,num_comments,num_crossposts,over_18,parent_whitelist_status,permalink,pinned,pwls,retrieved_on,score,selftext,send_replies,spoiler,stickied,subreddit,subreddit_id,subreddit_subscribers,subreddit_type,thumbnail,title,updated_utc,url,whitelist_status,wls,post_hint,preview,link_flair_css_class,link_flair_text,thumbnail_height,thumbnail_width
DGHOST_XCI,,,[],,,,text,t2_35cde24r,False,False,False,1555644015,self.Portland,https://www.reddit.com/r/Portland/comments/beujo2/my_new_home_new_to_reddit/,"{'gid_1': 0, 'gid_2': 0, 'gid_3': 0}",beujo2,True,False,False,False,True,True,False,,[],dark,text,False,False,True,11,0,False,all_ads,/r/Portland/comments/beujo2/my_new_home_new_to_reddit/,False,6,1555644016,0,"Bonjour et enchanté!  I transferred from Socal with my job and have been here in the ""City of Roses"" since September. My Girlfriend and I absolutely love it up here. I am glad I found a Reddit group just for Portland. Au revoir.",True,False,False,Portland,t5_2qi2i,123840,public,self,My new home. New to Reddit.,1555730417,https://www.reddit.com/r/Portland/comments/beujo2/my_new_home_new_to_reddit/,all_ads,6,,,,,,
impressiver,,,[],,,,text,t2_96xtq,False,False,False,1555641039,i.redd.it,https://www.reddit.com/r/Portland/comments/beu3cw/discovered_a_few_ants_in_our_xbox_more_than_a_few/,"{'gid_1': 0, 'gid_2': 0, 'gid_3': 0}",beu3cw,True,False,False,True,True,False,False,,[],dark,text,False,False,True,77,0,False,all_ads,/r/Portland/comments/beu3cw/discovered_a_few_ants_in_our_xbox_more_than_a_few/,False,6,1555641040,57,,True,False,False,Portland,t5_2qi2i,123838,public,default,Discovered a few ants in our Xbox (more than a few),1555727424,https://i.redd.it/x8l2s1azt4t21.jpg,all_ads,6,,,,,,
mecopian,,,[],,,,text,t2_i5x75mi,False,False,False,1555640920,self.Portland,https://www.reddit.com/r/Portland/comments/beu2oh/lost_wallet_on_bus_94/,"{'gid_1': 0, 'gid_2': 0, 'gid_3': 0}",beu2oh,True,False,False,False,True,True,False,,[],dark,text,False,False,True,1,0,False,all_ads,/r/Portland/comments/beu2oh/lost_wallet_on_bus_94/,False,6,1555640921,13,If you’ve lost your wallet on bus 94( black wallet with several cards including a chase blue). Get in touch with TriMet. I’ve handed it over to the driver.,True,False,False,Portland,t5_2qi2i,123837,public,self,Lost wallet on Bus 94???,1555727297,https://www.reddit.com/r/Portland/comments/beu2oh/lost_wallet_on_bus_94/,all_ads,6,,,,,,
rabbot3,,,[],,,,text,t2_rlt08,False,False,False,1555638681,imgur.com,https://www.reddit.com/r/Portland/comments/betq9t/not_the_best_placetiming_to_break_down_during/,"{'gid_1': 0, 'gid_2': 0, 'gid_3': 0}",betq9t,True,False,False,False,True,False,False,,[],dark,text,False,False,True,5,0,False,all_ads,/r/Portland/comments/betq9t/not_the_best_placetiming_to_break_down_during/,False,6,1555638682,0,,True,False,False,Portland,t5_2qi2i,123832,public,default,Not the best place/timing to break down during rush hour traffic.,1555725062,https://imgur.com/NoUZmen,all_ads,6,,,photo,Photo,,
rabbot3,,,[],,,,text,t2_rlt08,False,False,False,1555638586,imgur.com,https://www.reddit.com/r/Portland/comments/betprj/not_the_best_placetiming_to_break_down_during/,"{'gid_1': 0, 'gid_2': 0, 'gid_3': 0}",betprj,True,False,False,False,True,False,False,,[],dark,text,False,False,True,0,0,False,all_ads,/r/Portland/comments/betprj/not_the_best_placetiming_to_break_down_during/,False,6,1555638587,1,,True,False,False,Portland,t5_2qi2i,123832,public,default,Not the best place/timing to break down during rush our traffic...,1555725018,https://imgur.com/mXnRqNE,all_ads,6,,,photo,Photo,,
Liraella,,,[],,,,text,t2_mt550r3,False,False,False,1555635513,self.Portland,https://www.reddit.com/r/Portland/comments/bet84z/any_recommendations_on_mental_health_providers_in/,"{'gid_1': 0, 'gid_2': 0, 'gid_3': 0}",bet84z,True,False,False,False,True,True,False,,[],dark,text,False,False,True,5,0,False,all_ads,/r/Portland/comments/bet84z/any_recommendations_on_mental_health_providers_in/,False,6,1555635514,0,"I'm hoping to find a psychiatrist for combined therapy and medication management, but open to non-prescribing providers as well. I've got Providence insurance, and am working full-time, so someone with availabilities outside of 9-5 on weekdays would be ideal.

I've been checking through various sites like Psychology Today and Portland Therapy Center, but they don't really offer user reviews or anything like that, so I'm reaching out here in the hopes of getting people's feedback on their experiences.",False,False,False,Portland,t5_2qi2i,123826,public,self,Any recommendations on mental health providers in NE Portland?,1555721894,https://www.reddit.com/r/Portland/comments/bet84z/any_recommendations_on_mental_health_providers_in/,all_ads,6,,,,,,
tajones1992,,,[],,,,text,t2_1tyya2xa,False,False,False,1555634165,i.redd.it,https://www.reddit.com/r/Portland/comments/bet07z/was_planning_to_adopt_the_chonk_before_another/,"{'gid_1': 0, 'gid_2': 0, 'gid_3': 0}",bet07z,True,False,False,True,True,False,False,,[],dark,text,False,False,True,58,0,False,all_ads,/r/Portland/comments/bet07z/was_planning_to_adopt_the_chonk_before_another/,False,6,1555634166,454,,True,False,False,Portland,t5_2qi2i,123826,public,default,"Was planning to adopt The Chonk before another adopted him first, but thanks to a comment from u/notanotherjennifer another chonky kitty who needed a home was brought into my life and I couldn’t be happier. Reddit, meet Norah :)",1555720540,https://i.redd.it/zi2ssz8j94t21.jpg,all_ads,6,,,photo,Photo,,
Pinkmongoose,,,[],,,,text,t2_zyr18,False,False,False,1555633759,self.Portland,https://www.reddit.com/r/Portland/comments/besxsc/whats_going_on_for_420/,"{'gid_1': 0, 'gid_2': 0, 'gid_3': 0}",besxsc,True,False,False,False,True,True,False,,[],dark,text,False,False,True,11,0,False,all_ads,/r/Portland/comments/besxsc/whats_going_on_for_420/,False,6,1555633760,0,"It's on a weekend this year! Wondering if there are any fun festivals, or any businesses doing fun stuff for 4/20?",True,False,False,Portland,t5_2qi2i,123826,public,self,What's Going On for 420?,1555720215,https://www.reddit.com/r/Portland/comments/besxsc/whats_going_on_for_420/,all_ads,6,,,,,,
Sgsquints,,,[],,,,text,t2_p4ba1uz,False,False,False,1555632524,self.Portland,https://www.reddit.com/r/Portland/comments/besq81/informal_survey/,"{'gid_1': 0, 'gid_2': 0, 'gid_3': 0}",besq81,False,False,False,False,False,True,False,,[],dark,text,False,False,True,20,0,False,all_ads,/r/Portland/comments/besq81/informal_survey/,False,6,1555632525,0,[removed],True,False,False,Portland,t5_2qi2i,123825,public,self,Informal Survey!,1555718911,https://www.reddit.com/r/Portland/comments/besq81/informal_survey/,all_ads,6,,,,,,
bkerensa,,,[],,NE,dark,text,t2_35ak6,False,False,False,1555632491,twitter.com,https://www.reddit.com/r/Portland/comments/besq06/list_of_portland_police_officers_that_are/,"{'gid_1': 0, 'gid_2': 0, 'gid_3': 0}",besq06,True,False,False,False,True,False,False,,[],dark,text,False,False,True,30,0,False,all_ads,/r/Portland/comments/besq06/list_of_portland_police_officers_that_are/,False,6,1555632492,77,,True,False,False,Portland,t5_2qi2i,123825,public,default,List of Portland Police Officers that are distrusted by prosecutors,1555718873,https://twitter.com/bkerensa/status/1119026068684328960?s=21,all_ads,6,,,,,,
mileswood,,,[],,,,text,t2_2rp4tyho,False,False,False,1555630236,i.redd.it,https://www.reddit.com/r/Portland/comments/besce0/you_need_this_portland/,"{'gid_1': 0, 'gid_2': 0, 'gid_3': 0}",besce0,True,False,False,True,True,False,False,,[],dark,text,False,False,True,15,0,False,all_ads,/r/Portland/comments/besce0/you_need_this_portland/,False,6,1555630237,0,,True,False,False,Portland,t5_2qi2i,123820,public,https://a.thumbs.redditmedia.com/nfQ-H7DYZhdY-R-T9udDXfiM2_l4eUZ7N1FUlrD_i40.jpg,You need this Portland.,1555716624,https://i.redd.it/5zbkpm6vx3t21.jpg,all_ads,6,image,"{'enabled': True, 'images': [{'id': 'ILJWaokdgmxYJK-7RemH8GaC_4RIrNHFKGAMwD0QRdM', 'resolutions': [{'height': 97, 'url': 'https://preview.redd.it/5zbkpm6vx3t21.jpg?width=108&amp;crop=smart&amp;auto=webp&amp;s=246ac41c89b971b33ac7d8ff0f1d9754ee0a7931', 'width': 108}, {'height': 195, 'url': 'https://preview.redd.it/5zbkpm6vx3t21.jpg?width=216&amp;crop=smart&amp;auto=webp&amp;s=8b4a300f9e28c9942b7052991109b7d38d520dc4', 'width': 216}, {'height': 289, 'url': 'https://preview.redd.it/5zbkpm6vx3t21.jpg?width=320&amp;crop=smart&amp;auto=webp&amp;s=6b782bbe805831d160df2be1a0dd47532e5a17c4', 'width': 320}], 'source': {'height': 576, 'url': 'https://preview.redd.it/5zbkpm6vx3t21.jpg?auto=webp&amp;s=12ed1d5b34cd18877fdf45161e57a6bce3098160', 'width': 637}, 'variants': {}}]}",photo,Photo,126.0,140.0
DamuBob,,,[],,,,text,t2_16vll4y8,False,False,False,1555630210,self.Portland,https://www.reddit.com/r/Portland/comments/besc7i/love_renewable_energy_meet_and_greet_for/,"{'gid_1': 0, 'gid_2': 0, 'gid_3': 0}",besc7i,True,False,False,False,True,True,False,,[],dark,text,False,False,True,5,0,False,all_ads,/r/Portland/comments/besc7i/love_renewable_energy_meet_and_greet_for/,False,6,1555630211,4,"Hey everyone! I help run a non-profit, Northwest Energy Education Team, which is having a Meet-and-Greet on 4/30. We are a public outreach group with a focus on increasing public science literacy, especially in regards to renewable energy. We are looking for people interested in working with us to table events, such as the Oregon Country Fair, providing fun and accurate information about renewable energy---from how PV cells work to whats the hot new technology. Anyone working in, studying, or with an interest in renewable energy, engineering, or education are welcome to join us 4/30 for more information. Details about the event can be found here: [https://www.facebook.com/events/270151180596592/](https://www.facebook.com/events/270151180596592/)",True,False,False,Portland,t5_2qi2i,123820,public,self,"Love renewable energy? Meet and Greet for professionals, educators, and students! Help promote science literacy!",1555716621,https://www.reddit.com/r/Portland/comments/besc7i/love_renewable_energy_meet_and_greet_for/,all_ads,6,,,,,,
sirrkitt,,,[],,,,text,t2_d0ilg,False,False,False,1555625994,self.Portland,https://www.reddit.com/r/Portland/comments/berjvb/looking_for_a_century_mobile_tech_i_guess/,"{'gid_1': 0, 'gid_2': 0, 'gid_3': 0}",berjvb,True,False,False,False,True,True,False,,[],dark,text,False,False,True,3,0,False,all_ads,/r/Portland/comments/berjvb/looking_for_a_century_mobile_tech_i_guess/,False,6,1555625995,0,"Long story short, CenturyLink just installed fibre and are offering gigabit speeds in my neighborhood but the issue is that my address wasn't updated in their system to reflect this. I've called a few times and the sales reps in the call centers say that the only way to get the gigabit fibre service is to find a CenturyLink technician that can update our address in the system or call it in to be updated because apparently the call center employees aren't able to do this. I've tried reaching out to CenturyLink's Twitter as well but that hasn't been very fruitful, either. Anyone have any ideas to share? Thanks!",True,False,False,Portland,t5_2qi2i,123820,public,self,"Looking for a Century Mobile Tech, I guess?",1555712419,https://www.reddit.com/r/Portland/comments/berjvb/looking_for_a_century_mobile_tech_i_guess/,all_ads,6,,,,,,
democracylatermaybe,,,[],,,,text,t2_2ixqf348,False,False,False,1555625166,i.redd.it,https://www.reddit.com/r/Portland/comments/bereaf/hey_rportland_we_have_24_hour_bus_service_i_was/,"{'gid_1': 0, 'gid_2': 0, 'gid_3': 0}",bereaf,True,False,False,True,True,False,False,,[],dark,text,False,False,True,149,0,False,all_ads,/r/Portland/comments/bereaf/hey_rportland_we_have_24_hour_bus_service_i_was/,False,6,1555625167,1252,,True,False,False,Portland,t5_2qi2i,123818,public,default,Hey /r/Portland we have 24 hour bus service. I was hit by a likely drunk driver right in front of of a bus stop. Put your drunk ass on the bus.,1555711551,https://i.redd.it/yywu6deqi3t21.jpg,all_ads,6,,,,,,
ajshraf777,,,[],,,,text,t2_l9nyt8f,False,False,False,1555624614,self.Portland,https://www.reddit.com/r/Portland/comments/berafx/moving_to_portland_this_summer_what_neighborhoods/,"{'gid_1': 0, 'gid_2': 0, 'gid_3': 0}",berafx,True,False,False,False,True,True,False,,[],dark,text,False,False,True,1,0,False,all_ads,/r/Portland/comments/berafx/moving_to_portland_this_summer_what_neighborhoods/,False,6,1555624615,1,,True,False,False,Portland,t5_2qi2i,123817,public,self,Moving to Portland this Summer. What neighborhoods are the best and worst to live in?,1555710995,https://www.reddit.com/r/Portland/comments/berafx/moving_to_portland_this_summer_what_neighborhoods/,all_ads,6,,,,,,
hillsons,,,[],,,,text,t2_bj1c4,False,False,False,1555623880,koin.com,https://www.reddit.com/r/Portland/comments/ber5uf/harney_county_sheriff_to_resign_over_lack_of/,"{'gid_1': 0, 'gid_2': 0, 'gid_3': 0}",ber5uf,True,False,False,False,True,False,False,,[],dark,text,False,False,True,9,0,False,all_ads,/r/Portland/comments/ber5uf/harney_county_sheriff_to_resign_over_lack_of/,False,6,1555623881,8,,True,False,False,Portland,t5_2qi2i,123816,public,default,Harney County Sheriff to resign over (lack of) funding,1555710267,https://www.koin.com/news/oregon/harney-county-sheriff-to-resign-over-funding/1937011012,all_ads,6,,,,,,
Caged,,,[],,,,text,t2_dfk9,False,False,False,1555621701,pdx.eater.com,https://www.reddit.com/r/Portland/comments/beqriw/crestonkenilworth_is_getting_a_long_overdue/,"{'gid_1': 0, 'gid_2': 0, 'gid_3': 0}",beqriw,True,False,False,False,True,False,False,,[],dark,text,False,False,True,18,0,False,all_ads,/r/Portland/comments/beqriw/crestonkenilworth_is_getting_a_long_overdue/,False,6,1555621703,21,,True,False,False,Portland,t5_2qi2i,123813,public,default,Creston-Kenilworth is Getting a Long Overdue Dining Upgrade,1555708083,https://pdx.eater.com/2019/3/28/18285819/powell-marketplace-food-cart-qpdx-bbq-beer-opening,all_ads,6,,,,,,
slingshotrobot,,,[],,,,text,t2_behpvgp,False,False,False,1555620592,wweek.com,https://www.reddit.com/r/Portland/comments/beqk10/trimet_barber_banned_for_life_from_riding_the_bus/,"{'gid_1': 0, 'gid_2': 0, 'gid_3': 0}",beqk10,True,False,False,False,True,False,False,,[],dark,text,False,False,True,38,0,False,all_ads,/r/Portland/comments/beqk10/trimet_barber_banned_for_life_from_riding_the_bus/,False,6,1555620592,120,,False,False,False,Portland,t5_2qi2i,123812,public,default,“TriMet Barber” Banned for Life From Riding the Bus,1555707019,https://www.wweek.com/news/2019/04/18/trimet-barber-banned-for-life-from-riding-the-bus/,all_ads,6,,,,,,
pretzelbreath,,,[],,,,text,t2_dd3qq,False,False,False,1555619751,self.Portland,https://www.reddit.com/r/Portland/comments/beqekc/have_any_of_you_parents_had_any_experience_with/,"{'gid_1': 0, 'gid_2': 0, 'gid_3': 0}",beqekc,True,False,False,False,True,True,False,,[],dark,text,False,False,True,2,0,False,all_ads,/r/Portland/comments/beqekc/have_any_of_you_parents_had_any_experience_with/,False,6,1555619752,0,My kid just got offered a position.  I know some charters can be mickey mouse and lacking.  some can be great.  Our neighborhood school isn't the best.  Is it a good place for an education and for the kids?,True,False,False,Portland,t5_2qi2i,123811,public,self,Have any of you parents had any experience with Lewis and Clark Charter Montessori,1555706130,https://www.reddit.com/r/Portland/comments/beqekc/have_any_of_you_parents_had_any_experience_with/,all_ads,6,,,,,,
DommeChristi,,,[],,,,text,t2_wdaq4,False,False,False,1555619082,i.redd.it,https://www.reddit.com/r/Portland/comments/beqa9t/gorgeous_view_of_the_fremont_bridge_this_morning/,"{'gid_1': 0, 'gid_2': 0, 'gid_3': 0}",beqa9t,True,False,False,True,True,False,False,,[],dark,text,False,False,True,11,0,False,all_ads,/r/Portland/comments/beqa9t/gorgeous_view_of_the_fremont_bridge_this_morning/,False,6,1555619084,119,,True,False,False,Portland,t5_2qi2i,123809,public,default,Gorgeous view of the Fremont Bridge this morning (NW Waterfront),1555705466,https://i.redd.it/oy964qvo03t21.jpg,all_ads,6,,,,,,
terryrozierfan,,,[],,,,text,t2_1cbd2dd2,False,False,False,1555618011,self.Portland,https://www.reddit.com/r/Portland/comments/beq38b/outdoor_basketball_courts_downtown/,"{'gid_1': 0, 'gid_2': 0, 'gid_3': 0}",beq38b,True,False,False,False,True,True,False,,[],dark,text,False,False,True,7,0,False,all_ads,/r/Portland/comments/beq38b/outdoor_basketball_courts_downtown/,False,6,1555618013,0,"Hi!

I used to live in Northeast Portland, very close to Irving Park and would play basketball there every week during the nice weather months, but now live downtown and can't seem to find any local outdoor (or indoor) courts aside from 24 hour fitness, but don't really wanna pay for that every month. Does anyone know of any courts in the downtown, goose hollow, or sw/nw area by chance?? Thanks so much!!",True,False,False,Portland,t5_2qi2i,123807,public,self,Outdoor basketball courts downtown???,1555704393,https://www.reddit.com/r/Portland/comments/beq38b/outdoor_basketball_courts_downtown/,all_ads,6,,,,,,
SimplyTim90,,,[],,,,text,t2_14c7fg,False,False,False,1555616165,i.redd.it,https://www.reddit.com/r/Portland/comments/bepqps/also_applicable_with_rain/,"{'gid_1': 0, 'gid_2': 0, 'gid_3': 0}",bepqps,True,False,False,True,True,False,False,,[],dark,text,False,False,True,9,0,False,all_ads,/r/Portland/comments/bepqps/also_applicable_with_rain/,False,6,1555616165,2,,True,False,False,Portland,t5_2qi2i,123807,public,default,Also applicable with rain,1555702551,https://i.redd.it/hrwkhes0s2t21.jpg,all_ads,6,,,,,,
frankiemandala,,,[],,,,text,t2_3807x8h,False,False,False,1555615549,self.Portland,https://www.reddit.com/r/Portland/comments/bepmjx/anyone_know_of_any_parties_or_shows_going_on/,"{'gid_1': 0, 'gid_2': 0, 'gid_3': 0}",bepmjx,True,False,False,False,True,True,False,,[],dark,text,False,False,True,8,0,False,all_ads,/r/Portland/comments/bepmjx/anyone_know_of_any_parties_or_shows_going_on/,False,6,1555615550,1,"New here, looking for something to do.",True,False,False,Portland,t5_2qi2i,123807,public,self,Anyone know of any parties or shows going on tomorrow for bicycle day?,1555701936,https://www.reddit.com/r/Portland/comments/bepmjx/anyone_know_of_any_parties_or_shows_going_on/,all_ads,6,,,,,,
louderharderfaster,,,[],,,,text,t2_z8twz,False,False,False,1555615513,self.Portland,https://www.reddit.com/r/Portland/comments/bepmbo/best_temp_agencies_in_portland_area/,"{'gid_1': 0, 'gid_2': 0, 'gid_3': 0}",bepmbo,True,False,False,False,True,True,False,,[],dark,text,False,False,True,8,0,False,all_ads,/r/Portland/comments/bepmbo/best_temp_agencies_in_portland_area/,False,6,1555615515,0,I am looking for part or full-time temp work for the summer and would appreciate any insight on the best local agencies to work with. TIA!,True,False,False,Portland,t5_2qi2i,123807,public,self,Best Temp Agencies in Portland area?,1555701902,https://www.reddit.com/r/Portland/comments/bepmbo/best_temp_agencies_in_portland_area/,all_ads,6,,,,,,
Oneiropticon,,,[],,,,text,t2_c1yn3,False,False,False,1555615306,self.Portland,https://www.reddit.com/r/Portland/comments/bepkvr/urgent_care_for_the_uninsured/,"{'gid_1': 0, 'gid_2': 0, 'gid_3': 0}",bepkvr,True,False,False,False,True,True,False,,[],dark,text,False,False,True,7,0,False,all_ads,/r/Portland/comments/bepkvr/urgent_care_for_the_uninsured/,False,6,1555615308,1,"Has anyone gone to urgent care without insurance and had a reasonably good experience? I've been having a consistent issue for over a week now, and I think it's time to actually see someone for it, but I'm a delivery driver not earning much.",True,False,False,Portland,t5_2qi2i,123807,public,self,Urgent care for the uninsured?,1555701689,https://www.reddit.com/r/Portland/comments/bepkvr/urgent_care_for_the_uninsured/,all_ads,6,,,,,,
Rick_Shasta,,,[],,Buckman,dark,text,t2_d6zct,False,False,False,1555612975,imgur.com,https://www.reddit.com/r/Portland/comments/bep549/james_b_and_elizabeth_stephens_headstone/,"{'gid_1': 0, 'gid_2': 0, 'gid_3': 0}",bep549,True,False,False,False,True,False,False,,[],dark,text,False,False,True,5,0,False,all_ads,/r/Portland/comments/bep549/james_b_and_elizabeth_stephens_headstone/,False,6,1555612977,8,,True,False,False,Portland,t5_2qi2i,123806,public,default,James B. and Elizabeth Stephens Headstone,1555699362,https://imgur.com/a/aW6tgX3,all_ads,6,,,photo,Photo,,
Killahmeetahs,,,[],,,,text,t2_17hgaj,False,False,False,1555611271,i.redd.it,https://www.reddit.com/r/Portland/comments/beoth1/portland_sun_today_felt_cute_might_delete_later/,"{'gid_1': 0, 'gid_2': 0, 'gid_3': 0}",beoth1,True,False,False,True,True,False,False,,[],dark,text,False,False,True,1,0,False,all_ads,/r/Portland/comments/beoth1/portland_sun_today_felt_cute_might_delete_later/,False,6,1555611272,0,,True,False,False,Portland,t5_2qi2i,123806,public,default,Portland Sun today: “Felt cute; might delete later.”,1555697660,https://i.redd.it/314x8pzfd2t21.jpg,all_ads,6,,,photo,Photo,,
agentmantis,,,[],,,,text,t2_i0phs,False,False,False,1555610913,self.Portland,https://www.reddit.com/r/Portland/comments/beor1r/who_else_misses_rick_emerson/,"{'gid_1': 0, 'gid_2': 0, 'gid_3': 0}",beor1r,True,False,False,False,True,True,False,,[],dark,text,False,False,True,8,0,False,all_ads,/r/Portland/comments/beor1r/who_else_misses_rick_emerson/,False,6,1555610915,0,I miss his banter so much. I also think his Podcast he had before going off the air for good was poorly timed unfortunately. I think he'd have much more success in today's climate.,True,False,False,Portland,t5_2qi2i,123806,public,self,Who else misses Rick Emerson?,1555697296,https://www.reddit.com/r/Portland/comments/beor1r/who_else_misses_rick_emerson/,all_ads,6,,,,,,
MocoPDX,,,[],99b16bd2-42fb-11e1-90ec-12313d096aae,Boise,dark,text,t2_9m6it,False,False,False,1555610657,self.Portland,https://www.reddit.com/r/Portland/comments/beop97/spring_hikes_with_mountain_views/,"{'gid_1': 0, 'gid_2': 0, 'gid_3': 0}",beop97,True,False,False,False,True,True,False,,[],dark,text,False,False,True,5,0,False,all_ads,/r/Portland/comments/beop97/spring_hikes_with_mountain_views/,False,6,1555610658,0,"Howdy all! I’m looking for a hike on Saturday with a decent view of Mt Hood. In the summer I’d normally do something like Tom Dick and Harry, Bald Mountain, Yocum Ridge, etc., but these are all buried under snow still. Anyone know of some good hikes around this time where I can still see the beauty that is Wy’east?",True,False,False,Portland,t5_2qi2i,123805,public,self,Spring hikes with mountain views?,1555697045,https://www.reddit.com/r/Portland/comments/beop97/spring_hikes_with_mountain_views/,all_ads,6,,,,,,
Bubza101,,,[],5f9f71a2-50fa-11e1-8033-12313d096aae,Aloha,dark,text,t2_vsyt6,False,False,False,1555610023,kptv.com,https://www.reddit.com/r/Portland/comments/beoktv/aloha_hs_teacher_arrested_accused_of_luring/,"{'gid_1': 0, 'gid_2': 0, 'gid_3': 0}",beoktv,True,False,False,False,True,False,False,,[],dark,text,False,False,True,16,0,False,all_ads,/r/Portland/comments/beoktv/aloha_hs_teacher_arrested_accused_of_luring/,False,6,1555610025,34,,True,False,False,Portland,t5_2qi2i,123805,public,default,"Aloha HS teacher arrested, accused of luring student",1555696409,https://www.kptv.com/news/aloha-hs-teacher-arrested-accused-of-luring-a-student/article_83abe870-61fd-11e9-a45b-ffe64bdfdd25.html,all_ads,6,,,local-news,Local News,,
guanaco55,,,[],,Regional Gallowboob,dark,text,t2_hyfa9,False,False,False,1555609940,wweek.com,https://www.reddit.com/r/Portland/comments/beokb2/in_irreligious_portland_a_church_comes_to_the_aid/,"{'gid_1': 0, 'gid_2': 0, 'gid_3': 0}",beokb2,True,False,False,False,True,False,False,,[],dark,text,False,False,True,19,0,False,all_ads,/r/Portland/comments/beokb2/in_irreligious_portland_a_church_comes_to_the_aid/,False,6,1555609942,0,,True,False,False,Portland,t5_2qi2i,123804,public,default,"In Irreligious Portland, a Church Comes to the Aid of the Homeless With a Tiny House Village",1555696329,https://www.wweek.com/news/city/2019/04/17/in-irreligious-portland-a-church-comes-to-the-aid-of-the-homeless-with-a-tiny-house-village/,all_ads,6,,,homeless,Homeless,,
cgibsong002,,,[],,,,text,t2_izqa2,False,False,False,1555609699,self.Portland,https://www.reddit.com/r/Portland/comments/beoim1/outdoor_inline_hockey/,"{'gid_1': 0, 'gid_2': 0, 'gid_3': 0}",beoim1,True,False,False,False,True,True,False,,[],dark,text,False,False,True,5,0,False,all_ads,/r/Portland/comments/beoim1/outdoor_inline_hockey/,False,6,1555609700,0,"Does anyone know of any outdoor hockey rinks in the area? As far as i can tell there may be one in Beaverton at Tualatin Hills? Can't find so much as a picture or whether it's free, paid, whatever, but a hockey rink is listed on the website. 

I know there's a few indoor rinks, but I'm just looking for a free place to skate and practice.",True,False,False,Portland,t5_2qi2i,123804,public,self,Outdoor inline hockey?,1555696084,https://www.reddit.com/r/Portland/comments/beoim1/outdoor_inline_hockey/,all_ads,6,,,,,,
