author,author_created_utc,author_flair_css_class,author_flair_text,author_fullname,created_utc,domain,full_link,gilded,id,is_self,link_flair_css_class,link_flair_text,locked,media,media_embed,num_comments,over_18,permalink,retrieved_on,score,secure_media,secure_media_embed,selftext,stickied,subreddit,subreddit_id,thumbnail,title,url,post_hint,preview,banned_by,edited,distinguished
JohnKimble111,1360112889.0,,,t2_ahpz8,1462430175,youtube.com,https://www.reddit.com/r/Portland/comments/4hyret/feminists_surround_and_harass_cameraman_at/,0,4hyret,False,local-news,Local News,True,"{'oembed': {'author_name': 'Vidmax', 'author_url': 'https://www.youtube.com/channel/UCxjZGv1XyuswgTJZQ8mLF4A', 'height': 338, 'html': '&lt;iframe width=""600"" height=""338"" src=""https://www.youtube.com/embed/C5wnDuFnumw?feature=oembed"" frameborder=""0"" allowfullscreen&gt;&lt;/iframe&gt;', 'provider_name': 'YouTube', 'provider_url': 'https://www.youtube.com/', 'thumbnail_height': 360, 'thumbnail_url': 'https://i.ytimg.com/vi/C5wnDuFnumw/hqdefault.jpg', 'thumbnail_width': 480, 'title': 'Feminazis Surround and Harass Cameraman At Whiteness Presentation', 'type': 'video', 'version': '1.0', 'width': 600}, 'type': 'youtube.com'}","{'content': '&lt;iframe width=""600"" height=""338"" src=""https://www.youtube.com/embed/C5wnDuFnumw?feature=oembed"" frameborder=""0"" allowfullscreen&gt;&lt;/iframe&gt;', 'height': 338, 'scrolling': False, 'width': 600}",16,False,/r/Portland/comments/4hyret/feminists_surround_and_harass_cameraman_at/,1466429237,0,"{'oembed': {'author_name': 'Vidmax', 'author_url': 'https://www.youtube.com/channel/UCxjZGv1XyuswgTJZQ8mLF4A', 'height': 338, 'html': '&lt;iframe width=""600"" height=""338"" src=""https://www.youtube.com/embed/C5wnDuFnumw?feature=oembed"" frameborder=""0"" allowfullscreen&gt;&lt;/iframe&gt;', 'provider_name': 'YouTube', 'provider_url': 'https://www.youtube.com/', 'thumbnail_height': 360, 'thumbnail_url': 'https://i.ytimg.com/vi/C5wnDuFnumw/hqdefault.jpg', 'thumbnail_width': 480, 'title': 'Feminazis Surround and Harass Cameraman At Whiteness Presentation', 'type': 'video', 'version': '1.0', 'width': 600}, 'type': 'youtube.com'}","{'content': '&lt;iframe width=""600"" height=""338"" src=""https://www.youtube.com/embed/C5wnDuFnumw?feature=oembed"" frameborder=""0"" allowfullscreen&gt;&lt;/iframe&gt;', 'height': 338, 'scrolling': False, 'width': 600}",,False,Portland,t5_2qi2i,default,Feminists Surround and Harass Cameraman At Whiteness Presentation,https://www.youtube.com/watch?v=C5wnDuFnumw,,,,,
[deleted],,,,,1462428746,i.imgur.com,https://www.reddit.com/r/Portland/comments/4hyp7o/t/,0,4hyp7o,False,photo,Photo,False,,{},0,False,/r/Portland/comments/4hyp7o/t/,1466429209,1,,{},[deleted],False,Portland,t5_2qi2i,default,T,http://i.imgur.com/Ke1uPST.jpg,,,,,
[deleted],,,,,1462425685,self.Portland,https://www.reddit.com/r/Portland/comments/4hykcm/jackhammers_in_se/,0,4hykcm,True,help-me,Help Me,False,,{},4,False,/r/Portland/comments/4hykcm/jackhammers_in_se/,1466429146,0,,{},[deleted],False,Portland,t5_2qi2i,default,Jackhammers in SE?,https://www.reddit.com/r/Portland/comments/4hykcm/jackhammers_in_se/,,,,,
f14tomcat85,1445953715.0,,,t2_ri63l,1462425121,self.Portland,https://www.reddit.com/r/Portland/comments/4hyjdk/serious_please_read_nationwide_cultural_exchange/,0,4hyjdk,True,non-local-news,Outside News,False,,{},107,False,/r/Portland/comments/4hyjdk/serious_please_read_nationwide_cultural_exchange/,1466429133,15,,{},"**This message was allowed by the mods**

Definition of a cultural exchange:  you will create a thread on your sub and our mods will create a thread on our sub. Both of us will sticky the thread and we will exchange various questions and answers regarding our ways of life and about our country.  [**Here**](https://np.reddit.com/r/iranian/wiki/exchanges) is  the big list of all the exchanges that we have done so far. *Take a look*, you might be surprised by whom we have met before.

The mods of /r/AskAnAmerican and /r/iranian have agreed to a national exchange happening in both subreddits from **June 11-18**.



If you feel that at the end of the day, this post has negative feedback (i.e. NO), then I wish you all a good day. This thread was to see how the reception is by the people of this subreddit. Vox populi.



P.S. If you are confused as to why there are 2 Iranian subreddits, it's because there was a schism and we split because of mod drama. It is best if we do not talk about it hence it might become a burden on us in the long run. /r/iranian is the subreddit that has been doing the cultural exchanges after the split. 

Mamnoon (Thank you).

**If you believe that this post has enough positive support, then do the following**
-

1. This is your subreddit and it has it's own rules. The date is far away and the location is in a different subreddit. In order to remind yourselves, discuss on how you plan to remember it. Some mods that I have encountered (and I really mean a lot of mods) have declined to do sticky reminders because it does not go with the rules of their subreddit. Fair.

2.  I encourage you and your fellow statesmen to spread this  (x-post) to other subreddits within *this state* (only). The more Americans we reach, the better. Please share with medium to large subreddits (&gt;1000 subscribers and &gt;6 active users). 

**Guidelines for this exchange**

1. This subreddit will take no active part in the exchange. It's only between /r/AskAnAmerican and /r/iranian.

2. /r/AskAnAmerican is where we come to ask questions - /r/iranian is where you will ask yours. 

See you there then. ",False,Portland,t5_2qi2i,self,[Serious - Please read] Nation-wide Cultural exchange with /r/iranian date set: June 11th-18th. This is an invitation. Details below.,https://www.reddit.com/r/Portland/comments/4hyjdk/serious_please_read_nationwide_cultural_exchange/,,,,,
[deleted],,,,,1462423228,youtube.com,https://www.reddit.com/r/Portland/comments/4hyfxt/cyclist_running_light_vs_motorcycle_on_e_burnside/,0,4hyfxt,False,,,False,"{'oembed': {'author_name': 'RidePNW -', 'author_url': 'https://www.youtube.com/channel/UCV_R5wcKvR-Gea-ZZTwCJgA', 'height': 338, 'html': '&lt;iframe width=""600"" height=""338"" src=""https://www.youtube.com/embed/dsoseOgqb8w?feature=oembed"" frameborder=""0"" allowfullscreen&gt;&lt;/iframe&gt;', 'provider_name': 'YouTube', 'provider_url': 'https://www.youtube.com/', 'thumbnail_height': 360, 'thumbnail_url': 'https://i.ytimg.com/vi/dsoseOgqb8w/hqdefault.jpg', 'thumbnail_width': 480, 'title': 'Motorcycle vs. Cyclist', 'type': 'video', 'version': '1.0', 'width': 600}, 'type': 'youtube.com'}","{'content': '&lt;iframe width=""600"" height=""338"" src=""https://www.youtube.com/embed/dsoseOgqb8w?feature=oembed"" frameborder=""0"" allowfullscreen&gt;&lt;/iframe&gt;', 'height': 338, 'scrolling': False, 'width': 600}",3,False,/r/Portland/comments/4hyfxt/cyclist_running_light_vs_motorcycle_on_e_burnside/,1466429089,1,"{'oembed': {'author_name': 'RidePNW -', 'author_url': 'https://www.youtube.com/channel/UCV_R5wcKvR-Gea-ZZTwCJgA', 'height': 338, 'html': '&lt;iframe width=""600"" height=""338"" src=""https://www.youtube.com/embed/dsoseOgqb8w?feature=oembed"" frameborder=""0"" allowfullscreen&gt;&lt;/iframe&gt;', 'provider_name': 'YouTube', 'provider_url': 'https://www.youtube.com/', 'thumbnail_height': 360, 'thumbnail_url': 'https://i.ytimg.com/vi/dsoseOgqb8w/hqdefault.jpg', 'thumbnail_width': 480, 'title': 'Motorcycle vs. Cyclist', 'type': 'video', 'version': '1.0', 'width': 600}, 'type': 'youtube.com'}","{'content': '&lt;iframe width=""600"" height=""338"" src=""https://www.youtube.com/embed/dsoseOgqb8w?feature=oembed"" frameborder=""0"" allowfullscreen&gt;&lt;/iframe&gt;', 'height': 338, 'scrolling': False, 'width': 600}",[deleted],False,Portland,t5_2qi2i,default,Cyclist running light vs. Motorcycle on E. Burnside.,https://www.youtube.com/watch?v=dsoseOgqb8w,,,,,
NaturallyStoned,1407429602.0,,,t2_hrqe2,1462420784,hcn.org,https://www.reddit.com/r/Portland/comments/4hyb95/how_moss_helped_reveal_portlands_pollution/,0,4hyb95,False,local-news,Local News,False,,{},1,False,/r/Portland/comments/4hyb95/how_moss_helped_reveal_portlands_pollution/,1466429028,14,,{},,False,Portland,t5_2qi2i,http://b.thumbs.redditmedia.com/k8zyTsr9G3mGNChV6nioSr_tNart11bT4-0fDA6rUVM.jpg,How moss helped reveal Portlandâ€™s pollution,http://www.hcn.org/issues/48.7/inside-the-moss-mystery-how-the-organisms-helped-reveal-portlands-pollution,link,"{'images': [{'id': '7FCY4EwgWbR2Gnba6I9EcDe5iOhgdAs6GYQoll1t9cM', 'resolutions': [{'height': 72, 'url': 'https://i.redditmedia.com/Y1FRPO7teslggIP1kS-VRuYsI2NFP_YRUqoQNWWe4tY.jpg?fit=crop&amp;crop=faces%2Centropy&amp;arh=2&amp;w=108&amp;s=da18a27db6161829b818262ed7383b80', 'width': 108}, {'height': 144, 'url': 'https://i.redditmedia.com/Y1FRPO7teslggIP1kS-VRuYsI2NFP_YRUqoQNWWe4tY.jpg?fit=crop&amp;crop=faces%2Centropy&amp;arh=2&amp;w=216&amp;s=4a89bd64254f9ca6dafceaaf2bd059a1', 'width': 216}, {'height': 213, 'url': 'https://i.redditmedia.com/Y1FRPO7teslggIP1kS-VRuYsI2NFP_YRUqoQNWWe4tY.jpg?fit=crop&amp;crop=faces%2Centropy&amp;arh=2&amp;w=320&amp;s=215c189d29f12b1e1769937a507ff318', 'width': 320}, {'height': 426, 'url': 'https://i.redditmedia.com/Y1FRPO7teslggIP1kS-VRuYsI2NFP_YRUqoQNWWe4tY.jpg?fit=crop&amp;crop=faces%2Centropy&amp;arh=2&amp;w=640&amp;s=f7f4f1d293da802ccbef66dc33222b15', 'width': 640}], 'source': {'height': 512, 'url': 'https://i.redditmedia.com/Y1FRPO7teslggIP1kS-VRuYsI2NFP_YRUqoQNWWe4tY.jpg?s=a799c3400f91090954725c25a2961a4d', 'width': 768}, 'variants': {}}]}",,,
[deleted],,,,,1462417215,katu.com,https://www.reddit.com/r/Portland/comments/4hy3ot/driver_runs_from_rollover_crash_on_i5_in_n/,0,4hy3ot,False,local-news,Local News,False,,{},3,False,/r/Portland/comments/4hy3ot/driver_runs_from_rollover_crash_on_i5_in_n/,1466428930,0,,{},[deleted],False,Portland,t5_2qi2i,default,"Driver runs from rollover crash on I-5 in N. Portland, police find replica gun in the stolen car",http://katu.com/news/local/driver-runs-from-rollover-crash-on-i-5-in-n-portland-police-find-gun-in-car,,,,,
SLOTH_POTATO_PIRATE,1375543204.0,,,t2_cm62c,1462416719,self.Portland,https://www.reddit.com/r/Portland/comments/4hy2kb/i_hope_you_are_all_doing_okay/,0,4hy2kb,True,off-topic,Other,False,,{},53,False,/r/Portland/comments/4hy2kb/i_hope_you_are_all_doing_okay/,1466428915,527,,{},"A little over three years ago, my friend jumped off the Vista bridge and was kind of the ""last straw"", so to speak, for the barriers to be put up there. I plan on going up there at some point this week with some flowers.

 The last thing she looked at before jumping was our city. And Jesus Christ is it [beautiful](http://i.imgur.com/cWKuSfn.jpg). 

She loved Oregon, and everyone here. You guys that helped make Portland what it is are the people that made her happy. 

If you ever need any guidance or help, there are people in Portland that care and are willing to help. Hell, there are even subs for it. 

Hang in there, Portland.
",False,Portland,t5_2qi2i,self,I hope you are all doing okay.,https://www.reddit.com/r/Portland/comments/4hy2kb/i_hope_you_are_all_doing_okay/,self,"{'images': [{'id': 'EVpMWlfv8CUIwEBKnnq6nVSt1X2oQTULZkJuYKuJAIk', 'resolutions': [{'height': 81, 'url': 'https://i.redditmedia.com/x2d_Bjoxps70wPPuDp2-nuOVR0Z10xSyaVK8FMSBa3s.jpg?fit=crop&amp;crop=faces%2Centropy&amp;arh=2&amp;w=108&amp;s=a46bc8ad90078f08a7e8e22e47597c94', 'width': 108}, {'height': 162, 'url': 'https://i.redditmedia.com/x2d_Bjoxps70wPPuDp2-nuOVR0Z10xSyaVK8FMSBa3s.jpg?fit=crop&amp;crop=faces%2Centropy&amp;arh=2&amp;w=216&amp;s=27b4b9753a3e83390e8586ad6da7021c', 'width': 216}, {'height': 240, 'url': 'https://i.redditmedia.com/x2d_Bjoxps70wPPuDp2-nuOVR0Z10xSyaVK8FMSBa3s.jpg?fit=crop&amp;crop=faces%2Centropy&amp;arh=2&amp;w=320&amp;s=8baec8fcbdf6325f5d3827fd9801eef1', 'width': 320}, {'height': 480, 'url': 'https://i.redditmedia.com/x2d_Bjoxps70wPPuDp2-nuOVR0Z10xSyaVK8FMSBa3s.jpg?fit=crop&amp;crop=faces%2Centropy&amp;arh=2&amp;w=640&amp;s=4861155c2e662d98acf76c8490970739', 'width': 640}, {'height': 720, 'url': 'https://i.redditmedia.com/x2d_Bjoxps70wPPuDp2-nuOVR0Z10xSyaVK8FMSBa3s.jpg?fit=crop&amp;crop=faces%2Centropy&amp;arh=2&amp;w=960&amp;s=43a64b9249e76749b0c1f636feadc274', 'width': 960}, {'height': 810, 'url': 'https://i.redditmedia.com/x2d_Bjoxps70wPPuDp2-nuOVR0Z10xSyaVK8FMSBa3s.jpg?fit=crop&amp;crop=faces%2Centropy&amp;arh=2&amp;w=1080&amp;s=852c752e682a14dfc432e1b6080b4dc3', 'width': 1080}], 'source': {'height': 1200, 'url': 'https://i.redditmedia.com/x2d_Bjoxps70wPPuDp2-nuOVR0Z10xSyaVK8FMSBa3s.jpg?s=4a708edbbb56e8679f74030bc4515e0c', 'width': 1600}, 'variants': {}}]}",,,
daveayegee,1364067446.0,,,t2_b1u8l,1462416031,self.Portland,https://www.reddit.com/r/Portland/comments/4hy11k/vet_for_large_occasionally_skittish_dog/,0,4hy11k,True,classifieds,Classifieds,False,,{},13,False,/r/Portland/comments/4hy11k/vet_for_large_occasionally_skittish_dog/,1466428898,6,,{},"The title says it all.  My dog is 110 lbs. and chill/relaxed (Mastiff) but gets very weird in almost every vet office.  Our last vet had a difficult time calming her, getting her on a scale, and to generally cooperate in the examination room.  It's time for some checkups and maintenance and I'm, unfortunately, not finding many solid options.  I am willing to look into anything out from Beaverton/Tigard to Gresham.  Any suggestions and help is greatly appreciated.",False,Portland,t5_2qi2i,self,"Vet for Large, Occasionally Skittish, Dog",https://www.reddit.com/r/Portland/comments/4hy11k/vet_for_large_occasionally_skittish_dog/,,,,,
AdoptiveParent2,1389870387.0,,,t2_eu3wc,1462415836,i.imgur.com,https://www.reddit.com/r/Portland/comments/4hy0lu/oh_dear/,0,4hy0lu,False,photo,Photo,False,,{},20,False,/r/Portland/comments/4hy0lu/oh_dear/,1466428890,100,,{},,False,Portland,t5_2qi2i,http://a.thumbs.redditmedia.com/azlCQbMN-g5Wcx_Yrowb0k0_McyKn-PMRQtM4ZlvgL8.jpg,Oh dear....,http://i.imgur.com/guWwRbn.jpg?1,image,"{'images': [{'id': '0H-5xew8RF3Y0wf4ZOPmjuAOdT_aCecgN7qipNSgcwU', 'resolutions': [{'height': 192, 'url': 'https://i.redditmedia.com/z7DCZbENfmfx_PHzGGGhA9kJ5DaiaFNnU0SG0mvmNYE.jpg?fit=crop&amp;crop=faces%2Centropy&amp;arh=2&amp;w=108&amp;s=15d4b914037c1208c1fa651b70fe9ff3', 'width': 108}, {'height': 384, 'url': 'https://i.redditmedia.com/z7DCZbENfmfx_PHzGGGhA9kJ5DaiaFNnU0SG0mvmNYE.jpg?fit=crop&amp;crop=faces%2Centropy&amp;arh=2&amp;w=216&amp;s=4fc2f25e9259d8364fcd1006448a59c6', 'width': 216}, {'height': 568, 'url': 'https://i.redditmedia.com/z7DCZbENfmfx_PHzGGGhA9kJ5DaiaFNnU0SG0mvmNYE.jpg?fit=crop&amp;crop=faces%2Centropy&amp;arh=2&amp;w=320&amp;s=600cdd9007f638e4a1d9bcd0065e2c5f', 'width': 320}], 'source': {'height': 960, 'url': 'https://i.redditmedia.com/z7DCZbENfmfx_PHzGGGhA9kJ5DaiaFNnU0SG0mvmNYE.jpg?s=9118b49d1b2b9b4b2fceedbe495b73a6', 'width': 540}, 'variants': {}}]}",,,
nbrimhall,1338524669.0,,Piedmont,t2_7v36l,1462415310,wweek.com,https://www.reddit.com/r/Portland/comments/4hxzdq/timbers_stadium_proves_a_good_financial_bet_for/,0,4hxzdq,False,local-news,Local News,False,,{},13,False,/r/Portland/comments/4hxzdq/timbers_stadium_proves_a_good_financial_bet_for/,1466428875,16,,{},,False,Portland,t5_2qi2i,http://b.thumbs.redditmedia.com/VGUEbQmosl4t7ZEApfCjUYmE2nanVLzji7gkK7FEMgU.jpg,Timbers Stadium Proves a Good Financial Bet for City,http://www.wweek.com/news/2016/05/04/major-league-soccer-stadium-proves-a-good-financial-bet-for-portland/,link,"{'images': [{'id': 'Cw2Y0JhOGp4vEL-tdHGlexQueNRWnTNs2ng0EKsK8dk', 'resolutions': [{'height': 81, 'url': 'https://i.redditmedia.com/D0Jklle3V3SWKIjfVcwhbKoLZ81XRH80kqr8LtJHC3A.jpg?fit=crop&amp;crop=faces%2Centropy&amp;arh=2&amp;w=108&amp;s=7e5c8b02cf82184a6a28c538b05a2232', 'width': 108}, {'height': 162, 'url': 'https://i.redditmedia.com/D0Jklle3V3SWKIjfVcwhbKoLZ81XRH80kqr8LtJHC3A.jpg?fit=crop&amp;crop=faces%2Centropy&amp;arh=2&amp;w=216&amp;s=e83ffb6c8421ab875bb20a498f341664', 'width': 216}, {'height': 241, 'url': 'https://i.redditmedia.com/D0Jklle3V3SWKIjfVcwhbKoLZ81XRH80kqr8LtJHC3A.jpg?fit=crop&amp;crop=faces%2Centropy&amp;arh=2&amp;w=320&amp;s=7582a775d06d6e2be145c93df8f8633d', 'width': 320}, {'height': 482, 'url': 'https://i.redditmedia.com/D0Jklle3V3SWKIjfVcwhbKoLZ81XRH80kqr8LtJHC3A.jpg?fit=crop&amp;crop=faces%2Centropy&amp;arh=2&amp;w=640&amp;s=2838a622497040e2bf3384ad5d2b4ecf', 'width': 640}, {'height': 723, 'url': 'https://i.redditmedia.com/D0Jklle3V3SWKIjfVcwhbKoLZ81XRH80kqr8LtJHC3A.jpg?fit=crop&amp;crop=faces%2Centropy&amp;arh=2&amp;w=960&amp;s=c1e1080284ac465fe0bf87df720073e5', 'width': 960}, {'height': 813, 'url': 'https://i.redditmedia.com/D0Jklle3V3SWKIjfVcwhbKoLZ81XRH80kqr8LtJHC3A.jpg?fit=crop&amp;crop=faces%2Centropy&amp;arh=2&amp;w=1080&amp;s=5f879fd2ff773ba51d80d5094fd0655e', 'width': 1080}], 'source': {'height': 1130, 'url': 'https://i.redditmedia.com/D0Jklle3V3SWKIjfVcwhbKoLZ81XRH80kqr8LtJHC3A.jpg?s=42451c5666bca74d716d88712bac7a11', 'width': 1500}, 'variants': {}}]}",,,
[deleted],,,,,1462411488,self.Portland,https://www.reddit.com/r/Portland/comments/4hxqjy/need_suggestion_for_therapist/,0,4hxqjy,True,,,False,,{},0,False,/r/Portland/comments/4hxqjy/need_suggestion_for_therapist/,1466428760,1,,{},[removed],False,Portland,t5_2qi2i,default,Need Suggestion for Therapist,https://www.reddit.com/r/Portland/comments/4hxqjy/need_suggestion_for_therapist/,,,moderators,,
[deleted],,,,,1462410925,imgur.com,https://www.reddit.com/r/Portland/comments/4hxpaq/friends_were_talking_about_moving_i_did_my_duty/,0,4hxpaq,False,photo,Photo,False,,{},2,False,/r/Portland/comments/4hxpaq/friends_were_talking_about_moving_i_did_my_duty/,1466428744,0,,{},[deleted],False,Portland,t5_2qi2i,default,Friends were talking about moving. I did my duty.,http://imgur.com/WZxA0fi,,,,,
virgil2600,1440031308.0,,,t2_pp3zj,1462405943,self.Portland,https://www.reddit.com/r/Portland/comments/4hxdi5/good_computer_repair_shops_in_sw/,0,4hxdi5,True,classifieds,Classifieds,False,,{},9,False,/r/Portland/comments/4hxdi5/good_computer_repair_shops_in_sw/,1466428592,1,,{},"had a bit of a oops last night but anyway I need to get my laptop screen replaced and good shops that will replace it for cheap?
 ",False,Portland,t5_2qi2i,self,Good computer repair shops in SW??,https://www.reddit.com/r/Portland/comments/4hxdi5/good_computer_repair_shops_in_sw/,,,,,
[deleted],,,,,1462402029,youtube.com,https://www.reddit.com/r/Portland/comments/4hx3cj/any_love_for_a_band_of_portland_natives_most_of/,0,4hx3cj,False,,,False,"{'oembed': {'author_name': 'opbmusic', 'author_url': 'https://www.youtube.com/user/opbmusicDOTorg', 'height': 338, 'html': '&lt;iframe width=""600"" height=""338"" src=""https://www.youtube.com/embed/NDiOV5KyPNk?feature=oembed"" frameborder=""0"" allowfullscreen&gt;&lt;/iframe&gt;', 'provider_name': 'YouTube', 'provider_url': 'https://www.youtube.com/', 'thumbnail_height': 360, 'thumbnail_url': 'https://i.ytimg.com/vi/NDiOV5KyPNk/hqdefault.jpg', 'thumbnail_width': 480, 'title': 'Dirty Revival - She Cant Wait', 'type': 'video', 'version': '1.0', 'width': 600}, 'type': 'youtube.com'}","{'content': '&lt;iframe width=""600"" height=""338"" src=""https://www.youtube.com/embed/NDiOV5KyPNk?feature=oembed"" frameborder=""0"" allowfullscreen&gt;&lt;/iframe&gt;', 'height': 338, 'scrolling': False, 'width': 600}",1,False,/r/Portland/comments/4hx3cj/any_love_for_a_band_of_portland_natives_most_of/,1466428459,2,"{'oembed': {'author_name': 'opbmusic', 'author_url': 'https://www.youtube.com/user/opbmusicDOTorg', 'height': 338, 'html': '&lt;iframe width=""600"" height=""338"" src=""https://www.youtube.com/embed/NDiOV5KyPNk?feature=oembed"" frameborder=""0"" allowfullscreen&gt;&lt;/iframe&gt;', 'provider_name': 'YouTube', 'provider_url': 'https://www.youtube.com/', 'thumbnail_height': 360, 'thumbnail_url': 'https://i.ytimg.com/vi/NDiOV5KyPNk/hqdefault.jpg', 'thumbnail_width': 480, 'title': 'Dirty Revival - She Cant Wait', 'type': 'video', 'version': '1.0', 'width': 600}, 'type': 'youtube.com'}","{'content': '&lt;iframe width=""600"" height=""338"" src=""https://www.youtube.com/embed/NDiOV5KyPNk?feature=oembed"" frameborder=""0"" allowfullscreen&gt;&lt;/iframe&gt;', 'height': 338, 'scrolling': False, 'width': 600}",[deleted],False,Portland,t5_2qi2i,default,Any love for a band of Portland natives? Most of us went to high school together at Grant. Hope you enjoy.,https://www.youtube.com/watch?v=NDiOV5KyPNk,,,,,
fasterkillkill,1462400636.0,,Foster-Powell,t2_xp0zq,1462401772,kgw.com,https://www.reddit.com/r/Portland/comments/4hx2mm/kgw_why_portlands_homeless_crisis_is_at_a/,0,4hx2mm,False,homeless,Homeless,False,,{},0,False,/r/Portland/comments/4hx2mm/kgw_why_portlands_homeless_crisis_is_at_a/,1466428450,1,,{},,False,Portland,t5_2qi2i,default,KGW: Why Portland's Homeless Crisis Is At A Breaking Point,http://www.kgw.com/news/investigations/6-reasons-why-portlands-homeless-crisis-is-at-a-breaking-point/156737977,,,,,
Natural_Question,1334122673.0,,SW,t2_7f5bc,1462400654,portlandartmuseum.org,https://www.reddit.com/r/Portland/comments/4hwzk5/til_in_1937_famed_italian_fashion_designer_emilio/,0,4hwzk5,False,off-topic,Other,False,,{},6,False,/r/Portland/comments/4hwzk5/til_in_1937_famed_italian_fashion_designer_emilio/,1466428410,52,,{},,False,Portland,t5_2qi2i,http://b.thumbs.redditmedia.com/NK1UuSWX1YIZxs3XLbfyuBiN_YXUw_uAc1xHKoCnjhw.jpg,"TIL in 1937, famed Italian fashion designer Emilio Pucci started his career by designing ski suits for Reeds first ski team, which he created in exchange for tuition.",http://portlandartmuseum.org/italianstyle/pucci-portland/,link,"{'images': [{'id': '1sf2_rdVl4oKubwn0nK2olpQEOOHP4LLbyQgBeijdfU', 'resolutions': [{'height': 108, 'url': 'https://i.redditmedia.com/Fzgl0wbYrCiOhitJACqHh0g5RlkfOHt8dkFwuklsqTg.jpg?fit=crop&amp;crop=faces%2Centropy&amp;arh=2&amp;w=108&amp;s=cad8a0ad03be0f31e49559f0bc9932c6', 'width': 108}, {'height': 216, 'url': 'https://i.redditmedia.com/Fzgl0wbYrCiOhitJACqHh0g5RlkfOHt8dkFwuklsqTg.jpg?fit=crop&amp;crop=faces%2Centropy&amp;arh=2&amp;w=216&amp;s=227accf60f635cb5cb6787faf6431a5e', 'width': 216}], 'source': {'height': 230, 'url': 'https://i.redditmedia.com/Fzgl0wbYrCiOhitJACqHh0g5RlkfOHt8dkFwuklsqTg.jpg?s=fdc5371eab3eaf42947bda2100414201', 'width': 230}, 'variants': {}}]}",,,
vertstang86,1336064319.0,,,t2_7mkfv,1462400296,self.Portland,https://www.reddit.com/r/Portland/comments/4hwyk5/visiting_the_pnw_portland_and_seattle_any_tips_on/,0,4hwyk5,True,,,False,,{},5,False,/r/Portland/comments/4hwyk5/visiting_the_pnw_portland_and_seattle_any_tips_on/,1466428397,0,,{},[removed],False,Portland,t5_2qi2i,default,"Visiting the PNW, Portland and Seattle. Any tips on what I should do?",https://www.reddit.com/r/Portland/comments/4hwyk5/visiting_the_pnw_portland_and_seattle_any_tips_on/,,,,,
ckern82,1327042925.0,,,t2_6pi2j,1462398829,imgur.com,https://www.reddit.com/r/Portland/comments/4hwumh/how_do_you_really_feel/,0,4hwumh,False,photo,Photo,False,,{},81,False,/r/Portland/comments/4hwumh/how_do_you_really_feel/,1466428346,98,,{},,False,Portland,t5_2qi2i,http://b.thumbs.redditmedia.com/P2cIwLg3RKDESn-YVy74QICrnixopIh7SWPsGgGnUYU.jpg,How do you really feel?,http://imgur.com/AOdTV1G,link,"{'images': [{'id': 'J_zrCtQgbkW7nMrTXt7fda9qR9bGbVYsO-0sZvQMdII', 'resolutions': [{'height': 97, 'url': 'https://i.redditmedia.com/AnSwdnDrPsAngFwOrSGvjMg5PZdQlf_d0DkYNotWwA0.jpg?fit=crop&amp;crop=faces%2Centropy&amp;arh=2&amp;w=108&amp;s=15a4a048d1b0458540d83b0cce986010', 'width': 108}, {'height': 194, 'url': 'https://i.redditmedia.com/AnSwdnDrPsAngFwOrSGvjMg5PZdQlf_d0DkYNotWwA0.jpg?fit=crop&amp;crop=faces%2Centropy&amp;arh=2&amp;w=216&amp;s=8424752a79563f278f37df477a61fbeb', 'width': 216}, {'height': 287, 'url': 'https://i.redditmedia.com/AnSwdnDrPsAngFwOrSGvjMg5PZdQlf_d0DkYNotWwA0.jpg?fit=crop&amp;crop=faces%2Centropy&amp;arh=2&amp;w=320&amp;s=c0ca510d9fb676d1847e10b305ec1460', 'width': 320}, {'height': 575, 'url': 'https://i.redditmedia.com/AnSwdnDrPsAngFwOrSGvjMg5PZdQlf_d0DkYNotWwA0.jpg?fit=crop&amp;crop=faces%2Centropy&amp;arh=2&amp;w=640&amp;s=c51a9f2950d9df8d1f48d234ed385b7a', 'width': 640}, {'height': 863, 'url': 'https://i.redditmedia.com/AnSwdnDrPsAngFwOrSGvjMg5PZdQlf_d0DkYNotWwA0.jpg?fit=crop&amp;crop=faces%2Centropy&amp;arh=2&amp;w=960&amp;s=61d5b66e929daab72c9b9a18e7255717', 'width': 960}, {'height': 971, 'url': 'https://i.redditmedia.com/AnSwdnDrPsAngFwOrSGvjMg5PZdQlf_d0DkYNotWwA0.jpg?fit=crop&amp;crop=faces%2Centropy&amp;arh=2&amp;w=1080&amp;s=0f4255e61b8105956d59b11902ca7354', 'width': 1080}], 'source': {'height': 1222, 'url': 'https://i.redditmedia.com/AnSwdnDrPsAngFwOrSGvjMg5PZdQlf_d0DkYNotWwA0.jpg?s=cd08bb02743a889a7833f80ba6491768', 'width': 1359}, 'variants': {}}]}",,,
WhompKing,1441156132.0,,,t2_q1tbd,1462395925,self.Portland,https://www.reddit.com/r/Portland/comments/4hwmso/cheapest_travel_doctor_in_portland/,0,4hwmso,True,classifieds,Classifieds,False,,{},38,False,/r/Portland/comments/4hwmso/cheapest_travel_doctor_in_portland/,1466428245,6,,{},"I am on the Oregon Health Plan. I also am traveling to the Guianas, Cuba, and the Caribbean from May 15 until early August. I know I'll need at least a yellow fever vaccination, and maybe some malaria pills. I got a quote from Kaiser for the yellow fever vacc and that's about $160. It's $190 at Walgreens. Does anyone have any good experiences with travel doctors in Portland? It may be cheaper to not go through insurance, but who knows. ",False,Portland,t5_2qi2i,self,Cheapest travel doctor in Portland?,https://www.reddit.com/r/Portland/comments/4hwmso/cheapest_travel_doctor_in_portland/,,,,,
