author,author_flair_css_class,author_flair_richtext,author_flair_text,author_flair_type,author_fullname,author_patreon_flair,can_mod_post,contest_mode,created_utc,domain,full_link,gildings,id,is_crosspostable,is_meta,is_original_content,is_reddit_media_domain,is_robot_indexable,is_self,is_video,link_flair_background_color,link_flair_richtext,link_flair_text_color,link_flair_type,locked,media_only,no_follow,num_comments,num_crossposts,over_18,parent_whitelist_status,permalink,pinned,pwls,retrieved_on,score,selftext,send_replies,spoiler,stickied,subreddit,subreddit_id,subreddit_subscribers,subreddit_type,thumbnail,title,updated_utc,url,whitelist_status,wls,link_flair_css_class,link_flair_text,author_flair_background_color,author_flair_template_id,author_flair_text_color,post_hint,preview,thumbnail_height,thumbnail_width,media,media_embed,secure_media,secure_media_embed,author_cakeday,media_metadata
fixitmx,,[],,text,t2_3k8t5fdx,False,False,False,1554698003,self.Portland,https://www.reddit.com/r/Portland/comments/bapesj/advice_needed_unpermitted_tree_removalplanting/,"{'gid_1': 0, 'gid_2': 0, 'gid_3': 0}",bapesj,False,False,False,False,False,True,False,,[],dark,text,False,False,True,14,0,False,all_ads,/r/Portland/comments/bapesj/advice_needed_unpermitted_tree_removalplanting/,False,6,1554698004,3,[removed],True,False,False,Portland,t5_2qi2i,122955,public,self,advice needed: unpermitted tree removal/planting,1554834982,https://www.reddit.com/r/Portland/comments/bapesj/advice_needed_unpermitted_tree_removalplanting/,all_ads,6,,,,,,,,,,,,,,,
savagesvc,,[],,text,t2_y9gxy,False,False,False,1554697625,i.redd.it,https://www.reddit.com/r/Portland/comments/bapctq/this_loser_broke_into_my_car_in_beaverton_does/,"{'gid_1': 0, 'gid_2': 0, 'gid_3': 0}",bapctq,True,False,False,True,True,False,False,,[],dark,text,False,False,True,7,0,False,all_ads,/r/Portland/comments/bapctq/this_loser_broke_into_my_car_in_beaverton_does/,False,6,1554697626,4,,True,False,False,Portland,t5_2qi2i,122954,public,default,This loser broke into my car in Beaverton. Does anyone recognize her?,1554834939,https://i.redd.it/mnk6dr5qwyq21.jpg,all_ads,6,photo,Photo,,,,,,,,,,,,,
tw0-0h,,[],,text,t2_14am31,False,False,False,1554695674,self.Portland,https://www.reddit.com/r/Portland/comments/bap2u0/pottery_date_night/,"{'gid_1': 0, 'gid_2': 0, 'gid_3': 0}",bap2u0,True,False,False,False,True,True,False,,[],dark,text,False,False,True,12,0,False,all_ads,/r/Portland/comments/bap2u0/pottery_date_night/,False,6,1554695675,0,Where can one go to throw pottery for a date night?,True,False,False,Portland,t5_2qi2i,122951,public,self,Pottery date night,1554834661,https://www.reddit.com/r/Portland/comments/bap2u0/pottery_date_night/,all_ads,6,,,,,,,,,,,,,,,
Abysha,,[],,text,t2_ynrrrj,False,False,False,1554689722,self.Portland,https://www.reddit.com/r/Portland/comments/bao6lk/montavilla/,"{'gid_1': 0, 'gid_2': 0, 'gid_3': 0}",bao6lk,True,False,False,False,True,True,False,,[],dark,text,False,False,True,20,0,False,all_ads,/r/Portland/comments/bao6lk/montavilla/,False,6,1554689723,0,"Who wants to have a couple of drinks?  I ain't buying, fyi.",True,False,False,Portland,t5_2qi2i,122946,public,self,Montavilla,1554833743,https://www.reddit.com/r/Portland/comments/bao6lk/montavilla/,all_ads,6,,,,,,,,,,,,,,,
suuurge,,[],,text,t2_11sab1,False,False,False,1554689077,self.Portland,https://www.reddit.com/r/Portland/comments/bao2uw/or_tax_question_partyear_resident/,"{'gid_1': 0, 'gid_2': 0, 'gid_3': 0}",bao2uw,True,False,False,False,True,True,False,,[],dark,text,False,False,True,6,0,False,all_ads,/r/Portland/comments/bao2uw/or_tax_question_partyear_resident/,False,6,1554689078,0,"Have a simple question for Form OR-40-P. Hope you guys can help me out.

I am full-year resident (in Portland since 2016) but my wife moved to Oregon in 2018. According to [oregon.gov](https://oregon.gov), we need to file return for part-year residents (filing jointly). Form OR-40-P is asking ""Oregon resident from...to..."". What dates am I supposed to enter? It does not clarify whether it's for me or for my wife...

Appreciate your help!",True,False,False,Portland,t5_2qi2i,122944,public,self,OR Tax question: part-year resident,1554775464,https://www.reddit.com/r/Portland/comments/bao2uw/or_tax_question_partyear_resident/,all_ads,6,,,,,,,,,,,,,,,
mkarrots,,[],,text,t2_59564,False,False,False,1554685648,self.Portland,https://www.reddit.com/r/Portland/comments/banjsh/let_us_talk_about_this_and_do_something/,"{'gid_1': 0, 'gid_2': 0, 'gid_3': 0}",banjsh,True,False,False,False,True,True,False,,[],dark,text,False,False,True,75,0,False,all_ads,/r/Portland/comments/banjsh/let_us_talk_about_this_and_do_something/,False,6,1554685649,0,"Greeting Portland, 

I just watched ""Seattle is Dying""(it's on youtube, I recommend everyone watch it). The homeless population is rising quickly! Portland is getting out of hand to and soon will be as bad a Seattle. What can we do about this? And actually DO, not just talk about it. This is a very serious topic that affects us all, especially future generations. 

&amp;#x200B;

Things to keep in mind: according to Seattle statistics, the""Homeless"" title is more a drug issue! %100 of the people on the street use some sort of substance, most likely heroin or meth. They feel comfortable where they are and don't feel like changing anything in their lives.

&amp;#x200B;

What can we do? ",True,False,False,Portland,t5_2qi2i,122939,public,self,"Let us talk about this, and do something.",1554772096,https://www.reddit.com/r/Portland/comments/banjsh/let_us_talk_about_this_and_do_something/,all_ads,6,,,,,,,,,,,,,,,
itstoolatefororanges,,[],Downtown,text,t2_28two8dm,False,False,False,1554680406,self.Portland,https://www.reddit.com/r/Portland/comments/bamq5b/thank_you_ppb_officer/,"{'gid_1': 0, 'gid_2': 0, 'gid_3': 0}",bamq5b,True,False,False,False,True,True,False,,[],dark,text,False,False,True,22,0,False,all_ads,/r/Portland/comments/bamq5b/thank_you_ppb_officer/,False,6,1554680408,11,"A few weeks ago I got pulled over for turning left on a yellow in SE Portland. The officer told me it was the same as running a red and asked me if I was new here and unfamiliar with the laws. I was going to lie and say yes officer, but then realized he could easily do a background check and know that I was lying. Just told him the truth that I was in a hurry and told him the traffic lights at the intersection makes it almost impossible to turn left with the given traffic. Apologized and told him I won’t do it again. Still ended up getting what was essentially a running red light ticket. 

Up till this week, I was stressed out about paying it and what it would do to my insurance rates. I go to the Downtown court to pay for my ticket and the counter lady tells me my ticket is dismissed. No payment, not on my record, zip, gone. Holy shit. I asked her why it got dismissed and she told me the officer put the incorrrect court date on the ticket, making it invalid. 

So here I am wondering, did the officer fuck up on the ticket on accident or on purpose, just to give me a scare without the financial consequences?

Has that ever happened to anyone?",True,False,False,Portland,t5_2qi2i,122927,public,self,Thank you PPB officer?,1554766788,https://www.reddit.com/r/Portland/comments/bamq5b/thank_you_ppb_officer/,all_ads,6,,,,eabbbf0e-42ca-11e1-a863-12313b08a511,dark,,,,,,,,,,
guanaco55,,[],Regional Gallowboob,text,t2_hyfa9,False,False,False,1554677528,oregonlive.com,https://www.reddit.com/r/Portland/comments/bam8sc/these_12_portland_women_started_a_book_club_that/,"{'gid_1': 0, 'gid_2': 0, 'gid_3': 0}",bam8sc,True,False,False,False,True,False,False,,[],dark,text,False,False,True,2,0,False,all_ads,/r/Portland/comments/bam8sc/these_12_portland_women_started_a_book_club_that/,False,6,1554677528,61,,True,False,False,Portland,t5_2qi2i,122926,public,default,"These 12 Portland women started a book club that has lasted 50 years, touching the head and the heart",1554763910,https://www.oregonlive.com/entertainment/2019/04/the-women-started-a-book-club-that-has-lasted-50-years-touching-the-head-and-the-heart.html,all_ads,6,,,,,dark,,,,,,,,,,
Zeppy21,,[],,text,t2_35728b0z,False,False,False,1554676926,self.Portland,https://www.reddit.com/r/Portland/comments/bam4yz/for_rent_recommended_neighborhoods/,"{'gid_1': 0, 'gid_2': 0, 'gid_3': 0}",bam4yz,True,False,False,False,True,True,False,,[],dark,text,False,False,True,4,0,False,all_ads,/r/Portland/comments/bam4yz/for_rent_recommended_neighborhoods/,False,6,1554676927,0,"My boyfriend and I are looking for a house to rent that has a fenced in yard for our two adult dogs. We moved here from Wisconsin about a year ago so we are sill pretty green to the areas of Portland and preferred neighborhoods. I was hoping to find some neighborhood recommendations here. I appreciate any input or advice, thanks! ",True,False,False,Portland,t5_2qi2i,122925,public,self,For Rent/ Recommended Neighborhoods,1554763312,https://www.reddit.com/r/Portland/comments/bam4yz/for_rent_recommended_neighborhoods/,all_ads,6,,,,,,,,,,,,,,,
seevm,,[],,text,t2_1fd9wp1i,False,False,False,1554676454,i.redd.it,https://www.reddit.com/r/Portland/comments/bam221/shades_of_green_in_forest_park_oc/,"{'gid_1': 0, 'gid_2': 0, 'gid_3': 0}",bam221,True,False,False,True,True,False,False,,[],dark,text,False,False,True,2,0,False,all_ads,/r/Portland/comments/bam221/shades_of_green_in_forest_park_oc/,False,6,1554676456,66,,True,False,False,Portland,t5_2qi2i,122925,public,default,shades of green in forest park [OC],1554762936,https://i.redd.it/bdxzi4xq5xq21.jpg,all_ads,6,photo,Photo,,,,,,,,,,,,,
a0b1aa3f,,[],,text,t2_362dut8s,False,False,False,1554674819,self.Portland,https://www.reddit.com/r/Portland/comments/balros/i_visited_an_attractor_and_a_repeller/,"{'gid_1': 0, 'gid_2': 0, 'gid_3': 0}",balros,True,False,False,False,True,True,False,,[],dark,text,False,False,True,4,0,False,all_ads,/r/Portland/comments/balros/i_visited_an_attractor_and_a_repeller/,False,6,1554674821,0,"I saw  [https://www.reddit.com/r/randonauts/](https://www.reddit.com/r/randonauts/) was a trending subreddit today and was curious enough to try it out.

&amp;#x200B;

There's a lot of silly New Age language in the project description, but what it basically is is someone hooked up a quantum noise/randomness source to software, then they get some output from it and find points that are statistically overly clustered (attractor) and statistically unlikely empty (repeller) and it's mapped onto lat/long coordinates. You set your location with the bot, set a max radius, and have it generate the points, and go visit the points. So basically Pokemon Go but with truly random locations.

&amp;#x200B;

I set my radius to just over 1,000 meters and then went to a repeller and an attractor. The repeller was located inside someone's house, so obviously I didn't go to the pinpoint location. But the attractor was on the edge of a sidewalk, so I was able to go to that one. Nothing spooky or weird happened other than seeing a someone who looked like Greg Nibler of FunEmployment Radio podcast fame (don't think it was actually him) and a cute girl on my way to the attractor. So it just ended up being a pleasant, brisk 20 minute walk.

&amp;#x200B;

10/10 would quantum reality tunnel again, probably with a bicycle and a bigger radius next time.",False,False,False,Portland,t5_2qi2i,122924,public,self,I visited an attractor and a repeller.,1554761199,https://www.reddit.com/r/Portland/comments/balros/i_visited_an_attractor_and_a_repeller/,all_ads,6,,,,,,,,,,,,,,,
RushLocates,,[],,text,t2_z6xb1,False,False,False,1554673619,rushlocates.com,https://www.reddit.com/r/Portland/comments/balk4j/this_rose_bush_that_has_been_shaped_into_a_rose/,"{'gid_1': 0, 'gid_2': 0, 'gid_3': 0}",balk4j,True,False,False,False,True,False,False,,[],dark,text,False,False,True,5,0,False,all_ads,/r/Portland/comments/balk4j/this_rose_bush_that_has_been_shaped_into_a_rose/,False,6,1554673621,11,,True,False,False,Portland,t5_2qi2i,122923,public,https://b.thumbs.redditmedia.com/SkSqEYvqPy6h73SeueaDWCdzyQByrRMCCfxhJpwXNSA.jpg,This Rose bush that has been shaped into a Rose Tree of some sort,1554760047,https://www.rushlocates.com/wp-content/uploads/2019/04/Rose-Tree.png,all_ads,6,,,,,,image,"{'enabled': True, 'images': [{'id': '3UrvnnSel5CbCJENqQHsQ6xQdJqzrsYUnQkCut_AjDE', 'resolutions': [{'height': 192, 'url': 'https://external-preview.redd.it/NIaHosW-2slIrIozCfvafR40YktTSiiNZ2WJvrsqAII.png?width=108&amp;crop=smart&amp;auto=webp&amp;s=cffc909fea6934cc07842dc815bc9ca2b9830ef8', 'width': 108}, {'height': 384, 'url': 'https://external-preview.redd.it/NIaHosW-2slIrIozCfvafR40YktTSiiNZ2WJvrsqAII.png?width=216&amp;crop=smart&amp;auto=webp&amp;s=e1c2ac8967da6ec86db14c8d6400509d06f0c1cb', 'width': 216}, {'height': 569, 'url': 'https://external-preview.redd.it/NIaHosW-2slIrIozCfvafR40YktTSiiNZ2WJvrsqAII.png?width=320&amp;crop=smart&amp;auto=webp&amp;s=50d4ec0d6fadb92bc4f20b06bc56dd199907cc6b', 'width': 320}, {'height': 1138, 'url': 'https://external-preview.redd.it/NIaHosW-2slIrIozCfvafR40YktTSiiNZ2WJvrsqAII.png?width=640&amp;crop=smart&amp;auto=webp&amp;s=e22cb9139643e0322670a9ab7ef4755ce45822da', 'width': 640}], 'source': {'height': 1300, 'url': 'https://external-preview.redd.it/NIaHosW-2slIrIozCfvafR40YktTSiiNZ2WJvrsqAII.png?auto=webp&amp;s=89bcab76ccd1d2f04e46e23d12ce5c3fedb1ed34', 'width': 731}, 'variants': {}}]}",140.0,140.0,,,,,,
greeneyedgemini612,,[],,text,t2_6k2khq0,False,False,False,1554673209,self.Portland,https://www.reddit.com/r/Portland/comments/balhij/reflective_dog_raincoat_recommendations_plz/,"{'gid_1': 0, 'gid_2': 0, 'gid_3': 0}",balhij,True,False,False,False,True,True,False,,[],dark,text,False,False,True,4,0,False,all_ads,/r/Portland/comments/balhij/reflective_dog_raincoat_recommendations_plz/,False,6,1554673210,4,80 pound long haired flat coated retriever told me he’d enjoy our walks more if he stayed remotely dry. Bonus points if you have a large dog as well &amp; include what size you went with. ,True,False,False,Portland,t5_2qi2i,122923,public,self,Reflective dog raincoat recommendations plz,1554759584,https://www.reddit.com/r/Portland/comments/balhij/reflective_dog_raincoat_recommendations_plz/,all_ads,6,,,,,,,,,,,,,,,
Zeo85,,[],,text,t2_2xjv9ao6,False,False,False,1554670136,self.Portland,https://www.reddit.com/r/Portland/comments/baky1f/moved_to_portland_a_few_months_ago_and_seriously/,"{'gid_1': 0, 'gid_2': 0, 'gid_3': 0}",baky1f,True,False,False,False,True,True,False,,[],dark,text,False,False,True,61,0,False,all_ads,/r/Portland/comments/baky1f/moved_to_portland_a_few_months_ago_and_seriously/,False,6,1554670137,0,"I moved to Portland for work from Phoenix, AZ area (I lived a decade there and loved it) a few months ago and I was really excited about this place. Everyone talked it up! I think I thought I was moving to Munich! Clearly, my expectations were a bit high.
Here I am on a Sunday April afternoon unable to get out of bed, no energy or desire to do anything, dreading the cold and rain. I cry daily. 

I spent my first 3 weeks nothing but exploring. Coffee shops, restaurants, grocery stores, art galleries and studios where I could take art classes, parks, wineries. I tried some new exercise classes. 
Some were great. Others were overhyped... 

I'm really struggling. 
Any of the restaurants labeled top 10, either don't take reservations and the wait is 3+ hours on a weekend (I work weekdays), or you can get a reservation 2 months from now on a Sunday at 9pm or later. 
The art scene seems saturated to me, hence the very low price tags in galleries (compared to Phoenix). The art studios I checked are tiny, crowded, and most don't get good lighting. I am used to having lots of space, and lots of bright, natural light. 
The homeless issue!!! I was told they are harmless and I'd get used to it. But I don't feel safe. 
The traffic... 
I don't care for hiking, biking, breweries. I miss being able to walk outside in a t shirt any day of the year. Layers, Columbia and Patagonia gear don't make me feel sexy. Forget about doing my hair... My self confidence had plummeted. 
I get migraines every other day because of the atmospheric pressure /weather (probably compounded with other factors... I can't even have a glass of wine in Portland without waking up with a migraine).

I was told I need to give this place a chance. I honestly am not seeing the light at the end of the tunnel. I miss the sun. I miss the desert. I miss my old life in Arizona. Mostly, I miss the people - my friends. 

What am I missing? Others who have moved from the desert, what has worked for you?",True,False,False,Portland,t5_2qi2i,122917,public,self,Moved to Portland a few months ago and seriously struggling,1554756519,https://www.reddit.com/r/Portland/comments/baky1f/moved_to_portland_a_few_months_ago_and_seriously/,all_ads,6,,,,,,,,,,,,,,,
bixtuelista,,[],,text,t2_7ug3z,False,False,False,1554669835,self.Portland,https://www.reddit.com/r/Portland/comments/bakw5l/empty_shelves_at_frys/,"{'gid_1': 0, 'gid_2': 0, 'gid_3': 0}",bakw5l,True,False,False,False,True,True,False,,[],dark,text,False,False,True,72,0,False,all_ads,/r/Portland/comments/bakw5l/empty_shelves_at_frys/,False,6,1554669836,24,Just went to Frys for first time in maybe 2 months.. their shelves are spaced way out and many are empty.   Anyone willing to share the inside story?,True,False,False,Portland,t5_2qi2i,122916,public,self,Empty shelves at Frys,1554756225,https://www.reddit.com/r/Portland/comments/bakw5l/empty_shelves_at_frys/,all_ads,6,,,,,,,,,,,,,,,
Bondobart,,[],,text,t2_11k8ew3j,False,False,False,1554669649,i.redd.it,https://www.reddit.com/r/Portland/comments/bakuyi/some_ahat_drilled_a_hole_in_my_gastank_last_night/,"{'gid_1': 0, 'gid_2': 0, 'gid_3': 0}",bakuyi,True,False,False,True,True,False,False,,[],dark,text,False,False,True,94,0,False,all_ads,/r/Portland/comments/bakuyi/some_ahat_drilled_a_hole_in_my_gastank_last_night/,False,6,1554669651,167,,True,False,False,Portland,t5_2qi2i,122916,public,default,Some a**hat drilled a hole in my gastank last night. SE inner Belmont area. Keep an eye on your stuff. A car dweller no doubt.,1554756033,https://i.redd.it/1nxnljn2lwq21.jpg,all_ads,6,photo,Photo,,,,,,,,,,,,,
alexlee-dev,,[],,text,t2_23y4ky8n,False,False,False,1554668040,self.Portland,https://www.reddit.com/r/Portland/comments/bakkiu/looking_for_dog_daycare_location_in_portland/,"{'gid_1': 0, 'gid_2': 0, 'gid_3': 0}",bakkiu,True,False,False,False,True,True,False,,[],dark,text,False,False,True,11,0,False,all_ads,/r/Portland/comments/bakkiu/looking_for_dog_daycare_location_in_portland/,False,6,1554668040,1,Hi there. I’m looking for a good place to keep my pup entertained and cared for during the day while I’m at work. Does anyone have a favorite place for dog daycare in Portland?,True,False,False,Portland,t5_2qi2i,122916,public,self,Looking for dog daycare location in Portland,1554754476,https://www.reddit.com/r/Portland/comments/bakkiu/looking_for_dog_daycare_location_in_portland/,all_ads,6,,,,,,,,,,,,,,,
moistblessing,,[],,text,t2_19e4lh4g,False,False,False,1554667485,self.Portland,https://www.reddit.com/r/Portland/comments/bakgsp/what_great_volunteering_experiences_have_you_had/,"{'gid_1': 0, 'gid_2': 0, 'gid_3': 0}",bakgsp,True,False,False,False,True,True,False,,[],dark,text,False,False,True,24,0,False,all_ads,/r/Portland/comments/bakgsp/what_great_volunteering_experiences_have_you_had/,False,6,1554667486,12,"I'm open to any/all suggestions you have. 

I've done a few events through work (food pantry, parks cleanup) and have one coming up at Forest Park I'm excited about, but wanted to hear from all of you for things I can do in my free time. Kid-friendly is even better so the whole family can participate.

And if any of you commenting/reading any comments find a new one that interests you then awesome!",True,False,False,Portland,t5_2qi2i,122916,public,self,What great volunteering experiences have you had?,1554753874,https://www.reddit.com/r/Portland/comments/bakgsp/what_great_volunteering_experiences_have_you_had/,all_ads,6,,,,,,,,,,,,,,,
Spuhnkadelik,,[],Shari's Cafe & Pies,text,t2_azlpful,False,False,False,1554667463,i.redd.it,https://www.reddit.com/r/Portland/comments/bakgns/what_i_learned_from_my_first_trashtag_outing/,"{'gid_1': 0, 'gid_2': 0, 'gid_3': 0}",bakgns,True,False,False,True,True,False,False,,[],dark,text,False,False,True,41,0,False,all_ads,/r/Portland/comments/bakgns/what_i_learned_from_my_first_trashtag_outing/,False,6,1554667464,214,,True,False,False,Portland,t5_2qi2i,122916,public,default,What I learned from my first #trashtag outing,1554753850,https://i.redd.it/8lrxrdu0fwq21.jpg,all_ads,6,photo,Photo,,9913fd3a-c71f-11e7-813c-0e6c07f3cce2,dark,,,,,,,,,,
designtraveler,,[],Richmond,text,t2_a6jj8,False,False,False,1554664175,self.Portland,https://www.reddit.com/r/Portland/comments/bajuts/any_local_national_beer_day_deals/,"{'gid_1': 0, 'gid_2': 0, 'gid_3': 0}",bajuts,True,False,False,False,True,True,False,,[],dark,text,False,False,True,2,0,False,all_ads,/r/Portland/comments/bajuts/any_local_national_beer_day_deals/,False,6,1554664178,0,"looking for a place to take advantage of a national beer day deal around town, but not able to find a good list online.",True,False,False,Portland,t5_2qi2i,122911,public,self,Any local National Beer Day deals?,1554750563,https://www.reddit.com/r/Portland/comments/bajuts/any_local_national_beer_day_deals/,all_ads,6,,,,d8e46f8c-4276-11e1-9f2c-12313b08a511,dark,,,,,,,,,,
rock4lite,,[],,text,t2_10dtnh7t,False,False,False,1554663216,self.Portland,https://www.reddit.com/r/Portland/comments/bajob2/rehearsal_space/,"{'gid_1': 0, 'gid_2': 0, 'gid_3': 0}",bajob2,True,False,False,False,True,True,False,,[],dark,text,False,False,True,1,0,False,all_ads,/r/Portland/comments/bajob2/rehearsal_space/,False,6,1554663217,0,I’m looking for a rehearsal space where I can play drums. Any recommendations would be appreciated.,True,False,False,Portland,t5_2qi2i,122908,public,self,Rehearsal space.,1554749600,https://www.reddit.com/r/Portland/comments/bajob2/rehearsal_space/,all_ads,6,,,,,,,,,,,,,,,
Gjallarhorn_Lost,,[],,text,t2_12vv3o,False,False,False,1554660117,self.Portland,https://www.reddit.com/r/Portland/comments/baj2r2/japanese_breakfast/,"{'gid_1': 0, 'gid_2': 0, 'gid_3': 0}",baj2r2,True,False,False,False,True,True,False,,[],dark,text,False,False,True,15,0,False,all_ads,/r/Portland/comments/baj2r2/japanese_breakfast/,False,6,1554660118,0,Any recommendations for a Japanese breakfast place in PDX? I see people eating Japanese fluffy pancakes or French Toast and would like to try.,True,False,False,Portland,t5_2qi2i,122903,public,self,Japanese Breakfast,1554746508,https://www.reddit.com/r/Portland/comments/baj2r2/japanese_breakfast/,all_ads,6,,,,,,,,,,,,,,,
acol0mbian,,[],,text,t2_13kzwi,False,False,False,1554657119,self.Portland,https://www.reddit.com/r/Portland/comments/baiigc/looking_for_live_music_in_portland/,"{'gid_1': 0, 'gid_2': 0, 'gid_3': 0}",baiigc,True,False,False,False,True,True,False,,[],dark,text,False,False,True,13,0,False,all_ads,/r/Portland/comments/baiigc/looking_for_live_music_in_portland/,False,6,1554657121,0,"Hello! My girlfriend and I have been exploring Oregon all week and we end our trip with a flight out of Portland tonight. Originally had hikes planned all day but the rain seems determined to stay so we’ll be exploring the city until our red eye later tonight. After researching some things to do and browsing your visitors guide we’ve got a nice little itinerary planned (thanks!) but I didn’t see anything in there in regards to live music. Any places known for live local bands? Is there a techno or hip hop scene? Any where I could catch a casual DJ set on a  Sunday? Appreciate any info!!

",True,False,False,Portland,t5_2qi2i,122897,public,self,Looking for live music in Portland?,1554743508,https://www.reddit.com/r/Portland/comments/baiigc/looking_for_live_music_in_portland/,all_ads,6,,,,,,,,,,,,,,,
Troutsicle,,[],,text,t2_6x11w,False,False,False,1554655592,i.redd.it,https://www.reddit.com/r/Portland/comments/bai852/annual_guests_arrived_today_at_the_patio_door/,"{'gid_1': 0, 'gid_2': 0, 'gid_3': 0}",bai852,True,False,False,True,True,False,False,,[],dark,text,False,False,True,135,0,False,all_ads,/r/Portland/comments/bai852/annual_guests_arrived_today_at_the_patio_door/,False,6,1554655594,930,,False,False,False,Portland,t5_2qi2i,122893,public,https://b.thumbs.redditmedia.com/kbAu-YBI1KkO9C0oWQn-X3FMRWUZ_w8jlD5JawqkTig.jpg,"Annual guests arrived today at the patio door, expecting catfood bits. Eat well ya wee bastards.",1554741977,https://i.redd.it/2v7twvg0fvq21.jpg,all_ads,6,photo,Photo,,,,image,"{'enabled': True, 'images': [{'id': 'qcmk-h4X064sDSIQcRTDl8xq-nEjtSXN4tQrlWw6Tog', 'resolutions': [{'height': 66, 'url': 'https://preview.redd.it/2v7twvg0fvq21.jpg?width=108&amp;crop=smart&amp;auto=webp&amp;s=b43ab158333a1b76b5f37ee3470e64b2b2c72fe4', 'width': 108}, {'height': 133, 'url': 'https://preview.redd.it/2v7twvg0fvq21.jpg?width=216&amp;crop=smart&amp;auto=webp&amp;s=0a2383d20b711937ccce71f262c01f062f75a7a3', 'width': 216}, {'height': 197, 'url': 'https://preview.redd.it/2v7twvg0fvq21.jpg?width=320&amp;crop=smart&amp;auto=webp&amp;s=6a08f35fbbf0300eeb8c15a84003cd1dcf9cd014', 'width': 320}, {'height': 395, 'url': 'https://preview.redd.it/2v7twvg0fvq21.jpg?width=640&amp;crop=smart&amp;auto=webp&amp;s=219c237cceb9bb98b391f184ca10b4c1e00e122f', 'width': 640}, {'height': 592, 'url': 'https://preview.redd.it/2v7twvg0fvq21.jpg?width=960&amp;crop=smart&amp;auto=webp&amp;s=b1ee26ccb3e66b42c98ef14c8b64a1125c0bdec5', 'width': 960}], 'source': {'height': 632, 'url': 'https://preview.redd.it/2v7twvg0fvq21.jpg?auto=webp&amp;s=33c1359a15d2aa1edf235614b06f2916174125d6', 'width': 1024}, 'variants': {}}]}",86.0,140.0,,,,,,
