author,author_created_utc,author_flair_css_class,author_flair_text,author_fullname,created_utc,domain,full_link,gilded,id,is_self,media_embed,num_comments,over_18,permalink,retrieved_on,score,secure_media_embed,selftext,stickied,subreddit,subreddit_id,thumbnail,title,url,edited,media,secure_media
glidingclyde,1386178252.0,,,t2_e7ac4,1423518168,self.Portland,https://www.reddit.com/r/Portland/comments/2vcfd8/anyone_been_in_one_of_those_247_lingerie/,0,2vcfd8,True,{},40,False,/r/Portland/comments/2vcfd8/anyone_been_in_one_of_those_247_lingerie/,1440916951,19,{},"I drive by them all the time, I am curious if anyone of you have experienced the inside of one those.  It looks like a situation ripe for a mugging or abduction.",False,Portland,t5_2qi2i,self,"Anyone been in one of those 24/7 ""Lingerie Boutiques"" on 82nd?",http://www.reddit.com/r/Portland/comments/2vcfd8/anyone_been_in_one_of_those_247_lingerie/,,,
[deleted],,,,,1423516987,self.Portland,https://www.reddit.com/r/Portland/comments/2vccl9/any_business_owners_here/,0,2vccl9,True,{},2,False,/r/Portland/comments/2vccl9/any_business_owners_here/,1440916987,0,{},I'm a reliable and friendly male in my mid 20's looking for some work even part time. Please help,False,Portland,t5_2qi2i,default,Any business owners here?,http://www.reddit.com/r/Portland/comments/2vccl9/any_business_owners_here/,,,
andrewtaylorwilkins,1334345887.0,,,t2_7g3oy,1423516837,cuddlecon.com,https://www.reddit.com/r/Portland/comments/2vcc9q/get_your_boundaries_set_and_consent_requests/,0,2vcc9q,False,{},22,False,/r/Portland/comments/2vcc9q/get_your_boundaries_set_and_consent_requests/,1440916991,2,{},,False,Portland,t5_2qi2i,default,Get your boundaries set and consent requests ready... It's time for Cuddle Con 2015 this Valentine's Day!,http://cuddlecon.com/,,,
magicmarksthrowaway,1423514131.0,,,t2_l9gux,1423515597,self.Portland,https://www.reddit.com/r/Portland/comments/2vc9bg/drug_testing_and_physical_for_new_job/,0,2vc9bg,True,{},5,False,/r/Portland/comments/2vc9bg/drug_testing_and_physical_for_new_job/,1440917029,0,{},"Hi, I am wondering about the process of this all and would like to hear any experiences you guys have had with a drug test and physical in/around the Portland area.  Did you need to disrobe and put on a blue gown?  Do they check for hernia?  Thanks for any responses and please mention which spot it was.  Trying to substitute as there hasn't been enough time for weed to get out of my system.  Posted here instead of r/trees because I'm looking for Portland specifics.  Thanks for any responses.",False,Portland,t5_2qi2i,self,Drug testing and physical for new job,http://www.reddit.com/r/Portland/comments/2vc9bg/drug_testing_and_physical_for_new_job/,,,
EveryManALion,1401672887.0,,,t2_gt5h2,1423515269,self.Portland,https://www.reddit.com/r/Portland/comments/2vc8j7/does_anyone_know_of_any_covered_basketball_courts/,0,2vc8j7,True,{},16,False,/r/Portland/comments/2vc8j7/does_anyone_know_of_any_covered_basketball_courts/,1440917039,2,{},.,False,Portland,t5_2qi2i,self,Does anyone know of any covered basketball courts that DO NOT have extreme rain seepage?,http://www.reddit.com/r/Portland/comments/2vc8j7/does_anyone_know_of_any_covered_basketball_courts/,1433937933.0,,
solieu,1219962259.0,,,t2_389gd,1423515047,self.Portland,https://www.reddit.com/r/Portland/comments/2vc80u/help_cat_dropped_off_at_my_apartment/,0,2vc80u,True,{},19,False,/r/Portland/comments/2vc80u/help_cat_dropped_off_at_my_apartment/,1440917046,31,{},"I have a black cat, mostly indoors, male, fixed, about two and a half years old, who needs a home. 

He was dropped off at my apartment this morning by old roommates of mine.

I'll be contacting humane society or emergency re-homing organizations today, but I'd like to extend my hand out to see if anyone here might be interested in him.

I can attach pictures or provide more detail, I'm just reeling from having him suddenly dropped off without supplies and want to get this out there as soon as possible.

Edit: Added a few photos of Milo, the cat in question. The photos aren't recent (I'm waiting for him to venture out from under my bed). He's spent time with dogs both big and small, and lived in a household with children between the ages of about 7 to 12.

[Here's a few pictures](http://imgur.com/a/G5XF2)

UPDATE: /u/Troutsicle was kind enough to take Milo, so we've got a happy ending, everyone! Thanks!",False,Portland,t5_2qi2i,self,Help! Cat dropped off at my apartment.,http://www.reddit.com/r/Portland/comments/2vc80u/help_cat_dropped_off_at_my_apartment/,1423545574.0,,
tof-corey,1319873734.0,,,t2_64zxo,1423514870,self.Portland,https://www.reddit.com/r/Portland/comments/2vc7mk/am_i_allowed_to_sleep_at_pdx/,0,2vc7mk,True,{},61,False,/r/Portland/comments/2vc7mk/am_i_allowed_to_sleep_at_pdx/,1440917051,52,{},"I have a flight that leaves at 7:00 am on Saturday the 14th, and it seems that Public Transit from my house will not be an option that morning. So I may just take the MAX line from my work in downtown to the airport on Friday night, chill at IKEA and Starbucks until I can and then ""sleep"" in the ticket area at PDX. Since I will get there 9 hours before my flight takes off, I don't think they will let me past security. Do any of you have experience with sleeping at the Airport for an extended time or have any tips on how to get from Lake Oswego area to PDX in the early am, on a broke persons budget?

THANKS! ",False,Portland,t5_2qi2i,self,Am I allowed to sleep at PDX?,http://www.reddit.com/r/Portland/comments/2vc7mk/am_i_allowed_to_sleep_at_pdx/,,,
[deleted],,,,,1423513922,self.Portland,https://www.reddit.com/r/Portland/comments/2vc5hy/drug_test_and_physical_for_new_job/,0,2vc5hy,True,{},0,False,/r/Portland/comments/2vc5hy/drug_test_and_physical_for_new_job/,1440917080,1,{},Has anyone taken one of these in/around the Portland area.  I am curious as to the process.  Are they going to check for hernia?  Do I disrobe and wear a gown?  Any/all experiences you can share are appreciated.,False,Portland,t5_2qi2i,default,Drug test and physical for new job,http://www.reddit.com/r/Portland/comments/2vc5hy/drug_test_and_physical_for_new_job/,,,
Riguang1990,1386526796.0,,,t2_e9beh,1423512059,self.Portland,https://www.reddit.com/r/Portland/comments/2vc14d/loud_neighbors/,0,2vc14d,True,{},60,False,/r/Portland/comments/2vc14d/loud_neighbors/,1440917136,2,{},"So recently, I moved into a new apartments.  Everything was great for the first few days.  But for the past weeks, my neighbors upstair had been excessively loud.  

In the afternoon till around 6 PM, I can hear pretty loud musics coming from their unit upstair.  I can even make out some of the words in the lyric.  In addition, I can hear them laughing, yelling, and such.  

Past midnight, I can hear them moving around loudly (not just steps, but what sounds like dancing), talking loudly, and occasionally music being played.  I called the building security to them a couple of time after midnight, but I am tired of being woken up in the middle of the night to do that.  

Is hard to enjoy my time at home, when I am trying to read, do homework or something, and I can hear rap music playing played upstair.  I contacted the landlord, and beside posting letters on there that I d unit, they don't seem to do anything else.  

I made recording of the sounds, along with the DB reading.  What would you guys recommend?",False,Portland,t5_2qi2i,self,Loud neighbors.,http://www.reddit.com/r/Portland/comments/2vc14d/loud_neighbors/,,,
tobyfee,1350569183.0,,,t2_9cb70,1423511973,youtube.com,https://www.reddit.com/r/Portland/comments/2vc0wj/aspiring_game_devs_of_portland_who_wants_to_build/,0,2vc0wj,False,"{'content': '&lt;iframe class=""embedly-embed"" src=""//cdn.embedly.com/widgets/media.html?src=http%3A%2F%2Fwww.youtube.com%2Fembed%2Fvideoseries%3Flist%3DPLX2vGYjWbI0SKsNH5Rkpxvxr1dPE0Lw8F&amp;url=https%3A%2F%2Fwww.youtube.com%2Fwatch%3Fv%3DFdcnt2-Jf4w%26list%3DPLX2vGYjWbI0SKsNH5Rkpxvxr1dPE0Lw8F%26index%3D1&amp;image=http%3A%2F%2Fi.ytimg.com%2Fvi%2FFdcnt2-Jf4w%2Fhqdefault.jpg&amp;key=2aa3c4d5f3de4f5b9120b660ad850dc9&amp;type=text%2Fhtml&amp;schema=youtube"" width=""600"" height=""338"" scrolling=""no"" frameborder=""0"" allowfullscreen&gt;&lt;/iframe&gt;', 'height': 338, 'scrolling': False, 'width': 600}",16,False,/r/Portland/comments/2vc0wj/aspiring_game_devs_of_portland_who_wants_to_build/,1440917138,19,"{'content': '&lt;iframe class=""embedly-embed"" src=""https://cdn.embedly.com/widgets/media.html?src=https%3A%2F%2Fwww.youtube.com%2Fembed%2Fvideoseries%3Flist%3DPLX2vGYjWbI0SKsNH5Rkpxvxr1dPE0Lw8F&amp;url=https%3A%2F%2Fwww.youtube.com%2Fwatch%3Fv%3DFdcnt2-Jf4w%26list%3DPLX2vGYjWbI0SKsNH5Rkpxvxr1dPE0Lw8F%26index%3D1&amp;image=http%3A%2F%2Fi.ytimg.com%2Fvi%2FFdcnt2-Jf4w%2Fhqdefault.jpg&amp;key=2aa3c4d5f3de4f5b9120b660ad850dc9&amp;type=text%2Fhtml&amp;schema=youtube"" width=""600"" height=""338"" scrolling=""no"" frameborder=""0"" allowfullscreen&gt;&lt;/iframe&gt;', 'height': 338, 'scrolling': False, 'width': 600}",,False,Portland,t5_2qi2i,http://a.thumbs.redditmedia.com/pOZVZYdFXax6TWr-zg8PBWyFhSETEoXtO2LftFKz-H4.jpg,Aspiring game devs of Portland: who wants to build a game with me?,https://www.youtube.com/watch?v=Fdcnt2-Jf4w&amp;index=1&amp;list=PLX2vGYjWbI0SKsNH5Rkpxvxr1dPE0Lw8F,,"{'oembed': {'author_name': 'Unity', 'author_url': 'http://www.youtube.com/user/Unity3D', 'description': ""IMPORTANT - This projects requires Unity 4.6 or greater * Watch on Unity's learn site here - http://unity3d.com/learn/tutorials/projects/2d-roguelike This 2D Roguelike project guides you through creating a turn based, tile based game with procedurally generated levels. In the game you play as a lone man trying to find food and survive the waste land for as long as you can."", 'height': 338, 'html': '&lt;iframe class=""embedly-embed"" src=""//cdn.embedly.com/widgets/media.html?src=http%3A%2F%2Fwww.youtube.com%2Fembed%2Fvideoseries%3Flist%3DPLX2vGYjWbI0SKsNH5Rkpxvxr1dPE0Lw8F&amp;url=https%3A%2F%2Fwww.youtube.com%2Fwatch%3Fv%3DFdcnt2-Jf4w%26list%3DPLX2vGYjWbI0SKsNH5Rkpxvxr1dPE0Lw8F%26index%3D1&amp;image=http%3A%2F%2Fi.ytimg.com%2Fvi%2FFdcnt2-Jf4w%2Fhqdefault.jpg&amp;key=2aa3c4d5f3de4f5b9120b660ad850dc9&amp;type=text%2Fhtml&amp;schema=youtube"" width=""600"" height=""338"" scrolling=""no"" frameborder=""0"" allowfullscreen&gt;&lt;/iframe&gt;', 'provider_name': 'YouTube', 'provider_url': 'http://www.youtube.com/', 'thumbnail_height': 360, 'thumbnail_url': 'http://i.ytimg.com/vi/Fdcnt2-Jf4w/hqdefault.jpg', 'thumbnail_width': 480, 'title': '2D Roguelike 1 of 14 : Project Introduction', 'type': 'video', 'url': 'http://www.youtube.com/watch?v=Fdcnt2-Jf4w', 'version': '1.0', 'width': 600}, 'type': 'youtube.com'}","{'oembed': {'author_name': 'Unity', 'author_url': 'http://www.youtube.com/user/Unity3D', 'description': ""IMPORTANT - This projects requires Unity 4.6 or greater * Watch on Unity's learn site here - http://unity3d.com/learn/tutorials/projects/2d-roguelike This 2D Roguelike project guides you through creating a turn based, tile based game with procedurally generated levels. In the game you play as a lone man trying to find food and survive the waste land for as long as you can."", 'height': 338, 'html': '&lt;iframe class=""embedly-embed"" src=""https://cdn.embedly.com/widgets/media.html?src=https%3A%2F%2Fwww.youtube.com%2Fembed%2Fvideoseries%3Flist%3DPLX2vGYjWbI0SKsNH5Rkpxvxr1dPE0Lw8F&amp;url=https%3A%2F%2Fwww.youtube.com%2Fwatch%3Fv%3DFdcnt2-Jf4w%26list%3DPLX2vGYjWbI0SKsNH5Rkpxvxr1dPE0Lw8F%26index%3D1&amp;image=http%3A%2F%2Fi.ytimg.com%2Fvi%2FFdcnt2-Jf4w%2Fhqdefault.jpg&amp;key=2aa3c4d5f3de4f5b9120b660ad850dc9&amp;type=text%2Fhtml&amp;schema=youtube"" width=""600"" height=""338"" scrolling=""no"" frameborder=""0"" allowfullscreen&gt;&lt;/iframe&gt;', 'provider_name': 'YouTube', 'provider_url': 'http://www.youtube.com/', 'thumbnail_height': 360, 'thumbnail_url': 'https://i.embed.ly/1/image?url=http%3A%2F%2Fi.ytimg.com%2Fvi%2FFdcnt2-Jf4w%2Fhqdefault.jpg&amp;key=b1e305db91cf4aa5a86b732cc9fffceb', 'thumbnail_width': 480, 'title': '2D Roguelike 1 of 14 : Project Introduction', 'type': 'video', 'url': 'http://www.youtube.com/watch?v=Fdcnt2-Jf4w', 'version': '1.0', 'width': 600}, 'type': 'youtube.com'}"
born_again_atheist,1320508183.0,,,t2_66pbx,1423509021,self.Portland,https://www.reddit.com/r/Portland/comments/2vbubg/so_whatever_happened_to_the_famous_mysterious/,0,2vbubg,True,{},6,False,/r/Portland/comments/2vbubg/so_whatever_happened_to_the_famous_mysterious/,1440917224,6,{},"Around 2005-2006ish  I stumbled across this guy while channel surfing (Think it was on a public access channel of something) but I  realized I haven't seen him on TV in a long time. Does he still have a TV show? The show was weird but strangely funny at the same time, at least for me it was. ",False,Portland,t5_2qi2i,self,"So, whatever happened to the Famous Mysterious Actor show? Is he still on TV?",http://www.reddit.com/r/Portland/comments/2vbubg/so_whatever_happened_to_the_famous_mysterious/,,,
itzbetter,1409088281.0,,,t2_i2bwa,1423507486,self.Portland,https://www.reddit.com/r/Portland/comments/2vbqsk/portland_how_and_where_are_you_spending/,0,2vbqsk,True,{},29,False,/r/Portland/comments/2vbqsk/portland_how_and_where_are_you_spending/,1440917270,0,{},,False,Portland,t5_2qi2i,self,"Portland, how and where are you spending Valentine's Day?",http://www.reddit.com/r/Portland/comments/2vbqsk/portland_how_and_where_are_you_spending/,,,
georgemihaly,1342507749.0,,,t2_8cw8w,1423507339,self.Portland,https://www.reddit.com/r/Portland/comments/2vbqew/tedxmthood_happening_on_may_2nd_in_se_portland/,0,2vbqew,True,{},10,False,/r/Portland/comments/2vbqew/tedxmthood_happening_on_may_2nd_in_se_portland/,1440917274,1,{},,False,Portland,t5_2qi2i,default,TEDxMtHood (happening on May 2nd in SE Portland) tickets went on sale this morning. Limited number of community tickets available.,http://www.reddit.com/r/Portland/comments/2vbqew/tedxmthood_happening_on_may_2nd_in_se_portland/,,,
babylegs123,1336684273.0,,,t2_7oti0,1423506363,oregonlive.com,https://www.reddit.com/r/Portland/comments/2vbo6l/my_hero/,0,2vbo6l,False,{},6,False,/r/Portland/comments/2vbo6l/my_hero/,1440917303,0,{},,False,Portland,t5_2qi2i,http://b.thumbs.redditmedia.com/QkOLuDDuJroOCWSxZgmRqwxdAM5g1jZQehxUFJlg9-w.jpg,My hero,http://www.oregonlive.com/tigard/index.ssf/2015/02/woman_climbs_inside_tigard_bur.html,,,
[deleted],,,,,1423500725,self.Portland,https://www.reddit.com/r/Portland/comments/2vbbyx/the_subaru_thief_is_at_it_again_my_car_was_stolen/,0,2vbbyx,True,{},33,False,/r/Portland/comments/2vbbyx/the_subaru_thief_is_at_it_again_my_car_was_stolen/,1440917522,7,{},"Red 1994 Subaru Legacy wagon. Case #1510911. If you see this car, please call police! 503-823-3333

http://i.imgur.com/YqLXTnW.jpg

Stolen from near the intersection of SE Milwaukie/SE Tacoma in Sellwood, sometime between 4-7pm yesterday evening.",False,Portland,t5_2qi2i,default,The Subaru thief is at it again! My car was stolen from outside my house in Sellwood.,http://www.reddit.com/r/Portland/comments/2vbbyx/the_subaru_thief_is_at_it_again_my_car_was_stolen/,1423505496.0,,
s2trmack,1377797728.0,,Sunnyside,t2_cxts8,1423500611,i.imgur.com,https://www.reddit.com/r/Portland/comments/2vbbq5/saw_this_on_my_way_to_work_sw_3rd_and_morrison/,0,2vbbq5,False,{},55,False,/r/Portland/comments/2vbbq5/saw_this_on_my_way_to_work_sw_3rd_and_morrison/,1440917525,316,{},,False,Portland,t5_2qi2i,http://b.thumbs.redditmedia.com/CsMb0_6P4g6AozEWAL8GuBHiDZqgqa0PbBNbe7HjGNI.jpg,"Saw this on my way to work, SW 3rd and Morrison",http://i.imgur.com/H99Karb.jpg,,,
[deleted],,,,,1423498786,self.Portland,https://www.reddit.com/r/Portland/comments/2vb7wi/labdlord_has_left_us_without_hot_water_for_2_days/,0,2vb7wi,True,{},22,False,/r/Portland/comments/2vb7wi/labdlord_has_left_us_without_hot_water_for_2_days/,1440917574,22,{},"Hey thanks everyone, they have suddenly found the time to fix it today so yay",False,Portland,t5_2qi2i,default,"Labdlord has left us without hot water for 2 days, is there anything I can do?",http://www.reddit.com/r/Portland/comments/2vb7wi/labdlord_has_left_us_without_hot_water_for_2_days/,1423508094.0,,
Hugetuboguts,1423485687.0,,,t2_l97lf,1423495998,oregonlive.com,https://www.reddit.com/r/Portland/comments/2vb28y/portland_police_officer_resigned_after_testing/,0,2vb28y,False,{},2,False,/r/Portland/comments/2vb28y/portland_police_officer_resigned_after_testing/,1440917648,8,{},,False,Portland,t5_2qi2i,default,"Portland police officer resigned after testing positive for steroids, bureau report reveals",http://www.oregonlive.com/portland/index.ssf/2015/01/portland_police_officer_resign.html,,,
Newsnow2020,1423483246.0,,,t2_l972o,1423483358,katu.com,https://www.reddit.com/r/Portland/comments/2vajfd/2_dozen_shots_fired_in_ne_portland_shooting/,0,2vajfd,False,{},31,False,/r/Portland/comments/2vajfd/2_dozen_shots_fired_in_ne_portland_shooting/,1440917891,10,{},,False,Portland,t5_2qi2i,http://b.thumbs.redditmedia.com/Fw9M0qZJ56Hq8BJWUtGjZGYYjSs4zjb0P5FmqSXS8iw.jpg,2 dozen shots fired in NE Portland shooting,http://www.katu.com/news/local/Police-2-dozen-shots-fired-in-NE-Portland-shooting-at-Woodlawn-Park-291203981.html?mobile=n,,,
[deleted],,,,,1423481243,vimeo.com,https://www.reddit.com/r/Portland/comments/2vah6w/bridgetown_portland_a_great_flying_tour/,0,2vah6w,False,"{'content': '&lt;iframe class=""embedly-embed"" src=""//cdn.embedly.com/widgets/media.html?src=http%3A%2F%2Fplayer.vimeo.com%2Fvideo%2F118964609&amp;src_secure=1&amp;url=http%3A%2F%2Fvimeo.com%2F118964609&amp;image=http%3A%2F%2Fi.vimeocdn.com%2Fvideo%2F506210802_1280.jpg&amp;key=2aa3c4d5f3de4f5b9120b660ad850dc9&amp;type=text%2Fhtml&amp;schema=vimeo"" width=""600"" height=""338"" scrolling=""no"" frameborder=""0"" allowfullscreen&gt;&lt;/iframe&gt;', 'height': 338, 'scrolling': False, 'width': 600}",1,False,/r/Portland/comments/2vah6w/bridgetown_portland_a_great_flying_tour/,1440917920,0,"{'content': '&lt;iframe class=""embedly-embed"" src=""https://cdn.embedly.com/widgets/media.html?src=https%3A%2F%2Fplayer.vimeo.com%2Fvideo%2F118964609&amp;url=http%3A%2F%2Fvimeo.com%2F118964609&amp;image=http%3A%2F%2Fi.vimeocdn.com%2Fvideo%2F506210802_1280.jpg&amp;key=2aa3c4d5f3de4f5b9120b660ad850dc9&amp;type=text%2Fhtml&amp;schema=vimeo"" width=""600"" height=""338"" scrolling=""no"" frameborder=""0"" allowfullscreen&gt;&lt;/iframe&gt;', 'height': 338, 'scrolling': False, 'width': 600}",,False,Portland,t5_2qi2i,default,Bridgetown: Portland - a great flying tour,http://vimeo.com/118964609,,"{'oembed': {'author_name': 'Media272', 'author_url': 'http://vimeo.com/media272', 'description': 'We love where we live and love what we do. Enjoy. A Media272, Inc. Production 503.230.0406', 'height': 338, 'html': '&lt;iframe class=""embedly-embed"" src=""//cdn.embedly.com/widgets/media.html?src=http%3A%2F%2Fplayer.vimeo.com%2Fvideo%2F118964609&amp;src_secure=1&amp;url=http%3A%2F%2Fvimeo.com%2F118964609&amp;image=http%3A%2F%2Fi.vimeocdn.com%2Fvideo%2F506210802_1280.jpg&amp;key=2aa3c4d5f3de4f5b9120b660ad850dc9&amp;type=text%2Fhtml&amp;schema=vimeo"" width=""600"" height=""338"" scrolling=""no"" frameborder=""0"" allowfullscreen&gt;&lt;/iframe&gt;', 'provider_name': 'Vimeo', 'provider_url': 'https://vimeo.com/', 'thumbnail_height': 720, 'thumbnail_url': 'http://i.vimeocdn.com/video/506210802_1280.jpg', 'thumbnail_width': 1280, 'title': 'Bridgetown: Portland, Oregon', 'type': 'video', 'version': '1.0', 'width': 600}, 'type': 'vimeo.com'}","{'oembed': {'author_name': 'Media272', 'author_url': 'http://vimeo.com/media272', 'description': 'We love where we live and love what we do. Enjoy. A Media272, Inc. Production 503.230.0406', 'height': 338, 'html': '&lt;iframe class=""embedly-embed"" src=""https://cdn.embedly.com/widgets/media.html?src=https%3A%2F%2Fplayer.vimeo.com%2Fvideo%2F118964609&amp;url=http%3A%2F%2Fvimeo.com%2F118964609&amp;image=http%3A%2F%2Fi.vimeocdn.com%2Fvideo%2F506210802_1280.jpg&amp;key=2aa3c4d5f3de4f5b9120b660ad850dc9&amp;type=text%2Fhtml&amp;schema=vimeo"" width=""600"" height=""338"" scrolling=""no"" frameborder=""0"" allowfullscreen&gt;&lt;/iframe&gt;', 'provider_name': 'Vimeo', 'provider_url': 'https://vimeo.com/', 'thumbnail_height': 720, 'thumbnail_url': 'https://i.embed.ly/1/image?url=http%3A%2F%2Fi.vimeocdn.com%2Fvideo%2F506210802_1280.jpg&amp;key=b1e305db91cf4aa5a86b732cc9fffceb', 'thumbnail_width': 1280, 'title': 'Bridgetown: Portland, Oregon', 'type': 'video', 'version': '1.0', 'width': 600}, 'type': 'vimeo.com'}"
weebilgreen,1418869497.0,,,t2_k5nn0,1423460953,thegogame.com,https://www.reddit.com/r/Portland/comments/2v9uxg/sowhos_going/,0,2v9uxg,False,{},4,False,/r/Portland/comments/2v9uxg/sowhos_going/,1440918209,0,{},,False,Portland,t5_2qi2i,default,So-who's going?,http://thegogame.com/blog/2014/11/zombie-apocalypse-disaster-preparedness-game,,,
[deleted],,,,,1423460345,self.Portland,https://www.reddit.com/r/Portland/comments/2v9tzj/my_previous_employer_didnt_take_enough_taxes_out/,0,2v9tzj,True,{},27,False,/r/Portland/comments/2v9tzj/my_previous_employer_didnt_take_enough_taxes_out/,1440918221,17,{},"He claims that he's sent this amount on to the fed &amp; state govt's, like $3,500. He's sent me a demand letter asking for a check made out to the business for this amount. ?!  

My gut feeling is that this is between me and the various governments. If _they_ come to me asking for a tax payment, I should pay it. But this guy, who says he sent a check to the government? I'm highly skeptical.

Any thoughts? Thanks in advance.",False,Portland,t5_2qi2i,default,My previous employer didn't take enough taxes out of my paycheck. Now they want me to reimburse them.,http://www.reddit.com/r/Portland/comments/2v9tzj/my_previous_employer_didnt_take_enough_taxes_out/,,,
DoubleOEight,1377661562.0,,,t2_cx5o7,1423460247,self.Portland,https://www.reddit.com/r/Portland/comments/2v9tti/affordable_custom_framing/,0,2v9tti,True,{},8,False,/r/Portland/comments/2v9tti/affordable_custom_framing/,1440918223,1,{},"Does anyone know of any stores in the Portland area that don't charge an arm and a leg for framing? I just bought an amazing oil painting while I was abroad, after negotiating it was around $100, and I don't want to have to pay 5xs that to have it framed.",False,Portland,t5_2qi2i,self,Affordable custom framing?,http://www.reddit.com/r/Portland/comments/2v9tti/affordable_custom_framing/,,,
Andrewrogerson,1396941916.0,,,t2_g18at,1423459979,junkitportland.com,https://www.reddit.com/r/Portland/comments/2v9tew/old_furniture_removalsave_it_or_call_for_junk/,0,2v9tew,False,{},0,False,/r/Portland/comments/2v9tew/old_furniture_removalsave_it_or_call_for_junk/,1440918229,1,{},,False,Portland,t5_2qi2i,default,Old Furniture Removal-Save It or Call for Junk Removal Portland?,http://junkitportland.com/old-furniture-removal-save-it-or-call-for-junk-removal,,,
[deleted],,,,,1423458083,self.Portland,https://www.reddit.com/r/Portland/comments/2v9q7j/how_would_you_plan_a_staged_marriage_proposal_to/,0,2v9q7j,True,{},5,False,/r/Portland/comments/2v9q7j/how_would_you_plan_a_staged_marriage_proposal_to/,1440918270,0,{},"Cross posted to a couple relevant groups-- this one being one of them because obviously location is very important. Any local places just PERFECT for this sort of thing? 


My partner and I have been together for almost a decade. We have a house, two young kids, and married sibilings.

I've asked him to marry me before but he never would agree. I haven't asked in years, and this weekend be finally asked me! With a beautiful diamond. We are ready finally.

I am dreading the comments when we tell people- ""Finally!"", ""It's about time."", ""Why didn't you get married years ago?"", etc.

So.... I thought we could have some fun with it to draw some attention away. We haven't told anyone yet. I want to do something like this: http://www.degraucientifico.pt/social/12-2014/marriage-proposal-on-top-of-mountain-becomes-viral/

We have no singing, dancing, or acting skills and we're not into flash mobs.

Any ideas? If you have the winning idea I'll email you photos and the story!",False,Portland,t5_2qi2i,default,How would you plan a staged marriage proposal to go viral?,http://www.reddit.com/r/Portland/comments/2v9q7j/how_would_you_plan_a_staged_marriage_proposal_to/,,,
indigoreality,1373367572.0,,,t2_cbcer,1423452713,self.Portland,https://www.reddit.com/r/Portland/comments/2v9gvi/last_night_in_portland_what_should_i_eat/,0,2v9gvi,True,{},21,False,/r/Portland/comments/2v9gvi/last_night_in_portland_what_should_i_eat/,1440918391,2,{},Edit: Portland is such a great foodie city. 10/10 will come back to visit!,False,Portland,t5_2qi2i,self,Last night in Portland. What should I eat?,http://www.reddit.com/r/Portland/comments/2v9gvi/last_night_in_portland_what_should_i_eat/,1423487966.0,,
shcruz,1409540320.0,,,t2_i5dh7,1423451952,imgur.com,https://www.reddit.com/r/Portland/comments/2v9ffu/escaping_the_noise_of_the_city_at_forest_park/,0,2v9ffu,False,{},12,False,/r/Portland/comments/2v9ffu/escaping_the_noise_of_the_city_at_forest_park/,1440918410,50,{},,False,Portland,t5_2qi2i,http://a.thumbs.redditmedia.com/Hr49QQ97EplnmKl55ychYWGVACw4-Glvm8X_PNSB-f4.jpg,Escaping the noise of the city at Forest park,http://imgur.com/9TUunuq,,,
[deleted],,,,,1423451799,alerts.weather.gov,https://www.reddit.com/r/Portland/comments/2v9f6k/storm_about_to_arrive/,0,2v9f6k,False,{},17,False,/r/Portland/comments/2v9f6k/storm_about_to_arrive/,1440918413,8,{},,False,Portland,t5_2qi2i,default,Storm about to arrive,http://alerts.weather.gov/cap/wwacapget.php?x=OR1253960D2900.SpecialWeatherStatement.1253960D3904OR.PQRSPSPQR.cdc393a9fc5d99205adc461d43aa55a5,,,
