[],False,bebearaware,,[],Curled inside a pothole,text,t2_g963xmb,False,False,[],False,False,1601863873,self.Portland,https://www.reddit.com/r/Portland/comments/j5bafw/for_people_new_to_portland_what_to_understand/,{},j5bafw,True,False,False,False,True,True,False,,[],dark,text,False,False,True,49,0,False,all_ads,/r/Portland/comments/j5bafw/for_people_new_to_portland_what_to_understand/,False,self,"{'enabled': False, 'images': [{'id': 'pI75CNSG1Gk_blPplLFeWI-jkE9C2zP5LRrak1w-J-M', 'resolutions': [{'height': 81, 'url': 'https://external-preview.redd.it/HonYwb8v9VljsbducVWtXWUpYCcIvmBdh7O74t-KdQg.jpg?width=108&amp;crop=smart&amp;auto=webp&amp;s=6e6ec752cac58927061083ed14d9bf320973393f', 'width': 108}, {'height': 162, 'url': 'https://external-preview.redd.it/HonYwb8v9VljsbducVWtXWUpYCcIvmBdh7O74t-KdQg.jpg?width=216&amp;crop=smart&amp;auto=webp&amp;s=4a14826a4ebc7f26ae1ad836a2ae027a2078052e', 'width': 216}, {'height': 240, 'url': 'https://external-preview.redd.it/HonYwb8v9VljsbducVWtXWUpYCcIvmBdh7O74t-KdQg.jpg?width=320&amp;crop=smart&amp;auto=webp&amp;s=4235c42c2da193192dad82cf79c741a352fb0e97', 'width': 320}, {'height': 480, 'url': 'https://external-preview.redd.it/HonYwb8v9VljsbducVWtXWUpYCcIvmBdh7O74t-KdQg.jpg?width=640&amp;crop=smart&amp;auto=webp&amp;s=6484bab86e2f4c8986c5ffef3f1e17279bfc9457', 'width': 640}, {'height': 720, 'url': 'https://external-preview.redd.it/HonYwb8v9VljsbducVWtXWUpYCcIvmBdh7O74t-KdQg.jpg?width=960&amp;crop=smart&amp;auto=webp&amp;s=8da0862463841e022f04f0615716a2adf7939677', 'width': 960}, {'height': 810, 'url': 'https://external-preview.redd.it/HonYwb8v9VljsbducVWtXWUpYCcIvmBdh7O74t-KdQg.jpg?width=1080&amp;crop=smart&amp;auto=webp&amp;s=b1a746e078ceec31d7acfb4f8fc21094fddf3fc2', 'width': 1080}], 'source': {'height': 900, 'url': 'https://external-preview.redd.it/HonYwb8v9VljsbducVWtXWUpYCcIvmBdh7O74t-KdQg.jpg?auto=webp&amp;s=04bc2e2beceac6fcfbf7405815ec9b01e0d17dd1', 'width': 1200}, 'variants': {}}]}",6,1601863884,1,"No doubt you've seen the Kim Thatcher ads in heavy rotation - I'll sum and she's full of shit because of course she is. But I think it's important for people new to Oregon to know, we do not have a lieutenant governor. We have the Secretary of State which also oversees elections.

https://sos.oregon.gov/Pages/index.aspx

Our current governor was actually SOS before our governor Kitzhaber resigned over some serious fuckery. 

In a lot of communities outside inner Portland there's a campaign to recall Kate Brown. Thankfully the people running these campaigns so far have been to stupid to succeed. They've missed deadlines and not followed simple instructions for collecting signatures. But they are, of course, trying again this time using the state lockdown, employment department and ""riots"" as the reasons she's a bad governor.

Because most strategists know a popular vote for a Republican governor in Oregon is nigh impossible they're trying to slip one in through the back door. The idea is spend a ton of money on an election like SOS which *seems* less important, recall the current governor and slide in Thatcher who then has the advantage of an incumbency at the next election in 2022. 

They did exactly the same thing with Richardson v Avakian in 2016 and were successful with the election since frankly Avakian was a moron. 

There were two sequential recall campaigns that both failed. Had they succeeded, Richardson would have been governor. 

Richardson was a hardcore family values Republican.

He did die of a brain tumor and now we have Bev.

But that's a digression. 

Just know that the amount of money spent on those Thatcher commercials is for a reason and is absolutely coming logging, prolife, Comcast etc interests. And also cross your fingers that the ""flush the Brown"" idiots keep being terrible at what they're trying to do. 

(Thatcher is also antivax, prolife, weirdly influenced by the towing lobby just to name a few

https://ballotpedia.org/Kim_Thatcher

https://justfacts.votesmart.org/candidate/campaign-finance/46657/kim-thatcher)

I'm not campaigning for anyone but this was largely missed in discussions about the SOS last time.",True,False,False,Portland,t5_2qi2i,177670,public,confidence,self,"For people new to Portland, what to understand about the secretary of state election",0,[],1.0,https://www.reddit.com/r/Portland/comments/j5bafw/for_people_new_to_portland_what_to_understand/,all_ads,6,,dark,,,,,,,6b465fa4-bc4a-11e7-a72c-0e95632b04c0,,,,,,,,True,
[],False,ridgewood38666,,[],,text,t2_39bda1ml,False,False,[],False,False,1601863677,self.Portland,https://www.reddit.com/r/Portland/comments/j5b8r4/any_chance_of_someone_being_rejected_from_a_covid/,{},j5b8r4,True,False,False,False,True,True,False,,[],dark,text,False,False,True,9,0,False,all_ads,/r/Portland/comments/j5b8r4/any_chance_of_someone_being_rejected_from_a_covid/,False,,,6,1601863688,1,"I know of a guy who was out of town with a ton of people at a “festival” and said he was rejected from a covid testing site, and because he’s not showing symptoms. 

Curious if anyone has any info on this. Seem sketch and definitely don’t wanna be around him. 

Thanks in advance!",True,False,False,Portland,t5_2qi2i,177671,public,confidence,self,Any chance of someone being “rejected” from a covid testing site?,0,[],1.0,https://www.reddit.com/r/Portland/comments/j5b8r4/any_chance_of_someone_being_rejected_from_a_covid/,all_ads,6,,,,,,,,,,,,,,,,,,
[],False,ManyBecoming,,[],,text,t2_468ob46k,False,False,[],False,False,1601863514,self.Portland,https://www.reddit.com/r/Portland/comments/j5b7dg/ice_portland/,{},j5b7dg,True,False,False,False,True,True,False,,[],dark,text,False,False,True,7,0,False,all_ads,/r/Portland/comments/j5b7dg/ice_portland/,False,,,6,1601863525,1,"Hi, I am interested in hearing from people who have had direct and indirect experiences with ICE as it exists in Portland. I don't know much and can't find much information. This could be personal experience, professional experience, a protesting experience, or something else. You could just direct message me or post a comment in response to the questions below. Please do not share other people's experiences or stories without their permission.

What was your experience with ICE in Portland? What was the impact of the experience, and how do you feel about it? Is there anything you want others to know about the experience?

Note: I am a grad student *possibly* looking to use some of the information I find for my studies, but haven't even submitted a proposal yet. Truly, my first intention is to learn about something that really matters to me. Depending on what I learn (I will NOT share anything you write), I may follow up and try to conduct an interview either with someone from ICE who will speak to me, or someone on reddit. This is not a survey.",True,False,False,Portland,t5_2qi2i,177671,public,confidence,self,ICE Portland,0,[],1.0,https://www.reddit.com/r/Portland/comments/j5b7dg/ice_portland/,all_ads,6,,,,,,,,,,,,,,,,,,
[],False,JerqFase,,[],,text,t2_72tek084,False,False,[],False,False,1601862925,i.redd.it,https://www.reddit.com/r/Portland/comments/j5b2a4/steel_bridge_is_a_bada_not_the_best_photo_but_y/,{},j5b2a4,True,False,False,True,True,False,False,,[],dark,text,False,False,True,0,0,False,all_ads,/r/Portland/comments/j5b2a4/steel_bridge_is_a_bada_not_the_best_photo_but_y/,False,image,"{'enabled': True, 'images': [{'id': 'HXncwBUb5ynWm5r5EUI2r1fx9XjWrUNUSR75YlJfZ_M', 'resolutions': [{'height': 72, 'url': 'https://preview.redd.it/ucalq55dn6r51.jpg?width=108&amp;crop=smart&amp;auto=webp&amp;s=dbaeb823c1b40b9f460f675731a36fb53891b422', 'width': 108}, {'height': 145, 'url': 'https://preview.redd.it/ucalq55dn6r51.jpg?width=216&amp;crop=smart&amp;auto=webp&amp;s=871533e5018cbec08dd3725865ff38f72e9d7493', 'width': 216}, {'height': 215, 'url': 'https://preview.redd.it/ucalq55dn6r51.jpg?width=320&amp;crop=smart&amp;auto=webp&amp;s=5b3b61bdacdf279d49ebbf32036ce1e3a666a758', 'width': 320}, {'height': 431, 'url': 'https://preview.redd.it/ucalq55dn6r51.jpg?width=640&amp;crop=smart&amp;auto=webp&amp;s=14e401529155846393d9c9e74ecfd75deddd1a11', 'width': 640}, {'height': 647, 'url': 'https://preview.redd.it/ucalq55dn6r51.jpg?width=960&amp;crop=smart&amp;auto=webp&amp;s=ddef10825b1aba30a99bf344e1fa718747d2f682', 'width': 960}, {'height': 728, 'url': 'https://preview.redd.it/ucalq55dn6r51.jpg?width=1080&amp;crop=smart&amp;auto=webp&amp;s=38f5c6e3683ff378da43c050ad70ecf27f704980', 'width': 1080}], 'source': {'height': 2848, 'url': 'https://preview.redd.it/ucalq55dn6r51.jpg?auto=webp&amp;s=e894de51588bb229ce07ea9fee9632552314b7b1', 'width': 4225}, 'variants': {}}]}",6,1601862936,1,,True,False,False,Portland,t5_2qi2i,177669,public,confidence,https://b.thumbs.redditmedia.com/yat3Dk99YLIo6VMPKrO3iHs9e9Ts9qFBIXbFoONiKiA.jpg,"Steel bridge is a bada$$. Not the best (photo), but !y favorite (bridge)",0,[],1.0,https://i.redd.it/ucalq55dn6r51.jpg,all_ads,6,,,,photo,Photo,94.0,140.0,https://i.redd.it/ucalq55dn6r51.jpg,,,,,,,,,,
[],False,anassakata,,[],SW,text,t2_4nifz,False,False,[],False,False,1601862564,self.Portland,https://www.reddit.com/r/Portland/comments/j5az5e/daily_mental_health_checkin_thread/,{},j5az5e,True,False,False,False,True,True,False,,[],dark,text,False,False,True,33,0,False,all_ads,/r/Portland/comments/j5az5e/daily_mental_health_checkin_thread/,False,self,"{'enabled': True, 'images': [{'id': '50mExhN7Hf0-mWJHhVXenk9gIXIO6astdfvVMDPwKJo', 'resolutions': [{'height': 70, 'url': 'https://external-preview.redd.it/eKiEvXJqkf0UUoIPvm5iHwL_BhQ3sNFLhXqFz9NopT4.gif?width=108&amp;crop=smart&amp;format=png8&amp;s=b1b8d260287033d5c4df593699dc15cca8c7b244', 'width': 108}, {'height': 140, 'url': 'https://external-preview.redd.it/eKiEvXJqkf0UUoIPvm5iHwL_BhQ3sNFLhXqFz9NopT4.gif?width=216&amp;crop=smart&amp;format=png8&amp;s=7eb08fa57ed3a68162e699d5bc4b6a50fe4fb9c1', 'width': 216}, {'height': 208, 'url': 'https://external-preview.redd.it/eKiEvXJqkf0UUoIPvm5iHwL_BhQ3sNFLhXqFz9NopT4.gif?width=320&amp;crop=smart&amp;format=png8&amp;s=e21519096033de3a325a34c492efe28dc25a5d6c', 'width': 320}], 'source': {'height': 325, 'url': 'https://external-preview.redd.it/eKiEvXJqkf0UUoIPvm5iHwL_BhQ3sNFLhXqFz9NopT4.gif?format=png8&amp;s=f628aa9fe6c2297be9c29a409b149b5c477bf706', 'width': 500}, 'variants': {'gif': {'resolutions': [{'height': 70, 'url': 'https://external-preview.redd.it/eKiEvXJqkf0UUoIPvm5iHwL_BhQ3sNFLhXqFz9NopT4.gif?width=108&amp;crop=smart&amp;s=d794c63f89298be8a2b1bddc9cb89ea2eff46899', 'width': 108}, {'height': 140, 'url': 'https://external-preview.redd.it/eKiEvXJqkf0UUoIPvm5iHwL_BhQ3sNFLhXqFz9NopT4.gif?width=216&amp;crop=smart&amp;s=3b8181662968e0d7146a83eda8ce1b121329501b', 'width': 216}, {'height': 208, 'url': 'https://external-preview.redd.it/eKiEvXJqkf0UUoIPvm5iHwL_BhQ3sNFLhXqFz9NopT4.gif?width=320&amp;crop=smart&amp;s=7c76f231cbd8c53cc21baa5f78bcf31b19d4dc56', 'width': 320}], 'source': {'height': 325, 'url': 'https://external-preview.redd.it/eKiEvXJqkf0UUoIPvm5iHwL_BhQ3sNFLhXqFz9NopT4.gif?s=928bf3b97b37acb643f3361b1637224e8f2b9545', 'width': 500}}, 'mp4': {'resolutions': [{'height': 70, 'url': 'https://external-preview.redd.it/eKiEvXJqkf0UUoIPvm5iHwL_BhQ3sNFLhXqFz9NopT4.gif?width=108&amp;format=mp4&amp;s=c7237d0d7826d0a60298f75ca4581634d9d67062', 'width': 108}, {'height': 140, 'url': 'https://external-preview.redd.it/eKiEvXJqkf0UUoIPvm5iHwL_BhQ3sNFLhXqFz9NopT4.gif?width=216&amp;format=mp4&amp;s=c7eafc33467cebfa99aa146ea8174dda07ed7e29', 'width': 216}, {'height': 208, 'url': 'https://external-preview.redd.it/eKiEvXJqkf0UUoIPvm5iHwL_BhQ3sNFLhXqFz9NopT4.gif?width=320&amp;format=mp4&amp;s=5a1e15585eed350f9161e2f19eef667fead9ffba', 'width': 320}], 'source': {'height': 325, 'url': 'https://external-preview.redd.it/eKiEvXJqkf0UUoIPvm5iHwL_BhQ3sNFLhXqFz9NopT4.gif?format=mp4&amp;s=e665aee5382f7acb0a5c7bef9160d3ae840a836e', 'width': 500}}}}]}",6,1601862575,1,"Good evening! I fed my cat dinner an hour ago, and since then she's been meowing pitifully, trying to make me think I forgot and feed her twice. She's too manipulative for me.

This thread is for expressing how you feel, not just about the election and COVID and 2020, but stuff that's making life particularly hard right at this incredibly inconvenient moment. It's okay if you're furious, it's okay if you're sad, and it's even okay if you're just okay! If you have done anything lately that's helped your mood, please share that as well.

**To any users who have the emotional bandwidth to do so, please consider leaving a validating comment on another comment, especially one that hasn't gotten interaction, and [""that's rough, buddy""](https://i.imgur.com/X5tD7M5.gif) counts!**

I am hoping that rather than all of us shouting into the void, sharing it with some real Portlanders, or maybe bots, will help the commiserating feel better. This is an experiment, and it's ""daily"" so long as people find it helpful (the ~~beatings~~ mental health threads will continue until morale improves!).",True,False,False,Portland,t5_2qi2i,177670,public,confidence,self,Daily Mental Health Check-In Thread,0,[],1.0,https://www.reddit.com/r/Portland/comments/j5az5e/daily_mental_health_checkin_thread/,all_ads,6,,dark,,,,,,,,,,,,,,,,
[],False,havingahardtime0520,,[],,text,t2_8cjj7ev0,False,False,[],False,False,1601858725,self.Portland,https://www.reddit.com/r/Portland/comments/j5a1ki/looking_for_companionship/,{},j5a1ki,False,False,False,False,False,True,False,,[],dark,text,False,False,True,2,0,False,all_ads,/r/Portland/comments/j5a1ki/looking_for_companionship/,False,,,6,1601858736,1,[removed],True,False,False,Portland,t5_2qi2i,177660,public,confidence,self,Looking for Companionship,0,[],1.0,https://www.reddit.com/r/Portland/comments/j5a1ki/looking_for_companionship/,all_ads,6,,,,,,,,,,,,,,,,,,moderator
[],False,jadeeee129,,[],,text,t2_4o022p7b,False,False,[],False,False,1601857613,self.Portland,https://www.reddit.com/r/Portland/comments/j59rpa/movie_posters/,{},j59rpa,True,False,False,False,True,True,False,,[],dark,text,False,False,True,7,0,False,all_ads,/r/Portland/comments/j59rpa/movie_posters/,False,,,6,1601857624,1,Does anyone know of a good place to buy movie posters around Portland? I’m trying to make a horror themed wall in my place with movie posters/Knick knacks and I cannot find anything besides at spirit Halloween which is pretty picked over. It doesn’t even have to be horror related lol I am mostly just looking for a place with a bunch of poster options.,True,False,False,Portland,t5_2qi2i,177656,public,confidence,self,Movie posters,0,[],1.0,https://www.reddit.com/r/Portland/comments/j59rpa/movie_posters/,all_ads,6,,,,,,,,,,,,,,,,,True,
[],False,calliegirl326,,[],,text,t2_ja8nf,False,False,[],False,False,1601856217,i.redd.it,https://www.reddit.com/r/Portland/comments/j59f5b/megan_was_a_regular_at_our_open_mic_her_car_might/,{},j59f5b,True,False,False,True,True,False,False,,[],dark,text,False,False,True,0,0,False,all_ads,/r/Portland/comments/j59f5b/megan_was_a_regular_at_our_open_mic_her_car_might/,False,image,"{'enabled': True, 'images': [{'id': 'SwYsYVq6XTzY1OGHoDO1pPY5wwz2RRyAx24SSYrQJl4', 'resolutions': [{'height': 132, 'url': 'https://preview.redd.it/yh8wyonf36r51.jpg?width=108&amp;crop=smart&amp;auto=webp&amp;s=6a26dde61a64524b5a696b54dbc1683cfb0cddf0', 'width': 108}, {'height': 265, 'url': 'https://preview.redd.it/yh8wyonf36r51.jpg?width=216&amp;crop=smart&amp;auto=webp&amp;s=2ec01ca014b7d34dd65aa901c7765af39427d642', 'width': 216}, {'height': 392, 'url': 'https://preview.redd.it/yh8wyonf36r51.jpg?width=320&amp;crop=smart&amp;auto=webp&amp;s=d77cc4815d85ae1ffbb1e4e3a41a267a2190fc6b', 'width': 320}, {'height': 785, 'url': 'https://preview.redd.it/yh8wyonf36r51.jpg?width=640&amp;crop=smart&amp;auto=webp&amp;s=13919cdbe2ad3947244f93df7163e3bc5102240e', 'width': 640}, {'height': 1178, 'url': 'https://preview.redd.it/yh8wyonf36r51.jpg?width=960&amp;crop=smart&amp;auto=webp&amp;s=5eb22639860a237fe1071f6fc970436c0ebca038', 'width': 960}, {'height': 1325, 'url': 'https://preview.redd.it/yh8wyonf36r51.jpg?width=1080&amp;crop=smart&amp;auto=webp&amp;s=d1fb2b090fba7769a1657125f474034b468eda51', 'width': 1080}], 'source': {'height': 1381, 'url': 'https://preview.redd.it/yh8wyonf36r51.jpg?auto=webp&amp;s=8e612416cea1310fa6a589fde95796ee118bfc17', 'width': 1125}, 'variants': {}}]}",6,1601856228,1,,True,False,False,Portland,t5_2qi2i,177651,public,confidence,https://b.thumbs.redditmedia.com/0lL7xBaipb_DvrbgEBEIh0zOpP35gvn7gJ-IIWt1xIE.jpg,"Megan was a regular at our open mic. Her car might have been spotted in SE around 9th and Ankeny. If you see her or have any information, please call Portland Missing Persons unit at (503) 823-3333.",0,[],1.0,https://i.redd.it/yh8wyonf36r51.jpg,all_ads,6,,,,photo,Photo,140.0,140.0,https://i.redd.it/yh8wyonf36r51.jpg,,,,,,,,,,
[],False,fionasputnik,,[],,text,t2_4mt6v2jb,False,False,[],False,False,1601854950,self.Portland,https://www.reddit.com/r/Portland/comments/j593pt/downtown_right_now/,{},j593pt,True,False,False,False,True,True,False,,[],dark,text,False,False,True,43,0,False,all_ads,/r/Portland/comments/j593pt/downtown_right_now/,False,,,6,1601854961,1,"I’m running errands downtown right now and there’s a car erratically circling the block, tires screeching, (around 4th/Washington/stark/3rd) making announcements over the speaker system atop their car. They’re saying things including but not limited to:
-antifa are the true fascists
-BLM and antifa are terrorist organizations
-BLM and antifa are funded by China and are responsible for the Muslim concentration camps in China
Anyone else currently downtown and hearing all this? And has anyone been able to get a good look at who they are?",True,False,False,Portland,t5_2qi2i,177649,public,confidence,self,Downtown right now?,0,[],1.0,https://www.reddit.com/r/Portland/comments/j593pt/downtown_right_now/,all_ads,6,,,,,,,,,,,,,,,,,,
[],False,Gulfhero,,[],,text,t2_84lj0kso,False,True,[],False,False,1601853690,kgw.com,https://www.reddit.com/r/Portland/comments/j58sec/voter_guide_2020_everything_you_need_to_know/,{},j58sec,True,False,False,False,True,False,False,,[],dark,text,False,False,True,0,0,False,all_ads,/r/Portland/comments/j58sec/voter_guide_2020_everything_you_need_to_know/,False,link,"{'enabled': False, 'images': [{'id': 'o6SRI29aDOhWLPGsp2_RkoNZNab_x59BOp22ejBLLGg', 'resolutions': [{'height': 60, 'url': 'https://external-preview.redd.it/eMH-Pp8Kf2KlksJDKsIfyn2xsKHXnJndXoOsKnKsnUo.jpg?width=108&amp;crop=smart&amp;auto=webp&amp;s=0bdf0edca39ed56b3a8228f89799d22ddd92d0a7', 'width': 108}, {'height': 121, 'url': 'https://external-preview.redd.it/eMH-Pp8Kf2KlksJDKsIfyn2xsKHXnJndXoOsKnKsnUo.jpg?width=216&amp;crop=smart&amp;auto=webp&amp;s=2f960797afe154f10d831461a8880b07ef1f1dfe', 'width': 216}, {'height': 179, 'url': 'https://external-preview.redd.it/eMH-Pp8Kf2KlksJDKsIfyn2xsKHXnJndXoOsKnKsnUo.jpg?width=320&amp;crop=smart&amp;auto=webp&amp;s=b804099ba179762c9b6a86174a2d292020f54e77', 'width': 320}, {'height': 359, 'url': 'https://external-preview.redd.it/eMH-Pp8Kf2KlksJDKsIfyn2xsKHXnJndXoOsKnKsnUo.jpg?width=640&amp;crop=smart&amp;auto=webp&amp;s=00c0ca4adb80a47990da5a7fd95f0a6332bb6c9d', 'width': 640}, {'height': 539, 'url': 'https://external-preview.redd.it/eMH-Pp8Kf2KlksJDKsIfyn2xsKHXnJndXoOsKnKsnUo.jpg?width=960&amp;crop=smart&amp;auto=webp&amp;s=0dad7c2e908c060d1e94c65617bbb94938d1cc00', 'width': 960}, {'height': 607, 'url': 'https://external-preview.redd.it/eMH-Pp8Kf2KlksJDKsIfyn2xsKHXnJndXoOsKnKsnUo.jpg?width=1080&amp;crop=smart&amp;auto=webp&amp;s=11f86965c7e63a6b2bf1b6be19f666d161afc284', 'width': 1080}], 'source': {'height': 641, 'url': 'https://external-preview.redd.it/eMH-Pp8Kf2KlksJDKsIfyn2xsKHXnJndXoOsKnKsnUo.jpg?auto=webp&amp;s=3598b49f841528aad063219564011ff9b780357b', 'width': 1140}, 'variants': {}}]}",6,1601853701,1,,False,False,False,Portland,t5_2qi2i,177648,public,confidence,https://b.thumbs.redditmedia.com/_k1noMPpS6K11UEV8glgWIRDIswt1lzwFd_DIIcRmmM.jpg,Voter Guide 2020: Everything you need to know about voting in Oregon,0,[],1.0,https://www.kgw.com/mobile/article/news/politics/elections/voter-guide-2020-everything-you-need-to-know-about-voting-in-oregon/283-03975e04-30fa-4a64-86dd-8afc1850a306,all_ads,6,,,,local-news,Local News,78.0,140.0,https://www.kgw.com/mobile/article/news/politics/elections/voter-guide-2020-everything-you-need-to-know-about-voting-in-oregon/283-03975e04-30fa-4a64-86dd-8afc1850a306,,,,,,,,,,
[],False,flaming_pp,,[],,text,t2_7cq6ryzk,False,False,[],False,False,1601853582,i.redd.it,https://www.reddit.com/r/Portland/comments/j58rfo/i_fixed_fedexs_tracking_system_to_be_more_accurate/,{},j58rfo,True,False,False,True,True,False,False,,[],dark,text,False,False,True,120,0,False,all_ads,/r/Portland/comments/j58rfo/i_fixed_fedexs_tracking_system_to_be_more_accurate/,False,image,"{'enabled': True, 'images': [{'id': 'p7YJ89H7RgkIiYPAuN68ZowkuDUONydwzeS1GgNH1lA', 'resolutions': [{'height': 56, 'url': 'https://preview.redd.it/vbq6xq7jv5r51.jpg?width=108&amp;crop=smart&amp;auto=webp&amp;s=075ee7a3376b3dae5bf4555cfca26498d99d0bca', 'width': 108}, {'height': 113, 'url': 'https://preview.redd.it/vbq6xq7jv5r51.jpg?width=216&amp;crop=smart&amp;auto=webp&amp;s=4daecd3e0e4f808e5338a9a3fb89fb4f4f2ebbc1', 'width': 216}, {'height': 167, 'url': 'https://preview.redd.it/vbq6xq7jv5r51.jpg?width=320&amp;crop=smart&amp;auto=webp&amp;s=f7ac94d67de1da7c05f997ab36feebe3b6b2347b', 'width': 320}, {'height': 335, 'url': 'https://preview.redd.it/vbq6xq7jv5r51.jpg?width=640&amp;crop=smart&amp;auto=webp&amp;s=d04b736aa827492fd655c646b4588c23892a734e', 'width': 640}], 'source': {'height': 457, 'url': 'https://preview.redd.it/vbq6xq7jv5r51.jpg?auto=webp&amp;s=5d56c5aaf07dbbebb28ddcce48049850aae9eecc', 'width': 872}, 'variants': {}}]}",6,1601853592,1,,True,False,False,Portland,t5_2qi2i,177648,public,confidence,https://a.thumbs.redditmedia.com/1JogQKR1exjM52ICcyRGQGVwi1_Ifc16k24z_1LTRe4.jpg,I fixed FedEx's tracking system to be more accurate,0,[],1.0,https://i.redd.it/vbq6xq7jv5r51.jpg,all_ads,6,,,,photo,Photo,73.0,140.0,https://i.redd.it/vbq6xq7jv5r51.jpg,,,,,,,,,,
[],False,Gulfhero,,[],,text,t2_84lj0kso,False,True,[],False,False,1601853342,koin.com,https://www.reddit.com/r/Portland/comments/j58pa6/ppb_man_breaks_patrol_car_window_pepper_sprays/,{},j58pa6,True,False,False,False,True,False,False,,[],dark,text,False,False,True,53,0,False,all_ads,/r/Portland/comments/j58pa6/ppb_man_breaks_patrol_car_window_pepper_sprays/,False,link,"{'enabled': False, 'images': [{'id': '5nZBa-19LgNxaztfJQiK81oHBP-UesIeexTO43sH6iA', 'resolutions': [{'height': 81, 'url': 'https://external-preview.redd.it/NOsmitn4qm0Z6yI9xMUv7aXpsDl4qqWeY4J8CS3r_vs.jpg?width=108&amp;crop=smart&amp;auto=webp&amp;s=6ca89d36a436eb43aae8dc6783ed78ec19d834bd', 'width': 108}, {'height': 162, 'url': 'https://external-preview.redd.it/NOsmitn4qm0Z6yI9xMUv7aXpsDl4qqWeY4J8CS3r_vs.jpg?width=216&amp;crop=smart&amp;auto=webp&amp;s=c1e32ab2d01b5701bb5a3efda8abfc370a1daec3', 'width': 216}, {'height': 240, 'url': 'https://external-preview.redd.it/NOsmitn4qm0Z6yI9xMUv7aXpsDl4qqWeY4J8CS3r_vs.jpg?width=320&amp;crop=smart&amp;auto=webp&amp;s=289468fb6c9dbf4473f231c6366692ccfb070a0e', 'width': 320}, {'height': 480, 'url': 'https://external-preview.redd.it/NOsmitn4qm0Z6yI9xMUv7aXpsDl4qqWeY4J8CS3r_vs.jpg?width=640&amp;crop=smart&amp;auto=webp&amp;s=bc60d9fb08d38610ed82e06d2649ccf5a68cb572', 'width': 640}, {'height': 720, 'url': 'https://external-preview.redd.it/NOsmitn4qm0Z6yI9xMUv7aXpsDl4qqWeY4J8CS3r_vs.jpg?width=960&amp;crop=smart&amp;auto=webp&amp;s=6370cbc38f0a52e7b9f1ecc3c2aed9dba7ce8c78', 'width': 960}, {'height': 810, 'url': 'https://external-preview.redd.it/NOsmitn4qm0Z6yI9xMUv7aXpsDl4qqWeY4J8CS3r_vs.jpg?width=1080&amp;crop=smart&amp;auto=webp&amp;s=2b3c186b2134e68e63af9221e67aa45900c0fabe', 'width': 1080}], 'source': {'height': 960, 'url': 'https://external-preview.redd.it/NOsmitn4qm0Z6yI9xMUv7aXpsDl4qqWeY4J8CS3r_vs.jpg?auto=webp&amp;s=2ee8bd4e9fea2c66384df75d933703fdf9118059', 'width': 1280}, 'variants': {}}]}",6,1601853353,1,,False,False,False,Portland,t5_2qi2i,177648,public,confidence,https://a.thumbs.redditmedia.com/nleociR2wfHdGBxd3ypa5N50O8l7V_RTNRCzfwHMBM8.jpg,"PPB: Man breaks patrol car window, pepper sprays officer",0,[],1.0,https://www.koin.com/news/crime/ppb-man-breaks-patrol-car-window-pepper-sprays-officer/,all_ads,6,,,,local-news,Local News,105.0,140.0,https://www.koin.com/news/crime/ppb-man-breaks-patrol-car-window-pepper-sprays-officer/,,,,,,,,,,
