all_awardings,author,author_flair_css_class,author_flair_richtext,author_flair_text,author_flair_type,author_fullname,author_patreon_flair,can_mod_post,contest_mode,created_utc,domain,full_link,gildings,id,is_crosspostable,is_meta,is_original_content,is_reddit_media_domain,is_robot_indexable,is_self,is_video,link_flair_background_color,link_flair_richtext,link_flair_text_color,link_flair_type,locked,media_only,no_follow,num_comments,num_crossposts,over_18,parent_whitelist_status,permalink,pinned,pwls,retrieved_on,score,selftext,send_replies,spoiler,stickied,subreddit,subreddit_id,subreddit_subscribers,subreddit_type,thumbnail,title,total_awards_received,updated_utc,url,whitelist_status,wls,author_flair_background_color,author_flair_text_color,link_flair_css_class,link_flair_text,post_hint,preview,thumbnail_height,thumbnail_width,gilded,author_flair_template_id,media,media_embed,secure_media,secure_media_embed
[],Questionsquestionsth,,[],,text,t2_gqf12,False,False,False,1561803559,self.Portland,https://www.reddit.com/r/Portland/comments/c6xbn3/emergencyweekend_dental_that_takes_ohp/,{},c6xbn3,True,False,False,False,True,True,False,,[],dark,text,False,False,True,5,0,False,all_ads,/r/Portland/comments/c6xbn3/emergencyweekend_dental_that_takes_ohp/,False,6,1561803560,3,"Hi guys - I’m in a pinch! 

Does anyone know of a dentist/doctor that is either open on the weekends - and accepting very short notice appointments - or an emergency dentist that takes Oregon Health Plan? I literally can’t eat now, and haven’t been able to comfortably in days, the pain is so bad, and my gums are beyond swollen. I have no idea what is going on - no other signs of infection beyond the swelling - and I can’t wait until Monday. I don’t see a primary dentist because I just got OHP so haven’t had time to find and organize one yet, so even if I do wait until the weekdays I fear it’ll take too long. I need to see someone ASAP. Thank you!",True,False,False,Portland,t5_2qi2i,129866,public,self,Emergency/weekend dental that takes OHP?,0,1561889944,https://www.reddit.com/r/Portland/comments/c6xbn3/emergencyweekend_dental_that_takes_ohp/,all_ads,6,,,,,,,,,,,,,,
[],Jasperhaskins1,,[],,text,t2_3kamjvnj,False,False,False,1561791830,flexcomforts.com,https://www.reddit.com/r/Portland/comments/c6vswm/our_retail_based_in_oregon_is_giving_away_50/,{},c6vswm,True,False,False,False,True,False,False,,[],dark,text,False,False,True,4,0,False,all_ads,/r/Portland/comments/c6vswm/our_retail_based_in_oregon_is_giving_away_50/,False,6,1561791831,0,,True,False,False,Portland,t5_2qi2i,129852,public,https://b.thumbs.redditmedia.com/7LyKryy4oKLITAB0t520u-GJ1KwbUzNuWg3E0nXO-3s.jpg,Our retail based in Oregon is giving away 50 units of Phantom Wireless Earbuds to people within Portland to get initial response on product quality [Please claim yours and let us connect to you through email],0,1561878203,https://flexcomforts.com/collections/hot-products/products/phantom-wireless-earphone,all_ads,6,,,,,link,"{'enabled': False, 'images': [{'id': 'tVRpOnAG0nDCtwr7GGG0n3N4mDSTE95vEsgONKgHc0A', 'resolutions': [{'height': 181, 'url': 'https://external-preview.redd.it/68nvNoWDOHpQ-LS6F_T-IGF6alMJetzod6y58uwm-iA.jpg?width=108&amp;crop=smart&amp;auto=webp&amp;s=065b6c07be6b9cccb9450303b417a48b835a2df0', 'width': 108}, {'height': 363, 'url': 'https://external-preview.redd.it/68nvNoWDOHpQ-LS6F_T-IGF6alMJetzod6y58uwm-iA.jpg?width=216&amp;crop=smart&amp;auto=webp&amp;s=b85dce5a86df201f9b9ec731267d4de33ce95021', 'width': 216}, {'height': 538, 'url': 'https://external-preview.redd.it/68nvNoWDOHpQ-LS6F_T-IGF6alMJetzod6y58uwm-iA.jpg?width=320&amp;crop=smart&amp;auto=webp&amp;s=183a43a7bd9382c649cda3735f157a8ffe57f457', 'width': 320}, {'height': 1076, 'url': 'https://external-preview.redd.it/68nvNoWDOHpQ-LS6F_T-IGF6alMJetzod6y58uwm-iA.jpg?width=640&amp;crop=smart&amp;auto=webp&amp;s=3654c29d34b3d3291e62fc6715a832ae810be1af', 'width': 640}], 'source': {'height': 1199, 'url': 'https://external-preview.redd.it/68nvNoWDOHpQ-LS6F_T-IGF6alMJetzod6y58uwm-iA.jpg?auto=webp&amp;s=a3693336c4690efd1ecdf15148a5a8713f3b20c1', 'width': 713}, 'variants': {}}]}",140.0,140.0,,,,,,
[],imstayinghome,,[],,text,t2_efbw60m,False,False,False,1561789192,self.Portland,https://www.reddit.com/r/Portland/comments/c6vg9j/does_anyone_have_any_tiny_house_air_bnb/,{},c6vg9j,True,False,False,False,True,True,False,,[],dark,text,False,False,True,3,0,False,all_ads,/r/Portland/comments/c6vg9j/does_anyone_have_any_tiny_house_air_bnb/,False,6,1561789192,0,"My boyfriend and I are considering trying out the tiny house life and since our anniversary is coming up I wanted to surprise him with a weekend in one. Does anyone know any moderately priced options around? All the major sites are a little out of my price range, I'd like to keep it around 100/night if possible.

Thank you so much!

(I live in Salem, he lives in Portland, anywhere between there and Eugene is perfect)",True,False,False,Portland,t5_2qi2i,129849,public,self,Does anyone have any tiny house air bnb recommendations or suggestions?,0,1561875564,https://www.reddit.com/r/Portland/comments/c6vg9j/does_anyone_have_any_tiny_house_air_bnb/,all_ads,6,,,,,,,,,,,,,,
[],LeviStubbsAlive,,[],,text,t2_2qojd0ib,False,False,False,1561788455,portlandmercury.com,https://www.reddit.com/r/Portland/comments/c6vco7/this_is_the_best_article_on_what_to_do_about_our/,{},c6vco7,True,False,False,False,True,False,False,,[],dark,text,False,False,True,14,0,False,all_ads,/r/Portland/comments/c6vco7/this_is_the_best_article_on_what_to_do_about_our/,False,6,1561788456,6,,True,False,False,Portland,t5_2qi2i,129848,public,default,"This is the best article on what to do about our outbreak of political brawls. Great work, Will Humphrey!",0,1561874838,https://www.portlandmercury.com/blogtown/2019/06/28/26720951/insecure-attention-starved-right-wingers-are-marching-in-portland-saturday-heres-how-to-beat-em,all_ads,6,,,local-news,Local News,,,,,,,,,,
[],eatingcommas,,[],,text,t2_2s6cbk8v,False,False,False,1561788047,self.Portland,https://www.reddit.com/r/Portland/comments/c6vakv/long_shot_car_broken_into_around_9th/,{},c6vakv,True,False,False,False,True,True,False,,[],dark,text,False,False,True,14,0,False,all_ads,/r/Portland/comments/c6vakv/long_shot_car_broken_into_around_9th/,False,6,1561788049,13,"I'll start by saying I know I'm not terribly smart for leaving it in the car. The laptop isn't what is valuable. My entire business is run off that machine. Thousands of hours of client work. I live in Salem. If something comes across your path, I'd be unbelievably grateful for any help recovering it. Thank you.",True,False,False,Portland,t5_2qi2i,129847,public,self,Long shot.... Car broken into around 9th &amp; Hawthorne...missing MacBook Air ... Highly valuable.,0,1561874418,https://www.reddit.com/r/Portland/comments/c6vakv/long_shot_car_broken_into_around_9th/,all_ads,6,,,,,,,,,,,,,,
[],AlphaeisMangarae,,[],,text,t2_1zt625ti,False,False,False,1561787601,i.redd.it,https://www.reddit.com/r/Portland/comments/c6v89z/view_from_downtown_today/,{},c6v89z,True,False,False,True,True,False,False,,[],dark,text,False,False,True,1,0,False,all_ads,/r/Portland/comments/c6v89z/view_from_downtown_today/,False,6,1561787602,14,,True,False,False,Portland,t5_2qi2i,129847,public,default,View from downtown today...,0,1561873985,https://i.redd.it/h9mg8n6vi8731.jpg,all_ads,6,,,,,,,,,,,,,,
[],DEAF-LAMONT,,[],,text,t2_mcpir,False,False,False,1561787441,news.google.com,https://www.reddit.com/r/Portland/comments/c6v7hh/womans_eye_socket_broken_in_random_punching/,{},c6v7hh,True,False,False,False,True,False,False,,[],dark,text,False,False,True,2,0,False,all_ads,/r/Portland/comments/c6v7hh/womans_eye_socket_broken_in_random_punching/,False,6,1561787442,4,,True,False,False,Portland,t5_2qi2i,129847,public,default,"Woman’s eye socket broken in random punching attack, attacker already released",0,1561873817,https://news.google.com/articles/CBMiU2h0dHBzOi8vd3d3LmtvaW4uY29tL25ld3MvY3JpbWUvd29tYW5zLWV5ZS1zb2NrZXQtYnJva2VuLWluLXJhbmRvbS1wdW5jaGluZy1hdHRhY2sv0gFXaHR0cHM6Ly93d3cua29pbi5jb20vbmV3cy9jcmltZS93b21hbnMtZXllLXNvY2tldC1icm9rZW4taW4tcmFuZG9tLXB1bmNoaW5nLWF0dGFjay9hbXAv?hl=en-US&amp;gl=US&amp;ceid=US%3Aen,all_ads,6,,,,,,,,,,,,,,
[],cinemaphonic,,[],,text,t2_ke8er,False,False,False,1561786102,self.Portland,https://www.reddit.com/r/Portland/comments/c6v0jb/wallet_found_on_17th_and_ne_glisan_owner_initials/,{},c6v0jb,True,False,False,False,True,True,False,,[],dark,text,False,False,True,3,0,False,all_ads,/r/Portland/comments/c6v0jb/wallet_found_on_17th_and_ne_glisan_owner_initials/,False,6,1561786103,18,I'll hold on to and if i don't hear anything back i'll take it to a police station.,True,False,False,Portland,t5_2qi2i,129843,public,self,Wallet found on 17th and ne glisan. Owner initials AMS,0,1561872481,https://www.reddit.com/r/Portland/comments/c6v0jb/wallet_found_on_17th_and_ne_glisan_owner_initials/,all_ads,6,,,,,,,,,,,,,,
[],jordan112508,,[],,text,t2_3wusqmwg,False,False,False,1561783201,self.Portland,https://www.reddit.com/r/Portland/comments/c6uk7f/keys_found_s_of_hawthorne_very_near_ladds/,{},c6uk7f,True,False,False,False,True,True,False,,[],dark,text,False,False,True,0,0,False,all_ads,/r/Portland/comments/c6uk7f/keys_found_s_of_hawthorne_very_near_ladds/,False,6,1561783203,6,I have them. Let me know. 3 keys. Describe for me,True,False,False,Portland,t5_2qi2i,129837,public,self,Keys found s of Hawthorne very near Ladds.,0,1561869578,https://www.reddit.com/r/Portland/comments/c6uk7f/keys_found_s_of_hawthorne_very_near_ladds/,all_ads,6,,,,,,,,,,,,,,
[],imijay,,[],,text,t2_5drhg,False,False,False,1561782114,self.Portland,https://www.reddit.com/r/Portland/comments/c6ue19/se_foster_semi_truck_building_damage/,{},c6ue19,True,False,False,False,True,True,False,,[],dark,text,False,False,True,5,0,False,all_ads,/r/Portland/comments/c6ue19/se_foster_semi_truck_building_damage/,False,6,1561782115,0,"Just drove past a crazy scene on SE foster road (~58th). With a semi truck ripped open, debris spread across all lanes (in both direction), and significant building damage (south side). Does anyone know what happened?!",True,False,False,Portland,t5_2qi2i,129833,public,self,SE Foster semi truck &amp; building damage,0,1561868490,https://www.reddit.com/r/Portland/comments/c6ue19/se_foster_semi_truck_building_damage/,all_ads,6,,,,,,,,,,,,,,
[],shindig27,,[],,text,t2_63363,False,False,False,1561781738,somethinghappenseventually.blogspot.com,https://www.reddit.com/r/Portland/comments/c6uby4/i_conducted_an_investigation_into_how_the/,{},c6uby4,True,False,False,False,True,False,False,,[],dark,text,False,False,True,0,0,False,all_ads,/r/Portland/comments/c6uby4/i_conducted_an_investigation_into_how_the/,False,6,1561781739,0,,True,False,False,Portland,t5_2qi2i,129834,public,default,I conducted an investigation into how the senators fled our state.,0,1561868113,https://somethinghappenseventually.blogspot.com/2019/06/a-pioneering-exercise-in-escape.html?m=1,all_ads,6,,,,,,,,,,,,,,
[],Lydiagnostic,,[],Milwaukie,text,t2_h1dpy,False,False,False,1561781653,self.Portland,https://www.reddit.com/r/Portland/comments/c6ubhu/looking_to_donate_bioactive_vivarium/,{},c6ubhu,True,False,False,False,True,True,False,,[],dark,text,False,False,True,5,0,False,all_ads,/r/Portland/comments/c6ubhu/looking_to_donate_bioactive_vivarium/,False,6,1561781655,5,"I want to turn my minor tragedy into something good. You see, my beloved poison dart frog has died of unknown causes, and I can't see myself tearing apart the Viv to make it safe for another frog. 


That said, it's a well planted bioactive vivarium, with isopods and other creatures, that measures 18"" cubed. I feel like a biology classroom could put it to use. As well as my fruit fly culturing kit. Anyone know any schools that would want it?",True,False,False,Portland,t5_2qi2i,129834,public,self,Looking to donate bioactive vivarium,0,1561868030,https://www.reddit.com/r/Portland/comments/c6ubhu/looking_to_donate_bioactive_vivarium/,all_ads,6,,dark,,,,,,,,,,,,
[],Housing_Justice,,[],,text,t2_p8v5j,False,False,False,1561781592,oregonlive.com,https://www.reddit.com/r/Portland/comments/c6ub3l/dueling_demonstrations_set_for_saturday_in/,{},c6ub3l,True,False,False,False,True,False,False,,[],dark,text,False,False,True,31,0,False,all_ads,/r/Portland/comments/c6ub3l/dueling_demonstrations_set_for_saturday_in/,False,6,1561781593,18,,True,False,False,Portland,t5_2qi2i,129833,public,default,Dueling demonstrations set for Saturday in downtown Portland,0,1561867970,https://www.oregonlive.com/portland/2019/06/dueling-demonstrations-set-for-saturday-in-downtown-portland.html,all_ads,6,,,local-news,Local News,,,,,,,,,,
[],LEBRON_JAMES_5000,,[],,text,t2_41eez5vd,False,False,False,1561781281,self.Portland,https://www.reddit.com/r/Portland/comments/c6u9as/world_naked_bike_ride_is_tomorrow/,{},c6u9as,False,False,False,False,False,True,False,,[],dark,text,False,False,True,25,0,False,all_ads,/r/Portland/comments/c6u9as/world_naked_bike_ride_is_tomorrow/,False,6,1561781282,38,[removed],True,False,False,Portland,t5_2qi2i,129832,public,self,WORLD NAKED BIKE RIDE IS TOMORROW!!!,0,1561867661,https://www.reddit.com/r/Portland/comments/c6u9as/world_naked_bike_ride_is_tomorrow/,all_ads,6,,,,,self,"{'enabled': False, 'images': [{'id': 'T7Fdzn_m_jf5ABf7OhcyY9JpjKDVMNpqMNQ4Ov69__4', 'resolutions': [], 'source': {'height': 26, 'url': 'https://external-preview.redd.it/Iv3QQLCcEtTS5rSHBNmpwxT1jqXDd0h4m9MitIqv0T0.jpg?auto=webp&amp;s=a56134fe1789f7e8b0b834aec2ab705d24b96a5b', 'width': 92}, 'variants': {}}]}",,,,,,,,
[],ConfusedStickerPDX,,[],,text,t2_41eg8zrm,False,False,False,1561781123,i.redd.it,https://www.reddit.com/r/Portland/comments/c6u8fz/got_this_in_my_mailbox_today_any_clue_what_it_is/,{},c6u8fz,True,False,False,True,True,False,False,,[],dark,text,False,False,True,12,0,False,all_ads,/r/Portland/comments/c6u8fz/got_this_in_my_mailbox_today_any_clue_what_it_is/,False,6,1561781124,1,,True,False,False,Portland,t5_2qi2i,129832,public,default,Got this in my mailbox today. Any clue what it is?,0,1561867504,https://i.redd.it/ob3kxgxez7731.jpg,all_ads,6,,,,,,,,,,,,,,
[],deckchairz,,[],,text,t2_dx3a27a,False,False,False,1561780308,instagram.com,https://www.reddit.com/r/Portland/comments/c6u3nv/seattle_cartoonist_walks_portland/,{},c6u3nv,True,False,False,False,True,False,False,,[],dark,text,False,False,True,4,0,False,all_ads,/r/Portland/comments/c6u3nv/seattle_cartoonist_walks_portland/,False,6,1561780308,0,,True,False,False,Portland,t5_2qi2i,129831,public,default,Seattle Cartoonist walks Portland,0,1561866690,https://www.instagram.com/p/BzR2U7WADYa/?igshid=1hoxwznkicq3o,all_ads,6,,,,,,,,,,,,,,
[],gibsonsbutthole,,[],,text,t2_41e9ym0m,False,False,False,1561779710,self.Portland,https://www.reddit.com/r/Portland/comments/c6u088/any_of_you_degenerates_doing_the_wnbr_tomorrow/,{},c6u088,False,False,False,False,False,True,False,,[],dark,text,False,False,True,11,0,False,all_ads,/r/Portland/comments/c6u088/any_of_you_degenerates_doing_the_wnbr_tomorrow/,False,6,1561779712,3,[removed],True,False,False,Portland,t5_2qi2i,129830,public,self,Any of you degenerates doing the WNBR tomorrow?,0,1561866087,https://www.reddit.com/r/Portland/comments/c6u088/any_of_you_degenerates_doing_the_wnbr_tomorrow/,all_ads,6,,,,,,,,,,,,,,
[],HughMungusWang,,[],,text,t2_2pe49h8h,False,False,False,1561778378,self.Portland,https://www.reddit.com/r/Portland/comments/c6tsja/mac_guests/,{},c6tsja,True,False,False,False,True,True,False,,[],dark,text,False,False,True,10,0,False,all_ads,/r/Portland/comments/c6tsja/mac_guests/,False,6,1561778379,0,Do you guys know the rules about letting guests in to the mac. Like how old do you have to be to let a guest in.,True,False,False,Portland,t5_2qi2i,129826,public,self,Mac guests,0,1561864758,https://www.reddit.com/r/Portland/comments/c6tsja/mac_guests/,all_ads,6,,,,,,,,,,,,,,
[],lowIQanon,,[],,text,t2_22ipqvc8,False,False,False,1561777111,self.Portland,https://www.reddit.com/r/Portland/comments/c6tkvd/rustix_pub_is_turning_into_a_strip_club_last/,{},c6tkvd,True,False,False,False,True,True,False,,[],dark,text,False,False,True,8,0,False,all_ads,/r/Portland/comments/c6tkvd/rustix_pub_is_turning_into_a_strip_club_last/,False,6,1561777112,1,Come on out! Lesson at 930 PM by Inaki from VMAC.,True,False,False,Portland,t5_2qi2i,129824,public,self,Rustix Pub is turning into a strip club 😔 Last night of ladies night bachata is tonight.,0,1561863494,https://www.reddit.com/r/Portland/comments/c6tkvd/rustix_pub_is_turning_into_a_strip_club_last/,all_ads,6,,,,,,,,,,,,,,
[],MachineGunEtiquette,,[],,text,t2_6ivmc,False,False,False,1561776876,revealnews.org,https://www.reddit.com/r/Portland/comments/c6tjib/these_police_officers_were_members_of_extremist/,{},c6tjib,True,False,False,False,True,False,False,,[],dark,text,False,False,True,16,0,False,all_ads,/r/Portland/comments/c6tjib/these_police_officers_were_members_of_extremist/,False,6,1561776878,116,,True,False,False,Portland,t5_2qi2i,129824,public,https://b.thumbs.redditmedia.com/e1Ut-tRiRDXqnt7Eh0hTevL3NKCBz_CPZVwvFLc0Smo.jpg,These police officers were members of extremist groups on Facebook,0,1561863252,https://www.revealnews.org/article/these-police-officers-were-members-of-extremist-groups-on-facebook/,all_ads,6,,,,,link,"{'enabled': False, 'images': [{'id': 'IuupIIZXsQBDcnFqQ1ie9JVo0tY_gWMcV4d1gzRa_yw', 'resolutions': [{'height': 61, 'url': 'https://external-preview.redd.it/W-QrjtpSrkXQPEsL5W-UMZp1egqD9zCI6g2KZlzOjI0.jpg?width=108&amp;crop=smart&amp;auto=webp&amp;s=b0b153bbd26a94b2038bde5d672403d423607891', 'width': 108}, {'height': 122, 'url': 'https://external-preview.redd.it/W-QrjtpSrkXQPEsL5W-UMZp1egqD9zCI6g2KZlzOjI0.jpg?width=216&amp;crop=smart&amp;auto=webp&amp;s=0a7a9e3907c3124c7d01c36c15b4ed4c4d423570', 'width': 216}, {'height': 180, 'url': 'https://external-preview.redd.it/W-QrjtpSrkXQPEsL5W-UMZp1egqD9zCI6g2KZlzOjI0.jpg?width=320&amp;crop=smart&amp;auto=webp&amp;s=4e282f338580954585baab2293d39894e89208f4', 'width': 320}], 'source': {'height': 356, 'url': 'https://external-preview.redd.it/W-QrjtpSrkXQPEsL5W-UMZp1egqD9zCI6g2KZlzOjI0.jpg?auto=webp&amp;s=2ce16be73485efc06f95e939897591b664062ec7', 'width': 630}, 'variants': {}}]}",79.0,140.0,,,,,,
[],LatchedHiker,,[],,text,t2_2r6y2gqh,False,False,False,1561774545,self.Portland,https://www.reddit.com/r/Portland/comments/c6t5pm/now_how_about_paying_employees_especially_afscme/,{},c6t5pm,True,False,False,False,True,True,False,,[],dark,text,False,False,True,4,0,False,all_ads,/r/Portland/comments/c6t5pm/now_how_about_paying_employees_especially_afscme/,False,6,1561774546,17,"I have deep respect for this institution, but what they propose is such a cut to the heart. How are we supposed to work for you while living costs rise? 

 http ://www.bizjournals.com/portland/news/2019/06/27/oshu-reports-earnings-at-56-million-over-budget.html

AFSCME http://blog.local328.org/",True,False,False,Portland,t5_2qi2i,129822,public,self,"Now how about paying employees, especially AFSCME members a better wage? Stop the spousal surcharge and PTO proposed changes. Give back to those who work hard for you.",0,1561860921,https://www.reddit.com/r/Portland/comments/c6t5pm/now_how_about_paying_employees_especially_afscme/,all_ads,6,,,,,,,,,,,,,,
[],aagusgus,,[],,text,t2_5823c,False,False,False,1561773469,oregonlive.com,https://www.reddit.com/r/Portland/comments/c6sze9/mcmenamins_oregons_1st_brewpub_a_pioneer_still/,{},c6sze9,True,False,False,False,True,False,False,,[],dark,text,False,False,True,48,0,False,all_ads,/r/Portland/comments/c6sze9/mcmenamins_oregons_1st_brewpub_a_pioneer_still/,False,6,1561773470,61,,True,False,False,Portland,t5_2qi2i,129821,public,https://b.thumbs.redditmedia.com/Wuv1ZohC7Gmrl3hS56sN0k8nvZfmZ1rudJsavhU4wbg.jpg,"McMenamins, Oregon’s 1st brewpub, a pioneer still going its own way: Portland Breweries Series",0,1561859850,https://www.oregonlive.com/beer/2019/06/mcmenamins-oregons-1st-brewpub-a-pioneer-still-going-its-own-way-portland-breweries-series.html,all_ads,6,,,local-news,Local News,link,"{'enabled': False, 'images': [{'id': 'Pjgtbo92NPvhsVrB4_cZRgul0UpSCbNhYEqx5flnyh0', 'resolutions': [{'height': 72, 'url': 'https://external-preview.redd.it/HcOCd3JMA9NsSxGqO_TLOP4V1S4333PsSkFMge2O5Zc.jpg?width=108&amp;crop=smart&amp;auto=webp&amp;s=8e2634cc52ee602dd3c4722a74189c2272869c3f', 'width': 108}, {'height': 144, 'url': 'https://external-preview.redd.it/HcOCd3JMA9NsSxGqO_TLOP4V1S4333PsSkFMge2O5Zc.jpg?width=216&amp;crop=smart&amp;auto=webp&amp;s=faf47beafcf830eddc1a6899e703cd6b7b692222', 'width': 216}, {'height': 213, 'url': 'https://external-preview.redd.it/HcOCd3JMA9NsSxGqO_TLOP4V1S4333PsSkFMge2O5Zc.jpg?width=320&amp;crop=smart&amp;auto=webp&amp;s=e7408112e148e2204e0d6504cfeeb7479b1da91e', 'width': 320}, {'height': 426, 'url': 'https://external-preview.redd.it/HcOCd3JMA9NsSxGqO_TLOP4V1S4333PsSkFMge2O5Zc.jpg?width=640&amp;crop=smart&amp;auto=webp&amp;s=97e2e57065ee96a0ff310e1f95f627c2d4bc7c49', 'width': 640}, {'height': 640, 'url': 'https://external-preview.redd.it/HcOCd3JMA9NsSxGqO_TLOP4V1S4333PsSkFMge2O5Zc.jpg?width=960&amp;crop=smart&amp;auto=webp&amp;s=6cc3576c54c219b472f3f2e18a83c5f73d15b5a1', 'width': 960}, {'height': 720, 'url': 'https://external-preview.redd.it/HcOCd3JMA9NsSxGqO_TLOP4V1S4333PsSkFMge2O5Zc.jpg?width=1080&amp;crop=smart&amp;auto=webp&amp;s=ef154326a2da53ca502a91f62b1e8a5ba02e220d', 'width': 1080}], 'source': {'height': 800, 'url': 'https://external-preview.redd.it/HcOCd3JMA9NsSxGqO_TLOP4V1S4333PsSkFMge2O5Zc.jpg?auto=webp&amp;s=c20d1e1a97d9fc4d6e651bf7afd46dc36b10a477', 'width': 1200}, 'variants': {}}]}",93.0,140.0,,,,,,
[],pdxdayofdiy,,[],,text,t2_41df7kcs,False,False,False,1561773354,self.Portland,https://www.reddit.com/r/Portland/comments/c6syp2/all_ages_multigenre_music_festival_july_20th/,{},c6syp2,False,False,False,False,False,True,False,,[],dark,text,False,False,True,0,0,False,all_ads,/r/Portland/comments/c6syp2/all_ages_multigenre_music_festival_july_20th/,False,6,1561773356,1,[removed],True,False,False,Portland,t5_2qi2i,129821,public,self,"All Ages, Multi-Genre music festival July 20th!!!",0,1561859732,https://www.reddit.com/r/Portland/comments/c6syp2/all_ages_multigenre_music_festival_july_20th/,all_ads,6,,,,,,,,,,,,,,
[],mortimanmpls,,[],,text,t2_3z7gq00o,False,False,False,1561772501,dailymail.co.uk,https://www.reddit.com/r/Portland/comments/c6stlb/horrific_moment_man_sucker_punches_woman_in_the/,{},c6stlb,True,False,False,False,True,False,False,,[],dark,text,False,False,True,0,0,False,all_ads,/r/Portland/comments/c6stlb/horrific_moment_man_sucker_punches_woman_in_the/,False,6,1561772502,0,,True,False,False,Portland,t5_2qi2i,129816,public,default,Horrific moment man sucker punches woman in the face 'breaking her eye socket' in Portland,0,1561858881,https://www.dailymail.co.uk/news/article-7194105/Horrific-moment-man-sucker-punches-woman-face-breaking-eye-socket-Portland.html,all_ads,6,,,,,,,,,,,,,,
[],EagleCreekFire,,[],,text,t2_dl73ls6,False,False,False,1561766869,katu.com,https://www.reddit.com/r/Portland/comments/c6rufn/wildfire_burning_near_parkdale_100_contained/,{},c6rufn,True,False,False,False,True,False,False,,[],dark,text,False,False,True,11,0,False,all_ads,/r/Portland/comments/c6rufn/wildfire_burning_near_parkdale_100_contained/,False,6,1561766870,50,,True,False,False,Portland,t5_2qi2i,129813,public,default,Wildfire burning near Parkdale 100% contained,0,1561853248,https://katu.com/news/local/wildfire-burning-near-parkdale-100-contained,all_ads,6,,,local-news,Local News,,,,,,,,,,
[],holmquistc,,[],,text,t2_d45u6,False,False,False,1561765179,self.Portland,https://www.reddit.com/r/Portland/comments/c6rjfp/smartphones_dumb_people/,{},c6rjfp,True,False,False,False,True,True,False,,[],dark,text,False,False,True,21,0,False,all_ads,/r/Portland/comments/c6rjfp/smartphones_dumb_people/,False,6,1561765179,8,I'm actually serious about this. Did you know that your smartphone has a speaker in it where you can put it to your ear and hear through it? Meanwhile u have to hear your conversation through the speakerphone in the library?,True,False,False,Portland,t5_2qi2i,129812,public,self,Smartphones dumb people,0,1561851567,https://www.reddit.com/r/Portland/comments/c6rjfp/smartphones_dumb_people/,all_ads,6,,,,,,,,,,,,,,
