all_awardings,allow_live_comments,author,author_flair_css_class,author_flair_richtext,author_flair_text,author_flair_type,author_fullname,author_patreon_flair,author_premium,awarders,can_mod_post,contest_mode,created_utc,domain,full_link,gildings,id,is_crosspostable,is_meta,is_original_content,is_reddit_media_domain,is_robot_indexable,is_self,is_video,link_flair_background_color,link_flair_richtext,link_flair_text_color,link_flair_type,locked,media,media_embed,media_only,no_follow,num_comments,num_crossposts,over_18,parent_whitelist_status,permalink,pinned,post_hint,preview,pwls,retrieved_on,score,secure_media,secure_media_embed,selftext,send_replies,spoiler,stickied,subreddit,subreddit_id,subreddit_subscribers,subreddit_type,thumbnail,thumbnail_height,thumbnail_width,title,total_awards_received,url,whitelist_status,wls,link_flair_css_class,link_flair_text,author_flair_background_color,author_flair_text_color,author_flair_template_id,removed_by_category,distinguished,suggested_sort,author_cakeday
[],False,chooch138,,[],,text,t2_6s1nt,False,True,[],False,False,1582324176,twitter.com,https://www.reddit.com/r/Portland/comments/f7ixmo/christian_is_charged_with_the_firstdegree_murder/,{},f7ixmo,True,False,False,False,True,False,False,,[],dark,text,False,"{'oembed': {'author_name': 'The Oregonian', 'author_url': 'https://twitter.com/Oregonian', 'cache_age': 3153600000, 'height': None, 'html': '&lt;blockquote class=""twitter-video""&gt;&lt;p lang=""en"" dir=""ltr""&gt;Christian is charged with the first-degree murders of Taliesin Namkai-Meche, 23, and Ricky Best, 53, and the first-degree attempted murder of Micah Fletcher, then 21, on a MAX train in Portland in 2017.&lt;/p&gt;&amp;mdash; The Oregonian (@Oregonian) &lt;a href=""https://twitter.com/Oregonian/status/1230981769173712896?ref_src=twsrc%5Etfw""&gt;February 21, 2020&lt;/a&gt;&lt;/blockquote&gt;\n&lt;script async src=""https://platform.twitter.com/widgets.js"" charset=""utf-8""&gt;&lt;/script&gt;\n', 'provider_name': 'Twitter', 'provider_url': 'https://twitter.com', 'type': 'rich', 'url': 'https://twitter.com/Oregonian/status/1230981769173712896', 'version': '1.0', 'width': 350}, 'type': 'twitter.com'}","{'content': '&lt;blockquote class=""twitter-video""&gt;&lt;p lang=""en"" dir=""ltr""&gt;Christian is charged with the first-degree murders of Taliesin Namkai-Meche, 23, and Ricky Best, 53, and the first-degree attempted murder of Micah Fletcher, then 21, on a MAX train in Portland in 2017.&lt;/p&gt;&amp;mdash; The Oregonian (@Oregonian) &lt;a href=""https://twitter.com/Oregonian/status/1230981769173712896?ref_src=twsrc%5Etfw""&gt;February 21, 2020&lt;/a&gt;&lt;/blockquote&gt;\n&lt;script async src=""https://platform.twitter.com/widgets.js"" charset=""utf-8""&gt;&lt;/script&gt;\n', 'height': 200, 'scrolling': False, 'width': 350}",False,True,4,0,False,all_ads,/r/Portland/comments/f7ixmo/christian_is_charged_with_the_firstdegree_murder/,False,link,"{'enabled': False, 'images': [{'id': 'jBtQAPQzniRLuKyeJCQ6NzOUtnTlqZJeaOVRJFDRoEM', 'resolutions': [{'height': 108, 'url': 'https://external-preview.redd.it/nd7-zNRRDI7sh1R1pTRGCzfH10zTvn95-n5KQWQDXvs.jpg?width=108&amp;crop=smart&amp;auto=webp&amp;s=1fe67150362663ada6d2f4db789482f10b25b84d', 'width': 108}], 'source': {'height': 140, 'url': 'https://external-preview.redd.it/nd7-zNRRDI7sh1R1pTRGCzfH10zTvn95-n5KQWQDXvs.jpg?auto=webp&amp;s=c972ed6152566bd404c9a85415d94dc747ffef86', 'width': 140}, 'variants': {}}]}",6,1582324180,1,"{'oembed': {'author_name': 'The Oregonian', 'author_url': 'https://twitter.com/Oregonian', 'cache_age': 3153600000, 'height': None, 'html': '&lt;blockquote class=""twitter-video""&gt;&lt;p lang=""en"" dir=""ltr""&gt;Christian is charged with the first-degree murders of Taliesin Namkai-Meche, 23, and Ricky Best, 53, and the first-degree attempted murder of Micah Fletcher, then 21, on a MAX train in Portland in 2017.&lt;/p&gt;&amp;mdash; The Oregonian (@Oregonian) &lt;a href=""https://twitter.com/Oregonian/status/1230981769173712896?ref_src=twsrc%5Etfw""&gt;February 21, 2020&lt;/a&gt;&lt;/blockquote&gt;\n&lt;script async src=""https://platform.twitter.com/widgets.js"" charset=""utf-8""&gt;&lt;/script&gt;\n', 'provider_name': 'Twitter', 'provider_url': 'https://twitter.com', 'type': 'rich', 'url': 'https://twitter.com/Oregonian/status/1230981769173712896', 'version': '1.0', 'width': 350}, 'type': 'twitter.com'}","{'content': '&lt;blockquote class=""twitter-video""&gt;&lt;p lang=""en"" dir=""ltr""&gt;Christian is charged with the first-degree murders of Taliesin Namkai-Meche, 23, and Ricky Best, 53, and the first-degree attempted murder of Micah Fletcher, then 21, on a MAX train in Portland in 2017.&lt;/p&gt;&amp;mdash; The Oregonian (@Oregonian) &lt;a href=""https://twitter.com/Oregonian/status/1230981769173712896?ref_src=twsrc%5Etfw""&gt;February 21, 2020&lt;/a&gt;&lt;/blockquote&gt;\n&lt;script async src=""https://platform.twitter.com/widgets.js"" charset=""utf-8""&gt;&lt;/script&gt;\n', 'height': 200, 'media_domain_url': 'https://www.redditmedia.com/mediaembed/f7ixmo', 'scrolling': False, 'width': 350}",,True,False,False,Portland,t5_2qi2i,146504,public,https://b.thumbs.redditmedia.com/NWpbHmeGb2YschlgHgxIQ4GJNeN-5DjKtbCoZUCE3Yg.jpg,140.0,140.0,Christian is charged with the first-degree murder,0,https://twitter.com/Oregonian/status/1230981769173712896,all_ads,6,,,,,,,,,
[],False,Faster-Powell,,[],,text,t2_5j7l8dny,False,True,[],False,False,1582323102,oregonlive.com,https://www.reddit.com/r/Portland/comments/f7inxo/west_linn_police_victims_discrimination_complaint/,{},f7inxo,True,False,False,False,True,False,False,,[],dark,text,False,,,False,True,0,0,False,all_ads,/r/Portland/comments/f7inxo/west_linn_police_victims_discrimination_complaint/,False,,,6,1582323104,1,,,,False,False,False,Portland,t5_2qi2i,146505,public,default,,,"West Linn police victim’s discrimination complaint dismissed after short state labor investigation, files show",0,https://www.oregonlive.com/crime/2020/02/state-file-shows-labor-investigator-did-cursory-review-of-portland-mans-racial-discrimination-suit-against-boss-at-ab-towing.html,all_ads,6,,,,,,,,,
[],False,tinysquatch99,,[],,text,t2_5dhryzya,False,False,[],False,False,1582321428,self.Portland,https://www.reddit.com/r/Portland/comments/f7i8yg/oregon_kicker_question/,{},f7i8yg,True,False,False,False,True,True,False,,[],dark,text,False,,,False,True,18,0,False,all_ads,/r/Portland/comments/f7i8yg/oregon_kicker_question/,False,,,6,1582321430,1,,,"I filed my taxes about 3.5 weeks ago and had the “manual review” note for about a week. I filed with HR block and they said with the kicker I’d be getting a couple hundred but then the state deposited twice as much today.

Do I need to worry about them saying they made a mistake or can I spend the money lol? Sorry it’s a dumb question I’ve just never gotten so much more back than stated.",True,False,False,Portland,t5_2qi2i,146505,public,self,,,Oregon Kicker Question,0,https://www.reddit.com/r/Portland/comments/f7i8yg/oregon_kicker_question/,all_ads,6,,,,,,,,,
[],False,pdxbilly,,[],,text,t2_15w0nydl,False,False,[],False,False,1582319775,self.Portland,https://www.reddit.com/r/Portland/comments/f7htyf/hophouse_on_hawthorne_closing_today/,{},f7htyf,True,False,False,False,True,True,False,,[],dark,text,False,,,False,True,25,0,False,all_ads,/r/Portland/comments/f7htyf/hophouse_on_hawthorne_closing_today/,False,,,6,1582319778,1,,,Kinda bummed because I liked their jalapeno deviled eggs w/ bacon. Anyone know what's going to move into the space?,True,False,False,Portland,t5_2qi2i,146502,public,self,,,Hophouse on Hawthorne closing today,0,https://www.reddit.com/r/Portland/comments/f7htyf/hophouse_on_hawthorne_closing_today/,all_ads,6,,,,,,,,,
[],False,CrazyMushroomSoup,,[],,text,t2_nigrj,False,False,[],False,False,1582319716,oregonlive.com,https://www.reddit.com/r/Portland/comments/f7htgp/good_samaritan_fired_from_us_bank_gets_new_job/,{},f7htgp,True,False,False,False,True,False,False,,[],dark,text,False,,,False,True,12,0,False,all_ads,/r/Portland/comments/f7htgp/good_samaritan_fired_from_us_bank_gets_new_job/,False,,,6,1582319718,1,,,,False,False,False,Portland,t5_2qi2i,146502,public,default,,,Good Samaritan fired from U.S. Bank gets new job with credit union,0,https://www.oregonlive.com/news/2020/02/good-samaritan-fired-from-us-bank-gets-new-job-with-credit-union.html,all_ads,6,local-news,Local News,,,,,,,
[],False,PootyT,,[],Kenton,text,t2_3squc,False,False,[],False,False,1582317229,self.Portland,https://www.reddit.com/r/Portland/comments/f7h786/offleash_dogs/,{},f7h786,True,False,False,False,True,True,False,,[],dark,text,False,,,False,True,140,0,False,all_ads,/r/Portland/comments/f7h786/offleash_dogs/,False,,,6,1582317235,1,,,"Just the annual springtime reminder that in the City of Portland, all parks require leashes on dogs at all times EXCEPT those explicitly stated as off-leash or off-leash areas. You are not the exception. Your dog is not the exception. Your dog is cute but it’s not special.",True,False,False,Portland,t5_2qi2i,146498,public,self,,,Off-leash dogs!,0,https://www.reddit.com/r/Portland/comments/f7h786/offleash_dogs/,all_ads,6,,,,dark,,,,,
[],False,willregan,,[],,text,t2_wh0jx,False,False,[],False,False,1582315476,self.Portland,https://www.reddit.com/r/Portland/comments/f7gqze/extinction_rebellion_portland_is_making_a_huge/,{},f7gqze,True,False,False,False,True,True,False,,[],dark,text,False,,,False,True,2,0,False,all_ads,/r/Portland/comments/f7gqze/extinction_rebellion_portland_is_making_a_huge/,False,,,6,1582315482,1,,,"After the climate strike in mid summer, many Extinction Rebellion Activists decided to take it up a notch and start holding Extinction Rebellion events (before the really cold weather hit)

We did so for about 6 straight events. Had a lot of great swarms, and convos, and got out a ton of material.

We're still doing talks, and now have an official Extinction Rebellion club on the PSU campus

Don't listen to the haters, XR is coming up!

There are some squabbles between 3 &amp; 4 demands, but the main goal is climate justice, and we can all get behind this idea. Both 3 &amp; 4 demands have good and bad points, but they are both valid!

Today we are doing a talk on the PSU campus at 2:00pm, in the FMH building, rm 230, free and open to anyone!

[https://www.facebook.com/events/2365085563592669/](https://www.facebook.com/events/2365085563592669/)

March 21st, we will be doing an XR Summit for Climate and Ecological Justice:

[https://www.facebook.com/events/511410196448740/](https://www.facebook.com/events/511410196448740/)

May 9th, we are taking to the streets:

[https://www.facebook.com/events/511410196448740/](https://www.facebook.com/events/511410196448740/)",True,False,False,Portland,t5_2qi2i,146496,public,self,,,Extinction Rebellion Portland is making a huge comeback! Climate Talk today at 2pm on PSU campus!,0,https://www.reddit.com/r/Portland/comments/f7gqze/extinction_rebellion_portland_is_making_a_huge/,all_ads,6,,,,,,,,,
[],False,t0mserv0,,[],,text,t2_4spa4,False,False,[],False,False,1582314395,self.Portland,https://www.reddit.com/r/Portland/comments/f7ghcq/any_survivor_watch_parties_happening_in_portland/,{},f7ghcq,True,False,False,False,True,True,False,,[],dark,text,False,,,False,True,8,0,False,all_ads,/r/Portland/comments/f7ghcq/any_survivor_watch_parties_happening_in_portland/,False,,,6,1582314458,1,,,"I'm dyin to go to a cool watch party like they have in other cities, usually hosted by former Survivor players (the Philly one looks lit). I know Ciera is from around here... anybody heard anything about a local Survivor watch party on Wednesday nights?",True,False,False,Portland,t5_2qi2i,146496,public,self,,,Any Survivor watch parties happening in Portland on Wednesdays?,0,https://www.reddit.com/r/Portland/comments/f7ghcq/any_survivor_watch_parties_happening_in_portland/,all_ads,6,,,,,,,,,
[],False,torreyjaye,,[],,text,t2_5y40y,False,False,[],False,False,1582312807,self.Portland,https://www.reddit.com/r/Portland/comments/f7g39l/i_was_in_a_hit_and_run_carbicycle_accident/,{},f7g39l,True,False,False,False,True,True,False,,[],dark,text,False,,,False,True,37,0,False,all_ads,/r/Portland/comments/f7g39l/i_was_in_a_hit_and_run_carbicycle_accident/,False,,,6,1582312809,1,,,"Got hit by a car on my bike (well technically I hit it, but he pulled out in front of me.)  Flipped over my handlebars, hit the back of his car.  Completely his fault.  He fled the scene, but I got his license plate.  Police called me an hour later and said he was arrested for ""hit and run.""  I don't have any serious injuries, but my bike is all scratched up and front wheel is bent.  I am pretty sore this morning though and thinking of going to the doctor just to be safe.

I'm glad they arrested this prick.  But I don't know what happens now.  

Anyone have experience with something like this?",True,False,False,Portland,t5_2qi2i,146496,public,self,,,I was in a hit and run car/bicycle accident.,0,https://www.reddit.com/r/Portland/comments/f7g39l/i_was_in_a_hit_and_run_carbicycle_accident/,all_ads,6,,,,,,,,,
[],False,basicmay,,[],,text,t2_jyfr1gn,False,False,[],False,False,1582310948,self.Portland,https://www.reddit.com/r/Portland/comments/f7fmwt/cosmetology_school_recommendations/,{},f7fmwt,True,False,False,False,True,True,False,,[],dark,text,False,,,False,True,12,0,False,all_ads,/r/Portland/comments/f7fmwt/cosmetology_school_recommendations/,False,,,6,1582310952,1,,,"If you’re a cosmetology student or licensed cosmetologist in Portland, what schools do you recommend? 
I am interested in competency based programs just so I can get through school a little faster but open to other options as well. 
Finding tuition prices is difficult unless you go tour each school, so I’m hoping to get some pricing information here as well.",True,False,False,Portland,t5_2qi2i,146495,public,self,,,Cosmetology school recommendations,0,https://www.reddit.com/r/Portland/comments/f7fmwt/cosmetology_school_recommendations/,all_ads,6,,,,,,,,,
[],False,TheOtherOneK,,[],,text,t2_l4xfwqa,False,False,[],False,False,1582310549,i.redd.it,https://www.reddit.com/r/Portland/comments/f7fjhy/found_dog_corgi_powellhurst_neighborhood/,{},f7fjhy,True,False,False,True,True,False,False,,[],dark,text,False,,,False,True,8,0,False,all_ads,/r/Portland/comments/f7fjhy/found_dog_corgi_powellhurst_neighborhood/,False,image,"{'enabled': True, 'images': [{'id': 'dyB1vR8fyJ1-GfXLerOCxsoF8blcJYSCcWFsb7WwI6s', 'resolutions': [{'height': 151, 'url': 'https://preview.redd.it/xkbhkmn4obi41.jpg?width=108&amp;crop=smart&amp;auto=webp&amp;s=322d91234aef25f2bf2ae3aeb6e64e2e42085807', 'width': 108}, {'height': 302, 'url': 'https://preview.redd.it/xkbhkmn4obi41.jpg?width=216&amp;crop=smart&amp;auto=webp&amp;s=b75f492a5ea2f85edba485e3553472c5548a2aac', 'width': 216}, {'height': 447, 'url': 'https://preview.redd.it/xkbhkmn4obi41.jpg?width=320&amp;crop=smart&amp;auto=webp&amp;s=c6708fc6eb0ba010a5c06a2fcfc12eff66eb3528', 'width': 320}, {'height': 895, 'url': 'https://preview.redd.it/xkbhkmn4obi41.jpg?width=640&amp;crop=smart&amp;auto=webp&amp;s=d5ca7666c5bed8a2f24f8aa726c6fdcc8eda94a1', 'width': 640}], 'source': {'height': 1049, 'url': 'https://preview.redd.it/xkbhkmn4obi41.jpg?auto=webp&amp;s=295240f9b7ece30ba6458a2e6fa522190167ce6e', 'width': 750}, 'variants': {}}]}",6,1582310556,1,,,,True,False,False,Portland,t5_2qi2i,146495,public,https://b.thumbs.redditmedia.com/0t7UGm-mvLGZG3kR4h4_Vw-zhEI7TzILMU17WFw0ssA.jpg,140.0,140.0,Found dog (corgi?) Powellhurst neighborhood,0,https://i.redd.it/xkbhkmn4obi41.jpg,all_ads,6,photo,Photo,,,,,,,
[],False,TheOtherOneK,,[],,text,t2_l4xfwqa,False,False,[],False,False,1582310533,i.redd.it,https://www.reddit.com/r/Portland/comments/f7fjcn/found_dog_corgi_powellhurst_neighborhood/,{},f7fjcn,True,False,False,True,True,False,False,,[],dark,text,False,,,False,True,1,0,False,all_ads,/r/Portland/comments/f7fjcn/found_dog_corgi_powellhurst_neighborhood/,False,image,"{'enabled': True, 'images': [{'id': 'mvVI_ME5dRomRF__8m7ZLqOcip7fR6M0KL9tTbNnfYI', 'resolutions': [{'height': 151, 'url': 'https://preview.redd.it/vf5n0ry2obi41.jpg?width=108&amp;crop=smart&amp;auto=webp&amp;s=c4e212a94867339646d46c0eec6631d3cee8484e', 'width': 108}, {'height': 302, 'url': 'https://preview.redd.it/vf5n0ry2obi41.jpg?width=216&amp;crop=smart&amp;auto=webp&amp;s=6f4785855914286bb46e517499986e5e1d1f632d', 'width': 216}, {'height': 447, 'url': 'https://preview.redd.it/vf5n0ry2obi41.jpg?width=320&amp;crop=smart&amp;auto=webp&amp;s=332992435b82fffeefda3aeac2bea78a75f284a9', 'width': 320}, {'height': 895, 'url': 'https://preview.redd.it/vf5n0ry2obi41.jpg?width=640&amp;crop=smart&amp;auto=webp&amp;s=0353f285906784fbf06db2da178606b7a52dc145', 'width': 640}], 'source': {'height': 1049, 'url': 'https://preview.redd.it/vf5n0ry2obi41.jpg?auto=webp&amp;s=e9bcb169d2a5c386069bf7d86f188778eaef39b5', 'width': 750}, 'variants': {}}]}",6,1582310536,1,,,,True,False,False,Portland,t5_2qi2i,146495,public,https://b.thumbs.redditmedia.com/ZZr2q9kl9QZal1Jvc4w8Hu44d03QzgW-9pMCrMFmvUE.jpg,140.0,140.0,Found dog (corgi?) Powellhurst neighborhood,0,https://i.redd.it/vf5n0ry2obi41.jpg,all_ads,6,photo,Photo,,,,,,,
[],False,TheOtherOneK,,[],,text,t2_l4xfwqa,False,False,[],False,False,1582310515,i.redd.it,https://www.reddit.com/r/Portland/comments/f7fj7r/found_dog_corgi_powellhurst_neighborhood/,{},f7fj7r,True,False,False,True,True,False,False,,[],dark,text,False,,,False,True,1,0,False,all_ads,/r/Portland/comments/f7fj7r/found_dog_corgi_powellhurst_neighborhood/,False,image,"{'enabled': True, 'images': [{'id': 'NCshvnn65pn39M8Twcxs-0DfnXQJUYtoGif90E6iHwc', 'resolutions': [{'height': 151, 'url': 'https://preview.redd.it/uh0lke41obi41.jpg?width=108&amp;crop=smart&amp;auto=webp&amp;s=0377b3959247486969ad5ad4b2c51a1c66e05ff7', 'width': 108}, {'height': 302, 'url': 'https://preview.redd.it/uh0lke41obi41.jpg?width=216&amp;crop=smart&amp;auto=webp&amp;s=522a47d38905ac21c63f65c4bcda0d8616756c60', 'width': 216}, {'height': 447, 'url': 'https://preview.redd.it/uh0lke41obi41.jpg?width=320&amp;crop=smart&amp;auto=webp&amp;s=bcb2a3c24bdbd21c438a98f591e7023c11e042ce', 'width': 320}, {'height': 895, 'url': 'https://preview.redd.it/uh0lke41obi41.jpg?width=640&amp;crop=smart&amp;auto=webp&amp;s=86c4584ac9daa42acc0fcd40adab070fa6ceafec', 'width': 640}], 'source': {'height': 1049, 'url': 'https://preview.redd.it/uh0lke41obi41.jpg?auto=webp&amp;s=fc57dabdc9d576aa49a6b537cb33b8ff98ba7d80', 'width': 750}, 'variants': {}}]}",6,1582310520,1,,,,True,False,False,Portland,t5_2qi2i,146495,public,https://a.thumbs.redditmedia.com/YM-CcCK7p5I8f32J2GGW6VZixrOiYK4H5mhG62yKSi4.jpg,140.0,140.0,Found dog (corgi?) Powellhurst neighborhood,0,https://i.redd.it/uh0lke41obi41.jpg,all_ads,6,photo,Photo,,,,,,,
[],False,Tiberius696969,,[],,text,t2_48f4b6y7,False,False,[],False,False,1582308760,self.Portland,https://www.reddit.com/r/Portland/comments/f7f3qf/looking_for_housing/,{},f7f3qf,True,False,False,False,True,True,False,,[],dark,text,False,,,False,True,4,0,False,all_ads,/r/Portland/comments/f7f3qf/looking_for_housing/,False,,,6,1582308767,1,,,"Moving cross country (cuz y'all are so cool!) and wanna lock in an apartment/duplex/once-in-a-lifetime dreamhouse for cheap(ha!).

Can you help with suggestions?",True,False,False,Portland,t5_2qi2i,146495,public,self,,,Looking for housing,0,https://www.reddit.com/r/Portland/comments/f7f3qf/looking_for_housing/,all_ads,6,housing,Housing,,,,,,,
[],False,PersnicketyHazelnuts,,[],,text,t2_4y5bd7vg,False,False,[],False,False,1582308607,nytimes.com,https://www.reddit.com/r/Portland/comments/f7f2ao/john_hodgman_weighs_in_on_portland_drivers_not/,{},f7f2ao,True,False,False,False,True,False,False,,[],dark,text,False,,,False,True,114,0,False,all_ads,/r/Portland/comments/f7f2ao/john_hodgman_weighs_in_on_portland_drivers_not/,False,,,6,1582308610,1,,,,True,False,False,Portland,t5_2qi2i,146495,public,default,,,John Hodgman weighs in on Portland drivers not using the zipper merge (in the NY Times),0,https://www.nytimes.com/2020/02/21/magazine/judge-john-hodgman-on-portland-drivers.html,all_ads,6,,,,,,,,,
[],False,Uitwaaien,,[],St Johns,text,t2_55jk2,False,False,[],False,False,1582308601,self.Portland,https://www.reddit.com/r/Portland/comments/f7f28s/update_portland_water_bureau_notified_me_of_5x/,{},f7f28s,True,False,False,False,True,True,False,,[],dark,text,False,,,False,True,75,0,False,all_ads,/r/Portland/comments/f7f28s/update_portland_water_bureau_notified_me_of_5x/,False,,,6,1582308604,1,,,"here's a [link](https://www.reddit.com/r/Portland/comments/f4dqxt/portland_water_bureau_notified_me_of_5x_increase/) to my original post.

I got a leak detection service to come to my house and take a look around. He wrote up a formal inspection for me to send to the water bureau. His findings were as such: 

""After ruling out all other potential sources of leakage, I determined that all of the mentioned potential sources had not caused the excessive use. I also determined that the upstairs hall toilet was the source of excessive use, more particularly the fill valve and chain connected to the flush tower both allowed the water in the back of the tank to continuously flow down the drain. Occasionally when the chain is flipped next to the flush tower, it will draw water over the edge and cause the fill valve to continuously run, reference picture nine. While testing the fill valve, I found that the float on the fill valve will occasionally stick and allow water to constantly run, reference picture ten. It is recommended that all three fill valves on the toilets are replaced in order to prevent future high water usage.""

I cannot recommend [Steven Moon of Agent Leak Detection](https://agentleakdetection.com/) enough. He is a former plumber, journeyman, master plumber, and something like an ""investigative"" plumber?  He was so kind and taught me how to winterize my pipes because I didn't know how. I never would've found this myself, and even a plumber didn't catch it. The leak was silent, random, and constant so it makes sense the bill was so huge.   
Next week I am having a plumber from [Three Mountains Plumbing](https://www.3mountainsplumbing.com/) come out and fix these. The water bureau assured me that if I can prove these were fixed, the  bill will be adjusted to what my averages have been over the last year.  
Thank you for all of your ideas and sympathy. I hope this helps someone out in the future. I highly recommend both of these businesses for their promptness and helpfulness and sympathy.",True,False,False,Portland,t5_2qi2i,146495,public,self,,,!!!UPDATE: Portland Water Bureau notified me of 5x increase of water usage on my property but plumbers gave me a clean bill,0,https://www.reddit.com/r/Portland/comments/f7f28s/update_portland_water_bureau_notified_me_of_5x/,all_ads,6,,,,dark,6fa02886-42c6-11e1-9d5f-12313d18ad57,,,,
[],False,73233,,[],,text,t2_4bkd147o,False,False,[],False,False,1582307618,oregonlive.com,https://www.reddit.com/r/Portland/comments/f7etas/portland_couple_sentenced_for_murder_of_eugene/,{},f7etas,True,False,False,False,True,False,False,,[],dark,text,False,,,False,True,6,0,False,all_ads,/r/Portland/comments/f7etas/portland_couple_sentenced_for_murder_of_eugene/,False,link,"{'enabled': False, 'images': [{'id': 'kALiDaXPIMVNr2wIK1K37tPUWQ6F6w3OiNexCZxLWII', 'resolutions': [{'height': 81, 'url': 'https://external-preview.redd.it/th28QL5iQUyGQvjW7kSJ-j32-tAZMnYP_bR-hEQN468.jpg?width=108&amp;crop=smart&amp;auto=webp&amp;s=98dd47ee09db1c5b2483ac7ab1a0ec14cee64aea', 'width': 108}, {'height': 162, 'url': 'https://external-preview.redd.it/th28QL5iQUyGQvjW7kSJ-j32-tAZMnYP_bR-hEQN468.jpg?width=216&amp;crop=smart&amp;auto=webp&amp;s=04cd45e3f8df9e9b5b49894da1161b0121428e80', 'width': 216}, {'height': 241, 'url': 'https://external-preview.redd.it/th28QL5iQUyGQvjW7kSJ-j32-tAZMnYP_bR-hEQN468.jpg?width=320&amp;crop=smart&amp;auto=webp&amp;s=008f8978348f6e10de806f9d664734bf9c11591b', 'width': 320}, {'height': 482, 'url': 'https://external-preview.redd.it/th28QL5iQUyGQvjW7kSJ-j32-tAZMnYP_bR-hEQN468.jpg?width=640&amp;crop=smart&amp;auto=webp&amp;s=cac1b1002f71b3876de00168d594532c07b96469', 'width': 640}, {'height': 723, 'url': 'https://external-preview.redd.it/th28QL5iQUyGQvjW7kSJ-j32-tAZMnYP_bR-hEQN468.jpg?width=960&amp;crop=smart&amp;auto=webp&amp;s=22e0396f5b03e6fc22594f308a2186b324357e0f', 'width': 960}, {'height': 813, 'url': 'https://external-preview.redd.it/th28QL5iQUyGQvjW7kSJ-j32-tAZMnYP_bR-hEQN468.jpg?width=1080&amp;crop=smart&amp;auto=webp&amp;s=a6836e0afe6544dc0e74d0a00e4643e33949c49e', 'width': 1080}], 'source': {'height': 964, 'url': 'https://external-preview.redd.it/th28QL5iQUyGQvjW7kSJ-j32-tAZMnYP_bR-hEQN468.jpg?auto=webp&amp;s=56254f950a14a8da33feb2856e1a96a8befe2d2c', 'width': 1280}, 'variants': {}}]}",6,1582307624,1,,,,False,False,False,Portland,t5_2qi2i,146495,public,https://b.thumbs.redditmedia.com/BMwT10YwxZ00xCpdOA8fSqXz1Is2ZAWrCLCZbaS6KtI.jpg,105.0,140.0,Portland couple sentenced for murder of Eugene college student,0,https://www.oregonlive.com/pacific-northwest-news/2020/02/portland-couple-sentenced-for-murder-of-eugene-college-student.html,all_ads,6,local-news,Local News,,,,,,,
[],False,mashley503,,[],Hollywood,text,t2_ap2bf,False,False,[],False,False,1582306032,self.Portland,https://www.reddit.com/r/Portland/comments/f7eevj/without_looking_what_would_you_assume_was_the/,{},f7eevj,True,False,False,False,True,True,False,,[],dark,text,False,,,False,True,42,0,False,all_ads,/r/Portland/comments/f7eevj/without_looking_what_would_you_assume_was_the/,False,,,6,1582306059,1,,,,True,False,False,Portland,t5_2qi2i,146491,public,self,,,"Without looking, what would you assume was the most upvoted post of all time on r/Portland based on your own experience with the sub?",0,https://www.reddit.com/r/Portland/comments/f7eevj/without_looking_what_would_you_assume_was_the/,all_ads,6,,,,dark,,,,,
