author,author_created_utc,author_flair_css_class,author_flair_text,author_fullname,created_utc,domain,full_link,gilded,id,is_self,media_embed,num_comments,over_18,permalink,retrieved_on,score,secure_media_embed,selftext,stickied,subreddit,subreddit_id,thumbnail,title,url,edited,post_hint,preview,media,secure_media
darkforestzero,1303966522.0,,,t2_55oyz,1436287760,self.Portland,https://www.reddit.com/r/Portland/comments/3cfzey/the_opb_music_guy_is_going_crazy_today_with_video/,0,3cfzey,True,{},17,False,/r/Portland/comments/3cfzey/the_opb_music_guy_is_going_crazy_today_with_video/,1440626004,77,{},"Within the last 15 minutes I've heard remixes of nes Duck Tales, Mega Man, Tetris, and Mario.  This guy loves his job :P",False,Portland,t5_2qi2i,self,The OPB music guy is going crazy today with video game music remixes,http://www.reddit.com/r/Portland/comments/3cfzey/the_opb_music_guy_is_going_crazy_today_with_video/,,,,,
ejchristian86,1308197685.0,,Cedar Mill,t2_5dqsl,1436286074,i.imgur.com,https://www.reddit.com/r/Portland/comments/3cfveo/ive_never_been_so_excited_for_a_cooling_trend/,0,3cfveo,False,{},88,False,/r/Portland/comments/3cfveo/ive_never_been_so_excited_for_a_cooling_trend/,1440626056,351,{},,False,Portland,t5_2qi2i,http://b.thumbs.redditmedia.com/rj7rl3jpd71lwLjyjpmao7SwJewPHOjPt5-91mk7qEU.jpg,I've never been so excited for a cooling trend!,http://i.imgur.com/YNIoTB9.png,,image,"{'images': [{'id': 'yam0_wa4WyTeL16OBnu6fL2rQAvaVRKX8T7SZUeE5XE', 'resolutions': [{'height': 192, 'url': 'https://i.redditmedia.com/bW2KPbgxrRjQrcGPd5Hx4hIa3PdVRi6ZJAmqxle_EXA.jpg?fit=crop&amp;crop=faces%2Centropy&amp;arh=2&amp;w=108&amp;s=f446d10f1a3fe994f0b5b15fc273a2ee', 'width': 108}, {'height': 384, 'url': 'https://i.redditmedia.com/bW2KPbgxrRjQrcGPd5Hx4hIa3PdVRi6ZJAmqxle_EXA.jpg?fit=crop&amp;crop=faces%2Centropy&amp;arh=2&amp;w=216&amp;s=a7cdf770df13ad16366abac70f85d9f4', 'width': 216}, {'height': 568, 'url': 'https://i.redditmedia.com/bW2KPbgxrRjQrcGPd5Hx4hIa3PdVRi6ZJAmqxle_EXA.jpg?fit=crop&amp;crop=faces%2Centropy&amp;arh=2&amp;w=320&amp;s=55b3d3ab303fca5080d1cc4943d63dea', 'width': 320}, {'height': 1137, 'url': 'https://i.redditmedia.com/bW2KPbgxrRjQrcGPd5Hx4hIa3PdVRi6ZJAmqxle_EXA.jpg?fit=crop&amp;crop=faces%2Centropy&amp;arh=2&amp;w=640&amp;s=4b549778ab67d828497f44b1c6f2fa32', 'width': 640}], 'source': {'height': 1280, 'url': 'https://i.redditmedia.com/bW2KPbgxrRjQrcGPd5Hx4hIa3PdVRi6ZJAmqxle_EXA.jpg?s=0e91c58793dcdce7ff0827eedf76ecb8', 'width': 720}, 'variants': {}}]}",,
gdizzle815,1352586427.0,,,t2_9kdy1,1436286053,self.Portland,https://www.reddit.com/r/Portland/comments/3cfvcc/i_got_a_job_in_vancouver_is_it_worth_it_to_live/,0,3cfvcc,True,{},69,False,/r/Portland/comments/3cfvcc/i_got_a_job_in_vancouver_is_it_worth_it_to_live/,1440626057,20,{},"I got my first post-college job in Vancouver with the Evergreen school district. I'm going to be teaching at 4 schools (paid for drive time between schools). I'm deciding if it would be feasible to live in Portland and commute up to Vancouver. I am from a medium-sized city in Montana and went to college in a small town in central WA. I've spent a little time north of Seattle as well. I'd like to try the city life if I can make it happen.

I know that I would have to pay OR state income tax, is it worth it to live in Portland? How is the commute from Portland to Vancouver? From my brief research, it seems like I would be going the opposite way from the worst traffic. Rent would be higher in Portland. I'm looking at spending between 700 and 900 on rent, looking for a 1 bedroom or 2 bedroom, is that doable in Portland? I am single and want to live by myself.

TL;DR: Got a job in Vancouver, is it worth it to live in Portland?

Edit: Thanks for the responses. I'm surprised to see so many people telling me not to do it. I'm glad I asked!",False,Portland,t5_2qi2i,self,"I got a job in Vancouver, is it worth it to live in Portland? x-post to /r/vancouverwa",http://www.reddit.com/r/Portland/comments/3cfvcc/i_got_a_job_in_vancouver_is_it_worth_it_to_live/,1436287748.0,,,,
[deleted],,,,,1436282093,self.Portland,https://www.reddit.com/r/Portland/comments/3cfm5j/the_broadway_bridge_was_up_today_and_bike_advocacy/,0,3cfm5j,True,{},10,False,/r/Portland/comments/3cfm5j/the_broadway_bridge_was_up_today_and_bike_advocacy/,1440626176,0,{},"Hey guys, we're all gonna get off the bridge. We don't need to force people into the railing because you forgot there is still scaffolding up on the sidewalk. We're all super impressed with how fast you ride your bike downhill, but literally hit the brakes kid. Get in line so I don't have to pass you later because you not only suck at not putting other people in danger, but you have no acceleration skill. You're the human equivalent of a Saturn when you're on a bike. 

Another reason to be safe; it's good bike advocacy. You never know who you're being a dick to, or who sees you running a red that could somehow sway whether or not bike infrastructure gets funding or votes in the future. If you're not going to do good; at least do no harm. ",False,Portland,t5_2qi2i,default,The Broadway Bridge was up today and bike advocacy,http://www.reddit.com/r/Portland/comments/3cfm5j/the_broadway_bridge_was_up_today_and_bike_advocacy/,,,,,
fynflood,1339959863.0,,,t2_80zcb,1436281096,self.Portland,https://www.reddit.com/r/Portland/comments/3cfjx3/a_game_of_thrones_the_board_game/,0,3cfjx3,True,{},21,False,/r/Portland/comments/3cfjx3/a_game_of_thrones_the_board_game/,1440626205,5,{},"Anyone know how to play this? The learning curve is steep, and it would be super helpful to have someone around who knows what's happening.",False,Portland,t5_2qi2i,self,A Game of Thrones: The Board Game?,http://www.reddit.com/r/Portland/comments/3cfjx3/a_game_of_thrones_the_board_game/,,,,,
[deleted],,,,,1436261862,self.Portland,https://www.reddit.com/r/Portland/comments/3cepn2/just_want_to_give_a_big_shoutout_to_my_landlord/,0,3cepn2,True,{},117,False,/r/Portland/comments/3cepn2/just_want_to_give_a_big_shoutout_to_my_landlord/,1440626657,1,{},"You rock, dude! now please fix the plumbing and crumbling infastructure. oh, ok, that's not your responsibility? it was our short hair that made the tub seal leak? fuck you and fuck california. thanks for letting us know we're still ""well under market value"" you greedy fuck",False,Portland,t5_2qi2i,default,Just want to give a big shoutout to my landlord for raising the rent by $350 next month,http://www.reddit.com/r/Portland/comments/3cepn2/just_want_to_give_a_big_shoutout_to_my_landlord/,,,,,
jr98664,1304474855.0,,Overlook,t2_56rfr,1436253239,wweek.com,https://www.reddit.com/r/Portland/comments/3ceflm/portland_dispensaries_will_need_1500_city_permits/,0,3ceflm,False,{},25,False,/r/Portland/comments/3ceflm/portland_dispensaries_will_need_1500_city_permits/,1440626787,43,{},,False,Portland,t5_2qi2i,http://b.thumbs.redditmedia.com/dkCCvT-_wSmV7NSE1xM50R0fCqE7OHXiTAKPJsi4olI.jpg,"Portland Dispensaries Will Need $1,500 City Permits to Sell Recreational Weed This Fall.",http://www.wweek.com/portland/mobile/blogs/blogView/id:33423,,link,"{'images': [{'id': '9FLpC1s64XK6UBjHYpn_Zfsr0LGQNJsMld5uDV0UHLk', 'resolutions': [{'height': 71, 'url': 'https://i.redditmedia.com/Gkaz7BIc_ocaU5HsDR8nyfbYKUiBUbU0O8njOyjNaWo.jpg?fit=crop&amp;crop=faces%2Centropy&amp;arh=2&amp;w=108&amp;s=99cf39f8d4967eae1aab0a5780fba700', 'width': 108}, {'height': 143, 'url': 'https://i.redditmedia.com/Gkaz7BIc_ocaU5HsDR8nyfbYKUiBUbU0O8njOyjNaWo.jpg?fit=crop&amp;crop=faces%2Centropy&amp;arh=2&amp;w=216&amp;s=4aed77b9f4c77060165448df7266e817', 'width': 216}, {'height': 212, 'url': 'https://i.redditmedia.com/Gkaz7BIc_ocaU5HsDR8nyfbYKUiBUbU0O8njOyjNaWo.jpg?fit=crop&amp;crop=faces%2Centropy&amp;arh=2&amp;w=320&amp;s=d3add3b56d9c8e99e00abec35bce1803', 'width': 320}], 'source': {'height': 414, 'url': 'https://i.redditmedia.com/Gkaz7BIc_ocaU5HsDR8nyfbYKUiBUbU0O8njOyjNaWo.jpg?s=0d64071e36142fa5d0e42a477623a644', 'width': 622}, 'variants': {}}]}",,
shyamdas,1361166465.0,,SE,t2_an1xl,1436252641,self.Portland,https://www.reddit.com/r/Portland/comments/3ceete/where_on_mt_tabor_are_the_concerts_in_the_park/,0,3ceete,True,{},2,False,/r/Portland/comments/3ceete/where_on_mt_tabor_are_the_concerts_in_the_park/,1440626797,0,{},Tabor is a pretty big park does anyone know where they hold the free concerts? http://www.portlandoregon.gov/parks/article/489141,False,Portland,t5_2qi2i,self,Where on Mt Tabor are the Concerts in the park?,http://www.reddit.com/r/Portland/comments/3ceete/where_on_mt_tabor_are_the_concerts_in_the_park/,,self,"{'images': [{'id': 'Eu2vkQ--XKnCvhDNb3FZPGzV869VwCVkulVgmi2IDuE', 'resolutions': [{'height': 86, 'url': 'https://i.redditmedia.com/yi8RrPhLJ3phxkEiyDEtF9Yc-RveU1AUByu51H6zoaM.jpg?fit=crop&amp;crop=faces%2Centropy&amp;arh=2&amp;w=108&amp;s=b65980f4cf0249363a617515b6aca402', 'width': 108}, {'height': 172, 'url': 'https://i.redditmedia.com/yi8RrPhLJ3phxkEiyDEtF9Yc-RveU1AUByu51H6zoaM.jpg?fit=crop&amp;crop=faces%2Centropy&amp;arh=2&amp;w=216&amp;s=2a2180d472bfbf2f2cc67de2c269fc5a', 'width': 216}, {'height': 256, 'url': 'https://i.redditmedia.com/yi8RrPhLJ3phxkEiyDEtF9Yc-RveU1AUByu51H6zoaM.jpg?fit=crop&amp;crop=faces%2Centropy&amp;arh=2&amp;w=320&amp;s=63349d3bd16aac28a4dd6336259df402', 'width': 320}], 'source': {'height': 288, 'url': 'https://i.redditmedia.com/yi8RrPhLJ3phxkEiyDEtF9Yc-RveU1AUByu51H6zoaM.jpg?s=ae610afad511d7269bdef88b06e847ab', 'width': 360}, 'variants': {}}]}",,
rbevans,1309264166.0,,,t2_5fsyr,1436252341,self.Portland,https://www.reddit.com/r/Portland/comments/3ceedx/just_got_to_portland_and_fly_out_tomorrow_night/,0,3ceedx,True,{},25,False,/r/Portland/comments/3ceedx/just_got_to_portland_and_fly_out_tomorrow_night/,1440626803,0,{},My wife and I fly out tomorrow. We have a bunch of sites we want to see but there are too many breweries and not enough time. What is the best brewery to check out? ,False,Portland,t5_2qi2i,self,Just got to Portland and fly out tomorrow night and need your best brewery!,http://www.reddit.com/r/Portland/comments/3ceedx/just_got_to_portland_and_fly_out_tomorrow_night/,,,,,
[deleted],,,,,1436251691,self.Portland,https://www.reddit.com/r/Portland/comments/3cedie/just_got_to_portland_and_out_tomorrow_night_and/,0,3cedie,True,{},0,False,/r/Portland/comments/3cedie/just_got_to_portland_and_out_tomorrow_night_and/,1440626814,1,{},My wife and I fly out tomorrow. We have a bunch of sites we want to see but there are too many breweries and not enough time. What is the best brewery to check out? ,False,Portland,t5_2qi2i,default,Just got to Portland and out tomorrow night and need your nest brewery!,http://www.reddit.com/r/Portland/comments/3cedie/just_got_to_portland_and_out_tomorrow_night_and/,,,,,
deadmeat08,1257363445.0,,,t2_3phkn,1436250013,self.Portland,https://www.reddit.com/r/Portland/comments/3ceb8g/anyone_know_whats_going_on_at_6th_and_ainsworth/,0,3ceb8g,True,{},9,False,/r/Portland/comments/3ceb8g/anyone_know_whats_going_on_at_6th_and_ainsworth/,1440626844,0,{},My wife and I saw ~10 police cars there about 10 minutes ago. I can't find anything on the incident map or in the news yet though.,False,Portland,t5_2qi2i,self,Anyone know what's going on at 6th and Ainsworth?,http://www.reddit.com/r/Portland/comments/3ceb8g/anyone_know_whats_going_on_at_6th_and_ainsworth/,,,,,
[deleted],,,,,1436249413,self.Portland,https://www.reddit.com/r/Portland/comments/3ceaco/the_dream_of_the_90s_is_alive_in_portland/,0,3ceaco,True,{},0,False,/r/Portland/comments/3ceaco/the_dream_of_the_90s_is_alive_in_portland/,1440626855,1,{},,False,Portland,t5_2qi2i,default,The dream of the 90's is alive in Portland.,http://www.reddit.com/r/Portland/comments/3ceaco/the_dream_of_the_90s_is_alive_in_portland/,,,,,
atlanta824,1349330801.0,,,t2_97e0y,1436244392,self.Portland,https://www.reddit.com/r/Portland/comments/3ce2jd/affordable_hotel/,0,3ce2jd,True,{},12,False,/r/Portland/comments/3ce2jd/affordable_hotel/,1440626957,0,{},"Thank you in advance for any help.  I have read through old posts already, but I am looking for an affordable hotel or airbnb in Portland (downtown or close by) for one night in July but many of the rates are over $200.  Does anyone have any ideas?",False,Portland,t5_2qi2i,self,Affordable Hotel,http://www.reddit.com/r/Portland/comments/3ce2jd/affordable_hotel/,,,,,
[deleted],,,,,1436242507,self.Portland,https://www.reddit.com/r/Portland/comments/3cdzbt/four_new_members_sworn_to_constitute_portland/,0,3cdzbt,True,{},1,False,/r/Portland/comments/3cdzbt/four_new_members_sworn_to_constitute_portland/,1440626998,4,{},"Portland Public Schools tonight voted 7-0 to elect Tom Koehler, to be the new Board chair. Board members also have resurrected a practice of having board members lead subcommittees on topics such as the district's budget, its education philosophy, and its spending on construction projects.
Hopefully the new Board can improve the graduation rate from 70 percent, for the class of 2014. http://www.wweek.com/portland/blog-33427-tom_koehler_elected_chairman_of_portland_public_schools_board.html",False,Portland,t5_2qi2i,default,"Four new members sworn, to constitute Portland Public Schools' Board.",http://www.reddit.com/r/Portland/comments/3cdzbt/four_new_members_sworn_to_constitute_portland/,,,,,
safron42,1370945864.0,,,t2_c00ae,1436241300,imgur.com,https://www.reddit.com/r/Portland/comments/3cdx3r/saw_this_guy_smiling_at_me_the_other_day_at_lunch/,0,3cdx3r,False,{},4,False,/r/Portland/comments/3cdx3r/saw_this_guy_smiling_at_me_the_other_day_at_lunch/,1440627027,0,{},,False,Portland,t5_2qi2i,http://b.thumbs.redditmedia.com/ba9EUr6km_XKxS_DPU1KnfDzvRRBLYVvntAEDTaWySM.jpg,Saw this guy smiling at me the other day at lunch,http://imgur.com/ezTH3SZ,,link,"{'images': [{'id': 'jF77EOfk3nsVgxwL8JZKz2jSlCW9qEUwtw7RUifz1v8', 'resolutions': [{'height': 144, 'url': 'https://i.redditmedia.com/dLpHo_URBUvoI5Z75LAPWvaQGMNikrmqAVb2VuJRsHE.jpg?fit=crop&amp;crop=faces%2Centropy&amp;arh=2&amp;w=108&amp;s=ab767d7bd55cc450d45f6597cd378991', 'width': 108}, {'height': 288, 'url': 'https://i.redditmedia.com/dLpHo_URBUvoI5Z75LAPWvaQGMNikrmqAVb2VuJRsHE.jpg?fit=crop&amp;crop=faces%2Centropy&amp;arh=2&amp;w=216&amp;s=92020b6317bfad6b23ebaa350fd90fd3', 'width': 216}, {'height': 426, 'url': 'https://i.redditmedia.com/dLpHo_URBUvoI5Z75LAPWvaQGMNikrmqAVb2VuJRsHE.jpg?fit=crop&amp;crop=faces%2Centropy&amp;arh=2&amp;w=320&amp;s=0bff579b08d564d99a8ecaa3c5eb42bd', 'width': 320}, {'height': 853, 'url': 'https://i.redditmedia.com/dLpHo_URBUvoI5Z75LAPWvaQGMNikrmqAVb2VuJRsHE.jpg?fit=crop&amp;crop=faces%2Centropy&amp;arh=2&amp;w=640&amp;s=9c651c51930c1a17ce2639da9b2f58ad', 'width': 640}], 'source': {'height': 1024, 'url': 'https://i.redditmedia.com/dLpHo_URBUvoI5Z75LAPWvaQGMNikrmqAVb2VuJRsHE.jpg?s=22b819509bdcf4bc49c926821220a43f', 'width': 768}, 'variants': {}}]}",,
[deleted],,,,,1436237172,self.Portland,https://www.reddit.com/r/Portland/comments/3cdpcu/free_death_cab_ticket_for_july_8th/,0,3cdpcu,True,{},4,False,/r/Portland/comments/3cdpcu/free_death_cab_ticket_for_july_8th/,1440627127,1,{},"There is a free ticket for the Death Cab show at the Edgefield posted on the bulletin board at Zupans on Belmont and 33rd.  It is in a white envelope posted to the board and it's behind the cash machine.  FYI if you are thinking about reselling it, there is a reason that I am giving it away.  There are already a ton for sale at face value on Craigslist so please leave it for someone who is going to use it.  Thanks!",False,Portland,t5_2qi2i,default,Free Death Cab ticket for July 8th.,http://www.reddit.com/r/Portland/comments/3cdpcu/free_death_cab_ticket_for_july_8th/,,,,,
[deleted],,,,,1436233909,self.Portland,https://www.reddit.com/r/Portland/comments/3cditz/help_someone_has_been_in_my_house_and_shut_all/,0,3cditz,True,{},17,False,/r/Portland/comments/3cditz/help_someone_has_been_in_my_house_and_shut_all/,1440627212,7,{},,False,Portland,t5_2qi2i,default,"Help, someone has been in my house and shut all the windows.",http://www.reddit.com/r/Portland/comments/3cditz/help_someone_has_been_in_my_house_and_shut_all/,1436238269.0,,,,
jr98664,1304474855.0,,Overlook,t2_56rfr,1436233326,howweroll.trimet.org,https://www.reddit.com/r/Portland/comments/3cdho9/trimet_announces_brand_new_bus_line_connecting/,0,3cdho9,False,{},34,False,/r/Portland/comments/3cdho9/trimet_announces_brand_new_bus_line_connecting/,1440627227,52,{},,False,Portland,t5_2qi2i,http://b.thumbs.redditmedia.com/j3P0Oi0vpPsja-6o-d2vh5JyJk0bTtvESGHoZH2ebUY.jpg,TriMet announces brand new bus line connecting Sherwood and Tualatin for the first time. Planned to open next summer.,http://howweroll.trimet.org/2015/07/06/a-pioneering-connection-between-tualatin-and-sherwood/,,link,"{'images': [{'id': 'DpEzTDzNF59lFsujrxGGNp5EsO1GecPiNUJy5MI90gY', 'resolutions': [{'height': 63, 'url': 'https://i.redditmedia.com/eDBTQCZHdCR8vKpFJ73JgJtYGqrqPGo4Re3RJg5CXNQ.jpg?fit=crop&amp;crop=faces%2Centropy&amp;arh=2&amp;w=108&amp;s=61553f05d033636c2cee808294257e36', 'width': 108}, {'height': 127, 'url': 'https://i.redditmedia.com/eDBTQCZHdCR8vKpFJ73JgJtYGqrqPGo4Re3RJg5CXNQ.jpg?fit=crop&amp;crop=faces%2Centropy&amp;arh=2&amp;w=216&amp;s=ff80c8349647154ac3fb6ef66bc612b8', 'width': 216}, {'height': 189, 'url': 'https://i.redditmedia.com/eDBTQCZHdCR8vKpFJ73JgJtYGqrqPGo4Re3RJg5CXNQ.jpg?fit=crop&amp;crop=faces%2Centropy&amp;arh=2&amp;w=320&amp;s=1a632497bb5d3d5562eb608f46049c77', 'width': 320}, {'height': 379, 'url': 'https://i.redditmedia.com/eDBTQCZHdCR8vKpFJ73JgJtYGqrqPGo4Re3RJg5CXNQ.jpg?fit=crop&amp;crop=faces%2Centropy&amp;arh=2&amp;w=640&amp;s=41516fc33c412bd72c50b49bf64acc3b', 'width': 640}, {'height': 568, 'url': 'https://i.redditmedia.com/eDBTQCZHdCR8vKpFJ73JgJtYGqrqPGo4Re3RJg5CXNQ.jpg?fit=crop&amp;crop=faces%2Centropy&amp;arh=2&amp;w=960&amp;s=598f46f82d375e3602a28144eb9bdfd2', 'width': 960}], 'source': {'height': 615, 'url': 'https://i.redditmedia.com/eDBTQCZHdCR8vKpFJ73JgJtYGqrqPGo4Re3RJg5CXNQ.jpg?s=73e8c4885fb3e4521c342ce6e42d3e63', 'width': 1038}, 'variants': {}}]}",,
graniterockhead,1408479031.0,,Richmond,t2_hydh8,1436228487,portlandoregon.gov,https://www.reddit.com/r/Portland/comments/3cd803/summer_free_for_all_movies_concerts_in_the_park/,0,3cd803,False,{},10,False,/r/Portland/comments/3cd803/summer_free_for_all_movies_concerts_in_the_park/,1440627352,20,{},,False,Portland,t5_2qi2i,http://b.thumbs.redditmedia.com/7-tJd2jA9rWf8xSMn7vxHJhlKwOJzCnE3JE2NYdfeJQ.jpg,"""Summer Free For All"" - Movies &amp; Concerts in the Park starts this week",http://www.portlandoregon.gov/parks/61921,,link,"{'images': [{'id': 'TS0U-iIriNsn7zsgprS3HFKlbrWG36TQrtuR6OSDSDE', 'resolutions': [{'height': 185, 'url': 'https://i.redditmedia.com/eSDQ-k6UMjdEzuGefAxk6hCSNvsKHuLO22K5JddGFvI.jpg?fit=crop&amp;crop=faces%2Centropy&amp;arh=2&amp;w=108&amp;s=cf353bea4780b29ac4519c05ab5d7a1d', 'width': 108}, {'height': 371, 'url': 'https://i.redditmedia.com/eSDQ-k6UMjdEzuGefAxk6hCSNvsKHuLO22K5JddGFvI.jpg?fit=crop&amp;crop=faces%2Centropy&amp;arh=2&amp;w=216&amp;s=1b4c92f02e93dba8a183c180b65d7feb', 'width': 216}], 'source': {'height': 533, 'url': 'https://i.redditmedia.com/eSDQ-k6UMjdEzuGefAxk6hCSNvsKHuLO22K5JddGFvI.jpg?s=fe5b6cf604d3c5fb7115fcea950694db', 'width': 310}, 'variants': {}}]}",,
khturner,1274383192.0,,,t2_42k2o,1436228315,self.Portland,https://www.reddit.com/r/Portland/comments/3cd7ol/coming_to_portland_for_the_first_time_wheres_cool/,0,3cd7ol,True,{},14,False,/r/Portland/comments/3cd7ol/coming_to_portland_for_the_first_time_wheres_cool/,1440627356,0,{},"Hey all, my wife and I and some friends are coming for a few days in August and we're really excited to hang out in your city. Our friends are staying with some of their friends near Oregon Health &amp; Science, but we were thinking of getting an Airbnb in a neighborhood that's a bit more central. So I submit to you: what areas should we look in? We tend to like places that are pretty chill, have good character, aren't full of 20 year olds partying all night, are bikeable, and have good breweries and brewpubs. Thanks, see you soon!",False,Portland,t5_2qi2i,self,Coming to Portland for the first time - where's cool?,http://www.reddit.com/r/Portland/comments/3cd7ol/coming_to_portland_for_the_first_time_wheres_cool/,,,,,
WyattDoc,1347143057.0,,,t2_8y62r,1436227660,youtube.com,https://www.reddit.com/r/Portland/comments/3cd6ap/short_timelapse_of_the_fireworks_last_night_in_4k/,0,3cd6ap,False,"{'content': '&lt;iframe class=""embedly-embed"" src=""//cdn.embedly.com/widgets/media.html?src=https%3A%2F%2Fwww.youtube.com%2Fembed%2FxUtUqUEjGiw%3Ffeature%3Doembed&amp;url=https%3A%2F%2Fwww.youtube.com%2Fwatch%3Fv%3DxUtUqUEjGiw&amp;image=https%3A%2F%2Fi.ytimg.com%2Fvi%2FxUtUqUEjGiw%2Fhqdefault.jpg&amp;key=2aa3c4d5f3de4f5b9120b660ad850dc9&amp;type=text%2Fhtml&amp;schema=youtube"" width=""600"" height=""338"" scrolling=""no"" frameborder=""0"" allowfullscreen&gt;&lt;/iframe&gt;', 'height': 338, 'scrolling': False, 'width': 600}",4,False,/r/Portland/comments/3cd6ap/short_timelapse_of_the_fireworks_last_night_in_4k/,1440627374,18,"{'content': '&lt;iframe class=""embedly-embed"" src=""https://cdn.embedly.com/widgets/media.html?src=https%3A%2F%2Fwww.youtube.com%2Fembed%2FxUtUqUEjGiw%3Ffeature%3Doembed&amp;url=https%3A%2F%2Fwww.youtube.com%2Fwatch%3Fv%3DxUtUqUEjGiw&amp;image=https%3A%2F%2Fi.ytimg.com%2Fvi%2FxUtUqUEjGiw%2Fhqdefault.jpg&amp;key=2aa3c4d5f3de4f5b9120b660ad850dc9&amp;type=text%2Fhtml&amp;schema=youtube"" width=""600"" height=""338"" scrolling=""no"" frameborder=""0"" allowfullscreen&gt;&lt;/iframe&gt;', 'height': 338, 'scrolling': False, 'width': 600}",,False,Portland,t5_2qi2i,http://b.thumbs.redditmedia.com/y7jisqTVR1EU7L3xgzmBQihmj_pd_fR5H3Jj1rZ9lnY.jpg,Short Time-Lapse of the Fireworks last night in 4K,https://www.youtube.com/watch?v=xUtUqUEjGiw,,rich:video,"{'images': [{'id': 'hCseM_5Sd5U177bNBNCNR-HAdvuFD4Z6QwgJNcLexqk', 'resolutions': [{'height': 81, 'url': 'https://i.redditmedia.com/oESFRPqvTSOGvvjFRKzz844gASW2grZySR7eD2kEjvc.jpg?fit=crop&amp;crop=faces%2Centropy&amp;arh=2&amp;w=108&amp;s=d8405ed75cfacaecc3c471a79a76d81e', 'width': 108}, {'height': 162, 'url': 'https://i.redditmedia.com/oESFRPqvTSOGvvjFRKzz844gASW2grZySR7eD2kEjvc.jpg?fit=crop&amp;crop=faces%2Centropy&amp;arh=2&amp;w=216&amp;s=5d532703830f6ddb4bcd686fca9683e1', 'width': 216}, {'height': 240, 'url': 'https://i.redditmedia.com/oESFRPqvTSOGvvjFRKzz844gASW2grZySR7eD2kEjvc.jpg?fit=crop&amp;crop=faces%2Centropy&amp;arh=2&amp;w=320&amp;s=93083f950126e50353e950497df9d2a4', 'width': 320}], 'source': {'height': 360, 'url': 'https://i.redditmedia.com/oESFRPqvTSOGvvjFRKzz844gASW2grZySR7eD2kEjvc.jpg?s=39440dc8cf596629b0e8e1a355499241', 'width': 480}, 'variants': {}}]}","{'oembed': {'author_name': 'Cole Sprague Photo', 'author_url': 'http://www.youtube.com/channel/UCpX5Fzdk_NTHsLjD0zyKoTA', 'description': '4th of July time lapse of Portland Oregon. 2k15', 'height': 338, 'html': '&lt;iframe class=""embedly-embed"" src=""//cdn.embedly.com/widgets/media.html?src=https%3A%2F%2Fwww.youtube.com%2Fembed%2FxUtUqUEjGiw%3Ffeature%3Doembed&amp;url=https%3A%2F%2Fwww.youtube.com%2Fwatch%3Fv%3DxUtUqUEjGiw&amp;image=https%3A%2F%2Fi.ytimg.com%2Fvi%2FxUtUqUEjGiw%2Fhqdefault.jpg&amp;key=2aa3c4d5f3de4f5b9120b660ad850dc9&amp;type=text%2Fhtml&amp;schema=youtube"" width=""600"" height=""338"" scrolling=""no"" frameborder=""0"" allowfullscreen&gt;&lt;/iframe&gt;', 'provider_name': 'YouTube', 'provider_url': 'http://www.youtube.com/', 'thumbnail_height': 360, 'thumbnail_url': 'https://i.ytimg.com/vi/xUtUqUEjGiw/hqdefault.jpg', 'thumbnail_width': 480, 'title': 'Portland Oregon July 4th', 'type': 'video', 'url': 'http://www.youtube.com/watch?v=xUtUqUEjGiw', 'version': '1.0', 'width': 600}, 'type': 'youtube.com'}","{'oembed': {'author_name': 'Cole Sprague Photo', 'author_url': 'http://www.youtube.com/channel/UCpX5Fzdk_NTHsLjD0zyKoTA', 'description': '4th of July time lapse of Portland Oregon. 2k15', 'height': 338, 'html': '&lt;iframe class=""embedly-embed"" src=""https://cdn.embedly.com/widgets/media.html?src=https%3A%2F%2Fwww.youtube.com%2Fembed%2FxUtUqUEjGiw%3Ffeature%3Doembed&amp;url=https%3A%2F%2Fwww.youtube.com%2Fwatch%3Fv%3DxUtUqUEjGiw&amp;image=https%3A%2F%2Fi.ytimg.com%2Fvi%2FxUtUqUEjGiw%2Fhqdefault.jpg&amp;key=2aa3c4d5f3de4f5b9120b660ad850dc9&amp;type=text%2Fhtml&amp;schema=youtube"" width=""600"" height=""338"" scrolling=""no"" frameborder=""0"" allowfullscreen&gt;&lt;/iframe&gt;', 'provider_name': 'YouTube', 'provider_url': 'http://www.youtube.com/', 'thumbnail_height': 360, 'thumbnail_url': 'https://i.embed.ly/1/image?url=https%3A%2F%2Fi.ytimg.com%2Fvi%2FxUtUqUEjGiw%2Fhqdefault.jpg&amp;key=b1e305db91cf4aa5a86b732cc9fffceb', 'thumbnail_width': 480, 'title': 'Portland Oregon July 4th', 'type': 'video', 'url': 'http://www.youtube.com/watch?v=xUtUqUEjGiw', 'version': '1.0', 'width': 600}, 'type': 'youtube.com'}"
deprived,,,,,1436227143,self.Portland,https://www.reddit.com/r/Portland/comments/3cd55j/psa_riding_bikes_on_sidewalks_downtown_still/,0,3cd55j,True,{},48,False,/r/Portland/comments/3cd55j/psa_riding_bikes_on_sidewalks_downtown_still/,1440627389,43,{},"even if you're a ""bike messenger, brah!"", peddling at high speed on the sidewalks downtown, weaving through pedestrians is both illegal and irresponsible.

this violates ORS 814.410: Unsafe operation of bicycle on sidewalk, and city ordinance ~~6.10.060.090~~ 16.70.320: riding on Sidewalk.

",False,Portland,t5_2qi2i,self,PSA: Riding bikes on sidewalks downtown? Still illegal,http://www.reddit.com/r/Portland/comments/3cd55j/psa_riding_bikes_on_sidewalks_downtown_still/,1436227915.0,,,,
