author,author_created_utc,author_flair_css_class,author_flair_text,author_fullname,created_utc,domain,full_link,gilded,id,is_self,media_embed,num_comments,over_18,permalink,retrieved_on,score,secure_media_embed,selftext,stickied,subreddit,subreddit_id,thumbnail,title,url,edited,post_hint,preview,media,secure_media
alexhamilton,1279123758.0,,,t2_46lmr,1436202384,self.Portland,https://www.reddit.com/r/Portland/comments/3cbjws/found_johns_landing_male_black_and_white_cat/,0,3cbjws,True,{},3,False,/r/Portland/comments/3cbjws/found_johns_landing_male_black_and_white_cat/,1440628131,11,{},"Last night, a black and white cat followed me home and kept crying if he lost sight of me while walking.  He's super friendly and likes following me around my backyard.  He started following us near the intersection of Florida St. and Virginia Ave.  Also should mention he appears to be unneutered (SHAME!)


I'm taking him to the vet to check for a microchip now, but please let me know if you're missing a cat.


http://i.imgur.com/Mw5ilgs.jpg

Edit: He doesn't appear to have a microchip.  Still hoping to find the owner!",False,Portland,t5_2qi2i,self,Found: (John's Landing) Male Black and White Cat,http://www.reddit.com/r/Portland/comments/3cbjws/found_johns_landing_male_black_and_white_cat/,1436204390.0,self,"{'images': [{'id': 'vlH8OfTUDupIu8AwCxiYKXJ9o7uWLda6xzrMBdAHN-M', 'resolutions': [{'height': 188, 'url': 'https://i.redditmedia.com/SUAXoXr11FNOX8ujbCCK12zpN1UxuvzowKK48ksPAcI.jpg?fit=crop&amp;crop=faces%2Centropy&amp;arh=2&amp;w=108&amp;s=f90db301fcaf6dd43bf2d7627fff7208', 'width': 108}, {'height': 377, 'url': 'https://i.redditmedia.com/SUAXoXr11FNOX8ujbCCK12zpN1UxuvzowKK48ksPAcI.jpg?fit=crop&amp;crop=faces%2Centropy&amp;arh=2&amp;w=216&amp;s=9e745eb2a63e42b24215a28a2aa0e13b', 'width': 216}, {'height': 559, 'url': 'https://i.redditmedia.com/SUAXoXr11FNOX8ujbCCK12zpN1UxuvzowKK48ksPAcI.jpg?fit=crop&amp;crop=faces%2Centropy&amp;arh=2&amp;w=320&amp;s=939c329d494dca5277ae6e0c4b348e6b', 'width': 320}, {'height': 1118, 'url': 'https://i.redditmedia.com/SUAXoXr11FNOX8ujbCCK12zpN1UxuvzowKK48ksPAcI.jpg?fit=crop&amp;crop=faces%2Centropy&amp;arh=2&amp;w=640&amp;s=47d2f3690f66dd9436967c6926e2cc68', 'width': 640}], 'source': {'height': 1415, 'url': 'https://i.redditmedia.com/SUAXoXr11FNOX8ujbCCK12zpN1UxuvzowKK48ksPAcI.jpg?s=104cf1db4d303168400fe48fa7331578', 'width': 810}, 'variants': {}}]}",,
Shannonagannery,1409261914.0,,,t2_i3hkz,1436201793,imgur.com,https://www.reddit.com/r/Portland/comments/3cbinu/vanspotting_has_become_truck_spotting/,0,3cbinu,False,{},1,False,/r/Portland/comments/3cbinu/vanspotting_has_become_truck_spotting/,1440628147,12,{},,False,Portland,t5_2qi2i,http://b.thumbs.redditmedia.com/L7BeJz91Fb2hawcyiY6juCDf7hkhqTjuYMubv7Jf0Jc.jpg,Vanspotting has become Truck Spotting...,http://imgur.com/8zOvyle,,link,"{'images': [{'id': 'N-2nn41EmJkTWfgOXMjaNGuioDzvp9B1gK0WP6HMQyc', 'resolutions': [{'height': 107, 'url': 'https://i.redditmedia.com/aDVuhYYbwYbhCsyKW9YRrJWbUNf92g4EQslz5VTMOZ4.jpg?fit=crop&amp;crop=faces%2Centropy&amp;arh=2&amp;w=108&amp;s=1298f734159bf98204c3d8ac10683bbb', 'width': 108}, {'height': 214, 'url': 'https://i.redditmedia.com/aDVuhYYbwYbhCsyKW9YRrJWbUNf92g4EQslz5VTMOZ4.jpg?fit=crop&amp;crop=faces%2Centropy&amp;arh=2&amp;w=216&amp;s=abdc011d77c1458487c433cf8df7e52c', 'width': 216}, {'height': 318, 'url': 'https://i.redditmedia.com/aDVuhYYbwYbhCsyKW9YRrJWbUNf92g4EQslz5VTMOZ4.jpg?fit=crop&amp;crop=faces%2Centropy&amp;arh=2&amp;w=320&amp;s=eff4ae39c26ce361beb6148a7d7118e1', 'width': 320}], 'source': {'height': 631, 'url': 'https://i.redditmedia.com/aDVuhYYbwYbhCsyKW9YRrJWbUNf92g4EQslz5VTMOZ4.jpg?s=dddfdda0732d0a2410aa7536977bcad5', 'width': 634}, 'variants': {}}]}",,
sleepychinadoll,1327940656.0,,,t2_6skh1,1436200579,portlandmonthlymag.com,https://www.reddit.com/r/Portland/comments/3cbfyb/blame_the_blob_for_the_portland_heat_wave/,0,3cbfyb,False,{},21,False,/r/Portland/comments/3cbfyb/blame_the_blob_for_the_portland_heat_wave/,1440628182,22,{},,False,Portland,t5_2qi2i,http://a.thumbs.redditmedia.com/8Mk1KH9ibUEcdigPbqJ0x3JPq8zIfWlQLBuJUAYIop4.jpg,Blame The Blob For the Portland Heat Wave,http://www.portlandmonthlymag.com/articles/2015/7/1/why-is-it-so-hot-the-blob-of-course-no-seriously,,link,"{'images': [{'id': 'W47sodSLOOXDAJ6tNjmBzo-8kQ_eCyc_3x5O9umIu0M', 'resolutions': [{'height': 71, 'url': 'https://i.redditmedia.com/iyOgqm3sSTAfCWzRwZx1bxZxIRDErmy30YvY9Nm4RHg.jpg?fit=crop&amp;crop=faces%2Centropy&amp;arh=2&amp;w=108&amp;s=8ea18cb547478266cdcbea5faa64eea7', 'width': 108}, {'height': 143, 'url': 'https://i.redditmedia.com/iyOgqm3sSTAfCWzRwZx1bxZxIRDErmy30YvY9Nm4RHg.jpg?fit=crop&amp;crop=faces%2Centropy&amp;arh=2&amp;w=216&amp;s=3421c73833e4281bd0e15fb9972eabc7', 'width': 216}, {'height': 213, 'url': 'https://i.redditmedia.com/iyOgqm3sSTAfCWzRwZx1bxZxIRDErmy30YvY9Nm4RHg.jpg?fit=crop&amp;crop=faces%2Centropy&amp;arh=2&amp;w=320&amp;s=4143cac40f1f726efd13cf1aa53abd9c', 'width': 320}, {'height': 426, 'url': 'https://i.redditmedia.com/iyOgqm3sSTAfCWzRwZx1bxZxIRDErmy30YvY9Nm4RHg.jpg?fit=crop&amp;crop=faces%2Centropy&amp;arh=2&amp;w=640&amp;s=54be6c4f70d29682779f4cde5746c893', 'width': 640}], 'source': {'height': 426, 'url': 'https://i.redditmedia.com/iyOgqm3sSTAfCWzRwZx1bxZxIRDErmy30YvY9Nm4RHg.jpg?s=e060e2dd8616968240b0ec1359075fd3', 'width': 640}, 'variants': {}}]}",,
atomos-kairos,1362721334.0,,Old Town Chinatown,t2_av47o,1436198595,self.Portland,https://www.reddit.com/r/Portland/comments/3cbbkc/why_is_portland_weird/,0,3cbbkc,True,{},32,False,/r/Portland/comments/3cbbkc/why_is_portland_weird/,1440628239,0,{},"[Context here.](http://fancyfranzy.tumblr.com/post/123363210577/anyone-from-portland-anyone-weird)

My friend is doing a project for her university and I was one of the people she asked to read over that and give an opinion. I have a few things I plan on talking to her about, but for the most part am sorta drawing a blank. What would you say?",False,Portland,t5_2qi2i,self,"Why is Portland ""weird""?",http://www.reddit.com/r/Portland/comments/3cbbkc/why_is_portland_weird/,,self,"{'images': [{'id': 'uS1Adlee45Bg71SvRcevWC5zCZcJlY5Cy2IW23cJ6U4', 'resolutions': [{'height': 108, 'url': 'https://i.redditmedia.com/uzyljjkhY6w5ihJsYf-vPYHifkm3cj2mWMEk4yvRriI.jpg?fit=crop&amp;crop=faces%2Centropy&amp;arh=2&amp;w=108&amp;s=c2b471473b266153faa3481963acbc37', 'width': 108}], 'source': {'height': 200, 'url': 'https://i.redditmedia.com/uzyljjkhY6w5ihJsYf-vPYHifkm3cj2mWMEk4yvRriI.jpg?s=0d716de79bdfe15df1c5e691f67481a6', 'width': 200}, 'variants': {}}]}",,
gomichaelkgo,1259607903.0,,Piedmont,t2_3qy1n,1436196007,imgur.com,https://www.reddit.com/r/Portland/comments/3cb627/as_someone_trying_to_grow_a_garden_right_now/,0,3cb627,False,{},57,False,/r/Portland/comments/3cb627/as_someone_trying_to_grow_a_garden_right_now/,1440628311,145,{},,False,Portland,t5_2qi2i,http://b.thumbs.redditmedia.com/hJYf1bA7kLuvQ7IHXY7Le7PmZaQ4P-4KGYjcmXc2frQ.jpg,As someone trying to grow a garden right now...,http://imgur.com/0FK1JIq,,link,"{'images': [{'id': 'EDiUzBUOwGfdJoIl80PQJrlWkQ_q_OpnSbTDU3eFhRg', 'resolutions': [{'height': 72, 'url': 'https://i.redditmedia.com/XEcZaym8saPxdryVFUVrBosmmOmIQrTkudhPU5i7wMU.jpg?fit=crop&amp;crop=faces%2Centropy&amp;arh=2&amp;w=108&amp;s=67312efdc3dbc65cad9edd3c02f5a027', 'width': 108}, {'height': 144, 'url': 'https://i.redditmedia.com/XEcZaym8saPxdryVFUVrBosmmOmIQrTkudhPU5i7wMU.jpg?fit=crop&amp;crop=faces%2Centropy&amp;arh=2&amp;w=216&amp;s=57704d3cd106d3985c9642427d4b73f5', 'width': 216}, {'height': 214, 'url': 'https://i.redditmedia.com/XEcZaym8saPxdryVFUVrBosmmOmIQrTkudhPU5i7wMU.jpg?fit=crop&amp;crop=faces%2Centropy&amp;arh=2&amp;w=320&amp;s=5e8d8d6accf1d6980f893a5c9d780b82', 'width': 320}], 'source': {'height': 426, 'url': 'https://i.redditmedia.com/XEcZaym8saPxdryVFUVrBosmmOmIQrTkudhPU5i7wMU.jpg?s=7505993b7fd3b0b67a5061e2794eb193', 'width': 636}, 'variants': {}}]}",,
magenta_placenta,1229122632.0,,,t2_3bhyn,1436192574,inhabitat.com,https://www.reddit.com/r/Portland/comments/3caywu/portland_is_now_powered_by_water_pipes_and/,0,3caywu,False,{},33,False,/r/Portland/comments/3caywu/portland_is_now_powered_by_water_pipes_and/,1440628403,51,{},,False,Portland,t5_2qi2i,http://b.thumbs.redditmedia.com/56rcdiKryuX-pg9zze5r9WC_4GlM0AFtKbLUjc5EcTM.jpg,Portland is now powered by water pipes and flushing toilets,http://inhabitat.com/portlands-water-pipes-are-the-newest-source-of-clean-energy/,,link,"{'images': [{'id': 'E6A3ynZVuvkSiaSBQ3pmTyC7Cjyb6wCTD7znF2-lC3Q', 'resolutions': [{'height': 72, 'url': 'https://i.redditmedia.com/_-cmBsUhFIVmf6cCQ67jhxuhBUX_L2cQ8Z905v9bTgA.jpg?fit=crop&amp;crop=faces%2Centropy&amp;arh=2&amp;w=108&amp;s=55518877617c3dae3f911e91e2ef25e4', 'width': 108}, {'height': 144, 'url': 'https://i.redditmedia.com/_-cmBsUhFIVmf6cCQ67jhxuhBUX_L2cQ8Z905v9bTgA.jpg?fit=crop&amp;crop=faces%2Centropy&amp;arh=2&amp;w=216&amp;s=2175fadd27f67cf1a0e5c21cced5ee8e', 'width': 216}, {'height': 214, 'url': 'https://i.redditmedia.com/_-cmBsUhFIVmf6cCQ67jhxuhBUX_L2cQ8Z905v9bTgA.jpg?fit=crop&amp;crop=faces%2Centropy&amp;arh=2&amp;w=320&amp;s=483f851d29413f5db710beb0d8f0f81a', 'width': 320}], 'source': {'height': 354, 'url': 'https://i.redditmedia.com/_-cmBsUhFIVmf6cCQ67jhxuhBUX_L2cQ8Z905v9bTgA.jpg?s=a19148fc4455b78b1dddba774a016627', 'width': 529}, 'variants': {}}]}",,
shelfofdoom,1434152419.0,,,t2_o2pxp,1436172126,self.Portland,https://www.reddit.com/r/Portland/comments/3ca6ps/is_my_room_rental_legal/,0,3ca6ps,True,{},24,False,/r/Portland/comments/3ca6ps/is_my_room_rental_legal/,1440628769,8,{},"I've been renting a room out in a shared house the past 6 months. The room has no window and no closet. I've been paying 350 for rent. My question is, is this a legal rental and if it isn't what if anything can/should I do?


EDIT: info about my ""landlord'

-She is the actual renter but has another home and is subleasing the home so her kids can go to this school district
-She refuses to provide any physical/pdf forms of any utilities/bills
-She just increased my rent 20 dollars
",False,Portland,t5_2qi2i,self,Is my room rental legal?,http://www.reddit.com/r/Portland/comments/3ca6ps/is_my_room_rental_legal/,1436176854.0,,,,
profe55or,1225041245.0,,,t2_3a233,1436166788,i.imgur.com,https://www.reddit.com/r/Portland/comments/3ca0pw/close_to_sunset_on_mount_hood_a_few_days_ago/,0,3ca0pw,False,{},2,False,/r/Portland/comments/3ca0pw/close_to_sunset_on_mount_hood_a_few_days_ago/,1440628846,32,{},,False,Portland,t5_2qi2i,http://a.thumbs.redditmedia.com/1_AZRBhW4zGJwKx0JRw2K799ZuAeva4EBHTm9jcmYN0.jpg,Close to sunset on Mount Hood a few days ago,http://i.imgur.com/BcMDnO5.jpg,,image,"{'images': [{'id': 'JXYR67MjNiSaaiJLD5LCPGH-X13nahcw8Qs3mFl408M', 'resolutions': [{'height': 71, 'url': 'https://i.redditmedia.com/806ywF6m_gvGI9-zjPFRE2s8_W1r2UZK9lkie3RjWJ4.jpg?fit=crop&amp;crop=faces%2Centropy&amp;arh=2&amp;w=108&amp;s=90d33158db8d8ed8c43e5dd20553b814', 'width': 108}, {'height': 143, 'url': 'https://i.redditmedia.com/806ywF6m_gvGI9-zjPFRE2s8_W1r2UZK9lkie3RjWJ4.jpg?fit=crop&amp;crop=faces%2Centropy&amp;arh=2&amp;w=216&amp;s=a23c1aad7bf0ea6d385023664297471c', 'width': 216}, {'height': 213, 'url': 'https://i.redditmedia.com/806ywF6m_gvGI9-zjPFRE2s8_W1r2UZK9lkie3RjWJ4.jpg?fit=crop&amp;crop=faces%2Centropy&amp;arh=2&amp;w=320&amp;s=45c56339d63b1e4d1bb367db1578b9f7', 'width': 320}, {'height': 426, 'url': 'https://i.redditmedia.com/806ywF6m_gvGI9-zjPFRE2s8_W1r2UZK9lkie3RjWJ4.jpg?fit=crop&amp;crop=faces%2Centropy&amp;arh=2&amp;w=640&amp;s=23fc4e5edaae26f84ee9d13df9546c16', 'width': 640}, {'height': 639, 'url': 'https://i.redditmedia.com/806ywF6m_gvGI9-zjPFRE2s8_W1r2UZK9lkie3RjWJ4.jpg?fit=crop&amp;crop=faces%2Centropy&amp;arh=2&amp;w=960&amp;s=d0463b0dbd9729ed5795563ab724a1d2', 'width': 960}, {'height': 719, 'url': 'https://i.redditmedia.com/806ywF6m_gvGI9-zjPFRE2s8_W1r2UZK9lkie3RjWJ4.jpg?fit=crop&amp;crop=faces%2Centropy&amp;arh=2&amp;w=1080&amp;s=b50fb2344a08348fd68e36e54710ba4c', 'width': 1080}], 'source': {'height': 1365, 'url': 'https://i.redditmedia.com/806ywF6m_gvGI9-zjPFRE2s8_W1r2UZK9lkie3RjWJ4.jpg?s=68206b1aab17e55106784b334c400d53', 'width': 2048}, 'variants': {}}]}",,
feynmanwithtwosticks,1334788075.0,,,t2_7hrom,1436165322,self.Portland,https://www.reddit.com/r/Portland/comments/3c9yw9/oregon_coast_trail/,0,3c9yw9,True,{},10,False,/r/Portland/comments/3c9yw9/oregon_coast_trail/,1440628870,12,{},"Ok, this is a long shot but I figure here is as good a place to ask as any since the Parks Department couldn't give me anything. 

I am planning on hiking the first section of the Oregon Coast Trail, likely from Fort Stevens to Oceanside (if my timing works out to cross Tillamook bay). I am having the worlds hardest time finding any good maps of the trail. The Parks department has maps that are OK, but they don't provide any distance markers which makes it nearly impossible to plan a backpacking trip, even moreso given that the campground at Oswald West SP is shut down. 

Does anyone here have any good resources or maps of this section of the OCT? I have one hiking book for the ccoast that has most of the major segments of the hike, but its missing a lot of the in-between bits where you're hiking along 101 or through towns, plus it isn't a complete map of the trail section with Topo, which is what I would prefer. 

Any help would be appreciated. ",False,Portland,t5_2qi2i,self,Oregon Coast Trail,http://www.reddit.com/r/Portland/comments/3c9yw9/oregon_coast_trail/,,,,,
ocient,1299819642.0,,,t2_4y500,1436162142,self.Portland,https://www.reddit.com/r/Portland/comments/3c9unr/where_can_a_man_find_a_breakfast_sandwhich_in/,0,3c9unr,True,{},39,False,/r/Portland/comments/3c9unr/where_can_a_man_find_a_breakfast_sandwhich_in/,1440628925,0,{},"It seems so difficult to find a no frills basic meat, egg, and cheese sandwhich. cooked on a griddle, preferably on a toasted hard roll. bonus points for North, or Northeast Portland.",False,Portland,t5_2qi2i,self,Where can a man find a breakfast sandwhich in this town,http://www.reddit.com/r/Portland/comments/3c9unr/where_can_a_man_find_a_breakfast_sandwhich_in/,,,,,
pdxliz,1364300506.0,,,t2_b2xj1,1436161244,self.Portland,https://www.reddit.com/r/Portland/comments/3c9tfo/free_yoga_saturdays_in_sellwood_at_westmoreland/,0,3c9tfo,True,{},2,False,/r/Portland/comments/3c9tfo/free_yoga_saturdays_in_sellwood_at_westmoreland/,1440628941,3,{},"My sister hosts an hour long yoga class in the park on Saturday mornings, all are welcome to join!  You can read about the event on her facebook page: 

https://www.facebook.com/events/454384408075231/

I'm a complete beginner (this will be my third class) so don't be dissuaded by lack of experience.",False,Portland,t5_2qi2i,self,Free Yoga Saturdays in Sellwood at Westmoreland Park!,http://www.reddit.com/r/Portland/comments/3c9tfo/free_yoga_saturdays_in_sellwood_at_westmoreland/,,,,,
RaptorsFromSpace,1386024642.0,,,t2_e64t6,1436158155,self.Portland,https://www.reddit.com/r/Portland/comments/3c9p01/best_places_to_eat_and_drink/,0,3c9p01,True,{},3,False,/r/Portland/comments/3c9p01/best_places_to_eat_and_drink/,1440628998,0,{},,False,Portland,t5_2qi2i,default,Best places to Eat and Drink,http://www.reddit.com/r/Portland/comments/3c9p01/best_places_to_eat_and_drink/,,,,,
[deleted],,,,,1436157890,self.Portland,https://www.reddit.com/r/Portland/comments/3c9omf/looking_for_a_ride_to_walla_walla/,0,3c9omf,True,{},3,False,/r/Portland/comments/3c9omf/looking_for_a_ride_to_walla_walla/,1440629003,0,{},"I know this an incredible long shot, but would anyone happen to be going to Walla Walla, Wa the weekend of July 24th?  I'm looking for a ride for my husband.  I will already be there and I'm just looking for someone he can ride with so he can meet me there. Thanks.",False,Portland,t5_2qi2i,default,Looking for a ride to Walla Walla.,http://www.reddit.com/r/Portland/comments/3c9omf/looking_for_a_ride_to_walla_walla/,,,,,
ejchristian86,1308197685.0,,Cedar Mill,t2_5dqsl,1436157151,self.Portland,https://www.reddit.com/r/Portland/comments/3c9nfo/need_a_window_replaced_recommendations/,0,3c9nfo,True,{},6,False,/r/Portland/comments/3c9nfo/need_a_window_replaced_recommendations/,1440629018,3,{},"The outer pane of one of our double-pane windows broke today. (PSA: don't put your barbecue right next to your window.  Combo of hot day + cooking heated the air between the panes and cracked the outer one but good.) Looking for either a dedicated glass repair/replace person, or a reliable handyman/woman who has experience with glass. We're in NW near the Beaverton border. ",False,Portland,t5_2qi2i,self,Need a window replaced. Recommendations?,http://www.reddit.com/r/Portland/comments/3c9nfo/need_a_window_replaced_recommendations/,,,,,
threadjumper,1348533156.0,,,t2_944ih,1436156784,portlandoregon.gov,https://www.reddit.com/r/Portland/comments/3c9muk/til_you_cannot_be_certified_as_a_police_officer/,0,3c9muk,False,{},6,False,/r/Portland/comments/3c9muk/til_you_cannot_be_certified_as_a_police_officer/,1440629026,9,{},,False,Portland,t5_2qi2i,http://b.thumbs.redditmedia.com/kKlf1doac8Rd9CUfaG6NxOAWH0w8Zw3VK1Eh9O9sP5s.jpg,TIL: You cannot be certified as a police officer in Oregon if you've been convicted of bigamy (the act of going through a marriage ceremony while already married to another person),http://www.portlandoregon.gov/police/article/437580,,link,"{'images': [{'id': 'pVRlqHCOcLDazvgE6oo7kXB5hQGqg_tV4WqR8VR1OLA', 'resolutions': [{'height': 77, 'url': 'https://i.redditmedia.com/pVb6Dbx4nbLVSZk1388LD31QVi29LbVBlp3t6GrHG_A.jpg?fit=crop&amp;crop=faces%2Centropy&amp;arh=2&amp;w=108&amp;s=78467eae784a9f7573ac6fb1e312bdaf', 'width': 108}, {'height': 154, 'url': 'https://i.redditmedia.com/pVb6Dbx4nbLVSZk1388LD31QVi29LbVBlp3t6GrHG_A.jpg?fit=crop&amp;crop=faces%2Centropy&amp;arh=2&amp;w=216&amp;s=1b5dedecef7df3eab645395961ba814c', 'width': 216}], 'source': {'height': 219, 'url': 'https://i.redditmedia.com/pVb6Dbx4nbLVSZk1388LD31QVi29LbVBlp3t6GrHG_A.jpg?s=d47a4871dd9a37f7f724fd3d4954038c', 'width': 306}, 'variants': {}}]}",,
katherinemiller45,,,,,1436156227,self.Portland,https://www.reddit.com/r/Portland/comments/3c9lz5/anyone_hear_that_giant_bang_downtown_near_the/,0,3c9lz5,True,{},0,False,/r/Portland/comments/3c9lz5/anyone_hear_that_giant_bang_downtown_near_the/,1440629037,1,{},,False,Portland,t5_2qi2i,default,anyone hear that giant bang downtown near the timbers stadium?,http://www.reddit.com/r/Portland/comments/3c9lz5/anyone_hear_that_giant_bang_downtown_near_the/,,,,,
[deleted],,,,,1436155512,self.Portland,https://www.reddit.com/r/Portland/comments/3c9kth/my_welcome_to_portland_story_less_than_a_week/,0,3c9kth,True,{},49,False,/r/Portland/comments/3c9kth/my_welcome_to_portland_story_less_than_a_week/,1440629052,19,{},"Hey all!  Please let me know if this isn't the place for this post.

Hey, everyone!  I was Craigslist scammed out of a place to live, and desperate times call for desperate measures.  I made the amateur mistake of trusting a rental sight unseen, and have discovered my new landlord wants sexual favors for the pleasure of living there!  Luckily I was able to get my funds back as I noped out of that situation, but the Craigslist and Padmapper waters are a bit dry as it's now after the 5th.  Any posts I've seen, I've responded to, checked the sidebar, reached out to the 3 people I know in town.

Me: 27, starts work this next week, has a 10 pound trained dog named Professor Charles Xavier.  Has my own car, drama is gross, I'm LGBTQ, 420 friendly, accepting of everyone.  I like books, beer, and people.  Love to cook, love to explore the city.

I am reaching out to anyone or anyone who might be looking to rent a room in their house, or are looking, or have a friend - or can point me in the right direction.  I'm safe for the night, but going forward is a bit murky, and as I start work next week, I need to be somewhere other than a hotel or hostel.

I've seen incredible things come from r/Portland and am hoping a local might have knowledge that I don't.

Edit for helpfulness:

My budget is $600 monthly, hopefully all included.  I can go higher once school starts (PCC nursing student) but that's not for a few months.  I can commute from Gresham or Beaverton and have enough for 3 month's rent at the moment.  Ideally I'd love to be close to any of the PCC campuses, but I'm coming from Florida where I'm quite used to a 45+ minute drive to get anywhere, and have budgeted accordingly.
",False,Portland,t5_2qi2i,default,"My welcome to Portland story: less than a week here, and I was scammed for a living situation. Any advice appreciated, details inside.",http://www.reddit.com/r/Portland/comments/3c9kth/my_welcome_to_portland_story_less_than_a_week/,1436161790.0,,,,
jsaxton86,1224027714.0,,,t2_39oxu,1436153948,koin.com,https://www.reddit.com/r/Portland/comments/3c9i51/summer_2014_portlands_hottest_ever_2014/,0,3c9i51,False,{},7,False,/r/Portland/comments/3c9i51/summer_2014_portlands_hottest_ever_2014/,1440629087,5,{},,False,Portland,t5_2qi2i,http://b.thumbs.redditmedia.com/rGdbZi6gOTp49m_2b1NkM6Nc08ZDYf-7udaCqIXwhQA.jpg,Summer 2014: Portland’s hottest ever [2014],http://koin.com/2014/09/22/summer-2014-portlands-hottest-ever/,,link,"{'images': [{'id': 'ZoEYytfWJO9210sNZ4pXoXZyxS5wuZ0TNvgzA_JhbBE', 'resolutions': [{'height': 60, 'url': 'https://i.redditmedia.com/f7D4rxTg6mk-YJJmIBrHf8mjOTp2zDZPP_AwIjKuwsk.jpg?fit=crop&amp;crop=faces%2Centropy&amp;arh=2&amp;w=108&amp;s=fda40b158d2906625f75d6ee2a4c947f', 'width': 108}, {'height': 121, 'url': 'https://i.redditmedia.com/f7D4rxTg6mk-YJJmIBrHf8mjOTp2zDZPP_AwIjKuwsk.jpg?fit=crop&amp;crop=faces%2Centropy&amp;arh=2&amp;w=216&amp;s=5a035aad33e471bbb8e6873bd1ad354c', 'width': 216}, {'height': 180, 'url': 'https://i.redditmedia.com/f7D4rxTg6mk-YJJmIBrHf8mjOTp2zDZPP_AwIjKuwsk.jpg?fit=crop&amp;crop=faces%2Centropy&amp;arh=2&amp;w=320&amp;s=4d07a5a57cad66b1d65ae303af855442', 'width': 320}, {'height': 360, 'url': 'https://i.redditmedia.com/f7D4rxTg6mk-YJJmIBrHf8mjOTp2zDZPP_AwIjKuwsk.jpg?fit=crop&amp;crop=faces%2Centropy&amp;arh=2&amp;w=640&amp;s=6d522790caad6897205cfe8b60212da6', 'width': 640}], 'source': {'height': 360, 'url': 'https://i.redditmedia.com/f7D4rxTg6mk-YJJmIBrHf8mjOTp2zDZPP_AwIjKuwsk.jpg?s=2a7dc9aa1766738e6ab65cb13b8af066', 'width': 640}, 'variants': {}}]}",,
hilariuspdx,1343418375.0,,,t2_8h2tq,1436151928,portlandgeekcouncil.com,https://www.reddit.com/r/Portland/comments/3c9elm/the_5th_annual_portland_geek_olympathon_is_nigh/,0,3c9elm,False,{},2,False,/r/Portland/comments/3c9elm/the_5th_annual_portland_geek_olympathon_is_nigh/,1440629133,15,{},,False,Portland,t5_2qi2i,http://b.thumbs.redditmedia.com/nWC7QTko4E6v5AUQoX5hZNiWn86Ihrso5h2GaYE4bLk.jpg,The 5th Annual Portland Geek Olympathon is Nigh! Win 5 passes to PAX and $500 cash moneys.,http://www.portlandgeekcouncil.com/olympathon,,link,"{'images': [{'id': '1Cc76MiABEj1hA-MMn1vJ1VFH3tNr3jtT5xSd3j7dtU', 'resolutions': [{'height': 50, 'url': 'https://i.redditmedia.com/IuMiiPb77Og4EJcOHZbsz1yy4EOmj-ozyxfY4uE2S6s.jpg?fit=crop&amp;crop=faces%2Centropy&amp;arh=2&amp;w=108&amp;s=18c8ba0d4fa927d85d009bc74b16adae', 'width': 108}, {'height': 101, 'url': 'https://i.redditmedia.com/IuMiiPb77Og4EJcOHZbsz1yy4EOmj-ozyxfY4uE2S6s.jpg?fit=crop&amp;crop=faces%2Centropy&amp;arh=2&amp;w=216&amp;s=19e1699c6ac842805705aa569f54073a', 'width': 216}, {'height': 150, 'url': 'https://i.redditmedia.com/IuMiiPb77Og4EJcOHZbsz1yy4EOmj-ozyxfY4uE2S6s.jpg?fit=crop&amp;crop=faces%2Centropy&amp;arh=2&amp;w=320&amp;s=80cc22ba413df620fd7e561fae4d7eaa', 'width': 320}, {'height': 301, 'url': 'https://i.redditmedia.com/IuMiiPb77Og4EJcOHZbsz1yy4EOmj-ozyxfY4uE2S6s.jpg?fit=crop&amp;crop=faces%2Centropy&amp;arh=2&amp;w=640&amp;s=026dbbaf81c2891b45eaa364973fdab4', 'width': 640}, {'height': 452, 'url': 'https://i.redditmedia.com/IuMiiPb77Og4EJcOHZbsz1yy4EOmj-ozyxfY4uE2S6s.jpg?fit=crop&amp;crop=faces%2Centropy&amp;arh=2&amp;w=960&amp;s=dced9243f9ef41763d253b1fbe75d7a6', 'width': 960}, {'height': 509, 'url': 'https://i.redditmedia.com/IuMiiPb77Og4EJcOHZbsz1yy4EOmj-ozyxfY4uE2S6s.jpg?fit=crop&amp;crop=faces%2Centropy&amp;arh=2&amp;w=1080&amp;s=3602e8cbe1dfd347acd0bc61123b66fd', 'width': 1080}], 'source': {'height': 750, 'url': 'https://i.redditmedia.com/IuMiiPb77Og4EJcOHZbsz1yy4EOmj-ozyxfY4uE2S6s.jpg?s=e6ab7fff99a9196aa6af6b2d01bce485', 'width': 1590}, 'variants': {}}]}",,
drummertobeat,1383847998.0,,,t2_dtdc7,1436151367,self.Portland,https://www.reddit.com/r/Portland/comments/3c9dog/where_to_get_red_stripe_in_portland/,0,3c9dog,True,{},10,False,/r/Portland/comments/3c9dog/where_to_get_red_stripe_in_portland/,1440629145,0,{},"I haven't seen in Freddies, New Seasons, wherever I regularly go to pick up beer. Any tips on where I could find it? ",False,Portland,t5_2qi2i,self,Where to get Red Stripe in Portland?,http://www.reddit.com/r/Portland/comments/3c9dog/where_to_get_red_stripe_in_portland/,,,,,
