author,author_created_utc,author_flair_css_class,author_flair_text,author_fullname,created_utc,domain,full_link,gilded,id,is_self,media_embed,num_comments,over_18,permalink,retrieved_on,score,secure_media_embed,selftext,stickied,subreddit,subreddit_id,thumbnail,title,url,edited,media,secure_media
jesster114,1249592307.0,,Creston-Kenilworth,t2_3kspo,1425595996,self.Portland,https://www.reddit.com/r/Portland/comments/2y2pm8/looking_for_someone_local_for_some_computer_help/,0,2y2pm8,True,{},24,False,/r/Portland/comments/2y2pm8/looking_for_someone_local_for_some_computer_help/,1440870533,5,{},"Having a bit of computer trouble with my fiancée's computer. I built it for her to try and set up a hackintosh, but after a little while it just wouldn't start up. Worked fine in the first few weeks, but after a period of non use, it just stopped booting. I obviously don't want to take it to geek squad as they would probably be next to useless for something like this. 

I figure someone on this subreddit might have enough knowhow to help me out. I also realize that there needs to be some sort of compensation. I am not too well set up financially. I can offer up some cash for your time, hopefully it's a quick fix. However, if it is a more involved project that would stretch beyond my budget, I am happy to discuss some sort of barter and trade. I am currently leaving a job and will have plenty of free time if you have need of extra manpower on a job.

Anyway, if anyone reading this could help me out, it would be much appreciated. My fiancée would be thrilled to have a working computer again and not have to split time with my laptop. 

Thanks again,
jesster114",False,Portland,t5_2qi2i,self,Looking for someone local for some computer help,http://www.reddit.com/r/Portland/comments/2y2pm8/looking_for_someone_local_for_some_computer_help/,,,
tbonenowison,1386305223.0,,SE,t2_e84nc,1425595035,self.Portland,https://www.reddit.com/r/Portland/comments/2y2njj/favorite_history_bookswebsites_about_portland/,0,2y2njj,True,{},4,False,/r/Portland/comments/2y2njj/favorite_history_bookswebsites_about_portland/,1440870560,1,{},,False,Portland,t5_2qi2i,self,Favorite history books/websites about Portland?,http://www.reddit.com/r/Portland/comments/2y2njj/favorite_history_bookswebsites_about_portland/,,,
maxoregonian,1397022581.0,,,t2_g1p96,1425593985,s.oregonlive.com,https://www.reddit.com/r/Portland/comments/2y2law/jury_finds_portland_police_officers_did_not_act/,0,2y2law,False,{},0,False,/r/Portland/comments/2y2law/jury_finds_portland_police_officers_did_not_act/,1440870589,1,{},,False,Portland,t5_2qi2i,default,Jury finds Portland police officers did not act negligently before fatal shooting of Brad Morgan,http://s.oregonlive.com/Y0Cf0mX,,,
themercmonster,1421355066.0,,,t2_kqjs6,1425593639,youtube.com,https://www.reddit.com/r/Portland/comments/2y2kk4/did_portland_touch_itself_to_fifty_shades_of_grey/,0,2y2kk4,False,"{'content': '&lt;iframe class=""embedly-embed"" src=""//cdn.embedly.com/widgets/media.html?src=http%3A%2F%2Fwww.youtube.com%2Fembed%2Fd3iBf6ezwKY%3Ffeature%3Doembed&amp;url=https%3A%2F%2Fwww.youtube.com%2Fwatch%3Fv%3Dd3iBf6ezwKY&amp;image=http%3A%2F%2Fi.ytimg.com%2Fvi%2Fd3iBf6ezwKY%2Fhqdefault.jpg&amp;key=2aa3c4d5f3de4f5b9120b660ad850dc9&amp;type=text%2Fhtml&amp;schema=youtube"" width=""600"" height=""338"" scrolling=""no"" frameborder=""0"" allowfullscreen&gt;&lt;/iframe&gt;', 'height': 338, 'scrolling': False, 'width': 600}",7,False,/r/Portland/comments/2y2kk4/did_portland_touch_itself_to_fifty_shades_of_grey/,1440870599,0,"{'content': '&lt;iframe class=""embedly-embed"" src=""https://cdn.embedly.com/widgets/media.html?src=https%3A%2F%2Fwww.youtube.com%2Fembed%2Fd3iBf6ezwKY%3Ffeature%3Doembed&amp;url=https%3A%2F%2Fwww.youtube.com%2Fwatch%3Fv%3Dd3iBf6ezwKY&amp;image=http%3A%2F%2Fi.ytimg.com%2Fvi%2Fd3iBf6ezwKY%2Fhqdefault.jpg&amp;key=2aa3c4d5f3de4f5b9120b660ad850dc9&amp;type=text%2Fhtml&amp;schema=youtube"" width=""600"" height=""338"" scrolling=""no"" frameborder=""0"" allowfullscreen&gt;&lt;/iframe&gt;', 'height': 338, 'scrolling': False, 'width': 600}",,False,Portland,t5_2qi2i,default,"Did Portland touch itself to ""Fifty Shades of Grey""? (New Interview Video!)",https://www.youtube.com/watch?v=d3iBf6ezwKY,,"{'oembed': {'author_name': 'Aria Inthavong', 'author_url': 'http://www.youtube.com/channel/UC9PivtU3L4FK5SpvKBXxeaQ', 'description': 'Aria interviews people on the street to try and help keep Portland weird about bondage, fetishes, and ""Fifty Shades of Grey"". *Congratulations to Portland on being voted the kinkiest city in the US!* Twitter: https://twitter.com/ariainthavong @ariainthavong Instagram: https://instagram.com/ariainthavong/ @ariainthavong If you enjoyed this, please give the video a thumbs up and subscribe for more weekly interviews.', 'height': 338, 'html': '&lt;iframe class=""embedly-embed"" src=""//cdn.embedly.com/widgets/media.html?src=http%3A%2F%2Fwww.youtube.com%2Fembed%2Fd3iBf6ezwKY%3Ffeature%3Doembed&amp;url=https%3A%2F%2Fwww.youtube.com%2Fwatch%3Fv%3Dd3iBf6ezwKY&amp;image=http%3A%2F%2Fi.ytimg.com%2Fvi%2Fd3iBf6ezwKY%2Fhqdefault.jpg&amp;key=2aa3c4d5f3de4f5b9120b660ad850dc9&amp;type=text%2Fhtml&amp;schema=youtube"" width=""600"" height=""338"" scrolling=""no"" frameborder=""0"" allowfullscreen&gt;&lt;/iframe&gt;', 'provider_name': 'YouTube', 'provider_url': 'http://www.youtube.com/', 'thumbnail_height': 360, 'thumbnail_url': 'http://i.ytimg.com/vi/d3iBf6ezwKY/hqdefault.jpg', 'thumbnail_width': 480, 'title': 'Portland Gets Weird: Fifty Shades of Grey', 'type': 'video', 'url': 'http://www.youtube.com/watch?v=d3iBf6ezwKY', 'version': '1.0', 'width': 600}, 'type': 'youtube.com'}","{'oembed': {'author_name': 'Aria Inthavong', 'author_url': 'http://www.youtube.com/channel/UC9PivtU3L4FK5SpvKBXxeaQ', 'description': 'Aria interviews people on the street to try and help keep Portland weird about bondage, fetishes, and ""Fifty Shades of Grey"". *Congratulations to Portland on being voted the kinkiest city in the US!* Twitter: https://twitter.com/ariainthavong @ariainthavong Instagram: https://instagram.com/ariainthavong/ @ariainthavong If you enjoyed this, please give the video a thumbs up and subscribe for more weekly interviews.', 'height': 338, 'html': '&lt;iframe class=""embedly-embed"" src=""https://cdn.embedly.com/widgets/media.html?src=https%3A%2F%2Fwww.youtube.com%2Fembed%2Fd3iBf6ezwKY%3Ffeature%3Doembed&amp;url=https%3A%2F%2Fwww.youtube.com%2Fwatch%3Fv%3Dd3iBf6ezwKY&amp;image=http%3A%2F%2Fi.ytimg.com%2Fvi%2Fd3iBf6ezwKY%2Fhqdefault.jpg&amp;key=2aa3c4d5f3de4f5b9120b660ad850dc9&amp;type=text%2Fhtml&amp;schema=youtube"" width=""600"" height=""338"" scrolling=""no"" frameborder=""0"" allowfullscreen&gt;&lt;/iframe&gt;', 'provider_name': 'YouTube', 'provider_url': 'http://www.youtube.com/', 'thumbnail_height': 360, 'thumbnail_url': 'https://i.embed.ly/1/image?url=http%3A%2F%2Fi.ytimg.com%2Fvi%2Fd3iBf6ezwKY%2Fhqdefault.jpg&amp;key=b1e305db91cf4aa5a86b732cc9fffceb', 'thumbnail_width': 480, 'title': 'Portland Gets Weird: Fifty Shades of Grey', 'type': 'video', 'url': 'http://www.youtube.com/watch?v=d3iBf6ezwKY', 'version': '1.0', 'width': 600}, 'type': 'youtube.com'}"
michaelconfoy,1398224312.0,,,t2_g9dgz,1425593316,imgur.com,https://www.reddit.com/r/Portland/comments/2y2jul/w_burnside_st_and_nw_23rd_ave_looking_east_1952/,0,2y2jul,False,{},14,False,/r/Portland/comments/2y2jul/w_burnside_st_and_nw_23rd_ave_looking_east_1952/,1440870608,43,{},,False,Portland,t5_2qi2i,http://b.thumbs.redditmedia.com/8YOi3VqfX4diiQ84O9SXlJbEn5ZWEL-X6zelFwbhIoo.jpg,"W Burnside St and NW 23rd Ave looking east, 1952.",http://imgur.com/ACMODOs.jpg,,,
argyleecho,1369430621.0,,SE,t2_bsnq0,1425593150,oregonlive.com,https://www.reddit.com/r/Portland/comments/2y2jg7/oregon_senate_approves_automatic_voter/,0,2y2jg7,False,{},77,False,/r/Portland/comments/2y2jg7/oregon_senate_approves_automatic_voter/,1440870613,136,{},,False,Portland,t5_2qi2i,http://b.thumbs.redditmedia.com/SiOCRUW_lSfV1nFwHMvnUGmQsCCzfoPqtxd4kfEC2NQ.jpg,"Oregon Senate approves 'Automatic Voter Registration' bill, will be sent to Gov. Brown",http://www.oregonlive.com/mapes/index.ssf/2015/03/sweeping_new_motor_voter_bill.html#incart_m-rpt-1,,,
left_handed_violist,1331235271.0,,,t2_74fhl,1425591720,self.Portland,https://www.reddit.com/r/Portland/comments/2y2g2v/new_app_for_gresham_residents_my_gresham/,0,2y2g2v,True,{},5,False,/r/Portland/comments/2y2g2v/new_app_for_gresham_residents_my_gresham/,1440870657,6,{},"Just launched. It's for reporting non-emergency issues and giving feedback. It's pretty cool--you can pin your issue on a map, take a photo of it, and see other issues people have submitted. 

For both [Apple](https://www.publicstuff.com/iphone/961) and [Android](https://www.publicstuff.com/android/961).",False,Portland,t5_2qi2i,self,"New app for Gresham residents, My Gresham",http://www.reddit.com/r/Portland/comments/2y2g2v/new_app_for_gresham_residents_my_gresham/,,,
will--,1350348505.0,,,t2_9bc3t,1425589789,self.Portland,https://www.reddit.com/r/Portland/comments/2y2bkb/xpost_from_raskportland_traveling_from_downtown/,0,2y2bkb,True,{},4,False,/r/Portland/comments/2y2bkb/xpost_from_raskportland_traveling_from_downtown/,1440870715,0,{},"Sorry if this isn't the right place to post this, but I'm new to Portland and need some help. /r/askportland hasn't responded (yet).

I need to go to Vancouver, WA tonight around 7, and I don't have a car.
Several options I'm considering:

1. I've got an annual TriMet pass, but I'm not sure if it will work with C-Tran.
2. Car 2 Go/ZipCar
3. Travel to Vancouver city limits, then Uber to my destination.
4. Taxi

Any suggestions would be helpful!",False,Portland,t5_2qi2i,self,"[X-post from /r/askportland] Traveling from downtown to Vancouver, don't own a car",http://www.reddit.com/r/Portland/comments/2y2bkb/xpost_from_raskportland_traveling_from_downtown/,,,
meritt_zare,,,,,1425588818,i.imgur.com,https://www.reddit.com/r/Portland/comments/2y299t/new_ridesharing_company_for_dogs/,0,2y299t,False,{},14,False,/r/Portland/comments/2y299t/new_ridesharing_company_for_dogs/,1440870745,10,{},,False,Portland,t5_2qi2i,http://a.thumbs.redditmedia.com/AzcJevWwxRwfu5YV9VniWHCAVAG9AyuShy13uUAwPE8.jpg,New ride-sharing company for dogs?,http://i.imgur.com/VdTTgWb.jpg,,,
sawalrath,1333900376.0,,,t2_7e5kj,1425587818,self.Portland,https://www.reddit.com/r/Portland/comments/2y26zz/whats_your_favorite_korean_restaurant_in_portland/,0,2y26zz,True,{},30,False,/r/Portland/comments/2y26zz/whats_your_favorite_korean_restaurant_in_portland/,1440870774,12,{},Haven't had good Korean food since I was in Seoul and was wondering if anyone could recommend some good Korean restaurants in and around Portland. Specifically downtown and west of the river.,False,Portland,t5_2qi2i,self,What's your favorite Korean restaurant in Portland?,http://www.reddit.com/r/Portland/comments/2y26zz/whats_your_favorite_korean_restaurant_in_portland/,,,
[deleted],,,,,1425587408,kgw.com,https://www.reddit.com/r/Portland/comments/2y261y/multnomah_county_approves_ecigarette_restrictions/,0,2y261y,False,{},38,False,/r/Portland/comments/2y261y/multnomah_county_approves_ecigarette_restrictions/,1440870787,20,{},,False,Portland,t5_2qi2i,default,Multnomah County approves e-cigarette restrictions,http://www.kgw.com/story/news/2015/03/05/multnomah-county-e-cigarettes-vote/24440477/,,,
[deleted],,,,,1425586112,i.imgur.com,https://www.reddit.com/r/Portland/comments/2y2338/japanese_gardens_the_girl_the_sunoh_portland/,0,2y2338,False,{},2,False,/r/Portland/comments/2y2338/japanese_gardens_the_girl_the_sunoh_portland/,1440870825,0,{},,False,Portland,t5_2qi2i,default,"Japanese Gardens, the girl, the sun....oh Portland!!",http://i.imgur.com/R48Q75h.jpg,,,
tbshawk4,1360014268.0,,NE,t2_ah462,1425586061,oregonlive.com,https://www.reddit.com/r/Portland/comments/2y22z6/world_naked_bike_ride_sets_2015_date_in_portland/,0,2y22z6,False,{},39,False,/r/Portland/comments/2y22z6/world_naked_bike_ride_sets_2015_date_in_portland/,1440870826,36,{},,False,Portland,t5_2qi2i,http://b.thumbs.redditmedia.com/3VzPJMHWLQNtUTErLZG6rEQguqU81yQ8qvA2GBUUTGM.jpg,World Naked Bike Ride sets 2015 date in Portland,http://www.oregonlive.com/entertainment/index.ssf/2015/03/naked_bike_ride_sets_2015_date.html,,,
noautographsplease,1417470718.0,,,t2_jqf90,1425585437,self.Portland,https://www.reddit.com/r/Portland/comments/2y21ia/attention_oregon_washington_you_can_turn_on_a_red/,0,2y21ia,True,{},36,False,/r/Portland/comments/2y21ia/attention_oregon_washington_you_can_turn_on_a_red/,1440870846,0,{},"Yes indeed-once you have stopped at a red arrow you may proceed. A red arrow stop light does NOT mean no turn on red UNLESS there is a posted sign saying that you may not turn on red. That is all, please carry on and have a nice day.",False,Portland,t5_2qi2i,self,Attention Oregon &amp; Washington: You CAN turn on a red arrow stop light.,http://www.reddit.com/r/Portland/comments/2y21ia/attention_oregon_washington_you_can_turn_on_a_red/,,,
MurrayCarter,1338580366.0,,,t2_7vadz,1425583998,self.Portland,https://www.reddit.com/r/Portland/comments/2y1y8g/traditional_japanese_bladesmith_hosting_an_open/,0,2y1y8g,True,{},20,False,/r/Portland/comments/2y1y8g/traditional_japanese_bladesmith_hosting_an_open/,1440870888,48,{},"Hi again /r/Portland!  
I am [Murray Carter](https://www.youtube.com/watch?v=BqanJCj__NM), a traditional Japanese bladesmith. I make knives by hand using traditional Japanese bladesmithing techniques. We host an open house on the first Saturday of every month (when time permits) and open the doors of our forge to the general public.  
This coming Saturday, March 7th, at 10 AM is our next open house. All are welcome to attend! Ear plugs will be provided (the power hammer can be a little loud). The demonstration is not dangerous, but please use good judgement - a forge is still a forge.  
Following the open house we will be having a cash-only *FLASH SALE* from 12:00 - 1:00 PM. All Carter Cutlery products are 40% off! 

Ready to learn what goes into making high-performance cutlery? We hope to see you there.   
Our address:  
Carter Cutlery  
2038 NW Aloclek, Suite 225  
Hillsboro, OR  
97124",False,Portland,t5_2qi2i,self,"Traditional Japanese Bladesmith hosting an open house this Saturday, March 7th, at 10 AM.",http://www.reddit.com/r/Portland/comments/2y1y8g/traditional_japanese_bladesmith_hosting_an_open/,1425596014.0,,
psymonetta,1358101088.0,,Lents,t2_a7mnz,1425583861,portlandtribune.com,https://www.reddit.com/r/Portland/comments/2y1xx8/chad_rennaker_is_betting_on_making_more_than_a/,0,2y1xx8,False,{},3,False,/r/Portland/comments/2y1xx8/chad_rennaker_is_betting_on_making_more_than_a/,1440870892,12,{},,False,Portland,t5_2qi2i,http://a.thumbs.redditmedia.com/CsKLXxidQ4mo3U3lvUITaFYVsgP_PKm9IPDbRdK4Qx0.jpg,Chad Rennaker is betting on making more than a brewpub in Lents,http://portlandtribune.com/pt/9-news/252419-121073-developer-says-brewpub-will-spark-other-projects-in-lents-district,,,
Peace_Love_Happiness,1316528948.0,,4 oz stout,t2_5w6le,1425582420,self.Portland,https://www.reddit.com/r/Portland/comments/2y1um7/reminder_weekly_rportland_meetup_saturday_730pm/,0,2y1um7,True,{},0,False,/r/Portland/comments/2y1um7/reminder_weekly_rportland_meetup_saturday_730pm/,1440870935,0,{},"The location this week is Bar Bar, in the Mississippi district. We always get a decent to large group of people showing up, and would love to have you if you haven't come to a meetup yet!

Details here: http://www.reddit.com/r/Portland/comments/2t7288/weekly_rportland_social_meetup_saturdays_730pm/",False,Portland,t5_2qi2i,self,"REMINDER: Weekly /r/Portland Meetup - Saturday, 7:30pm",http://www.reddit.com/r/Portland/comments/2y1um7/reminder_weekly_rportland_meetup_saturday_730pm/,,,
cgparfois,1400536785.0,,,t2_gmv8m,1425581144,self.Portland,https://www.reddit.com/r/Portland/comments/2y1rnm/watir_users/,0,2y1rnm,True,{},2,False,/r/Portland/comments/2y1rnm/watir_users/,1440870973,0,{},My company uses this and ruby for testing. Are there any other watir users here in pdx (that I don't work with). It seems like I'm going to get pigeoholed into a career in ruby at this rate since the language of choice for QA professionals seems to be java.,False,Portland,t5_2qi2i,self,Watir users?,http://www.reddit.com/r/Portland/comments/2y1rnm/watir_users/,,,
Hickesy,1307493847.0,,,t2_5cfhv,1425579657,self.Portland,https://www.reddit.com/r/Portland/comments/2y1obi/any_freelance_writerscopywritersauthors_on_here/,0,2y1obi,True,{},6,False,/r/Portland/comments/2y1obi/any_freelance_writerscopywritersauthors_on_here/,1440871016,0,{},Could you recommend a good accountant in the Portland area? Any help much appreciated. ,False,Portland,t5_2qi2i,self,Any freelance writers/copywriters/authors on here?,http://www.reddit.com/r/Portland/comments/2y1obi/any_freelance_writerscopywritersauthors_on_here/,,,
pdx_flyer,1410451522.0,,Downtown,t2_icp7i,1425578698,imgur.com,https://www.reddit.com/r/Portland/comments/2y1m60/downtown_portland_sunset_from_pittock/,0,2y1m60,False,{},15,False,/r/Portland/comments/2y1m60/downtown_portland_sunset_from_pittock/,1440871044,321,{},,False,Portland,t5_2qi2i,http://b.thumbs.redditmedia.com/sBQomUO__pkCKcjryJZmGhnBYsl04DM1uuP0qCHeyEc.jpg,Downtown Portland Sunset from Pittock,http://imgur.com/ahB4hVz,,,
brosephone,1306743130.0,,,t2_5b0jg,1425575374,self.Portland,https://www.reddit.com/r/Portland/comments/2y1er2/stuff_to_do_in_portland_for_socal_newbs/,0,2y1er2,True,{},8,False,/r/Portland/comments/2y1er2/stuff_to_do_in_portland_for_socal_newbs/,1440871199,0,{},"I am visiting Portland with my wife during the first week of may. We like books, craft beer, the great outdoors, food, and all the other cultural parts of a city. Any recommendations on must sees in Portland? We are also thinking of renting a car to drive further out.",False,Portland,t5_2qi2i,self,Stuff to do in Portland for socal newbs,http://www.reddit.com/r/Portland/comments/2y1er2/stuff_to_do_in_portland_for_socal_newbs/,,,
bricks4bikers,1425515574.0,,,t2_lw4yp,1425574419,oregonlive.com,https://www.reddit.com/r/Portland/comments/2y1cim/13_reasons_portland_used_to_be_better/,0,2y1cim,False,{},0,False,/r/Portland/comments/2y1cim/13_reasons_portland_used_to_be_better/,1440871228,0,{},,False,Portland,t5_2qi2i,default,13 reasons Portland used to be better,http://www.oregonlive.com/living/index.ssf/2015/03/13_reasons_portland_used_to_be.html#incart_m-rpt-1,,,
C_schustey,1375759198.0,,,t2_cn77f,1425573955,self.Portland,https://www.reddit.com/r/Portland/comments/2y1bh4/where_do_you_guys_recommend_to_get_a_tattoo/,0,2y1bh4,True,{},12,False,/r/Portland/comments/2y1bh4/where_do_you_guys_recommend_to_get_a_tattoo/,1440871243,0,{},"I have many tattoos but the two artists I used in past have moved away.  I'm not looking for a complex piece. Just something small, black and white. But I need someone with great line work.

Any studio you guys swear by?

Edit: By place I mean tattoo parlor.",False,Portland,t5_2qi2i,self,Where do you guys recommend to get a tattoo?,http://www.reddit.com/r/Portland/comments/2y1bh4/where_do_you_guys_recommend_to_get_a_tattoo/,1425574487.0,,
green_and_yellow,1339437684.0,,Hillsdale,t2_7ypoy,1425573928,oregonlive.com,https://www.reddit.com/r/Portland/comments/2y1bez/oregon_square_redevelopment_to_bring_enormous/,0,2y1bez,False,{},31,False,/r/Portland/comments/2y1bez/oregon_square_redevelopment_to_bring_enormous/,1440871244,24,{},,False,Portland,t5_2qi2i,http://b.thumbs.redditmedia.com/B-bYtnKCyXdFBr-QMstO2QqtW6sshNGNydClx4VQMlE.jpg,Oregon Square redevelopment to bring enormous public plaza to the Lloyd District (images),http://www.oregonlive.com/business/index.ssf/2015/03/lloyd_district_redevelopment_p.html#incart_m-rpt-1,,,
bnblazer,1324822725.0,,NW,t2_6ie30,1425572170,oregonlive.com,https://www.reddit.com/r/Portland/comments/2y17h5/have_a_tough_time_finding_parking_in_northwest/,0,2y17h5,False,{},109,False,/r/Portland/comments/2y17h5/have_a_tough_time_finding_parking_in_northwest/,1440871295,26,{},,False,Portland,t5_2qi2i,http://b.thumbs.redditmedia.com/6dPogzuGwt1n3iyY3BrtKtjrVZOCvqWZF0OLod_lhhg.jpg,Have a tough time finding parking in Northwest Portland? It's about to get tougher,http://www.oregonlive.com/portland/index.ssf/2015/03/have_a_tough_time_finding_park.html,,,
[deleted],,,,,1425570002,flickr.com,https://www.reddit.com/r/Portland/comments/2y12v3/if_you_notice_a_lot_of_bicyclists_in_portland_its/,0,2y12v3,False,{},7,False,/r/Portland/comments/2y12v3/if_you_notice_a_lot_of_bicyclists_in_portland_its/,1440871354,0,{},,False,Portland,t5_2qi2i,default,"If you notice a lot of bicyclists in Portland, it's because they multiply like...",https://www.flickr.com/photos/bartking/16527912960/,,,
TugboatThomas,1391981001.0,,Beaumont-Wilshire,t2_f748y,1425568703,self.Portland,https://www.reddit.com/r/Portland/comments/2y109s/rocky_butte/,0,2y109s,True,{},9,False,/r/Portland/comments/2y109s/rocky_butte/,1440871388,0,{},"This might be a silly question, but I've been on Rocky Butte a few times at night to enjoy the view and MAYBE to make out a little. The weird thing, besides the makeouts, is that there are always children up there at like midnight. I'm talking 7 year old kids being supervised by an adult. Once there was a birthday party. I understand maybe swing shift people wanting to celebrate with their children, but it seems like a weird spot to bring kids that late at night. 

I'm not from Portland, is this a normal thing people do growing up? Did you stay up until 1 AM and then pester your mom to take you to the butte to play, or was this just random luck?",False,Portland,t5_2qi2i,self,Rocky Butte,http://www.reddit.com/r/Portland/comments/2y109s/rocky_butte/,,,
[deleted],,,,,1425555305,self.Portland,https://www.reddit.com/r/Portland/comments/2y0gzg/fun_things_to_do_in_the_city/,0,2y0gzg,True,{},8,False,/r/Portland/comments/2y0gzg/fun_things_to_do_in_the_city/,1440871637,0,{},Hello folks! I recently just moved to this beautiful city and I was wondering what sort of fun things my girlfriend (who is 20) and I could go do? We both do not have a car so easily accessible by public transportation would be a definite plus! ,False,Portland,t5_2qi2i,default,Fun things to do in the city?,http://www.reddit.com/r/Portland/comments/2y0gzg/fun_things_to_do_in_the_city/,,,
LadyVimes,1390980243.0,,,t2_f12h1,1425552736,self.Portland,https://www.reddit.com/r/Portland/comments/2y0eet/solid_gym_for_starter_in_beaverton_area/,0,2y0eet,True,{},25,False,/r/Portland/comments/2y0eet/solid_gym_for_starter_in_beaverton_area/,1440871670,5,{},"I'm looking for gym recommendations, but very nervous. Let's be frank, I'm an obese 40 year old with some physical limitations. I would like to find a place that can teach me safe ways to work out, but also some place where I won't feel like the freak show exhibit. Preferably a place with a decent balance between cardio and weights. 

Any suggestions?",False,Portland,t5_2qi2i,self,Solid gym for starter in Beaverton area?,http://www.reddit.com/r/Portland/comments/2y0eet/solid_gym_for_starter_in_beaverton_area/,,,
Gnarkill62,1382184528.0,,,t2_dkjmh,1425540839,self.Portland,https://www.reddit.com/r/Portland/comments/2y02xs/i_need_to_move_to_portland/,0,2y02xs,True,{},11,False,/r/Portland/comments/2y02xs/i_need_to_move_to_portland/,1440871819,0,{},I've done extensive research regarding companies that fall into the industry I work in (media/tech). I do advertising for a company that provides SVOD (streaming video on demand). What tech companies are in the area that I might not know of? I've been searching for a long time and would love to make Portland or the surrounding area home!,False,Portland,t5_2qi2i,self,I need to move to Portland,http://www.reddit.com/r/Portland/comments/2y02xs/i_need_to_move_to_portland/,,,
[deleted],,,,,1425538870,15nowpdx.org,https://www.reddit.com/r/Portland/comments/2y00hx/proposal_to_reduce_or_minimum_wage_to_725_per/,0,2y00hx,False,{},105,False,/r/Portland/comments/2y00hx/proposal_to_reduce_or_minimum_wage_to_725_per/,1440871852,168,{},,False,Portland,t5_2qi2i,http://b.thumbs.redditmedia.com/iRhzrquxKJHn-wCCC-TI5za2hq5sQB0TmfG4Y9WpVQg.jpg,"Proposal to reduce OR minimum wage to $7.25 per hour, introduced by Cedric Hayden",http://www.15nowpdx.org/bill-introduced-to-reduced-oregons-minimum-wage-to-federal-level-undermine-paid-sick-leave/,,,
[deleted],,,,,1425535159,self.Portland,https://www.reddit.com/r/Portland/comments/2xzv8h/looking_for_family_please_read/,0,2xzv8h,True,{},10,False,/r/Portland/comments/2xzv8h/looking_for_family_please_read/,1440871920,13,{},,False,Portland,t5_2qi2i,default,Looking for family! please read,http://www.reddit.com/r/Portland/comments/2xzv8h/looking_for_family_please_read/,1425537061.0,,
atari52oo,1307519333.0,,Kenton,t2_5chd9,1425532973,portlandoregon.gov,https://www.reddit.com/r/Portland/comments/2xzrs9/led_street_light_conversion_map_with_estimated/,0,2xzrs9,False,{},34,False,/r/Portland/comments/2xzrs9/led_street_light_conversion_map_with_estimated/,1440871965,45,{},,False,Portland,t5_2qi2i,http://b.thumbs.redditmedia.com/6E0YXUncXhFZE-HgC8IH7COjePvS20nr4P30WrcpyiU.jpg,LED street light conversion map with estimated changeover dates.,https://www.portlandoregon.gov/transportation/66437,,,
