all_awardings,author,author_flair_css_class,author_flair_richtext,author_flair_text,author_flair_type,author_fullname,author_patreon_flair,can_mod_post,contest_mode,created_utc,domain,full_link,gildings,id,is_crosspostable,is_meta,is_original_content,is_reddit_media_domain,is_robot_indexable,is_self,is_video,link_flair_background_color,link_flair_richtext,link_flair_text_color,link_flair_type,locked,media_only,no_follow,num_comments,num_crossposts,over_18,parent_whitelist_status,permalink,pinned,pwls,retrieved_on,score,selftext,send_replies,spoiler,stickied,subreddit,subreddit_id,subreddit_subscribers,subreddit_type,thumbnail,title,total_awards_received,updated_utc,url,whitelist_status,wls,author_flair_background_color,author_flair_text_color,link_flair_css_class,link_flair_text,post_hint,preview,thumbnail_height,thumbnail_width,gilded,author_flair_template_id,media,media_embed,secure_media,secure_media_embed
[],TwistedJake503,,[],,text,t2_221af3rj,False,False,False,1561859692,i.redd.it,https://www.reddit.com/r/Portland/comments/c77lpl/oregon_lavender_farm_festival/,{},c77lpl,False,False,False,True,False,False,False,,[],dark,text,False,False,True,4,0,False,all_ads,/r/Portland/comments/c77lpl/oregon_lavender_farm_festival/,False,6,1561859693,0,,True,False,False,Portland,t5_2qi2i,129933,public,default,Oregon Lavender Farm - Festival,0,1561946067,https://i.redd.it/721pzfb8he731.jpg,all_ads,6,,,,,,,,,,,,,,
[],ryan_ens,,[],,text,t2_24jq2781,False,False,False,1561859374,self.Portland,https://www.reddit.com/r/Portland/comments/c77jw8/restaurantfood_cartcafeetc_recommendations_in_the/,{},c77jw8,True,False,False,False,True,True,False,,[],dark,text,False,False,True,10,0,False,all_ads,/r/Portland/comments/c77jw8/restaurantfood_cartcafeetc_recommendations_in_the/,False,6,1561859375,0,"Hey guys, I’ve been looking for some new restaurants to try around Portland because I’m kinda tired of just the same 8 restaurants I’ve been going to for the past 3 years.

Does anyone have any recommendations? I’m not a picky eater, so please don’t hesitate to give any suggestions. Wether it’s comfort food, Italian, Vietnamese, Thai, sushi, etc. Doesn’t matter if it’s breakfast, lunch, or dinner, I’ll take it. Also it doesn’t just have to be in downtown, it can literally be anywhere like lake Oswego, Portland heights, north east, Raleigh hills, etc.",True,False,False,Portland,t5_2qi2i,129932,public,self,Restaurant/food cart/cafe/etc. recommendations in the Portland area,0,1561945759,https://www.reddit.com/r/Portland/comments/c77jw8/restaurantfood_cartcafeetc_recommendations_in_the/,all_ads,6,,,,,,,,,,,,,,
[],Sisyphus54,,[],,text,t2_41ngx7bd,False,False,False,1561858797,self.Portland,https://www.reddit.com/r/Portland/comments/c77gl3/interesting_places_around_town/,{},c77gl3,False,False,False,False,False,True,False,,[],dark,text,False,False,True,20,0,False,all_ads,/r/Portland/comments/c77gl3/interesting_places_around_town/,False,6,1561858798,0,[removed],True,False,False,Portland,t5_2qi2i,129931,public,self,Interesting places around town?,0,1561945178,https://www.reddit.com/r/Portland/comments/c77gl3/interesting_places_around_town/,all_ads,6,,,,,,,,,,,,,,
[],oregone1,,[],2nd Place In A Cute Butt Contest?,text,t2_4gq1v,False,False,False,1561858057,imgur.com,https://www.reddit.com/r/Portland/comments/c77cad/get_em_before_theyre_gone/,{},c77cad,True,False,False,False,True,False,False,,[],dark,text,False,False,True,11,0,False,all_ads,/r/Portland/comments/c77cad/get_em_before_theyre_gone/,False,6,1561858058,21,,False,False,False,Portland,t5_2qi2i,129930,public,default,Get ‘em before they’re gone,0,1561944437,https://imgur.com/a/JqUaYup,all_ads,6,,dark,photo,Photo,,,,,,,,,,
[],turdfergusonpdx,,[],,text,t2_166zcy,False,False,False,1561857397,oregonmetro.gov,https://www.reddit.com/r/Portland/comments/c778jo/metro_to_study_max_tunnel_extremely_unlikely_but/,{},c778jo,True,False,False,False,True,False,False,,[],dark,text,False,False,True,14,0,False,all_ads,/r/Portland/comments/c778jo/metro_to_study_max_tunnel_extremely_unlikely_but/,False,6,1561857398,21,,True,False,False,Portland,t5_2qi2i,129929,public,default,Metro to study MAX tunnel. Extremely unlikely but I appreciate them thinking big.,0,1561943781,https://www.oregonmetro.gov/public-projects/max-tunnel-study,all_ads,6,,,,,,,,,,,,,,
[],toloveboyz,,[],,text,t2_40e8tz6,False,False,False,1561856231,google.com,https://www.reddit.com/r/Portland/comments/c771lt/oregon_photojournalist_andy_ngo_attacked_by/,{},c771lt,True,False,False,False,True,False,False,,[],dark,text,False,False,True,1,0,False,all_ads,/r/Portland/comments/c771lt/oregon_photojournalist_andy_ngo_attacked_by/,False,6,1561856232,1,,True,False,False,Portland,t5_2qi2i,129928,public,default,Oregon photojournalist Andy Ngo attacked by black-masked antifa activists,0,1561942618,https://www.google.com/amp/amp.washingtontimes.com/news/2019/jun/29/andy-ngo-beaten-up-by-antifa-activists-at-portland/,all_ads,6,,,,,,,,,,,,,,
[],sparkysko,,[],Hillsboro,text,t2_2untn,False,False,False,1561856225,twitter.com,https://www.reddit.com/r/Portland/comments/c771kq/portlandpolice_twitter_police_have_received/,{},c771kq,True,False,False,False,True,False,False,,[],dark,text,False,False,True,78,0,False,all_ads,/r/Portland/comments/c771kq/portlandpolice_twitter_police_have_received/,False,6,1561856227,10,,True,False,False,Portland,t5_2qi2i,129928,public,https://b.thumbs.redditmedia.com/fF0EISz5z5fju3g2gfmpE9YOWkOv9yHsjM_Bpnvm5eA.jpg,"@PortlandPolice Twitter: ""Police have received information that some of the milkshakes thrown today during the demonstration contained quick-drying cement. We are encouraging anyone hit with a substance today to report it to police.""",0,1561942605,https://twitter.com/PortlandPolice/status/1145106839618502656,all_ads,6,,dark,,,link,"{'enabled': False, 'images': [{'id': 'MWIvctNTW_aqiPctoGBU7Qg2HGPMh5pdO6eDOxh_kP4', 'resolutions': [{'height': 108, 'url': 'https://external-preview.redd.it/gwHaZxyKgURqq3ejPSL1JQc6GNLuvcw3nciRBuxDHF4.jpg?width=108&amp;crop=smart&amp;auto=webp&amp;s=1f151b1452d36d040c27dbf34295c526c73963fd', 'width': 108}, {'height': 216, 'url': 'https://external-preview.redd.it/gwHaZxyKgURqq3ejPSL1JQc6GNLuvcw3nciRBuxDHF4.jpg?width=216&amp;crop=smart&amp;auto=webp&amp;s=01fb75134f7bc09763d4bc4178ea024f258dddd0', 'width': 216}, {'height': 320, 'url': 'https://external-preview.redd.it/gwHaZxyKgURqq3ejPSL1JQc6GNLuvcw3nciRBuxDHF4.jpg?width=320&amp;crop=smart&amp;auto=webp&amp;s=f7f93662a5d233e8c945a24bb01e25a37a8f1cf2', 'width': 320}], 'source': {'height': 400, 'url': 'https://external-preview.redd.it/gwHaZxyKgURqq3ejPSL1JQc6GNLuvcw3nciRBuxDHF4.jpg?auto=webp&amp;s=f00881a1d11f5557015b8477cd250fde962736df', 'width': 400}, 'variants': {}}]}",140.0,140.0,,,,,,
[],tildespamzor,,[],,text,t2_fjvez,False,False,False,1561855874,self.Portland,https://www.reddit.com/r/Portland/comments/c76zig/what_are_some_good_portlandarea/,{},c76zig,True,False,False,False,True,True,False,,[],dark,text,False,False,True,7,0,False,all_ads,/r/Portland/comments/c76zig/what_are_some_good_portlandarea/,False,6,1561855875,0,"I've moved to the Portland/Vancouver area not too long ago, and I'm looking for some accounts to follow on social media. I'm looking to try to keep up to date on the goings-on around here, connect with local folks (nerds especially), find events to attend, and generally try to integrate into the community a bit more than I've done so far (I've had very limited success on account of being a pretty staunch introvert, but I'm trying to change that!)

I'd love to hear you guys's suggestions for accounts, pages, and groups to follow on Twitter, Facebook, or elsewhere. Or generally, anything else you think I ought to know about around here! 

I'll tell you a little about me in case it helps, but please feel free to leave more general suggestions in the comments as well, in case others who aren't like me find this post in the future. :-) 

---

**About me**

Hi! I'm Tim - I'm a huge nerd, with a dark and inappropriate sense of humor. I love anything that has to do with computers, or science. 

I'm a software architect &amp; developer. I've also written five books about software development. I run a small consulting company, and two charities ([this one](http://precipice.foundation/), and [this one](http://virtualretirement.foundation/)). They're both low-budget (&lt;$30k/yr) small charities, and I'm shite at marketing and getting donations, so gave up on that and I'm pretty much funding them entirely myself, but that's okay - I don't have a lot of free time anyway, so it's probably for the best. :-P 

I enjoy gaming, especially VR gaming! I had my house custom-built with a VR gaming ""holodeck"" room so I can have a dedicated space for VR gaming, which is super fun! I also recently bought a Tesla Model X, so I've been really enjoying going on short little day-long road trips around the Pacific NorthWest, like along the Lewis and Clark Scenic byway (which is absolutely breathtaking).

---

Thanks for reading, and thank you for any suggestions you might have for me! :-)",True,False,False,Portland,t5_2qi2i,129928,public,self,"What are some good Portland-area accounts/pages/groups to follow on Twitter/Facebook? (people, businesses, government)",0,1561942250,https://www.reddit.com/r/Portland/comments/c76zig/what_are_some_good_portlandarea/,all_ads,6,,,,,,,,,,,,,,
[],LAfeels,,[],,text,t2_fmt67,False,False,False,1561853657,kgw.com,https://www.reddit.com/r/Portland/comments/c76mjr/licenses_for_undocumented_immigrants_passes/,{},c76mjr,True,False,False,False,True,False,False,,[],dark,text,False,False,True,92,0,False,all_ads,/r/Portland/comments/c76mjr/licenses_for_undocumented_immigrants_passes/,False,6,1561853658,47,,True,False,False,Portland,t5_2qi2i,129923,public,default,"Licenses for undocumented immigrants passes Oregon Senate, heads to governor's desk",0,1561940035,https://www.kgw.com/article/news/politics/licenses-for-undocumented-immigrants-passes-oregon-senate-heads-to-governors-desk/283-e1de4b96-0ee5-45d9-9a06-51fb1ab3b318,all_ads,6,,,local-news,Local News,,,,,,,,,,
[],mnmbug26,,[],,text,t2_12fi4s7t,False,False,False,1561852842,self.Portland,https://www.reddit.com/r/Portland/comments/c76hhf/fourth_of_july_party/,{},c76hhf,True,False,False,False,True,True,False,,[],dark,text,False,False,True,13,0,False,all_ads,/r/Portland/comments/c76hhf/fourth_of_july_party/,False,6,1561852843,0,Does anyone know any fun bars to go to on the Fourth of July? My friends and I are looking for a place to go at night! Would love suggestions,True,False,False,Portland,t5_2qi2i,129921,public,self,Fourth of July party,0,1561939231,https://www.reddit.com/r/Portland/comments/c76hhf/fourth_of_july_party/,all_ads,6,,,,,,,,,,,,,,
[],Front_Cartoonist,,[],,text,t2_40zztbd7,False,False,False,1561851999,self.Portland,https://www.reddit.com/r/Portland/comments/c76c71/i_hate_flying_into_your_city_for_work/,{},c76c71,True,False,False,False,True,True,False,,[],dark,text,False,False,True,0,0,False,all_ads,/r/Portland/comments/c76c71/i_hate_flying_into_your_city_for_work/,False,6,1561852000,1,"You people are pathetic

&amp;#x200B;

 [https://twitter.com/Jimryan015/status/1145067852375851008?s=09](https://twitter.com/Jimryan015/status/1145067852375851008?s=09)",True,False,False,Portland,t5_2qi2i,129921,public,self,I hate flying into your city for work,0,1561938379,https://www.reddit.com/r/Portland/comments/c76c71/i_hate_flying_into_your_city_for_work/,all_ads,6,,,,,,,,,,,,,,
[],Tubbagunts,,[],,text,t2_407c8lwt,False,False,False,1561851007,koin.com,https://www.reddit.com/r/Portland/comments/c7663w/groups_clash_ppb_closes_pioneer_courthouse_square/,{},c7663w,False,False,False,False,False,False,False,,[],dark,text,False,False,True,10,0,False,all_ads,/r/Portland/comments/c7663w/groups_clash_ppb_closes_pioneer_courthouse_square/,False,6,1561851008,11,,False,False,False,Portland,t5_2qi2i,129918,public,default,"Groups clash, PPB closes Pioneer Courthouse Square",0,1561937388,https://www.koin.com/news/civic-affairs/opposing-groups-to-protest-in-portland-this-saturday/,all_ads,6,,,,,,,,,,,,,,
[],pool-bully,,[],,text,t2_lmof2d7,False,False,False,1561850357,self.Portland,https://www.reddit.com/r/Portland/comments/c76222/looking_for_a_specific_location_for_a_photo/,{},c76222,True,False,False,False,True,True,False,,[],dark,text,False,False,True,5,0,False,all_ads,/r/Portland/comments/c76222/looking_for_a_specific_location_for_a_photo/,False,6,1561850359,0,"Looking for any type of lot, parking lot/ gravel lot/ field/ etc. where I can drive a car up and overlook the river, preferably on the east side but I'll take all recomendations!",True,False,False,Portland,t5_2qi2i,129917,public,self,Looking for a specific location for a photo,0,1561936744,https://www.reddit.com/r/Portland/comments/c76222/looking_for_a_specific_location_for_a_photo/,all_ads,6,,,,,,,,,,,,,,
[],djkeone,,[],,text,t2_ensal,False,False,False,1561849682,self.Portland,https://www.reddit.com/r/Portland/comments/c75xn3/i_have_2_free_tickets_to_elo_at_the_moda_center/,{},c75xn3,True,False,False,False,True,True,False,,[],dark,text,False,False,True,7,0,False,all_ads,/r/Portland/comments/c75xn3/i_have_2_free_tickets_to_elo_at_the_moda_center/,False,6,1561849683,37,I have 2 comp tickets to the concert tonight. The only catch is you need to come pick me them up in Gresham. Send me a pm if you’re interested. First come first serve.,True,False,False,Portland,t5_2qi2i,129916,public,self,I have 2 free tickets to ELO at the Moda Center tonight,0,1561936061,https://www.reddit.com/r/Portland/comments/c75xn3/i_have_2_free_tickets_to_elo_at_the_moda_center/,all_ads,6,,,,,,,,,,,,,,
[],OHNOcomtage,,[],,text,t2_yen1mnw,False,False,False,1561849455,i.redd.it,https://www.reddit.com/r/Portland/comments/c75w7x/from_the_standard_two_days_ago/,{},c75w7x,True,False,False,True,True,False,False,,[],dark,text,False,False,True,0,0,False,all_ads,/r/Portland/comments/c75w7x/from_the_standard_two_days_ago/,False,6,1561849456,25,,True,False,False,Portland,t5_2qi2i,129916,public,default,"From the standard, two days ago.",0,1561935839,https://i.redd.it/wxkqinesmd731.jpg,all_ads,6,,,,,,,,,,,,,,
[],Ign0ranceIzBliss,,[],,text,t2_dxhwoo3,False,False,False,1561848783,self.Portland,https://www.reddit.com/r/Portland/comments/c75rsw/what_are_your_roommate_success_and_fail_stories/,{},c75rsw,True,False,False,False,True,True,False,,[],dark,text,False,False,True,1,0,False,all_ads,/r/Portland/comments/c75rsw/what_are_your_roommate_success_and_fail_stories/,False,6,1561848784,2,Need to move out of my current (well priced) living situation soon and can’t stomach the price of owning or renting. Non of my immediate friends are in need of a roommate so I’m contemplating finding someone new. Thoughts? Suggestions?,True,False,False,Portland,t5_2qi2i,129916,public,self,What are your roommate success and fail stories?,0,1561935170,https://www.reddit.com/r/Portland/comments/c75rsw/what_are_your_roommate_success_and_fail_stories/,all_ads,6,,,,,,,,,,,,,,
[],GPUCrashMan,,[],,text,t2_3vfe9grl,False,False,False,1561847714,twitter.com,https://www.reddit.com/r/Portland/comments/c75l2q/antifa_assault_a_journalist/,{},c75l2q,True,False,False,False,True,False,False,,[],dark,text,False,False,True,19,0,False,all_ads,/r/Portland/comments/c75l2q/antifa_assault_a_journalist/,False,6,1561847714,0,,True,False,False,Portland,t5_2qi2i,129915,public,https://a.thumbs.redditmedia.com/CF8hy2e9795h27czlLibk1q0B8lfB-neLyf2Wjg3LH8.jpg,Antifa assault a journalist.,0,1561934095,https://twitter.com/mrandyngo/status/1145068311048101888?s=21,all_ads,6,,,,,link,"{'enabled': False, 'images': [{'id': 'Tvlg54TTtBmESumvGWoJ5C6fkvTIZNM4tVKsFiDXW9o', 'resolutions': [{'height': 108, 'url': 'https://external-preview.redd.it/LJ_ucea-ZUllHkqb7Rd4CLGr5ktpjqqDzKsExM8B-dA.jpg?width=108&amp;crop=smart&amp;auto=webp&amp;s=720596373dadfdef2111a413f64d91cc0d3c2629', 'width': 108}, {'height': 216, 'url': 'https://external-preview.redd.it/LJ_ucea-ZUllHkqb7Rd4CLGr5ktpjqqDzKsExM8B-dA.jpg?width=216&amp;crop=smart&amp;auto=webp&amp;s=feec7fd83392e015a8e9560e74beed0226b2baa7', 'width': 216}, {'height': 320, 'url': 'https://external-preview.redd.it/LJ_ucea-ZUllHkqb7Rd4CLGr5ktpjqqDzKsExM8B-dA.jpg?width=320&amp;crop=smart&amp;auto=webp&amp;s=d7f15d6e228b565c445bc7a124fc23e96c968f0c', 'width': 320}], 'source': {'height': 400, 'url': 'https://external-preview.redd.it/LJ_ucea-ZUllHkqb7Rd4CLGr5ktpjqqDzKsExM8B-dA.jpg?auto=webp&amp;s=91d5d511fb505db6ec71dc39b0ccdd815ca13574', 'width': 400}, 'variants': {}}]}",140.0,140.0,,,,,,
[],lacus-rebip,,[],,text,t2_oj24ca5,False,False,False,1561847649,self.Portland,https://www.reddit.com/r/Portland/comments/c75kmt/multnomah_county_library_system_benefits/,{'gid_2': 1},c75kmt,True,False,False,False,True,True,False,,[],dark,text,False,False,True,65,0,False,all_ads,/r/Portland/comments/c75kmt/multnomah_county_library_system_benefits/,False,6,1561847650,441,"I've had a library card for years, and just realized that MyDiscoveryPass is a thing, and figured there are other free things the library gives us that I wasn't using, so compiled a list of the things I could find, feel free to send me any others and I'll add them.

——

• [Hoopla](https://www.hoopladigital.com/) — Hoopla is a collection of streaming videos, comics, and music available instantly, with automatic returns and no late fees. **Limited to 10 items a month, resets on the first of each month.**

• [Kanopy](https://multcolib.org/resource/kanopy) — Kanopy is a collection of streaming videos with a focus on classic, documentary, and independent film available instantly, with automatic returns and no late fees. **Limited to 6 items a month, resets on the first of each month.**

• [MyDiscoveryPass](https://multcolib.org/how-it-works-my-discovery-pass) — Visit local museums and cultural institutions for free with My Discovery Pass. **You may reserve 1 pass per institution per year, and can reserve up to 2 passes at one time.**

• [OverDrive](https://multcolib.org/resource/overdrive) and Libby — OverDrive is a collection of e-books and digital audiobooks offered by the library. The e-books and audiobooks can be downloaded to your computer, e-reader (including Kindle) or other device. Libby is OverDrive's new app. 

• [Lynda.com](https://multcolib.org/resource/lyndacom) — Lynda.com is an online learning platform with courses in business, software, technology, and creative skills.

• [Mango Languages](https://multcolib.org/resource/mango-languages) — Learn over 40 languages, including Arabic, Spanish, Mandarin, Cantonese, French, Italian, Vietnamese, German, Russian, Swahili and many more.


• [Library Music Project](https://librarymusicproject.com/) — Music streaming from the library I guess? 

• [RB Digital](https://multcolib.org/resource/rbdigital) — RBdigital is a collection of current digital magazines offered by the library.  Magazines are always available -- no holds, no checkout limits, and no loan periods -- once you check it out, it’s yours to keep.

• [TumbleBook Library](https://multcolib.org/resource/tumblebook-library) — Has Story Books: a selection of children's favorite story books, and Language Learning: a growing selection of books in Spanish and French. Many are bilingual titles which allow the user to read the book in two languages

——

Also, here's your reminder that if you live in Multnomah, Clackamas, or Washington Counties you can get library cards from the other two (which come with more benefit type things!)",True,False,False,Portland,t5_2qi2i,129915,public,self,"Multnomah County Library System ""Benefits""",0,1561934037,https://www.reddit.com/r/Portland/comments/c75kmt/multnomah_county_library_system_benefits/,all_ads,6,,,,,,,,,1.0,,,,,
[],pdxmetroarea,,[],,text,t2_y947b,False,False,False,1561847302,oregonlive.com,https://www.reddit.com/r/Portland/comments/c75iaa/portland_antifaright_wing_protests_now_civil/,{},c75iaa,True,False,False,False,True,False,False,,[],dark,text,False,False,True,673,0,False,all_ads,/r/Portland/comments/c75iaa/portland_antifaright_wing_protests_now_civil/,False,6,1561847304,146,,True,False,False,Portland,t5_2qi2i,129915,public,https://b.thumbs.redditmedia.com/O04t89N2qcnN5D55TM6F23TybLLBcrnGt52p24JcCEI.jpg,Portland antifa/right wing protests now ‘civil disturbance’; police order people to disperse: LIVE UPDATES,0,1561933683,https://www.oregonlive.com/portland/2019/06/proud-boys-antifa-plan-to-protest-in-downtown-portland-on-saturday.html,all_ads,6,,,local-news,Local News,link,"{'enabled': False, 'images': [{'id': '9rK8u9WYwauJguAVQNDsO9Lt7CYj64HeLcGhfTFdrns', 'resolutions': [{'height': 72, 'url': 'https://external-preview.redd.it/iGI-QaLNj-jmqrqj-UytkV9CQFuPJtU5QdRsdQh5lKY.jpg?width=108&amp;crop=smart&amp;auto=webp&amp;s=58efd1840eb8b025d329aab2f505703af0764db8', 'width': 108}, {'height': 144, 'url': 'https://external-preview.redd.it/iGI-QaLNj-jmqrqj-UytkV9CQFuPJtU5QdRsdQh5lKY.jpg?width=216&amp;crop=smart&amp;auto=webp&amp;s=958b4d0996f7094308576ebb18831ed42e0a46d1', 'width': 216}, {'height': 213, 'url': 'https://external-preview.redd.it/iGI-QaLNj-jmqrqj-UytkV9CQFuPJtU5QdRsdQh5lKY.jpg?width=320&amp;crop=smart&amp;auto=webp&amp;s=f6b8b08e4177cedfe9fde67d2daff98f7e25b884', 'width': 320}, {'height': 426, 'url': 'https://external-preview.redd.it/iGI-QaLNj-jmqrqj-UytkV9CQFuPJtU5QdRsdQh5lKY.jpg?width=640&amp;crop=smart&amp;auto=webp&amp;s=c35e72cfa1fa26112fc807eae58ec92e3826dc44', 'width': 640}, {'height': 640, 'url': 'https://external-preview.redd.it/iGI-QaLNj-jmqrqj-UytkV9CQFuPJtU5QdRsdQh5lKY.jpg?width=960&amp;crop=smart&amp;auto=webp&amp;s=0b4f0e50214530daa32f46ce59a31c0e3e05dc92', 'width': 960}, {'height': 720, 'url': 'https://external-preview.redd.it/iGI-QaLNj-jmqrqj-UytkV9CQFuPJtU5QdRsdQh5lKY.jpg?width=1080&amp;crop=smart&amp;auto=webp&amp;s=892dff859172babd8a610cd2f31e13985e473baa', 'width': 1080}], 'source': {'height': 800, 'url': 'https://external-preview.redd.it/iGI-QaLNj-jmqrqj-UytkV9CQFuPJtU5QdRsdQh5lKY.jpg?auto=webp&amp;s=9f18ad07985bff267d5187d34c71d0a9f3dd09b9', 'width': 1200}, 'variants': {}}]}",93.0,140.0,,,,,,
[],hedonist69420,,[],,text,t2_pva5x1c,False,False,False,1561847268,i.redd.it,https://www.reddit.com/r/Portland/comments/c75i2d/stunning_brunette_with_aquamarine_purse_strap_at/,{},c75i2d,True,False,False,True,True,False,False,,[],dark,text,False,False,True,8,0,False,all_ads,/r/Portland/comments/c75i2d/stunning_brunette_with_aquamarine_purse_strap_at/,False,6,1561847269,0,,True,False,False,Portland,t5_2qi2i,129915,public,default,Stunning brunette with aquamarine purse strap at PIB..I gave you and your friends my extra tickets...May we meet to get to know each other?,0,1561933648,https://i.redd.it/tyb1xveagd731.jpg,all_ads,6,,,,,,,,,,,,,,
[],Squigglefits,,[],,text,t2_15cglh,False,False,False,1561845904,self.Portland,https://www.reddit.com/r/Portland/comments/c759cq/how_tight_is_security_for_oregon_zoo_concerts/,{},c759cq,True,False,False,False,True,True,False,,[],dark,text,False,False,True,14,0,False,all_ads,/r/Portland/comments/c759cq/how_tight_is_security_for_oregon_zoo_concerts/,False,6,1561845905,0,,True,False,False,Portland,t5_2qi2i,129911,public,self,How tight is security for Oregon zoo concerts? Just thinking about bringing a flask in.,0,1561932287,https://www.reddit.com/r/Portland/comments/c759cq/how_tight_is_security_for_oregon_zoo_concerts/,all_ads,6,,,,,,,,,,,,,,
[],urbanlife78,,[],,text,t2_10m11d,False,False,False,1561845838,i.imgur.com,https://www.reddit.com/r/Portland/comments/c758tv/the_portland_indie_con_2019_is_going_on_right_now/,{},c758tv,True,False,False,False,True,False,False,,[],dark,text,False,False,True,2,0,False,all_ads,/r/Portland/comments/c758tv/the_portland_indie_con_2019_is_going_on_right_now/,False,6,1561845839,43,,True,False,False,Portland,t5_2qi2i,129911,public,https://b.thumbs.redditmedia.com/orNYqy8XCyZFw11zTQQYWm8jhfCOMl5j4F7Xy84dqyE.jpg,"The Portland Indie Con 2019 is going on right now, it's a great collection of local comic artists.",0,1561932216,https://i.imgur.com/CwqmumS.jpg,all_ads,6,,,photo,Photo,image,"{'enabled': True, 'images': [{'id': 'uXraCuKD6ZfNRSZOxhs9Cwew-ju0ib0y6Bdb1MiMaPE', 'resolutions': [{'height': 128, 'url': 'https://external-preview.redd.it/RQWZxmyLrtEUtFNvqsmDxnIbfXs64pHOEcUkxZMdvbc.jpg?width=108&amp;crop=smart&amp;auto=webp&amp;s=1c20f5a6d157b1779d6d682c4a30d49efa93884a', 'width': 108}, {'height': 257, 'url': 'https://external-preview.redd.it/RQWZxmyLrtEUtFNvqsmDxnIbfXs64pHOEcUkxZMdvbc.jpg?width=216&amp;crop=smart&amp;auto=webp&amp;s=afcaa6c18b46c6b2fbd810904a39069141d9ad9a', 'width': 216}, {'height': 381, 'url': 'https://external-preview.redd.it/RQWZxmyLrtEUtFNvqsmDxnIbfXs64pHOEcUkxZMdvbc.jpg?width=320&amp;crop=smart&amp;auto=webp&amp;s=ca4c3efeb84a8900f7a3c2fadef89ea0d2ba76db', 'width': 320}, {'height': 763, 'url': 'https://external-preview.redd.it/RQWZxmyLrtEUtFNvqsmDxnIbfXs64pHOEcUkxZMdvbc.jpg?width=640&amp;crop=smart&amp;auto=webp&amp;s=487f1a8821e0e8be4f6cdcf395603b37b3fea599', 'width': 640}, {'height': 1145, 'url': 'https://external-preview.redd.it/RQWZxmyLrtEUtFNvqsmDxnIbfXs64pHOEcUkxZMdvbc.jpg?width=960&amp;crop=smart&amp;auto=webp&amp;s=75615664b54103d01be678df1999518580bd5aca', 'width': 960}, {'height': 1288, 'url': 'https://external-preview.redd.it/RQWZxmyLrtEUtFNvqsmDxnIbfXs64pHOEcUkxZMdvbc.jpg?width=1080&amp;crop=smart&amp;auto=webp&amp;s=92199e26b3c8d6b72bb1b5f5c686e12f77bb1224', 'width': 1080}], 'source': {'height': 2048, 'url': 'https://external-preview.redd.it/RQWZxmyLrtEUtFNvqsmDxnIbfXs64pHOEcUkxZMdvbc.jpg?auto=webp&amp;s=b30545081af20eee46c5474a870ae4eb50f49567', 'width': 1717}, 'variants': {}}]}",140.0,140.0,,,,,,
