author,author_created_utc,author_flair_css_class,author_flair_text,author_fullname,created_utc,domain,full_link,gilded,id,is_self,locked,media_embed,num_comments,over_18,permalink,retrieved_on,score,secure_media_embed,selftext,stickied,subreddit,subreddit_id,thumbnail,title,url,edited,post_hint,preview,banned_by,media,secure_media
hollishillis,1289616577.0,,,t2_4in5r,1451073587,self.Portland,https://www.reddit.com/r/Portland/comments/3y7khx/the_revenant_showings_in_pdx/,0,3y7khx,True,False,{},18,False,/r/Portland/comments/3y7khx/the_revenant_showings_in_pdx/,1454952302,18,{},Anyone know of any?,False,Portland,t5_2qi2i,self,The Revenant - Showings in PDX?,https://www.reddit.com/r/Portland/comments/3y7khx/the_revenant_showings_in_pdx/,,,,,,
shulamit,1441912625.0,,,t2_qc9o0,1451066222,koin.com,https://www.reddit.com/r/Portland/comments/3y772a/beaverton_woman_left_at_hospital_as_infant_gets/,0,3y772a,False,False,{},0,False,/r/Portland/comments/3y772a/beaverton_woman_left_at_hospital_as_infant_gets/,1454952128,1,{},,False,Portland,t5_2qi2i,default,Beaverton woman left at hospital as infant gets answers 44 years later,http://koin.com/2015/12/25/baby-jane-gets-christmas-miracle-after-44-years/,,,,,,
QuantumRealism,,,Downtown,,1451065011,self.Portland,https://www.reddit.com/r/Portland/comments/3y74xi/ham_bone/,1,3y74xi,True,False,{},25,False,/r/Portland/comments/3y74xi/ham_bone/,1454952099,44,{},"Who here is eating Ham today, or had one last night?   Free the bone from it and contact me, someone on a bike will come pick it up and bring it here so I can turn it into soup.

We will be out tomorrow serving to our rough sleepers, downtown and inner SE.

Edit: keep it to yourself you we beating your Ham today.  Hilarious mistake fixed begrudgingly.",False,Portland,t5_2qi2i,self,Ham Bone,https://www.reddit.com/r/Portland/comments/3y74xi/ham_bone/,1451067434.0,,,,,
rabbot3,1446249118.0,,,t2_rlt08,1451060267,imgur.com,https://www.reddit.com/r/Portland/comments/3y6wmc/merry_christmas_portland/,0,3y6wmc,False,False,{},6,False,/r/Portland/comments/3y6wmc/merry_christmas_portland/,1454951992,8,{},,False,Portland,t5_2qi2i,http://a.thumbs.redditmedia.com/WSdc1I1N401TgH954szkfN4McfETae5ahJSWHBmYpX8.jpg,Merry Christmas Portland!,http://imgur.com/Yc1shMq,,link,"{'images': [{'id': '2bMjD8LtgpjFbSrG9C2lnUAosnEhdToOGRg4bjOdS1Y', 'resolutions': [{'height': 60, 'url': 'https://i.redditmedia.com/eCYzMV0FC-Cks6VrYIn3yxlQ1DHBfwJhlHfju_m2AbE.jpg?fit=crop&amp;crop=faces%2Centropy&amp;arh=2&amp;w=108&amp;s=ad50e5faa257c40b8d2cc8f73cb3a090', 'width': 108}, {'height': 121, 'url': 'https://i.redditmedia.com/eCYzMV0FC-Cks6VrYIn3yxlQ1DHBfwJhlHfju_m2AbE.jpg?fit=crop&amp;crop=faces%2Centropy&amp;arh=2&amp;w=216&amp;s=eee32a89d460fc745aeb7fe79425c19c', 'width': 216}, {'height': 180, 'url': 'https://i.redditmedia.com/eCYzMV0FC-Cks6VrYIn3yxlQ1DHBfwJhlHfju_m2AbE.jpg?fit=crop&amp;crop=faces%2Centropy&amp;arh=2&amp;w=320&amp;s=9a428414f5aeea1025c10d5886cbb067', 'width': 320}, {'height': 360, 'url': 'https://i.redditmedia.com/eCYzMV0FC-Cks6VrYIn3yxlQ1DHBfwJhlHfju_m2AbE.jpg?fit=crop&amp;crop=faces%2Centropy&amp;arh=2&amp;w=640&amp;s=1c8468084a695d3d583af4dc4cd9f98f', 'width': 640}, {'height': 540, 'url': 'https://i.redditmedia.com/eCYzMV0FC-Cks6VrYIn3yxlQ1DHBfwJhlHfju_m2AbE.jpg?fit=crop&amp;crop=faces%2Centropy&amp;arh=2&amp;w=960&amp;s=e6508c7287bc5ea54b276cf7eaf8d257', 'width': 960}, {'height': 607, 'url': 'https://i.redditmedia.com/eCYzMV0FC-Cks6VrYIn3yxlQ1DHBfwJhlHfju_m2AbE.jpg?fit=crop&amp;crop=faces%2Centropy&amp;arh=2&amp;w=1080&amp;s=e2ec2bccb3e977592ce48b541b0a747c', 'width': 1080}], 'source': {'height': 2988, 'url': 'https://i.redditmedia.com/eCYzMV0FC-Cks6VrYIn3yxlQ1DHBfwJhlHfju_m2AbE.jpg?s=a1935394fe92f1fc3eead1df83ef993c', 'width': 5312}, 'variants': {}}]}",,,
[deleted],,,,,1451058504,self.Portland,https://www.reddit.com/r/Portland/comments/3y6tyn/unofficial_christmas_rant_thread/,0,3y6tyn,True,False,{},256,False,/r/Portland/comments/3y6tyn/unofficial_christmas_rant_thread/,1454951958,34,{},BAH HUMBUG,False,Portland,t5_2qi2i,self,UNOFFICIAL CHRISTMAS RANT THREAD,https://www.reddit.com/r/Portland/comments/3y6tyn/unofficial_christmas_rant_thread/,,,,,,
stonedforsatan,1388431603.0,,,t2_ektdm,1451040318,self.Portland,https://www.reddit.com/r/Portland/comments/3y68nc/bus_or_train_to_snow_park/,0,3y68nc,True,False,{},17,False,/r/Portland/comments/3y68nc/bus_or_train_to_snow_park/,1454951612,0,{},Are there any buses or trains that go to any snow parks from portland? I'd really like to smoke a joint in the snow but I really don't have the car required to get to any snow.,False,Portland,t5_2qi2i,self,Bus or Train to Snow park,https://www.reddit.com/r/Portland/comments/3y68nc/bus_or_train_to_snow_park/,,,,,,
Joan_Wayne_Gacy,1439103162.0,,Brooklyn,t2_peycr,1451030619,self.Portland,https://www.reddit.com/r/Portland/comments/3y5ydl/welcome_to_the_rportland_best_of_2015_awards/,0,3y5ydl,True,False,{},41,False,/r/Portland/comments/3y5ydl/welcome_to_the_rportland_best_of_2015_awards/,1454951477,12,{},"r/Portland is participating in Reddit's Best of 2015 Awards this year!

The Best of Awards are meant to be a lighthearted way of celebrating those that have provided/created the contents on Reddit that make Reddit the fabulous place it is in the year 2015. 

[If you are unfamiliar with the BoAs please read this](https://www.reddit.com/r/bestof2015)

What this means to us as a local subreddit is that we are wanting to celebrate those that have created and/or submitted the contents that made us go ""wow."" 

## How This Werks

This thread is in contest mode.  Each category will be posted here as a comment. 

* To nominate a thread or comment, reply to each category comment **as a reply**. AS A LINK

*  Each reply to the category that has the **most upvotes will be a winner**. 
We urge everyone to upvote what they want to win, and to downvote what they do not want to win.

**Voting ends the 30th.**

All comments about questions and concerns will be removed - mod mail us. Clutter only makes distinguishing the winner more difficult. 

**THE CATEGORIES**

* BEST SELF POST

This award is for the person who submitted the most thought-provoking self post. Perhaps they didn't. Perhaps this is for a shit post? It's up to you to decide!

* BEST PHOTO SUBMISSION

Loved a photo? Did it stick in your memory? If so then submit it here! 

* BIGGEST NEWS STORY

Need more explanation? This is for the biggest story of Portland, and r/Portland that rocked your world. 

* BEST COMMENT

This award is for the best comment posted in this subreddit. DO NOT elect yourself. This award is for the sickest burn, the harshest reality check, or just the straight up funniest shit you ever saw. This is for the comment that made an impact. Choose wisely! 

* FAN FAVORITE USER OF R/PORTLAND

This award is for your fave user. Any user. Who do you like? Who makes comments that move you, scorn you, or jostle your loins? Who is this person? We want to know! 


Each winner will be granted 1-2 months of Reddit Gold (the admins are famously unclear about that)

**YOU MUST submit a link to what you are nominating!**

",False,Portland,t5_2qi2i,self,Welcome to the r/Portland Best of 2015 Awards!!,https://www.reddit.com/r/Portland/comments/3y5ydl/welcome_to_the_rportland_best_of_2015_awards/,1451093896.0,,,,,
[deleted],,,,,1451026544,self.Portland,https://www.reddit.com/r/Portland/comments/3y5t3j/anyone_ever_been_to_midnight_mass_at_the_grotto/,0,3y5t3j,True,False,{},0,False,/r/Portland/comments/3y5t3j/anyone_ever_been_to_midnight_mass_at_the_grotto/,1454951409,3,{},[deleted],False,Portland,t5_2qi2i,default,anyone ever been to midnight mass at the Grotto?,https://www.reddit.com/r/Portland/comments/3y5t3j/anyone_ever_been_to_midnight_mass_at_the_grotto/,,,,,,
geomod,1296180546.0,,,t2_4rwjr,1451024393,self.Portland,https://www.reddit.com/r/Portland/comments/3y5q85/11_gunshots_near_six_corners/,0,3y5q85,True,False,{},11,False,/r/Portland/comments/3y5q85/11_gunshots_near_six_corners/,1454951372,5,{},Anyone else just hear that?,False,Portland,t5_2qi2i,self,11 Gunshots near six corners,https://www.reddit.com/r/Portland/comments/3y5q85/11_gunshots_near_six_corners/,,,,,,
redskyblueheart,1408114016.0,,,t2_hw4jp,1451023815,self.Portland,https://www.reddit.com/r/Portland/comments/3y5pgn/i_have_a_visitor_tomorrow_that_i_need_a_present/,0,3y5pgn,True,False,{},19,False,/r/Portland/comments/3y5pgn/i_have_a_visitor_tomorrow_that_i_need_a_present/,1454951362,0,{},We invited my brothers gf over and we need to find her a gift!,False,Portland,t5_2qi2i,self,"I have a visitor tomorrow that I need a present for, what's open?",https://www.reddit.com/r/Portland/comments/3y5pgn/i_have_a_visitor_tomorrow_that_i_need_a_present/,,,,,,
markevens,1276741897.0,,Hollywood,t2_44hc8,1451023076,kgw.com,https://www.reddit.com/r/Portland/comments/3y5odd/search_for_alissa_mccrann_being_suspended/,0,3y5odd,False,False,{},6,False,/r/Portland/comments/3y5odd/search_for_alissa_mccrann_being_suspended/,1454951349,32,{},,False,Portland,t5_2qi2i,default,Search for Alissa McCrann being suspended. Conditions too dangerous and new snow covering any signs of her.,http://www.kgw.com/news/missing-portland-woman-sought-by-police/7342607,,,,,,
In-League-With,1352542303.0,,,t2_9k8jr,1451015697,self.Portland,https://www.reddit.com/r/Portland/comments/3y5djd/where_can_i_go_to_grab_a_pint_tonight/,0,3y5djd,True,False,{},12,False,/r/Portland/comments/3y5djd/where_can_i_go_to_grab_a_pint_tonight/,1454951207,0,{},"Because it's Christmas eve,  not a creature is stirring in my house (not even a mouse) and.... I decided against traveling to see family this year.  

Know of any bars that are open? Shit, maybe you'd appreciate (another) guy with a beard joining you.",False,Portland,t5_2qi2i,self,Where can I go to grab a pint tonight?,https://www.reddit.com/r/Portland/comments/3y5djd/where_can_i_go_to_grab_a_pint_tonight/,,,,,,
tiamdi,1380281076.0,,,t2_daw67,1451013676,self.Portland,https://www.reddit.com/r/Portland/comments/3y5ajr/psa_for_those_going_south/,0,3y5ajr,True,False,{},7,False,/r/Portland/comments/3y5ajr/psa_for_those_going_south/,1454951169,6,{},I-5 is closed by Seven Feathers due to Suburus Suburuing in bad weather. No ETA.,False,Portland,t5_2qi2i,self,PSA for those going south,https://www.reddit.com/r/Portland/comments/3y5ajr/psa_for_those_going_south/,,,,,,
the_interrobanger,1317770150.0,,Beaumont-Wilshire,t2_5zcuy,1451011137,self.Portland,https://www.reddit.com/r/Portland/comments/3y56v8/mom_andor_dad_rock_looking_for_band_members/,0,3y56v8,True,False,{},40,False,/r/Portland/comments/3y56v8/mom_andor_dad_rock_looking_for_band_members/,1454951121,33,{},"*^Apologies ^in ^advance ^if ^you're ^not ^a ^musician. ^/r/portlandmusic ^has ^nearly ^zero ^audience. ^Bring ^on ^the ^downvotes! ^Um, ^but ^I'd ^appreciate ^if ^you ^didn't. ^Cheers.*

You're thirty-something, or maybe even late twenty-something. You've got a kid or two. Or three. Or maybe most of your friends do. You used to listen to Saves the Day and The Anniversary (or The Get Up Kids, or Piebald, or Hey Mercedes, or Cursive, or The Weakerthans, etc, etc) back in the 90s and 2000s. You probably were in your own shitty band back then too, and maybe even played some shows. Maybe at some point you got married and/or went to school and/or started a career, stopped playing, and maybe got rid of your gear... once or twice (or maybe you kept it around to collect dust for a bit). Now it's a decade and change later (holy shit!) and you're feeling that urge to be playing music again. To be on the stage, in front of a crowd again (or let's be honest, to be in front of 7 of your buddies, including all band members' SOs/parents, and a whole lot of empty chairs). But now you've got a career, and/or a family, so there's no way you're gonna be in a van skipping around the country borderline starving with a bunch of fellow unwashed delinquents, hoping that the club you're headed to will pay you enough to make it to the next place. But you've got some gear, some skill (however rusty it may be), an urge to perform, and a bit of time to set aside to make it happen (call it once a week?).

Hi. You're my people. Let's start making some music. Let's take that music and inflict it on some other people, who might even, despite their better judgement, actually like it. I play guitar. I'm looking for ~~a bassist,~~ a drummer, and someone that can lay down some keys. Any ability to sing would be celebrated, but not required. Dudes and ladies alike are welcome. Maybe you'd like a beer or a bowl while playing. Or not. It's cool. Here's some stuff I've been working on: https://soundcloud.com/thelonggoodnight.

Shoot me a message or reply here if you're interested. Cheers!

**EDIT:** *Thanks for all the feedback and fun conversation, folks. I've got a ton of responses from guitarists and bassists, but I still need a drummer and some keys!*",False,Portland,t5_2qi2i,self,mom and/or dad rock (looking for band members),https://www.reddit.com/r/Portland/comments/3y56v8/mom_andor_dad_rock_looking_for_band_members/,1451417510.0,self,"{'images': [{'id': 'eCfxdyFFlj1TNBRPdYN56Wizotz9MRWn21bBCzS_BZM', 'resolutions': [{'height': 108, 'url': 'https://i.redditmedia.com/JYPEmsKWmsX9aCq0Spv8BDTw0TGRg7mX3asdqvf01aY.jpg?fit=crop&amp;crop=faces%2Centropy&amp;arh=2&amp;w=108&amp;s=b32dc9c6683412e42dce3b12210a5f74', 'width': 108}, {'height': 216, 'url': 'https://i.redditmedia.com/JYPEmsKWmsX9aCq0Spv8BDTw0TGRg7mX3asdqvf01aY.jpg?fit=crop&amp;crop=faces%2Centropy&amp;arh=2&amp;w=216&amp;s=2905f0642e195fd3e867bc19df344853', 'width': 216}, {'height': 320, 'url': 'https://i.redditmedia.com/JYPEmsKWmsX9aCq0Spv8BDTw0TGRg7mX3asdqvf01aY.jpg?fit=crop&amp;crop=faces%2Centropy&amp;arh=2&amp;w=320&amp;s=9b94750240657696f7ecd59eee05bc3a', 'width': 320}], 'source': {'height': 500, 'url': 'https://i.redditmedia.com/JYPEmsKWmsX9aCq0Spv8BDTw0TGRg7mX3asdqvf01aY.jpg?s=349746631b97eb02b483e16edf48c03c', 'width': 500}, 'variants': {}}]}",,,
slimeatk,1439615508.0,,,t2_pkj54,1451008860,self.Portland,https://www.reddit.com/r/Portland/comments/3y53hx/wheres_my_mom/,0,3y53hx,True,False,{},4,False,/r/Portland/comments/3y53hx/wheres_my_mom/,1454951077,0,{},[removed],False,Portland,t5_2qi2i,default,Where's my Mom?,https://www.reddit.com/r/Portland/comments/3y53hx/wheres_my_mom/,,,,,,
OregonFreeman,1366080334.0,,,t2_bbzss,1451006925,imgur.com,https://www.reddit.com/r/Portland/comments/3y50ng/ill_take_it/,0,3y50ng,False,False,{},17,False,/r/Portland/comments/3y50ng/ill_take_it/,1454951041,653,{},,False,Portland,t5_2qi2i,http://a.thumbs.redditmedia.com/XfivhAcolG8gTaulqPHvUdYFWxQW5uICzQjo9m1gMN4.jpg,I'll take it,http://imgur.com/sgdPwsU,,link,"{'images': [{'id': 'hFj8z7ORQAkOlq4Z67SASkncYS5HREcE5e-vnwXAUn0', 'resolutions': [{'height': 108, 'url': 'https://i.redditmedia.com/5SvaIBEk4-5ub8AoxhVMBscIBU-WNFaa78voA7eykTM.jpg?fit=crop&amp;crop=faces%2Centropy&amp;arh=2&amp;w=108&amp;s=9ffb95b2501ef9566d5344898bce8ae8', 'width': 108}, {'height': 216, 'url': 'https://i.redditmedia.com/5SvaIBEk4-5ub8AoxhVMBscIBU-WNFaa78voA7eykTM.jpg?fit=crop&amp;crop=faces%2Centropy&amp;arh=2&amp;w=216&amp;s=d459b3899586622e14591eed24a04950', 'width': 216}, {'height': 320, 'url': 'https://i.redditmedia.com/5SvaIBEk4-5ub8AoxhVMBscIBU-WNFaa78voA7eykTM.jpg?fit=crop&amp;crop=faces%2Centropy&amp;arh=2&amp;w=320&amp;s=23c29d212fdc67149257ae5a0c88480d', 'width': 320}, {'height': 640, 'url': 'https://i.redditmedia.com/5SvaIBEk4-5ub8AoxhVMBscIBU-WNFaa78voA7eykTM.jpg?fit=crop&amp;crop=faces%2Centropy&amp;arh=2&amp;w=640&amp;s=f11d7a48fdf53d7c7c64ddc21ab882fb', 'width': 640}, {'height': 960, 'url': 'https://i.redditmedia.com/5SvaIBEk4-5ub8AoxhVMBscIBU-WNFaa78voA7eykTM.jpg?fit=crop&amp;crop=faces%2Centropy&amp;arh=2&amp;w=960&amp;s=6d760b1b24cf6e66d4b77b5e98a6463f', 'width': 960}], 'source': {'height': 960, 'url': 'https://i.redditmedia.com/5SvaIBEk4-5ub8AoxhVMBscIBU-WNFaa78voA7eykTM.jpg?s=bc4a382556d610892c76e79bc3e7a15b', 'width': 960}, 'variants': {}}]}",,,
runnerselbow,1449710693.0,,,t2_stemc,1451001123,self.Portland,https://www.reddit.com/r/Portland/comments/3y4rbu/police_sheriff_ambulance_fire_truck_at_nw_cornell/,0,3y4rbu,True,False,{},1,False,/r/Portland/comments/3y4rbu/police_sheriff_ambulance_fire_truck_at_nw_cornell/,1454950920,1,{},"Was driving down Cornell at about noon and saw fire brigade, ambulance, about 10 cruisers (sheriff dept and police dept). Road wasn't closed but they were hanging out for a while with traffic crawling by.  Does anyone know what happened?",False,Portland,t5_2qi2i,self,"Police, sheriff, ambulance, fire truck at NW Cornell and 123rd.",https://www.reddit.com/r/Portland/comments/3y4rbu/police_sheriff_ambulance_fire_truck_at_nw_cornell/,,,,,,
ZiFiStriClub,1405975432.0,,,t2_hic73,1450998563,stripclubjournals.com,https://www.reddit.com/r/Portland/comments/3y4n30/acclimating_desertdaze_strip_club_journals/,0,3y4n30,False,False,{},0,False,/r/Portland/comments/3y4n30/acclimating_desertdaze_strip_club_journals/,1454950865,1,{},,False,Portland,t5_2qi2i,default,Acclimating #DesertDaze | Strip Club Journals,http://www.stripclubjournals.com/acclimating-desertdaze/,,,,,,
PC-LoadLetter,1421443692.0,,,t2_krah6,1450997801,self.Portland,https://www.reddit.com/r/Portland/comments/3y4lqs/i_dont_feel_safe_travelling_on_portland_streets/,0,3y4lqs,True,False,{},109,False,/r/Portland/comments/3y4lqs/i_dont_feel_safe_travelling_on_portland_streets/,1454950847,1,{},"A list of problems I see:

* Bicyclists and pedestrians not illuminated (I *literally* cannot see you). Where's the enforcement on this?
* Drivers/passengers parallel parked on streets enter/exit their cars without looking for oncoming traffic and just open their doors into the travel lanes (see this everyday)
* Cars going way too fast or too slow; cars that do not adjust to weather conditions properly or are too conservative
* Street lights appear inadequate and do not illuminate enough (I'd be curious to see photometrics of different cities compared to ours). Everything seems dim even with new LED lights
* Bicyclists ""lane split"" on non-bike lane streets and sidle up to cars who may be trying to make a turn and don't see the bicyclist on their side
* Inability as a driver to see people crossing crosswalks (too dark or pedestrian does not give a commitment to crossing or pedestrian darts into traffic unfairly).
* Cars blatantly not stopping for people in crosswalks
* Cars parked waaaayy too close to intersections that blocks visibility of cars/bikes/pedestrians -- I literally cannot see when I turn at some intersections.
* Red light runners
* Cannot see a street sign at night to save my life. Has the city every considered reflective material for these signs for night time visibility? 

Where's the enforcement of some of these safety measures? Where is the city addressing some of these issues? For instance, I've driven E Burnside a few times at night and the new crosswalks are good during the day generally, but they are hard to see people trying to cross while driving the speed limit (e.g., pedestrians are hidden behind parallel parked cars and street illumination is weak especially at crosswalks).

Where I am confused, is the E. Burnside did receive some money to make it safer, but in some regards the new design has made it unsafe in other areas. 

Does anyone else feel scared walking, driving, or riding their bikes in Portland? Am I the only one?",False,Portland,t5_2qi2i,self,I don't feel safe travelling on Portland streets - Am I the only one?,https://www.reddit.com/r/Portland/comments/3y4lqs/i_dont_feel_safe_travelling_on_portland_streets/,,,,,,
SyntaxPolice,1198346740.0,,,t2_3222f,1450997646,imgur.com,https://www.reddit.com/r/Portland/comments/3y4lgh/accident_on_84_west_2_lanes_closed_and_slow_downs/,0,3y4lgh,False,False,{},2,False,/r/Portland/comments/3y4lgh/accident_on_84_west_2_lanes_closed_and_slow_downs/,1454950843,3,{},,False,Portland,t5_2qi2i,http://b.thumbs.redditmedia.com/D3nuG1qhN9j913cKyM9TMaXKdyX-4r_sRu1UivWGzaU.jpg,Accident on 84 west - 2 lanes closed and slow downs both directions,http://imgur.com/WZy5INq,,link,"{'images': [{'id': 'AYhI4fZ_4IGmO9nCBysgfG8aQbrcHNzzRDl5ZxFH0x8', 'resolutions': [{'height': 58, 'url': 'https://i.redditmedia.com/fqP9KuBzkD4Oc83kU2GHobjsg2Ew5v1HzYXI2ZyTbKY.jpg?fit=crop&amp;crop=faces%2Centropy&amp;arh=2&amp;w=108&amp;s=e844e5f834670c943dfb8d844601d467', 'width': 108}, {'height': 116, 'url': 'https://i.redditmedia.com/fqP9KuBzkD4Oc83kU2GHobjsg2Ew5v1HzYXI2ZyTbKY.jpg?fit=crop&amp;crop=faces%2Centropy&amp;arh=2&amp;w=216&amp;s=9df6e3e78d075f85d3527dcdedd7a5ed', 'width': 216}, {'height': 171, 'url': 'https://i.redditmedia.com/fqP9KuBzkD4Oc83kU2GHobjsg2Ew5v1HzYXI2ZyTbKY.jpg?fit=crop&amp;crop=faces%2Centropy&amp;arh=2&amp;w=320&amp;s=c413e095d190f98bc54cb274f3f0a9cb', 'width': 320}, {'height': 343, 'url': 'https://i.redditmedia.com/fqP9KuBzkD4Oc83kU2GHobjsg2Ew5v1HzYXI2ZyTbKY.jpg?fit=crop&amp;crop=faces%2Centropy&amp;arh=2&amp;w=640&amp;s=fcfe63cde34726b4d7255806ba668444', 'width': 640}, {'height': 515, 'url': 'https://i.redditmedia.com/fqP9KuBzkD4Oc83kU2GHobjsg2Ew5v1HzYXI2ZyTbKY.jpg?fit=crop&amp;crop=faces%2Centropy&amp;arh=2&amp;w=960&amp;s=83750565ce30d88bd089609b72412b23', 'width': 960}, {'height': 580, 'url': 'https://i.redditmedia.com/fqP9KuBzkD4Oc83kU2GHobjsg2Ew5v1HzYXI2ZyTbKY.jpg?fit=crop&amp;crop=faces%2Centropy&amp;arh=2&amp;w=1080&amp;s=af150e82e81b5d8220286c8a81aa615c', 'width': 1080}], 'source': {'height': 2149, 'url': 'https://i.redditmedia.com/fqP9KuBzkD4Oc83kU2GHobjsg2Ew5v1HzYXI2ZyTbKY.jpg?s=6335b94d8c64c0a479de15531e2db3e3', 'width': 4000}, 'variants': {}}]}",,,
[deleted],,,,,1450995358,self.Portland,https://www.reddit.com/r/Portland/comments/3y4h6c/thanks_to_gentrification_i_have_been_forced_to/,0,3y4h6c,True,False,{},0,False,/r/Portland/comments/3y4h6c/thanks_to_gentrification_i_have_been_forced_to/,1454950788,1,{},[removed],False,Portland,t5_2qi2i,default,Thanks to gentrification i have been forced to not celebrate my fav holiday. Chrsitmas.,https://www.reddit.com/r/Portland/comments/3y4h6c/thanks_to_gentrification_i_have_been_forced_to/,,,,moderators,,
dontaskhowiknowit,1412328792.0,,,t2_ioorn,1450993178,koin.com,https://www.reddit.com/r/Portland/comments/3y4dc5/man_dies_in_fall_from_downtown_portland_balcony/,0,3y4dc5,False,False,{},20,False,/r/Portland/comments/3y4dc5/man_dies_in_fall_from_downtown_portland_balcony/,1454950739,31,{},,False,Portland,t5_2qi2i,http://b.thumbs.redditmedia.com/yjwDea6euDpE4qEdVDDR6MAySRYz_N_PlfFdVTTbDkg.jpg,Man dies in fall from downtown Portland balcony,http://koin.com/2015/12/24/man-dies-in-fall-from-downtown-portland-balcony/,,link,"{'images': [{'id': 'oe-VT0SYtqWcLgbIGXbTQPwaQRdklVJebAL4lM5J_gs', 'resolutions': [{'height': 64, 'url': 'https://i.redditmedia.com/PeDQLJ8W8QSYJkXoEy-8Uidr3pR2HQSRquXA1CC3bws.jpg?fit=crop&amp;crop=faces%2Centropy&amp;arh=2&amp;w=108&amp;s=fb31306434c6125370968fbbc80c5112', 'width': 108}, {'height': 129, 'url': 'https://i.redditmedia.com/PeDQLJ8W8QSYJkXoEy-8Uidr3pR2HQSRquXA1CC3bws.jpg?fit=crop&amp;crop=faces%2Centropy&amp;arh=2&amp;w=216&amp;s=f9cf9abbedb98f9287533079d6f8179f', 'width': 216}, {'height': 192, 'url': 'https://i.redditmedia.com/PeDQLJ8W8QSYJkXoEy-8Uidr3pR2HQSRquXA1CC3bws.jpg?fit=crop&amp;crop=faces%2Centropy&amp;arh=2&amp;w=320&amp;s=3a18b5fe8e6931aab15657e00bd2478e', 'width': 320}, {'height': 384, 'url': 'https://i.redditmedia.com/PeDQLJ8W8QSYJkXoEy-8Uidr3pR2HQSRquXA1CC3bws.jpg?fit=crop&amp;crop=faces%2Centropy&amp;arh=2&amp;w=640&amp;s=ace81886d19dcbf211aa2fcb9299cb8a', 'width': 640}], 'source': {'height': 480, 'url': 'https://i.redditmedia.com/PeDQLJ8W8QSYJkXoEy-8Uidr3pR2HQSRquXA1CC3bws.jpg?s=324807587d86ae48cf744f66fdd3a1a6', 'width': 800}, 'variants': {}}]}",,,
cjs1009,1374114201.0,,,t2_cf3uk,1450991057,imgur.com,https://www.reddit.com/r/Portland/comments/3y49f7/too_drunk_to_make_it_to_the_store_safeway/,0,3y49f7,False,False,{},51,False,/r/Portland/comments/3y49f7/too_drunk_to_make_it_to_the_store_safeway/,1454950687,317,{},,False,Portland,t5_2qi2i,http://b.thumbs.redditmedia.com/nV99ya3OSy6n2yEl9N29-IgPammWbXfohNNfmi8sS9U.jpg,Too drunk to make it to the store? Safeway delivers 40oz and more!,http://imgur.com/07VzpSA,,link,"{'images': [{'id': 'alkEkJk2r-MwCkST63L5eHPrSHEDWbJZEQXrBbImw6E', 'resolutions': [{'height': 108, 'url': 'https://i.redditmedia.com/zcY-slVScNu09gMhK63uyiFKmgFCgBePjVsG-f_YHGo.jpg?fit=crop&amp;crop=faces%2Centropy&amp;arh=2&amp;w=108&amp;s=dfd6900815aa2093ec9df06199a04089', 'width': 108}, {'height': 216, 'url': 'https://i.redditmedia.com/zcY-slVScNu09gMhK63uyiFKmgFCgBePjVsG-f_YHGo.jpg?fit=crop&amp;crop=faces%2Centropy&amp;arh=2&amp;w=216&amp;s=4123b156ae2fb79fc50f67ee6a4a170f', 'width': 216}, {'height': 320, 'url': 'https://i.redditmedia.com/zcY-slVScNu09gMhK63uyiFKmgFCgBePjVsG-f_YHGo.jpg?fit=crop&amp;crop=faces%2Centropy&amp;arh=2&amp;w=320&amp;s=6d5ccee5f555bc1845db583345743c29', 'width': 320}, {'height': 640, 'url': 'https://i.redditmedia.com/zcY-slVScNu09gMhK63uyiFKmgFCgBePjVsG-f_YHGo.jpg?fit=crop&amp;crop=faces%2Centropy&amp;arh=2&amp;w=640&amp;s=8f6b2f524623d410bc1a626f1a51fea9', 'width': 640}, {'height': 960, 'url': 'https://i.redditmedia.com/zcY-slVScNu09gMhK63uyiFKmgFCgBePjVsG-f_YHGo.jpg?fit=crop&amp;crop=faces%2Centropy&amp;arh=2&amp;w=960&amp;s=97421399add404d5610ea3829a9b3a22', 'width': 960}, {'height': 1080, 'url': 'https://i.redditmedia.com/zcY-slVScNu09gMhK63uyiFKmgFCgBePjVsG-f_YHGo.jpg?fit=crop&amp;crop=faces%2Centropy&amp;arh=2&amp;w=1080&amp;s=8ade66ecad3e583834a980a86ee6e49b', 'width': 1080}], 'source': {'height': 1936, 'url': 'https://i.redditmedia.com/zcY-slVScNu09gMhK63uyiFKmgFCgBePjVsG-f_YHGo.jpg?s=00269e5ddbc6278cdbff87027b59b652', 'width': 1936}, 'variants': {}}]}",,,
