author,author_created_utc,author_flair_css_class,author_flair_text,author_fullname,created_utc,domain,full_link,gilded,id,is_self,media_embed,num_comments,over_18,permalink,retrieved_on,score,secure_media_embed,selftext,stickied,subreddit,subreddit_id,thumbnail,title,url,edited,media,secure_media
Cereal_Killer79,1399695696.0,,Kerns,t2_gi4ot,1425423909,self.Portland,https://www.reddit.com/r/Portland/comments/2xuc2l/im_am_desperate_and_need_help_so_desperate_that/,0,2xuc2l,True,{},59,False,/r/Portland/comments/2xuc2l/im_am_desperate_and_need_help_so_desperate_that/,1440874521,0,{},"Hi everybody. I'm posting on here because I don't know what else to do. I'm facing eviction from the apartment that I've lived in for 7 1/2 years. Everything was going great, until my then fiancé and I split up and he moved out in July. Well, unfortunately the following month my mother passed away after battling cancer and it sent me into a free fall. I had been working part time to try and help take care of her and living off of my measly 401k. When she died, I lost it and ended up taking some time off work. 

So long story short, I got a month behind on rent and have just not been able to catch up. In order for myself, my sweet puppy dogs and my kitty cat to stay in our home I have to come up with $1550 by Thursday morning. My primary goal is to avoid having the eviction on my record but I plan on moving into a friend's house next month. The landlord said I would have to be out by 3/15 if I don't pay the amount owed on Thursday.

I have a decent job and I work upwards of 60 hours a week. It seems like I've been hit with a financial crisis or a health crisis every other week. I don't have any family really, and my savings is behind depleted. I've looked into state and county funded programs, but as a single, childless female there aren't any real options for me. I'm asking for good old fashioned help. And in return I will do your taxes, walk your dog, wash your car, basically anything (well, not ANYTHING).

I know us redditors are not an independently wealthy lot, but I just don't know what else to do. I thought about setting up a go fund me site, but it seems like to get anything going you have to link it to your Facebook page? Well, pride is a bitch and ideally I wouldn't have to air my financial grievances to every one I went to high school with. So I do it here...I know, i know.

Thanks for reading. Wish me luck.

Everything is squared away. Thanks so much to everyone that offered their help and/or kind words.",False,Portland,t5_2qi2i,self,I'm am desperate and need help. So desperate that I'm posting on Reddit,http://www.reddit.com/r/Portland/comments/2xuc2l/im_am_desperate_and_need_help_so_desperate_that/,1425500888.0,,
Nonewfriends0,1423852407.0,,,t2_lc8ce,1425423387,theportlandtimbros.com,https://www.reddit.com/r/Portland/comments/2xuawh/meet_madison_shanley_your_timbers_opening_kick/,0,2xuawh,False,{},1,False,/r/Portland/comments/2xuawh/meet_madison_shanley_your_timbers_opening_kick/,1440874537,0,{},,False,Portland,t5_2qi2i,default,Meet Madison Shanley Your Timbers Opening Kick Off National Anthem Singer!,http://www.theportlandtimbros.com/2015/03/03/meet-madison-shanley-your-opening-kick-off-national-anthem-singer/,,,
jr98664,1304474855.0,,Overlook,t2_56rfr,1425421975,i.imgur.com,https://www.reddit.com/r/Portland/comments/2xu7uf/truckmotorcycle_cleared_from_interstate_bridge_nb/,0,2xu7uf,False,{},3,False,/r/Portland/comments/2xu7uf/truckmotorcycle_cleared_from_interstate_bridge_nb/,1440874576,0,{},,False,Portland,t5_2qi2i,http://b.thumbs.redditmedia.com/VsRT6SfvcBdQmpSfrhWx8_Zz_3fr70uQScXeDWI2eTA.jpg,Truck/motorcycle cleared from Interstate Bridge NB as of 2:28 pm. Expect delays.,http://i.imgur.com/7aBRaEY.jpg,,,
[deleted],,,,,1425421882,self.Portland,https://www.reddit.com/r/Portland/comments/2xu7lv/truckmotorcycle_cleared_from_nb_interstate_bridge/,0,2xu7lv,True,{},0,False,/r/Portland/comments/2xu7lv/truckmotorcycle_cleared_from_nb_interstate_bridge/,1440874579,1,{},,False,Portland,t5_2qi2i,default,Truck/motorcycle cleared from NB Interstate Bridge as of 2:28 pm. Expect delays.,http://www.reddit.com/r/Portland/comments/2xu7lv/truckmotorcycle_cleared_from_nb_interstate_bridge/,,,
[deleted],,,,,1425421516,youtu.be,https://www.reddit.com/r/Portland/comments/2xu6rw/oc_the_resignation_of_john_kitzhaber_comedy/,0,2xu6rw,False,"{'content': '&lt;iframe class=""embedly-embed"" src=""//cdn.embedly.com/widgets/media.html?src=http%3A%2F%2Fwww.youtube.com%2Fembed%2FMHCWkse1_9w%3Ffeature%3Doembed&amp;url=https%3A%2F%2Fwww.youtube.com%2Fwatch%3Fv%3DMHCWkse1_9w&amp;image=http%3A%2F%2Fi.ytimg.com%2Fvi%2FMHCWkse1_9w%2Fhqdefault.jpg&amp;key=2aa3c4d5f3de4f5b9120b660ad850dc9&amp;type=text%2Fhtml&amp;schema=youtube"" width=""600"" height=""338"" scrolling=""no"" frameborder=""0"" allowfullscreen&gt;&lt;/iframe&gt;', 'height': 338, 'scrolling': False, 'width': 600}",6,True,/r/Portland/comments/2xu6rw/oc_the_resignation_of_john_kitzhaber_comedy/,1440874590,7,"{'content': '&lt;iframe class=""embedly-embed"" src=""https://cdn.embedly.com/widgets/media.html?src=https%3A%2F%2Fwww.youtube.com%2Fembed%2FMHCWkse1_9w%3Ffeature%3Doembed&amp;url=https%3A%2F%2Fwww.youtube.com%2Fwatch%3Fv%3DMHCWkse1_9w&amp;image=http%3A%2F%2Fi.ytimg.com%2Fvi%2FMHCWkse1_9w%2Fhqdefault.jpg&amp;key=2aa3c4d5f3de4f5b9120b660ad850dc9&amp;type=text%2Fhtml&amp;schema=youtube"" width=""600"" height=""338"" scrolling=""no"" frameborder=""0"" allowfullscreen&gt;&lt;/iframe&gt;', 'height': 338, 'scrolling': False, 'width': 600}",,False,Portland,t5_2qi2i,nsfw,(OC) The Resignation of John Kitzhaber (Comedy),http://youtu.be/MHCWkse1_9w,,"{'oembed': {'author_name': 'Andy Chandler', 'author_url': 'http://www.youtube.com/user/andygeek44', 'description': ""The true story of John Kitzhaber's resignation is revealed for the first time..."", 'height': 338, 'html': '&lt;iframe class=""embedly-embed"" src=""//cdn.embedly.com/widgets/media.html?src=http%3A%2F%2Fwww.youtube.com%2Fembed%2FMHCWkse1_9w%3Ffeature%3Doembed&amp;url=https%3A%2F%2Fwww.youtube.com%2Fwatch%3Fv%3DMHCWkse1_9w&amp;image=http%3A%2F%2Fi.ytimg.com%2Fvi%2FMHCWkse1_9w%2Fhqdefault.jpg&amp;key=2aa3c4d5f3de4f5b9120b660ad850dc9&amp;type=text%2Fhtml&amp;schema=youtube"" width=""600"" height=""338"" scrolling=""no"" frameborder=""0"" allowfullscreen&gt;&lt;/iframe&gt;', 'provider_name': 'YouTube', 'provider_url': 'http://www.youtube.com/', 'thumbnail_height': 360, 'thumbnail_url': 'http://i.ytimg.com/vi/MHCWkse1_9w/hqdefault.jpg', 'thumbnail_width': 480, 'title': 'The Resignation of John Kitzhaber', 'type': 'video', 'url': 'http://www.youtube.com/watch?v=MHCWkse1_9w', 'version': '1.0', 'width': 600}, 'type': 'youtu.be'}","{'oembed': {'author_name': 'Andy Chandler', 'author_url': 'http://www.youtube.com/user/andygeek44', 'description': ""The true story of John Kitzhaber's resignation is revealed for the first time..."", 'height': 338, 'html': '&lt;iframe class=""embedly-embed"" src=""https://cdn.embedly.com/widgets/media.html?src=https%3A%2F%2Fwww.youtube.com%2Fembed%2FMHCWkse1_9w%3Ffeature%3Doembed&amp;url=https%3A%2F%2Fwww.youtube.com%2Fwatch%3Fv%3DMHCWkse1_9w&amp;image=http%3A%2F%2Fi.ytimg.com%2Fvi%2FMHCWkse1_9w%2Fhqdefault.jpg&amp;key=2aa3c4d5f3de4f5b9120b660ad850dc9&amp;type=text%2Fhtml&amp;schema=youtube"" width=""600"" height=""338"" scrolling=""no"" frameborder=""0"" allowfullscreen&gt;&lt;/iframe&gt;', 'provider_name': 'YouTube', 'provider_url': 'http://www.youtube.com/', 'thumbnail_height': 360, 'thumbnail_url': 'https://i.embed.ly/1/image?url=http%3A%2F%2Fi.ytimg.com%2Fvi%2FMHCWkse1_9w%2Fhqdefault.jpg&amp;key=b1e305db91cf4aa5a86b732cc9fffceb', 'thumbnail_width': 480, 'title': 'The Resignation of John Kitzhaber', 'type': 'video', 'url': 'http://www.youtube.com/watch?v=MHCWkse1_9w', 'version': '1.0', 'width': 600}, 'type': 'youtu.be'}"
mermlgloop,1393147758.0,,,t2_fep61,1425418813,koin.com,https://www.reddit.com/r/Portland/comments/2xu0mt/2_arrested_in_hammer_attack/,0,2xu0mt,False,{},14,False,/r/Portland/comments/2xu0mt/2_arrested_in_hammer_attack/,1440874669,7,{},,False,Portland,t5_2qi2i,http://b.thumbs.redditmedia.com/LvEToVSz_ZfstBC62WeYTdKzUV-x5GRK9IF15DbemlE.jpg,2 arrested in hammer attack,http://koin.com/2015/03/03/2-accused-in-seaside-hammer-attack/,,,
[deleted],,,,,1425418390,i.imgur.com,https://www.reddit.com/r/Portland/comments/2xtzmb/dog_found_at_gabriel_park/,0,2xtzmb,False,{},0,False,/r/Portland/comments/2xtzmb/dog_found_at_gabriel_park/,1440874682,1,{},,False,Portland,t5_2qi2i,default,Dog found at Gabriel Park,http://i.imgur.com/2FTrtZW.jpg,,,
[deleted],,,,,1425417217,self.Portland,https://www.reddit.com/r/Portland/comments/2xtwq1/found_dog_at_gabriel_park/,0,2xtwq1,True,{},0,False,/r/Portland/comments/2xtwq1/found_dog_at_gabriel_park/,1440874720,1,{},"I spotted this poor girl running loose yesterday morning in Gabriel Park (the upper portion, where Canby St. dead ends).   

Me and another gentleman tried to catch her for close to an hour, to no avail. If I got too close she would get a bit aggressive (she was very, very, scared). She was wearing a black leash and red collar, so I assume (obviously) that she is someone's pet. She was constantly racing around, but she never ventured past the field/neighborhood, which made me think she was familiar with the area.   

I finally called animal control, but they were unable to catch her as well. The other gentleman returned in the evening, and with the help of some neighbors, was finally able to catch her.  

She was taken to Dove Lewis to be evaluated, and they will turn her over to animal services. She looks like she may have been loose for a while, but if this is your pet (or you know who she is), I have her case number. Thanks!",False,Portland,t5_2qi2i,default,Found dog at Gabriel Park,http://www.reddit.com/r/Portland/comments/2xtwq1/found_dog_at_gabriel_park/,,,
[deleted],,,,,1425416209,youtube.com,https://www.reddit.com/r/Portland/comments/2xtu6n/number_one_blazers_podcast_playlist/,0,2xtu6n,False,{},0,False,/r/Portland/comments/2xtu6n/number_one_blazers_podcast_playlist/,1440874753,0,{},,False,Portland,t5_2qi2i,default,Number One Blazers Podcast - playlist,https://www.youtube.com/playlist?list=PLsAqYnYhG-TrMgpQZME6NybuL5tS7wQ7F,,,
gorilladust,1292458479.0,,Woodstock,t2_4mi1b,1425408764,oregonlive.com,https://www.reddit.com/r/Portland/comments/2xtcnk/the_growing_inconvenience_of_oregons_bottle_bill/,0,2xtcnk,False,{},83,False,/r/Portland/comments/2xtcnk/the_growing_inconvenience_of_oregons_bottle_bill/,1440874980,21,{},,False,Portland,t5_2qi2i,http://b.thumbs.redditmedia.com/IniMZdvp9odv-tUiQcqUYL3AW9WMoEwRnvkWM4sMMzY.jpg,The growing inconvenience of Oregon's Bottle Bill: Editorial,http://www.oregonlive.com/opinion/index.ssf/2015/03/the_inconvenient_future_of_ore.html,,,
[deleted],,,,,1425407490,giveanorange.org,https://www.reddit.com/r/Portland/comments/2xt9me/my_friend_and_i_had_a_simple_idea_give_oranges_as/,0,2xt9me,False,{},39,False,/r/Portland/comments/2xt9me/my_friend_and_i_had_a_simple_idea_give_oranges_as/,1440875019,2,{},,False,Portland,t5_2qi2i,default,My friend and I had a simple idea: Give oranges as a positive way to respond to panhandlers and help prevent scurvy. Would love to hear feedback and thoughts on the idea.,http://giveanorange.org/,,,
[deleted],,,,,1425407395,giveanorange.org,https://www.reddit.com/r/Portland/comments/2xt9cz/my_friend_and_i_had_a_simple_idea_give_oranges_to/,0,2xt9cz,False,{},0,False,/r/Portland/comments/2xt9cz/my_friend_and_i_had_a_simple_idea_give_oranges_to/,1440875023,1,{},,False,Portland,t5_2qi2i,default,My friend and I had a simple idea: Give oranges to as a positive way to respond to panhandlers and help prevent scurvy. Would love to hear feedback and thoughts on the idea and the website.,http://giveanorange.org/,,,
[deleted],,,,,1425405551,self.Portland,https://www.reddit.com/r/Portland/comments/2xt4x7/found_lost_cat_in_lake_oswego/,0,2xt4x7,True,{},2,False,/r/Portland/comments/2xt4x7/found_lost_cat_in_lake_oswego/,1440875080,7,{},"Last night I found this cute boy crying, caught in the bushes near the train tracks. I know this isn't technically Portland, but I figured it's the best place to post about it. He's smart, incredibly sweet and mannered. Sorry for the shit pictures, he wouldn't stop romping around exploring his new surroundings. Please send me a message if you recognize him or you know the owner. 

Link to pics:
http://imgur.com/a/LrC0m
",False,Portland,t5_2qi2i,default,Found lost cat in Lake Oswego.,http://www.reddit.com/r/Portland/comments/2xt4x7/found_lost_cat_in_lake_oswego/,,,
Nsurgnie,1296853341.0,,Downtown,t2_4sz43,1425403994,self.Portland,https://www.reddit.com/r/Portland/comments/2xt1de/making_a_champagne_saber_for_wedding/,0,2xt1de,True,{},6,False,/r/Portland/comments/2xt1de/making_a_champagne_saber_for_wedding/,1440875127,0,{},"Hi.

My fiance is really into champagne. We're going to be doing a lot of things centered around champagne for the wedding. Even the invitations are going to be tiny splits(187ml) with our information on them.

I was looking to see if anyone could help point me in the right direction of making a champagne saber to give to her as a gift for the wedding. Any ideas? It doesn't have to be sharp, in fact, quite the opposite.

Thanks!",False,Portland,t5_2qi2i,self,Making a Champagne Saber for Wedding,http://www.reddit.com/r/Portland/comments/2xt1de/making_a_champagne_saber_for_wedding/,,,
ExiledOkie,1388423723.0,,Parkrose Heights,t2_ekrcq,1425403167,midcountymemo.com,https://www.reddit.com/r/Portland/comments/2xszeo/initiative_petition_filed_for_east_portland/,0,2xszeo,False,{},82,False,/r/Portland/comments/2xszeo/initiative_petition_filed_for_east_portland/,1440875152,52,{},,False,Portland,t5_2qi2i,http://b.thumbs.redditmedia.com/lMMYRv7W9VfwTporAL5nvSfQUah8dDleJ6WIIeNzSKs.jpg,Initiative petition filed for East Portland secede from Portland,http://midcountymemo.com/memlog/new-city-proposed-for-east-portland/,,,
amy-amy,,,,,1425402132,oregonlive.com,https://www.reddit.com/r/Portland/comments/2xsx06/lol_local_homosexuals_infighting_to_death_over/,0,2xsx06,False,{},1,False,/r/Portland/comments/2xsx06/lol_local_homosexuals_infighting_to_death_over/,1440875183,0,{},,False,Portland,t5_2qi2i,default,LOL: Local homosexuals infighting to death over political correctness (and making themselves look like idiots).,http://www.oregonlive.com/portland/index.ssf/2015/03/problems_at_portlands_q_center.html,,,
coastiefish,1283104192.0,,N Tabor,t2_4agoa,1425401312,kptv.com,https://www.reddit.com/r/Portland/comments/2xsv2n/portland_woman_likely_to_lose_eye_after_being/,0,2xsv2n,False,{},30,False,/r/Portland/comments/2xsv2n/portland_woman_likely_to_lose_eye_after_being/,1440875208,116,{},,False,Portland,t5_2qi2i,http://b.thumbs.redditmedia.com/z86KjfM1DFCZP1ndLi7EZgli7AsNzrSixFngS4Ly0HQ.jpg,Portland woman likely to lose eye after being shot by pellet gun - Looking for any witnesses or help,http://www.kptv.com/story/28244052/portland-woman-recalls-being-shot-in-the-eye#.VPXlrdvV_Zg.reddit,,,
isaacsmiller,1393391584.0,,,t2_fgfdk,1425399510,bikeportland.org,https://www.reddit.com/r/Portland/comments/2xsrbe/if_you_want_more_accessible_mountain_biking_in/,0,2xsrbe,False,{},21,False,/r/Portland/comments/2xsrbe/if_you_want_more_accessible_mountain_biking_in/,1440875257,0,{},,False,Portland,t5_2qi2i,http://b.thumbs.redditmedia.com/tL0QUglUrNuF43FG2zg8DSPbZxtge1eh-PMsVtSPIbA.jpg,If you want more accessible mountain biking in Portland Amanda Fritz is killing that dream. Write her an e-mail,http://bikeportland.org/2015/03/02/citing-conservation-goals-city-says-biking-will-allowed-river-view-natural-area-135163,,,
bnblazer,1324822725.0,,NW,t2_6ie30,1425397580,bikeportland.org,https://www.reddit.com/r/Portland/comments/2xsn5m/oregon_lawmaker_wants_to_punish_people_who_bike/,0,2xsn5m,False,{},351,False,/r/Portland/comments/2xsn5m/oregon_lawmaker_wants_to_punish_people_who_bike/,1440875311,212,{},,False,Portland,t5_2qi2i,http://b.thumbs.redditmedia.com/mqhksFlhZuY0BwZQ929PxzmPVNF7lfSYdZLWF60Za_k.jpg,Oregon lawmaker wants to punish people who bike without reflective clothing,http://bikeportland.org/2015/02/27/oregon-lawmaker-wants-punish-people-bike-without-hi-viz-clothing-135100,,,
Pdxwinter,1425394556.0,,,t2_lu7e1,1425394860,self.Portland,https://www.reddit.com/r/Portland/comments/2xshq5/curtis_nelson_i_found_your_phone/,0,2xshq5,True,{},1,False,/r/Portland/comments/2xshq5/curtis_nelson_i_found_your_phone/,1440875381,1,{},,False,Portland,t5_2qi2i,default,"Curtis Nelson, I Found Your Phone",http://www.reddit.com/r/Portland/comments/2xshq5/curtis_nelson_i_found_your_phone/,,,
tbonenowison,1386305223.0,,SE,t2_e84nc,1425387368,self.Portland,https://www.reddit.com/r/Portland/comments/2xs5wg/favorite_daily_drinking_local_tea/,0,2xs5wg,True,{},0,False,/r/Portland/comments/2xs5wg/favorite_daily_drinking_local_tea/,1440875534,5,{},,False,Portland,t5_2qi2i,default,Favorite daily drinking local tea?,http://www.reddit.com/r/Portland/comments/2xs5wg/favorite_daily_drinking_local_tea/,,,
cosmic_persimmon,1358404176.0,,NW,t2_a9cuz,1425371368,self.Portland,https://www.reddit.com/r/Portland/comments/2xroxg/buying_a_local_chawan_tea_ceremony_bowl_for_matcha/,0,2xroxg,True,{},4,False,/r/Portland/comments/2xroxg/buying_a_local_chawan_tea_ceremony_bowl_for_matcha/,1440875754,1,{},"I'm in the market for a large tea bowl (chawan, about 5 inches diameter, now see here: http://akirasatake.com/chawan)

Anyone know of some cool places to buy unique Japanese or Japanese-inspired tea bowls in PDX?  I'm looking for ones that are wood-fired, not glazed with modern glazes, but with traditional shino, ash, salt, true oribe, etc.  Probably no raku, as US raku isn't usually food safe.",False,Portland,t5_2qi2i,self,Buying a local chawan? (tea ceremony bowl for matcha),http://www.reddit.com/r/Portland/comments/2xroxg/buying_a_local_chawan_tea_ceremony_bowl_for_matcha/,,,
im_db_cooper,1425370126.0,,,t2_ltvyn,1425370870,self.Portland,https://www.reddit.com/r/Portland/comments/2xrofh/missing_a_dog_named_freya/,0,2xrofh,True,{},13,False,/r/Portland/comments/2xrofh/missing_a_dog_named_freya/,1440875761,16,{},"I would post a pic, but I'm a luddite. Anywho, a friend who is allergic to dogs found a big tan/brown pooch with a tag that says ""Freya"" DT at about SW 6/Pine. We are watching it for now. Is it yours?  

Edit: she has been reunited with her mum!",False,Portland,t5_2qi2i,self,Missing a dog named Freya?,http://www.reddit.com/r/Portland/comments/2xrofh/missing_a_dog_named_freya/,1425414346.0,,
2error,1393105388.0,,Sullivan's Gulch,t2_fefwq,1425367206,kgw.com,https://www.reddit.com/r/Portland/comments/2xrk68/portland_sets_record_for_warmest_winter/,0,2xrk68,False,{},64,False,/r/Portland/comments/2xrk68/portland_sets_record_for_warmest_winter/,1440875816,112,{},,False,Portland,t5_2qi2i,http://b.thumbs.redditmedia.com/G7Ng6Sl7T35eGZDKEBo082V33M6YaVC1A-4oeSpEzaE.jpg,Portland sets record for warmest winter,http://www.kgw.com/story/weather/2015/03/01/portland-sets-record-for-warmest-winter/24219845/,,,
laddersdazed,1385005576.0,,,t2_e0bnf,1425363305,koin.com,https://www.reddit.com/r/Portland/comments/2xrezs/union_pacific_says_2_trains_derail_in_oregon/,0,2xrezs,False,{},7,False,/r/Portland/comments/2xrezs/union_pacific_says_2_trains_derail_in_oregon/,1440875883,65,{},,False,Portland,t5_2qi2i,http://b.thumbs.redditmedia.com/pjv-ZBqRQ3wTr6jmjkAhsMWX6CePAOetEUrE32lJUXk.jpg,Union Pacific says 2 trains derail in Oregon.,http://koin.com/2015/03/02/union-pacific-says-2-trains-derail-in-oregon/,,,
[deleted],,,,,1425360202,youtu.be,https://www.reddit.com/r/Portland/comments/2xra9l/the_resignation_of_john_kitzhaber_sketch_video/,0,2xra9l,False,"{'content': '&lt;iframe class=""embedly-embed"" src=""//cdn.embedly.com/widgets/media.html?src=http%3A%2F%2Fwww.youtube.com%2Fembed%2FMHCWkse1_9w%3Ffeature%3Doembed&amp;url=https%3A%2F%2Fwww.youtube.com%2Fwatch%3Fv%3DMHCWkse1_9w&amp;image=http%3A%2F%2Fi.ytimg.com%2Fvi%2FMHCWkse1_9w%2Fhqdefault.jpg&amp;key=2aa3c4d5f3de4f5b9120b660ad850dc9&amp;type=text%2Fhtml&amp;schema=youtube"" width=""600"" height=""338"" scrolling=""no"" frameborder=""0"" allowfullscreen&gt;&lt;/iframe&gt;', 'height': 338, 'scrolling': False, 'width': 600}",0,False,/r/Portland/comments/2xra9l/the_resignation_of_john_kitzhaber_sketch_video/,1440875944,0,"{'content': '&lt;iframe class=""embedly-embed"" src=""https://cdn.embedly.com/widgets/media.html?src=https%3A%2F%2Fwww.youtube.com%2Fembed%2FMHCWkse1_9w%3Ffeature%3Doembed&amp;url=https%3A%2F%2Fwww.youtube.com%2Fwatch%3Fv%3DMHCWkse1_9w&amp;image=http%3A%2F%2Fi.ytimg.com%2Fvi%2FMHCWkse1_9w%2Fhqdefault.jpg&amp;key=2aa3c4d5f3de4f5b9120b660ad850dc9&amp;type=text%2Fhtml&amp;schema=youtube"" width=""600"" height=""338"" scrolling=""no"" frameborder=""0"" allowfullscreen&gt;&lt;/iframe&gt;', 'height': 338, 'scrolling': False, 'width': 600}",,False,Portland,t5_2qi2i,default,The Resignation of John Kitzhaber - Sketch Video,http://youtu.be/MHCWkse1_9w,,"{'oembed': {'author_name': 'Andy Chandler', 'author_url': 'http://www.youtube.com/user/andygeek44', 'description': ""The true story of John Kitzhaber's resignation is revealed for the first time..."", 'height': 338, 'html': '&lt;iframe class=""embedly-embed"" src=""//cdn.embedly.com/widgets/media.html?src=http%3A%2F%2Fwww.youtube.com%2Fembed%2FMHCWkse1_9w%3Ffeature%3Doembed&amp;url=https%3A%2F%2Fwww.youtube.com%2Fwatch%3Fv%3DMHCWkse1_9w&amp;image=http%3A%2F%2Fi.ytimg.com%2Fvi%2FMHCWkse1_9w%2Fhqdefault.jpg&amp;key=2aa3c4d5f3de4f5b9120b660ad850dc9&amp;type=text%2Fhtml&amp;schema=youtube"" width=""600"" height=""338"" scrolling=""no"" frameborder=""0"" allowfullscreen&gt;&lt;/iframe&gt;', 'provider_name': 'YouTube', 'provider_url': 'http://www.youtube.com/', 'thumbnail_height': 360, 'thumbnail_url': 'http://i.ytimg.com/vi/MHCWkse1_9w/hqdefault.jpg', 'thumbnail_width': 480, 'title': 'The Resignation of John Kitzhaber', 'type': 'video', 'url': 'http://www.youtube.com/watch?v=MHCWkse1_9w', 'version': '1.0', 'width': 600}, 'type': 'youtu.be'}","{'oembed': {'author_name': 'Andy Chandler', 'author_url': 'http://www.youtube.com/user/andygeek44', 'description': ""The true story of John Kitzhaber's resignation is revealed for the first time..."", 'height': 338, 'html': '&lt;iframe class=""embedly-embed"" src=""https://cdn.embedly.com/widgets/media.html?src=https%3A%2F%2Fwww.youtube.com%2Fembed%2FMHCWkse1_9w%3Ffeature%3Doembed&amp;url=https%3A%2F%2Fwww.youtube.com%2Fwatch%3Fv%3DMHCWkse1_9w&amp;image=http%3A%2F%2Fi.ytimg.com%2Fvi%2FMHCWkse1_9w%2Fhqdefault.jpg&amp;key=2aa3c4d5f3de4f5b9120b660ad850dc9&amp;type=text%2Fhtml&amp;schema=youtube"" width=""600"" height=""338"" scrolling=""no"" frameborder=""0"" allowfullscreen&gt;&lt;/iframe&gt;', 'provider_name': 'YouTube', 'provider_url': 'http://www.youtube.com/', 'thumbnail_height': 360, 'thumbnail_url': 'https://i.embed.ly/1/image?url=http%3A%2F%2Fi.ytimg.com%2Fvi%2FMHCWkse1_9w%2Fhqdefault.jpg&amp;key=b1e305db91cf4aa5a86b732cc9fffceb', 'thumbnail_width': 480, 'title': 'The Resignation of John Kitzhaber', 'type': 'video', 'url': 'http://www.youtube.com/watch?v=MHCWkse1_9w', 'version': '1.0', 'width': 600}, 'type': 'youtu.be'}"
[deleted],,,,,1425358961,self.Portland,https://www.reddit.com/r/Portland/comments/2xr818/need_a_house_cleaner_who_doesnt_sucksic/,0,2xr818,True,{},12,False,/r/Portland/comments/2xr818/need_a_house_cleaner_who_doesnt_sucksic/,1440875973,0,{},"My girlfriend and I have four dogs and will be getting a cat so we are looking for a weekly housecleaner to keep the dust bunnies from taking over. If you are interested or know someone who might be, read on!

We have worked with a couple cleaning companies and think a self employed person might fit our needs a little better. The person we are looking to hire will also be available to do other random jobs we might need done like organizing the garage, helping move furniture, packing/unpacking boxes, painting rooms, assembling Ikea furniture, etc. We want a go-getter! Someone who enjoys cleaning and organizing and wants to make money weekly as well as doing odd jobs! A cleaning handy person! A Jack or Jane of all trades!

Ideally, they will come on Thursdays because that day only one dog and the cat will be home, but if the right person was busy Thursdays, Tuesdays and Wednesdays two dogs and the cat will be home so that would work too.

We have had most of the house cleaned a couple times recently, so we just need someone to keep it up and take care of what they didn't do, like windows, tops of door frames, cobwebs on walls, under the bed, etc.  Our house is 2-story and has a master bed/bath, an office, a living room, dining room, guest bed/bath and kitchen that will all need weekly maintenance along with sheets changed. There is also a craft/pet room that will need the floors cleaned and the litter box changed weekly.  

We can supply the cleaning materials, including a vacuum and Shark steam mop or you can bring your own.

We are located in SE Portland and would like someone to start next week.  

tl;dr: Housecleaner needed who isn't scared of heavy lifting or cat poop",False,Portland,t5_2qi2i,default,Need a house cleaner who doesn't suck(sic),http://www.reddit.com/r/Portland/comments/2xr818/need_a_house_cleaner_who_doesnt_sucksic/,,,
allydelaann,1355727862.0,,,t2_9x0zd,1425358664,self.Portland,https://www.reddit.com/r/Portland/comments/2xr7hi/sweet_pup_urgently_needs_a_new_home_in_portland/,0,2xr7hi,True,{},1,False,/r/Portland/comments/2xr7hi/sweet_pup_urgently_needs_a_new_home_in_portland/,1440875981,5,{},,False,Portland,t5_2qi2i,default,Sweet pup urgently needs a new home in Portland!,http://www.reddit.com/r/Portland/comments/2xr7hi/sweet_pup_urgently_needs_a_new_home_in_portland/,,,
