author,author_flair_css_class,author_flair_richtext,author_flair_text,author_flair_type,author_fullname,can_mod_post,contest_mode,created_utc,domain,full_link,gilded,id,is_crosspostable,is_meta,is_original_content,is_reddit_media_domain,is_self,is_video,link_flair_background_color,link_flair_richtext,link_flair_text_color,link_flair_type,locked,media_only,no_follow,num_comments,num_crossposts,over_18,parent_whitelist_status,permalink,pinned,pwls,retrieved_on,score,selftext,send_replies,spoiler,stickied,subreddit,subreddit_id,subreddit_subscribers,subreddit_type,thumbnail,title,url,whitelist_status,wls,author_flair_background_color,author_flair_text_color,link_flair_css_class,link_flair_text,post_hint,preview,thumbnail_height,thumbnail_width,author_flair_template_id,media,media_embed,secure_media,secure_media_embed
Akitaguru,,[],,text,t2_16w0hm,False,False,1535551008,oregonlive.com,https://www.reddit.com/r/Portland/comments/9b9i2c/so_he_dozed_off_in_the_drivers_seat_of_his_van/,0,9b9i2c,True,False,False,False,False,False,,[],dark,text,False,False,True,33,0,False,all_ads,/r/Portland/comments/9b9i2c/so_he_dozed_off_in_the_drivers_seat_of_his_van/,False,6,1535551010,40,,True,False,False,Portland,t5_2qi2i,103420,public,https://b.thumbs.redditmedia.com/QNLS-q_AlnZLn3iARqeayDJ0dlD4nPiSbTGD8yocSek.jpg,"""So he dozed off in the driver's seat of his van. When he awoke, his rig was surrounded by water.""",https://www.oregonlive.com/pacific-northwest-news/index.ssf/2018/08/oregon_man_bemoans_van_lost_at.html,all_ads,6,,,local-news,Local News,link,"{'enabled': False, 'images': [{'id': 'M0jBUiD8aLIT6WQaKDk02BKGYAi_XU-q-mLt2Jafvxc', 'resolutions': [{'height': 81, 'url': 'https://i.redditmedia.com/esNv5ogOJtNXuDLoRIK5weNL2ZN7Xyr3poVcfqO954A.jpg?fit=crop&amp;crop=faces%2Centropy&amp;arh=2&amp;w=108&amp;s=dfa929fa444667dedd8f79dcf3e62642', 'width': 108}, {'height': 162, 'url': 'https://i.redditmedia.com/esNv5ogOJtNXuDLoRIK5weNL2ZN7Xyr3poVcfqO954A.jpg?fit=crop&amp;crop=faces%2Centropy&amp;arh=2&amp;w=216&amp;s=b24f3ce1fbebf5fd69add00435bd55a9', 'width': 216}, {'height': 240, 'url': 'https://i.redditmedia.com/esNv5ogOJtNXuDLoRIK5weNL2ZN7Xyr3poVcfqO954A.jpg?fit=crop&amp;crop=faces%2Centropy&amp;arh=2&amp;w=320&amp;s=8e29ff3cfc0f11a794478e1778c55d6e', 'width': 320}, {'height': 480, 'url': 'https://i.redditmedia.com/esNv5ogOJtNXuDLoRIK5weNL2ZN7Xyr3poVcfqO954A.jpg?fit=crop&amp;crop=faces%2Centropy&amp;arh=2&amp;w=640&amp;s=2758bc5307d8fda61cdd6d2254b25253', 'width': 640}, {'height': 720, 'url': 'https://i.redditmedia.com/esNv5ogOJtNXuDLoRIK5weNL2ZN7Xyr3poVcfqO954A.jpg?fit=crop&amp;crop=faces%2Centropy&amp;arh=2&amp;w=960&amp;s=2881ca0e4ea18157ae5746342bc1a3fa', 'width': 960}], 'source': {'height': 720, 'url': 'https://i.redditmedia.com/esNv5ogOJtNXuDLoRIK5weNL2ZN7Xyr3poVcfqO954A.jpg?s=3847cb5d3c246d633d7fad608c45dae9', 'width': 960}, 'variants': {}}]}",105.0,140.0,,,,,
Akitaguru,,[],,text,t2_16w0hm,False,False,1535547891,koin.com,https://www.reddit.com/r/Portland/comments/9b93sy/which_of_you_turds_has_been_dropping_mines_in/,0,9b93sy,True,False,False,False,False,False,,[],dark,text,False,False,True,0,0,False,all_ads,/r/Portland/comments/9b93sy/which_of_you_turds_has_been_dropping_mines_in/,False,6,1535547891,3,,True,False,False,Portland,t5_2qi2i,103419,public,https://b.thumbs.redditmedia.com/j33VSpj8oM6-eDoaK3pRp6jOgEDpd0Q_Oac3YidHO5o.jpg,WHICH OF YOU TURDS HAS BEEN DROPPING MINES IN PUGET SOUND?,https://www.koin.com/news/washington/unexploded-device-floating-in-puget-sound-near-bainbridge/1402664430,all_ads,6,,,,,link,"{'enabled': False, 'images': [{'id': 'aONgM1DB-AntMlmDqd7u2lmdqyQ0W50IhXhQv6z3jME', 'resolutions': [{'height': 60, 'url': 'https://i.redditmedia.com/MIJklE-Q099k6CH-4rJwojrgR8TwAtzi-1dO5Zu3XPE.jpg?fit=crop&amp;crop=faces%2Centropy&amp;arh=2&amp;w=108&amp;s=e274b26af816332b9dd2aeda96008311', 'width': 108}, {'height': 121, 'url': 'https://i.redditmedia.com/MIJklE-Q099k6CH-4rJwojrgR8TwAtzi-1dO5Zu3XPE.jpg?fit=crop&amp;crop=faces%2Centropy&amp;arh=2&amp;w=216&amp;s=9ac656fcbe8a7d4c95de6dc3b35f2323', 'width': 216}, {'height': 179, 'url': 'https://i.redditmedia.com/MIJklE-Q099k6CH-4rJwojrgR8TwAtzi-1dO5Zu3XPE.jpg?fit=crop&amp;crop=faces%2Centropy&amp;arh=2&amp;w=320&amp;s=d5a15102c2af11ede66b0fa457101861', 'width': 320}, {'height': 359, 'url': 'https://i.redditmedia.com/MIJklE-Q099k6CH-4rJwojrgR8TwAtzi-1dO5Zu3XPE.jpg?fit=crop&amp;crop=faces%2Centropy&amp;arh=2&amp;w=640&amp;s=d0dc2131749183aff1af7e749a216a89', 'width': 640}, {'height': 539, 'url': 'https://i.redditmedia.com/MIJklE-Q099k6CH-4rJwojrgR8TwAtzi-1dO5Zu3XPE.jpg?fit=crop&amp;crop=faces%2Centropy&amp;arh=2&amp;w=960&amp;s=2fe52dab9ff6c31c4ad42df712e9b3dc', 'width': 960}, {'height': 606, 'url': 'https://i.redditmedia.com/MIJklE-Q099k6CH-4rJwojrgR8TwAtzi-1dO5Zu3XPE.jpg?fit=crop&amp;crop=faces%2Centropy&amp;arh=2&amp;w=1080&amp;s=1d3d23fe9f4aa49be3603dac75415890', 'width': 1080}], 'source': {'height': 719, 'url': 'https://i.redditmedia.com/MIJklE-Q099k6CH-4rJwojrgR8TwAtzi-1dO5Zu3XPE.jpg?s=c7861d422138e23721df2666f3c02bc5', 'width': 1280}, 'variants': {}}]}",78.0,140.0,,,,,
Akitaguru,,[],,text,t2_16w0hm,False,False,1535547283,koin.com,https://www.reddit.com/r/Portland/comments/9b90y0/which_of_you_turds_has_been_laying_mines_in_puget/,0,9b90y0,True,False,False,False,False,False,,[],dark,text,False,False,True,0,0,False,all_ads,/r/Portland/comments/9b90y0/which_of_you_turds_has_been_laying_mines_in_puget/,False,6,1535547284,1,,True,False,False,Portland,t5_2qi2i,103419,public,default,WHICH OF YOU TURDS HAS BEEN LAYING MINES IN PUGET SOUND?,https://www.koin.com/news/washington/unexploded-device-floating-in-puget-sound-near-bainbridge/1402664430,all_ads,6,,,local-news,Local News,,,,,,,,,
SweatyButterscotch,,[],,text,t2_237rmrgc,False,False,1535540322,self.Portland,https://www.reddit.com/r/Portland/comments/9b88p5/underage_pot_smoking_and_employment/,0,9b88p5,False,False,False,False,True,False,,[],dark,text,False,False,True,34,0,False,all_ads,/r/Portland/comments/9b88p5/underage_pot_smoking_and_employment/,False,6,1535540323,0,[removed],True,False,False,Portland,t5_2qi2i,103416,public,self,Under-Age Pot Smoking and Employment,https://www.reddit.com/r/Portland/comments/9b88p5/underage_pot_smoking_and_employment/,all_ads,6,,,,,,,,,,,,,
mastermoebius,,[],NW,text,t2_ag2j8,False,False,1535528080,self.Portland,https://www.reddit.com/r/Portland/comments/9b75ri/this_will_likely_be_unpopular_here_but_is_anyone/,0,9b75ri,True,False,False,False,True,False,,[],dark,text,False,False,True,0,0,False,all_ads,/r/Portland/comments/9b75ri/this_will_likely_be_unpopular_here_but_is_anyone/,False,6,1535528081,0,I'm going by myself but would love to hang out with folks before or after.,False,False,False,Portland,t5_2qi2i,103416,public,self,"This will likely be unpopular here, but is anyone going to the Jacksepticeye show?",https://www.reddit.com/r/Portland/comments/9b75ri/this_will_likely_be_unpopular_here_but_is_anyone/,all_ads,6,,dark,,,,,,,,,,,
NevoftheWilds,,[],,text,t2_ngi646k,False,False,1535518291,self.Portland,https://www.reddit.com/r/Portland/comments/9b69a5/dispersed_camping_in_mt_hood_national_forest/,0,9b69a5,True,False,False,False,True,False,,[],dark,text,False,False,True,19,0,False,all_ads,/r/Portland/comments/9b69a5/dispersed_camping_in_mt_hood_national_forest/,False,6,1535518292,4,"Hey y'all,

Looking to go with the wife this weekend into the Mt. Hood NF. We wanted to try and just ""find"" a dispersed campsite, preferably somewhere near water and not too far of a hike.

Does anyone have any advice for finding dispersed campsites, or any recommendations from previous experiences? We're looking for just a good one night getaway, preferably somewhere just off the road, ideally near a lake/river but not a deal breaker. 

Please help! Thanks!",True,False,False,Portland,t5_2qi2i,103409,public,self,Dispersed Camping in Mt. Hood National Forest,https://www.reddit.com/r/Portland/comments/9b69a5/dispersed_camping_in_mt_hood_national_forest/,all_ads,6,,,,,,,,,,,,,
_Jensin_,,[],,text,t2_hcuj4,False,False,1535518184,self.Portland,https://www.reddit.com/r/Portland/comments/9b68x0/wheres_the_party_at/,0,9b68x0,True,False,False,False,True,False,,[],dark,text,False,False,True,11,0,False,all_ads,/r/Portland/comments/9b68x0/wheres_the_party_at/,False,6,1535518185,0,So I'm from australia. Where would all the young people be drinking on a Tuesday night?,True,False,False,Portland,t5_2qi2i,103409,public,self,Where's the party at,https://www.reddit.com/r/Portland/comments/9b68x0/wheres_the_party_at/,all_ads,6,,,,,,,,,,,,,
shaggytits,,[],St Johns,text,t2_gii2c,False,False,1535515453,imgur.com,https://www.reddit.com/r/Portland/comments/9b5yq7/idiot_was_using_the_dog_as_a_headrest_in_his/,0,9b5yq7,True,False,False,False,False,False,,[],dark,text,False,False,True,7,0,False,all_ads,/r/Portland/comments/9b5yq7/idiot_was_using_the_dog_as_a_headrest_in_his/,False,6,1535515454,0,,True,False,False,Portland,t5_2qi2i,103406,public,default,Idiot was using the dog as a headrest in his convertible and made a fast left turn,https://imgur.com/a/mfXok49,all_ads,6,,dark,photo,Photo,,,,,6fa02886-42c6-11e1-9d5f-12313d18ad57,,,,
FrancisNero,,[],,text,t2_7kjhm,False,False,1535512640,self.Portland,https://www.reddit.com/r/Portland/comments/9b5nqz/purchasing_organ_meats/,0,9b5nqz,True,False,False,False,True,False,,[],dark,text,False,False,True,35,0,False,all_ads,/r/Portland/comments/9b5nqz/purchasing_organ_meats/,False,6,1535512641,1,Any suggestions on where to purchase organ meats in our fair city? ,True,False,False,Portland,t5_2qi2i,103403,public,self,Purchasing organ meats,https://www.reddit.com/r/Portland/comments/9b5nqz/purchasing_organ_meats/,all_ads,6,,,,,,,,,,,,,
7lusus4,,[],,text,t2_55syxqe,False,False,1535512493,self.Portland,https://www.reddit.com/r/Portland/comments/9b5n66/tonights_katu_circular_file_did_you_hear_it/,0,9b5n66,True,False,False,False,True,False,,[],dark,text,False,False,True,4,0,False,all_ads,/r/Portland/comments/9b5n66/tonights_katu_circular_file_did_you_hear_it/,False,6,1535512495,0,"I watch KATU’s news.  I also watch news from other sources; I try to get my knowledge from a wide variety to form my own opinions, so don’t say I only watch Sinclair.  Anyway...

I was half-watching tonight while burning dinner.  My wife heard the end of the evening’s showing right before Jeopardy and she heard SOMETHING from the Circular File section or whatever it’s called; it’s the show’s Slice of Life/Light Side/Funny News whatever thing.  It made her sufficiently irritable and she made grumbly noises, but I didn’t hear the section itself.  I asked and she said “{grumble} Never mind {grumble},” which is usually a good sign that it was, in fact, interesting to me but not to her.

So what was it?  I can’t find it online and I’m smart enough not to press too far when she’s irritable...  I’m incredibly curious (and nosy).",True,False,False,Portland,t5_2qi2i,103403,public,self,Tonight’s KATU Circular File: Did you hear it?,https://www.reddit.com/r/Portland/comments/9b5n66/tonights_katu_circular_file_did_you_hear_it/,all_ads,6,,,,,,,,,,,,,
Red_Patcher,,[],,text,t2_i4x8n,False,False,1535511817,articles.oregonlive.com,https://www.reddit.com/r/Portland/comments/9b5kac/i_was_thinking_that_this_thing_should_have_been/,0,9b5kac,True,False,False,False,False,False,,[],dark,text,False,False,True,1,0,False,all_ads,/r/Portland/comments/9b5kac/i_was_thinking_that_this_thing_should_have_been/,False,6,1535511818,1,,True,False,False,Portland,t5_2qi2i,103403,public,default,I was thinking that this thing should have been swapped out with a particular one of the orange variety but then I realized the Pacific Ocean is polluted enough.,https://articles.oregonlive.com/pacific-northwest-news/index.ssf/2018/08/oregon_man_bemoans_van_lost_at.amp,all_ads,6,,,local-news,Local News,,,,,,,,,
NWgreyskies1,,[],,text,t2_m5eptws,False,False,1535509111,i.redd.it,https://www.reddit.com/r/Portland/comments/9b58ee/schools_back_in_drive_safe/,0,9b58ee,True,False,False,True,False,False,,[],dark,text,False,False,True,16,0,False,all_ads,/r/Portland/comments/9b58ee/schools_back_in_drive_safe/,False,6,1535509112,23,,True,False,False,Portland,t5_2qi2i,103402,public,https://b.thumbs.redditmedia.com/ry15JuZ8whK6Yvtizra9ULCQjS_4fRKZ9dmrARNOmDU.jpg,Schools back in drive safe!,https://i.redd.it/z6ajqt9fzxi11.jpg,all_ads,6,,,photo,Photo,image,"{'enabled': True, 'images': [{'id': 'GoRkS6deFPTbP5BdcMHXLZEvUPAvhFWjSmtEnGnwEoI', 'resolutions': [{'height': 192, 'url': 'https://i.redditmedia.com/kHiE22FhviidrriCT6zduEdY24cnBsUFUq9phjgH_Ac.jpg?fit=crop&amp;crop=faces%2Centropy&amp;arh=2&amp;w=108&amp;s=7a154716924f76250d2e802e31ace24a', 'width': 108}, {'height': 384, 'url': 'https://i.redditmedia.com/kHiE22FhviidrriCT6zduEdY24cnBsUFUq9phjgH_Ac.jpg?fit=crop&amp;crop=faces%2Centropy&amp;arh=2&amp;w=216&amp;s=6d100fe9e91dfcd2abefe86ecc7bcca8', 'width': 216}, {'height': 568, 'url': 'https://i.redditmedia.com/kHiE22FhviidrriCT6zduEdY24cnBsUFUq9phjgH_Ac.jpg?fit=crop&amp;crop=faces%2Centropy&amp;arh=2&amp;w=320&amp;s=25ffbd016ad0b9d6d83aefa5f9e71562', 'width': 320}, {'height': 1137, 'url': 'https://i.redditmedia.com/kHiE22FhviidrriCT6zduEdY24cnBsUFUq9phjgH_Ac.jpg?fit=crop&amp;crop=faces%2Centropy&amp;arh=2&amp;w=640&amp;s=c960a55b1acc00593eef6a37be391bf2', 'width': 640}, {'height': 1706, 'url': 'https://i.redditmedia.com/kHiE22FhviidrriCT6zduEdY24cnBsUFUq9phjgH_Ac.jpg?fit=crop&amp;crop=faces%2Centropy&amp;arh=2&amp;w=960&amp;s=1098b14077d519a8f146aa4f082f4ddd', 'width': 960}, {'height': 1920, 'url': 'https://i.redditmedia.com/kHiE22FhviidrriCT6zduEdY24cnBsUFUq9phjgH_Ac.jpg?fit=crop&amp;crop=faces%2Centropy&amp;arh=2&amp;w=1080&amp;s=bc49117fc589a6e46bd27ea9926241ff', 'width': 1080}], 'source': {'height': 1920, 'url': 'https://i.redditmedia.com/kHiE22FhviidrriCT6zduEdY24cnBsUFUq9phjgH_Ac.jpg?s=a090229cd89222e1b4e713f086735b8e', 'width': 1080}, 'variants': {}}]}",140.0,140.0,,,,,
PDXPLUMBER,,[],,text,t2_qhshy,False,False,1535507377,self.Portland,https://www.reddit.com/r/Portland/comments/9b50pa/works_electric_scooters/,0,9b50pa,True,False,False,False,True,False,,[],dark,text,False,False,True,10,0,False,all_ads,/r/Portland/comments/9b50pa/works_electric_scooters/,False,6,1535507378,3,"I know, I know, enough about that scooters. I was out, like so many other routinely house bound middle aged people, riding the shit out of the scooters as soon as they showed up. I think for older people it's  a stupid easy, entry to having fun. Fun, OH yeah! I remember having fun. This is fucking great! Anyway,  I got the bug, and then I spent some time looking into how scooters could be better, and who builds them better, ( maybe a little forgiveness on the bumps so my fillings don't fall out of my teeth?).

I found these guys, http://www.works-electric.com/
right here in SE Portland. Has anyone ridden one? Anybody know anything about the builders? Seems like my kind of shop. I don't mind spending the money on something like this, I just wondered if anyone else has?",True,False,False,Portland,t5_2qi2i,103400,public,self,Works Electric scooters,https://www.reddit.com/r/Portland/comments/9b50pa/works_electric_scooters/,all_ads,6,,,,,,,,,,,,,
cryemoxkidcry,,[],,text,t2_33tao,False,False,1535504161,self.Portland,https://www.reddit.com/r/Portland/comments/9b4mgd/why_does_no_one_look_for_oncoming_traffic_before/,0,9b4mgd,True,False,False,False,True,False,,[],dark,text,False,False,True,33,0,False,all_ads,/r/Portland/comments/9b4mgd/why_does_no_one_look_for_oncoming_traffic_before/,False,6,1535504163,0,"I've spent time all over the country and this is the only place I've had daily problems with people meandering out into traffic as if they have no idea where they are, or that there are other people around them. Are they expecting an insurance payout or something similar? ",True,False,False,Portland,t5_2qi2i,103396,public,self,Why does no one look for oncoming traffic before crossing roads?,https://www.reddit.com/r/Portland/comments/9b4mgd/why_does_no_one_look_for_oncoming_traffic_before/,all_ads,6,,,,,,,,,,,,,
Sohcahtoa82,,[],Beaverton,text,t2_5k2ic,False,False,1535503277,self.Portland,https://www.reddit.com/r/Portland/comments/9b4ihu/best_thai_restaurant_in_portland/,0,9b4ihu,True,False,False,False,True,False,,[],dark,text,False,False,True,83,0,False,all_ads,/r/Portland/comments/9b4ihu/best_thai_restaurant_in_portland/,False,6,1535503277,2,"My wife loves Thai food, but I'm not a fan, but I'm gonna take her to Thai for her birthday anyways.

So what's the best Thai restaurant in the Portland metro area?  Preferably a place where I can make a reservation.

(Yeah, I know I can just Google this, but I prefer hearing from real people and not what some review site says)",True,False,False,Portland,t5_2qi2i,103398,public,self,Best Thai restaurant in Portland?,https://www.reddit.com/r/Portland/comments/9b4ihu/best_thai_restaurant_in_portland/,all_ads,6,,dark,,,,,,,,,,,
threwawaytherose,,[],,text,t2_9662g,False,False,1535500883,self.Portland,https://www.reddit.com/r/Portland/comments/9b47zj/i_have_a_basement_room_for_rent/,0,9b47zj,True,False,False,False,True,False,,[],dark,text,False,False,True,3,0,False,all_ads,/r/Portland/comments/9b47zj/i_have_a_basement_room_for_rent/,False,6,1535500883,0,"Hello, I have a room for rent at my place and hoping it is ok to post here! Looking for someone who is already living in Portland and can physically come meet us to see if it's a good fit.  
Pictures and details in the CL ad I posted : [Basement room for rent](https://portland.craigslist.org/mlt/roo/d/basement-room-in-woodlawn-500/6683412164.html)  
Thanks for looking.",True,False,False,Portland,t5_2qi2i,103391,public,self,I have a basement room for rent,https://www.reddit.com/r/Portland/comments/9b47zj/i_have_a_basement_room_for_rent/,all_ads,6,,,,,,,,,,,,,
combatwombat007,,[],,text,t2_uetww,False,False,1535499875,oregonlive.com,https://www.reddit.com/r/Portland/comments/9b43hw/that_voodoo_doughnut_rumor_theres_nothing_to_it/,0,9b43hw,True,False,False,False,False,False,,[],dark,text,False,False,True,2,0,False,all_ads,/r/Portland/comments/9b43hw/that_voodoo_doughnut_rumor_theres_nothing_to_it/,False,6,1535499876,0,,True,False,False,Portland,t5_2qi2i,103390,public,https://b.thumbs.redditmedia.com/GMMz2kirVtA1gQ5PsnW0duKvvawj15AY0tLyRr9J33w.jpg,"That Voodoo Doughnut rumor? There's nothing to it, police say",https://www.oregonlive.com/portland/index.ssf/2018/08/that_voodoo_doughnut_rumor_the.html,all_ads,6,,,,,link,"{'enabled': False, 'images': [{'id': '2-f0IYPObYoA1DG_hXWgq9oO689UMs6obG-3I5QOZ6M', 'resolutions': [{'height': 80, 'url': 'https://i.redditmedia.com/ocwCFQmjjgbVcUYJrY7tjRqFv2TRHXL2PgOBfTooLSY.jpg?fit=crop&amp;crop=faces%2Centropy&amp;arh=2&amp;w=108&amp;s=a43827690dec476e341e828324be03f2', 'width': 108}, {'height': 161, 'url': 'https://i.redditmedia.com/ocwCFQmjjgbVcUYJrY7tjRqFv2TRHXL2PgOBfTooLSY.jpg?fit=crop&amp;crop=faces%2Centropy&amp;arh=2&amp;w=216&amp;s=7300179c88cbc1d0cbc14869efaa4864', 'width': 216}, {'height': 239, 'url': 'https://i.redditmedia.com/ocwCFQmjjgbVcUYJrY7tjRqFv2TRHXL2PgOBfTooLSY.jpg?fit=crop&amp;crop=faces%2Centropy&amp;arh=2&amp;w=320&amp;s=c7eeba2e30882b9d79b50085a4550032', 'width': 320}], 'source': {'height': 464, 'url': 'https://i.redditmedia.com/ocwCFQmjjgbVcUYJrY7tjRqFv2TRHXL2PgOBfTooLSY.jpg?s=636884aec8eb32e502c7bf7d59ceb670', 'width': 620}, 'variants': {}}]}",104.0,140.0,,,,,
cbaca89,,[],,text,t2_7c5eo,False,False,1535499613,self.Portland,https://www.reddit.com/r/Portland/comments/9b428i/portland_dance_music/,0,9b428i,False,False,False,False,True,False,,[],dark,text,False,False,True,1,0,False,all_ads,/r/Portland/comments/9b428i/portland_dance_music/,False,6,1535499614,1,[removed],True,False,False,Portland,t5_2qi2i,103390,public,self,Portland Dance Music,https://www.reddit.com/r/Portland/comments/9b428i/portland_dance_music/,all_ads,6,,,,,,,,,,,,,
El_Cartografo,,[],,text,t2_d7v7v,False,False,1535499553,oregonlive.com,https://www.reddit.com/r/Portland/comments/9b41yt/that_voodoo_doughnut_rumor_theres_nothing_to_it/,0,9b41yt,True,False,False,False,False,False,,[],dark,text,False,False,True,33,0,False,all_ads,/r/Portland/comments/9b41yt/that_voodoo_doughnut_rumor_theres_nothing_to_it/,False,6,1535499553,41,,False,False,False,Portland,t5_2qi2i,103390,public,default,"That Voodoo Doughnut rumor? There's nothing to it, police say",https://www.oregonlive.com/portland/index.ssf/2018/08/that_voodoo_doughnut_rumor_the.html,all_ads,6,,,local-news,Local News,,,,,,,,,
haircut12344,,[],,text,t2_2334itmz,False,False,1535497565,self.Portland,https://www.reddit.com/r/Portland/comments/9b3slx/working_at_bishops_or_rudys/,0,9b3slx,True,False,False,False,True,False,,[],dark,text,False,False,True,8,0,False,all_ads,/r/Portland/comments/9b3slx/working_at_bishops_or_rudys/,False,6,1535497565,4,"Has anyone ever worked for bishops or Rudy’s? If so, what was your experience like?  Would you recommend it?",True,False,False,Portland,t5_2qi2i,103386,public,self,Working at Bishops or Rudy’s?,https://www.reddit.com/r/Portland/comments/9b3slx/working_at_bishops_or_rudys/,all_ads,6,,,,,,,,,,,,,
Trickmantj,,[],,text,t2_l1vzx,False,False,1535496270,self.Portland,https://www.reddit.com/r/Portland/comments/9b3m8y/does_anybody_know_why_helicopters_are_flying_low/,0,9b3m8y,True,False,False,False,True,False,,[],dark,text,False,False,True,29,0,False,all_ads,/r/Portland/comments/9b3m8y/does_anybody_know_why_helicopters_are_flying_low/,False,6,1535496272,7,Just had a helicopter fly rather low over my apartment twice. ,True,False,False,Portland,t5_2qi2i,103385,public,self,Does Anybody Know why helicopters are flying low overhead in SE?,https://www.reddit.com/r/Portland/comments/9b3m8y/does_anybody_know_why_helicopters_are_flying_low/,all_ads,6,,,,,,,,,,,,,
Morlok8k,,[],Gresham,text,t2_eyo3e,False,False,1535492918,self.Portland,https://www.reddit.com/r/Portland/comments/9b364b/all_of_my_friends_dab_tools_were_stolen_last_night/,0,9b364b,True,False,False,False,True,False,,[],dark,text,False,False,True,9,0,False,all_ads,/r/Portland/comments/9b364b/all_of_my_friends_dab_tools_were_stolen_last_night/,False,6,1535492919,0,"A propane torch, two nectar collectors, a metal case with oil slicks, and a 6+1 Lego container were all left out on the porch overnight at my friends house near 122nd &amp; Stark.

It may not seem like much, but damn it hurts when you can't afford to replace it... 

I'm just so sick and tired of stuff being stolen.  I've had so much stolen lately - but those were actual break-ins to my garage or car...

I can be reached here, no questions asked...",True,False,False,Portland,t5_2qi2i,103381,public,self,All of my friend's dab tools were stolen last night...,https://www.reddit.com/r/Portland/comments/9b364b/all_of_my_friends_dab_tools_were_stolen_last_night/,all_ads,6,,dark,,,,,,,,,,,
TapoutKing666,,[],,text,t2_16sxq1,False,False,1535490125,self.Portland,https://www.reddit.com/r/Portland/comments/9b2rsh/lake_oswego_prosperity_association_labor_day/,0,9b2rsh,True,False,False,False,True,False,,[],dark,text,False,False,True,5,0,False,all_ads,/r/Portland/comments/9b2rsh/lake_oswego_prosperity_association_labor_day/,False,6,1535490127,0,"
By Richard Tipkiss,
Rtipkiss@Oregonlive
The Oregonian/Oregonlive

Lake Oswego, Oregon - This upcoming Labor Day (Monday, September 3rd) marks the second annual LOPA (Lake Oswego Prosperity Association) Parade since the organization elected its new chairman, Jacob ""Jake"" Oswego in 2016.

The parade will start at 8:30am at Millennium Plaza Park, running down N. State Street, ending at George Rogers Park.

Registration is still open for Lake Oswego business owners and resident organizations alike. If you wish to register, please contact the Lake Oswego Prosperity Organization (www.LOPAelite.com/contact). The current registered float and march participants are as follows:

The Platinum Homeowners Guild (For residents with property values exceeding $2m)

Golden Dog Walkers Association (Senior citizens will parade their purebread Golden Retrievers)

Silver Starbucks™ Street Stroller Society (Middle aged coffee aficionados will demonstrate their walking and sipping skills)

North Face™ Northerners Club
(State street will become a high fashion catwalk for those who wear The North Face™ apparel - and also enjoy the genealogy originating in Northern Europe)

The Mountain Park Minority Reporters (This elite Neighborhood Watch group will be handing out free binoculars and brochures to the crowd, all in hopes to keep the community safe)

Jakes Blog Joggers
(A favorite from 2017. This exclusive club for morning joggers who are also fitness bloggers (Helmed by the famous town mascot, Jacob ""Jake"" Oswego) stunned crowds last year with their texting-while-running demonstration)

Oregon Subaru Club
(A definite crowd pleaser. Last year they set the world record for ""Longest Line of Subaru Outbacks on a Single Street"". Maybe this year they'll up the ante?)

The Southwest Maid and Butler Association for Fair Pay
(While their 2017 demonstration was considered to be very controversial, these migrant workers and indentured servants bring an exotic flair to the parade's caboose)

More details to come soon!



",True,False,False,Portland,t5_2qi2i,103379,public,self,Lake Oswego Prosperity Association (Labor Day Parade '18),https://www.reddit.com/r/Portland/comments/9b2rsh/lake_oswego_prosperity_association_labor_day/,all_ads,6,,,,,,,,,,,,,
