all_awardings,allow_live_comments,author,author_flair_css_class,author_flair_richtext,author_flair_text,author_flair_type,author_fullname,author_patreon_flair,author_premium,awarders,can_mod_post,contest_mode,created_utc,domain,full_link,gildings,id,is_crosspostable,is_meta,is_original_content,is_reddit_media_domain,is_robot_indexable,is_self,is_video,link_flair_background_color,link_flair_richtext,link_flair_text_color,link_flair_type,locked,media_only,no_follow,num_comments,num_crossposts,over_18,parent_whitelist_status,permalink,pinned,pwls,retrieved_on,score,selftext,send_replies,spoiler,stickied,subreddit,subreddit_id,subreddit_subscribers,subreddit_type,thumbnail,title,total_awards_received,treatment_tags,upvote_ratio,url,whitelist_status,wls,removed_by_category,author_flair_background_color,author_flair_text_color,link_flair_css_class,link_flair_text,post_hint,preview,thumbnail_height,thumbnail_width,distinguished,author_flair_template_id,media,media_embed,secure_media,secure_media_embed,suggested_sort,banned_by
[],False,Toyota4skinner,,[],,text,t2_43yfsxau,False,False,[],False,False,1589561000,self.Portland,https://www.reddit.com/r/Portland/comments/gkcmde/that_propane_smell_around_the_i5_bridge/,{},gkcmde,True,False,False,False,True,True,False,,[],dark,text,False,False,True,12,0,False,all_ads,/r/Portland/comments/gkcmde/that_propane_smell_around_the_i5_bridge/,False,6,1589564662,5,"Has anyone ever noticed that propane smell around  Marine drive by the expo center? Often times, you can smell it when driving on i5 even with the windows rolled up. Wondering where that smell is coming from.",True,False,False,Portland,t5_2qi2i,154110,public,self,That propane smell around the I5 bridge,0,[],1.0,https://www.reddit.com/r/Portland/comments/gkcmde/that_propane_smell_around_the_i5_bridge/,all_ads,6,,,,,,,,,,,,,,,,,
[],False,SE_PDX_Trashpicker,,[],,text,t2_6hhgd8c5,False,False,[],False,False,1589559774,self.Portland,https://www.reddit.com/r/Portland/comments/gkc8dz/im_picking_up_litter_around_se_portland_can_you/,{},gkc8dz,False,False,False,False,False,True,False,,[],dark,text,False,False,True,1,0,False,all_ads,/r/Portland/comments/gkc8dz/im_picking_up_litter_around_se_portland_can_you/,False,6,1589563550,1,[removed],True,False,False,Portland,t5_2qi2i,154109,public,self,I'm picking up litter around SE Portland. Can you help with disposal space?,0,[],1.0,https://www.reddit.com/r/Portland/comments/gkc8dz/im_picking_up_litter_around_se_portland_can_you/,all_ads,6,moderator,,,,,,,,,,,,,,,,
[],False,MIZZKATHY74,,[],,text,t2_52d2ntpx,False,False,[],False,False,1589557544,portlandlivingonthecheap.com,https://www.reddit.com/r/Portland/comments/gkbj2d/free_french_fries/,{},gkbj2d,True,False,False,False,True,False,False,,[],dark,text,False,False,True,4,0,False,all_ads,/r/Portland/comments/gkbj2d/free_french_fries/,False,6,1589561469,0,,True,False,False,Portland,t5_2qi2i,154107,public,default,Free French fries 🍟,0,[],0.45,https://portlandlivingonthecheap.com/free-fries-mcdonalds/,all_ads,6,,,,,,,,,,,,,,,,,
[],False,[deleted],,,,,,,,[],False,False,1589555166,self.Portland,https://www.reddit.com/r/Portland/comments/gkas4z/portland_open_for_business/,{},gkas4z,False,False,False,False,False,True,False,,[],dark,text,False,False,True,1,0,False,all_ads,/r/Portland/comments/gkas4z/portland_open_for_business/,False,6,1589559261,1,[deleted],True,False,False,Portland,t5_2qi2i,154106,public,default,Portland open for business,0,[],1.0,https://www.reddit.com/r/Portland/comments/gkas4z/portland_open_for_business/,all_ads,6,deleted,,dark,,,,,,,,,,,,,,
[],False,Piperz1,,[],,text,t2_2r0ga6qo,False,False,[],False,False,1589553385,i.redd.it,https://www.reddit.com/r/Portland/comments/gka8yp/okapi_in_portland/,{},gka8yp,True,False,False,True,True,False,False,,[],dark,text,False,False,False,9,0,False,all_ads,/r/Portland/comments/gka8yp/okapi_in_portland/,False,6,1589557633,7,,True,False,False,Portland,t5_2qi2i,154105,public,https://b.thumbs.redditmedia.com/dmHSP4GcbhXReRT-fNNxpigxfd2rBA-7b0BxVtylqKk.jpg,Okapi in Portland,0,[],0.73,https://i.redd.it/atdd801swxy41.jpg,all_ads,6,,,,photo,Photo,image,"{'enabled': True, 'images': [{'id': 'wxJVkGCcjnIV6Nbd9wVWk1r2kIuz3W3ZKebhWqpCxc8', 'resolutions': [{'height': 144, 'url': 'https://preview.redd.it/atdd801swxy41.jpg?width=108&amp;crop=smart&amp;auto=webp&amp;s=5c60e174bdbc40578e8bf39f9cad1580c1014d9d', 'width': 108}, {'height': 288, 'url': 'https://preview.redd.it/atdd801swxy41.jpg?width=216&amp;crop=smart&amp;auto=webp&amp;s=4b2eb05e19b4d2cb248b2af1e80c8cfbb39b7f84', 'width': 216}, {'height': 426, 'url': 'https://preview.redd.it/atdd801swxy41.jpg?width=320&amp;crop=smart&amp;auto=webp&amp;s=61810861be638418d10a30523edffaf5febc1d54', 'width': 320}, {'height': 853, 'url': 'https://preview.redd.it/atdd801swxy41.jpg?width=640&amp;crop=smart&amp;auto=webp&amp;s=6f7593ca1a828ffb0c0d1e1e8049688582cbc26d', 'width': 640}, {'height': 1280, 'url': 'https://preview.redd.it/atdd801swxy41.jpg?width=960&amp;crop=smart&amp;auto=webp&amp;s=3184d2a1434a156f9b33e65f6b4b834f213fab5f', 'width': 960}, {'height': 1440, 'url': 'https://preview.redd.it/atdd801swxy41.jpg?width=1080&amp;crop=smart&amp;auto=webp&amp;s=f46f4c74a85af51a6e2554d4de3c91bf0075b463', 'width': 1080}], 'source': {'height': 4032, 'url': 'https://preview.redd.it/atdd801swxy41.jpg?auto=webp&amp;s=ff145297d0afad2d5fcd0fad3370be3a1bd4b145', 'width': 3024}, 'variants': {}}]}",140.0,140.0,,,,,,,,
[],False,K_throwaway_B,,[],,text,t2_16x8vb,False,False,[],False,False,1589553294,self.Portland,https://www.reddit.com/r/Portland/comments/gka81f/clorox_wipes/,{},gka81f,True,False,False,False,True,True,False,,[],dark,text,False,False,True,35,0,False,all_ads,/r/Portland/comments/gka81f/clorox_wipes/,False,6,1589557549,0,Anyone know of any stores that still have Clorox wipes?,True,False,False,Portland,t5_2qi2i,154105,public,self,Clorox wipes,0,[],0.2,https://www.reddit.com/r/Portland/comments/gka81f/clorox_wipes/,all_ads,6,,,,,,,,,,,,,,,,,
[],False,Titus_29,,[],,text,t2_1iuj512r,False,False,[],False,False,1589552365,self.Portland,https://www.reddit.com/r/Portland/comments/gk9yep/sos_i_need_to_contact_the_unemployment_office/,{},gk9yep,True,False,False,False,True,True,False,,[],dark,text,False,False,True,20,0,False,all_ads,/r/Portland/comments/gk9yep/sos_i_need_to_contact_the_unemployment_office/,False,6,1589556695,0,"I was furloughed in March on St.Patrick's Day :(. I filed for unemployment and it took 3 weeks to get my first check, but have not received one sine then. I have filed my weekly claim every week but each week when I check my status it comes back as ""claim needs to be restarted"" this is the case with every single weekly claim! I have tried calling in relentlessly and I cannot get through. What can I do? My savings is depleted at this point, and though I have just returned to work I still am trying to get the money that I was told I would get. PLEASE HELP!!!!!",True,False,False,Portland,t5_2qi2i,154104,public,self,SOS I need to contact the unemployment office!,0,[],0.27,https://www.reddit.com/r/Portland/comments/gk9yep/sos_i_need_to_contact_the_unemployment_office/,all_ads,6,,,,,,,,,,,,,,,,,
[],False,mansplainlikeim5,,[],,text,t2_gdf31kl,False,False,[],False,False,1589551717,self.Portland,https://www.reddit.com/r/Portland/comments/gk9rpz/monster_speed_enforcement_event_on_i5_south_from/,{},gk9rpz,True,False,False,False,True,True,False,,[],dark,text,False,False,True,33,0,False,all_ads,/r/Portland/comments/gk9rpz/monster_speed_enforcement_event_on_i5_south_from/,False,6,1589553149,0,,True,False,False,Portland,t5_2qi2i,154104,public,self,Monster Speed Enforcement event on I5 south from Barbut to Carman Dr. 0700,0,[],0.43,https://www.reddit.com/r/Portland/comments/gk9rpz/monster_speed_enforcement_event_on_i5_south_from/,all_ads,6,,,,,,,,,,,,,,,,,
[],False,AutoModerator,,[],🌅,text,t2_6l4z3,False,True,[],False,False,1589551682,self.Portland,https://www.reddit.com/r/Portland/comments/gk9rcb/dear_portland_may_15_2020_weekly_rave_thread/,{},gk9rcb,True,False,False,False,True,True,False,,[],dark,text,False,False,True,92,0,False,all_ads,/r/Portland/comments/gk9rcb/dear_portland_may_15_2020_weekly_rave_thread/,False,6,1589553055,1,"What made you smile this week--tell us about it! what are you looking forward to this weekend? what's making you happy?

Caps lock off, downvotes never, go forth and be happy!",False,False,True,Portland,t5_2qi2i,154104,public,self,"dear portland: May 15, 2020 weekly rave thread",0,[],1.0,https://www.reddit.com/r/Portland/comments/gk9rcb/dear_portland_may_15_2020_weekly_rave_thread/,all_ads,6,,,dark,custom,Weekly Rave,,,,,moderator,,,,,,,
[],False,indyca,,[],,text,t2_qje2w4h,False,False,[],False,False,1589543076,self.Portland,https://www.reddit.com/r/Portland/comments/gk7li2/moving_in/,{},gk7li2,True,False,False,False,True,True,False,,[],dark,text,False,False,True,17,0,False,all_ads,/r/Portland/comments/gk7li2/moving_in/,False,6,1589543078,1,"After 9 long years of annual visits, I finally am moving to Portland, so excited!!",True,False,False,Portland,t5_2qi2i,154095,public,self,Moving in!,0,[],1.0,https://www.reddit.com/r/Portland/comments/gk7li2/moving_in/,all_ads,6,,,,,,,,,,,,,,,,,
[],False,dhdnen,,[],,text,t2_47s0p140,False,False,[],False,False,1589532780,self.Portland,https://www.reddit.com/r/Portland/comments/gk5jvz/is_there_an_online_petition_urging_oregon_to_go/,{},gk5jvz,True,False,False,False,True,True,False,,[],dark,text,False,False,True,84,0,False,all_ads,/r/Portland/comments/gk5jvz/is_there_an_online_petition_urging_oregon_to_go/,False,6,1589532785,1,"BEFORE ANYONE SAYS THIS IS AN UNUSUAL CIRCUMSTANCE WITH AN UNUSUALLY HIGH AMOUNT OF CLAIMS: Yes, this is true. However, California is processing PUA claims in two days. They also apologized for taking up to three weeks to process people’s pandemic UI claims. They also have far more people than we do. They have been doing their claims well within a reasonable timeframe. Yet California still apologized for claims taking up to three weeks agreeing it was too long. Meanwhile in Oregon, people have waited over two months. 

This issue doesn’t seem to be getting any better for us and their strange outdated solutions they keep adding in don’t seem to be working. I’m seeing some terrifying posts online from people who are scared and their mental health isn’t good and It’s really concerning. I’ve read about people who spend 40 hours a week on the phone trying to get through. It’s unacceptable. People are breaking down mentally. This isn’t good and I’m really terrified of what’s to come given that nobody knows how much longer it’ll take, or if they’ll ever even get that money at all as we all sort of continue to sit in limbo without any kind of valid, trustworthy communication.

I hardly hear of people getting paid out for PUA. I know regular UI is horrible too. Has anyone started an online petition? If there is one can you please link it in the comments? I’m not the best writer but if there isn’t a petition yet then I can type one up online myself tomorrow. My laptop charger is broken right now but I’m expecting a new one in the mail tomorrow so once I get that I’ll be able to type it up. If someone else is good at writing and wants to do it, please don’t hesitate to take that task on and make it. Just give me a heads up if you do so I can sign it and edit this post to include it. Also, if there is one that already exists and I’m just not finding it for some reason, then please post it in the comments. Thank you!",True,False,False,Portland,t5_2qi2i,154092,public,self,Is there an online petition urging Oregon to go into a state of emergency over unprocessed unemployment claims yet? Tons of people are starting to panic and it’s extremely concerning...,0,[],1.0,https://www.reddit.com/r/Portland/comments/gk5jvz/is_there_an_online_petition_urging_oregon_to_go/,all_ads,6,,,,,,,,,,,,,,,,,
[],False,0001212,,[],Beaverton,text,t2_hqvvmns,False,False,[],False,False,1589532746,self.Portland,https://www.reddit.com/r/Portland/comments/gk5jml/being_a_loner_is_getting_old/,{},gk5jml,True,False,False,False,True,True,False,,[],dark,text,False,False,True,80,0,False,all_ads,/r/Portland/comments/gk5jml/being_a_loner_is_getting_old/,False,6,1589532747,1,"TL;DR lets be book reading, coffee loving, meme sharing, city loving friends


I moved to Oregon two years ago in an attempt to distance myself from my old toxic life. I bought my home, got a new job, and focused on healing my wounds. 

I was okay being alone at first. I poured all my energy into working on the best version of myself. Now that I’ve resolved so many of my problems and am in a healthy place in my life I’m ready to branch out again and make friends. 

I find it hard to make connections in my day to day life. Im a shy person who takes a bit to warm up to. I just want someone who loves gardens/gardening/plants, music of all kinds, cooking, video games, reading, and a damn good cup of coffee to chat with. 

Portland I love you so much, I’ve admired from afar until I’ve been ready to open my heart to you. The culture that is steeped into this city  is something I’ve been enamored with and would love to be a part of in due time. I want to laugh and love with all of you! 

PM me if you need a friend",True,False,False,Portland,t5_2qi2i,154092,public,self,Being a loner is getting old,0,[],1.0,https://www.reddit.com/r/Portland/comments/gk5jml/being_a_loner_is_getting_old/,all_ads,6,,,dark,,,,,,,,1c71e906-42fd-11e1-b27b-12313d2c1af1,,,,,,
[],False,thespaceageisnow,,[],,text,t2_bqfutt4,False,False,[],False,False,1589527553,oregonlive.com,https://www.reddit.com/r/Portland/comments/gk4kb4/gov_kate_brown_is_allowing_nearly_all_of_oregons/,{},gk4kb4,True,False,False,False,True,False,False,,[],dark,text,False,False,True,23,0,False,all_ads,/r/Portland/comments/gk4kb4/gov_kate_brown_is_allowing_nearly_all_of_oregons/,False,6,1589527555,1,,True,False,False,Portland,t5_2qi2i,154090,public,https://b.thumbs.redditmedia.com/jvCQd-TpHlJJAvynP-zru81nBKYI67JXuQW5uavkt4M.jpg,"Gov. Kate Brown is allowing nearly all of Oregon’s counties outside the Portland metro area to begin reopening Friday, as well as all retail statewide",0,[],1.0,https://www.oregonlive.com/coronavirus/2020/05/governor-allows-28-counties-all-retail-stores-statewide-to-begin-phase-1-reopening-friday.html,all_ads,6,,,,,,link,"{'enabled': False, 'images': [{'id': 'l_XU_gKaz4cXGqXC0dIZCGZ5wFvOXHL0EYmqQPsWe_0', 'resolutions': [{'height': 54, 'url': 'https://external-preview.redd.it/kuz3bp4VjGy-vA_s1u9n96iTokxUMXrXJS5EaO943e4.jpg?width=108&amp;crop=smart&amp;auto=webp&amp;s=c457e8dfe8c238538646e475756882ecdc7cf564', 'width': 108}, {'height': 109, 'url': 'https://external-preview.redd.it/kuz3bp4VjGy-vA_s1u9n96iTokxUMXrXJS5EaO943e4.jpg?width=216&amp;crop=smart&amp;auto=webp&amp;s=050d8c013b445ad998e41c465c6ab2789cc4c47d', 'width': 216}, {'height': 161, 'url': 'https://external-preview.redd.it/kuz3bp4VjGy-vA_s1u9n96iTokxUMXrXJS5EaO943e4.jpg?width=320&amp;crop=smart&amp;auto=webp&amp;s=51fb98612ba9b53383a3edb041dc3f1c6ab1e30f', 'width': 320}, {'height': 323, 'url': 'https://external-preview.redd.it/kuz3bp4VjGy-vA_s1u9n96iTokxUMXrXJS5EaO943e4.jpg?width=640&amp;crop=smart&amp;auto=webp&amp;s=dc1216d46e0f493669f5248fe90fd78e9e6c7972', 'width': 640}, {'height': 485, 'url': 'https://external-preview.redd.it/kuz3bp4VjGy-vA_s1u9n96iTokxUMXrXJS5EaO943e4.jpg?width=960&amp;crop=smart&amp;auto=webp&amp;s=b63a6df54fe6ae5fe6557127c610ceb91d4117db', 'width': 960}, {'height': 545, 'url': 'https://external-preview.redd.it/kuz3bp4VjGy-vA_s1u9n96iTokxUMXrXJS5EaO943e4.jpg?width=1080&amp;crop=smart&amp;auto=webp&amp;s=9b312edc2d7b5e513d06753d2c0fec4455bf5104', 'width': 1080}], 'source': {'height': 647, 'url': 'https://external-preview.redd.it/kuz3bp4VjGy-vA_s1u9n96iTokxUMXrXJS5EaO943e4.jpg?auto=webp&amp;s=b7f1c0d867f7db5c99ca32c9a044a32ef8e0e47b', 'width': 1280}, 'variants': {}}]}",70.0,140.0,,,,,,,,
[],False,thespaceageisnow,,[],,text,t2_bqfutt4,False,False,[],False,False,1589527444,oregonlive.com,https://www.reddit.com/r/Portland/comments/gk4jk3/gov_kate_brown_is_allowing_nearly_all_of_oregons/,{},gk4jk3,True,False,False,False,True,False,False,,[],dark,text,False,False,True,0,0,False,all_ads,/r/Portland/comments/gk4jk3/gov_kate_brown_is_allowing_nearly_all_of_oregons/,False,6,1589527449,1,,True,False,False,Portland,t5_2qi2i,154090,public,default,"Gov. Kate Brown is allowing nearly all of Oregon’s counties outside the Portland metro area to begin reopening Friday, as well as all retail statewide",0,[],1.0,http://oregonlive.com/coronavirus/2020/05/governor-allows-28-counties-all-retail-stores-statewide-to-begin-phase-1-reopening-friday.html,all_ads,6,,,,local-news,Local News,,,,,,,,,,,,
[],False,thespaceageisnow,,[],,text,t2_bqfutt4,False,False,[],False,False,1589527372,oregonlive.com,https://www.reddit.com/r/Portland/comments/gk4j0v/coronavirus_in_oregon_governor_allows_31_counties/,{},gk4j0v,True,False,False,False,True,False,False,,[],dark,text,False,False,True,0,0,False,all_ads,/r/Portland/comments/gk4j0v/coronavirus_in_oregon_governor_allows_31_counties/,False,6,1589527375,1,,True,False,False,Portland,t5_2qi2i,154090,public,https://b.thumbs.redditmedia.com/jvCQd-TpHlJJAvynP-zru81nBKYI67JXuQW5uavkt4M.jpg,"Coronavirus in Oregon: Governor allows 31 counties (not metro yet), all retail stores statewide, to begin reopening Friday",0,[],1.0,https://www.oregonlive.com/coronavirus/2020/05/governor-allows-28-counties-all-retail-stores-statewide-to-begin-phase-1-reopening-friday.html,all_ads,6,,,,local-news,Local News,link,"{'enabled': False, 'images': [{'id': 'l_XU_gKaz4cXGqXC0dIZCGZ5wFvOXHL0EYmqQPsWe_0', 'resolutions': [{'height': 54, 'url': 'https://external-preview.redd.it/kuz3bp4VjGy-vA_s1u9n96iTokxUMXrXJS5EaO943e4.jpg?width=108&amp;crop=smart&amp;auto=webp&amp;s=c457e8dfe8c238538646e475756882ecdc7cf564', 'width': 108}, {'height': 109, 'url': 'https://external-preview.redd.it/kuz3bp4VjGy-vA_s1u9n96iTokxUMXrXJS5EaO943e4.jpg?width=216&amp;crop=smart&amp;auto=webp&amp;s=050d8c013b445ad998e41c465c6ab2789cc4c47d', 'width': 216}, {'height': 161, 'url': 'https://external-preview.redd.it/kuz3bp4VjGy-vA_s1u9n96iTokxUMXrXJS5EaO943e4.jpg?width=320&amp;crop=smart&amp;auto=webp&amp;s=51fb98612ba9b53383a3edb041dc3f1c6ab1e30f', 'width': 320}, {'height': 323, 'url': 'https://external-preview.redd.it/kuz3bp4VjGy-vA_s1u9n96iTokxUMXrXJS5EaO943e4.jpg?width=640&amp;crop=smart&amp;auto=webp&amp;s=dc1216d46e0f493669f5248fe90fd78e9e6c7972', 'width': 640}, {'height': 485, 'url': 'https://external-preview.redd.it/kuz3bp4VjGy-vA_s1u9n96iTokxUMXrXJS5EaO943e4.jpg?width=960&amp;crop=smart&amp;auto=webp&amp;s=b63a6df54fe6ae5fe6557127c610ceb91d4117db', 'width': 960}, {'height': 545, 'url': 'https://external-preview.redd.it/kuz3bp4VjGy-vA_s1u9n96iTokxUMXrXJS5EaO943e4.jpg?width=1080&amp;crop=smart&amp;auto=webp&amp;s=9b312edc2d7b5e513d06753d2c0fec4455bf5104', 'width': 1080}], 'source': {'height': 647, 'url': 'https://external-preview.redd.it/kuz3bp4VjGy-vA_s1u9n96iTokxUMXrXJS5EaO943e4.jpg?auto=webp&amp;s=b7f1c0d867f7db5c99ca32c9a044a32ef8e0e47b', 'width': 1280}, 'variants': {}}]}",70.0,140.0,,,,,,,,
[],False,treelovingaytheist,,[],,text,t2_euj5x,False,False,[],False,False,1589526943,i.redd.it,https://www.reddit.com/r/Portland/comments/gk4fyh/some_of_yall_are_getting_pretty_desperate/,{},gk4fyh,True,False,False,True,True,False,False,,[],dark,text,False,False,True,20,0,False,all_ads,/r/Portland/comments/gk4fyh/some_of_yall_are_getting_pretty_desperate/,False,6,1589526948,1,,True,False,False,Portland,t5_2qi2i,154090,public,https://b.thumbs.redditmedia.com/bHYFOMwpA3a0c_A2LSmmp8QOc9IOXAkKfvsm0MfoiUA.jpg,Some of y’all are getting pretty desperate...,0,[],1.0,https://i.redd.it/rm8ql9b6qvy41.jpg,all_ads,6,,,,photo,Photo,image,"{'enabled': True, 'images': [{'id': 'dO27AKhT_9Q5iebZMJH3Er5lrmeip0bEODu8W8y3lkQ', 'resolutions': [{'height': 104, 'url': 'https://preview.redd.it/rm8ql9b6qvy41.jpg?width=108&amp;crop=smart&amp;auto=webp&amp;s=6175544e31e4c7421e53524cf1104abe0d600215', 'width': 108}, {'height': 208, 'url': 'https://preview.redd.it/rm8ql9b6qvy41.jpg?width=216&amp;crop=smart&amp;auto=webp&amp;s=5950e79d9322dbc9acbe62f2ce3b5d11b6c653b5', 'width': 216}, {'height': 308, 'url': 'https://preview.redd.it/rm8ql9b6qvy41.jpg?width=320&amp;crop=smart&amp;auto=webp&amp;s=6da80cb3058a1c62a09f162ee4e1b9caf196a609', 'width': 320}, {'height': 617, 'url': 'https://preview.redd.it/rm8ql9b6qvy41.jpg?width=640&amp;crop=smart&amp;auto=webp&amp;s=71c0f3cb952c86abd7ec902318341b8560ca01bb', 'width': 640}], 'source': {'height': 724, 'url': 'https://preview.redd.it/rm8ql9b6qvy41.jpg?auto=webp&amp;s=b2944d11d6cf5bcfa703155d2ad7796b36ae154c', 'width': 750}, 'variants': {}}]}",135.0,140.0,,,,,,,,
[],False,BridgeCityBus,,[],Tilikum Crossing,text,t2_3yx0xraz,False,True,[],False,False,1589525782,i.redd.it,https://www.reddit.com/r/Portland/comments/gk47wr/first_week_back_in_a_while_and_im_enjoying_my/,{},gk47wr,True,False,False,True,True,False,False,,[],dark,text,False,False,True,15,0,False,all_ads,/r/Portland/comments/gk47wr/first_week_back_in_a_while_and_im_enjoying_my/,False,6,1589525786,1,,True,False,False,Portland,t5_2qi2i,154090,public,https://b.thumbs.redditmedia.com/ndQjRfgSXFqfiSEuxB-AcU8YGp0P23laik23CxdNljU.jpg,"First week back in a while and I’m enjoying my routes. I got to drive the 66/65 today, that allowed me to pull over on Terwilliger for a break. I got a 20 min and a 45 min break here. I need to polish my boots now—they are covered in mud and grass/petals/pollen. Life is good.",0,[],1.0,https://i.redd.it/q9ueprtpmvy41.jpg,all_ads,6,,,dark,photo,Photo,image,"{'enabled': True, 'images': [{'id': 'NWymP0tQsV3A8ijK1fpsEPvKqBtIuHJGH745w1Ghx18', 'resolutions': [{'height': 108, 'url': 'https://preview.redd.it/q9ueprtpmvy41.jpg?width=108&amp;crop=smart&amp;auto=webp&amp;s=12ebf499a6489fc75d89e6f61d7d9d8484f23cae', 'width': 108}, {'height': 216, 'url': 'https://preview.redd.it/q9ueprtpmvy41.jpg?width=216&amp;crop=smart&amp;auto=webp&amp;s=cdf534e6dab153a7f418d030d39bda14edafbe3c', 'width': 216}, {'height': 320, 'url': 'https://preview.redd.it/q9ueprtpmvy41.jpg?width=320&amp;crop=smart&amp;auto=webp&amp;s=3c963b74949586c2fb4886e34c90c11387280ec5', 'width': 320}, {'height': 640, 'url': 'https://preview.redd.it/q9ueprtpmvy41.jpg?width=640&amp;crop=smart&amp;auto=webp&amp;s=858d94bb47575fc668382e253165dba4c70a3d89', 'width': 640}, {'height': 960, 'url': 'https://preview.redd.it/q9ueprtpmvy41.jpg?width=960&amp;crop=smart&amp;auto=webp&amp;s=ecc00d724454051109f852c21957a6db3ebd377b', 'width': 960}, {'height': 1080, 'url': 'https://preview.redd.it/q9ueprtpmvy41.jpg?width=1080&amp;crop=smart&amp;auto=webp&amp;s=3015a579f312f8df5dd3e05f80ce92bd3ee9237c', 'width': 1080}], 'source': {'height': 1800, 'url': 'https://preview.redd.it/q9ueprtpmvy41.jpg?auto=webp&amp;s=d423dfce75ad95ca05ac081c935f9a1fa7bee44e', 'width': 1800}, 'variants': {}}]}",140.0,140.0,,dadf92e8-4942-11e7-9eb1-0e40e3d28306,,,,,,
[],False,bbgrl777,,[],,text,t2_6fmydw5y,False,False,[],False,False,1589525542,i.redd.it,https://www.reddit.com/r/Portland/comments/gk468s/new_tattoo/,{},gk468s,False,False,False,True,False,False,False,,[],dark,text,False,False,True,0,0,False,all_ads,/r/Portland/comments/gk468s/new_tattoo/,False,6,1589525546,1,,True,False,False,Portland,t5_2qi2i,154090,public,https://b.thumbs.redditmedia.com/B6UdSmz5FIc3BMOsBk_QydzsgPYLftSFRhK8PULQF_A.jpg,new tattoo!!!,0,[],1.0,https://i.redd.it/5zecdza0mvy41.jpg,all_ads,6,automod_filtered,,,,,image,"{'enabled': True, 'images': [{'id': 'EcE8YZ1yWVO5gE601mSx9DW4S17Yslp1khHbEhGfCt8', 'resolutions': [{'height': 104, 'url': 'https://preview.redd.it/5zecdza0mvy41.jpg?width=108&amp;crop=smart&amp;auto=webp&amp;s=1fdc3d75e4a057b78d18904855a25bef4443b4dd', 'width': 108}, {'height': 209, 'url': 'https://preview.redd.it/5zecdza0mvy41.jpg?width=216&amp;crop=smart&amp;auto=webp&amp;s=4ac351c94795d907266e73fc7efbd184454b7ac9', 'width': 216}, {'height': 310, 'url': 'https://preview.redd.it/5zecdza0mvy41.jpg?width=320&amp;crop=smart&amp;auto=webp&amp;s=85ddf112a5427ec930189f1dfbf6c6ee823f47ba', 'width': 320}, {'height': 621, 'url': 'https://preview.redd.it/5zecdza0mvy41.jpg?width=640&amp;crop=smart&amp;auto=webp&amp;s=b31d8a8463ae082a3d2405d2d3b79335d5dcacf4', 'width': 640}], 'source': {'height': 804, 'url': 'https://preview.redd.it/5zecdza0mvy41.jpg?auto=webp&amp;s=e76825129d173df3d2a825f73c5bc1b6ff8349d0', 'width': 828}, 'variants': {}}]}",135.0,140.0,,,,,,,,
[],False,Redsald,,[],,text,t2_eu3kt,False,False,[],False,False,1589524678,apple.news,https://www.reddit.com/r/Portland/comments/gk3zx3/most_oregon_counties_will_be_able_to_reopen_will/,{},gk3zx3,False,False,False,False,False,False,False,,[],dark,text,False,False,True,0,0,False,all_ads,/r/Portland/comments/gk3zx3/most_oregon_counties_will_be_able_to_reopen_will/,False,6,1589524684,1,,True,False,False,Portland,t5_2qi2i,154088,public,default,Most Oregon counties will be able to reopen — Will you leave the Portland metro area?,0,[],1.0,https://apple.news/AhfigBVOxSra4OYxxW0iQLw,all_ads,6,reddit,,,,,,,,,,,,,,,,
