author,author_flair_css_class,author_flair_richtext,author_flair_text,author_flair_type,brand_safe,can_mod_post,contest_mode,created_utc,domain,full_link,id,is_crosspostable,is_reddit_media_domain,is_self,is_video,link_flair_background_color,link_flair_css_class,link_flair_richtext,link_flair_text,link_flair_text_color,link_flair_type,locked,num_comments,num_crossposts,over_18,parent_whitelist_status,permalink,pinned,post_hint,preview,retrieved_on,rte_mode,score,selftext,spoiler,stickied,subreddit,subreddit_id,subreddit_type,thumbnail,thumbnail_height,thumbnail_width,title,url,whitelist_status,link_flair_template_id,author_flair_background_color,author_flair_text_color,banned_by,media,media_embed,secure_media,secure_media_embed,edited,crosspost_parent,crosspost_parent_list
tit_curtain,,[],,text,True,False,False,1518208058,oregonlive.com,https://www.reddit.com/r/Portland/comments/7wgcar/report_dont_allow_portland_cops_involved_in/,7wgcar,True,False,False,False,,local-news,"[{'e': 'text', 't': 'Local News'}]",Local News,dark,richtext,False,125,0,False,all_ads,/r/Portland/comments/7wgcar/report_dont_allow_portland_cops_involved_in/,False,link,"{'enabled': False, 'images': [{'id': 'sf3ONEE_9XxyIuIWT11N737QdDSzkaoly5pIz5q3WL4', 'resolutions': [{'height': 80, 'url': 'https://i.redditmedia.com/IT_dE_e-ls-4kCCFY8qDoMU5w55kYse9JeL9qihqW0I.jpg?fit=crop&amp;crop=faces%2Centropy&amp;arh=2&amp;w=108&amp;s=2729b7c9dac125d8182bf4abb9ef7018', 'width': 108}, {'height': 161, 'url': 'https://i.redditmedia.com/IT_dE_e-ls-4kCCFY8qDoMU5w55kYse9JeL9qihqW0I.jpg?fit=crop&amp;crop=faces%2Centropy&amp;arh=2&amp;w=216&amp;s=0b4d2deb60a690fcafdfbb37028d0076', 'width': 216}, {'height': 239, 'url': 'https://i.redditmedia.com/IT_dE_e-ls-4kCCFY8qDoMU5w55kYse9JeL9qihqW0I.jpg?fit=crop&amp;crop=faces%2Centropy&amp;arh=2&amp;w=320&amp;s=e3d787d027cc2c5a02d7e470e63aefe2', 'width': 320}], 'source': {'height': 464, 'url': 'https://i.redditmedia.com/IT_dE_e-ls-4kCCFY8qDoMU5w55kYse9JeL9qihqW0I.jpg?s=7845d7bf980b0c78b03cf1875b1d07fc', 'width': 620}, 'variants': {}}]}",1518275033,markdown,509,,False,False,Portland,t5_2qi2i,public,https://b.thumbs.redditmedia.com/vyT6GFb6si8TfGOBOxqM95A3VBA4E7-bCNldQBmZKMA.jpg,104.0,140.0,Report: Don't allow Portland cops involved in shootings to view video evidence before interview,http://www.oregonlive.com/portland/index.ssf/2018/02/consultants_dont_allow_portlan.html,all_ads,,,,,,,,,,,
EagleCreekFire,,[],,text,True,False,False,1518206524,trailkeepersoforegon.org,https://www.reddit.com/r/Portland/comments/7wg5ma/interested_in_working_on_restoring_the_gorge/,7wg5ma,True,False,False,False,,event,"[{'e': 'text', 't': 'Events'}]",Events,dark,richtext,False,10,0,False,all_ads,/r/Portland/comments/7wg5ma/interested_in_working_on_restoring_the_gorge/,False,link,"{'enabled': False, 'images': [{'id': 'VI_d9f_YbeUsoexjC3F-YyZcod9zwYXDA-YCd7PT9A4', 'resolutions': [{'height': 79, 'url': 'https://i.redditmedia.com/WheXIFOaDqc8sYl9JcnRsx13xCJ2kTuuQj7eL_fCazo.jpg?fit=crop&amp;crop=faces%2Centropy&amp;arh=2&amp;w=108&amp;s=34e9499fe5b5327d6d53d338c6c3e20a', 'width': 108}], 'source': {'height': 111, 'url': 'https://i.redditmedia.com/WheXIFOaDqc8sYl9JcnRsx13xCJ2kTuuQj7eL_fCazo.jpg?s=b2c0d67acbac5fd0c5a68553116cd0db', 'width': 150}, 'variants': {}}]}",1518272934,markdown,90,,False,False,Portland,t5_2qi2i,public,https://b.thumbs.redditmedia.com/dqs1b6O5dCfe0WmHDM2grPN0WznXo736oLdKraCC4so.jpg,103.0,140.0,Interested in working on Restoring the Gorge? February trail work parties are full but March should be posting soon.,https://www.trailkeepersoforegon.org/get-involved/trailwork/,all_ads,15259f58-f866-11e5-a8fa-0ed23bc17a17,,,,,,,,,,
bkerensa,,"[{'e': 'text', 't': 'NE'}]",NE,richtext,True,False,False,1518203365,oregonlive.com,https://www.reddit.com/r/Portland/comments/7wfs7e/surviving_loretta_smith/,7wfs7e,True,False,False,False,,local-news,"[{'e': 'text', 't': 'Local News'}]",Local News,dark,richtext,False,38,0,False,all_ads,/r/Portland/comments/7wfs7e/surviving_loretta_smith/,False,link,"{'enabled': False, 'images': [{'id': '9odjJb2lkhXO3ybSIR6HRUscqIlZtAYkSghlNfpMXFg', 'resolutions': [{'height': 72, 'url': 'https://i.redditmedia.com/yhBwoKB6iJtrJMNIydVR_bkgAKP0F_oIZFd9MZPAO2U.jpg?fit=crop&amp;crop=faces%2Centropy&amp;arh=2&amp;w=108&amp;s=a808df6063cceef8e3cd49d362540325', 'width': 108}, {'height': 144, 'url': 'https://i.redditmedia.com/yhBwoKB6iJtrJMNIydVR_bkgAKP0F_oIZFd9MZPAO2U.jpg?fit=crop&amp;crop=faces%2Centropy&amp;arh=2&amp;w=216&amp;s=fedc5d0ae539fcb2df14743de21fb51e', 'width': 216}, {'height': 213, 'url': 'https://i.redditmedia.com/yhBwoKB6iJtrJMNIydVR_bkgAKP0F_oIZFd9MZPAO2U.jpg?fit=crop&amp;crop=faces%2Centropy&amp;arh=2&amp;w=320&amp;s=d1fdfbc50393bc80f4c9a29e54f163d4', 'width': 320}], 'source': {'height': 400, 'url': 'https://i.redditmedia.com/yhBwoKB6iJtrJMNIydVR_bkgAKP0F_oIZFd9MZPAO2U.jpg?s=6bad77f13587c7822c5376e9b2dec1d1', 'width': 600}, 'variants': {}}]}",1518268079,markdown,22,,False,False,Portland,t5_2qi2i,public,https://a.thumbs.redditmedia.com/bSkzUuhUIuVrSKz4xOIV40c_-L1IOAihjqCoHYFSxF8.jpg,93.0,140.0,Surviving Loretta Smith,http://www.oregonlive.com/opinion/index.ssf/2018/02/steve_duin_surviving_loretta_s.html,all_ads,,,,,,,,,,,
[deleted],,,,,True,False,False,1518201427,katu.com,https://www.reddit.com/r/Portland/comments/7wfjiy/students_protesters_march_to_mark_one_year_since/,7wfjiy,False,False,False,False,,local-news,"[{'e': 'text', 't': 'Local News'}]",Local News,dark,richtext,False,6,0,False,all_ads,/r/Portland/comments/7wfjiy/students_protesters_march_to_mark_one_year_since/,False,,,1518264604,markdown,3,[deleted],False,False,Portland,t5_2qi2i,public,default,78.0,140.0,"Students, protesters march to mark one year since Portland teen shot, killed by police",http://katu.com/news/local/students-protesters-march-to-mark-one-year-since-portland-teen-shot-killed-by-police,all_ads,,,dark,,,,,,,,
IanKetterer,,[],,text,True,False,False,1518200809,self.Portland,https://www.reddit.com/r/Portland/comments/7wfgx2/hey_were_among_authors_from_seattle_and_were/,7wfgx2,True,False,True,False,,,[],,dark,text,False,8,0,False,all_ads,/r/Portland/comments/7wfgx2/hey_were_among_authors_from_seattle_and_were/,False,self,"{'enabled': False, 'images': [{'id': '9GB8ORi8c_9s2DJ6JMBGA8jpOZ8aFlkRkAO-uM3slcs', 'resolutions': [{'height': 81, 'url': 'https://i.redditmedia.com/qVjP-z2dP0QBXaA93npi1s7IpOPfbVuG98ZpYGZwx7o.jpg?fit=crop&amp;crop=faces%2Centropy&amp;arh=2&amp;w=108&amp;s=0921590fe6b13b619647f3f9adb16500', 'width': 108}, {'height': 162, 'url': 'https://i.redditmedia.com/qVjP-z2dP0QBXaA93npi1s7IpOPfbVuG98ZpYGZwx7o.jpg?fit=crop&amp;crop=faces%2Centropy&amp;arh=2&amp;w=216&amp;s=cf3d34db9bc31e0350bc121f58c1c207', 'width': 216}, {'height': 240, 'url': 'https://i.redditmedia.com/qVjP-z2dP0QBXaA93npi1s7IpOPfbVuG98ZpYGZwx7o.jpg?fit=crop&amp;crop=faces%2Centropy&amp;arh=2&amp;w=320&amp;s=ec85c96ebd55f0118edc19fd46279d36', 'width': 320}], 'source': {'height': 360, 'url': 'https://i.redditmedia.com/qVjP-z2dP0QBXaA93npi1s7IpOPfbVuG98ZpYGZwx7o.jpg?s=cb93d3561515e398a5730ee68c945a90', 'width': 480}, 'variants': {}}]}",1518263510,markdown,0,"Hey my name is Ian, singer/keyboardist of Seattle-based indie alt-rock band Among Authors. We're doing a tour down to L.A. in late February/early March and we're still looking to book Portland on either March 2nd or March 3rd. I'm wondering if there are any bands that are interested in sharing a bill with us on either of those dates. We really need some help lining up a venue, so if anyone knows of a solid place to play, we are all ears. Also joining the bill with us would be local portland artist The Holy Dark. Please check out much more band info, music, and recent press below. Thanks so much, hope to hear from you soon!

BAND BIO: A lyrically intriguing and musically emotional indie alt-rock band hailing out of Seattle Washington, Among Authors is fronted by lead singer and keyboardist Ian Ketterer. After undergoing open-heart surgery at the age of 23, Ian relocated the band from Wisconsin to Seattle, WA to further the band's music career. The band is unsure why they write such emotional music, maybe getting Ian's heart ripped out (in the most literal sense) subconsciously solidifies the band's writing process. Among Authors has been fortunate enough to be sponsored by an analog photography company called Lomography, which is based in Vienna, Austria. Among Authors wrote and recorded the music for a short film called “Dear Emma” and their music will also be featured in an upcoming Playstation 4 and Xbox One game called “On A Roll” which is due out in early 2018. Among Authors released their debut full length album “I AM BECOME” on physical CD and all digital platforms in April 2017. 180gram transparent blue Vinyl was released on December 2nd, 2017.

Below is a link to the animated music video we made for one of the singles off the album, and a link to stream the entire album on Spotify and SoundCloud (not sure your preference).

• WATCH ON YOUTUBE https://youtu.be/mhOR-k7jipQ

• LISTEN ON SPOTIFY https://open.spotify.com/album/5JSziexyfNdCYF9Loexoco

• OR LISTEN ON SOUNDCLOUD https://soundcloud.com/amongauthors/sets/i-am-become

PRESS QUOTES: ""We can confidently say I AM BECOME is one of the top albums to be released in the northwest so far this year."" ~ Northwest Music Scene - 100 bands in 100 days

""From my first listen to their single ""Imitation House"" I fell in love with these dudes and their Explosions In The Sky vibes. This album from Among Authors really doesn't sound like anything else happening in Seattle right now."" ~ Best New Albums of 2017 (so far) - 107.7 FM The End

""Epic indeed. In the land historically known for grunge guitars, it’s refreshing to find a band use piano as its primary instrument. Among Authors stand out among the Seattle scene, owing more to the epic, swelling melodies of bands like One Republic or even Radiohead than to the crunchy, angular guitar rock that often catches NadaMucho.com’s attention. Surpassing the band’s lovely, epic instrumentation are the vocals of Ian Ketterer; if his live performances don’t move you, check your pulse."" ~ Nadamucho.com's 41 bands to watch in 2017

""Among Authors has been getting some spins on Locals Only the last couple weeks, and after listening to their debut single “Imitation House,” you’ll see why."" ~ Branden Griffith - 107.7 The End",False,False,Portland,t5_2qi2i,public,self,,,Hey we're Among Authors (from Seattle) and we're looking to book a show in Portland on Mar. 2nd or 3rd as part of our west coast tour and we need some help!,https://www.reddit.com/r/Portland/comments/7wfgx2/hey_were_among_authors_from_seattle_and_were/,all_ads,,,,,,,,,,,
CarlSchmidt99,,[],,text,True,False,False,1518200789,reddit.com,https://www.reddit.com/r/Portland/comments/7wfgth/rip_phil_irwin/,7wfgth,True,False,False,False,,,[],,dark,text,False,1,0,False,all_ads,/r/Portland/comments/7wfgth/rip_phil_irwin/,False,link,"{'enabled': False, 'images': [{'id': 'MERAt0vB37HDtgy9ugWi56K5o_N4sAAOwrYwTX5Z4do', 'resolutions': [{'height': 81, 'url': 'https://i.redditmedia.com/_FNOqKeh2eRXrTwAZhQIBjnP4Fs_zUS7vfMjP7d8Xhk.jpg?fit=crop&amp;crop=faces%2Centropy&amp;arh=2&amp;w=108&amp;s=73c9247b7fef46446d92c744a3415b46', 'width': 108}, {'height': 162, 'url': 'https://i.redditmedia.com/_FNOqKeh2eRXrTwAZhQIBjnP4Fs_zUS7vfMjP7d8Xhk.jpg?fit=crop&amp;crop=faces%2Centropy&amp;arh=2&amp;w=216&amp;s=bbc56f6e23d70ab0bd4e0cc3c179a3be', 'width': 216}, {'height': 240, 'url': 'https://i.redditmedia.com/_FNOqKeh2eRXrTwAZhQIBjnP4Fs_zUS7vfMjP7d8Xhk.jpg?fit=crop&amp;crop=faces%2Centropy&amp;arh=2&amp;w=320&amp;s=d1ac9ba32f61d8ec5cd5e8537efb7eef', 'width': 320}], 'source': {'height': 240, 'url': 'https://i.redditmedia.com/_FNOqKeh2eRXrTwAZhQIBjnP4Fs_zUS7vfMjP7d8Xhk.jpg?s=e1f95e4edd1ce971db9ae5ee69b3a709', 'width': 320}, 'variants': {}}]}",1518263456,markdown,13,,False,False,Portland,t5_2qi2i,public,https://b.thumbs.redditmedia.com/x8qvVW4SaSDb_ciS8RWlxLLmxXTUWTElJQHocUoxiXU.jpg,105.0,140.0,RIP Phil Irwin,https://www.reddit.com/user/CarlSchmidt99/comments/7wfg6j/rip_phil_irwin_rancid_vatthee_whiskey/?utm_source=reddit-android,all_ads,,,,,,,,,,,
TheSynthesizer,,[],,text,True,False,False,1518200475,self.Portland,https://www.reddit.com/r/Portland/comments/7wffen/a_question_for_stumpdrunks_and_ripstoners_follow/,7wffen,True,False,True,False,,custom,"[{'e': 'text', 't': '1 marijuana pls'}]",1 marijuana pls,dark,richtext,False,38,0,False,all_ads,/r/Portland/comments/7wffen/a_question_for_stumpdrunks_and_ripstoners_follow/,False,,,1518262768,markdown,0,"I have smoked shit tons of weed and drank more than my fair share of alcohol...

But I still have a couple of questions.

1)  It is weird but I notice if I am sober would I prefer to be around someone who has had 2-3 beers versus someone who has had the ""same"" amount of weed.

I get alcohol being a social drug and all but I wonder if that's the only reason.  

Because.....


2)  I don't really know anyone who drinks the same way a lot of my friends smoke.  They kinda take huge rips and try to get as high as possible as fast as possible.  I don't have a single friend who would light a joint, take a hit, stub it out and relight it again in an hour, and then just nurse it all night.  

Contrast that to my alcohol friends.  I really don't know any who open all 6 beers and pound them as fast as possible. That would be weird.


So I don't have any agenda here, don't really care, but was just curious if this behavior is more due to the delivery method, the psychopharmacology or just the socialization of how we do these things.

Hmmm...",False,False,Portland,t5_2qi2i,public,self,,,A question for stumpdrunks and ripstoners. (Follow up about weed/ alcohol perceptions thread),https://www.reddit.com/r/Portland/comments/7wffen/a_question_for_stumpdrunks_and_ripstoners_follow/,all_ads,79c2c9da-0343-11e6-8466-0e6ae3cc5bdb,,dark,,,,,,,,
imbellish2,,"[{'e': 'text', 't': '""Evil IRC Cabal""'}]","""Evil IRC Cabal""",richtext,True,False,False,1518196059,self.Portland,https://www.reddit.com/r/Portland/comments/7wevda/lend_me_your_ears/,7wevda,False,False,True,False,,,[],,dark,text,False,0,0,False,all_ads,/r/Portland/comments/7wevda/lend_me_your_ears/,False,,,1518253245,markdown,1,[removed],False,False,Portland,t5_2qi2i,public,default,,,Lend me your ears!,https://www.reddit.com/r/Portland/comments/7wevda/lend_me_your_ears/,all_ads,,,dark,,,,,,,,
[deleted],,,,,True,False,False,1518195935,self.Portland,https://www.reddit.com/r/Portland/comments/7weuub/lend_me_your_ears/,7weuub,False,False,True,False,,,[],,dark,text,False,0,0,False,all_ads,/r/Portland/comments/7weuub/lend_me_your_ears/,False,,,1518252987,markdown,1,,False,False,Portland,t5_2qi2i,public,default,,,Lend me your ears!,https://www.reddit.com/r/Portland/comments/7weuub/lend_me_your_ears/,all_ads,,,dark,moderators,,,,,,,
[deleted],,,,,True,False,False,1518195638,self.Portland,https://www.reddit.com/r/Portland/comments/7wetgt/lend_me_your_ears/,7wetgt,False,False,True,False,,,[],,dark,text,False,0,0,False,all_ads,/r/Portland/comments/7wetgt/lend_me_your_ears/,False,,,1518252330,markdown,1,,False,False,Portland,t5_2qi2i,public,default,,,Lend me your ears!,https://www.reddit.com/r/Portland/comments/7wetgt/lend_me_your_ears/,all_ads,,,dark,moderators,,,,,,,
oregone1,,"[{'e': 'text', 't': 'NOT A MOD'}]",NOT A MOD,richtext,True,False,False,1518194822,sfgate.com,https://www.reddit.com/r/Portland/comments/7wepq6/talkeetna_alaska_has_a_cat_mayor_could_portland/,7wepq6,False,False,False,False,,,[],,dark,text,False,4,0,False,all_ads,/r/Portland/comments/7wepq6/talkeetna_alaska_has_a_cat_mayor_could_portland/,False,,,1518250536,markdown,0,,False,False,Portland,t5_2qi2i,public,default,93.0,140.0,Talkeetna Alaska has a cat mayor. Could Portland be next?,https://www.sfgate.com/travel/article/Talkeetna-Alaska-proudly-keeps-it-weird-6146319.php,all_ads,,,,,,,,,,,
[deleted],,,,,True,False,False,1518194679,google.com,https://www.reddit.com/r/Portland/comments/7wep4c/talkeetna_alaska_has_a_cat_mayor_could_portland/,7wep4c,False,False,False,False,,,[],,dark,text,False,0,0,False,all_ads,/r/Portland/comments/7wep4c/talkeetna_alaska_has_a_cat_mayor_could_portland/,False,,,1518250275,markdown,1,[deleted],False,False,Portland,t5_2qi2i,public,default,93.0,140.0,Talkeetna Alaska has a cat mayor. Could Portland be next?,https://www.google.com/amp/www.sfgate.com/travel/amp/Talkeetna-Alaska-proudly-keeps-it-weird-6146319.php,all_ads,,,dark,,,,,,,,
EagleCreekFire,,[],,text,True,False,False,1518193534,xinhuanet.com,https://www.reddit.com/r/Portland/comments/7wejzh/rare_marsupial_spotted_in_australian_forest_for/,7wejzh,False,False,False,False,,,[],,dark,text,False,1,0,False,all_ads,/r/Portland/comments/7wejzh/rare_marsupial_spotted_in_australian_forest_for/,False,,,1518247962,markdown,1,,False,False,Portland,t5_2qi2i,public,default,,,Rare marsupial spotted in Australian forest for first time in 35 years after forest fire. Could the Eagle Creek Fire allow Portlanders to discover rare animals here?,http://www.xinhuanet.com/english/2018-02/08/c_136957955.htm,all_ads,,,,,,,,,,,
[deleted],,,,,True,False,False,1518193459,xinhuanet.com,https://www.reddit.com/r/Portland/comments/7wejnc/rare_marsupial_spotted_in_australian_forest_for/,7wejnc,False,False,False,False,,,[],,dark,text,False,0,0,False,all_ads,/r/Portland/comments/7wejnc/rare_marsupial_spotted_in_australian_forest_for/,False,,,1518247803,markdown,1,[deleted],False,False,Portland,t5_2qi2i,public,default,,,Rare marsupial spotted in Australian forest for first time in 35 years. Could the Eagle Creek Fire allow Portlanders to discover rare animals here?,http://www.xinhuanet.com/english/2018-02/08/c_136957955.htm,all_ads,,,dark,,,,,,,,
babbage_ct,,"[{'e': 'text', 't': 'N'}]",N,richtext,True,False,False,1518192968,self.Portland,https://www.reddit.com/r/Portland/comments/7wehja/pyeongchang_is_hosting_the_winter_olympics_could/,7wehja,False,False,True,False,,,[],,dark,text,False,18,0,False,all_ads,/r/Portland/comments/7wehja/pyeongchang_is_hosting_the_winter_olympics_could/,False,,,1518246838,markdown,0,[removed],False,False,Portland,t5_2qi2i,public,default,,,PyeongChang is hosting the Winter Olympics. Could the Olympics Portland be next?,https://www.reddit.com/r/Portland/comments/7wehja/pyeongchang_is_hosting_the_winter_olympics_could/,all_ads,,,,,,,,,,,
Jason-in-silico,,"[{'e': 'text', 't': 'Mt Tabor'}]",Mt Tabor,richtext,True,False,False,1518192860,streamable.com,https://www.reddit.com/r/Portland/comments/7weh32/blazers_fans_dont_know_how_to_play_tic_tac_toe_on/,7weh32,True,False,False,False,,off-topic,"[{'e': 'text', 't': 'Other'}]",Other,dark,richtext,False,63,0,False,all_ads,/r/Portland/comments/7weh32/blazers_fans_dont_know_how_to_play_tic_tac_toe_on/,False,rich:video,"{'enabled': False, 'images': [{'id': 'QKB0HKysR7aKlXcXd5ajq1BNzz8LiYwdwzvutafZW8g', 'resolutions': [{'height': 60, 'url': 'https://i.redditmedia.com/2D8eIRJtBkU5jW_0Ixn_31k_DaDi3Vw-cGJJK2xbbsg.jpg?fit=crop&amp;crop=faces%2Centropy&amp;arh=2&amp;w=108&amp;s=6a5daa130dfce550a34965e0d2408ac7', 'width': 108}, {'height': 121, 'url': 'https://i.redditmedia.com/2D8eIRJtBkU5jW_0Ixn_31k_DaDi3Vw-cGJJK2xbbsg.jpg?fit=crop&amp;crop=faces%2Centropy&amp;arh=2&amp;w=216&amp;s=a54c9f69725c50db61fc0fa67d99612b', 'width': 216}, {'height': 180, 'url': 'https://i.redditmedia.com/2D8eIRJtBkU5jW_0Ixn_31k_DaDi3Vw-cGJJK2xbbsg.jpg?fit=crop&amp;crop=faces%2Centropy&amp;arh=2&amp;w=320&amp;s=aae02515d9ce7ab2d26f203aac546b8a', 'width': 320}, {'height': 360, 'url': 'https://i.redditmedia.com/2D8eIRJtBkU5jW_0Ixn_31k_DaDi3Vw-cGJJK2xbbsg.jpg?fit=crop&amp;crop=faces%2Centropy&amp;arh=2&amp;w=640&amp;s=08e7a9ddba0a9ffd1d6bfefe957cb818', 'width': 640}, {'height': 540, 'url': 'https://i.redditmedia.com/2D8eIRJtBkU5jW_0Ixn_31k_DaDi3Vw-cGJJK2xbbsg.jpg?fit=crop&amp;crop=faces%2Centropy&amp;arh=2&amp;w=960&amp;s=4b086d5bbbcc8c63f966064b4bbdd210', 'width': 960}, {'height': 607, 'url': 'https://i.redditmedia.com/2D8eIRJtBkU5jW_0Ixn_31k_DaDi3Vw-cGJJK2xbbsg.jpg?fit=crop&amp;crop=faces%2Centropy&amp;arh=2&amp;w=1080&amp;s=808ac63a164b0c6f9326b0d777b00487', 'width': 1080}], 'source': {'height': 720, 'url': 'https://i.redditmedia.com/2D8eIRJtBkU5jW_0Ixn_31k_DaDi3Vw-cGJJK2xbbsg.jpg?s=83f0ff26d5f20a9600eed11fe0c82ee9', 'width': 1280}, 'variants': {}}]}",1518246631,markdown,333,,False,False,Portland,t5_2qi2i,public,https://b.thumbs.redditmedia.com/9vRh8IFxyR9UenFAZMel1HaMuuBrLafO9aQp6Q6B-4E.jpg,78.0,140.0,"Blazers fans don't know how to play tic tac toe, on the jumbotron.",https://streamable.com/9npiz,all_ads,224cd8ea-f866-11e5-a935-0e9dc1ca97af,,,,"{'oembed': {'description': 'Check out this video on Streamable using your phone, tablet or desktop.', 'height': 338, 'html': '&lt;iframe class=""embedly-embed"" src=""//cdn.embedly.com/widgets/media.html?src=https%3A%2F%2Fstreamable.com%2Ft%2F9npiz&amp;url=https%3A%2F%2Fstreamable.com%2F9npiz&amp;image=https%3A%2F%2Fcf-e2.streamablevideo.com%2Fimage%2F9npiz.jpg%3Ftoken%3D1518155523-QBQFZpDy7c%252Bw%252BrtCalElM%252Fq4mEHcnE7K%252FZqce%252BU7qHU%253D&amp;key=522baf40bd3911e08d854040d3dc5c07&amp;type=text%2Fhtml&amp;schema=streamable"" width=""600"" height=""338"" scrolling=""no"" frameborder=""0"" allowfullscreen&gt;&lt;/iframe&gt;', 'provider_name': 'Streamable', 'provider_url': 'https://www.streamable.com', 'thumbnail_height': 720, 'thumbnail_url': 'https://cf-e2.streamablevideo.com/image/9npiz.jpg?token=1518155523-QBQFZpDy7c%2Bw%2BrtCalElM%2Fq4mEHcnE7K%2FZqce%2BU7qHU%3D', 'thumbnail_width': 1280, 'title': 'Streamable - free video publishing', 'type': 'video', 'version': '1.0', 'width': 600}, 'type': 'streamable.com'}","{'content': '&lt;iframe class=""embedly-embed"" src=""//cdn.embedly.com/widgets/media.html?src=https%3A%2F%2Fstreamable.com%2Ft%2F9npiz&amp;url=https%3A%2F%2Fstreamable.com%2F9npiz&amp;image=https%3A%2F%2Fcf-e2.streamablevideo.com%2Fimage%2F9npiz.jpg%3Ftoken%3D1518155523-QBQFZpDy7c%252Bw%252BrtCalElM%252Fq4mEHcnE7K%252FZqce%252BU7qHU%253D&amp;key=522baf40bd3911e08d854040d3dc5c07&amp;type=text%2Fhtml&amp;schema=streamable"" width=""600"" height=""338"" scrolling=""no"" frameborder=""0"" allowfullscreen&gt;&lt;/iframe&gt;', 'height': 338, 'scrolling': False, 'width': 600}","{'oembed': {'description': 'Check out this video on Streamable using your phone, tablet or desktop.', 'height': 338, 'html': '&lt;iframe class=""embedly-embed"" src=""https://cdn.embedly.com/widgets/media.html?src=https%3A%2F%2Fstreamable.com%2Ft%2F9npiz&amp;url=https%3A%2F%2Fstreamable.com%2F9npiz&amp;image=https%3A%2F%2Fcf-e2.streamablevideo.com%2Fimage%2F9npiz.jpg%3Ftoken%3D1518155523-QBQFZpDy7c%252Bw%252BrtCalElM%252Fq4mEHcnE7K%252FZqce%252BU7qHU%253D&amp;key=522baf40bd3911e08d854040d3dc5c07&amp;type=text%2Fhtml&amp;schema=streamable"" width=""600"" height=""338"" scrolling=""no"" frameborder=""0"" allowfullscreen&gt;&lt;/iframe&gt;', 'provider_name': 'Streamable', 'provider_url': 'https://www.streamable.com', 'thumbnail_height': 720, 'thumbnail_url': 'https://i.embed.ly/1/image?url=https%3A%2F%2Fcf-e2.streamablevideo.com%2Fimage%2F9npiz.jpg%3Ftoken%3D1518155523-QBQFZpDy7c%252Bw%252BrtCalElM%252Fq4mEHcnE7K%252FZqce%252BU7qHU%253D&amp;key=522baf40bd3911e08d854040d3dc5c07', 'thumbnail_width': 1280, 'title': 'Streamable - free video publishing', 'type': 'video', 'version': '1.0', 'width': 600}, 'type': 'streamable.com'}","{'content': '&lt;iframe class=""embedly-embed"" src=""https://cdn.embedly.com/widgets/media.html?src=https%3A%2F%2Fstreamable.com%2Ft%2F9npiz&amp;url=https%3A%2F%2Fstreamable.com%2F9npiz&amp;image=https%3A%2F%2Fcf-e2.streamablevideo.com%2Fimage%2F9npiz.jpg%3Ftoken%3D1518155523-QBQFZpDy7c%252Bw%252BrtCalElM%252Fq4mEHcnE7K%252FZqce%252BU7qHU%253D&amp;key=522baf40bd3911e08d854040d3dc5c07&amp;type=text%2Fhtml&amp;schema=streamable"" width=""600"" height=""338"" scrolling=""no"" frameborder=""0"" allowfullscreen&gt;&lt;/iframe&gt;', 'height': 338, 'media_domain_url': 'https://www.redditmedia.com/mediaembed/7weh32', 'scrolling': False, 'width': 600}",,,
Northpdx_v_everybody,,[],,text,True,False,False,1518192177,detroit.curbed.com,https://www.reddit.com/r/Portland/comments/7wee35/detroit_just_banned_airbnb_could_it_happen_here/,7wee35,False,False,False,False,,,[],,dark,text,False,17,0,False,all_ads,/r/Portland/comments/7wee35/detroit_just_banned_airbnb_could_it_happen_here/,False,,,1518245349,markdown,3,,False,False,Portland,t5_2qi2i,public,default,73.0,140.0,Detroit just banned Airbnb. [could it happen here?],https://detroit.curbed.com/2018/2/8/16991266/detroit-banned-airbnb-zoning,all_ads,,,,,,,,,,,
[deleted],,,,,True,False,False,1518190659,imgur.com,https://www.reddit.com/r/Portland/comments/7we7w9/are_sunrises_a_thing_this_morning/,7we7w9,False,False,False,False,,photo,"[{'e': 'text', 't': 'Photo'}]",Photo,dark,richtext,False,0,0,False,all_ads,/r/Portland/comments/7we7w9/are_sunrises_a_thing_this_morning/,False,,,1518242839,markdown,0,[deleted],False,False,Portland,t5_2qi2i,public,default,140.0,140.0,Are sunrises a thing this morning?,https://imgur.com/L98xp6M,all_ads,,,dark,,,,,,,,
humanclock,,"[{'e': 'text', 't': 'Foster-Powell'}]",Foster-Powell,richtext,True,False,False,1518189972,self.Portland,https://www.reddit.com/r/Portland/comments/7we552/some_other_town_did_something_could_it_happen_here/,7we552,False,False,True,False,,,[],,dark,text,False,13,0,False,all_ads,/r/Portland/comments/7we552/some_other_town_did_something_could_it_happen_here/,False,,,1518241766,markdown,24,[removed],False,False,Portland,t5_2qi2i,public,default,,,Some other town did something [could it happen here?],https://www.reddit.com/r/Portland/comments/7we552/some_other_town_did_something_could_it_happen_here/,all_ads,,,,,,,,,,,
