author,author_flair_css_class,author_flair_richtext,author_flair_text,author_flair_type,author_fullname,author_patreon_flair,can_mod_post,contest_mode,created_utc,domain,full_link,gildings,id,is_crosspostable,is_meta,is_original_content,is_reddit_media_domain,is_robot_indexable,is_self,is_video,link_flair_background_color,link_flair_richtext,link_flair_text_color,link_flair_type,locked,media_only,no_follow,num_comments,num_crossposts,over_18,parent_whitelist_status,permalink,pinned,pwls,retrieved_on,score,selftext,send_replies,spoiler,stickied,subreddit,subreddit_id,subreddit_subscribers,subreddit_type,thumbnail,title,updated_utc,url,whitelist_status,wls,link_flair_css_class,link_flair_text,author_flair_background_color,author_flair_template_id,author_flair_text_color,post_hint,preview,thumbnail_height,thumbnail_width,media,media_embed,secure_media,secure_media_embed,author_cakeday,media_metadata
rgretzky,,[],,text,t2_11epj1,False,False,False,1554606979,youtube.com,https://www.reddit.com/r/Portland/comments/bac8s3/gretzky_taking_lives_rap_official_video/,"{'gid_1': 0, 'gid_2': 0, 'gid_3': 0}",bac8s3,True,False,False,False,True,False,False,,[],dark,text,False,False,True,1,0,False,all_ads,/r/Portland/comments/bac8s3/gretzky_taking_lives_rap_official_video/,False,6,1554606981,0,,False,False,False,Portland,t5_2qi2i,122852,public,https://b.thumbs.redditmedia.com/PGQZAYU-bpc5GBS-O4qPXIW-p3NqvFEkiAyMIdH68AM.jpg,Gretzky -Taking Lives [Rap] (Official Video),1554693350,https://www.youtube.com/watch?v=uyN9XV-oWOo,all_ads,6,custom,Video,,,,rich:video,"{'enabled': False, 'images': [{'id': '4IYdYuoDBV9QKkIMfCMelo4v0lNQn0DT-Vs3oH120Mk', 'resolutions': [{'height': 81, 'url': 'https://external-preview.redd.it/7zypPOh6x5cmJNaBZqCOUl7DZCPsVSl8Xu3CO208Rn0.jpg?width=108&amp;crop=smart&amp;auto=webp&amp;s=a02a7213df17c011171b79c97bd43e8ea5f39066', 'width': 108}, {'height': 162, 'url': 'https://external-preview.redd.it/7zypPOh6x5cmJNaBZqCOUl7DZCPsVSl8Xu3CO208Rn0.jpg?width=216&amp;crop=smart&amp;auto=webp&amp;s=096aea49354c0fd81f8ca66deb0b4f1ff9072ba7', 'width': 216}, {'height': 240, 'url': 'https://external-preview.redd.it/7zypPOh6x5cmJNaBZqCOUl7DZCPsVSl8Xu3CO208Rn0.jpg?width=320&amp;crop=smart&amp;auto=webp&amp;s=d9d4d68bdc672abf36b307c16d37eb0f6ad17f8e', 'width': 320}], 'source': {'height': 360, 'url': 'https://external-preview.redd.it/7zypPOh6x5cmJNaBZqCOUl7DZCPsVSl8Xu3CO208Rn0.jpg?auto=webp&amp;s=52f547de10525f1ec6586d070851d19d5856a2ec', 'width': 480}, 'variants': {}}]}",105.0,140.0,"{'oembed': {'author_name': 'TAKEALOOK MEDIA TV', 'author_url': 'https://www.youtube.com/channel/UC2iJO1SF6wmvijQJfuE6Qbg', 'height': 338, 'html': '&lt;iframe width=""600"" height=""338"" src=""https://www.youtube.com/embed/uyN9XV-oWOo?feature=oembed&amp;enablejsapi=1"" frameborder=""0"" allow=""accelerometer; autoplay; encrypted-media; gyroscope; picture-in-picture"" allowfullscreen&gt;&lt;/iframe&gt;', 'provider_name': 'YouTube', 'provider_url': 'https://www.youtube.com/', 'thumbnail_height': 360, 'thumbnail_url': 'https://i.ytimg.com/vi/uyN9XV-oWOo/hqdefault.jpg', 'thumbnail_width': 480, 'title': 'Gretzky -Taking Lives [Rap] (Official Video)', 'type': 'video', 'version': '1.0', 'width': 600}, 'type': 'youtube.com'}","{'content': '&lt;iframe width=""600"" height=""338"" src=""https://www.youtube.com/embed/uyN9XV-oWOo?feature=oembed&amp;enablejsapi=1"" frameborder=""0"" allow=""accelerometer; autoplay; encrypted-media; gyroscope; picture-in-picture"" allowfullscreen&gt;&lt;/iframe&gt;', 'height': 338, 'scrolling': False, 'width': 600}","{'oembed': {'author_name': 'TAKEALOOK MEDIA TV', 'author_url': 'https://www.youtube.com/channel/UC2iJO1SF6wmvijQJfuE6Qbg', 'height': 338, 'html': '&lt;iframe width=""600"" height=""338"" src=""https://www.youtube.com/embed/uyN9XV-oWOo?feature=oembed&amp;enablejsapi=1"" frameborder=""0"" allow=""accelerometer; autoplay; encrypted-media; gyroscope; picture-in-picture"" allowfullscreen&gt;&lt;/iframe&gt;', 'provider_name': 'YouTube', 'provider_url': 'https://www.youtube.com/', 'thumbnail_height': 360, 'thumbnail_url': 'https://i.ytimg.com/vi/uyN9XV-oWOo/hqdefault.jpg', 'thumbnail_width': 480, 'title': 'Gretzky -Taking Lives [Rap] (Official Video)', 'type': 'video', 'version': '1.0', 'width': 600}, 'type': 'youtube.com'}","{'content': '&lt;iframe width=""600"" height=""338"" src=""https://www.youtube.com/embed/uyN9XV-oWOo?feature=oembed&amp;enablejsapi=1"" frameborder=""0"" allow=""accelerometer; autoplay; encrypted-media; gyroscope; picture-in-picture"" allowfullscreen&gt;&lt;/iframe&gt;', 'height': 338, 'media_domain_url': 'https://www.redditmedia.com/mediaembed/bac8s3', 'scrolling': False, 'width': 600}",,
guanaco55,,[],Regional Gallowboob,text,t2_hyfa9,False,False,False,1554602500,oregonlive.com,https://www.reddit.com/r/Portland/comments/babmw3/abbys_closet_gives_away_thousands_of_prom_dresses/,"{'gid_1': 0, 'gid_2': 0, 'gid_3': 0}",babmw3,True,False,False,False,True,False,False,,[],dark,text,False,False,True,4,0,False,all_ads,/r/Portland/comments/babmw3/abbys_closet_gives_away_thousands_of_prom_dresses/,False,6,1554602500,65,,True,False,False,Portland,t5_2qi2i,122848,public,default,Abby’s Closet gives away thousands of prom dresses this weekend at the Oregon Convention Center,1554688886,https://www.oregonlive.com/news/2019/04/abbys-closet-gives-away-thousands-of-prom-dresses-this-weekend-at-the-oregon-convention-center.html,all_ads,6,,,,,dark,,,,,,,,,,
timtamtt,,[],,text,t2_u0whg,False,False,False,1554602314,i.redd.it,https://www.reddit.com/r/Portland/comments/bablut/drove_the_historic_columbia_river_highway_today/,"{'gid_1': 0, 'gid_2': 0, 'gid_3': 0}",bablut,True,False,False,True,True,False,False,,[],dark,text,False,False,True,4,0,False,all_ads,/r/Portland/comments/bablut/drove_the_historic_columbia_river_highway_today/,False,6,1554602315,45,,True,False,False,Portland,t5_2qi2i,122848,public,default,Drove the Historic Columbia River Highway today.,1554688696,https://i.redd.it/bd50bmya1rq21.jpg,all_ads,6,photo,Photo,,,,,,,,,,,,,
tonderthrowaway,,[],,text,t2_2nea9cjc,False,False,False,1554601809,i.redd.it,https://www.reddit.com/r/Portland/comments/babj7n/missing_cat_in_st_johns_seneca_columbia_waysmall/,"{'gid_1': 0, 'gid_2': 0, 'gid_3': 0}",babj7n,True,False,False,True,True,False,False,,[],dark,text,False,False,True,9,0,False,all_ads,/r/Portland/comments/babj7n/missing_cat_in_st_johns_seneca_columbia_waysmall/,False,6,1554601811,83,,True,False,False,Portland,t5_2qi2i,122845,public,https://b.thumbs.redditmedia.com/6Z9I5n7yVjBIXZ05HIxkdXru0h5hJrZe7C9vd6wyTLU.jpg,"missing cat in St. Johns (Seneca &amp; Columbia Way)...small friendly tabby, no collar, may convince you she's starving",1554688191,https://i.redd.it/i89qldzlzqq21.jpg,all_ads,6,photo,Photo,,,,image,"{'enabled': True, 'images': [{'id': 'FFFxPsbiJnZoKukZt56ZE-52uFttZ7YK05OVdEfV4NQ', 'resolutions': [{'height': 31, 'url': 'https://preview.redd.it/i89qldzlzqq21.jpg?width=108&amp;crop=smart&amp;auto=webp&amp;s=ca4bc0717fdbbc8ef4e3b8c0379af20f395261db', 'width': 108}, {'height': 62, 'url': 'https://preview.redd.it/i89qldzlzqq21.jpg?width=216&amp;crop=smart&amp;auto=webp&amp;s=988b0f69f65fc52c79f4b7289b883812f7fd53be', 'width': 216}, {'height': 92, 'url': 'https://preview.redd.it/i89qldzlzqq21.jpg?width=320&amp;crop=smart&amp;auto=webp&amp;s=d44c0ec873e3c843b8d96845cf6576277ce56b6c', 'width': 320}, {'height': 184, 'url': 'https://preview.redd.it/i89qldzlzqq21.jpg?width=640&amp;crop=smart&amp;auto=webp&amp;s=4064e4b5fcfbe1dee8d89eab227149e39b839009', 'width': 640}], 'source': {'height': 250, 'url': 'https://preview.redd.it/i89qldzlzqq21.jpg?auto=webp&amp;s=100806762df56a96c33d7abefc0444864f821028', 'width': 865}, 'variants': {}}]}",40.0,140.0,,,,,,
WhereverUGoThereUR,,[],NW Heights,text,t2_7z04y,False,False,False,1554601803,i.redd.it,https://www.reddit.com/r/Portland/comments/babj6b/sea_scout_ship_643_postsail_report_great_afternoon/,"{'gid_1': 0, 'gid_2': 0, 'gid_3': 0}",babj6b,True,False,False,True,True,False,False,,[],dark,text,False,False,True,8,0,False,all_ads,/r/Portland/comments/babj6b/sea_scout_ship_643_postsail_report_great_afternoon/,False,6,1554601804,14,,False,False,False,Portland,t5_2qi2i,122845,public,default,Sea Scout Ship 643 post-sail report (Great afternoon!),1554688176,https://i.redd.it/66cu6haozqq21.jpg,all_ads,6,,,,a83c2e8e-42ca-11e1-a86c-12313d096aae,dark,,,,,,,,,,
giuseppiseafoodsnack,,[],,text,t2_37668jnn,False,False,False,1554601487,i.redd.it,https://www.reddit.com/r/Portland/comments/babhkr/i_think_this_is_my_favorite_building_in_portland/,"{'gid_1': 0, 'gid_2': 0, 'gid_3': 0}",babhkr,True,False,False,True,True,False,False,,[],dark,text,False,False,True,4,0,False,all_ads,/r/Portland/comments/babhkr/i_think_this_is_my_favorite_building_in_portland/,False,6,1554601488,46,,True,False,False,Portland,t5_2qi2i,122845,public,default,"I think this is my favorite building in Portland... what are some of your favorites? (Believe it or not, this is a no filter iPhone shot)",1554687869,https://i.redd.it/was59iruyqq21.jpg,all_ads,6,,,,,,,,,,,,,,,
Eddsworld_Starboy,,[],,text,t2_149c0tq,False,False,False,1554601260,self.Portland,https://www.reddit.com/r/Portland/comments/babge3/anybody_whos_been_to_ohsu_as_a_visitor_or_a/,"{'gid_1': 0, 'gid_2': 0, 'gid_3': 0}",babge3,True,False,False,False,True,True,False,,[],dark,text,False,False,True,8,0,False,all_ads,/r/Portland/comments/babge3/anybody_whos_been_to_ohsu_as_a_visitor_or_a/,False,6,1554601261,38,"Remember Hope? She was/is the golden retriever that (forgot her name) had as an emotional support dog for people. I used to visit my dad there and I would talk to Hope's owner. I randomly remembered that Hope was a thing and got really nostalgic. I got to see Hope 3 times from what I remember. (this was \~5 years ago) The owner gave my dad a plush of Hope to put in his room. I'm trying to find the plush in my closet because I saw it a few weeks ago. My dad didn't make it and the first thing I got back was the Hope plush. (mom gave it to me) I slept next to it to help me not be so sad about the death. I miss Hope and my dad. The only Hope I've lost was the plush but I'l find it soon. Stay safe, everyone. Thanks for reading this.",True,False,False,Portland,t5_2qi2i,122843,public,self,Anybody who's been to OHSU as a visitor or a patient remember Hope?,1554687632,https://www.reddit.com/r/Portland/comments/babge3/anybody_whos_been_to_ohsu_as_a_visitor_or_a/,all_ads,6,,,,,,,,,,,,,,,
fuckyoufeedme,,[],,text,t2_2wg1biks,False,False,False,1554601106,self.Portland,https://www.reddit.com/r/Portland/comments/babflw/does_cannibas_nation_do_returns/,"{'gid_1': 0, 'gid_2': 0, 'gid_3': 0}",babflw,True,False,False,False,True,True,False,,[],dark,text,False,False,True,8,0,False,all_ads,/r/Portland/comments/babflw/does_cannibas_nation_do_returns/,False,6,1554601107,0,I overspent and I don't need a full gram of oil... Damn,True,False,False,Portland,t5_2qi2i,122843,public,self,Does cannibas nation do returns?,1554687480,https://www.reddit.com/r/Portland/comments/babflw/does_cannibas_nation_do_returns/,all_ads,6,,,,,,,,,,,,,,,
wormrunner,,[],,text,t2_8xic2,False,False,False,1554600428,self.Portland,https://www.reddit.com/r/Portland/comments/babc4i/waiting_for_the_train_at_11th_division_over_an/,"{'gid_1': 0, 'gid_2': 0, 'gid_3': 0}",babc4i,True,False,False,False,True,True,False,,[],dark,text,False,False,True,34,0,False,all_ads,/r/Portland/comments/babc4i/waiting_for_the_train_at_11th_division_over_an/,False,6,1554600429,4,,True,False,False,Portland,t5_2qi2i,122842,public,self,Waiting for the train at 11th &amp; Division. Over an hour so far.,1554686801,https://www.reddit.com/r/Portland/comments/babc4i/waiting_for_the_train_at_11th_division_over_an/,all_ads,6,,,,,,,,,,,,,,,
jenred,,[],,text,t2_80uo,False,False,False,1554599840,i.redd.it,https://www.reddit.com/r/Portland/comments/bab930/obligatory_portland_cherry_blossoms_annual_photo/,"{'gid_1': 0, 'gid_2': 0, 'gid_3': 0}",bab930,True,False,False,True,True,False,False,,[],dark,text,False,False,True,0,0,False,all_ads,/r/Portland/comments/bab930/obligatory_portland_cherry_blossoms_annual_photo/,False,6,1554599842,0,,True,False,False,Portland,t5_2qi2i,122841,public,default,Obligatory Portland Cherry Blossoms Annual Photo,1554686225,https://i.redd.it/tc4g1l7ytqq21.jpg,all_ads,6,photo,Photo,,,,,,,,,,,,,
x_____________,,[],,text,t2_3x2nb,False,False,False,1554594992,self.Portland,https://www.reddit.com/r/Portland/comments/baajxl/psa_every_city_in_america_has_bad_drivers/,"{'gid_1': 0, 'gid_2': 0, 'gid_3': 0}",baajxl,True,False,False,False,True,True,False,,[],dark,text,False,False,True,1,0,False,all_ads,/r/Portland/comments/baajxl/psa_every_city_in_america_has_bad_drivers/,False,6,1554594993,0,*,True,False,False,Portland,t5_2qi2i,122837,public,self,"PSA: Every city in America has bad drivers, potholes and bike theft.",1554681378,https://www.reddit.com/r/Portland/comments/baajxl/psa_every_city_in_america_has_bad_drivers/,all_ads,6,,,,,,,,,,,,,,,
MichaelTen,,[],,text,t2_884o7,False,False,False,1554594712,ifiberone.com,https://www.reddit.com/r/Portland/comments/baaiih/ninth_circuit_court_upholds_ruling_which_states/,"{'gid_1': 0, 'gid_2': 0, 'gid_3': 0}",baaiih,True,False,False,False,True,False,False,,[],dark,text,False,False,True,12,0,False,all_ads,/r/Portland/comments/baaiih/ninth_circuit_court_upholds_ruling_which_states/,False,6,1554594713,0,,False,False,False,Portland,t5_2qi2i,122837,public,default,"Ninth Circuit Court upholds ruling which states homeless persons cannot be punished for sleeping in cities that don't offer alternatives [OK, Portland?!]",1554681091,http://www.ifiberone.com/columbia_basin/ninth-circuit-court-upholds-ruling-which-states-homeless-persons-cannot/article_08e5681c-56f6-11e9-a69b-0b5e5707aec0.html,all_ads,6,,,,,,,,,,,,,,,
rubbercheck,,[],,text,t2_29lzpsrs,False,False,False,1554589348,self.Portland,https://www.reddit.com/r/Portland/comments/ba9ozw/chicken_noodle_soup/,"{'gid_1': 0, 'gid_2': 0, 'gid_3': 0}",ba9ozw,True,False,False,False,True,True,False,,[],dark,text,False,False,True,3,0,False,all_ads,/r/Portland/comments/ba9ozw/chicken_noodle_soup/,False,6,1554589350,0,"Sitting here in my recliner enjoying some time reading from my iPad Pro and the name chicken noodle came up, nothing to do with Campbell’s Soup. Well within 5 minutes I was walking down the Safeway soup aisle looking for a can of Campbell’s Chicken Noodle Soup. The memories of opening up that can, heating it up on the stove, no microwaves then, pouring it in a bowl and taking a large handful of Nabisco saltine crackers and crushing them up in your hands and dropping them in the bowl.............. WOW the unreal memories of something so long ago that was so satisfying. Doing something so simple today on this rainy Saturday afternoon and the pleasure it brought me me was superb, as the last time I did that was probably 55+ years ago. ",True,False,False,Portland,t5_2qi2i,122831,public,self,Chicken Noodle Soup,1554675724,https://www.reddit.com/r/Portland/comments/ba9ozw/chicken_noodle_soup/,all_ads,6,,,,,,,,,,,,,,,
gloriapeterson,,[],,text,t2_avn8ao,False,False,False,1554589214,i.redd.it,https://www.reddit.com/r/Portland/comments/ba9o8a/my_pooch_admiring_the_cherries_two_weekends_ago/,"{'gid_1': 0, 'gid_2': 0, 'gid_3': 0}",ba9o8a,True,False,False,True,True,False,False,,[],dark,text,False,False,True,2,0,False,all_ads,/r/Portland/comments/ba9o8a/my_pooch_admiring_the_cherries_two_weekends_ago/,False,6,1554589215,117,,True,False,False,Portland,t5_2qi2i,122830,public,default,My pooch admiring the cherries two weekends ago,1554675589,https://i.redd.it/9gm5y8v9ypq21.jpg,all_ads,6,,,,,,,,,,,,,,,
cannikin13,,[],,text,t2_3zdxh,False,False,False,1554587444,i.redd.it,https://www.reddit.com/r/Portland/comments/ba9du5/seeing_things_at_the_horse_brass_pub/,"{'gid_1': 0, 'gid_2': 0, 'gid_3': 0}",ba9du5,True,False,False,True,True,False,False,,[],dark,text,False,False,True,59,0,False,all_ads,/r/Portland/comments/ba9du5/seeing_things_at_the_horse_brass_pub/,False,6,1554587445,826,,True,False,False,Portland,t5_2qi2i,122829,public,default,Seeing things at The Horse Brass Pub,1554673829,https://i.redd.it/658n6uy3tpq21.jpg,all_ads,6,,,,,,,,,,,,,,,
gljttery,,[],,text,t2_1itxn8so,False,False,False,1554587108,self.Portland,https://www.reddit.com/r/Portland/comments/ba9bx0/portland_is_my_book_in_progresss_setting_but_i/,"{'gid_1': 0, 'gid_2': 0, 'gid_3': 0}",ba9bx0,True,False,False,False,True,True,False,,[],dark,text,False,False,True,17,0,False,all_ads,/r/Portland/comments/ba9bx0/portland_is_my_book_in_progresss_setting_but_i/,False,6,1554587109,0,"Hi! I hope this is okay to post. My story takes place in Portland and I was wondering if someone could talk to me about the city, discuss the compatibility of its reality with the events I'm writing, and... Sort of give me general help, yknow?

In general, my doubts (as much as my book's subjects) surround culture, the street artists/musicians scene, but also more sensitive things too like drug problems, where poverty is more set in, prostitution... I think knowing specific places that are known for things like that (the good things, and places to hang out in, as much as the bad ones) could help me a lot, mainly because I haven't decided where my characters are going to live, and the Portland decision is very recent, because just little while ago all I knew was that the book was going to take place in Oregon. But as far as I've seen Portland is a good choice.

Overall, all tips are gonna come in handy, but if anyone wants to take the discussion further I want to and I am very eager to talk outside of reddit.

Thank you in advance and I'm sorry if this is inconvenient! if it is i can take the post down.",True,False,False,Portland,t5_2qi2i,122827,public,self,"Portland is my book in progress's setting, but I live outside the US",1554673494,https://www.reddit.com/r/Portland/comments/ba9bx0/portland_is_my_book_in_progresss_setting_but_i/,all_ads,6,,,,,,,,,,,,,,,
Lutran,,[],Hosford-Abernethy,text,t2_mqbge,False,False,False,1554585229,self.Portland,https://www.reddit.com/r/Portland/comments/ba90z5/psa_speed_limit_reduction_on_11th_12th_between/,"{'gid_1': 0, 'gid_2': 0, 'gid_3': 0}",ba90z5,True,False,False,False,True,True,False,,[],dark,text,False,False,True,24,0,False,all_ads,/r/Portland/comments/ba90z5/psa_speed_limit_reduction_on_11th_12th_between/,False,6,1554585231,64,"Old Speed Limit: 30 MPH
New Speed Limit: 25 MPH

Judging by the stickers on the back, the new signs went up today, each has two pieces of flair (hi viz flags) to help them stand out.",True,False,False,Portland,t5_2qi2i,122825,public,self,PSA: Speed Limit Reduction on 11th &amp; 12th between Hawthorne &amp; Division,1554671608,https://www.reddit.com/r/Portland/comments/ba90z5/psa_speed_limit_reduction_on_11th_12th_between/,all_ads,6,,,,,dark,,,,,,,,,True,
xzgrgfzbdfgz,,[],,text,t2_3281ozjq,False,False,False,1554584386,self.Portland,https://www.reddit.com/r/Portland/comments/ba8vv2/i_cant_take_portland_anymore/,"{'gid_1': 0, 'gid_2': 0, 'gid_3': 0}",ba8vv2,True,False,False,False,True,True,False,,[],dark,text,False,False,True,457,0,False,all_ads,/r/Portland/comments/ba8vv2/i_cant_take_portland_anymore/,False,6,1554584387,129,"Sorry for the whiney title. Throwaway account because I'm being whiney. My wife and I bought a home in NE Portland in 2011. We are fortunate that we have a house that we own with enough space for our kids, but that's about the only thing I like about our current situation. There is a never-ending caravan of crappy motorhomes, junkies, cycling through our neighborhood and trashing it up. We have awesome neighbors, but pretty much the only topic of conversation is the newest quality of life issue. Once one is taken care of, the next one happens. It's become really, really hard for me to see anything good about Portland anymore. I hate the defeatist attitude. I hate the dysfunctional city government. I hate that someone pretty much has to get stabbed before something happens. I hate the trash so much. It feels like the only people who still get to enjoy Portland are those for whom laws don't apply and maybe those who rent and party, and can leave whenever they want. I was much happier when I was still renting, it feels like. 

In theory, I should count my blessings. Good job, place to live, and all that. But in practice, I'm feeling bitter, and it's really starting to affect me. I don't want to be bitter, and I don't want garbage and low-level crime to affect my life, but it does, and I don't know how to handle it. 

Anyone in a similar situation? Sorry for the rant. ",True,False,False,Portland,t5_2qi2i,122823,public,self,I can't take Portland anymore,1554670771,https://www.reddit.com/r/Portland/comments/ba8vv2/i_cant_take_portland_anymore/,all_ads,6,,,,,,,,,,,,,,,
chocokate,,[],SW,text,t2_gozeh,False,False,False,1554583513,i.redd.it,https://www.reddit.com/r/Portland/comments/ba8qs2/its_a_beautiful_day_at_the_waterfront_and_the/,"{'gid_1': 0, 'gid_2': 0, 'gid_3': 0}",ba8qs2,True,False,False,True,True,False,False,,[],dark,text,False,False,True,0,0,False,all_ads,/r/Portland/comments/ba8qs2/its_a_beautiful_day_at_the_waterfront_and_the/,False,6,1554583513,108,,True,False,False,Portland,t5_2qi2i,122821,public,default,It's a beautiful day at the waterfront and the cherry blossoms are falling fast!,1554669898,https://i.redd.it/ho5t38lehpq21.jpg,all_ads,6,,,,13a73d02-4254-11e1-9f6c-12313d2c1af1,dark,,,,,,,,,,
rgretzky,,[],,text,t2_11epj1,False,False,False,1554581960,youtube.com,https://www.reddit.com/r/Portland/comments/ba8hd0/gretzky_taking_lives_rap_official_video/,"{'gid_1': 0, 'gid_2': 0, 'gid_3': 0}",ba8hd0,True,False,False,False,True,False,False,,[],dark,text,False,False,True,1,0,False,all_ads,/r/Portland/comments/ba8hd0/gretzky_taking_lives_rap_official_video/,False,6,1554581961,0,,False,False,False,Portland,t5_2qi2i,122820,public,https://b.thumbs.redditmedia.com/PGQZAYU-bpc5GBS-O4qPXIW-p3NqvFEkiAyMIdH68AM.jpg,Gretzky -Taking Lives [Rap] (Official Video),1554668345,https://www.youtube.com/watch?v=uyN9XV-oWOo,all_ads,6,custom,Video,,,,rich:video,"{'enabled': False, 'images': [{'id': '4IYdYuoDBV9QKkIMfCMelo4v0lNQn0DT-Vs3oH120Mk', 'resolutions': [{'height': 81, 'url': 'https://external-preview.redd.it/7zypPOh6x5cmJNaBZqCOUl7DZCPsVSl8Xu3CO208Rn0.jpg?width=108&amp;crop=smart&amp;auto=webp&amp;s=a02a7213df17c011171b79c97bd43e8ea5f39066', 'width': 108}, {'height': 162, 'url': 'https://external-preview.redd.it/7zypPOh6x5cmJNaBZqCOUl7DZCPsVSl8Xu3CO208Rn0.jpg?width=216&amp;crop=smart&amp;auto=webp&amp;s=096aea49354c0fd81f8ca66deb0b4f1ff9072ba7', 'width': 216}, {'height': 240, 'url': 'https://external-preview.redd.it/7zypPOh6x5cmJNaBZqCOUl7DZCPsVSl8Xu3CO208Rn0.jpg?width=320&amp;crop=smart&amp;auto=webp&amp;s=d9d4d68bdc672abf36b307c16d37eb0f6ad17f8e', 'width': 320}], 'source': {'height': 360, 'url': 'https://external-preview.redd.it/7zypPOh6x5cmJNaBZqCOUl7DZCPsVSl8Xu3CO208Rn0.jpg?auto=webp&amp;s=52f547de10525f1ec6586d070851d19d5856a2ec', 'width': 480}, 'variants': {}}]}",105.0,140.0,"{'oembed': {'author_name': 'TAKEALOOK MEDIA TV', 'author_url': 'https://www.youtube.com/channel/UC2iJO1SF6wmvijQJfuE6Qbg', 'height': 338, 'html': '&lt;iframe width=""600"" height=""338"" src=""https://www.youtube.com/embed/uyN9XV-oWOo?feature=oembed&amp;enablejsapi=1"" frameborder=""0"" allow=""accelerometer; autoplay; encrypted-media; gyroscope; picture-in-picture"" allowfullscreen&gt;&lt;/iframe&gt;', 'provider_name': 'YouTube', 'provider_url': 'https://www.youtube.com/', 'thumbnail_height': 360, 'thumbnail_url': 'https://i.ytimg.com/vi/uyN9XV-oWOo/hqdefault.jpg', 'thumbnail_width': 480, 'title': 'Gretzky -Taking Lives [Rap] (Official Video)', 'type': 'video', 'version': '1.0', 'width': 600}, 'type': 'youtube.com'}","{'content': '&lt;iframe width=""600"" height=""338"" src=""https://www.youtube.com/embed/uyN9XV-oWOo?feature=oembed&amp;enablejsapi=1"" frameborder=""0"" allow=""accelerometer; autoplay; encrypted-media; gyroscope; picture-in-picture"" allowfullscreen&gt;&lt;/iframe&gt;', 'height': 338, 'scrolling': False, 'width': 600}","{'oembed': {'author_name': 'TAKEALOOK MEDIA TV', 'author_url': 'https://www.youtube.com/channel/UC2iJO1SF6wmvijQJfuE6Qbg', 'height': 338, 'html': '&lt;iframe width=""600"" height=""338"" src=""https://www.youtube.com/embed/uyN9XV-oWOo?feature=oembed&amp;enablejsapi=1"" frameborder=""0"" allow=""accelerometer; autoplay; encrypted-media; gyroscope; picture-in-picture"" allowfullscreen&gt;&lt;/iframe&gt;', 'provider_name': 'YouTube', 'provider_url': 'https://www.youtube.com/', 'thumbnail_height': 360, 'thumbnail_url': 'https://i.ytimg.com/vi/uyN9XV-oWOo/hqdefault.jpg', 'thumbnail_width': 480, 'title': 'Gretzky -Taking Lives [Rap] (Official Video)', 'type': 'video', 'version': '1.0', 'width': 600}, 'type': 'youtube.com'}","{'content': '&lt;iframe width=""600"" height=""338"" src=""https://www.youtube.com/embed/uyN9XV-oWOo?feature=oembed&amp;enablejsapi=1"" frameborder=""0"" allow=""accelerometer; autoplay; encrypted-media; gyroscope; picture-in-picture"" allowfullscreen&gt;&lt;/iframe&gt;', 'height': 338, 'media_domain_url': 'https://www.redditmedia.com/mediaembed/ba8hd0', 'scrolling': False, 'width': 600}",,
geoidian,,[],,text,t2_mcjtf,False,False,False,1554581787,self.Portland,https://www.reddit.com/r/Portland/comments/ba8gb0/is_it_alright_to_scavenging_limbs_from_a_cut_down/,"{'gid_1': 0, 'gid_2': 0, 'gid_3': 0}",ba8gb0,True,False,False,False,True,True,False,,[],dark,text,False,False,True,5,0,False,all_ads,/r/Portland/comments/ba8gb0/is_it_alright_to_scavenging_limbs_from_a_cut_down/,False,6,1554581788,0,,True,False,False,Portland,t5_2qi2i,122819,public,self,Is it alright to scavenging limbs from a cut down tree along the Springwater Corridor?,1554668167,https://www.reddit.com/r/Portland/comments/ba8gb0/is_it_alright_to_scavenging_limbs_from_a_cut_down/,all_ads,6,,,,,,,,,,,,,,,
