all_awardings,allow_live_comments,author,author_flair_css_class,author_flair_richtext,author_flair_text,author_flair_type,author_fullname,author_patreon_flair,author_premium,awarders,can_mod_post,contest_mode,created_utc,domain,full_link,gildings,id,is_crosspostable,is_meta,is_original_content,is_reddit_media_domain,is_robot_indexable,is_self,is_video,link_flair_background_color,link_flair_richtext,link_flair_text_color,link_flair_type,locked,media_only,no_follow,num_comments,num_crossposts,over_18,parent_whitelist_status,permalink,pinned,pwls,retrieved_on,score,selftext,send_replies,spoiler,stickied,subreddit,subreddit_id,subreddit_subscribers,subreddit_type,thumbnail,title,total_awards_received,url,whitelist_status,wls,post_hint,preview,thumbnail_height,thumbnail_width,link_flair_css_class,link_flair_text,author_flair_template_id,author_flair_text_color,author_flair_background_color,removed_by_category,author_cakeday,media,media_embed,secure_media,secure_media_embed
[],False,aeon_irl,,[],,text,t2_b2s2f,False,False,[],False,False,1584826433,self.Portland,https://www.reddit.com/r/Portland/comments/fmn734/live_streaming_local_portland_music_tonight_8pm/,{},fmn734,True,False,False,False,True,True,False,,[],dark,text,False,False,True,0,0,False,all_ads,/r/Portland/comments/fmn734/live_streaming_local_portland_music_tonight_8pm/,False,6,1584826438,1,"Heya

One of the upsides to being stuck in the house for the last week and a half, is that it's given me the chance to set up a live streaming rig in the living room.

So tonight at 8, we're going to stream a live set from Will of Window Business.  If you're like us and hanging out at home this evening and would like to catch some local Portland music, do drop by for a few!

[www.twitch.tv/duke\_studios](https://www.twitch.tv/duke_studios)

[www.windowbusinessmusic.com/](http://www.windowbusinessmusic.com/)",True,False,False,Portland,t5_2qi2i,149071,public,self,Live streaming local Portland music tonight @ 8pm,0,https://www.reddit.com/r/Portland/comments/fmn734/live_streaming_local_portland_music_tonight_8pm/,all_ads,6,self,"{'enabled': False, 'images': [{'id': 'LDTAtOeTLMt6izB4xaf_MT3-4AKTh9x9DNDsfYNNv9o', 'resolutions': [{'height': 108, 'url': 'https://external-preview.redd.it/F5pckq8km-yX08ZJmBmBUzwPALsGUMvpEnXtVQFOZys.jpg?width=108&amp;crop=smart&amp;auto=webp&amp;s=78b076c77a758c8ed4a3f9cc1e13ad90e6a84566', 'width': 108}, {'height': 216, 'url': 'https://external-preview.redd.it/F5pckq8km-yX08ZJmBmBUzwPALsGUMvpEnXtVQFOZys.jpg?width=216&amp;crop=smart&amp;auto=webp&amp;s=8079dfaedbc091b6b50d5a0dea3158b65949c0e4', 'width': 216}], 'source': {'height': 300, 'url': 'https://external-preview.redd.it/F5pckq8km-yX08ZJmBmBUzwPALsGUMvpEnXtVQFOZys.jpg?auto=webp&amp;s=658b6ab48d30ef631b8368b78e9dc56f71add21d', 'width': 300}, 'variants': {}}]}",,,,,,,,,,,,,
[],False,cartwhisperer,,[],SE,text,t2_2w3fzcaf,False,False,[],False,False,1584825913,i.redd.it,https://www.reddit.com/r/Portland/comments/fmn01h/beauty_in_the_emptiness/,{},fmn01h,True,False,False,True,True,False,False,,[],dark,text,False,False,True,1,0,False,all_ads,/r/Portland/comments/fmn01h/beauty_in_the_emptiness/,False,6,1584825921,1,,True,False,False,Portland,t5_2qi2i,149069,public,https://a.thumbs.redditmedia.com/npdNB3LOyFo3vRKvJ8nh6L37HcmUcNYcXQWgtz62W10.jpg,Beauty in the emptiness.,0,https://i.redd.it/7gf3bn3kd3o41.jpg,all_ads,6,image,"{'enabled': True, 'images': [{'id': 'z4_UHKrQAvdrjCnDH9Seau7PYIzxKgQcu4qX2jGCz8U', 'resolutions': [{'height': 72, 'url': 'https://preview.redd.it/7gf3bn3kd3o41.jpg?width=108&amp;crop=smart&amp;auto=webp&amp;s=09395d554f9947ffb743e3d30706bf21995ba345', 'width': 108}, {'height': 144, 'url': 'https://preview.redd.it/7gf3bn3kd3o41.jpg?width=216&amp;crop=smart&amp;auto=webp&amp;s=b921ded3a6f2499b9335fce108a2383171f4519a', 'width': 216}, {'height': 213, 'url': 'https://preview.redd.it/7gf3bn3kd3o41.jpg?width=320&amp;crop=smart&amp;auto=webp&amp;s=c209bc468810810da22b8bddec9506bf3a16b2c5', 'width': 320}, {'height': 426, 'url': 'https://preview.redd.it/7gf3bn3kd3o41.jpg?width=640&amp;crop=smart&amp;auto=webp&amp;s=d97833554647be0948cd1bcf469fb3c383fac613', 'width': 640}, {'height': 640, 'url': 'https://preview.redd.it/7gf3bn3kd3o41.jpg?width=960&amp;crop=smart&amp;auto=webp&amp;s=5a4e1edb7e6c7b9e53e380d46547ddffc2672e45', 'width': 960}, {'height': 720, 'url': 'https://preview.redd.it/7gf3bn3kd3o41.jpg?width=1080&amp;crop=smart&amp;auto=webp&amp;s=6120ffeda2997a7ea174574b91f116152fb19a31', 'width': 1080}], 'source': {'height': 4000, 'url': 'https://preview.redd.it/7gf3bn3kd3o41.jpg?auto=webp&amp;s=6592a125601aefc9a17b5bc6abcdd11fd3a0f2c4', 'width': 6000}, 'variants': {}}]}",93.0,140.0,photo,Photo,065fa756-4254-11e1-92dd-12313d096aae,dark,,,,,,,
[],False,flopdroptop,,[],,text,t2_3xi9jcst,False,False,[],False,False,1584825913,self.Portland,https://www.reddit.com/r/Portland/comments/fmn014/gloves_and_vegan_dog_food_for_free/,{},fmn014,True,False,False,False,True,True,False,,[],dark,text,False,False,True,3,0,False,all_ads,/r/Portland/comments/fmn014/gloves_and_vegan_dog_food_for_free/,False,6,1584825920,1,"I have 2 boxes of small sized gloves and 1 bag of just opened (my dog is allergic) 20-30 lb vegan dog food. Medical / grocery / food workers / compromised / and minority ppl to the front of the line. Message me and I’ll arrange some sort of pickup. I’m in SE, not far from Woodstock.",True,False,False,Portland,t5_2qi2i,149069,public,self,Gloves and vegan dog food for free,0,https://www.reddit.com/r/Portland/comments/fmn014/gloves_and_vegan_dog_food_for_free/,all_ads,6,,,,,,,,,,,,,,,
[],False,gryphiti2,,[],,text,t2_ub7syay,False,False,[],False,False,1584824765,i.redd.it,https://www.reddit.com/r/Portland/comments/fmmkm7/on_the_26_a_little_levity_for_the_hard_times/,{},fmmkm7,True,False,False,True,True,False,False,,[],dark,text,False,False,True,1,0,False,all_ads,/r/Portland/comments/fmmkm7/on_the_26_a_little_levity_for_the_hard_times/,False,6,1584824770,1,,True,False,False,Portland,t5_2qi2i,149067,public,https://b.thumbs.redditmedia.com/rlOrJbCx584gHzTUSqr1llpMfBD7wM3TstuSD_Tihgw.jpg,On the 26 😂 a little levity for the hard times,0,https://i.redd.it/ex2n4drw93o41.jpg,all_ads,6,image,"{'enabled': True, 'images': [{'id': 'YXle5zJeUrZGbfAq5it1xTnKEpQej8ZYyZzYnO1OuJY', 'resolutions': [{'height': 144, 'url': 'https://preview.redd.it/ex2n4drw93o41.jpg?width=108&amp;crop=smart&amp;auto=webp&amp;s=165abaec8e10fd55e89d079ae6d22a7ce17dc941', 'width': 108}, {'height': 288, 'url': 'https://preview.redd.it/ex2n4drw93o41.jpg?width=216&amp;crop=smart&amp;auto=webp&amp;s=34249383ffdcfaaff4ee7bc939bcec63e745b927', 'width': 216}, {'height': 426, 'url': 'https://preview.redd.it/ex2n4drw93o41.jpg?width=320&amp;crop=smart&amp;auto=webp&amp;s=1fae4b68ecf73627f527e8ed9bdcf61f8550be20', 'width': 320}, {'height': 853, 'url': 'https://preview.redd.it/ex2n4drw93o41.jpg?width=640&amp;crop=smart&amp;auto=webp&amp;s=da6931c333251d201eaecbaa5a5e7b22bc69c1eb', 'width': 640}, {'height': 1280, 'url': 'https://preview.redd.it/ex2n4drw93o41.jpg?width=960&amp;crop=smart&amp;auto=webp&amp;s=6a5810ac47c3ede71ca7eaf8c78438ddc24eac4f', 'width': 960}, {'height': 1440, 'url': 'https://preview.redd.it/ex2n4drw93o41.jpg?width=1080&amp;crop=smart&amp;auto=webp&amp;s=1659bf942b475dbd0076b929db7cba1dcec6b1d8', 'width': 1080}], 'source': {'height': 4032, 'url': 'https://preview.redd.it/ex2n4drw93o41.jpg?auto=webp&amp;s=cc0ea3def163c5f0e2187a460ad0aab770486ec7', 'width': 3024}, 'variants': {}}]}",140.0,140.0,photo,Photo,,,,,,,,,
[],False,Juhnelle,,[],,text,t2_102vj9,False,False,[],False,False,1584824711,self.Portland,https://www.reddit.com/r/Portland/comments/fmmjwx/are_portlanders_not_taking_the_virus_seriously/,{},fmmjwx,True,False,False,False,True,True,False,,[],dark,text,False,False,True,80,0,False,all_ads,/r/Portland/comments/fmmjwx/are_portlanders_not_taking_the_virus_seriously/,False,6,1584824716,1,There seems to still be tons of people out and about still. I just looked at the numbers and just over 500 people have been tested out of 800k in multnomah county. New Jersey tested 600 people in one day at one facility. What can we do to get our leaders to take this more seriously? The number of 137 cases in Oregon is laughable when WA had more than that in new cases yesterday.,True,False,False,Portland,t5_2qi2i,149067,public,self,Are portlanders not taking the virus seriously because of the numbers?,0,https://www.reddit.com/r/Portland/comments/fmmjwx/are_portlanders_not_taking_the_virus_seriously/,all_ads,6,,,,,,,,,,,,,,,
[],False,oneletterzz,,[],,text,t2_5h4yaofu,False,False,[],False,False,1584824653,self.Portland,https://www.reddit.com/r/Portland/comments/fmmj6a/thoughts_on_the_kateted_talk_last_night/,{},fmmj6a,True,False,False,False,True,True,False,,[],dark,text,False,False,True,2,0,False,all_ads,/r/Portland/comments/fmmj6a/thoughts_on_the_kateted_talk_last_night/,False,6,1584824659,1,"I think it's interesting that Kate opened up with something some references to a *storm*.  I'm not a Q Anon guy... but I've looked the conspiracy reddits enough to know these guys are nuts and they think something called a *storm* is on the horizon.

I think Kate was really being cautious... She sees these nuts everyday and understands just how crazy they really are... I mean when you've got elected officials saying they are going to shoot state troopers... They are ~kinda~ nuts.  

I guess I'm just saying I understand her hesitantation and desire to make sure all the ducks are in a row before the gavel comes down.",True,False,False,Portland,t5_2qi2i,149065,public,self,Thoughts on the Kate/Ted talk last night,0,https://www.reddit.com/r/Portland/comments/fmmj6a/thoughts_on_the_kateted_talk_last_night/,all_ads,6,,,,,,,,,,,,,,,
[],False,lawstandaloan,,[],,text,t2_b0r73,False,False,[],False,False,1584824621,oregonlive.com,https://www.reddit.com/r/Portland/comments/fmmish/portlandarea_mayors_press_gov_kate_brown_for/,{},fmmish,True,False,False,False,True,False,False,,[],dark,text,False,False,True,46,0,False,all_ads,/r/Portland/comments/fmmish/portlandarea_mayors_press_gov_kate_brown_for/,False,6,1584824628,1,,False,False,False,Portland,t5_2qi2i,149065,public,https://b.thumbs.redditmedia.com/_c6q8wQRu6IrDaUx878lENXtIeoGJGuw35hVVRiFj2o.jpg,Portland-area mayors press Gov. Kate Brown for statewide ‘stay home’ order,0,https://www.oregonlive.com/business/2020/03/25-portland-area-mayors-press-gov-kate-brown-for-statewide-stay-home-order.html,all_ads,6,link,"{'enabled': False, 'images': [{'id': '4qm35IOj3Qmh8Bkc5f7s0xvpDF6H7kz1wBG233VMGY0', 'resolutions': [{'height': 71, 'url': 'https://external-preview.redd.it/AshnzN_hwNKaUI2iOv41VMM8irB9BfY2Vgrlcwh7Tkc.jpg?width=108&amp;crop=smart&amp;auto=webp&amp;s=14794edbd9e10136ec795fd0877cf20d9976694d', 'width': 108}, {'height': 143, 'url': 'https://external-preview.redd.it/AshnzN_hwNKaUI2iOv41VMM8irB9BfY2Vgrlcwh7Tkc.jpg?width=216&amp;crop=smart&amp;auto=webp&amp;s=9241614cf92b63c7c808929e61bbcbee82567aa2', 'width': 216}, {'height': 213, 'url': 'https://external-preview.redd.it/AshnzN_hwNKaUI2iOv41VMM8irB9BfY2Vgrlcwh7Tkc.jpg?width=320&amp;crop=smart&amp;auto=webp&amp;s=5a6146f939828fc47f7c0b869664289720aba849', 'width': 320}, {'height': 426, 'url': 'https://external-preview.redd.it/AshnzN_hwNKaUI2iOv41VMM8irB9BfY2Vgrlcwh7Tkc.jpg?width=640&amp;crop=smart&amp;auto=webp&amp;s=10a57d6d29f90646b1dc2685b16e35f38d1218cd', 'width': 640}, {'height': 639, 'url': 'https://external-preview.redd.it/AshnzN_hwNKaUI2iOv41VMM8irB9BfY2Vgrlcwh7Tkc.jpg?width=960&amp;crop=smart&amp;auto=webp&amp;s=69b32d69597e127ad70697d9ddd75ad71314f580', 'width': 960}, {'height': 719, 'url': 'https://external-preview.redd.it/AshnzN_hwNKaUI2iOv41VMM8irB9BfY2Vgrlcwh7Tkc.jpg?width=1080&amp;crop=smart&amp;auto=webp&amp;s=d32fbbacb63a9f4983ba0c6e1e739fd655178adf', 'width': 1080}], 'source': {'height': 853, 'url': 'https://external-preview.redd.it/AshnzN_hwNKaUI2iOv41VMM8irB9BfY2Vgrlcwh7Tkc.jpg?auto=webp&amp;s=d6b83b474064ce960b0f5919925b6bdd416c05af', 'width': 1280}, 'variants': {}}]}",93.0,140.0,local-news,Local News,,,,,,,,,
[],False,whitejosh,,[],,text,t2_wz958,False,False,[],False,False,1584824551,self.Portland,https://www.reddit.com/r/Portland/comments/fmmhty/downtown_parking_enforcement/,{},fmmhty,True,False,False,False,True,True,False,,[],dark,text,False,False,True,9,0,False,all_ads,/r/Portland/comments/fmmhty/downtown_parking_enforcement/,False,6,1584824556,1,Any update to the parking enforcement since the virus spread? Are they still ticketing for street parking? I live downtown and would love to be able to park near my building,True,False,False,Portland,t5_2qi2i,149065,public,self,Downtown parking enforcement,0,https://www.reddit.com/r/Portland/comments/fmmhty/downtown_parking_enforcement/,all_ads,6,,,,,,,,,,,,,,,
[],False,thenewguyonreddit,,[],,text,t2_5s2ym,False,True,[],False,False,1584824445,self.Portland,https://www.reddit.com/r/Portland/comments/fmmghb/my_house_has_never_been_cleaner/,{},fmmghb,True,False,False,False,True,True,False,,[],dark,text,False,False,True,31,0,False,all_ads,/r/Portland/comments/fmmghb/my_house_has_never_been_cleaner/,False,6,1584824452,1,"Gotta say that is one positive benefit of the quarantine. I’m spending so much time indoors that I just start cleaning for fun. Small jobs here and there. And I’m a lazy fuck so that’s saying something. 

Finally mopped my floors and cleaned the microwave today. Two things I’ve been putting off for weeks. 

Am I the only one?",True,False,False,Portland,t5_2qi2i,149065,public,self,My house has never been cleaner,0,https://www.reddit.com/r/Portland/comments/fmmghb/my_house_has_never_been_cleaner/,all_ads,6,,,,,,,,,,,,,,,
[],False,super_hoommen,,[],,text,t2_4dthdyih,False,False,[],False,False,1584823295,i.redd.it,https://www.reddit.com/r/Portland/comments/fmm1xj/spring_is_in_the_air/,{},fmm1xj,True,False,False,True,True,False,False,,[],dark,text,False,False,True,6,0,False,all_ads,/r/Portland/comments/fmm1xj/spring_is_in_the_air/,False,6,1584823301,1,,True,False,False,Portland,t5_2qi2i,149059,public,https://b.thumbs.redditmedia.com/Ymu0d7UI3xO-2mxOw6islh4sc6GQ69Tgm0UXzQSo4SY.jpg,Spring is in the air!,0,https://i.redd.it/14s4btga53o41.jpg,all_ads,6,image,"{'enabled': True, 'images': [{'id': 'HINRM0g1UDYwdrW4qbXxvPU0Ugf_qW3fwW0sd1sRT2A', 'resolutions': [{'height': 144, 'url': 'https://preview.redd.it/14s4btga53o41.jpg?width=108&amp;crop=smart&amp;auto=webp&amp;s=b24bd4fa1530dd70174d9504eec5b2a05bf21d86', 'width': 108}, {'height': 288, 'url': 'https://preview.redd.it/14s4btga53o41.jpg?width=216&amp;crop=smart&amp;auto=webp&amp;s=ad76912d793312e75596cbf26a612c47ab5e3e7b', 'width': 216}, {'height': 426, 'url': 'https://preview.redd.it/14s4btga53o41.jpg?width=320&amp;crop=smart&amp;auto=webp&amp;s=557fff7cdd53940011407b730ae968a299e8c0ea', 'width': 320}, {'height': 853, 'url': 'https://preview.redd.it/14s4btga53o41.jpg?width=640&amp;crop=smart&amp;auto=webp&amp;s=c027017df9857d0fdbbec7d30d09a94f2851d7d9', 'width': 640}, {'height': 1280, 'url': 'https://preview.redd.it/14s4btga53o41.jpg?width=960&amp;crop=smart&amp;auto=webp&amp;s=bcc5329bd7e74b15200fd49446d87023b01a4b69', 'width': 960}, {'height': 1440, 'url': 'https://preview.redd.it/14s4btga53o41.jpg?width=1080&amp;crop=smart&amp;auto=webp&amp;s=fef00fe56742eeecccbf6d4999792b0e864303e2', 'width': 1080}], 'source': {'height': 3952, 'url': 'https://preview.redd.it/14s4btga53o41.jpg?auto=webp&amp;s=c2b53a0d72b82aee8d4d771ceed1dd64b50993b1', 'width': 2964}, 'variants': {}}]}",140.0,140.0,photo,Photo,,,,,,,,,
[],False,BentleyTock,,[],Boise,text,t2_anyv0,False,False,[],False,False,1584822980,self.Portland,https://www.reddit.com/r/Portland/comments/fmly01/yall_are_doing_a_great_job/,{},fmly01,True,False,False,False,True,True,False,,[],dark,text,False,False,True,5,0,False,all_ads,/r/Portland/comments/fmly01/yall_are_doing_a_great_job/,False,6,1584822986,1,"But if I can ask one thing, when you have someone deliver something for you, stay in the house! Don’t come meet us at the door! Almost every delivery service is instructing us to leave deliveries at the door; it’s unsafe for you and for us to come face to face, even that briefly. Be safe and patient. And if you have a courier that insists making a handoff, don’t feel bad explaining to them that it’s better to just leave the order at the door.",True,False,False,Portland,t5_2qi2i,149058,public,self,Y’all are doing a great job!,0,https://www.reddit.com/r/Portland/comments/fmly01/yall_are_doing_a_great_job/,all_ads,6,,,,,,,99b16bd2-42fb-11e1-90ec-12313d096aae,dark,,,,,,,
[],False,cliffskiscliffs,,[],,text,t2_28f02lbq,False,False,[],False,False,1584822927,self.Portland,https://www.reddit.com/r/Portland/comments/fmlxa9/wear_a_mask_of_any_kind/,{},fmlxa9,True,False,False,False,True,True,False,,[],dark,text,False,False,True,50,0,False,all_ads,/r/Portland/comments/fmlxa9/wear_a_mask_of_any_kind/,False,6,1584822937,1,"Stop being stupid. Stop being an asshole. Wear a mask. Don't matter what kind, wear a Halloween mask for fucks sake.

When your Grandma doesn't die, you'll thank everyone that wore one.

COVER YOUR FUCKING COUGHS. 

THIS ISN'T FUCKING PLAYTIME. THIS IS NOT A JOKE.  IT IS NOT A HOAX.

It's like you know you have HIV, but you're still fucking around with out a condom.

You're gonna get sicker than you've never been sick before. 

If you don't know what an asthma attack is like, you're gonna feel what it's like, for days.

You are putting your family in grave danger. Your Grandma and your children. They could die and you'll cry and wail, IF ONLY I HAD WORN A MASK MAYBE GAMMY WOULD STILL BE ALIVE.

Stop being an asshole and get some damn sense.",True,False,False,Portland,t5_2qi2i,149058,public,self,Wear a Mask of ANY KIND,0,https://www.reddit.com/r/Portland/comments/fmlxa9/wear_a_mask_of_any_kind/,all_ads,6,,,,,,,,,,,,,,,
[],False,sleeptrouble,,[],,text,t2_e4bcb,False,False,[],False,False,1584822400,imgur.com,https://www.reddit.com/r/Portland/comments/fmlqt0/half_allergies_half_not/,{},fmlqt0,True,False,False,False,True,False,False,,[],dark,text,False,False,True,9,0,False,all_ads,/r/Portland/comments/fmlqt0/half_allergies_half_not/,False,6,1584822407,1,,False,False,False,Portland,t5_2qi2i,149057,public,https://b.thumbs.redditmedia.com/IXE_AG_I4Ig-itOKjnLm3D6tBwBXvhHoDbdeK0Ijgts.jpg,"Half allergies, half not.",0,https://imgur.com/huba5RZ,all_ads,6,link,"{'enabled': False, 'images': [{'id': 'Rvq5482lFgMGp29i23Kfnc_-AIcFyU9vvkkJ1_29n1E', 'resolutions': [{'height': 60, 'url': 'https://external-preview.redd.it/Dm0Hk7RMViEUVg24e2yNmOesmiPaBLiv6Persl-a_Ss.jpg?width=108&amp;crop=smart&amp;auto=webp&amp;s=be00c231e79e54bbe8d67bcf6648367fa0ec6c40', 'width': 108}, {'height': 121, 'url': 'https://external-preview.redd.it/Dm0Hk7RMViEUVg24e2yNmOesmiPaBLiv6Persl-a_Ss.jpg?width=216&amp;crop=smart&amp;auto=webp&amp;s=3487ab6c4b9074fb6b4a22d944587f58a625219a', 'width': 216}, {'height': 180, 'url': 'https://external-preview.redd.it/Dm0Hk7RMViEUVg24e2yNmOesmiPaBLiv6Persl-a_Ss.jpg?width=320&amp;crop=smart&amp;auto=webp&amp;s=b4378d57e6407e6f4f8fc71938e9e18846e1f96c', 'width': 320}, {'height': 360, 'url': 'https://external-preview.redd.it/Dm0Hk7RMViEUVg24e2yNmOesmiPaBLiv6Persl-a_Ss.jpg?width=640&amp;crop=smart&amp;auto=webp&amp;s=065d79fec06ba45db0f122fae8dfba79651e5786', 'width': 640}, {'height': 540, 'url': 'https://external-preview.redd.it/Dm0Hk7RMViEUVg24e2yNmOesmiPaBLiv6Persl-a_Ss.jpg?width=960&amp;crop=smart&amp;auto=webp&amp;s=dd7fcb4688bdfe2f9db97a40cb305b0be4527389', 'width': 960}, {'height': 607, 'url': 'https://external-preview.redd.it/Dm0Hk7RMViEUVg24e2yNmOesmiPaBLiv6Persl-a_Ss.jpg?width=1080&amp;crop=smart&amp;auto=webp&amp;s=109d51eaa821a38c2793297164efe6e836fc7a2e', 'width': 1080}], 'source': {'height': 2365, 'url': 'https://external-preview.redd.it/Dm0Hk7RMViEUVg24e2yNmOesmiPaBLiv6Persl-a_Ss.jpg?auto=webp&amp;s=cec0fc1bb33d3e97c6d6ce4e13c5106163e4884c', 'width': 4204}, 'variants': {}}]}",78.0,140.0,photo,Photo,,,,,,"{'oembed': {'description': 'Post with 0 votes and 0 views.', 'height': 467, 'html': '&lt;iframe class=""embedly-embed"" src=""https://cdn.embedly.com/widgets/media.html?src=https%3A%2F%2Fimgur.com%2Fhuba5RZ%2Fembed%3Fpub%3Dtrue%26ref%3Dhttps%253A%252F%252Fembed.ly%26w%3D900&amp;display_name=Imgur&amp;url=https%3A%2F%2Fimgur.com%2Fhuba5RZ&amp;image=https%3A%2F%2Fi.imgur.com%2Fhuba5RZ.jpg%3Ffb&amp;key=ed8fa8699ce04833838e66ce79ba05f1&amp;type=text%2Fhtml&amp;schema=imgur"" width=""600"" height=""467"" scrolling=""no"" title=""Imgur embed"" frameborder=""0"" allow=""autoplay; fullscreen"" allowfullscreen=""true""&gt;&lt;/iframe&gt;', 'provider_name': 'Imgur', 'provider_url': 'http://imgur.com', 'thumbnail_height': 315, 'thumbnail_url': 'https://i.imgur.com/huba5RZ.jpg?fb', 'thumbnail_width': 600, 'title': 'Imgur', 'type': 'rich', 'url': 'https://imgur.com/huba5RZ', 'version': '1.0', 'width': 600}, 'type': 'imgur.com'}","{'content': '&lt;iframe class=""embedly-embed"" src=""https://cdn.embedly.com/widgets/media.html?src=https%3A%2F%2Fimgur.com%2Fhuba5RZ%2Fembed%3Fpub%3Dtrue%26ref%3Dhttps%253A%252F%252Fembed.ly%26w%3D900&amp;display_name=Imgur&amp;url=https%3A%2F%2Fimgur.com%2Fhuba5RZ&amp;image=https%3A%2F%2Fi.imgur.com%2Fhuba5RZ.jpg%3Ffb&amp;key=ed8fa8699ce04833838e66ce79ba05f1&amp;type=text%2Fhtml&amp;schema=imgur"" width=""600"" height=""467"" scrolling=""no"" title=""Imgur embed"" frameborder=""0"" allow=""autoplay; fullscreen"" allowfullscreen=""true""&gt;&lt;/iframe&gt;', 'height': 467, 'scrolling': False, 'width': 600}","{'oembed': {'description': 'Post with 0 votes and 0 views.', 'height': 467, 'html': '&lt;iframe class=""embedly-embed"" src=""https://cdn.embedly.com/widgets/media.html?src=https%3A%2F%2Fimgur.com%2Fhuba5RZ%2Fembed%3Fpub%3Dtrue%26ref%3Dhttps%253A%252F%252Fembed.ly%26w%3D900&amp;display_name=Imgur&amp;url=https%3A%2F%2Fimgur.com%2Fhuba5RZ&amp;image=https%3A%2F%2Fi.imgur.com%2Fhuba5RZ.jpg%3Ffb&amp;key=ed8fa8699ce04833838e66ce79ba05f1&amp;type=text%2Fhtml&amp;schema=imgur"" width=""600"" height=""467"" scrolling=""no"" title=""Imgur embed"" frameborder=""0"" allow=""autoplay; fullscreen"" allowfullscreen=""true""&gt;&lt;/iframe&gt;', 'provider_name': 'Imgur', 'provider_url': 'http://imgur.com', 'thumbnail_height': 315, 'thumbnail_url': 'https://i.imgur.com/huba5RZ.jpg?fb', 'thumbnail_width': 600, 'title': 'Imgur', 'type': 'rich', 'url': 'https://imgur.com/huba5RZ', 'version': '1.0', 'width': 600}, 'type': 'imgur.com'}","{'content': '&lt;iframe class=""embedly-embed"" src=""https://cdn.embedly.com/widgets/media.html?src=https%3A%2F%2Fimgur.com%2Fhuba5RZ%2Fembed%3Fpub%3Dtrue%26ref%3Dhttps%253A%252F%252Fembed.ly%26w%3D900&amp;display_name=Imgur&amp;url=https%3A%2F%2Fimgur.com%2Fhuba5RZ&amp;image=https%3A%2F%2Fi.imgur.com%2Fhuba5RZ.jpg%3Ffb&amp;key=ed8fa8699ce04833838e66ce79ba05f1&amp;type=text%2Fhtml&amp;schema=imgur"" width=""600"" height=""467"" scrolling=""no"" title=""Imgur embed"" frameborder=""0"" allow=""autoplay; fullscreen"" allowfullscreen=""true""&gt;&lt;/iframe&gt;', 'height': 467, 'media_domain_url': 'https://www.redditmedia.com/mediaembed/fmlqt0', 'scrolling': False, 'width': 600}"
[],False,teejay_vanslyke,,[],,text,t2_310nskf2,False,False,[],False,False,1584822324,self.Portland,https://www.reddit.com/r/Portland/comments/fmlpwc/division_virtual_block_party_discord_server/,{},fmlpwc,True,False,False,False,True,True,False,,[],dark,text,False,False,True,4,0,False,all_ads,/r/Portland/comments/fmlpwc/division_virtual_block_party_discord_server/,False,6,1584822331,1,"These are uncertain times. Many of us are isolated and unable to engage with our local communities for support. And yet, through a crisis of this nature, knowing our neighbors makes all the difference.

Today I've started a neighborhood Discord server for those of us in and around Division Street in SE Portland to gather and support our neighbors during this difficult time.

If you live on or around the inner Division Street area (Richmond, Hosford-Abernethy, South Tabor, etc), visit the URL below to get started:  

[https://discord.gg/nFt5ns](https://discord.gg/nFt5ns)

Ideally, we'll keep this localized, but Discord is free and easy to set up if you want to start your own neighborhood online community. Go to [http://www.discordapp.com](http://www.discordapp.com) to set up a server.

**We’ve got this, Portland. Be kind, be supportive, be connected.**",True,False,False,Portland,t5_2qi2i,149057,public,self,Division Virtual Block Party Discord Server,0,https://www.reddit.com/r/Portland/comments/fmlpwc/division_virtual_block_party_discord_server/,all_ads,6,,,,,,,,,,,,,,,
