all_awardings,allow_live_comments,author,author_flair_css_class,author_flair_richtext,author_flair_text,author_flair_type,author_fullname,author_patreon_flair,can_mod_post,contest_mode,created_utc,domain,full_link,gildings,id,is_crosspostable,is_meta,is_original_content,is_reddit_media_domain,is_robot_indexable,is_self,is_video,link_flair_background_color,link_flair_richtext,link_flair_text_color,link_flair_type,locked,media_only,no_follow,num_comments,num_crossposts,over_18,parent_whitelist_status,permalink,pinned,pwls,retrieved_on,score,selftext,send_replies,spoiler,stickied,subreddit,subreddit_id,subreddit_subscribers,subreddit_type,thumbnail,title,total_awards_received,updated_utc,url,whitelist_status,wls,author_flair_template_id,author_flair_text_color,link_flair_css_class,link_flair_text,post_hint,preview,thumbnail_height,thumbnail_width,author_flair_background_color,author_cakeday,media,media_embed,secure_media,secure_media_embed
[],False,LINUX_IS_COMMUNIST,,[],,text,t2_26dwkt3y,False,False,False,1562945974,self.Portland,https://www.reddit.com/r/Portland/comments/cccg47/are_loud_motorcycles_legal_in_the_city/,{},cccg47,True,False,False,False,True,True,False,,[],dark,text,False,False,True,22,0,False,all_ads,/r/Portland/comments/cccg47/are_loud_motorcycles_legal_in_the_city/,False,6,1562945976,0,"I live near NE 16th and Sandy, across from SeeSee’s.  Every day all day and night long there are motorcycles racing and revving their engines.  There’s a children’s day care and schools nearby. How can this be legal?  Will the cops do anything if I call them.  SeeSee’s doesn’t seem to care.",True,False,False,Portland,t5_2qi2i,131103,public,self,Are loud motorcycles legal in the city?,0,1563032356,https://www.reddit.com/r/Portland/comments/cccg47/are_loud_motorcycles_legal_in_the_city/,all_ads,6,,,,,,,,,,,,,,
[],False,bleepbleep1111,,[],,text,t2_2wshmu02,False,False,False,1562944418,self.Portland,https://www.reddit.com/r/Portland/comments/ccc468/visiting_portland_area_for_the_first_time_from/,{},ccc468,False,False,False,False,False,True,False,,[],dark,text,False,False,True,2,0,False,all_ads,/r/Portland/comments/ccc468/visiting_portland_area_for_the_first_time_from/,False,6,1562944420,1,[removed],True,False,False,Portland,t5_2qi2i,131101,public,self,Visiting Portland area for the first time from the Midwest!,0,1563030808,https://www.reddit.com/r/Portland/comments/ccc468/visiting_portland_area_for_the_first_time_from/,all_ads,6,,,,,,,,,,,,,,
[],False,itstoolatefororanges,,[],Downtown,text,t2_28two8dm,False,False,False,1562944119,expo.oregonlive.com,https://www.reddit.com/r/Portland/comments/ccc1w1/these_15_portlandarea_restaurants_failed_an/,{},ccc1w1,True,False,False,False,True,False,False,,[],dark,text,False,False,True,5,0,False,all_ads,/r/Portland/comments/ccc1w1/these_15_portlandarea_restaurants_failed_an/,False,6,1562944121,0,,True,False,False,Portland,t5_2qi2i,131101,public,https://b.thumbs.redditmedia.com/1uVeZ-ehmgTPV9-kf927gJVfIFa3MDQv_sp8HmDMXok.jpg,These 15 Portland-area restaurants failed an inspection,0,1563030506,https://expo.oregonlive.com/life-and-culture/g66l-2019/07/26651351134022/these-15-portlandarea-restaurants-failed-an-inspection-in-2019.html,all_ads,6,eabbbf0e-42ca-11e1-a863-12313b08a511,dark,local-news,Local News,link,"{'enabled': False, 'images': [{'id': 'EwZVyYycSX49G3BbpTSk69osXjhzBpm5jhLlKNudS2Y', 'resolutions': [{'height': 68, 'url': 'https://external-preview.redd.it/LuiGz9xxceG_BF5xqmgY3AoxomylYRur__rGBDK_3G4.jpg?width=108&amp;crop=smart&amp;auto=webp&amp;s=b002eb655182ec49d8bf9f482533a4af71f94612', 'width': 108}, {'height': 137, 'url': 'https://external-preview.redd.it/LuiGz9xxceG_BF5xqmgY3AoxomylYRur__rGBDK_3G4.jpg?width=216&amp;crop=smart&amp;auto=webp&amp;s=7b6405d4dff86a049cfcc44c9d8f9cf151d896f4', 'width': 216}, {'height': 203, 'url': 'https://external-preview.redd.it/LuiGz9xxceG_BF5xqmgY3AoxomylYRur__rGBDK_3G4.jpg?width=320&amp;crop=smart&amp;auto=webp&amp;s=f4cb0bd9d813667d81656303e3c36a7c4b4399c9', 'width': 320}, {'height': 406, 'url': 'https://external-preview.redd.it/LuiGz9xxceG_BF5xqmgY3AoxomylYRur__rGBDK_3G4.jpg?width=640&amp;crop=smart&amp;auto=webp&amp;s=0eadffeec1a2843e57a5d81aa9aa6000a1028d67', 'width': 640}, {'height': 610, 'url': 'https://external-preview.redd.it/LuiGz9xxceG_BF5xqmgY3AoxomylYRur__rGBDK_3G4.jpg?width=960&amp;crop=smart&amp;auto=webp&amp;s=792a26139d2a55bdce6df5f94fb91be0540e16d1', 'width': 960}], 'source': {'height': 610, 'url': 'https://external-preview.redd.it/LuiGz9xxceG_BF5xqmgY3AoxomylYRur__rGBDK_3G4.jpg?auto=webp&amp;s=3d45cdc16ef217a2da85daaa3631b00be07526f4', 'width': 960}, 'variants': {}}]}",88.0,140.0,,,,,,
[],False,Filling_In_The_Owl,,[],,text,t2_2ky0ro40,False,False,False,1562943845,self.Portland,https://www.reddit.com/r/Portland/comments/ccbzmy/affordable_chiropractor_for_my_coworker/,{},ccbzmy,True,False,False,False,True,True,False,,[],dark,text,False,False,True,17,0,False,all_ads,/r/Portland/comments/ccbzmy/affordable_chiropractor_for_my_coworker/,False,6,1562943846,0,"My coworker hurt her neck about a week ago, and cant afford to get it looked at. It appears to be getting worse, and I don't know how to help. I just hate seeing her suffer every day.

The company only hires through a temp agency, so she's not considered a ""real"" employee. Meaning shell need to actually get hired on, then wait a year to get insurance. Other than starting a GoFundMe, is there anything I can do? Any resources she can take advantage of? I'm on the poor side, myself, so I cant really help her financially.",True,False,False,Portland,t5_2qi2i,131100,public,self,Affordable Chiropractor for my Coworker?,0,1563030233,https://www.reddit.com/r/Portland/comments/ccbzmy/affordable_chiropractor_for_my_coworker/,all_ads,6,,,,,,,,,,,,,,
[],False,AutoModerator,,[],24 Hour Church of Elvis,text,t2_6l4z3,False,False,False,1562940518,self.Portland,https://www.reddit.com/r/Portland/comments/ccbb9s/dear_portland_july_12_2019_weekly_rave_thread/,{},ccbb9s,True,False,False,False,True,True,False,,[],dark,text,False,False,True,53,0,False,all_ads,/r/Portland/comments/ccbb9s/dear_portland_july_12_2019_weekly_rave_thread/,False,6,1562940519,12,"What made you smile this week--tell us about it! what are you looking forward to this weekend? what's making you happy?

Caps lock off, downvotes never, go forth and be happy!",False,False,False,Portland,t5_2qi2i,131098,public,self,"dear portland: July 12, 2019 weekly rave thread",0,1563026905,https://www.reddit.com/r/Portland/comments/ccbb9s/dear_portland_july_12_2019_weekly_rave_thread/,all_ads,6,,dark,,,,,,,,,,,,
[],False,Flrg808,,[],,text,t2_18obmoit,False,False,False,1562937676,self.Portland,https://www.reddit.com/r/Portland/comments/ccarvf/what_to_do_in_portland/,{},ccarvf,True,False,False,False,True,True,False,,[],dark,text,False,False,True,9,0,False,all_ads,/r/Portland/comments/ccarvf/what_to_do_in_portland/,False,6,1562937678,0,"Hoping this is the right sub for this, I’ll be in Portland for one day in a couple weeks for work. Work will be over by probably 11am so I’m looking for some things to see/do for the rest of the day..

I’m from the east coast and have never been west of Chicago. I plan to go to the Hoyt Arboretum because I’m kinda into nature things and excited to see the contrasting differences of the pacific NW.

I’ll probably also hop on the metro system and tool around downtown, other than that I’m at a loss. For food I plan to just Yelp my way to local lunch and dinner spots as I usually do unless someone has any recommendations. Open to anything really if it doesn’t break the bank. Thanks!",True,False,False,Portland,t5_2qi2i,131095,public,self,What to do in Portland,0,1563024052,https://www.reddit.com/r/Portland/comments/ccarvf/what_to_do_in_portland/,all_ads,6,,,,,,,,,,,,,,
[],False,3yt,,[],,text,t2_dqaen,False,False,False,1562923175,i.redd.it,https://www.reddit.com/r/Portland/comments/cc8jzw/had_some_robert_frost_ready_for_this_but_i/,{},cc8jzw,True,False,False,True,True,False,False,,[],dark,text,False,False,True,6,0,False,all_ads,/r/Portland/comments/cc8jzw/had_some_robert_frost_ready_for_this_but_i/,False,6,1562923176,26,,True,False,False,Portland,t5_2qi2i,131088,public,default,Had some Robert Frost ready for this but I couldn't find the group.,0,1563009562,https://i.redd.it/ds0sb5v7bu931.png,all_ads,6,,,photo,Photo,,,,,,,,,,
[],False,Hermes85,,[],,text,t2_41qvfclt,False,False,False,1562919081,i.redd.it,https://www.reddit.com/r/Portland/comments/cc81gu/a_friend_lost_her_keys_please_keep_an_eye_out_for/,{},cc81gu,True,False,False,True,True,False,False,,[],dark,text,False,False,True,5,0,False,all_ads,/r/Portland/comments/cc81gu/a_friend_lost_her_keys_please_keep_an_eye_out_for/,False,6,1562919083,0,,True,False,False,Portland,t5_2qi2i,131085,public,https://a.thumbs.redditmedia.com/9juiMfOBEFrsrR1lkjHO7cLDbh0g3lI73OWf8DJqY54.jpg,A friend lost her keys. Please keep an eye out for them! Near downtown,0,1563005446,https://i.redd.it/azhx7mcczt931.jpg,all_ads,6,,,photo,Photo,image,"{'enabled': True, 'images': [{'id': 'dz635Xn-QA6ZnTNNgVT4b4kobRtI8-Q0Y-6XvJASJ3M', 'resolutions': [{'height': 191, 'url': 'https://preview.redd.it/azhx7mcczt931.jpg?width=108&amp;crop=smart&amp;auto=webp&amp;s=e2ebf7def39900ab681af94bd501cf451204fe33', 'width': 108}, {'height': 383, 'url': 'https://preview.redd.it/azhx7mcczt931.jpg?width=216&amp;crop=smart&amp;auto=webp&amp;s=b897f6c6927af52fa7d4d13424c7234cf226935a', 'width': 216}, {'height': 568, 'url': 'https://preview.redd.it/azhx7mcczt931.jpg?width=320&amp;crop=smart&amp;auto=webp&amp;s=8e121ca7fe7cd0cb744c0cb16909a7a6d9030370', 'width': 320}], 'source': {'height': 940, 'url': 'https://preview.redd.it/azhx7mcczt931.jpg?auto=webp&amp;s=e42395cf0fb444079a56c970fc7a5ee42498b58a', 'width': 529}, 'variants': {}}]}",140.0,140.0,,,,,,
[],False,Originator07,,[],,text,t2_mlpt3,False,False,False,1562911230,babylonbee.com,https://www.reddit.com/r/Portland/comments/cc6yk8/impressed_military_drops_portland_antifa_in/,{},cc6yk8,True,False,False,False,True,False,False,,[],dark,text,False,False,True,3,0,False,all_ads,/r/Portland/comments/cc6yk8/impressed_military_drops_portland_antifa_in/,False,6,1562911230,0,,True,False,False,Portland,t5_2qi2i,131077,public,default,Impressed Military Drops Portland Antifa In Hostile ISIS Territory To Continue Doling Out Justice,0,1562997612,https://babylonbee.com/news/impressed-military-drops-portland-antifa-in-hostile-isis-territory-to-continue-doling-out-justice?fbclid=IwAR024gW52Rzhfcp0W2v74sNf7MieiC-soh8uj2y-UAZdSCwBDVViwzFNBC4,all_ads,6,,,,,,,,,,,,,,
[],False,Julianhyde88,,[],,text,t2_b8fx6,False,False,False,1562909326,i.redd.it,https://www.reddit.com/r/Portland/comments/cc6ogj/just_a_glimpse_of_old_portland_down_by_the/,{},cc6ogj,True,False,False,True,True,False,False,,[],dark,text,False,False,True,4,0,False,all_ads,/r/Portland/comments/cc6ogj/just_a_glimpse_of_old_portland_down_by_the/,False,6,1562909327,126,,True,False,False,Portland,t5_2qi2i,131077,public,default,Just a glimpse of old Portland down by the industrial waterfront. Playing around with some purple-shift film. No filter or photoshop.,0,1562995706,https://i.redd.it/1t8v9ss96t931.jpg,all_ads,6,,,photo,Photo,,,,,,,,,,
[],False,piewagon,,[],,text,t2_14e6zs,False,False,False,1562909027,i.redd.it,https://www.reddit.com/r/Portland/comments/cc6my1/i_saw_a_car_on_fire_today/,{},cc6my1,True,False,False,True,True,False,False,,[],dark,text,False,False,True,76,0,False,all_ads,/r/Portland/comments/cc6my1/i_saw_a_car_on_fire_today/,False,6,1562909028,349,,True,False,False,Portland,t5_2qi2i,131077,public,default,I saw a car on fire today...,0,1562995400,https://i.redd.it/1ppk710g5t931.jpg,all_ads,6,,,,,,,,,,,,,,
[],False,degenerate_nomad,,[],,text,t2_2jxu0uct,False,False,False,1562907976,i.redd.it,https://www.reddit.com/r/Portland/comments/cc6h88/thanks_to_my_assuming_cop_neighbor_for_the_155/,{},cc6h88,True,False,False,True,True,False,False,,[],dark,text,False,False,True,3,0,False,all_ads,/r/Portland/comments/cc6h88/thanks_to_my_assuming_cop_neighbor_for_the_155/,False,6,1562907976,1,,True,False,False,Portland,t5_2qi2i,131076,public,default,"Thanks to my (assuming) cop neighbor for the $155 ticket while I was getting surgery. Literally someone new is parked in this same spot every day all day and night, someones there now. Have never seen ANY tickets. Appreciate it bud!",0,1562994353,https://i.redd.it/pho9m4gb2t931.jpg,all_ads,6,,,,,,,,,,,,,,
[],False,ironscythe,,[],,text,t2_23gk9b,False,False,False,1562903280,self.Portland,https://www.reddit.com/r/Portland/comments/cc5r4i/question_about_the_identity_of_a_blind_ivy_basket/,{},cc5r4i,True,False,False,False,True,True,False,,[],dark,text,False,False,True,3,0,False,all_ads,/r/Portland/comments/cc5r4i/question_about_the_identity_of_a_blind_ivy_basket/,False,6,1562903281,19,"Hello,

&amp;#x200B;

This isn't an urgent post, just one borne of curiosity. I lived on Sauvie Island in the mid-1990s, and every day I rode in to Portland, I would see an old man selling hand-woven ivy baskets on the side of the road, near one of the roads going up the hill from St. Helens Road, maybe right by/under the St. John's Bridge. 

My mother stopped once and bought a woven ivy Christmas tree angel from him, and discovered that he was blind and had been coming down that road to make and sell ivy baskets and decorations for most of his life. She recalls seeing at least one article in the Oregonian about him over the years, and a tribute to him after he died. 

Again, this is just for the sake of my curiosity, but does anyone else have memories of this guy, or know where I can find an article online that actually mentions him?",True,False,False,Portland,t5_2qi2i,131069,public,self,Question about the identity of a blind ivy basket weaver in the 1990s,0,1562989665,https://www.reddit.com/r/Portland/comments/cc5r4i/question_about_the_identity_of_a_blind_ivy_basket/,all_ads,6,,,,,,,,,,,,,,
[],False,anonuman,,[],,text,t2_o7w81,False,False,False,1562901375,self.Portland,https://www.reddit.com/r/Portland/comments/cc5ftg/the_bikers_ultimate_guide_to_riding_in_portland/,{},cc5ftg,True,False,False,False,True,True,False,,[],dark,text,False,False,True,43,0,False,all_ads,/r/Portland/comments/cc5ftg/the_bikers_ultimate_guide_to_riding_in_portland/,False,6,1562901376,55," 

The Bikers Ultimate guide to riding in Portland and achieving Moral Superiority while Still Being Awesome!

Biking in Portland is a challenge…

* Laws are confusing and poorly understood.
* There are many different types of riders with varying opinions of what is right and wrong.
* Are we riders? Cars? Pedestrians? How do we communicate that to others on the road?
* Lots of people want to tell you what their rights are, but not many people talk about their responsibilities. We need to be better aware of both.

The following are the rules of the road that I believe work best for all involved and are the result of commuting to work almost every day, year round, for 3 years. I am also a driver.

Here are the things I work on:

* Be Excellent to Each Other!
* If there is a bike between your legs, you are a bike, and need to follow the rules of the road just like a car. If you want the rights of a pedestrian, dismount and walk. Ignore those horrible signs by someone at the city that encourage bikes to be treated like pedestrians…sometimes. Be consistent. If you are on a bike boulevard and crossing a busy street, wait like a car, or dismount like a pedestrian. If there is a bike between your legs, you are a bike, and therefore need to follow the rules of the road like a car.
* Get a bell. Pee Wee Herman the shit out of it. Remember, bells are awesome! It says “hey baby! Nice work on that hill! Keep it up!” and “Dude! You rocked that flat! Love you tons”. The bell is the rainbow from the unicorn’s butt! It says, “I respect you and care about you and want you to be safe!” and “BTW…passing yo ass!”. Plus, pedestrians tend to leap at inopportune moments, so good to bell them up as well.
* Ride straight lines – Swerving in and out of your lane makes it difficult to pass. Be consistent so others can anticipate
* No line, no lane – I know the law says you can pass cars on the right, but don’t. Odds are, there is a better route. Find it.
* Stay off of arterial collectives – yes, the law says you can do it, but don’t. Burnside? Cornell? Taylors Ferry? Sandy? Scholls Ferry? Hawthorne? 33rd? Srsly!?! Why would ANYONE want to ride a bike on these? I have been rec riding with the spandex clad. Really don’t understand this as a sport. Yes, you have rights, but by the time your rights are aggravating everyone and endangering you, I think you need to rethink your definition of fun. Lead, follow, or get out of the way, but don’t keep people from getting to their jobs or home to their families.
* Yield right of way – Here we go…I roll stop signs and red lights ALL. THE. TIME. I justify this by saying that the traffic signs/lights are there to regulate traffic, and if there is no traffic, there is nothing to regulate. This REALLY pisses people off. I yield right of way religiously. I stop for pedestrians when they have the right of way, and insist they go before I will. I stop for cars parking through the bike lane when I could swerve around. I queue with cars at stops so I don’t create confusion at the intersection or block a driver turning right. But I CAN NOT sit at a red light with no traffic coming. I wish they would change stops to yields for bikes, but until then, I will continue to be an asshole.
* Lights, reflective gear, helmet – Remember, it does not matter as they never see you anyway, and the ones who do are trying to kill you, but when they do scrape your body off the road and your lights are shining bright…they won’t be able to say you are part of the problem.
* Don’t argue with cars at intersections – They are scared of us and don’t know how to treat us. Are we bikes? Cars? Pedestrians? Hell, we can’t decide, it’s no wonder nobody else knows. Yield right of way and insist others do the same. When you come to a 4way stop, don’t let the guy with the right of way wave you through. Whether they are being a nicehole or don’t know the rules of the road. The next car is watching the car that has rights. If they don’t see you and you go, you are in the kill zone. It gets ugly. I have been having great luck with the “down look”. I ignore traffic until they go. Track stand and look down. Once they realize you can’t see their “go ahead” wave, they go pretty fast.
* Understand and resist the sin of “mental inertia”. Cars do this ALL THE TIME. The car in front goes to parallel park. EVERYONE KNOWS the front end will swing out…but we are moving, we see a hole, and we can get around. I have observed that this is 10x worse on a bike. Remember, no line, no lane. Yield right of way. And of course, be excellent to each other.
* Don’t attempt to educate other riders – there are tons of different styles of riding and different types of riders. Nothing is gained by attempting to advise other riders they are doing it wrong. Save the rant for Reddit.
* Sidewalks – Legally allowed, but just about impossible to do with anyone around without being an asshole. Dismount if anybody around.
* Parked cars – Ride outside the door swing. If you are uncomfortable taking up that much road, find a better route. These are, IMO, the most common serious injuries out there. Doors are sharp and they don’t yield at all. Avoid them.",True,False,False,Portland,t5_2qi2i,131071,public,self,The Bikers Ultimate guide to riding in Portland and achieving Moral Superiority while Still Being Awesome!,0,1562987756,https://www.reddit.com/r/Portland/comments/cc5ftg/the_bikers_ultimate_guide_to_riding_in_portland/,all_ads,6,,,,,,,,,,,,,,
[],False,allie87mallie,,[],,text,t2_5xdkd9t,False,False,False,1562900927,self.Portland,https://www.reddit.com/r/Portland/comments/cc5d3b/gimme_your_best_tacos/,{},cc5d3b,True,False,False,False,True,True,False,,[],dark,text,False,False,True,68,0,False,all_ads,/r/Portland/comments/cc5d3b/gimme_your_best_tacos/,False,6,1562900928,12,"I’m looking at planning a taco century ride - 100 miles where we eat 100 tacos. 

Where are the best tacos? Can include places outside of Portland (Beaverton, Tigard, Hood River, Salem, etc.)

¿Por Que No? And Cruz Room are already in consideration, curious for other spots.",True,False,False,Portland,t5_2qi2i,131070,public,self,Gimme your best tacos!,0,1562987313,https://www.reddit.com/r/Portland/comments/cc5d3b/gimme_your_best_tacos/,all_ads,6,,,,,,,,,,True,,,,
[],False,grain_d,,[],,text,t2_m3mcd9x,False,False,False,1562896825,self.Portland,https://www.reddit.com/r/Portland/comments/cc4nzz/any_recommendations_for_used_car_dealerships_or/,{},cc4nzz,True,False,False,False,True,True,False,,[],dark,text,False,False,True,38,0,False,all_ads,/r/Portland/comments/cc4nzz/any_recommendations_for_used_car_dealerships_or/,False,6,1562896826,4,"I don’t really know much about cars and about to start the process of looking around for cars.

Interested in Toyota suvs, suburu outback or something roomy like the sorts ( these are just what I have driven and found comfortable). Or perhaps a small pick up. 

Anyone had good interactions/transactions at dealers that stood out?",True,False,False,Portland,t5_2qi2i,131066,public,self,Any recommendations for used car dealerships? Or advice for car shopping in Portland?,0,1562983204,https://www.reddit.com/r/Portland/comments/cc4nzz/any_recommendations_for_used_car_dealerships_or/,all_ads,6,,,,,,,,,,,,,,
[],False,Never-Ending-Sunset,,[],,text,t2_4478pqi1,False,False,False,1562896713,self.Portland,https://www.reddit.com/r/Portland/comments/cc4na3/anyone_know_what_happened_to_the_max_plans_going/,{},cc4na3,False,False,False,False,False,True,False,,[],dark,text,False,False,True,27,0,False,all_ads,/r/Portland/comments/cc4na3/anyone_know_what_happened_to_the_max_plans_going/,False,6,1562896715,0,[removed],True,False,False,Portland,t5_2qi2i,131066,public,self,Anyone know what happened to the Max plans going out to the beach?,0,1562983095,https://www.reddit.com/r/Portland/comments/cc4na3/anyone_know_what_happened_to_the_max_plans_going/,all_ads,6,,,,,,,,,,,,,,
[],False,sheriffmia,,[],,text,t2_v98jrbt,False,False,False,1562896639,self.Portland,https://www.reddit.com/r/Portland/comments/cc4mu3/looking_to_make_a_list_of_must_dos_for_my_visit/,{},cc4mu3,True,False,False,False,True,True,False,,[],dark,text,False,False,True,2,0,False,all_ads,/r/Portland/comments/cc4mu3/looking_to_make_a_list_of_must_dos_for_my_visit/,False,6,1562896640,1,"Myself (f25), and boyfriend (m28) are traveling from Saskatchewan to Portland and we were hoping to make it a great adventure! What are some things we should check out?
Things such as hiking, waterfalls, swimming, camping, museums, pubs, restaurants etc. ... open to all ideas. Thanks!",True,False,False,Portland,t5_2qi2i,131066,public,self,Looking to make a list of ‘Must Do’s’ for my visit to Portland in August. Thanks!,0,1562983018,https://www.reddit.com/r/Portland/comments/cc4mu3/looking_to_make_a_list_of_must_dos_for_my_visit/,all_ads,6,,,,,,,,,,,,,,
[],False,nimb0slice,,[],,text,t2_eb3dym6,False,False,False,1562893813,self.Portland,https://www.reddit.com/r/Portland/comments/cc454r/2_free_tix_to_beck_cage_spoon_tonight/,{},cc454r,True,False,False,False,True,True,False,,[],dark,text,False,False,True,0,0,False,all_ads,/r/Portland/comments/cc454r/2_free_tix_to_beck_cage_spoon_tonight/,False,6,1562893815,2,Can’t make the concert and don’t want to see these go to waste. Pm me,True,False,False,Portland,t5_2qi2i,131062,public,self,"2 free tix to Beck, Cage, Spoon tonight!",0,1562980198,https://www.reddit.com/r/Portland/comments/cc454r/2_free_tix_to_beck_cage_spoon_tonight/,all_ads,6,,,,,,,,,,,,,,
[],False,SammyBaughsGhost,,[],,text,t2_jeoks,False,False,False,1562887721,self.Portland,https://www.reddit.com/r/Portland/comments/cc31f0/ne_broadway_street_closures/,{},cc31f0,True,False,False,False,True,True,False,,[],dark,text,False,False,True,6,0,False,all_ads,/r/Portland/comments/cc31f0/ne_broadway_street_closures/,False,6,1562887722,20,Anybody know Broadway is shut down in NE? There many streets were blocked by either cop cars or fire trucks. It’s a few blocks East of Lloyd Center.,True,False,False,Portland,t5_2qi2i,131054,public,self,NE Broadway Street Closures,0,1562974105,https://www.reddit.com/r/Portland/comments/cc31f0/ne_broadway_street_closures/,all_ads,6,,,,,,,,,,,,,,
[],False,Nudeless,,[],,text,t2_30sqh7ak,False,False,False,1562887357,self.Portland,https://www.reddit.com/r/Portland/comments/cc2ywi/seriously_thinking_about_moving_to_portland_what/,{},cc2ywi,True,False,False,False,True,True,False,,[],dark,text,False,False,True,1,0,False,all_ads,/r/Portland/comments/cc2ywi/seriously_thinking_about_moving_to_portland_what/,False,6,1562887358,1,"Pros, Cons, fun facts, and everything in between! 

(Coming from Colorado.)",True,False,False,Portland,t5_2qi2i,131053,public,self,Seriously thinking about moving to Portland. What to know?,0,1562973740,https://www.reddit.com/r/Portland/comments/cc2ywi/seriously_thinking_about_moving_to_portland_what/,all_ads,6,,,,,,,,,,,,,,
