all_awardings,allow_live_comments,author,author_flair_css_class,author_flair_richtext,author_flair_text,author_flair_type,author_fullname,author_patreon_flair,author_premium,awarders,can_mod_post,contest_mode,created_utc,domain,full_link,gildings,id,is_crosspostable,is_meta,is_original_content,is_reddit_media_domain,is_robot_indexable,is_self,is_video,link_flair_background_color,link_flair_richtext,link_flair_text_color,link_flair_type,locked,media_only,no_follow,num_comments,num_crossposts,over_18,parent_whitelist_status,permalink,pinned,pwls,retrieved_on,score,selftext,send_replies,spoiler,stickied,subreddit,subreddit_id,subreddit_subscribers,subreddit_type,thumbnail,title,total_awards_received,url,whitelist_status,wls,post_hint,preview,thumbnail_height,thumbnail_width,link_flair_css_class,link_flair_text,author_flair_template_id,author_flair_text_color,author_flair_background_color,removed_by_category,author_cakeday,media,media_embed,secure_media,secure_media_embed
[],False,Training-Product,,[],,text,t2_5xrfjube,False,False,[],False,False,1584884320,self.Portland,https://www.reddit.com/r/Portland/comments/fn03tg/an_idea_regarding_grocery_shopping/,{},fn03tg,True,False,False,False,True,True,False,,[],dark,text,False,False,True,0,0,False,all_ads,/r/Portland/comments/fn03tg/an_idea_regarding_grocery_shopping/,False,6,1584884321,1,"Social distancing is all well and good, but we still need food. If you're isolating yourselves at home, and then you have to go out shopping, there's a bit of an issue with the isolation; plus, all the workers who are put at risk because of all the people in the grocery stores.

Here's my thought with regards to this problem. There are ~250k households in the Portland area. Assuming that each household gets groceries once per week, that is 35k deliveries of groceries to be made. Now, let's assume (because atm I don't have the numbers) that there are 500 grocery stores in the Portland Area. That would mean there would need to be 70 pickups per grocery store, per day.

* 250k homes
* 500 grocery stores
* 35k grocery deliveries per day / 7 days week
* 70 pick ups per grocery store.

So my idea is this: If every grocery store got on board, their employees would only need to shop for items and package them in boxes. Volunteer drivers would then pick up these orders and drop them at the people's front doors. With the right coordination, this could be coordinated in such a way that each grocery store in the area gets N number of pickups per day, and can essentially shut themselves off from the public. This also handles the issue with people hoarding.

As well, it would be nice to go along with this something to allow people who are more fortunate to donate to those who are less fortunate, so that nobody is going without food.

This is just a rough idea. There'd need to be a lot of coordination here, but I was curious to see if anyone had any thoughts.",True,False,False,Portland,t5_2qi2i,149140,public,self,An idea regarding grocery shopping.,0,https://www.reddit.com/r/Portland/comments/fn03tg/an_idea_regarding_grocery_shopping/,all_ads,6,,,,,,,,,,,,,,,
[],False,johnhenry123456,,[],,text,t2_2bl6khgw,False,False,[],False,False,1584882978,self.Portland,https://www.reddit.com/r/Portland/comments/fmzt46/climate_change_will_be_worse/,{},fmzt46,True,False,False,False,True,True,False,,[],dark,text,False,False,True,20,0,False,all_ads,/r/Portland/comments/fmzt46/climate_change_will_be_worse/,False,6,1584882980,1,"Hello, I am one of the scientists that resides in this city. Something that has been a problem for my community is a paranoid denial of scientific evidence. For years now scientists have been informing the public of a disaster that will be much more damaging than the one we are currently experiencing. Please try to understand that scientists may be flawed but they are hard to convince. Almost every gathering of scientist results in a debate over how to interpret the results and what experiments need to be done that can be more convincing. This is the nature of science. When it comes to man made climate change the community agrees that there needs to be a change. Hopefully this global disaster will catalyze the public to demand a more scientific approach to government policies. Especially ones that involve global disasters. However, watching how serious people are taking this pandemic gives me little hope.",True,False,False,Portland,t5_2qi2i,149138,public,self,Climate change will be worse,0,https://www.reddit.com/r/Portland/comments/fmzt46/climate_change_will_be_worse/,all_ads,6,,,,,,,,,,,,,,,
[],False,senshikarate,,[],,text,t2_5pwncfl1,False,False,[],False,False,1584879916,karatelessonsonline.com,https://www.reddit.com/r/Portland/comments/fmz5cc/free_online_karate_lesson_for_portland_kids_stuck/,{},fmz5cc,True,False,False,False,True,False,False,,[],dark,text,False,False,True,4,0,False,all_ads,/r/Portland/comments/fmz5cc/free_online_karate_lesson_for_portland_kids_stuck/,False,6,1584879917,1,,True,False,False,Portland,t5_2qi2i,149135,public,https://b.thumbs.redditmedia.com/eCChj7LNmNvnLrXueekP1CbHJFWGn8FiZqOlqJYKWMo.jpg,Free Online Karate Lesson for Portland Kids stuck at home,0,https://www.karatelessonsonline.com,all_ads,6,link,"{'enabled': False, 'images': [{'id': 'FPk0_VHP5aYPI3gNvONVqS73EoozmUB1lLzAYTOSx9c', 'resolutions': [{'height': 81, 'url': 'https://external-preview.redd.it/Wb9lB_7skJZ0ZeIiNk4x9882lX6tJiE6LuhZgV92_0E.jpg?width=108&amp;crop=smart&amp;auto=webp&amp;s=f3c02bc263fe0cdcc3be75d0b65db257491472ca', 'width': 108}, {'height': 162, 'url': 'https://external-preview.redd.it/Wb9lB_7skJZ0ZeIiNk4x9882lX6tJiE6LuhZgV92_0E.jpg?width=216&amp;crop=smart&amp;auto=webp&amp;s=9d5938a91b2d220a360fd32fc69408f2694222cf', 'width': 216}, {'height': 240, 'url': 'https://external-preview.redd.it/Wb9lB_7skJZ0ZeIiNk4x9882lX6tJiE6LuhZgV92_0E.jpg?width=320&amp;crop=smart&amp;auto=webp&amp;s=c72699e5d64451e56ab5d4ae5272563c63713f53', 'width': 320}, {'height': 480, 'url': 'https://external-preview.redd.it/Wb9lB_7skJZ0ZeIiNk4x9882lX6tJiE6LuhZgV92_0E.jpg?width=640&amp;crop=smart&amp;auto=webp&amp;s=cff062eaaeb650fbd3fb6742c7f508bd408f54f0', 'width': 640}, {'height': 720, 'url': 'https://external-preview.redd.it/Wb9lB_7skJZ0ZeIiNk4x9882lX6tJiE6LuhZgV92_0E.jpg?width=960&amp;crop=smart&amp;auto=webp&amp;s=5fb5b0d8288232542866110f03dd702ea6239e3e', 'width': 960}, {'height': 810, 'url': 'https://external-preview.redd.it/Wb9lB_7skJZ0ZeIiNk4x9882lX6tJiE6LuhZgV92_0E.jpg?width=1080&amp;crop=smart&amp;auto=webp&amp;s=db9ca0191f1d7e3fcb6894ac9fc9f490fde8c6d3', 'width': 1080}], 'source': {'height': 1125, 'url': 'https://external-preview.redd.it/Wb9lB_7skJZ0ZeIiNk4x9882lX6tJiE6LuhZgV92_0E.jpg?auto=webp&amp;s=fe8b2cd16cb2e6f80125007160584f2c40990a94', 'width': 1500}, 'variants': {}}]}",105.0,140.0,,,,,,,,,,,
[],False,sailboatguypdx,,[],,text,t2_3hx7au18,False,False,[],False,False,1584878600,i.redd.it,https://www.reddit.com/r/Portland/comments/fmyvt1/something_else_to_look_at_from_our_quarintine/,{},fmyvt1,True,False,False,True,True,False,False,,[],dark,text,False,False,True,0,0,False,all_ads,/r/Portland/comments/fmyvt1/something_else_to_look_at_from_our_quarintine/,False,6,1584878601,1,,True,False,False,Portland,t5_2qi2i,149135,public,default,Something else to look at from our quarintine view. Aboard our Sail Boat SY Windbella II.,0,https://i.redd.it/l1h4nsq3s7o41.jpg,all_ads,6,,,,,photo,Photo,,,,,,,,,
[],False,evilsibe,,[],,text,t2_3eg50,False,False,[],False,False,1584877849,self.Portland,https://www.reddit.com/r/Portland/comments/fmyqj5/tp_in_stock_megathread/,{},fmyqj5,True,False,False,False,True,True,False,,[],dark,text,False,False,True,7,0,False,all_ads,/r/Portland/comments/fmyqj5/tp_in_stock_megathread/,False,6,1584877850,1,,True,False,False,Portland,t5_2qi2i,149136,public,self,TP in stock megathread,0,https://www.reddit.com/r/Portland/comments/fmyqj5/tp_in_stock_megathread/,all_ads,6,,,,,,,,,,,,,,,
[],False,digsafe,,[],,text,t2_9wrwk,False,False,[],False,False,1584877684,self.Portland,https://www.reddit.com/r/Portland/comments/fmypge/cant_find_tp_or_hand_sanitizer/,{},fmypge,True,False,False,False,True,True,False,,[],dark,text,False,False,True,14,0,False,all_ads,/r/Portland/comments/fmypge/cant_find_tp_or_hand_sanitizer/,False,6,1584877685,1,"To all of you that hoarded these items, FUCK YOU.",True,False,False,Portland,t5_2qi2i,149136,public,self,Can’t find TP or hand sanitizer,0,https://www.reddit.com/r/Portland/comments/fmypge/cant_find_tp_or_hand_sanitizer/,all_ads,6,,,,,,,,,,,,,,,
[],False,KosherBaconJam,,[],,text,t2_zcvdw,False,False,[],False,False,1584874435,self.Portland,https://www.reddit.com/r/Portland/comments/fmy4f6/thank_you_wasnt_enough/,{},fmy4f6,True,False,False,False,True,True,False,,[],dark,text,False,False,True,313,0,False,all_ads,/r/Portland/comments/fmy4f6/thank_you_wasnt_enough/,False,6,1584874436,1,"I work in a Grocery Store. I love my job. 

I used to have a skilled trade job, a stressful job, that made my life miserable emotionally and physically. 

Today at the Grocery a Customer came over and said, ""I'd like to thank you for being here. It's nice to see that the Unskilled Workforce is finally getting the recognition you all deserve"".

I'm sorry but who do you think you are talking down to us like that. You don't know what our personal skill set is or what we do for a job on a day to day basis. Why could you not have stopped at ""Thank you for being here""? Did you really need to feel uppity and bash who we are and the job we work?",True,False,False,Portland,t5_2qi2i,149133,public,self,Thank you wasn't enough?,0,https://www.reddit.com/r/Portland/comments/fmy4f6/thank_you_wasnt_enough/,all_ads,6,,,,,,,,,,,,,,,
[],False,mrhairyasshole,,[],,text,t2_3ta4pg31,False,False,[],False,False,1584873535,self.Portland,https://www.reddit.com/r/Portland/comments/fmxysy/anyone_know_of_some_cool_low_traffic_skatespots/,{},fmxysy,True,False,False,False,True,True,False,,[],dark,text,False,False,True,5,0,False,all_ads,/r/Portland/comments/fmxysy/anyone_know_of_some_cool_low_traffic_skatespots/,False,6,1584873536,1,,True,False,False,Portland,t5_2qi2i,149132,public,self,Anyone know of some cool low traffic skatespots in SE?,0,https://www.reddit.com/r/Portland/comments/fmxysy/anyone_know_of_some_cool_low_traffic_skatespots/,all_ads,6,,,,,,,,,,,,,,,
[],False,Clackamas1,,[],,text,t2_25xwp3ci,False,False,[],False,False,1584866454,self.Portland,https://www.reddit.com/r/Portland/comments/fmwrtu/heads_up_there_is_not_enough_money_in_the/,{},fmwrtu,True,False,False,False,True,True,False,,[],dark,text,False,False,True,57,0,False,all_ads,/r/Portland/comments/fmwrtu/heads_up_there_is_not_enough_money_in_the/,False,6,1584866454,1,"I saw on the news that the Governor said ""to be clear"" there is not enough money to cover unemployment claims.  This was on KGW 2 days ago.  I checked with a state legislator, and it was confirmed.  Thank God the R's trashed the legislative session because the state was going to raid the SAIF fund and bankrupt disabled people.   I have no idea what they are going to do, but with so many unemployment claims the state can't pay them all.",True,False,False,Portland,t5_2qi2i,149129,public,self,Heads up - There is not enough money in the Unemployment pool to cover benefits,0,https://www.reddit.com/r/Portland/comments/fmwrtu/heads_up_there_is_not_enough_money_in_the/,all_ads,6,,,,,,,,,,,,,,,
[],False,portlandninja,,[],,text,t2_274vv0y6,False,False,[],False,False,1584863903,self.Portland,https://www.reddit.com/r/Portland/comments/fmwcpi/new_hours_at_stores/,{},fmwcpi,True,False,False,False,True,True,False,,[],dark,text,False,False,True,15,0,False,all_ads,/r/Portland/comments/fmwcpi/new_hours_at_stores/,False,6,1584863904,1,"does anyone have any schedule of hours of operation for grocery stores? posted hours seem no longer applicable. i hate to go out to find i have to wait an hour for a store to open. t.j.'s usually opens at 8, now? safeway? freddy's? and what about senior hours? i called the stores yesterday and there is either no answer or the taped message hasn't been updated.  any info would save me having to make multiple trips, you know, trying to follow guidelines about staying in and all. thanks for any information.",True,False,False,Portland,t5_2qi2i,149128,public,self,NEW hours at stores?,0,https://www.reddit.com/r/Portland/comments/fmwcpi/new_hours_at_stores/,all_ads,6,,,,,,,,,,,,,,,
[],False,im_justin_jk,,[],,text,t2_4mikm355,False,False,[],False,False,1584862206,self.Portland,https://www.reddit.com/r/Portland/comments/fmw2j1/3d_printers_for_medical_supplies_going_unused/,{},fmw2j1,True,False,False,False,True,True,False,,[],dark,text,False,False,True,0,0,False,all_ads,/r/Portland/comments/fmw2j1/3d_printers_for_medical_supplies_going_unused/,False,6,1584862207,1,"I know all of these are closed down, but couldn’t a handful of people being using these facilities to create medical supplies? Sorry if anyone has posted about this. I know that PSU,  and some Multnomah county libraries have 3D printers. I’m not sure about high schools, other colleges, other libraries, private businesses, etc? I’ve seen a lot of articles about people 3D printing face shields, ventilators, and other items for medical staff. Would it not be possible to reopen these facilities for small teams to start creating some much needed supplies?",True,False,False,Portland,t5_2qi2i,149125,public,self,"3D Printers for medical supplies going unused (schools, libraries, etc)?",0,https://www.reddit.com/r/Portland/comments/fmw2j1/3d_printers_for_medical_supplies_going_unused/,all_ads,6,,,,,,,,,,,,,,,
[],False,Blueyedgirl316,,[],Sherwood,text,t2_2xxs9vw7,False,False,[],False,False,1584860099,google.com,https://www.reddit.com/r/Portland/comments/fmvp5o/what_is_essential_and_nonessential_during_a/,{},fmvp5o,True,False,False,False,True,False,False,,[],dark,text,False,False,True,23,0,False,all_ads,/r/Portland/comments/fmvp5o/what_is_essential_and_nonessential_during_a/,False,6,1584860101,1,,True,False,False,Portland,t5_2qi2i,149126,public,default,What is essential and non-essential during a pandemic?,0,https://www.google.com/amp/s/amp.usatoday.com/amp/2884758001,all_ads,6,,,,,,,e506530c-2751-11e5-8a2f-0e5e20c89e15,dark,,,,,,,
[],False,Drewbacca,,[],Richmond,text,t2_4b1za,False,False,[],False,False,1584860070,self.Portland,https://www.reddit.com/r/Portland/comments/fmvoyv/we_need_to_stop_calling_it_shelter_in_place/,{},fmvoyv,True,False,False,False,True,True,False,,[],dark,text,False,False,True,20,0,False,all_ads,/r/Portland/comments/fmvoyv/we_need_to_stop_calling_it_shelter_in_place/,False,6,1584860072,1,"Ted Wheeler explained it yesterday, ""shelter in place"" has a very specific definition and the (likely) coming order from the governer does **not** fit that definition. 

From Wikipedia:  
**Shelter in place** is to seek safety within the building one already occupies, rather than to evacuate the area or seek a community emergency shelter. The American Red Cross says the warning is issued when ""chemical, biological, or radiological contaminants may be released accidentally or intentionally into the environment"" and residents should ""select a small, interior room, with no or few windows, taking refuge there.""

""Stay at home"" is not the same as ""shelter in place,"" and it's important that we use the correct terminology throughout this ordeal.",True,False,False,Portland,t5_2qi2i,149126,public,self,"We need to stop calling it ""shelter in place""",0,https://www.reddit.com/r/Portland/comments/fmvoyv/we_need_to_stop_calling_it_shelter_in_place/,all_ads,6,,,,,,,,dark,,,,,,,
[],False,Yeh_Old_Rums,,[],,text,t2_5y5j6smg,False,False,[],False,False,1584857276,koin.com,https://www.reddit.com/r/Portland/comments/fmv6r0/beaverton_farmers_market_adapts_to_social/,{},fmv6r0,False,False,False,False,False,False,False,,[],dark,text,False,False,True,0,0,False,all_ads,/r/Portland/comments/fmv6r0/beaverton_farmers_market_adapts_to_social/,False,6,1584857277,1,,False,False,False,Portland,t5_2qi2i,149121,public,default,Beaverton Farmers Market adapts to social distancing,0,https://www.koin.com/news/health/coronavirus/beaverton-farmers-market-adapts-to-social-distancing/,all_ads,6,,,,,,,,,,automod_filtered,,,,,
[],False,zenigata_mondatta,,[],,text,t2_1spmlmqx,False,False,[],False,False,1584856417,i.redd.it,https://www.reddit.com/r/Portland/comments/fmv0n5/thought_id_stir_the_pot_one_more_time/,{},fmv0n5,True,False,False,True,True,False,False,,[],dark,text,False,False,True,495,0,False,all_ads,/r/Portland/comments/fmv0n5/thought_id_stir_the_pot_one_more_time/,False,6,1584856418,1,,True,False,False,Portland,t5_2qi2i,149118,public,default,Thought I'd stir the pot one more time.,0,https://i.redd.it/rijw9pvay5o41.jpg,all_ads,6,,,,,photo,Photo,,,,,,,,,
[],False,archpope,,[],Gresham,text,t2_4npc9,False,True,[],False,False,1584855952,i.redd.it,https://www.reddit.com/r/Portland/comments/fmuxhf/trying_to_keep_my_beak_held_high_in_these_dark/,{},fmuxhf,True,False,False,True,True,False,False,,[],dark,text,False,False,True,13,0,False,all_ads,/r/Portland/comments/fmuxhf/trying_to_keep_my_beak_held_high_in_these_dark/,False,6,1584855952,1,,True,False,False,Portland,t5_2qi2i,149117,public,default,Trying to keep my beak held high in these dark times.,0,https://i.redd.it/5z5zs1muw5o41.jpg,all_ads,6,,,,,,,215746fa-42fd-11e1-b445-12313d18ad57,dark,,,,,,,
[],False,Projectrage,,[],,text,t2_8m08z,False,True,[],False,False,1584855726,reddit.com,https://www.reddit.com/r/Portland/comments/fmuvyb/unverified_peace_health_had_a_covid_19_patient_in/,{},fmuvyb,True,False,False,False,True,False,False,,[],dark,text,False,False,True,11,0,False,all_ads,/r/Portland/comments/fmuvyb/unverified_peace_health_had_a_covid_19_patient_in/,False,6,1584855727,1,,True,False,False,Portland,t5_2qi2i,149118,public,default,Unverified: Peace Health had a covid 19 patient in February and told staff to keep quiet. (Comments in link),0,https://www.reddit.com/r/CoronavirusOregon/comments/fmm0xd/can_we_please_start_a_class_action_lawsuits/?utm_source=share&amp;utm_medium=ios_app&amp;utm_name=iossmf,all_ads,6,,,,,,,,,,,,,,,
[],False,mallorykeaton,,[],,text,t2_fi338,False,False,[],False,False,1584855709,self.Portland,https://www.reddit.com/r/Portland/comments/fmuvtt/where_should_we_donate_homemade_medical_masks/,{},fmuvtt,True,False,False,False,True,True,False,,[],dark,text,False,False,True,13,0,False,all_ads,/r/Portland/comments/fmuvtt/where_should_we_donate_homemade_medical_masks/,False,6,1584855709,1,,True,False,False,Portland,t5_2qi2i,149118,public,self,Where should we donate homemade medical masks?,0,https://www.reddit.com/r/Portland/comments/fmuvtt/where_should_we_donate_homemade_medical_masks/,all_ads,6,,,,,,,,,,,,,,,
[],False,ChicaFoxy,,[],,text,t2_13okgv,False,False,[],False,False,1584855092,self.Portland,https://www.reddit.com/r/Portland/comments/fmurbu/please_redirect_me_if_this_is_not_allowed_im/,{},fmurbu,True,False,False,False,True,True,False,,[],dark,text,False,False,True,13,0,False,all_ads,/r/Portland/comments/fmurbu/please_redirect_me_if_this_is_not_allowed_im/,False,6,1584855093,1,"I'm looking for my older brother who lives in Portland, I have no contact information whatsoever or names of poeple he knows (except for one from years ago) but I do know quite a few people know him around town but he's kind of a loner vagabond type I guess you could say, known for being kind hearted and sticking up for others. He might be renting or just staying with friends. I don't know where to start. I want to know if he's ok.",True,False,False,Portland,t5_2qi2i,149118,public,self,Please redirect me if this is not allowed. I'm looking for my brother in Portland.,0,https://www.reddit.com/r/Portland/comments/fmurbu/please_redirect_me_if_this_is_not_allowed_im/,all_ads,6,,,,,,,,,,,,,,,
[],False,Humdrum_ca,,[],,text,t2_awrb2,False,False,[],False,False,1584854989,self.Portland,https://www.reddit.com/r/Portland/comments/fmuqla/lots_of_love_from_canada/,{},fmuqla,True,False,False,False,True,True,False,,[],dark,text,False,False,True,4,0,False,all_ads,/r/Portland/comments/fmuqla/lots_of_love_from_canada/,False,6,1584854990,1,"Lived in Portland for a couple of years (SW Irving, in alphabet). Loved Portland and loved you guys, , been back in Ontario for quite a few years but still thinking of you all. Keep it safe and keep it weird.
Love from random Canada guy",True,False,False,Portland,t5_2qi2i,149117,public,self,Lots of love from Canada.,0,https://www.reddit.com/r/Portland/comments/fmuqla/lots_of_love_from_canada/,all_ads,6,,,,,,,,,,,,,,,
[],False,Redsald,,[],,text,t2_eu3kt,False,False,[],False,False,1584854889,fosters.com,https://www.reddit.com/r/Portland/comments/fmupw1/nh_governor_bans_use_of_reusable_bags_to_prevent/,{},fmupw1,True,False,False,False,True,False,False,,[],dark,text,False,False,True,24,0,False,all_ads,/r/Portland/comments/fmupw1/nh_governor_bans_use_of_reusable_bags_to_prevent/,False,6,1584854890,1,,True,False,False,Portland,t5_2qi2i,149117,public,default,NH Governor Bans Use Of Reusable Bags To Prevent The Spread Of COVID19. Oregon Must Follow Suit.,0,https://www.fosters.com/news/20200321/covid-19-safeguard-nh-governor-bans-use-of-reusable-bags-in-grocery-retail-stores,all_ads,6,,,,,,,,,,,,,,,
[],False,FormerFoster1,,[],,text,t2_5n3wgpo3,False,False,[],False,False,1584853774,rollingstone.com,https://www.reddit.com/r/Portland/comments/fmuhzt/doj_wants_to_suspend_our_constitutional_rights_be/,{},fmuhzt,True,False,False,False,True,False,False,,[],dark,text,False,False,True,9,0,False,all_ads,/r/Portland/comments/fmuhzt/doj_wants_to_suspend_our_constitutional_rights_be/,False,6,1584853775,1,,True,False,False,Portland,t5_2qi2i,149111,public,https://b.thumbs.redditmedia.com/PxneipRjng3jEvnSXoD7qsfytp-Y5Xe92y7cvSlvEjI.jpg,DOJ wants to suspend our constitutional rights. Be alert Portland while you beg for our rights to be taken.,0,https://www.rollingstone.com/politics/politics-news/doj-suspend-constitutional-rights-coronavirus-970935/?fbclid=IwAR3itkxjbGQ39GgyeFZVavAMp5ZopXM0XfNR8EqK2ng-Jn1gbQz5vyaoCig,all_ads,6,link,"{'enabled': False, 'images': [{'id': 'KjAjId1t45e7htq1rNoqEHv38D-YccKHfEQkCm_jhqc', 'resolutions': [{'height': 71, 'url': 'https://external-preview.redd.it/mXc-8R2FTwQhBKQ7S8Fz30_cxhefgDSD0bDLm5mQRaM.jpg?width=108&amp;crop=smart&amp;auto=webp&amp;s=2a2fcdd98bb61f9189bb0cf89180974ea38afb96', 'width': 108}, {'height': 143, 'url': 'https://external-preview.redd.it/mXc-8R2FTwQhBKQ7S8Fz30_cxhefgDSD0bDLm5mQRaM.jpg?width=216&amp;crop=smart&amp;auto=webp&amp;s=e6436110a51c339e090d46b41c9d7df0dea39877', 'width': 216}, {'height': 213, 'url': 'https://external-preview.redd.it/mXc-8R2FTwQhBKQ7S8Fz30_cxhefgDSD0bDLm5mQRaM.jpg?width=320&amp;crop=smart&amp;auto=webp&amp;s=d02b17f2552a8f113cf6ed467f0b9a32a15eccf4', 'width': 320}, {'height': 426, 'url': 'https://external-preview.redd.it/mXc-8R2FTwQhBKQ7S8Fz30_cxhefgDSD0bDLm5mQRaM.jpg?width=640&amp;crop=smart&amp;auto=webp&amp;s=ae1b9c7e492aedb903ad115236e04a0fc6d37176', 'width': 640}, {'height': 639, 'url': 'https://external-preview.redd.it/mXc-8R2FTwQhBKQ7S8Fz30_cxhefgDSD0bDLm5mQRaM.jpg?width=960&amp;crop=smart&amp;auto=webp&amp;s=f11330a6f6bf840012503caa7a3357d3098479d2', 'width': 960}, {'height': 719, 'url': 'https://external-preview.redd.it/mXc-8R2FTwQhBKQ7S8Fz30_cxhefgDSD0bDLm5mQRaM.jpg?width=1080&amp;crop=smart&amp;auto=webp&amp;s=5544118e733c93f6e61ac52aa6e7c3ea6fbdf17c', 'width': 1080}], 'source': {'height': 1333, 'url': 'https://external-preview.redd.it/mXc-8R2FTwQhBKQ7S8Fz30_cxhefgDSD0bDLm5mQRaM.jpg?auto=webp&amp;s=a4653565387e841ff85b2cba0508e739257019c1', 'width': 2000}, 'variants': {}}]}",93.0,140.0,,,,,,,,,,,
[],False,probablyawalrus,,[],,text,t2_c1508,False,False,[],False,False,1584852663,self.Portland,https://www.reddit.com/r/Portland/comments/fmu9lk/looking_for_places_to_help_work_or_volunteer/,{},fmu9lk,True,False,False,False,True,True,False,,[],dark,text,False,False,True,8,0,False,all_ads,/r/Portland/comments/fmu9lk/looking_for_places_to_help_work_or_volunteer/,False,6,1584852664,1,My friend is losing her mind being out of work and not having a scheduled thing or anything helpful to do. Her cars a bit too old to do food delivery jobs as well. Any recommendations? Does anywhere need volunteers or is hiring?,True,False,False,Portland,t5_2qi2i,149105,public,self,"Looking for places to help, work or volunteer.",0,https://www.reddit.com/r/Portland/comments/fmu9lk/looking_for_places_to_help_work_or_volunteer/,all_ads,6,,,,,,,,,,,,,,,
[],False,Redsald,,[],,text,t2_eu3kt,False,False,[],False,False,1584851978,self.Portland,https://www.reddit.com/r/Portland/comments/fmu4fn/the_time_to_ban_reusable_bags_is_now/,{},fmu4fn,True,False,False,False,True,True,False,,[],dark,text,False,False,True,46,0,False,all_ads,/r/Portland/comments/fmu4fn/the_time_to_ban_reusable_bags_is_now/,False,6,1584851979,1,"I know we have worked very hard on finding sustainable ways of getting our products from the store to our homes, but the threat of bags being contaminated with COVID19 is growing every day. These reusable bags are seldom washed, and present a greater immediate threat to our population then the alternative of switching back to one time use paper/plastic bags. 

Let me know your thoughts on this topic in the comments.",True,False,False,Portland,t5_2qi2i,149103,public,self,The Time to Ban Reusable Bags is Now.,0,https://www.reddit.com/r/Portland/comments/fmu4fn/the_time_to_ban_reusable_bags_is_now/,all_ads,6,,,,,,,,,,,,,,,
