author,author_flair_background_color,author_flair_css_class,author_flair_richtext,author_flair_text,author_flair_text_color,author_flair_type,author_fullname,author_patreon_flair,can_mod_post,contest_mode,created_utc,domain,full_link,gildings,id,is_crosspostable,is_meta,is_original_content,is_reddit_media_domain,is_robot_indexable,is_self,is_video,link_flair_background_color,link_flair_richtext,link_flair_text_color,link_flair_type,locked,media_only,no_follow,num_comments,num_crossposts,over_18,parent_whitelist_status,permalink,pinned,pwls,retrieved_on,score,selftext,send_replies,spoiler,stickied,subreddit,subreddit_id,subreddit_subscribers,subreddit_type,thumbnail,title,updated_utc,url,whitelist_status,wls,link_flair_css_class,link_flair_text,suggested_sort,author_flair_template_id,media_metadata,media,media_embed,post_hint,preview,secure_media,secure_media_embed,thumbnail_height,thumbnail_width
BeastofBurden,,,[],,,text,t2_42k1l,False,False,False,1551323918,self.Portland,https://www.reddit.com/r/Portland/comments/avm7qh/anagram_man_in_ne_portland/,"{'gid_1': 0, 'gid_2': 0, 'gid_3': 0}",avm7qh,True,False,False,False,True,True,False,,[],dark,text,False,False,True,7,0,False,all_ads,/r/Portland/comments/avm7qh/anagram_man_in_ne_portland/,False,6,1551323919,9,"I lived in Portland years ago. Well, long story short I had some beers tonight and randomly remembered a guy I would run into at Mauis or on Mississippi Ave who had this anagram spiel he’d recite from memory. Just wondering if I dreamt that or if it was real. I seem to remember him being drunk all the time and his name might have been Floyd. ",True,False,False,Portland,t5_2qi2i,119499,public,self,Anagram man in NE Portland,1553287386,https://www.reddit.com/r/Portland/comments/avm7qh/anagram_man_in_ne_portland/,all_ads,6,,,,,,,,,,,,,
Jgk4dolo,,,[],,,text,t2_3bbdqsnk,False,False,False,1551323036,self.Portland,https://www.reddit.com/r/Portland/comments/avm2rj/nike_company_store_pass/,"{'gid_1': 0, 'gid_2': 0, 'gid_3': 0}",avm2rj,True,False,False,False,True,True,False,,[],dark,text,False,False,True,1,0,False,all_ads,/r/Portland/comments/avm2rj/nike_company_store_pass/,False,6,1551323037,1,Headed to Portland for the first time next week and really wanted to check out the Nike company store. Any way someone help me get into the company store? ,True,False,False,Portland,t5_2qi2i,119497,public,self,Nike company store pass,1553287305,https://www.reddit.com/r/Portland/comments/avm2rj/nike_company_store_pass/,all_ads,6,,,,,,,,,,,,,
westernbittercrass,,,[],,,text,t2_sbu81jg,False,False,False,1551321402,oregonlive.com,https://www.reddit.com/r/Portland/comments/avltqo/2013_agreement_between_city_police_union_may/,"{'gid_1': 0, 'gid_2': 0, 'gid_3': 0}",avltqo,True,False,False,False,True,False,False,,[],dark,text,False,False,True,3,0,False,all_ads,/r/Portland/comments/avltqo/2013_agreement_between_city_police_union_may/,False,6,1551321403,7,,True,False,False,Portland,t5_2qi2i,119493,public,default,"2013 agreement between city, police union, may thwart attempt to reform police discipline",1553287157,https://www.oregonlive.com/crime/2019/02/portlands-bill-that-would-curb-an-arbitrator-from-overturning-certain-police-discipline-may-not-help-city.html,all_ads,6,,,,,,,,,,,,,
westernbittercrass,,,[],,,text,t2_sbu81jg,False,False,False,1551320654,oregonlive.com,https://www.reddit.com/r/Portland/comments/avlpo1/ristretto_roasters_saga_continues_as_wife_of/,"{'gid_1': 0, 'gid_2': 0, 'gid_3': 0}",avlpo1,True,False,False,False,True,False,False,,[],dark,text,False,False,True,46,0,False,all_ads,/r/Portland/comments/avlpo1/ristretto_roasters_saga_continues_as_wife_of/,False,6,1551320655,40,,True,False,False,Portland,t5_2qi2i,119493,public,default,Ristretto Roasters saga continues as wife of owner writes op-eds and coffee company solicits donations,1553287091,https://www.oregonlive.com/dining/2019/02/ristretto-roasters-saga-continues-as-wife-of-owner-writes-op-eds-and-coffee-company-solicits-donations.html,all_ads,6,,,,,,,,,,,,,
ab2g,,,[],Milwaukie,dark,text,t2_4kgw6,False,False,False,1551318792,self.Portland,https://www.reddit.com/r/Portland/comments/avlf9b/i_need_to_rehome_a_flock_of_chickens_and_one/,"{'gid_1': 0, 'gid_2': 0, 'gid_3': 0}",avlf9b,True,False,False,False,True,True,False,,[],dark,text,False,False,True,9,0,False,all_ads,/r/Portland/comments/avlf9b/i_need_to_rehome_a_flock_of_chickens_and_one/,False,6,1551318792,7,"I have 17 birds that will need a new home by the start of next week. They are currently located in Canby. The sooner you can pick them up, the better. They do not all need to go together. We would like to reserve them for a place that is not going to use them for slaughter. This is a great group of birds, we've loved having them. We will miss their quirky personalities.

There are 4 Rhode Island Red hens, a Minorca Rooster, a Red Cockerel  rooster, one Barneveldar  hen, one black jersey giant, a bantam wyandotte, some english partridges, a rhode island white hen, some arcauna mixes, and some others.

There is also a white turkey that would make a great family animal. She likes to be pet and she is good with small children. She is laying as well.

About 1/3 of the birds are 2 years old, and the rest, including the turkey is 1 year old.

I have tried reaching out to sanctuaries but so far I have not had any success. Please contact me if you can be of any help. Thank you",True,False,False,Portland,t5_2qi2i,119491,public,self,I need to re-home a flock of chickens and one turkey.,1553286923,https://www.reddit.com/r/Portland/comments/avlf9b/i_need_to_rehome_a_flock_of_chickens_and_one/,all_ads,6,,,,,,,,,,,,,
PriscillaNicol,,,[],,,text,t2_1taoa25u,False,False,False,1551317436,i.redd.it,https://www.reddit.com/r/Portland/comments/avl7ly/shout_out_to_this_guy_today/,"{'gid_1': 0, 'gid_2': 0, 'gid_3': 0}",avl7ly,True,False,False,True,True,False,False,,[],dark,text,False,False,True,96,0,False,all_ads,/r/Portland/comments/avl7ly/shout_out_to_this_guy_today/,False,6,1551317437,347,,True,False,False,Portland,t5_2qi2i,119491,public,default,Shout out to this guy today !,1553286799,https://i.redd.it/tqhgd2zop7j21.jpg,all_ads,6,,,,,,,,,,,,,
thisxisxderek,,,[],,,text,t2_2da0fnba,False,False,False,1551313547,self.Portland,https://www.reddit.com/r/Portland/comments/avkl9g/how_bad_was_it_in_banks_today_and_monday_on_the/,"{'gid_1': 0, 'gid_2': 0, 'gid_3': 0}",avkl9g,True,False,False,False,True,True,False,,[],dark,text,False,False,True,34,0,False,all_ads,/r/Portland/comments/avkl9g/how_bad_was_it_in_banks_today_and_monday_on_the/,False,6,1551313548,0,,True,False,False,Portland,t5_2qi2i,119483,public,self,How bad was it in Banks today and Monday on the roads? We had a new hire “work remote” because he couldn’t make it to Vancouver. Everyone else made it in.,1553286441,https://www.reddit.com/r/Portland/comments/avkl9g/how_bad_was_it_in_banks_today_and_monday_on_the/,all_ads,6,,,,,,,,,,,,,
raster_raster,,,[],,,text,t2_ib2ns,False,False,False,1551311497,self.Portland,https://www.reddit.com/r/Portland/comments/avk8wo/psu_houses_a_chinese_run_confucius_institute_that/,"{'gid_1': 0, 'gid_2': 0, 'gid_3': 0}",avk8wo,True,False,False,False,True,True,False,,[],dark,text,False,False,True,26,0,False,all_ads,/r/Portland/comments/avk8wo/psu_houses_a_chinese_run_confucius_institute_that/,False,6,1551311498,2,"[https://www.nbcnews.com/politics/national-security/senate-investigators-warn-chinese-state-run-centers-more-100-u-n977351](https://www.nbcnews.com/politics/national-security/senate-investigators-warn-chinese-state-run-centers-more-100-u-n977351)

[https://www.pdx.edu/confucius-institute/](https://www.pdx.edu/confucius-institute/)

&amp;#x200B;

I find this program to be very alarming based on some of the quotes in the article:

""As China has expanded Confucius Institutes here in the U.S., it has systematically shut down key U.S. State Department public diplomacy efforts on Chinese college campuses,"" Portman said in a statement. ""We learned that schools in the United States—from kindergarten to college—have provided a level of access to the Chinese government that the Chinese government has refused to provide to the United States."" 

Additionally, ""the Chinese teachers sign contracts with the Chinese government pledging they will not damage the national interests of China,"" according to the report. ""Such limitations attempt to export China's censorship of political debate and prevent discussion of potentially politically sensitive topics.""

U.S. school officials who spoke to Senate investigators disclosed that Confucius Institutes shun controversial topics, such as China's poor human rights record and other hot button topics that could be damaging to the country's reputation.

""Confucius Institutes exist as one part of China's broader, long-term strategy,"" the Senate committee concluded. ""Through Confucius Institutes, the Chinese government is attempting to change the impression in the United States and around the world that China is an economic and security threat.""

&amp;#x200B;

I think we should be alarmed by this and we should call on PSU and UO to end these chinese run programs that are not very reciprocal and potential threat to our security.

&amp;#x200B;",False,False,False,Portland,t5_2qi2i,119481,public,self,PSU houses a chinese run Confucius Institute that is only beholden to chinese gov't,1553286241,https://www.reddit.com/r/Portland/comments/avk8wo/psu_houses_a_chinese_run_confucius_institute_that/,all_ads,6,,,,,,,,self,"{'enabled': False, 'images': [{'id': 'dH6qK7WYmnlsdsPRLqSYHHhn2CHe3fHQnMpeXt6fr9c', 'resolutions': [{'height': 56, 'url': 'https://external-preview.redd.it/sSPV52E8opHw5-YNcpSo0ecWbfJhGAuOzm4rkki36Z4.jpg?width=108&amp;crop=smart&amp;auto=webp&amp;s=b7861bab698bb1c01e4ed546e5a5261486092d6a', 'width': 108}, {'height': 113, 'url': 'https://external-preview.redd.it/sSPV52E8opHw5-YNcpSo0ecWbfJhGAuOzm4rkki36Z4.jpg?width=216&amp;crop=smart&amp;auto=webp&amp;s=7bdec49fca7bb457c622576332a2d7ee59863f2c', 'width': 216}, {'height': 168, 'url': 'https://external-preview.redd.it/sSPV52E8opHw5-YNcpSo0ecWbfJhGAuOzm4rkki36Z4.jpg?width=320&amp;crop=smart&amp;auto=webp&amp;s=b96c81583911d7b702aaa8ac0419117ab6d8ab15', 'width': 320}, {'height': 336, 'url': 'https://external-preview.redd.it/sSPV52E8opHw5-YNcpSo0ecWbfJhGAuOzm4rkki36Z4.jpg?width=640&amp;crop=smart&amp;auto=webp&amp;s=d706686964fa36b1177428b0c03a2f6674d1672b', 'width': 640}, {'height': 504, 'url': 'https://external-preview.redd.it/sSPV52E8opHw5-YNcpSo0ecWbfJhGAuOzm4rkki36Z4.jpg?width=960&amp;crop=smart&amp;auto=webp&amp;s=f8883e6079a0fe80b29bd4615fb88692d89df15d', 'width': 960}, {'height': 567, 'url': 'https://external-preview.redd.it/sSPV52E8opHw5-YNcpSo0ecWbfJhGAuOzm4rkki36Z4.jpg?width=1080&amp;crop=smart&amp;auto=webp&amp;s=272ae0b247e13538d4a1bfbf4810ea1eca4a52e3', 'width': 1080}], 'source': {'height': 630, 'url': 'https://external-preview.redd.it/sSPV52E8opHw5-YNcpSo0ecWbfJhGAuOzm4rkki36Z4.jpg?auto=webp&amp;s=95388d776bb3b3d78861fd23d3cf9388541285e3', 'width': 1200}, 'variants': {}}]}",,,,
imemilyaurzella,,,[],,,text,t2_r2dgd,False,False,False,1551310837,i.redd.it,https://www.reddit.com/r/Portland/comments/avk4q1/please_help_me_find_this_sign/,"{'gid_1': 0, 'gid_2': 0, 'gid_3': 0}",avk4q1,True,False,False,True,True,False,False,,[],dark,text,False,False,True,19,0,False,all_ads,/r/Portland/comments/avk4q1/please_help_me_find_this_sign/,False,6,1551310838,0,,True,False,False,Portland,t5_2qi2i,119480,public,default,Please help me find this sign!,1553286176,https://i.redd.it/ea1r030267j21.jpg,all_ads,6,photo,Photo,,,,,,,,,,,
jzgs18,,,[],,,text,t2_wxxhufx,False,False,False,1551307351,seattletimes.com,https://www.reddit.com/r/Portland/comments/avjhwl/cdc_director_federal_health_officials_stress/,"{'gid_1': 0, 'gid_2': 0, 'gid_3': 0}",avjhwl,True,False,False,False,True,False,False,,[],dark,text,False,False,True,0,0,False,all_ads,/r/Portland/comments/avjhwl/cdc_director_federal_health_officials_stress/,False,6,1551307352,14,,True,False,False,Portland,t5_2qi2i,119476,public,https://a.thumbs.redditmedia.com/KO1iFA_5x2aXwUlCzIhpRmD5bO3i4Of6DY6fzAoXUq8.jpg,"CDC director, federal health officials stress importance of measles vaccinations",1553285743,https://www.seattletimes.com/seattle-news/health/cdc-director-federal-health-officials-stress-importance-of-measles-vaccinations/,all_ads,6,,,,,,,,link,"{'enabled': False, 'images': [{'id': 'J91gL3s0fCJtaf2-xnm4sSZTYOSbu0rG0LuFujOerWA', 'resolutions': [{'height': 56, 'url': 'https://external-preview.redd.it/H3OSn88wwidaDHVDlBQSfT_iC4O0bkz3Rm0cdMBqrF8.jpg?width=108&amp;crop=smart&amp;auto=webp&amp;s=8957f8b6174b422baf0c687964e4510e3e939cff', 'width': 108}, {'height': 113, 'url': 'https://external-preview.redd.it/H3OSn88wwidaDHVDlBQSfT_iC4O0bkz3Rm0cdMBqrF8.jpg?width=216&amp;crop=smart&amp;auto=webp&amp;s=326f02bb6121a007ef09e4a049cc5ae2926b08f4', 'width': 216}, {'height': 168, 'url': 'https://external-preview.redd.it/H3OSn88wwidaDHVDlBQSfT_iC4O0bkz3Rm0cdMBqrF8.jpg?width=320&amp;crop=smart&amp;auto=webp&amp;s=ee0ff0485769434dd94c4639068222091f5d54ab', 'width': 320}, {'height': 336, 'url': 'https://external-preview.redd.it/H3OSn88wwidaDHVDlBQSfT_iC4O0bkz3Rm0cdMBqrF8.jpg?width=640&amp;crop=smart&amp;auto=webp&amp;s=ab89c531720212306e5fe2c7d33456211bf6f32b', 'width': 640}, {'height': 504, 'url': 'https://external-preview.redd.it/H3OSn88wwidaDHVDlBQSfT_iC4O0bkz3Rm0cdMBqrF8.jpg?width=960&amp;crop=smart&amp;auto=webp&amp;s=13690f0617022375599a82eb02c3dbc0c7b385e1', 'width': 960}, {'height': 567, 'url': 'https://external-preview.redd.it/H3OSn88wwidaDHVDlBQSfT_iC4O0bkz3Rm0cdMBqrF8.jpg?width=1080&amp;crop=smart&amp;auto=webp&amp;s=fa6c4fa9f04eaf7486849cc1f4fe4c44025ffc54', 'width': 1080}], 'source': {'height': 630, 'url': 'https://external-preview.redd.it/H3OSn88wwidaDHVDlBQSfT_iC4O0bkz3Rm0cdMBqrF8.jpg?auto=webp&amp;s=dece99f701cffc663c2ac29944a09e46fd32f69c', 'width': 1200}, 'variants': {}}]}",,,73.0,140.0
largos,,,[],,,text,t2_2grp0,False,False,False,1551306903,opb.org,https://www.reddit.com/r/Portland/comments/avjexy/rent_control_bill_passes_house_brown_stated/,"{'gid_1': 0, 'gid_2': 0, 'gid_3': 0}",avjexy,True,False,False,False,True,False,False,,[],dark,text,False,False,True,71,0,False,all_ads,/r/Portland/comments/avjexy/rent_control_bill_passes_house_brown_stated/,False,6,1551306904,31,,True,False,False,Portland,t5_2qi2i,119475,public,default,Rent control bill passes house; Brown stated intent to sign it into law.,1553285694,https://www.opb.org/news/article/oregon-rent-control-statewide-passed/?utm_campaign=Crushin5&amp;utm_source=Facebook&amp;utm_medium=social,all_ads,6,local-news,Local News,,,,,,,,,,,
4runneroregon,,,[],,,text,t2_t4f90,False,False,False,1551306682,i.redd.it,https://www.reddit.com/r/Portland/comments/avjdi3/stolen_car_from_ne_case_number_1964778_please/,"{'gid_1': 0, 'gid_2': 0, 'gid_3': 0}",avjdi3,True,False,False,True,True,False,False,,[],dark,text,False,False,True,13,0,False,all_ads,/r/Portland/comments/avjdi3/stolen_car_from_ne_case_number_1964778_please/,False,6,1551306683,19,,True,False,False,Portland,t5_2qi2i,119475,public,default,Stolen car from NE. Case number 19-64778. Please call the police if you see it,1553285671,https://i.redd.it/m50wr0tnt6j21.jpg,all_ads,6,,,,,,,,,,,,,
trashtalkpdx,,,[],Goose Hollow,dark,text,t2_2hbch6pw,False,False,False,1551306069,i.redd.it,https://www.reddit.com/r/Portland/comments/avj9ia/the_rose_city_forest_park_in_particular_got_a/,"{'gid_1': 0, 'gid_2': 0, 'gid_3': 0}",avj9ia,True,False,False,True,True,False,False,,[],dark,text,False,False,True,14,0,False,all_ads,/r/Portland/comments/avj9ia/the_rose_city_forest_park_in_particular_got_a/,False,6,1551306070,73,,True,False,False,Portland,t5_2qi2i,119474,public,default,The Rose City (Forest Park in particular) got a shout-out on today's Jeopardy! All-Stars Tournament episode,1553285610,https://i.redd.it/6o7r5rxtr6j21.png,all_ads,6,,,,5580b8e0-42ca-11e1-9514-12313d18ad57,,,,,,,,,
4runneroregon,,,[],,,text,t2_t4f90,False,False,False,1551305545,i.redd.it,https://www.reddit.com/r/Portland/comments/avj63j/my_car_was_stolen_from_ne_please_call_the_police/,"{'gid_1': 0, 'gid_2': 0, 'gid_3': 0}",avj63j,True,False,False,True,True,False,False,,[],dark,text,False,False,True,0,0,False,all_ads,/r/Portland/comments/avj63j/my_car_was_stolen_from_ne_please_call_the_police/,False,6,1551305546,2,,True,False,False,Portland,t5_2qi2i,119473,public,default,My car was stolen from NE. Please call the police if you see it,1553285554,https://i.redd.it/i5ceo8rbq6j21.jpg,all_ads,6,photo,Photo,,,,,,,,,,,
6_tubs_of_guts,,,[],,,text,t2_2vh12mex,False,False,False,1551304255,youtu.be,https://www.reddit.com/r/Portland/comments/avixiy/another_snow_day_for_junction_city_schools/,"{'gid_1': 0, 'gid_2': 0, 'gid_3': 0}",avixiy,True,False,False,False,True,False,False,,[],dark,text,False,False,True,1,0,False,all_ads,/r/Portland/comments/avixiy/another_snow_day_for_junction_city_schools/,False,6,1551304256,0,,False,False,False,Portland,t5_2qi2i,119473,public,default,Another Snow Day for Junction City Schools,1553285421,https://youtu.be/QGOz_uqHCdg,all_ads,6,,,,,,,,,,,,,
PDX_Nguyen,,,[],,,text,t2_2p3ujcbx,False,False,False,1551303596,i.redd.it,https://www.reddit.com/r/Portland/comments/avit3s/woke_up_to_this_blizzard_in_richmond_court/,"{'gid_1': 0, 'gid_2': 0, 'gid_3': 0}",avit3s,True,False,False,True,True,False,False,,[],dark,text,False,False,True,3,0,False,all_ads,/r/Portland/comments/avit3s/woke_up_to_this_blizzard_in_richmond_court/,False,6,1551303597,0,,True,False,False,Portland,t5_2qi2i,119472,public,default,Woke up to this blizzard in Richmond court,1553285349,https://i.redd.it/uxnxxjrhk6j21.jpg,all_ads,6,,,,,,,,,,,,,
tinyclap,,,[],,,text,t2_rfxmo,False,False,False,1551303548,i.redd.it,https://www.reddit.com/r/Portland/comments/avist5/confused_sausages_reporting_from_tigard/,"{'gid_1': 0, 'gid_2': 0, 'gid_3': 0}",avist5,True,False,False,True,True,False,False,,[],dark,text,False,False,True,0,0,False,all_ads,/r/Portland/comments/avist5/confused_sausages_reporting_from_tigard/,False,6,1551303550,1,,True,False,False,Portland,t5_2qi2i,119472,public,default,confused sausages reporting from tigard,1553285344,https://i.redd.it/3y2wl3bek6j21.jpg,all_ads,6,,,,,,,,,,,,,
NathanFoley69,,,[],Gateway,dark,text,t2_2rhx14f,False,False,False,1551300312,self.Portland,https://www.reddit.com/r/Portland/comments/avi6q9/snow/,"{'gid_1': 0, 'gid_2': 0, 'gid_3': 0}",avi6q9,True,False,False,False,True,True,False,,[],dark,text,False,False,True,1,0,False,all_ads,/r/Portland/comments/avi6q9/snow/,False,6,1551300314,0,Oh boy could I go for a nice jog and some kale as I return :) love Portland snow ,True,False,False,Portland,t5_2qi2i,119465,public,self,Snow,1553284971,https://www.reddit.com/r/Portland/comments/avi6q9/snow/,all_ads,6,,,,a8acf30c-aed2-11e1-b953-12313b0c247a,,,,,,,,,
guanaco55,,,[],Regional Gallowboob,dark,text,t2_hyfa9,False,False,False,1551297537,opb.org,https://www.reddit.com/r/Portland/comments/avhntp/oregon_lawmakers_pay_tribute_to_dennis_richardson/,"{'gid_1': 0, 'gid_2': 0, 'gid_3': 0}",avhntp,True,False,False,False,True,False,False,,[],dark,text,False,False,True,2,0,False,all_ads,/r/Portland/comments/avhntp/oregon_lawmakers_pay_tribute_to_dennis_richardson/,False,6,1551297542,44,,True,False,False,Portland,t5_2qi2i,119460,public,default,"Oregon Lawmakers Pay Tribute To Dennis Richardson Following Death -- Gov. Kate Brown ordered that flags be lowered to half-staff and said: “Regardless of what side of the aisle his colleagues sat on, we all knew Dennis’ kind heart guided his career of service to the people of Oregon.”",1553284652,https://www.opb.org/news/article/oregon-dennis-richardson-death-lawmakers-tribute/,all_ads,6,local-news,Local News,,,,,,,,,,,
lamontana,,,[],,,text,t2_gls9f,False,False,False,1551297064,wweek.com,https://www.reddit.com/r/Portland/comments/avhkjx/understanding_terpenes_is_the_future_of_cannabis/,"{'gid_1': 0, 'gid_2': 0, 'gid_3': 0}",avhkjx,True,False,False,False,True,False,False,,[],dark,text,False,False,True,1,0,False,all_ads,/r/Portland/comments/avhkjx/understanding_terpenes_is_the_future_of_cannabis/,False,6,1551297065,0,,True,False,False,Portland,t5_2qi2i,119460,public,default,Understanding Terpenes Is the Future of Cannabis Consumption. So Why Does Oregon Not Require Testing For Them?,1553284597,http://www.wweek.com/potlander/2019/02/26/understanding-terpenes-is-the-future-of-cannabis-consumption-so-why-does-oregon-not-require-testing-for-them/,all_ads,6,local-news,Local News,,,,,,,,,,,
Beauty_Nova,,,[],,,text,t2_25bz3e0s,False,False,False,1551296076,canoe.com,https://www.reddit.com/r/Portland/comments/avhdt7/pitbull_registered_as_emotional_support_animal/,"{'gid_1': 0, 'gid_2': 0, 'gid_3': 0}",avhdt7,True,False,False,False,True,False,False,,[],dark,text,False,False,True,2,0,False,all_ads,/r/Portland/comments/avhdt7/pitbull_registered_as_emotional_support_animal/,False,6,1551296077,0,,True,False,False,Portland,t5_2qi2i,119455,public,default,"Pitbull ""registered"" as emotional support animal mauls girl at Portland airport: Lawsuit",1553284485,https://canoe.com/news/world/emotional-support-dog-mauls-girl-at-portland-airport-lawsuit,all_ads,6,,,,,,,,,,,,,
TimbersFan8,,,[],,,text,t2_197hvpl8,False,False,False,1551292225,i.redd.it,https://www.reddit.com/r/Portland/comments/avgnyi/hello_from_the_willamette/,"{'gid_1': 0, 'gid_2': 0, 'gid_3': 0}",avgnyi,True,False,False,True,True,False,False,,[],dark,text,False,False,True,3,0,False,all_ads,/r/Portland/comments/avgnyi/hello_from_the_willamette/,False,6,1551292227,86,,True,False,False,Portland,t5_2qi2i,119448,public,default,Hello from the Willamette!,1553284048,https://i.redd.it/och9ynqpm5j21.jpg,all_ads,6,photo,Photo,,,,,,,,,,,
x_motif,,,[],,,text,t2_abz3u,False,False,False,1551291941,self.Portland,https://www.reddit.com/r/Portland/comments/avglyv/barnes_rd_washington_county_road_conditions/,"{'gid_1': 0, 'gid_2': 0, 'gid_3': 0}",avglyv,True,False,False,False,True,True,False,,[],dark,text,False,False,True,2,0,False,all_ads,/r/Portland/comments/avglyv/barnes_rd_washington_county_road_conditions/,False,6,1551291942,0,"Just curious if anyone has driven through Barnes Rd and Washington County this morning? I'm reading reports that chains or traction devices are required, so just curious what I should expect if I need to leave the house today.",True,False,False,Portland,t5_2qi2i,119447,public,self,Barnes Rd &amp; Washington County Road Conditions,1553284015,https://www.reddit.com/r/Portland/comments/avglyv/barnes_rd_washington_county_road_conditions/,all_ads,6,,,,,,,,,,,,,
westernbittercrass,,,[],,,text,t2_sbu81jg,False,False,False,1551291335,portlandmercury.com,https://www.reddit.com/r/Portland/comments/avghxb/portlands_trying_to_prepare_brick_buildings_for/,"{'gid_1': 0, 'gid_2': 0, 'gid_3': 0}",avghxb,True,False,False,False,True,False,False,,[],dark,text,False,False,True,29,0,False,all_ads,/r/Portland/comments/avghxb/portlands_trying_to_prepare_brick_buildings_for/,False,6,1551291336,7,,True,False,False,Portland,t5_2qi2i,119446,public,default,Portland’s Trying to Prepare Brick Buildings for an Earthquake—But at What Cost?,1553283949,https://www.portlandmercury.com/news/2019/02/28/26018798/portlands-trying-to-prepare-brick-buildings-for-an-earthquake-but-at-what-cost,all_ads,6,,,,,,,,,,,,,
cluelessuchi,,,[],,,text,t2_28tw3awn,False,False,False,1551291301,self.Portland,https://www.reddit.com/r/Portland/comments/avghpd/with_regard_to_litterdebristrash_would_you_say/,"{'gid_1': 0, 'gid_2': 0, 'gid_3': 0}",avghpd,True,False,False,False,True,True,False,,[],dark,text,False,False,True,19,0,False,all_ads,/r/Portland/comments/avghpd/with_regard_to_litterdebristrash_would_you_say/,False,6,1551291302,0,"I'm a college student who's never never been to the PNW but I do see the 10 cent OR deposit on so many things that I buy. Then Google tells me you're one of the cleanest states in the US with regard to litter|debris|trash. In contrast to my home state, which is one of the worst in that regard – and we just struck down a bill to mirror your deposit law.

If Portland is an extraordinarily clean city, can you all describe why and how? Does the deposit bill help a lot? Are people just organically averse to littering and everyone volunteers a lot to pick-up? Does local or state gov do other things to address litter and keep things clean? 

Thank you for any insights you share. I'm trying to understand how you're so clean and my home state unfortunately isn't.",True,False,False,Portland,t5_2qi2i,119446,public,self,"With regard to litter|debris|trash, would you say Portland is an especially clean big city?",1553283946,https://www.reddit.com/r/Portland/comments/avghpd/with_regard_to_litterdebristrash_would_you_say/,all_ads,6,,,,,,,,,,,,,
