author,author_flair_background_color,author_flair_css_class,author_flair_richtext,author_flair_template_id,author_flair_text,author_flair_text_color,author_flair_type,author_fullname,author_patreon_flair,can_mod_post,contest_mode,created_utc,domain,full_link,gildings,id,is_crosspostable,is_meta,is_original_content,is_reddit_media_domain,is_robot_indexable,is_self,is_video,link_flair_background_color,link_flair_css_class,link_flair_richtext,link_flair_text,link_flair_text_color,link_flair_type,locked,media_only,no_follow,num_comments,num_crossposts,over_18,parent_whitelist_status,permalink,pinned,pwls,retrieved_on,score,selftext,send_replies,spoiler,stickied,subreddit,subreddit_id,subreddit_subscribers,subreddit_type,thumbnail,title,updated_utc,url,whitelist_status,wls,media,media_embed,post_hint,preview,secure_media,secure_media_embed,thumbnail_height,thumbnail_width,media_metadata,gilded
anthropicprincipal,,,[],de833834-42fc-11e1-9d02-12313d2c1af1,Hawthorne,dark,text,t2_jcu70nq,False,False,False,1554347375,portlandoregon.gov,https://www.reddit.com/r/Portland/comments/b97isu/update_ppb_captures_hit_and_run_suspect_after_k9/,"{'gid_1': 0, 'gid_2': 0, 'gid_3': 0}",b97isu,True,False,False,False,True,False,False,,local-news,[],Local News,dark,text,False,False,True,12,0,False,all_ads,/r/Portland/comments/b97isu/update_ppb_captures_hit_and_run_suspect_after_k9/,False,6,1554347376,29,,True,False,False,Portland,t5_2qi2i,122622,public,default,UPDATE: PPB Captures Hit and Run Suspect After K9 Track-Locates Firearm (Photo),1554523523,https://www.portlandoregon.gov/police/news/read.cfm?id=219850&amp;ec=2&amp;ch=twitter,all_ads,6,,,,,,,,,,
peachdoughnut,,,[],,,,text,t2_15i16s,False,False,False,1554342625,self.Portland,https://www.reddit.com/r/Portland/comments/b96r52/april_9_free_basic_cpraed_training_offered_from/,"{'gid_1': 0, 'gid_2': 0, 'gid_3': 0}",b96r52,True,False,False,False,True,True,False,,,[],,dark,text,False,False,True,4,0,False,all_ads,/r/Portland/comments/b96r52/april_9_free_basic_cpraed_training_offered_from/,False,6,1554342626,76,"AAA NET Standard
Free Hands-only CPR/AED classes
Attend one of these one-hour classes to learn the critical skill of hands-only CPR/AED treatment, taught by Portland Fire &amp; Rescue's Lt. Laurent Picard and Lt. Ryan Mathes.

Please note this is not full CPR certification required by some employers. Our goal is to make it easy for Portlanders to gain these life-saving skills without attending a full-day class.

Note that parking in the area around Fire Station 01 is very difficult. We highly recommend taking TriMet.

NET volunteers, please log hours as ADVANCED TRAINING.

Date: 04/09/2019 (Tue.)
Location: Fire Station 01
55 SW Ash St, Portland, OR 97204 

[Link to sign-up 1 hour slots](https://www.signupgenius.com/go/20f0d4cafa923a7fc1-handsonly)",True,False,False,Portland,t5_2qi2i,122619,public,self,April 9 - FREE Basic CPR/AED Training offered from Portland Fire &amp; Rescue,1554522778,https://www.reddit.com/r/Portland/comments/b96r52/april_9_free_basic_cpraed_training_offered_from/,all_ads,6,,,,,,,,,,
ladylaguna,,,[],,,,text,t2_13z9d2,False,False,False,1554341581,self.Portland,https://www.reddit.com/r/Portland/comments/b96l09/looking_for_a_freeinexpensive_venue_to_host_a/,"{'gid_1': 0, 'gid_2': 0, 'gid_3': 0}",b96l09,True,False,False,False,True,True,False,,,[],,dark,text,False,False,True,14,0,False,all_ads,/r/Portland/comments/b96l09/looking_for_a_freeinexpensive_venue_to_host_a/,False,6,1554341582,0,"Hi everyone! Sorry if this is in the wrong place but I’m looking for a space/venue that’s inexpensive to rent or even free. The event is sponsored by Sunset High School but we are unable to do it at the school. The event is similar to an open mic night, student musicians perform covers or originals to an audience, it’s really fun and a great opportunity for students. If anyone knows a venue that could hold 300-400 people, a comment or message would be greatly appreciated. Thank you!",True,False,False,Portland,t5_2qi2i,122618,public,self,Looking for a free/inexpensive venue to host a small musical event,1554522384,https://www.reddit.com/r/Portland/comments/b96l09/looking_for_a_freeinexpensive_venue_to_host_a/,all_ads,6,,,,,,,,,,
doshido,,,[],,,,text,t2_hodxz,False,False,False,1554341510,self.Portland,https://www.reddit.com/r/Portland/comments/b96kkr/who_lives_in_portland_that_has_lived_in_is_from/,"{'gid_1': 0, 'gid_2': 0, 'gid_3': 0}",b96kkr,True,False,False,False,True,True,False,,,[],,dark,text,False,False,True,24,0,False,all_ads,/r/Portland/comments/b96kkr/who_lives_in_portland_that_has_lived_in_is_from/,False,6,1554341511,0,"Shot in the dark but, I'm hoping to get some comparisons between neighborhoods. Like what's the equivalent of a neighborhood in Cincy to PDX? I'm about to move there and trying to get some perspective.....

In Cincy I live in Clifton, Northside and Mariemont....",True,False,False,Portland,t5_2qi2i,122618,public,self,Who lives in Portland that has lived in / is from Cincinnati?,1554522378,https://www.reddit.com/r/Portland/comments/b96kkr/who_lives_in_portland_that_has_lived_in_is_from/,all_ads,6,,,,,,,,,,
shaggytits,,,[],6fa02886-42c6-11e1-9d5f-12313d18ad57,St Johns,dark,text,t2_gii2c,False,False,False,1554340772,imgur.com,https://www.reddit.com/r/Portland/comments/b96g7o/one_last_thing_that_i_found_under_st_johns_bridge/,"{'gid_1': 0, 'gid_2': 0, 'gid_3': 0}",b96g7o,True,False,False,False,True,False,False,,,[],,dark,text,False,False,True,4,0,False,all_ads,/r/Portland/comments/b96g7o/one_last_thing_that_i_found_under_st_johns_bridge/,False,6,1554340772,6,,True,False,False,Portland,t5_2qi2i,122616,public,default,"One last thing that I found under St Johns Bridge today: goose parents, eggs",1554522315,https://imgur.com/a/oBo0GGz,all_ads,6,,,,,,,,,,
NBALiveStreaming,,,[],,,,text,t2_3jb6kiye,False,False,False,1554339394,livestreamhdtv24.com,https://www.reddit.com/r/Portland/comments/b967yf/shazam_heads_toward_opening_2019/,"{'gid_1': 0, 'gid_2': 0, 'gid_3': 0}",b967yf,False,False,False,False,False,False,False,,,[],,dark,text,False,False,True,0,0,False,all_ads,/r/Portland/comments/b967yf/shazam_heads_toward_opening_2019/,False,6,1554339395,1,,True,False,False,Portland,t5_2qi2i,122615,public,default,Shazam!’ Heads Toward Opening 2019,1554522194,http://livestreamhdtv24.com/shazam-movie-live/,all_ads,6,,,,,,,,,,
sparkysko,,,[],,Hillsboro,dark,text,t2_2untn,False,False,False,1554337466,self.Portland,https://www.reddit.com/r/Portland/comments/b95wbl/when_my_lease_expires_it_goes_up_50_if_i_choose/,"{'gid_1': 0, 'gid_2': 0, 'gid_3': 0}",b95wbl,True,False,False,False,True,True,False,,,[],,dark,text,False,False,True,21,0,False,all_ads,/r/Portland/comments/b95wbl/when_my_lease_expires_it_goes_up_50_if_i_choose/,False,6,1554337468,0,,True,False,False,Portland,t5_2qi2i,122615,public,self,When my lease expires it goes up 50% if I choose month to month. Is that legal under the new rent control stuff?,1554521749,https://www.reddit.com/r/Portland/comments/b95wbl/when_my_lease_expires_it_goes_up_50_if_i_choose/,all_ads,6,,,,,,,,,,
trenchcoatangel,,,[],,,,text,t2_a8gbq,False,False,False,1554337100,self.Portland,https://www.reddit.com/r/Portland/comments/b95u2t/parking_ticket_advice_parking_kitty/,"{'gid_1': 0, 'gid_2': 0, 'gid_3': 0}",b95u2t,True,False,False,False,True,True,False,,,[],,dark,text,False,False,True,13,0,False,all_ads,/r/Portland/comments/b95u2t/parking_ticket_advice_parking_kitty/,False,6,1554337102,12,"Has anyone successfully contested a parking ticket from an inputting error on Parking Kitty? I fucked up and my phone auto corrected or I pressed the wrong button and was off on my license plate by one digit (it was a P instead of a 0). It was an honest mistake and I paid for the parking, and now I'm stuck with a $65 ticket I don't have the funds to pay. My options are to pay and ""plead guilty"", submit an explanation, and maybe get my money back in 6-12 months, or pay and ""plead innocent"" and take my chances on court. Does anyone have any experience with this?",True,False,False,Portland,t5_2qi2i,122613,public,self,Parking ticket advice (Parking Kitty),1554521716,https://www.reddit.com/r/Portland/comments/b95u2t/parking_ticket_advice_parking_kitty/,all_ads,6,,,,,,,,,,
Kathynancygirl,,,[],,,,text,t2_1chvg9eb,False,False,False,1554335765,self.Portland,https://www.reddit.com/r/Portland/comments/b95lyg/free_ticket_for_broods_tonight_43/,"{'gid_1': 0, 'gid_2': 0, 'gid_3': 0}",b95lyg,True,False,False,False,True,True,False,,,[],,dark,text,False,False,True,2,0,False,all_ads,/r/Portland/comments/b95lyg/free_ticket_for_broods_tonight_43/,False,6,1554335767,2,I bought a single ticket months ago and the night of the show I feel like crap. Any one want it? First to PM me with their email gets it. ,True,False,False,Portland,t5_2qi2i,122607,public,self,Free ticket for Broods tonight 4/3,1554521507,https://www.reddit.com/r/Portland/comments/b95lyg/free_ticket_for_broods_tonight_43/,all_ads,6,,,,,,,,,,
PM_ME_YOUR_HANDCUFFS,,,[],9913fd3a-c71f-11e7-813c-0e6c07f3cce2,Shari's Cafe & Pies,dark,text,t2_1218ud,False,False,False,1554335111,oregonlive.com,https://www.reddit.com/r/Portland/comments/b95htx/only_3_of_61_applicants_pass_background_checks/,"{'gid_1': 0, 'gid_2': 0, 'gid_3': 0}",b95htx,True,False,False,False,True,False,False,,,[],,dark,text,False,False,True,5,0,False,all_ads,/r/Portland/comments/b95htx/only_3_of_61_applicants_pass_background_checks/,False,6,1554335112,10,,True,False,False,Portland,t5_2qi2i,122604,public,default,Only 3 of 61 applicants pass background checks for new Portland public safety specialist jobs,1554521444,https://www.oregonlive.com/crime/2019/04/only-3-of-61-applicants-pass-background-checks-for-new-portland-public-safety-specialist-jobs.html,all_ads,6,,,,,,,,,,
OregonTripleBeam,,,[],,,,text,t2_10k39a,False,False,False,1554333564,bizjournals.com,https://www.reddit.com/r/Portland/comments/b9586c/oregon_senate_takes_step_towards_legalizing/,"{'gid_1': 0, 'gid_2': 0, 'gid_3': 0}",b9586c,True,False,False,False,True,False,False,,,[],,dark,text,False,False,True,8,0,False,all_ads,/r/Portland/comments/b9586c/oregon_senate_takes_step_towards_legalizing/,False,6,1554333565,32,,True,False,False,Portland,t5_2qi2i,122603,public,default,Oregon Senate takes step towards legalizing cannabis exports,1554521094,https://www.bizjournals.com/portland/news/2019/04/03/oregon-takes-step-toward-out-of-state-pot-sales.html,all_ads,6,,,,,,,,,,
BaconPDX,,,[],,Sellwood-Moreland,dark,text,t2_zjp8t,False,False,False,1554333488,self.Portland,https://www.reddit.com/r/Portland/comments/b957mt/much_like_the_cherry_blossoms_returningso_have/,"{'gid_1': 0, 'gid_2': 0, 'gid_3': 0}",b957mt,True,False,False,False,True,True,False,,,[],,dark,text,False,False,True,38,0,False,all_ads,/r/Portland/comments/b957mt/much_like_the_cherry_blossoms_returningso_have/,False,6,1554333489,25,And it’s only a matter of time til the Hawthorne Bridge one completely takes over. If it’s already getting bad...how much worse will it be when the crusties start traveling up I-5 like they do every summer? ,True,False,False,Portland,t5_2qi2i,122603,public,self,Much like the cherry blossoms returning...so have the “off-ramp cities” in SE. Why doesn’t the news cover that like the garbage flow on 84? The Morrison bridge one is already a beaut...,1554521086,https://www.reddit.com/r/Portland/comments/b957mt/much_like_the_cherry_blossoms_returningso_have/,all_ads,6,,,,,,,,,,
itstoolatefororanges,,,[],eabbbf0e-42ca-11e1-a863-12313b08a511,Downtown,dark,text,t2_28two8dm,False,False,False,1554333209,wweek.com,https://www.reddit.com/r/Portland/comments/b955wc/anyone_try_the_flamin_hot_cheetos_torta_at_lulu/,"{'gid_1': 0, 'gid_2': 0, 'gid_3': 0}",b955wc,True,False,False,False,True,False,False,,,[],,dark,text,False,False,True,3,0,False,all_ads,/r/Portland/comments/b955wc/anyone_try_the_flamin_hot_cheetos_torta_at_lulu/,False,6,1554333209,0,,True,False,False,Portland,t5_2qi2i,122603,public,default,Anyone try the Flamin’ Hot Cheetos torta at Lulu?,1554521060,https://www.wweek.com/bars/2019/04/03/lulu-goes-understated-on-motif-creative-on-cocktails/,all_ads,6,,,,,,,,,,
lisarenelle,,,[],,,,text,t2_qfj3k,False,False,False,1554332090,self.Portland,https://www.reddit.com/r/Portland/comments/b94y21/family_friendly/,"{'gid_1': 0, 'gid_2': 0, 'gid_3': 0}",b94y21,True,False,False,False,True,True,False,,,[],,dark,text,False,False,True,3,0,False,all_ads,/r/Portland/comments/b94y21/family_friendly/,False,6,1554332092,0,"Hey guys and gals! I have friends moving to Portland, they have 3 children under the age of 10. They are hoping to find an area that has kids in the neighborhood that their kids can play with. The husband is doing residency at OHSU, and they found a nice house for rent nearby so he can walk, but are unsure if the neighborhood has many kids. They brought up looking in Beaverton, Tigard, and Aloha, but I brought up that the traffic might not make it worth it. Thoughts? ",True,False,False,Portland,t5_2qi2i,122602,public,self,Family Friendly,1554520947,https://www.reddit.com/r/Portland/comments/b94y21/family_friendly/,all_ads,6,,,,,,,,,,
SethQuartz,,,[],,,,text,t2_167xi6,False,False,False,1554331254,self.Portland,https://www.reddit.com/r/Portland/comments/b94smx/bleu_diamond_blue_cheese_dressing/,"{'gid_1': 0, 'gid_2': 0, 'gid_3': 0}",b94smx,True,False,False,False,True,True,False,,,[],,dark,text,False,False,True,6,0,False,all_ads,/r/Portland/comments/b94smx/bleu_diamond_blue_cheese_dressing/,False,6,1554331255,2,"Anybody know what happened to Blue Diamond Blue Cheese Dressing?  I sent email to the contact address at the company site but no response after a few weeks.

[http://www.bleudiamonddressing.com/](http://www.bleudiamonddressing.com/)

&amp;#x200B;

It had been available for years at New Seasons Market but disappeared last month from the refrigerated section where it used to be.  Not inexpensive at $8/pt but in IMHO, the best blue cheese dressing available.

&amp;#x200B;

&amp;#x200B;",True,False,False,Portland,t5_2qi2i,122602,public,self,Bleu Diamond Blue Cheese Dressing?,1554520555,https://www.reddit.com/r/Portland/comments/b94smx/bleu_diamond_blue_cheese_dressing/,all_ads,6,,,,,,,,,,
itstoolatefororanges,,,[],eabbbf0e-42ca-11e1-a863-12313b08a511,Downtown,dark,text,t2_28two8dm,False,False,False,1554330982,katu.com,https://www.reddit.com/r/Portland/comments/b94r8y/red_cross_giving_away_ultimate_game_of_thrones/,"{'gid_1': 0, 'gid_2': 0, 'gid_3': 0}",b94r8y,True,False,False,False,True,False,False,,,[],,dark,text,False,False,True,0,0,False,all_ads,/r/Portland/comments/b94r8y/red_cross_giving_away_ultimate_game_of_thrones/,False,6,1554330983,0,,True,False,False,Portland,t5_2qi2i,122602,public,default,Red Cross giving away ultimate 'Game of Thrones' prize to lucky blood donor,1554520534,https://katu.com/news/local/red-cross-giving-away-ultimate-game-of-thrones-prize-to-lucky-blood-donor,all_ads,6,,,,,,,,,,
MegaMaga2020,,,[],,,,text,t2_2y0xs9k4,False,False,False,1554329934,youtube.com,https://www.reddit.com/r/Portland/comments/b94ka6/things_you_should_ngo_the_suspicious_rise_of_hate/,"{'gid_1': 1, 'gid_2': 0, 'gid_3': 0}",b94ka6,False,False,False,False,False,False,False,,,[],,dark,text,False,False,True,24,0,False,all_ads,/r/Portland/comments/b94ka6/things_you_should_ngo_the_suspicious_rise_of_hate/,False,6,1554329936,0,,True,False,False,Portland,t5_2qi2i,122598,public,https://a.thumbs.redditmedia.com/b7KBroW4xEtO_60FrqSI3-NPgw-MSb_2Iz0HizMqxw0.jpg,Things You Should Ngo: The Suspicious Rise of Hate Crimes in Portland ft. Ben Shapiro,1554520424,https://www.youtube.com/watch?v=aqspsEVV7yE,all_ads,6,"{'oembed': {'author_name': 'Andy Ngo', 'author_url': 'https://www.youtube.com/channel/UCmmfVSRVwMSfHdRf6v3lPxQ', 'height': 338, 'html': '&lt;iframe width=""600"" height=""338"" src=""https://www.youtube.com/embed/aqspsEVV7yE?feature=oembed&amp;enablejsapi=1"" frameborder=""0"" allow=""accelerometer; autoplay; encrypted-media; gyroscope; picture-in-picture"" allowfullscreen&gt;&lt;/iframe&gt;', 'provider_name': 'YouTube', 'provider_url': 'https://www.youtube.com/', 'thumbnail_height': 360, 'thumbnail_url': 'https://i.ytimg.com/vi/aqspsEVV7yE/hqdefault.jpg', 'thumbnail_width': 480, 'title': 'Things You Should Ngo: The Suspicious Rise of Hate Crimes in Portland ft. Ben Shapiro', 'type': 'video', 'version': '1.0', 'width': 600}, 'type': 'youtube.com'}","{'content': '&lt;iframe width=""600"" height=""338"" src=""https://www.youtube.com/embed/aqspsEVV7yE?feature=oembed&amp;enablejsapi=1"" frameborder=""0"" allow=""accelerometer; autoplay; encrypted-media; gyroscope; picture-in-picture"" allowfullscreen&gt;&lt;/iframe&gt;', 'height': 338, 'scrolling': False, 'width': 600}",rich:video,"{'enabled': False, 'images': [{'id': 'UK_Ld0FpCFFtwHFzWEoQrIG_mz1oLmpOr01E0JhA5Dw', 'resolutions': [{'height': 81, 'url': 'https://external-preview.redd.it/lg3qBqX_NLLOhhAn5-SHEwDd4I-tQp0BlFZKHTkQvko.jpg?width=108&amp;crop=smart&amp;auto=webp&amp;s=6154ffa5bc57accbe86d7f269ce00d2dbf737f84', 'width': 108}, {'height': 162, 'url': 'https://external-preview.redd.it/lg3qBqX_NLLOhhAn5-SHEwDd4I-tQp0BlFZKHTkQvko.jpg?width=216&amp;crop=smart&amp;auto=webp&amp;s=01892a9bb25bf5b6df3770df3985f8fb074891d7', 'width': 216}, {'height': 240, 'url': 'https://external-preview.redd.it/lg3qBqX_NLLOhhAn5-SHEwDd4I-tQp0BlFZKHTkQvko.jpg?width=320&amp;crop=smart&amp;auto=webp&amp;s=6ac4eb5bc176c2c3fecaec134d26f720015e0bce', 'width': 320}], 'source': {'height': 360, 'url': 'https://external-preview.redd.it/lg3qBqX_NLLOhhAn5-SHEwDd4I-tQp0BlFZKHTkQvko.jpg?auto=webp&amp;s=627b8638ad5ecfa7c6d40ccaa3fb0a2f3ecad5b4', 'width': 480}, 'variants': {}}]}","{'oembed': {'author_name': 'Andy Ngo', 'author_url': 'https://www.youtube.com/channel/UCmmfVSRVwMSfHdRf6v3lPxQ', 'height': 338, 'html': '&lt;iframe width=""600"" height=""338"" src=""https://www.youtube.com/embed/aqspsEVV7yE?feature=oembed&amp;enablejsapi=1"" frameborder=""0"" allow=""accelerometer; autoplay; encrypted-media; gyroscope; picture-in-picture"" allowfullscreen&gt;&lt;/iframe&gt;', 'provider_name': 'YouTube', 'provider_url': 'https://www.youtube.com/', 'thumbnail_height': 360, 'thumbnail_url': 'https://i.ytimg.com/vi/aqspsEVV7yE/hqdefault.jpg', 'thumbnail_width': 480, 'title': 'Things You Should Ngo: The Suspicious Rise of Hate Crimes in Portland ft. Ben Shapiro', 'type': 'video', 'version': '1.0', 'width': 600}, 'type': 'youtube.com'}","{'content': '&lt;iframe width=""600"" height=""338"" src=""https://www.youtube.com/embed/aqspsEVV7yE?feature=oembed&amp;enablejsapi=1"" frameborder=""0"" allow=""accelerometer; autoplay; encrypted-media; gyroscope; picture-in-picture"" allowfullscreen&gt;&lt;/iframe&gt;', 'height': 338, 'media_domain_url': 'https://www.redditmedia.com/mediaembed/b94ka6', 'scrolling': False, 'width': 600}",105.0,140.0,,
atomicant13,,,[],d8e46f8c-4276-11e1-9f2c-12313b08a511,Richmond,dark,text,t2_hnvsw,False,False,False,1554328217,i.redd.it,https://www.reddit.com/r/Portland/comments/b948iv/im_adam_dixon_one_of_the_owners_of_portlands/,"{'gid_1': 0, 'gid_2': 0, 'gid_3': 0}",b948iv,True,False,False,True,True,False,False,,photo,[],Photo,dark,text,False,False,True,289,0,False,all_ads,/r/Portland/comments/b948iv/im_adam_dixon_one_of_the_owners_of_portlands/,False,6,1554328219,1013,,True,False,False,Portland,t5_2qi2i,122596,public,default,"I’m Adam Dixon, one of the owners of Portland’s newest brewery and brew pub, Assembly Brewing. AMA!!!",1554520031,https://i.redd.it/slrh3z8ae4q21.jpg,all_ads,6,,,,,,,,,,
misstuna420,,,[],,,,text,t2_1v22ypz8,False,False,False,1554327733,self.Portland,https://www.reddit.com/r/Portland/comments/b9458r/thank_you_to_whoever_left_a_flower_outside_my/,"{'gid_1': 0, 'gid_2': 0, 'gid_3': 0}",b9458r,True,False,False,False,True,True,False,,,[],,dark,text,False,False,True,10,0,False,all_ads,/r/Portland/comments/b9458r/thank_you_to_whoever_left_a_flower_outside_my/,False,6,1554327735,26,"I woke up to a sweet note and a bottle with a flower in it outside my door this morning. Thank you to whoever did that, I needed it. ",True,False,False,Portland,t5_2qi2i,122596,public,self,Thank you to whoever left a flower outside my door this morning,1554519983,https://www.reddit.com/r/Portland/comments/b9458r/thank_you_to_whoever_left_a_flower_outside_my/,all_ads,6,,,,,,,,,,
shaggytits,,,[],6fa02886-42c6-11e1-9d5f-12313d18ad57,St Johns,dark,text,t2_gii2c,False,False,False,1554327617,imgur.com,https://www.reddit.com/r/Portland/comments/b944fy/found_these_flyers_under_st_johns_bridge_please/,"{'gid_1': 0, 'gid_2': 0, 'gid_3': 0}",b944fy,True,False,False,False,True,False,False,,,[],,dark,text,False,False,True,79,0,False,all_ads,/r/Portland/comments/b944fy/found_these_flyers_under_st_johns_bridge_please/,False,6,1554327619,0,,True,False,False,Portland,t5_2qi2i,122596,public,default,Found these flyers under St Johns bridge. Please stop encouraging political violence.,1554519971,https://imgur.com/a/jBSdhY3,all_ads,6,,,,,,,,,,
rockandsun,,,[],,,,text,t2_zpyjx,False,False,False,1554324287,self.Portland,https://www.reddit.com/r/Portland/comments/b93gkm/looking_for_a_columbia_employee_store_pass/,"{'gid_1': 0, 'gid_2': 0, 'gid_3': 0}",b93gkm,False,False,False,False,False,True,False,,,[],,dark,text,False,False,True,2,0,False,all_ads,/r/Portland/comments/b93gkm/looking_for_a_columbia_employee_store_pass/,False,6,1554324289,1,[removed],True,False,False,Portland,t5_2qi2i,122592,public,self,Looking for a Columbia Employee Store pass,1554519351,https://www.reddit.com/r/Portland/comments/b93gkm/looking_for_a_columbia_employee_store_pass/,all_ads,6,,,,,,,,,,
Bondobart,,,[],,,,text,t2_11k8ew3j,False,False,False,1554322767,i.redd.it,https://www.reddit.com/r/Portland/comments/b9352z/cloudy_day_in_pdx/,"{'gid_1': 0, 'gid_2': 0, 'gid_3': 0}",b9352z,True,False,False,True,True,False,False,,,[],,dark,text,False,False,True,5,0,False,all_ads,/r/Portland/comments/b9352z/cloudy_day_in_pdx/,False,6,1554322768,55,,True,False,False,Portland,t5_2qi2i,122590,public,default,Cloudy day in PDX.,1554519014,https://i.redd.it/tv19af4zx3q21.jpg,all_ads,6,,,,,,,,,,
slingshotrobot,,,[],,,,text,t2_behpvgp,False,False,False,1554320452,oregonlive.com,https://www.reddit.com/r/Portland/comments/b92n4d/national_popular_vote_poised_to_pass_oregon_senate/,"{'gid_1': 0, 'gid_2': 0, 'gid_3': 0}",b92n4d,True,False,False,False,True,False,False,,local-news,[],Local News,dark,text,False,False,True,143,0,False,all_ads,/r/Portland/comments/b92n4d/national_popular_vote_poised_to_pass_oregon_senate/,False,6,1554320530,228,,False,False,False,Portland,t5_2qi2i,122590,public,https://b.thumbs.redditmedia.com/gFIJptCzKPgIPAmGUnJMip608qk74rUXHroTlJi-o9w.jpg,National popular vote poised to pass Oregon Senate,1554518452,https://www.oregonlive.com/politics/2019/04/peter-courtney-national-popular-vote-poised-to-pass-oregon-senate.html?utm_medium=social&amp;utm_source=twitter&amp;utm_campaign=oregonian_sf,all_ads,6,,,link,"{'enabled': False, 'images': [{'id': 'SssvHw0HA05-SMiAB8_KO_C9pcLA029viG-WzNiNGpg', 'resolutions': [{'height': 75, 'url': 'https://external-preview.redd.it/zDcUgYjYWXtGNc6gFflgnuMqfMfK3k0ZHe2HvrhIBnA.jpg?width=108&amp;crop=smart&amp;auto=webp&amp;s=c8fccef384a12624b4bd8626c59f99ac0fc28051', 'width': 108}, {'height': 150, 'url': 'https://external-preview.redd.it/zDcUgYjYWXtGNc6gFflgnuMqfMfK3k0ZHe2HvrhIBnA.jpg?width=216&amp;crop=smart&amp;auto=webp&amp;s=b263e11ff1f3b023f5eeaa0aa777de4f76640572', 'width': 216}, {'height': 222, 'url': 'https://external-preview.redd.it/zDcUgYjYWXtGNc6gFflgnuMqfMfK3k0ZHe2HvrhIBnA.jpg?width=320&amp;crop=smart&amp;auto=webp&amp;s=a341fb4c9fe6f3bd5c722c64afa41236cdfa5c5c', 'width': 320}, {'height': 445, 'url': 'https://external-preview.redd.it/zDcUgYjYWXtGNc6gFflgnuMqfMfK3k0ZHe2HvrhIBnA.jpg?width=640&amp;crop=smart&amp;auto=webp&amp;s=5890b755531c7cc082a8f7418e75019441ff62c2', 'width': 640}, {'height': 668, 'url': 'https://external-preview.redd.it/zDcUgYjYWXtGNc6gFflgnuMqfMfK3k0ZHe2HvrhIBnA.jpg?width=960&amp;crop=smart&amp;auto=webp&amp;s=dc6816aab2c7f1e38e3fbf36487f5c5a7fdea4af', 'width': 960}, {'height': 751, 'url': 'https://external-preview.redd.it/zDcUgYjYWXtGNc6gFflgnuMqfMfK3k0ZHe2HvrhIBnA.jpg?width=1080&amp;crop=smart&amp;auto=webp&amp;s=b07eb0ba3187d1f7315e6c0dd9ce7048bb54f4b7', 'width': 1080}], 'source': {'height': 835, 'url': 'https://external-preview.redd.it/zDcUgYjYWXtGNc6gFflgnuMqfMfK3k0ZHe2HvrhIBnA.jpg?auto=webp&amp;s=332340026c7d602482c69364f95fe9afa9023fc5', 'width': 1200}, 'variants': {}}]}",,,97.0,140.0,,
