author,author_created_utc,author_flair_css_class,author_flair_text,author_fullname,created_utc,domain,full_link,gilded,id,is_self,link_flair_css_class,link_flair_text,locked,media,media_embed,num_comments,over_18,permalink,retrieved_on,score,secure_media,secure_media_embed,selftext,stickied,subreddit,subreddit_id,thumbnail,title,url,post_hint,preview,banned_by,edited,distinguished
gravity27,1443709574.0,,,t2_qv2e4,1462309947,self.Portland,https://www.reddit.com/r/Portland/comments/4hqe0b/first_world_problem_need_ants/,0,4hqe0b,True,help-me,Help Me,False,,{},59,False,/r/Portland/comments/4hqe0b/first_world_problem_need_ants/,1466425261,40,,{},"So, we bought an ant farm for child-the-youngest, and then paypal'd the address inside the box to get our live ants shipped to us from Utah. Turns out (according to ant seller in Utah) Oregon legislature made shipping ants into Oregon illegal about a year ago.

Antman in Utah says find a local ant hill-- one with big, huge, demon-looking ants, and put those in our ant farm.

Leading to the obvious question: Can anyone recommend a location in greater PDX(public park? Empty corner lot?)* where we might find a mega-anthill so we can rustle up 20 of these beasts**?

*Not to sound trollish, but yeah, not going anywhere near Springwater Corridor or other sketchy spots... Bringing the kids to get the ants!

**We have itty-bitty ants in our yard... but we want monster ants with big mandibles!

Thanks!
 ",False,Portland,t5_2qi2i,self,First World Problem... need ants...,https://www.reddit.com/r/Portland/comments/4hqe0b/first_world_problem_need_ants/,,,,,
CthuluCatSnacks,1444756127.0,,,t2_r5p1i,1462309439,twitter.com,https://www.reddit.com/r/Portland/comments/4hqbzq/our_community_is_devolving/,0,4hqbzq,False,homeless,Homeless,False,,{},4,False,/r/Portland/comments/4hqbzq/our_community_is_devolving/,1466425235,0,,{},,False,Portland,t5_2qi2i,http://b.thumbs.redditmedia.com/eSR_SYhsNTBdOycla0_xDa86YvZYPsPCCP6Dr6kJ_cc.jpg,Our Community is Devolving,https://twitter.com/pdxalerts/status/727518546884861956,link,"{'images': [{'id': 'ZbFckMH3tJW5OXZDHDc7lPMuy6aEQL-GY8AH1BTfhwU', 'resolutions': [{'height': 108, 'url': 'https://i.redditmedia.com/kToNENMctgCK4fp2NU1MGP0xkGW45DLGQU9EvOSDq9k.jpg?fit=crop&amp;crop=faces%2Centropy&amp;arh=2&amp;w=108&amp;s=49d08986be5ce43a5f4d79f539d381af', 'width': 108}, {'height': 216, 'url': 'https://i.redditmedia.com/kToNENMctgCK4fp2NU1MGP0xkGW45DLGQU9EvOSDq9k.jpg?fit=crop&amp;crop=faces%2Centropy&amp;arh=2&amp;w=216&amp;s=8723f6c61e9340b83f042622f5a54978', 'width': 216}, {'height': 320, 'url': 'https://i.redditmedia.com/kToNENMctgCK4fp2NU1MGP0xkGW45DLGQU9EvOSDq9k.jpg?fit=crop&amp;crop=faces%2Centropy&amp;arh=2&amp;w=320&amp;s=b9a0cde1f2ee5b262382389aa4269030', 'width': 320}], 'source': {'height': 400, 'url': 'https://i.redditmedia.com/kToNENMctgCK4fp2NU1MGP0xkGW45DLGQU9EvOSDq9k.jpg?s=22a70a61b89a9dce03f12aec01594e6c', 'width': 400}, 'variants': {}}]}",,,
sdf_cardinal,1409813514.0,,,t2_i8cxq,1462308976,oregonlive.com,https://www.reddit.com/r/Portland/comments/4hq9is/leader_of_oregon_refuge_singers_arrested_for/,0,4hq9is,False,non-local-news,Outside News,False,,{},5,False,/r/Portland/comments/4hq9is/leader_of_oregon_refuge_singers_arrested_for/,1466425203,7,,{},,False,Portland,t5_2qi2i,http://b.thumbs.redditmedia.com/ueanhzrDlv2gKOtojtfzchp0ZQtUgek_RFICoaj8J_c.jpg,Leader of Oregon refuge singers arrested for assault; 7 children in Kansas state custody,http://www.oregonlive.com/oregon-standoff/2016/05/post_11.html#incart_2box,link,"{'images': [{'id': 'lDfAiF32V8SpxD-uZ0oFvWpHrgOxcOhAOjmUpujO0DY', 'resolutions': [{'height': 81, 'url': 'https://i.redditmedia.com/ylH3mlFUlTi7SQicBo08ga7MHK3I8R9FGpAb5_1LQoY.jpg?fit=crop&amp;crop=faces%2Centropy&amp;arh=2&amp;w=108&amp;s=c50b2b6a3cecaf5615993a30c2143433', 'width': 108}, {'height': 162, 'url': 'https://i.redditmedia.com/ylH3mlFUlTi7SQicBo08ga7MHK3I8R9FGpAb5_1LQoY.jpg?fit=crop&amp;crop=faces%2Centropy&amp;arh=2&amp;w=216&amp;s=7f7fc6b7c1e29d060acf879c864ad5ab', 'width': 216}, {'height': 240, 'url': 'https://i.redditmedia.com/ylH3mlFUlTi7SQicBo08ga7MHK3I8R9FGpAb5_1LQoY.jpg?fit=crop&amp;crop=faces%2Centropy&amp;arh=2&amp;w=320&amp;s=b24920b75a20c6f7ed8273133a4564d5', 'width': 320}], 'source': {'height': 285, 'url': 'https://i.redditmedia.com/ylH3mlFUlTi7SQicBo08ga7MHK3I8R9FGpAb5_1LQoY.jpg?s=de5537ac86769211ae9ddbf8d05915ab', 'width': 380}, 'variants': {}}]}",,,
Isnt,1251824308.0,,SE,t2_3m1vf,1462308815,facebook.com,https://www.reddit.com/r/Portland/comments/4hq8nl/come_out_and_oppose_trump_in_vancouver_saturday/,0,4hq8nl,False,non-local-news,Outside News,False,,{},36,False,/r/Portland/comments/4hq8nl/come_out_and_oppose_trump_in_vancouver_saturday/,1466425192,0,,{},,False,Portland,t5_2qi2i,default,Come out and oppose trump in Vancouver Saturday May 7.,https://www.facebook.com/events/833786100087255/,,,,,
SpinnerettePDX,1342057132.0,,Ladd's Addition,t2_8axob,1462307719,self.Portland,https://www.reddit.com/r/Portland/comments/4hq3bx/any_rportland_people_going_to_primavera_at_the/,0,4hq3bx,True,event,Events,False,,{},9,False,/r/Portland/comments/4hq3bx/any_rportland_people_going_to_primavera_at_the/,1466425123,0,,{},"Just curious if any of r/portland happens to be going to Primavera in Spain at the end of the month. I'll be going and would love to connect with anyone from Portland that might be going, too!",False,Portland,t5_2qi2i,self,Any r/portland people going to Primavera at the end of the month?,https://www.reddit.com/r/Portland/comments/4hq3bx/any_rportland_people_going_to_primavera_at_the/,,,,,
BundleOfHiss,1431998731.0,,Sunnyside,t2_njxhy,1462307218,portlandoregon.gov,https://www.reddit.com/r/Portland/comments/4hq0w7/whatever_happened_to_the_ppb_incident_map_and/,0,4hq0w7,False,local-news,Local News,False,,{},11,False,/r/Portland/comments/4hq0w7/whatever_happened_to_the_ppb_incident_map_and/,1466425091,54,,{},,False,Portland,t5_2qi2i,http://a.thumbs.redditmedia.com/qKkcI3721noJkQIYbSmuinHmqYTWB0EqBWRdVZvyW34.jpg,Whatever happened to the PPB incident map and will it come online again?,https://www.portlandoregon.gov/police/apps/calls/incidents_map.cfm,link,"{'images': [{'id': 'g61mF26tdrPTFzIiZ66RrnXN6ZczJ3Wo4llZHnLWiNE', 'resolutions': [{'height': 64, 'url': 'https://i.redditmedia.com/sfPTHamftzkGuQXxoFZWO6FCExHkfA1rygxJ8hkMnQA.jpg?fit=crop&amp;crop=faces%2Centropy&amp;arh=2&amp;w=108&amp;s=b732acdcd0f29495422a1d87fe3c7776', 'width': 108}, {'height': 129, 'url': 'https://i.redditmedia.com/sfPTHamftzkGuQXxoFZWO6FCExHkfA1rygxJ8hkMnQA.jpg?fit=crop&amp;crop=faces%2Centropy&amp;arh=2&amp;w=216&amp;s=bd57ffa54eec2c437abd4f987262eeab', 'width': 216}, {'height': 191, 'url': 'https://i.redditmedia.com/sfPTHamftzkGuQXxoFZWO6FCExHkfA1rygxJ8hkMnQA.jpg?fit=crop&amp;crop=faces%2Centropy&amp;arh=2&amp;w=320&amp;s=9383d62ef0fef7023365cc8915450609', 'width': 320}, {'height': 383, 'url': 'https://i.redditmedia.com/sfPTHamftzkGuQXxoFZWO6FCExHkfA1rygxJ8hkMnQA.jpg?fit=crop&amp;crop=faces%2Centropy&amp;arh=2&amp;w=640&amp;s=04a7aaaca72960cb123a6ef8d53c1175', 'width': 640}], 'source': {'height': 426, 'url': 'https://i.redditmedia.com/sfPTHamftzkGuQXxoFZWO6FCExHkfA1rygxJ8hkMnQA.jpg?s=728c8daf26ea6cf053bfcfa3e63a4fbd', 'width': 711}, 'variants': {}}]}",,,
Lydiagnostic,1403141597.0,,Milwaukie,t2_h1dpy,1462306993,self.Portland,https://www.reddit.com/r/Portland/comments/4hpzso/automated_massage_chairs/,0,4hpzso,True,classifieds,Classifieds,False,,{},8,False,/r/Portland/comments/4hpzso/automated_massage_chairs/,1466425077,3,,{},"Just got back from a trip to Chicago, where we got a chance to use those awesome automated massage chairs in the terminal before a long flight. It was incredible. For $5 each, we got 30 minute massages. Now I want to know:

**Is there anywhere in Portland that has automated massage chairs set up for public use?**",False,Portland,t5_2qi2i,self,Automated Massage Chairs?,https://www.reddit.com/r/Portland/comments/4hpzso/automated_massage_chairs/,,,,,
bongo16,1462306003.0,,,t2_xnv75,1462306988,self.Portland,https://www.reddit.com/r/Portland/comments/4hpzr9/multnomah_county_elections_didnt_update_my_voter/,0,4hpzr9,True,help-me,Help Me,False,,{},10,False,/r/Portland/comments/4hpzr9/multnomah_county_elections_didnt_update_my_voter/,1466425077,0,,{},"**Issue has been resolved.**

**PSA: Call Multnomah County Elections to get a corrected ballot if you registered as a member of a different party on or before April 26, but your [online voter registration](https://secure.sos.state.or.us/orestar/vr/showVoterSearch.do) still shows you as a member of the former party. Someone there will correct it and will mail you a new ballot. Here's the number to call: 503-988-3720**

I'm discouraged with Multnomah County Elections. I updated my voter registration online on April 11 to be registered for a different party, well before the April 26 deadline. Despite this, I received the wrong ballot. Today, I checked online and my voter registration hadn't been updated.

I called Multnomah County Elections and the woman I spoke with confirmed that Multnomah County received my request to update my voter registration. She would not, though, admit that Multnomah County committed an error. Instead, she was going to have her supervisor review the issue and that her supervisor would give me a call tomorrow.

If this happened to me, I imagine this has happened to others. While one vote is unlikely to change the outcome of an election, multiple votes can.

**UPDATE 1:** I don't believe https://multco.us/elections/got-wrong-ballot-dont-panic applies to me. The fact that my call was escalated to a supervisor means there's likely an error of some kind. Regardless if it was simply a matter of waiting for the second ballot, my name would still be associated with the new party when I look up my registration info online... which it is not.

Since I first posted on here, a friend of mine let me know that he knows at least two other people with the same issue.

**UPDATE 2:** I received a call from the supervisor. She admitted that it was an error committed by Multnomah County. She didn't provide detail other than saying that the county was processing plenty of other voter registrations. She said I will be mailed a corrected ballot.",False,Portland,t5_2qi2i,self,Multnomah County Elections Didn't Update My Voter Registration,https://www.reddit.com/r/Portland/comments/4hpzr9/multnomah_county_elections_didnt_update_my_voter/,,,,1462320479.0,
swedishcalypso,1377469815.0,,,t2_cw5ih,1462306962,self.Portland,https://www.reddit.com/r/Portland/comments/4hpzjn/scam_alert_jm_consulting/,0,4hpzjn,True,classifieds,Classifieds,False,,{},11,False,/r/Portland/comments/4hpzjn/scam_alert_jm_consulting/,1466425074,32,,{},"Just a friendly tip for any Portlanders like myself who are job hunting; I've seen several listings on different job boards for a company called J&amp;M Consulting, hiring for sales, customer service, HR admin, management, etc. I applied and went in today for a ""preliminary interview"" and saw several red flags. First of all, the website linked in my confirmation email is charmingly vague and packed with buzz words and stock images, with no real description of exactly what they DO. See for yourself: http://jm-consultinginc.com/

Second, the office is quite small, in a generic shared office building, which belies what seems to be indicated by the website. The plaque on the wall and in the building's directory is for a different company (""US Consolidated"" or something like that). I had a long wait in the ""lobby"" and witnessed the receptionist answer the phone as yet ANOTHER company, this one dealing with co-signing loans to ""help"" people who have been evicted get back into their homes. I waited in the lobby with three other people, all scheduled for the same time, with only one interviewer (leading to about an hour wait). Third, the interview itself. Nothing against the guy who interviewed me personally, but he was obviously reading a script in his head, monotone, seemed uncomfortable speaking, constant almost unnerving eye contact, occasionally pausing for my response but didn't really seem super interested. Basically repeated several of the vague statements from the website; how they have high customer satisfaction, work with several Fortune 500 companies, and obtain hundreds of thousands of new customers for those companies. At the end of the interview I mentioned that I had several questions, and his response was ""it's good that you have questions, but if you're called for a second interview, that's when we go into more detail including day to day responsibilities"". I'd be amazed if they don't call me for interview #2; feels like they just want more cannon fodder for whatever scam they're running. 

TL; DR - J&amp;M Consulting seems to be the scammiest bunch of scammers that ever scammed. Beware, or just don't waste your time.",False,Portland,t5_2qi2i,self,Scam alert - J&amp;M Consulting,https://www.reddit.com/r/Portland/comments/4hpzjn/scam_alert_jm_consulting/,self,"{'images': [{'id': 'Wz2jDDiB9pWDAudXaPEPkrtgl43XMTcm5-8jcfnalGQ', 'resolutions': [{'height': 107, 'url': 'https://i.redditmedia.com/4ZEikL5_bOuTSnoWoBCjJopDAX1v-nmSyn27cz-EPAQ.jpg?fit=crop&amp;crop=faces%2Centropy&amp;arh=2&amp;w=108&amp;s=effaccaa1e6bd960633e78282496039b', 'width': 108}, {'height': 215, 'url': 'https://i.redditmedia.com/4ZEikL5_bOuTSnoWoBCjJopDAX1v-nmSyn27cz-EPAQ.jpg?fit=crop&amp;crop=faces%2Centropy&amp;arh=2&amp;w=216&amp;s=d77e84b781318d811547f9932b4763ba', 'width': 216}, {'height': 319, 'url': 'https://i.redditmedia.com/4ZEikL5_bOuTSnoWoBCjJopDAX1v-nmSyn27cz-EPAQ.jpg?fit=crop&amp;crop=faces%2Centropy&amp;arh=2&amp;w=320&amp;s=9f4aa47c755cb199fee63bcc1c4e0e72', 'width': 320}], 'source': {'height': 402, 'url': 'https://i.redditmedia.com/4ZEikL5_bOuTSnoWoBCjJopDAX1v-nmSyn27cz-EPAQ.jpg?s=ac680c69f487dbc046f591a7fdab4105', 'width': 403}, 'variants': {}}]}",,,
hailHydra69,1400909394.0,,,t2_gozj1,1462306712,self.Portland,https://www.reddit.com/r/Portland/comments/4hpy62/columbia_employee_store_pass/,0,4hpy62,True,,,False,,{},1,False,/r/Portland/comments/4hpy62/columbia_employee_store_pass/,1466425055,1,,{},[removed],False,Portland,t5_2qi2i,default,Columbia Employee Store Pass,https://www.reddit.com/r/Portland/comments/4hpy62/columbia_employee_store_pass/,,,,,
[deleted],,,,,1462305171,katu.com,https://www.reddit.com/r/Portland/comments/4hpquu/police_conduct_sweep_of_springwater_corridor_at/,0,4hpquu,False,local-news,Local News,False,,{},54,False,/r/Portland/comments/4hpquu/police_conduct_sweep_of_springwater_corridor_at/,1466424961,108,,{},[deleted],False,Portland,t5_2qi2i,default,Police conduct sweep of Springwater Corridor at Cartlandia,http://katu.com/news/local/police-conduct-sweep-of-springwater-corridor-at-cartlandia,,,,,
miah66,1438034073.0,,Roseway,t2_p4a8e,1462304098,self.Portland,https://www.reddit.com/r/Portland/comments/4hploh/my_company_was_just_bought_by_an_la_investment/,0,4hploh,True,help-me,Help Me,False,,{},7,False,/r/Portland/comments/4hploh/my_company_was_just_bought_by_an_la_investment/,1466424894,0,,{},"I wonder what this means for the company? We are a smallish industrial machine and engineering shop. We've grown alot in the past few years since I've been here. They say nothing will change. but everyone has heard that before. Time will tell I guess. They are keeping staff, shop and management all in their positions at this time. The owner of the company is nearing retirement, so it's not surprising he was wanting to cash out. Supposedly he's staying on for at least the next 3-5 years during the ""transition period"". Anyone know anything about [Crosspoint Capital Partners](http://www.counterpointcp.com/about/)?",False,Portland,t5_2qi2i,self,My company was just bought by an LA investment group,https://www.reddit.com/r/Portland/comments/4hploh/my_company_was_just_bought_by_an_la_investment/,self,"{'images': [{'id': 'SS7ukNmnIHJKptVGsxOhXomhiQLZl1cLg__0P8g40sY', 'resolutions': [{'height': 68, 'url': 'https://i.redditmedia.com/Sxhumww7_wKTFkLBs9RWqJcQCj60MaVVPTKEruZhVf4.jpg?fit=crop&amp;crop=faces%2Centropy&amp;arh=2&amp;w=108&amp;s=74ec9deaa7a518aee54b45ada6df3cd4', 'width': 108}], 'source': {'height': 68, 'url': 'https://i.redditmedia.com/Sxhumww7_wKTFkLBs9RWqJcQCj60MaVVPTKEruZhVf4.jpg?s=54217b6b0311216ba4793434dc43d70f', 'width': 108}, 'variants': {}}]}",,,
gavinster,1438777782.0,,,t2_pbwf0,1462302072,self.Portland,https://www.reddit.com/r/Portland/comments/4hpbqi/barefoot_man_save_elderly_woman_from_house_fire/,0,4hpbqi,True,local-news,Local News,False,,{},7,False,/r/Portland/comments/4hpbqi/barefoot_man_save_elderly_woman_from_house_fire/,1466424765,17,,{},"A family friend just made the news for running into a burning house, John McClane style, when he heard cries for help.
[edit: Sorry for the confusion, it's my first time posting a link. http://www.kptv.com/story/31870829/woman-hospitalized-for-smoke-inhalation-after-se-portland-fire ]",False,Portland,t5_2qi2i,self,Barefoot man save elderly woman from house fire in SE Portland,https://www.reddit.com/r/Portland/comments/4hpbqi/barefoot_man_save_elderly_woman_from_house_fire/,self,"{'images': [{'id': 'D0ZTVmUgXybD1c1qbLJaRpvjLElnUlNzXvcVe_C50yQ', 'resolutions': [{'height': 81, 'url': 'https://i.redditmedia.com/oMS3BS2FYsze34rbs8eCDxOnVRsWVFBWma2IUBO7MrQ.jpg?fit=crop&amp;crop=faces%2Centropy&amp;arh=2&amp;w=108&amp;s=38d3142a0c561c659e7cd89dc5193943', 'width': 108}, {'height': 162, 'url': 'https://i.redditmedia.com/oMS3BS2FYsze34rbs8eCDxOnVRsWVFBWma2IUBO7MrQ.jpg?fit=crop&amp;crop=faces%2Centropy&amp;arh=2&amp;w=216&amp;s=3b79426ffbc1fbf1cb27fcc194a43eea', 'width': 216}, {'height': 240, 'url': 'https://i.redditmedia.com/oMS3BS2FYsze34rbs8eCDxOnVRsWVFBWma2IUBO7MrQ.jpg?fit=crop&amp;crop=faces%2Centropy&amp;arh=2&amp;w=320&amp;s=2fa88f7ca6f0152c7cabe45d9ecfa95b', 'width': 320}, {'height': 480, 'url': 'https://i.redditmedia.com/oMS3BS2FYsze34rbs8eCDxOnVRsWVFBWma2IUBO7MrQ.jpg?fit=crop&amp;crop=faces%2Centropy&amp;arh=2&amp;w=640&amp;s=323fefc560d0a3a239e948f3991d1b2f', 'width': 640}, {'height': 720, 'url': 'https://i.redditmedia.com/oMS3BS2FYsze34rbs8eCDxOnVRsWVFBWma2IUBO7MrQ.jpg?fit=crop&amp;crop=faces%2Centropy&amp;arh=2&amp;w=960&amp;s=3c37d26251f98efe4644fbf9d0298ddb', 'width': 960}, {'height': 810, 'url': 'https://i.redditmedia.com/oMS3BS2FYsze34rbs8eCDxOnVRsWVFBWma2IUBO7MrQ.jpg?fit=crop&amp;crop=faces%2Centropy&amp;arh=2&amp;w=1080&amp;s=64c552084b18df7f42c3fcbd9aec7312', 'width': 1080}], 'source': {'height': 810, 'url': 'https://i.redditmedia.com/oMS3BS2FYsze34rbs8eCDxOnVRsWVFBWma2IUBO7MrQ.jpg?s=b7f63c37bead53339137295ae13f6906', 'width': 1080}, 'variants': {}}]}",,1462365068.0,
cocothemonkey,1262653750.0,,Garden Home,t2_3t38m,1462301828,rawstory.com,https://www.reddit.com/r/Portland/comments/4hpahm/a_californians_story_of_being_pushed_out_by/,0,4hpahm,False,housing,Housing,False,,{},32,False,/r/Portland/comments/4hpahm/a_californians_story_of_being_pushed_out_by/,1466424749,0,,{},,False,Portland,t5_2qi2i,http://b.thumbs.redditmedia.com/ObkzrNGX1iCY32TXbYAkQpJxX5BP1opso2fKLlpG6wk.jpg,"A Californian's story of being pushed out by rising rents only to end up in ""a promised land up north where one could afford an entire house for the price of our stuffy Oakland apartment""",http://www.rawstory.com/2016/04/i-love-california-deeply-and-heres-why-im-one-of-the-thousands-who-had-to-leave/,link,"{'images': [{'id': 'NFhMzUORRahYatxs3GPypZxR_PEN3CrQmKfT7W_H4qc', 'resolutions': [{'height': 58, 'url': 'https://i.redditmedia.com/C6UmDIDsrE-cmBBtrOFOS7HKde6x6vAak6oaHc0-UlU.jpg?fit=crop&amp;crop=faces%2Centropy&amp;arh=2&amp;w=108&amp;s=42ca0dd70bc0c79ad29502405ee78b01', 'width': 108}, {'height': 116, 'url': 'https://i.redditmedia.com/C6UmDIDsrE-cmBBtrOFOS7HKde6x6vAak6oaHc0-UlU.jpg?fit=crop&amp;crop=faces%2Centropy&amp;arh=2&amp;w=216&amp;s=11b9f0ff2b5dd7da04be66cd6d55708a', 'width': 216}, {'height': 172, 'url': 'https://i.redditmedia.com/C6UmDIDsrE-cmBBtrOFOS7HKde6x6vAak6oaHc0-UlU.jpg?fit=crop&amp;crop=faces%2Centropy&amp;arh=2&amp;w=320&amp;s=0bc028916ad9da12fe833dee2319b58c', 'width': 320}, {'height': 344, 'url': 'https://i.redditmedia.com/C6UmDIDsrE-cmBBtrOFOS7HKde6x6vAak6oaHc0-UlU.jpg?fit=crop&amp;crop=faces%2Centropy&amp;arh=2&amp;w=640&amp;s=9ee7cee09b50dff8a3198c99c1147517', 'width': 640}], 'source': {'height': 430, 'url': 'https://i.redditmedia.com/C6UmDIDsrE-cmBBtrOFOS7HKde6x6vAak6oaHc0-UlU.jpg?s=a2f43f42d6ebd9d287067062f2d72f58', 'width': 800}, 'variants': {}}]}",,,
elislider,1284367923.0,,Hillsboro,t2_4c6xs,1462300489,gjohnce.com,https://www.reddit.com/r/Portland/comments/4hp3w9/what_even_is_this_guys_site_also_youtube_channel/,0,4hp3w9,False,off-topic,Other,False,,{},4,False,/r/Portland/comments/4hp3w9/what_even_is_this_guys_site_also_youtube_channel/,1466424664,0,,{},,False,Portland,t5_2qi2i,default,What even is this guy's site? (also: youtube channel),http://www.gjohnce.com/,,,,,
jr98664,1304474855.0,,Humboldt,t2_56rfr,1462299477,oregonlive.com,https://www.reddit.com/r/Portland/comments/4hozbq/kelley_point_park_portlands_public_beach_was/,0,4hozbq,False,local-news,Local News,False,,{},7,False,/r/Portland/comments/4hozbq/kelley_point_park_portlands_public_beach_was/,1466424604,22,,{},,False,Portland,t5_2qi2i,http://b.thumbs.redditmedia.com/gyHpl3GVOuad3lM_xJeWwusywkId0FYagh_JIUrQaBQ.jpg,"Kelley Point Park, Portland's public beach, was supposed to be a city.",http://www.oregonlive.com/travel/index.ssf/2016/05/kelley_point_park_was_supposed.html,link,"{'images': [{'id': 'jb1E8rFkw-7PJ_YP8KWOl28ERlFIESNAVbiZcHez3KQ', 'resolutions': [{'height': 73, 'url': 'https://i.redditmedia.com/scSduduV-7b1QRcNSku1de0yQslWwoFoQMN5wLPkjHk.jpg?fit=crop&amp;crop=faces%2Centropy&amp;arh=2&amp;w=108&amp;s=4d24e2a9380214d775a314a7b3dffb6f', 'width': 108}, {'height': 146, 'url': 'https://i.redditmedia.com/scSduduV-7b1QRcNSku1de0yQslWwoFoQMN5wLPkjHk.jpg?fit=crop&amp;crop=faces%2Centropy&amp;arh=2&amp;w=216&amp;s=e5fc2675fac8a4c991f8068df10ada4f', 'width': 216}, {'height': 217, 'url': 'https://i.redditmedia.com/scSduduV-7b1QRcNSku1de0yQslWwoFoQMN5wLPkjHk.jpg?fit=crop&amp;crop=faces%2Centropy&amp;arh=2&amp;w=320&amp;s=a23a66eb2fe72507727f34ee661d16f4', 'width': 320}], 'source': {'height': 258, 'url': 'https://i.redditmedia.com/scSduduV-7b1QRcNSku1de0yQslWwoFoQMN5wLPkjHk.jpg?s=ad87d1eb7bcb0268f7ab0eca218db0c2', 'width': 380}, 'variants': {}}]}",,,
Jfost29,1455568332.0,,,t2_v35cx,1462299313,self.Portland,https://www.reddit.com/r/Portland/comments/4hoyt7/naked_man_walking_near_division_20th_headed_east/,0,4hoyt7,True,help-me,Help Me,False,,{},24,False,/r/Portland/comments/4hoyt7/naked_man_walking_near_division_20th_headed_east/,1466424598,28,,{},"Anyone else see this around 6:00am-6:15am?

On my drive to work early this morning I caught a glimpse of a regular looking guy just strolling down the street, buns to the sun. I usually would not be surprised, but from what I seen this guy looked normal as can be. Other than the fact that he was naked...",False,Portland,t5_2qi2i,self,Naked man walking near Division &amp; 20th headed east.,https://www.reddit.com/r/Portland/comments/4hoyt7/naked_man_walking_near_division_20th_headed_east/,,,,,
zedical,1371827797.0,,SE,t2_c44xm,1462299050,aoan.org,https://www.reddit.com/r/Portland/comments/4hoxc3/request_looking_for_portland_age_of_aquarius/,0,4hoxc3,False,classifieds,Classifieds,False,,{},2,False,/r/Portland/comments/4hoxc3/request_looking_for_portland_age_of_aquarius/,1466424579,0,,{},,False,Portland,t5_2qi2i,http://b.thumbs.redditmedia.com/LqeDSpjrecdDnRH72yHb6_Xkcgpaiw_R8nBCHe_z6Ew.jpg,â–µââ–µ Request: Looking for Portland Age of Aquarius Network Contributors,http://www.aoan.org/2016/05/request-looking-for-aoan-contributors.html,link,"{'images': [{'id': 'pCvce1FXAO6CwFu7atEomUP0LEnxYTxW8zFIjz8fjDM', 'resolutions': [{'height': 72, 'url': 'https://i.redditmedia.com/jtsJY7zCoSvkWpVPibesyuRLFwkqXHdZDycyNVaw4ss.jpg?fit=crop&amp;crop=faces%2Centropy&amp;arh=2&amp;w=108&amp;s=98d1a0cdec5addc7f9f0e4f5e5819828', 'width': 108}, {'height': 144, 'url': 'https://i.redditmedia.com/jtsJY7zCoSvkWpVPibesyuRLFwkqXHdZDycyNVaw4ss.jpg?fit=crop&amp;crop=faces%2Centropy&amp;arh=2&amp;w=216&amp;s=cbe3e6d5ac6c40e6e5ebc232f0d7a142', 'width': 216}, {'height': 213, 'url': 'https://i.redditmedia.com/jtsJY7zCoSvkWpVPibesyuRLFwkqXHdZDycyNVaw4ss.jpg?fit=crop&amp;crop=faces%2Centropy&amp;arh=2&amp;w=320&amp;s=30708c15bc320c833153674ab0c233f3', 'width': 320}, {'height': 426, 'url': 'https://i.redditmedia.com/jtsJY7zCoSvkWpVPibesyuRLFwkqXHdZDycyNVaw4ss.jpg?fit=crop&amp;crop=faces%2Centropy&amp;arh=2&amp;w=640&amp;s=fb9953d245b872d5cd246b211c5d4ad0', 'width': 640}, {'height': 640, 'url': 'https://i.redditmedia.com/jtsJY7zCoSvkWpVPibesyuRLFwkqXHdZDycyNVaw4ss.jpg?fit=crop&amp;crop=faces%2Centropy&amp;arh=2&amp;w=960&amp;s=a1658772d7b401253433dff39591c55a', 'width': 960}], 'source': {'height': 640, 'url': 'https://i.redditmedia.com/jtsJY7zCoSvkWpVPibesyuRLFwkqXHdZDycyNVaw4ss.jpg?s=444535becf2863c78322ae5c1c4826cc', 'width': 960}, 'variants': {}}]}",,,
1pdx1,1408209967.0,,,t2_hwozw,1462297891,self.Portland,https://www.reddit.com/r/Portland/comments/4hos1s/anyone_know_i_place_i_can_reach_by_trimet_to_go/,0,4hos1s,True,help-me,Help Me,False,,{},20,False,/r/Portland/comments/4hos1s/anyone_know_i_place_i_can_reach_by_trimet_to_go/,1466424510,4,,{},,False,Portland,t5_2qi2i,self,Anyone know I place I can reach by Trimet to go swimming?,https://www.reddit.com/r/Portland/comments/4hos1s/anyone_know_i_place_i_can_reach_by_trimet_to_go/,,,,,
