author,author_flair_css_class,author_flair_text,brand_safe,can_mod_post,contest_mode,created_utc,domain,edited,full_link,id,is_crosspostable,is_reddit_media_domain,is_self,is_video,link_flair_css_class,link_flair_text,locked,num_comments,num_crossposts,over_18,parent_whitelist_status,permalink,pinned,retrieved_on,score,selftext,spoiler,stickied,subreddit,subreddit_id,subreddit_type,thumbnail,title,url,whitelist_status,post_hint,preview,thumbnail_height,thumbnail_width,media,media_embed,secure_media,secure_media_embed,suggested_sort
question_23,,,True,False,False,1515979395,self.SeattleWA,1515980963.0,https://www.reddit.com/r/SeattleWA/comments/7qg93s/commuting_from_north_beacon_hill_to_bellevue_on/,7qg93s,True,False,True,False,question,Question,False,17,0,False,all_ads,/r/SeattleWA/comments/7qg93s/commuting_from_north_beacon_hill_to_bellevue_on/,False,1516045854,0,"*EDIT: I-90.* Sorry.

I've tested it out a few times. In the morning it seems ok, returning in the evening it's a bit crazier and a little slower. Anyone done it long term?",False,False,SeattleWA,t5_2vbli,public,self,Commuting from North Beacon Hill to Bellevue on the 90. How bad is it?,https://www.reddit.com/r/SeattleWA/comments/7qg93s/commuting_from_north_beacon_hill_to_bellevue_on/,all_ads,,,,,,,,,
PrimpinAintEasy,,,True,False,False,1515976976,self.SeattleWA,,https://www.reddit.com/r/SeattleWA/comments/7qg0g0/monday_capitol_hill_board_game_night_730_pm_at/,7qg0g0,True,False,True,False,meetup,Meetup,False,0,0,False,all_ads,/r/SeattleWA/comments/7qg0g0/monday_capitol_hill_board_game_night_730_pm_at/,False,1516043456,7,"Hello everyone! Welcome back to our weekly meetup. This week only, we'll be at Optimism Brewing, 1158 Broadway. I'll set out board games on one of the tables so you can find us.

We usually have 15-30 people, and end by 10 or 11. Optimism doesn't serve food, but they allow food from outside.

Start time is actually more like 7:15, people tend to show up then to order food, chat, etc. *Note: there may not be games visible at this time. Do not be alarmed.* Also if you have a particular game you want to make sure gets played, especially a long game, it's best to show up then and acquire players.

Many different sorts of people show up, though male programmers in their mid-20s are common. We play strategic games and social/party games, and everything in between. I bring some games^1, which you are free to use, or bring other games you want to play.

*Please order something, even if it's just one beverage. Optimism is a public bar, and we need to respect their business needs.*

---

FAQ

Q: *Does this happen every week?*  
A: Yes, except for some major holidays, or when The Elysian is closed. I will make a cancellation post in either of those cases.

Q: *Do I have to bring games?*  
A: Nope! You're welcome to, but feel free to play the games that others and I have brought.

Q: *Is this always at The Elysian?*  
A: Yes. We've moved around a bit over the years, and Elysian was the best (only?) option for the latest move a few years ago. If you have a different venue in mind, let me know, and I will personally investigate. Keep in mind that we do have very particular needs^2. Only Capitol Hill venues will be considered, there are other meetups for other areas.

Q: *Will I be welcome there?*  
A: Yes, in all likelihood. We take weirdos, normals, all kinds. Just don't be an asshole.


---

^1 *I usually bring Concept, Smallworld, Seven Wonders, Splendor, VivaJave Dice Game, Race for the Galaxy, Codenames, Avalon, Biblios, Timeline, Hanabi, Fluxx, Citadels, Zombie Dice, Love Letter, playing cards and a box of dice.*

^2 *We have variable attendance, 15-30. We move to different tables a lot. We need wide tables for game boards. We need separate checks. Some people are there for 3 hours and only order 1 iced tea. We want semi-reasonably priced food and drinks.*

",False,False,SeattleWA,t5_2vbli,public,self,Monday Capitol Hill Board Game Night: 7:30 pm at Optimism,https://www.reddit.com/r/SeattleWA/comments/7qg0g0/monday_capitol_hill_board_game_night_730_pm_at/,all_ads,,,,,,,,,
ChefJoe98136,plain,jackfruit denier,True,False,False,1515975362,seattletimes.com,,https://www.reddit.com/r/SeattleWA/comments/7qfurl/cyclist_struck_by_car_and_killed_near_golden/,7qfurl,True,False,False,False,bicycle,Bicycle,False,28,0,False,all_ads,/r/SeattleWA/comments/7qfurl/cyclist_struck_by_car_and_killed_near_golden/,False,1516041807,53,,False,False,SeattleWA,t5_2vbli,public,https://b.thumbs.redditmedia.com/63MN0s7iIksqUdjF0BmWkW7aEazXcnyr6_HX8AfP4EY.jpg,"Cyclist struck by car and killed near Golden Gardens Park at 4:30 AM Sunday, S of Shilshole Marina",https://www.seattletimes.com/seattle-news/cyclist-struck-by-car-and-killed-near-golden-gardens-park/,all_ads,link,"{'enabled': False, 'images': [{'id': 'YRIhxl6KpYce1NC2fMqyiZqNZkh0ZOxxD5EJAas_E44', 'resolutions': [{'height': 108, 'url': 'https://i.redditmedia.com/1zcBl_bvSIbV-95FSc_cqAUd_3HEFTwCXWCl88ldz60.jpg?fit=crop&amp;crop=faces%2Centropy&amp;arh=2&amp;w=108&amp;s=f7bb98895393cce9396ab5d4496bdb23', 'width': 108}], 'source': {'height': 200, 'url': 'https://i.redditmedia.com/1zcBl_bvSIbV-95FSc_cqAUd_3HEFTwCXWCl88ldz60.jpg?s=aa86592ee5d36b601208c2727790b075', 'width': 200}, 'variants': {}}]}",140.0,140.0,,,,,
John_Schlick,,,True,False,False,1515971788,self.SeattleWA,,https://www.reddit.com/r/SeattleWA/comments/7qfhrj/medium_strategy_board_game_night_at_the_dragon/,7qfhrj,True,False,True,False,meetup,Meetup,False,4,0,False,all_ads,/r/SeattleWA/comments/7qfhrj/medium_strategy_board_game_night_at_the_dragon/,False,1516038299,14,"Thursday evening, January 25th, starting at 6:00PM, lets get together and play some medium strategy board games.  It's pretty much guaranteed to be cold and rainy and still dark, so it strikes me as a great thing to spend some time with others and play a few games.

Let me define my title a little bit.  To me, Medium strategy board games are games that play 4 to 6, take about an hour (to maybe an hour and a half) to play, and are a solid mix of luck and strategy.  This means if you are new, you won't feel overpowered even though you might lose, and if luck is with you every step of the way, you might even win.  It also means that if you are experienced, you might still lose.  I try to pick games where it takes maybe 5 minutes to explain the rules of the game, so they are not overly complicated.

These games are also normally ""thematically consistant"" which to me means that if it's a game about railroads, the rules fit the world of railroads.  If it's a game about panda bears eating bamboo, the rules give you points when the panda bear eats bamboo.  These thematic elements foster a certain amount of conversation.
 
I have plenty of room to set up 3 separate games going at once, so we ought to be able to accomodate as many folks as show up.  I have 5 games that I own, and will propose that we play.  Any game I have, I am more than willing to teach, and I'll give a few starting strategy hints as the game starts so that you can get a feel for it.  It's far more about having fun playing against an opponent thats playing well than having someone feel left behind.  There will probably be a number of people that have never played before so please do not feel intimidated if you want to explore the world of board games that you have no doubt been hearing about.  and, if you feel so inclined, I have created a facebook event for this that you may share with others: https://www.facebook.com/events/540801852979272/

If you want to bring a game, it should fit with this theme.


The Dragon House is in West Seattle at 5284 44th Ave SW.  It's the North East house on the corner of 44th and Brandon, and right there on the corner there is a 16 foot tall dragon that has been carved out of a tree that grew in that spot (hence the name).  Come up the concrete grand entry stairs on 44th just to the north of the dragon, and make your way past the trampoline, and head up the front steps to the house.  If you have any trouble finding the place, just call me at (207) 932-6622 and I can talk you in from anywhere.

Feel free to bring a beverage or a snack to share, but we will be keeping these OFF the tables and away from the games for the most part.

I'm going to list the games that I'd like to play.  Feel free to look them up online, they are all very popular in the gaming community, but more importantly they are all really fun to play.

Ticket to Ride.  This is a train based game where you build railroad segments in order to create routes (also called a tickets) that you draw at the start of the game.  At the end of the game any tickets you have built are points for you, any that you failed to build are points against you.  Be aware that there are a limited number of tracks between any two cities on the map, and if others build them first you may have to build a longer route to get to your destination.

Takenoko. (Jades favorite game!)  In this game, you are in the emporers garden.  You may add more gardens to the game board, you may help the bamboo grow, and you may have the panda eat bamboo, each of these activities can give you points.   There are also some random rolls for things that happen on your turn.  for example, if lightening strikes, the panda gets scared, and runs to some point on the board to eat bamboo (you know, stress eating to feel better about themselves).  Of course YOU get to determine where that is, and what color bamboo he eats, so, naturally scaring the panda can be a good thing.  (You brutes!)

Settlers of Cataan...  ok, not.  Lets play Star Trek Catan.  It's the same game with a twist.  In this game, you trade resources to build spacelanes and starbases.  On every players turn the dice is rolled, and that roll determines resources that every player might or might not get.  Then, you can see if the character you have has a power that will allow you to forcibly trade with someone, or make them discard some of their resources.  First person to build a proper network of space lanes and bases (ok, 10 points) wins.

The DC deck building game.   Set in the world of DC comics.   Everyone starts with an identical deck of 10 cards.  As you play, you buy cards of certain characters off the table to add to your deck, and as you cycle thru those characters they allow you to buy more and more powerful cards for your deck.    Along the way, if you have powerful enough hands you can ""defeat"" a supervillian and add that very powerful card to your deck.   You also start the game with a personna like the Flash, Batman, Superman or maybe Wonder Woman.  These characters make some cards more powerful for you.  (Oh, and Jake is NEVER allowed to be The Flash)

Carcassone.  This is a game of laying map tiles down on the board and as you do so claiming something about that tile.  The field?  The road?  The City?  The Cloister?  You claim that feature py putting one of your meeples on that feature, but you only have so many meeples, and they don't come back until that feature is complete (at which point you get the points), so use them wisely.  You can also end up sharing features with others, and so you each get all the points for it.  But if you try to share and they have more meeples?  Well, you get nothing!

I am looking forward to seeing you all here. ",False,False,SeattleWA,t5_2vbli,public,self,"Medium Strategy Board Game night at the Dragon House in West Seattle on Jan 25th. (open to all, beginners welcome)",https://www.reddit.com/r/SeattleWA/comments/7qfhrj/medium_strategy_board_game_night_at_the_dragon/,all_ads,self,"{'enabled': False, 'images': [{'id': 'RrTq_nZ3OUsvhBh2efvc5VQhtj9scUCTYjVORm3GpSk', 'resolutions': [{'height': 143, 'url': 'https://i.redditmedia.com/4HRGv6H6h1UEkCcPQdC-WI4YUy8UzSF53f2fzAr5d9E.jpg?fit=crop&amp;crop=faces%2Centropy&amp;arh=2&amp;w=108&amp;s=6c0fd937980958a10c51dc0184bef150', 'width': 108}, {'height': 287, 'url': 'https://i.redditmedia.com/4HRGv6H6h1UEkCcPQdC-WI4YUy8UzSF53f2fzAr5d9E.jpg?fit=crop&amp;crop=faces%2Centropy&amp;arh=2&amp;w=216&amp;s=f02a36cbdf286e18c760d8a9c2d0a210', 'width': 216}, {'height': 426, 'url': 'https://i.redditmedia.com/4HRGv6H6h1UEkCcPQdC-WI4YUy8UzSF53f2fzAr5d9E.jpg?fit=crop&amp;crop=faces%2Centropy&amp;arh=2&amp;w=320&amp;s=77436557da0727400ebf166b973df825', 'width': 320}], 'source': {'height': 701, 'url': 'https://i.redditmedia.com/4HRGv6H6h1UEkCcPQdC-WI4YUy8UzSF53f2fzAr5d9E.jpg?s=c740c66088dda2560a93b338b7470518', 'width': 526}, 'variants': {}}]}",,,,,,,
Monkeyfeng,,,True,False,False,1515970537,seattletimes.com,,https://www.reddit.com/r/SeattleWA/comments/7qfd1p/overbilled_and_overstressed_3_seattle_city_light/,7qfd1p,True,False,False,False,news,News,False,23,0,False,all_ads,/r/SeattleWA/comments/7qfd1p/overbilled_and_overstressed_3_seattle_city_light/,False,1516035946,15,,False,False,SeattleWA,t5_2vbli,public,https://b.thumbs.redditmedia.com/dE51DCmSfowzSYRN-dyPtJvEK8kg5YgPfagN9AhFSLs.jpg,Overbilled and overstressed: 3 Seattle City Light customers vent,https://www.seattletimes.com/seattle-news/overbilled-and-overstressed-3-seattle-city-light-customers-vent/,all_ads,link,"{'enabled': False, 'images': [{'id': 'U8Vfc_mknF60hnNT1yiXS1Z2hht5bT3LLHbJuCa476k', 'resolutions': [{'height': 108, 'url': 'https://i.redditmedia.com/KRosniUr4Fw8lls9O_pcpTQVB7QgUiqwKRZxQiqCO6s.jpg?fit=crop&amp;crop=faces%2Centropy&amp;arh=2&amp;w=108&amp;s=2e2656d4ec7e1c3e953c1617ecf68141', 'width': 108}, {'height': 216, 'url': 'https://i.redditmedia.com/KRosniUr4Fw8lls9O_pcpTQVB7QgUiqwKRZxQiqCO6s.jpg?fit=crop&amp;crop=faces%2Centropy&amp;arh=2&amp;w=216&amp;s=03c4b3294cb9168b0431f4cbe54a3fd9', 'width': 216}], 'source': {'height': 316, 'url': 'https://i.redditmedia.com/KRosniUr4Fw8lls9O_pcpTQVB7QgUiqwKRZxQiqCO6s.jpg?s=2bb6a68b0c28cf444c4b76f3e3dc969c', 'width': 316}, 'variants': {}}]}",140.0,140.0,,,,,
Avenged_Seven_Muse,,,True,False,False,1515966619,self.SeattleWA,,https://www.reddit.com/r/SeattleWA/comments/7qexlm/bus_rant_thread/,7qexlm,True,False,True,False,discussion,Discussion,False,75,0,False,all_ads,/r/SeattleWA/comments/7qexlm/bus_rant_thread/,False,1516031382,0,3... 2... 1...  GO!,False,False,SeattleWA,t5_2vbli,public,self,Bus Rant Thread,https://www.reddit.com/r/SeattleWA/comments/7qexlm/bus_rant_thread/,all_ads,,,,,,,,,
smellit,,,True,False,False,1515965393,i.redd.it,,https://www.reddit.com/r/SeattleWA/comments/7qeskl/towncar_fire_downtown_today/,7qeskl,True,True,False,False,media,Media,False,38,0,False,all_ads,/r/SeattleWA/comments/7qeskl/towncar_fire_downtown_today/,False,1516030073,144,,False,False,SeattleWA,t5_2vbli,public,https://b.thumbs.redditmedia.com/uMn9hIEw7dFLohiS4u4Us-qtm4ZiZk_GSs3gH9_kdSs.jpg,Towncar fire downtown today.,https://i.redd.it/vxdde17xp3a01.jpg,all_ads,image,"{'enabled': True, 'images': [{'id': 'nLu6m9flcEhJImQ5j-tk1Ip3j1dNjaSLEko6yWYBfZ4', 'resolutions': [{'height': 108, 'url': 'https://i.redditmedia.com/XZhayWleMmPL3qz0ogC7h_J3SH09RHPLKT2M9u5J3XI.jpg?fit=crop&amp;crop=faces%2Centropy&amp;arh=2&amp;w=108&amp;s=c7ca42c667dec7a1fb8f3204ed24a776', 'width': 108}, {'height': 216, 'url': 'https://i.redditmedia.com/XZhayWleMmPL3qz0ogC7h_J3SH09RHPLKT2M9u5J3XI.jpg?fit=crop&amp;crop=faces%2Centropy&amp;arh=2&amp;w=216&amp;s=562f8d2d0c49a76f47ab0e607e30dcc1', 'width': 216}, {'height': 320, 'url': 'https://i.redditmedia.com/XZhayWleMmPL3qz0ogC7h_J3SH09RHPLKT2M9u5J3XI.jpg?fit=crop&amp;crop=faces%2Centropy&amp;arh=2&amp;w=320&amp;s=79c66ffdce0272d89aeeb235630ff37a', 'width': 320}, {'height': 640, 'url': 'https://i.redditmedia.com/XZhayWleMmPL3qz0ogC7h_J3SH09RHPLKT2M9u5J3XI.jpg?fit=crop&amp;crop=faces%2Centropy&amp;arh=2&amp;w=640&amp;s=82772a40e132f577d6b2b2d5761190a2', 'width': 640}, {'height': 960, 'url': 'https://i.redditmedia.com/XZhayWleMmPL3qz0ogC7h_J3SH09RHPLKT2M9u5J3XI.jpg?fit=crop&amp;crop=faces%2Centropy&amp;arh=2&amp;w=960&amp;s=bcf2beabfecb688eb92a78b5d63d5052', 'width': 960}, {'height': 1080, 'url': 'https://i.redditmedia.com/XZhayWleMmPL3qz0ogC7h_J3SH09RHPLKT2M9u5J3XI.jpg?fit=crop&amp;crop=faces%2Centropy&amp;arh=2&amp;w=1080&amp;s=e9fb6a9bdbaff2eddefcdbd504a316a8', 'width': 1080}], 'source': {'height': 1080, 'url': 'https://i.redditmedia.com/XZhayWleMmPL3qz0ogC7h_J3SH09RHPLKT2M9u5J3XI.jpg?s=8cdc292e1857cc9caf751e4d24f3327f', 'width': 1080}, 'variants': {}}]}",140.0,140.0,,,,,
Dyeode,,,True,False,False,1515963085,youtube.com,,https://www.reddit.com/r/SeattleWA/comments/7qej7q/little_quilcene_river_upper_watershed_xpost/,7qej7q,True,False,False,False,media,Media,False,5,0,False,all_ads,/r/SeattleWA/comments/7qej7q/little_quilcene_river_upper_watershed_xpost/,False,1516027573,0,,False,False,SeattleWA,t5_2vbli,public,https://b.thumbs.redditmedia.com/AhjcBx1RmyOxn_p-e5b9jOh-CuoSyEXBQCOAULQduIQ.jpg,Little Quilcene River | Upper Watershed | x-post r/Washington,https://www.youtube.com/watch?feature=youtu.be&amp;v=DT_u502HgLQ&amp;app=desktop,all_ads,rich:video,"{'enabled': False, 'images': [{'id': 'phkmmuYkKgsybcoUmUt79gXhSy1VdV_igZeUfmC-AOw', 'resolutions': [{'height': 81, 'url': 'https://i.redditmedia.com/MViLv-Rt0zADFZuqXogLFrztnxoRMo9nK-cNBCPQfp8.jpg?fit=crop&amp;crop=faces%2Centropy&amp;arh=2&amp;w=108&amp;s=63d67cb2a205f0246839c3df865bc92f', 'width': 108}, {'height': 162, 'url': 'https://i.redditmedia.com/MViLv-Rt0zADFZuqXogLFrztnxoRMo9nK-cNBCPQfp8.jpg?fit=crop&amp;crop=faces%2Centropy&amp;arh=2&amp;w=216&amp;s=2221628ae99d1a779f3b0c0eb0f7bd8b', 'width': 216}, {'height': 240, 'url': 'https://i.redditmedia.com/MViLv-Rt0zADFZuqXogLFrztnxoRMo9nK-cNBCPQfp8.jpg?fit=crop&amp;crop=faces%2Centropy&amp;arh=2&amp;w=320&amp;s=4d756b94d86664e0b7bdd28b71f5387c', 'width': 320}], 'source': {'height': 360, 'url': 'https://i.redditmedia.com/MViLv-Rt0zADFZuqXogLFrztnxoRMo9nK-cNBCPQfp8.jpg?s=684ede524cfa06bdb04f5453545116e5', 'width': 480}, 'variants': {}}]}",105.0,140.0,"{'oembed': {'author_name': 'Larry Holman', 'author_url': 'https://www.youtube.com/user/larryholman', 'height': 338, 'html': '&lt;iframe width=""600"" height=""338"" src=""https://www.youtube.com/embed/DT_u502HgLQ?feature=oembed"" frameborder=""0"" allow=""autoplay; encrypted-media"" allowfullscreen&gt;&lt;/iframe&gt;', 'provider_name': 'YouTube', 'provider_url': 'https://www.youtube.com/', 'thumbnail_height': 360, 'thumbnail_url': 'https://i.ytimg.com/vi/DT_u502HgLQ/hqdefault.jpg', 'thumbnail_width': 480, 'title': 'Can U take me higher', 'type': 'video', 'version': '1.0', 'width': 600}, 'type': 'youtube.com'}","{'content': '&lt;iframe width=""600"" height=""338"" src=""https://www.youtube.com/embed/DT_u502HgLQ?feature=oembed"" frameborder=""0"" allow=""autoplay; encrypted-media"" allowfullscreen&gt;&lt;/iframe&gt;', 'height': 338, 'scrolling': False, 'width': 600}","{'oembed': {'author_name': 'Larry Holman', 'author_url': 'https://www.youtube.com/user/larryholman', 'height': 338, 'html': '&lt;iframe width=""600"" height=""338"" src=""https://www.youtube.com/embed/DT_u502HgLQ?feature=oembed"" frameborder=""0"" allow=""autoplay; encrypted-media"" allowfullscreen&gt;&lt;/iframe&gt;', 'provider_name': 'YouTube', 'provider_url': 'https://www.youtube.com/', 'thumbnail_height': 360, 'thumbnail_url': 'https://i.ytimg.com/vi/DT_u502HgLQ/hqdefault.jpg', 'thumbnail_width': 480, 'title': 'Can U take me higher', 'type': 'video', 'version': '1.0', 'width': 600}, 'type': 'youtube.com'}","{'content': '&lt;iframe width=""600"" height=""338"" src=""https://www.youtube.com/embed/DT_u502HgLQ?feature=oembed"" frameborder=""0"" allow=""autoplay; encrypted-media"" allowfullscreen&gt;&lt;/iframe&gt;', 'height': 338, 'media_domain_url': 'https://www.redditmedia.com/mediaembed/7qej7q', 'scrolling': False, 'width': 600}",
scottydg,,,True,False,False,1515960532,self.SeattleWA,,https://www.reddit.com/r/SeattleWA/comments/7qe8xx/looking_for_a_crash_course_in_japanese/,7qe8xx,True,False,True,False,other,Other,False,12,0,False,all_ads,/r/SeattleWA/comments/7qe8xx/looking_for_a_crash_course_in_japanese/,False,1516024550,2,"I'm traveling to Japan for work in a couple months, and I would like to learn some of the language before I go there. I went for 3 weeks (again, for work) late last year, and it was definitely a struggle not to be able to say or understand anything. I only had a week's notice last time, but now I have some time to learn more about how to have a simple conversation. 

If there is a resource around Seattle, or if anyone knows any apps to try (I tried Duolingo, but honestly wasn't a huge fan), I'd be very receptive to it. I'm looking to have some basic knowledge of how to have a simple conversation, order food (for myself and others), ask for directions, things like that. I have nights and weekends free, if it is somewhere I need to go.

Thanks!",False,False,SeattleWA,t5_2vbli,public,self,Looking for a crash course in Japanese,https://www.reddit.com/r/SeattleWA/comments/7qe8xx/looking_for_a_crash_course_in_japanese/,all_ads,,,,,,,,,
it-is-sandwich-time,plain,🍩☕,True,False,False,1515958359,dailyuw.com,,https://www.reddit.com/r/SeattleWA/comments/7qe01o/good_news_or_bad_news_first/,7qe01o,True,False,False,False,homeless,Homeless,False,2,0,False,all_ads,/r/SeattleWA/comments/7qe01o/good_news_or_bad_news_first/,False,1516021654,0,,False,False,SeattleWA,t5_2vbli,public,https://b.thumbs.redditmedia.com/fl_5y8i5GudXdxKvkpiy0Qoe3IR3_hLaA9mIy8rg1Jk.jpg,Good news or bad news first?,http://www.dailyuw.com/news/article_193474f2-f80a-11e7-aab4-af33ac1da33b.html,all_ads,link,"{'enabled': False, 'images': [{'id': 'oUCK8YZ8Egw-3Lw4oREZ27E4CvOXyRp2J011NUQhk-Q', 'resolutions': [{'height': 56, 'url': 'https://i.redditmedia.com/AjdC-SjnyoXR00JJiDHsSZSV-JO1IZO5ltO_unsvRDE.jpg?fit=crop&amp;crop=faces%2Centropy&amp;arh=2&amp;w=108&amp;s=51b227d3d7eb037d047e59f7c5f4c200', 'width': 108}, {'height': 113, 'url': 'https://i.redditmedia.com/AjdC-SjnyoXR00JJiDHsSZSV-JO1IZO5ltO_unsvRDE.jpg?fit=crop&amp;crop=faces%2Centropy&amp;arh=2&amp;w=216&amp;s=4919c025f7286ad787cc087a176e4a0a', 'width': 216}, {'height': 168, 'url': 'https://i.redditmedia.com/AjdC-SjnyoXR00JJiDHsSZSV-JO1IZO5ltO_unsvRDE.jpg?fit=crop&amp;crop=faces%2Centropy&amp;arh=2&amp;w=320&amp;s=d2701bf295da07e6901e5e4cb364f92e', 'width': 320}, {'height': 336, 'url': 'https://i.redditmedia.com/AjdC-SjnyoXR00JJiDHsSZSV-JO1IZO5ltO_unsvRDE.jpg?fit=crop&amp;crop=faces%2Centropy&amp;arh=2&amp;w=640&amp;s=0271efe3cb37013298fdef5bd108cc0a', 'width': 640}, {'height': 504, 'url': 'https://i.redditmedia.com/AjdC-SjnyoXR00JJiDHsSZSV-JO1IZO5ltO_unsvRDE.jpg?fit=crop&amp;crop=faces%2Centropy&amp;arh=2&amp;w=960&amp;s=bb2b2e7995fcc353d70fff12eaa95d9c', 'width': 960}, {'height': 567, 'url': 'https://i.redditmedia.com/AjdC-SjnyoXR00JJiDHsSZSV-JO1IZO5ltO_unsvRDE.jpg?fit=crop&amp;crop=faces%2Centropy&amp;arh=2&amp;w=1080&amp;s=39c1c2eac3a79dd727b1abd872bbd1e9', 'width': 1080}], 'source': {'height': 630, 'url': 'https://i.redditmedia.com/AjdC-SjnyoXR00JJiDHsSZSV-JO1IZO5ltO_unsvRDE.jpg?s=2bbbf94ceacc890520878badb3b86c66', 'width': 1200}, 'variants': {}}]}",73.0,140.0,,,,,
MAGA_WA,,,True,False,False,1515957741,seattletimes.com,,https://www.reddit.com/r/SeattleWA/comments/7qdxh5/gov_inslees_climatechange_advisers_draw_scrutiny/,7qdxh5,True,False,False,False,government,Government,False,3,0,False,all_ads,/r/SeattleWA/comments/7qdxh5/gov_inslees_climatechange_advisers_draw_scrutiny/,False,1516020726,0,,False,False,SeattleWA,t5_2vbli,public,https://b.thumbs.redditmedia.com/kh5nW8dGEI7IX33VQuQctflRsKH5fabd-5Ep_1qD_Rk.jpg,Gov. Inslee’s climate-change advisers draw scrutiny as his national profile rises,https://www.seattletimes.com/seattle-news/politics/gov-inslees-climate-change-advisers-draw-attention-as-his-national-profile-rises/,all_ads,link,"{'enabled': False, 'images': [{'id': 'eed9DAP9fwB8YnSdkSGQcebEgdOOSzQ_aHi5LYhBwuQ', 'resolutions': [{'height': 56, 'url': 'https://i.redditmedia.com/8tEaI2VfL9slaaOIqBqtlYqjeBlhedSp13-wbIX849o.jpg?fit=crop&amp;crop=faces%2Centropy&amp;arh=2&amp;w=108&amp;s=40eadf00719e607cc70861a053544d97', 'width': 108}, {'height': 113, 'url': 'https://i.redditmedia.com/8tEaI2VfL9slaaOIqBqtlYqjeBlhedSp13-wbIX849o.jpg?fit=crop&amp;crop=faces%2Centropy&amp;arh=2&amp;w=216&amp;s=02ee5ca50c65df1a68855dc51026e358', 'width': 216}, {'height': 168, 'url': 'https://i.redditmedia.com/8tEaI2VfL9slaaOIqBqtlYqjeBlhedSp13-wbIX849o.jpg?fit=crop&amp;crop=faces%2Centropy&amp;arh=2&amp;w=320&amp;s=c2c3d197f7fac2eff6d1197e1f82f881', 'width': 320}, {'height': 336, 'url': 'https://i.redditmedia.com/8tEaI2VfL9slaaOIqBqtlYqjeBlhedSp13-wbIX849o.jpg?fit=crop&amp;crop=faces%2Centropy&amp;arh=2&amp;w=640&amp;s=770770db291df9c20ce4d863093f3360', 'width': 640}, {'height': 504, 'url': 'https://i.redditmedia.com/8tEaI2VfL9slaaOIqBqtlYqjeBlhedSp13-wbIX849o.jpg?fit=crop&amp;crop=faces%2Centropy&amp;arh=2&amp;w=960&amp;s=bca60b2426990a27b3735bc1fa3b7f7c', 'width': 960}, {'height': 567, 'url': 'https://i.redditmedia.com/8tEaI2VfL9slaaOIqBqtlYqjeBlhedSp13-wbIX849o.jpg?fit=crop&amp;crop=faces%2Centropy&amp;arh=2&amp;w=1080&amp;s=d7c061bfaec3e02f57906d24fd620ef7', 'width': 1080}], 'source': {'height': 630, 'url': 'https://i.redditmedia.com/8tEaI2VfL9slaaOIqBqtlYqjeBlhedSp13-wbIX849o.jpg?s=5fc4d8c6c54dd55c5340db536456b9bc', 'width': 1200}, 'variants': {}}]}",73.0,140.0,,,,,
