all_awardings,allow_live_comments,author,author_flair_css_class,author_flair_richtext,author_flair_text,author_flair_type,author_fullname,author_patreon_flair,author_premium,awarders,can_mod_post,contest_mode,created_utc,domain,full_link,gildings,id,is_crosspostable,is_meta,is_original_content,is_reddit_media_domain,is_robot_indexable,is_self,is_video,link_flair_background_color,link_flair_richtext,link_flair_text_color,link_flair_type,locked,media_only,no_follow,num_comments,num_crossposts,over_18,parent_whitelist_status,permalink,pinned,post_hint,preview,pwls,retrieved_on,score,selftext,send_replies,spoiler,stickied,subreddit,subreddit_id,subreddit_subscribers,subreddit_type,suggested_sort,thumbnail,thumbnail_height,thumbnail_width,title,total_awards_received,treatment_tags,upvote_ratio,url,whitelist_status,wls,link_flair_css_class,link_flair_template_id,link_flair_text,author_flair_template_id,author_flair_text_color,edited,author_flair_background_color,removed_by_category,media,media_embed,secure_media,secure_media_embed,crosspost_parent,crosspost_parent_list
[],False,AlexdressinginTN,,[],,text,t2_4nb7vf8w,False,False,[],False,False,1590687004,i.imgur.com,https://www.reddit.com/r/SeattleWA/comments/gsam3g/view_of_the_sunset_during_my_walk_the_other_night/,{},gsam3g,True,False,False,False,True,False,False,,[],dark,text,False,False,True,4,0,False,all_ads,/r/SeattleWA/comments/gsam3g/view_of_the_sunset_during_my_walk_the_other_night/,False,image,"{'enabled': True, 'images': [{'id': '2lIz7BUKruiNwJ3qs5HU8cuqxJyqbWMro9YWVEU1-Ss', 'resolutions': [{'height': 80, 'url': 'https://external-preview.redd.it/6J6vjYNs7cAApUxL-Hgwl8RXr-j4WkTca-ohCuAa1dk.jpg?width=108&amp;crop=smart&amp;auto=webp&amp;s=f1ac79987d63ebd13f219f7acd82507d9623b24a', 'width': 108}, {'height': 161, 'url': 'https://external-preview.redd.it/6J6vjYNs7cAApUxL-Hgwl8RXr-j4WkTca-ohCuAa1dk.jpg?width=216&amp;crop=smart&amp;auto=webp&amp;s=2dcf1573ccb8ab137e36df97d56c9cc559b4e0d8', 'width': 216}, {'height': 239, 'url': 'https://external-preview.redd.it/6J6vjYNs7cAApUxL-Hgwl8RXr-j4WkTca-ohCuAa1dk.jpg?width=320&amp;crop=smart&amp;auto=webp&amp;s=da7becffd940be613d86f61efc1ac7c72bbc5058', 'width': 320}, {'height': 479, 'url': 'https://external-preview.redd.it/6J6vjYNs7cAApUxL-Hgwl8RXr-j4WkTca-ohCuAa1dk.jpg?width=640&amp;crop=smart&amp;auto=webp&amp;s=f74dea247eb659143fa2dca304cff9c9c4c65ccc', 'width': 640}, {'height': 719, 'url': 'https://external-preview.redd.it/6J6vjYNs7cAApUxL-Hgwl8RXr-j4WkTca-ohCuAa1dk.jpg?width=960&amp;crop=smart&amp;auto=webp&amp;s=51292e8c05026a5ad580115f2c9c61afaf085411', 'width': 960}, {'height': 809, 'url': 'https://external-preview.redd.it/6J6vjYNs7cAApUxL-Hgwl8RXr-j4WkTca-ohCuAa1dk.jpg?width=1080&amp;crop=smart&amp;auto=webp&amp;s=89918bd6f152f5e7d149403af28739dd83257b0b', 'width': 1080}], 'source': {'height': 1996, 'url': 'https://external-preview.redd.it/6J6vjYNs7cAApUxL-Hgwl8RXr-j4WkTca-ohCuAa1dk.jpg?auto=webp&amp;s=f7fa1babfeef41b9cbdd98456ee50ea6aadf86b4', 'width': 2662}, 'variants': {}}]}",6,1590687082,1,,True,False,False,SeattleWA,t5_2vbli,123793,public,confidence,https://b.thumbs.redditmedia.com/9TyIP7RU82SWz4I9pbxmrPH3HetP_chULq0xe1zar8I.jpg,104.0,140.0,View of the sunset during my walk the other night,0,[],1.0,https://i.imgur.com/USs1L4L.jpg,all_ads,6,,,,,,,,,,,,,,
[],False,hweinberger,,[],,text,t2_mm0ci,False,False,[],False,False,1590683830,crosscut.com,https://www.reddit.com/r/SeattleWA/comments/gs9ltt/extremophile_scientist_trades_antarctica_for/,{},gs9ltt,True,False,False,False,True,False,False,,"[{'e': 'text', 't': 'News'}]",dark,richtext,False,False,True,0,0,False,all_ads,/r/SeattleWA/comments/gs9ltt/extremophile_scientist_trades_antarctica_for/,False,link,"{'enabled': False, 'images': [{'id': 'dq60b_XLokppsRFTtOLGmRVxQHhCSYz21FPTxzK3tBg', 'resolutions': [{'height': 81, 'url': 'https://external-preview.redd.it/LDNDp-St8CZzbcSWXECa8KTAoLsYrcC_rvxdo1MKQNI.jpg?width=108&amp;crop=smart&amp;auto=webp&amp;s=54472ebde68eb774a41fa3dab2317966fde147f7', 'width': 108}, {'height': 162, 'url': 'https://external-preview.redd.it/LDNDp-St8CZzbcSWXECa8KTAoLsYrcC_rvxdo1MKQNI.jpg?width=216&amp;crop=smart&amp;auto=webp&amp;s=2a37a2dcae73334f9be11980fa2ffb1b0415151c', 'width': 216}, {'height': 240, 'url': 'https://external-preview.redd.it/LDNDp-St8CZzbcSWXECa8KTAoLsYrcC_rvxdo1MKQNI.jpg?width=320&amp;crop=smart&amp;auto=webp&amp;s=d5be9c092f287a69b36acd6019036e1277bd6cc3', 'width': 320}, {'height': 480, 'url': 'https://external-preview.redd.it/LDNDp-St8CZzbcSWXECa8KTAoLsYrcC_rvxdo1MKQNI.jpg?width=640&amp;crop=smart&amp;auto=webp&amp;s=462be6f2bd2e5865c337ae61001d1e405054dcb4', 'width': 640}, {'height': 720, 'url': 'https://external-preview.redd.it/LDNDp-St8CZzbcSWXECa8KTAoLsYrcC_rvxdo1MKQNI.jpg?width=960&amp;crop=smart&amp;auto=webp&amp;s=51772af173626b61b0513bb08bbd592e46ea9c1a', 'width': 960}, {'height': 810, 'url': 'https://external-preview.redd.it/LDNDp-St8CZzbcSWXECa8KTAoLsYrcC_rvxdo1MKQNI.jpg?width=1080&amp;crop=smart&amp;auto=webp&amp;s=6cf47e07c742b1f1f84e9cef556215dda2d3d875', 'width': 1080}], 'source': {'height': 1500, 'url': 'https://external-preview.redd.it/LDNDp-St8CZzbcSWXECa8KTAoLsYrcC_rvxdo1MKQNI.jpg?auto=webp&amp;s=55ea39baf98b1bea4499ac18f006e36c7a9b0edf', 'width': 2000}, 'variants': {}}]}",6,1590684181,1,,True,False,False,SeattleWA,t5_2vbli,123787,public,confidence,https://b.thumbs.redditmedia.com/lEZQUSIeBJ0yV4vw9vLzuezuRbpPztIwU-wBfa0mjIQ.jpg,105.0,140.0,‘Extremophile’ scientist trades Antarctica for COVID-19 environmental surveillance research in Seattle,0,[],1.0,https://crosscut.com/2020/05/extremophile-scientist-trades-antarctica-covid-19-research,all_ads,6,news,2acf4938-8b2a-11e6-a0d2-0eb47e0770c3,News,,,,,,,,,,,
[],False,Muldoon713,plain,"[{'e': 'text', 't': 'Lake City'}]",Lake City,richtext,t2_69yv0,False,False,[],False,False,1590682107,self.SeattleWA,https://www.reddit.com/r/SeattleWA/comments/gs92ml/requiem_for_the_cinerama_courtesy_of_the_cover/,{},gs92ml,True,False,False,False,True,True,False,,"[{'e': 'text', 't': 'Arts'}]",dark,richtext,False,False,False,23,0,False,all_ads,/r/SeattleWA/comments/gs92ml/requiem_for_the_cinerama_courtesy_of_the_cover/,False,self,"{'enabled': False, 'images': [{'id': 'V7mSdRFe0MwNOyrdL9nRv2whWRCH9PXYSoBOZjGGwrI', 'resolutions': [{'height': 60, 'url': 'https://external-preview.redd.it/rjeMuVFIR1rhYpT0m0SonHU9tjVo5XSh5eY0cWQ5RE8.jpg?width=108&amp;crop=smart&amp;auto=webp&amp;s=625958e3381478efc7a245087b035c1a1dbfa5f6', 'width': 108}, {'height': 121, 'url': 'https://external-preview.redd.it/rjeMuVFIR1rhYpT0m0SonHU9tjVo5XSh5eY0cWQ5RE8.jpg?width=216&amp;crop=smart&amp;auto=webp&amp;s=8ca429816f70bdc3874fae04b76d0c0cecad2d03', 'width': 216}, {'height': 180, 'url': 'https://external-preview.redd.it/rjeMuVFIR1rhYpT0m0SonHU9tjVo5XSh5eY0cWQ5RE8.jpg?width=320&amp;crop=smart&amp;auto=webp&amp;s=c61dbfbc86fdc802b33c39c18d92ef091a6784f9', 'width': 320}, {'height': 360, 'url': 'https://external-preview.redd.it/rjeMuVFIR1rhYpT0m0SonHU9tjVo5XSh5eY0cWQ5RE8.jpg?width=640&amp;crop=smart&amp;auto=webp&amp;s=05c7a15cfec0a01ee19722ba1f030cf42173c9aa', 'width': 640}, {'height': 540, 'url': 'https://external-preview.redd.it/rjeMuVFIR1rhYpT0m0SonHU9tjVo5XSh5eY0cWQ5RE8.jpg?width=960&amp;crop=smart&amp;auto=webp&amp;s=a2f5d0b7b7a8ad2bfee7f56c95d1f871fb21e11a', 'width': 960}, {'height': 608, 'url': 'https://external-preview.redd.it/rjeMuVFIR1rhYpT0m0SonHU9tjVo5XSh5eY0cWQ5RE8.jpg?width=1080&amp;crop=smart&amp;auto=webp&amp;s=804dccad50c8f8348b73cbeaac636f0e5ffa9f9e', 'width': 1080}], 'source': {'height': 730, 'url': 'https://external-preview.redd.it/rjeMuVFIR1rhYpT0m0SonHU9tjVo5XSh5eY0cWQ5RE8.jpg?auto=webp&amp;s=cc51ee63948dd8149a6addae135f42c1d1c4eb3a', 'width': 1296}, 'variants': {}}]}",6,1590682566,2,"Incoming Wall-O-Text

Let me first say - let's not blame the shuddering of Vulcan Art + Entertainment on corona - they are using it as a convenient excuse to try and save face. All signs pointed to this happening back in February, and really, anyone who has ever worked for them could have told you this was coming for quite sometime. For a little background - I definitely recommend reading over u/draggingvulcan 's [excellent post](https://reddit.com/r/Seattle/comments/f20lit/cinerama_layoffs_the_untold_story/) (albeit awful) from a few months back. I'm sorry for everything that happened to the staff there - ya'll made every trip to the Cinerama memorable, and were clearly responsible for making it what it was.

Okay - into the mushy stuff. As a native Seattlite - hearing about the potential demise of the Cinerama is absolutely brutal. I grew up seeing films here. It was a comforting presence when I moved back after almost 10 years away. I saw there movies I'd never seen, in a format they were meant to be viewed in - something very few other places in the country will do in this day and age. Seattle is truly losing a part of it's cultural identity with the loss of this place in my eyes, and one of the best cinemas in the country. I hear people calling for Amazon to take it over, or something life Drafthouse (both [questionable organizations](https://www.hollywoodreporter.com/news/alamo-drafthouse-crisis-allegations-sexual-assault-harassment-mount-1043207) tbh) - but anything that replaces it will just kind of be a hollow shell of something that was uniquely Seattle. To say it was formative place for me is an understatement. No where else are you going to find somewhere that values BOTH loud bombastic blockbusters, and cinema as high art, and embrace them both as equals as they should be.

That said - against all warnings from former employees I really wanted to apply for an exciting  job opportunity that came up there a few years back, because the place meant a lot to me. I tepidly present to you my rejected cover letter, that I feel sums up my feelings on the place, and what it means to me and probably a whole lot of others in the city. It's odd reading it now realizing the last film I saw there was Rise of Skywalker - book-ending my experiences at the Cinerama with equally questionable Star Wars film, that both still provided amazing experiences.

&gt;*On May 19, 1999, my best friend and I stood impatiently in line on the corner of 4th Ave and Lenora St – our parents had let us bail on our final days of elementary school, travel to the city, and our pre-pubescent selves we’re about to bare witness to a monumental rite of passage – seeing a brand-new Star Wars movie on the big screen. While the mileage may vary on the film itself in retrospect, the spectacle that was seeing an event-film at Cinerama for the first time was unlike anything I had experienced. From the audience engagement, to the staff, and being in awe of the gargantuan screen – it is still something I think about every time I visit the cinema today. To me – this is what the Cinerama is all about – personal cinematic milestones and experiences.*  
&gt;  
&gt;*Those early years of cinematic spectacles cemented the foundations of always needing film in my life in some capacity. In high school it was being the only film critic for our school paper and taking my first job selling tickets and concessions at a local cinema. In college it was studying film in a grander sense, exposing myself to new realms of foreign, experimental, and classic films, and exploring the history of how cinema got to where it is today. In my post-college years, I worked at one of the state’s few remaining independent video stores and interned with the Seattle International Film Festival. Currently, with the \[x\] I advocate for, and act as a resource for filmmakers so they can do the work that will ultimately end up on the screens for our enjoyment.*  
&gt;  
&gt;*Not only did these past job experiences keep film active in my life – but they are at their heart, focused on sharing and educating others about the the exciting experiences film, film-watching, and cinema-going can offer them – something I believe is at the heart of the role of the \[x\] at the Cinerama and Vulcan Art + Entertainment, and make me a qualified candidate.*

TLDR: This blows",True,False,False,SeattleWA,t5_2vbli,123788,public,confidence,self,,,Requiem for the Cinerama - Courtesy of the Cover Letter I Wrote for a Job I (Luckily) Didn't Get,0,[],1.0,https://www.reddit.com/r/SeattleWA/comments/gs92ml/requiem_for_the_cinerama_courtesy_of_the_cover/,all_ads,6,arts,e2ea1766-7a48-11e6-9c4d-0eeb724eeebd,Arts,7197cf98-8661-11e6-8b81-0e39e0f9e455,dark,1590682456.0,,,,,,,,
[],False,weeenis,plain,"[{'e': 'text', 't': 'Lake City'}]",Lake City,richtext,t2_3d570,False,False,[],False,False,1590681817,kingcounty.gov,https://www.reddit.com/r/SeattleWA/comments/gs8z7e/key_indicators_of_covid19_activity_in_king_county/,{},gs8z7e,True,False,False,False,True,False,False,,"[{'e': 'text', 't': 'Government'}]",dark,richtext,False,False,False,24,0,False,all_ads,/r/SeattleWA/comments/gs8z7e/key_indicators_of_covid19_activity_in_king_county/,False,link,"{'enabled': False, 'images': [{'id': 'x_-Owy1I-62QQ8trR9n3CMGSMU9jP0UQjVbZQP5YSOU', 'resolutions': [{'height': 143, 'url': 'https://external-preview.redd.it/1FsUliDd1Yz0qY7Q6A08hd3e_4Wjzehu_8SpnPIykck.jpg?width=108&amp;crop=smart&amp;auto=webp&amp;s=b5a528840264d5b45b2ae505c80a76039f6e1a98', 'width': 108}, {'height': 286, 'url': 'https://external-preview.redd.it/1FsUliDd1Yz0qY7Q6A08hd3e_4Wjzehu_8SpnPIykck.jpg?width=216&amp;crop=smart&amp;auto=webp&amp;s=4013bc7d1a7361862bdbec5f52a4ff02fea7f536', 'width': 216}, {'height': 424, 'url': 'https://external-preview.redd.it/1FsUliDd1Yz0qY7Q6A08hd3e_4Wjzehu_8SpnPIykck.jpg?width=320&amp;crop=smart&amp;auto=webp&amp;s=8bf9ebc48d1f69620e2880b22fcb8555803b6629', 'width': 320}, {'height': 848, 'url': 'https://external-preview.redd.it/1FsUliDd1Yz0qY7Q6A08hd3e_4Wjzehu_8SpnPIykck.jpg?width=640&amp;crop=smart&amp;auto=webp&amp;s=130bbd058f5499292c41a332d9f06464056d9f25', 'width': 640}], 'source': {'height': 1126, 'url': 'https://external-preview.redd.it/1FsUliDd1Yz0qY7Q6A08hd3e_4Wjzehu_8SpnPIykck.jpg?auto=webp&amp;s=b8ccaee3591a8f62b74190be612a99c3b3ca543e', 'width': 849}, 'variants': {}}]}",6,1590682288,3,,False,False,False,SeattleWA,t5_2vbli,123788,public,confidence,https://b.thumbs.redditmedia.com/oonORXikbET2W3g4YGmc80ESG88QVsuN3aEs9gis-AM.jpg,140.0,140.0,Key indicators of COVID-19 activity in King County,0,[],1.0,https://www.kingcounty.gov/depts/health/covid-19/data/key-indicators.aspx,all_ads,6,government,01ca8b48-7a49-11e6-b552-0e18b019564b,Government,7197cf98-8661-11e6-8b81-0e39e0f9e455,dark,,,,,,,,,
[],False,chiquisea,,[],,text,t2_8stvl,False,False,[],False,False,1590677778,kuow.org,https://www.reddit.com/r/SeattleWA/comments/gs7q8w/its_not_how_i_thought_my_store_would_end_bop/,{},gs7q8w,True,False,False,False,True,False,False,,"[{'e': 'text', 't': 'News'}]",dark,richtext,False,False,True,14,0,False,all_ads,/r/SeattleWA/comments/gs7q8w/its_not_how_i_thought_my_store_would_end_bop/,False,link,"{'enabled': False, 'images': [{'id': 'o7aPuhaaxy19CubfatldYHLQCTDWDHpAEIyvgu5hBco', 'resolutions': [{'height': 72, 'url': 'https://external-preview.redd.it/njEqdElDk73ZQeiE6wqm2ZaMzucj4R_RDibf4faqNFE.jpg?width=108&amp;crop=smart&amp;auto=webp&amp;s=f5282589cb03692045817241fc60040518ac7a2d', 'width': 108}, {'height': 144, 'url': 'https://external-preview.redd.it/njEqdElDk73ZQeiE6wqm2ZaMzucj4R_RDibf4faqNFE.jpg?width=216&amp;crop=smart&amp;auto=webp&amp;s=9511b8bcc7161bfbbb973ee78908f2bf8fe8c6eb', 'width': 216}, {'height': 213, 'url': 'https://external-preview.redd.it/njEqdElDk73ZQeiE6wqm2ZaMzucj4R_RDibf4faqNFE.jpg?width=320&amp;crop=smart&amp;auto=webp&amp;s=21e8cb3513d47706b803a00948d3789d5d241a2d', 'width': 320}, {'height': 426, 'url': 'https://external-preview.redd.it/njEqdElDk73ZQeiE6wqm2ZaMzucj4R_RDibf4faqNFE.jpg?width=640&amp;crop=smart&amp;auto=webp&amp;s=be6a17266ea72ece5b108cc9475c589b8de9c26a', 'width': 640}], 'source': {'height': 628, 'url': 'https://external-preview.redd.it/njEqdElDk73ZQeiE6wqm2ZaMzucj4R_RDibf4faqNFE.jpg?auto=webp&amp;s=517de8e73111761c50a4de9dbd25f418db011f56', 'width': 942}, 'variants': {}}]}",6,1590678546,1,,True,False,False,SeattleWA,t5_2vbli,123782,public,confidence,https://b.thumbs.redditmedia.com/yFVd3XHnsVq6EblfpJwFsaOB9sETNklBwx3LpLwj_Uo.jpg,93.0,140.0,It's not how I thought my store would end: Bop Street Records in Ballard,0,[],1.0,https://www.kuow.org/stories/bop-street-records-bound-for-san-francisco,all_ads,6,news,2acf4938-8b2a-11e6-a0d2-0eb47e0770c3,News,,,,,,,,,,,
[],False,not_waduda,,[],,text,t2_614y2tky,False,False,[],False,False,1590675026,i.imgur.com,https://www.reddit.com/r/SeattleWA/comments/gs6yh9/i_like_how_wild_and_overgrown_the_grass_is/,{},gs6yh9,True,False,False,False,True,False,False,,[],dark,text,False,False,False,41,0,False,all_ads,/r/SeattleWA/comments/gs6yh9/i_like_how_wild_and_overgrown_the_grass_is/,False,image,"{'enabled': True, 'images': [{'id': 'RmupYVWETM63VFcV50MTgNv21ZXZGEAgfNM32KboUwE', 'resolutions': [{'height': 81, 'url': 'https://external-preview.redd.it/BLIc-st-UaY6l3jiFT5_Y1osZrR_gXgrcVgIyl9owqs.jpg?width=108&amp;crop=smart&amp;auto=webp&amp;s=f8cafa38fc05cd8e4323488d49bcb71c45a6ecd1', 'width': 108}, {'height': 162, 'url': 'https://external-preview.redd.it/BLIc-st-UaY6l3jiFT5_Y1osZrR_gXgrcVgIyl9owqs.jpg?width=216&amp;crop=smart&amp;auto=webp&amp;s=148094d57c7c2c2734f7bead1d1fbb36f819b92b', 'width': 216}, {'height': 240, 'url': 'https://external-preview.redd.it/BLIc-st-UaY6l3jiFT5_Y1osZrR_gXgrcVgIyl9owqs.jpg?width=320&amp;crop=smart&amp;auto=webp&amp;s=9c02a084c919f25fccdc43b75d3ec7c725044b9d', 'width': 320}, {'height': 480, 'url': 'https://external-preview.redd.it/BLIc-st-UaY6l3jiFT5_Y1osZrR_gXgrcVgIyl9owqs.jpg?width=640&amp;crop=smart&amp;auto=webp&amp;s=9bbc9826cba8558b92560a665ab80709661ad869', 'width': 640}, {'height': 720, 'url': 'https://external-preview.redd.it/BLIc-st-UaY6l3jiFT5_Y1osZrR_gXgrcVgIyl9owqs.jpg?width=960&amp;crop=smart&amp;auto=webp&amp;s=51312248d785310740a419cedb987c47131d6455', 'width': 960}, {'height': 810, 'url': 'https://external-preview.redd.it/BLIc-st-UaY6l3jiFT5_Y1osZrR_gXgrcVgIyl9owqs.jpg?width=1080&amp;crop=smart&amp;auto=webp&amp;s=f6f433d85cd675078dd6a1b396cfbf1369805169', 'width': 1080}], 'source': {'height': 1600, 'url': 'https://external-preview.redd.it/BLIc-st-UaY6l3jiFT5_Y1osZrR_gXgrcVgIyl9owqs.jpg?auto=webp&amp;s=932fe7b5aff76f517b4329de3b31f052b8b2ba97', 'width': 2133}, 'variants': {}}]}",6,1590676086,2,,True,False,False,SeattleWA,t5_2vbli,123782,public,confidence,https://b.thumbs.redditmedia.com/gm5soKkobhQVCqSBVrP3FXIsZTmyY3iJGOmx_5jf8vM.jpg,105.0,140.0,I like how wild and overgrown the grass is getting at our parks.,0,[],0.75,https://i.imgur.com/2qmuS0m.jpg,all_ads,6,,,,,,,,,,,,,,
[],False,OnlineMemeArmy,,"[{'e': 'text', 't': 'The Jumping Frenchman of Maine '}]",The Jumping Frenchman of Maine ,richtext,t2_3l1oj988,False,False,[],False,False,1590672820,capitolhillseattle.com,https://www.reddit.com/r/SeattleWA/comments/gs6cxd/pcc_grocery_store_delayed_by_covid19_crisis_sets/,{},gs6cxd,True,False,False,False,True,False,False,,"[{'e': 'text', 't': 'Business'}]",dark,richtext,False,False,True,4,0,False,all_ads,/r/SeattleWA/comments/gs6cxd/pcc_grocery_store_delayed_by_covid19_crisis_sets/,False,link,"{'enabled': False, 'images': [{'id': 'bjplyq8DajaWxTn1KeWQEqEuGK5UUNB9f9H2qi41QNg', 'resolutions': [{'height': 146, 'url': 'https://external-preview.redd.it/l7uGPPkwSjoTz7U-ZmG-EWUQGcqQfckh3k1lxtOwhIQ.jpg?width=108&amp;crop=smart&amp;auto=webp&amp;s=515fa3cf6e9ef4b6092b8cb411802bd3adb60ebd', 'width': 108}, {'height': 292, 'url': 'https://external-preview.redd.it/l7uGPPkwSjoTz7U-ZmG-EWUQGcqQfckh3k1lxtOwhIQ.jpg?width=216&amp;crop=smart&amp;auto=webp&amp;s=56f4a3fe9632ac70be0089cfda044972f1eb7a38', 'width': 216}], 'source': {'height': 430, 'url': 'https://external-preview.redd.it/l7uGPPkwSjoTz7U-ZmG-EWUQGcqQfckh3k1lxtOwhIQ.jpg?auto=webp&amp;s=6c2be51bac4d1fd5550b91d70e0faa458b0186d3', 'width': 318}, 'variants': {}}]}",6,1590673055,1,,False,False,False,SeattleWA,t5_2vbli,123778,public,confidence,https://b.thumbs.redditmedia.com/sP3T4Y3RaWIMJATQd5ylslECjEohvCCwJ758pBY9MhQ.jpg,140.0,140.0,"PCC grocery store, delayed by COVID-19 crisis, sets June opening date in Central District",0,[],1.0,https://www.capitolhillseattle.com/2020/05/pcc-grocery-store-delayed-by-covid-19-crisis-sets-june-opening-date-in-central-district/,all_ads,6,business,e634f09e-7a48-11e6-ad63-0e0aa093d8a1,Business,89e2036c-d5bd-11e9-9c3f-0e58b79bcec4,dark,,#edeff1,,,,,,,
[],False,OnlineMemeArmy,,"[{'e': 'text', 't': 'The Jumping Frenchman of Maine '}]",The Jumping Frenchman of Maine ,richtext,t2_3l1oj988,False,False,[],False,False,1590672601,capitolhillseattle.com,https://www.reddit.com/r/SeattleWA/comments/gs6atm/with_oneway_foot_traffic_central_districts/,{},gs6atm,True,False,False,False,True,False,False,,"[{'e': 'text', 't': 'Lifestyle'}]",dark,richtext,False,False,True,0,0,False,all_ads,/r/SeattleWA/comments/gs6atm/with_oneway_foot_traffic_central_districts/,False,link,"{'enabled': False, 'images': [{'id': 'd6XOc_Zvi3CKe2a00x3S1mcv12itsuCltprR1DDHhp0', 'resolutions': [{'height': 67, 'url': 'https://external-preview.redd.it/XxozkQpydv8-fNyk37dvBF3rhFnFqAL62J3FbcwZ8Qk.jpg?width=108&amp;crop=smart&amp;auto=webp&amp;s=49778a3ccc65b771546954533759a32f79c9ffd0', 'width': 108}, {'height': 135, 'url': 'https://external-preview.redd.it/XxozkQpydv8-fNyk37dvBF3rhFnFqAL62J3FbcwZ8Qk.jpg?width=216&amp;crop=smart&amp;auto=webp&amp;s=63941d1e18417d4ea8027ee489dfa169a83863b6', 'width': 216}, {'height': 200, 'url': 'https://external-preview.redd.it/XxozkQpydv8-fNyk37dvBF3rhFnFqAL62J3FbcwZ8Qk.jpg?width=320&amp;crop=smart&amp;auto=webp&amp;s=580add73c78665186d2cb7ac02b33f405b184928', 'width': 320}], 'source': {'height': 250, 'url': 'https://external-preview.redd.it/XxozkQpydv8-fNyk37dvBF3rhFnFqAL62J3FbcwZ8Qk.jpg?auto=webp&amp;s=495f7b9d1a61ab9b17e9de86a6458e5e3076016a', 'width': 400}, 'variants': {}}]}",6,1590672717,1,,True,False,False,SeattleWA,t5_2vbli,123778,public,confidence,https://a.thumbs.redditmedia.com/ez__i12iJkHvDLnv_NPpKHufSRDBSetaJiMDY4sh2W4.jpg,87.0,140.0,"With ‘one-way foot traffic,’ Central District’s farmers market reopens for 2020 season",0,[],1.0,https://www.capitolhillseattle.com/2020/05/with-one-way-foot-traffic-central-districts-farmers-market-reopens-for-2020-season/,all_ads,6,lifestyle,0d14c324-7a49-11e6-bf71-0e6da4bbd5b7,Lifestyle,89e2036c-d5bd-11e9-9c3f-0e58b79bcec4,dark,,#edeff1,,,,,,,
[],False,murdergirl_,,[],,text,t2_2mtco4xd,False,False,[],False,False,1590671925,self.SeattleWA,https://www.reddit.com/r/SeattleWA/comments/gs64fw/hi_hi_would_love_seattle_representation_in_my/,{},gs64fw,False,False,False,False,False,True,False,,"[{'e': 'text', 't': 'Question'}]",dark,richtext,False,False,True,0,0,False,all_ads,/r/SeattleWA/comments/gs64fw/hi_hi_would_love_seattle_representation_in_my/,False,,,6,1590671930,1,[removed],True,False,False,SeattleWA,t5_2vbli,123778,public,confidence,self,,,Hi hi would love Seattle representation in my COVID-19 thesis.. please help!,0,[],1.0,https://www.reddit.com/r/SeattleWA/comments/gs64fw/hi_hi_would_love_seattle_representation_in_my/,all_ads,6,question,deb2d6c4-0e68-11e7-b2bd-0e2e93dbfc84,Question,,,,,automod_filtered,,,,,,
[],False,Seahawkanon,,[],,text,t2_vbtqj,False,False,[],False,False,1590671821,komonews.com,https://www.reddit.com/r/SeattleWA/comments/gs63gi/im_not_a_racist_man_wrestling_coachs_social_media/,{},gs63gi,True,False,False,False,True,False,False,,"[{'e': 'text', 't': 'Other'}]",dark,richtext,False,False,True,109,0,False,all_ads,/r/SeattleWA/comments/gs63gi/im_not_a_racist_man_wrestling_coachs_social_media/,False,link,"{'enabled': False, 'images': [{'id': '9DPM1NpIUFCQwdbfr3e5kQUVoBKrsTJfCwJd3sp1xwc', 'resolutions': [{'height': 60, 'url': 'https://external-preview.redd.it/buHw1s7TExjfZjfvYpaeAgAiU-BXUKfbag52VNVSYUM.jpg?width=108&amp;crop=smart&amp;auto=webp&amp;s=bb42ef71b586bf7c3a479a56a02a09884684efb2', 'width': 108}, {'height': 121, 'url': 'https://external-preview.redd.it/buHw1s7TExjfZjfvYpaeAgAiU-BXUKfbag52VNVSYUM.jpg?width=216&amp;crop=smart&amp;auto=webp&amp;s=711c5f62d959ff436215c31b05ba4fa9f24ff123', 'width': 216}, {'height': 180, 'url': 'https://external-preview.redd.it/buHw1s7TExjfZjfvYpaeAgAiU-BXUKfbag52VNVSYUM.jpg?width=320&amp;crop=smart&amp;auto=webp&amp;s=4107e0ddbf6560092afe808ce7e5aad11cb467d9', 'width': 320}, {'height': 360, 'url': 'https://external-preview.redd.it/buHw1s7TExjfZjfvYpaeAgAiU-BXUKfbag52VNVSYUM.jpg?width=640&amp;crop=smart&amp;auto=webp&amp;s=96566c366c9a32a03f72faa012ad6cba3aad0c89', 'width': 640}, {'height': 540, 'url': 'https://external-preview.redd.it/buHw1s7TExjfZjfvYpaeAgAiU-BXUKfbag52VNVSYUM.jpg?width=960&amp;crop=smart&amp;auto=webp&amp;s=ac596941fc62380c6e80763ec4bb44f917e03de8', 'width': 960}], 'source': {'height': 555, 'url': 'https://external-preview.redd.it/buHw1s7TExjfZjfvYpaeAgAiU-BXUKfbag52VNVSYUM.jpg?auto=webp&amp;s=2c4603ab3ed1224ca809ac8d77048be1e78468ea', 'width': 986}, 'variants': {}}]}",6,1590671826,1,,False,False,False,SeattleWA,t5_2vbli,123778,public,confidence,https://a.thumbs.redditmedia.com/AcrpQvRQIWKtGQNySr0inCWGb5Io4MMrTLYe-D-rD00.jpg,78.0,140.0,'I'm not a racist man:' Wrestling coach's social media post defends Minnesota police,0,[],1.0,https://komonews.com/news/local/im-not-a-racist-man-wrestling-coachs-social-media-post-defends-minnesota-police,all_ads,6,other,b5108792-0e6a-11e7-a3b3-0e2e93dbfc84,Other,,,,,,,,,,,
