all_awardings,allow_live_comments,author,author_flair_css_class,author_flair_richtext,author_flair_text,author_flair_type,author_fullname,author_patreon_flair,author_premium,awarders,can_mod_post,contest_mode,created_utc,domain,full_link,gildings,id,is_crosspostable,is_meta,is_original_content,is_reddit_media_domain,is_robot_indexable,is_self,is_video,link_flair_background_color,link_flair_css_class,link_flair_richtext,link_flair_template_id,link_flair_text,link_flair_text_color,link_flair_type,locked,media_only,no_follow,num_comments,num_crossposts,over_18,parent_whitelist_status,permalink,pinned,pwls,removed_by_category,retrieved_on,score,selftext,send_replies,spoiler,stickied,subreddit,subreddit_id,subreddit_subscribers,subreddit_type,suggested_sort,thumbnail,title,total_awards_received,treatment_tags,upvote_ratio,url,whitelist_status,wls,author_flair_background_color,author_flair_template_id,author_flair_text_color,post_hint,preview,thumbnail_height,thumbnail_width,url_overridden_by_dest,crosspost_parent,crosspost_parent_list,media,media_embed,secure_media,secure_media_embed,gallery_data,is_gallery,media_metadata
[],False,georgejeffersonIIII,,[],,text,t2_5lgbu7lr,False,True,[],False,False,1598301841,self.SeattleWA,https://www.reddit.com/r/SeattleWA/comments/ifxf61/which_is_your_favorite_kind_of_way_to_eat_dicks/,{},ifxf61,False,False,False,False,False,True,False,,ama,"[{'e': 'text', 't': 'AMA'}]",d598631a-7a48-11e6-89aa-0e0aa093d8a1,AMA,dark,richtext,False,False,True,0,0,False,all_ads,/r/SeattleWA/comments/ifxf61/which_is_your_favorite_kind_of_way_to_eat_dicks/,False,6,reddit,1598301852,1,"[removed]

[View Poll](https://www.reddit.com/poll/ifxf61)",True,False,False,SeattleWA,t5_2vbli,137841,public,confidence,self,Which is your favorite kind of way to eat Dicks,0,[],1.0,https://www.reddit.com/r/SeattleWA/comments/ifxf61/which_is_your_favorite_kind_of_way_to_eat_dicks/,all_ads,6,,,,,,,,,,,,,,,,,
[],False,OnlineMemeArmy,,"[{'e': 'text', 't': 'The Jumping Frenchman of Maine '}]",The Jumping Frenchman of Maine ,richtext,t2_3l1oj988,False,True,[],False,False,1598299999,kiro7.com,https://www.reddit.com/r/SeattleWA/comments/ifwt7q/judge_sets_bail_at_500000_for_auburn_police/,{},ifwt7q,True,False,False,False,True,False,False,,crime,"[{'e': 'text', 't': 'Crime'}]",f08eb57a-7a48-11e6-98db-0e113643c931,Crime,dark,richtext,False,False,True,8,0,False,all_ads,/r/SeattleWA/comments/ifwt7q/judge_sets_bail_at_500000_for_auburn_police/,False,6,,1598300011,1,,False,False,False,SeattleWA,t5_2vbli,137840,public,confidence,https://b.thumbs.redditmedia.com/7Vd0Cm2sfjjwyZvNa0S6us1qAijQ9vHaJ_xQTWnHFSU.jpg,"Judge sets bail at $500,000 for Auburn police officer charged with murder",0,[],1.0,https://www.kiro7.com/news/local/judge-sets-bail-500000-auburn-police-officer-charged-with-murder/DT2LC4IHFVFU3OXK33GGDYL5XA/,all_ads,6,#edeff1,89e2036c-d5bd-11e9-9c3f-0e58b79bcec4,dark,link,"{'enabled': False, 'images': [{'id': 'GjcqCAEzvcWxrKU3eJyyvhNsWZctkqk_19-HfIwypQw', 'resolutions': [{'height': 60, 'url': 'https://external-preview.redd.it/uHAFPEfByIzWcLdNooeX1ZtlOcZ-6vwJsy9lFr0k074.jpg?width=108&amp;crop=smart&amp;auto=webp&amp;s=aa23236fdc708641cddf0559db80ec41f5465e06', 'width': 108}, {'height': 121, 'url': 'https://external-preview.redd.it/uHAFPEfByIzWcLdNooeX1ZtlOcZ-6vwJsy9lFr0k074.jpg?width=216&amp;crop=smart&amp;auto=webp&amp;s=2e20c4e76bdeebddadbc7509d74024b3df6dd9fa', 'width': 216}, {'height': 180, 'url': 'https://external-preview.redd.it/uHAFPEfByIzWcLdNooeX1ZtlOcZ-6vwJsy9lFr0k074.jpg?width=320&amp;crop=smart&amp;auto=webp&amp;s=e2e11f08d8f42cd0a226874f9dec8bc2737f2527', 'width': 320}, {'height': 360, 'url': 'https://external-preview.redd.it/uHAFPEfByIzWcLdNooeX1ZtlOcZ-6vwJsy9lFr0k074.jpg?width=640&amp;crop=smart&amp;auto=webp&amp;s=fdf2c7644702973c959e85ae03927605aac6c8f0', 'width': 640}], 'source': {'height': 360, 'url': 'https://external-preview.redd.it/uHAFPEfByIzWcLdNooeX1ZtlOcZ-6vwJsy9lFr0k074.jpg?auto=webp&amp;s=6794f04ef1987830ec20ee3866d3827be0c966b4', 'width': 640}, 'variants': {}}]}",78.0,140.0,https://www.kiro7.com/news/local/judge-sets-bail-500000-auburn-police-officer-charged-with-murder/DT2LC4IHFVFU3OXK33GGDYL5XA/,,,,,,,,,
[],False,OnlineMemeArmy,,"[{'e': 'text', 't': 'The Jumping Frenchman of Maine '}]",The Jumping Frenchman of Maine ,richtext,t2_3l1oj988,False,True,[],False,False,1598299723,king5.com,https://www.reddit.com/r/SeattleWA/comments/ifwq0h/quinault_indian_nation_closed_to_visitors_due_to/,{},ifwq0h,True,False,False,False,True,False,False,,news,"[{'e': 'text', 't': 'News'}]",2acf4938-8b2a-11e6-a0d2-0eb47e0770c3,News,dark,richtext,False,False,True,4,0,False,all_ads,/r/SeattleWA/comments/ifwq0h/quinault_indian_nation_closed_to_visitors_due_to/,False,6,,1598299734,1,,False,False,False,SeattleWA,t5_2vbli,137840,public,confidence,https://b.thumbs.redditmedia.com/DuHhcaiOxVdrW2NgXLWf54wamFviXIyOBqTQcGKjTRg.jpg,Quinault Indian Nation closed to visitors due to COVID-19,0,[],1.0,https://www.king5.com/article/news/health/coronavirus/quinault-indian-nation-closed-visitors-covid-19-coronavirus/281-d9af2689-ccd3-4451-be9c-d87f313537b3,all_ads,6,#edeff1,89e2036c-d5bd-11e9-9c3f-0e58b79bcec4,dark,link,"{'enabled': False, 'images': [{'id': '1POaLht0v-npc7g6Uq01q4m3yJNLK_d4XPh_wX_loUw', 'resolutions': [{'height': 60, 'url': 'https://external-preview.redd.it/M-KarEuNOzBavJ8uuq7Fkz0PC1p6QL7o54uKZNMs57M.jpg?width=108&amp;crop=smart&amp;auto=webp&amp;s=e508d175d3ea5ac4d1f2b8ed8b10b9dd44327641', 'width': 108}, {'height': 121, 'url': 'https://external-preview.redd.it/M-KarEuNOzBavJ8uuq7Fkz0PC1p6QL7o54uKZNMs57M.jpg?width=216&amp;crop=smart&amp;auto=webp&amp;s=64d8d2bdaa177a55c73d9dd51d2db8ec5f4be597', 'width': 216}, {'height': 179, 'url': 'https://external-preview.redd.it/M-KarEuNOzBavJ8uuq7Fkz0PC1p6QL7o54uKZNMs57M.jpg?width=320&amp;crop=smart&amp;auto=webp&amp;s=a192564b39fb0220f654f81f0e50cf2d8a647571', 'width': 320}, {'height': 359, 'url': 'https://external-preview.redd.it/M-KarEuNOzBavJ8uuq7Fkz0PC1p6QL7o54uKZNMs57M.jpg?width=640&amp;crop=smart&amp;auto=webp&amp;s=5ad18ac455aef82b99bfd86e22f13c2b0df326e2', 'width': 640}, {'height': 539, 'url': 'https://external-preview.redd.it/M-KarEuNOzBavJ8uuq7Fkz0PC1p6QL7o54uKZNMs57M.jpg?width=960&amp;crop=smart&amp;auto=webp&amp;s=6a7d5ddf09fff8172341ed45530dbfdc784ee318', 'width': 960}, {'height': 607, 'url': 'https://external-preview.redd.it/M-KarEuNOzBavJ8uuq7Fkz0PC1p6QL7o54uKZNMs57M.jpg?width=1080&amp;crop=smart&amp;auto=webp&amp;s=fb8c5250d8df1ed65bda9fdd509b1b42fbb5b14b', 'width': 1080}], 'source': {'height': 641, 'url': 'https://external-preview.redd.it/M-KarEuNOzBavJ8uuq7Fkz0PC1p6QL7o54uKZNMs57M.jpg?auto=webp&amp;s=d13f9db661eb2deefcfc71be0915b0b8b10dfe2b', 'width': 1140}, 'variants': {}}]}",78.0,140.0,https://www.king5.com/article/news/health/coronavirus/quinault-indian-nation-closed-visitors-covid-19-coronavirus/281-d9af2689-ccd3-4451-be9c-d87f313537b3,,,,,,,,,
[],False,roundabout_rover,,[],,text,t2_70k2sq4j,False,False,[],False,False,1598293463,self.SeattleWA,https://www.reddit.com/r/SeattleWA/comments/ifumte/help_roommate_not_following_king_county_safe/,{},ifumte,True,False,False,False,True,True,False,,question,"[{'e': 'text', 't': 'Question'}]",deb2d6c4-0e68-11e7-b2bd-0e2e93dbfc84,Question,dark,richtext,False,False,True,54,0,False,all_ads,/r/SeattleWA/comments/ifumte/help_roommate_not_following_king_county_safe/,False,6,,1598293474,1,"Hello, I (21F) live near the Seattle area and am at great risk regarding Covid. My roommate (19F) who recently moved back in for school is not following King County guidelines for safety and prevention. I have tried communicating with her about it multiple times and she has refused to comply with local and state laws regarding Covid. We have another roommate who is also at risk and can’t come home until she knows for certain the other girl will abide by safe start rules. The other girl’s mother is our guarantor and we’re wondering if it is legally possible for a guarantor to force a person off a shared lease. Thank you so much for your help.",True,False,False,SeattleWA,t5_2vbli,137828,public,confidence,self,Help! Roommate not following King County safe start guidelines,0,[],1.0,https://www.reddit.com/r/SeattleWA/comments/ifumte/help_roommate_not_following_king_county_safe/,all_ads,6,,,,,,,,,,,,,,,,,
[],False,mr_dude_guy,,[],,text,t2_564tq,False,False,[],False,False,1598293119,self.raisedbynarcissists,https://www.reddit.com/r/SeattleWA/comments/ifuii0/my_15f_mom_wants_to_have_my_clitoris_removed_and/,{},ifuii0,True,False,False,False,True,False,False,,crime,"[{'e': 'text', 't': 'Crime'}]",f08eb57a-7a48-11e6-98db-0e113643c931,Crime,dark,richtext,False,False,True,4,0,True,all_ads,/r/SeattleWA/comments/ifuii0/my_15f_mom_wants_to_have_my_clitoris_removed_and/,False,6,,1598293130,1,,True,False,False,SeattleWA,t5_2vbli,137825,public,confidence,nsfw,"My 15F mom wants to have my clitoris removed and my vagina infibulated at a local clinic, I live in Washington State.",0,[],1.0,/r/raisedbynarcissists/comments/ifpnt9/my_15f_mom_wants_to_have_my_clitoris_removed_and/,promo_adult_nsfw,3,,,,,,,,/r/raisedbynarcissists/comments/ifpnt9/my_15f_mom_wants_to_have_my_clitoris_removed_and/,t3_ifpnt9,"[{'all_awardings': [], 'allow_live_comments': True, 'approved_at_utc': None, 'approved_by': None, 'archived': False, 'author': 'Throwaway543245678', 'author_flair_background_color': None, 'author_flair_css_class': None, 'author_flair_richtext': [], 'author_flair_template_id': None, 'author_flair_text': None, 'author_flair_text_color': None, 'author_flair_type': 'text', 'author_fullname': 't2_77ppm2bh', 'author_patreon_flair': False, 'author_premium': False, 'awarders': [], 'banned_at_utc': None, 'banned_by': None, 'can_gild': True, 'can_mod_post': False, 'category': None, 'clicked': False, 'content_categories': None, 'contest_mode': False, 'created': 1598306895.0, 'created_utc': 1598278095.0, 'discussion_type': None, 'distinguished': None, 'domain': 'self.raisedbynarcissists', 'downs': 0, 'edited': 1598280862.0, 'gilded': 0, 'gildings': {}, 'hidden': False, 'hide_score': False, 'id': 'ifpnt9', 'is_crosspostable': True, 'is_meta': False, 'is_original_content': False, 'is_reddit_media_domain': False, 'is_robot_indexable': True, 'is_self': True, 'is_video': False, 'likes': None, 'link_flair_background_color': '', 'link_flair_css_class': 'supporturgent', 'link_flair_richtext': [], 'link_flair_template_id': '52dd740c-1364-11e5-a74c-0e8a71196b25', 'link_flair_text': '[URGENT]', 'link_flair_text_color': 'dark', 'link_flair_type': 'text', 'locked': False, 'media': None, 'media_embed': {}, 'media_only': False, 'mod_note': None, 'mod_reason_by': None, 'mod_reason_title': None, 'mod_reports': [], 'name': 't3_ifpnt9', 'no_follow': False, 'num_comments': 193, 'num_crossposts': 3, 'num_reports': None, 'over_18': True, 'parent_whitelist_status': 'no_ads', 'permalink': '/r/raisedbynarcissists/comments/ifpnt9/my_15f_mom_wants_to_have_my_clitoris_removed_and/', 'pinned': False, 'pwls': 0, 'quarantine': False, 'removal_reason': None, 'removed_by': None, 'removed_by_category': None, 'report_reasons': None, 'saved': False, 'score': 588, 'secure_media': None, 'secure_media_embed': {}, 'selftext': ""My mom doesn't like that I masturbate and she wants me infibulated so I don't have sex/unable to masturbate. \n\nI read on Washington's laws and they say I'm not protected and that my mom can have it performed on me. There's nothing to protect me from my mother forcing this on me if she wants it.\n\nMy mom pulled me out of school temporarily and now I'm afraid she means it.\n\nMy mom says we're going to the clinic for me to be infibulated in two days. My mom says I have to comply because she is my parent and I can't say no or resist. She says my infibulation and clitoris removal will be done under anesthetic and while I'm unconscious. The person infibulating me is a former doctor, but not an active one. She's planning to have the clinic he used to own cover it up. I'm also Caucasian so is my mom, so she can't take me out of country.\n\nI tried posting on r/legaladvice but my post got deleted in two hours.\n\nPlease tell me what I can do, my mom took my phone away so I can't call or text cps or police."", 'selftext_html': '&lt;!-- SC_OFF --&gt;&lt;div class=""md""&gt;&lt;p&gt;My mom doesn&amp;#39;t like that I masturbate and she wants me infibulated so I don&amp;#39;t have sex/unable to masturbate. &lt;/p&gt;\n\n&lt;p&gt;I read on Washington&amp;#39;s laws and they say I&amp;#39;m not protected and that my mom can have it performed on me. There&amp;#39;s nothing to protect me from my mother forcing this on me if she wants it.&lt;/p&gt;\n\n&lt;p&gt;My mom pulled me out of school temporarily and now I&amp;#39;m afraid she means it.&lt;/p&gt;\n\n&lt;p&gt;My mom says we&amp;#39;re going to the clinic for me to be infibulated in two days. My mom says I have to comply because she is my parent and I can&amp;#39;t say no or resist. She says my infibulation and clitoris removal will be done under anesthetic and while I&amp;#39;m unconscious. The person infibulating me is a former doctor, but not an active one. She&amp;#39;s planning to have the clinic he used to own cover it up. I&amp;#39;m also Caucasian so is my mom, so she can&amp;#39;t take me out of country.&lt;/p&gt;\n\n&lt;p&gt;I tried posting on &lt;a href=""/r/legaladvice""&gt;r/legaladvice&lt;/a&gt; but my post got deleted in two hours.&lt;/p&gt;\n\n&lt;p&gt;Please tell me what I can do, my mom took my phone away so I can&amp;#39;t call or text cps or police.&lt;/p&gt;\n&lt;/div&gt;&lt;!-- SC_ON --&gt;', 'send_replies': True, 'spoiler': False, 'stickied': False, 'subreddit': 'raisedbynarcissists', 'subreddit_id': 't5_2we9n', 'subreddit_name_prefixed': 'r/raisedbynarcissists', 'subreddit_subscribers': 622535, 'subreddit_type': 'public', 'suggested_sort': None, 'thumbnail': 'nsfw', 'thumbnail_height': None, 'thumbnail_width': None, 'title': 'My 15F mom wants to have my clitoris removed and my vagina infibulated at a local clinic, I live in Washington State.', 'top_awarded_type': None, 'total_awards_received': 0, 'treatment_tags': [], 'ups': 588, 'upvote_ratio': 0.97, 'url': 'https://www.reddit.com/r/raisedbynarcissists/comments/ifpnt9/my_15f_mom_wants_to_have_my_clitoris_removed_and/', 'user_reports': [], 'view_count': None, 'visited': False, 'whitelist_status': 'no_ads', 'wls': 0}]",,,,,,,
[],False,jazbi67,,[],,text,t2_lye09mr,False,False,[],False,False,1598291440,self.SeattleWA,https://www.reddit.com/r/SeattleWA/comments/iftxw0/cameras_inside_vacasa_rental_in_bedrooms_watching/,{},iftxw0,True,False,False,False,True,True,False,,discussion,"[{'e': 'text', 't': 'Discussion'}]",f3f2f636-7a48-11e6-a022-0e38969b1951,Discussion,dark,richtext,False,False,True,17,0,False,all_ads,/r/SeattleWA/comments/iftxw0/cameras_inside_vacasa_rental_in_bedrooms_watching/,False,6,,1598291451,1,I'm cleaning a vacasa rental in the Seattle area and found cameras inside the home. nowhere on the website does it State anything about indoor camera surveillance. Only outdoor. And no where inside or outside the house does it State you are being recorded I double checked and there are wires coming out of the back of these. There are some in the kitchen hallways bedrooms facing beds this is a multi-family home rental and children's day here is this illegal by any means?,True,False,False,SeattleWA,t5_2vbli,137821,public,confidence,self,Cameras inside vacasa rental in bedrooms watching people sleep.,0,[],1.0,https://www.reddit.com/r/SeattleWA/comments/iftxw0/cameras_inside_vacasa_rental_in_bedrooms_watching/,all_ads,6,,,,,,,,,,,,,,,,,
[],False,supaflyrobby,plain,"[{'e': 'text', 't': 'Capitol Hill'}]",Capitol Hill,richtext,t2_detbk,False,True,[],False,False,1598288111,self.SeattleWA,https://www.reddit.com/r/SeattleWA/comments/ifstpn/heading_to_cle_elum_to_spend_a_couple_of_weeks/,{},ifstpn,True,False,False,False,True,True,False,,question,"[{'e': 'text', 't': 'Question'}]",deb2d6c4-0e68-11e7-b2bd-0e2e93dbfc84,Question,dark,richtext,False,False,True,26,0,False,all_ads,/r/SeattleWA/comments/ifstpn/heading_to_cle_elum_to_spend_a_couple_of_weeks/,False,6,,1598288122,1,"So since I am working from home for the foreseeable future, I decided to rent a house in Cle Elum for a couple of weeks to get away from the city and decompress for awhile. I leave this weekend and I am really excited. A vacation that is not really a vacation. 

I am not native to Washington and was wondering if anyone had any stops along the way that would be worth it to stop and check out along I-90.",True,False,False,SeattleWA,t5_2vbli,137814,public,confidence,self,Heading to Cle Elum to spend a couple of weeks. What should I stop to check out on the way?,0,[],1.0,https://www.reddit.com/r/SeattleWA/comments/ifstpn/heading_to_cle_elum_to_spend_a_couple_of_weeks/,all_ads,6,,45778066-8661-11e6-b27e-0e0c2bb520df,dark,,,,,,,,,,,,,,
[],False,DantwanDeLaFrance,,[],,text,t2_m1zdw,False,False,[],False,False,1598286448,i.redd.it,https://www.reddit.com/r/SeattleWA/comments/ifs9j1/i_spent_three_days_in_everett_painting_this/,{},ifs9j1,True,False,False,True,True,False,False,,arts,"[{'e': 'text', 't': 'Arts'}]",e2ea1766-7a48-11e6-9c4d-0eeb724eeebd,Arts,dark,richtext,False,False,True,101,0,False,all_ads,/r/SeattleWA/comments/ifs9j1/i_spent_three_days_in_everett_painting_this/,False,6,,1598286459,1,,True,False,False,SeattleWA,t5_2vbli,137814,public,confidence,https://b.thumbs.redditmedia.com/iocXwqWDBNcRyHDCKRJ5o76DgC6dmPfP5CTbWxhrxHs.jpg,I spent three days in Everett painting this landscape on top of some of my favorite artists growing up. Thanks to everyone who showed support!!!,0,[],1.0,https://i.redd.it/yrtd81bo8zi51.jpg,all_ads,6,,,,image,"{'enabled': True, 'images': [{'id': 'rkwD8NSJASnoBcFNm3oSDmzPG1NPX_CYqhOmmh_Ipz8', 'resolutions': [{'height': 63, 'url': 'https://preview.redd.it/yrtd81bo8zi51.jpg?width=108&amp;crop=smart&amp;auto=webp&amp;s=ef7979e7d03cfc46ab2666e5f681310a9b934f53', 'width': 108}, {'height': 127, 'url': 'https://preview.redd.it/yrtd81bo8zi51.jpg?width=216&amp;crop=smart&amp;auto=webp&amp;s=2dc32bea4e18562f73c72c6ce3922aaf5468ba91', 'width': 216}, {'height': 188, 'url': 'https://preview.redd.it/yrtd81bo8zi51.jpg?width=320&amp;crop=smart&amp;auto=webp&amp;s=9ae0e5fd967420c1a200dcecd10ad50d13ffe3d8', 'width': 320}, {'height': 376, 'url': 'https://preview.redd.it/yrtd81bo8zi51.jpg?width=640&amp;crop=smart&amp;auto=webp&amp;s=3fb97461a7c24abbeb8a96088454c30d4d84b6c6', 'width': 640}, {'height': 564, 'url': 'https://preview.redd.it/yrtd81bo8zi51.jpg?width=960&amp;crop=smart&amp;auto=webp&amp;s=7592b23c12b16be9ca67e8452ffcae09800ab56b', 'width': 960}, {'height': 635, 'url': 'https://preview.redd.it/yrtd81bo8zi51.jpg?width=1080&amp;crop=smart&amp;auto=webp&amp;s=54485f7cdbfdfe7c2f5c12d52e40619b17fbc971', 'width': 1080}], 'source': {'height': 3806, 'url': 'https://preview.redd.it/yrtd81bo8zi51.jpg?auto=webp&amp;s=c07d74cff914995eb2c9181b4cb33027bc763cfa', 'width': 6468}, 'variants': {}}]}",82.0,140.0,https://i.redd.it/yrtd81bo8zi51.jpg,,,,,,,,,
[],False,CommercialThing5,,"[{'e': 'text', 't': 'Fakemonds '}, {'a': ':snoo_trollface:', 'e': 'emoji', 'u': 'https://emoji.redditmedia.com/mssz6vvv9ezz_t5_3nqvj/snoo_trollface'}, {'e': 'text', 't': ' (Outside of ""The Bowl of Edmonds"")'}]","Fakemonds :snoo_trollface: (Outside of ""The Bowl of Edmonds"")",richtext,t2_5dn994re,False,True,[],False,False,1598285569,youtube.com,https://www.reddit.com/r/SeattleWA/comments/ifrzli/staying_safe_and_connected_a_message_from_ben/,{},ifrzli,True,False,False,False,True,False,False,,media,"[{'e': 'text', 't': 'Media'}]",168a4956-7a49-11e6-ad69-0e9ca4a99471,Media,dark,richtext,False,False,True,2,0,False,all_ads,/r/SeattleWA/comments/ifrzli/staying_safe_and_connected_a_message_from_ben/,False,6,,1598285580,1,,True,False,False,SeattleWA,t5_2vbli,137811,public,confidence,https://b.thumbs.redditmedia.com/Abjkx6kUyQxJ1VIxPDlNTIBHwBzvrH222_bmYzIJjzg.jpg,Staying safe and connected: A message from Ben Minicucci President of Alaska Airlines,0,[],1.0,https://youtube.com/watch?v=XlAzT1KbKEQ,all_ads,6,#edeff1,89e2036c-d5bd-11e9-9c3f-0e58b79bcec4,dark,rich:video,"{'enabled': False, 'images': [{'id': 'DQ6__NQbPSY_FTTKvbkC-iVKkuCUlfYrdfXdttogRTE', 'resolutions': [{'height': 81, 'url': 'https://external-preview.redd.it/ETASZ0IOJ1VlJnMCtO5xhTsSEe4Dvkp1xoVIzo7XPQs.jpg?width=108&amp;crop=smart&amp;auto=webp&amp;s=ad8c4826ea7e16438d6582fb4dd8b5a303598336', 'width': 108}, {'height': 162, 'url': 'https://external-preview.redd.it/ETASZ0IOJ1VlJnMCtO5xhTsSEe4Dvkp1xoVIzo7XPQs.jpg?width=216&amp;crop=smart&amp;auto=webp&amp;s=39d77eb63eb11f2580566e808da035351385d8e0', 'width': 216}, {'height': 240, 'url': 'https://external-preview.redd.it/ETASZ0IOJ1VlJnMCtO5xhTsSEe4Dvkp1xoVIzo7XPQs.jpg?width=320&amp;crop=smart&amp;auto=webp&amp;s=c607528c79503332eed629171f29615315e49f2a', 'width': 320}], 'source': {'height': 360, 'url': 'https://external-preview.redd.it/ETASZ0IOJ1VlJnMCtO5xhTsSEe4Dvkp1xoVIzo7XPQs.jpg?auto=webp&amp;s=6dc6f78143bd64ac000bb643cd4ef039fb3c838d', 'width': 480}, 'variants': {}}]}",105.0,140.0,https://youtube.com/watch?v=XlAzT1KbKEQ,,,"{'oembed': {'author_name': 'Alaska Airlines', 'author_url': 'https://www.youtube.com/user/AlaskaAirVids', 'height': 338, 'html': '&lt;iframe width=""600"" height=""338"" src=""https://www.youtube.com/embed/XlAzT1KbKEQ?feature=oembed&amp;enablejsapi=1"" frameborder=""0"" allow=""accelerometer; autoplay; encrypted-media; gyroscope; picture-in-picture"" allowfullscreen&gt;&lt;/iframe&gt;', 'provider_name': 'YouTube', 'provider_url': 'https://www.youtube.com/', 'thumbnail_height': 360, 'thumbnail_url': 'https://i.ytimg.com/vi/XlAzT1KbKEQ/hqdefault.jpg', 'thumbnail_width': 480, 'title': 'Staying safe and connected: A message from Ben Minicucci', 'type': 'video', 'version': '1.0', 'width': 600}, 'type': 'youtube.com'}","{'content': '&lt;iframe width=""600"" height=""338"" src=""https://www.youtube.com/embed/XlAzT1KbKEQ?feature=oembed&amp;enablejsapi=1"" frameborder=""0"" allow=""accelerometer; autoplay; encrypted-media; gyroscope; picture-in-picture"" allowfullscreen&gt;&lt;/iframe&gt;', 'height': 338, 'scrolling': False, 'width': 600}","{'oembed': {'author_name': 'Alaska Airlines', 'author_url': 'https://www.youtube.com/user/AlaskaAirVids', 'height': 338, 'html': '&lt;iframe width=""600"" height=""338"" src=""https://www.youtube.com/embed/XlAzT1KbKEQ?feature=oembed&amp;enablejsapi=1"" frameborder=""0"" allow=""accelerometer; autoplay; encrypted-media; gyroscope; picture-in-picture"" allowfullscreen&gt;&lt;/iframe&gt;', 'provider_name': 'YouTube', 'provider_url': 'https://www.youtube.com/', 'thumbnail_height': 360, 'thumbnail_url': 'https://i.ytimg.com/vi/XlAzT1KbKEQ/hqdefault.jpg', 'thumbnail_width': 480, 'title': 'Staying safe and connected: A message from Ben Minicucci', 'type': 'video', 'version': '1.0', 'width': 600}, 'type': 'youtube.com'}","{'content': '&lt;iframe width=""600"" height=""338"" src=""https://www.youtube.com/embed/XlAzT1KbKEQ?feature=oembed&amp;enablejsapi=1"" frameborder=""0"" allow=""accelerometer; autoplay; encrypted-media; gyroscope; picture-in-picture"" allowfullscreen&gt;&lt;/iframe&gt;', 'height': 338, 'media_domain_url': 'https://www.redditmedia.com/mediaembed/ifrzli', 'scrolling': False, 'width': 600}",,,
[],False,713_281_832_346,,[],,text,t2_7jf4zpde,False,False,[],False,False,1598284609,diamondandsilk.com,https://www.reddit.com/r/SeattleWA/comments/ifrofn/blm_activists_storm_neighborhood_in_seattle/,{},ifrofn,True,False,False,False,True,False,False,,,[],,,dark,text,False,False,True,88,0,False,all_ads,/r/SeattleWA/comments/ifrofn/blm_activists_storm_neighborhood_in_seattle/,False,6,,1598284620,1,,False,False,False,SeattleWA,t5_2vbli,137809,public,confidence,https://b.thumbs.redditmedia.com/v9_lxDTWWZ7-LriNHtZK9cTQvV-AqEdn3_VF_DjGmOA.jpg,"BLM Activists Storm Neighborhood in Seattle, Demand Residents ‘Get the F*** Out!’ ‘Open Your Purse!’",0,[],1.0,https://www.diamondandsilk.com/blm-activists-storm-neighborhood-in-seattle-demand-residents-get-the-f-out-open-your-purse/?fbclid=IwAR1hSSQHZM4vYfd7szZ_nASMaMGvHaUhMy97PzXZA2k_41LEWiGJ-tjsu_I,all_ads,6,,,,link,"{'enabled': False, 'images': [{'id': 'VT7yHStwSWQOiNmorNe0dOSgI2ofdofEzlOaEmGJIZs', 'resolutions': [{'height': 66, 'url': 'https://external-preview.redd.it/TJ6E8NuHB40sbkm7g7VfJZwJgFCbAbOCZONkR1k0tbk.jpg?width=108&amp;crop=smart&amp;auto=webp&amp;s=2c9dc70386839fbd4876acfce97ab7a95713795a', 'width': 108}, {'height': 132, 'url': 'https://external-preview.redd.it/TJ6E8NuHB40sbkm7g7VfJZwJgFCbAbOCZONkR1k0tbk.jpg?width=216&amp;crop=smart&amp;auto=webp&amp;s=27a4d000854c5adfc518fd4975e42c1bda7d4b23', 'width': 216}, {'height': 196, 'url': 'https://external-preview.redd.it/TJ6E8NuHB40sbkm7g7VfJZwJgFCbAbOCZONkR1k0tbk.jpg?width=320&amp;crop=smart&amp;auto=webp&amp;s=2cdd8fe5dfe4639f383960886d6f589af828b546', 'width': 320}, {'height': 393, 'url': 'https://external-preview.redd.it/TJ6E8NuHB40sbkm7g7VfJZwJgFCbAbOCZONkR1k0tbk.jpg?width=640&amp;crop=smart&amp;auto=webp&amp;s=84909c36ce930277065579141c6bf55c48c5f54d', 'width': 640}], 'source': {'height': 500, 'url': 'https://external-preview.redd.it/TJ6E8NuHB40sbkm7g7VfJZwJgFCbAbOCZONkR1k0tbk.jpg?auto=webp&amp;s=37d293b8d700ae2c8fb1bb2d407ae66b4724292c', 'width': 814}, 'variants': {}}]}",85.0,140.0,https://www.diamondandsilk.com/blm-activists-storm-neighborhood-in-seattle-demand-residents-get-the-f-out-open-your-purse/?fbclid=IwAR1hSSQHZM4vYfd7szZ_nASMaMGvHaUhMy97PzXZA2k_41LEWiGJ-tjsu_I,,,,,,,,,
