all_awardings,allow_live_comments,author,author_flair_css_class,author_flair_richtext,author_flair_text,author_flair_type,author_fullname,author_patreon_flair,author_premium,awarders,can_mod_post,contest_mode,created_utc,domain,full_link,gildings,id,is_crosspostable,is_meta,is_original_content,is_reddit_media_domain,is_robot_indexable,is_self,is_video,link_flair_background_color,link_flair_richtext,link_flair_text_color,link_flair_type,locked,media_only,no_follow,num_comments,num_crossposts,over_18,parent_whitelist_status,permalink,pinned,pwls,retrieved_on,score,selftext,send_replies,spoiler,steward_reports,stickied,subreddit,subreddit_id,subreddit_subscribers,subreddit_type,suggested_sort,thumbnail,title,total_awards_received,url,whitelist_status,wls,link_flair_css_class,link_flair_template_id,link_flair_text,post_hint,preview,thumbnail_height,thumbnail_width,author_flair_template_id,author_flair_text_color,author_flair_background_color,crosspost_parent,crosspost_parent_list,media,media_embed,secure_media,secure_media_embed,removed_by_category
[],False,deliverykp,,[],,text,t2_563qrfwb,False,False,[],False,False,1576612517,i.redd.it,https://www.reddit.com/r/SeattleWA/comments/ec0yk5/this_was_taken_in_november_at_magnolia_boulevard/,{},ec0yk5,True,False,False,True,True,False,False,,[],dark,text,False,False,True,0,0,False,all_ads,/r/SeattleWA/comments/ec0yk5/this_was_taken_in_november_at_magnolia_boulevard/,False,6,1576612518,1,,True,False,[],False,SeattleWA,t5_2vbli,107361,public,confidence,default,"This was taken in November at Magnolia Boulevard Point, Seattle, WA.",0,https://i.redd.it/mk9pqkcy09541.jpg,all_ads,6,,,,,,,,,,,,,,,,,
[],False,butthurt_in_seattle,,[],,text,t2_4y2slvtx,False,False,[],False,False,1576610491,thedailybeast.com,https://www.reddit.com/r/SeattleWA/comments/ec0gum/consulting_firm_accidentally_doxxed_thousands_of/,{},ec0gum,True,False,False,False,True,False,False,,"[{'e': 'text', 't': 'News'}]",dark,richtext,False,False,True,9,0,False,all_ads,/r/SeattleWA/comments/ec0gum/consulting_firm_accidentally_doxxed_thousands_of/,False,6,1576610496,1,,True,False,[],False,SeattleWA,t5_2vbli,107360,public,confidence,https://b.thumbs.redditmedia.com/j9_q3aeVYW-R7wL_ExVAUHn03A3JPyxJnoAZJtR-WTY.jpg,Consulting Firm Accidentally Doxxed Thousands of Employees at Boeing,0,https://www.thedailybeast.com/imge-consulting-firm-accidentally-doxxed-thousands-of-employees-at-boeing-americas-top-defense-contractor,all_ads,6,news,2acf4938-8b2a-11e6-a0d2-0eb47e0770c3,News,link,"{'enabled': False, 'images': [{'id': 'rEgWPQhWbAyF9nfX5SWYz-QBWPQfJf33Xb5IaZAMWp4', 'resolutions': [{'height': 60, 'url': 'https://external-preview.redd.it/7XiJ4eK7XaAja6k8WuBj50f5g7KeriVVkRCvRQxLoYs.jpg?width=108&amp;crop=smart&amp;auto=webp&amp;s=a6a8d99c89b234e7ee549d6649a8831f4b9d07ba', 'width': 108}, {'height': 121, 'url': 'https://external-preview.redd.it/7XiJ4eK7XaAja6k8WuBj50f5g7KeriVVkRCvRQxLoYs.jpg?width=216&amp;crop=smart&amp;auto=webp&amp;s=1c685b79be7677fa26a593a44a71850145eb9d66', 'width': 216}, {'height': 179, 'url': 'https://external-preview.redd.it/7XiJ4eK7XaAja6k8WuBj50f5g7KeriVVkRCvRQxLoYs.jpg?width=320&amp;crop=smart&amp;auto=webp&amp;s=38d9112c694b0e3f4837af6e49c3bda3e20d516a', 'width': 320}, {'height': 359, 'url': 'https://external-preview.redd.it/7XiJ4eK7XaAja6k8WuBj50f5g7KeriVVkRCvRQxLoYs.jpg?width=640&amp;crop=smart&amp;auto=webp&amp;s=d7176ed2ac99ed381a8742788fd767b182d69cd3', 'width': 640}, {'height': 539, 'url': 'https://external-preview.redd.it/7XiJ4eK7XaAja6k8WuBj50f5g7KeriVVkRCvRQxLoYs.jpg?width=960&amp;crop=smart&amp;auto=webp&amp;s=92ef8e5d3a725117e3547ffdd6dbe9ad9afcf8f7', 'width': 960}, {'height': 607, 'url': 'https://external-preview.redd.it/7XiJ4eK7XaAja6k8WuBj50f5g7KeriVVkRCvRQxLoYs.jpg?width=1080&amp;crop=smart&amp;auto=webp&amp;s=b1b34bb4f4801b41eaf135f681448f7682a9b2e9', 'width': 1080}], 'source': {'height': 832, 'url': 'https://external-preview.redd.it/7XiJ4eK7XaAja6k8WuBj50f5g7KeriVVkRCvRQxLoYs.jpg?auto=webp&amp;s=b63ddf87e4b8edd63bd12cc6ee799fdaf0818119', 'width': 1480}, 'variants': {}}]}",78.0,140.0,,,,,,,,,,
[],False,Joemargarita,,[],,text,t2_zss6j,False,False,[],False,False,1576609750,self.SeattleWA,https://www.reddit.com/r/SeattleWA/comments/ec0ad7/sunset_spots/,{},ec0ad7,True,False,False,False,True,True,False,,"[{'e': 'text', 't': 'Question'}]",dark,richtext,False,False,True,10,0,False,all_ads,/r/SeattleWA/comments/ec0ad7/sunset_spots/,False,6,1576609751,1,Hi all! I'll be in Seattle from 18 to 20 December and was wondering if you guys could recommend any spot to view the sunset? Thanks in advance!,True,False,[],False,SeattleWA,t5_2vbli,107360,public,confidence,self,Sunset spots?,0,https://www.reddit.com/r/SeattleWA/comments/ec0ad7/sunset_spots/,all_ads,6,question,deb2d6c4-0e68-11e7-b2bd-0e2e93dbfc84,Question,,,,,,,,,,,,,,
[],False,the_republokrater,,[],,text,t2_4phxhhxv,False,True,[],False,False,1576609138,spl.org,https://www.reddit.com/r/SeattleWA/comments/ec051s/a_message_from_the_chief_librarian_starting_jan/,{},ec051s,True,False,False,False,True,False,False,,"[{'e': 'text', 't': 'Notice'}]",dark,richtext,False,False,True,48,0,False,all_ads,/r/SeattleWA/comments/ec051s/a_message_from_the_chief_librarian_starting_jan/,False,6,1576609140,1,,True,False,[],False,SeattleWA,t5_2vbli,107359,public,confidence,default,A message from the Chief Librarian - Starting Jan 2nd. 2020: No more late fines!,0,https://www.spl.org/about-us/the-organization/leadership/quarterly-message-from-the-chief-librarian,all_ads,6,notice,6737cc2e-8b2a-11e6-8b52-0ee00aa5364f,Notice,,,,,,,,,,,,,,
[],False,ChefJoe98136,plain,"[{'e': 'text', 't': 'West Seattle'}]",West Seattle,richtext,t2_obrrs,False,False,[],False,False,1576603055,geekwire.com,https://www.reddit.com/r/SeattleWA/comments/ebyods/samaritan_homeless_donation_platform_adjusts/,{},ebyods,True,False,False,False,True,False,False,,[],dark,text,False,False,True,8,0,False,all_ads,/r/SeattleWA/comments/ebyods/samaritan_homeless_donation_platform_adjusts/,False,6,1576603056,1,,True,False,[],False,SeattleWA,t5_2vbli,107357,public,confidence,default,"Samaritan homeless donation platform adjusts approach from city government to healthcare, expands reach",0,https://www.geekwire.com/2019/beacons-hope-unhoused-samaritan-takes-top-prize-cambia-groves-trail-competition-plans-launch-donation-platform-la/,all_ads,6,,,,,,,,b0c368c6-8661-11e6-8eba-0ec387b19b95,dark,,,,,,,,
[],False,chiquisea,,[],,text,t2_8stvl,False,False,[],False,False,1576601542,kuow.org,https://www.reddit.com/r/SeattleWA/comments/ebyc6c/washington_congresswoman_to_vote_against/,{},ebyc6c,True,False,False,False,True,False,False,,"[{'e': 'text', 't': 'Politics'}]",dark,richtext,False,False,True,527,0,False,all_ads,/r/SeattleWA/comments/ebyc6c/washington_congresswoman_to_vote_against/,False,6,1576601543,1,,True,False,[],False,SeattleWA,t5_2vbli,107358,public,confidence,default,"Washington Congresswoman to vote against impeachment, calling testimony 'hearsay'",0,https://www.kuow.org/stories/this-western-washington-state-congresswoman-will-vote-against-impeachment,all_ads,6,politics,1f25eb56-9de4-11e6-884f-0e1a21b57db4,Politics,,,,,,,,,,,,,,
[],False,Cosmo-DNA,,[],,text,t2_gbcpy,False,False,[],False,False,1576600690,geekwire.com,https://www.reddit.com/r/SeattleWA/comments/eby55g/hightech_football_helmet_maker_vicis_is_running/,{},eby55g,True,False,False,False,True,False,False,,[],dark,text,False,False,True,10,0,False,all_ads,/r/SeattleWA/comments/eby55g/hightech_football_helmet_maker_vicis_is_running/,False,6,1576600694,1,,True,False,[],False,SeattleWA,t5_2vbli,107358,public,confidence,https://b.thumbs.redditmedia.com/9KOCxsfauMRpJ_dQfcaEfw8C6lKCd3Dfalkk6RIxu2w.jpg,High-tech football helmet maker Vicis is running out of money in sudden downfall for Seattle startup,0,https://www.geekwire.com/2019/high-tech-football-helmet-maker-vicis-running-money-sudden-downfall-seattle-startup/,all_ads,6,,,,link,"{'enabled': False, 'images': [{'id': 'Q1jdtxBl-XY2AmA41Km1hQqY959zOg4oqan7qDyYp30', 'resolutions': [{'height': 81, 'url': 'https://external-preview.redd.it/ZSQ9QbG-kROpMxIJ89p_mvPS5z04N2YQxa-bO44Ujcw.jpg?width=108&amp;crop=smart&amp;auto=webp&amp;s=a86bda59332c82f286e8f363db55137c96061952', 'width': 108}, {'height': 162, 'url': 'https://external-preview.redd.it/ZSQ9QbG-kROpMxIJ89p_mvPS5z04N2YQxa-bO44Ujcw.jpg?width=216&amp;crop=smart&amp;auto=webp&amp;s=8d3d7651f22b331f0829b29bb4aeb7cf656dac11', 'width': 216}, {'height': 240, 'url': 'https://external-preview.redd.it/ZSQ9QbG-kROpMxIJ89p_mvPS5z04N2YQxa-bO44Ujcw.jpg?width=320&amp;crop=smart&amp;auto=webp&amp;s=d693d2b6bc41611b6f9d6ed91d2107d32a5914ae', 'width': 320}, {'height': 480, 'url': 'https://external-preview.redd.it/ZSQ9QbG-kROpMxIJ89p_mvPS5z04N2YQxa-bO44Ujcw.jpg?width=640&amp;crop=smart&amp;auto=webp&amp;s=f44a1ed25a7c383af02aad6c788b00baf325df09', 'width': 640}, {'height': 720, 'url': 'https://external-preview.redd.it/ZSQ9QbG-kROpMxIJ89p_mvPS5z04N2YQxa-bO44Ujcw.jpg?width=960&amp;crop=smart&amp;auto=webp&amp;s=a5b4602f3672b9a5c4fb730d3035b53cea903ec1', 'width': 960}, {'height': 810, 'url': 'https://external-preview.redd.it/ZSQ9QbG-kROpMxIJ89p_mvPS5z04N2YQxa-bO44Ujcw.jpg?width=1080&amp;crop=smart&amp;auto=webp&amp;s=477dfacfb13d82e9aefa2e0aa29acf6a8aeb7470', 'width': 1080}], 'source': {'height': 945, 'url': 'https://external-preview.redd.it/ZSQ9QbG-kROpMxIJ89p_mvPS5z04N2YQxa-bO44Ujcw.jpg?auto=webp&amp;s=37c6be4af8e9e32eb59ee2516184c2d863e5645e', 'width': 1260}, 'variants': {}}]}",105.0,140.0,,,,,,,,,,
[],False,half-rations-rogers,,[],,text,t2_3noydwbd,False,False,[],False,False,1576597674,i.redd.it,https://www.reddit.com/r/SeattleWA/comments/ebxguh/sunrise_inbound/,{},ebxguh,True,False,False,True,True,False,False,,[],dark,text,False,False,True,0,0,False,all_ads,/r/SeattleWA/comments/ebxguh/sunrise_inbound/,False,6,1576597676,1,,True,False,[],False,SeattleWA,t5_2vbli,107350,public,confidence,default,Sunrise Inbound,0,https://i.redd.it/wcxx4n0ts7541.png,all_ads,6,,,,,,,,,,,,,,,,,
[],False,the_republokrater,,[],,text,t2_4phxhhxv,False,True,[],False,False,1576597652,komonews.com,https://www.reddit.com/r/SeattleWA/comments/ebxgo6/seattle_city_council_approves_new_regional/,{},ebxgo6,True,False,False,False,True,False,False,,"[{'e': 'text', 't': 'Government'}]",dark,richtext,False,False,True,2,0,False,all_ads,/r/SeattleWA/comments/ebxgo6/seattle_city_council_approves_new_regional/,False,6,1576597654,1,,True,False,[],False,SeattleWA,t5_2vbli,107350,public,confidence,default,Seattle City Council approves new Regional Homeless Authority,0,https://komonews.com/news/project-seattle/seattle-city-council-approves-new-regional-homeless-authority,all_ads,6,government,01ca8b48-7a49-11e6-b552-0e18b019564b,Government,,,,,,,,,,,,,,
[],False,rupertcbharlow,,[],,text,t2_3278mgzl,False,False,[],False,False,1576596780,i.redd.it,https://www.reddit.com/r/SeattleWA/comments/ebx9r8/the_majestic_from_the_colombia_tower_club/,{},ebx9r8,True,False,False,True,True,False,False,,[],dark,text,False,False,True,16,0,False,all_ads,/r/SeattleWA/comments/ebx9r8/the_majestic_from_the_colombia_tower_club/,False,6,1576596782,1,,True,False,[],False,SeattleWA,t5_2vbli,107350,public,confidence,default,The majestic 💩 from the Colombia Tower Club.,0,https://i.redd.it/r6c5tnq5q7541.jpg,all_ads,6,,,,,,,,,,,,,,,,,
[],False,the_republokrater,,[],,text,t2_4phxhhxv,False,True,[],False,False,1576596647,self.SeattleWA,https://www.reddit.com/r/SeattleWA/comments/ebx8oh/seattle_is_no_longer_a_democracy_but_an_anti/,{},ebx8oh,True,False,False,False,True,True,False,,"[{'e': 'text', 't': 'Discussion'}]",dark,richtext,False,False,True,45,0,False,all_ads,/r/SeattleWA/comments/ebx8oh/seattle_is_no_longer_a_democracy_but_an_anti/,False,6,1576596649,1,"As I browse city groups and facebook private chats, I see the greeting call: Comrades. I see the soviet flag being waved around in downtown Seattle on youtube. I see universities advocating the dissolvancy of the  first amendment so they can exercise more control. I see the rallying cry of anti americanism grow: Eat the rich.

I could tell that we have become a banana republic when the Seattle elites got a king county judge, to side with king county, in a king county court, by saying an initiative ballot title that was written by king county was confusing. Done so, in order to defy the will to the vast majority of Washingtonians. This is now the de facto playbook for removing any ballot initiative. Now, king county merely has to author any text they want to strike any law they disagree with, defying our state constitution.

We find millions being embezzled from our taxes. Our police force being castrized and vilified for political distrust. Durkan used private emails to hide conversations about our business from public view. Contracts being rewarded to special interest friends; ie: Anne Fennessy's street car. Our money being spent on institutionalized workplace sexual harassment.  And now, the government, coming from a place of 'expertise on the homeless', creating a new arm of government compromising a panel of politicians overseeing a panel of their experts, all being paid with the 6 figure banana export of the region: Middle class and Tech Industry Taxes. 

***This Thursday, despite the voters expressing their will on a gas tax, they are planning to impose a new gas tax anyways. 57 cents a gallon anyways.*** 

This is it. This is the point where you must realize, as a citizen, that our government has been seized and the will of the people are no longer represented. They are siphoning our money to feed their own machinations of a labor force. A hostile one at that. Every personal friend of the ruling Elite has made out regarding Seattle, except for the people here.

Think about all the rock-bottom residents. The campers, vagrants, the drug-addicted. Falsely putting hope into a system that is designed to steal from us. All the while promising the very help used to conduct the theft.  It just reeks in the City of Seattle right now. Figuratively, and literally.

 People are literally starving. 

We are constantly told 'we don't have the money'. Yet, project after project, story after story, bureaucracy after bureaucracy, over runs after over runs, all plague the news cycle every week. Every week. 

 The soon to be president of the City Council is backed by foreign to Seattle money and agencies. Fully admitted and out in the open.  Our interests are not being represented. When you see the depth of corruption in this City and its government, are you actually happy? Are you happy that your tax money is being used to pad the pockets of the Durkan fellowship of friends? Are you happy that your tax money is used to defy American values, like the absolute defiance of our 2nd amendment? Are you happy that city business is conducted behind closed doors, not even benefiting its own citizens?

 **Are you honestly even American anymore?**",True,False,[],False,SeattleWA,t5_2vbli,107350,public,confidence,self,"Seattle is no longer a Democracy, but an anti American corrupted Banana Republic",0,https://www.reddit.com/r/SeattleWA/comments/ebx8oh/seattle_is_no_longer_a_democracy_but_an_anti/,all_ads,6,discussion,f3f2f636-7a48-11e6-a022-0e38969b1951,Discussion,,,,,,,,,,,,,,
[],False,Cosmo-DNA,,[],,text,t2_gbcpy,False,False,[],False,False,1576595043,komonews.com,https://www.reddit.com/r/SeattleWA/comments/ebwwcf/super_soaker_storms_this_week_likely_to_bring/,{},ebwwcf,True,False,False,False,True,False,False,,[],dark,text,False,False,True,19,0,False,all_ads,/r/SeattleWA/comments/ebwwcf/super_soaker_storms_this_week_likely_to_bring/,False,6,1576595045,1,,True,False,[],False,SeattleWA,t5_2vbli,107349,public,confidence,default,Super soaker: Storms this week likely to bring wettest day of year to Seattle,0,http://komonews.com/news/local/super-soaker-storms-this-week-likely-to-bring-wettest-day-of-year-to-seattle,all_ads,6,,,,,,,,,,,,,,,,,
[],False,therationaltroll,,[],,text,t2_aoz6y,False,False,[],False,False,1576594493,self.SeattleWA,https://www.reddit.com/r/SeattleWA/comments/ebws7c/frys_is_dead_theres_no_microcenter_here_what_are/,{},ebws7c,True,False,False,False,True,True,False,,[],dark,text,False,False,True,70,0,False,all_ads,/r/SeattleWA/comments/ebws7c/frys_is_dead_theres_no_microcenter_here_what_are/,False,6,1576594494,1,,True,False,[],False,SeattleWA,t5_2vbli,107349,public,confidence,self,Fry's is dead. There's no microcenter here. What are the alternatives,0,https://www.reddit.com/r/SeattleWA/comments/ebws7c/frys_is_dead_theres_no_microcenter_here_what_are/,all_ads,6,,,,,,,,,,,,,,,,,
[],False,CRYPT0CORTEZ,,[],,text,t2_187opl5d,False,False,[],False,False,1576594250,self.SeattleWA,https://www.reddit.com/r/SeattleWA/comments/ebwqem/plates_on_a_green_prius/,{},ebwqem,True,False,False,False,True,True,False,,[],dark,text,False,False,True,13,0,False,all_ads,/r/SeattleWA/comments/ebwqem/plates_on_a_green_prius/,False,6,1576594251,1,"Anyone happened to see a green Prius that was involved in a hit an run last night? Happened st the light on 45th in the U-District off the ramp from the highway, both lanes turn left and this idiot in the far left left decided to go straight and hits my driver door. Then darted off into the bus lane swerving through traffic.
         It as a first gen Toyota Prius , green, the first couple letters of the plate was BF———— I could get the rest with my girlfriend yelling at me not to speed up because I wanted to chase them down and was also shocked at what happened. 
      Any help would be appreciated, I never asked the Internet for help like this but maybe someone had their dash cam on during the time which I’m in the process of purchasing now.  Just been struggle since I e been here and I don’t know how I’m going to afford to get my driver door fixed.",True,False,[],False,SeattleWA,t5_2vbli,107349,public,confidence,self,Plates on a green Prius?,0,https://www.reddit.com/r/SeattleWA/comments/ebwqem/plates_on_a_green_prius/,all_ads,6,,,,,,,,,,,,,,,,,
[],False,nomadaiam,,[],,text,t2_12ri2o,False,False,[],False,False,1576574723,i.redd.it,https://www.reddit.com/r/SeattleWA/comments/ebtm25/ffs_enough_with_the_vandalized_bikes_anytime_i/,{},ebtm25,True,False,False,True,True,False,False,,[],dark,text,False,False,True,34,0,False,all_ads,/r/SeattleWA/comments/ebtm25/ffs_enough_with_the_vandalized_bikes_anytime_i/,False,6,1576574724,1,,True,False,[],False,SeattleWA,t5_2vbli,107348,public,confidence,default,"FFS enough with the vandalized bikes. Anytime I see this I stop and put them back up, takes little effort, lets all show Seattle some love.",0,https://i.redd.it/4ut76bckw5541.jpg,all_ads,6,,,,,,,,,,,,,,,,,
[],False,SeattleWARedditBot,official,"[{'e': 'text', 't': '🤖'}]",🤖,richtext,t2_c5x5nhk,False,False,[],False,False,1576573287,self.SeattleWA,https://www.reddit.com/r/SeattleWA/comments/ebtf83/seattle_reddit_community_open_chat_tuesday/,{},ebtf83,True,False,False,False,True,True,False,,[],dark,text,False,False,True,268,0,False,all_ads,/r/SeattleWA/comments/ebtf83/seattle_reddit_community_open_chat_tuesday/,False,6,1576573288,1,"Welcome to the [Seattle Reddit Community](https://www.reddit.com/r/SeattleWA) Daily Lounge! This is our open chat for anything you want to talk about, and it doesn't have to be Seattle related! 

---

**Things to do today:**

* [Event calendar hosted by MoPOP.](https://www.mopop.org/exhibitions-plus-events/events/)
* [Event calendar hosted by Event12.](https://www.events12.com/seattle/)
* [Event calendar hosted by Seattle Met.](https://www.seattlemet.com/events/)
* [Event calendar hosted by The Stranger.](https://www.thestranger.com/events/)
* [Event calendar hosted by the City of Seattle.](https://www.seattle.gov/event-calendar)
* [Event calendar hosted by Parent Map (for families &amp; kids).](https://www.parentmap.com/calendar)
* [Event calendar hosted by Red Tricycle (for families &amp; kids).](http://redtri.com/events/seattle/)
* Event calendar hosted by Live Music Project: [this month](http://livemusicproject.org/calendar/) &amp; [this month calendar view](http://livemusicproject.org/calendar/month/)

---

2-Day Weather forecast for the /r/SeattleWA metro area from the NWS:

* Overnight: ☁ Cloudy, with a low around 41. South wind around 7 mph.
* Tuesday: ☁ A chance of rain after 4pm. Cloudy. High near 48, with temperatures falling to around 46 in the afternoon. South southwest wind 6 to 10 mph. Chance of precipitation is 30%.
* Tuesday Night: 🌧 Rain likely. Mostly cloudy. Low around 42, with temperatures rising to around 44 overnight. South southeast wind 10 to 15 mph. Chance of precipitation is 70%. New rainfall amounts less than a tenth of an inch possible.
* Wednesday: 🌧 Rain. Cloudy, with a high near 47. South wind 15 to 21 mph, with gusts as high as 25 mph. Chance of precipitation is 90%. New rainfall amounts between a quarter and half of an inch possible.
* Wednesday Night: 🌧 Rain. Cloudy, with a low around 44. South wind 15 to 18 mph, with gusts as high as 22 mph. Chance of precipitation is 90%. New rainfall amounts between a half and three quarters of an inch possible.

*Weather emojis wrong? [Open an issue on GitHub!](https://github.com/r-seattle-wa/SeattleRedditBot/issues/new)*

---

Quote of the Day:

&gt; They're getting there. bro  Feigning incoherence with regard to the majority opinion on this article, on this sub, but generally.

&gt; ~ /r/SeattleWA

---

**Come chat!** Join us on the chat server. [Click here!](https://discord.gg/seattle)

---

*Full Seattle Lounge archive [here](https://www.reddit.com/r/SeattleWA/search?q=flair%3ASeattle%2BLounge&amp;restrict_sr=on&amp;sort=new&amp;t=all). If you have suggestions for this daily post, please [send a modmail](https://www.reddit.com/message/compose?to=%2Fr%2FSeattleWA).*",False,False,[],True,SeattleWA,t5_2vbli,107348,public,new,self,"Seattle Reddit Community Open Chat, Tuesday, December 17, 2019",0,https://www.reddit.com/r/SeattleWA/comments/ebtf83/seattle_reddit_community_open_chat_tuesday/,all_ads,6,,,,,,,,,dark,,,,,,,,
[],False,Varg_DidNothingWrong,,[],,text,t2_56r4t0tt,False,False,[],False,False,1576568568,usnews.com,https://www.reddit.com/r/SeattleWA/comments/ebssfx/washington_state_seeks_to_ban_sale_of_assault/,{},ebssfx,True,False,False,False,True,False,False,,[],dark,text,False,False,True,337,0,False,all_ads,/r/SeattleWA/comments/ebssfx/washington_state_seeks_to_ban_sale_of_assault/,False,6,1576568568,1,,False,False,[],False,SeattleWA,t5_2vbli,107348,public,confidence,default,"Washington State Seeks to Ban Sale of 'Assault Weapons,' High Capacity Magazines",0,https://www.usnews.com/news/us/articles/2019-12-12/washington-state-seeks-to-ban-sale-of-assault-weapons-high-capacity-magazines,all_ads,6,,,,,,,,,,,,,,,,,
[],False,nelf4life,,[],,text,t2_qyraq,False,False,[],False,False,1576563946,act.moveon.org,https://www.reddit.com/r/SeattleWA/comments/ebs34m/3000_rally_to_call_for_the_impeachment_of_trump/,{},ebs34m,True,False,False,False,True,False,False,,[],dark,text,False,False,True,7,0,False,all_ads,/r/SeattleWA/comments/ebs34m/3000_rally_to_call_for_the_impeachment_of_trump/,False,6,1576563947,1,,True,False,[],False,SeattleWA,t5_2vbli,107343,public,confidence,https://b.thumbs.redditmedia.com/1si2U4z5Kz6I0-3qnDsDt0VUsREtRL-wvKRHkAk-IQM.jpg,3000 Rally to Call for the Impeachment of Trump: Sign up today,0,https://act.moveon.org/event/impeach-and-remove-attend/search/?logo,all_ads,6,,,,link,"{'enabled': False, 'images': [{'id': 'AO9IFlb1TfOZFcOTH5rum5U5NdSZRCYN_nPE5ssIbtY', 'resolutions': [{'height': 49, 'url': 'https://external-preview.redd.it/reo2U0lCVWKv2rVD_x9O587mPlGVYN-b8nuAQtktYH8.jpg?width=108&amp;crop=smart&amp;auto=webp&amp;s=b4226da3c70df10897200bca65180af8e77b8ba6', 'width': 108}, {'height': 98, 'url': 'https://external-preview.redd.it/reo2U0lCVWKv2rVD_x9O587mPlGVYN-b8nuAQtktYH8.jpg?width=216&amp;crop=smart&amp;auto=webp&amp;s=1a7aebff608a56385280d942b12622f498ed97e8', 'width': 216}, {'height': 145, 'url': 'https://external-preview.redd.it/reo2U0lCVWKv2rVD_x9O587mPlGVYN-b8nuAQtktYH8.jpg?width=320&amp;crop=smart&amp;auto=webp&amp;s=9e0a2081ab6da7cf038309b0b5a919d66c5cefa2', 'width': 320}, {'height': 290, 'url': 'https://external-preview.redd.it/reo2U0lCVWKv2rVD_x9O587mPlGVYN-b8nuAQtktYH8.jpg?width=640&amp;crop=smart&amp;auto=webp&amp;s=33548ae0c76046602c3ecb07a5037a6426e17be9', 'width': 640}, {'height': 436, 'url': 'https://external-preview.redd.it/reo2U0lCVWKv2rVD_x9O587mPlGVYN-b8nuAQtktYH8.jpg?width=960&amp;crop=smart&amp;auto=webp&amp;s=c64c10cdacc1bd980f4b564df43782af72c01d14', 'width': 960}, {'height': 491, 'url': 'https://external-preview.redd.it/reo2U0lCVWKv2rVD_x9O587mPlGVYN-b8nuAQtktYH8.jpg?width=1080&amp;crop=smart&amp;auto=webp&amp;s=79cd9b36b778c5e6f28b2de96162abdaaf4a7737', 'width': 1080}], 'source': {'height': 772, 'url': 'https://external-preview.redd.it/reo2U0lCVWKv2rVD_x9O587mPlGVYN-b8nuAQtktYH8.jpg?auto=webp&amp;s=f65f6ad743ff680d329cb08180b7fc867ca6df29', 'width': 1698}, 'variants': {}}]}",63.0,140.0,,,,,,,,,,
[],False,Melissa6991,,[],,text,t2_548k5slm,False,False,[],False,False,1576562259,self.SeattleWA,https://www.reddit.com/r/SeattleWA/comments/ebrt5e/alaskan_way_viaduct/,{},ebrt5e,True,False,False,False,True,True,False,,[],dark,text,False,False,True,2,0,False,all_ads,/r/SeattleWA/comments/ebrt5e/alaskan_way_viaduct/,False,6,1576562260,1,I’m so glad the Alaskan way viaduct is completely torn down or at least most of it is,True,False,[],False,SeattleWA,t5_2vbli,107342,public,confidence,self,Alaskan way viaduct,0,https://www.reddit.com/r/SeattleWA/comments/ebrt5e/alaskan_way_viaduct/,all_ads,6,,,,,,,,,,,,,,,,,
