author,author_flair_css_class,author_flair_text,brand_safe,can_mod_post,contest_mode,created_utc,domain,full_link,id,is_crosspostable,is_reddit_media_domain,is_self,is_video,link_flair_css_class,link_flair_text,locked,media,media_embed,num_comments,num_crossposts,over_18,parent_whitelist_status,permalink,pinned,post_hint,preview,retrieved_on,score,secure_media,secure_media_embed,selftext,spoiler,stickied,subreddit,subreddit_id,subreddit_type,thumbnail,thumbnail_height,thumbnail_width,title,url,whitelist_status,suggested_sort,banned_by,edited
timothycrosley,plain,Green Lake,True,False,False,1514528719,imgur.com,https://www.reddit.com/r/SeattleWA/comments/7msmcn/green_lake_in_the_winter/,7msmcn,True,False,False,False,media,Media,False,"{'oembed': {'description': 'Post with 2 votes and 4 views. Shared by timothyedmund. Green Lake in the Winter', 'height': 550, 'html': '&lt;iframe class=""embedly-embed"" src=""//cdn.embedly.com/widgets/media.html?src=%2F%2Fimgur.com%2Fa%2F217cz%2Fembed&amp;url=https%3A%2F%2Fimgur.com%2Fa%2F217cz&amp;image=https%3A%2F%2Fi.imgur.com%2FE5JH3O9.jpg%3Ffb&amp;key=522baf40bd3911e08d854040d3dc5c07&amp;type=text%2Fhtml&amp;schema=imgur"" width=""550"" height=""550"" scrolling=""no"" frameborder=""0"" allowfullscreen&gt;&lt;/iframe&gt;', 'provider_name': 'Imgur', 'provider_url': 'http://imgur.com', 'thumbnail_height': 315, 'thumbnail_url': 'https://i.imgur.com/E5JH3O9.jpg?fb', 'thumbnail_width': 600, 'title': 'Green Lake in the Winter', 'type': 'rich', 'version': '1.0', 'width': 550}, 'type': 'imgur.com'}","{'content': '&lt;iframe class=""embedly-embed"" src=""//cdn.embedly.com/widgets/media.html?src=%2F%2Fimgur.com%2Fa%2F217cz%2Fembed&amp;url=https%3A%2F%2Fimgur.com%2Fa%2F217cz&amp;image=https%3A%2F%2Fi.imgur.com%2FE5JH3O9.jpg%3Ffb&amp;key=522baf40bd3911e08d854040d3dc5c07&amp;type=text%2Fhtml&amp;schema=imgur"" width=""550"" height=""550"" scrolling=""no"" frameborder=""0"" allowfullscreen&gt;&lt;/iframe&gt;', 'height': 550, 'scrolling': False, 'width': 550}",3,0,False,all_ads,/r/SeattleWA/comments/7msmcn/green_lake_in_the_winter/,False,link,"{'enabled': False, 'images': [{'id': 'Q14_rZLk9ajhfxifXT-Ibf_2WnEKMCSzOL9t2_MesXU', 'resolutions': [{'height': 72, 'url': 'https://i.redditmedia.com/aWdOWGNnUVXrE3SOKrZtNPzyvbKwB80tUzCrDEwCiWM.jpg?fit=crop&amp;crop=faces%2Centropy&amp;arh=2&amp;w=108&amp;s=ca2d5c39f26a7e27e8b6fce6d35da57c', 'width': 108}, {'height': 144, 'url': 'https://i.redditmedia.com/aWdOWGNnUVXrE3SOKrZtNPzyvbKwB80tUzCrDEwCiWM.jpg?fit=crop&amp;crop=faces%2Centropy&amp;arh=2&amp;w=216&amp;s=9f844e38bb5ff930e27bcbfd2b7cea7b', 'width': 216}, {'height': 213, 'url': 'https://i.redditmedia.com/aWdOWGNnUVXrE3SOKrZtNPzyvbKwB80tUzCrDEwCiWM.jpg?fit=crop&amp;crop=faces%2Centropy&amp;arh=2&amp;w=320&amp;s=19acab0d07891db3618eebfb97fd4c1f', 'width': 320}, {'height': 426, 'url': 'https://i.redditmedia.com/aWdOWGNnUVXrE3SOKrZtNPzyvbKwB80tUzCrDEwCiWM.jpg?fit=crop&amp;crop=faces%2Centropy&amp;arh=2&amp;w=640&amp;s=88bf2a317cea32fae3b8b9e2a9182647', 'width': 640}, {'height': 640, 'url': 'https://i.redditmedia.com/aWdOWGNnUVXrE3SOKrZtNPzyvbKwB80tUzCrDEwCiWM.jpg?fit=crop&amp;crop=faces%2Centropy&amp;arh=2&amp;w=960&amp;s=652c0562f96e2014a17c7b6e2aa9b03c', 'width': 960}, {'height': 720, 'url': 'https://i.redditmedia.com/aWdOWGNnUVXrE3SOKrZtNPzyvbKwB80tUzCrDEwCiWM.jpg?fit=crop&amp;crop=faces%2Centropy&amp;arh=2&amp;w=1080&amp;s=4561b2dad0f5b87d21e23608acc0cb6b', 'width': 1080}], 'source': {'height': 1504, 'url': 'https://i.redditmedia.com/aWdOWGNnUVXrE3SOKrZtNPzyvbKwB80tUzCrDEwCiWM.jpg?s=5c194800c02c6cda06c29d34509896f5', 'width': 2256}, 'variants': {}}]}",1514592727,19,"{'oembed': {'description': 'Post with 2 votes and 4 views. Shared by timothyedmund. Green Lake in the Winter', 'height': 550, 'html': '&lt;iframe class=""embedly-embed"" src=""https://cdn.embedly.com/widgets/media.html?src=%2F%2Fimgur.com%2Fa%2F217cz%2Fembed&amp;url=https%3A%2F%2Fimgur.com%2Fa%2F217cz&amp;image=https%3A%2F%2Fi.imgur.com%2FE5JH3O9.jpg%3Ffb&amp;key=2aa3c4d5f3de4f5b9120b660ad850dc9&amp;type=text%2Fhtml&amp;schema=imgur"" width=""550"" height=""550"" scrolling=""no"" frameborder=""0"" allowfullscreen&gt;&lt;/iframe&gt;', 'provider_name': 'Imgur', 'provider_url': 'http://imgur.com', 'thumbnail_height': 315, 'thumbnail_url': 'https://i.embed.ly/1/image?url=https%3A%2F%2Fi.imgur.com%2FE5JH3O9.jpg%3Ffb&amp;key=b1e305db91cf4aa5a86b732cc9fffceb', 'thumbnail_width': 600, 'title': 'Green Lake in the Winter', 'type': 'rich', 'version': '1.0', 'width': 550}, 'type': 'imgur.com'}","{'content': '&lt;iframe class=""embedly-embed"" src=""https://cdn.embedly.com/widgets/media.html?src=%2F%2Fimgur.com%2Fa%2F217cz%2Fembed&amp;url=https%3A%2F%2Fimgur.com%2Fa%2F217cz&amp;image=https%3A%2F%2Fi.imgur.com%2FE5JH3O9.jpg%3Ffb&amp;key=2aa3c4d5f3de4f5b9120b660ad850dc9&amp;type=text%2Fhtml&amp;schema=imgur"" width=""550"" height=""550"" scrolling=""no"" frameborder=""0"" allowfullscreen&gt;&lt;/iframe&gt;', 'height': 550, 'media_domain_url': 'https://www.redditmedia.com/mediaembed/7msmcn', 'scrolling': False, 'width': 550}",,False,False,SeattleWA,t5_2vbli,public,https://a.thumbs.redditmedia.com/Xjj9hLzlZQ_y4PskH9WTr9LsJ-LxVnNMHpPN5ZFDCf4.jpg,93.0,140.0,Green Lake in the Winter,https://imgur.com/a/217cz,all_ads,,,
tiff_seattle,plain,Pike-Market,True,False,False,1514525905,i.imgur.com,https://www.reddit.com/r/SeattleWA/comments/7mse89/farwest_taxi_in_pioneer_square_1947/,7mse89,True,False,False,False,history,History,False,,,5,0,False,all_ads,/r/SeattleWA/comments/7mse89/farwest_taxi_in_pioneer_square_1947/,False,image,"{'enabled': True, 'images': [{'id': 'UVPG045rO6CE--btCPI6S_dWyWIeQoEjuRl973eZnTk', 'resolutions': [{'height': 71, 'url': 'https://i.redditmedia.com/eCrCFM9NEgJtdnE7cDYFI3B77bixmZ0sw9MycRQrvMM.jpg?fit=crop&amp;crop=faces%2Centropy&amp;arh=2&amp;w=108&amp;s=c05aad2758ab5c0905ee7c1948d3e8f0', 'width': 108}, {'height': 143, 'url': 'https://i.redditmedia.com/eCrCFM9NEgJtdnE7cDYFI3B77bixmZ0sw9MycRQrvMM.jpg?fit=crop&amp;crop=faces%2Centropy&amp;arh=2&amp;w=216&amp;s=926f7aa45c0b7ab73b7848c49aa6553a', 'width': 216}, {'height': 212, 'url': 'https://i.redditmedia.com/eCrCFM9NEgJtdnE7cDYFI3B77bixmZ0sw9MycRQrvMM.jpg?fit=crop&amp;crop=faces%2Centropy&amp;arh=2&amp;w=320&amp;s=332b6eafe879392bb87a557583df23c5', 'width': 320}, {'height': 425, 'url': 'https://i.redditmedia.com/eCrCFM9NEgJtdnE7cDYFI3B77bixmZ0sw9MycRQrvMM.jpg?fit=crop&amp;crop=faces%2Centropy&amp;arh=2&amp;w=640&amp;s=3d5d55fab255117a5424fa311e430d4e', 'width': 640}, {'height': 638, 'url': 'https://i.redditmedia.com/eCrCFM9NEgJtdnE7cDYFI3B77bixmZ0sw9MycRQrvMM.jpg?fit=crop&amp;crop=faces%2Centropy&amp;arh=2&amp;w=960&amp;s=c69bcd0c0bc7e1663a7f84c02f968178', 'width': 960}, {'height': 717, 'url': 'https://i.redditmedia.com/eCrCFM9NEgJtdnE7cDYFI3B77bixmZ0sw9MycRQrvMM.jpg?fit=crop&amp;crop=faces%2Centropy&amp;arh=2&amp;w=1080&amp;s=70aff5f171f1691c6e3816a47b3bfcbe', 'width': 1080}], 'source': {'height': 2232, 'url': 'https://i.redditmedia.com/eCrCFM9NEgJtdnE7cDYFI3B77bixmZ0sw9MycRQrvMM.jpg?s=ee1472dcb37f8e124e9da7641a5cb574', 'width': 3358}, 'variants': {}}]}",1514590490,85,,,,False,False,SeattleWA,t5_2vbli,public,https://b.thumbs.redditmedia.com/hK-8u4OJT9yteMkiYqvbKZkLiRYDkTuzoFskHXyVAcI.jpg,93.0,140.0,"Farwest Taxi in Pioneer Square, 1947",https://i.imgur.com/W9pHZmH.jpg,all_ads,,,
lumpytrout,,southy,True,False,False,1514523726,self.SeattleWA,https://www.reddit.com/r/SeattleWA/comments/7ms7ju/first_costco_introduced_the_burger_which_was_cool/,7ms7ju,True,False,True,False,other,Other,False,,,25,1,False,all_ads,/r/SeattleWA/comments/7ms7ju/first_costco_introduced_the_burger_which_was_cool/,False,,,1514588673,3,,,"Costco has been testing new foods at their 4th Ave location and recently introduced a huge hamburger which was fine.  But now they have eliminated my favorite thing on the menu, the Very Berry Sundae and replaced it with a $4.99 monstrosity called the Acai Berry Sundae.  WTF Costco, bring back your old school deliciousness and dump this Acai mutant.  This is a symbol of everything that is going wrong with Seattle right now.",False,False,SeattleWA,t5_2vbli,public,self,,,"First Costco introduced the burger which was cool, but now they have gone too far",https://www.reddit.com/r/SeattleWA/comments/7ms7ju/first_costco_introduced_the_burger_which_was_cool/,all_ads,,,
Clown-Dog,,,True,False,False,1514516709,self.SeattleWA,https://www.reddit.com/r/SeattleWA/comments/7mrlhc/might_visit_seattle_for_a_week_to_sort_out_some/,7mrlhc,True,False,True,False,discussion,Discussion,False,,,28,0,False,all_ads,/r/SeattleWA/comments/7mrlhc/might_visit_seattle_for_a_week_to_sort_out_some/,False,,,1514582659,1,,,"To the point I might fly from NC to WA in the upcoming month to have some job interviews lined up, since I ultimately want to move here. Should I bother renting a car if I stay at an AirBNB or should I depend on public transport/Uber/lyft",False,False,SeattleWA,t5_2vbli,public,self,,,Might Visit Seattle for a week to sort out some job interviews. Best way to travel?,https://www.reddit.com/r/SeattleWA/comments/7mrlhc/might_visit_seattle_for_a_week_to_sort_out_some/,all_ads,,,
burlycabin,plain,Fremont,True,False,False,1514512841,sightline.org,https://www.reddit.com/r/SeattleWA/comments/7mr8ew/democrats_could_split_the_vote_in_washingtons_8th/,7mr8ew,True,False,False,False,politics,Politics,False,,,2,0,False,all_ads,/r/SeattleWA/comments/7mr8ew/democrats_could_split_the_vote_in_washingtons_8th/,False,link,"{'enabled': False, 'images': [{'id': 'uyQuMNpnrYE0hlu81HhdopiPGeTFw_auFkQ1ULSJW7g', 'resolutions': [{'height': 71, 'url': 'https://i.redditmedia.com/ov4AENbOpYNltVt6rnalwV4vwqq-9oE_rGXmvmHgmto.jpg?fit=crop&amp;crop=faces%2Centropy&amp;arh=2&amp;w=108&amp;s=34bef2fe177189feed15a7d460439050', 'width': 108}, {'height': 143, 'url': 'https://i.redditmedia.com/ov4AENbOpYNltVt6rnalwV4vwqq-9oE_rGXmvmHgmto.jpg?fit=crop&amp;crop=faces%2Centropy&amp;arh=2&amp;w=216&amp;s=08509a55f0f107bd6f160e745675987d', 'width': 216}, {'height': 213, 'url': 'https://i.redditmedia.com/ov4AENbOpYNltVt6rnalwV4vwqq-9oE_rGXmvmHgmto.jpg?fit=crop&amp;crop=faces%2Centropy&amp;arh=2&amp;w=320&amp;s=1651e15a9da60c9657823e7ed0fca9a2', 'width': 320}, {'height': 426, 'url': 'https://i.redditmedia.com/ov4AENbOpYNltVt6rnalwV4vwqq-9oE_rGXmvmHgmto.jpg?fit=crop&amp;crop=faces%2Centropy&amp;arh=2&amp;w=640&amp;s=0aca3ecbc77ad5d86ef1338c6a2008f5', 'width': 640}], 'source': {'height': 614, 'url': 'https://i.redditmedia.com/ov4AENbOpYNltVt6rnalwV4vwqq-9oE_rGXmvmHgmto.jpg?s=9676edab070a0a25eb11866d1aab3456', 'width': 922}, 'variants': {}}]}",1514579131,7,,,,False,False,SeattleWA,t5_2vbli,public,https://b.thumbs.redditmedia.com/tko5JGbwP6gRCz009nCe-TX1DO4C1rB0405yGci4GRk.jpg,93.0,140.0,Democrats Could Split the Vote in Washington’s 8th Congressional District Race,http://www.sightline.org/2017/10/04/democrats-could-split-the-vote-in-washingtons-8th-congressional-district-race/,all_ads,,,
blahblahseattle,,,True,False,False,1514509729,self.SeattleWA,https://www.reddit.com/r/SeattleWA/comments/7mqxwu/landlord_overcharging_upon_move_out/,7mqxwu,True,False,True,False,real estate,Real Estate,False,,,37,0,False,all_ads,/r/SeattleWA/comments/7mqxwu/landlord_overcharging_upon_move_out/,False,,,1514576353,9,,,"Hi Seattle. I just moved apartments. As I always do, I left my previous apartment in really shiny condition because I know landlords like to keep deposits whenever possible, and I'd heard rumor of this particular company (Pillar Properties) habitually overcharging people. So you can imagine my surprise and disgust when I got hit with a bill for nearly $1000 for ""damages"" to the apartment. They'd chosen to replace both the carpet and laminate in the entire apartment, and charge for repainting. I lived in this unit for 2 years, and in the building for 3. Here's a [link to a video](https://youtu.be/Lwm4HfBhcwI) showing the condition I left the place in. It's long, because detail matters in these kinds of things, but skip through as desired. 
Does anyone else have experience or advice from a similar situation?
Tl;dr don't rent from Pillar Properties.",False,False,SeattleWA,t5_2vbli,public,self,,,Landlord over-charging upon move out.,https://www.reddit.com/r/SeattleWA/comments/7mqxwu/landlord_overcharging_upon_move_out/,all_ads,,,
[deleted],,,True,False,False,1514508891,imgur.com,https://www.reddit.com/r/SeattleWA/comments/7mqv0e/how_grocery_store_fliers_handle_the/,7mqv0e,False,False,False,False,business,Business,False,,,5,0,False,all_ads,/r/SeattleWA/comments/7mqv0e/how_grocery_store_fliers_handle_the/,False,,,1514575688,2,,,[deleted],False,False,SeattleWA,t5_2vbli,public,default,34.0,140.0,How grocery store fliers handle the distributor-level Seattle Soda Tax - itemize it,https://imgur.com/gallery/pIE8K,all_ads,,,
wiscowonder,plain,Bainbridge Island,True,False,False,1514508285,self.SeattleWA,https://www.reddit.com/r/SeattleWA/comments/7mqswc/people_that_eat_at_taco_del_mar_why/,7mqswc,True,False,True,False,question,Question,False,,,31,0,False,all_ads,/r/SeattleWA/comments/7mqswc/people_that_eat_at_taco_del_mar_why/,False,,,1514575193,0,,,,False,False,SeattleWA,t5_2vbli,public,self,,,People that eat at Taco Del Mar — why?,https://www.reddit.com/r/SeattleWA/comments/7mqswc/people_that_eat_at_taco_del_mar_why/,all_ads,,,
pg868,,,True,False,False,1514507852,self.SeattleWA,https://www.reddit.com/r/SeattleWA/comments/7mqrf9/where_can_i_watch_the_chicago_blackhawks_game/,7mqrf9,True,False,True,False,question,Question,False,,,3,0,False,all_ads,/r/SeattleWA/comments/7mqrf9/where_can_i_watch_the_chicago_blackhawks_game/,False,,,1514574879,2,,,Preferably within 10 mins of Pike Place - will take all suggestions with or without game audio :p. ,False,False,SeattleWA,t5_2vbli,public,self,,,Where can I watch the Chicago Blackhawks game tonight at 7 near the Market,https://www.reddit.com/r/SeattleWA/comments/7mqrf9/where_can_i_watch_the_chicago_blackhawks_game/,all_ads,,,
GetFreeCash,,,True,False,False,1514506411,festival.crosscut.com,https://www.reddit.com/r/SeattleWA/comments/7mqm8u/anyone_going_to_crosscut_festival_in_february/,7mqm8u,True,False,False,False,events,Events,False,,,2,0,False,all_ads,/r/SeattleWA/comments/7mqm8u/anyone_going_to_crosscut_festival_in_february/,False,link,"{'enabled': False, 'images': [{'id': 'zTYPYTs0XWF-RSjUkjwM2wnqpBT4n4Z-d-1yxnRS3Ok', 'resolutions': [{'height': 53, 'url': 'https://i.redditmedia.com/U1s7w3_L9uBQ9A9UMft27t22lcAR_LH9s10hLPiAx6I.jpg?fit=crop&amp;crop=faces%2Centropy&amp;arh=2&amp;w=108&amp;s=8ad2eac699def9c4acd0d6b2789e7836', 'width': 108}, {'height': 106, 'url': 'https://i.redditmedia.com/U1s7w3_L9uBQ9A9UMft27t22lcAR_LH9s10hLPiAx6I.jpg?fit=crop&amp;crop=faces%2Centropy&amp;arh=2&amp;w=216&amp;s=f4e2625bb609be2db11d5d4ed0f5ad0c', 'width': 216}, {'height': 158, 'url': 'https://i.redditmedia.com/U1s7w3_L9uBQ9A9UMft27t22lcAR_LH9s10hLPiAx6I.jpg?fit=crop&amp;crop=faces%2Centropy&amp;arh=2&amp;w=320&amp;s=3088355b4c9635c9e795d14bf8412eed', 'width': 320}, {'height': 316, 'url': 'https://i.redditmedia.com/U1s7w3_L9uBQ9A9UMft27t22lcAR_LH9s10hLPiAx6I.jpg?fit=crop&amp;crop=faces%2Centropy&amp;arh=2&amp;w=640&amp;s=25c7073b5b8a1bb7a48379eed1fb12ec', 'width': 640}, {'height': 474, 'url': 'https://i.redditmedia.com/U1s7w3_L9uBQ9A9UMft27t22lcAR_LH9s10hLPiAx6I.jpg?fit=crop&amp;crop=faces%2Centropy&amp;arh=2&amp;w=960&amp;s=fddb387ff7507a7575219072d8a20ff1', 'width': 960}, {'height': 533, 'url': 'https://i.redditmedia.com/U1s7w3_L9uBQ9A9UMft27t22lcAR_LH9s10hLPiAx6I.jpg?fit=crop&amp;crop=faces%2Centropy&amp;arh=2&amp;w=1080&amp;s=b05530e56629a65d48ad8951bf807dcb', 'width': 1080}], 'source': {'height': 790, 'url': 'https://i.redditmedia.com/U1s7w3_L9uBQ9A9UMft27t22lcAR_LH9s10hLPiAx6I.jpg?s=5bdde4ec98f6284307d02719cfac7b03', 'width': 1600}, 'variants': {}}]}",1514573710,0,,,,False,False,SeattleWA,t5_2vbli,public,https://a.thumbs.redditmedia.com/_-Kq37OPPIAfyAQpEb2Iii51alxKnzxM4yalP9NvM74.jpg,69.0,140.0,Anyone going to Crosscut Festival in February? Student tickets are just $15,http://festival.crosscut.com,all_ads,,,
PedanticGoat,,,True,False,False,1514503104,self.SeattleWA,https://www.reddit.com/r/SeattleWA/comments/7mqa2w/ballard_apartments_amli_mark_24_is_terrible/,7mqa2w,True,False,True,False,discussion,Discussion,False,,,23,0,False,all_ads,/r/SeattleWA/comments/7mqa2w/ballard_apartments_amli_mark_24_is_terrible/,False,,,1514570635,1,,,"It looks nice, but this building is horrible. They like to falsely accuse people of violating their lease. Then they are incapable of listening to reason. That is on top of the ineptness of their staff and inability to fix anything on time. The door to my hallway was broken for almost a week. We had to use a large rock to keep the door accessible. This wasn't the first time that door broke too! Consistently is the right word to use here. And it always takes days to fix.  The railings are constantly broken with no signs of them actually making any effort to fix them. The paint is so thin that the chain for the blinds causes the paint to come off just by using them. My towel rack fell off the wall while I was taking my towel off it in my first couple weeks of living there. Dogs pee constantly in the hallways and it doesn't get cleaned by maintenance for weeks. Do I need to go on? Oh yeah, I do. When the bank didn't transfer our money on time, Amli decided to make our lives harder and made it so we had to pay with cashiers checks. All this dysfunction and its nearly $2k a month. One would think with all that money we're shelling out for this place that professionalism would be a given. Sadly, it is not and Amli is by far the worst building I've lived in for the decade I've been in Seattle. Run, don't walk, far away from these guys.",False,False,SeattleWA,t5_2vbli,public,self,,,Ballard Apartments - Amli Mark 24 is Terrible,https://www.reddit.com/r/SeattleWA/comments/7mqa2w/ballard_apartments_amli_mark_24_is_terrible/,all_ads,,,
cheekiemarie,,,True,False,False,1514502002,self.SeattleWA,https://www.reddit.com/r/SeattleWA/comments/7mq5vy/what_are_some_of_your_favorite_local_small/,7mq5vy,True,False,True,False,question,Question,False,,,77,0,False,all_ads,/r/SeattleWA/comments/7mq5vy/what_are_some_of_your_favorite_local_small/,False,,,1514569318,23,,,"I'm looking to start supporting smaller businesses this year rather than buying everything online or at QFC, Target, Petco, etc. So what are some of your favorites and why? I do live on the Eastside but if there's a great business in Seattle proper, I'd still love to hear about it!",False,False,SeattleWA,t5_2vbli,public,self,,,What are some of your favorite local small businesses?,https://www.reddit.com/r/SeattleWA/comments/7mq5vy/what_are_some_of_your_favorite_local_small/,all_ads,,,
Donavanm,,,True,False,False,1514497441,ricksteves.com,https://www.reddit.com/r/SeattleWA/comments/7mpo8r/rick_steves_gave_a_4_million_apartment_complex/,7mpo8r,True,False,False,False,homeless,Homeless,False,,,97,0,False,all_ads,/r/SeattleWA/comments/7mpo8r/rick_steves_gave_a_4_million_apartment_complex/,False,link,"{'enabled': False, 'images': [{'id': 'VnWRuFERa5jlacgSe3X5revTOkBbi1fWWO5gwb0z6LY', 'resolutions': [{'height': 81, 'url': 'https://i.redditmedia.com/XBMwYvl_zBznSrigKlX27SfbfG6uBcBCjCny1uB-MY0.jpg?fit=crop&amp;crop=faces%2Centropy&amp;arh=2&amp;w=108&amp;s=d6e7043866c74b0c75d29d705b271971', 'width': 108}, {'height': 162, 'url': 'https://i.redditmedia.com/XBMwYvl_zBznSrigKlX27SfbfG6uBcBCjCny1uB-MY0.jpg?fit=crop&amp;crop=faces%2Centropy&amp;arh=2&amp;w=216&amp;s=30c33f18c4c4f804e15eb24b44868076', 'width': 216}, {'height': 240, 'url': 'https://i.redditmedia.com/XBMwYvl_zBznSrigKlX27SfbfG6uBcBCjCny1uB-MY0.jpg?fit=crop&amp;crop=faces%2Centropy&amp;arh=2&amp;w=320&amp;s=989d18bd6ee73cc90f290c6cfb1a9c28', 'width': 320}], 'source': {'height': 450, 'url': 'https://i.redditmedia.com/XBMwYvl_zBznSrigKlX27SfbfG6uBcBCjCny1uB-MY0.jpg?s=bc21398d9bedeffef8b53a983de92e2e', 'width': 600}, 'variants': {}}]}",1514564451,553,,,,False,False,SeattleWA,t5_2vbli,public,https://b.thumbs.redditmedia.com/JlucT_xCskj2PCA2zvQvbkCEuQEZqVOmni9Xr6SvAzw.jpg,105.0,140.0,Rick Steves gave a $4 million apartment complex for homeless women and kids to the YWCA,https://www.ricksteves.com/about-rick/trinity-place,all_ads,,,
Gerbille,,,True,False,False,1514497326,self.SeattleWA,https://www.reddit.com/r/SeattleWA/comments/7mpnt3/fun_restaurant_for_relatives/,7mpnt3,True,False,True,False,question,Question,False,,,15,0,False,all_ads,/r/SeattleWA/comments/7mpnt3/fun_restaurant_for_relatives/,False,,,1514564330,1,,,"I have some family visiting and I'd like to take them to a restaurant that doesn't just serve your dinner on a plate. We've done Din Tai Fung, oysters, Asadero Ballard, Ethiopian, and dim sum. I'm thinking Korean BBQ might be a nice change but it's all I can come up with. Any ideas? (Not The Melting Pot.)",False,False,SeattleWA,t5_2vbli,public,self,,,Fun restaurant for relatives?,https://www.reddit.com/r/SeattleWA/comments/7mpnt3/fun_restaurant_for_relatives/,all_ads,,,
KebNes,,,True,False,False,1514495249,sonicsrising.com,https://www.reddit.com/r/SeattleWA/comments/7mpfl0/elite_eight_vote_for_seattles_nhl_team_name/,7mpfl0,True,False,False,False,sports,Sports,False,,,31,0,False,all_ads,/r/SeattleWA/comments/7mpfl0/elite_eight_vote_for_seattles_nhl_team_name/,False,link,"{'enabled': False, 'images': [{'id': 'qHaEwHZBqgGUEpzWw6B0dUZaPcHjEjaB3tjM2v4ZV2A', 'resolutions': [{'height': 56, 'url': 'https://i.redditmedia.com/3-gBd--TxSJ4QV8E-lcXM37GBFj2kmUlGgoFSW2_ESA.jpg?fit=crop&amp;crop=faces%2Centropy&amp;arh=2&amp;w=108&amp;s=3fd71746ef048ec325e73647f0298dcc', 'width': 108}, {'height': 113, 'url': 'https://i.redditmedia.com/3-gBd--TxSJ4QV8E-lcXM37GBFj2kmUlGgoFSW2_ESA.jpg?fit=crop&amp;crop=faces%2Centropy&amp;arh=2&amp;w=216&amp;s=d97668ea02ceb50a23ade9e9b5cf36b6', 'width': 216}, {'height': 167, 'url': 'https://i.redditmedia.com/3-gBd--TxSJ4QV8E-lcXM37GBFj2kmUlGgoFSW2_ESA.jpg?fit=crop&amp;crop=faces%2Centropy&amp;arh=2&amp;w=320&amp;s=26a65a4ae0cbf4f00ea4e08790bc05b4', 'width': 320}, {'height': 335, 'url': 'https://i.redditmedia.com/3-gBd--TxSJ4QV8E-lcXM37GBFj2kmUlGgoFSW2_ESA.jpg?fit=crop&amp;crop=faces%2Centropy&amp;arh=2&amp;w=640&amp;s=0b0336d47ee2097c60d56eec8e0ad349', 'width': 640}], 'source': {'height': 419, 'url': 'https://i.redditmedia.com/3-gBd--TxSJ4QV8E-lcXM37GBFj2kmUlGgoFSW2_ESA.jpg?s=da65b69d372cc3a63c3cc5dee9518415', 'width': 800}, 'variants': {}}]}",1514562093,6,,,,False,False,SeattleWA,t5_2vbli,public,https://b.thumbs.redditmedia.com/9Cyysv77Ms_aKfYGdOZ923H8OCO1PeoqNQbWkA72DNQ.jpg,73.0,140.0,Elite Eight: Vote for Seattle’s NHL Team Name,https://www.sonicsrising.com/2017/12/27/16821164/seattle-hockey-name-tournament-elite-eight,all_ads,,,
thesecretmarketer,plain,Westlake,True,False,False,1514494566,i.redd.it,https://www.reddit.com/r/SeattleWA/comments/7mpcwn/thought_this_photo_of_the_ride_the_ducks_being/,7mpcwn,True,True,False,False,other,Other,False,,,45,0,False,all_ads,/r/SeattleWA/comments/7mpcwn/thought_this_photo_of_the_ride_the_ducks_being/,False,image,"{'enabled': True, 'images': [{'id': 'gCBI2RBPTKYRxW8QDgDPBwPgfgpMApZG-i6MrC9ggvI', 'resolutions': [{'height': 81, 'url': 'https://i.redditmedia.com/EGpAuPoF6HBjBJXRpeudjDcqd9_VvE6vlNlOK8iqrNg.jpg?fit=crop&amp;crop=faces%2Centropy&amp;arh=2&amp;w=108&amp;s=42d5b5f651052692bce2402129eacf3e', 'width': 108}, {'height': 162, 'url': 'https://i.redditmedia.com/EGpAuPoF6HBjBJXRpeudjDcqd9_VvE6vlNlOK8iqrNg.jpg?fit=crop&amp;crop=faces%2Centropy&amp;arh=2&amp;w=216&amp;s=f45b16727f6ba06407e4a6b6f4106d4f', 'width': 216}, {'height': 240, 'url': 'https://i.redditmedia.com/EGpAuPoF6HBjBJXRpeudjDcqd9_VvE6vlNlOK8iqrNg.jpg?fit=crop&amp;crop=faces%2Centropy&amp;arh=2&amp;w=320&amp;s=39b576d7cd84aa406e6c00cf912732a0', 'width': 320}, {'height': 480, 'url': 'https://i.redditmedia.com/EGpAuPoF6HBjBJXRpeudjDcqd9_VvE6vlNlOK8iqrNg.jpg?fit=crop&amp;crop=faces%2Centropy&amp;arh=2&amp;w=640&amp;s=43dc0203c2f410ee02fbb0db2e084e7b', 'width': 640}, {'height': 720, 'url': 'https://i.redditmedia.com/EGpAuPoF6HBjBJXRpeudjDcqd9_VvE6vlNlOK8iqrNg.jpg?fit=crop&amp;crop=faces%2Centropy&amp;arh=2&amp;w=960&amp;s=b9bd99625fda8ba3f9ae323564eec92c', 'width': 960}, {'height': 810, 'url': 'https://i.redditmedia.com/EGpAuPoF6HBjBJXRpeudjDcqd9_VvE6vlNlOK8iqrNg.jpg?fit=crop&amp;crop=faces%2Centropy&amp;arh=2&amp;w=1080&amp;s=4beb29540c683e86eed03760403d8e5e', 'width': 1080}], 'source': {'height': 3024, 'url': 'https://i.redditmedia.com/EGpAuPoF6HBjBJXRpeudjDcqd9_VvE6vlNlOK8iqrNg.jpg?s=95ee350c742890740a62f970d5a60859', 'width': 4032}, 'variants': {}}]}",1514561295,223,,,,False,False,SeattleWA,t5_2vbli,public,https://b.thumbs.redditmedia.com/L42CBtg-xQ35BqPsKSM4Zc9EqLg-YYW71jt75VpO4KU.jpg,105.0,140.0,Thought this photo of the Ride The Ducks being towed would bring some joy to some...,https://i.redd.it/y3t2tpe08q601.jpg,all_ads,,,
drew1492,plain,West Edge (downtown),True,False,False,1514494506,seattletransitblog.com,https://www.reddit.com/r/SeattleWA/comments/7mpcoi/no_clear_consensus_on_metro_routes_34/,7mpcoi,True,False,False,False,transit,Transit,False,,,1,0,False,all_ads,/r/SeattleWA/comments/7mpcoi/no_clear_consensus_on_metro_routes_34/,False,,,1514561227,9,,,,False,False,SeattleWA,t5_2vbli,public,default,,,No Clear Consensus on Metro Routes 3/4,https://seattletransitblog.com/2017/12/28/no-clear-consensus-routes-3-4/,all_ads,,,
