[],False,kaphrahorna,,[],,text,t2_56ivzxba,False,False,[],False,False,1598115208,self.SeattleWA,https://www.reddit.com/r/SeattleWA/comments/ielxiz/wtf_happened_to_the_rainier_ave_farm_stand/,{},ielxiz,True,False,False,False,True,True,False,,,[],,,dark,text,False,False,True,20,0,False,all_ads,/r/SeattleWA/comments/ielxiz/wtf_happened_to_the_rainier_ave_farm_stand/,False,6,,1598115218,1,"Seriously, has some of the best priced and wide variety of produce in the city.  So sad to see it now",True,False,False,SeattleWA,t5_2vbli,137492,public,confidence,self,Wtf happened to the rainier ave farm stand?,0,[],1.0,https://www.reddit.com/r/SeattleWA/comments/ielxiz/wtf_happened_to_the_rainier_ave_farm_stand/,all_ads,6,,,,,,,,,,,,,,,,,
[],False,OnlineMemeArmy,,"[{'e': 'text', 't': 'The Jumping Frenchman of Maine '}]",The Jumping Frenchman of Maine ,richtext,t2_3l1oj988,False,True,[],False,False,1598114714,komonews.com,https://www.reddit.com/r/SeattleWA/comments/iels3q/seattle_business_owner_moving_shop_out_of/,{},iels3q,True,False,False,False,True,False,False,,business,"[{'e': 'text', 't': 'Business'}]",e634f09e-7a48-11e6-ad63-0e0aa093d8a1,Business,dark,richtext,False,False,True,65,0,False,all_ads,/r/SeattleWA/comments/iels3q/seattle_business_owner_moving_shop_out_of/,False,6,,1598114724,1,,False,False,False,SeattleWA,t5_2vbli,137492,public,confidence,https://a.thumbs.redditmedia.com/NuX-mDHZ3ZQOewmOmEXJJpvICNU3i0tLQMw_Se7aaD4.jpg,Seattle business owner moving shop out of downtown due to increasing violence,0,[],1.0,http://komonews.com/news/local/seattle-business-owner-moving-shop-out-of-downtown-due-to-increasing-violence,all_ads,6,#edeff1,89e2036c-d5bd-11e9-9c3f-0e58b79bcec4,dark,link,"{'enabled': False, 'images': [{'id': 'f-Xxv_42fXweozWfNTkGjpZ3ZGYxNXBiDZfAcJYe9cE', 'resolutions': [{'height': 60, 'url': 'https://external-preview.redd.it/7vzWhqTbcnPviGi_JJq4qNADQYkSSim-pkAFl3dgw8A.jpg?width=108&amp;crop=smart&amp;auto=webp&amp;s=d81477d9e5235c8b4b7df5b4320a8b25cfd4e199', 'width': 108}, {'height': 121, 'url': 'https://external-preview.redd.it/7vzWhqTbcnPviGi_JJq4qNADQYkSSim-pkAFl3dgw8A.jpg?width=216&amp;crop=smart&amp;auto=webp&amp;s=6ce7a060073c863d425238069dfc09f396d48497', 'width': 216}, {'height': 180, 'url': 'https://external-preview.redd.it/7vzWhqTbcnPviGi_JJq4qNADQYkSSim-pkAFl3dgw8A.jpg?width=320&amp;crop=smart&amp;auto=webp&amp;s=269442bcacfcf3cbe840529a435e18d7d1b9cc5a', 'width': 320}, {'height': 360, 'url': 'https://external-preview.redd.it/7vzWhqTbcnPviGi_JJq4qNADQYkSSim-pkAFl3dgw8A.jpg?width=640&amp;crop=smart&amp;auto=webp&amp;s=56c4dc60da9f36b5bd408ed4f185fcad022b60d4', 'width': 640}, {'height': 540, 'url': 'https://external-preview.redd.it/7vzWhqTbcnPviGi_JJq4qNADQYkSSim-pkAFl3dgw8A.jpg?width=960&amp;crop=smart&amp;auto=webp&amp;s=6c483c08d3649a2721b1c21ca6bdb163acb324df', 'width': 960}], 'source': {'height': 555, 'url': 'https://external-preview.redd.it/7vzWhqTbcnPviGi_JJq4qNADQYkSSim-pkAFl3dgw8A.jpg?auto=webp&amp;s=742fb788048ec9c4498179125f84ea37c01f3c35', 'width': 986}, 'variants': {}}]}",78.0,140.0,http://komonews.com/news/local/seattle-business-owner-moving-shop-out-of-downtown-due-to-increasing-violence,,,,,,,,,
[],False,rothmonogon,,[],,text,t2_7r578bxl,False,False,[],False,False,1598113689,i.redd.it,https://www.reddit.com/r/SeattleWA/comments/ielgxa/council_member_swamp_rat/,{},ielgxa,True,False,False,True,True,False,False,,politics,"[{'e': 'text', 't': 'Politics'}]",1f25eb56-9de4-11e6-884f-0e1a21b57db4,Politics,dark,richtext,False,False,True,14,0,False,all_ads,/r/SeattleWA/comments/ielgxa/council_member_swamp_rat/,False,6,,1598113701,1,,True,False,False,SeattleWA,t5_2vbli,137487,public,confidence,https://b.thumbs.redditmedia.com/9PDfEdvZ73IxpOdBMtpb22Ci2RoAQPbSHjWFnehVRGE.jpg,Council Member Swamp Rat,0,[],1.0,https://i.redd.it/hmsvotuuyki51.jpg,all_ads,6,,,,image,"{'enabled': True, 'images': [{'id': '78-vdu2cFMlRni4Y3YZRi27gfKvF-OZHPB8nXlF5oV4', 'resolutions': [{'height': 41, 'url': 'https://preview.redd.it/hmsvotuuyki51.jpg?width=108&amp;crop=smart&amp;auto=webp&amp;s=af6f10b0b7f041ff7edd140bca6a0697542dd990', 'width': 108}, {'height': 83, 'url': 'https://preview.redd.it/hmsvotuuyki51.jpg?width=216&amp;crop=smart&amp;auto=webp&amp;s=a334d99575b94f7e753e465f87d46c7a03b7bdc6', 'width': 216}, {'height': 124, 'url': 'https://preview.redd.it/hmsvotuuyki51.jpg?width=320&amp;crop=smart&amp;auto=webp&amp;s=72d712d1e340535deb55498e38856511a0e7fd21', 'width': 320}, {'height': 248, 'url': 'https://preview.redd.it/hmsvotuuyki51.jpg?width=640&amp;crop=smart&amp;auto=webp&amp;s=b0da56e9fc0810cbd1500f75a70b9da75d526cff', 'width': 640}, {'height': 372, 'url': 'https://preview.redd.it/hmsvotuuyki51.jpg?width=960&amp;crop=smart&amp;auto=webp&amp;s=fd068ad3321e25d63bc7d8062fbe8336ee4b597f', 'width': 960}], 'source': {'height': 400, 'url': 'https://preview.redd.it/hmsvotuuyki51.jpg?auto=webp&amp;s=5141ba353a542d65f362c60608875062d9e9a053', 'width': 1032}, 'variants': {}}]}",54.0,140.0,https://i.redd.it/hmsvotuuyki51.jpg,,,,,,,,,
[],False,OnlineMemeArmy,,"[{'e': 'text', 't': 'The Jumping Frenchman of Maine '}]",The Jumping Frenchman of Maine ,richtext,t2_3l1oj988,False,True,[],False,False,1598111824,capitolhillseattle.com,https://www.reddit.com/r/SeattleWA/comments/iekww7/capitol_hills_neumos_vermillion_and_century/,{},iekww7,True,False,False,False,True,False,False,,government,"[{'e': 'text', 't': 'Government'}]",01ca8b48-7a49-11e6-b552-0e18b019564b,Government,dark,richtext,False,False,True,0,0,False,all_ads,/r/SeattleWA/comments/iekww7/capitol_hills_neumos_vermillion_and_century/,False,6,,1598111834,1,,False,False,False,SeattleWA,t5_2vbli,137489,public,confidence,https://b.thumbs.redditmedia.com/Qw_OUIZIRQnjyb6qhXmi3aBz1esF1RXLR--Sqjuzk8A.jpg,"Capitol Hill’s Neumos, Vermillion, and Century Ballroom get boost from King County arts COVID-19 relief fund",0,[],1.0,https://www.capitolhillseattle.com/2020/08/capitol-hills-neumos-vermillion-and-century-ballroom-get-boost-from-king-county-arts-covid-19-relief-fund/,all_ads,6,#edeff1,89e2036c-d5bd-11e9-9c3f-0e58b79bcec4,dark,link,"{'enabled': False, 'images': [{'id': 'zPKcq6SGyFacqI4VjkRvZe6BpUO-LEfnREoTB7BSeOY', 'resolutions': [{'height': 118, 'url': 'https://external-preview.redd.it/qRKzQmnqimH60Nj5DmtYTp7v6Oyq1eLe2J0PFIG7DUk.jpg?width=108&amp;crop=smart&amp;auto=webp&amp;s=9fb02b8aa157d9dca8806f3d0e75d3360fe961c8', 'width': 108}, {'height': 237, 'url': 'https://external-preview.redd.it/qRKzQmnqimH60Nj5DmtYTp7v6Oyq1eLe2J0PFIG7DUk.jpg?width=216&amp;crop=smart&amp;auto=webp&amp;s=827a5027a50a2a892593eeba4559d259903bfd51', 'width': 216}, {'height': 351, 'url': 'https://external-preview.redd.it/qRKzQmnqimH60Nj5DmtYTp7v6Oyq1eLe2J0PFIG7DUk.jpg?width=320&amp;crop=smart&amp;auto=webp&amp;s=a90093e16272f941e93793cd51a40b71df7b9372', 'width': 320}, {'height': 703, 'url': 'https://external-preview.redd.it/qRKzQmnqimH60Nj5DmtYTp7v6Oyq1eLe2J0PFIG7DUk.jpg?width=640&amp;crop=smart&amp;auto=webp&amp;s=1e1a5953a2d1d85220b25aee9263c7a7ad81b04a', 'width': 640}], 'source': {'height': 756, 'url': 'https://external-preview.redd.it/qRKzQmnqimH60Nj5DmtYTp7v6Oyq1eLe2J0PFIG7DUk.jpg?auto=webp&amp;s=e91a9d8fb9d7ea59f8b51bb026269bdb676b3eff', 'width': 688}, 'variants': {}}]}",140.0,140.0,https://www.capitolhillseattle.com/2020/08/capitol-hills-neumos-vermillion-and-century-ballroom-get-boost-from-king-county-arts-covid-19-relief-fund/,,,,,,,,,
[],False,SillyMeSea,,[],,text,t2_52gi37d1,False,False,[],False,False,1598105802,seattletimes.com,https://www.reddit.com/r/SeattleWA/comments/iej74m/boeings_787_choice_could_gut_washington_states/,{},iej74m,True,False,False,False,True,False,False,,business,"[{'e': 'text', 't': 'Business'}]",e634f09e-7a48-11e6-ad63-0e0aa093d8a1,Business,dark,richtext,False,False,True,77,0,False,all_ads,/r/SeattleWA/comments/iej74m/boeings_787_choice_could_gut_washington_states/,False,6,,1598105813,1,,True,False,False,SeattleWA,t5_2vbli,137488,public,confidence,https://b.thumbs.redditmedia.com/kenOEclaxol26CTjE9g6b7lr95WsDBPsCEkXXalflHM.jpg,Boeing’s 787 choice could gut Washington state’s aircraft industry,0,[],1.0,https://www.seattletimes.com/business/boeing-aerospace/boeings-787-choice-could-gut-washington-states-aircraft-industry/,all_ads,6,,,,link,"{'enabled': False, 'images': [{'id': 'xrsAjNI-KH-tgzwSl8wGoxRsYWBekkTZtZHCKyhordg', 'resolutions': [{'height': 69, 'url': 'https://external-preview.redd.it/CLioiFoBslWNP1ER-S2pOUar9dfO9vrTYEznh1-aKUw.jpg?width=108&amp;crop=smart&amp;auto=webp&amp;s=7cae8ba4992e09e55f0a3d55591ec27eea8bda1b', 'width': 108}, {'height': 138, 'url': 'https://external-preview.redd.it/CLioiFoBslWNP1ER-S2pOUar9dfO9vrTYEznh1-aKUw.jpg?width=216&amp;crop=smart&amp;auto=webp&amp;s=a0eba1141d94e0a9210eabe022aa905e924b1551', 'width': 216}, {'height': 205, 'url': 'https://external-preview.redd.it/CLioiFoBslWNP1ER-S2pOUar9dfO9vrTYEznh1-aKUw.jpg?width=320&amp;crop=smart&amp;auto=webp&amp;s=849e5a078ddd3c2d7e65e16dae189b34680e5301', 'width': 320}], 'source': {'height': 241, 'url': 'https://external-preview.redd.it/CLioiFoBslWNP1ER-S2pOUar9dfO9vrTYEznh1-aKUw.jpg?auto=webp&amp;s=1057ea5b2bbff8a01a8f4344c1b45ec68bdffd91', 'width': 375}, 'variants': {}}]}",89.0,140.0,https://www.seattletimes.com/business/boeing-aerospace/boeings-787-choice-could-gut-washington-states-aircraft-industry/,,,,,,,,,
[],False,brakos,,[],,text,t2_6hxei,False,False,[],False,False,1598089313,self.SeattleWA,https://www.reddit.com/r/SeattleWA/comments/iefo7r/my_late_night_ramblings_about_seattle_the_city/,{},iefo7r,True,False,True,False,True,True,False,,other,"[{'e': 'text', 't': 'Other'}]",b5108792-0e6a-11e7-a3b3-0e2e93dbfc84,Other,dark,richtext,False,False,True,7,0,False,all_ads,/r/SeattleWA/comments/iefo7r/my_late_night_ramblings_about_seattle_the_city/,False,6,,1598089327,1,"Maybe it’s the ""what if"" thoughts going through my head right now that’s led me to write this. Maybe it’s the fact that my twenties are nearly over. Maybe it’s the quarantine. Maybe it’s just simple nostalgia. I don’t know.

But tonight, I feel I need to reflect on the city that made me who I am today. Seattle, Washington.

I was born and raised in Port Orchard and Bremerton. No matter what, that will always be my hometown, familiar territory. There will always be the bowling alley, the elementary school I went to, and Grandma’s house. But that’s not what this story is about.

This story probably begins earlier than I feel it should, but it’s my first true memory of Seattle. A journey with my grandparents to see the Mariners play at the Kingdome for my seventh birthday. There might only be three things I can remember about that day: The Mariners won and scored at least 10 runs (I think it was 11). I was very intrigued by the scoreboard, but I loved technology like that back then. The bus ride back to some park and ride south of the city was probably the most memorable. I had no idea buses could even bend in the middle, so of course I sat on that sideways-facing seat. A seven-year-old boy, probably wearing a Mariners hat and shirt, completely fascinated by the fact that two halves of a bus could twist and turn and not break. And being in a vehicle with complete strangers seemed so foreign at the time. But it was all new, so it was cool.

Fast forward to when I was ten or eleven. My mom and I took the ferry over to downtown Seattle. Definitely a summer day, it was uncomfortable in the days that air conditioning was a luxury in the northwest. We went to the aquarium, some lemonade cart that’s probably long gone, Pike Place Market (when you’re still a kid, those stairs from the waterfront feel like they go on forever by the way), the Monorail, and the Space Needle. Interestingly enough, I don’t think I’ve been up to the top since. I later learned of much better view points. The tall buildings made me completely disoriented, which is how my present-day partner feels when she’s downtown.

A year or two later, I think sixth grade, my class took a field trip to EMP. I grew up on the peninsula in the nineties, all I really was comfortable with was country music at that point, so I really didn’t get much out of it. All I could remember was loathing the pop music of the time, and not realizing there’s more than just what’s on the pop stations and country. But we’ll save that for another paragraph.

I ran off to Seattle for the first time when I was fifteen I think. Looking back, probably a stupid idea. But aren’t most ideas when you’re fifteen. It was actually just for a couple hours, I mostly wanted to go to the sporting goods store on the waterfront and find some hats. They weren’t even Seattle-based teams, which is probably why I didn’t just go to the mall in Silverdale. I still have no idea if my folks knew that I went to Seattle. I never got in trouble if they did.

Jonathon, if you’re reading this, I still remember you scaring the shit out of me coming back from a Mariners game we went to in 2008 with Mr. Phillips’s marketing class.

In high school, I longed to get out. Maybe too much. I wanted to move to Texas and go to college to learn to be computer graphics designer. I don’t think I ever managed to be more specific than that. Spoiler alert: I didn’t move to Texas. I didn’t become a graphics designer. Plus I’m colorblind so it probably would have been difficult anyways. But somehow the city that made me who I am today was only a ferry ride away.

I guess the story really starts here. And before I even visited Seattle as an adult. Throughout high school, I discovered so much interesting music thanks to some less than legal avenues with names bearing citrus fruits. Eventually I found some bands I liked, which led me to a few more similar ones, and so on. At some point I stumbled upon The Postal Service and Death Cab for Cutie. I had no idea they were from Seattle for months, maybe even a year or two. It was comforting, relaxing, and resonated with me. Honestly it still does all these years later. I swear this will tie in eventually.

Jump ahead a while, it’s the fall of 2010. I found a live performance of a radio program in Seattle I really wanted to go to. I saved up some money and made the journey out there. Hopped on the ferry, and sailed off. I was 19, the grimy city I never understood was simultaneously both more and less foreboding than it was when I was a kid. At some point, I remember helping an older woman take some stuff to her apartment. I don’t know if this has any significance, but I just remembered it.

Bus route 11, which later on I became much more familiar with, was a mystery at that point. The first one that came by, I didn’t even know where to catch it at. I knew it was a corner of 1st Avenue… somewhere. But I missed it somehow, so had to wait another 15 minutes or whatever it was. At this point I was glad buses ran more than once an hour like they do in Port Orchard.  

By the time I got to the other side of the city, I was getting pretty hungry. I found The Independent Pizzeria. I have no idea if it still exists or not, the few times I thought to look it up again, they were either closed for the season or our schedules didn’t align. I should go back if it's still around. The hole-in-the-wall atmosphere was charming and cozy. The smell of pizza definitely helped matters.

A few minutes in there, I heard a familiar tune: Such Great Heights. I was home at that moment. To this day it’s still my favorite Postal Service song, probably because of that memory. I don’t even remember the show anymore, or the journey back onto the ferry. I felt comfortable. I had a place I belonged.

My first year I lived in Bellevue, compared to the peninsula it was close enough for me. I still visited Seattle a few nights a week: board game nights, pick-up football games, playing tourist on occasion. I had a close-knit group of friends, one of which I was dating. At twenty years old, I felt like I had it all.

My grandmother passed away in September that year. I had just moved into Bellevue in August, but was visiting her in Bremerton a few times a week. I still remember one night, coming back on the ferry to Seattle. The sky was glowing green from all the city lights. I had my mp3 player on, and What Sarah Said came on next. That song still reminds me of both my grandmother and that ferry ride to this day. I think that might have been the last night I saw her too.

The next year, the city kicked me out. It was my own undoing no doubt about it, and I’m not going into details here. But I moved back home, and was ready to get back out as soon as I could. Three months later, I was back in the city. The big one this time. Seattle.

It was an old turn-of-the-century apartment I shared with a couple roommates. The space was cramped, but it was mine. Plus I was about five blocks from downtown. Admittedly these few years I was only at home to shower and sleep, constantly bouncing around the city. Last I checked, the building got torn down and replaced with some massive office space.

I lived there for three years. In that time, I truly discovered myself. I came to terms with my identity, my sexuality, my health, what I liked and disliked. I was in the best shape of my life, walking up and down the hills probably had a lot to do with that. My groups of friends rotated through the years: from one board game group to the next, that group of exchange students I met on their way to North Bend, the sports bar where I spent so many Sunday afternoons downing hot dogs with bizarre toppings. I jumped from job to job: cashiering, tour guide, furniture store sales, and too much online stuff to keep track of. I never got rich or even close to it, just enough to squeak by on what I had. It was enough for me.

I met my current partner at the end of 2013. Our first ""date"" was me showing her around Seattle, since she lived an hour away and had never really been in the city. I don’t think either one of us envisioned a full-fledged relationship, but after showing her around the city I called home, and a few other trips around the area, we were together and have been ever since. I guess you could say Seattle caused my relationship too.

Remember that Mariners game I went to on my seventh birthday? Well, one day my partner and some of my family (including my 3 year old cousin) got to go to a Mariners game at Safeco in 2015. A nice Wednesday day game. Pretty memorable for being a nice family outing, and really memorable for it being Iwakuma's no-hitter. It was purely dumb luck that it was that game we went to. I should remind them about that next time I visit.

Fate and circumstance took me away from the city again. I moved in with my partner outside of town, then we moved down to Vancouver, and we may soon be moving again. 

Unfortunately, not back to Seattle.

I still miss the ferry rides to visit my family, the chaos of downtown, and the relatively laid back atmospheres of Fremont and Ballard. I miss meandering through the UW campus, or grabbing lunch at Pike Place, Tat’s, or Pagliacci’s. I miss the walk around Discovery Park, and going to Lincoln Park in Fauntleroy after it’s officially closed, watching the last ferry head out towards my home town at two in the morning. I miss the eerily quiet early weekend mornings in downtown, when the night owls have fallen asleep, and the morning people haven’t quite woken up yet. I miss playing flag football at Roosevelt High on Saturday mornings, though my shoulders and knees definitely don’t. I miss taking the bus to North Bend to get away from it all when the city got too overwhelming. I hope the bakery there is still as good as I remember it being.

I still visit here and there, work not included. I try to make it to Folklife every year, but obviously that didn’t happen this year, and who knows about next year.

Even though I don’t live there anymore, Seattle will always be the city that built me, for better or worse. And I’m okay with that. Maybe I'm happy about that. I just hope I’ll be back again soon.",True,False,False,SeattleWA,t5_2vbli,137481,public,confidence,self,My late night ramblings about Seattle: The city that built me.,0,[],1.0,https://www.reddit.com/r/SeattleWA/comments/iefo7r/my_late_night_ramblings_about_seattle_the_city/,all_ads,6,,,,,,,,,,,,,,,,,
[],False,iCyber,,[],,text,t2_66snz,False,False,[],False,False,1598088673,self.SeattleWA,https://www.reddit.com/r/SeattleWA/comments/iefk7j/i_have_my_own_hookah_but_i_live_in_a_smokefree/,{},iefk7j,True,False,False,False,True,True,False,,question,"[{'e': 'text', 't': 'Question'}]",deb2d6c4-0e68-11e7-b2bd-0e2e93dbfc84,Question,dark,richtext,False,False,True,16,0,False,all_ads,/r/SeattleWA/comments/iefk7j/i_have_my_own_hookah_but_i_live_in_a_smokefree/,False,6,,1598088684,1,"Not a hookah lounge, but like a quiet yard/site/camp etc Just myself and a friend. Since we're still trying to isolate but crave a shisha/hookah smoke...  


And yes, I'm fully aware that smoking is bad, but it's part of my culture to have a hookah once in a while as a socializing method. But I also do not want to break rules.

PS: I have a dog.",True,False,False,SeattleWA,t5_2vbli,137480,public,confidence,self,"I have my own Hookah, but I live in a smoke-free apartment. Where can I legally go to enjoy my smoking session outdoors these days?",0,[],1.0,https://www.reddit.com/r/SeattleWA/comments/iefk7j/i_have_my_own_hookah_but_i_live_in_a_smokefree/,all_ads,6,,,,,,,,,,,,,,,,,
[],False,Frontdeskguy1,,[],,text,t2_3kavpl4s,False,False,[],False,False,1598087674,self.SeattleWA,https://www.reddit.com/r/SeattleWA/comments/iefe5y/tired_of_the_fast_and_the_furious_wannabes_every/,{},iefe5y,True,False,False,False,True,True,False,,business,"[{'e': 'text', 't': 'Business'}]",e634f09e-7a48-11e6-ad63-0e0aa093d8a1,Business,dark,richtext,False,False,True,33,0,False,all_ads,/r/SeattleWA/comments/iefe5y/tired_of_the_fast_and_the_furious_wannabes_every/,False,6,,1598087684,1,8/14 &amp; 8/21 Multiple cars block off intersection at S King and 2nd Ave 11:30AM-12:40AM.  Donuts squealing engines.  I get it you are young and want to have fun but there are also residents and people visiting the City who are getting fed up with it.  I work overnight at a 282 room hotel down here and am ready to quit cause of this shit.   Guests lose their minds and its not fun trying to pacify them. I know the police are hanging out 4 blocks away watching it unfold.  Police want people to get upset with situation to push their cause that this is what city will become without police.  Idiots in cars know police are just burnt out and have been neutered so they will continue to pull this shit.  It's going to take a person getting shot or run over to change the weekend madness that has honestly only gotten bad in the last month or two.   Worked here for 2 years.  Apart from the rowdy bar groups it was never this damn bad.  GROW UP.,True,False,False,SeattleWA,t5_2vbli,137479,public,confidence,self,Tired of the Fast and the Furious Wannabe's Every Friday in Pioneer Square.,0,[],1.0,https://www.reddit.com/r/SeattleWA/comments/iefe5y/tired_of_the_fast_and_the_furious_wannabes_every/,all_ads,6,,,,,,,,,,,,,,,,,
