[],False,rumbygum,,[],,text,t2_34pzm,False,[],False,False,1572125614,self.Seattle,https://www.reddit.com/r/Seattle/comments/dnk4n0/going_trick_or_treating_at_neighborhood_sponsored/,{},dnk4n0,True,False,False,False,True,True,False,,,[],,,dark,text,False,False,True,7,0,,,False,all_ads,/r/Seattle/comments/dnk4n0/going_trick_or_treating_at_neighborhood_sponsored/,False,6,1572125615,11,"I was at the Greenwood Trick or Treat today and couldn't believe how many clueless parents were shoving their strollers through throngs of kids on the narrow sidewalks. Often the strollers were empty, with their occupants going door to door getting candy. Many of the strollers contained babies too young to eat candy, but fat mom and dad decided to cash in, shoving their stroller through kids to get up to the folks handing out candy.

Several dads decided to be militant about it and were slamming their strollers into the legs of kids in front of them, or forcing small children into the street without so much as an ""excuse me"". Multiple strollers would line up and form a blockade so kids couldn't get through to get to the candy, and many other stroller pushers seem to be unaware of keeping to the right, and instead plowed through foot traffic in the opposite direction.

Meanwhile kids are wearing costumes that are hard to see in, may have cumbersome tails or inflatable portions, and the stroller pushers have no regard for them. Indeed, they get ANGRY that people are in THEIR way, despite the fact that they are the ones pushing an empty double-wide through a crowd and expecting the same deference that an ambulance gets with its sirens on blast.

If your kid is small enough to need a stroller to get around, just carry them. Put them on your back, in a a carrier or in a moby. If they can't walk, they really don't need that much candy, no need to cart them around just so you can sit your fat ass in front of the TV later with a bucket of crap that your kid can't even eat.

Leave your strollers at home on Halloween too!",True,False,[],False,Seattle,t5_2qhad,176540,public,self,Going Trick or Treating at neighborhood sponsored events? Leave your stroller at home!,0,1572295266,https://www.reddit.com/r/Seattle/comments/dnk4n0/going_trick_or_treating_at_neighborhood_sponsored/,all_ads,6,,,,,,,,,,,,,
[],False,TAKE-MY-MONEY-,,[],,text,t2_3lx4sye1,False,[],False,False,1572124791,i.redd.it,https://www.reddit.com/r/Seattle/comments/dnjy97/it_be_like_that_with_99/,{},dnjy97,True,False,False,True,True,False,False,,flair,"[{'e': 'text', 't': 'Media'}]",,Media,dark,richtext,False,False,True,69,0,,,False,all_ads,/r/Seattle/comments/dnjy97/it_be_like_that_with_99/,False,6,1572124793,1527,,True,False,[],False,Seattle,t5_2qhad,176539,public,https://b.thumbs.redditmedia.com/dqiT5pvuXqfvjKMait2Qb_alScSuVwAiGiyplSu36DY.jpg,It be like that with 99,0,1572294946,https://i.redd.it/zncfod7ncyu31.jpg,all_ads,6,image,"{'enabled': True, 'images': [{'id': 'p2NvU4TpQJxbr7-DjEZNrqh9kZ6MXRNv4M82b3RqcMw', 'resolutions': [{'height': 132, 'url': 'https://preview.redd.it/zncfod7ncyu31.jpg?width=108&amp;crop=smart&amp;auto=webp&amp;s=a4754f77ed09428108b1a02410970c974fcf6b76', 'width': 108}, {'height': 265, 'url': 'https://preview.redd.it/zncfod7ncyu31.jpg?width=216&amp;crop=smart&amp;auto=webp&amp;s=1a111791a5996eda10de63bf944ab4079e40d464', 'width': 216}, {'height': 393, 'url': 'https://preview.redd.it/zncfod7ncyu31.jpg?width=320&amp;crop=smart&amp;auto=webp&amp;s=a47cfc4be71362f8cb3df93a18fc4f962b9f11ee', 'width': 320}, {'height': 787, 'url': 'https://preview.redd.it/zncfod7ncyu31.jpg?width=640&amp;crop=smart&amp;auto=webp&amp;s=7b92e922b0806d07fbe6454ab37c969374ecfb78', 'width': 640}], 'source': {'height': 960, 'url': 'https://preview.redd.it/zncfod7ncyu31.jpg?auto=webp&amp;s=4aed25acc7a3dfe5e497d2f5e7fa68c5675101a2', 'width': 780}, 'variants': {}}]}",140.0,140.0,,,,,,,,,
[],False,woodclapping,,[],,text,t2_3zzgn7e3,False,[],False,False,1572124509,self.Seattle,https://www.reddit.com/r/Seattle/comments/dnjw04/public_pianos/,{},dnjw04,True,False,False,False,True,True,False,,,[],,,dark,text,False,False,True,2,0,,,False,all_ads,/r/Seattle/comments/dnjw04/public_pianos/,False,6,1572124510,0,Is there anyone in Seattle that has public pianos / practice rooms? I’m a complete fiend right now to play and all the ones at the public library are booked.,True,False,[],False,Seattle,t5_2qhad,176538,public,self,Public Pianos,0,1572294915,https://www.reddit.com/r/Seattle/comments/dnjw04/public_pianos/,all_ads,6,,,,,,,,,,,,,
[],False,Severe_Duty,,[],,text,t2_38v5twtl,False,[],False,False,1572124264,self.Seattle,https://www.reddit.com/r/Seattle/comments/dnju34/survey_regarding_how_the_weather_impacts_your_mood/,{},dnju34,True,False,False,False,True,True,False,,,[],,,dark,text,False,False,True,7,0,,,False,all_ads,/r/Seattle/comments/dnju34/survey_regarding_how_the_weather_impacts_your_mood/,False,6,1572124266,1,"Hello everybody, we're a group of students from the University of Washington, currently enrolled in the Informatics 200 course. My group is working on a project right now studying how the weather may impact your mood, and if you could fill out this quick survey, it would really help us out!

&amp;#x200B;

\*\*THANKS A LOT!\*\*

&amp;#x200B;

[https://forms.gle/5LcJuvTczmUApWdg6](https://forms.gle/5LcJuvTczmUApWdg6)",True,False,[],False,Seattle,t5_2qhad,176538,public,self,Survey regarding how the weather impacts your mood,0,1572294887,https://www.reddit.com/r/Seattle/comments/dnju34/survey_regarding_how_the_weather_impacts_your_mood/,all_ads,6,self,"{'enabled': False, 'images': [{'id': '-S1LV_FW9henuBorPLB28DHtVh87sussFo31pb4Ln70', 'resolutions': [{'height': 56, 'url': 'https://external-preview.redd.it/58E-BTClQinmVHRFRixQgGA3wOkpvWNlAAH_udZE5D8.jpg?width=108&amp;crop=smart&amp;auto=webp&amp;s=07eaeb78836ca7c70ffae1feba3861ec5b73df61', 'width': 108}, {'height': 113, 'url': 'https://external-preview.redd.it/58E-BTClQinmVHRFRixQgGA3wOkpvWNlAAH_udZE5D8.jpg?width=216&amp;crop=smart&amp;auto=webp&amp;s=617023b86624fbb492461b26e36476dcf3d3ae2f', 'width': 216}, {'height': 168, 'url': 'https://external-preview.redd.it/58E-BTClQinmVHRFRixQgGA3wOkpvWNlAAH_udZE5D8.jpg?width=320&amp;crop=smart&amp;auto=webp&amp;s=d211c744924ca10377877baafd859cd65ce946b2', 'width': 320}, {'height': 336, 'url': 'https://external-preview.redd.it/58E-BTClQinmVHRFRixQgGA3wOkpvWNlAAH_udZE5D8.jpg?width=640&amp;crop=smart&amp;auto=webp&amp;s=12d7a971008c7932c1b3d0511e48af6bd122f3ac', 'width': 640}, {'height': 504, 'url': 'https://external-preview.redd.it/58E-BTClQinmVHRFRixQgGA3wOkpvWNlAAH_udZE5D8.jpg?width=960&amp;crop=smart&amp;auto=webp&amp;s=8ef34284d9f81aa29c7d5602ea1d199a864ea353', 'width': 960}, {'height': 567, 'url': 'https://external-preview.redd.it/58E-BTClQinmVHRFRixQgGA3wOkpvWNlAAH_udZE5D8.jpg?width=1080&amp;crop=smart&amp;auto=webp&amp;s=5a5bee2b121fbb4289af094e99bbdc745479e0df', 'width': 1080}], 'source': {'height': 630, 'url': 'https://external-preview.redd.it/58E-BTClQinmVHRFRixQgGA3wOkpvWNlAAH_udZE5D8.jpg?auto=webp&amp;s=807c7b384d0089143bbf1c5352f10c79e0967011', 'width': 1200}, 'variants': {}}]}",,,,,,,,,,,
[],False,Kibbo20,,[],,text,t2_3c7zq2hi,False,[],False,False,1572119880,self.Seattle,https://www.reddit.com/r/Seattle/comments/dniwel/anyone_who_moved_from_co_to_seattle_have_an/,{},dniwel,True,False,False,False,True,True,False,,,[],,,dark,text,False,False,True,18,0,,,False,all_ads,/r/Seattle/comments/dniwel/anyone_who_moved_from_co_to_seattle_have_an/,False,6,1572119881,0,"Trying to get my parents to move to Seattle, money is a problem mom has a law degree and could get something thanks to the large job  opportunities. My parents just want to stay info and if anyone has any stories I could use for convincing?",True,False,[],False,Seattle,t5_2qhad,176537,public,self,Anyone who moved from CO to Seattle have an opinion after living there?,0,1572294130,https://www.reddit.com/r/Seattle/comments/dniwel/anyone_who_moved_from_co_to_seattle_have_an/,all_ads,6,,,,,,,,,,,,,
[],False,SeattlePubCrawls,,[],,text,t2_zo4y7,False,[],False,False,1572111910,eventbrite.com,https://www.reddit.com/r/Seattle/comments/dnh5ww/9th_annual_halloween_pub_crawl_is_happening_all/,{},dnh5ww,True,False,False,False,True,False,False,,,[],,,dark,text,False,False,True,3,0,,,False,all_ads,/r/Seattle/comments/dnh5ww/9th_annual_halloween_pub_crawl_is_happening_all/,False,6,1572111912,0,,True,False,[],False,Seattle,t5_2qhad,176529,public,default,9th annual Halloween Pub Crawl is happening all day from Downtown to Pioneer Square today!,0,1572292501,https://www.eventbrite.com/e/halloween-pub-crawl-2019-day-2-tickets-70062580063,all_ads,6,,,,,,,,,,,,,
[],False,torrenceofarabia,,[],,text,t2_wmyw7,False,[],False,False,1572111543,self.Seattle,https://www.reddit.com/r/Seattle/comments/dnh2so/any_sam_members_going_to_sam_remix_on_nov_15/,{},dnh2so,True,False,False,False,True,True,False,,,[],,,dark,text,False,False,True,11,0,,,False,all_ads,/r/Seattle/comments/dnh2so/any_sam_members_going_to_sam_remix_on_nov_15/,False,6,1572111543,6,"SAM Remix is a 21+ event at the art museum where there will be live music, artists, art creation stations and more. I’m a new member and would love to meet some of you there.",True,False,[],False,Seattle,t5_2qhad,176528,public,self,Any SAM members going to SAM Remix on Nov. 15?? Would love to meet some new friends!,0,1572292457,https://www.reddit.com/r/Seattle/comments/dnh2so/any_sam_members_going_to_sam_remix_on_nov_15/,all_ads,6,,,,,,,,,,,,,
[],False,TacTownMBox,,[],,text,t2_15xv8a,False,[],False,False,1572109778,self.Seattle,https://www.reddit.com/r/Seattle/comments/dngoe2/im_interested_in_finding_a_scenic_fall_walking/,{},dngoe2,True,False,False,False,True,True,False,,,[],,,dark,text,False,False,True,5,0,,,False,all_ads,/r/Seattle/comments/dngoe2/im_interested_in_finding_a_scenic_fall_walking/,False,6,1572109782,0,Where should I go? I live in South Seattle and these gorgeous fall days are too beautiful to not be outside. Where should I go? Thanks in advance.,True,False,[],False,Seattle,t5_2qhad,176527,public,self,Im interested in finding a scenic fall walking trail.,0,1572292240,https://www.reddit.com/r/Seattle/comments/dngoe2/im_interested_in_finding_a_scenic_fall_walking/,all_ads,6,,,,,,,,,,,,,
[],False,laynster,,[],,text,t2_6wg4a,False,[],False,False,1572109375,i.redd.it,https://www.reddit.com/r/Seattle/comments/dngl0s/snuck_this_picture_of_the_space_needle_on_capitol/,{},dngl0s,True,False,False,True,True,False,False,,flair,"[{'e': 'text', 't': 'Media'}]",,Media,dark,richtext,False,False,True,2,0,,,False,all_ads,/r/Seattle/comments/dngl0s/snuck_this_picture_of_the_space_needle_on_capitol/,False,6,1572109377,0,,True,False,[],False,Seattle,t5_2qhad,176526,public,default,Snuck this picture of the space needle on Capitol Hill last night. I love this city!,0,1572291967,https://i.redd.it/p7d1zg5n2xu31.png,all_ads,6,,,,,,,,,,,,,
[],False,TheItinerantSkeptic,,[],,text,t2_ovdha,False,[],False,False,1572108994,i.redd.it,https://www.reddit.com/r/Seattle/comments/dnghsh/legal_to_park_except_on_sundays_or/,{},dnghsh,True,False,False,True,True,False,False,,flair,"[{'e': 'text', 't': 'Question'}]",9b95cc16-44bf-11e6-aba4-0e42ab5b9d91,Question,dark,richtext,False,False,True,8,0,,,False,all_ads,/r/Seattle/comments/dnghsh/legal_to_park_except_on_sundays_or/,False,6,1572108996,8,,True,False,[],False,Seattle,t5_2qhad,176524,public,https://a.thumbs.redditmedia.com/QLAhWtV_wIPoUzLV-MGS3ywRMq12XkH0Rvr5KNJFNk4.jpg,"Legal to Park EXCEPT On Sundays, Or...?",0,1572291923,https://i.redd.it/vjct3s5o1xu31.png,all_ads,6,image,"{'enabled': True, 'images': [{'id': 'dhRqqFPj_aeuvhNHjLX6LziFLR4TQrY077ZwlfXtigg', 'resolutions': [{'height': 78, 'url': 'https://preview.redd.it/vjct3s5o1xu31.png?width=108&amp;crop=smart&amp;auto=webp&amp;s=bd53e8d06b34c3ec19300c6c5ea3798538195bd3', 'width': 108}, {'height': 157, 'url': 'https://preview.redd.it/vjct3s5o1xu31.png?width=216&amp;crop=smart&amp;auto=webp&amp;s=883aed865b1b130d15958a70b00f7273f8528d7a', 'width': 216}, {'height': 233, 'url': 'https://preview.redd.it/vjct3s5o1xu31.png?width=320&amp;crop=smart&amp;auto=webp&amp;s=6165b3e189132fa0e42475d3a4ec1de0a25cfdf9', 'width': 320}], 'source': {'height': 250, 'url': 'https://preview.redd.it/vjct3s5o1xu31.png?auto=webp&amp;s=14fd0f6b0911145271844e3a5fdd10c9071ecbcc', 'width': 343}, 'variants': {}}]}",102.0,140.0,,,,,,,,,
[],False,littletonothinghere,,[],,text,t2_3yiaiadl,False,[],False,False,1572106854,self.Seattle,https://www.reddit.com/r/Seattle/comments/dng0aa/a_favor_to_ask_about_travel_logistics_in_wa_and/,{},dng0aa,True,False,False,False,True,True,False,,,[],,,dark,text,False,False,True,13,0,,,False,all_ads,/r/Seattle/comments/dng0aa/a_favor_to_ask_about_travel_logistics_in_wa_and/,False,6,1572106854,0,"Hi guys, 

My sister has a few interviews coming up for residency and I wanted to ask if you guys had any helpful tips on how to get to each with cost in mind. Will have to train, shuttle, or take bus, or uber/lyft in between each destination.

She will be flying out from EWR or JFK most likely. 

1st Interview on Dec 10th at St Peters (931 S Market Blvd,   Chehalis, WA 98532)

Sleep one night somewhere in between?

2nd Interview on Dec 12th at SeaMar (9710 State Ave, Marysville, Wa 98270).

Is it best to fly to PDX and get to Chehalis? Or is it best to fly to SEATAC? And between each is there a transportation shuttle?

Thank you so much in advance!
Cheers",True,False,[],False,Seattle,t5_2qhad,176522,public,self,A favor to ask about Travel Logistics in WA and Portland,0,1572291666,https://www.reddit.com/r/Seattle/comments/dng0aa/a_favor_to_ask_about_travel_logistics_in_wa_and/,all_ads,6,,,,,,,,,,,,,
[],False,life-space,,[],,text,t2_4fx0unta,False,[],False,False,1572102302,self.Seattle,https://www.reddit.com/r/Seattle/comments/dnf0b3/dear_seattle_i_miss_you/,{},dnf0b3,True,False,False,False,True,True,False,,,[],,,dark,text,False,False,True,254,0,,,False,all_ads,/r/Seattle/comments/dnf0b3/dear_seattle_i_miss_you/,False,6,1572103158,539,"i moved to california, and regretted the decision immediately. i'm now always broke, the sun is always in my eyes, it's noisy as hell, the air quality is horrible due to the yearly wildfires and constant exposure to car exhaust, there are no trees, the only people who can afford to live here appear to be wealthy adult children or finance bros.

i miss the trees, the rain, wearing sweaters, night and darkness, kind regard for pedestrians crossing the street, affordable organic produce, studio apartments, humble people, mount ranier, the smell of the ocean, ravenna park, quiet, gardens, good coffee, fall and winter.

here, the leaves don't really change. they just remain an ugly shade of green, or they fall off of the trees. yesterday, it was 80 degrees. it's almost november.

:-(",True,False,[],False,Seattle,t5_2qhad,176521,public,self,"dear seattle, i miss you",0,1572290671,https://www.reddit.com/r/Seattle/comments/dnf0b3/dear_seattle_i_miss_you/,all_ads,6,,,,,,,,,,,,,
[],False,godsfav-customer,,[],,text,t2_2ct2trv3,False,[],False,False,1572081730,self.Seattle,https://www.reddit.com/r/Seattle/comments/dnblb2/best_places_to_hike/,{},dnblb2,True,False,False,False,True,True,False,,moving,"[{'e': 'text', 't': 'Moving / Visiting'}]",e210a192-4a63-11e8-839c-0e70be2d8a82,Moving / Visiting,dark,richtext,False,False,True,8,0,,,False,all_ads,/r/Seattle/comments/dnblb2/best_places_to_hike/,False,6,1572081731,0,"I’m visiting next summer and i’m hoping to hike somewhere, preferably a trail that is not too intense (probably nothing longer than 5 miles).  I don’t have a preference, just somewhere beautiful :)",True,False,[],False,Seattle,t5_2qhad,176509,public,self,Best places to hike?,0,1572287724,https://www.reddit.com/r/Seattle/comments/dnblb2/best_places_to_hike/,all_ads,6,,,,,,,,,,,,,
[],False,LMGDiVa,,[],,text,t2_kkyox2,False,[],False,False,1572080831,self.Seattle,https://www.reddit.com/r/Seattle/comments/dnbgo6/shooting_at_1st_and_blanchard/,{},dnbgo6,True,False,False,False,True,True,False,,,[],,,dark,text,False,False,True,17,0,,,False,all_ads,/r/Seattle/comments/dnbgo6/shooting_at_1st_and_blanchard/,False,6,1572080832,14,"I heard gunshots and pulled up the police scanner for Seattle.

Apparently a shooting just happened at 1st and blanchard.",True,False,[],False,Seattle,t5_2qhad,176508,public,self,Shooting at 1st and Blanchard.,0,1572287659,https://www.reddit.com/r/Seattle/comments/dnbgo6/shooting_at_1st_and_blanchard/,all_ads,6,,,,,,,,,,,,,
[],False,lixiyan666,,[],,text,t2_4iywa785,False,[],False,False,1572078796,i.redd.it,https://www.reddit.com/r/Seattle/comments/dnb6ht/httpseventsdancemarathoncomindexcfmfuseactiondonor/,{},dnb6ht,True,False,False,True,True,False,False,,,[],,,dark,text,False,False,True,1,0,,,False,all_ads,/r/Seattle/comments/dnb6ht/httpseventsdancemarathoncomindexcfmfuseactiondonor/,False,6,1572078797,1,,True,False,[],False,Seattle,t5_2qhad,176508,public,default,https://events.dancemarathon.com/index.cfm?fuseaction=donorDrive.participant&amp;participantID=641011,0,1572287517,https://i.redd.it/2hui7smvjuu31.png,all_ads,6,,,,,,,,,,,,,
[],False,invalid_potatoe,,[],,text,t2_46fi6i95,False,[],False,False,1572074336,i.redd.it,https://www.reddit.com/r/Seattle/comments/dnakmh/a_painting_of_bill_gates_i_found_in_a_hotel/,{},dnakmh,True,False,False,True,True,False,False,,,[],,,dark,text,False,False,True,7,0,,,False,all_ads,/r/Seattle/comments/dnakmh/a_painting_of_bill_gates_i_found_in_a_hotel/,False,6,1572074336,34,,True,False,[],False,Seattle,t5_2qhad,176504,public,default,A painting of Bill Gates I found in a hotel,0,1572286979,https://i.redd.it/14yafqzl6uu31.jpg,all_ads,6,,,,,,,,,,,,,
[],False,Brushie123,,[],,text,t2_rwam4,False,[],False,False,1572073142,self.Seattle,https://www.reddit.com/r/Seattle/comments/dnaerx/driving_to_banff_from_seattle_safe/,{},dnaerx,True,False,False,False,True,True,False,,,[],,,dark,text,False,False,True,12,0,,,False,all_ads,/r/Seattle/comments/dnaerx/driving_to_banff_from_seattle_safe/,False,6,1572073143,0,"Hi /r/Seattle.

I’m thinking of driving up to Banff from Seattle during thanksgiving weekend and was concerned about driving conditions. Our car is a rental which will have all season tires, likely 2WD. 

Has anyone who’s done the drive or is familiar tell me whether this would be advisable or not?",True,False,[],False,Seattle,t5_2qhad,176503,public,self,Driving to Banff from Seattle safe?,0,1572286897,https://www.reddit.com/r/Seattle/comments/dnaerx/driving_to_banff_from_seattle_safe/,all_ads,6,,,,,,,,,,,,,
[],False,shegrin,,[],,text,t2_5csm6,False,[],False,False,1572069355,self.Seattle,https://www.reddit.com/r/Seattle/comments/dn9w3a/shots_fired_on_cap_hill/,{},dn9w3a,True,False,False,False,True,True,False,,,[],,,dark,text,False,False,True,1,0,,,False,all_ads,/r/Seattle/comments/dn9w3a/shots_fired_on_cap_hill/,False,6,1572069365,0,Sounded like gun fire on the hill around 10:45. I would say at least 20 shots.,True,False,[],False,Seattle,t5_2qhad,176498,public,self,Shots fired on Cap Hill?,0,1572286381,https://www.reddit.com/r/Seattle/comments/dn9w3a/shots_fired_on_cap_hill/,all_ads,6,,,,,,,,,,,,,
[],False,jackjackj8ck,flair,"[{'e': 'text', 't': 'Hillman City'}]",Hillman City,richtext,t2_2lm4xpn9,False,[],False,False,1572069144,self.Seattle,https://www.reddit.com/r/Seattle/comments/dn9uzv/thanksgiving_to_go/,{},dn9uzv,True,False,False,False,True,True,False,,flair,"[{'e': 'text', 't': 'Recommendation'}]",9f763cd0-473d-11e8-93f7-0e6f632c214e,Recommendation,dark,richtext,False,False,True,19,0,,,False,all_ads,/r/Seattle/comments/dn9uzv/thanksgiving_to_go/,False,6,1572069146,0,"My baby is due on Nov 10, so I highly doubt I’ll be in the mood to cook. 

Can anyone recommend any good restaurants that I could order a small Thanksgiving meal for 2 adults for pick up or delivery? 

I’m in Columbia City if that helps at all",True,False,[],False,Seattle,t5_2qhad,176498,public,self,Thanksgiving To Go?,0,1572286366,https://www.reddit.com/r/Seattle/comments/dn9uzv/thanksgiving_to_go/,all_ads,6,,,,,,,13188b4c-433d-11e4-9667-12313b087994,dark,,,,,
[],False,Dalosbills,,[],,text,t2_4nkkln4a,False,[],False,False,1572067834,i.redd.it,https://www.reddit.com/r/Seattle/comments/dn9ohs/didnt_know_we_had_a_satanic_temple_though_im_not/,{},dn9ohs,True,False,False,True,True,False,False,,flair,"[{'e': 'text', 't': 'Media'}]",,Media,dark,richtext,False,False,True,8,0,,,False,all_ads,/r/Seattle/comments/dn9ohs/didnt_know_we_had_a_satanic_temple_though_im_not/,False,6,1572067835,27,,True,False,[],False,Seattle,t5_2qhad,176497,public,https://b.thumbs.redditmedia.com/z-OBvgDh5uh2D2KZI4SSYaUWor3WeokSDGEJKMCNDnI.jpg,"Didn’t know we had a satanic temple, though I’m not surprised",0,1572286272,https://i.redd.it/h3vhptmgrqu31.jpg,all_ads,6,image,"{'enabled': True, 'images': [{'id': 'GfZ-hwqETzof2MJQSpuf5KJsScZ2JkAHI8GDbeG2EuU', 'resolutions': [{'height': 192, 'url': 'https://preview.redd.it/h3vhptmgrqu31.jpg?width=108&amp;crop=smart&amp;auto=webp&amp;s=d685ed2a20fd350414e99ee319a474b3d541ae0c', 'width': 108}, {'height': 384, 'url': 'https://preview.redd.it/h3vhptmgrqu31.jpg?width=216&amp;crop=smart&amp;auto=webp&amp;s=9c6948c83a95da4f90d0373df4da0529790187da', 'width': 216}, {'height': 568, 'url': 'https://preview.redd.it/h3vhptmgrqu31.jpg?width=320&amp;crop=smart&amp;auto=webp&amp;s=57194499a319dd74471a4e08e301375cbfaa0924', 'width': 320}, {'height': 1137, 'url': 'https://preview.redd.it/h3vhptmgrqu31.jpg?width=640&amp;crop=smart&amp;auto=webp&amp;s=224ee1745d112138e301944c30de1a7d411d5a2b', 'width': 640}, {'height': 1706, 'url': 'https://preview.redd.it/h3vhptmgrqu31.jpg?width=960&amp;crop=smart&amp;auto=webp&amp;s=d64ec8c55f9fbd90ed7e6949ae1b21130c38cad1', 'width': 960}, {'height': 1920, 'url': 'https://preview.redd.it/h3vhptmgrqu31.jpg?width=1080&amp;crop=smart&amp;auto=webp&amp;s=6b98b935b5e4618d09f11ca8ba15e3255eeb41c8', 'width': 1080}], 'source': {'height': 1920, 'url': 'https://preview.redd.it/h3vhptmgrqu31.jpg?auto=webp&amp;s=14a83cc075e60bd1b7cb13ee69b2a5a239a6bf50', 'width': 1080}, 'variants': {}}]}",140.0,140.0,t3_dn2qni,"[{'all_awardings': [], 'allow_live_comments': True, 'approved_at_utc': None, 'approved_by': None, 'archived': False, 'author': 'SPF_9001', 'author_flair_background_color': None, 'author_flair_css_class': None, 'author_flair_richtext': [], 'author_flair_template_id': None, 'author_flair_text': None, 'author_flair_text_color': None, 'author_flair_type': 'text', 'author_fullname': 't2_rbza9', 'author_patreon_flair': False, 'awarders': [], 'banned_at_utc': None, 'banned_by': None, 'can_gild': True, 'can_mod_post': False, 'category': None, 'clicked': False, 'content_categories': None, 'contest_mode': False, 'created': 1572061719.0, 'created_utc': 1572032919.0, 'discussion_type': None, 'distinguished': None, 'domain': 'i.redd.it', 'downs': 0, 'edited': False, 'gilded': 0, 'gildings': {}, 'hidden': False, 'hide_score': False, 'id': 'dn2qni', 'is_crosspostable': True, 'is_meta': False, 'is_original_content': False, 'is_reddit_media_domain': True, 'is_robot_indexable': True, 'is_self': False, 'is_video': False, 'likes': None, 'link_flair_background_color': '', 'link_flair_css_class': None, 'link_flair_richtext': [], 'link_flair_text': None, 'link_flair_text_color': 'dark', 'link_flair_type': 'text', 'locked': False, 'media': None, 'media_embed': {}, 'media_only': False, 'mod_note': None, 'mod_reason_by': None, 'mod_reason_title': None, 'mod_reports': [], 'name': 't3_dn2qni', 'no_follow': False, 'num_comments': 43, 'num_crossposts': 1, 'num_reports': None, 'og_description': '', 'og_title': '', 'over_18': False, 'parent_whitelist_status': 'no_ads', 'permalink': '/r/rimjob_steve/comments/dn2qni/menstruatin_with_satan/', 'pinned': False, 'post_hint': 'image', 'preview': {'enabled': True, 'images': [{'id': 'GfZ-hwqETzof2MJQSpuf5KJsScZ2JkAHI8GDbeG2EuU', 'resolutions': [{'height': 192, 'url': 'https://preview.redd.it/h3vhptmgrqu31.jpg?width=108&amp;crop=smart&amp;auto=webp&amp;s=d685ed2a20fd350414e99ee319a474b3d541ae0c', 'width': 108}, {'height': 384, 'url': 'https://preview.redd.it/h3vhptmgrqu31.jpg?width=216&amp;crop=smart&amp;auto=webp&amp;s=9c6948c83a95da4f90d0373df4da0529790187da', 'width': 216}, {'height': 568, 'url': 'https://preview.redd.it/h3vhptmgrqu31.jpg?width=320&amp;crop=smart&amp;auto=webp&amp;s=57194499a319dd74471a4e08e301375cbfaa0924', 'width': 320}, {'height': 1137, 'url': 'https://preview.redd.it/h3vhptmgrqu31.jpg?width=640&amp;crop=smart&amp;auto=webp&amp;s=224ee1745d112138e301944c30de1a7d411d5a2b', 'width': 640}, {'height': 1706, 'url': 'https://preview.redd.it/h3vhptmgrqu31.jpg?width=960&amp;crop=smart&amp;auto=webp&amp;s=d64ec8c55f9fbd90ed7e6949ae1b21130c38cad1', 'width': 960}, {'height': 1920, 'url': 'https://preview.redd.it/h3vhptmgrqu31.jpg?width=1080&amp;crop=smart&amp;auto=webp&amp;s=6b98b935b5e4618d09f11ca8ba15e3255eeb41c8', 'width': 1080}], 'source': {'height': 1920, 'url': 'https://preview.redd.it/h3vhptmgrqu31.jpg?auto=webp&amp;s=14a83cc075e60bd1b7cb13ee69b2a5a239a6bf50', 'width': 1080}, 'variants': {}}]}, 'pwls': 0, 'quarantine': False, 'removal_reason': None, 'report_reasons': None, 'saved': False, 'score': 2376, 'secure_media': None, 'secure_media_embed': {}, 'selftext': '', 'selftext_html': None, 'send_replies': True, 'spoiler': False, 'steward_reports': [], 'stickied': False, 'subreddit': 'rimjob_steve', 'subreddit_id': 't5_k44tx', 'subreddit_name_prefixed': 'r/rimjob_steve', 'subreddit_subscribers': 329757, 'subreddit_type': 'public', 'suggested_sort': None, 'thumbnail': 'https://b.thumbs.redditmedia.com/z-OBvgDh5uh2D2KZI4SSYaUWor3WeokSDGEJKMCNDnI.jpg', 'thumbnail_height': 140, 'thumbnail_width': 140, 'title': ""Menstruatin' with Satan"", 'total_awards_received': 0, 'ups': 2376, 'url': 'https://i.redd.it/h3vhptmgrqu31.jpg', 'user_reports': [], 'view_count': None, 'visited': False, 'whitelist_status': 'no_ads', 'wls': 0}]",,,,,,,
