all_awardings,allow_live_comments,author,author_flair_css_class,author_flair_richtext,author_flair_text,author_flair_type,author_fullname,author_is_blocked,author_patreon_flair,author_premium,awarders,can_mod_post,contest_mode,created_utc,domain,full_link,gildings,id,is_created_from_ads_ui,is_crosspostable,is_gallery,is_meta,is_original_content,is_reddit_media_domain,is_robot_indexable,is_self,is_video,link_flair_background_color,link_flair_richtext,link_flair_text_color,link_flair_type,locked,media_only,no_follow,num_comments,num_crossposts,over_18,parent_whitelist_status,permalink,pinned,pwls,removed_by_category,retrieved_on,score,selftext,send_replies,spoiler,stickied,subreddit,subreddit_id,subreddit_subscribers,subreddit_type,thumbnail,thumbnail_height,thumbnail_width,title,total_awards_received,treatment_tags,upvote_ratio,url,url_overridden_by_dest,whitelist_status,wls,link_flair_css_class,link_flair_text,link_flair_template_id,media,media_embed,post_hint,preview,secure_media,secure_media_embed,gallery_data,media_metadata,author_flair_background_color,author_flair_text_color,crosspost_parent,crosspost_parent_list,author_flair_template_id
[],False,allison-linda,,[],,text,t2_d6te4bwg,False,False,False,[],False,False,1626990219,reddit.com,https://www.reddit.com/r/Seattle/comments/opnudz/im_a_female_escort_available_for_hookup_text_my/,{},opnudz,False,False,True,False,False,False,False,False,False,,[],dark,text,False,False,True,2,0,True,all_ads,/r/Seattle/comments/opnudz/im_a_female_escort_available_for_hookup_text_my/,False,6,automod_filtered,1626990230,1,,True,False,False,Seattle,t5_2qhad,322339,public,nsfw,140.0,140.0,I’m a female escort available for hookup text my Kik @Allisonlinda89,0,[],1.0,https://www.reddit.com/gallery/opnudz,https://www.reddit.com/gallery/opnudz,promo_adult_nsfw,3,,,,,,,,,,,,,,,,
[],False,Ang-It,,[],,text,t2_df417v3c,False,False,False,[],False,False,1626989307,self.Seattle,https://www.reddit.com/r/Seattle/comments/opnjh4/help_finding_queeraffirming_outpatient_behavioral/,{},opnjh4,False,True,,False,False,False,True,True,False,,[],dark,text,False,False,False,7,0,False,all_ads,/r/Seattle/comments/opnjh4/help_finding_queeraffirming_outpatient_behavioral/,False,6,,1626989318,1,"**I need help finding queer-affirming outpatient behavioral health providers that are covered by WA Medicaid and located in the Everett to Seattle area.**

I am a gender-queer, pan-sexual, multiracial individual with Apple Health (Medicaid) coverage. I struggle with severe depression and suicidal ideation, social anxiety, alcohol addiction, and cannabis abuse. All of these things were greatly exacerbated during the pandemic to the point I haven’t worked or even spoken to anyone outside my immediate family in nearly a year. 

I've tried attending two separate in-patient programs for dual-diagnosis Substance Abuse and Mental Health disorders since the start of 2021, but both experiences were so negative I dropped out early due to overwhelming urges to self-harm. During the first program at Pioneer Center North in Sedro-Woolley I experienced daily anti-queer bullying and racial microaggressions by some of the other residents, and the staff did little to mitigate. The second program was at Prosperity Wellness Center in Tacoma, and the staff there actively undermined and disdained my gender identity (and generally approached the clients with the utmost condescension; like we were a homogeneous, unruly, child-like flock they were inconveniently called upon to tend).

I want to try getting help again, and I want to pivot to intensive outpatient treatment while I look for part-time work. But I've been overwhelmed and frustrated trying to find an affordable program with which I'll have a better experience. I've tried utilizing Seattle-based queer resources like Gay City and Ingersoll with no luck. So I'm asking for help here.

*If you identify as a LGBTQIA/Queer BIPOC individual who has received outpatient behavioral health care through Medicaid in the Everett to Seattle area in the last few years, I am in dire need of your suggestions and recommendations!* 

As has been explained to me several times by the folks at Molina, I know I'm not likely to find any places GEARED toward our community. But a place where the staff knows what preferred gender pronouns are; are aware that there's more than just gay/straight, man/woman; understands that ""oriental"" and ""mulatto"" are offensive terms; knows it's not OK to use every damn opportunity to pet a Black person's hair. A place that isn't going to exacerbate the mental anguish I'm trying to heal - that is what I’m looking for.

So if you know where I can go for that, please reply. Thank you!",True,False,False,Seattle,t5_2qhad,322332,public,self,,,Help Finding Queer-Affirming Outpatient Behavioral Health Care,0,[],1.0,https://www.reddit.com/r/Seattle/comments/opnjh4/help_finding_queeraffirming_outpatient_behavioral/,,all_ads,6,,,,,,,,,,,,,,,,
[],False,ty_rex,,[],,text,t2_11bofl,False,False,False,[],False,False,1626988239,self.Seattle,https://www.reddit.com/r/Seattle/comments/opn6uf/whale_watching_is_a_day_trip_to_sji_possible/,{},opn6uf,False,True,,False,False,False,True,True,False,,"[{'e': 'text', 't': 'Moving / Visiting'}]",dark,richtext,False,False,True,19,0,False,all_ads,/r/Seattle/comments/opn6uf/whale_watching_is_a_day_trip_to_sji_possible/,False,6,,1626988250,1,"Hi Everyone,

I'm going to be visiting Seattle in late August, and I'd like to go whale watching.  After searching this sub, I noticed that heading to SJI out of Anacortes is the way to go.  However, is it possible to do that in a day trip from Seattle?  I'm looking at San Juan Safaris and they say you can do it in a day trip, but I'm skeptical.  


* 2 hour drive to Anacortes
* \~1 hour? ferry ride to Friday Harbor
* 3-4 hours on the tour
* \~1 hour? ferry ride back to Anacortes
* 2 our drive to Seattle
* 9-10 hour day

Has anyone done this?  Is this bullshit, or just a long day?  I feel like this would be a much cooler experience than going out of Edmonds with Puget Sound Express, so if it's just a long day, then I'm game!",True,False,False,Seattle,t5_2qhad,322329,public,self,,,Whale Watching - Is a day trip to SJI possible?,0,[],1.0,https://www.reddit.com/r/Seattle/comments/opn6uf/whale_watching_is_a_day_trip_to_sji_possible/,,all_ads,6,moving,Moving / Visiting,,,,,,,,,,,,,,
[],False,TallRepresentative46,,[],,text,t2_cfq6egzi,False,False,False,[],False,False,1626987647,self.Seattle,https://www.reddit.com/r/Seattle/comments/opmzx9/hey_everyone/,{},opmzx9,False,True,,False,False,False,True,True,False,,[],dark,text,False,False,True,0,0,False,all_ads,/r/Seattle/comments/opmzx9/hey_everyone/,False,6,,1626987658,1,How’s it going,True,False,False,Seattle,t5_2qhad,322329,public,self,,,Hey everyone,0,[],1.0,https://www.reddit.com/r/Seattle/comments/opmzx9/hey_everyone/,,all_ads,6,,,,,,,,,,,,,,,,
[],False,OrganicSomewhere9461,,[],,text,t2_8gb6j1s6,False,False,False,[],False,False,1626987571,self.Seattle,https://www.reddit.com/r/Seattle/comments/opmyus/observation_the_seattle_freeze_largely_just/,{},opmyus,False,False,,False,False,False,False,True,False,,[],dark,text,False,False,True,0,0,False,all_ads,/r/Seattle/comments/opmyus/observation_the_seattle_freeze_largely_just/,False,6,automod_filtered,1626987582,1,[removed],True,False,False,Seattle,t5_2qhad,322330,public,self,,,"Observation: the ""Seattle Freeze"" largely just applies to antisocial people",0,[],1.0,https://www.reddit.com/r/Seattle/comments/opmyus/observation_the_seattle_freeze_largely_just/,,all_ads,6,,,,,,,,,,,,,,,,
[],False,Sarah_Kerrigen,,[],,text,t2_d62fpv4d,False,False,False,[],False,False,1626985688,self.Seattle,https://www.reddit.com/r/Seattle/comments/opmchx/where_is_there_a_confessional_one_can_use_if_they/,{},opmchx,False,True,,False,False,False,True,True,False,,"[{'e': 'text', 't': 'Question'}]",dark,richtext,False,False,True,18,0,False,all_ads,/r/Seattle/comments/opmchx/where_is_there_a_confessional_one_can_use_if_they/,False,6,,1626985699,1,In need kind of desperate need of some guidance and religious counsel.,True,False,False,Seattle,t5_2qhad,322328,public,self,,,"Where is there a confessional one can use, if they are not a member? Or, where is there a priest who takes consultations in the Seattle area?",0,[],1.0,https://www.reddit.com/r/Seattle/comments/opmchx/where_is_there_a_confessional_one_can_use_if_they/,,all_ads,6,flair,Question,9b95cc16-44bf-11e6-aba4-0e42ab5b9d91,,,,,,,,,,,,,
[],False,Monostache,,[],,text,t2_9vsggu7t,False,False,False,[],False,False,1626984288,self.Seattle,https://www.reddit.com/r/Seattle/comments/oplvxz/looking_for_dog_friendly_restaurant_things_to_do/,{},oplvxz,False,True,,False,False,False,True,True,False,,"[{'e': 'text', 't': 'Recommendation'}]",dark,richtext,False,False,True,15,0,False,all_ads,/r/Seattle/comments/oplvxz/looking_for_dog_friendly_restaurant_things_to_do/,False,6,,1626984300,1,"Hello, Reddit! My birthday is coming up, and because of the pandemic, my husband and I haven't done anything in ages. I'd love to do something fun for my birthday, where bringing my dog Sunny would be no issue, and would love some recommendations! Bonus points for places in the South Sound, as we live near Tacoma.",True,False,False,Seattle,t5_2qhad,322323,public,self,,,Looking for Dog Friendly Restaurant/ Things To Do,0,[],1.0,https://www.reddit.com/r/Seattle/comments/oplvxz/looking_for_dog_friendly_restaurant_things_to_do/,,all_ads,6,flair,Recommendation,9f763cd0-473d-11e8-93f7-0e6f632c214e,,,,,,,,,,,,,
[],False,PineappleTreePro,,[],,text,t2_zmbkv,False,False,False,[],False,False,1626983949,youtube.com,https://www.reddit.com/r/Seattle/comments/oplrhv/i_noticed_a_female_elephant_seal_in_bell_harbor/,{},oplrhv,False,False,,False,False,False,False,False,False,,"[{'e': 'text', 't': 'Media'}]",dark,richtext,False,False,True,0,0,False,all_ads,/r/Seattle/comments/oplrhv/i_noticed_a_female_elephant_seal_in_bell_harbor/,False,6,reddit,1626983960,1,,True,False,False,Seattle,t5_2qhad,322323,public,https://b.thumbs.redditmedia.com/7r6dtTZgpofklAKnFoUxV7BlKzfI5dpd-Era2YopOvw.jpg,105.0,140.0,"I noticed a female elephant seal in Bell Harbor earlier this year. I thought it was hurt. Called it in, but found out that it was molting. So I followed it for a few weeks until its new coat grew in and it happily swam away.",0,[],1.0,https://www.youtube.com/watch?v=_UewarDSSes,https://www.youtube.com/watch?v=_UewarDSSes,all_ads,6,flair,Media,,"{'oembed': {'author_name': 'Bruce Benik II', 'author_url': 'https://www.youtube.com/channel/UCQ3jQbotUCaSOvWs9EgYSFA', 'height': 200, 'html': '&lt;iframe width=""356"" height=""200"" src=""https://www.youtube.com/embed/_UewarDSSes?feature=oembed&amp;enablejsapi=1"" frameborder=""0"" allow=""accelerometer; autoplay; clipboard-write; encrypted-media; gyroscope; picture-in-picture"" allowfullscreen&gt;&lt;/iframe&gt;', 'provider_name': 'YouTube', 'provider_url': 'https://www.youtube.com/', 'thumbnail_height': 360, 'thumbnail_url': 'https://i.ytimg.com/vi/_UewarDSSes/hqdefault.jpg', 'thumbnail_width': 480, 'title': 'Molting Elephant Seal', 'type': 'video', 'version': '1.0', 'width': 356}, 'type': 'youtube.com'}","{'content': '&lt;iframe width=""356"" height=""200"" src=""https://www.youtube.com/embed/_UewarDSSes?feature=oembed&amp;enablejsapi=1"" frameborder=""0"" allow=""accelerometer; autoplay; clipboard-write; encrypted-media; gyroscope; picture-in-picture"" allowfullscreen&gt;&lt;/iframe&gt;', 'height': 200, 'scrolling': False, 'width': 356}",rich:video,"{'enabled': False, 'images': [{'id': '4RvTCBfXi0vmi1W2OEvaTGlVlk1SmXnU915h9Btt0gU', 'resolutions': [{'height': 81, 'url': 'https://external-preview.redd.it/f5GP8tgJ1yJFZ1I_Z0Uw74J-maQP8ZUuDmRdUnU_IEo.jpg?width=108&amp;crop=smart&amp;auto=webp&amp;s=b828be35550a5edc7658f6b1b62278074b42138f', 'width': 108}, {'height': 162, 'url': 'https://external-preview.redd.it/f5GP8tgJ1yJFZ1I_Z0Uw74J-maQP8ZUuDmRdUnU_IEo.jpg?width=216&amp;crop=smart&amp;auto=webp&amp;s=170b83ce54fa07641569fdb0d5a043a70c65acf3', 'width': 216}, {'height': 240, 'url': 'https://external-preview.redd.it/f5GP8tgJ1yJFZ1I_Z0Uw74J-maQP8ZUuDmRdUnU_IEo.jpg?width=320&amp;crop=smart&amp;auto=webp&amp;s=4dc70f8af29b711e3a44b051e1242b4c5dcb43b6', 'width': 320}], 'source': {'height': 360, 'url': 'https://external-preview.redd.it/f5GP8tgJ1yJFZ1I_Z0Uw74J-maQP8ZUuDmRdUnU_IEo.jpg?auto=webp&amp;s=3054a97f662ec796ba676ef6385b24fb2f857577', 'width': 480}, 'variants': {}}]}","{'oembed': {'author_name': 'Bruce Benik II', 'author_url': 'https://www.youtube.com/channel/UCQ3jQbotUCaSOvWs9EgYSFA', 'height': 200, 'html': '&lt;iframe width=""356"" height=""200"" src=""https://www.youtube.com/embed/_UewarDSSes?feature=oembed&amp;enablejsapi=1"" frameborder=""0"" allow=""accelerometer; autoplay; clipboard-write; encrypted-media; gyroscope; picture-in-picture"" allowfullscreen&gt;&lt;/iframe&gt;', 'provider_name': 'YouTube', 'provider_url': 'https://www.youtube.com/', 'thumbnail_height': 360, 'thumbnail_url': 'https://i.ytimg.com/vi/_UewarDSSes/hqdefault.jpg', 'thumbnail_width': 480, 'title': 'Molting Elephant Seal', 'type': 'video', 'version': '1.0', 'width': 356}, 'type': 'youtube.com'}","{'content': '&lt;iframe width=""356"" height=""200"" src=""https://www.youtube.com/embed/_UewarDSSes?feature=oembed&amp;enablejsapi=1"" frameborder=""0"" allow=""accelerometer; autoplay; clipboard-write; encrypted-media; gyroscope; picture-in-picture"" allowfullscreen&gt;&lt;/iframe&gt;', 'height': 200, 'media_domain_url': 'https://www.redditmedia.com/mediaembed/oplrhv', 'scrolling': False, 'width': 356}",,,,,,,
[],False,someshooter,,[],,text,t2_4021c,False,False,False,[],False,False,1626982906,self.Seattle,https://www.reddit.com/r/Seattle/comments/oplexm/those_with_electric_scooters_which_ones_are_best/,{},oplexm,False,True,,False,False,False,True,True,False,,"[{'e': 'text', 't': 'Question'}]",dark,richtext,False,False,True,9,0,False,all_ads,/r/Seattle/comments/oplexm/those_with_electric_scooters_which_ones_are_best/,False,6,,1626982917,1,"I am researching models like the Ninebot Max and Mantis 8, etc....just wondering if any of them can tackle the crazy hills downtown.",True,False,False,Seattle,t5_2qhad,322317,public,self,,,"Those with electric scooters - which ones are best for the crazy hills, if any?",0,[],1.0,https://www.reddit.com/r/Seattle/comments/oplexm/those_with_electric_scooters_which_ones_are_best/,,all_ads,6,flair,Question,9b95cc16-44bf-11e6-aba4-0e42ab5b9d91,,,,,,,,,,,,,
[],False,Albion_Tourgee,,[],,text,t2_3005x,False,False,True,[],False,False,1626981591,crosscut.com,https://www.reddit.com/r/Seattle/comments/opkz6x/opinion_for_homeless_solutions_seattle_can_look/,{},opkz6x,False,True,,False,False,False,True,False,False,,"[{'e': 'text', 't': 'Community'}]",dark,richtext,False,False,True,12,0,False,all_ads,/r/Seattle/comments/opkz6x/opinion_for_homeless_solutions_seattle_can_look/,False,6,,1626981601,1,,True,False,False,Seattle,t5_2qhad,322316,public,https://b.thumbs.redditmedia.com/2larkKTaFGnnm4BZLixutb5JMbR_651wMivFH9tWCzc.jpg,93.0,140.0,"Opinion | For homeless solutions, Seattle can look to New York and Vancouver",0,[],1.0,https://crosscut.com/opinion/2021/07/homeless-solutions-seattle-can-look-new-york-and-vancouver,https://crosscut.com/opinion/2021/07/homeless-solutions-seattle-can-look-new-york-and-vancouver,all_ads,6,flair,Community,d34790c2-412a-11e8-a986-0e3a917b7a84,,,link,"{'enabled': False, 'images': [{'id': 'aUYrDq4wqyxTD7NPbOoOnBKlyF1Q9BDoOxF9FcB9Zqg', 'resolutions': [{'height': 72, 'url': 'https://external-preview.redd.it/331xyfLpUnKgDhlAIM2SdXSsHzqzRJV2HZPSHHhpZ1k.jpg?width=108&amp;crop=smart&amp;auto=webp&amp;s=1695d60c8e868d15a6fd4cf61661e3c01a4b49d5', 'width': 108}, {'height': 144, 'url': 'https://external-preview.redd.it/331xyfLpUnKgDhlAIM2SdXSsHzqzRJV2HZPSHHhpZ1k.jpg?width=216&amp;crop=smart&amp;auto=webp&amp;s=4bb2915fc6d3ffcf69f234e5a58ddc379e6e05fb', 'width': 216}, {'height': 213, 'url': 'https://external-preview.redd.it/331xyfLpUnKgDhlAIM2SdXSsHzqzRJV2HZPSHHhpZ1k.jpg?width=320&amp;crop=smart&amp;auto=webp&amp;s=421763248979b0fbc1b83e034b93ff788a86a341', 'width': 320}, {'height': 426, 'url': 'https://external-preview.redd.it/331xyfLpUnKgDhlAIM2SdXSsHzqzRJV2HZPSHHhpZ1k.jpg?width=640&amp;crop=smart&amp;auto=webp&amp;s=3f17715951b7858bcf4b22e992e1d6001e1ae2b8', 'width': 640}, {'height': 640, 'url': 'https://external-preview.redd.it/331xyfLpUnKgDhlAIM2SdXSsHzqzRJV2HZPSHHhpZ1k.jpg?width=960&amp;crop=smart&amp;auto=webp&amp;s=0e8a8f9ca0979f89b4330e3ce051a7cf502d45c8', 'width': 960}, {'height': 720, 'url': 'https://external-preview.redd.it/331xyfLpUnKgDhlAIM2SdXSsHzqzRJV2HZPSHHhpZ1k.jpg?width=1080&amp;crop=smart&amp;auto=webp&amp;s=9696c1bd2ebaa95dc51506849aef89b7293572d4', 'width': 1080}], 'source': {'height': 1334, 'url': 'https://external-preview.redd.it/331xyfLpUnKgDhlAIM2SdXSsHzqzRJV2HZPSHHhpZ1k.jpg?auto=webp&amp;s=b468d68d0d06805d12539c2dbbe2109e09ff535b', 'width': 2000}, 'variants': {}}]}",,,,,,,,,
[],False,gooddogepnw,,[],,text,t2_ca0ydgqc,False,False,False,[],False,False,1626979572,/r/Seattle/comments/opk9w9/finally_got_the_boat_in_the_water/,https://www.reddit.com/r/Seattle/comments/opk9w9/finally_got_the_boat_in_the_water/,{},opk9w9,False,True,,False,False,False,True,False,True,,[],dark,text,False,False,True,5,0,False,all_ads,/r/Seattle/comments/opk9w9/finally_got_the_boat_in_the_water/,False,6,,1626979583,1,,True,False,False,Seattle,t5_2qhad,322308,public,https://b.thumbs.redditmedia.com/7htr_ed_OS-mOFfEUEgff7AMzzKmIID-moTtczIC4gc.jpg,140.0,140.0,Finally got the boat in the water! ✅,0,[],1.0,https://v.redd.it/obv7shnv7tc71,https://v.redd.it/obv7shnv7tc71,all_ads,6,,,,,,hosted:video,"{'enabled': False, 'images': [{'id': 'M-dsEfvIQVgBk4lL6L9bbcO3uJN-V3GJE2oDD0-Vo-k', 'resolutions': [{'height': 192, 'url': 'https://external-preview.redd.it/6647BUSmvEljQ13VEZ8NxE6qTu0GYzcQuuBMVs0kGu0.png?width=108&amp;crop=smart&amp;format=pjpg&amp;auto=webp&amp;s=ccc6b8259b4b8225c04ed2bc7c934d9e8441cf68', 'width': 108}, {'height': 384, 'url': 'https://external-preview.redd.it/6647BUSmvEljQ13VEZ8NxE6qTu0GYzcQuuBMVs0kGu0.png?width=216&amp;crop=smart&amp;format=pjpg&amp;auto=webp&amp;s=338a79caaa548fa6e4334dbe8e6adbefae729bae', 'width': 216}, {'height': 568, 'url': 'https://external-preview.redd.it/6647BUSmvEljQ13VEZ8NxE6qTu0GYzcQuuBMVs0kGu0.png?width=320&amp;crop=smart&amp;format=pjpg&amp;auto=webp&amp;s=e79247fe8f6ec92a2786d3ccef8e65bee6c51283', 'width': 320}, {'height': 1137, 'url': 'https://external-preview.redd.it/6647BUSmvEljQ13VEZ8NxE6qTu0GYzcQuuBMVs0kGu0.png?width=640&amp;crop=smart&amp;format=pjpg&amp;auto=webp&amp;s=9506a1a10ef0399c9b02dd834dd0bae8ad3743b8', 'width': 640}], 'source': {'height': 1280, 'url': 'https://external-preview.redd.it/6647BUSmvEljQ13VEZ8NxE6qTu0GYzcQuuBMVs0kGu0.png?format=pjpg&amp;auto=webp&amp;s=abe616d4da626632271742101262fa7b29990830', 'width': 720}, 'variants': {}}]}",,,,,,,,,
[],False,fbdrtallz,,[],,text,t2_z7bio,False,False,False,[],False,False,1626979021,reddit.com,https://www.reddit.com/r/Seattle/comments/opk2ye/i_need_to_rehome_my_beautiful_cat/,{},opk2ye,False,True,True,False,False,False,True,False,False,,[],dark,text,False,False,True,19,0,False,all_ads,/r/Seattle/comments/opk2ye/i_need_to_rehome_my_beautiful_cat/,False,6,,1626979031,1,,True,False,False,Seattle,t5_2qhad,322306,public,default,,,I need to rehome my beautiful cat,0,[],1.0,https://www.reddit.com/gallery/opk2ye,https://www.reddit.com/gallery/opk2ye,all_ads,6,,,,,,,,,,"{'items': [{'id': 59088044, 'media_id': 'rnm6qtwe6tc71'}, {'id': 59088045, 'media_id': '0abrnswe6tc71'}, {'id': 59088046, 'media_id': 'uenb30xe6tc71'}, {'id': 59088047, 'media_id': 'x1174owe6tc71'}, {'caption': 'He is 4 years old and can be very sweet. I am unable to have him where I am and the people that were fostering him can also no longer have him. I just want him to be happy. ', 'id': 59088048, 'media_id': '0pkosswe6tc71'}]}","{'0abrnswe6tc71': {'status': 'unprocessed'}, '0pkosswe6tc71': {'status': 'unprocessed'}, 'rnm6qtwe6tc71': {'status': 'unprocessed'}, 'uenb30xe6tc71': {'status': 'unprocessed'}, 'x1174owe6tc71': {'status': 'unprocessed'}}",,,,,
[],False,no_kids_thank_god,,[],,text,t2_71nvv98m,False,False,False,[],False,False,1626977849,self.Seattle,https://www.reddit.com/r/Seattle/comments/opjof5/is_the_i5_rock_thrower_actually_from_the_homeless/,{},opjof5,False,True,,False,False,False,True,True,False,,[],dark,text,False,False,True,78,0,False,all_ads,/r/Seattle/comments/opjof5/is_the_i5_rock_thrower_actually_from_the_homeless/,False,6,,1626977859,1,"So I keep reading that they caught a guy directly and he will be appearing in court.  I've also seen they are clearing out the near by homeless camps.  
BUT I have yet to hear if the two are actually related.   I mean I know they are clearing the camps as a ""safety measure"" due to the incidents.  But do we know if the people throwing rocks were coming from the camps?",True,False,False,Seattle,t5_2qhad,322300,public,self,,,"Is the ""I-5 rock thrower"" actually from the homeless camps near by?",0,[],1.0,https://www.reddit.com/r/Seattle/comments/opjof5/is_the_i5_rock_thrower_actually_from_the_homeless/,,all_ads,6,,,,,,,,,,,,,,,,
[],False,sir_deadlock,,[],,text,t2_grr0k,False,False,False,[],False,False,1626977648,self.Seattle,https://www.reddit.com/r/Seattle/comments/opjm13/there_are_fifteen_bids_for_mayor_on_the_ballot/,{},opjm13,False,True,,False,False,False,True,True,False,,"[{'e': 'text', 't': 'Politics'}]",dark,richtext,False,False,False,44,0,False,all_ads,/r/Seattle/comments/opjm13/there_are_fifteen_bids_for_mayor_on_the_ballot/,False,6,,1626977660,1,"Or not necessarily RCV, but something! I mean, it's a total waste of time and money to put forward a candidate who can't possibly win, but it'd also go against their freedom of speech to not be allowed to try.

 But then, the first past the post system in place ensures it to be that way. It's a system of either voting for who one likes or voting strategically against the unliked. It all boils down to a bunch of wasted votes on candidates who sound good but can never win. And if somebody is well liked, but not liked enough, that may results in maybe an unliked candidate winning the plurality. It's so unsettling.

I hear that King County is working on getting RCV. I hope it comes here too. As it stands I feel like I'm voting for who I think can win, rather than who I want to win.

 I'm probably just shouting into the ether on this one. I'm not politically active beyond voting. Guess I'm just going to vote with my employers' union selections.

 There was a time I'd say ""my vote doesn't matter, so I'll vote for who I like"" but thinks are so narrowly divided these days. Don't think I can afford to be self interested.",True,False,False,Seattle,t5_2qhad,322300,public,self,,,There are fifteen bids for mayor on the ballot. Think it was about that big last time too. Why don't we have ranked choice voting yet?,0,[],1.0,https://www.reddit.com/r/Seattle/comments/opjm13/there_are_fifteen_bids_for_mayor_on_the_ballot/,,all_ads,6,flair,Politics,d03c04ee-412a-11e8-88cf-0e80e220ed5c,,,,,,,,,,,,,
[],False,shelterwaterfirefood,,[],,text,t2_5j0h0m5o,False,False,False,[],False,False,1626977218,i.redd.it,https://www.reddit.com/r/Seattle/comments/opjgl1/missing_juvenile_in_seattle_area_des_moines/,{},opjgl1,False,True,,False,False,True,True,False,False,,"[{'e': 'text', 't': 'Media'}]",dark,richtext,False,False,False,0,0,False,all_ads,/r/Seattle/comments/opjgl1/missing_juvenile_in_seattle_area_des_moines/,False,6,,1626977230,1,,True,False,False,Seattle,t5_2qhad,322299,public,https://b.thumbs.redditmedia.com/qQNg-yli8753fO71GMeU5J2zhHu0rDTTGmwvwIJkDeQ.jpg,140.0,140.0,Missing juvenile in Seattle area (Des Moines). Posting here to increase visibility. Thank you.,0,[],1.0,https://i.redd.it/b0eb9gg21tc71.jpg,https://i.redd.it/b0eb9gg21tc71.jpg,all_ads,6,flair,Media,,,,image,"{'enabled': True, 'images': [{'id': '6s8EpRySA45o0jFQDLJ-ZlKfJ-ICSdXVdC6B-x2d-ok', 'resolutions': [{'height': 142, 'url': 'https://preview.redd.it/b0eb9gg21tc71.jpg?width=108&amp;crop=smart&amp;auto=webp&amp;s=88cb7a39085e372a48e5912942608b5ef3febd9d', 'width': 108}, {'height': 284, 'url': 'https://preview.redd.it/b0eb9gg21tc71.jpg?width=216&amp;crop=smart&amp;auto=webp&amp;s=51befc69a1b47401888456cec0acdc0fc978205f', 'width': 216}, {'height': 421, 'url': 'https://preview.redd.it/b0eb9gg21tc71.jpg?width=320&amp;crop=smart&amp;auto=webp&amp;s=e55eadb284d15383eddef74bd1632d7ceee3cf62', 'width': 320}, {'height': 843, 'url': 'https://preview.redd.it/b0eb9gg21tc71.jpg?width=640&amp;crop=smart&amp;auto=webp&amp;s=1979457099091754021293438e5423050d1e2a59', 'width': 640}], 'source': {'height': 1016, 'url': 'https://preview.redd.it/b0eb9gg21tc71.jpg?auto=webp&amp;s=c7656c29b60d79dbaac6e5391ecbf6c60cdac149', 'width': 771}, 'variants': {}}]}",,,,,,,,,
