author,author_flair_css_class,author_flair_richtext,author_flair_text,author_flair_type,author_fullname,author_patreon_flair,can_mod_post,contest_mode,created_utc,domain,full_link,gildings,id,is_crosspostable,is_meta,is_original_content,is_reddit_media_domain,is_robot_indexable,is_self,is_video,link_flair_background_color,link_flair_richtext,link_flair_text_color,link_flair_type,locked,media_only,no_follow,num_comments,num_crossposts,over_18,parent_whitelist_status,permalink,pinned,pwls,retrieved_on,score,selftext,send_replies,spoiler,stickied,subreddit,subreddit_id,subreddit_subscribers,subreddit_type,thumbnail,title,url,whitelist_status,wls,link_flair_css_class,link_flair_text,post_hint,preview,thumbnail_height,thumbnail_width,author_flair_background_color,author_flair_text_color,link_flair_template_id,media_metadata,crosspost_parent,crosspost_parent_list,author_flair_template_id,media,media_embed,secure_media,secure_media_embed,author_cakeday
creatingcreator,,[],,text,t2_sbi171m,False,False,False,1549487175,self.Seattle,https://www.reddit.com/r/Seattle/comments/anvj2p/whats_up_with_all_these_spas_being_women_only/,"{'gid_1': 0, 'gid_2': 0, 'gid_3': 0}",anvj2p,True,False,False,False,True,True,False,,[],dark,text,False,False,True,7,0,False,all_ads,/r/Seattle/comments/anvj2p/whats_up_with_all_these_spas_being_women_only/,False,6,1549487176,1,"Iv been looking for a spot and came across Olympus Spa which looks awesome. But then noticed it’s women’s only.

Then there was another one called Lady’s well Vitality Spa and Sauna. Oh and Hothouse Spa &amp; Sauana...

I get that women want to go to a place and not have to worry about being uncomfortable. But all these spots look so rad. 

Am I being out of line for being bothered? ",True,False,False,Seattle,t5_2qhad,145759,public,self,What’s up with all these spas being women only?,https://www.reddit.com/r/Seattle/comments/anvj2p/whats_up_with_all_these_spas_being_women_only/,all_ads,6,,,,,,,,,,,,,,,,,,
juul_thief,,[],,text,t2_2hyfpbwh,False,False,False,1549483213,self.Seattle,https://www.reddit.com/r/Seattle/comments/anuswj/recommendations_on_where_to_live/,"{'gid_1': 0, 'gid_2': 0, 'gid_3': 0}",anuswj,True,False,False,False,True,True,False,,"[{'e': 'text', 't': 'Moving / Visiting'}]",dark,richtext,False,False,True,18,0,False,all_ads,/r/Seattle/comments/anuswj/recommendations_on_where_to_live/,False,6,1549483214,1,"Hi I'm going to be a new grad moving to Seattle around the end of the summer. I will be working in Kent, but I'd like to live in the city and don't mind the commute. Bringing my car is an option. I like to go out and I'm interested in living somewhere with restaurants, bars, and stores within walking distance. Would really like to get the experience of living in the city of Seattle. Any recommendations of any nice neighborhoods in the city that are nice for young people to live? If you have any questions please ask.",True,False,False,Seattle,t5_2qhad,145753,public,self,Recommendations on where to live?,https://www.reddit.com/r/Seattle/comments/anuswj/recommendations_on_where_to_live/,all_ads,6,moving,Moving / Visiting,,,,,,,,,,,,,,,,
magenta_placenta,,[],,text,t2_3bhyn,False,False,False,1549482780,seattle.gov,https://www.reddit.com/r/Seattle/comments/anuq1c/the_city_of_seattle_surveillance_ordinance_125376/,"{'gid_1': 0, 'gid_2': 0, 'gid_3': 0}",anuq1c,True,False,False,False,True,False,False,,[],dark,text,False,False,True,0,0,False,all_ads,/r/Seattle/comments/anuq1c/the_city_of_seattle_surveillance_ordinance_125376/,False,6,1549482781,1,,True,False,False,Seattle,t5_2qhad,145753,public,default,"The City of Seattle Surveillance Ordinance 125376 took effect on September 1, 2017 and is designed to provide greater transparency to City Council and the public when the City acquires technology that meets the City's definition of surveillance",http://www.seattle.gov/tech/initiatives/privacy/surveillance-technologies,all_ads,6,,,,,,,,,,,,,,,,,,
madness707,,[],,text,t2_exyvjjn,False,False,False,1549482779,self.Seattle,https://www.reddit.com/r/Seattle/comments/anuq12/moving_to_seattle_possibly_in_the_summer/,"{'gid_1': 0, 'gid_2': 0, 'gid_3': 0}",anuq12,True,False,False,False,True,True,False,,[],dark,text,False,False,True,29,0,False,all_ads,/r/Seattle/comments/anuq12/moving_to_seattle_possibly_in_the_summer/,False,6,1549482780,1,"Family of 4. And 2 dogs .  Looking to move to Seattle, kinda by the Seattle center.   I know it can get pricey but ant tips on apartment in the ""city"" life that would be good for my 2 kids(good schools) and 2 dogs for walking.

Priority is safety and schools for us for sure. Of course I never lived in an apartment but seeing some apartments have nice amenities would be nice !   

Thank you all kind Seattle locals!",True,False,False,Seattle,t5_2qhad,145753,public,self,Moving to seattle possibly in the summer.,https://www.reddit.com/r/Seattle/comments/anuq12/moving_to_seattle_possibly_in_the_summer/,all_ads,6,,,,,,,,,,,,,,,,,,
wookywooky369,,[],,text,t2_13j5lg,False,False,False,1549479140,i.redd.it,https://www.reddit.com/r/Seattle/comments/anu1gw/happy_hump_day/,"{'gid_1': 0, 'gid_2': 0, 'gid_3': 0}",anu1gw,True,False,False,True,True,False,False,,"[{'e': 'text', 't': 'Media'}]",dark,richtext,False,False,True,0,0,False,all_ads,/r/Seattle/comments/anu1gw/happy_hump_day/,False,6,1549479141,1,,True,False,False,Seattle,t5_2qhad,145746,public,default,Happy hump day! 🥶,https://i.redd.it/jf11ighhvze21.jpg,all_ads,6,flair,Media,,,,,,,,,,,,,,,,
thidwickthemoose,,[],,text,t2_7w0qap3,False,False,False,1549478041,patch.com,https://www.reddit.com/r/Seattle/comments/antu1k/brace_yourselves_its_coming/,"{'gid_1': 0, 'gid_2': 0, 'gid_3': 0}",antu1k,True,False,False,False,True,False,False,,[],dark,text,False,False,True,0,0,False,all_ads,/r/Seattle/comments/antu1k/brace_yourselves_its_coming/,False,6,1549478042,1,,True,False,False,Seattle,t5_2qhad,145742,public,https://a.thumbs.redditmedia.com/BXE4uc0OI3rS6YG7iXsxB7zh0fzHpaj8GzCr2MNHGp4.jpg,Brace yourselves... It's coming.,https://patch.com/washington/seattle/snowiest-coldest-weather-decade-headed-puget-sound,all_ads,6,,,link,"{'enabled': False, 'images': [{'id': '9otSgVu_gZGXMXUTBxSOwH5mWQqt0a8z3o41cFHkGUk', 'resolutions': [{'height': 81, 'url': 'https://external-preview.redd.it/0Eo1HzXczb-3QxLi5p1BhL3y9hgyINsCg3_uFNz73I0.jpg?width=108&amp;crop=smart&amp;auto=webp&amp;s=6542b4a04ddd8f95d155c63153adabea92450b17', 'width': 108}, {'height': 162, 'url': 'https://external-preview.redd.it/0Eo1HzXczb-3QxLi5p1BhL3y9hgyINsCg3_uFNz73I0.jpg?width=216&amp;crop=smart&amp;auto=webp&amp;s=9eab1f6c635bc5082dbbe346b5a2657828aa31db', 'width': 216}, {'height': 240, 'url': 'https://external-preview.redd.it/0Eo1HzXczb-3QxLi5p1BhL3y9hgyINsCg3_uFNz73I0.jpg?width=320&amp;crop=smart&amp;auto=webp&amp;s=11a5534018f5077c01a9dcfd223ffedabb20722b', 'width': 320}, {'height': 480, 'url': 'https://external-preview.redd.it/0Eo1HzXczb-3QxLi5p1BhL3y9hgyINsCg3_uFNz73I0.jpg?width=640&amp;crop=smart&amp;auto=webp&amp;s=5d22d6c4de98309877a8720a3473f6d65e09be0b', 'width': 640}], 'source': {'height': 600, 'url': 'https://external-preview.redd.it/0Eo1HzXczb-3QxLi5p1BhL3y9hgyINsCg3_uFNz73I0.jpg?auto=webp&amp;s=63e79dfba0d5b7136b8a0b31c2bf5826b6fe981f', 'width': 800}, 'variants': {}}]}",105.0,140.0,,,,,,,,,,,,
wiscowonder,flair,"[{'e': 'text', 't': 'Bainbridge Island'}]",Bainbridge Island,richtext,t2_8e7s8,False,False,False,1549474437,reddit.com,https://www.reddit.com/r/Seattle/comments/ant5vp/with_the_99_tunnel_now_open_i_think_its_a_good/,"{'gid_1': 0, 'gid_2': 0, 'gid_3': 0}",ant5vp,True,False,False,False,True,False,False,,[],dark,text,False,False,True,4,0,False,all_ads,/r/Seattle/comments/ant5vp/with_the_99_tunnel_now_open_i_think_its_a_good/,False,6,1549474438,1,,True,False,False,Seattle,t5_2qhad,145734,public,default,"With the 99 tunnel now open I think it's a good time to revisit the ""Reddit office pool on how far Bertha makes it before she breaks down again"" post. Any Bertha-believers get paid out?",https://www.reddit.com/r/Seattle/comments/3xwzs9/reddit_office_pool_on_how_far_bertha_makes_it/,all_ads,6,,,,,,,,dark,,,,,,,,,,
Psycho-semantic,,[],,text,t2_15870h,False,False,False,1549474222,self.Seattle,https://www.reddit.com/r/Seattle/comments/ant4gv/i_just_wanted_to_see_if_their_were_any/,"{'gid_1': 0, 'gid_2': 0, 'gid_3': 0}",ant4gv,True,False,False,False,True,True,False,,[],dark,text,False,False,True,3,0,False,all_ads,/r/Seattle/comments/ant4gv/i_just_wanted_to_see_if_their_were_any/,False,6,1549474224,1,Just wanted to let you knoe its all your fault and this is what theyve been talking about for 10 years. ,True,False,False,Seattle,t5_2qhad,145734,public,self,I just wanted to see if their were any anti-vaxxers here?,https://www.reddit.com/r/Seattle/comments/ant4gv/i_just_wanted_to_see_if_their_were_any/,all_ads,6,,,,,,,,,,,,,,,,,,
rynkwng,,[],,text,t2_2aljscnd,False,False,False,1549472630,i.redd.it,https://www.reddit.com/r/Seattle/comments/anstrs/emjoying_the_sun_before_the_snow_returns/,"{'gid_1': 0, 'gid_2': 0, 'gid_3': 0}",anstrs,True,False,False,True,True,False,False,,"[{'e': 'text', 't': 'Media'}]",dark,richtext,False,False,True,4,0,False,all_ads,/r/Seattle/comments/anstrs/emjoying_the_sun_before_the_snow_returns/,False,6,1549472631,1,,True,False,False,Seattle,t5_2qhad,145730,public,default,Emjoying the sun before the snow returns.,https://i.redd.it/vtpzvfl4cze21.jpg,all_ads,6,flair,Media,,,,,,,cba61046-412a-11e8-8b48-0e90cbddd944,,,,,,,,,
BigCitySmallGuy,,[],,text,t2_fy36xe8,False,False,False,1549471965,self.Seattle,https://www.reddit.com/r/Seattle/comments/ansp70/seattlelites_in_january_this_is_one_of_the/,"{'gid_1': 0, 'gid_2': 0, 'gid_3': 0}",ansp70,True,False,False,False,True,True,False,,[],dark,text,False,False,True,9,0,False,all_ads,/r/Seattle/comments/ansp70/seattlelites_in_january_this_is_one_of_the/,False,6,1549471967,1,"Seattlelites in February: "" This is one of the coldest winters ever""

And for some reason, I hear those two every year",True,False,False,Seattle,t5_2qhad,145729,public,self,"Seattlelites in January: ""This is one of the warmest winters ever""",https://www.reddit.com/r/Seattle/comments/ansp70/seattlelites_in_january_this_is_one_of_the/,all_ads,6,,,,,,,,,,,,,,,,,,
theschwill,,[],,text,t2_jyncx,False,False,False,1549471169,i.redd.it,https://www.reddit.com/r/Seattle/comments/ansjvo/how_do_i_get_this_car_towed_asap/,"{'gid_1': 0, 'gid_2': 0, 'gid_3': 0}",ansjvo,True,False,False,True,True,False,False,,"[{'e': 'text', 't': 'Media'}]",dark,richtext,False,False,True,88,0,False,all_ads,/r/Seattle/comments/ansjvo/how_do_i_get_this_car_towed_asap/,False,6,1549471170,1,,True,False,False,Seattle,t5_2qhad,145728,public,default,How do I get this car towed asap?,https://i.redd.it/tdsk82gs7ze21.jpg,all_ads,6,flair,Media,,,,,,,,,,,,,,,,
scobeavs,,[],,text,t2_migmp,False,False,False,1549467210,i.imgur.com,https://www.reddit.com/r/Seattle/comments/anru9b/i_recently_moved_from_seattle_to_san_diego_and/,"{'gid_1': 0, 'gid_2': 0, 'gid_3': 0}",anru9b,True,False,False,False,True,False,False,,"[{'e': 'text', 't': 'Media'}]",dark,richtext,False,False,True,2,0,False,all_ads,/r/Seattle/comments/anru9b/i_recently_moved_from_seattle_to_san_diego_and/,False,6,1549467211,1,,True,False,False,Seattle,t5_2qhad,145711,public,default,"I recently moved from Seattle to San Diego, and every time it rains my new HR manager gives me a hard time. Yesterday he sent me an email about it, and this was my reply.",https://i.imgur.com/dOfXsKY.jpg,all_ads,6,flair,Media,,,,,,,,,,,,,,,,
pizzapilatesmom789,,[],,text,t2_3421pei1,False,False,False,1549467188,self.Seattle,https://www.reddit.com/r/Seattle/comments/anru50/boston_to_seattle/,"{'gid_1': 0, 'gid_2': 0, 'gid_3': 0}",anru50,True,False,False,False,True,True,False,,[],dark,text,False,False,True,8,0,False,all_ads,/r/Seattle/comments/anru50/boston_to_seattle/,False,6,1549467189,1,"Hi everyone! Thinking of moving my family from Boston to the eastside ‘burbs of Seattle. For any recent transplants from the east coast, how do you like it? Did anything surprise you? What do you like better, worse? Thanks so much in advance. It’s such a big transition and any insights would be so greatly appreciated. ❤️",True,False,False,Seattle,t5_2qhad,145710,public,self,Boston to Seattle,https://www.reddit.com/r/Seattle/comments/anru50/boston_to_seattle/,all_ads,6,,,,,,,,,,,,,,,,,,
oni2016,,[],,text,t2_27wbvnuw,False,False,False,1549458558,/r/Seattle/comments/anqjbq/i5_lakewood_crash_yesterday_feb_2019/,https://www.reddit.com/r/Seattle/comments/anqjbq/i5_lakewood_crash_yesterday_feb_2019/,"{'gid_1': 0, 'gid_2': 0, 'gid_3': 0}",anqjbq,True,False,False,False,True,False,True,,[],dark,text,False,False,True,1,0,False,all_ads,/r/Seattle/comments/anqjbq/i5_lakewood_crash_yesterday_feb_2019/,False,6,1549458558,1,,True,False,False,Seattle,t5_2qhad,145695,public,default,I5 Lakewood crash yesterday feb 2019,https://v.redd.it/kjhfdotv5ye21,all_ads,6,,,,,,,,,,,,,,,,,,
peppermint_queen,,[],,text,t2_y255o,False,False,False,1549441295,self.Seattle,https://www.reddit.com/r/Seattle/comments/anop0b/do_you_know_this_fremont_homeless_woman/,"{'gid_1': 0, 'gid_2': 0, 'gid_3': 0}",anop0b,True,False,False,False,True,True,False,,[],dark,text,False,False,True,5,0,False,all_ads,/r/Seattle/comments/anop0b/do_you_know_this_fremont_homeless_woman/,False,6,1549441296,1,"I see this homeless woman in Fremont almost daily. She looks to be around 70 years old, wears a yellow coat, and pushes a tilt-back cart of her belongings. She spends a lot of time right by the PCC. 

To be honest, I'm really worried about her with this weather. Does anyone know her story? Have you talked to her?

I've never spoken to her, she's very quiet. Never asks for anything. I find myself wanting to help her but I'm not sure how. Any info about her would be greatly appreciated. Thank you!",True,False,False,Seattle,t5_2qhad,145680,public,self,Do you know this Fremont homeless woman?,https://www.reddit.com/r/Seattle/comments/anop0b/do_you_know_this_fremont_homeless_woman/,all_ads,6,,,,,,,,,,,,,,,,,,
Bradleycastaneda,,[],,text,t2_wmwn9,False,False,False,1549436144,/r/Seattle/comments/ano5cn/here_she_comes_folks_this_could_be_a_big_storm_if/,https://www.reddit.com/r/Seattle/comments/ano5cn/here_she_comes_folks_this_could_be_a_big_storm_if/,"{'gid_1': 0, 'gid_2': 0, 'gid_3': 0}",ano5cn,True,False,False,False,True,False,True,,"[{'e': 'text', 't': 'News'}]",dark,richtext,False,False,True,25,0,False,all_ads,/r/Seattle/comments/ano5cn/here_she_comes_folks_this_could_be_a_big_storm_if/,False,6,1549436145,1,,True,False,False,Seattle,t5_2qhad,145666,public,default,Here she comes folks! This could be a big storm if she puts us in her crosshairs.,https://v.redd.it/rs7rcl9kbwe21,all_ads,6,flair,News,,,,,,,9f9ba910-f804-11e4-be5c-0ea18645ab5f,,,,,,,,,
sludgecakeconveyor,,[],,text,t2_i55ko,False,False,False,1549432733,i.imgur.com,https://www.reddit.com/r/Seattle/comments/annr3t/cliff_mass_adsense_so_hot_right_now/,"{'gid_1': 0, 'gid_2': 0, 'gid_3': 0}",annr3t,True,False,False,False,True,False,False,,"[{'e': 'text', 't': 'Media'}]",dark,richtext,False,False,True,1,0,False,all_ads,/r/Seattle/comments/annr3t/cliff_mass_adsense_so_hot_right_now/,False,6,1549432734,1,,False,False,False,Seattle,t5_2qhad,145657,public,https://a.thumbs.redditmedia.com/MLrJHerpo26FCwyRMaJTLrH2QYePGSpbSUoAnJxioK4.jpg,Cliff Mass Adsense - So hot right now.,https://i.imgur.com/iIBeulu.jpg,all_ads,6,flair,Media,image,"{'enabled': True, 'images': [{'id': 'gY8JNd9GUC2Sdt9zaIEjRiefbxWAKCDqZjGKz6TdFY8', 'resolutions': [{'height': 90, 'url': 'https://external-preview.redd.it/vxkyFxMF3H8lJ3D-lRaksmFhnmeeqv7grxeBgi_LodQ.jpg?width=108&amp;crop=smart&amp;auto=webp&amp;s=8de210256dda09accdbf149093268639fa2a63ee', 'width': 108}, {'height': 181, 'url': 'https://external-preview.redd.it/vxkyFxMF3H8lJ3D-lRaksmFhnmeeqv7grxeBgi_LodQ.jpg?width=216&amp;crop=smart&amp;auto=webp&amp;s=b3d36eff9a8f65cd746774f611b86114617adfa1', 'width': 216}, {'height': 268, 'url': 'https://external-preview.redd.it/vxkyFxMF3H8lJ3D-lRaksmFhnmeeqv7grxeBgi_LodQ.jpg?width=320&amp;crop=smart&amp;auto=webp&amp;s=903e08cfaa05ba9191f9e8562f8dc4008a751130', 'width': 320}, {'height': 537, 'url': 'https://external-preview.redd.it/vxkyFxMF3H8lJ3D-lRaksmFhnmeeqv7grxeBgi_LodQ.jpg?width=640&amp;crop=smart&amp;auto=webp&amp;s=6f617e1549a9e78e62a99a1fac501b0ed30c4d7e', 'width': 640}], 'source': {'height': 581, 'url': 'https://external-preview.redd.it/vxkyFxMF3H8lJ3D-lRaksmFhnmeeqv7grxeBgi_LodQ.jpg?auto=webp&amp;s=309ee64a8f0f3b91071b51a7c660a6afa1af52cd', 'width': 692}, 'variants': {}}]}",117.0,140.0,,,,,,,,,,,,
IRedditHereCody,,[],,text,t2_q67omat,False,False,False,1549429353,self.Seattle,https://www.reddit.com/r/Seattle/comments/annaij/no_parking_barricade_moving_questions/,"{'gid_1': 0, 'gid_2': 0, 'gid_3': 0}",annaij,True,False,False,False,True,True,False,,[],dark,text,False,False,True,7,0,False,all_ads,/r/Seattle/comments/annaij/no_parking_barricade_moving_questions/,False,6,1549429354,1,"Hello! My wife and I are moving to West Seattle at the end of this month/beginning of next. I have a moving truck I will need to park off street.

In my research I've found I need to get some no parking barricades and then place a printed notice on them. The barricades need to be placed 72 hours ahead of time. The issue is I will not be in Seattle 72 hours before my moving truck. Is there a company that will rent and place them? 

The other issue is the printed notice that need to be on the barricades 24 hours ahead of time. I have hired a company to unload the morning after I arrive so I could probably put the notice up 12 - 18 hours in advance. Do you think this will be an issue, any suggestions?

Finally I will have a 16 foot moving truck, with ramp I'm thinking I may need 3 barricades? Sound right?

Thanks for any help and suggestions, can't wait to get out there!",True,False,False,Seattle,t5_2qhad,145651,public,self,No Parking Barricade Moving Questions,https://www.reddit.com/r/Seattle/comments/annaij/no_parking_barricade_moving_questions/,all_ads,6,,,,,,,,,,,,,,,,,,
syncopation1,flair,"[{'e': 'text', 't': 'Ballard'}]",Ballard,richtext,t2_ony2a,False,False,False,1549429055,self.Seattle,https://www.reddit.com/r/Seattle/comments/ann8wy/psa_get_an_outdoor_faucet_cover/,"{'gid_1': 0, 'gid_2': 0, 'gid_3': 0}",ann8wy,True,False,False,False,True,True,False,,[],dark,text,False,False,True,2,0,False,all_ads,/r/Seattle/comments/ann8wy/psa_get_an_outdoor_faucet_cover/,False,6,1549429057,1,"Get an [outdoor faucet cover](https://www.homedepot.com/p/M-D-Building-Products-5-in-x-4-5-in-White-Faucet-Cover-03939/205129964) so your pipes don't freeze and blow up. You can get them at Fred Meyer, Home Depot, Lowe's or on Amazon. ",True,False,False,Seattle,t5_2qhad,145651,public,self,PSA: Get an outdoor faucet cover,https://www.reddit.com/r/Seattle/comments/ann8wy/psa_get_an_outdoor_faucet_cover/,all_ads,6,,,self,"{'enabled': False, 'images': [{'id': 'LsdZnn-gF3Gv9lSr5Iht6j_yfBas2jHcyeDF0qtSNoQ', 'resolutions': [{'height': 108, 'url': 'https://external-preview.redd.it/burtBe3O5cN_9Ce6waQDFfjPhcDM-0b0xriu74KVf_c.jpg?width=108&amp;crop=smart&amp;auto=webp&amp;s=cc76627c589e9484cc904cac1e6ef02a7272c623', 'width': 108}, {'height': 216, 'url': 'https://external-preview.redd.it/burtBe3O5cN_9Ce6waQDFfjPhcDM-0b0xriu74KVf_c.jpg?width=216&amp;crop=smart&amp;auto=webp&amp;s=eaaec8afdefbc532b4d8f2fcaf062c5a59557f4e', 'width': 216}], 'source': {'height': 300, 'url': 'https://external-preview.redd.it/burtBe3O5cN_9Ce6waQDFfjPhcDM-0b0xriu74KVf_c.jpg?auto=webp&amp;s=b64e51231775e99e065f3de858b3907f65415fa5', 'width': 300}, 'variants': {}}]}",,,,dark,,,,,,,,,,
yeah4it_nw,,[],,text,t2_c0rwr,False,False,False,1549428748,i.redd.it,https://www.reddit.com/r/Seattle/comments/ann7co/queen_anne_house_its_in_the_details/,"{'gid_1': 0, 'gid_2': 0, 'gid_3': 0}",ann7co,True,False,False,True,True,False,False,,"[{'e': 'text', 't': 'Media'}]",dark,richtext,False,False,True,70,0,False,all_ads,/r/Seattle/comments/ann7co/queen_anne_house_its_in_the_details/,False,6,1549428749,1,,True,False,False,Seattle,t5_2qhad,145649,public,default,"Queen Anne House, it’s in the details",https://i.redd.it/zmg1c2jnpve21.jpg,all_ads,6,flair,Media,,,,,,,,,,,,,,,,
jonp,flair,"[{'e': 'text', 't': 'Pioneer Square'}]",Pioneer Square,richtext,t2_1slx,False,False,False,1549426198,i.redd.it,https://www.reddit.com/r/Seattle/comments/anmtq0/sending_a_message_to_the_guests_at_the_warwick/,"{'gid_1': 0, 'gid_2': 0, 'gid_3': 0}",anmtq0,True,False,False,True,True,False,False,,"[{'e': 'text', 't': 'Media'}]",dark,richtext,False,False,True,2,0,False,all_ads,/r/Seattle/comments/anmtq0/sending_a_message_to_the_guests_at_the_warwick/,False,6,1549426199,1,,True,False,False,Seattle,t5_2qhad,145644,public,default,Sending a message to the guests at the Warwick?,https://i.redd.it/x16h7clqhve21.jpg,all_ads,6,flair,Media,,,,,,dark,,,,,,,,,,
6shooter1971,,[],,text,t2_zs18c,False,False,False,1549421994,self.Seattle,https://www.reddit.com/r/Seattle/comments/anm6ix/icy_sunset/,"{'gid_1': 0, 'gid_2': 0, 'gid_3': 0}",anm6ix,True,False,False,False,True,True,False,,[],dark,text,False,False,True,0,0,False,all_ads,/r/Seattle/comments/anm6ix/icy_sunset/,False,6,1549421996,1,"&amp;#x200B;

https://i.redd.it/na0c6p0y4ve21.jpg",True,False,False,Seattle,t5_2qhad,145634,public,https://b.thumbs.redditmedia.com/6eFWqyMADtsWBChQoFNii6NOxy35-ik6iYQgel0aycU.jpg,Icy Sunset,https://www.reddit.com/r/Seattle/comments/anm6ix/icy_sunset/,all_ads,6,,,,,78.0,140.0,,,,"{'na0c6p0y4ve21': {'e': 'Image', 'id': 'na0c6p0y4ve21', 'm': 'image/jpg', 's': {'u': 'https://i.redd.it/na0c6p0y4ve21.jpg', 'x': 4240, 'y': 2384}, 'status': 'valid'}}",,,,,,,,
scottiek,,[],,text,t2_46srk,False,False,False,1549421351,i.redd.it,https://www.reddit.com/r/Seattle/comments/anm314/ice_ice_baby/,"{'gid_1': 0, 'gid_2': 0, 'gid_3': 0}",anm314,True,False,False,True,True,False,False,,[],dark,text,False,False,True,4,0,False,all_ads,/r/Seattle/comments/anm314/ice_ice_baby/,False,6,1549421351,1,,True,False,False,Seattle,t5_2qhad,145630,public,default,Ice Ice Baby,https://i.redd.it/4dw29rsn3ve21.jpg,all_ads,6,,,,,,,,,,,,,,,,,,
jzgs18,,[],,text,t2_wxxhufx,False,False,False,1549416527,seattletimes.com,https://www.reddit.com/r/Seattle/comments/anlccx/eviction_reforms_in_olympia_get_a_boost_from/,"{'gid_1': 0, 'gid_2': 0, 'gid_3': 0}",anlccx,True,False,False,False,True,False,False,,"[{'e': 'text', 't': 'Soft paywall'}]",dark,richtext,False,False,True,3,0,False,all_ads,/r/Seattle/comments/anlccx/eviction_reforms_in_olympia_get_a_boost_from/,False,6,1549416529,1,,True,False,False,Seattle,t5_2qhad,145617,public,https://a.thumbs.redditmedia.com/5istCy7p91HCN0J_6epkb4s03tL1l9_0No_5A7JaHe4.jpg,Eviction reforms in Olympia get a boost from Seattle’s tech giants,https://www.seattletimes.com/seattle-news/politics/eviction-reforms-in-olympia-get-a-boost-from-seattles-tech-giants/,all_ads,6,,Soft paywall,link,"{'enabled': False, 'images': [{'id': 'YRIhxl6KpYce1NC2fMqyiZqNZkh0ZOxxD5EJAas_E44', 'resolutions': [{'height': 108, 'url': 'https://external-preview.redd.it/1zcBl_bvSIbV-95FSc_cqAUd_3HEFTwCXWCl88ldz60.jpg?width=108&amp;crop=smart&amp;auto=webp&amp;s=1848ccc372794e3581f82b5cd920137dae952e94', 'width': 108}], 'source': {'height': 200, 'url': 'https://external-preview.redd.it/1zcBl_bvSIbV-95FSc_cqAUd_3HEFTwCXWCl88ldz60.jpg?auto=webp&amp;s=8cb142f87c407219dc402f329b2de0d6ebbfeaef', 'width': 200}, 'variants': {}}]}",140.0,140.0,,,,,,,,,,,,
byron_mu,,[],,text,t2_aqg7m,False,False,False,1549415030,self.Seattle,https://www.reddit.com/r/Seattle/comments/anl40u/where_to_watch_the_sotu/,"{'gid_1': 0, 'gid_2': 0, 'gid_3': 0}",anl40u,True,False,False,False,True,True,False,,[],dark,text,False,False,True,5,0,False,all_ads,/r/Seattle/comments/anl40u/where_to_watch_the_sotu/,False,6,1549415032,1,Bars downtown??? Any ideas?,True,False,False,Seattle,t5_2qhad,145616,public,self,Where to watch the SOTU?,https://www.reddit.com/r/Seattle/comments/anl40u/where_to_watch_the_sotu/,all_ads,6,,,,,,,,,,,,,,,,,,
Cattiechu,,[],,text,t2_12dlj0,False,False,False,1549414180,self.Seattle,https://www.reddit.com/r/Seattle/comments/ankz3e/is_parking_at_uw_free_when_school_is_canceled/,"{'gid_1': 0, 'gid_2': 0, 'gid_3': 0}",ankz3e,True,False,False,False,True,True,False,,[],dark,text,False,False,True,4,0,False,all_ads,/r/Seattle/comments/ankz3e/is_parking_at_uw_free_when_school_is_canceled/,False,6,1549414182,1,"I can’t find anything online, please don’t troll me. Specifically by the link station? ",True,False,False,Seattle,t5_2qhad,145613,public,self,Is parking at UW free when school is canceled?,https://www.reddit.com/r/Seattle/comments/ankz3e/is_parking_at_uw_free_when_school_is_canceled/,all_ads,6,,,,,,,,,,,,,,,,,,
