all_awardings,allow_live_comments,author,author_flair_css_class,author_flair_richtext,author_flair_text,author_flair_type,author_fullname,author_patreon_flair,author_premium,awarders,can_mod_post,contest_mode,created_utc,domain,full_link,gildings,id,is_crosspostable,is_meta,is_original_content,is_reddit_media_domain,is_robot_indexable,is_self,is_video,link_flair_background_color,link_flair_css_class,link_flair_richtext,link_flair_text,link_flair_text_color,link_flair_type,locked,media_only,no_follow,num_comments,num_crossposts,over_18,parent_whitelist_status,permalink,pinned,post_hint,preview,pwls,retrieved_on,score,selftext,send_replies,spoiler,stickied,subreddit,subreddit_id,subreddit_subscribers,subreddit_type,thumbnail,thumbnail_height,thumbnail_width,title,total_awards_received,url,whitelist_status,wls,author_flair_background_color,author_flair_text_color,link_flair_template_id,crosspost_parent,crosspost_parent_list,author_flair_template_id,removed_by_category,media,media_embed,secure_media,secure_media_embed
[],False,notananthem,,[],,text,t2_7lhaa,False,False,[],False,False,1584032214,i.redd.it,https://www.reddit.com/r/Seattle/comments/fhji7b/ive_been_in_hardwarelumber_stores_where_this_crap/,{},fhji7b,True,False,False,True,True,False,False,,flair,"[{'e': 'text', 't': 'Media'}]",Media,dark,richtext,False,False,True,29,0,False,all_ads,/r/Seattle/comments/fhji7b/ive_been_in_hardwarelumber_stores_where_this_crap/,False,image,"{'enabled': True, 'images': [{'id': 'IznvwU-AouW0gF1KDhW4-FROTCpK2RQ-gMnwpGOb0zA', 'resolutions': [{'height': 35, 'url': 'https://preview.redd.it/4icfjxobv9m41.png?width=108&amp;crop=smart&amp;auto=webp&amp;s=05f9b652ce12e15bb4861c246bb4d73dc0e2f126', 'width': 108}, {'height': 70, 'url': 'https://preview.redd.it/4icfjxobv9m41.png?width=216&amp;crop=smart&amp;auto=webp&amp;s=266d31a8146b0d1b936d868f6387920bef126228', 'width': 216}, {'height': 104, 'url': 'https://preview.redd.it/4icfjxobv9m41.png?width=320&amp;crop=smart&amp;auto=webp&amp;s=02550600f2e584a08c4061cd73b0e52a11c67688', 'width': 320}, {'height': 208, 'url': 'https://preview.redd.it/4icfjxobv9m41.png?width=640&amp;crop=smart&amp;auto=webp&amp;s=50a48eda3decda8cb8724ac0754bf2757eff7d5d', 'width': 640}, {'height': 313, 'url': 'https://preview.redd.it/4icfjxobv9m41.png?width=960&amp;crop=smart&amp;auto=webp&amp;s=74431de9a84ee45b27a79e1a94a310566949d9ea', 'width': 960}, {'height': 352, 'url': 'https://preview.redd.it/4icfjxobv9m41.png?width=1080&amp;crop=smart&amp;auto=webp&amp;s=be0acbca4213def2cfb03230cb00c99081e69f9e', 'width': 1080}], 'source': {'height': 625, 'url': 'https://preview.redd.it/4icfjxobv9m41.png?auto=webp&amp;s=4fb50c0c9fc47e352e35e8b2fc96077394750e97', 'width': 1915}, 'variants': {}}]}",6,1584032224,1,,True,False,False,Seattle,t5_2qhad,192268,public,https://b.thumbs.redditmedia.com/5yYSMj63y5M_uJ7jglq5InHMSkmy-NrcVTbQtZHEzoA.jpg,45.0,140.0,I've been in hardware/lumber stores where this crap is happening: you are going to kill people,0,https://i.redd.it/4icfjxobv9m41.png,all_ads,6,,,,,,,,,,,
[],False,wsdot,flair verified,"[{'e': 'text', 't': 'WA State Dept of Transportation'}]",WA State Dept of Transportation,richtext,t2_4upd9,False,False,[],False,False,1584030707,wsdotblog.blogspot.com,https://www.reddit.com/r/Seattle/comments/fhj32p/whats_going_on_with_seattle_area_traffic_with/,{},fhj32p,True,False,False,False,True,False,False,,,[],,dark,text,False,False,True,5,0,False,all_ads,/r/Seattle/comments/fhj32p/whats_going_on_with_seattle_area_traffic_with/,False,link,"{'enabled': False, 'images': [{'id': 'Niq6_6lhdx-TuyRYvfhd6gSXP85UnBpsIvLbAUib7bY', 'resolutions': [{'height': 56, 'url': 'https://external-preview.redd.it/2F5aAVZtFtjuFYCHusvzEo6_ZrJNU0p2y7Meh8y9lsI.jpg?width=108&amp;crop=smart&amp;auto=webp&amp;s=dfdb8d3f37ef4fad32a5132c8747dabbb14c4d0c', 'width': 108}, {'height': 113, 'url': 'https://external-preview.redd.it/2F5aAVZtFtjuFYCHusvzEo6_ZrJNU0p2y7Meh8y9lsI.jpg?width=216&amp;crop=smart&amp;auto=webp&amp;s=eb21322ca863f60bfef98535f85e6ebcbfec618a', 'width': 216}, {'height': 168, 'url': 'https://external-preview.redd.it/2F5aAVZtFtjuFYCHusvzEo6_ZrJNU0p2y7Meh8y9lsI.jpg?width=320&amp;crop=smart&amp;auto=webp&amp;s=03d46400f3afc484a23a03e9778cfac9c73b6d12', 'width': 320}, {'height': 336, 'url': 'https://external-preview.redd.it/2F5aAVZtFtjuFYCHusvzEo6_ZrJNU0p2y7Meh8y9lsI.jpg?width=640&amp;crop=smart&amp;auto=webp&amp;s=45a71144937f051084d9e1619400de30db186971', 'width': 640}, {'height': 504, 'url': 'https://external-preview.redd.it/2F5aAVZtFtjuFYCHusvzEo6_ZrJNU0p2y7Meh8y9lsI.jpg?width=960&amp;crop=smart&amp;auto=webp&amp;s=9138a87bc3027440149d8384cbd9338176b4139f', 'width': 960}, {'height': 567, 'url': 'https://external-preview.redd.it/2F5aAVZtFtjuFYCHusvzEo6_ZrJNU0p2y7Meh8y9lsI.jpg?width=1080&amp;crop=smart&amp;auto=webp&amp;s=10a0a91891abef4282e04e13a8a58c91570d370a', 'width': 1080}], 'source': {'height': 630, 'url': 'https://external-preview.redd.it/2F5aAVZtFtjuFYCHusvzEo6_ZrJNU0p2y7Meh8y9lsI.jpg?auto=webp&amp;s=c3521cbab4e3759ef8f10884d9428abc5441dd79', 'width': 1200}, 'variants': {}}]}",6,1584030721,1,,True,False,False,Seattle,t5_2qhad,192266,public,https://b.thumbs.redditmedia.com/nDV5fEaaxL86Wwedj5s8U76zY61mScJl8EB_UDyPOZw.jpg,73.0,140.0,What's going on with Seattle area traffic with COVID-19?,0,https://wsdotblog.blogspot.com/2020/03/seattle-area-traffic-covid-19.html,all_ads,6,,dark,,,,,,,,,
[],False,thehofstetter,,[],,text,t2_3344n,False,False,[],False,False,1584029633,self.Seattle,https://www.reddit.com/r/Seattle/comments/fhishv/refunds_for_my_upcoming_shows_in_the_pacific/,{},fhishv,True,False,False,False,True,True,False,,,[],,dark,text,False,False,True,19,0,False,all_ads,/r/Seattle/comments/fhishv/refunds_for_my_upcoming_shows_in_the_pacific/,False,,,6,1584029639,1,"Hey, Steve Hofstetter here. If you have tickets to my pacific northwest tour (March 19 through March 28), please read this. You may also read this if you don't have tickets, but it may be a waste of your time. You have tons of COVID-19 emails to read from companies you bought one thing from 7 years ago. 

We are cancelling the Yakima show as it's at a venue above the state-recommended 250 capacity. Those who bought tickets will automatically receive a full refund. All the other venues are at 250 or fewer, and we are not currently planning on cancelling those shows. 

We are, however, offering refunds to anyone who has purchased tickets that does not feel comfortable attending. If you are 60 years or older, we recommend you take us up on this offer. This goes for Eugene, Everett, Vancouver, Kelowna, Richland, Spokane, Moscow, Couer d'Alene, and Seattle. (That is for the city of Eugene Oregon, not just a guy named Eugene). If you'd like a refund, please email refunds@stevehofstetter.com before Monday March 16th so he has time to process all of them. Please include the name you purchased tickets under and the date/time &amp; city of the show. 

As the situation develops, we will be making decisions on future tours as well. 

In the interests of public health, there will be a few changes at the meet and greet after the shows. As much as I want to shake hands with everyone, there will be absolutely no physical contact post-show, even for pictures. Also, sales will be credit card only to avoid the transfer of cash between parties. The good news is we will still be selling shirts. Even if you don't like the shirts, they can be useful in a post-toilet paper society. (If you're one of those selfish toilet-paper hoarding monsters, I hope you get crushed by a giant pile of it).

If you do attend, of course, I'd love to see you. After the show, we will wave at each other longingly, like one of us is on a train slowly pulling away from the station. 

I do ask that you be mindful of your fellow patrons. Please, please, please wash your hand thoroughly before and after the show. (And just in general, you dirty dirty boy).

One last thing: the name of this virus is Covid-19, commonly referred to as Coronavirus. It is not called the ""China Virus"" unless you are an asshole trying to scare racist people. 

Thank you for reading. This is a very strange time to work in the people gathering business, and we appreciate you bearing with us as we figure this all out.",True,False,False,Seattle,t5_2qhad,192262,public,self,,,Refunds for my upcoming shows in the Pacific Northwest,0,https://www.reddit.com/r/Seattle/comments/fhishv/refunds_for_my_upcoming_shows_in_the_pacific/,all_ads,6,,,,,,,,,,,
[],False,rynkwng,,[],,text,t2_2aljscnd,False,False,[],False,False,1584029401,i.redd.it,https://www.reddit.com/r/Seattle/comments/fhiq97/same_salad_different_dressing/,{},fhiq97,True,False,False,True,True,False,False,,flair,"[{'e': 'text', 't': 'Media'}]",Media,dark,richtext,False,False,True,2,0,False,all_ads,/r/Seattle/comments/fhiq97/same_salad_different_dressing/,False,image,"{'enabled': True, 'images': [{'id': '8sS-2VcOeZRxMl91eqIXRZWeozGd1Kr0vSGcomqY6Yk', 'resolutions': [{'height': 72, 'url': 'https://preview.redd.it/fl65v2f5n9m41.jpg?width=108&amp;crop=smart&amp;auto=webp&amp;s=0835b7591b67721983d19f5069699ea809a7df0c', 'width': 108}, {'height': 144, 'url': 'https://preview.redd.it/fl65v2f5n9m41.jpg?width=216&amp;crop=smart&amp;auto=webp&amp;s=69c29a245339f26599ee5b39f26d0befca3cf9d5', 'width': 216}, {'height': 213, 'url': 'https://preview.redd.it/fl65v2f5n9m41.jpg?width=320&amp;crop=smart&amp;auto=webp&amp;s=b31069f9581f4a4ad4a881614421a0b7daf1a8aa', 'width': 320}, {'height': 426, 'url': 'https://preview.redd.it/fl65v2f5n9m41.jpg?width=640&amp;crop=smart&amp;auto=webp&amp;s=3afb6dec09ac304085fdb554023ffebf0625f42f', 'width': 640}, {'height': 640, 'url': 'https://preview.redd.it/fl65v2f5n9m41.jpg?width=960&amp;crop=smart&amp;auto=webp&amp;s=1ba0774861439162aa4ef4988fa89417744693dc', 'width': 960}, {'height': 720, 'url': 'https://preview.redd.it/fl65v2f5n9m41.jpg?width=1080&amp;crop=smart&amp;auto=webp&amp;s=8ab9b5384031f4a253c627fffd7d7f6ddae521c7', 'width': 1080}], 'source': {'height': 3783, 'url': 'https://preview.redd.it/fl65v2f5n9m41.jpg?auto=webp&amp;s=86905eb3d9b02f1709a867fc1f2e214f82d316de', 'width': 5674}, 'variants': {}}]}",6,1584029407,1,,True,False,False,Seattle,t5_2qhad,192260,public,https://a.thumbs.redditmedia.com/6NVnlSZYgm7Y_mzfOeKojlGaTBFXgOSv1TBDytsS5F8.jpg,93.0,140.0,Same salad different dressing,0,https://i.redd.it/fl65v2f5n9m41.jpg,all_ads,6,,,cba61046-412a-11e8-8b48-0e90cbddd944,,,,,,,,
[],False,neo_linux,,[],,text,t2_4e7zvlxn,False,False,[],False,False,1584029202,staythefuckhome.com,https://www.reddit.com/r/Seattle/comments/fhioe4/a_movement_to_stop_the_covid19_pandemic/,{},fhioe4,True,False,False,False,True,False,False,,flair,"[{'e': 'text', 't': 'Recommendation'}]",Recommendation,dark,richtext,False,False,True,7,0,False,all_ads,/r/Seattle/comments/fhioe4/a_movement_to_stop_the_covid19_pandemic/,False,,,6,1584029208,1,,True,False,False,Seattle,t5_2qhad,192260,public,default,,,A Movement to Stop the COVID-19 Pandemic,0,https://staythefuckhome.com/,all_ads,6,,,9f763cd0-473d-11e8-93f7-0e6f632c214e,,,,,,,,
[],False,OnlineMemeArmy,,[],,text,t2_3l1oj988,False,False,[],False,False,1584029123,geekwire.com,https://www.reddit.com/r/Seattle/comments/fhinoh/after_being_cashonly_for_62_years_seattle_burger/,{},fhinoh,True,False,False,False,True,False,False,,flair,"[{'e': 'text', 't': 'News'}]",News,dark,richtext,False,False,True,2,0,False,all_ads,/r/Seattle/comments/fhinoh/after_being_cashonly_for_62_years_seattle_burger/,False,link,"{'enabled': False, 'images': [{'id': 'bOJ6jmWiAZG41thDnwOLLFNUVDPIaepCp3DGJDd3OOo', 'resolutions': [{'height': 108, 'url': 'https://external-preview.redd.it/NG0cuZJvlx-XNrBSS9Nh25lGovNu8UzaMP02MSvJsFY.jpg?width=108&amp;crop=smart&amp;auto=webp&amp;s=f05e42a3502e3536cdabe8a746cafc5dbf562300', 'width': 108}, {'height': 216, 'url': 'https://external-preview.redd.it/NG0cuZJvlx-XNrBSS9Nh25lGovNu8UzaMP02MSvJsFY.jpg?width=216&amp;crop=smart&amp;auto=webp&amp;s=3c157d460689ac75442ff90d4f0567cc851c278c', 'width': 216}, {'height': 320, 'url': 'https://external-preview.redd.it/NG0cuZJvlx-XNrBSS9Nh25lGovNu8UzaMP02MSvJsFY.jpg?width=320&amp;crop=smart&amp;auto=webp&amp;s=2a76593421dd93cfd4f640bc654e57f11cd3d36c', 'width': 320}, {'height': 640, 'url': 'https://external-preview.redd.it/NG0cuZJvlx-XNrBSS9Nh25lGovNu8UzaMP02MSvJsFY.jpg?width=640&amp;crop=smart&amp;auto=webp&amp;s=00c7408ecde6761af51e5a92dba88036817c23ed', 'width': 640}, {'height': 960, 'url': 'https://external-preview.redd.it/NG0cuZJvlx-XNrBSS9Nh25lGovNu8UzaMP02MSvJsFY.jpg?width=960&amp;crop=smart&amp;auto=webp&amp;s=f339ac03cd18c9e0a17ece0ebc418e22586868c8', 'width': 960}, {'height': 1080, 'url': 'https://external-preview.redd.it/NG0cuZJvlx-XNrBSS9Nh25lGovNu8UzaMP02MSvJsFY.jpg?width=1080&amp;crop=smart&amp;auto=webp&amp;s=bfb88d82d95f6fb8442043e13929e4397b984f83', 'width': 1080}], 'source': {'height': 1240, 'url': 'https://external-preview.redd.it/NG0cuZJvlx-XNrBSS9Nh25lGovNu8UzaMP02MSvJsFY.jpg?auto=webp&amp;s=de9dfe884800e7699d44d84af2fc2669e11232f0', 'width': 1240}, 'variants': {}}]}",6,1584029130,1,,True,False,False,Seattle,t5_2qhad,192260,public,https://b.thumbs.redditmedia.com/B6beAEGi3GPF1oVdjg-DrgKseUm013jOKymnRyKIvwY.jpg,140.0,140.0,"After being cash-only for 62 years, Seattle burger chain Dick’s prefers only cards during coronavirus",0,https://www.geekwire.com/2020/cash-62-years-seattle-burger-chain-dicks-prefers-cards-coronavirus/,all_ads,6,,,9f9ba910-f804-11e4-be5c-0ea18645ab5f,,,,,,,,
[],False,labelsaredumb,,[],,text,t2_kq5zr,False,False,[],False,False,1584028636,self.Seattle,https://www.reddit.com/r/Seattle/comments/fhiitn/volunteer_organic_farming_in_exchange_for_produce/,{},fhiitn,True,False,False,False,True,True,False,,moving,"[{'e': 'text', 't': 'Moving / Visiting'}]",Moving / Visiting,dark,richtext,False,False,True,6,0,False,all_ads,/r/Seattle/comments/fhiitn/volunteer_organic_farming_in_exchange_for_produce/,False,,,6,1584028641,1,"While living in Austin, TX I would volunteer for 4 hours on an organic farm and then get bags of fresh produce in exchange afterwards. Are there any places like that around?",True,False,False,Seattle,t5_2qhad,192260,public,self,,,Volunteer organic farming in exchange for produce?,0,https://www.reddit.com/r/Seattle/comments/fhiitn/volunteer_organic_farming_in_exchange_for_produce/,all_ads,6,,,e210a192-4a63-11e8-839c-0e70be2d8a82,,,,,,,,
[],False,Ulttrix,,[],,text,t2_4ev2dula,False,False,[],False,False,1584027959,self.Seattle,https://www.reddit.com/r/Seattle/comments/fhic0b/cant_decide_between_bootcamps/,{},fhic0b,True,False,False,False,True,True,False,,,[],,dark,text,False,False,True,20,0,False,all_ads,/r/Seattle/comments/fhic0b/cant_decide_between_bootcamps/,False,,,6,1584027964,1,"I graduated from the UW full stack development Bootcamp in November and wasn't satisfied with the program the curriculum felt very rushed and the entire career services is a joke. I was thinking of going back to another Bootcamp and I can't decide between Code fellows and testing in to 301 or 401 course, Epicodus , or Flat Iron. I am looking for one that will teach the best curriculum and offer the best after graduation support and opportunitys for the Seattle area. 

TLDR: EPICODUS VS CODE FELLOWS VS FLAT IRON Bootcamp",True,False,False,Seattle,t5_2qhad,192258,public,self,,,Can't decide between bootcamps,0,https://www.reddit.com/r/Seattle/comments/fhic0b/cant_decide_between_bootcamps/,all_ads,6,,,,,,,,,,,
[],False,dope-beard,,[],,text,t2_3hdjgpx6,False,False,[],False,False,1584027925,i.redd.it,https://www.reddit.com/r/Seattle/comments/fhibrt/we_will_survive_this_too/,{},fhibrt,True,False,False,True,True,False,False,,flair,"[{'e': 'text', 't': 'Media'}]",Media,dark,richtext,False,False,True,10,0,False,all_ads,/r/Seattle/comments/fhibrt/we_will_survive_this_too/,False,image,"{'enabled': True, 'images': [{'id': 'J7btfFAw01ZYv20kdRGoOmvJfHnLVuM6S8y3l7LH3Jw', 'resolutions': [{'height': 109, 'url': 'https://preview.redd.it/2ozd42srx3m41.png?width=108&amp;crop=smart&amp;auto=webp&amp;s=2fb2b03058d34a05ac1620868cca84a4a7c31a9b', 'width': 108}, {'height': 218, 'url': 'https://preview.redd.it/2ozd42srx3m41.png?width=216&amp;crop=smart&amp;auto=webp&amp;s=e80f9ee23faf270f83f6ce2e2c85788861272ad6', 'width': 216}, {'height': 323, 'url': 'https://preview.redd.it/2ozd42srx3m41.png?width=320&amp;crop=smart&amp;auto=webp&amp;s=034bab0078f5a751b7142cb34f3e6aca491c151f', 'width': 320}, {'height': 646, 'url': 'https://preview.redd.it/2ozd42srx3m41.png?width=640&amp;crop=smart&amp;auto=webp&amp;s=cece094cb4b4ad9e5ce988eb410e8003efd5db0b', 'width': 640}], 'source': {'height': 800, 'url': 'https://preview.redd.it/2ozd42srx3m41.png?auto=webp&amp;s=435a1a4a1594f68605ccd64ab3d80f01d782322e', 'width': 792}, 'variants': {}}]}",6,1584027933,1,,True,False,False,Seattle,t5_2qhad,192258,public,https://a.thumbs.redditmedia.com/kaf3N2PjgNYQwDGDw2_azuFxNwEEaQvKaUlxsjWpJM8.jpg,140.0,140.0,We will survive this too.,0,https://i.redd.it/2ozd42srx3m41.png,all_ads,6,,,,t3_fh49xy,"[{'all_awardings': [], 'allow_live_comments': False, 'approved_at_utc': None, 'approved_by': None, 'archived': False, 'author': 'BattlemechJohnBrown', 'author_flair_background_color': None, 'author_flair_css_class': None, 'author_flair_richtext': [], 'author_flair_template_id': None, 'author_flair_text': None, 'author_flair_text_color': None, 'author_flair_type': 'text', 'author_fullname': 't2_574w9o2l', 'author_patreon_flair': False, 'author_premium': False, 'awarders': [], 'banned_at_utc': None, 'banned_by': None, 'can_gild': True, 'can_mod_post': False, 'category': None, 'clicked': False, 'content_categories': None, 'contest_mode': False, 'created': 1583989172.0, 'created_utc': 1583960372.0, 'discussion_type': None, 'distinguished': None, 'domain': 'i.redd.it', 'downs': 0, 'edited': False, 'gilded': 0, 'gildings': {}, 'hidden': False, 'hide_score': False, 'id': 'fh49xy', 'is_crosspostable': True, 'is_meta': False, 'is_original_content': False, 'is_reddit_media_domain': True, 'is_robot_indexable': True, 'is_self': False, 'is_video': False, 'likes': None, 'link_flair_background_color': '', 'link_flair_css_class': 'pre-1920', 'link_flair_richtext': [], 'link_flair_text': 'Pre-1920s', 'link_flair_text_color': 'dark', 'link_flair_type': 'text', 'locked': False, 'media': None, 'media_embed': {}, 'media_only': False, 'mod_note': None, 'mod_reason_by': None, 'mod_reason_title': None, 'mod_reports': [], 'name': 't3_fh49xy', 'no_follow': False, 'num_comments': 97, 'num_crossposts': 2, 'num_reports': None, 'over_18': False, 'parent_whitelist_status': 'all_ads', 'permalink': '/r/TheWayWeWere/comments/fh49xy/precautions_taken_in_seattle_usa_to_prevent_the/', 'pinned': False, 'post_hint': 'image', 'preview': {'enabled': True, 'images': [{'id': 'J7btfFAw01ZYv20kdRGoOmvJfHnLVuM6S8y3l7LH3Jw', 'resolutions': [{'height': 109, 'url': 'https://preview.redd.it/2ozd42srx3m41.png?width=108&amp;crop=smart&amp;auto=webp&amp;s=2fb2b03058d34a05ac1620868cca84a4a7c31a9b', 'width': 108}, {'height': 218, 'url': 'https://preview.redd.it/2ozd42srx3m41.png?width=216&amp;crop=smart&amp;auto=webp&amp;s=e80f9ee23faf270f83f6ce2e2c85788861272ad6', 'width': 216}, {'height': 323, 'url': 'https://preview.redd.it/2ozd42srx3m41.png?width=320&amp;crop=smart&amp;auto=webp&amp;s=034bab0078f5a751b7142cb34f3e6aca491c151f', 'width': 320}, {'height': 646, 'url': 'https://preview.redd.it/2ozd42srx3m41.png?width=640&amp;crop=smart&amp;auto=webp&amp;s=cece094cb4b4ad9e5ce988eb410e8003efd5db0b', 'width': 640}], 'source': {'height': 800, 'url': 'https://preview.redd.it/2ozd42srx3m41.png?auto=webp&amp;s=435a1a4a1594f68605ccd64ab3d80f01d782322e', 'width': 792}, 'variants': {}}]}, 'pwls': 6, 'quarantine': False, 'removal_reason': None, 'removed_by': None, 'removed_by_category': None, 'report_reasons': None, 'saved': False, 'score': 3085, 'secure_media': None, 'secure_media_embed': {}, 'selftext': '', 'selftext_html': None, 'send_replies': False, 'spoiler': False, 'stickied': False, 'subreddit': 'TheWayWeWere', 'subreddit_id': 't5_2tp0t', 'subreddit_name_prefixed': 'r/TheWayWeWere', 'subreddit_subscribers': 393738, 'subreddit_type': 'public', 'suggested_sort': None, 'thumbnail': 'https://a.thumbs.redditmedia.com/kaf3N2PjgNYQwDGDw2_azuFxNwEEaQvKaUlxsjWpJM8.jpg', 'thumbnail_height': 140, 'thumbnail_width': 140, 'title': 'Precautions taken in Seattle, USA, to prevent the spread of the Spanish Influenza in the city. At the height of the pandemic, persons going out in public, including policemen and elevator operators, were required to wear masks made of six layers of gauze. (1919)', 'total_awards_received': 0, 'ups': 3085, 'url': 'https://i.redd.it/2ozd42srx3m41.png', 'user_reports': [], 'view_count': None, 'visited': False, 'whitelist_status': 'all_ads', 'wls': 6}]",,,,,,
[],False,aigret,flair,"[{'e': 'text', 't': 'North Beacon Hill'}]",North Beacon Hill,richtext,t2_5k3u9,False,False,[],False,False,1584027611,self.Seattle,https://www.reddit.com/r/Seattle/comments/fhi8ue/why_you_need_to_stay_home_a_perspective_from_an/,{},fhi8ue,True,False,False,False,True,True,False,,,[],,dark,text,False,False,True,79,0,False,all_ads,/r/Seattle/comments/fhi8ue/why_you_need_to_stay_home_a_perspective_from_an/,False,,,6,1584027618,1,"Got this text from a relative who is an ER doc in Seattle today: 

“This is only the beginning. Americans aren’t listening and coming to the hospital for sniffles, which is exactly what they aren’t supposed to do. It’s only a matter of time before the healthcare workers in turn get sick, leading to lack of staff. We already are running low on supplies and the hospital is busting at the seams. UW banned any visitors, which is what [others] need to do, even when people bitch. 

A pandemic absolutely proves that our private insurance system sucks. Pandemics don’t care about insurance, everyone needs to have access to care for the good of society. This entitled culture needs to learn that even if you are insured, we have limited resources and need to reserve them for the sickest/highest need, which in the end protects us all. This may be the most frustrating experience throughout the lifetime of my medical career.”",True,False,False,Seattle,t5_2qhad,192259,public,self,,,Why you need to stay home: a perspective from an ER doc I know.,0,https://www.reddit.com/r/Seattle/comments/fhi8ue/why_you_need_to_stay_home_a_perspective_from_an/,all_ads,6,,dark,,,,797814b6-3cba-11e1-87b7-12313b12e564,,,,,
[],False,1ftinfrntoftheother,flair,"[{'e': 'text', 't': 'Ballard'}]",Ballard,richtext,t2_hjg03,False,False,[],False,False,1584027589,pccmarkets.com,https://www.reddit.com/r/Seattle/comments/fhi8n9/greenlake_aurora_pcc_has_a_confirmed_case/,{},fhi8n9,True,False,False,False,True,False,False,,,[],,dark,text,False,False,True,0,0,False,all_ads,/r/Seattle/comments/fhi8n9/greenlake_aurora_pcc_has_a_confirmed_case/,False,,,6,1584027598,1,,False,False,False,Seattle,t5_2qhad,192259,public,default,,,Greenlake Aurora PCC has a confirmed case,0,https://www.pccmarkets.com/news/2020/an-update-on-covid-19-information-about-green-lake-aurora-pcc/,all_ads,6,,dark,,t3_fhcf73,"[{'all_awardings': [], 'allow_live_comments': False, 'approved_at_utc': None, 'approved_by': None, 'archived': False, 'author': 'the_republokrater', 'author_flair_background_color': None, 'author_flair_css_class': None, 'author_flair_richtext': [], 'author_flair_template_id': None, 'author_flair_text': None, 'author_flair_text_color': None, 'author_flair_type': 'text', 'author_fullname': 't2_4phxhhxv', 'author_patreon_flair': False, 'author_premium': True, 'awarders': [], 'banned_at_utc': None, 'banned_by': None, 'can_gild': True, 'can_mod_post': False, 'category': None, 'clicked': False, 'content_categories': None, 'contest_mode': False, 'created': 1584025735.0, 'created_utc': 1583996935.0, 'discussion_type': None, 'distinguished': None, 'domain': 'pccmarkets.com', 'downs': 0, 'edited': False, 'gilded': 0, 'gildings': {}, 'hidden': False, 'hide_score': False, 'id': 'fhcf73', 'is_crosspostable': True, 'is_meta': False, 'is_original_content': False, 'is_reddit_media_domain': False, 'is_robot_indexable': True, 'is_self': False, 'is_video': False, 'likes': None, 'link_flair_background_color': '', 'link_flair_css_class': 'notice', 'link_flair_richtext': [{'e': 'text', 't': 'Notice'}], 'link_flair_template_id': '6737cc2e-8b2a-11e6-8b52-0ee00aa5364f', 'link_flair_text': 'Notice', 'link_flair_text_color': 'dark', 'link_flair_type': 'richtext', 'locked': False, 'media': None, 'media_embed': {}, 'media_only': False, 'mod_note': None, 'mod_reason_by': None, 'mod_reason_title': None, 'mod_reports': [], 'name': 't3_fhcf73', 'no_follow': False, 'num_comments': 5, 'num_crossposts': 1, 'num_reports': None, 'over_18': False, 'parent_whitelist_status': 'all_ads', 'permalink': '/r/SeattleWA/comments/fhcf73/greenlake_aurora_pcc_has_a_confirmed_case/', 'pinned': False, 'pwls': 6, 'quarantine': False, 'removal_reason': None, 'removed_by': None, 'removed_by_category': None, 'report_reasons': None, 'saved': False, 'score': 29, 'secure_media': None, 'secure_media_embed': {}, 'selftext': '', 'selftext_html': None, 'send_replies': True, 'spoiler': False, 'stickied': False, 'subreddit': 'SeattleWA', 'subreddit_id': 't5_2vbli', 'subreddit_name_prefixed': 'r/SeattleWA', 'subreddit_subscribers': 114739, 'subreddit_type': 'public', 'suggested_sort': 'confidence', 'thumbnail': 'default', 'thumbnail_height': None, 'thumbnail_width': None, 'title': 'Greenlake Aurora PCC has a confirmed case', 'total_awards_received': 0, 'ups': 29, 'url': 'https://www.pccmarkets.com/news/2020/an-update-on-covid-19-information-about-green-lake-aurora-pcc/', 'user_reports': [], 'view_count': None, 'visited': False, 'whitelist_status': 'all_ads', 'wls': 6}]",,,,,,
