author,author_flair_css_class,author_flair_richtext,author_flair_text,author_flair_type,author_fullname,author_patreon_flair,can_mod_post,contest_mode,created_utc,domain,full_link,gildings,id,is_crosspostable,is_meta,is_original_content,is_reddit_media_domain,is_robot_indexable,is_self,is_video,link_flair_background_color,link_flair_richtext,link_flair_text_color,link_flair_type,locked,media_only,no_follow,num_comments,num_crossposts,over_18,parent_whitelist_status,permalink,pinned,pwls,retrieved_on,score,selftext,send_replies,spoiler,stickied,subreddit,subreddit_id,subreddit_subscribers,subreddit_type,thumbnail,title,url,whitelist_status,wls,author_cakeday,post_hint,preview,thumbnail_height,thumbnail_width,author_flair_background_color,author_flair_text_color,link_flair_css_class,link_flair_template_id,link_flair_text,crosspost_parent,crosspost_parent_list,media,media_embed,secure_media,secure_media_embed
Rainishername,,[],,text,t2_jzm7grl,False,False,False,1547083340,self.Seattle,https://www.reddit.com/r/Seattle/comments/aedv14/to_the_cashier_at_the_walgreens_on_pike_screw/,"{'gid_1': 0, 'gid_2': 0, 'gid_3': 0}",aedv14,True,False,False,False,True,True,False,,"[{'e': 'text', 't': 'Rant'}]",dark,richtext,False,False,True,9,0,False,all_ads,/r/Seattle/comments/aedv14/to_the_cashier_at_the_walgreens_on_pike_screw/,False,6,1547083341,1,"I may have been there to use the clinic, and I may feel like crap, but I don’t feel so terrible that I can’t stand up for a cashier being treated like garbage by some bag of trash human. 

I came down the escalator and noticed an old, white haired woman in a wheel chair, right at the end of the escalator, who was seemingly yelling at no one. Thinking she was off her knock, I ignored her and went to the souvenir trinkets across from your checkout counter. I just wanted to get a postcard to send to my family and maybe a keychain for the little ones. 
You were helping another woman, when the mental old shit started yelling louder, “WONT SOMEONE HELP ME” over and over. For a moment I thought she was in some sort of duress. Nope. She was just trying to cut in line, like the rude sack of shit she is. 



She yelled at you, *”why aren’t you helping me!?! What’s taking so long!?!?”* Still trying to cut ahead of the woman you were currently ringing up. You told her that it was because you were currently helping another customer, and I could hear in your voice how annoyed and frustrated you were with this lady. The hag barked back at you *”Well whys it taking so long! It’s not complicated it’s not hard!”*
Even your current customer was done with her shit. She spoke up *”You need to wait your turn”*

Which made the old bags start going off even more. So I butted in too. *”If it’s so easy, why don’t you do it yourself then?!”*

She was taken aback but quickly snapped at me *”Mind your own business!!!”*

*”You’re being loud in a public space, it is my business.”*

*”Well you’re steeling! That’s why! I can tell! You’re steeling!”*

“Woooow, old, gross, an asshole, AND racist.”

(I don’t know fonthat was her intended insult, but she was the only white person in this ordeal and you know how it goes, brown person can’t shop without being a shoplifter, right? I’m not giving her the benefit of the doubt if not being that nasty either. If she’s nasty enough to harass a cashier, she’s already sub par. 

That remark of mine made her go OFF, She’s going on about some more crap. Honestly couldn’t even make it out at this point. 

I pulled down the cloth mask that covered my nose and mouth and couched full force at her. *”Hope you get pneumonia, gross hag”*


Not that it makes a difference, because she’s old as fuck anyway. She was probably in such a rush because she knows she’s on her way out and she has to make everyone around her suffer as much as possible with what little time she has left. 
Funny she mentioned theft,  I bet you she was hiding all sorts of stolen merch under her saggy, crusty, decrepit fat sacks she calls breasts. Since you know, she can tell when people are steeling, it’s because she the pro. 
She was in a wheelchair there alone, I bet it’s because she’s so god fucking awful that even her family can’t put up with her bullshit. She knows he’s dying, and she probably has to go back to whatever damn nursing home her family rightfully stuck her in. 


She isn’t shit, and you don’t deserve to be treated like her personal punching bag. Fuck her. I regret not hanging back to see if she left you alone, I’m still not feeling well and I had to get back inside so I could rest. But this post is for you, from one retail worker to another. I can’t, or couldn’t say anything back to the assholes like that who came though my job. But I don’t work at Walgreens, so I can say whatever the damn well I please to someone thinking that cashiers aren’t human. And it felt right. 



I hope the rest of your day is better than the 15 minutes that that  no body took up. You’re a person, and you deserve much better. 
The people of Seattle have been very kind to me while I have been here, I was able to go to the doctors today because of advice and direction from the locals. So this is my small contribution. Fuck rude and verbally abusive customers all across the west coast! Fuck’em! I even left without getting the post card. Damn. 


Note: It might have been trashy of me to cough at her, but honestly? I don’t think was a situation where I could have dropped to her level. I mean, mentally and you know. Because she was screaming at me from about 3 foot below me. It was kind of hard to take her seriously when Security could of just wheeled her screeching ass out the door.  Now that I think about it, she was near a fridge. I think it was alcohol? Lmao. Hope she didn’t plan to drink and roll. 

Okay okay  I’m just being awful now. 
",True,False,False,Seattle,t5_2qhad,142313,public,self,"To the cashier at the Walgreens on Pike, screw that old hag that was harassing you. You don’t deserve that and I was glad to chew her out.",https://www.reddit.com/r/Seattle/comments/aedv14/to_the_cashier_at_the_walgreens_on_pike_screw/,all_ads,6,,,,,,,,flair,8e17612a-59fe-11e8-bb72-0eebcf11070a,Rant,,,,,,
xoxota99,flair,"[{'e': 'text', 't': 'North Queen Anne'}]",North Queen Anne,richtext,t2_4jdzl,False,False,False,1547082888,self.Seattle,https://www.reddit.com/r/Seattle/comments/aedskl/where_to_get_decent_creole_cajun_food_in_the_city/,"{'gid_1': 0, 'gid_2': 0, 'gid_3': 0}",aedskl,True,False,False,False,True,True,False,,[],dark,text,False,False,True,13,0,False,all_ads,/r/Seattle/comments/aedskl/where_to_get_decent_creole_cajun_food_in_the_city/,False,6,1547082889,1,"I'm craving some decent Etoufee and Jambalaya!! Where do people go for decent, real Creole? 

Any suggestions?",True,False,False,Seattle,t5_2qhad,142312,public,self,Where to get decent Creole / Cajun food in the city?,https://www.reddit.com/r/Seattle/comments/aedskl/where_to_get_decent_creole_cajun_food_in_the_city/,all_ads,6,,,,,,,dark,,,,,,,,,
micallab,,[],,text,t2_ljlum,False,False,False,1547078374,self.Seattle,https://www.reddit.com/r/Seattle/comments/aed3pi/getting_to_the_ski_trails_wo_awd/,"{'gid_1': 0, 'gid_2': 0, 'gid_3': 0}",aed3pi,True,False,False,False,True,True,False,,[],dark,text,False,False,True,6,0,False,all_ads,/r/Seattle/comments/aed3pi/getting_to_the_ski_trails_wo_awd/,False,6,1547078375,1,"I'm trying to figure out if there are groomed XC Ski trails that I can get to that don't require AWD to get there? I've already looked into the shuttle option but I don't want to shell out $60 for the shuttle to the slopes every time I want to go. 

Anyone else have a crap in the snow car that gets to the trails in one piece?",True,False,False,Seattle,t5_2qhad,142303,public,self,Getting to the ski trails w/o AWD,https://www.reddit.com/r/Seattle/comments/aed3pi/getting_to_the_ski_trails_wo_awd/,all_ads,6,,,,,,,,,,,,,,,,
beautifulprawncess,,[],,text,t2_exh6k,False,False,False,1547077870,self.Seattle,https://www.reddit.com/r/Seattle/comments/aed0xk/i_bought_a_dresser_at_goodwill_and_have_no_way_to/,"{'gid_1': 0, 'gid_2': 0, 'gid_3': 0}",aed0xk,True,False,False,False,True,True,False,,[],dark,text,False,False,True,28,0,False,all_ads,/r/Seattle/comments/aed0xk/i_bought_a_dresser_at_goodwill_and_have_no_way_to/,False,6,1547077871,1,I just moved to Seattle and I don't know anyone with a truck. I only paid $40 for the dresser so I'm not looking to spend much to get it delivered. Anybody know a cheap way to get it back to my place? I live about 15 minutes from the Capital Hill Goodwill.,True,False,False,Seattle,t5_2qhad,142302,public,self,I bought a dresser at Goodwill and have no way to get it home. Anyone know a cheap service?,https://www.reddit.com/r/Seattle/comments/aed0xk/i_bought_a_dresser_at_goodwill_and_have_no_way_to/,all_ads,6,,,,,,,,,,,,,,,,
Seattlenative1,,[],,text,t2_169lk2,False,False,False,1547076022,self.Seattle,https://www.reddit.com/r/Seattle/comments/aecqbf/how_did_taco_time_get_so_expensive/,"{'gid_1': 0, 'gid_2': 0, 'gid_3': 0}",aecqbf,True,False,False,False,True,True,False,,[],dark,text,False,False,True,74,0,False,all_ads,/r/Seattle/comments/aecqbf/how_did_taco_time_get_so_expensive/,False,6,1547076023,1,"Just went to the one in Wallingford and it was $16.02 for a #11 combo (original burrito with chicken).  I haven’t been to Taco Time in a few months, but I feel like all combos were about $9.99-$11 bucks max.  What happened?",True,False,False,Seattle,t5_2qhad,142297,public,self,How did Taco Time get so expensive?,https://www.reddit.com/r/Seattle/comments/aecqbf/how_did_taco_time_get_so_expensive/,all_ads,6,,,,,,,,,,,,,,,,
Andromeda321,,[],,text,t2_cnv9x,False,False,False,1547069505,self.Seattle,https://www.reddit.com/r/Seattle/comments/aebmey/astronomer_here_we_are_doing_a_special_astronomy/,"{'gid_1': 0, 'gid_2': 0, 'gid_3': 0}",aebmey,True,False,False,False,True,True,False,,[],dark,text,False,False,True,1,0,False,all_ads,/r/Seattle/comments/aebmey/astronomer_here_we_are_doing_a_special_astronomy/,False,6,1547069506,1,"Hello Seattle!

I am participating in Astronomy on Tap Seattle next week, January 10, at Peddler Brewing Company at 7pm (event goes to 9pm, with many speakers from all over the country). My talk will be about ten minutes, focusing on the topic of what would happen if a supernova went off in our own galaxy and its light reached us tonight. Additionally there are several other talented astronomers from around the country speaking after, about all sorts of topics, and it should be awesome!

The event page is here: https://www.facebook.com/events/595800564210780/

They will be live streaming the event at this link: https://youtu.be/82OFtB4pLW8

It should be super fun! Hope some of you guys can make it, or enjoy the live stream if not! :)",True,False,False,Seattle,t5_2qhad,142283,public,self,"Astronomer here! We are doing a special Astronomy on Tap event tomorrow, Thursday Jan 10, and I am one of the speakers!",https://www.reddit.com/r/Seattle/comments/aebmey/astronomer_here_we_are_doing_a_special_astronomy/,all_ads,6,,,,,,,,,,,,,,,,
swampbarbarian,,[],,text,t2_12kxli,False,False,False,1547068136,self.Seattle,https://www.reddit.com/r/Seattle/comments/aebdty/cbd_oil_in_seattle/,"{'gid_1': 0, 'gid_2': 0, 'gid_3': 0}",aebdty,True,False,False,False,True,True,False,,[],dark,text,False,False,True,10,0,False,all_ads,/r/Seattle/comments/aebdty/cbd_oil_in_seattle/,False,6,1547068137,1,"I live in downtown Seattle and am looking for high quality, affordable (if that exists) 100% CBD products. Any recommendations of where I can go?",True,False,False,Seattle,t5_2qhad,142279,public,self,CBD Oil in Seattle,https://www.reddit.com/r/Seattle/comments/aebdty/cbd_oil_in_seattle/,all_ads,6,,,,,,,,,,,,,,,,
Josewasframed,,[],,text,t2_l0x24,False,False,False,1547064916,self.Seattle,https://www.reddit.com/r/Seattle/comments/aeatnw/seattle_and_wa_in_general_112116/,"{'gid_1': 0, 'gid_2': 0, 'gid_3': 0}",aeatnw,True,False,False,False,True,True,False,,"[{'e': 'text', 't': 'Moving / Visiting'}]",dark,richtext,False,False,True,44,0,False,all_ads,/r/Seattle/comments/aeatnw/seattle_and_wa_in_general_112116/,False,6,1547064917,1,"GF and I are travelling to Seattle from 1/12-1/16 and will have a rental car to get around anywhere. 

Took a look at the subreddit's guide to enjoying the city, but most of the guide seemed outdated or too specific to one interest or another. 

We plan on checking out Pike Place, getting as close to Mt. Rainier as possible (w/ the shutdown), driving to Vancouver one day, and eating great seafood, but are looking for any and all suggestions on what to do and see. 

&amp;#x200B;

We are both in our mid-20s and we are open to most suggestions. We don't mind touristy things/places, but we also love the local hangouts that only locals would know. My favorite travel stories are always of something we saw or experienced per a local's suggestion.

&amp;#x200B;

To make it easy, perhaps you have a top 3 of any of the following:

Unique buildings to check out

Best seafood

Best date night cocktail bar

Most unique neighborhood to drive/walk through

One-of-a-kind experience in Seattle

Best lookout spots

Restaurant at top of building

Best live music

Best beach or hike within 1 hour of town. 

Best place/thing to see outside of Seattle",True,False,False,Seattle,t5_2qhad,142268,public,self,Seattle and WA in general 1/12-1/16,https://www.reddit.com/r/Seattle/comments/aeatnw/seattle_and_wa_in_general_112116/,all_ads,6,,,,,,,,moving,e210a192-4a63-11e8-839c-0e70be2d8a82,Moving / Visiting,,,,,,
beancakes1,,[],,text,t2_sx008yw,False,False,False,1547060568,self.Seattle,https://www.reddit.com/r/Seattle/comments/aea2j4/seattle_volunteer_opportunities/,"{'gid_1': 0, 'gid_2': 0, 'gid_3': 0}",aea2j4,True,False,False,False,True,True,False,,[],dark,text,False,False,True,8,0,False,all_ads,/r/Seattle/comments/aea2j4/seattle_volunteer_opportunities/,False,6,1547060569,1,"Hello all. I am looking for some good opportunities to get involved in weekly volunteering in the evenings or during the weekends. I teach, so there is not a huge amount of time, but I would like to find something that is consistent and works with my busy schedule. Is there anyone out there involved in an organization in the north Seattle (close to my work) area that is looking for people or knows of good places to look? I really appreciate the help! ",True,False,False,Seattle,t5_2qhad,142268,public,self,Seattle Volunteer Opportunities,https://www.reddit.com/r/Seattle/comments/aea2j4/seattle_volunteer_opportunities/,all_ads,6,,,,,,,,,,,,,,,,
pharmswede,,[],,text,t2_5lc79,False,False,False,1547056566,self.Seattle,https://www.reddit.com/r/Seattle/comments/ae9dgz/lord_of_the_rings_marathon_and_other_films_at/,"{'gid_1': 0, 'gid_2': 0, 'gid_3': 0}",ae9dgz,True,False,False,False,True,True,False,,"[{'e': 'text', 't': 'Meetup'}]",dark,richtext,False,False,True,2,0,False,all_ads,/r/Seattle/comments/ae9dgz/lord_of_the_rings_marathon_and_other_films_at/,False,6,1547056567,1,"We also run movie nights twice a month in our restored auditorium theater.

Classics every 2nd Thursday, and stranger things every 4th Saturday.

Come check us out.

Meetup group: [https://www.meetup.com/Movies-in-the-Auditorium](https://www.meetup.com/Movies-in-the-Auditorium)

Theater Thursdays: [https://www.uheightscenter.org/events/theater-thursdays-double-indemnity](https://www.uheightscenter.org/events/theater-thursdays-double-indemnity)

Cinema Eclectica: [https://www.uheightscenter.org/events/cinema-eclectica-february](https://www.uheightscenter.org/events/cinema-eclectica-february)

LORD OF THE RINGS MARATHON: [https://www.uheightscenter.org/events/lord-of-the-rings-trilogy](https://www.uheightscenter.org/events/lord-of-the-rings-trilogy)

&amp;#x200B;

https://i.redd.it/ikeh80jynf921.png

&amp;#x200B;

https://i.redd.it/9hhsyow4of921.png

&amp;#x200B;

https://i.redd.it/y6jxj747of921.png

https://i.redd.it/7zpb7zqznf921.jpg",True,False,False,Seattle,t5_2qhad,142261,public,self,Lord of the Rings Marathon! (and other films) at University Heights Center,https://www.reddit.com/r/Seattle/comments/ae9dgz/lord_of_the_rings_marathon_and_other_films_at/,all_ads,6,,,,,,,,flair,4d832954-a794-11e7-90db-0efd5e173148,Meetup,,,,,,
revoc25,,[],,text,t2_6bbbj,False,False,False,1547054231,youtube.com,https://www.reddit.com/r/Seattle/comments/ae8yxg/o_viaduct/,"{'gid_1': 0, 'gid_2': 0, 'gid_3': 0}",ae8yxg,True,False,False,False,True,False,False,,[],dark,text,False,False,True,1,0,False,all_ads,/r/Seattle/comments/ae8yxg/o_viaduct/,False,6,1547054231,1,,False,False,False,Seattle,t5_2qhad,142259,public,default,"O, Viaduct!",https://www.youtube.com/watch?v=MFLjCc8MZoc,all_ads,6,,,,,,,,,,,,,,,,
Soopsmojo,,[],,text,t2_uk0zd,False,False,False,1547050736,self.Seattle,https://www.reddit.com/r/Seattle/comments/ae8d9b/affordable_dry_cleaning_north_seattle/,"{'gid_1': 0, 'gid_2': 0, 'gid_3': 0}",ae8d9b,True,False,False,False,True,True,False,,[],dark,text,False,False,True,0,0,False,all_ads,/r/Seattle/comments/ae8d9b/affordable_dry_cleaning_north_seattle/,False,6,1547050737,1,"I usually go to Greenwood cleaners but they're coming out to be super expensive. I've noticed Seattle seems to be a lot more expensive than many parts of the country. 

What are some of your favorite and affordable dry cleaners north seattle (Northgate, Greenwood, Shoreline)",True,False,False,Seattle,t5_2qhad,142247,public,self,Affordable dry cleaning - north Seattle?,https://www.reddit.com/r/Seattle/comments/ae8d9b/affordable_dry_cleaning_north_seattle/,all_ads,6,,,,,,,,,,,,,,,,
asaspadesss,,[],,text,t2_137qcp,False,False,False,1547050393,self.Seattle,https://www.reddit.com/r/Seattle/comments/ae8b9s/best_cocktail_barspeakeasy_in_seattle/,"{'gid_1': 0, 'gid_2': 0, 'gid_3': 0}",ae8b9s,True,False,False,False,True,True,False,,[],dark,text,False,False,True,43,0,False,all_ads,/r/Seattle/comments/ae8b9s/best_cocktail_barspeakeasy_in_seattle/,False,6,1547050394,1,"Not looking for anything too fancy, just looking for a place with a chill vibe and awesome drinks. Cost isn't too much of a factor (unless the prices are outrageous).",True,False,False,Seattle,t5_2qhad,142247,public,self,Best Cocktail Bar/Speakeasy in Seattle?,https://www.reddit.com/r/Seattle/comments/ae8b9s/best_cocktail_barspeakeasy_in_seattle/,all_ads,6,,,,,,,,,,,,,,,,
Jake1125,,[],,text,t2_9i9sh,False,False,False,1547045747,apnews.com,https://www.reddit.com/r/Seattle/comments/ae7k7n/seattle_braces_for_highway_closure_historic/,"{'gid_1': 0, 'gid_2': 0, 'gid_3': 0}",ae7k7n,True,False,False,False,True,False,False,,[],dark,text,False,False,True,203,0,False,all_ads,/r/Seattle/comments/ae7k7n/seattle_braces_for_highway_closure_historic/,False,6,1547045748,1,,True,False,False,Seattle,t5_2qhad,142242,public,default,"Seattle braces for highway closure, historic traffic squeeze",https://www.apnews.com/426e8295e4804ed383c3a8c323239ac2,all_ads,6,,,,,,,,,,,,,,,,
magenta_placenta,,[],,text,t2_3bhyn,False,False,False,1547044985,twitter.com,https://www.reddit.com/r/Seattle/comments/ae7g7c/the_city_of_seattle_has_modified_its_collective/,"{'gid_1': 0, 'gid_2': 0, 'gid_3': 0}",ae7g7c,True,False,False,False,True,False,False,,[],dark,text,False,False,True,32,0,False,all_ads,/r/Seattle/comments/ae7g7c/the_city_of_seattle_has_modified_its_collective/,False,6,1547044985,1,,True,False,False,Seattle,t5_2qhad,142240,public,default,The city of Seattle has modified its collective bargaining ordinance for ridesharing drivers to prohibit them from bargaining over pay,https://twitter.com/Econ_Marshall/status/1082731483620655105,all_ads,6,,,,,,,,,,,,,,,,
poor-toy-soul-doll,,[],,text,t2_o1iqp3r,False,False,False,1547037610,seattlepi.com,https://www.reddit.com/r/Seattle/comments/ae6g5a/charge_man_who_stabbed_teen_in_s_seattle_wanted/,"{'gid_1': 0, 'gid_2': 0, 'gid_3': 0}",ae6g5a,True,False,False,False,True,False,False,,[],dark,text,False,False,True,52,0,False,all_ads,/r/Seattle/comments/ae6g5a/charge_man_who_stabbed_teen_in_s_seattle_wanted/,False,6,1547037613,1,,True,False,False,Seattle,t5_2qhad,142237,public,https://b.thumbs.redditmedia.com/U940TsgceCFKkymuWZd12FwhPtKhwVbaeqKQ31YuwzQ.jpg,Charge: Man who stabbed teen in S. Seattle 'wanted to kill white people',https://www.seattlepi.com/local/crime/article/Charge-Man-who-stabbed-teen-in-S-Seattle-13518150.php,all_ads,6,,link,"{'enabled': False, 'images': [{'id': 'sayg7fG5xv4Ys1ctxt2mzjh2p4OgUiRF0AcSmLAX-8k', 'resolutions': [{'height': 147, 'url': 'https://external-preview.redd.it/IyXszFeBTP6SejxjzBY0Y05Chzq9MLqSru81E4iOW1k.jpg?width=108&amp;crop=smart&amp;auto=webp&amp;s=4e68cb993d0ed66e7f35178e24980e59d3fb2d33', 'width': 108}, {'height': 294, 'url': 'https://external-preview.redd.it/IyXszFeBTP6SejxjzBY0Y05Chzq9MLqSru81E4iOW1k.jpg?width=216&amp;crop=smart&amp;auto=webp&amp;s=bbd8cfe39ce6874bfac676d159ea0aac9bd11e09', 'width': 216}, {'height': 436, 'url': 'https://external-preview.redd.it/IyXszFeBTP6SejxjzBY0Y05Chzq9MLqSru81E4iOW1k.jpg?width=320&amp;crop=smart&amp;auto=webp&amp;s=f5a9002dc67c338859adc1f2e8d722961ee49964', 'width': 320}], 'source': {'height': 568, 'url': 'https://external-preview.redd.it/IyXszFeBTP6SejxjzBY0Y05Chzq9MLqSru81E4iOW1k.jpg?auto=webp&amp;s=4ba172a6b69b2e7b146f60627dedca09fa38178e', 'width': 416}, 'variants': {}}]}",140.0,140.0,,,,,,,,,,,
gyozaz64,,[],,text,t2_k804g,False,False,False,1547032366,self.Seattle,https://www.reddit.com/r/Seattle/comments/ae5va6/hi_all_whats_the_cheapest_way_to_get_from_seattle/,"{'gid_1': 0, 'gid_2': 0, 'gid_3': 0}",ae5va6,True,False,False,False,True,True,False,,[],dark,text,False,False,True,28,0,False,all_ads,/r/Seattle/comments/ae5va6/hi_all_whats_the_cheapest_way_to_get_from_seattle/,False,6,1547032367,1,,True,False,False,Seattle,t5_2qhad,142235,public,self,Hi all! What’s the cheapest way to get from Seattle to Vancouver?,https://www.reddit.com/r/Seattle/comments/ae5va6/hi_all_whats_the_cheapest_way_to_get_from_seattle/,all_ads,6,,,,,,,,,,,,,,,,
LitchLitch,,[],,text,t2_j3ho9,False,False,False,1547018443,self.Seattle,https://www.reddit.com/r/Seattle/comments/ae4gy3/seattle_homeless_are_from_seattle/,"{'gid_1': 0, 'gid_2': 0, 'gid_3': 0}",ae4gy3,True,False,False,False,True,True,False,,[],dark,text,False,False,True,99,0,False,all_ads,/r/Seattle/comments/ae4gy3/seattle_homeless_are_from_seattle/,False,6,1547018444,1,"One thing I keep seeing from folks bitching about the homeless in Seattle is the claim they that they are from out of town.  


It's not true.  


Really, we actually have done research on it. Most homeless in Seattle are local, from King and the surrounding counties.  
[https://www.thestranger.com/slog/2017/03/03/24967599/new-survey-finds-most-people-experiencing-homelessness-in-seattle-were-already-here-when-they-became-homeless](https://www.thestranger.com/slog/2017/03/03/24967599/new-survey-finds-most-people-experiencing-homelessness-in-seattle-were-already-here-when-they-became-homeless)  


It's not surprising, folks have researched this in other cities and found the same thing. The homeless are not really that mobile. People become homeless when rents rise or jobs fall, folks who were just barely hanging on fall off the grid and hit the streets.

&amp;#x200B;

But time after time I see people on here trying to pretend like our city policies are somehow luring homeless. But it is clear from the evidence that is not true and I don't really understand why they are so attached to this idea. I have seen folks here try to correct them with the facts and they utterly reject it. And then they claim to be reasonable people.

&amp;#x200B;

I've gotten used to people who refuse to believe in global warming, the efficacy of vaccines, or the curvature of the earth but I honestly don't have a satisfactory way to respond to these people. And the problem is they vote, they protest reasonable evidence based policies for addressing the issues, and generally they just don't care about the facts.  


The idea of homeless people flooding into town makes them angry and they just want to be angry regardless of the facts.",True,False,False,Seattle,t5_2qhad,142222,public,self,Seattle homeless are from Seattle.,https://www.reddit.com/r/Seattle/comments/ae4gy3/seattle_homeless_are_from_seattle/,all_ads,6,,,,,,,,,,,,,,,,
sleepygirlinseattle,,[],,text,t2_ycn59,False,False,False,1547014065,/r/Seattle/comments/ae3yvb/please_tell_me_someone_else_saw_this_trump_edit/,https://www.reddit.com/r/Seattle/comments/ae3yvb/please_tell_me_someone_else_saw_this_trump_edit/,"{'gid_1': 0, 'gid_2': 0, 'gid_3': 0}",ae3yvb,True,False,False,False,True,False,True,,[],dark,text,False,False,True,0,0,False,all_ads,/r/Seattle/comments/ae3yvb/please_tell_me_someone_else_saw_this_trump_edit/,False,6,1547014066,1,,True,False,False,Seattle,t5_2qhad,142210,public,default,Please tell me someone else saw this Trump edit on Q13,https://v.redd.it/7jerm6hi9c921,all_ads,6,,,,,,,,,,,,,,,,
mynameistoast,,[],,text,t2_cmc55,False,False,False,1547012503,i.imgur.com,https://www.reddit.com/r/Seattle/comments/ae3rt2/the_hero_seattle_needs_now_more_than_ever/,"{'gid_1': 0, 'gid_2': 0, 'gid_3': 0}",ae3rt2,True,False,False,False,True,False,False,,[],dark,text,False,False,True,2,0,False,all_ads,/r/Seattle/comments/ae3rt2/the_hero_seattle_needs_now_more_than_ever/,False,6,1547012504,1,,True,False,False,Seattle,t5_2qhad,142207,public,default,The hero Seattle needs now more than ever.,http://i.imgur.com/zp8VCib.jpg,all_ads,6,,,,,,,,,,,,,,,,
