[],False,SeaHaw808,,[],,text,t2_3e70v9jj,False,False,[],False,False,1592802172,self.Seattle,https://www.reddit.com/r/Seattle/comments/hdlpgz/loud_noises_in_chopchaz/,{},hdlpgz,True,False,False,False,True,True,False,,,[],,,dark,text,False,False,True,2,0,False,all_ads,/r/Seattle/comments/hdlpgz/loud_noises_in_chopchaz/,False,,,6,1592802173,1,"I'm just a block off CHOP and heard a series of loud noises. It was like fireworks, but could have been gunfire. Not sure. I hear people yelling- what is happening?",True,False,False,Seattle,t5_2qhad,220422,public,self,,,Loud noises in CHOP/CHAZ,0,[],1.0,https://www.reddit.com/r/Seattle/comments/hdlpgz/loud_noises_in_chopchaz/,all_ads,6,,,,,,,,,,,,,
[],False,PuffBreezy,,[],,text,t2_6f8t9k7l,False,True,[],False,False,1592802007,google.com,https://www.reddit.com/r/Seattle/comments/hdlnz6/seattle_fire_department_criticized_in_fatal_chop/,{},hdlnz6,True,False,False,False,True,False,False,,flair,"[{'e': 'text', 't': 'News'}]",9f9ba910-f804-11e4-be5c-0ea18645ab5f,News,dark,richtext,False,False,True,4,0,False,all_ads,/r/Seattle/comments/hdlnz6/seattle_fire_department_criticized_in_fatal_chop/,False,,,6,1592802009,1,,True,False,False,Seattle,t5_2qhad,220422,public,default,,,Seattle Fire Department criticized in fatal CHOP shootings,0,[],1.0,https://www.google.com/amp/s/www.kiro7.com/news/local/seattle-fire-department-criticized-fatal-chop-shootings/UHJ2PD6ZANCJ5N2Z3TLVUJAVMA/%3foutputType=amp,all_ads,6,,,,,,,,,,,,,
[],False,MrCabbageCabbage,flair,"[{'e': 'text', 't': 'Capitol Hill'}]",Capitol Hill,richtext,t2_12m24j,False,True,[],False,False,1592801990,self.Seattle,https://www.reddit.com/r/Seattle/comments/hdlntd/chop_shots_fired/,{},hdlntd,True,False,False,False,True,True,False,,flair,"[{'e': 'text', 't': 'News'}]",9f9ba910-f804-11e4-be5c-0ea18645ab5f,News,dark,richtext,False,False,True,11,0,False,all_ads,/r/Seattle/comments/hdlntd/chop_shots_fired/,False,,,6,1592801991,1,Chop - shots fired,True,False,False,Seattle,t5_2qhad,220422,public,self,,,Chop - shots fired,0,[],1.0,https://www.reddit.com/r/Seattle/comments/hdlntd/chop_shots_fired/,all_ads,6,6e1ff2a0-3cba-11e1-9d9e-12313b0284b1,dark,,,,,,,,,,,
[],False,BrianBosche,,[],,text,t2_fnosp,False,False,[],False,False,1592801872,i.redd.it,https://www.reddit.com/r/Seattle/comments/hdlmu0/pike_place_still_illuminating_the_blm_on_their/,{},hdlmu0,True,False,False,True,True,False,False,,flair,"[{'e': 'text', 't': 'News'}]",9f9ba910-f804-11e4-be5c-0ea18645ab5f,News,dark,richtext,False,False,True,4,0,False,all_ads,/r/Seattle/comments/hdlmu0/pike_place_still_illuminating_the_blm_on_their/,False,,,6,1592801873,1,,True,False,False,Seattle,t5_2qhad,220421,public,default,,,Pike Place still illuminating the “BLM” on their sign tonight in support of Black Lives Matter.,0,[],1.0,https://i.redd.it/gpp1pyy78e651.jpg,all_ads,6,,,,,,,,,,,,,
[],False,Levibisonn,,[],,text,t2_lzjr2,False,False,[],False,False,1592801802,self.Seattle,https://www.reddit.com/r/Seattle/comments/hdlm9i/does_anyone_know_why_i5_north_is_closed_right_now/,{},hdlm9i,True,False,False,False,True,True,False,,,[],,,dark,text,False,False,True,20,0,False,all_ads,/r/Seattle/comments/hdlm9i/does_anyone_know_why_i5_north_is_closed_right_now/,False,,,6,1592801804,1,Title,True,False,False,Seattle,t5_2qhad,220421,public,self,,,Does anyone know why I-5 North is closed right now?,0,[],1.0,https://www.reddit.com/r/Seattle/comments/hdlm9i/does_anyone_know_why_i5_north_is_closed_right_now/,all_ads,6,,,,,,,,,,,,,
[],False,Hedwig-Valhebrus,,[],,text,t2_1uf5hpby,False,False,[],False,False,1592801744,kiro7.com,https://www.reddit.com/r/Seattle/comments/hdllsp/seattle_fire_department_criticized_in_fatal_chop/,{},hdllsp,True,False,False,False,True,False,False,,flair,"[{'e': 'text', 't': 'News'}]",9f9ba910-f804-11e4-be5c-0ea18645ab5f,News,dark,richtext,False,False,True,32,0,False,all_ads,/r/Seattle/comments/hdllsp/seattle_fire_department_criticized_in_fatal_chop/,False,link,"{'enabled': False, 'images': [{'id': '7BTi6iam--7utwN1qiBJHehfPpb-hh9SiLM738KCnY8', 'resolutions': [{'height': 56, 'url': 'https://external-preview.redd.it/atPu5JmSU8Glg_SBAeWI-WJdOTC3TvbO-bnYKnBsCNI.jpg?width=108&amp;crop=smart&amp;auto=webp&amp;s=5021c8664679af4d3b9d0b14024834d444b5b45e', 'width': 108}, {'height': 113, 'url': 'https://external-preview.redd.it/atPu5JmSU8Glg_SBAeWI-WJdOTC3TvbO-bnYKnBsCNI.jpg?width=216&amp;crop=smart&amp;auto=webp&amp;s=8700173dd25fac006793b3f1eac80f379ad26bcd', 'width': 216}, {'height': 167, 'url': 'https://external-preview.redd.it/atPu5JmSU8Glg_SBAeWI-WJdOTC3TvbO-bnYKnBsCNI.jpg?width=320&amp;crop=smart&amp;auto=webp&amp;s=52aff22c64339c399816b60d184417c7f5a859ca', 'width': 320}, {'height': 334, 'url': 'https://external-preview.redd.it/atPu5JmSU8Glg_SBAeWI-WJdOTC3TvbO-bnYKnBsCNI.jpg?width=640&amp;crop=smart&amp;auto=webp&amp;s=c779f9e08471db219054e28cf18c848c109d0691', 'width': 640}, {'height': 502, 'url': 'https://external-preview.redd.it/atPu5JmSU8Glg_SBAeWI-WJdOTC3TvbO-bnYKnBsCNI.jpg?width=960&amp;crop=smart&amp;auto=webp&amp;s=2c8ee0fc8b76788d981561c118143d430d400f56', 'width': 960}, {'height': 565, 'url': 'https://external-preview.redd.it/atPu5JmSU8Glg_SBAeWI-WJdOTC3TvbO-bnYKnBsCNI.jpg?width=1080&amp;crop=smart&amp;auto=webp&amp;s=731f97abff3a57a86b06254848424e7085952f71', 'width': 1080}], 'source': {'height': 628, 'url': 'https://external-preview.redd.it/atPu5JmSU8Glg_SBAeWI-WJdOTC3TvbO-bnYKnBsCNI.jpg?auto=webp&amp;s=7328dd9576ea5ab2c1ca21fb8d12b096fcb25929', 'width': 1200}, 'variants': {}}]}",6,1592801746,1,,True,False,False,Seattle,t5_2qhad,220421,public,https://b.thumbs.redditmedia.com/xq7zRfRlX2CxU8BxBBKw1djTdaQRL00EwB9Q2Ud0e3U.jpg,73.0,140.0,Seattle Fire Department criticized in fatal CHOP shootings,0,[],1.0,https://www.kiro7.com/news/local/seattle-fire-department-criticized-fatal-chop-shootings/UHJ2PD6ZANCJ5N2Z3TLVUJAVMA/?fbclid=IwAR0Rxol0doKBemaGDyXOP4LphMBYiMbTdqQxH1S4Sj9uYz8KFpWTkb2hij0,all_ads,6,,,,,,,,,,,,,
[],False,inspirit16,,[],,text,t2_1x7x40e7,False,False,[],False,False,1592800043,self.Seattle,https://www.reddit.com/r/Seattle/comments/hdl7wz/where_to_generate_rental_leases/,{},hdl7wz,True,False,False,False,True,True,False,,,[],,,dark,text,False,False,True,8,0,False,all_ads,/r/Seattle/comments/hdl7wz/where_to_generate_rental_leases/,False,,,6,1592800045,1,"Where can I generate a rental lease customized for my rental proeprties, with the following specifics on the lease:

1. Lease termination fees of 2 month's rent
2. Move in/move out inspection
3. Other legal terms",True,False,False,Seattle,t5_2qhad,220414,public,self,,,Where to generate rental leases?,0,[],1.0,https://www.reddit.com/r/Seattle/comments/hdl7wz/where_to_generate_rental_leases/,all_ads,6,,,,,,,,,,,,,
[],False,jaggedjottings,,[],,text,t2_4kyq08b,False,False,[],False,False,1592798953,i.redd.it,https://www.reddit.com/r/Seattle/comments/hdkz3o/is_this_legit_or_a_red_herring/,{},hdkz3o,True,False,False,True,True,False,False,,flair,"[{'e': 'text', 't': 'Politics'}]",d03c04ee-412a-11e8-88cf-0e80e220ed5c,Politics,dark,richtext,False,False,True,3,0,False,all_ads,/r/Seattle/comments/hdkz3o/is_this_legit_or_a_red_herring/,False,,,6,1592798955,1,,False,False,False,Seattle,t5_2qhad,220412,public,default,,,"Is this legit, or a red herring?",0,[],1.0,https://i.redd.it/i1g1qvtazd651.png,all_ads,6,,,,,,,,,,,,,
[],False,Queenrhino,,[],,text,t2_6x7d2,False,False,[],False,False,1592797846,i.redd.it,https://www.reddit.com/r/Seattle/comments/hdkpv0/spotted_this_dingus_around_23rd_jackson_i_didnt/,{},hdkpv0,True,False,False,True,True,False,False,,flair,"[{'e': 'text', 't': 'Media'}]",,Media,dark,richtext,False,False,True,5,0,False,all_ads,/r/Seattle/comments/hdkpv0/spotted_this_dingus_around_23rd_jackson_i_didnt/,False,image,"{'enabled': True, 'images': [{'id': 'c9hBDhxOO1rmZe4MItNB3TvpPBL_RuiYlFTO9U7yjBk', 'resolutions': [{'height': 129, 'url': 'https://preview.redd.it/1rjhu809wd651.jpg?width=108&amp;crop=smart&amp;auto=webp&amp;s=d90f4c89e87d029e5da9d213b307a5ad020cddad', 'width': 108}, {'height': 258, 'url': 'https://preview.redd.it/1rjhu809wd651.jpg?width=216&amp;crop=smart&amp;auto=webp&amp;s=70b661da63b0029017675125d54e1e9037cbec09', 'width': 216}, {'height': 383, 'url': 'https://preview.redd.it/1rjhu809wd651.jpg?width=320&amp;crop=smart&amp;auto=webp&amp;s=45ea7676b6bf24917c31ba8b1b9e43a28f71e599', 'width': 320}, {'height': 767, 'url': 'https://preview.redd.it/1rjhu809wd651.jpg?width=640&amp;crop=smart&amp;auto=webp&amp;s=739351af9ab594d5da9ec68dbed61d52c9316847', 'width': 640}], 'source': {'height': 899, 'url': 'https://preview.redd.it/1rjhu809wd651.jpg?auto=webp&amp;s=3d825383f493674fdd0d6c5b407f113b6753f9b3', 'width': 750}, 'variants': {}}]}",6,1592797848,1,,True,False,False,Seattle,t5_2qhad,220411,public,https://b.thumbs.redditmedia.com/Lnv1q33tozj1krbsxc0pw5WfbnUN5Slk0d4NVZAnyFY.jpg,140.0,140.0,spotted this dingus around 23rd &amp; Jackson. I didn’t see an owner so I thought i’d post this here just in case somebody recognizes doge.,0,[],1.0,https://i.redd.it/1rjhu809wd651.jpg,all_ads,6,,,,,,,,,,,,,
[],False,idkmybffyeff,,[],,text,t2_om65v,False,False,[],False,False,1592797067,i.redd.it,https://www.reddit.com/r/Seattle/comments/hdkj9h/spotted_near_greenlake_thank_you_stranger_for_the/,{},hdkj9h,True,False,False,True,True,False,False,,flair,"[{'e': 'text', 't': 'Meetup'}]",4d832954-a794-11e7-90db-0efd5e173148,Meetup,dark,richtext,False,False,True,52,0,False,all_ads,/r/Seattle/comments/hdkj9h/spotted_near_greenlake_thank_you_stranger_for_the/,False,,,6,1592797068,1,,True,False,False,Seattle,t5_2qhad,220411,public,default,,,Spotted near Greenlake. Thank you stranger for the laugh during my morning walk.,0,[],1.0,https://i.redd.it/bx1cno3xtd651.jpg,all_ads,6,,,,,,,,,,,,,
[],False,Gshock720,,[],,text,t2_13qtevb6,False,False,[],False,False,1592794346,twitter.com,https://www.reddit.com/r/Seattle/comments/hdjw55/chaz_security_assaults_a_man_for_filming/,{},hdjw55,True,False,False,False,True,False,False,,,[],,,dark,text,False,False,True,24,0,False,all_ads,/r/Seattle/comments/hdjw55/chaz_security_assaults_a_man_for_filming/,False,,,6,1592794347,1,,True,False,False,Seattle,t5_2qhad,220409,public,default,,,CHAZ Security assaults a man for filming,0,[],1.0,https://twitter.com/i/status/1273603987845988352,all_ads,6,,,,,,,,,,,,,
[],False,AlSweigart,,[],,text,t2_369qx,False,True,[],False,False,1592792471,self.Seattle,https://www.reddit.com/r/Seattle/comments/hdjgko/seattle_police_is_punishing_seattle_by_refusing/,{},hdjgko,True,False,False,False,True,True,False,,moving,"[{'e': 'text', 't': 'Moving / Visiting'}]",,Moving / Visiting,dark,richtext,False,False,True,628,0,False,all_ads,/r/Seattle/comments/hdjgko/seattle_police_is_punishing_seattle_by_refusing/,False,,,6,1592792473,1,"Not sure if Reddit is the best place to post this story, but here goes. It involves [this smashed window at the Starbucks on Broadway and Pike.](https://imgur.com/a/mexx5ja)

I've been volunteering to do the night watch security at the Capitol Hill Occupied Protest since I live in cap hill. I had been with the Castro neighborhood watch in San Francisco for a year before moving to Seattle and it's mostly just hanging out and keeping an eye on things, with some interesting moments. I had been attending the protests before and after the cops abandoned the East Precinct. The protesters are convinced that the police would be happy to see the precinct burn to score political points, but so far the protesters have managed to keep random idiots from destroying the building.

Last night (Saturday, the 20th) had an interesting moment. There's a young homeless guy who had been going around with a 2x4 and smashing windows just outside the CHOP earlier in the day. Sometime after midnight he was back in the area around 12th and Pike, and about a half dozen protesters on night watch confronted him. I'll call him Two-by-Four. Two-by-Four was agitated, brandishing the 2x4, sometimes quickly moving into the middle of the street, threatening to hit people around him, but also seemed to understand that would be crossing a line. The group followed him for about half an hour (and he had been followed by others before this point too) while directing traffic away from him, during which time he also smashed the windows of two other businesses. This was a couple blocks outside the CHOP itself, so they hadn't boarded up their windows. One of these was the Starbucks on Broadway and Pike.

During this time, several people had called 911 (protesters and non), but the police refuse to respond. When people, even Seattleites, talk about the CHOP they often miss the fact that the CHOP is just six blocks. It's not a big area; you can walk from one end to the other in three minutes. The entire time we were dealing with Two-by-Four, we were well outside the CHOP; the Starbucks at Broadway and Pike is well out of sight from any protesters.

One person was talking to Two-by-Four, trying to calm him down but also mostly distracting him while another person grabbed the 2x4 from him. We chased him out at a sprint, and he quickly got tired and sat down. Me and another person ended up walking him (from a distance) out of Capitol Hill. We can disarm him and chase him away, but we don't have the authority to arrest anyone.

This guy had been smashing windows on-and-off for hours, all outside the protest zone. SPD is punishing Capitol Hill by refusing to respond to calls in the area (here's a [police scanner clip from a few days ago where an SPD officer tells dispatch that a call is in the ""Communist Republic of Capitol Hill"" and ""advise their state department to handle it.""](https://twitter.com/supersat/status/1273732620245852160). They know they can blame the protesters for any crime that happens in the area, even if it's well outside the protest zone.

I've become more pessimistic about the culture that police departments in America have. I don't think police reforms have changed anything. What good are body cams when police can just turn them off or police departments can withhold the video? Why are we giving cops more military equipment and using the police as the solution for every social problem? Why can cops demand to be called heroes while playing political games with public safety?

At about 6 am, I was done with the night watch shift, and on my walk home I swung by and snapped the photo of the Starbucks window.",True,False,False,Seattle,t5_2qhad,220404,public,self,,,Seattle Police Is Punishing Seattle By Refusing to Respond to 911 Calls,0,[],1.0,https://www.reddit.com/r/Seattle/comments/hdjgko/seattle_police_is_punishing_seattle_by_refusing/,all_ads,6,,,,,,,,,,,,,
[],False,Michael-Wayne,,[],,text,t2_mdctm,False,False,[],False,False,1592791882,i.imgur.com,https://www.reddit.com/r/Seattle/comments/hdjbey/only_in_seattle_is_this_an_understandable_typo/,{},hdjbey,True,False,False,False,True,False,False,,flair,"[{'e': 'text', 't': 'Media'}]",,Media,dark,richtext,False,False,True,8,0,False,all_ads,/r/Seattle/comments/hdjbey/only_in_seattle_is_this_an_understandable_typo/,False,image,"{'enabled': True, 'images': [{'id': '7_ZXKmay6W0-QoKpsoQw5ucHGF9wEBWA_uNI9A4D0Ps', 'resolutions': [{'height': 126, 'url': 'https://external-preview.redd.it/d0jVty__B9oHiATkuK4qcCzxDxsQ1tyk-VA7YtLndcg.jpg?width=108&amp;crop=smart&amp;auto=webp&amp;s=20b8f1b3acbdf78ec9e5e40f93496a50fe3419fd', 'width': 108}, {'height': 253, 'url': 'https://external-preview.redd.it/d0jVty__B9oHiATkuK4qcCzxDxsQ1tyk-VA7YtLndcg.jpg?width=216&amp;crop=smart&amp;auto=webp&amp;s=e8d4d148127f638373814646715ae69825c71379', 'width': 216}, {'height': 375, 'url': 'https://external-preview.redd.it/d0jVty__B9oHiATkuK4qcCzxDxsQ1tyk-VA7YtLndcg.jpg?width=320&amp;crop=smart&amp;auto=webp&amp;s=dcd488cdcf0d12c62c8d8500ffa447b6251503dd', 'width': 320}, {'height': 750, 'url': 'https://external-preview.redd.it/d0jVty__B9oHiATkuK4qcCzxDxsQ1tyk-VA7YtLndcg.jpg?width=640&amp;crop=smart&amp;auto=webp&amp;s=43b45f3a6142319e7c7fb219aa47be1ddd3059f1', 'width': 640}, {'height': 1126, 'url': 'https://external-preview.redd.it/d0jVty__B9oHiATkuK4qcCzxDxsQ1tyk-VA7YtLndcg.jpg?width=960&amp;crop=smart&amp;auto=webp&amp;s=634fef38f27c2bc9f14e95c8d4850fc9764d0f43', 'width': 960}, {'height': 1267, 'url': 'https://external-preview.redd.it/d0jVty__B9oHiATkuK4qcCzxDxsQ1tyk-VA7YtLndcg.jpg?width=1080&amp;crop=smart&amp;auto=webp&amp;s=49a75e39d3c6221bfbf1737ba218eb03e81d45f2', 'width': 1080}], 'source': {'height': 1267, 'url': 'https://external-preview.redd.it/d0jVty__B9oHiATkuK4qcCzxDxsQ1tyk-VA7YtLndcg.jpg?auto=webp&amp;s=815886e9d0113d872dd104ada341c8fb9ddb4501', 'width': 1080}, 'variants': {}}]}",6,1592791883,1,,True,False,False,Seattle,t5_2qhad,220404,public,https://b.thumbs.redditmedia.com/LDxn6IGc-SsQ9FuP8Ueurzf4RwO0tycUvbLKYaAC0Tc.jpg,140.0,140.0,Only in Seattle is this an understandable typo....,0,[],1.0,https://i.imgur.com/fc7qSBs.jpg,all_ads,6,,,,,,,,,,,,,
