all_awardings,allow_live_comments,author,author_flair_css_class,author_flair_richtext,author_flair_text,author_flair_type,author_fullname,author_patreon_flair,awarders,can_mod_post,contest_mode,created_utc,domain,full_link,gildings,id,is_crosspostable,is_meta,is_original_content,is_reddit_media_domain,is_robot_indexable,is_self,is_video,link_flair_background_color,link_flair_css_class,link_flair_richtext,link_flair_template_id,link_flair_text,link_flair_text_color,link_flair_type,locked,media_only,no_follow,num_comments,num_crossposts,og_description,og_title,over_18,parent_whitelist_status,permalink,pinned,pwls,retrieved_on,score,selftext,send_replies,spoiler,steward_reports,stickied,subreddit,subreddit_id,subreddit_subscribers,subreddit_type,thumbnail,title,total_awards_received,updated_utc,url,whitelist_status,wls,post_hint,preview,thumbnail_height,thumbnail_width,crosspost_parent,crosspost_parent_list,author_flair_template_id,author_flair_text_color,media,media_embed,secure_media,secure_media_embed,author_flair_background_color
[],False,theoiginaljellycat,,[],,text,t2_4pd9ukwu,False,[],False,False,1572213333,i.redd.it,https://www.reddit.com/r/Seattle/comments/dnzr0b/frisky_boi_iso_snacks_in_volunteer_park/,{},dnzr0b,True,False,False,True,True,False,False,,flair,"[{'e': 'text', 't': 'Community'}]",d34790c2-412a-11e8-a986-0e3a917b7a84,Community,dark,richtext,False,False,True,0,0,,,False,all_ads,/r/Seattle/comments/dnzr0b/frisky_boi_iso_snacks_in_volunteer_park/,False,6,1572213335,2,,True,False,[],False,Seattle,t5_2qhad,176637,public,default,Frisky boi ISO snacks 🐿️ in Volunteer Park,0,1572313555,https://i.redd.it/onio9bs9n5v31.jpg,all_ads,6,,,,,,,,,,,,,
[],False,kuso99,,[],,text,t2_1wfmlzid,False,[],False,False,1572213280,i.redd.it,https://www.reddit.com/r/Seattle/comments/dnzq3q/stone_lion_at_the_rainbow_temple_in_north_bend/,{},dnzq3q,True,False,False,True,True,False,False,,,[],,,dark,text,False,False,True,0,0,,,False,all_ads,/r/Seattle/comments/dnzq3q/stone_lion_at_the_rainbow_temple_in_north_bend/,False,6,1572213280,8,,True,False,[],False,Seattle,t5_2qhad,176637,public,default,Stone lion at the Rainbow Temple in North Bend,0,1572313533,https://i.redd.it/3fytulh3k5v31.png,all_ads,6,,,,,,,,,,,,,
[],False,MenloPark4A,,[],,text,t2_1qy92duf,False,[],False,False,1572210517,self.Seattle,https://www.reddit.com/r/Seattle/comments/dnz8t4/locked_out_of_my_apartment_in_slu/,{},dnz8t4,True,False,False,False,True,True,False,,,[],,,dark,text,False,False,True,6,0,,,False,all_ads,/r/Seattle/comments/dnz8t4/locked_out_of_my_apartment_in_slu/,False,6,1572210518,0,Can someone help me get back into my apartment? I live in SLU and I call the property management company and they said they can't open it for me until tomorrow morning.,True,False,[],False,Seattle,t5_2qhad,176633,public,self,Locked out of my apartment in SLU,0,1572312894,https://www.reddit.com/r/Seattle/comments/dnz8t4/locked_out_of_my_apartment_in_slu/,all_ads,6,,,,,,,,,,,,,
[],False,LitchLitch,,[],,text,t2_j3ho9,False,[],False,False,1572207944,self.Seattle,https://www.reddit.com/r/Seattle/comments/dnyuq4/heard_about_the_rape_squad_of_bothell_high/,{},dnyuq4,True,False,False,False,True,True,False,,,[],,,dark,text,False,False,True,3,0,,,False,all_ads,/r/Seattle/comments/dnyuq4/heard_about_the_rape_squad_of_bothell_high/,False,6,1572207945,0,"The problem with ""boys will be boys' horseplay is that it escalates. A couple years ago the Kirkland rape squad got in trouble when  they raped a developmentally disabled kid with a broomstick.

Here, once the Bothell boys got the all clear from the corrupt cop on the spring they really went to town own a kid at summer camp, targeted him of three separate occasions even though he begged them to stop and didn't want to testify because he just wanted it to be over.

But I am sure the coaches promise to watch them more closely on away game will absolutely correct the problem.

https://www.seattletimes.com/seattle-news/times-watchdog/disturbing-allegations-at-bothell-football-but-no-criminal-charges/",True,False,[],False,Seattle,t5_2qhad,176630,public,self,Heard about the 'rape squad' of Bothell high?,0,1572312342,https://www.reddit.com/r/Seattle/comments/dnyuq4/heard_about_the_rape_squad_of_bothell_high/,all_ads,6,,,,,,,,,,,,,
[],False,carbonconcept,,[],,text,t2_4btztw4h,False,[],False,False,1572206077,self.Seattle,https://www.reddit.com/r/Seattle/comments/dnyiso/tipping_in_the_u_district/,{},dnyiso,True,False,False,False,True,True,False,,,[],,,dark,text,False,False,True,5,0,,,False,all_ads,/r/Seattle/comments/dnyiso/tipping_in_the_u_district/,False,6,1572206084,0,"I've worked at a couple places on the ave and while I've been taught that it's always good to tip, I've learned that the tip money doesn't always make it back to the worker. I was curious to know which restaurants and places on the Ave and in UVillage operate like this so I was hoping fellow Redditors would fill out this quick anonymous form

[https://docs.google.com/forms/d/e/1FAIpQLSfbzF5kdUPvi0UCZ9-2MVqSd17wMTgSXlAkP\_9crC349rp1Rw/viewform?usp=sf\_link](https://docs.google.com/forms/d/e/1FAIpQLSfbzF5kdUPvi0UCZ9-2MVqSd17wMTgSXlAkP_9crC349rp1Rw/viewform?usp=sf_link)",True,False,[],False,Seattle,t5_2qhad,176622,public,self,Tipping in the U District,0,1572312030,https://www.reddit.com/r/Seattle/comments/dnyiso/tipping_in_the_u_district/,all_ads,6,,,,,,,,,,,,,
[],False,gaminggfreakk,,[],,text,t2_4dayidw2,False,[],False,False,1572204694,apkpure.com,https://www.reddit.com/r/Seattle/comments/dnybgn/best_free_app_for_watching_movies_tv_shows_for/,{},dnybgn,False,False,False,False,False,False,False,,flair,"[{'e': 'text', 't': 'Found'}]",df48292c-412a-11e8-94f6-0ea72814b416,Found,dark,richtext,False,False,True,0,0,,,False,all_ads,/r/Seattle/comments/dnybgn/best_free_app_for_watching_movies_tv_shows_for/,False,6,1572204695,1,,True,False,[],False,Seattle,t5_2qhad,176619,public,default,Best Free App for Watching Movies &amp; Tv Shows for Free,0,1572311655,https://apkpure.com/store/apps/details?id=com.mb.movieclub,all_ads,6,,,,,,,,,,,,,
[],False,gabe-schirwing,,[],,text,t2_187oesgg,False,[],False,False,1572201939,self.Seattle,https://www.reddit.com/r/Seattle/comments/dnxolg/exportlanders_what_do_you_miss_now_that_youre_a/,{},dnxolg,True,False,False,False,True,True,False,,,[],,,dark,text,False,False,True,23,0,,,False,all_ads,/r/Seattle/comments/dnxolg/exportlanders_what_do_you_miss_now_that_youre_a/,False,6,1572201940,5,,True,False,[],False,Seattle,t5_2qhad,176616,public,self,Ex-Portlanders - What do you miss now that you're a Seattleite?,0,1572310903,https://www.reddit.com/r/Seattle/comments/dnxolg/exportlanders_what_do_you_miss_now_that_youre_a/,all_ads,6,,,,,,,,,,,,,
[],False,BabeFuckingRuthless,,[],,text,t2_rrkljz2,False,[],False,False,1572198011,i.redd.it,https://www.reddit.com/r/Seattle/comments/dnwrla/good_morning_seattle/,{},dnwrla,True,False,False,True,True,False,False,,,[],,,dark,text,False,False,True,11,0,,,False,all_ads,/r/Seattle/comments/dnwrla/good_morning_seattle/,False,6,1572198012,94,,True,False,[],False,Seattle,t5_2qhad,176606,public,default,Good morning Seattle,0,1572309664,https://i.redd.it/lvz5i37ce4v31.jpg,all_ads,6,,,,,,,,,,,,,
[],False,conqrr,,[],,text,t2_eis3c,False,[],False,False,1572197422,self.Seattle,https://www.reddit.com/r/Seattle/comments/dnwmr0/closed_glass_rooftop_with_waternature_views/,{},dnwmr0,True,False,False,False,True,True,False,,,[],,,dark,text,False,False,True,3,0,,,False,all_ads,/r/Seattle/comments/dnwmr0/closed_glass_rooftop_with_waternature_views/,False,6,1572197423,1,I'm looking for a cafe/library/open area with a rooftop/glassview (closed so that its not cold) with nice outdoorish views (prefarably a waterfront or nature views with not much cityscape). On summer days i'd just hangout at a less crowded park. But its not so fun without the warmth (coming from a tropical country).,True,False,[],False,Seattle,t5_2qhad,176606,public,self,Closed Glass rooftop with water/nature views.,0,1572309351,https://www.reddit.com/r/Seattle/comments/dnwmr0/closed_glass_rooftop_with_waternature_views/,all_ads,6,,,,,,,,,,,,,
[],False,pjhasbeats,,[],,text,t2_k9p7oc8,False,[],False,False,1572196982,/r/Seattle/comments/dnwj4q/anyone_else_see_an_arrangement_of_lights_hovering/,https://www.reddit.com/r/Seattle/comments/dnwj4q/anyone_else_see_an_arrangement_of_lights_hovering/,{},dnwj4q,True,False,False,False,True,False,True,,flair,"[{'e': 'text', 't': 'Media'}]",cba61046-412a-11e8-8b48-0e90cbddd944,Media,dark,richtext,False,False,True,10,0,,,False,all_ads,/r/Seattle/comments/dnwj4q/anyone_else_see_an_arrangement_of_lights_hovering/,False,6,1572196984,0,,True,False,[],False,Seattle,t5_2qhad,176605,public,default,Anyone else see an arrangement of lights hovering over S. Seattle last night?,0,1572309257,https://v.redd.it/v3dpc0txa4v31,all_ads,6,,,,,,,,,,,,,
[],False,chiquisea,,[],,text,t2_8stvl,False,[],False,False,1572194687,kuow.org,https://www.reddit.com/r/Seattle/comments/dnvzhq/those_vibrant_fall_colors_in_the_northwest_are/,{},dnvzhq,True,False,False,False,True,False,False,,,[],,,dark,text,False,False,True,2,0,,,False,all_ads,/r/Seattle/comments/dnvzhq/those_vibrant_fall_colors_in_the_northwest_are/,False,6,1572194688,32,,True,False,[],False,Seattle,t5_2qhad,176605,public,default,Those vibrant fall colors in the Northwest are likely to stick around for awhile,0,1572308587,https://kuow.org/stories/notice-those-pretty-fall-colors-in-seattle-they-re-likely-to-stick-around,all_ads,6,,,,,,,,,,,,,
[],False,atl0618,,[],,text,t2_1psorong,False,[],False,False,1572193616,self.Seattle,https://www.reddit.com/r/Seattle/comments/dnvpu4/best_pancakes_in_seattle/,{},dnvpu4,True,False,False,False,True,True,False,,flair,"[{'e': 'text', 't': 'Question'}]",9b95cc16-44bf-11e6-aba4-0e42ab5b9d91,Question,dark,richtext,False,False,True,24,0,,,False,all_ads,/r/Seattle/comments/dnvpu4/best_pancakes_in_seattle/,False,6,1572193617,0,"Hey y’all! We are traveling up to Seattle in late December and rather than asking all of touristy questions, I have one very important question-

Where can we find the best pancakes (and breakfast) in Seattle? 

We will be there a few days so we are looking to try a couple of different breakfast places. So please send your best recommendations. 

Thanks!",True,False,[],False,Seattle,t5_2qhad,176604,public,self,Best Pancakes in Seattle,0,1572308154,https://www.reddit.com/r/Seattle/comments/dnvpu4/best_pancakes_in_seattle/,all_ads,6,,,,,,,,,,,,,
[],False,Its_Happning_Again,,[],,text,t2_494d4vxp,False,[],False,False,1572190105,i.redd.it,https://www.reddit.com/r/Seattle/comments/dnuva8/former_soldier_james_m_smith_blames_murdering_his/,{},dnuva8,True,False,False,True,True,False,False,,flair,"[{'e': 'text', 't': 'News'}]",9f9ba910-f804-11e4-be5c-0ea18645ab5f,News,dark,richtext,False,False,True,5,0,,,False,all_ads,/r/Seattle/comments/dnuva8/former_soldier_james_m_smith_blames_murdering_his/,False,6,1572190106,17,,True,False,[],False,Seattle,t5_2qhad,176602,public,default,"Former soldier James M. Smith blames murdering his wife on the ""blood lust"" he developed while deployed during the war. He went to his wife's house at 3534 Hudson St, Seattle shot her, his mother-in-law and then turned the gun on himself. Mother-in-law and Smith survived - Oct 27, 1919",0,1572306983,https://i.redd.it/nma16q83q3v31.jpg,all_ads,6,,,,,,,,,,,,,
[],False,MoonPiesInMyPants,,[],,text,t2_3xrxphld,False,[],False,False,1572189971,self.Seattle,https://www.reddit.com/r/Seattle/comments/dnuu4t/best_spots_to_study/,{},dnuu4t,True,False,False,False,True,True,False,,,[],,,dark,text,False,False,True,9,0,,,False,all_ads,/r/Seattle/comments/dnuu4t/best_spots_to_study/,False,6,1572189974,2,Looking for a good spot to study. A nice view and some good coffee would be great ! What's your favorite study spot ?,True,False,[],False,Seattle,t5_2qhad,176602,public,self,Best spots to study ?,0,1572306953,https://www.reddit.com/r/Seattle/comments/dnuu4t/best_spots_to_study/,all_ads,6,,,,,,,,,,,,,
[],False,kkastorf,,[],,text,t2_hf0f7,False,[],False,False,1572184935,self.Seattle,https://www.reddit.com/r/Seattle/comments/dntn28/do_you_like_popcorn/,{},dntn28,True,False,False,False,True,True,False,,,[],,,dark,text,False,False,True,3,0,,,False,all_ads,/r/Seattle/comments/dntn28/do_you_like_popcorn/,False,6,1572184936,0,"My name is Soren. I am eight and posted from my Dad's account. I am a Cub Scout and last year was one of the top popcorn sellers in Atlanta, GA. I won an award for selling popcorn to people in the most states - eleven! This year I want to sell to one person in every state in the United States, but I have never met anyone from Seattle. If you buy popcorn from me and send me your mailing address, I will make you a postcard with interesting information about Atlanta. If you don't like popcorn you can also make a donation that helps our troops. Thank you! This is a link to my popcorn store and you can learn more about me.  [https://www.trails-end.com/store/scout/NW90NL4K](https://www.trails-end.com/store/scout/NW90NL4K)",True,False,[],False,Seattle,t5_2qhad,176599,public,self,Do you like popcorn?,0,1572305509,https://www.reddit.com/r/Seattle/comments/dntn28/do_you_like_popcorn/,all_ads,6,,,,,,,,,,,,,
[],False,ezrh,,[],,text,t2_3fhgeqw,False,[],False,False,1572170048,i.redd.it,https://www.reddit.com/r/Seattle/comments/dnrata/january_4th_2017_a_cold_winter/,{},dnrata,True,False,False,True,True,False,False,,flair,"[{'e': 'text', 't': 'Media'}]",cba61046-412a-11e8-8b48-0e90cbddd944,Media,dark,richtext,False,False,True,2,0,,,False,all_ads,/r/Seattle/comments/dnrata/january_4th_2017_a_cold_winter/,False,6,1572170049,8,,True,False,[],False,Seattle,t5_2qhad,176594,public,default,"January 4th , 2017; a cold winter",0,1572302529,https://i.redd.it/jkh4mzl732v31.png,all_ads,6,,,,,,,,,,,,,
[],False,internetmaster5000,,[],,text,t2_123tpl,False,[],False,False,1572169200,reason.com,https://www.reddit.com/r/Seattle/comments/dnr6yy/seattle_public_schools_will_start_teaching_that/,{},dnr6yy,True,False,False,False,True,False,False,,,[],,,dark,text,False,False,True,4,0,Math is a deeply frustrating subject for many elementary and high school students. But Seattle public schools are gearing up,Seattle Public Schools Will Start Teaching That Math Is Oppressive,False,all_ads,/r/Seattle/comments/dnr6yy/seattle_public_schools_will_start_teaching_that/,False,6,1572169201,0,,True,False,[],False,Seattle,t5_2qhad,176593,public,https://b.thumbs.redditmedia.com/LjPDxHyXkqigJ2tzrcG7BGYltfmbhoNwsVNmwvz-dBI.jpg,Seattle Public Schools Will Start Teaching That Math Is Oppressive,0,1572302429,https://reason.com/2019/10/22/seattle-math-oppressive-cultural-woke/,all_ads,6,link,"{'enabled': False, 'images': [{'id': 'CPep-rem7i570GE5W_TNWfFBE7juxLpoX1ZbWZKcGDI', 'resolutions': [{'height': 56, 'url': 'https://external-preview.redd.it/lnZ5p_D8RYR4QPo6suLLmrEApJy_0mC_d-B17oDtCGs.jpg?width=108&amp;crop=smart&amp;auto=webp&amp;s=7b52cb412230e35ab70b9d1db5457321228628ec', 'width': 108}, {'height': 113, 'url': 'https://external-preview.redd.it/lnZ5p_D8RYR4QPo6suLLmrEApJy_0mC_d-B17oDtCGs.jpg?width=216&amp;crop=smart&amp;auto=webp&amp;s=1dd745c0d933764d79651c7547fa3fcbef1ab666', 'width': 216}, {'height': 168, 'url': 'https://external-preview.redd.it/lnZ5p_D8RYR4QPo6suLLmrEApJy_0mC_d-B17oDtCGs.jpg?width=320&amp;crop=smart&amp;auto=webp&amp;s=5f87d9ce7340a2a3bde04af202a519dc2228448e', 'width': 320}, {'height': 336, 'url': 'https://external-preview.redd.it/lnZ5p_D8RYR4QPo6suLLmrEApJy_0mC_d-B17oDtCGs.jpg?width=640&amp;crop=smart&amp;auto=webp&amp;s=a6d173022d9983c62d4bd379514fcbd215fe0627', 'width': 640}, {'height': 504, 'url': 'https://external-preview.redd.it/lnZ5p_D8RYR4QPo6suLLmrEApJy_0mC_d-B17oDtCGs.jpg?width=960&amp;crop=smart&amp;auto=webp&amp;s=3b41ba89d8d786a47fdefd57b962932273533b16', 'width': 960}, {'height': 567, 'url': 'https://external-preview.redd.it/lnZ5p_D8RYR4QPo6suLLmrEApJy_0mC_d-B17oDtCGs.jpg?width=1080&amp;crop=smart&amp;auto=webp&amp;s=f45b4fcf779e2af41fbefe0b6d25eb4ac8bee6a7', 'width': 1080}], 'source': {'height': 630, 'url': 'https://external-preview.redd.it/lnZ5p_D8RYR4QPo6suLLmrEApJy_0mC_d-B17oDtCGs.jpg?auto=webp&amp;s=95e1fb9f54b5ad892e10b2a0dc35b14e51b06b08', 'width': 1200}, 'variants': {}}]}",73.0,140.0,,,,,,,,,
[],False,pm_me_ur_dragonart,,[],,text,t2_2bbzry5w,False,[],False,False,1572160972,self.Seattle,https://www.reddit.com/r/Seattle/comments/dnq688/food_habits_survey/,{},dnq688,True,False,False,False,True,True,False,,,[],,,dark,text,False,False,True,6,0,,,False,all_ads,/r/Seattle/comments/dnq688/food_habits_survey/,False,6,1572160972,0,"Hello! I am a student at the University of Washington, and I am researching the food and nutrition habits of people in this area for a project. I have created this brief survey, and I would really appreciate it if you would answer my research questions!

Link to survey: [https://docs.google.com/forms/d/e/1FAIpQLScy7q15-Owgy9J5UlzhJiQ8WgTrSoAg\_t1w-xhWnloUTs-sog/viewform?usp=sf\_link](https://docs.google.com/forms/d/e/1FAIpQLScy7q15-Owgy9J5UlzhJiQ8WgTrSoAg_t1w-xhWnloUTs-sog/viewform?usp=sf_link)

Thank you! :)",True,False,[],False,Seattle,t5_2qhad,176586,public,self,Food Habits Survey,0,1572300959,https://www.reddit.com/r/Seattle/comments/dnq688/food_habits_survey/,all_ads,6,,,,,,,,,,,,,
[],False,cg_,,[],,text,t2_advij,False,[],False,False,1572157185,i.redd.it,https://www.reddit.com/r/Seattle/comments/dnpom3/new_east_link_near_bellevueredmond_not_too/,{},dnpom3,True,False,False,True,True,False,False,,flair,"[{'e': 'text', 't': 'Media'}]",,Media,dark,richtext,False,False,True,3,0,,,False,all_ads,/r/Seattle/comments/dnpom3/new_east_link_near_bellevueredmond_not_too/,False,6,1572157186,0,,True,False,[],False,Seattle,t5_2qhad,176584,public,default,"New East link near Bellevue/Redmond, not too straight...",0,1572300372,https://i.redd.it/9fyw8ufm01v31.jpg,all_ads,6,,,,,,,,,,,,,
