author,author_flair_css_class,author_flair_richtext,author_flair_text,author_flair_type,author_fullname,author_patreon_flair,can_mod_post,contest_mode,created_utc,domain,full_link,gildings,id,is_crosspostable,is_meta,is_original_content,is_reddit_media_domain,is_robot_indexable,is_self,is_video,link_flair_background_color,link_flair_richtext,link_flair_text_color,link_flair_type,locked,media_only,no_follow,num_comments,num_crossposts,over_18,parent_whitelist_status,permalink,pinned,pwls,retrieved_on,score,selftext,send_replies,spoiler,stickied,subreddit,subreddit_id,subreddit_subscribers,subreddit_type,thumbnail,title,url,whitelist_status,wls,link_flair_css_class,link_flair_text,post_hint,preview,thumbnail_height,thumbnail_width,author_flair_background_color,author_flair_text_color,link_flair_template_id,media_metadata,crosspost_parent,crosspost_parent_list,author_flair_template_id,media,media_embed,secure_media,secure_media_embed,author_cakeday
AvianTralfamadorian,,[],,text,t2_12onso,False,False,False,1549410823,self.WAbeer,https://www.reddit.com/r/Seattle/comments/ankfsi/still_thirsty_ballard_brewery_taproom_12_and_13/,"{'gid_1': 0, 'gid_2': 0, 'gid_3': 0}",ankfsi,True,False,False,False,True,False,False,,[],dark,text,False,False,True,0,0,False,all_ads,/r/Seattle/comments/ankfsi/still_thirsty_ballard_brewery_taproom_12_and_13/,False,6,1549410824,1,,True,False,False,Seattle,t5_2qhad,145608,public,default,Still thirsty Ballard? Brewery taproom #12 and #13 (maybe even #14) expected by end of 2019,https://www.reddit.com/r/WAbeer/comments/ankd7u/urban_family_brewing_to_relocate_a_short_distance/,all_ads,6,,,link,"{'enabled': False, 'images': [{'id': '4UYBKmkKpDeJoPeMcBagOioE74X8y15xacqV0Jg2Gtg', 'resolutions': [{'height': 66, 'url': 'https://external-preview.redd.it/Np0Ne9MQfUFVbY7SI1G3UnK1atO8EU_wOHMhdlEJMDY.jpg?width=108&amp;crop=smart&amp;auto=webp&amp;s=3b9382842ae044a926a09251753bf20a64308584', 'width': 108}, {'height': 133, 'url': 'https://external-preview.redd.it/Np0Ne9MQfUFVbY7SI1G3UnK1atO8EU_wOHMhdlEJMDY.jpg?width=216&amp;crop=smart&amp;auto=webp&amp;s=eb9a7a5d002d4997d4714c2a7468057eb0276144', 'width': 216}, {'height': 197, 'url': 'https://external-preview.redd.it/Np0Ne9MQfUFVbY7SI1G3UnK1atO8EU_wOHMhdlEJMDY.jpg?width=320&amp;crop=smart&amp;auto=webp&amp;s=2c1bd2246d863a98a32e317d2a4f93c02e2cf499', 'width': 320}], 'source': {'height': 356, 'url': 'https://external-preview.redd.it/Np0Ne9MQfUFVbY7SI1G3UnK1atO8EU_wOHMhdlEJMDY.jpg?auto=webp&amp;s=84db1e7b7d2a69fad5e6856f2b51cec5005fc4f0', 'width': 577}, 'variants': {}}]}",,,,,,,t3_ankd7u,"[{'approved_at_utc': None, 'approved_by': None, 'archived': False, 'author': 'AvianTralfamadorian', 'author_flair_background_color': None, 'author_flair_css_class': None, 'author_flair_richtext': [], 'author_flair_template_id': None, 'author_flair_text': None, 'author_flair_text_color': None, 'author_flair_type': 'text', 'author_fullname': 't2_12onso', 'author_patreon_flair': False, 'banned_at_utc': None, 'banned_by': None, 'can_gild': True, 'can_mod_post': False, 'category': None, 'clicked': False, 'content_categories': None, 'contest_mode': False, 'created': 1549439170.0, 'created_utc': 1549410370.0, 'distinguished': None, 'domain': 'self.WAbeer', 'downs': 0, 'edited': False, 'gilded': 0, 'gildings': {'gid_1': 0, 'gid_2': 0, 'gid_3': 0}, 'hidden': False, 'hide_score': True, 'id': 'ankd7u', 'is_crosspostable': True, 'is_meta': False, 'is_original_content': False, 'is_reddit_media_domain': False, 'is_robot_indexable': True, 'is_self': True, 'is_video': False, 'likes': None, 'link_flair_background_color': '', 'link_flair_css_class': None, 'link_flair_richtext': [], 'link_flair_template_id': None, 'link_flair_text': None, 'link_flair_text_color': 'dark', 'link_flair_type': 'text', 'locked': False, 'media': None, 'media_embed': {}, 'media_only': False, 'mod_note': None, 'mod_reason_by': None, 'mod_reason_title': None, 'mod_reports': [], 'name': 't3_ankd7u', 'no_follow': False, 'num_comments': 0, 'num_crossposts': 2, 'num_reports': None, 'over_18': False, 'parent_whitelist_status': None, 'permalink': '/r/WAbeer/comments/ankd7u/urban_family_brewing_to_relocate_a_short_distance/', 'pinned': False, 'post_hint': 'self', 'preview': {'enabled': False, 'images': [{'id': '4UYBKmkKpDeJoPeMcBagOioE74X8y15xacqV0Jg2Gtg', 'resolutions': [{'height': 66, 'url': 'https://external-preview.redd.it/Np0Ne9MQfUFVbY7SI1G3UnK1atO8EU_wOHMhdlEJMDY.jpg?width=108&amp;crop=smart&amp;auto=webp&amp;s=3b9382842ae044a926a09251753bf20a64308584', 'width': 108}, {'height': 133, 'url': 'https://external-preview.redd.it/Np0Ne9MQfUFVbY7SI1G3UnK1atO8EU_wOHMhdlEJMDY.jpg?width=216&amp;crop=smart&amp;auto=webp&amp;s=eb9a7a5d002d4997d4714c2a7468057eb0276144', 'width': 216}, {'height': 197, 'url': 'https://external-preview.redd.it/Np0Ne9MQfUFVbY7SI1G3UnK1atO8EU_wOHMhdlEJMDY.jpg?width=320&amp;crop=smart&amp;auto=webp&amp;s=2c1bd2246d863a98a32e317d2a4f93c02e2cf499', 'width': 320}], 'source': {'height': 356, 'url': 'https://external-preview.redd.it/Np0Ne9MQfUFVbY7SI1G3UnK1atO8EU_wOHMhdlEJMDY.jpg?auto=webp&amp;s=84db1e7b7d2a69fad5e6856f2b51cec5005fc4f0', 'width': 577}, 'variants': {}}]}, 'pwls': None, 'quarantine': False, 'removal_reason': None, 'report_reasons': None, 'saved': False, 'score': 2, 'secure_media': None, 'secure_media_embed': {}, 'selftext': '[Here is their official announcement](http://www.urbanfamilybrewing.com/moving-to-ballard/). By my count, that would make it brewery #12 in Ballard with a taproom. “We think we’re going to be the first brewery in Ballard,” jokes Andy Gundel, director of operations at Urban Family.\n\nIn related news, Dirty Couch Brewing is moving out of Ballard and relocating to the Interbay sometime in 2019 (although DCB never had a public taproom, so it isn’t part of the 12 Ballard breweries that you can visit).\n\nNot clear if Fremont Brewing plans on opening a new taproom at their brew house expansion in Ballard, but we do know that the crowd-funded [Fair Isle Brewing](https://www.fairislebrewing.com) is going to open summer of this year. They are partly supported by Jester King, which should give you plenty of hints that they will have lots of “foraged and funky” barrel aged beer.\n\nThat means Ballard will have a minimum of 13 brewery taprooms by end of 2019, or as many as 14 taprooms if Fremont Brewing opens one at their expansion brew house, too.\n\nHere is the [36 minute walking map for the 11 Ballard breweries to hold you over in the mean time.](https://www.reddit.com/r/WAbeer/comments/aifz6l/ballard_brewery_passport_and_map/?st=JRSEY1C0&amp;sh=63e6e9a3) ', 'selftext_html': '&lt;!-- SC_OFF --&gt;&lt;div class=""md""&gt;&lt;p&gt;&lt;a href=""http://www.urbanfamilybrewing.com/moving-to-ballard/""&gt;Here is their official announcement&lt;/a&gt;. By my count, that would make it brewery #12 in Ballard with a taproom. “We think we’re going to be the first brewery in Ballard,” jokes Andy Gundel, director of operations at Urban Family.&lt;/p&gt;\n\n&lt;p&gt;In related news, Dirty Couch Brewing is moving out of Ballard and relocating to the Interbay sometime in 2019 (although DCB never had a public taproom, so it isn’t part of the 12 Ballard breweries that you can visit).&lt;/p&gt;\n\n&lt;p&gt;Not clear if Fremont Brewing plans on opening a new taproom at their brew house expansion in Ballard, but we do know that the crowd-funded &lt;a href=""https://www.fairislebrewing.com""&gt;Fair Isle Brewing&lt;/a&gt; is going to open summer of this year. They are partly supported by Jester King, which should give you plenty of hints that they will have lots of “foraged and funky” barrel aged beer.&lt;/p&gt;\n\n&lt;p&gt;That means Ballard will have a minimum of 13 brewery taprooms by end of 2019, or as many as 14 taprooms if Fremont Brewing opens one at their expansion brew house, too.&lt;/p&gt;\n\n&lt;p&gt;Here is the &lt;a href=""https://www.reddit.com/r/WAbeer/comments/aifz6l/ballard_brewery_passport_and_map/?st=JRSEY1C0&amp;amp;sh=63e6e9a3""&gt;36 minute walking map for the 11 Ballard breweries to hold you over in the mean time.&lt;/a&gt; &lt;/p&gt;\n&lt;/div&gt;&lt;!-- SC_ON --&gt;', 'send_replies': True, 'spoiler': False, 'stickied': False, 'subreddit': 'WAbeer', 'subreddit_id': 't5_2vdid', 'subreddit_name_prefixed': 'r/WAbeer', 'subreddit_subscribers': 1696, 'subreddit_type': 'public', 'suggested_sort': None, 'thumbnail': 'self', 'thumbnail_height': None, 'thumbnail_width': None, 'title': 'Urban Family Brewing to relocate a short distance to Ballard neighborhood from Magnolia by end of 2019', 'ups': 2, 'url': 'https://www.reddit.com/r/WAbeer/comments/ankd7u/urban_family_brewing_to_relocate_a_short_distance/', 'user_reports': [], 'view_count': None, 'visited': False, 'whitelist_status': None, 'wls': None}]",,,,,,
coogi_huxtable,,[],,text,t2_phwqzih,False,False,False,1549410459,i.redd.it,https://www.reddit.com/r/Seattle/comments/ankdqv/bring_the_sonics_back_to_seattle/,"{'gid_1': 0, 'gid_2': 0, 'gid_3': 0}",ankdqv,True,False,False,True,True,False,False,,[],dark,text,False,False,True,0,0,False,all_ads,/r/Seattle/comments/ankdqv/bring_the_sonics_back_to_seattle/,False,6,1549410460,1,,True,False,False,Seattle,t5_2qhad,145608,public,default,Bring the Sonics back to Seattle,https://i.redd.it/sukg12397ue21.jpg,all_ads,6,,,,,,,,,,,,,,,,,,
longlive289s,flair,"[{'e': 'text', 't': 'Bremerton'}]",Bremerton,richtext,t2_dq9tr,False,False,False,1549410246,seattletimes.com,https://www.reddit.com/r/Seattle/comments/ankch3/unfortunately_we_might_not_be_quite_done_with_the/,"{'gid_1': 0, 'gid_2': 0, 'gid_3': 0}",ankch3,True,False,False,False,True,False,False,,[],dark,text,False,False,True,2,0,False,all_ads,/r/Seattle/comments/ankch3/unfortunately_we_might_not_be_quite_done_with_the/,False,6,1549410247,1,,False,False,False,Seattle,t5_2qhad,145608,public,default,Unfortunately we might not be quite done with the cold temps and snow. More predicted this weekend,https://www.seattletimes.com/seattle-news/weather/more-snow-another-weather-system-could-hit-seattle-on-friday-or-saturday/,all_ads,6,,,,,,,,dark,,,,,f1e2a126-7a24-11e1-aaae-12313b08a511,,,,,
redit-fan,,[],,text,t2_323lxwxg,False,False,False,1549408097,i.redd.it,https://www.reddit.com/r/Seattle/comments/anjzxe/a_little_drone_fun_in_the_snow/,"{'gid_1': 0, 'gid_2': 0, 'gid_3': 0}",anjzxe,True,False,False,True,True,False,False,,[],dark,text,False,False,True,4,0,False,all_ads,/r/Seattle/comments/anjzxe/a_little_drone_fun_in_the_snow/,False,6,1549408098,1,,True,False,False,Seattle,t5_2qhad,145605,public,default,A little drone fun in the snow,https://i.redd.it/ihgvhq580ue21.jpg,all_ads,6,,,,,,,,,,,,,,,,,,
ChefVader,,[],,text,t2_70ejp,False,False,False,1549402318,reddit.com,https://www.reddit.com/r/Seattle/comments/anizep/sheriffs_use_of_courtroom_camera_to_view_jurors/,"{'gid_1': 0, 'gid_2': 0, 'gid_3': 0}",anizep,True,False,False,False,True,False,False,,[],dark,text,False,False,True,2,0,False,all_ads,/r/Seattle/comments/anizep/sheriffs_use_of_courtroom_camera_to_view_jurors/,False,6,1549402319,1,,True,False,False,Seattle,t5_2qhad,145597,public,default,"Sheriff’s use of courtroom camera to view juror’s notebook, lawyer’s notes sparks dismissal of criminal case",https://www.reddit.com/r/news/comments/anf0s8/sheriffs_use_of_courtroom_camera_to_view_jurors/,all_ads,6,,,,,,,,,,,,,,,,,,
lunchmeat317,,[],,text,t2_djc0x,False,False,False,1549402260,self.Seattle,https://www.reddit.com/r/Seattle/comments/aniz0z/donating_old_programming_books_in_seattle/,"{'gid_1': 0, 'gid_2': 0, 'gid_3': 0}",aniz0z,True,False,False,False,True,True,False,,[],dark,text,False,False,True,3,0,False,all_ads,/r/Seattle/comments/aniz0z/donating_old_programming_books_in_seattle/,False,6,1549402262,1,"Not a snow thread.

I have some older programming, networking, and technology books that I no longer want to keep. I considered donating them to the public library, but they have a policy that material of this nature older than five years won't be accepted (likely due to the churn of technology).

I would rather not recycle the books, as some of them may still have worthwhile information and could help someone, even if things have evolved. (For example, I have a book on TCP/IP - while some things have changed, like IPv6, TCP is the same and many of the logic behind IP is still intact.)

Are there any places in Seattle - charities, bookstores, places looking for historical technical reference material for scanning and archival purposes - that would take these books? I'm also open to shipping if anyone knows anything.

Thank you!

",True,False,False,Seattle,t5_2qhad,145597,public,self,Donating old programming books in Seattle?,https://www.reddit.com/r/Seattle/comments/aniz0z/donating_old_programming_books_in_seattle/,all_ads,6,,,,,,,,,,,,,,,,,,
aquasquirrel1,,[],,text,t2_vvo1cia,False,False,False,1549402222,self.Seattle,https://www.reddit.com/r/Seattle/comments/aniys5/sammamish_roadsicy_or_good/,"{'gid_1': 0, 'gid_2': 0, 'gid_3': 0}",aniys5,True,False,False,False,True,True,False,,"[{'e': 'text', 't': 'Question'}]",dark,richtext,False,False,True,2,0,False,all_ads,/r/Seattle/comments/aniys5/sammamish_roadsicy_or_good/,False,6,1549402223,1,"Might be a long shot, but has anyone driven some of the main hills in Sammamish today, specifically Louis Thompson Rd or Sahalie? I’m headed that way tomorrow morning and really hoping it’s clear/not an icy mess. I heard the local roads of Sammamish are fine and am hoping the main hills in/out are good too. Thanks!",True,False,False,Seattle,t5_2qhad,145597,public,self,Sammamish roads-icy or good?,https://www.reddit.com/r/Seattle/comments/aniys5/sammamish_roadsicy_or_good/,all_ads,6,flair,Question,,,,,,,9b95cc16-44bf-11e6-aba4-0e42ab5b9d91,,,,,,,,,
vampyire,,[],,text,t2_lb0ts,False,False,False,1549400924,self.Seattle,https://www.reddit.com/r/Seattle/comments/aniqdy/252014_was_a_pretty_good_day/,"{'gid_1': 0, 'gid_2': 0, 'gid_3': 0}",aniqdy,True,False,False,False,True,True,False,,[],dark,text,False,False,True,0,0,False,all_ads,/r/Seattle/comments/aniqdy/252014_was_a_pretty_good_day/,False,6,1549400925,1,,True,False,False,Seattle,t5_2qhad,145593,public,self,2/5/2014 was a pretty good day,https://www.reddit.com/r/Seattle/comments/aniqdy/252014_was_a_pretty_good_day/,all_ads,6,,,,,,,,,,,,,,,,,,
Thorsek,,[],,text,t2_aog72,False,False,False,1549400315,self.Seattle,https://www.reddit.com/r/Seattle/comments/animdv/i_have_5_hours_to_cancel_or_keep_my_flight_help/,"{'gid_1': 0, 'gid_2': 0, 'gid_3': 0}",animdv,True,False,False,False,True,True,False,,"[{'e': 'text', 't': 'Question'}]",dark,richtext,False,False,True,11,0,False,all_ads,/r/Seattle/comments/animdv/i_have_5_hours_to_cancel_or_keep_my_flight_help/,False,6,1549400487,1,I have a group of 4 from Texas that just bought flights to SEA for May 3-11 for a trip to enjoy some outdoors and scenic views. We are quickly finding out that many trails and parks throughout the cascades aren't as accessible as we thought they would be. Mt. Rainier park is likely to be closed correct? Are there still trails to backpack/hike open that make the trip worth it? Are these dates simply too early for the hiking adventure we hoped for? ,True,False,False,Seattle,t5_2qhad,145593,public,self,I have 5 hours to cancel or keep my flight! Help!,https://www.reddit.com/r/Seattle/comments/animdv/i_have_5_hours_to_cancel_or_keep_my_flight_help/,all_ads,6,flair,Question,,,,,,,9b95cc16-44bf-11e6-aba4-0e42ab5b9d91,,,,,,,,,
Jimmybelltown,,[],,text,t2_gb20p,False,False,False,1549398822,/r/Seattle/comments/anie57/my_first_trip_thru_new_tunnel/,https://www.reddit.com/r/Seattle/comments/anie57/my_first_trip_thru_new_tunnel/,"{'gid_1': 0, 'gid_2': 0, 'gid_3': 0}",anie57,True,False,False,False,True,False,True,,[],dark,text,False,False,True,63,0,False,all_ads,/r/Seattle/comments/anie57/my_first_trip_thru_new_tunnel/,False,6,1549398823,1,,True,False,False,Seattle,t5_2qhad,145587,public,default,My first trip thru new tunnel.,https://v.redd.it/l4sdbcuf8te21,all_ads,6,,,,,,,,,,,,,,,,,,
synapomorpheus,,[],,text,t2_1l5jwhn7,False,False,False,1549398567,self.Seattle,https://www.reddit.com/r/Seattle/comments/anicgw/a_request_for_seattle_drivers/,"{'gid_1': 0, 'gid_2': 0, 'gid_3': 0}",anicgw,True,False,False,False,True,True,False,,"[{'e': 'text', 't': 'Recommendation'}]",dark,richtext,False,False,True,36,0,False,all_ads,/r/Seattle/comments/anicgw/a_request_for_seattle_drivers/,False,6,1549398569,1,"Hello Seattle! 
A quick request from a fellow Seattlite, could you please dust the snow off the tops of your vehicles before you drive? Snow flying off  your cars on the highway creates an unnecessary hazard for both you and other drivers, it can also obstruct your view of it slides forward. Unfortunately, I have seen a lot of drivers with the snow hats. 
I know not all of us are used to seeing this much snow, but it’s good practice to always brush snow off your cars. 

Thank you! ",True,False,False,Seattle,t5_2qhad,145584,public,self,A request for Seattle Drivers,https://www.reddit.com/r/Seattle/comments/anicgw/a_request_for_seattle_drivers/,all_ads,6,flair,Recommendation,,,,,,,9f763cd0-473d-11e8-93f7-0e6f632c214e,,,,,,,,,
parlayoloswag,,[],,text,t2_o2272,False,False,False,1549397300,i.redd.it,https://www.reddit.com/r/Seattle/comments/ani49m/my_gf_got_this_for_my_office_i_love_this_city_and/,"{'gid_1': 0, 'gid_2': 0, 'gid_3': 0}",ani49m,True,False,False,True,True,False,False,,"[{'e': 'text', 't': 'Media'}]",dark,richtext,False,False,True,25,0,False,all_ads,/r/Seattle/comments/ani49m/my_gf_got_this_for_my_office_i_love_this_city_and/,False,6,1549397301,1,,True,False,False,Seattle,t5_2qhad,145584,public,default,"My GF got this for my office! I love this city! and her, :) .",https://i.redd.it/wh0i1ccy3te21.jpg,all_ads,6,flair,Media,,,,,,,,,,,,,,,,
LitchLitch,,[],,text,t2_j3ho9,False,False,False,1549397091,self.Seattle,https://www.reddit.com/r/Seattle/comments/ani2wc/oww/,"{'gid_1': 0, 'gid_2': 0, 'gid_3': 0}",ani2wc,True,False,False,False,True,True,False,,[],dark,text,False,False,True,5,0,False,all_ads,/r/Seattle/comments/ani2wc/oww/,False,6,1549397092,1,"Nothing makes you as aware of how out of shape you are as shoveling snow off your sidewalk.  


Really should have done it yesterday before it was compacted into ice.",True,False,False,Seattle,t5_2qhad,145583,public,self,Oww,https://www.reddit.com/r/Seattle/comments/ani2wc/oww/,all_ads,6,,,,,,,,,,,,,,,,,,
MaximumYogertCloset,flair,"[{'e': 'text', 't': 'Covington'}]",Covington,richtext,t2_1x4ggqpy,False,False,False,1549395823,i.redd.it,https://www.reddit.com/r/Seattle/comments/anhuww/evening_in_covington/,"{'gid_1': 0, 'gid_2': 0, 'gid_3': 0}",anhuww,True,False,False,True,True,False,False,,"[{'e': 'text', 't': 'Media'}]",dark,richtext,False,False,True,3,0,False,all_ads,/r/Seattle/comments/anhuww/evening_in_covington/,False,6,1549395824,1,,True,False,False,Seattle,t5_2qhad,145579,public,default,Evening in Covington,https://i.redd.it/s71l3w4qzse21.jpg,all_ads,6,flair,Media,,,,,,dark,,,,,71ef8960-4a55-11e1-b335-12313d096aae,,,,,
rydawell,,[],,text,t2_jekrq,False,False,False,1549388305,i.redd.it,https://www.reddit.com/r/Seattle/comments/angij0/not_pictured_the_other_side_with_untouched_snow/,"{'gid_1': 0, 'gid_2': 0, 'gid_3': 0}",angij0,True,False,False,True,True,False,False,,"[{'e': 'text', 't': 'Media'}]",dark,richtext,False,False,True,7,0,False,all_ads,/r/Seattle/comments/angij0/not_pictured_the_other_side_with_untouched_snow/,False,6,1549388306,1,,True,False,False,Seattle,t5_2qhad,145562,public,https://b.thumbs.redditmedia.com/U_Hc4WeeHYavHRE4eZAno7M5rNqcghLuhnA4Q_hZYGY.jpg,Not pictured: the other side with untouched snow. 🤔,https://i.redd.it/0ew6mscedse21.jpg,all_ads,6,flair,Media,image,"{'enabled': True, 'images': [{'id': '93MsHoWE59klQ61n7u0z3dZfSXM22o4rXjMFYnfGMQI', 'resolutions': [{'height': 192, 'url': 'https://preview.redd.it/0ew6mscedse21.jpg?width=108&amp;crop=smart&amp;auto=webp&amp;s=d17bd23242855b55cd421724ffb0ac3d2e0ef811', 'width': 108}, {'height': 384, 'url': 'https://preview.redd.it/0ew6mscedse21.jpg?width=216&amp;crop=smart&amp;auto=webp&amp;s=08fe830baba49133e172e851a83a9de4cf787597', 'width': 216}, {'height': 569, 'url': 'https://preview.redd.it/0ew6mscedse21.jpg?width=320&amp;crop=smart&amp;auto=webp&amp;s=f30889431c0eec37f38a8eb8876d81753926a0d5', 'width': 320}, {'height': 1138, 'url': 'https://preview.redd.it/0ew6mscedse21.jpg?width=640&amp;crop=smart&amp;auto=webp&amp;s=90594b21d3adcf3d905f6b16a55e71e95f022218', 'width': 640}], 'source': {'height': 1334, 'url': 'https://preview.redd.it/0ew6mscedse21.jpg?auto=webp&amp;s=75542c79f700f0c38dd0b7d9baec744e7703720b', 'width': 750}, 'variants': {}}]}",140.0,140.0,,,,,,,,,,,,
Edawg444,,[],,text,t2_ng1l2,False,False,False,1549388154,youtu.be,https://www.reddit.com/r/Seattle/comments/anghml/my_alternate_form_of_transportation/,"{'gid_1': 0, 'gid_2': 0, 'gid_3': 0}",anghml,True,False,False,False,True,False,False,,"[{'e': 'text', 't': 'Media'}]",dark,richtext,False,False,True,0,0,False,all_ads,/r/Seattle/comments/anghml/my_alternate_form_of_transportation/,False,6,1549388156,1,,True,False,False,Seattle,t5_2qhad,145562,public,https://b.thumbs.redditmedia.com/cv42tv3Y-ubcnOkm1eYHHKq9G3Puyy_UyVZlUlAGoaU.jpg,My Alternate Form of Transportation,https://youtu.be/wb1nmg6qduA,all_ads,6,flair,Media,rich:video,"{'enabled': False, 'images': [{'id': 'Gwx9oCJZucnOoNVftUcjlFwzJDWjqHHHabNAS6qu5tw', 'resolutions': [{'height': 81, 'url': 'https://external-preview.redd.it/llVe_ONpb9LLimmGoGSzBOQeTaYxZVCxDK-BzbwOYyU.jpg?width=108&amp;crop=smart&amp;auto=webp&amp;s=086b96e98d2ed1076581cbfe874cc946528a4ad2', 'width': 108}, {'height': 162, 'url': 'https://external-preview.redd.it/llVe_ONpb9LLimmGoGSzBOQeTaYxZVCxDK-BzbwOYyU.jpg?width=216&amp;crop=smart&amp;auto=webp&amp;s=d838627344fc8780b153e6415763d79bb0ff82c7', 'width': 216}, {'height': 240, 'url': 'https://external-preview.redd.it/llVe_ONpb9LLimmGoGSzBOQeTaYxZVCxDK-BzbwOYyU.jpg?width=320&amp;crop=smart&amp;auto=webp&amp;s=92a4c9304c49a08f94d3d8c3e0d88d67941d5c91', 'width': 320}], 'source': {'height': 360, 'url': 'https://external-preview.redd.it/llVe_ONpb9LLimmGoGSzBOQeTaYxZVCxDK-BzbwOYyU.jpg?auto=webp&amp;s=c6f727ef115670e3565a4d4847da58cd130725c1', 'width': 480}, 'variants': {}}]}",105.0,140.0,,,,,,,,"{'oembed': {'author_name': 'Snowboard-EN', 'author_url': 'https://www.youtube.com/user/TheEdawg444', 'height': 338, 'html': '&lt;iframe width=""600"" height=""338"" src=""https://www.youtube.com/embed/wb1nmg6qduA?feature=oembed&amp;enablejsapi=1"" frameborder=""0"" allow=""accelerometer; autoplay; encrypted-media; gyroscope; picture-in-picture"" allowfullscreen&gt;&lt;/iframe&gt;', 'provider_name': 'YouTube', 'provider_url': 'https://www.youtube.com/', 'thumbnail_height': 360, 'thumbnail_url': 'https://i.ytimg.com/vi/wb1nmg6qduA/hqdefault.jpg', 'thumbnail_width': 480, 'title': 'Snowboarding in Seattle After Snowstorm', 'type': 'video', 'version': '1.0', 'width': 600}, 'type': 'youtube.com'}","{'content': '&lt;iframe width=""600"" height=""338"" src=""https://www.youtube.com/embed/wb1nmg6qduA?feature=oembed&amp;enablejsapi=1"" frameborder=""0"" allow=""accelerometer; autoplay; encrypted-media; gyroscope; picture-in-picture"" allowfullscreen&gt;&lt;/iframe&gt;', 'height': 338, 'scrolling': False, 'width': 600}","{'oembed': {'author_name': 'Snowboard-EN', 'author_url': 'https://www.youtube.com/user/TheEdawg444', 'height': 338, 'html': '&lt;iframe width=""600"" height=""338"" src=""https://www.youtube.com/embed/wb1nmg6qduA?feature=oembed&amp;enablejsapi=1"" frameborder=""0"" allow=""accelerometer; autoplay; encrypted-media; gyroscope; picture-in-picture"" allowfullscreen&gt;&lt;/iframe&gt;', 'provider_name': 'YouTube', 'provider_url': 'https://www.youtube.com/', 'thumbnail_height': 360, 'thumbnail_url': 'https://i.ytimg.com/vi/wb1nmg6qduA/hqdefault.jpg', 'thumbnail_width': 480, 'title': 'Snowboarding in Seattle After Snowstorm', 'type': 'video', 'version': '1.0', 'width': 600}, 'type': 'youtube.com'}","{'content': '&lt;iframe width=""600"" height=""338"" src=""https://www.youtube.com/embed/wb1nmg6qduA?feature=oembed&amp;enablejsapi=1"" frameborder=""0"" allow=""accelerometer; autoplay; encrypted-media; gyroscope; picture-in-picture"" allowfullscreen&gt;&lt;/iframe&gt;', 'height': 338, 'media_domain_url': 'https://www.redditmedia.com/mediaembed/anghml', 'scrolling': False, 'width': 600}",
malker84,,[],,text,t2_7bess1i,False,False,False,1549388037,i.redd.it,https://www.reddit.com/r/Seattle/comments/anggv9/these_roads_are_meant_for_sliding_be_careful_out/,"{'gid_1': 0, 'gid_2': 0, 'gid_3': 0}",anggv9,True,False,False,True,True,False,False,,"[{'e': 'text', 't': 'Media'}]",dark,richtext,False,False,True,0,0,False,all_ads,/r/Seattle/comments/anggv9/these_roads_are_meant_for_sliding_be_careful_out/,False,6,1549388039,1,,True,False,False,Seattle,t5_2qhad,145561,public,default,These roads are meant for sliding. Be careful out there everyone.,https://i.redd.it/dn6m5dzkcse21.jpg,all_ads,6,flair,Media,,,,,,,,,,,,,,,,
kyrfe,,[],,text,t2_1xx2ncq5,False,False,False,1549386867,i.redd.it,https://www.reddit.com/r/Seattle/comments/ang9ax/gooooooood_morning_seattle_looks_a_little_chilly/,"{'gid_1': 0, 'gid_2': 0, 'gid_3': 0}",ang9ax,True,False,False,True,True,False,False,,[],dark,text,False,False,True,14,0,False,all_ads,/r/Seattle/comments/ang9ax/gooooooood_morning_seattle_looks_a_little_chilly/,False,6,1549386867,1,,True,False,False,Seattle,t5_2qhad,145560,public,default,Gooooooood morning Seattle! Looks a little chilly down there :),https://i.redd.it/p8o148949se21.jpg,all_ads,6,,,,,,,,,,,,,,,,,,
