author,author_flair_css_class,author_flair_richtext,author_flair_text,author_flair_type,author_fullname,author_patreon_flair,can_mod_post,contest_mode,created_utc,domain,full_link,gildings,id,is_crosspostable,is_meta,is_original_content,is_reddit_media_domain,is_robot_indexable,is_self,is_video,link_flair_background_color,link_flair_richtext,link_flair_text_color,link_flair_type,locked,media_only,no_follow,num_comments,num_crossposts,over_18,parent_whitelist_status,permalink,pinned,pwls,retrieved_on,score,selftext,send_replies,spoiler,stickied,subreddit,subreddit_id,subreddit_subscribers,subreddit_type,thumbnail,title,url,whitelist_status,wls,author_cakeday,post_hint,preview,thumbnail_height,thumbnail_width,author_flair_background_color,author_flair_text_color,link_flair_css_class,link_flair_template_id,link_flair_text,crosspost_parent,crosspost_parent_list,media,media_embed,secure_media,secure_media_embed
Mikecantfindme3,,[],,text,t2_2ys9iome,False,False,False,1547135340,self.Seattle,https://www.reddit.com/r/Seattle/comments/aek7ay/government_shutdown_has_thrown_a_wrench_in/,"{'gid_1': 0, 'gid_2': 0, 'gid_3': 0}",aek7ay,False,False,False,False,False,True,False,,[],dark,text,False,False,True,6,0,False,all_ads,/r/Seattle/comments/aek7ay/government_shutdown_has_thrown_a_wrench_in/,False,6,1547135341,1,[removed],True,False,False,Seattle,t5_2qhad,142372,public,self,Government Shutdown has thrown a wrench in vacation plans. Any alternatives to National Parks?,https://www.reddit.com/r/Seattle/comments/aek7ay/government_shutdown_has_thrown_a_wrench_in/,all_ads,6,,,,,,,,,,,,,,,,
seattlegg,,[],,text,t2_f5hrs,False,False,False,1547134264,self.Seattle,https://www.reddit.com/r/Seattle/comments/aek0u3/23rd_east_john_car_accidents/,"{'gid_1': 0, 'gid_2': 0, 'gid_3': 0}",aek0u3,True,False,False,False,True,True,False,,[],dark,text,False,False,True,44,0,False,all_ads,/r/Seattle/comments/aek0u3/23rd_east_john_car_accidents/,False,6,1547134264,1,A year worth of car accidents January 2018-January 2019 in Seattle on 23rd &amp; East John. Dangerous corner... ,True,False,False,Seattle,t5_2qhad,142370,public,self,23rd &amp; East John Car Accidents,https://www.reddit.com/r/Seattle/comments/aek0u3/23rd_east_john_car_accidents/,all_ads,6,,,,,,,,,,,,,,,,
kxserasera,,[],,text,t2_14bits,False,False,False,1547122697,i.redd.it,https://www.reddit.com/r/Seattle/comments/aeilev/reminiscing_summer_days_with_my_doggo/,"{'gid_1': 0, 'gid_2': 0, 'gid_3': 0}",aeilev,True,False,False,True,True,False,False,,[],dark,text,False,False,True,9,0,False,all_ads,/r/Seattle/comments/aeilev/reminiscing_summer_days_with_my_doggo/,False,6,1547122698,1,,True,False,False,Seattle,t5_2qhad,142358,public,default,Reminiscing summer days with my doggo,https://i.redd.it/pcnvb3yk8l921.jpg,all_ads,6,True,,,,,,,,,,,,,,,
pandafat,,[],,text,t2_87dat,False,False,False,1547118346,self.Seattle,https://www.reddit.com/r/Seattle/comments/aei2br/public_telescope_viewing/,"{'gid_1': 0, 'gid_2': 0, 'gid_3': 0}",aei2br,True,False,False,False,True,True,False,,[],dark,text,False,False,True,4,0,False,all_ads,/r/Seattle/comments/aei2br/public_telescope_viewing/,False,6,1547118347,1,"What are some good places, if any, to view the night sky through a telescope in the Seattle area? I am interested in astronomy, but as far as I know, decent quality personal telescopes with a mount cost hundreds of dollars if not thousands.

I know that the University of Washington offers public viewings, but only during April-September and likely require a reservation as they only accommodate around 12 people at a time. Are there any other places in the area that are open year-round, with maybe a more flexible schedule? I know I may be asking a lot, but any help or suggestions would be greatly appreciated!

(Could also be a really fun date night!)",True,False,False,Seattle,t5_2qhad,142358,public,self,Public Telescope Viewing?,https://www.reddit.com/r/Seattle/comments/aei2br/public_telescope_viewing/,all_ads,6,,,,,,,,,,,,,,,,
Nap39,,[],,text,t2_gu4hx,False,False,False,1547109694,self.Seattle,https://www.reddit.com/r/Seattle/comments/aeh7t3/moving_back_to_seattle_anyone_have_a_cellphone/,"{'gid_1': 0, 'gid_2': 0, 'gid_3': 0}",aeh7t3,True,False,False,False,True,True,False,,[],dark,text,False,False,True,16,0,False,all_ads,/r/Seattle/comments/aeh7t3/moving_back_to_seattle_anyone_have_a_cellphone/,False,6,1547109695,1,"As the title says I’m about to move back to Seattle after being gone a couple of years. 

I need to sign up for a cellphone plan once I land. 

Can anyone recommend a great plan that has unlimited data, international calling and is reliable and cheap?

Thanks!!",True,False,False,Seattle,t5_2qhad,142355,public,self,Moving back to Seattle - anyone have a cellphone plan that they love??,https://www.reddit.com/r/Seattle/comments/aeh7t3/moving_back_to_seattle_anyone_have_a_cellphone/,all_ads,6,,,,,,,,,,,,,,,,
RitaRudzinsky,,[],,text,t2_lp0t6,False,False,False,1547109132,mynorthwest.com,https://www.reddit.com/r/Seattle/comments/aeh609/was_video_of_president_trumps_tuesday_address/,"{'gid_1': 0, 'gid_2': 0, 'gid_3': 0}",aeh609,True,False,False,False,True,False,False,,[],dark,text,False,False,True,5,0,False,all_ads,/r/Seattle/comments/aeh609/was_video_of_president_trumps_tuesday_address/,False,6,1547109133,1,,True,False,False,Seattle,t5_2qhad,142354,public,https://b.thumbs.redditmedia.com/zyx1vaDWcZ6-40ykV_5BVA1ufFro517M_VC7Wq3Bnks.jpg,Was video of President Trump’s Tuesday address doctored?,http://mynorthwest.com/1237906/was-video-of-president-trumps-tuesday-address-doctored/,all_ads,6,,link,"{'enabled': False, 'images': [{'id': '-ZtF05z_lbOO3PMfopP_LKM1_oeJbcq77zEqTcNqJ1Y', 'resolutions': [{'height': 64, 'url': 'https://external-preview.redd.it/HXHQubwHoNFp14OhL0G18TBEbw5pxYzfdu_lC526udo.jpg?width=108&amp;crop=smart&amp;auto=webp&amp;s=b5d153af90aec004bad38c568c5d783c9e89a966', 'width': 108}, {'height': 128, 'url': 'https://external-preview.redd.it/HXHQubwHoNFp14OhL0G18TBEbw5pxYzfdu_lC526udo.jpg?width=216&amp;crop=smart&amp;auto=webp&amp;s=7cf6ea7129385fa534149859130031352f3372f2', 'width': 216}, {'height': 190, 'url': 'https://external-preview.redd.it/HXHQubwHoNFp14OhL0G18TBEbw5pxYzfdu_lC526udo.jpg?width=320&amp;crop=smart&amp;auto=webp&amp;s=3b3c6ba9ec783c91a60d65e7a6ff8283c354fa58', 'width': 320}], 'source': {'height': 370, 'url': 'https://external-preview.redd.it/HXHQubwHoNFp14OhL0G18TBEbw5pxYzfdu_lC526udo.jpg?auto=webp&amp;s=66ac821c3b70d58b37ec7f88ac22e0b4ceca92a6', 'width': 620}, 'variants': {}}]}",83.0,140.0,,,,,,,,,,,
Seapoogoo,,[],,text,t2_10dpf658,False,False,False,1547105447,seattletimes.com,https://www.reddit.com/r/Seattle/comments/aegshq/heres_some_help_to_get_around_the_seattle_region/,"{'gid_1': 0, 'gid_2': 0, 'gid_3': 0}",aegshq,True,False,False,False,True,False,False,,[],dark,text,False,False,True,1,0,False,all_ads,/r/Seattle/comments/aegshq/heres_some_help_to_get_around_the_seattle_region/,False,6,1547105448,1,,True,False,False,Seattle,t5_2qhad,142350,public,default,Here’s some help to get around the Seattle region when Highway 99 closes for three weeks,https://www.seattletimes.com/seattle-news/transportation/heres-some-help-to-get-around-the-seattle-region-when-highway-99-closes-for-three-weeks/,all_ads,6,,,,,,,,,,,,,,,,
DantheDoughMan,,[],,text,t2_qgrw6,False,False,False,1547098955,self.Seattle,https://www.reddit.com/r/Seattle/comments/aeg1gt/fun_thingsgood_food_good_hikesthings_to_seethings/,"{'gid_1': 0, 'gid_2': 0, 'gid_3': 0}",aeg1gt,True,False,False,False,True,True,False,,[],dark,text,False,False,True,2,0,False,all_ads,/r/Seattle/comments/aeg1gt/fun_thingsgood_food_good_hikesthings_to_seethings/,False,6,1547098956,1,"My girlfriend and I are heading out to the and will be staying in port angeles but trying to adventure around and do anything possible. We know hurricane ridge is closed and I grew up going to lake crescent and dugness spit but was wondering if anyone had any suggestions of must see’s/do’s or mist eats. We’re making a little road trip out of it driving up to whidbey island, taking the coupe I’ll ferry over to port Townsend and then heading to port angeles from there.  If anyone has suggestions or knows of anything we should do on the way out there we are open to all of it. Thanks!",True,False,False,Seattle,t5_2qhad,142335,public,self,Fun things/good food/ good hikes/things to see/things to do out on the coast/port angeles area?,https://www.reddit.com/r/Seattle/comments/aeg1gt/fun_thingsgood_food_good_hikesthings_to_seethings/,all_ads,6,,,,,,,,,,,,,,,,
verycurious333,,[],,text,t2_15jfst,False,False,False,1547097472,self.Seattle,https://www.reddit.com/r/Seattle/comments/aefusa/does_anyone_have_a_recommendation_for_a_therapist/,"{'gid_1': 0, 'gid_2': 0, 'gid_3': 0}",aefusa,True,False,False,False,True,True,False,,[],dark,text,False,False,True,4,0,False,all_ads,/r/Seattle/comments/aefusa/does_anyone_have_a_recommendation_for_a_therapist/,False,6,1547097473,1,The title pretty much sums it up. I'm a young adult dealing with depression and finding someone to speak to has been a bit overwhelming. I'm willing to travel to areas in or around West Seattle. Thanks! ,True,False,False,Seattle,t5_2qhad,142333,public,self,Does anyone have a recommendation for a therapist in the West Seattle area?,https://www.reddit.com/r/Seattle/comments/aefusa/does_anyone_have_a_recommendation_for_a_therapist/,all_ads,6,,,,,,,,,,,,,,,,
fishmael,,[],,text,t2_45wur,False,False,False,1547095384,self.Seattle,https://www.reddit.com/r/Seattle/comments/aefksz/is_it_me_or_is_it_really_hard_to_get_a_job_for/,"{'gid_1': 0, 'gid_2': 0, 'gid_3': 0}",aefksz,True,False,False,False,True,True,False,,[],dark,text,False,False,True,52,0,False,all_ads,/r/Seattle/comments/aefksz/is_it_me_or_is_it_really_hard_to_get_a_job_for/,False,6,1547095385,1,"I made the mistake of not getting a coding/programming related master's degree, so my life is basically falling apart after 4 month of unemployment. Le sigh. Too broke to leave, too broke to stay. ",True,False,False,Seattle,t5_2qhad,142327,public,self,Is it me or is it REALLY hard to get a job for some reason?,https://www.reddit.com/r/Seattle/comments/aefksz/is_it_me_or_is_it_really_hard_to_get_a_job_for/,all_ads,6,,,,,,,,,,,,,,,,
BootsOrHat,flair,"[{'e': 'text', 't': 'Ballard'}]",Ballard,richtext,t2_4dxbk,False,False,False,1547092487,washington.edu,https://www.reddit.com/r/Seattle/comments/aef6h2/uw_developed_a_smartphone_app_to_detect_opioid/,"{'gid_1': 0, 'gid_2': 0, 'gid_3': 0}",aef6h2,True,False,False,False,True,False,False,,[],dark,text,False,False,True,4,0,False,all_ads,/r/Seattle/comments/aef6h2/uw_developed_a_smartphone_app_to_detect_opioid/,False,6,1547092488,1,,True,False,False,Seattle,t5_2qhad,142322,public,default,UW developed a smartphone app to detect opioid overdoses,https://www.washington.edu/news/2019/01/09/smartphone-app-detects-opioid-overdose/,all_ads,6,,,,,,,dark,,,,,,,,,
Washington_Brief,,[],,text,t2_2eoexb1x,False,False,False,1547090086,m.seattlepi.com,https://www.reddit.com/r/Seattle/comments/aeeuos/charge_seattle_man_who_claimed_to_have_killed/,"{'gid_1': 0, 'gid_2': 0, 'gid_3': 0}",aeeuos,True,False,False,False,True,False,False,,"[{'e': 'text', 't': 'News'}]",dark,richtext,False,False,True,1,0,False,all_ads,/r/Seattle/comments/aeeuos/charge_seattle_man_who_claimed_to_have_killed/,False,6,1547090088,1,,True,False,False,Seattle,t5_2qhad,142320,public,default,Charge: Seattle man who claimed to have killed brother 'thought he was a lizard',https://m.seattlepi.com/local/crime/article/Charge-Seattle-man-who-claimed-to-have-killed-13520882.php,all_ads,6,,,,,,,,flair,9f9ba910-f804-11e4-be5c-0ea18645ab5f,News,,,,,,
creative1love,,[],,text,t2_tik3f,False,False,False,1547089380,i.redd.it,https://www.reddit.com/r/Seattle/comments/aeer0t/its_nice_having_flowers_in_january/,"{'gid_1': 0, 'gid_2': 0, 'gid_3': 0}",aeer0t,True,False,False,True,True,False,False,,[],dark,text,False,False,True,0,0,False,all_ads,/r/Seattle/comments/aeer0t/its_nice_having_flowers_in_january/,False,6,1547089380,1,,True,False,False,Seattle,t5_2qhad,142320,public,default,It's nice having flowers in January.,https://i.redd.it/9orwqk39hi921.jpg,all_ads,6,,,,,,,,,,,,,,,,
LitchLitch,,[],,text,t2_j3ho9,False,False,False,1547087751,self.Seattle,https://www.reddit.com/r/Seattle/comments/aeeig1/child_slavery_in_woodinville/,"{'gid_1': 0, 'gid_2': 0, 'gid_3': 0}",aeeig1,True,False,False,False,True,True,False,,[],dark,text,False,False,True,52,0,False,all_ads,/r/Seattle/comments/aeeig1/child_slavery_in_woodinville/,False,6,1547087752,1,"Folks in Woodiville are a little highstrung.  


Woman posted an ad in her neighborhood website saying her kids available to help with chores.  


People clutched thier pearls so hard the string snapped and they called the cops on her.  


The police confirmed that this was not a nefarious sweatshop hidden in suburbia.  


[https://reason.com/blog/2019/01/09/mom-neighbor-ad-9-year-old-child-labor](https://reason.com/blog/2019/01/09/mom-neighbor-ad-9-year-old-child-labor)",True,False,False,Seattle,t5_2qhad,142319,public,self,Child slavery in Woodinville!!!,https://www.reddit.com/r/Seattle/comments/aeeig1/child_slavery_in_woodinville/,all_ads,6,,self,"{'enabled': False, 'images': [{'id': 'BS4YflWYoRKdirgKOlZ6mqXAR1REHbJR0kbrmpykxJs', 'resolutions': [{'height': 81, 'url': 'https://external-preview.redd.it/D16LMPyWYqsZSA8p2qSb72zyv_qdTu_JF6citdO2HBM.jpg?width=108&amp;crop=smart&amp;auto=webp&amp;s=68412f4c7c35366cf8f9c50df7b1264293758b1e', 'width': 108}, {'height': 162, 'url': 'https://external-preview.redd.it/D16LMPyWYqsZSA8p2qSb72zyv_qdTu_JF6citdO2HBM.jpg?width=216&amp;crop=smart&amp;auto=webp&amp;s=66f28f072c53b2d54f1b913de10f26762dac6f8d', 'width': 216}, {'height': 240, 'url': 'https://external-preview.redd.it/D16LMPyWYqsZSA8p2qSb72zyv_qdTu_JF6citdO2HBM.jpg?width=320&amp;crop=smart&amp;auto=webp&amp;s=9f33809322dd83e89c74519a0dcb527d6bcb2f25', 'width': 320}, {'height': 480, 'url': 'https://external-preview.redd.it/D16LMPyWYqsZSA8p2qSb72zyv_qdTu_JF6citdO2HBM.jpg?width=640&amp;crop=smart&amp;auto=webp&amp;s=be4bd1161bd594ffadbf4947d4c5b8149d1bd0a2', 'width': 640}], 'source': {'height': 642, 'url': 'https://external-preview.redd.it/D16LMPyWYqsZSA8p2qSb72zyv_qdTu_JF6citdO2HBM.jpg?auto=webp&amp;s=97810e8dea8d123176ffaf802bb54a9d559b8f98', 'width': 856}, 'variants': {}}]}",,,,,,,,,,,,,
TheNobode,,[],,text,t2_5v3rmne,False,False,False,1547086429,self.Seattle,https://www.reddit.com/r/Seattle/comments/aeebig/looking_for_cinematographer_to_collaborate_w/,"{'gid_1': 0, 'gid_2': 0, 'gid_3': 0}",aeebig,True,False,False,False,True,True,False,,"[{'e': 'text', 't': 'Media'}]",dark,richtext,False,False,True,0,0,False,all_ads,/r/Seattle/comments/aeebig/looking_for_cinematographer_to_collaborate_w/,False,6,1547086430,1,"Hey Guys,

My names Jerald aka ""Nobody Named Jerald"", and I'm a local Seattle artist. I'm mainly a musician, focusing on Hip-Hop and Rnb, but I also have a pretty decent amount of experience in film. Below I've linked some of what I consider my best (all unreleased) musical work:

[https://soundcloud.com/tenobody/nobody-life-on-a-loop-v5/s-yQTg7](https://soundcloud.com/tenobody/nobody-life-on-a-loop-v5/s-yQTg7)

[https://soundcloud.com/tenobody/didntchaknowfreestyle-prod-j-dilla-1](https://soundcloud.com/tenobody/didntchaknowfreestyle-prod-j-dilla-1)

[https://soundcloud.com/tenobody/intro/s-FJTaT](https://soundcloud.com/tenobody/intro/s-FJTaT)

[https://soundcloud.com/tenobody/ihu/s-DubRn](https://soundcloud.com/tenobody/ihu/s-DubRn)

&amp;#x200B;

Recently, I unfortunately lost the vast majority of music I'd been working on for the past year. I'd been sitting on it for a little why as I'm a perfectionist and hate releasing projects that aren't to my level of production quality.

So because of this, I've dedicated the remainder of the year (until I go off to college) to putting out as much QUALITY content I can. I'm looking for a **cinematographer with a QUALITY camera** to collaborate with. High production quality is very important to me. I want to experiment w/ social media content and behind the scenes work of my creative process. I'm also working on some other performance art pieces I'm looking to get documented. Below I've linked some work I am a fan of and displays the type of content I'm looking to make (**NOTE: I also want to help you guys create (especially in the art field. Link me your inspirations.**):

[https://www.youtube.com/watch?v=fGCtjM7vi-Y](https://www.youtube.com/watch?v=fGCtjM7vi-Y)

[https://www.instagram.com/p/Bn6Z45agKjT/](https://www.instagram.com/p/Bn6Z45agKjT/)

[https://www.youtube.com/watch?v=tuvVC2i4saw](https://www.youtube.com/watch?v=tuvVC2i4saw)

[https://www.instagram.com/p/BlRsUCJAdyg/](https://www.instagram.com/p/BlRsUCJAdyg/)

&amp;#x200B;

If you're down to create something and want to trade ideas, we can meet up, get a cup of coffee or something and trade ideas. 

**DM ME ON HERE, EMAIL ME:** [**tenobody@gmail.com**](mailto:tenobody@gmail.com)**,** **or DM ON INSTA:** [@n.obdy\_](https://www.instagram.com/n.obdy_/)",True,False,False,Seattle,t5_2qhad,142315,public,self,Looking for Cinematographer to Collaborate w/,https://www.reddit.com/r/Seattle/comments/aeebig/looking_for_cinematographer_to_collaborate_w/,all_ads,6,,,,,,,,flair,cba61046-412a-11e8-8b48-0e90cbddd944,Media,,,,,,
happycowboy101,flair,"[{'e': 'text', 't': 'Beacon Hill'}]",Beacon Hill,richtext,t2_711z9,False,False,False,1547085937,seattlehorizonbooks.com,https://www.reddit.com/r/Seattle/comments/aee8ze/mark_your_calendars_seattle_2019_independent/,"{'gid_1': 0, 'gid_2': 0, 'gid_3': 0}",aee8ze,True,False,False,False,True,False,False,,[],dark,text,False,False,True,0,0,False,all_ads,/r/Seattle/comments/aee8ze/mark_your_calendars_seattle_2019_independent/,False,6,1547085938,1,,True,False,False,Seattle,t5_2qhad,142316,public,https://b.thumbs.redditmedia.com/i0XlCDmIcGrMbRrQZdKGNA3zEqKblRJz0cmkEGV85uk.jpg,Mark your calendars! Seattle 2019 Independent Bookstore Day is April 27,https://www.seattlehorizonbooks.com/pages/events/5/2019-seattle-independent-bookstore-day,all_ads,6,,link,"{'enabled': False, 'images': [{'id': 'CLrN3h5m5kF6FNL8ojfzexMDnXlbRe8-4OP42s4aEbc', 'resolutions': [{'height': 130, 'url': 'https://external-preview.redd.it/vYRu0-BqdphMmNDu4U03lpmpVbwUEcJCYYpXq_cqy1g.jpg?width=108&amp;crop=smart&amp;auto=webp&amp;s=6848ff7ddf1f062e3fb398aac8a7cf70797d9787', 'width': 108}, {'height': 260, 'url': 'https://external-preview.redd.it/vYRu0-BqdphMmNDu4U03lpmpVbwUEcJCYYpXq_cqy1g.jpg?width=216&amp;crop=smart&amp;auto=webp&amp;s=5ccb47f5d30a3e407ea6351a0718b6c8d1fe9980', 'width': 216}, {'height': 386, 'url': 'https://external-preview.redd.it/vYRu0-BqdphMmNDu4U03lpmpVbwUEcJCYYpXq_cqy1g.jpg?width=320&amp;crop=smart&amp;auto=webp&amp;s=ab33068ec847b42ae3c7cdc5beaaafd630abf3e6', 'width': 320}], 'source': {'height': 386, 'url': 'https://external-preview.redd.it/vYRu0-BqdphMmNDu4U03lpmpVbwUEcJCYYpXq_cqy1g.jpg?auto=webp&amp;s=6eb82f4feb65ec826caf65a14ffb9602607982ac', 'width': 320}, 'variants': {}}]}",140.0,140.0,,dark,,,,,,,,,
happycowboy101,flair,"[{'e': 'text', 't': 'Beacon Hill'}]",Beacon Hill,richtext,t2_711z9,False,False,False,1547084791,seattlehorizonbooks.com,https://www.reddit.com/r/Seattle/comments/aee2w7/mark_your_calendars_2019_independent_bookstore/,"{'gid_1': 0, 'gid_2': 0, 'gid_3': 0}",aee2w7,True,False,False,False,True,False,False,,[],dark,text,False,False,True,0,0,False,all_ads,/r/Seattle/comments/aee2w7/mark_your_calendars_2019_independent_bookstore/,False,6,1547084792,1,,True,False,False,Seattle,t5_2qhad,142315,public,default,Mark your calendars! 2019 Independent Bookstore Day is April 17th 2019,https://www.seattlehorizonbooks.com/pages/events/5/2019-seattle-independent-bookstore-day,all_ads,6,,,,,,,dark,,,,,,,,,
BlackSkull64,,[],,text,t2_eblec,False,False,False,1547084592,self.Seattle,https://www.reddit.com/r/Seattle/comments/aee1sy/brazilian_brothers_flying_to_seattle_to_ski/,"{'gid_1': 0, 'gid_2': 0, 'gid_3': 0}",aee1sy,True,False,False,False,True,True,False,,[],dark,text,False,False,True,15,0,False,all_ads,/r/Seattle/comments/aee1sy/brazilian_brothers_flying_to_seattle_to_ski/,False,6,1547084593,1,"Hello!

My name is Marcelo, and on the 24th of January my sister and I will fly to Seattle with the intent to Ski/Snowboard until the 28th. She did some research, and between Stevens Pass and Crystal Mountain, we decided to go to Stevens Pass!

That being said, I would like some tips regarding places to stay: Is it possible to stay at the mountain? Is it worth it? Are there any other places that are good for people who want to go to Stevens Pass?

Thanks for your help!",True,False,False,Seattle,t5_2qhad,142314,public,self,Brazilian brothers flying to Seattle to Ski!,https://www.reddit.com/r/Seattle/comments/aee1sy/brazilian_brothers_flying_to_seattle_to_ski/,all_ads,6,,,,,,,,,,,,,,,,
ITBry,,[],,text,t2_hkr0b,False,False,False,1547084485,self.Seattle,https://www.reddit.com/r/Seattle/comments/aee16h/will_google_maps_update_friday_night_after_the/,"{'gid_1': 0, 'gid_2': 0, 'gid_3': 0}",aee16h,True,False,False,False,True,True,False,,[],dark,text,False,False,True,56,0,False,all_ads,/r/Seattle/comments/aee16h/will_google_maps_update_friday_night_after_the/,False,6,1547084486,1,,True,False,False,Seattle,t5_2qhad,142314,public,self,Will Google Maps update Friday Night after the viaduct closes?,https://www.reddit.com/r/Seattle/comments/aee16h/will_google_maps_update_friday_night_after_the/,all_ads,6,,,,,,,,,,,,,,,,
Rm50,,[],,text,t2_y44oe,False,False,False,1547083909,self.Seattle,https://www.reddit.com/r/Seattle/comments/aedy4f/seeking_a_dry_cleanertailor_that_can_help_clean/,"{'gid_1': 0, 'gid_2': 0, 'gid_3': 0}",aedy4f,True,False,False,False,True,True,False,,[],dark,text,False,False,True,0,0,False,all_ads,/r/Seattle/comments/aedy4f/seeking_a_dry_cleanertailor_that_can_help_clean/,False,6,1547083911,1,,True,False,False,Seattle,t5_2qhad,142314,public,self,Seeking a dry cleaner/tailor that can help clean my purse. The liner has ink/makeup stains. The outside is leather/ suede needs a light touch up. I’m open to a cleaner removing the liner and replacing it with a new liner Leathercare on Elliott ave does not clean the lining. Any suggestions ? TIA,https://www.reddit.com/r/Seattle/comments/aedy4f/seeking_a_dry_cleanertailor_that_can_help_clean/,all_ads,6,,,,,,,,,,,,,,,,
