all_awardings,allow_live_comments,author,author_flair_css_class,author_flair_richtext,author_flair_text,author_flair_type,author_fullname,author_patreon_flair,author_premium,awarders,can_mod_post,contest_mode,created_utc,domain,full_link,gildings,id,is_crosspostable,is_meta,is_original_content,is_reddit_media_domain,is_robot_indexable,is_self,is_video,link_flair_background_color,link_flair_css_class,link_flair_richtext,link_flair_template_id,link_flair_text,link_flair_text_color,link_flair_type,locked,media_only,no_follow,num_comments,num_crossposts,over_18,parent_whitelist_status,permalink,pinned,post_hint,preview,pwls,retrieved_on,score,selftext,send_replies,spoiler,stickied,subreddit,subreddit_id,subreddit_subscribers,subreddit_type,thumbnail,thumbnail_height,thumbnail_width,title,total_awards_received,treatment_tags,upvote_ratio,url,url_overridden_by_dest,whitelist_status,wls,removed_by_category,author_flair_template_id,author_flair_text_color,media,media_embed,secure_media,secure_media_embed,is_gallery,author_flair_background_color,crosspost_parent,crosspost_parent_list,gallery_data,media_metadata
[],False,Hanz_Q,,[],,text,t2_e27z6,False,False,[],False,False,1596132066,i.redd.it,https://www.reddit.com/r/Seattle/comments/i0qte6/i_know_were_all_having_a_weird_year_but/,{},i0qte6,True,False,False,True,True,False,False,,flair,"[{'e': 'text', 't': 'Politics'}]",d03c04ee-412a-11e8-88cf-0e80e220ed5c,Politics,dark,richtext,False,False,True,274,0,False,all_ads,/r/Seattle/comments/i0qte6/i_know_were_all_having_a_weird_year_but/,False,image,"{'enabled': True, 'images': [{'id': 'FtoPxWLmdgy_UekRa4uFYZolHif-aQ_7F8FSbbDfcKs', 'resolutions': [{'height': 100, 'url': 'https://preview.redd.it/kh5kz1rka1e51.jpg?width=108&amp;crop=smart&amp;auto=webp&amp;s=73c948c317fbde5b89b302a1c8bd099360b6fe86', 'width': 108}, {'height': 200, 'url': 'https://preview.redd.it/kh5kz1rka1e51.jpg?width=216&amp;crop=smart&amp;auto=webp&amp;s=31119c9124b13ce1739e9ec17912df08f3ac1883', 'width': 216}, {'height': 297, 'url': 'https://preview.redd.it/kh5kz1rka1e51.jpg?width=320&amp;crop=smart&amp;auto=webp&amp;s=9053bb8888e162d0a21dac456924dca29c572c9f', 'width': 320}, {'height': 594, 'url': 'https://preview.redd.it/kh5kz1rka1e51.jpg?width=640&amp;crop=smart&amp;auto=webp&amp;s=d4f0e0d7d4b48558e3fc8a012f01a056465fb8f5', 'width': 640}], 'source': {'height': 857, 'url': 'https://preview.redd.it/kh5kz1rka1e51.jpg?auto=webp&amp;s=ab7982949e2f73259b907090cfc1521339758851', 'width': 923}, 'variants': {}}]}",6,1596132077,1,,True,False,False,Seattle,t5_2qhad,223852,public,https://a.thumbs.redditmedia.com/ns68V674_IZBLsZwknTgwuHdjF7OX1lBKdP3spRj8C4.jpg,129.0,140.0,I know we're all having a weird year but,0,[],1.0,https://i.redd.it/kh5kz1rka1e51.jpg,https://i.redd.it/kh5kz1rka1e51.jpg,all_ads,6,,,,,,,,,,,,,
[],False,silent_winter,,[],,text,t2_m4c8ebi,False,False,[],False,False,1596131854,self.Seattle,https://www.reddit.com/r/Seattle/comments/i0qr0w/are_hiking_trails_nature_areas_more_crowded_than/,{},i0qr0w,True,False,False,False,True,True,False,,flair,"[{'e': 'text', 't': 'Question'}]",9b95cc16-44bf-11e6-aba4-0e42ab5b9d91,Question,dark,richtext,False,False,True,19,0,False,all_ads,/r/Seattle/comments/i0qr0w/are_hiking_trails_nature_areas_more_crowded_than/,False,,,6,1596131866,1,"Hey folks, I'm curious -- are hiking and nature areas more crowded than normal?   


I went to Baker Lake on a weekday and saw several groups camping. Hiked Hannegan Pass, also on a weekday, and saw 50 people at least. Checked the Olympics backcountry camp permit availability, and again very surprised by how many placed are booked up.   


I wouldn't be surprised, since there's both higher unemployment and fewer other activities people can do. But, I just want to get a sense of whether this is actually true or I'm just craving solitude more than usual.   


\#introvertproblems",True,False,False,Seattle,t5_2qhad,223852,public,self,,,Are hiking trails / nature areas more crowded than usual?,0,[],1.0,https://www.reddit.com/r/Seattle/comments/i0qr0w/are_hiking_trails_nature_areas_more_crowded_than/,,all_ads,6,,,,,,,,,,,,,
[],False,borgchupacabras,,[],,text,t2_11fyv1,False,False,[],False,False,1596129397,self.Seattle,https://www.reddit.com/r/Seattle/comments/i0q06c/wa_department_of_health_requesting_residents_to/,{},i0q06c,True,False,False,False,True,True,False,,,[],,,dark,text,False,False,True,0,0,False,all_ads,/r/Seattle/comments/i0q06c/wa_department_of_health_requesting_residents_to/,False,,,6,1596129408,1,"Originally seen on Nextdoor.

&gt;The Washington State Department of Health (DOH) launched the Community Recovery-Oriented Needs Assessment, or the CORONA survey. The survey is an effort to assess the behavioral, economic, social, and emotional impacts and the needs of communities across the state as a result of the COVID-19 outbreak.

&gt;The CORONA survey results will inform immediate, long-term, and ongoing actions that DOH and local health jurisdictions can take to address the impacts of the COVID-19 outbreak on Washingtonians.

&gt;In order to appropriately and equitably inform recovery plans at the state and local levels, DOH is requesting residents from across Washington to go to www.wacoronasurvey.com to take part in the survey. (To take the survey by phone, call 855-530-5787—interpreters are available to assist.)

&gt;The survey is voluntary and confidential. At the end of the survey, participants will be given the option to provide their name, phone number and/or email address. Each week of the survey, three participants will receive a $100 Amazon.com gift code as a thank you for their time and participation. If you have additional questions about the CORONA Survey, you can call the Washington State Department of Health at 1-800-525-0127.If you have additional questions about the CORONA Survey, you can call the Washington State Department of Health at 360-236-2670.


https://www.doh.wa.gov/Newsroom/Articles/ID/1308/The-Department-of-Health-launches-CORONA-Survey",True,False,False,Seattle,t5_2qhad,223851,public,self,,,WA Department of Health requesting residents to fill CORONA Survey,0,[],1.0,https://www.reddit.com/r/Seattle/comments/i0q06c/wa_department_of_health_requesting_residents_to/,,all_ads,6,,,,,,,,,,,,,
[],False,apisdorsata,,[],,text,t2_lduq6,False,False,[],False,False,1596125647,self.Seattle,https://www.reddit.com/r/Seattle/comments/i0ouoz/anyone_flown_with_alaska_airlines_from_seatac/,{},i0ouoz,True,False,False,False,True,True,False,,,[],,,dark,text,False,False,True,8,0,False,all_ads,/r/Seattle/comments/i0ouoz/anyone_flown_with_alaska_airlines_from_seatac/,False,,,6,1596125658,1,"My housemate has to fly one-way to Texas this month to pick up a car and drive it back to Seattle. Wondering if anyone has flown with Alaska and can tell me about their experience both moving through the airport and aboard the flight.

What was going through security like? I imagine you have to remove your mask to have your ID checked — how does that work? Did you see what kinds of PPE are or aren’t allowed through the scanners? My housemate is planning on wearing  a KN95 with a fabric mask over it and possibly goggles. Do you think they’d have to remove any of these?

Alaska states that only children ages 8 and over are required to wear a mask. Did you see a lot of unmasked kids around?

How packed was your flight? Do you feel that the seats are adequately spaced apart? Praying that it’s not an exaggeration when Alaska says that their planes are fitted with high-end filters that can filter out even viruses.

Feeling very nervous about the whole affair — luckily we live in a house that allows for easy quarantining from each other when they return.",True,False,False,Seattle,t5_2qhad,223849,public,self,,,Anyone flown with Alaska Airlines from Seatac recently?,0,[],1.0,https://www.reddit.com/r/Seattle/comments/i0ouoz/anyone_flown_with_alaska_airlines_from_seatac/,,all_ads,6,,,,,,,,,,,,,
[],False,Ill_Assist,,[],,text,t2_4rp7xj0l,False,False,[],False,False,1596124953,i.ibb.co,https://www.reddit.com/r/Seattle/comments/i0on2s/racist_comedian_owen_benjamin_smith_is_selling/,{},i0on2s,False,False,False,False,False,False,False,,flair,"[{'e': 'text', 't': 'Media'}]",cba61046-412a-11e8-8b48-0e90cbddd944,Media,dark,richtext,False,False,True,0,0,False,all_ads,/r/Seattle/comments/i0on2s/racist_comedian_owen_benjamin_smith_is_selling/,False,image,"{'enabled': True, 'images': [{'id': 'gEiaP0HyV8SqPKwyB13trgmafEPK5PEnNo5AhUIBBWU', 'resolutions': [{'height': 108, 'url': 'https://external-preview.redd.it/btbDPhhfrtuFPrEDRceB9sKFRS7J9_Z2gmzKS7NeHUY.jpg?width=108&amp;crop=smart&amp;auto=webp&amp;s=dc99002ff37652e35c5455e6aab8d53d91ed8644', 'width': 108}, {'height': 216, 'url': 'https://external-preview.redd.it/btbDPhhfrtuFPrEDRceB9sKFRS7J9_Z2gmzKS7NeHUY.jpg?width=216&amp;crop=smart&amp;auto=webp&amp;s=65e4566a42a225abfefb9de49a4a7a94e531920e', 'width': 216}, {'height': 320, 'url': 'https://external-preview.redd.it/btbDPhhfrtuFPrEDRceB9sKFRS7J9_Z2gmzKS7NeHUY.jpg?width=320&amp;crop=smart&amp;auto=webp&amp;s=e686594fe292be87a54c1012e7211ca6d371737a', 'width': 320}, {'height': 640, 'url': 'https://external-preview.redd.it/btbDPhhfrtuFPrEDRceB9sKFRS7J9_Z2gmzKS7NeHUY.jpg?width=640&amp;crop=smart&amp;auto=webp&amp;s=5729462187caf2b4240fd7310eea4600475dea4f', 'width': 640}], 'source': {'height': 700, 'url': 'https://external-preview.redd.it/btbDPhhfrtuFPrEDRceB9sKFRS7J9_Z2gmzKS7NeHUY.jpg?auto=webp&amp;s=904237b11a99099fc4e49722d0359a3e2561e61d', 'width': 700}, 'variants': {}}]}",6,1596124964,1,,True,False,False,Seattle,t5_2qhad,223848,public,https://b.thumbs.redditmedia.com/8p7mit8BJoykqn3epTinMXSfQPE85teEKpe7Pr-vApw.jpg,140.0,140.0,"Racist ""comedian"" Owen Benjamin Smith is selling this t-shirt in Gig Harbor",0,[],1.0,https://i.ibb.co/VMrLXvv/Owen-Benjamin-George-Floyd-cleaned.jpg,https://i.ibb.co/VMrLXvv/Owen-Benjamin-George-Floyd-cleaned.jpg,all_ads,6,reddit,,,,,,,,,,,,
[],False,Captain_Clark,,[],,text,t2_cfppv,False,True,[],False,False,1596123385,self.Seattle,https://www.reddit.com/r/Seattle/comments/i0o6b1/googles_street_view_for_central_district_is_a/,{},i0o6b1,True,False,False,False,True,True,False,,flair,"[{'e': 'text', 't': 'Community'}]",d34790c2-412a-11e8-a986-0e3a917b7a84,Community,dark,richtext,False,False,True,0,0,False,all_ads,/r/Seattle/comments/i0o6b1/googles_street_view_for_central_district_is_a/,False,self,"{'enabled': False, 'images': [{'id': '-DdkhpALTyOmm8P3RHAxx9xdu2U449aUdrrGyIXl7vg', 'resolutions': [{'height': 108, 'url': 'https://external-preview.redd.it/mwD5XkqrO89CxLIDu5o8J78ecJrzvW2OfN8YbcDUo40.jpg?width=108&amp;crop=smart&amp;auto=webp&amp;s=a7cbaae366ebefe4070f2fff434c87f9d91642f8', 'width': 108}, {'height': 216, 'url': 'https://external-preview.redd.it/mwD5XkqrO89CxLIDu5o8J78ecJrzvW2OfN8YbcDUo40.jpg?width=216&amp;crop=smart&amp;auto=webp&amp;s=0ae7fec6427ac3d0c15b2da1f30335f0744246f8', 'width': 216}], 'source': {'height': 256, 'url': 'https://external-preview.redd.it/mwD5XkqrO89CxLIDu5o8J78ecJrzvW2OfN8YbcDUo40.jpg?auto=webp&amp;s=97e5977c824dd6293d9a1791df477816ced0df0b', 'width': 256}, 'variants': {}}]}",6,1596123395,1,"I’d not spent much time in the CD, so I Googled it to look around and the place it displays [is this](https://goo.gl/maps/BGcgPugaH5dp4ikn6) (click the Street View and turn around).

This is kind of a crummy thing to see, when a stranger is curious about an area.",True,False,False,Seattle,t5_2qhad,223844,public,self,,,Google’s “Street View” for “Central District” is a ratty old graffiti-covered bench with empty beer bottles at Viretta Park.,0,[],1.0,https://www.reddit.com/r/Seattle/comments/i0o6b1/googles_street_view_for_central_district_is_a/,,all_ads,6,,,,,,,,,,,,,
[],False,maza1319,,[],,text,t2_knlgp,False,False,[],False,False,1596123049,self.Seattle,https://www.reddit.com/r/Seattle/comments/i0o2pp/any_free_tourist_suggestions/,{},i0o2pp,True,False,False,False,True,True,False,,,[],,,dark,text,False,False,True,9,0,False,all_ads,/r/Seattle/comments/i0o2pp/any_free_tourist_suggestions/,False,,,6,1596123059,1,"I am in Seattle for the day and have never been here before.  I was wondering if any locals had any suggestions as what to do, hopefully for free or cheap. I honestly am not sure what is here!
Thank you!",True,False,False,Seattle,t5_2qhad,223843,public,self,,,Any free tourist suggestions?,0,[],1.0,https://www.reddit.com/r/Seattle/comments/i0o2pp/any_free_tourist_suggestions/,,all_ads,6,,,,,,,,,,,,,
[],False,concededpenguin1,,[],,text,t2_7pstv,False,False,[],False,False,1596122522,imgur.com,https://www.reddit.com/r/Seattle/comments/i0nx2q/spotted_in_wa_is_this_thinking_why_covid_rates/,{},i0nx2q,True,False,False,False,True,False,False,,,[],,,dark,text,False,False,True,379,0,False,all_ads,/r/Seattle/comments/i0nx2q/spotted_in_wa_is_this_thinking_why_covid_rates/,False,link,"{'enabled': False, 'images': [{'id': '2zYUk7x28j68woR2bjRAT0V7Jee8lt-LCn0RRij3HaM', 'resolutions': [{'height': 144, 'url': 'https://external-preview.redd.it/j3VYoHwEPnYPI69-5CRGorcPjkoUZUXOb5GgohK--NQ.jpg?width=108&amp;crop=smart&amp;auto=webp&amp;s=1667044b3ded5b95d2e652a28fbe1d0453f32b32', 'width': 108}, {'height': 288, 'url': 'https://external-preview.redd.it/j3VYoHwEPnYPI69-5CRGorcPjkoUZUXOb5GgohK--NQ.jpg?width=216&amp;crop=smart&amp;auto=webp&amp;s=99abfe52ea6c65e6acfdf7d4043c1d29688c060f', 'width': 216}, {'height': 426, 'url': 'https://external-preview.redd.it/j3VYoHwEPnYPI69-5CRGorcPjkoUZUXOb5GgohK--NQ.jpg?width=320&amp;crop=smart&amp;auto=webp&amp;s=769e7303cec2e72d2e0ee993b11d1045cfb7d1eb', 'width': 320}, {'height': 853, 'url': 'https://external-preview.redd.it/j3VYoHwEPnYPI69-5CRGorcPjkoUZUXOb5GgohK--NQ.jpg?width=640&amp;crop=smart&amp;auto=webp&amp;s=fd973f43a5d0c207fbae6d0e7de44f2386572186', 'width': 640}, {'height': 1280, 'url': 'https://external-preview.redd.it/j3VYoHwEPnYPI69-5CRGorcPjkoUZUXOb5GgohK--NQ.jpg?width=960&amp;crop=smart&amp;auto=webp&amp;s=0a89c1fc9e429151e24238fa3cbac748f1a934de', 'width': 960}, {'height': 1440, 'url': 'https://external-preview.redd.it/j3VYoHwEPnYPI69-5CRGorcPjkoUZUXOb5GgohK--NQ.jpg?width=1080&amp;crop=smart&amp;auto=webp&amp;s=00669233b9248d0799078e59b81b5317ab6014c1', 'width': 1080}], 'source': {'height': 4032, 'url': 'https://external-preview.redd.it/j3VYoHwEPnYPI69-5CRGorcPjkoUZUXOb5GgohK--NQ.jpg?auto=webp&amp;s=79b77348896145b3a21c084421fb07008dba9af1', 'width': 3024}, 'variants': {}}]}",6,1596122533,1,,True,False,False,Seattle,t5_2qhad,223843,public,https://b.thumbs.redditmedia.com/HGqiFMKjgU6JHbQQ7eUlKNYt75mlJZvsPGBHXpwS0OU.jpg,140.0,140.0,Spotted in WA -- Is this thinking why COVID rates are spiking? (HIPAA and the Fourth Amendment not applying notwithstanding),0,[],1.0,https://imgur.com/XjLACDi,https://imgur.com/XjLACDi,all_ads,6,,,,,,,,,,,,,
[],False,warhawkjah,flair,"[{'e': 'text', 't': 'Des Moines'}]",Des Moines,richtext,t2_x8jsa,False,False,[],False,False,1596121364,justice.gov,https://www.reddit.com/r/Seattle/comments/i0nkox/could_they_have_been_filling_positions_for_amazon/,{},i0nkox,True,False,False,False,True,False,False,,flair,"[{'e': 'text', 't': 'Rant'}]",8e17612a-59fe-11e8-bb72-0eebcf11070a,Rant,dark,richtext,False,False,True,5,0,False,all_ads,/r/Seattle/comments/i0nkox/could_they_have_been_filling_positions_for_amazon/,False,link,"{'enabled': False, 'images': [{'id': 'Xl1_YVzU4YW2LwbKsSkm5qq8NUF5LNfXk_KIiT4bR6w', 'resolutions': [{'height': 108, 'url': 'https://external-preview.redd.it/w93zRzaRJxd5t8UZ0qmwxNnQ42WUkGACAVu4F6kYt5s.jpg?width=108&amp;crop=smart&amp;auto=webp&amp;s=fc20e1aec4443077677bd4c317ecb1150b621862', 'width': 108}], 'source': {'height': 200, 'url': 'https://external-preview.redd.it/w93zRzaRJxd5t8UZ0qmwxNnQ42WUkGACAVu4F6kYt5s.jpg?auto=webp&amp;s=b79b5e4c727a2a33f42a03386f69f7f956238969', 'width': 200}, 'variants': {}}]}",6,1596121374,1,,True,False,False,Seattle,t5_2qhad,223843,public,https://b.thumbs.redditmedia.com/6YINA0XJc3rS5oNkdRzn5nwkEpZ11QCfB3qxY4mzrkU.jpg,140.0,140.0,Could they have been filling positions for Amazon 2.0? Maybe 1.0 is next.,0,[],1.0,https://www.justice.gov/opa/pr/justice-department-settles-claim-against-virginia-based-staffing-company-improperly-favoring,https://www.justice.gov/opa/pr/justice-department-settles-claim-against-virginia-based-staffing-company-improperly-favoring,all_ads,6,,ab214820-55e2-11e1-a82d-12313d18ad57,dark,,,,,,,,,,
[],False,Positivity2020,,[],,text,t2_5eybghj2,False,False,[],False,False,1596118229,twitter.com,https://www.reddit.com/r/Seattle/comments/i0mp4k/fresh_off_of_grilling_and_roasting_ag_bill_barr/,{},i0mp4k,True,False,False,False,True,False,False,,,[],,,dark,text,False,False,True,68,0,False,all_ads,/r/Seattle/comments/i0mp4k/fresh_off_of_grilling_and_roasting_ag_bill_barr/,False,link,"{'enabled': False, 'images': [{'id': 'KA74ygTHvCWswQfLfu-dbyi9vvViZsgudnK_aNjVgXM', 'resolutions': [{'height': 108, 'url': 'https://external-preview.redd.it/U3lr1ZsTyxdU90g5oDOiwnftIUdygbOUyf0Vjqxm_Co.jpg?width=108&amp;crop=smart&amp;auto=webp&amp;s=10786f851af06a374e4867bec1a07af010a56428', 'width': 108}], 'source': {'height': 140, 'url': 'https://external-preview.redd.it/U3lr1ZsTyxdU90g5oDOiwnftIUdygbOUyf0Vjqxm_Co.jpg?auto=webp&amp;s=7a519c106eb18f956f2a15faf197470a3c449de1', 'width': 140}, 'variants': {}}]}",6,1596118241,1,,True,False,False,Seattle,t5_2qhad,223844,public,https://b.thumbs.redditmedia.com/l1NCqnM_9kqQBlnbC6B3dHS1OCEfkpADHV7DDFpMJJI.jpg,140.0,140.0,"Fresh off of Grilling and Roasting AG Bill Barr, Jayapal Sinks her Teeth into Zuckerberg",0,[],1.0,https://twitter.com/mehdirhasan/status/1288632273139621889,https://twitter.com/mehdirhasan/status/1288632273139621889,all_ads,6,,,,"{'oembed': {'author_name': 'Mehdi Hasan', 'author_url': 'https://twitter.com/mehdirhasan', 'cache_age': 3153600000, 'height': None, 'html': '&lt;blockquote class=""twitter-video""&gt;&lt;p lang=""en"" dir=""ltr""&gt;&amp;quot;I&amp;#39;d like to just remind you that you are under oath.&amp;quot;&lt;a href=""https://twitter.com/RepJayapal?ref_src=twsrc%5Etfw""&gt;@RepJayapal&lt;/a&gt; fresh off of grilling and destroying AG Barr goes after Mark Zuckerberg today. She is one of the most vital, effective and important members of the House right now. &lt;a href=""https://t.co/svfmKcoWyN""&gt;https://t.co/svfmKcoWyN&lt;/a&gt;&lt;/p&gt;&amp;mdash; Mehdi Hasan (@mehdirhasan) &lt;a href=""https://twitter.com/mehdirhasan/status/1288632273139621889?ref_src=twsrc%5Etfw""&gt;July 30, 2020&lt;/a&gt;&lt;/blockquote&gt;\n&lt;script async src=""https://platform.twitter.com/widgets.js"" charset=""utf-8""&gt;&lt;/script&gt;\n', 'provider_name': 'Twitter', 'provider_url': 'https://twitter.com', 'type': 'rich', 'url': 'https://twitter.com/mehdirhasan/status/1288632273139621889', 'version': '1.0', 'width': 350}, 'type': 'twitter.com'}","{'content': '&lt;blockquote class=""twitter-video""&gt;&lt;p lang=""en"" dir=""ltr""&gt;&amp;quot;I&amp;#39;d like to just remind you that you are under oath.&amp;quot;&lt;a href=""https://twitter.com/RepJayapal?ref_src=twsrc%5Etfw""&gt;@RepJayapal&lt;/a&gt; fresh off of grilling and destroying AG Barr goes after Mark Zuckerberg today. She is one of the most vital, effective and important members of the House right now. &lt;a href=""https://t.co/svfmKcoWyN""&gt;https://t.co/svfmKcoWyN&lt;/a&gt;&lt;/p&gt;&amp;mdash; Mehdi Hasan (@mehdirhasan) &lt;a href=""https://twitter.com/mehdirhasan/status/1288632273139621889?ref_src=twsrc%5Etfw""&gt;July 30, 2020&lt;/a&gt;&lt;/blockquote&gt;\n&lt;script async src=""https://platform.twitter.com/widgets.js"" charset=""utf-8""&gt;&lt;/script&gt;\n', 'height': 200, 'scrolling': False, 'width': 350}","{'oembed': {'author_name': 'Mehdi Hasan', 'author_url': 'https://twitter.com/mehdirhasan', 'cache_age': 3153600000, 'height': None, 'html': '&lt;blockquote class=""twitter-video""&gt;&lt;p lang=""en"" dir=""ltr""&gt;&amp;quot;I&amp;#39;d like to just remind you that you are under oath.&amp;quot;&lt;a href=""https://twitter.com/RepJayapal?ref_src=twsrc%5Etfw""&gt;@RepJayapal&lt;/a&gt; fresh off of grilling and destroying AG Barr goes after Mark Zuckerberg today. She is one of the most vital, effective and important members of the House right now. &lt;a href=""https://t.co/svfmKcoWyN""&gt;https://t.co/svfmKcoWyN&lt;/a&gt;&lt;/p&gt;&amp;mdash; Mehdi Hasan (@mehdirhasan) &lt;a href=""https://twitter.com/mehdirhasan/status/1288632273139621889?ref_src=twsrc%5Etfw""&gt;July 30, 2020&lt;/a&gt;&lt;/blockquote&gt;\n&lt;script async src=""https://platform.twitter.com/widgets.js"" charset=""utf-8""&gt;&lt;/script&gt;\n', 'provider_name': 'Twitter', 'provider_url': 'https://twitter.com', 'type': 'rich', 'url': 'https://twitter.com/mehdirhasan/status/1288632273139621889', 'version': '1.0', 'width': 350}, 'type': 'twitter.com'}","{'content': '&lt;blockquote class=""twitter-video""&gt;&lt;p lang=""en"" dir=""ltr""&gt;&amp;quot;I&amp;#39;d like to just remind you that you are under oath.&amp;quot;&lt;a href=""https://twitter.com/RepJayapal?ref_src=twsrc%5Etfw""&gt;@RepJayapal&lt;/a&gt; fresh off of grilling and destroying AG Barr goes after Mark Zuckerberg today. She is one of the most vital, effective and important members of the House right now. &lt;a href=""https://t.co/svfmKcoWyN""&gt;https://t.co/svfmKcoWyN&lt;/a&gt;&lt;/p&gt;&amp;mdash; Mehdi Hasan (@mehdirhasan) &lt;a href=""https://twitter.com/mehdirhasan/status/1288632273139621889?ref_src=twsrc%5Etfw""&gt;July 30, 2020&lt;/a&gt;&lt;/blockquote&gt;\n&lt;script async src=""https://platform.twitter.com/widgets.js"" charset=""utf-8""&gt;&lt;/script&gt;\n', 'height': 200, 'media_domain_url': 'https://www.redditmedia.com/mediaembed/i0mp4k', 'scrolling': False, 'width': 350}",,,,,,
[],False,Weazel03,,[],,text,t2_jhk8n,False,False,[],False,False,1596117518,self.Seattle,https://www.reddit.com/r/Seattle/comments/i0mi72/visiting_seattle_should_we_wait/,{},i0mi72,True,False,False,False,True,True,False,,moving,"[{'e': 'text', 't': 'Moving / Visiting'}]",,Moving / Visiting,dark,richtext,False,False,True,9,0,False,all_ads,/r/Seattle/comments/i0mi72/visiting_seattle_should_we_wait/,False,,,6,1596117529,1,"Wife has always wanted to visit Seattle so we were planning on going the weekend of Aug 14th. Just wanted a locals perspective on if you would suggest pushing off the trip with the recent events going on, or anything you would strongly suggest we stay away from. I appreciate the help.",True,False,False,Seattle,t5_2qhad,223844,public,self,,,Visiting Seattle - Should we wait?,0,[],1.0,https://www.reddit.com/r/Seattle/comments/i0mi72/visiting_seattle_should_we_wait/,,all_ads,6,,,,,,,,,,,,,
[],False,jojofine,flair,"[{'e': 'text', 't': 'West Seattle'}]",West Seattle,richtext,t2_523fu,False,False,[],False,False,1596116826,seattletimes.com,https://www.reddit.com/r/Seattle/comments/i0mbpn/seattle_police_found_explosives_in_van_at/,{},i0mbpn,True,False,False,False,True,False,False,,flair,"[{'e': 'text', 't': 'News'}]",9f9ba910-f804-11e4-be5c-0ea18645ab5f,News,dark,richtext,False,False,True,132,0,False,all_ads,/r/Seattle/comments/i0mbpn/seattle_police_found_explosives_in_van_at/,False,link,"{'enabled': False, 'images': [{'id': 'tfT3t7Rt1bGncFhvo32LKNkpSmTpabV63n8lid28ano', 'resolutions': [{'height': 69, 'url': 'https://external-preview.redd.it/l1jDaW-O5kHnlAg3A-7LNjMhMT-wo65DYRbXdRTkUiE.jpg?width=108&amp;crop=smart&amp;auto=webp&amp;s=b3a48c5fd3142b3025101fcad423cfaca42ce28d', 'width': 108}, {'height': 138, 'url': 'https://external-preview.redd.it/l1jDaW-O5kHnlAg3A-7LNjMhMT-wo65DYRbXdRTkUiE.jpg?width=216&amp;crop=smart&amp;auto=webp&amp;s=5f75ca126011b89a40b44616c9451519e70190dd', 'width': 216}, {'height': 205, 'url': 'https://external-preview.redd.it/l1jDaW-O5kHnlAg3A-7LNjMhMT-wo65DYRbXdRTkUiE.jpg?width=320&amp;crop=smart&amp;auto=webp&amp;s=eca5d78f2a3eb742a199817ae235c2fe5955f6f4', 'width': 320}], 'source': {'height': 241, 'url': 'https://external-preview.redd.it/l1jDaW-O5kHnlAg3A-7LNjMhMT-wo65DYRbXdRTkUiE.jpg?auto=webp&amp;s=09b7fd3d7e1aa96d5a2e315f61db256f4e142b96', 'width': 375}, 'variants': {}}]}",6,1596116837,1,,False,False,False,Seattle,t5_2qhad,223843,public,https://b.thumbs.redditmedia.com/OM16IdsTyspKvHXyoATJ8WLCnWdXdKWqun2I9zPiyZE.jpg,89.0,140.0,Seattle police found explosives in van at protests over weekend,0,[],1.0,https://www.seattletimes.com/seattle-news/seattle-police-found-explosives-in-van-at-protests-over-weekend/,https://www.seattletimes.com/seattle-news/seattle-police-found-explosives-in-van-at-protests-over-weekend/,all_ads,6,,7bb789c8-3cba-11e1-a03f-12313d16916e,dark,,,,,,,,,,
[],False,OH-Kelly-DOH-Kelly,,[],,text,t2_3u6h5c0a,False,False,[],False,False,1596116233,self.Seattle,https://www.reddit.com/r/Seattle/comments/i0m63j/coverups_bullying_deaths_in_snohomish_casinos/,{},i0m63j,True,False,False,False,True,True,False,,,[],,,dark,text,False,False,True,10,0,False,all_ads,/r/Seattle/comments/i0m63j/coverups_bullying_deaths_in_snohomish_casinos/,False,,,6,1596116245,1,"Casinos are staying open and forcing employees to sign liability waivers. 

2-3 employees now dead. 

Casino regulars upon receiving they’r partners “usuals.” Respond with “they are no longer with us.” 

Families are breaking down as the casinos are forcing them to work or forfeit benefits while the forms are evidence that new cases are evident on site.",True,False,False,Seattle,t5_2qhad,223842,public,self,,,"Cover-ups, bullying, deaths in snohomish casinos: just 1 hour north",0,[],1.0,https://www.reddit.com/r/Seattle/comments/i0m63j/coverups_bullying_deaths_in_snohomish_casinos/,,all_ads,6,,,,,,,,,,,,,
