all_awardings,allow_live_comments,author,author_flair_css_class,author_flair_richtext,author_flair_text,author_flair_type,author_fullname,author_patreon_flair,author_premium,awarders,can_mod_post,contest_mode,created_utc,domain,full_link,gildings,id,is_crosspostable,is_meta,is_original_content,is_reddit_media_domain,is_robot_indexable,is_self,is_video,link_flair_background_color,link_flair_css_class,link_flair_richtext,link_flair_template_id,link_flair_text,link_flair_text_color,link_flair_type,locked,media_only,no_follow,num_comments,num_crossposts,over_18,parent_whitelist_status,permalink,pinned,pwls,retrieved_on,score,selftext,send_replies,spoiler,stickied,subreddit,subreddit_id,subreddit_subscribers,subreddit_type,thumbnail,title,total_awards_received,treatment_tags,upvote_ratio,url,whitelist_status,wls,removed_by_category,post_hint,preview,thumbnail_height,thumbnail_width,url_overridden_by_dest,crosspost_parent,crosspost_parent_list,media,media_embed,secure_media,secure_media_embed,author_flair_template_id,author_flair_text_color
[],False,___yuki,,[],,text,t2_4wdceco0,False,False,[],False,False,1600960493,self.Seattle,https://www.reddit.com/r/Seattle/comments/iyz3j5/another_moving_to_seattle_post/,{},iyz3j5,True,False,False,False,True,True,False,,flair,"[{'e': 'text', 't': 'Question'}]",9b95cc16-44bf-11e6-aba4-0e42ab5b9d91,Question,dark,richtext,False,False,True,23,0,False,all_ads,/r/Seattle/comments/iyz3j5/another_moving_to_seattle_post/,False,6,1600960504,1,"Hi everyone. I'll be moving to Seattle next month due to an internal transfer with my company and I had some questions I hope some of you can answer more concretely than some of the research I've done elsewhere online.

\- My office is in downtown so I'll be looking for apartments in Lower Queen Anne, SLU, or Cap Hill areas to be within walking distance once COVID is over. I've actually found a few nice places in ""Cascade"". It seems to be a pretty small geographic area. Is Cascade similar to SLU, Cap Hill, etc? Nice area?

\- I'll be making 56k salary + bonus. I'm not bringing my car (-320 car note -200 car ins = $520 savings) and coming from LA, I see I won't be paying state income tax anymore. I looked up an income calculator for WA online and apparently my take home pay will be around $3500 after taxes and 401k, health, etc. Is a $1600-1800 rent budget realistic? I want to live nicely for the first time in my life. I've been living with relatives in LA since rent is so insane here.

\- If I don't have a car, I won't need to pay the monthly parking fees at apartments, right? Just wanted to be sure because I've seen a range of $100-250 for parking and I don't want to pay that if I don't have a car obviously.

\- I've seen the protests in Cap Hill and elsewhere and it got me thinking. Is it a bad time to be moving to that specific neighborhood? I'm all for justice and equality don't get me wrong, but I'd like to avoid any police interactions.

&amp;#x200B;

I know everyone is probably sick of these posts but any insight would be hugely appreciated. This is a new chapter in my life and I'm pretty excited ngl. I just want to be making level-headed and informed decisions. Have a great day everyone and stay safe.",True,False,False,Seattle,t5_2qhad,233573,public,self,Another moving to Seattle post,0,[],1.0,https://www.reddit.com/r/Seattle/comments/iyz3j5/another_moving_to_seattle_post/,all_ads,6,,,,,,,,,,,,,,
[],False,politicsis_trash,,[],,text,t2_6h4k47ex,False,False,[],False,False,1600959037,self.Seattle,https://www.reddit.com/r/Seattle/comments/iyynmm/i_got_a_ticket_for_expired_tags_on_my_texas/,{},iyynmm,False,False,False,False,False,True,False,,,[],,,dark,text,False,False,True,9,0,False,all_ads,/r/Seattle/comments/iyynmm/i_got_a_ticket_for_expired_tags_on_my_texas/,False,6,1600959048,1,[removed],True,False,False,Seattle,t5_2qhad,233571,public,self,"I got a ticket for expired tags on my Texas plates, but it's literally impossible for me to get a WA license to register my vehicle here.",0,[],1.0,https://www.reddit.com/r/Seattle/comments/iyynmm/i_got_a_ticket_for_expired_tags_on_my_texas/,all_ads,6,reddit,,,,,,,,,,,,,
[],False,OnlineMemeArmy,,[],,text,t2_3l1oj988,False,False,[],False,False,1600958634,thestranger.com,https://www.reddit.com/r/Seattle/comments/iyyjhz/two_hospitalized_after_belltown_stabbing_suspect/,{},iyyjhz,True,False,False,False,True,False,False,,flair,"[{'e': 'text', 't': 'News'}]",9f9ba910-f804-11e4-be5c-0ea18645ab5f,News,dark,richtext,False,False,True,0,0,False,all_ads,/r/Seattle/comments/iyyjhz/two_hospitalized_after_belltown_stabbing_suspect/,False,6,1600958645,1,,False,False,False,Seattle,t5_2qhad,233570,public,https://b.thumbs.redditmedia.com/Hil8YYRUD9SHTujaazwDrr6QWAtnDjA62lB0GsQZ4hg.jpg,Two Hospitalized After Belltown Stabbing; Suspect Barricaded in Apartment,0,[],1.0,https://www.thestranger.com/slog/2020/09/23/45101712/two-hospitalized-after-belltown-stabbing-suspect-barricaded-in-apartment,all_ads,6,,link,"{'enabled': False, 'images': [{'id': 'Ri9gOjmyUOHlNGEiVOHMhZfvyO0ls1665unlRE0FTHY', 'resolutions': [{'height': 72, 'url': 'https://external-preview.redd.it/v4usa7k5e975yDHX5rQMWitflXEIhAYF17uaVayj86s.jpg?width=108&amp;crop=smart&amp;auto=webp&amp;s=fcae7241033323a3e0e93b73372ad2a64ae3a9c4', 'width': 108}, {'height': 144, 'url': 'https://external-preview.redd.it/v4usa7k5e975yDHX5rQMWitflXEIhAYF17uaVayj86s.jpg?width=216&amp;crop=smart&amp;auto=webp&amp;s=7d3775ada107402488234cc9800ad3a42aad6f45', 'width': 216}, {'height': 213, 'url': 'https://external-preview.redd.it/v4usa7k5e975yDHX5rQMWitflXEIhAYF17uaVayj86s.jpg?width=320&amp;crop=smart&amp;auto=webp&amp;s=ce4280872edafc13719c4e27ce8b39234f3c052f', 'width': 320}, {'height': 426, 'url': 'https://external-preview.redd.it/v4usa7k5e975yDHX5rQMWitflXEIhAYF17uaVayj86s.jpg?width=640&amp;crop=smart&amp;auto=webp&amp;s=02c291748423c153a2ea3fad3c50780b6843047a', 'width': 640}], 'source': {'height': 467, 'url': 'https://external-preview.redd.it/v4usa7k5e975yDHX5rQMWitflXEIhAYF17uaVayj86s.jpg?auto=webp&amp;s=f2bd186071f83d124253d5d865640605ef42852c', 'width': 700}, 'variants': {}}]}",93.0,140.0,https://www.thestranger.com/slog/2020/09/23/45101712/two-hospitalized-after-belltown-stabbing-suspect-barricaded-in-apartment,,,,,,,,
[],False,Impressive_Rock3444,,[],,text,t2_7q09nuir,False,False,[],False,False,1600958414,i.redd.it,https://www.reddit.com/r/Seattle/comments/iyyh3e/my_friend_just_gifted_me_this_amazing_thing_of/,{},iyyh3e,True,False,False,True,True,False,False,,flair,"[{'e': 'text', 't': 'Media'}]",cba61046-412a-11e8-8b48-0e90cbddd944,Media,dark,richtext,False,False,True,5,0,False,all_ads,/r/Seattle/comments/iyyh3e/my_friend_just_gifted_me_this_amazing_thing_of/,False,6,1600958425,1,,True,False,False,Seattle,t5_2qhad,233570,public,https://b.thumbs.redditmedia.com/iCFQ1nqU2fVc2AZG2qyNDWyDS-kyJiYTWaL09KxWRVw.jpg,My friend just gifted me this amazing thing of our future hockey team. GO BITCH PIGEONS!,0,[],1.0,https://i.redd.it/yzv2e8qqx3p51.png,all_ads,6,,image,"{'enabled': True, 'images': [{'id': '5jk-Bw2JCQCfpKQUClf0fCn6VivuIpwV_OC1y92x_TA', 'resolutions': [{'height': 86, 'url': 'https://preview.redd.it/yzv2e8qqx3p51.png?width=108&amp;crop=smart&amp;auto=webp&amp;s=a89400b82119124f4d1525cdfc2036fbc54e59e6', 'width': 108}, {'height': 172, 'url': 'https://preview.redd.it/yzv2e8qqx3p51.png?width=216&amp;crop=smart&amp;auto=webp&amp;s=a2c1d8aefca3d17348adb38b4384efac06f5bc84', 'width': 216}, {'height': 255, 'url': 'https://preview.redd.it/yzv2e8qqx3p51.png?width=320&amp;crop=smart&amp;auto=webp&amp;s=ca46c630e13605a5ccabf18bfa8f3576378d9319', 'width': 320}, {'height': 511, 'url': 'https://preview.redd.it/yzv2e8qqx3p51.png?width=640&amp;crop=smart&amp;auto=webp&amp;s=5bd2c075dc7a6eb1d1575d3e661825a590ee6044', 'width': 640}], 'source': {'height': 576, 'url': 'https://preview.redd.it/yzv2e8qqx3p51.png?auto=webp&amp;s=f39687049e65f35375b515b477b2c58f25405f99', 'width': 721}, 'variants': {}}]}",111.0,140.0,https://i.redd.it/yzv2e8qqx3p51.png,,,,,,,,
