all_awardings,allow_live_comments,author,author_flair_css_class,author_flair_richtext,author_flair_text,author_flair_type,author_fullname,author_patreon_flair,author_premium,awarders,can_mod_post,contest_mode,created_utc,domain,full_link,gildings,id,is_crosspostable,is_meta,is_original_content,is_reddit_media_domain,is_robot_indexable,is_self,is_video,link_flair_background_color,link_flair_css_class,link_flair_richtext,link_flair_template_id,link_flair_text,link_flair_text_color,link_flair_type,locked,media_only,no_follow,num_comments,num_crossposts,over_18,parent_whitelist_status,permalink,pinned,post_hint,preview,pwls,retrieved_on,score,selftext,send_replies,spoiler,stickied,subreddit,subreddit_id,subreddit_subscribers,subreddit_type,thumbnail,thumbnail_height,thumbnail_width,title,total_awards_received,treatment_tags,upvote_ratio,url,whitelist_status,wls,author_flair_template_id,author_flair_text_color,poll_data,author_flair_background_color,removed_by_category,media_metadata,media,media_embed,secure_media,secure_media_embed,crosspost_parent,crosspost_parent_list,author_cakeday
[],False,KamFromOly,,[],,text,t2_2c1rnnp0,False,False,[],False,False,1592836520,i.redd.it,https://www.reddit.com/r/Seattle/comments/hdtg7k/launching_an_open_source_police_brutality_app/,{},hdtg7k,True,False,False,True,True,False,False,,flair,"[{'e': 'text', 't': 'Community'}]",d34790c2-412a-11e8-a986-0e3a917b7a84,Community,dark,richtext,False,False,False,7,0,False,all_ads,/r/Seattle/comments/hdtg7k/launching_an_open_source_police_brutality_app/,False,image,"{'enabled': True, 'images': [{'id': '-F2P-tIphbqOyYfsMY234MnLNYBpvJYOq1kNVdajdf8', 'resolutions': [{'height': 55, 'url': 'https://preview.redd.it/6oto7jv83h651.jpg?width=108&amp;crop=smart&amp;auto=webp&amp;s=1dae68f1da0845bfd34832c71972a635fad7e137', 'width': 108}, {'height': 111, 'url': 'https://preview.redd.it/6oto7jv83h651.jpg?width=216&amp;crop=smart&amp;auto=webp&amp;s=aec754735e71acbe0285b1ab335a7e80221b6f34', 'width': 216}, {'height': 165, 'url': 'https://preview.redd.it/6oto7jv83h651.jpg?width=320&amp;crop=smart&amp;auto=webp&amp;s=22d986ab041ba80cbaf5cb6925c68bd0563ae62b', 'width': 320}, {'height': 330, 'url': 'https://preview.redd.it/6oto7jv83h651.jpg?width=640&amp;crop=smart&amp;auto=webp&amp;s=22ca3b44f601b9f13f17baab3759a84024e98e06', 'width': 640}, {'height': 495, 'url': 'https://preview.redd.it/6oto7jv83h651.jpg?width=960&amp;crop=smart&amp;auto=webp&amp;s=0bb22f267d23254b0f502cecd19b255f428d2ce6', 'width': 960}, {'height': 557, 'url': 'https://preview.redd.it/6oto7jv83h651.jpg?width=1080&amp;crop=smart&amp;auto=webp&amp;s=8ed16cfd54afddb63fc1766dc8a8f9b1e26ca3b2', 'width': 1080}], 'source': {'height': 967, 'url': 'https://preview.redd.it/6oto7jv83h651.jpg?auto=webp&amp;s=ce8f87fa2506c2f73e5d70b736100d0f12c25208', 'width': 1874}, 'variants': {}}]}",6,1592838356,3,,True,False,False,Seattle,t5_2qhad,220488,public,https://a.thumbs.redditmedia.com/AsCIKWe0Xxs5pL0BSw2-Jz17kIoanFSr7JMENr9R7D8.jpg,72.0,140.0,"Launching an open source police brutality app, with my volunteer group. Feel free to share feedback and/or DM me if you would like to pitch in as a volunteer! This screenshot from a demo of the app, so it uses imperfect data.",0,[],0.62,https://i.redd.it/6oto7jv83h651.jpg,all_ads,6,,,,,,,,,,,,,
[],False,AtomicAerials,,[],,text,t2_5e0czaje,False,True,[],False,False,1592835625,i.redd.it,https://www.reddit.com/r/Seattle/comments/hdt761/empty_highways_and_dusky_skyways/,{},hdt761,True,False,False,True,True,False,False,,flair,"[{'e': 'text', 't': 'Media'}]",,Media,dark,richtext,False,False,False,10,0,False,all_ads,/r/Seattle/comments/hdt761/empty_highways_and_dusky_skyways/,False,image,"{'enabled': True, 'images': [{'id': 'Wm5H66Siw-xAU3ECcZCyyh3MPDNUzHI2ewqOlN05Jyk', 'resolutions': [{'height': 78, 'url': 'https://preview.redd.it/7dwxgi500h651.jpg?width=108&amp;crop=smart&amp;auto=webp&amp;s=800b26817ca1a920c9c2fb46c3d23b4f4335bc9c', 'width': 108}, {'height': 157, 'url': 'https://preview.redd.it/7dwxgi500h651.jpg?width=216&amp;crop=smart&amp;auto=webp&amp;s=df0a37a89a45d0cc1c76e3bc4b76aaf5bc2df1f5', 'width': 216}, {'height': 233, 'url': 'https://preview.redd.it/7dwxgi500h651.jpg?width=320&amp;crop=smart&amp;auto=webp&amp;s=892df6d6b73267ecb4dd6028f733432ac41266e7', 'width': 320}, {'height': 467, 'url': 'https://preview.redd.it/7dwxgi500h651.jpg?width=640&amp;crop=smart&amp;auto=webp&amp;s=98655fa767f88ccb24fe8f786f8a75430a3790cf', 'width': 640}, {'height': 700, 'url': 'https://preview.redd.it/7dwxgi500h651.jpg?width=960&amp;crop=smart&amp;auto=webp&amp;s=e1e8c876886f2c00deb1ac08125ebe4261174c99', 'width': 960}, {'height': 788, 'url': 'https://preview.redd.it/7dwxgi500h651.jpg?width=1080&amp;crop=smart&amp;auto=webp&amp;s=f66b84f3a1736db65784f2e1c67f8924e9c5cbb4', 'width': 1080}], 'source': {'height': 3069, 'url': 'https://preview.redd.it/7dwxgi500h651.jpg?auto=webp&amp;s=2ff07bae411b6be633ea4f7adc0097b717531f39', 'width': 4204}, 'variants': {}}]}",6,1592835932,2,,True,False,False,Seattle,t5_2qhad,220487,public,https://b.thumbs.redditmedia.com/-AyowwqSWfkqxeHL_C4zWR3zVi1UzysG3mDsCgs9hUI.jpg,102.0,140.0,Empty highways and dusky skyways,0,[],1.0,https://i.redd.it/7dwxgi500h651.jpg,all_ads,6,,,,,,,,,,,,,
[],False,gaviidae,flair,"[{'e': 'text', 't': 'West Edge'}]",West Edge,richtext,t2_4j8fj,False,True,[],False,False,1592833217,self.Seattle,https://www.reddit.com/r/Seattle/comments/hdsj48/does_courtney_cox_have_a_connection_to_washington/,{},hdsj48,True,False,False,False,True,True,False,,flair,"[{'e': 'text', 't': 'Question'}]",9b95cc16-44bf-11e6-aba4-0e42ab5b9d91,Question,dark,richtext,False,False,True,11,0,False,all_ads,/r/Seattle/comments/hdsj48/does_courtney_cox_have_a_connection_to_washington/,False,self,"{'enabled': False, 'images': [{'id': 'YpenTV8NUlBE7UhYQjtiidYuoKnrdiV_1sIoXnQFbxA', 'resolutions': [{'height': 60, 'url': 'https://external-preview.redd.it/Qq1GVJgdBzlK7vhBPd7QrgX9wXacZnosaxMvZ6k15cY.jpg?width=108&amp;crop=smart&amp;auto=webp&amp;s=d7acf1286619f96d004875b30f98d6b5b80e1f62', 'width': 108}, {'height': 121, 'url': 'https://external-preview.redd.it/Qq1GVJgdBzlK7vhBPd7QrgX9wXacZnosaxMvZ6k15cY.jpg?width=216&amp;crop=smart&amp;auto=webp&amp;s=c943b9b1f2732685050a8fa80249783b98f57680', 'width': 216}, {'height': 179, 'url': 'https://external-preview.redd.it/Qq1GVJgdBzlK7vhBPd7QrgX9wXacZnosaxMvZ6k15cY.jpg?width=320&amp;crop=smart&amp;auto=webp&amp;s=83988c28983badc2506ecf480a56955bcf42fd51', 'width': 320}], 'source': {'height': 354, 'url': 'https://external-preview.redd.it/Qq1GVJgdBzlK7vhBPd7QrgX9wXacZnosaxMvZ6k15cY.jpg?auto=webp&amp;s=98d90fa9e6600b56949f834ddb3af278b3832b7b', 'width': 630}, 'variants': {}}]}",6,1592833219,1,"[All in WA concert](https://i0.wp.com/abcnewsradioonline.com/storage/music-news-images-june-2020/M_allinwa_61820.jpg?w=1016) has a list of big names connected to Washington, mostly Seattle. But then they also have Courtney Cox. I have never heard of any connection she has had to the PNW. Anyone know what it is or if she just joined the concert to help out?

Also, surprised Conan O'Brien isn't on the list. Seems like something he would participate in.",True,False,False,Seattle,t5_2qhad,220482,public,self,,,Does Courtney Cox have a connection to Washington state? (All in WA concert),0,[],1.0,https://www.reddit.com/r/Seattle/comments/hdsj48/does_courtney_cox_have_a_connection_to_washington/,all_ads,6,2d58217a-4b6f-11e1-a7f9-12313d2c1af1,dark,,,,,,,,,,,
[],False,ChinaTrumper,,[],,text,t2_yoi8u,False,False,[],False,False,1592832499,self.Seattle,https://www.reddit.com/r/Seattle/comments/hdsc5e/should_chop_be_dismantled_by_the_city/,{},hdsc5e,True,False,False,False,True,True,False,,,[],,,dark,text,False,False,True,72,0,False,all_ads,/r/Seattle/comments/hdsc5e/should_chop_be_dismantled_by_the_city/,False,,,6,1592832500,1,"

[View Poll](https://www.reddit.com/poll/hdsc5e)",True,False,False,Seattle,t5_2qhad,220480,public,self,,,Should CHOP be dismantled by the city?,0,[],1.0,https://www.reddit.com/r/Seattle/comments/hdsc5e/should_chop_be_dismantled_by_the_city/,all_ads,6,,,"{'options': [{'id': '1512886', 'text': 'Yes'}, {'id': '1512887', 'text': 'No'}], 'total_vote_count': 0, 'user_selection': None, 'voting_end_timestamp': 1593091699379}",,,,,,,,,,
[],False,Gshock720,,[],,text,t2_13qtevb6,False,False,[],False,False,1592831410,twitter.com,https://www.reddit.com/r/Seattle/comments/hds25k/segregation_in_chaz_2020/,{},hds25k,True,False,False,False,True,False,False,,flair,"[{'e': 'text', 't': 'News'}]",9f9ba910-f804-11e4-be5c-0ea18645ab5f,News,dark,richtext,False,False,True,285,0,False,all_ads,/r/Seattle/comments/hds25k/segregation_in_chaz_2020/,False,,,6,1592831410,1,,True,False,False,Seattle,t5_2qhad,220478,public,default,,,Segregation in CHAZ 2020,0,[],1.0,https://twitter.com/i/status/1274337412181823489,all_ads,6,,,,,,,,,,,,,
[],False,Gshock720,,[],,text,t2_13qtevb6,False,False,[],False,False,1592830839,imgur.com,https://www.reddit.com/r/Seattle/comments/hdrx2i/segregation_in_chaz_2020/,{},hdrx2i,True,False,False,False,True,False,False,,flair,"[{'e': 'text', 't': 'News'}]",9f9ba910-f804-11e4-be5c-0ea18645ab5f,News,dark,richtext,False,False,True,1,0,False,all_ads,/r/Seattle/comments/hdrx2i/segregation_in_chaz_2020/,False,,,6,1592830841,1,,True,False,False,Seattle,t5_2qhad,220478,public,default,,,Segregation in CHAZ 2020,0,[],1.0,http://imgur.com/a/2wmZS99,all_ads,6,,,,,,,,,,,,,
[],False,RAZESLAUGHTER4,,[],,text,t2_6n9ub1x8,False,False,[],False,False,1592821119,self.Seattle,https://www.reddit.com/r/Seattle/comments/hdpqk0/mysterious_lights_at_307_am/,{},hdpqk0,True,False,False,False,True,True,False,,flair,"[{'e': 'text', 't': 'Question'}]",9b95cc16-44bf-11e6-aba4-0e42ab5b9d91,Question,dark,richtext,False,False,True,10,0,False,all_ads,/r/Seattle/comments/hdpqk0/mysterious_lights_at_307_am/,False,,,6,1592821120,1,So I just saw a line of several dozen lights (im assuming they are planes) above seatac. Am i crazy or can anybody confirm this?,True,False,False,Seattle,t5_2qhad,220470,public,self,,,Mysterious lights at 3:07 AM?,0,[],1.0,https://www.reddit.com/r/Seattle/comments/hdpqk0/mysterious_lights_at_307_am/,all_ads,6,,,,,,,,,,,,,
[],False,JimmyTheGinger,,[],,text,t2_9hqz5,False,False,[],False,False,1592816487,self.Seattle,https://www.reddit.com/r/Seattle/comments/hdornx/shut_down_chop_make_it_a_biannual_event/,{},hdornx,True,False,False,False,True,True,False,,,[],,,dark,text,False,False,True,58,0,False,all_ads,/r/Seattle/comments/hdornx/shut_down_chop_make_it_a_biannual_event/,False,,,6,1592816488,1,"The title says it all.. CHOP has become a magnet for drug dealing, homelessness and every other aspect of a shantytown. For reasons best left unsaid, CHOP is no longer safe and will continue to be a wildcard until leadership steps in.  


CHOP could be salvaged, reduced in size, with police presence, but the city needs to get back on board and someone needs to be held accountable and be available to authorities and city at all times. I honestly don't see this happening on a short time scale, so I think CHOP should be shut down (not forcefully, but over a 2 day timeline with open communication).

&amp;#x200B;

CHOP was a success. It's a fascinating story, that can be retold and continued at Cal Anderson/Capitol Hill. Twice a year, lock off the area, sell tickets that fund the event, have community do all that CHOP loves; art, dance, talks, discussions, food, music, dancing! This could become an international event; A cultured festival focused around societal reform, racism, police brutality, philosopy, art and so much more.

&amp;#x200B;

What do you all think?",True,False,False,Seattle,t5_2qhad,220460,public,self,,,"SHUT DOWN CHOP, Make it a biannual event.",0,[],1.0,https://www.reddit.com/r/Seattle/comments/hdornx/shut_down_chop_make_it_a_biannual_event/,all_ads,6,,,,,,,,,,,,,
[],False,mobile-user-guy,,[],,text,t2_d6oci,False,False,[],False,False,1592815392,self.Seattle,https://www.reddit.com/r/Seattle/comments/hdojw9/meet_the_new_boss_same_as_the_old_boss/,{},hdojw9,True,False,False,False,True,True,False,,,[],,,dark,text,False,False,True,5,0,False,all_ads,/r/Seattle/comments/hdojw9/meet_the_new_boss_same_as_the_old_boss/,False,,,6,1592815393,1,"This is a complete disgrace. ANTIFA and a bunch of other pussies have anointed themselves as GOD.

[https://m.twitch.tv/videos/657835014](https://m.twitch.tv/videos/657835014) \- 3:44:00 for the shots fired, 3:50:00 for ANTIFA stealing streamers phone and basically acting EXACTLY like the police they are against.

If you can stomach watching that and side with the guy who stole the phone AND the way these guys are talking about the situation - then just bring back the police and shut down all protesting nationwide because this is EXACTLY what we already had.

Kick these fucking people out of your neighborhood.",True,False,False,Seattle,t5_2qhad,220461,public,self,,,"Meet the New Boss, same as the Old Boss",0,[],1.0,https://www.reddit.com/r/Seattle/comments/hdojw9/meet_the_new_boss_same_as_the_old_boss/,all_ads,6,,,,,,,,,,,,,
[],False,2ZERO6,,[],,text,t2_zo1etzl,False,False,[],False,False,1592814348,twitch.tv,https://www.reddit.com/r/Seattle/comments/hdocfz/saw_this_on_twitter_shooting_on_capitol_hill_and/,{},hdocfz,True,False,False,False,True,False,False,,flair,"[{'e': 'text', 't': 'Community'}]",d34790c2-412a-11e8-a986-0e3a917b7a84,Community,dark,richtext,False,False,True,0,0,False,all_ads,/r/Seattle/comments/hdocfz/saw_this_on_twitter_shooting_on_capitol_hill_and/,False,,,6,1592814349,1,,True,False,False,Seattle,t5_2qhad,220461,public,default,,,"Saw this on Twitter. Shooting on Capitol Hill, and some guys took the streamers phone.",0,[],1.0,https://www.twitch.tv/videos/657835014?t=13307s,all_ads,6,,,,,,,,,,,,,
[],False,yungsemite,,[],,text,t2_23pyq2bp,False,False,[],False,False,1592814179,self.Seattle,https://www.reddit.com/r/Seattle/comments/hdob6u/police_helicopters_over_leschi_10_years_ago/,{},hdob6u,True,False,False,False,True,True,False,,flair,"[{'e': 'text', 't': 'Question'}]",9b95cc16-44bf-11e6-aba4-0e42ab5b9d91,Question,dark,richtext,False,False,True,5,0,False,all_ads,/r/Seattle/comments/hdob6u/police_helicopters_over_leschi_10_years_ago/,False,,,6,1592814180,1,"Hello Seattle,

I’m trying to validate this memory that I have of there being some kind of person at large in leschi, at which point there was extreme police presence and even helicopters overhead as they tried to extract this person from a house. Does anyone else either remember this, or have any ideas how I might find out if/ when / what happened?

Thanks",True,False,False,Seattle,t5_2qhad,220461,public,self,,,Police helicopters over Leschi 10? years ago,0,[],1.0,https://www.reddit.com/r/Seattle/comments/hdob6u/police_helicopters_over_leschi_10_years_ago/,all_ads,6,,,,,,,,,,,,,
[],False,Jasonwj322a,,[],,text,t2_wo67s,False,False,[],False,False,1592814053,self.Seattle,https://www.reddit.com/r/Seattle/comments/hdoabk/harborview_or_swedish_for_inpatient_program/,{},hdoabk,True,False,False,False,True,True,False,,flair,"[{'e': 'text', 't': 'Question'}]",9b95cc16-44bf-11e6-aba4-0e42ab5b9d91,Question,dark,richtext,False,False,True,11,0,False,all_ads,/r/Seattle/comments/hdoabk/harborview_or_swedish_for_inpatient_program/,False,,,6,1592814054,1,"I have Premera as my insurance which is under my parents. They do not know about my situation. I have been struggling with mental health issues and have recently been abusing over the counter medicine which has a negative reaction with my prescribed medication. I am some times suicidal which is scary because each time I have those thoughts, I feel more of an urge to enact on it.

I've heard of impatient programs from my therapist as they suggested I go to one after telling them about my substance abuse. I did some research myself and it seems like something that can help me. Only thing I am afraid of is the experience itself and cost. I believe both hospitals accept my insurance but I know healthcare can be expensive. I am also afraid of arriving there alone, I do not know how the process is like. I would love to hear your experience if you have had similar experience with this.",True,False,False,Seattle,t5_2qhad,220461,public,self,,,Harborview or Swedish for Inpatient Program?,0,[],1.0,https://www.reddit.com/r/Seattle/comments/hdoabk/harborview_or_swedish_for_inpatient_program/,all_ads,6,,,,,,,,,,,,,
[],False,ShadowHandler,flair,"[{'e': 'text', 't': 'Newcastle'}]",Newcastle,richtext,t2_gzuml,False,False,[],False,False,1592813895,komonews.com,https://www.reddit.com/r/Seattle/comments/hdo977/second_shooting_in_48hrs_occurs_in_chop_sunday/,{},hdo977,True,False,False,False,True,False,False,,,[],,,dark,text,False,False,True,56,0,False,all_ads,/r/Seattle/comments/hdo977/second_shooting_in_48hrs_occurs_in_chop_sunday/,False,,,6,1592813895,1,,False,False,False,Seattle,t5_2qhad,220461,public,default,,,Second shooting in 48hrs occurs in CHOP Sunday Night,0,[],1.0,https://komonews.com/news/local/shots-fired-on-capitol-hill,all_ads,6,,dark,,,,,,,,,,,
[],False,Pale-Illustrator6230,,[],,text,t2_6pq20m33,False,False,[],False,False,1592813837,self.Seattle,https://www.reddit.com/r/Seattle/comments/hdo8ro/what_does_broken_window_policing_mean_to_rseattle/,{},hdo8ro,False,False,False,False,False,True,False,,flair,"[{'e': 'text', 't': 'Rant'}]",8e17612a-59fe-11e8-bb72-0eebcf11070a,Rant,dark,richtext,False,False,True,2,0,False,all_ads,/r/Seattle/comments/hdo8ro/what_does_broken_window_policing_mean_to_rseattle/,False,,,6,1592813839,1,[removed],True,False,False,Seattle,t5_2qhad,220461,public,self,,,"What does ""broken window policing"" mean to /r/Seattle",0,[],1.0,https://www.reddit.com/r/Seattle/comments/hdo8ro/what_does_broken_window_policing_mean_to_rseattle/,all_ads,6,,,,,automod_filtered,,,,,,,,
[],False,UnturntUnicorn,,[],,text,t2_dr83u26,False,False,[],False,False,1592813612,self.Seattle,https://www.reddit.com/r/Seattle/comments/hdo74u/is_there_a_reason_that_i_am_unaware_of_for_the/,{},hdo74u,True,False,False,False,True,True,False,,flair,"[{'e': 'text', 't': 'Question'}]",9b95cc16-44bf-11e6-aba4-0e42ab5b9d91,Question,dark,richtext,False,False,True,6,0,False,all_ads,/r/Seattle/comments/hdo74u/is_there_a_reason_that_i_am_unaware_of_for_the/,False,,,6,1592813613,1,"Bit of an weird question for y’all

There have been a lot of fireworks around me lately. I went up to my parents house in shoreline for Father’s Day and some people nearby set off some fireworks. At about 0100 Monday, someone near me in the U-District began setting off a bunch of fireworks. 

Is there a reason that people have been setting off fireworks?  Is there a holiday that I am unaware of that I haven’t noticed in the past?",True,False,False,Seattle,t5_2qhad,220461,public,self,,,Is there a reason that I am unaware of for the fireworks?,0,[],1.0,https://www.reddit.com/r/Seattle/comments/hdo74u/is_there_a_reason_that_i_am_unaware_of_for_the/,all_ads,6,,,,,,,,,,,,,
[],False,W3rush,,[],,text,t2_4kqqzfgj,False,False,[],False,False,1592813205,self.Seattle,https://www.reddit.com/r/Seattle/comments/hdo447/drugs_and_homeless_in_belltown/,{},hdo447,True,False,False,False,True,True,False,,,[],,,dark,text,False,False,True,30,0,False,all_ads,/r/Seattle/comments/hdo447/drugs_and_homeless_in_belltown/,False,,,6,1592813206,1,"We recently moved to Belltown, it’s awesome but the only thing making us angry is the building management and neighbors. What should we do? Our neighbors are for sure drug dealers, they always scream hyped on something, bring over weird people, smoke inside and it’s a no smoking building. And so on....We asked them politely so many times and nothing has changed. We also contacted the building manager and nothing is happening. The cherry on top of it is that tonight we seen this woman, who we know is homeless and drug user leaving our building. I want to be in peace but I don’t know what to do. I’m scared too. Our lease is done next year so I can’t consider moving...",True,False,False,Seattle,t5_2qhad,220461,public,self,,,Drugs and homeless in Belltown,0,[],1.0,https://www.reddit.com/r/Seattle/comments/hdo447/drugs_and_homeless_in_belltown/,all_ads,6,,,,,,,,,,,,,
[],False,Wolfofthesea123,,[],,text,t2_8f1kxxh,False,False,[],False,False,1592812836,/r/Seattle/comments/hdo1bl/huge_fireworks_going_off_in_u_district_going_off/,https://www.reddit.com/r/Seattle/comments/hdo1bl/huge_fireworks_going_off_in_u_district_going_off/,{},hdo1bl,True,False,False,False,True,False,True,,,[],,,dark,text,False,False,True,129,0,False,all_ads,/r/Seattle/comments/hdo1bl/huge_fireworks_going_off_in_u_district_going_off/,False,,,6,1592812837,1,,True,False,False,Seattle,t5_2qhad,220459,public,default,,,Huge fireworks going off in u district going off right in the street,0,[],1.0,https://v.redd.it/qjhv31ys4f651,all_ads,6,,,,,,,,,,,,,
[],False,SeattleiteKiwi,flair,"[{'e': 'text', 't': 'Capitol Hill'}]",Capitol Hill,richtext,t2_11x2mm,False,False,[],False,False,1592812686,self.Seattle,https://www.reddit.com/r/Seattle/comments/hdo09c/anyone_else_hearing_gunshots_in_capitol_hill/,{},hdo09c,True,False,False,False,True,True,False,,flair,"[{'e': 'text', 't': 'Question'}]",9b95cc16-44bf-11e6-aba4-0e42ab5b9d91,Question,dark,richtext,False,False,True,2,0,False,all_ads,/r/Seattle/comments/hdo09c/anyone_else_hearing_gunshots_in_capitol_hill/,False,,,6,1592812687,1,"I don’t know if what I’m hearing are gun shots, or fireworks. Does anyone in Capitol Hill hear it and know what it is?",True,False,False,Seattle,t5_2qhad,220459,public,self,,,Anyone else hearing gunshots in Capitol Hill?,0,[],1.0,https://www.reddit.com/r/Seattle/comments/hdo09c/anyone_else_hearing_gunshots_in_capitol_hill/,all_ads,6,6e1ff2a0-3cba-11e1-9d9e-12313b0284b1,dark,,,,,,,,,,,
[],False,greenyellowflamingo,,[],,text,t2_5qa20xxn,False,False,[],False,False,1592811973,self.Seattle,https://www.reddit.com/r/Seattle/comments/hdnv4l/were_those_shots_just_now_in_the_cap_hill_area/,{},hdnv4l,True,False,False,False,True,True,False,,,[],,,dark,text,False,False,True,33,0,False,all_ads,/r/Seattle/comments/hdnv4l/were_those_shots_just_now_in_the_cap_hill_area/,False,,,6,1592811975,1,"I heard some muted sounds which could have been gunshots, or fireworks? Hard to tell these days",True,False,False,Seattle,t5_2qhad,220460,public,self,,,Were those shots *just now* in the Cap Hill area?,0,[],1.0,https://www.reddit.com/r/Seattle/comments/hdnv4l/were_those_shots_just_now_in_the_cap_hill_area/,all_ads,6,,,,,,,,,,,,,
[],False,magmamyr,,[],,text,t2_156nqn,False,False,[],False,False,1592811891,i.redd.it,https://www.reddit.com/r/Seattle/comments/hdnujl/shitty_picture_off_my_phone_but_im_just_admiring/,{},hdnujl,True,False,False,True,True,False,False,,flair,"[{'e': 'text', 't': 'Media'}]",cba61046-412a-11e8-8b48-0e90cbddd944,Media,dark,richtext,False,False,True,4,0,False,all_ads,/r/Seattle/comments/hdnujl/shitty_picture_off_my_phone_but_im_just_admiring/,False,,,6,1592811892,1,,True,False,False,Seattle,t5_2qhad,220460,public,default,,,Shitty picture off my phone but I’m just admiring the city. CenturyLink then Space Needle on the far left,0,[],1.0,https://i.redd.it/b5eohrd02f651.jpg,all_ads,6,,,,,,,,,,,,,
[],False,ridhan3912,,[],,text,t2_4tqcuo12,False,True,[],False,False,1592811489,lailasnews.com,https://www.reddit.com/r/Seattle/comments/hdnrls/randonaut_dead_body_dead_body_found_in_suitcase/,{},hdnrls,False,False,False,False,False,False,False,,,[],,,dark,text,False,False,True,2,0,False,all_ads,/r/Seattle/comments/hdnrls/randonaut_dead_body_dead_body_found_in_suitcase/,False,,,6,1592811490,1,,True,False,False,Seattle,t5_2qhad,220458,public,default,,,Randonaut dead body: Dead body found in suitcase Seattle - VIDEO,0,[],1.0,https://lailasnews.com/international/randonaut-dead-body-dead-body-found-in-suitcase-seattle-video/,all_ads,6,,,,,reddit,,,,,,,,
[],False,honestabe66,,[],,text,t2_xacb6mu,False,False,[],False,False,1592810972,self.Seattle,https://www.reddit.com/r/Seattle/comments/hdnnpz/he_did_nothing_wrong/,{},hdnnpz,True,False,False,False,True,True,False,,,[],,,dark,text,False,False,True,4,0,False,all_ads,/r/Seattle/comments/hdnnpz/he_did_nothing_wrong/,False,,,6,1592810974,1,[youtube]o5LF9FSvhmA[/youtube],True,False,False,Seattle,t5_2qhad,220452,public,self,,,He did nothing wrong,0,[],1.0,https://www.reddit.com/r/Seattle/comments/hdnnpz/he_did_nothing_wrong/,all_ads,6,,,,,,,,,,,,,
[],False,HXMBER,,[],,text,t2_41eeyy9f,False,False,[],False,False,1592810380,youtube.com,https://www.reddit.com/r/Seattle/comments/hdnj7k/chazchop_security_beats_streamer_for_filming/,{},hdnj7k,True,False,False,False,True,False,False,,,[],,,dark,text,False,False,True,6,0,False,all_ads,/r/Seattle/comments/hdnj7k/chazchop_security_beats_streamer_for_filming/,False,,,6,1592810381,1,,True,False,False,Seattle,t5_2qhad,220451,public,default,,,"CHAZ/CHOP Security beats streamer for filming shooting scene, takes phone while the stream was on",0,[],1.0,https://www.youtube.com/watch?v=X1enrcPRU5E,all_ads,6,,,,,,,,,,,,,
[],False,ridhan3912,,[],,text,t2_4tqcuo12,False,True,[],False,False,1592810148,/r/Seattle/comments/hdnhfj/on_june_20_authorities_found_multiple_bags_filled/,https://www.reddit.com/r/Seattle/comments/hdnhfj/on_june_20_authorities_found_multiple_bags_filled/,{},hdnhfj,True,False,False,False,True,False,True,,,[],,,dark,text,False,False,True,17,0,False,all_ads,/r/Seattle/comments/hdnhfj/on_june_20_authorities_found_multiple_bags_filled/,False,,,6,1592810149,1,,True,False,False,Seattle,t5_2qhad,220452,public,default,,,On June 20 authorities found multiple bags filled with human remains in the water as well as on the beach.Multiple women in the area have gone missing recently. It is unclear if the object attack is related but something weird is happening. Do not walk alone.,0,[],1.0,https://v.redd.it/0uihsm9mwe651,all_ads,6,,,,,,,,,,,,,
