[],False,pandabearlily,,[],,text,t2_2jns6udi,False,False,[],False,False,1596053484,self.Seattle,https://www.reddit.com/r/Seattle/comments/i07qp4/getting_a_reservation_at_kashibas/,{},i07qp4,True,False,False,False,True,True,False,,flair,"[{'e': 'text', 't': 'Question'}]",9b95cc16-44bf-11e6-aba4-0e42ab5b9d91,Question,dark,richtext,False,False,True,1,0,False,all_ads,/r/Seattle/comments/i07qp4/getting_a_reservation_at_kashibas/,False,,,6,1596053496,1,"Hi all!

I’ve traveled from Oregon to visit relatives. My boyfriend and I really wanted to try Kashiba’s after trying Shiro’s. We got a reservation at Shiro’s day of. How likely do you think we’ll be able to get in today (it’s our last day here)?

Thanks in advance! If we miss it this time, it’s okay because we’ll hopefully be back later on.",True,False,False,Seattle,t5_2qhad,223783,public,self,,,Getting a reservation at Kashiba’s?,0,[],1.0,https://www.reddit.com/r/Seattle/comments/i07qp4/getting_a_reservation_at_kashibas/,,all_ads,6,,,,,,,,,,,,,
[],False,TheFishSeattle,,[],,text,t2_9e4f5,False,False,[],False,False,1596052991,self.Seattle,https://www.reddit.com/r/Seattle/comments/i07l0l/several_bad_experiences_around_the_city_lately/,{},i07l0l,True,False,False,False,True,True,False,,,[],,,dark,text,False,False,True,18,0,False,all_ads,/r/Seattle/comments/i07l0l/several_bad_experiences_around_the_city_lately/,False,,,6,1596053001,1,"So I've noticed a lot of animosity towards me and my innocuous and/or day-to-day small-talk (good morning and the like) in public from black men.  This morning I had three irrationally unpleasant encounters on my errands.  I'm not a chatterbox, this is Seattle, I only mention anything if its appropriate. Offhand comments made in light conversation are met with angst and implications of racism.  I'm not sure how to take all this, but I'm not a weakling and I'm not going to continue to give all these assholes I talk to a pass, especially if my son is present (and he often is).  This is an immature and unbalanced way to deal with strangers and guys more prone to anger than me are not going to respond well to having ""fuck you cracker racist"" as the undertone to so many of their day-to-day interactions.  This is oddly common with employees at retailers and the like-deeply unprofessional.  Things are hot right now, I get it, but i will not tolerate being treated so pathetically.  Some might think this is some kind of poetic justice, so its justified-I can tell you its not justified, it makes you come off as a weak-minded asshole.",True,False,False,Seattle,t5_2qhad,223783,public,self,,,Several bad experiences around the city lately,0,[],1.0,https://www.reddit.com/r/Seattle/comments/i07l0l/several_bad_experiences_around_the_city_lately/,,all_ads,6,,,,,,,,,,,,,
[],False,kentkirk,,[],,text,t2_h8koy,False,False,[],False,False,1596051163,self.Seattle,https://www.reddit.com/r/Seattle/comments/i070jo/where_to_find_jojos_like_montlake_market_made/,{},i070jo,True,False,False,False,True,True,False,,,[],,,dark,text,False,False,True,7,0,False,all_ads,/r/Seattle/comments/i070jo/where_to_find_jojos_like_montlake_market_made/,False,,,6,1596051174,1,I'm jonesing for some jojos from Montlake Market. Is there any place that makes them like they did?,True,False,False,Seattle,t5_2qhad,223781,public,self,,,Where to find Jojos like Montlake Market made?,0,[],1.0,https://www.reddit.com/r/Seattle/comments/i070jo/where_to_find_jojos_like_montlake_market_made/,,all_ads,6,,,,,,,,,,,,,
[],False,JJGerms,,[],,text,t2_6ra6q,False,False,[],False,False,1596050968,twitter.com,https://www.reddit.com/r/Seattle/comments/i06y9l/bobby_wagner_with_some_lowkey_shade_on_seattles/,{},i06y9l,True,False,False,False,True,False,False,,,[],,,dark,text,False,False,True,26,0,False,all_ads,/r/Seattle/comments/i06y9l/bobby_wagner_with_some_lowkey_shade_on_seattles/,False,link,"{'enabled': False, 'images': [{'id': 'tCHqJe_PEKhoPYYkCgLrLA_Xdj22vDsnXpZBSNci8Eg', 'resolutions': [{'height': 108, 'url': 'https://external-preview.redd.it/Tm47BZq0RVoVWorrjve0t_0P7IVqTWA8kNOMZUdpRxA.jpg?width=108&amp;crop=smart&amp;auto=webp&amp;s=14caa3fb4917dd4a6987ad54c2a6bcc251b949b8', 'width': 108}], 'source': {'height': 140, 'url': 'https://external-preview.redd.it/Tm47BZq0RVoVWorrjve0t_0P7IVqTWA8kNOMZUdpRxA.jpg?auto=webp&amp;s=3af301843be19263164f076c7a99be50640fe916', 'width': 140}, 'variants': {}}]}",6,1596050979,1,,False,False,False,Seattle,t5_2qhad,223781,public,https://b.thumbs.redditmedia.com/2rFqRRdbzNSrwRZ2OCRQz4e1XOvS4E9EGrfMNYgZY4M.jpg,140.0,140.0,"Bobby Wagner with some low-key shade on Seattle's nightlife in regard to players being smart and making wise decisions: ""Luckily we are in Seattle, so there's not really clubs for us to go to.""",0,[],1.0,https://twitter.com/Joe_Fann/status/1288545425805340672?s=19,https://twitter.com/Joe_Fann/status/1288545425805340672?s=19,all_ads,6,,,,"{'oembed': {'author_name': 'Joe Fann', 'author_url': 'https://twitter.com/Joe_Fann', 'cache_age': 3153600000, 'height': None, 'html': '&lt;blockquote class=""twitter-video""&gt;&lt;p lang=""en"" dir=""ltr""&gt;Bobby Wagner with some low-key shade on Seattle&amp;#39;s nightlife in regard to players being smart and making wise decisions:&lt;br&gt;&lt;br&gt;&amp;quot;Luckily we are in Seattle, so there&amp;#39;s not really clubs for us to go to.&amp;quot;&lt;/p&gt;&amp;mdash; Joe Fann (@Joe_Fann) &lt;a href=""https://twitter.com/Joe_Fann/status/1288545425805340672?ref_src=twsrc%5Etfw""&gt;July 29, 2020&lt;/a&gt;&lt;/blockquote&gt;\n&lt;script async src=""https://platform.twitter.com/widgets.js"" charset=""utf-8""&gt;&lt;/script&gt;\n', 'provider_name': 'Twitter', 'provider_url': 'https://twitter.com', 'type': 'rich', 'url': 'https://twitter.com/Joe_Fann/status/1288545425805340672', 'version': '1.0', 'width': 350}, 'type': 'twitter.com'}","{'content': '&lt;blockquote class=""twitter-video""&gt;&lt;p lang=""en"" dir=""ltr""&gt;Bobby Wagner with some low-key shade on Seattle&amp;#39;s nightlife in regard to players being smart and making wise decisions:&lt;br&gt;&lt;br&gt;&amp;quot;Luckily we are in Seattle, so there&amp;#39;s not really clubs for us to go to.&amp;quot;&lt;/p&gt;&amp;mdash; Joe Fann (@Joe_Fann) &lt;a href=""https://twitter.com/Joe_Fann/status/1288545425805340672?ref_src=twsrc%5Etfw""&gt;July 29, 2020&lt;/a&gt;&lt;/blockquote&gt;\n&lt;script async src=""https://platform.twitter.com/widgets.js"" charset=""utf-8""&gt;&lt;/script&gt;\n', 'height': 200, 'scrolling': False, 'width': 350}","{'oembed': {'author_name': 'Joe Fann', 'author_url': 'https://twitter.com/Joe_Fann', 'cache_age': 3153600000, 'height': None, 'html': '&lt;blockquote class=""twitter-video""&gt;&lt;p lang=""en"" dir=""ltr""&gt;Bobby Wagner with some low-key shade on Seattle&amp;#39;s nightlife in regard to players being smart and making wise decisions:&lt;br&gt;&lt;br&gt;&amp;quot;Luckily we are in Seattle, so there&amp;#39;s not really clubs for us to go to.&amp;quot;&lt;/p&gt;&amp;mdash; Joe Fann (@Joe_Fann) &lt;a href=""https://twitter.com/Joe_Fann/status/1288545425805340672?ref_src=twsrc%5Etfw""&gt;July 29, 2020&lt;/a&gt;&lt;/blockquote&gt;\n&lt;script async src=""https://platform.twitter.com/widgets.js"" charset=""utf-8""&gt;&lt;/script&gt;\n', 'provider_name': 'Twitter', 'provider_url': 'https://twitter.com', 'type': 'rich', 'url': 'https://twitter.com/Joe_Fann/status/1288545425805340672', 'version': '1.0', 'width': 350}, 'type': 'twitter.com'}","{'content': '&lt;blockquote class=""twitter-video""&gt;&lt;p lang=""en"" dir=""ltr""&gt;Bobby Wagner with some low-key shade on Seattle&amp;#39;s nightlife in regard to players being smart and making wise decisions:&lt;br&gt;&lt;br&gt;&amp;quot;Luckily we are in Seattle, so there&amp;#39;s not really clubs for us to go to.&amp;quot;&lt;/p&gt;&amp;mdash; Joe Fann (@Joe_Fann) &lt;a href=""https://twitter.com/Joe_Fann/status/1288545425805340672?ref_src=twsrc%5Etfw""&gt;July 29, 2020&lt;/a&gt;&lt;/blockquote&gt;\n&lt;script async src=""https://platform.twitter.com/widgets.js"" charset=""utf-8""&gt;&lt;/script&gt;\n', 'height': 200, 'media_domain_url': 'https://www.redditmedia.com/mediaembed/i06y9l', 'scrolling': False, 'width': 350}",,,,,,
[],False,Emergency_Novel,,[],,text,t2_4bbcc2is,False,False,[],False,False,1596050490,oceanfacts.net,https://www.reddit.com/r/Seattle/comments/i06ssx/chinese_white_dolphin_resource_protection_is_not/,{},i06ssx,True,False,False,False,True,False,False,,,[],,,dark,text,False,False,True,0,0,False,all_ads,/r/Seattle/comments/i06ssx/chinese_white_dolphin_resource_protection_is_not/,False,link,"{'enabled': False, 'images': [{'id': 'es4enadE_14JAmMxrfOU2AQBK7nkliHusVDsngES0i0', 'resolutions': [{'height': 108, 'url': 'https://external-preview.redd.it/ikkA_dRo2r_AYAGnx28SbNo9yF-8vBUCuBimnnAyC7M.jpg?width=108&amp;crop=smart&amp;auto=webp&amp;s=d4ad6062006874b75643fe7bf5ece2d4a9a441d0', 'width': 108}, {'height': 216, 'url': 'https://external-preview.redd.it/ikkA_dRo2r_AYAGnx28SbNo9yF-8vBUCuBimnnAyC7M.jpg?width=216&amp;crop=smart&amp;auto=webp&amp;s=e72183033518e674e221667e7c1ea9880dd5638b', 'width': 216}, {'height': 320, 'url': 'https://external-preview.redd.it/ikkA_dRo2r_AYAGnx28SbNo9yF-8vBUCuBimnnAyC7M.jpg?width=320&amp;crop=smart&amp;auto=webp&amp;s=305ab0687abb993aa4337ea06dfdbdd02f17e45a', 'width': 320}, {'height': 640, 'url': 'https://external-preview.redd.it/ikkA_dRo2r_AYAGnx28SbNo9yF-8vBUCuBimnnAyC7M.jpg?width=640&amp;crop=smart&amp;auto=webp&amp;s=e979048e3e7ab058f6613ecc233cc3c778dff77f', 'width': 640}], 'source': {'height': 800, 'url': 'https://external-preview.redd.it/ikkA_dRo2r_AYAGnx28SbNo9yF-8vBUCuBimnnAyC7M.jpg?auto=webp&amp;s=95685af042364f40c3496771b7acd5b8bfb28a93', 'width': 800}, 'variants': {}}]}",6,1596050501,1,,False,False,False,Seattle,t5_2qhad,223780,public,https://b.thumbs.redditmedia.com/d9q49hQlbLUs32kTI5E-p9_KWwFa0acJpcE6gcPi_TM.jpg,140.0,140.0,Chinese White Dolphin - Resource protection is not optimistic..🐬🐳,0,[],1.0,http://oceanfacts.net/chinese-white-dolphin-resource-protection-is-not-optimistic/,http://oceanfacts.net/chinese-white-dolphin-resource-protection-is-not-optimistic/,all_ads,6,,,,,,,,,,,,,
[],False,wsdot,flair verified,"[{'e': 'text', 't': 'WA State Dept of Transportation'}]",WA State Dept of Transportation,richtext,t2_4upd9,False,False,[],False,False,1596048115,self.Seattle,https://www.reddit.com/r/Seattle/comments/i061xe/full_overnight_i5_closures_in_fife_next_month/,{},i061xe,True,False,False,False,True,True,False,,,[],,,dark,text,False,False,True,1,0,False,all_ads,/r/Seattle/comments/i061xe/full_overnight_i5_closures_in_fife_next_month/,False,self,"{'enabled': False, 'images': [{'id': 'ZQRIS8GKfPBfjU2mjt-LhwRwCAm9uS0G8yhlHxgINFo', 'resolutions': [{'height': 56, 'url': 'https://external-preview.redd.it/hHsGJOPhMRYjaspm5IRgMjIEIwwatlVHHMp8rGedzQU.jpg?width=108&amp;crop=smart&amp;auto=webp&amp;s=c0a2799b7fa9052886806a89ca331dae2ca27fdb', 'width': 108}, {'height': 113, 'url': 'https://external-preview.redd.it/hHsGJOPhMRYjaspm5IRgMjIEIwwatlVHHMp8rGedzQU.jpg?width=216&amp;crop=smart&amp;auto=webp&amp;s=8fd496052f37047ec00b15705a14c0e3c151f8f0', 'width': 216}, {'height': 168, 'url': 'https://external-preview.redd.it/hHsGJOPhMRYjaspm5IRgMjIEIwwatlVHHMp8rGedzQU.jpg?width=320&amp;crop=smart&amp;auto=webp&amp;s=23bc6a1da946f6f5f3701fdbb191704be0ea963a', 'width': 320}, {'height': 336, 'url': 'https://external-preview.redd.it/hHsGJOPhMRYjaspm5IRgMjIEIwwatlVHHMp8rGedzQU.jpg?width=640&amp;crop=smart&amp;auto=webp&amp;s=9e0a1d698d95a2aa673263aa1eedd67a0dfbfdbd', 'width': 640}, {'height': 504, 'url': 'https://external-preview.redd.it/hHsGJOPhMRYjaspm5IRgMjIEIwwatlVHHMp8rGedzQU.jpg?width=960&amp;crop=smart&amp;auto=webp&amp;s=3c5fad1f75f5bee7d5727e384a50d99e7953ea49', 'width': 960}, {'height': 567, 'url': 'https://external-preview.redd.it/hHsGJOPhMRYjaspm5IRgMjIEIwwatlVHHMp8rGedzQU.jpg?width=1080&amp;crop=smart&amp;auto=webp&amp;s=5b0e37b14c776ba7294b848e92f6b16341af4415', 'width': 1080}], 'source': {'height': 630, 'url': 'https://external-preview.redd.it/hHsGJOPhMRYjaspm5IRgMjIEIwwatlVHHMp8rGedzQU.jpg?auto=webp&amp;s=36e17802be1e4bdda6a6f1647a39dc8b0b0a39ca', 'width': 1200}, 'variants': {}}]}",6,1596048268,1,A heads up that in late August we'll have two overnight full closures of I-5 in Fife to install 10 massive girders for a new bridge as part of the SR 167 Completion Project. The highway will be closed from Friday night Aug. 28 to Saturday morning Aug. 29 and again from that Saturday night into Sunday morning. More info in our blog:  [https://wsdotblog.blogspot.com/2020/07/building-bridge-over-i-5-in-one-weekend.html](https://wsdotblog.blogspot.com/2020/07/building-bridge-over-i-5-in-one-weekend.html),True,False,False,Seattle,t5_2qhad,223779,public,self,,,Full overnight I-5 closures in Fife next month,0,[],1.0,https://www.reddit.com/r/Seattle/comments/i061xe/full_overnight_i5_closures_in_fife_next_month/,,all_ads,6,,,dark,,,,,,,,,,
[],False,EentsyTeetsees,,[],,text,t2_mllow,False,False,[],False,False,1596045030,imgur.com,https://www.reddit.com/r/Seattle/comments/i053xt/family_of_raccoons_spotted_in_the_brighton/,{},i053xt,True,False,False,False,True,False,False,,,[],,,dark,text,False,False,True,62,0,False,all_ads,/r/Seattle/comments/i053xt/family_of_raccoons_spotted_in_the_brighton/,False,link,"{'enabled': False, 'images': [{'id': 'WII_k_o04apZmxKfKVj0HfC3Jwa885YqC31gKeU-I0Q', 'resolutions': [{'height': 192, 'url': 'https://external-preview.redd.it/7sf4807cwPRmga9UistfgHpkln2m7FJf5dslZ7eGhec.jpg?width=108&amp;crop=smart&amp;auto=webp&amp;s=ad18ef7356e86af3b156a26b0e34f669a4403d4a', 'width': 108}, {'height': 384, 'url': 'https://external-preview.redd.it/7sf4807cwPRmga9UistfgHpkln2m7FJf5dslZ7eGhec.jpg?width=216&amp;crop=smart&amp;auto=webp&amp;s=91f09823fd68c5896f661980ac32adedd16c3c91', 'width': 216}, {'height': 568, 'url': 'https://external-preview.redd.it/7sf4807cwPRmga9UistfgHpkln2m7FJf5dslZ7eGhec.jpg?width=320&amp;crop=smart&amp;auto=webp&amp;s=30b00acda47e6df8589d9b0c3fcf10293f683aee', 'width': 320}, {'height': 1137, 'url': 'https://external-preview.redd.it/7sf4807cwPRmga9UistfgHpkln2m7FJf5dslZ7eGhec.jpg?width=640&amp;crop=smart&amp;auto=webp&amp;s=695def56d5b7ede050ab4e744dcb2c3e00c53f27', 'width': 640}, {'height': 1706, 'url': 'https://external-preview.redd.it/7sf4807cwPRmga9UistfgHpkln2m7FJf5dslZ7eGhec.jpg?width=960&amp;crop=smart&amp;auto=webp&amp;s=942933f070b9c5ec27db8fd975381bbd627912be', 'width': 960}, {'height': 1920, 'url': 'https://external-preview.redd.it/7sf4807cwPRmga9UistfgHpkln2m7FJf5dslZ7eGhec.jpg?width=1080&amp;crop=smart&amp;auto=webp&amp;s=3e63c7f9ac1fb9ff72d985b030b572953fcd7a4b', 'width': 1080}], 'source': {'height': 2688, 'url': 'https://external-preview.redd.it/7sf4807cwPRmga9UistfgHpkln2m7FJf5dslZ7eGhec.jpg?auto=webp&amp;s=30ae0276daf1417c1decb5025618434100272a2a', 'width': 1512}, 'variants': {}}]}",6,1596045206,1,,True,False,False,Seattle,t5_2qhad,223777,public,https://a.thumbs.redditmedia.com/uRgXq73jqVFyx-wVhiwtIjYEa7k0Lrc1p4k9hyskoe4.jpg,140.0,140.0,Family of raccoons spotted in the Brighton neighborhood this morning,0,[],1.0,https://imgur.com/an3OOEf,https://imgur.com/an3OOEf,all_ads,6,,,,,,,,,,,,,
[],False,iforgotwhat8wasfor,,[],,text,t2_3yuifpg0,False,True,[],False,False,1596044832,self.Seattle,https://www.reddit.com/r/Seattle/comments/i051ra/so_late_last_night_between_about_midnight_and_2am/,{},i051ra,True,False,False,False,True,True,False,,flair,"[{'e': 'text', 't': 'Question'}]",9b95cc16-44bf-11e6-aba4-0e42ab5b9d91,Question,dark,richtext,False,False,True,40,0,False,all_ads,/r/Seattle/comments/i051ra/so_late_last_night_between_about_midnight_and_2am/,False,,,6,1596045021,1,just a coincidence?,True,False,False,Seattle,t5_2qhad,223777,public,self,,,"so late last night, between about midnight and 2am, there were 4 posts here about: a super-loud explosion; a low-flying helicopter ghosted by radar; numerous sirens &amp; police activity; &amp; vibrating buildings......any explanation so far?",0,[],1.0,https://www.reddit.com/r/Seattle/comments/i051ra/so_late_last_night_between_about_midnight_and_2am/,,all_ads,6,,,,,,,,,,,,,
[],False,RedditRacists77,,[],,text,t2_6opjtga3,False,True,[],False,False,1596044231,projects.propublica.org,https://www.reddit.com/r/Seattle/comments/i04v3k/seattle_cases_in_here/,{},i04v3k,True,False,False,False,True,False,False,,flair,"[{'e': 'text', 't': 'News'}]",9f9ba910-f804-11e4-be5c-0ea18645ab5f,News,dark,richtext,False,False,True,12,0,False,all_ads,/r/Seattle/comments/i04v3k/seattle_cases_in_here/,False,link,"{'enabled': False, 'images': [{'id': 'iYsY0SrYG-i987gGabTaaWp9O46sTz_7vKQVYxYZsUA', 'resolutions': [{'height': 56, 'url': 'https://external-preview.redd.it/m2BD7M34I6ZDMgxWTjLQwTxH6W2TqWHGgQ8nZ3ayo0o.jpg?width=108&amp;crop=smart&amp;auto=webp&amp;s=230c9c00b9c0a5a94c541c4df6f306b8d7406e27', 'width': 108}, {'height': 113, 'url': 'https://external-preview.redd.it/m2BD7M34I6ZDMgxWTjLQwTxH6W2TqWHGgQ8nZ3ayo0o.jpg?width=216&amp;crop=smart&amp;auto=webp&amp;s=e27382791050c889866e559440d1ccff6e2f7047', 'width': 216}, {'height': 168, 'url': 'https://external-preview.redd.it/m2BD7M34I6ZDMgxWTjLQwTxH6W2TqWHGgQ8nZ3ayo0o.jpg?width=320&amp;crop=smart&amp;auto=webp&amp;s=ef74fcdd8e0c899903efe94c41d0e9af4efe9299', 'width': 320}, {'height': 336, 'url': 'https://external-preview.redd.it/m2BD7M34I6ZDMgxWTjLQwTxH6W2TqWHGgQ8nZ3ayo0o.jpg?width=640&amp;crop=smart&amp;auto=webp&amp;s=957bb5655c67638c541ec50d38a19d2ab20e97cf', 'width': 640}, {'height': 504, 'url': 'https://external-preview.redd.it/m2BD7M34I6ZDMgxWTjLQwTxH6W2TqWHGgQ8nZ3ayo0o.jpg?width=960&amp;crop=smart&amp;auto=webp&amp;s=02ab16e630250aa41eb74079305a72fc577e6282', 'width': 960}, {'height': 567, 'url': 'https://external-preview.redd.it/m2BD7M34I6ZDMgxWTjLQwTxH6W2TqWHGgQ8nZ3ayo0o.jpg?width=1080&amp;crop=smart&amp;auto=webp&amp;s=3cbcc2b7c23cb767836c03328cd0952a7f614cfb', 'width': 1080}], 'source': {'height': 630, 'url': 'https://external-preview.redd.it/m2BD7M34I6ZDMgxWTjLQwTxH6W2TqWHGgQ8nZ3ayo0o.jpg?auto=webp&amp;s=8b47d0fc337f52d2000c6748749859d1f7e86fba', 'width': 1200}, 'variants': {}}]}",6,1596044288,0,,False,False,False,Seattle,t5_2qhad,223776,public,https://b.thumbs.redditmedia.com/0FIYxZk5c4oexX50-N8rsvRRCmiXi0tHHTtzBq0ZUmo.jpg,73.0,140.0,Seattle Cases in here.,0,[],0.5,https://projects.propublica.org/protest-police-videos/,https://projects.propublica.org/protest-police-videos/,all_ads,6,,,,,,,,,,t3_i02awt,"[{'all_awardings': [], 'allow_live_comments': False, 'approved_at_utc': None, 'approved_by': None, 'archived': False, 'author': 'Mynameis__--__', 'author_flair_background_color': None, 'author_flair_css_class': None, 'author_flair_richtext': [], 'author_flair_template_id': None, 'author_flair_text': None, 'author_flair_text_color': None, 'author_flair_type': 'text', 'author_fullname': 't2_mrn2g', 'author_patreon_flair': False, 'author_premium': True, 'awarders': [], 'banned_at_utc': None, 'banned_by': None, 'can_gild': True, 'can_mod_post': False, 'category': None, 'clicked': False, 'content_categories': None, 'contest_mode': False, 'created': 1596064150.0, 'created_utc': 1596035350.0, 'discussion_type': None, 'distinguished': None, 'domain': 'projects.propublica.org', 'downs': 0, 'edited': False, 'gilded': 0, 'gildings': {}, 'hidden': False, 'hide_score': False, 'id': 'i02awt', 'is_crosspostable': True, 'is_meta': False, 'is_original_content': False, 'is_reddit_media_domain': False, 'is_robot_indexable': True, 'is_self': False, 'is_video': False, 'likes': None, 'link_flair_background_color': '', 'link_flair_css_class': None, 'link_flair_richtext': [], 'link_flair_text': None, 'link_flair_text_color': 'dark', 'link_flair_type': 'text', 'locked': False, 'media': None, 'media_embed': {}, 'media_only': False, 'mod_note': None, 'mod_reason_by': None, 'mod_reason_title': None, 'mod_reports': [], 'name': 't3_i02awt', 'no_follow': False, 'num_comments': 17, 'num_crossposts': 5, 'num_reports': None, 'over_18': False, 'parent_whitelist_status': 'all_ads', 'permalink': '/r/Portland/comments/i02awt/we_are_tracking_what_happens_to_police_after_they/', 'pinned': False, 'post_hint': 'link', 'preview': {'enabled': False, 'images': [{'id': 'iYsY0SrYG-i987gGabTaaWp9O46sTz_7vKQVYxYZsUA', 'resolutions': [{'height': 56, 'url': 'https://external-preview.redd.it/m2BD7M34I6ZDMgxWTjLQwTxH6W2TqWHGgQ8nZ3ayo0o.jpg?width=108&amp;crop=smart&amp;auto=webp&amp;s=230c9c00b9c0a5a94c541c4df6f306b8d7406e27', 'width': 108}, {'height': 113, 'url': 'https://external-preview.redd.it/m2BD7M34I6ZDMgxWTjLQwTxH6W2TqWHGgQ8nZ3ayo0o.jpg?width=216&amp;crop=smart&amp;auto=webp&amp;s=e27382791050c889866e559440d1ccff6e2f7047', 'width': 216}, {'height': 168, 'url': 'https://external-preview.redd.it/m2BD7M34I6ZDMgxWTjLQwTxH6W2TqWHGgQ8nZ3ayo0o.jpg?width=320&amp;crop=smart&amp;auto=webp&amp;s=ef74fcdd8e0c899903efe94c41d0e9af4efe9299', 'width': 320}, {'height': 336, 'url': 'https://external-preview.redd.it/m2BD7M34I6ZDMgxWTjLQwTxH6W2TqWHGgQ8nZ3ayo0o.jpg?width=640&amp;crop=smart&amp;auto=webp&amp;s=957bb5655c67638c541ec50d38a19d2ab20e97cf', 'width': 640}, {'height': 504, 'url': 'https://external-preview.redd.it/m2BD7M34I6ZDMgxWTjLQwTxH6W2TqWHGgQ8nZ3ayo0o.jpg?width=960&amp;crop=smart&amp;auto=webp&amp;s=02ab16e630250aa41eb74079305a72fc577e6282', 'width': 960}, {'height': 567, 'url': 'https://external-preview.redd.it/m2BD7M34I6ZDMgxWTjLQwTxH6W2TqWHGgQ8nZ3ayo0o.jpg?width=1080&amp;crop=smart&amp;auto=webp&amp;s=3cbcc2b7c23cb767836c03328cd0952a7f614cfb', 'width': 1080}], 'source': {'height': 630, 'url': 'https://external-preview.redd.it/m2BD7M34I6ZDMgxWTjLQwTxH6W2TqWHGgQ8nZ3ayo0o.jpg?auto=webp&amp;s=8b47d0fc337f52d2000c6748749859d1f7e86fba', 'width': 1200}, 'variants': {}}]}, 'pwls': 6, 'quarantine': False, 'removal_reason': None, 'removed_by': None, 'removed_by_category': None, 'report_reasons': None, 'saved': False, 'score': 253, 'secure_media': None, 'secure_media_embed': {}, 'selftext': '', 'selftext_html': None, 'send_replies': True, 'spoiler': False, 'stickied': False, 'subreddit': 'Portland', 'subreddit_id': 't5_2qi2i', 'subreddit_name_prefixed': 'r/Portland', 'subreddit_subscribers': 167106, 'subreddit_type': 'public', 'suggested_sort': 'confidence', 'thumbnail': 'https://b.thumbs.redditmedia.com/0FIYxZk5c4oexX50-N8rsvRRCmiXi0tHHTtzBq0ZUmo.jpg', 'thumbnail_height': 73, 'thumbnail_width': 140, 'title': 'We Are Tracking What Happens to Police After They Use Force on Protestors', 'top_awarded_type': None, 'total_awards_received': 0, 'treatment_tags': [], 'ups': 253, 'upvote_ratio': 0.94, 'url': 'https://projects.propublica.org/protest-police-videos/', 'url_overridden_by_dest': 'https://projects.propublica.org/protest-police-videos/', 'user_reports': [], 'view_count': None, 'visited': False, 'whitelist_status': 'all_ads', 'wls': 6}]",,
[],False,cohesiveenigma,,[],,text,t2_12mgu3,False,False,[],False,False,1596043675,i.redd.it,https://www.reddit.com/r/Seattle/comments/i04ono/yesterdays_downtown_waterfront_view_was_unbeatable/,{},i04ono,True,False,False,True,True,False,False,,flair,"[{'e': 'text', 't': 'Recommendation'}]",9f763cd0-473d-11e8-93f7-0e6f632c214e,Recommendation,dark,richtext,False,False,True,0,0,False,all_ads,/r/Seattle/comments/i04ono/yesterdays_downtown_waterfront_view_was_unbeatable/,False,image,"{'enabled': True, 'images': [{'id': 'YLWHORBRIAc3Z96YRdK8HvWXHKbTa9m4GGaME789F5k', 'resolutions': [{'height': 60, 'url': 'https://preview.redd.it/k1v88zqqztd51.jpg?width=108&amp;crop=smart&amp;auto=webp&amp;s=e3e838b018e7d6319242a83ed7c5ed0231d2e36d', 'width': 108}, {'height': 121, 'url': 'https://preview.redd.it/k1v88zqqztd51.jpg?width=216&amp;crop=smart&amp;auto=webp&amp;s=c9ef7fa1a88a49354857916b0d0ca259e101606a', 'width': 216}, {'height': 179, 'url': 'https://preview.redd.it/k1v88zqqztd51.jpg?width=320&amp;crop=smart&amp;auto=webp&amp;s=5e07fe5a916e9507960f03e966483174e6d51843', 'width': 320}, {'height': 359, 'url': 'https://preview.redd.it/k1v88zqqztd51.jpg?width=640&amp;crop=smart&amp;auto=webp&amp;s=83768e7fc1d3dd8ea93d9052c48117edc9960735', 'width': 640}, {'height': 539, 'url': 'https://preview.redd.it/k1v88zqqztd51.jpg?width=960&amp;crop=smart&amp;auto=webp&amp;s=294e7301ec27b368d7435f9928fb92076f477963', 'width': 960}, {'height': 607, 'url': 'https://preview.redd.it/k1v88zqqztd51.jpg?width=1080&amp;crop=smart&amp;auto=webp&amp;s=5e8c039ed7450124980b56077ab7235272ce7abb', 'width': 1080}], 'source': {'height': 1540, 'url': 'https://preview.redd.it/k1v88zqqztd51.jpg?auto=webp&amp;s=9a22c8533bdbc0c3b598eba5bda0403ffa028615', 'width': 2738}, 'variants': {}}]}",6,1596043686,1,,True,False,False,Seattle,t5_2qhad,223775,public,https://b.thumbs.redditmedia.com/gQNW6JWf8YXwh9oFI8Vp9DOgqTy4Mnc-WnjNh8Ot7dw.jpg,78.0,140.0,Yesterday's downtown waterfront view was unbeatable!,0,[],1.0,https://i.redd.it/k1v88zqqztd51.jpg,https://i.redd.it/k1v88zqqztd51.jpg,all_ads,6,,,,,,,,,,,,,
