author,author_flair_css_class,author_flair_richtext,author_flair_text,author_flair_type,author_fullname,author_patreon_flair,can_mod_post,contest_mode,created_utc,domain,full_link,gildings,id,is_crosspostable,is_meta,is_original_content,is_reddit_media_domain,is_robot_indexable,is_self,is_video,link_flair_background_color,link_flair_richtext,link_flair_text_color,link_flair_type,locked,media_only,no_follow,num_comments,num_crossposts,over_18,parent_whitelist_status,permalink,pinned,pwls,retrieved_on,score,selftext,send_replies,spoiler,stickied,subreddit,subreddit_id,subreddit_subscribers,subreddit_type,thumbnail,title,url,whitelist_status,wls,author_cakeday,post_hint,preview,thumbnail_height,thumbnail_width,author_flair_background_color,author_flair_text_color,link_flair_css_class,link_flair_template_id,link_flair_text,crosspost_parent,crosspost_parent_list,media,media_embed,secure_media,secure_media_embed
Republokrat,,[],,text,t2_1fhf2zhc,False,False,False,1547007091,self.Seattle,https://www.reddit.com/r/Seattle/comments/ae31e1/distracted_driving_in_seattle_is_getting_out_of/,"{'gid_1': 0, 'gid_2': 0, 'gid_3': 0}",ae31e1,True,False,False,False,True,True,False,,[],dark,text,False,False,True,20,0,False,all_ads,/r/Seattle/comments/ae31e1/distracted_driving_in_seattle_is_getting_out_of/,False,6,1547007092,1,"My aunt is in the hospital tonight and was apparently hit by a distracted driver. When are the cops and the council going to do something about this issue? 

I see people on their phones at every damn stop light pretty much. You could probably fund a solution to the homelessness funding just on the ticket fees. Considering that science has proven it is equal to driving drunk why are we not slapping ankle bracets and locking people up for this? I thought Seattle was a progressive science thinking city. It cant whine about Trump ignore science in climate control while itself ignore science on distracted driving.

That also goes for drivers with those damn poodles in their lap, how is that even legal ?!? ",True,False,False,Seattle,t5_2qhad,142195,public,self,Distracted driving in Seattle is getting out of control,https://www.reddit.com/r/Seattle/comments/ae31e1/distracted_driving_in_seattle_is_getting_out_of/,all_ads,6,,,,,,,,,,,,,,,,
tacoslikeme,,[],,text,t2_9mpzco9,False,False,False,1547005943,i.redd.it,https://www.reddit.com/r/Seattle/comments/ae2vkb/seattle_tries/,"{'gid_1': 0, 'gid_2': 0, 'gid_3': 0}",ae2vkb,True,False,False,True,True,False,False,,"[{'e': 'text', 't': 'Media'}]",dark,richtext,False,False,True,22,0,False,all_ads,/r/Seattle/comments/ae2vkb/seattle_tries/,False,6,1547005945,1,,True,False,False,Seattle,t5_2qhad,142192,public,default,Seattle Tries,https://i.redd.it/mduuyrrelb921.jpg,all_ads,6,,,,,,,,flair,,Media,,,,,,
verve_genocide,,[],,text,t2_qc66a,False,False,False,1547003099,self.Seattle,https://www.reddit.com/r/Seattle/comments/ae2gha/looking_for_suggestions_for_a_frozen_waterfall/,"{'gid_1': 0, 'gid_2': 0, 'gid_3': 0}",ae2gha,True,False,False,False,True,True,False,,"[{'e': 'text', 't': 'Question'}]",dark,richtext,False,False,True,3,0,False,all_ads,/r/Seattle/comments/ae2gha/looking_for_suggestions_for_a_frozen_waterfall/,False,6,1547003099,1,"Hi guys,

I want to take my wife to see a frozen waterfall for her birthday (she has been wanting to go see one for a really long time now!). Looking for an easy or moderate winter hike which ends with a frozen waterfall. Any suggestions? Also, which is the best source for information on whether the waterfall has frozen or not yet? 

I live in Seattle so anyplace within a couple of hours drive would be good.  

&amp;#x200B;

Thanks in advance for your suggestions!",True,False,False,Seattle,t5_2qhad,142182,public,self,Looking for suggestions for a frozen waterfall hike near Seattle,https://www.reddit.com/r/Seattle/comments/ae2gha/looking_for_suggestions_for_a_frozen_waterfall/,all_ads,6,,,,,,,,flair,9b95cc16-44bf-11e6-aba4-0e42ab5b9d91,Question,,,,,,
IMAKILL3R,,[],,text,t2_hnrft,False,False,False,1547002651,self.Seattle,https://www.reddit.com/r/Seattle/comments/ae2e2m/writing_a_story_set_in_and_around_seattle_what/,"{'gid_1': 0, 'gid_2': 0, 'gid_3': 0}",ae2e2m,True,False,False,False,True,True,False,,"[{'e': 'text', 't': 'Question'}]",dark,richtext,False,False,True,25,0,False,all_ads,/r/Seattle/comments/ae2e2m/writing_a_story_set_in_and_around_seattle_what/,False,6,1547002653,1,"It’s a thriller about the missing daughter of a game developer, the employee who fixates on what happened, and a real estate fraud he uncovers while unwittingly making himself and those close to him the target of dark machinations. 

So far it’s set mostly in downtown Seattle in a game studio, but there are bits at Pike Place Market, Gas Works Park, and the climax happens in the old underground tunnels.",True,False,False,Seattle,t5_2qhad,142182,public,self,"Writing a story set in and around Seattle, what are some things I should know?",https://www.reddit.com/r/Seattle/comments/ae2e2m/writing_a_story_set_in_and_around_seattle_what/,all_ads,6,,,,,,,,flair,9b95cc16-44bf-11e6-aba4-0e42ab5b9d91,Question,,,,,,
zxcvbnm1342,,[],,text,t2_2ydq1z7p,False,False,False,1547001963,self.Seattle,https://www.reddit.com/r/Seattle/comments/ae2ajn/do_we_have_a_plan/,"{'gid_1': 0, 'gid_2': 0, 'gid_3': 0}",ae2ajn,True,False,False,False,True,True,False,,"[{'e': 'text', 't': 'Question'}]",dark,richtext,False,False,True,1,0,False,all_ads,/r/Seattle/comments/ae2ajn/do_we_have_a_plan/,False,6,1547001963,1,"We all know we have a growing homeless population. Do we have a plan if this population grows exponentially during the government shutdown? At the end of this month, all assistance programs, such as rent assistance, food assistance, Medicare, and child care assistance, will come to a halt, rendering a lot of people homeless. Has anyone heard of an emergency plan yet? ",True,False,False,Seattle,t5_2qhad,142182,public,self,Do We Have A Plan?,https://www.reddit.com/r/Seattle/comments/ae2ajn/do_we_have_a_plan/,all_ads,6,,,,,,,,flair,9b95cc16-44bf-11e6-aba4-0e42ab5b9d91,Question,,,,,,
CrazedProphet,,[],,text,t2_yis2l,False,False,False,1546997559,self.Seattle,https://www.reddit.com/r/Seattle/comments/ae1ls6/can_uw_students_make_spl_accounts/,"{'gid_1': 0, 'gid_2': 0, 'gid_3': 0}",ae1ls6,True,False,False,False,True,True,False,,[],dark,text,False,False,True,17,0,False,all_ads,/r/Seattle/comments/ae1ls6/can_uw_students_make_spl_accounts/,False,6,1546997562,1,"While I'm here in the city studying at UW I would love to have access to a local library. So my question is if I live in a different town but I am a student in the city can I get a Seattle Public Library account. If so to get a library card I need proof of residency, as I live on the UW campus what would I use for that?",True,False,False,Seattle,t5_2qhad,142176,public,self,Can UW students make SPL accounts?,https://www.reddit.com/r/Seattle/comments/ae1ls6/can_uw_students_make_spl_accounts/,all_ads,6,,,,,,,,,,,,,,,,
roycey,,[],,text,t2_6atti,False,False,False,1546994355,self.Seattle,https://www.reddit.com/r/Seattle/comments/ae13i2/interior_design_consultation/,"{'gid_1': 0, 'gid_2': 0, 'gid_3': 0}",ae13i2,True,False,False,False,True,True,False,,[],dark,text,False,False,True,1,0,False,all_ads,/r/Seattle/comments/ae13i2/interior_design_consultation/,False,6,1546994356,1,"We’re moving into a new house and want to find an interior designer to come in and make recommendations on how we may want to lay things out, brainstorm some ideas on what types of items to buy but not necessarily source the furniture and decor for us, we’d take care of that. My partner and I are moving from two apartments into this house so we have a jumble of stuff and there is a lot of extra space so the designer would help narrow down some design style/principles, look at what we have, learn what we’re thinking and help provide a consult. Thinking just for the living room and kitchen which is one big space. Any recommendations on professionals who would be good for this?",True,False,False,Seattle,t5_2qhad,142169,public,self,Interior design consultation,https://www.reddit.com/r/Seattle/comments/ae13i2/interior_design_consultation/,all_ads,6,,,,,,,,,,,,,,,,
Corrupt_Power,,[],,text,t2_f9oyk,False,False,False,1546993779,self.Seattle,https://www.reddit.com/r/Seattle/comments/ae105w/fighting_a_parking_ticket/,"{'gid_1': 0, 'gid_2': 0, 'gid_3': 0}",ae105w,True,False,False,False,True,True,False,,[],dark,text,False,False,True,7,0,False,all_ads,/r/Seattle/comments/ae105w/fighting_a_parking_ticket/,False,6,1546993780,1,"Any tips on fighting a parking ticket? It looks like Seattle isn't available on DoNotPay anymore. This is the first parking ticket I've ever received. The spot had 4 or 5 signs all saying different things, in addition to a PayByPhone area - which I paid. The ticket is for ""Peak Traffic Hours"". On top of all that this is a company vehicle that the company has stated in the past that they don't intend to help with any ticketing of their vehicles. ",True,False,False,Seattle,t5_2qhad,142169,public,self,Fighting a parking ticket?,https://www.reddit.com/r/Seattle/comments/ae105w/fighting_a_parking_ticket/,all_ads,6,,,,,,,,,,,,,,,,
BrieRipley,,[],,text,t2_26uf9b0j,False,False,False,1546993468,self.SeattleWA,https://www.reddit.com/r/Seattle/comments/ae0yea/are_you_a_federal_worker_or_federal_benefits/,"{'gid_1': 0, 'gid_2': 0, 'gid_3': 0}",ae0yea,True,False,False,False,True,False,False,,"[{'e': 'text', 't': 'Question'}]",dark,richtext,False,False,True,3,0,False,all_ads,/r/Seattle/comments/ae0yea/are_you_a_federal_worker_or_federal_benefits/,False,6,1546993470,1,,True,False,False,Seattle,t5_2qhad,142168,public,https://b.thumbs.redditmedia.com/UI9EIJ8RYrILvnK9fde4dLedh7jXnZhUKnjBnv17qaw.jpg,Are you a federal worker or federal benefits recipient that has been impacted by the government shutdown?,https://www.reddit.com/r/SeattleWA/comments/ae0ybz/are_you_a_federal_worker_or_federal_benefits/,all_ads,6,,,,140.0,140.0,,,flair,9b95cc16-44bf-11e6-aba4-0e42ab5b9d91,Question,t3_ae0ybz,"[{'approved_at_utc': None, 'approved_by': None, 'archived': False, 'author': 'BrieRipley', 'author_flair_background_color': None, 'author_flair_css_class': None, 'author_flair_richtext': [], 'author_flair_template_id': None, 'author_flair_text': None, 'author_flair_text_color': None, 'author_flair_type': 'text', 'author_fullname': 't2_26uf9b0j', 'author_patreon_flair': False, 'banned_at_utc': None, 'banned_by': None, 'can_gild': True, 'can_mod_post': False, 'category': None, 'clicked': False, 'content_categories': None, 'contest_mode': False, 'created': 1547022256.0, 'created_utc': 1546993456.0, 'distinguished': None, 'domain': 'self.SeattleWA', 'downs': 0, 'edited': False, 'gilded': 0, 'gildings': {'gid_1': 0, 'gid_2': 0, 'gid_3': 0}, 'hidden': False, 'hide_score': True, 'id': 'ae0ybz', 'is_crosspostable': True, 'is_meta': False, 'is_original_content': False, 'is_reddit_media_domain': False, 'is_robot_indexable': True, 'is_self': True, 'is_video': False, 'likes': None, 'link_flair_background_color': '', 'link_flair_css_class': 'question', 'link_flair_richtext': [], 'link_flair_template_id': 'deb2d6c4-0e68-11e7-b2bd-0e2e93dbfc84', 'link_flair_text': 'Question', 'link_flair_text_color': 'dark', 'link_flair_type': 'text', 'locked': False, 'media': None, 'media_embed': {}, 'media_only': False, 'mod_note': None, 'mod_reason_by': None, 'mod_reason_title': None, 'mod_reports': [], 'name': 't3_ae0ybz', 'no_follow': True, 'num_comments': 0, 'num_crossposts': 1, 'num_reports': None, 'over_18': False, 'parent_whitelist_status': 'all_ads', 'permalink': '/r/SeattleWA/comments/ae0ybz/are_you_a_federal_worker_or_federal_benefits/', 'pinned': False, 'pwls': 6, 'quarantine': False, 'removal_reason': None, 'report_reasons': None, 'saved': False, 'score': 1, 'secure_media': None, 'secure_media_embed': {}, 'selftext': '', 'selftext_html': None, 'send_replies': True, 'spoiler': False, 'stickied': False, 'subreddit': 'SeattleWA', 'subreddit_id': 't5_2vbli', 'subreddit_name_prefixed': 'r/SeattleWA', 'subreddit_subscribers': 78520, 'subreddit_type': 'public', 'suggested_sort': None, 'thumbnail': 'self', 'thumbnail_height': None, 'thumbnail_width': None, 'title': 'Are you a federal worker or federal benefits recipient that has been impacted by the government shutdown?', 'ups': 1, 'url': 'https://www.reddit.com/r/SeattleWA/comments/ae0ybz/are_you_a_federal_worker_or_federal_benefits/', 'user_reports': [], 'view_count': None, 'visited': False, 'whitelist_status': 'all_ads', 'wls': 6}]",,,,
herbage923,,[],,text,t2_lwi5utc,False,False,False,1546993447,i.redd.it,https://www.reddit.com/r/Seattle/comments/ae0yag/complete_neighborhood_map/,"{'gid_1': 0, 'gid_2': 0, 'gid_3': 0}",ae0yag,True,False,False,True,True,False,False,,[],dark,text,False,False,True,23,0,False,all_ads,/r/Seattle/comments/ae0yag/complete_neighborhood_map/,False,6,1546993448,1,,True,False,False,Seattle,t5_2qhad,142168,public,default,Complete neighborhood map,https://i.redd.it/jvw7n2t8ka921.jpg,all_ads,6,,,,,,,,,,,,,,,,
battlesnarf,flair,"[{'e': 'text', 't': 'Fremont'}]",Fremont,richtext,t2_5qbvr,False,False,False,1546992732,self.Seattle,https://www.reddit.com/r/Seattle/comments/ae0u0g/anyone_use_virgin_mobile/,"{'gid_1': 0, 'gid_2': 0, 'gid_3': 0}",ae0u0g,True,False,False,False,True,True,False,,[],dark,text,False,False,True,8,0,False,all_ads,/r/Seattle/comments/ae0u0g/anyone_use_virgin_mobile/,False,6,1546992733,1,"Trying to get my cell phone bill (just one line) down from $70 a month - they have one for $35 for the first 5gb, which would be fine for me.   


How's the coverage? Any other thoughts out there?",True,False,False,Seattle,t5_2qhad,142166,public,self,Anyone use Virgin Mobile?,https://www.reddit.com/r/Seattle/comments/ae0u0g/anyone_use_virgin_mobile/,all_ads,6,,,,,,,dark,,,,,,,,,
guanaco55,,[],,text,t2_hyfa9,False,False,False,1546992104,kuow.org,https://www.reddit.com/r/Seattle/comments/ae0q5g/weve_been_arguing_about_the_viaduct_since_before/,"{'gid_1': 0, 'gid_2': 0, 'gid_3': 0}",ae0q5g,True,False,False,False,True,False,False,,[],dark,text,False,False,True,2,0,False,all_ads,/r/Seattle/comments/ae0q5g/weve_been_arguing_about_the_viaduct_since_before/,False,6,1546992105,1,,True,False,False,Seattle,t5_2qhad,142165,public,default,"We've been arguing about the viaduct since before it was even built -- The Alaskan Way Viaduct first opened to traffic on April 4, 1953. On January 11, the viaduct will close forever. The new Highway 99 tunnel will open in February.",https://www.kuow.org/stories/we-ve-been-arguing-about-the-viaduct-since-before-it-was-even-built,all_ads,6,,,,,,,,,,,,,,,,
yogamomswhovape,,[],,text,t2_2hx0y15n,False,False,False,1546986393,i.redd.it,https://www.reddit.com/r/Seattle/comments/adzroo/lost_cat_wallace_in_south_park_neighborhood_call/,"{'gid_1': 0, 'gid_2': 0, 'gid_3': 0}",adzroo,True,False,False,True,True,False,False,,[],dark,text,False,False,True,7,0,False,all_ads,/r/Seattle/comments/adzroo/lost_cat_wallace_in_south_park_neighborhood_call/,False,6,1546986394,1,,True,False,False,Seattle,t5_2qhad,142150,public,default,"Lost cat ""Wallace"" in South Park neighborhood 😿😿😿 Call # on flyer",https://i.redd.it/mghk2i1az9921.jpg,all_ads,6,,,,,,,,,,,,,,,,
WesternCountry,,[],,text,t2_28k0z1wn,False,False,False,1546981934,self.Seattle,https://www.reddit.com/r/Seattle/comments/adz02y/vehicle_registration_after_some_months_repair/,"{'gid_1': 0, 'gid_2': 0, 'gid_3': 0}",adz02y,True,False,False,False,True,True,False,,[],dark,text,False,False,True,11,0,False,all_ads,/r/Seattle/comments/adz02y/vehicle_registration_after_some_months_repair/,False,6,1546981936,1,So I have a vehicle that needed repairs and emissions before it could be registered. Well months later its fixed and can get tested. Will I incur a penalty even though though the vehicle was inoperable and registration was impossible at the time?,True,False,False,Seattle,t5_2qhad,142144,public,self,"Vehicle registration after some months (repair emissions), penalty?",https://www.reddit.com/r/Seattle/comments/adz02y/vehicle_registration_after_some_months_repair/,all_ads,6,,,,,,,,,,,,,,,,
nathanm1990,,[],,text,t2_12yvkp,False,False,False,1546981885,self.Seattle,https://www.reddit.com/r/Seattle/comments/adyzqt/best_place_to_get_used_sports_shoes/,"{'gid_1': 0, 'gid_2': 0, 'gid_3': 0}",adyzqt,True,False,False,False,True,True,False,,"[{'e': 'text', 't': 'Question'}]",dark,richtext,False,False,True,8,0,False,all_ads,/r/Seattle/comments/adyzqt/best_place_to_get_used_sports_shoes/,False,6,1546981886,1,"Been to a few goodwills without any luck. They have shoes but all small sizes im a size 12 :-( 

Ive gone to children hospital thrift store, three good wills, and second chance sports. Every place seems to have 10s or smaller.

I need soccer cleats and basketball shoes",True,False,False,Seattle,t5_2qhad,142144,public,self,Best place to get used sports shoes?,https://www.reddit.com/r/Seattle/comments/adyzqt/best_place_to_get_used_sports_shoes/,all_ads,6,,,,,,,,flair,9b95cc16-44bf-11e6-aba4-0e42ab5b9d91,Question,,,,,,
NattyLite15,,[],,text,t2_1lu7gn2c,False,False,False,1546981712,self.Seattle,https://www.reddit.com/r/Seattle/comments/adyyoy/things_to_do_and_places_to_stay/,"{'gid_1': 0, 'gid_2': 0, 'gid_3': 0}",adyyoy,True,False,False,False,True,True,False,,[],dark,text,False,False,True,21,0,False,all_ads,/r/Seattle/comments/adyyoy/things_to_do_and_places_to_stay/,False,6,1546981713,1,"Hey everybody!

I’m from Oklahoma City. My wife and I are going to be in Seattle for about a day and a half before setting sail on a cruise.  This will be in June. We’ve got three questions for y’all. 

1) What should we do?
2) Where should we eat?
3) What area should we stay in?

Thanks in advance!",True,False,False,Seattle,t5_2qhad,142145,public,self,Things to Do and Places to Stay,https://www.reddit.com/r/Seattle/comments/adyyoy/things_to_do_and_places_to_stay/,all_ads,6,,,,,,,,,,,,,,,,
tallyrand,flair,"[{'e': 'text', 't': 'Olympia'}]",Olympia,richtext,t2_a7mho,False,False,False,1546980910,seattletimes.com,https://www.reddit.com/r/Seattle/comments/adytu4/bruce_harrell_third_incumbent_who_wont_seek/,"{'gid_1': 0, 'gid_2': 0, 'gid_3': 0}",adytu4,True,False,False,False,True,False,False,,[],dark,text,False,False,True,3,0,False,all_ads,/r/Seattle/comments/adytu4/bruce_harrell_third_incumbent_who_wont_seek/,False,6,1546980911,1,,True,False,False,Seattle,t5_2qhad,142144,public,default,Bruce Harrell third incumbent who won’t seek re-election to Seattle City Council,https://www.seattletimes.com/seattle-news/politics/bruce-harrell-wont-run-for-re-election-to-seattle-city-council-third-incumbent-to-bow-out/,all_ads,6,,,,,,,dark,,,,,,,,,
suzepie,,[],,text,t2_46vsk,False,False,False,1546980282,imgur.com,https://www.reddit.com/r/Seattle/comments/adypzd/since_yall_got_punked_by_that_fake_show_poster/,"{'gid_1': 0, 'gid_2': 0, 'gid_3': 0}",adypzd,True,False,False,False,True,False,False,,[],dark,text,False,False,True,5,0,False,all_ads,/r/Seattle/comments/adypzd/since_yall_got_punked_by_that_fake_show_poster/,False,6,1546980283,1,,True,False,False,Seattle,t5_2qhad,142144,public,default,"Since y'all got punked by that fake show poster, here's a real one I saved in '88.",https://imgur.com/a/t3SvF8x,all_ads,6,,,,,,,,,,,,,,,,
JarLowrey,,[],,text,t2_177ux9,False,False,False,1546980198,seattletimes.com,https://www.reddit.com/r/Seattle/comments/adyphj/inslee_proposes_public_option_healthinsurance/,"{'gid_1': 0, 'gid_2': 0, 'gid_3': 0}",adyphj,True,False,False,False,True,False,False,,[],dark,text,False,False,True,12,0,False,all_ads,/r/Seattle/comments/adyphj/inslee_proposes_public_option_healthinsurance/,False,6,1546980199,1,,True,False,False,Seattle,t5_2qhad,142143,public,https://b.thumbs.redditmedia.com/GL5-dKlFK4OOeWPnQiUzTtgUDYFi-xvj5gTutoWYxXI.jpg,Inslee proposes ‘public option’ health-insurance plan for Washington,https://www.seattletimes.com/seattle-news/politics/inslee-proposes-public-option-health-insurance-plan-for-washington/,all_ads,6,,link,"{'enabled': False, 'images': [{'id': 'ZX_gndf1IkxnpBiLghuQDUxtL0MJumqMv05fC06o_mA', 'resolutions': [{'height': 56, 'url': 'https://external-preview.redd.it/4uqEr5L8by-rGd4VRM6VHyFs7FUI2YT8oIIUTjVNLno.jpg?width=108&amp;crop=smart&amp;auto=webp&amp;s=ea5a8233cd61370fdb103dda7b43857172761a78', 'width': 108}, {'height': 113, 'url': 'https://external-preview.redd.it/4uqEr5L8by-rGd4VRM6VHyFs7FUI2YT8oIIUTjVNLno.jpg?width=216&amp;crop=smart&amp;auto=webp&amp;s=438f75a2b22e9fd53f59c82c9894e95ad03cbe44', 'width': 216}, {'height': 168, 'url': 'https://external-preview.redd.it/4uqEr5L8by-rGd4VRM6VHyFs7FUI2YT8oIIUTjVNLno.jpg?width=320&amp;crop=smart&amp;auto=webp&amp;s=592c636d85a94238a8b2eb98afedf87e3086a63b', 'width': 320}, {'height': 336, 'url': 'https://external-preview.redd.it/4uqEr5L8by-rGd4VRM6VHyFs7FUI2YT8oIIUTjVNLno.jpg?width=640&amp;crop=smart&amp;auto=webp&amp;s=e2e6774e372e629bf110a495c3fee90b2f9ece6c', 'width': 640}, {'height': 504, 'url': 'https://external-preview.redd.it/4uqEr5L8by-rGd4VRM6VHyFs7FUI2YT8oIIUTjVNLno.jpg?width=960&amp;crop=smart&amp;auto=webp&amp;s=427d683f2e08b64690de0f9e35c226763dc3b05d', 'width': 960}, {'height': 567, 'url': 'https://external-preview.redd.it/4uqEr5L8by-rGd4VRM6VHyFs7FUI2YT8oIIUTjVNLno.jpg?width=1080&amp;crop=smart&amp;auto=webp&amp;s=b6bbdbb9f4759ff78a95a9ebc9bad7c250a9294f', 'width': 1080}], 'source': {'height': 630, 'url': 'https://external-preview.redd.it/4uqEr5L8by-rGd4VRM6VHyFs7FUI2YT8oIIUTjVNLno.jpg?auto=webp&amp;s=5b9b78278d2ea27afec400db3e40a38dd5d35959', 'width': 1200}, 'variants': {}}]}",73.0,140.0,,,,,,,,,,,
FeyOutfitter,,[],,text,t2_lifcnvm,False,False,False,1546978878,self.Seattle,https://www.reddit.com/r/Seattle/comments/adyhfc/church_recommendations/,"{'gid_1': 0, 'gid_2': 0, 'gid_3': 0}",adyhfc,True,False,False,False,True,True,False,,"[{'e': 'text', 't': 'Recommendation'}]",dark,richtext,False,False,True,4,0,False,all_ads,/r/Seattle/comments/adyhfc/church_recommendations/,False,6,1546978879,1,"I moved here just a couple months ago and am still settling in. I don’t know that many people yet and the ones I do aren’t religious, so I wanted to ask about any good churches around. I live in the First Hill area so anything walkable or within distance of a reasonable bus ride would be great!

I’ve grown up Presbyterian, but I’m open to other denominations. I’d like to find a church with a younger congregation so I can meet people around my age (20s or early 30s) and with active bible studies or small groups. I really want to be able to meet people and get involved in the community!",True,False,False,Seattle,t5_2qhad,142142,public,self,Church recommendations?,https://www.reddit.com/r/Seattle/comments/adyhfc/church_recommendations/,all_ads,6,,,,,,,,flair,9f763cd0-473d-11e8-93f7-0e6f632c214e,Recommendation,,,,,,
killamongaro259,,[],,text,t2_27836y0c,False,False,False,1546978364,i.redd.it,https://www.reddit.com/r/Seattle/comments/adye70/looks_like_theyre_about_to_dig_up_ivan_ooze_by/,"{'gid_1': 0, 'gid_2': 0, 'gid_3': 0}",adye70,True,False,False,True,True,False,False,,[],dark,text,False,False,True,6,0,False,all_ads,/r/Seattle/comments/adye70/looks_like_theyre_about_to_dig_up_ivan_ooze_by/,False,6,1546978364,1,,True,False,False,Seattle,t5_2qhad,142141,public,default,Looks like they're about to dig up Ivan Ooze by the convention center,https://i.redd.it/y5vmq9meb9921.jpg,all_ads,6,,,,,,,,,,,,,,,,
AsuPartier,,[],,text,t2_1fqhhr0i,False,False,False,1546977815,self.Seattle,https://www.reddit.com/r/Seattle/comments/adyarl/what_is_the_best_place_for_a_crazy_night/,"{'gid_1': 0, 'gid_2': 0, 'gid_3': 0}",adyarl,True,False,False,False,True,True,False,,"[{'e': 'text', 't': 'Question'}]",dark,richtext,False,False,True,4,0,False,all_ads,/r/Seattle/comments/adyarl/what_is_the_best_place_for_a_crazy_night/,False,6,1546977816,1,"So flying in Friday afternoon, leaving Sunday night from PHX. Staying at the Hilton in downtown. What’s the best area to go and party hearty. Also what’s the price of skiing? ",True,False,False,Seattle,t5_2qhad,142141,public,self,What is the best place for a crazy night,https://www.reddit.com/r/Seattle/comments/adyarl/what_is_the_best_place_for_a_crazy_night/,all_ads,6,,,,,,,,flair,9b95cc16-44bf-11e6-aba4-0e42ab5b9d91,Question,,,,,,
ap39,,[],,text,t2_3egoow6,False,False,False,1546977682,self.Seattle,https://www.reddit.com/r/Seattle/comments/ady9wn/is_this_the_right_time_to_buy_a_house_in_seattle/,"{'gid_1': 0, 'gid_2': 0, 'gid_3': 0}",ady9wn,True,False,False,False,True,True,False,,[],dark,text,False,False,True,22,0,False,all_ads,/r/Seattle/comments/ady9wn/is_this_the_right_time_to_buy_a_house_in_seattle/,False,6,1546977683,1,"I don't know if this is the right place to post this question, if it isn't please let me where to ask this question and I will delete my post. I am currently sitting on some cash and seeing the house prices so low I am tempted to use the cash to make a downpayment on a house. I am considering 2 bed condos/townhomes in King county! Do you guys think this is the lowest the market would go or is there a chance that it would go down further?",True,False,False,Seattle,t5_2qhad,142141,public,self,Is this the right time to buy a house in Seattle?,https://www.reddit.com/r/Seattle/comments/ady9wn/is_this_the_right_time_to_buy_a_house_in_seattle/,all_ads,6,,,,,,,,,,,,,,,,
